name,category,amazon_link,total_mentions,subreddit_mentions
Queens Of The Stone Age,Digital Music Album,http://www.amazon.com/dp/B004OM2K94/,3,3
Queens of the Stone Age (Remastered) (Bonus Tracks),Music,http://www.amazon.com/dp/B004JR9YNY/,2,2
DVD by Sexy,DVD,http://www.amazon.com/dp/B000I2IRFU/,2,1
Rockabye Baby! Lullaby Renditions of Queens of the Stone Age,Music,http://www.amazon.com/dp/B000KP62Z2/,1,1
Boss GE-7 7-Band EQ Pedal,Musical Instruments,http://www.amazon.com/dp/B000RW0O02/,1,1
Songs For The Deaf,Digital Music Album,http://www.amazon.com/dp/B000VZIOCK/,1,1
Rated R - Deluxe Edition,Music,http://www.amazon.com/dp/B003MPIO08/,1,1
Queens of the Stone Age - (Censored),Music,http://www.amazon.com/dp/B004JR9YP2/,1,1
Remo Apple-shaped Fruit Shaker,Musical Instruments,http://www.amazon.com/dp/B0076MVLYY/,1,1
Uncovered Queens of the Stone Age,Music,http://www.amazon.com/dp/B00CW07KOA/,1,1
Pro-ject Debut III Turntable In Piano Black W - Ortofon Om-5,Speakers,http://www.amazon.com/dp/B00DUER2S6/,5,1
Lo Sound Desert,Movie,http://www.amazon.com/dp/B01HQNB6ME/,1,1
Over The Years And Through The Woods: Live (CD/DVD),Music,http://www.amazon.com/dp/B000BNTM96/,1,1
Doom Side of the Moon,Digital Music Album,http://www.amazon.com/dp/B06Y3J3H9J/,1,1
BEHRINGER MICROPHONO PP400,Musical Instruments,http://www.amazon.com/dp/B000H2BC4E/,33,1
