name,category,amazon_link,total_mentions,subreddit_mentions
Husqvarna 531300089 Professional Headband Hearing Protectors,"Patio, Lawn & Garden",https://www.amazon.com/dp/B002PNUWWG/ref=asc_df_B002PNUWWG5156117/?tag=hyprod-20&amp;creative=394997&amp;creativeASIN=B002PNUWWG&amp;linkCode=df0&amp;hvadid=198070022856&amp;hvpos=1o2&amp;hvnetw=g&amp;hvrand=3232798478063803274&amp;hvpone=&amp;hvptwo=&amp;hvqmt=&amp;hvdev=c&amp;hvdvcmdl=&amp;hvlocint=&amp;hvlocphy=9008585&amp;hvtargid=pla-320293259713,,1
Kingston DataTraveler HyperX Predator 1TB USB 3.0 Flash Drive (DTHXP30/1TB),Personal Computer,http://www.amazon.com/dp/B00E65QM8O/,26,1
"mberry Miracle Fruit Tablets, 10-Count",Grocery,http://www.amazon.com/dp/B001LXYA5Q/,16,1
Islam and the Future of Tolerance: A Dialogue,Book,http://www.amazon.com/dp/0674088700/,15,1
"TOMOKO Mechanical Gaming Keyboard, 87-Key Water-resistant Gaming Keyboard with Blue Switch Attached Anti-ghosting Key Cap Puller for Laptop Computer Macbook",Personal Computer,http://www.amazon.com/dp/B01DBJTZU2/,8,1
We Are Legion (We Are Bob) (Bobiverse Book 1),eBooks,http://www.amazon.com/dp/B01LWAESYQ/,5,1
Bowflex SelectTech 552 Adjustable Dumbbells (Pair),Sports,http://www.amazon.com/dp/B001ARYU58/,5,1
Selani Silicone Skin Sex Doll Male Body Torso for Women 3d Realistic Male Dildo,Health and Beauty,http://www.amazon.com/dp/B00U8IAZFO/,3,1
"[180 days warranty] ZeroLemon Samsung Galaxy S4 7500mAh Extended Battery + Free Black Extended TPU Full Edge Protection Case (Compatible with AT&T I337, Verizon I545, Sprint L720, T-Mobile M919, International I9500 & I9505) NFC for S Beam and Google Wallet - WORLD'S HIGHEST S4 BATTERY CAPACITY **USA PATENT PENDING DESIGN** - Black",Wireless,http://www.amazon.com/dp/B00CXZI3DQ/,2,1
The Elder Scrolls V: Skyrim,Video Games,http://www.amazon.com/dp/B004HYK956/,1,1
Nevermind,Music,http://www.amazon.com/dp/B0057GYO9K/,1,1
The One-Minute Cure: The Secret to Healing Virtually All Diseases,Book,http://www.amazon.com/dp/0977075141/,1,1
Heritage Survival Seed Vault 25 Year Storage Life. Fruit Herb and Vegetable Heirloom Seeds. 85% Germination Success For Doomsday Preparedness Peace of Mind. Emergency Supplies in a .30 Cal Ammo Box.,Lawn & Patio,http://www.amazon.com/dp/B01BLJ9UZ4/,1,1
Miracle Fruit Berries - Pack of 20,Grocery,http://www.amazon.com/dp/B00FBVTVYO/,1,1
Black Diamond Posiwire Quickpack (6ea - 12cm Quickdraws),Sports,http://www.amazon.com/dp/B004M3FNWQ/,1,1
"Good Day Chocolate - Milk Chocolate With Pharmaceutical Grade Nutraceuticals for Relaxation and Stress Relief {Calm, 12 Pack}",Grocery,http://www.amazon.com/dp/B015QLCY1U/,1,1
"The ""Racial"" Economy of Science: Toward a Democratic Future (Race, Gender, and Science)",Book,http://www.amazon.com/dp/0253208106/,1,1
How to be a Hobo,Book,http://www.amazon.com/dp/1938357183/,1,1
"The Private Investigator Handbook: The Do-It-Yourself Guide to Protect Yourself, Get Justice, or Get Even",Book,http://www.amazon.com/dp/0399531696/,1,1
Rihe Paint By Numbers Kits Mounted on Wood Frame with Brushes and Paints for Adults Children Seniors Junior DIY Beginner Level Acrylics Painting Kits on Canvas Lovers 16*20 Inch,Toy,http://www.amazon.com/dp/B01HLU5QE6/,1,1
GO FUCK YOURSELF: A Mini-Zine Devoted to D.I.Y. Sex Toys and Gender Bending Devices,Book,http://www.amazon.com/dp/B00B5ON5K2/,1,1
