name,category,amazon_link,total_mentions,subreddit_mentions
The Autobiography of Malcolm X: As Told to Alex Haley,Books,https://www.amazon.com/Autobiography-Malcolm-Told-Alex-Haley/dp/0345350685/ref=sr_1_1?ie=UTF8&amp;qid=1502938003&amp;sr=8-1&amp;keywords=malcolm+x+autobiography,3,2
The Righteous Mind: Why Good People Are Divided by Politics and Religion,Books,https://www.amazon.com/Righteous-Mind-Divided-Politics-Religion/dp/0307455777/ref=sr_1_1?ie=UTF8&amp;qid=1502940697&amp;sr=8-1&amp;keywords=the+righteous+mind,8,1
The Sayings of the Desert Fathers: The Alphabetical Collection,Books,https://www.amazon.com/gp/product/0879079592/ref=as_li_tl?ie=UTF8&amp;camp=1789&amp;creative=390957&amp;creativeASIN=0879079592&amp;linkCode=as2&amp;tag=orthchurquot-20&amp;linkId=3M5OLCVR5WM4WK2O,3,1
Hidden In Liquid: Return to Me - A Love Lost in Time,Books,https://www.amazon.com/Hidden-Liquid-Return-Love-Lost/dp/1478780657/ref=sr_1_1?s=books&amp;ie=UTF8&amp;qid=1491346418&amp;sr=1-1&amp;keywords=9781478780656,1,1
Algebra of Infinite Justice,Books,https://www.amazon.com/Algebra-Infinite-Justice-Arundhati-Roy/dp/014302907X,1,1
At Home in the World: A Memoir,Books,https://www.amazon.com/At-Home-World-Joyce-Maynard/dp/1250046440/ref=sr_1_7?ie=UTF8&amp;qid=1464479268&amp;sr=8-7&amp;keywords=joyce+maynard,1,1
When Breath Becomes Air,Books,https://www.amazon.com/When-Breath-Becomes-Paul-Kalanithi/dp/081298840X,1,1
The Agony and the Ecstasy: A Biographical Novel of Michelangelo,Books,https://www.amazon.com/Agony-Ecstasy-Biographical-Novel-Michelangelo/dp/0451171357/ref=sr_1_1?s=books&amp;ie=UTF8&amp;qid=1487268845&amp;sr=1-1&amp;keywords=the+agony+and+the+ecstasy,1,1
