name,category,amazon_link,total_mentions,subreddit_mentions
Shea Moisture Coconut & Hibiscus Curl & Style Milk 8 oz,Beauty,http://www.amazon.com/dp/B0038TYTSO/,3,1
"SheaMoisture Jamaican Black Castor Oil Shampoo, 16.3 Ounce",Beauty,http://www.amazon.com/dp/B00MXD137Q/,2,1
"Renpure Solutions  Cleansing Conditioner, Sweet Pomegranate, 16 Fluid Ounce",Beauty,http://www.amazon.com/dp/B0081CWUD4/,2,1
it's a 10 Miracle Leave-In product 10 oz,Health and Beauty,http://www.amazon.com/dp/B002CMLHEC/,2,1
"Olivia Garden 2 1/2"" Ceramic Ionic and 100% Boar Bristles Round Vented Hair Brush",Beauty,http://www.amazon.com/dp/B000SST7BW/,1,1
"XFusion Economy Keratin Hair Fibers, Medium Brown 28g",Beauty & Personal Care,https://www.amazon.com/Xfusion-Keratin-Fibers-Thickens-Balding/dp/B002Q803Q0,1,1
"Senscience Inner Restore Intensif Deep Repairing Masque 99562, 5.1 Fluid Ounce",Beauty,http://www.amazon.com/dp/B001U2RQY0/,1,1
Wetbrush Pro Detangler Coral Chic,Beauty,http://www.amazon.com/dp/B00MPP3T4M/,1,1
