name,category,amazon_link,total_mentions,subreddit_mentions
Clear Casting Resin With Catalyst 32 Ounce,Art and Craft Supply,http://www.amazon.com/dp/B0018N9E3M/,3,1
"Myard Fireproof Human Fire Pit Skull Gas Log for NG, LP Wood Fireplace, Firepit, Campfire, Halloween Decor, Barbecue (Black, 1pk)",Lawn & Patio,http://www.amazon.com/dp/B00KBNIZDK/,2,1
"Bachelorette Party Big Boobs, Silicone Mold for fondant, chocolate and more... By Oh! Sweet Art FDA Approved for Food, Cupcakes",Grocery,http://www.amazon.com/dp/B06XS99Z1T/,1,1
New Big Penis Shaped Silicone Cake Mould Dick Soap Mold 3D Fondant Cake Mold,Kitchen,http://www.amazon.com/dp/B01KHGE99Y/,1,1
"Dritz 1-9/16-Inch Inner Diameter Curtain Grommets, 8-Pack, Pewter",Home & Kitchen,https://www.amazon.com/gp/product/B0016ZZS32/ref=oh_aui_detailpage_o01_s02?ie=UTF8&amp;psc=1,1,1
"BAKER DEPOT DIY Silicone Mold For Handmade Soap, cake, Chocolate, Jelly, Budding, 6 Holes Half Sphere Shape, Set of 3",Kitchen,http://www.amazon.com/dp/B01FTO6ZDC/,1,1
Hallowe'en Party: A Hercule Poirot Mystery (Hercule Poirot Mysteries),Book,http://www.amazon.com/dp/0062073958/,1,1
The October Country,Book,http://www.amazon.com/dp/034532448X/,1,1
"Bulbrite H90PAR38A 120V 90W PAR38 Halogen Light, Amber",Home Improvement,http://www.amazon.com/dp/B002ZPI11I/,1,1
The End of Summer: Thirteen Tales of Halloween,Book,http://www.amazon.com/dp/098844688X/,1,1
"Monster Cereal, Count Chocula, 10.4-Ounce Box (Pack of 4)",Grocery,http://www.amazon.com/dp/B005DQGIA2/,1,1
Vincent Price: The Ultimate Collection,DVD,http://www.amazon.com/dp/B00GTTP8BC/,1,1
elope Ram Horns,Apparel,http://www.amazon.com/dp/B00IOXLFUY/,1,1
The Halloween Legion,Book,http://www.amazon.com/dp/0983953201/,1,1
Leg Avenue Women's Spandex Printed Glow-In-The-Dark Skeleton Catsuit,Apparel,http://www.amazon.com/dp/B00KM5M6NC/,1,1
"Chilling, Thrilling Sounds Of The Haunted House [LP]",Music,http://www.amazon.com/dp/B013BXFMP0/,1,1
Dark Harvest,Book,http://www.amazon.com/dp/076531911X/,1,1
Trick or Treat: A History of Halloween,Book,http://www.amazon.com/dp/1780231873/,1,1
Haunted Air,Book,http://www.amazon.com/dp/0224089706/,1,1
Scary Stories to Tell in the Dark Series: More Scary Stories to Tell in the Dark; Scary Stories to Tell in the Dark 3 (Book sets for Kids: Grade 3 and Up) by Alvin Schwartz (1981) Paperback,Books,https://www.amazon.com/Scary-Stories-Tell-Dark-Grade/dp/1484123069/ref=sr_1_2?s=books&amp;ie=UTF8&amp;qid=1471784433&amp;sr=1-2&amp;keywords=scary+stories+to+tell+in+the+dark,1,1
