name,category,amazon_link,total_mentions,subreddit_mentions
Grand Trunk Double Hammock with Carabiners and Hanging Kit - Two Toned Parachute Nylon,Sports & Outdoors,https://www.amazon.com/Grand-Trunk-Parachute-Hammock-Crimson/dp/B002XO43TK/ref=sr_1_2?ie=UTF8&amp;qid=1484191601&amp;sr=8-2&amp;keywords=grand+trunk+hammock,2,2
"Grand Trunk Ultralight Hammock - Portable Camping, Hiking, Backpacking, and Travel Hammock",Sports & Outdoors,https://www.amazon.com/Grand-Trunk-Ultralight-Hammock-Forest/dp/B001AIHB76/ref=redir_mobile_desktop?_encoding=UTF8&amp%3Bsr=8-1&qid=1421173806&ref_=mp_s_a_1_1,2,2
"Best Choice Products Double Hammock With Space Saving Steel Stand Includes Portable Carrying Case, Desert Stripe","Patio, Lawn & Garden",https://www.amazon.com/Best-Choice-Products-Portable-Carrying/dp/B00LOZNXRC/ref=sr_1_3?ie=UTF8&amp;qid=1478979098&amp;sr=8-3&amp;keywords=hammock+and+stand,3,1
OuterEQ Portable Parachute Nylon Fabric Travel Camping Hammock,Sports & Outdoors,https://www.amazon.com/OuterEQ-Portable-Parachute-Camping-Hammock/dp/B00G3ZURYU/ref=sr_1_8?ie=UTF8&amp;qid=1470927304&amp;sr=8-8&amp;keywords=hammock,2,1
Bear Butt Double Hammock - Going Outdoors Backpacking Camping Or Hiking - Then Get The Best Lightweight Parachute Hammocks - 2 Year Company On Amazon - The Reviews Say It All,Sports & Outdoors,https://www.amazon.com/gp/product/B07226HVGX/ref=ox_sc_sfl_title_1?ie=UTF8&amp;psc=1&amp;smid=AT69S86ILQP1Z,1,1
"BalsaCircle 90x132"" Crinkle Taffeta Rectangular Tablecloth Overlay - Apple Green",Home & Kitchen,https://www.amazon.com/BalsaCircle-Crinkle-Taffeta-Rectangular-Tablecloth/dp/B0067EKOR2/ref=sr_1_6?ie=UTF8&amp;qid=1473690579&amp;sr=8-6&amp;keywords=taffeta+tablecloth,1,1
ENO Eagles Nest Outfitters - DoubleNest Hammock,Sports & Outdoors,https://www.amazon.com/Eagles-Nest-Outfitters-DoubleNest-Hammock/dp/B00EV5W1TS/ref=sr_1_2?ie=UTF8&amp;qid=1478979260&amp;sr=8-2&amp;keywords=hammock,1,1
Black Diamond Hotwire Carabiner,Sports & Outdoors,https://www.amazon.com/Black-Diamond-Hotwire-Carabiner/dp/B0033EUILG/,1,1
Best ChoiceProducts Space Saving Steel Hammock Stand 9' Outdoor Patio Portable with Carrying Case,"Patio, Lawn & Garden",https://www.amazon.com/dp/B00WFH3TIG/ref=cm_sw_r_cp_apa_lt8JxbHJDHW9Y,1,1
"Vivere Double Hammock with Space Saving Steel Stand, Denim","Patio, Lawn & Garden",https://www.amazon.com/gp/product/B00IAJCUWY/ref=oh_aui_detailpage_o02_s00?ie=UTF8&amp;psc=1,1,1
"Snugpak Hammock Under Blanket with Travelsoft Filling, Olive",Sports & Outdoors,https://www.amazon.com/Snugpak-Hammock-Blanket-Travelsoft-Filling/dp/B0167IYGH6/ref=pd_sim_468_8?ie=UTF8&amp;dpID=41Cv7gj2HZL&amp;dpSrc=sims&amp;preST=_AC_UL160_SR160,1,1
F2C 15' Steel Stand Space Saving Hammock Stand Two Person Free Standing Heavy Duty,"Patio, Lawn & Garden",https://www.amazon.com/dp/B01CHZEQSC/ref=cm_sw_r_cp_api_Yt6Kxb8KBYYP2,1,1
"Camping Hammock, Rusee Mosquito Net Outdoor Hammock Travel Bed Lightweight Parachute Fabric Double Hammock For Indoor, Camping, Hiking, Backpacking, Backyard",Sports & Outdoors,https://www.amazon.com/Rusee-Mosquito-Lightweight-Parachute-Backpacking/dp/B01DW5PD0G/ref=sr_1_1?ie=UTF8&amp;qid=1474424049&amp;sr=8-1&amp;keywords=mosquito+net+hammock,1,1
"Vivere Double Hammock with Space Saving Steel Stand, Oasis","Patio, Lawn & Garden",https://www.amazon.com/Vivere-Double-Hammock-Space-Saving/dp/B00AXN35WY/ref=redir_mobile_desktop?_encoding=UTF8&amp%3BdpID=51yQm0eJaBL&amp%3BdpPl=1&amp%3Bkeywords=Vivere&amp%3Bpi=SX200_QL40&amp%3Bref=plSrch&amp%3Bsr=8-1&qid=1452701362&ref_=mp_s_a_1_1,1,1
"Outpost Double/Single Camping Hammock With 11’ Tree Straps - 100% Parachute Nylon - Cinch Buckle Design, No Knots Required - Easiest Hammock To Hang",Sports & Outdoors,https://www.amazon.com/gp/product/B01A0NAQMS/ref=oh_aui_detailpage_o00_s00?ie=UTF8&amp;psc=1,1,1
Therm-A-Rest Slacker Hammock Suspenders Hanging Kit,Sports & Outdoors,https://www.amazon.com/Therm-a-Rest-Slacker-Suspenders-Hanging-Kit/dp/B00Q608G8Q,1,1
"ENO Eagles Nest Outfitters - Atlas XL Hammock Suspension System, Black (FFP)",Sports & Outdoors,https://www.amazon.com/Eagles-Nest-Outfitters-Atlas-FFP/dp/B00MX5WMLA/ref=sr_1_2?s=sporting-goods&amp;ie=UTF8&amp;qid=1438100278&amp;sr=1-2&amp;keywords=atlas+strap&amp;pebp=1438100280866&amp;perid=1QG7SN48RPP8M0PGG9SB,1,1
