name,category,amazon_link,total_mentions,subreddit_mentions
Grand Trunk Double Parachute Nylon Hammock (Crimson/Khaki),Sports,http://www.amazon.com/dp/B002XO43TK/,2,2
Grand Trunk Ultralight Hammock (Forest Green),Sports,http://www.amazon.com/dp/B001AIHB76/,2,2
"Best Choice Products Double Hammock With Space Saving Steel Stand Includes Portable Carrying Case, Desert Stripe",Lawn & Patio,http://www.amazon.com/dp/B00LOZNXRC/,3,1
OuterEQ Portable Parachute Nylon Fabric Travel Camping Hammock Grey & Orange,Sports,http://www.amazon.com/dp/B00G3ZURYU/,2,1
Bear Butt #1 Double Hammock - A Start Up Company With Top Quality Gear At Half The Cost Of The Other Guys (Black / Red),Sports,http://www.amazon.com/dp/B07226HVGX/,1,1
"BalsaCircle 90x132"" Crinkle Taffeta Rectangular Tablecloth Overlay - Sage Green",Home,http://www.amazon.com/dp/B0067EKOR2/,1,1
"ENO Eagles Nest Outfitters - DoubleNest Hammock, Portable Hammock for Two, Rasta Limited Edition",Sports,http://www.amazon.com/dp/B00EV5W1TS/,1,1
Black Diamond Hotwire Carabiner,Sports,http://www.amazon.com/dp/B0033EUILG/,1,1
Best ChoiceProducts Space Saving Steel Hammock Stand 9' Outdoor Patio Portable with Carrying Case,Lawn & Patio,http://www.amazon.com/dp/B00WFH3TIG/,1,1
"Vivere Double Hammock with Space Saving Steel Stand, Denim",Lawn & Patio,http://www.amazon.com/dp/B00IAJCUWY/,1,1
"Snugpak Hammock Under Blanket with Travelsoft Filling, Olive",Sports,http://www.amazon.com/dp/B0167IYGH6/,1,1
"Double Hammock With Space Saving Steel Stand Includes Portable Carrying Case, Desert Moon Stripe (blue&green stripe with stand)",Lawn & Patio,http://www.amazon.com/dp/B01CHZEQSC/,1,1
"Camping Hammock, Rusee Mosquito Net Outdoor Hammock Travel Bed Lightweight Parachute Fabric Double Hammock For Indoor, Camping, Hiking, Backpacking, Backyard",Sports,http://www.amazon.com/dp/B01DW5PD0G/,1,1
"Vivere Double Hammock with Space Saving Steel Stand, Oasis",Lawn & Patio,http://www.amazon.com/dp/B00AXN35WY/,1,1
"Outpost Camping Hammock With Adjustable Suspension System- Includes 11’ 100% Polyester Tree Straps, Wire Gate Carabiners- Double Size - 100% Ripstop Parachute Nylon (Gray/Blue, Double)",Sports,http://www.amazon.com/dp/B01A0NAQMS/,1,1
Therm-A-Rest Slacker Hammock Suspenders Hanging Kit,Sports,http://www.amazon.com/dp/B00Q608G8Q/,1,1
"ENO Eagles Nest Outfitters - Atlas XL Hammock Suspension System, Black (FFP)",Sports,http://www.amazon.com/dp/B00MX5WMLA/,1,1
