name,category,amazon_link,total_mentions,subreddit_mentions
Hearthstone,Mobile Application,http://www.amazon.com/dp/B00P77ZAN8/,7,5
World of Warcraft: Chronicle Volume 1,Book,http://www.amazon.com/dp/1616558458/,51,4
BattleNet Pre-Paid Game Card $20,Video Games,http://www.amazon.com/dp/B00PKK54PG/,4,3
The Art of Hearthstone,Book,http://www.amazon.com/dp/1945683058/,3,3
"Fire Tablet with Alexa, 7"" Display, 8 GB, Black - with Special Offers (Previous Generation - 5th)",Amazon Tablets,http://www.amazon.com/dp/B00TSUGXKE/,84,2
Cryptozoic Entertainment 1082 World Of War Craft - Assault On Icecrown Citadel Deck,Toy,http://www.amazon.com/dp/B004HLU3PK/,4,2
Staying Sober: A Guide for Relapse Prevention,Book,http://www.amazon.com/dp/083090459X/,4,1
The Unsinkable Titanic Thompson,Book,http://www.amazon.com/dp/0963401580/,1,1
World of Warcraft Vol. 1 SC (World of Warcraft World of Warcraft),Book,http://www.amazon.com/dp/1401220762/,2,1
WarCraft War of the Ancients Archive,Book,http://www.amazon.com/dp/1416552030/,6,1
World of Warcraft: Chronicles of War,Book,http://www.amazon.com/dp/1439172722/,10,1
War Crimes (World of Warcraft),Book,http://www.amazon.com/dp/1451684487/,2,1
Catalyst: The Fall of House Ulywn,Book,http://www.amazon.com/dp/1495382931/,1,1
The Art of World of Warcraft,Book,http://www.amazon.com/dp/1608874494/,1,1
World of Warcraft: The Official Cookbook,Book,http://www.amazon.com/dp/160887804X/,7,1
DC Comics Deck Building Game,Toy,http://www.amazon.com/dp/1617681709/,3,1
Introduction to Civil Engineering: A Student's Guide to Academic and Professional Success (Revised First Edition),Book,http://www.amazon.com/dp/1631890042/,1,1
Facehunter,Book,http://www.amazon.com/dp/3791344536/,1,1
Super Seasoning Aji-No-Moto (MSG) 3.5 oz. Shaker,Grocery,http://www.amazon.com/dp/B0001DMTFK/,3,1
Banzai - DVD Betting Game,Toy,http://www.amazon.com/dp/B000E9T9WC/,1,1
BIA Cordon Bleu Elephant Teapot,Kitchen,http://www.amazon.com/dp/B000MFIRN0/,2,1
"Mead Memo Book, College Ruled, 5 x 3 Inches, Wirebound, 60 Sheets, Assorted (45534)",Office Product,http://www.amazon.com/dp/B000PS8JPU/,2,1
"BIC Round Stic Xtra Life Ball Pen, Medium Point (1.0 mm), Black, 60-Count",Office Product,http://www.amazon.com/dp/B0012YVGOW/,12,1
World of Warcraft: Arthas: Rise of the Lich King,eBooks,http://www.amazon.com/dp/B001NLL6LM/,1,1
Sennheiser HD 800 Reference Dynamic Headphone,Audio Video,http://www.amazon.com/dp/B001OTZ8DA/,18,1
Vinyl Snakes - 48 Count,Toy,http://www.amazon.com/dp/B002F4LHA6/,1,1
#2 Pencils 10 Ct. Penway Wood Barrel,Office Product,http://www.amazon.com/dp/B002M59BEW/,1,1
The Church of Anonymous,eBooks,http://www.amazon.com/dp/B003X976C0/,1,1
World of Warcraft Trading Card Game [TCG]: Scourgewar Icecrown Booster Box,Toy,http://www.amazon.com/dp/B0041JIG8O/,1,1
Carbonell Extra Virgin Spanish Olive Oil (2 Litre),Grocery,http://www.amazon.com/dp/B004T69CZA/,1,1
Three Felonies A Day: How the Feds Target the Innocent,eBooks,http://www.amazon.com/dp/B00505UZ4G/,19,1
Magic: the Gathering - Black Lotus - Unlimited,Toy,http://www.amazon.com/dp/B005OVFVXG/,2,1
Blizzcon 2011 exclusive Murkablo pet World Warcraft wow + SC2 portrait loot card,Toy,http://www.amazon.com/dp/B0065FUSPQ/,1,1
Epic Weapons DoomHammer LARP Edition,Toy,http://www.amazon.com/dp/B006LRLXPW/,1,1
"Samsung Galaxy Note 10.1 (32GB, Deep Grey)",Home Improvement,http://www.amazon.com/dp/B007M506WS/,2,1
"Morton Table Salt, 25 Pound",Grocery,http://www.amazon.com/dp/B007SNJ98G/,11,1
Borderlands 2 Ultimate Loot Chest Limited Edition -Xbox 360,Video Games,http://www.amazon.com/dp/B00841ZJYY/,2,1
World of Warcraft TCG - Power Word: Preservation (WB - 78) - Worldbreaker,Toy,http://www.amazon.com/dp/B008V1KHS0/,1,1
LOG910003057 - Logitech Wireless Rechargeable Touchpad T650,Furniture,http://www.amazon.com/dp/B0093H4WT6/,7,1
Minecraft,Mobile Application,http://www.amazon.com/dp/B00992CF6W/,4,1
Leegoal Novelty Latex Horse Head Mask Gangnam Style,Apparel,http://www.amazon.com/dp/B009PJV6KK/,7,1
MuchBuy MHL Micro USB to HDMI Adapter Cable for Android HTC Samsung Galaxy Nokia LG,Office Product,http://www.amazon.com/dp/B00DR3XIR4/,1,1
Blue Microphones Yeti and Yeti Pro Custom Spider Shock Mount,Photography,http://www.amazon.com/dp/B00HL5WWHQ/,7,1
Blizzard Battle.net Security Key/RSA Token,Video Games,http://www.amazon.com/dp/B00J44RQA0/,1,1
"The Friendly Swede Replaceable Micro-Knit Tip Hybrid Stylus with Lanyards, Cloth and Replacement Tips (3 Pack) (Black + White + Dark Blue)",Wireless,http://www.amazon.com/dp/B00K4NVRRI/,5,1
Classic Retro N64 Bit USB Wired Controller for PC and MAC - Black,Video Games,http://www.amazon.com/dp/B00KBAE52S/,3,1
STAR TREK CCG 1E VOYAGER ASSIGN MISSION SPECIALISTS 107C,Entertainment Memorabilia,http://www.amazon.com/dp/B00KWMN60W/,1,1
AmazonBasics HDMI to DVI Adapter Cable - 6 Feet (1.8 Meters),Speakers,http://www.amazon.com/dp/B00L3KNZZ8/,8,1
Lisa Frank Two Piece School Bundle - Two Pocket Portfolio Folder and Spiral Bound Notebook (Leopard),Office Product,http://www.amazon.com/dp/B00LXOZA52/,1,1
Kangaroo Black Fedora Gangster Hat,Apparel,http://www.amazon.com/dp/B00O17V8RM/,1,1
"Prontotec Touch-Smart Series M1 7.85 Inch Ultra Slim Tablet PC, Android 4.2, TN Touch Screen (1024 x 768 Pixels), Cortex A7 Quad Core Processor, 1GB DDR3/16GB ROM, Dual Camera, HDMI, G-Sensor, Google Play Pre-loaded –Black",PC Accessory,http://www.amazon.com/dp/B00QRLR1OY/,1,1
Lenovo TAB2 A10 ZA000001US 10.1-Inch 16GB Wi-Fi Tablet (Midnight Blue),Personal Computer,http://www.amazon.com/dp/B00TR05L9Y/,8,1
SanDisk Extreme PLUS 16GB microSDHC UHS-I/U3 Card with Adapter (SDSQXSG-016G-GN6MA) [Newest Version],Personal Computer,http://www.amazon.com/dp/B010NE3ND8/,1,1
Milliard Himalayan Salt Coarse Crystals – 1Lb. Bag – Pure and Natural with Minerals and Nutrients for Health Benefits (3-6 mm),Grocery,http://www.amazon.com/dp/B0117QUV90/,1,1
$20 Battle.net Store Gift Card Balance - Blizzard Entertainment [Digital Code],Digital Video Games,http://www.amazon.com/dp/B012JMS4W2/,19,1
Duo Underwater MP3 Player Black / Acid Green,Sports,http://www.amazon.com/dp/B0169RSNPG/,1,1
"NVIDIA SHIELD K1 8"" Tablet - Black",Personal Computer,http://www.amazon.com/dp/B0171BS9CG/,29,1
Warcraft [Blu-ray+DVD+Digital HD],DVD,http://www.amazon.com/dp/B01GUVOXIW/,2,1
"Asus 14 inch FHD (1920 x 1080) Premium Portable Laptop, Intel Dual-Core Processor up to 2.48GHz, 4GB RAM, 32GB eMMC, HDMI, VGA, Webcam, Bluetooth, WiFi, Windows 10",Personal Computer,http://www.amazon.com/dp/B01N1P0GDC/,1,1
Amarillo Slim in a World Full of Fat People: The Memoirs of the Greatest Gambler Who Ever Lived,Book,http://www.amazon.com/dp/0060762306/,1,1
Blue Microphones Snowball iCE Black Microphone with Knox Studio Boom Arm & Pop Filter,Musical Instruments,http://www.amazon.com/dp/B01N3TMY12/,2,1
Amusing Ourselves to Death: Public Discourse in the Age of Show Business,Book,http://www.amazon.com/dp/014303653X/,20,1
"The Elements of Style, Fourth Edition",Book,http://www.amazon.com/dp/020530902X/,59,1
Associated Press Stylebook 2015 and Briefing on Media Law,Book,http://www.amazon.com/dp/0465062946/,1,1
Going Rouge: An American Nightmare,Book,http://www.amazon.com/dp/0757315240/,1,1
Dynamic Anatomy: Revised and Expanded Edition,Book,http://www.amazon.com/dp/0823015521/,5,1
