name,category,amazon_link,total_mentions,subreddit_mentions
Kali: The Black Goddess of Dakshineswar,Book,http://www.amazon.com/dp/0892540257/,3,3
In Praise of the Goddess: The Devimahatmya and Its Meaning,Book,http://www.amazon.com/dp/089254080X/,3,3
The Living Gita: The Complete Bhagavad Gita - A Commentary for Modern Readers,Book,http://www.amazon.com/dp/0932040276/,3,3
Mystic Universe: An Introduction to Vedic Cosmology,eBooks,http://www.amazon.com/dp/B01EMAV6QU/,3,3
"The Principal Upanishads: Edited with Introduction, Text, Translation and Notes (English, Sanskrit and Sanskrit Edition)",Book,http://www.amazon.com/dp/8172231245/,3,3
The Bhagavad Gita with The Commentary of Sri Sankaracharya,Book,http://www.amazon.com/dp/8185208085/,3,2
"Tantra Illuminated: The Philosophy, History, and Practice of a Timeless Tradition",Book,http://www.amazon.com/dp/0989761304/,2,2
A Systematic Course in the Ancient Tantric Techniques of Yoga and Kriya,Book,http://www.amazon.com/dp/8185787085/,4,2
The Ramayana: A Modern Retelling of the Great Indian Epic,Book,http://www.amazon.com/dp/0865476950/,4,2
The Essentials of Hinduism: A Comprehensive Overview of the World's Oldest Religion,Book,http://www.amazon.com/dp/1884852041/,2,2
The Shape of Ancient Thought: Comparative Studies in Greek and Indian Philosophies,Book,http://www.amazon.com/dp/1581152035/,4,2
The Bhagavad Gita (Easwaran's Classics of Indian Spirituality),Book,http://www.amazon.com/dp/1586380192/,15,2
The Upanishads: A Classic of Indian Spirituality,Book,http://www.amazon.com/dp/1586380214/,8,2
An Introduction to Hinduism (Introduction to Religion),Book,http://www.amazon.com/dp/0521438780/,3,1
The Bhagavad-Gita : Krishna's Counsel in Time of War (Bantam Classics),Book,http://www.amazon.com/dp/0553213652/,1,1
A Sourcebook in Indian Philosophy,Book,http://www.amazon.com/dp/0691019584/,2,1
Poems to Siva: The Hymns of the Tamil Saints (Princeton Legacy Library),Book,http://www.amazon.com/dp/0691609268/,1,1
Pocket Bhagavad Gita,Book,http://www.amazon.com/dp/0791420302/,1,1
"Do The Gods Wear Capes?: Spirituality, Fantasy, and Superheroes (New Directions in Religion and Literature)",Book,http://www.amazon.com/dp/082644198X/,1,1
Philosophical Questions: East and West (Philosophy and the Global Context),Book,http://www.amazon.com/dp/084769285X/,1,1
The Yoga of Jesus: Understanding the Hidden Teachings of the Gospels (Self-Realization Fellowship),Book,http://www.amazon.com/dp/0876125569/,1,1
The Handbook of Yoruba Religious Concepts,Book,http://www.amazon.com/dp/0877287899/,1,1
Bhagavad Gita,Book,http://www.amazon.com/dp/0892540907/,1,1
The Himalayan Masters A Living Tradition,Book,http://www.amazon.com/dp/0893892270/,2,1
The Secret of the Yoga Sutra: Samadhi Pada,Book,http://www.amazon.com/dp/0893892777/,2,1
The Gospel of Sri Ramakrishna,Book,http://www.amazon.com/dp/0911206019/,1,1
Jnaneshwar's Gita: A Rendering of the Jnaneshwari,Book,http://www.amazon.com/dp/0911307648/,1,1
Abhinavagupta's Commentary on the Bhagavad Gita: Gitartha-Samgraha,Book,http://www.amazon.com/dp/0915801930/,1,1
Asana Pranayama Mudra Bandha,Book,http://www.amazon.com/dp/0949551147/,1,1
My Cat Saved My Life,Book,http://www.amazon.com/dp/0968327303/,1,1
The Bhagavad Gita: Twenty-Fifth-Anniversary Edition (Suny Series in Cultural Perspectives),Book,http://www.amazon.com/dp/1438428421/,2,1
Simple Kali Puja: Instructions for Ritualistic Worship of Dakshina Kali,Book,http://www.amazon.com/dp/1463685327/,1,1
Bhagavad Gita: Based on Sri Ramanuja's Gitabhashyam,Book,http://www.amazon.com/dp/1499696914/,1,1
The Handy Religion Answer Book (The Handy Answer Book Series),Book,http://www.amazon.com/dp/1578593794/,1,1
The Bhagavad-Gita: A New Translation,Book,http://www.amazon.com/dp/159030893X/,1,1
Shakti: Realm of the Divine Mother,Book,http://www.amazon.com/dp/1594771995/,1,1
Lost Masters: Rediscovering the Mysticism of the Ancient Greek Philosophers (An Eckhart Tolle Edition),Book,http://www.amazon.com/dp/1608684385/,1,1
The Thousand Names Of The Divine Mother: Shri Lalita Sahasranama,Book,http://www.amazon.com/dp/1680372823/,1,1
Prabhupada : Your Ever Well Wisher,Book,http://www.amazon.com/dp/1845990862/,1,1
Kali Puja,Book,http://www.amazon.com/dp/1887472649/,1,1
Evil and the Retributive Hypothesis,Book,http://www.amazon.com/dp/812081097X/,1,1
Classical Indian Philosophy of Mind,Book,http://www.amazon.com/dp/8120817044/,1,1
Brahma Sutras and Their Principal Commentaries,Book,http://www.amazon.com/dp/812150032X/,1,1
The Mahabharata-a modern rendering/2 Vol Set,Book,http://www.amazon.com/dp/8129114925/,3,1
Japa Yoga A Comprehensive Treatise on Mantra-Sastra,Book,http://www.amazon.com/dp/8170520185/,1,1
Hindu Gods and Goddesses,Book,http://www.amazon.com/dp/8171201105/,2,1
"1: Eight Upanishads, with the Commentary of Sankaracarya, Vol. I",Book,http://www.amazon.com/dp/8175050160/,2,1
Madhusudana Saraswati Bhagavad-Gita,Book,http://www.amazon.com/dp/8175051949/,1,1
Kindle Life,Book,http://www.amazon.com/dp/8175971894/,1,1
Sri Ramanuja Gita Bhasya,Book,http://www.amazon.com/dp/8178235188/,1,1
Harivamsa Purana (Set of 10 Volumes),Book,http://www.amazon.com/dp/8184030649/,1,1
Bhagavan Buddha and our Heritage,Book,http://www.amazon.com/dp/8185301077/,1,1
Kundalini Tantra/2012 Re-print/ 2013 Golden Jubilee edition,Book,http://www.amazon.com/dp/8185787158/,2,1
The Garland of Letters: Studies in the Mantra-Sastra,Book,http://www.amazon.com/dp/8185988129/,1,1
"Meditations: Yogas, Gods, Religions",Book,http://www.amazon.com/dp/8185990646/,1,1
Abhinavagupta's Commentary on the Bhagavad Gita  Gitartha Samgraha,Book,http://www.amazon.com/dp/8186569448/,1,1
Krishna: The Protector of Dharma (Amar Chitra Katha) 5 in 1,Book,http://www.amazon.com/dp/8189999184/,1,1
Breaking India,Book,http://www.amazon.com/dp/8191067374/,2,1
Being Different,Book,http://www.amazon.com/dp/9350291908/,2,1
"Rearming Hinduism: Nature, Hinduphobia and the Return of Indian Intelligence",Book,http://www.amazon.com/dp/938403052X/,1,1
Mystic Universe: An Introduction to Vedic Cosmology,Book,http://www.amazon.com/dp/9385384066/,1,1
Bhakti Ratnavali,Book,http://www.amazon.com/dp/B003DXLX70/,1,1
Sri Bhaktisiddhanta Vaibhava,eBooks,http://www.amazon.com/dp/B003XT5J3S/,1,1
The Upanishads (Easwaran's Classics of Indian Spirituality),eBooks,http://www.amazon.com/dp/B004DI7R4W/,1,1
Bhagavad-gita As It Is,eBooks,http://www.amazon.com/dp/B004GHNEL0/,1,1
Shakti: Realm of the Divine Mother,eBooks,http://www.amazon.com/dp/B004X6WN02/,1,1
Bhagavad-gita As It Is (1972 edition),eBooks,http://www.amazon.com/dp/B0052EXB1O/,1,1
Yogic Pranayama: Breathing For Long Life & Good Health,Book,http://www.amazon.com/dp/B008RXZDPO/,1,1
By Swami Hariharananda Aranya - Yoga Philosophy of Patanjali: Containing His Yoga Aphorisms with Vy†asa's Commentary in Sanskrit and a Translation with Annotations Including Many Suggestions for the Practice of Yoga: 1st (first) Edition,Book,http://www.amazon.com/dp/B008VR764M/,1,1
Seven Secrets of Shiva,Audible,http://www.amazon.com/dp/B0098PP27O/,1,1
Mantra: Sacred Words of Power,Audible,http://www.amazon.com/dp/B00A43KZ58/,1,1
Ayurveda and the Mind: The Healing of Consciousness,Book,http://www.amazon.com/dp/B00GSHTQXG/,1,1
Quantum Meaning: A Semantic Interpretation of Quantum Theory,eBooks,http://www.amazon.com/dp/B00PPTQZC8/,1,1
Is the Apple Really Red?: 10 Essays on Science and Religion,eBooks,http://www.amazon.com/dp/B00PPTRBXU/,1,1
Six Causes: The Vedic Theory of Creation,eBooks,http://www.amazon.com/dp/B00PQRINQA/,1,1
"The Yoga Sutras of Patañjali: A New Edition, Translation, and Commentary",eBooks,http://www.amazon.com/dp/B00QRZI1XA/,1,1
In Praise of the Goddess: The Devimahatmya and Its Meaning,eBooks,http://www.amazon.com/dp/B0125TX190/,1,1
The Thousand Names Of The Divine Mother: Shri Lalita Sahasranama: (Fixed Layout Edition),eBooks,http://www.amazon.com/dp/B013TJ28O4/,1,1
Kundalini — An Untold Story: A Himalayan Mystic's Insight into the Power of Kundalini and Chakra Sadhana,eBooks,http://www.amazon.com/dp/B01DYMWO9U/,1,1
Flow: The Psychology of Optimal Experience (Harper Perennial Modern Classics),Book,http://www.amazon.com/dp/0061339202/,46,1
Goddess and the Guru: A Spiritual Biography of Sri Amritananda Natha Saraswati,eBooks,http://www.amazon.com/dp/B071V84SD6/,1,1
Krishna: the Beautiful Legend of God: (Srimad Bhagavata Purana Book X) (Penguin Classics) (Bk.10),Book,http://www.amazon.com/dp/0140447997/,1,1
Sita: An Illustrated Retelling of the Ramayana,Book,http://www.amazon.com/dp/0143064320/,4,1
Mahabharata Vol 1 (Penguin Translated Texts),Book,http://www.amazon.com/dp/0143100130/,1,1
Jaya: An Illustrated Retelling of the Mahabharata,Book,http://www.amazon.com/dp/014310425X/,2,1
The Mahabharata (10 vol Box Set),Book,http://www.amazon.com/dp/0143424785/,3,1
The Interpretation of Caste (Oxford India Paperbacks),Book,http://www.amazon.com/dp/0195651715/,1,1
The Origins of the World's Mythologies,Book,http://www.amazon.com/dp/0199812853/,5,1
The Invention of Religion in Japan,Book,http://www.amazon.com/dp/0226412342/,4,1
The Hare Krishna Movement: The Postcharismatic Fate of a Religious Transplant,Book,http://www.amazon.com/dp/023112256X/,1,1
The Upanishads: Breath from the Eternal,Book,http://www.amazon.com/dp/0451528484/,1,1
The Little Book of Hindu Deities: From the Goddess of Wealth to the Sacred Cow,Book,http://www.amazon.com/dp/0452287758/,4,1
"The Sword and the Flute: Kali and Krsna- Dark Visions of the Terrible and the Sublime in Hindu Mythology (Hermeneutics, Studies in the History of Religions)",Book,http://www.amazon.com/dp/0520224760/,1,1
