name,category,amazon_link,total_mentions,subreddit_mentions
The Upanishads: A Classic of Indian Spirituality,Books,https://www.amazon.com/Upanishads-Classic-Indian-Spirituality/dp/1586380214/ref=sr_1_1?ie=UTF8&amp;qid=1502231249&amp;sr=8-1&amp;keywords=upanishad,3,1
"The Principal Upanishads: Edited with Introduction, Text, Translation and Notes",Books,https://www.amazon.com/Principal-Upanishads-Edited-Introduction-Translation/dp/8172231245/ref=sr_1_1?ie=UTF8&amp;qid=1453997545&amp;sr=8-1&amp;keywords=principal+upanishads,1,1
"Meditations: Yogas, Gods, Religions",Books,https://www.amazon.com/Meditations-Yogas-Religions-Ram-Swarup/dp/8185990646,1,1
The Upanishads: Breath from the Eternal,Books,https://www.amazon.com/Upanishads-Breath-Eternal-Swami-Prabhavanada/dp/0451528484/ref=sr_1_4?ie=UTF8&amp;qid=1502231249&amp;sr=8-4&amp;keywords=upanishad,1,1
Shakti: Realm of the Divine Mother,Books,https://www.amazon.com/Shakti-Realm-Divine-Mother-Vanamali/dp/1594771995,1,1
In Praise of the Goddess: The Devimahatmya and Its Meaning,Books,https://www.amazon.com/Praise-Goddess-Devimahatmya-Its-Meaning/dp/089254080X,1,1
The Thousand Names Of The Divine Mother: Shri Lalita Sahasranama,Books,https://www.amazon.com/Thousand-Names-Divine-Mother-Sahasranama/dp/1680372823/ref=sr_1_1?s=books&amp;ie=UTF8&amp;qid=1470238060&amp;sr=1-1,1,1
