name,category,amazon_link,total_mentions,subreddit_mentions
The Upanishads: A Classic of Indian Spirituality,Book,http://www.amazon.com/dp/1586380214/,3,1
"The Principal Upanishads: Edited with Introduction, Text, Translation and Notes",Book,http://www.amazon.com/dp/8172231245/,1,1
"Meditations: Yogas, Gods, Religions",Book,http://www.amazon.com/dp/8185990646/,1,1
The Upanishads: Breath from the Eternal,Book,http://www.amazon.com/dp/0451528484/,1,1
Shakti: Realm of the Divine Mother,Book,http://www.amazon.com/dp/1594771995/,1,1
In Praise of the Goddess: The Devimahatmya and Its Meaning,Book,http://www.amazon.com/dp/089254080X/,1,1
The Thousand Names Of The Divine Mother: Shri Lalita Sahasranama,Book,http://www.amazon.com/dp/1680372823/,1,1
