name,category,amazon_link,total_mentions,subreddit_mentions
Thrustmaster   T.16000M FCS HOTAS Controller,Personal Computer,http://www.amazon.com/dp/B01KCHPRXA/,18,5
Fighter Combat: Tactics and Maneuvering,Book,http://www.amazon.com/dp/0870210599/,12,3
Thrustmaster Hotas Warthog Joystick,Electronics,https://www.amazon.com/Thrustmaster-Hotas-Warthog-Joystick-2960720/dp/B00371R8P4/ref=sr_1_1?ie=UTF8&amp;qid=1451155799&amp;sr=8-1&amp;keywords=thrustmaster+warthog,7,2
Thrustmaster T-Flight Hotas X Flight Stick,Video Games,http://www.amazon.com/dp/B001CXYMFS/,32,1
Thrustmaster T-16000M Flight Stick,CE,http://www.amazon.com/dp/B001S0RTU0/,17,1
"Inateck Superspeed 7 Ports PCI-E to USB 3.0 Expansion Card - 5 USB 3.0 Ports and 2 Rear USB 3.0 Ports Express Card Desktop with 15 Pin SATA Power Connector, Including Two Power Cables",PC Accessory,http://www.amazon.com/dp/B00FPIMICA/,6,1
Mig Pilot: The Final Escape of Lt. Belenko,Book,http://www.amazon.com/dp/0380538687/,5,1
Saitek Pro Flight X-55 Rhino H.O.T.A.S. (Hands on Throttle and Stick) System for PC,Personal Computer,http://www.amazon.com/dp/B00HHAIY72/,5,1
CH Products Pro Pedals USB Flight Simulator Pedals ( 300-111 ),CE,http://www.amazon.com/dp/B0000512IE/,4,1
TrackIr 5 Premium Head Tracking for Gaming,Video Games,http://www.amazon.com/dp/B0029M6VKA/,3,1
"Helicopter Performance, Stability, and Control",Book,http://www.amazon.com/dp/1575242095/,2,1
Logitech G Saitek X52 Flight Control System,Personal Computer,http://www.amazon.com/dp/B01LY285ZH/,2,1
Stick and Rudder: An Explanation of the Art of Flying,Book,http://www.amazon.com/dp/0070362408/,2,1
Learn Russian: Rosetta Stone Russian - Level 1-5 Set,Software,http://www.amazon.com/dp/1617168777/,2,1
"Rust-Oleum 265495 11-Ounce Leak Seal Flexible Rubber Sealant, Clear",Home Improvement,http://www.amazon.com/dp/B00AGZ0MUW/,1,1
Red Star Against the Swastika: The Story of a Soviet Pilot over the Eastern Front,Book,http://www.amazon.com/dp/1848328036/,1,1
Revell 1:48 F-14A Tomcat,Hobby,http://www.amazon.com/dp/B0000DEW86/,1,1
Vlamgat: The Story of the Mirage F1 in the South African Air Force,Book,http://www.amazon.com/dp/192014336X/,1,1
Great Planes RealFlight 7.5 RC Flight Simulator with Interlink Elite Controller,Hobby,http://www.amazon.com/dp/B00P6PCOBW/,1,1
In Pursuit: A Pilot's Guide to Online Air Combat,Book,http://www.amazon.com/dp/9197607703/,1,1
A-10 Warthog Vehicle Decal - Nobody Cares About Your Stick Figure Family,Sports,http://www.amazon.com/dp/B00JG8I2VQ/,1,1
Logitech G Pro Flight X56 Rhino HOTAS,Personal Computer,http://www.amazon.com/dp/B01LX398IE/,1,1
Thrustmaster TFRP Flight Rudder Pedals for PC & Playstation 4,Personal Computer,http://www.amazon.com/dp/B015PII6YI/,1,1
Logitech Extreme 3D Pro Precision Fightstick,Home Theater,http://www.amazon.com/dp/B00CJ5FPTA/,1,1
Busboard Protot SB400 Solder able PC Breadboard 1 Sided PCB Matches 400 Tie-Point Breadboards with Power Rails,Industrial & Scientific,https://www.amazon.com/gp/product/B0040Z3012,1,1
2-button Ergonomic USB 800dpi Optical Finger Mouse,Personal Computer,http://www.amazon.com/dp/B000UVD8B2/,1,1
