name,category,amazon_link,total_mentions,subreddit_mentions
Spinning Hat Cap Zappa Bottle Opener,Kitchen,http://www.amazon.com/dp/B00BKQSL2C/,16,2
"Rexing V1 Car Dash Cam 2.4"" LCD FHD 1080p 170 Degree Wide Angle Dashboard Camera Recorder with Sony Exmor Video Sensor, G-Sensor, WDR, Loop Recording",Wireless,http://www.amazon.com/dp/B00X528FNE/,28,1
"YI 2.7"" Screen Full HD 1080P60 165 Wide Angle Dashboard Camera, Car DVR Vehicle Dash Cam with G-Sensor, WDR, Loop Recording, Grey",Wireless,http://www.amazon.com/dp/B01C89GCHU/,23,1
A People's History of the United States,Book,http://www.amazon.com/dp/0060838655/,19,1
"Pruveeo F5 Dash Cam with WiFi, Discreet Design Dash Camera for Cars, Car Driving Recorder DVR",Car Audio or Theater,http://www.amazon.com/dp/B01KZWMGFY/,3,1
Rhode Island Novelty Classic Gag: Squirting Wee Pee Boy Squirter Quantity of 1 Novelty,Toy,http://www.amazon.com/dp/B0067N91V8/,2,1
Don't Break the Ice,Toy,http://www.amazon.com/dp/B00000IVZJ/,2,1
Christmas Eggnog Moose Mugs - Gift Boxed Set of 2 - Safer Than Glass,Kitchen,http://www.amazon.com/dp/B000WWYG1A/,1,1
Elucto Electric Bug Zapper Fly Swatter 2200 Volt Single Layer Yellow,Lawn & Patio,http://www.amazon.com/dp/B010PWBNNK/,1,1
"JerseyFame #96 Conway ""The Mighty Ducks"" Hockey Jersey ALL SIZE GREEN (XL)",Apparel,http://www.amazon.com/dp/B01N9V78TL/,1,1
Hangar 9 (No Suggestions) 12V Starter,Hobby,http://www.amazon.com/dp/B0006OBNOM/,1,1
"Command Picture Hanging Strips Variety Value Pack, 4-Small and 8-Medium Pairs (17203-ES)",Tools & Home Improvement,https://www.amazon.com/Command-Picture-Hanging-4-Small-8-Medium/dp/B000OF6X48,1,1
"SOG FastHawk F06TN-CP - Hardcased Black, 420 Stainless Steel, GRN Handle, Nylon Sheath, 2"" Blade",Home Improvement,http://www.amazon.com/dp/B00438RI7S/,1,1
12'' Special Forces Action Figure - ACU,Toy,http://www.amazon.com/dp/B00FOIMWT0/,1,1
OIC92914 - Officemate OIC Thumb Tacks,Office Product,http://www.amazon.com/dp/B003H95UK6/,1,1
