name,category,amazon_link,total_mentions,subreddit_mentions
Master Lock 265DCCSEN Dual-Function Security Bar,Tools & Home Improvement,https://www.amazon.com/Master-Lock-265DCCSEN-Dual-Function-Security/dp/B0002YUX8I/ref=sr_1_1?ie=UTF8&amp;qid=1460653424&amp;sr=8-1&amp;keywords=door+bar,14,3
Door Armor MAX Combo Set – Door Security from Armor Concepts - SET-EZA-23000 (Satin Nickel),Tools & Home Improvement,https://www.amazon.com/Door-Armor-MAX-Combo-Set/dp/B00E9ZGWNQ/ref=sr_1_1?ie=UTF8&amp;qid=1491651545&amp;sr=8-1&amp;keywords=front+door+reinforcement,5,3
"GE 45174 Magnetic Indoor Window Alarms, 4 Pack",Electronics,https://www.amazon.com/GE-45174-Magnetic-Indoor-Window/dp/B00FGPM1SS/,2,2
"Prime-Line Products U 10385 Door Strike, Accommodates 5-1/2 in. to 6 in. Hole Centers, Steel, Satin Nickel Plated",Tools & Home Improvement,https://www.amazon.com/Prime-Line-Products-10385-Accommodates-Centers/dp/B00D2K33NG/ref=redir_mobile_desktop?_encoding=UTF8&amp%3BdpID=31AjDUX1GIL&amp%3BdpPl=1&amp%3Bkeywords=strike%20plate&amp%3Bpi=SY200_QL40&amp%3Bref=plSrch&amp%3Bsr=8-3&qid=1452955662&ref_=mp_s_a_1_3,2,2
Reolink IP PoE Security Camera 4 Megapixels Super HD 2560x1440 Bullet Outdoor Indoor IR Night Vision Motion Detection RLC-410 (Fixed Bullet without SD card),Electronics,https://www.amazon.com/Reolink-RLC-410-4-Megapixel-POE-Waterproof/dp/B010LH48F4,,1
Addalock - (1 Piece),Tools & Home Improvement,https://www.amazon.com/Rishon-Enterprises-Addalock-1-Piece/dp/B00186URTY/ref=sr_1_fkmr3_1?ie=UTF8&amp;qid=1485088469&amp;sr=8-1-fkmr3&amp;keywords=travel+door+jamb+security,11,1
"SABRE Red Pepper Gel - Police Strength - Tactical Series with 18-Foot (5.5M) Range, 18 Bursts & Belt Holster",Sports & Outdoors,https://www.amazon.com/SABRE-RED-Pepper-Gel-Professional/dp/B004NKSPR8/ref=sr_1_1?ie=UTF8&amp;qid=1460653560&amp;sr=8-1&amp;keywords=sabre+gel,9,1
"SABRE 3-IN-1 Pepper Spray - Police Strength - Compact Size with Clip (Max Protection - 35 shots, up to 5x's more)",Sports & Outdoors,https://www.amazon.com/SABRE-3---1-Pepper-Spray/dp/B0007VM8UC/,9,1
"SABRE RED Pepper Gel Spray - Police Strength - Runner with Adjustable Hand Strap (Max Protection - 35 bursts, up to 5x's More)",Sports & Outdoors,https://www.amazon.com/SABRE-RED-Pepper-Gel-Spray/dp/B002E6RERU/ref=sr_1_2?s=sporting-goods&amp;ie=UTF8&amp;qid=1491634964&amp;sr=1-2-spons&amp;keywords=pepper+spray&amp;psc=1,6,1
Door Armor MAX Combo Set – Door Security from Armor Concepts - SET-EZA-20000 (White),Tools & Home Improvement,https://www.amazon.com/Door-Armor-MAX-Combo-Set/dp/B008N3QW4O,5,1
"Defender Security U 10827 High Security Door Reinforcement Lock, Aluminum, Satin Nickel Anodized Finish",Tools & Home Improvement,https://www.amazon.com/Prime-Line-Products-10827-Reinforcement-Construction/dp/B00D2K367Y,3,1
"The Source Hot Sauce, 7.1 Million Scoville Units",Grocery & Gourmet Food,https://www.amazon.com/Source-Sauce-Million-Scoville-Units/dp/B001BIXJG2/ref=sr_1_2_a_it?ie=UTF8&amp;qid=1470367924&amp;sr=8-2,3,1
Evertech 4 Pairs HD Video Audio Power Balun Compatible with 1080P/720P TVI AHD CVI Analog CCTV Cameras ( tested well ) Network Transceiver Connectors CAT5/CAT6 to BNC,Electronics,https://www.amazon.com/Evertech-Pairs-Network-Transceiver-Connectors/dp/B00X6GWVRU/ref=sr_1_4?ie=UTF8&amp;qid=1496289498&amp;sr=8-4&amp;keywords=cctv+balun,2,1
VideoSecu Key Lock 9 Output 12 V DC CCTV Distributed Power Supply Box for Security Camera WK9,Electronics,https://www.amazon.com/VideoSecu-Output-Distributed-Supply-Security/dp/B000TBHBSO/ref=sr_1_4?ie=UTF8&amp;qid=1496289694&amp;sr=8-4&amp;keywords=cctv+power+supply,2,1
"Prime-Line Products U 11026 Jamb Repair & Reinforcement Kit, 59-1/2"" Installed, Steel Construction, White",Tools & Home Improvement,https://www.amazon.com/Prime-Line-Products-11026-Reinforcement-Construction/dp/B00FB29LZW/ref=redir_mobile_desktop?_encoding=UTF8&amp%3Bkeywords=door%20reinforcer&amp%3Bpi=AC_SX236_SY340_FMwebp_QL65&amp%3Bqid=1473128760&amp%3Bsr=8-12&ref_=mp_s_a_1_12,2,1
Gibraltar SM16KB01 Locking Mailbox,Tools & Home Improvement,https://www.amazon.com/dp/B006ELC9HG/ref=cm_sw_r_cp_apa_5BFIyb2QRMC1S,2,1
"Stealth Cam Megapixel Digital Scouting Camera, Tree Bark",Sports & Outdoors,https://www.amazon.com/Stealth-Cam-STC-P12-Megapixel-Scouting/dp/B00HMN7LDC,2,1
Hikvision V5.2.5 DS-2CD2632F-IS 3MP Bullet Camera Full HD 1080P POE Power Network 2.7-12mm Vari-focal Lens IP CCTV Camera,Electronics,https://www.amazon.com/Hikvision-DS-2CD2632F--Network-2-8-12mm-Vari-focal/dp/B00VSRA752/ref=sr_1_3?ie=UTF8&amp;qid=1465066302&amp;sr=8-3&amp;keywords=hikvision+bullet,2,1
"VIPERTEK VTS-195 - Aluminum Series 980,000,000 Heavy Duty Stun Gun - Rechargeable with LED Tactical Flashlight",Sports & Outdoors,https://www.amazon.com/VIPERTEK-VTS-195-Rechargeable-Tactical-Flashlight/dp/B01FL444JW/ref=sr_1_4?s=sporting-goods&amp;ie=UTF8&amp;qid=1491635084&amp;sr=1-4&amp;keywords=flashlight+stun+gun,2,1
Arlo VMS3130  Indoor/Outdoor Night Vision Security System with 1 Wire-Free HD Camera,Electronics,https://www.amazon.com/Arlo-VMS3130-Outdoor-Security-Wire-Free/dp/B00QH0Q8J4/ref=sr_1_16?s=photo&amp;ie=UTF8&amp;qid=1501254344&amp;sr=1-16&amp;keywords=arlo+camera,2,1
"Defender Security U 11126 High Security Door Reinforcement Lock, Aluminum, Bronze Anodized Finish",Tools & Home Improvement,https://www.amazon.com/dp/B00QR2QCJI/ref=cm_sw_r_sms_awd_x_PZu5xb0DVAH4F,2,1
"1080P 20X Optical Zoom PTZ Camera 4.5"" CMOS HD 2.0MP IP Pan Tilt Camera PTZ Security Camera Support 164ft-262ft IR Distance PTZ Outdoor Camera SW SWINWAY",Electronics,https://www.amazon.com/SW-Optical-Distance-Outdoor-Security/dp/B018VAOQYG/ref=sr_1_3?s=photo&amp;ie=UTF8&amp;qid=1474334841&amp;sr=1-3,1,1
NETCAT Outdoor Sony CMOS Mini 20X Optical Zoom HD 1080P 2.0MP 150M IR High Speed Dome PTZ IP Camera,Electronics,https://www.amazon.com/NETCAT-Outdoor-Optical-1080P-Camera/dp/B011R609QU,1,1
"Schlage B60N626 Deadbolt, Keyed 1 Side, Satin Chrome",Tools & Home Improvement,https://www.amazon.com/Schlage-B60N626-Deadbolt-Keyed-Chrome/dp/B0030ZUC3M/ref=sr_1_2?ie=UTF8&amp;qid=1491651406&amp;sr=8-2&amp;keywords=Schlage+Grade+1+Locks,1,1
"2wayz Garden Hose Splitter, Hose Nozzle with Heavy Duty Metal Body Attachments and 3 Rubber Washers (Set of 2)","Patio, Lawn & Garden",https://www.amazon.com/Garden-Splitter-Arthritis-Friendly-Connector/dp/B00KNPAQ9M,1,1
MOHOO 20A 12V 24V Solar Charge Controller Auto Switch LCD Intelligent Panel Battery Regulator Charge Controller Overload Protection,"Patio, Lawn & Garden",https://www.amazon.com/Intelligent-Controller-Protection-Temperature-Compensation/dp/B0191QN7OO/ref=sr_1_1?ie=UTF8&amp;qid=1472141859&amp;sr=8-1-spons&amp;keywords=12v+solar+charge+controller&amp;psc=1,1,1
Door Armor Mini Combo Set - White,Tools & Home Improvement,https://www.amazon.com/dp/B00LSWEEDI/ref=cm_sw_r_cp_apa_D15czb1PQ8H7Z,1,1
iPower GLTIME 120 Volt 24 Hour Heavy Duty Plug-in Mechanical Timer,"Patio, Lawn & Garden",https://www.amazon.com/dp/B00BDGHJK4/ref=cm_sw_r_cp_awd_EqxTwbD6WQ0TD,1,1
"1byone Safety Driveway Patrol Infrared and Wireless Home Security Alert Alarm System Kit, White",Electronics,https://www.amazon.com/Driveway-Classical-Indicator-Weatherproof-Warehouse/dp/B00EPCN9O8/,1,1
Door Wedge Alarms (pack of 2),Tools & Home Improvement,https://www.amazon.com/Door-Wedge-Alarms-pack-2/dp/B00A1DY6WO/ref=sr_1_3?ie=UTF8&amp;qid=1485088469&amp;sr=8-3&amp;keywords=travel+door+jamb+security,1,1
VideoSecu 4 Pack Dome Dummy Fake Infrared IR CCTV Surveillance Security Cameras Imitation Simulated Blinking LED with Security Warning Stickers C4B,Tools & Home Improvement,https://www.amazon.com/VideoSecu-Security-Surveillance-Simulated-C4B/dp/B009FGS6LA/ref=sr_1_8?s=hi&amp;ie=UTF8&amp;qid=1427757250&amp;sr=1-8&amp;keywords=fake+security+camera,1,1
SECURITY HINGE BOLTS BZP STEEL WITH FIXING SCREWS ( 1 pair ),Tools & Home Improvement,https://www.amazon.com/SECURITY-HINGE-BOLTS-FIXING-SCREWS/dp/B007JHI694,1,1
ANVIL MARK GIDDS-558780 Lockout Device For Knobset,Tools & Home Improvement,https://www.amazon.com/Keyed-Lock-Out-Device-International-Source/dp/B002NGJTAG,1,1
Travelers Security Lock Llc.,Tools & Home Improvement,https://www.amazon.com/Travelers-Security-Lock-Llc/dp/B00AFN2NKW/ref=sr_1_fkmr3_3?ie=UTF8&amp;qid=1485088469&amp;sr=8-3-fkmr3&amp;keywords=travel+door+jamb+security,1,1
"Amcrest UltraHD 3-Megapixel (2048 x 1536P) 8Ch Network POE Video Security System (NVR Kit) - Four 3MP POE Outdoor Bullet IP Cameras, 98ft Night Vision, 2TB HDD, Power over Ethernet (Black)",Electronics,https://www.amazon.com/Amcrest-3-Megapixel-Network-Security-System/dp/B01C6DJUKE/,1,1
"Prime-Line Products U 9809 Sliding Window Lock, 1/2 in., Diecast Construction, White, FOR VINYL WINDOWS (Pack of 2)",Tools & Home Improvement,https://www.amazon.com/gp/product/B005H3N43K,1,1
"Shepherd Hardware 9133 Heavy Duty Rubber Door Wedge, Brown",Tools & Home Improvement,https://www.amazon.com/dp/B00004YOHN/,1,1
SABRE Wireless Home Security Burglar Alarm Set - Includes LOUD 120 dB Keypad Alarm with Three Additional Door/Window Alarms - DIY EASY Installation,Tools & Home Improvement,https://www.amazon.com/SABRE-Wireless-Security-Burglar-Alarm/dp/B00M30SHFU/ref=redir_mobile_desktop?_encoding=UTF8&%2AVersion%2A=1&%2Aentries%2A=0,1,1
TH Marine TWA-1-DP Two Way Boat Alarm System,Sports & Outdoors,https://www.amazon.com/TH-Marine-TWA-1-DP-Alarm-System/dp/B0053HR8CI,1,1
BDF S8MC Window Film Security and Safety Clear 8 Mil (30in X 12ft),Tools & Home Improvement,https://www.amazon.com/S8MC-Window-Security-Safety-Clear/dp/B00FRLJU0I/,1,1
Manker E11 Pocket EDC Flashlight 800 Lumens CREE XP-L LED Torch Use 1x 14500 / AA Battery - Simple Version of Manker T01,Sports & Outdoors,https://www.amazon.com/Manker-E11-Flashlight-Battery-Version/dp/B01G1QJO3U/ref=sr_1_1?ie=UTF8&amp;qid=1491634943&amp;sr=8-1&amp;keywords=manker+e11,1,1
"Window Guard Pin Lock Set for Sliding Doors and Windows - Extra-Long 3-1/2"" Pin",Tools & Home Improvement,https://www.amazon.com/Window-Guard-Sliding-Doors-Windows/dp/B0036UFTVQ,1,1
"Strybuc 16108C-48 Charley Bar for Sliding Glass Door, 48"" Bar",Tools & Home Improvement,https://www.amazon.com/Strybuc-16108C-48-Charley-Sliding-Glass/dp/B00106A7WY,1,1
"Cardinal Gates Door Guardian, Brass",Baby,https://www.amazon.com/dp/B000H5ON10/ref=wl_it_dp_o_pC_nS_ttl?_encoding=UTF8&amp;colid=27C7TTR6VDF1X&amp;coliid=I2V3KSXMYOQF5E&amp;psc=1,1,1
"Arlo Pro Security System with Siren – 1 Rechargeable Wire-Free HD Camera with Audio, Indoor/Outdoor, Night Vision  (VMS4130)",Electronics,https://www.amazon.com/Arlo-Pro-Security-System-Siren/dp/B01LR8PG52/ref=sr_1_1?s=electronics&amp;ie=UTF8&amp;qid=1501254990&amp;sr=1-1&amp;keywords=arlo+pro+1+camera+kit,1,1
Cocoweb PortBlock Dual-Function Door Security Bar,Tools & Home Improvement,https://www.amazon.com/dp/B00PSPSE6E/,1,1
Hikvision V5.3.0 DS-2CD2032F-I Replace DS-2CD2032-I 3MP 1080P Poe with SD Card Slot IR IP Network CCTV Camera Multi-language 4mm,Electronics,https://www.amazon.com/Hikvision-DS-2CD2032F-I-Replace-DS-2CD2032-I-Multi-language/dp/B00YJ2QICO/ref=sr_1_1?ie=UTF8&amp;qid=1488515366&amp;sr=8-1&amp;keywords=hikvision+sd,1,1
Garage Shield GS100 - Garage Guard for Garage Door Security - Protect Your Garage and Home from Burglars,Tools & Home Improvement,https://www.amazon.com/Garage-Shield-GS100-Guard-Security/dp/B0160TRIS6,1,1
Home Zone Motion Activated LED Security Light - 2500 Lumens,Tools & Home Improvement,https://www.amazon.com/gp/product/B01AYB9M1W/ref=oh_aui_search_detailpage?ie=UTF8&amp;psc=1,1,1
Doberman Security SE-0119A Wireless Door Alarm with 2 Remote Controls (Silver/Black),Electronics,https://www.amazon.com/Doberman-Security-SE-0119A-Wireless-Controls/dp/B01B1QOFCU/ref=pd_sbs_421_4?_encoding=UTF8&amp;pd_rd_i=B01B1QOFCU&amp;pd_rd_r=00VRSCZ9NRQ9HCY1KMW9&amp;pd_rd_w=3hFKg&amp;pd_rd_wg=Uy249&amp;psc=1&amp;refRID=00VRSCZ9NRQ9HCY1KMW9,1,1
Door Armor MAX Combo Set – Door Security from Armor Concepts - SET-EZA-22000 (Aged Bronze),Tools & Home Improvement,https://www.amazon.com/dp/B00E9ZGWH2/ref=cm_sw_r_sms_awd_x_dNu5xbKJXZD15,1,1
