name,category,amazon_link,total_mentions,subreddit_mentions
Genova Products 910071 3/4-Inch x 100-Foot 100 PSI Poly Cold Water Plumbing/Irrigation Pipe Tubing Roll,Lawn & Patio,http://www.amazon.com/dp/B000BVS1YK/,1,1
Sports Hula Hoop for Workout - ARMHOOP 200 - box 200 gram. 2 Hoops,Sports,http://www.amazon.com/dp/B002N6QDZA/,1,1
"3M Gripping Material TB731 Clear, 1 in x 15 ft (Pack of 2)",BISS,http://www.amazon.com/dp/B0093CQRK8/,1,1
Real Premium Grade Gaffer Tape  By GafferPower Made in the USA Black (Also Available in Multiple Colors) 2 Inch X 30 Yards Heavy Duty Gaffer's Tape,Office Product,http://www.amazon.com/dp/B00GZE3UJ8/,9,1
"36"", 3/4"" Polypro - Best, Safest Fitness Hula Hoop for Development and Fun",Sports,http://www.amazon.com/dp/B00PFZBSN8/,1,1
"3 Pound Weighted Hula Hoop. Perfect for Dancing, Hot Fitness Workouts and Simply the Funnest Way to Lose Weight.",Sports,http://www.amazon.com/dp/B00T6RPJ0E/,1,1
Office Marshal Chair Mat for Hard Floors | Eco-Friendly Series Chair Floor Protector | 100% Recycled (PET) Floor Mat for Office or Home Use | Multiple Sizes | Translucent - 48'' x 78'',Office Product,http://www.amazon.com/dp/B071KBWW2M/,1,1
