name,category,amazon_link,total_mentions,subreddit_mentions
"Smart Pots 5-Gallon Smart Pot Soft-Sided Container, Black",Lawn & Patio,http://www.amazon.com/dp/B002JUOWB2/,7,3
Sunlite SL65/27K/MED 65 Watt High Wattage Spiral Energy Saving CFL Light Bulb Medium Base 120 Volt Warm White,Home Improvement,http://www.amazon.com/dp/B005550NN4/,2,2
"Agrobrite FLT24 T5 Fluorescent Grow Light System, 2 Foot, 4 Tube",Lawn & Patio,http://www.amazon.com/dp/B002JQBQZQ/,15,2
Alaska Fish Emulsion Fertilizer 5-1-1 Concentrate 1 Gallon,Lawn & Patio,http://www.amazon.com/dp/B002RH0B26/,3,2
"Bonide Products 857 Pyrethrin Spray Concentrate, 8-Ounce",Lawn & Patio,http://www.amazon.com/dp/B0035HA0AK/,2,2
"General Hydroponics Flora Grow, Bloom, Micro Combo Fertilizer set, 1 Quart (Pack of 3)",Lawn & Patio,http://www.amazon.com/dp/B017H73708/,8,2
Patton PUH680-N-U Milk-House Utility Heater,Home,http://www.amazon.com/dp/B0000BYC61/,5,2
"Nesco FD-75A Snackmaster Pro Food Dehydrator, White",Kitchen,http://www.amazon.com/dp/B0090WOCN0/,27,2
"Magnesium Sulfate Anhydrous - 19.8% Mg, 26% Sulfur - 1 Pound",Lawn & Patio,http://www.amazon.com/dp/B00M2DHVPU/,2,2
T5 HO Grow Light (2 FT 2 Lamps) DL822 Fluorescent Hydroponic Fixture Bloom Veg Grow Light System 6500k bulbs,Lawn & Patio,http://www.amazon.com/dp/B009GU4QPU/,6,2
General Hydroponics pH Down - 8 Oz,Lawn & Patio,http://www.amazon.com/dp/B000FG0FA4/,2,1
"Jump Start CK64050, Germination Station w/Heat Mat, Tray, 72-Cell Pack, 2"" Dome",Lawn & Patio,http://www.amazon.com/dp/B000HHO1RO/,6,1
Dewitt 6-Feet by 250-Feet Bulk 5-Ounce Woven Landscape Fabric,Lawn & Patio,http://www.amazon.com/dp/B000W690BC/,1,1
"Lithonia Lighting 1245 SHOPLIGHTH2:H183 2-Light Fluorescent Shop Light, Polished Silver",Home Improvement,http://www.amazon.com/dp/B000WTLPXU/,1,1
Frost Protek Plant Cover - Large - Garden Fabric for Protection and Insulation,Lawn & Patio,http://www.amazon.com/dp/B000XVJ6DS/,1,1
"Tomato-tone Organic Fertilizer - FOR ALL YOUR TOMATOES, 4 lb. bag",Lawn & Patio,http://www.amazon.com/dp/B0011UEKKE/,1,1
Miracle-Gro Watering Can Singles - Includes 24 Pre-Measured Packets (10.24 ounces)  of Miracle-Gro All Purpose Plant Food (Plant Fertilizer),Lawn & Patio,http://www.amazon.com/dp/B00192I3QQ/,1,1
Hydrofarm TM01715D 7-Day Digital Program Timer,Lawn & Patio,http://www.amazon.com/dp/B001BPOBTY/,11,1
"Technaflora MagiCal Fertilizers, 1 L",Lawn & Patio,http://www.amazon.com/dp/B001GBOAU8/,1,1
Garden Safe Multi-Purpose Garden Insect Killer (Ready-to-Use) (HG-93078) (24 fl oz),Lawn & Patio,http://www.amazon.com/dp/B003B3N5YQ/,2,1
108 pcs drawstring Organza Jewelry Pouch Bags by Aketek,Jewelry,http://www.amazon.com/dp/B003C7ICVC/,1,1
"Neptune's Harvest HPI122 Hot Pepper Wax RTU Insect Repellent, 22-Ounce",Lawn & Patio,http://www.amazon.com/dp/B003MRBZ20/,1,1
Hydrofarm JSEF55 Smart Float Grow Tray with Plugs,Lawn & Patio,http://www.amazon.com/dp/B003ST9WQI/,1,1
Tutto Calabria Hot Long Calabrian Chili Peppers 10.2 Oz. Jar,Grocery,http://www.amazon.com/dp/B0040EAYZS/,2,1
FoxFarm FX14051 FoxFarm Peace of Mind Tomato and Vegetable Organic Fertilizer 7-4-5,Lawn & Patio,http://www.amazon.com/dp/B0049XGYJ0/,1,1
6 in. Wide Lip Bucket Basket - Round Plant Container with Mesh Bottom - Hydrofarm HG6RDBK,Lawn & Patio,http://www.amazon.com/dp/B0049XIIGC/,6,1
"Oakton EcoTestr pH 2 Waterproof pH Tester, 0.0 to 14.0 pH Range",BISS Basic,http://www.amazon.com/dp/B004G8PWAU/,17,1
"HydroOrganics HOJ07601 Earth Juice Microblast Germination Kit, 1-Quart",Lawn & Patio,http://www.amazon.com/dp/B004JKDSGU/,1,1
"HydroDynamics Clonex Rooting Compound, 100 ml",Lawn & Patio,http://www.amazon.com/dp/B004Q3NN4W/,3,1
Apollo Horticulture GLK400GW19 400 Watt Grow Light Digital Dimmable HPS MH System for Plants Gull Wing Hood Set,Lawn & Patio,http://www.amazon.com/dp/B004YXDHX6/,12,1
"Fox Farm FX14049 Liquid Nutrient Trio Soil Formula: Big Bloom, Grow Big, Tiger Bloom (Pack of 3 - 32 oz. bottles)",Lawn & Patio,http://www.amazon.com/dp/B00572026S/,14,1
"VELCRO Brand - 45' x 1/2"" Adjustable Plant Ties For Gardens and Gardening - Green",Office Product,http://www.amazon.com/dp/B0057567U0/,2,1
1500 Live Ladybugs + Hirt's Nature Nectar - Guaranteed Live Delivery,Lawn & Patio,http://www.amazon.com/dp/B0057AZ5U8/,12,1
"10 Plant Growing Trays (No Drain Holes) - 20"" x 10"" - Perfect Garden Seed Starter Grow Trays: For Seedlings, Indoor Gardening, Growing Microgreens, Wheatgrass & More - Soil or Hydroponic",Lawn & Patio,http://www.amazon.com/dp/B0058PTK6M/,2,1
"LimoStudio 2 Packs of Photography Fluorescent Full Spectrum Bulb, 105 Watt, 6500 Kelvin Daylight Neutral Tone, Energy Saving CFL Bulb, Photo Video Studio, LMS121",Photography,http://www.amazon.com/dp/B005FRCUHY/,5,1
Bayco SL-302B3 10-1/2-Inch Brooder Clamp Light with Porcelain Ceramic Socket,Home Improvement,http://www.amazon.com/dp/B0061MZ4Q6/,2,1
Dripper Insert for Hot Sauce Bottles 20ct,BISS,http://www.amazon.com/dp/B0064OPXOY/,1,1
"Osmocote Plus Outdoor and Indoor Smart-Release Plant Food, 1-Pound (Plant Fertilizer)",Lawn & Patio,http://www.amazon.com/dp/B0071CZTBA/,4,1
"FoxFarm Ocean Forest Potting Soil, 1.5 cu ft",Lawn & Patio,http://www.amazon.com/dp/B007C9QKCO/,9,1
Volcanic Peppers Fatali Pepper Powder 0.75 Ounces,Grocery,http://www.amazon.com/dp/B007P7CHGG/,1,1
"Samsung Samsung Galaxy S3 Replacement Battery (2100 mAh) for AT&T, Sprint & T-Mobile Models - Battery - Non-Retail Packaging - Silver",Wireless,http://www.amazon.com/dp/B007Y8VJP6/,2,1
Phosphoric Acid 85% High Purity 1000ml (32oz),Health and Beauty,http://www.amazon.com/dp/B009S05Z2Q/,2,1
"Secret Aardvark Habanero Sauce, 8 fl oz",Grocery,http://www.amazon.com/dp/B00AIR3Q38/,16,1
"3030 Apple Mini Ziplock 100 Baggies Clear Color Colored 100 Bags 3"" X 3""",BISS,http://www.amazon.com/dp/B00AQYSWQO/,1,1
"Texas Shaped 24 Hole Stuffed Jalapeno Popper Rack for the Grill, BBQ, Smoker or Oven",Lawn & Patio,http://www.amazon.com/dp/B00BVBJ6UW/,2,1
"General Hydroponics pH Down Liquid Fertilizer, 1-Quart",Lawn & Patio,http://www.amazon.com/dp/B00CJID1I4/,2,1
"NuVue Products 24000 Bug'n Shade Cover, Multiple Sizes Available",Lawn & Patio,http://www.amazon.com/dp/B00CPHV1PO/,1,1
"Nesco FD-37A American Harvest Food Dehydrator, White, 400-watt",Kitchen,http://www.amazon.com/dp/B00CS5ZI6G/,5,1
Apollo Horticulture GL60LED Full Spectrum 180W LED Grow Light for Plant Growing,Lawn & Patio,http://www.amazon.com/dp/B00FGFW0XO/,26,1
"EL YUCATECO SAUCE HABANERO XTRA HOT, 4 OZ (4-Pack)",Grocery,http://www.amazon.com/dp/B00GHXGUIU/,2,1
"Grow Light Hangers - 1/8"" Heavy Duty Triplet, THREE (3) Ratchets per Pack , METAL Internal Gears, Strong Composite Case, 7' Rope - For Adjustable Hoist Hydroponics, Reflectors, Kayak, Canoe Tie Down",Sports,http://www.amazon.com/dp/B00GJKHY6S/,3,1
"MILLIARD Horticulture D-Door 30"" x 18"" x 36"" 100% Reflective Mylar Hydroponic Grow Tent with Window, Great for Indoor Planting and Early Seedling Starters",Lawn & Patio,http://www.amazon.com/dp/B00H2ULDR0/,18,1
T5 Grow Light (4ft 4lamps) DL844s Ho Fluorescent Hydroponic Fixture Bloom Veg Daisy Chain with Bulbs,Lawn & Patio,http://www.amazon.com/dp/B00HEYCRI8/,11,1
"Agfabric Sunblock Shade Cloth 50% , 6.5x20ft Black -Cut Edge with Free Clips for Plant Cover Greenhouse,Barn,Kennel, Pool, Pergola or Carport",Home Improvement,http://www.amazon.com/dp/B00KM9JMUI/,1,1
"QRP BEGINNER'S No Messy Overflow No Weights Needed Mason Jar Fermentation Kits with Exclusive Food Retainer Cups keep food submerged, 6 Fermentation Lids & ONLY 4 Airlocks (WIDE MOUTH)",Kitchen,http://www.amazon.com/dp/B00KZNA516/,1,1
70% Black 6.5'x10' Sun Mesh Shade Sunblock Shade Cloth UV Resistant Net For Garden Flower Plant,Lawn & Patio,http://www.amazon.com/dp/B00L40C7NI/,1,1
40% Black 6.5'x10' Sun Mesh Shade Sunblock Shade UV Resistant Net For Garden Flower Plant,Lawn & Patio,http://www.amazon.com/dp/B00LBUO22K/,2,1
"Clear Glass Woozy Bottles with Shrink Capsules, 5 Oz - Case of 12",Kitchen,http://www.amazon.com/dp/B00MMT8XH4/,1,1
Tin Can Garden - Ghost Chili Pepper,Lawn & Patio,http://www.amazon.com/dp/B00MT66X2M/,1,1
T5 HO Grow Light - 4 FT 6 Lamps - DL846S Fluorescent Hydroponic Fixture Bloom Veg Daisy Chain with Bulbs,Lawn & Patio,http://www.amazon.com/dp/B00NMYLOBU/,1,1
"General Hydroponics MaxiGro for Gardening, 2.2-Pound",Lawn & Patio,http://www.amazon.com/dp/B00NQANQAC/,3,1
Apollo Horticulture 24W LED Grow Light w/ Red & Blue LED Spectrum for Indoor Plant Growing,Lawn & Patio,http://www.amazon.com/dp/B00PBCG8X0/,6,1
Fertilome Triple Action with 70% Neem Oil VPG Edible Garden Products,Lawn & Patio,http://www.amazon.com/dp/B00TB6OM80/,1,1
"Yellowbird Habanero Hot Sauce (19.6 Oz, 1 Bottle)",Grocery,http://www.amazon.com/dp/B00TBFMXGE/,4,1
30 NEW Square Jiffy Peat Pots Size 3x3 ~ Pots Are 3 Inch Square At the Top and 3 Inch Deep.,Lawn & Patio,http://www.amazon.com/dp/B00TOY8Y7Y/,1,1
Carolina Reaper Chili Peppers Wicked Reaper World's Hottest Dried Spice 10 Pack +2 Free,Grocery,http://www.amazon.com/dp/B00U5GK6TY/,1,1
"Clear Glass Woozy Bottles, 5 Oz - Case of 12",Kitchen,http://www.amazon.com/dp/B00VEYL12M/,2,1
MarsHydro 300W LED Grow Light Full Spectrum for Hydroponic Indoor Plants Growing Veg and Flower,Lawn & Patio,http://www.amazon.com/dp/B00XC3LBI2/,50,1
"Hyperikon LED Utility Shop Light, 4FT Integrated Linkable Double-Fixture, 38W (100W Eq) 4000 Lumens, 3000K (Soft White Glow) DLC 4.1 Qualified, Pull Chain Switch, Workshop Garage Basement",Lighting,http://www.amazon.com/dp/B012ENQFVS/,1,1
"NOW Foods Xanthan Gum Powder,6-Ounce",Pantry,http://www.amazon.com/dp/B015FCFRW8/,1,1
"TP-Link Smart Plug w/ Energy Monitoring, No Hub Required, Wi-Fi, Works with Alexa and Google Assistant, Control your Devices from Anywhere (HS110)",Home Improvement,http://www.amazon.com/dp/B0178IC5ZY/,4,1
"Hydroplanet T5 4ft 8lamp Fluorescent Ho Bulbs Included for Indoor Horticulture Gardening T5 Grow Lights Fixtures (8 Lamp, 4ft)",Lawn & Patio,http://www.amazon.com/dp/B019J3UPUS/,4,1
VIPARSPECTRA Reflector-Series 300W LED Grow Light Full Spectrum for Indoor Plants Veg and Flower,Lawn & Patio,http://www.amazon.com/dp/B01B4GQ6MO/,30,1
Deckey LED Grow Light Plant Grow Light Hanging Light Red Blue Plant Light,Lawn & Patio,http://www.amazon.com/dp/B01C56NBRU/,1,1
"Apollo Horticulture 47.25""x20.75"" Seedling Heat Mat for Propagation and Cloning",Lawn & Patio,http://www.amazon.com/dp/B01CPOARHY/,1,1
"Easy Fermenter Wide Mouth Lid Kit: Simplified Fermenting In Jars Not Crock Pots! Make Sauerkraut, Kimchi, Pickles Or Any Fermented Probiotic Foods. 3 Lids, Extractor Pump & Recipe eBook - Mold Free",Kitchen,http://www.amazon.com/dp/B01DJVVORE/,5,1
Pickle Pipe - One-Piece Silicone Waterless Fermentation Airlock Lids for Mason Jar Fermentation - REGULAR SMALL MOUTH - 4 Pack,Kitchen,http://www.amazon.com/dp/B01ERZGVVK/,1,1
"Estilo Swing Top Easy Cap Clear Glass Bottles, Square, 8.5 oz, Set of 6",Kitchen,http://www.amazon.com/dp/B01I476CRK/,1,1
"Elflight LED Plant Grow Strip Light(Power Adapter Included),5050 Waterproof Full Spectrum Red Blue 4:1 Growing Lamp Aquarium Greenhouse Hydroponic Pant Garden Flowers (2M/6.56ft)",Lawn & Patio,http://www.amazon.com/dp/B01LO55GC6/,1,1
"Coofel Aeration Container 4-Pack 5 Gallons Planting Grow Bags with Strap Handles, Soft-Sided Fabric Garden Plant Pots and Little Shovel (Black)",Lawn & Patio,http://www.amazon.com/dp/B01LW6GTRK/,1,1
"OxyLED LED Grow Bulbs, Hydroponic Plant Grow Lights for Greenhouse Aquatic, Indoor Plant Growing Lamp, 12W Full Spectrum Led Grow Light Bulb, 2 Pack (E263Blue/9 Red)",Home Improvement,http://www.amazon.com/dp/B01M5IHX2G/,1,1
"Year of Plenty BPA-Free Fermentation Lids for Making Sauerkraut in Wide Mouth Mason Jars, Set of 4, Includes Instructions and Recipe … (White)",Kitchen,http://www.amazon.com/dp/B01MTK3J6U/,1,1
"BetyBedy Tea Filter Bags, Disposable Tea Infuser, Safe & Natural Material, 1-Cup Capacity, Drawstring Empty Bag for Loose Leaf Tea, Set of 100（3.15 x 3.94 inch）",Kitchen,http://www.amazon.com/dp/B06XCT9BLZ/,1,1
What's Wrong With My Plant? (And How Do I Fix It?): A Visual Guide to Easy Diagnosis and Organic Remedies (What’s Wrong Series),Book,http://www.amazon.com/dp/0881929611/,1,1
"6-Pack Fermenting Lids Kit w/ Bonus Pump, galahome Waterless Airlock For Mason Jar Fermentation, Turn Wide Mouth Jars to Crock Pots, Black ( 2 Colors Available )",Kitchen,http://www.amazon.com/dp/B0719PCL7Y/,1,1
The Field Guide to Peppers,Book,http://www.amazon.com/dp/1604695889/,1,1
The Hot Sauce Cookbook: Turn Up the Heat with 60+ Pepper Sauce Recipes,Book,http://www.amazon.com/dp/1607744260/,2,1
"Seed to Seed: Seed Saving and Growing Techniques for Vegetable Gardeners, 2nd Edition",Book,http://www.amazon.com/dp/1882424581/,14,1
"Wild Fermentation: The Flavor, Nutrition, and Craft of Live-Culture Foods",Book,http://www.amazon.com/dp/1931498237/,9,1
"DA BOMB Ground Zero, 4 fl oz",Grocery,http://www.amazon.com/dp/B0000DG56P/,1,1
"Hydrofarm Seedling Heat Mats, 17 Watts, 9 x 19.5 Inches",Lawn & Patio,http://www.amazon.com/dp/B0001WV010/,10,1
Self-Watering Probes - Package of 5,Lawn & Patio,http://www.amazon.com/dp/B0002VAHXC/,3,1
"Kozy Coat Wall-of-Water Gardening Teepees, 3-Pack",Lawn & Patio,http://www.amazon.com/dp/B0006IH400/,1,1
Monterey LG6500 Sluggo Slug & Snail Killer 2.5 Pound,Lawn & Patio,http://www.amazon.com/dp/B000BWZ89K/,7,1
