name,category,amazon_link,total_mentions,subreddit_mentions
The Universe Doesn't Give a Flying Fuck About You (Epic series Book 1),eBooks,http://www.amazon.com/dp/B005OMBTKY/,5,2
A Guide to the Good Life: The Ancient Art of Stoic Joy,Book,http://www.amazon.com/dp/0195374614/,15,1
The Four Agreements: A Practical Guide to Personal Freedom (A Toltec Wisdom Book),Book,http://www.amazon.com/dp/1878424319/,14,1
The Obstacle Is the Way: The Timeless Art of Turning Trials into Triumph,Book,http://www.amazon.com/dp/1591846358/,7,1
Ego Is the Enemy,Book,http://www.amazon.com/dp/1591847818/,5,1
The Happiness Trap: How to Stop Struggling and Start Living: A Guide to ACT,eBooks,http://www.amazon.com/dp/B004XI12O8/,3,1
A Guide to the Good Life: The Ancient Art of Stoic Joy,Book,http://www.amazon.com/dp/1522632735/,3,1
"Transforming Negative Self-Talk: Practical, Effective Exercises",Book,http://www.amazon.com/dp/039370789X/,2,1
