name,category,amazon_link,total_mentions,subreddit_mentions
The Highly Sensitive Person in Love: Understanding and Managing Relationships When the World Overwhelms You,Book,http://www.amazon.com/dp/0767903366/,4,4
The Highly Sensitive Person: How to Thrive When the World Overwhelms You,Book,http://www.amazon.com/dp/0553062182/,11,3
The Highly Sensitive Person's Survival Guide: Essential Skills for Living Well in an Overstimulating World (Step-By-Step Guides),Book,http://www.amazon.com/dp/1572243961/,3,2
Against Empathy: The Case for Rational Compassion,Book,http://www.amazon.com/dp/0062339338/,16,1
Become The Most Important Person in the Room: Your 30-Day Plan for Empath Empowerment  (Empath Empowerment® Book),Book,http://www.amazon.com/dp/0975253875/,1,1
Will I Ever Be Good Enough?: Healing the Daughters of Narcissistic Mothers,Book,http://www.amazon.com/dp/1439129436/,29,1
"Cognitive Behavioural Therapy, 3rd Edition: A Teach Yourself Guide",Book,http://www.amazon.com/dp/1444170295/,2,1
The Rational Male,Book,http://www.amazon.com/dp/1492777862/,16,1
The Anti 9-to-5 Guide: Practical Career Advice for Women Who Think Outside the Cube,Book,http://www.amazon.com/dp/1580051863/,1,1
"DownBeats Reusable High Fidelity Hearing Protection: Ear Plugs for Concerts, Music, and Musicians (Clear Ear Plugs, Black Case)",Health and Beauty,http://www.amazon.com/dp/B00A3Z44R2/,41,1
"Best Home Fashion Basic Thermal Insulated Blackout Curtains - Antique Bronze Grommet Top - Chocolate - 52""W x 63""L – (1 Panel)",Home,http://www.amazon.com/dp/B00EEDPS88/,3,1
"ClearArmor 141001 Shooters Hearing Protection Safety Ear Muffs Folding-Padded Head Band Ear Cups, Black",Home Improvement,http://www.amazon.com/dp/B00NKSMPZW/,25,1
"Too Loud, Too Bright, Too Fast, Too Tight: What to Do If You Are Sensory Defensive in an Overstimulating World",Book,http://www.amazon.com/dp/0060932929/,7,1
"1000 Thread Count 100% Egyptian Cotton, Single Ply, King/California King Duvet Cover Set, Solid, Light Blue",Home,http://www.amazon.com/dp/B01BWX6HB4/,1,1
"Your Brain at Work: Strategies for Overcoming Distraction, Regaining Focus, and Working Smarter All Day Long",Book,http://www.amazon.com/dp/0061771295/,1,1
"Search Inside Yourself: The Unexpected Path to Achieving Success, Happiness (and World Peace)",Book,http://www.amazon.com/dp/0062116932/,10,1
