name,category,amazon_link,total_mentions,subreddit_mentions
The Hungarians: A Thousand Years of Victory in Defeat,Book,http://www.amazon.com/dp/0691119694/,1,1
The Flower Show and the Toth Family (English and Hungarian Edition),Book,http://www.amazon.com/dp/0811208370/,1,1
"Hungary in World War II: Caught in the Cauldron (World War II: The Global, Human, and Ethical Dimension)",Book,http://www.amazon.com/dp/0823233448/,1,1
Metropole,Book,http://www.amazon.com/dp/1846590345/,1,1
Eclipse of the Cresent Moon,Book,http://www.amazon.com/dp/9631347729/,1,1
The Illustrated History of Hungary,Book,http://www.amazon.com/dp/9635472056/,1,1
VCT USA to Europe Travel Plug Adapter Grounded German Shucko Plug (VP-11W),Home Improvement,http://www.amazon.com/dp/B000WFYUGI/,1,1
