name,category,amazon_link,total_mentions,subreddit_mentions
TOTO Travel Handy Washlet YEW350-WH,Home Improvement,http://www.amazon.com/dp/B005FDJ8SM/,5,2
"Delta Cycle Delta Airzound Bike Horn , colors may vary",Sports,http://www.amazon.com/dp/B000ACAMJC/,53,2
Secret Rendezvous,Book,http://www.amazon.com/dp/0375726543/,1,1
A Frequency Dictionary of Japanese (Routledge Frequency Dictionaries),Book,http://www.amazon.com/dp/0415610133/,3,1
The Bogleheads' Guide to Investing,Book,http://www.amazon.com/dp/0470067365/,48,1
The Making of Modern Japan,Book,http://www.amazon.com/dp/0669200204/,1,1
The Woman in the Dunes,Book,http://www.amazon.com/dp/0679733787/,2,1
"How to Cook Everything: 2,000 Simple Recipes for Great Food,10th Anniversary Edition",Book,http://www.amazon.com/dp/0764578650/,36,1
Remembering the Kanji 1: A Complete Course on How Not to Forget the Meaning and Writing of Japanese Characters,Book,http://www.amazon.com/dp/0824835921/,19,1
Hiking in Japan: An Adventurer's Guide to the Mountain Trails,Book,http://www.amazon.com/dp/0870118935/,1,1
The Power to Compete: An Economist and an Entrepreneur on Revitalizing Japan in the Global Economy,Book,http://www.amazon.com/dp/1119000602/,1,1
Excel 2016 For Dummies (Excel for Dummies),Book,http://www.amazon.com/dp/111907701X/,1,1
KLUTZ Book of Knots Toy,Toy,http://www.amazon.com/dp/1338106422/,1,1
"The Upside of Your Dark Side: Why Being Your Whole Self―Not Just Your ""Good"" Self―Drives Success and Fulfillment",Book,http://www.amazon.com/dp/1491528222/,1,1
Japanese Cooking: A Simple Art,Book,http://www.amazon.com/dp/1568363885/,15,1
Cockeyed,Book,http://www.amazon.com/dp/1586484400/,1,1
Survival Mode,Book,http://www.amazon.com/dp/194331604X/,1,1
Straitjacket Society: An Insider's Irreverent View of Bureaucratic Japan,Book,http://www.amazon.com/dp/4770018487/,3,1
Genki: An Integrated Course in Elementary Japanese Workbook I [Second Edition] (Japanese Edition),Book,http://www.amazon.com/dp/478901441X/,7,1
Coal Tar Soap (Black) (110g) Brand: Soap Works,Beauty,http://www.amazon.com/dp/B0002DTUME/,1,1
Quakehold! 88111 Museum Putty Neutral,Home Improvement,http://www.amazon.com/dp/B0002VA9NA/,10,1
"Yogi Tea, Bedtime, 16 Count (Pack of 6), Packaging May Vary",Grocery,http://www.amazon.com/dp/B0009F3SA0/,4,1
Salux Nylon Japanese Beauty Skin Bath Wash Cloth/Towel - Blue,Beauty,http://www.amazon.com/dp/B000CSDDDG/,44,1
Doot Doola Doot Doo Doot Doo!,DVD,http://www.amazon.com/dp/B000CSUNC0/,1,1
Camco 43421 Oak Accents Countertop Extension,Automotive Parts and Accessories,http://www.amazon.com/dp/B000EDQQJM/,1,1
Quakehold! 66111 2-Ounce Museum Wax,Home Improvement,http://www.amazon.com/dp/B000FJU29U/,6,1
Stumbling on Happiness,eBooks,http://www.amazon.com/dp/B000GCFW0A/,1,1
"TRITON CONSUMER PRODUCTS MG 217 Medicated Coal Tar Shampoo for Psoriasis, 8 Fluid Ounce",Beauty,http://www.amazon.com/dp/B000GD03TO/,3,1
Kashimura Down Trans Voltage Converter From 110v-130v to 100v 35w for Japanese Products Japan,Speakers,http://www.amazon.com/dp/B000WMK6QY/,1,1
"Ergodyne Chill-Its 6602 Evaporative Cooling Towel, Blue",Home Improvement,http://www.amazon.com/dp/B001B5I57I/,17,1
Tcp Antiseptic Liquid 100Ml,Beauty,http://www.amazon.com/dp/B001E17FG6/,1,1
Whamo Solo Snow Ball Blaster,Sports,http://www.amazon.com/dp/B002KKE79S/,1,1
Arko Shaving Cream - Maximum Comfort,Beauty,http://www.amazon.com/dp/B0030JVMBY/,1,1
"Marie Sharp's Hot Sauce, Habanero Pepper, 10 Ounce",Grocery,http://www.amazon.com/dp/B0030KLW0Y/,4,1
"Louisiana, Sauce, Habanero Hot, 3-Ounce (Pack of 12)",Grocery,http://www.amazon.com/dp/B003QWN6Y6/,1,1
"Spenco 2nd Skin Dressing Kit Bandages for Blister Protection, Sports, 8-Count",Health and Beauty,http://www.amazon.com/dp/B004UOTVF2/,1,1
"Marriage in Translation: Foreign Wife, Japanese Husband",eBooks,http://www.amazon.com/dp/B004W0IBA0/,1,1
Petz Route Long Stick Play with a Kitten Made in Japan,Pet Products,http://www.amazon.com/dp/B005DIE62W/,1,1
"ArtToFrames 12x17 inch Satin Black Picture Frame, 2WOMFRBW26079-12x17",Home,http://www.amazon.com/dp/B005MRT9TY/,1,1
"Intel D2500CCE Atom D2500 Dual LAN & Dual COM Mini-ITX Motherboard, BLKD2500CCE",PC Accessory,http://www.amazon.com/dp/B006ICQ3FK/,5,1
"Heartburn - Fast Tract Digestion: LPR, Acid Reflux & GERD Diet Cure Without Drugs | Surprising Truth about the Cause of Acid Reflux Explained (Clinically Proven Solution)",eBooks,http://www.amazon.com/dp/B007WZHCWK/,1,1
"Toto HW300-W Portable Travel Washlet, White",Home Improvement,http://www.amazon.com/dp/B008O1G4LQ/,1,1
OEM Huawei BATTERY HUA U8680 U8730 G300 U8815 U8818 M660 Mytouch Q Buddy HB5N1H,Wireless,http://www.amazon.com/dp/B00ANWBJC8/,1,1
TriGear TG 1500W 1500 Watt Step Up Down Voltage Transformer Converter AC 110 / 220 V or 110 / 220 Volt,Speakers,http://www.amazon.com/dp/B00B924U5O/,1,1
"Remington HC5850 Virtually Indestructible Haircut & Beard Trimmer, Hair Clippers, Beard Trimmer, Clippers",Beauty,http://www.amazon.com/dp/B00BB5YHFC/,1,1
"AGPtek SATA/PATA/IDE Drive to USB 2.0 Adapter Converter Cable for Hard Drive Disk HDD 2.5"" 3.5"" with External AC Power Adapter",Personal Computer,http://www.amazon.com/dp/B00BIE996S/,9,1
Wolfgang Puck Pie & Pastry Baker (HSN Generic Brown Box),Kitchen,http://www.amazon.com/dp/B00BTHQXMW/,1,1
"Four Pairs of Boots: A 3,200 Kilometre Hike The Length of Japan",eBooks,http://www.amazon.com/dp/B00FZUG7D4/,1,1
"TP Link AV500 Wi Fi Range Extender, Powerline Edition Starter Kit w/ 2 LAN Ports, Up to 300Mbps Wireless",Personal Computer,http://www.amazon.com/dp/B00HSQAIQU/,29,1
SpyCrushers Spy Pen Camera - Hidden Camera Pen HD Video Recorder - Free 8GB SD Card,Photography,http://www.amazon.com/dp/B00J3CL3Q6/,5,1
"Philips Norelco Electric Shaver 9700, S9721/87 - Frustration Free Package",Beauty,http://www.amazon.com/dp/B00M1E55HQ/,1,1
Modern Romance,eBooks,http://www.amazon.com/dp/B00OZ0TMYG/,2,1
H&R Block Tax Software Basic 2014 Win [Download],Digital Software,http://www.amazon.com/dp/B00PG8F2W2/,1,1
LARGE SOLVE et COAGULA PENTAGRAM SABBATIC GOAT BAPHOMET SATAN WALL PLAQUE,Home,http://www.amazon.com/dp/B00T8WE3O0/,1,1
Mirror's Edge Catalyst - PlayStation 4,Video Games,http://www.amazon.com/dp/B00ZDYJ9P0/,4,1
Nintendo Animal Crossing: Happy Home Designer + New 3DS Bundle,Video Games,http://www.amazon.com/dp/B0144K8KQW/,18,1
"NutriBullet (Gray) Blender/Mixer, 8-piece Set (Certified Refurbished)",Kitchen,http://www.amazon.com/dp/B017DFJXXY/,1,1
Deadpool Blu-ray,DVD,http://www.amazon.com/dp/B01BLS9E2Y/,5,1
Samsung UN40KU6300 40-Inch 4K Ultra HD Smart LED TV (2016 Model),Home Theater,http://www.amazon.com/dp/B01DUTL4OI/,19,1
"The Daily Stoic: 366 Meditations on Wisdom, Perseverance, and the Art of Living",eBooks,http://www.amazon.com/dp/B01HNJIJB2/,7,1
"Intermediate Technical Japanese, Volume 1: Readings and Grammatical Patterns (Technical Japanese Series)",Book,http://www.amazon.com/dp/0299185540/,3,1
Samsung 960 PRO Series - 1TB PCIe NVMe - M.2 Internal SSD (MZ-V6P1T0BW),Personal Computer,http://www.amazon.com/dp/B01LYRCIPG/,10,1
Leviathan Wakes,Book,http://www.amazon.com/dp/0316129089/,17,1
