name,category,amazon_link,total_mentions,subreddit_mentions
"Code Complete: A Practical Handbook of Software Construction, Second Edition",Books,https://www.amazon.com/Code-Complete-Practical-Handbook-Construction/dp/0735619670/ref=sr_1_4?ie=UTF8&amp;qid=1459112272&amp;sr=8-4&amp;keywords=Clean+Code,12,1
JavaScript: The Good Parts,Books,https://www.amazon.com/JavaScript-Good-Parts-Douglas-Crockford/dp/0596517742/ref=sr_1_1?s=books&amp;ie=UTF8&amp;qid=1471153011&amp;sr=1-1&amp;keywords=javascript+the+good+parts,8,1
JavaScript: The Definitive Guide: Activate Your Web Pages (Definitive Guides),Books,https://www.amazon.com/JavaScript-Definitive-Guide-Activate-Guides/dp/0596805527/ref=dp_ob_title_bk,2,1
"Eloquent JavaScript, 2nd Ed.: A Modern Introduction to Programming",Books,https://www.amazon.com/Eloquent-JavaScript-Modern-Introduction-Programming/dp/1593275846/,1,1
A Smarter Way to Learn JavaScript. The new tech-assisted approach that requires half the effort,Books,https://www.amazon.com/Smarter-Way-Learn-JavaScript-technology/dp/1497408180/ref=sr_1_1?ie=UTF8&amp;qid=1477697715&amp;sr=8-1&amp;keywords=javascript,1,1
You Don't Know JS: this & Object Prototypes,Books,https://www.amazon.com/You-Dont-Know-JS-Prototypes/dp/1491904151,1,1
Functional Programming in JavaScript: How to improve your JavaScript programs using functional techniques,Books,https://www.amazon.com/Functional-Programming-JavaScript-functional-techniques/dp/1617292826/ref=pd_lpo_sbs_14_t_0?_encoding=UTF8&amp;psc=1&amp;refRID=CDGXQAQPACBJPMT3NFKD,1,1
JavaScript: The Definitive Guide,Books,https://www.amazon.com/JavaScript-Definitive-Guide-David-Flanagan/dp/0596000480,1,1
