name,category,amazon_link,total_mentions,subreddit_mentions
Tandy Leather Craftool Rivet Setter 8100-00,Art and Craft Supply,http://www.amazon.com/dp/B003ABGIWK/,1,1
"Country Brook Design 1 1/2 Inch Heavy Black Polypro Webbing, 25 Yards",Art and Craft Supply,http://www.amazon.com/dp/B003K12LGM/,1,1
Tandy Leather Gunmetal Black Plated Steel Double Cap Rivets Small 100 pack 1371-13,Art and Craft Supply,http://www.amazon.com/dp/B004C6NS48/,1,1
"Southwire 64162122 2 Conductor 18/2 Thermostat Wire, 18-Gauge Solid Copper Class 2 Power-Limited Circuit Cable, Brown",Home Improvement,http://www.amazon.com/dp/B0069F4H0E/,1,1
10 - 1 1/2 Inch YKK Flat Side Release Plastic Buckles,Home,http://www.amazon.com/dp/B006MKRZCS/,1,1
"Emgo Tiedowns 18"" Soft Touches - Tie Down Extension 4-Pack Black",Automotive Parts and Accessories,http://www.amazon.com/dp/B00CGOTNH4/,1,1
uxcell 12mm Flush Mount SPST ON/OFF Momentary Push Button Switch 250VAC 3A,Home Improvement,http://www.amazon.com/dp/B00D0XKVIU/,1,1
Stainless Steel 8 Holes Clutch Lock Car Brake Lock Car Pedal Lock Anti-theft Device,Automotive Parts and Accessories,http://www.amazon.com/dp/B019YU6QYA/,1,1
"Xprite LED Headlight Canbus Wiring Kit Computer Warning Error Free Anti Flicker Resistor Canceler Decoder (Pair) (H4, 9003) …",Automotive Parts and Accessories,http://www.amazon.com/dp/B01ENTK2BK/,1,1
