name,category,amazon_link,total_mentions,subreddit_mentions
Alla Lighting New CSP Xtremely Bright H13 9008 H13LL LED Headlight Conversion Kits Bulbs w/ High Power 8000Lm 6500K White Lamps (H13 9008),Automotive Parts and Accessories,http://www.amazon.com/dp/B01JKK1HDY/,3,3
BAFX Products 34t5 Bluetooth OBDII Scan Tool for Android Devices,Automotive Parts and Accessories,http://www.amazon.com/dp/B005NLQAHS/,136,2
etopmia Car Glasses Sunglasses Sun Glass Holder Case Storage Box For Jeep Renegade 2015 2016 2017,Automotive Parts and Accessories,http://www.amazon.com/dp/B01N4NK0QN/,2,2
CCIYU 10 Pack T10 Wedge Samsung 2323 SMD 194 168 192 921 High Power 1W White LED Light Bulbs US,Automotive Parts and Accessories,http://www.amazon.com/dp/B018Z25G5S/,2,2
"Whispbar S46 Rail Bar Roof-Rack System - 970mm, 2 Bars",Sports,http://www.amazon.com/dp/B003BFN5EO/,2,2
Yakima LoadWarrior Rooftop Cargo Basket,Sports,http://www.amazon.com/dp/B0009XAMTM/,2,2
Apex RB-1004-49 Universal Side Rail Mounted Crossbars,Automotive Parts and Accessories,http://www.amazon.com/dp/B0052WHK2W/,2,1
"Rhino Rack Roof Mount Cargo Basket, Regular",Sports,http://www.amazon.com/dp/B00A5VG6Q6/,2,1
Arkansas Atlas & Gazetteer (Delorme Atlas & Gazetteer Series) (Paperback) - Common,Book,http://www.amazon.com/dp/B00D5L1EBA/,1,1
For Car Plastic Pocket Telescopic Dash Coins Case Storage Box Holder Container Style,Automotive Parts and Accessories,http://www.amazon.com/dp/B00FLL8SPM/,1,1
"Rain-X 5079279-1 Latitude Wiper Blade - 22"" (Pack of 1)",Automotive Parts and Accessories,http://www.amazon.com/dp/B00FRHOMNM/,1,1
"CargoLoc Roof Top 2 PC. 46"" Aluminum Cross Bars - Lockable",Home Improvement,http://www.amazon.com/dp/B00GA2HKAU/,3,1
BOSCH Rear Windshield Wiper Blade 240/9 H240 Fits CITROEN C4 JEEP MINI 2006-,Automotive Parts and Accessories,http://www.amazon.com/dp/B00L7YHF3S/,1,1
ANiceS OTG 5 Pin F/M mini Changer Adapter Converter USB Male to Female Micro USB,PC Accessory,http://www.amazon.com/dp/B00O519I9E/,2,1
Heavy Duty Foldable Step Stool,Furniture,http://www.amazon.com/dp/B00ODF2DO4/,1,1
"WawaAuto CST-1023 Car Snack Tray, Cup Holder Bottle Can Holder, Car Tray Phone Drink Cup Coffee Holder Snack Food Organizer, Black",Automotive Parts and Accessories,http://www.amazon.com/dp/B00TO5KPNY/,1,1
2015-2016 Jeep Renegade Mopar All Weather Slush Floor Mats,Automotive Parts and Accessories,http://www.amazon.com/dp/B00W8DBZQU/,1,1
Zone Tech Car Organizer Side Seat Net Bag (Black),Automotive Parts and Accessories,http://www.amazon.com/dp/B011VEPDBO/,1,1
"Rain-X 5079277-2 Latitude Wiper Blade, 20"" (Pack of 1)",Automotive Parts and Accessories,http://www.amazon.com/dp/B015JTJPX4/,1,1
"CAR ROVER H13 9008 40W 8,000LM(4000LM Each Bulb) 6,000K CREE LED Headlight Conversion Kit Super Bright Cool white Lamp Light Bulbs with No Error CanBus Technology",Automotive Parts and Accessories,http://www.amazon.com/dp/B015XVW0U8/,1,1
Jeep Renegade Trailhawk Style Hood Decal Blackout Fits 2015+ (Textured Black),Automotive Parts and Accessories,http://www.amazon.com/dp/B017JACHAY/,1,1
"JDM ASTAR Extremely Bright 3030 Chipsets 1157 2057 2357 7528 LED Bulbs with Projector , Xenon White",Automotive Parts and Accessories,http://www.amazon.com/dp/B019JAT4XK/,1,1
Jeep Renegade Red HP-5688 12V Ride-on Car for Kids with Remote Control,Toy,http://www.amazon.com/dp/B01AFLHIU8/,1,1
"Adashine Dash Cam Dashboard Camera DVR Mini 0805 World's Smallest Ambarella A7LA50 Chip + FILM + OV4689 Sensor + 8gb Card Super HD 1296P(Upgraded 0803) Video Recorder, Car Camera with GPS Logger",Wireless,http://www.amazon.com/dp/B01EJBW1H0/,1,1
"TYGER Heavy Duty Roof Mounted Cargo Basket Rack | L47"" x W37"" x H6"" | Roof Top Luggage Carrier | With Wind Fairing",Automotive Parts and Accessories,http://www.amazon.com/dp/B01FNDCSTO/,2,1
"Daystar, Jeep Renegade Trailhawk Frame Mounted Bull Bar fits Trailhawk Model only, fits 2015 to 2017 2/4WD, KJ50005BK, Made in America",Automotive Parts and Accessories,http://www.amazon.com/dp/B01HG75RP2/,1,1
Spy Tec A119 Version 2 Car Dash 60 FPS 1440p Camera with Novate Chipset G Sensor Wide Angle Lens and Low Light Recording,Photography,http://www.amazon.com/dp/B01HMZVYLY/,61,1
SiriusLED Extremely Bright COB LED Chip 8000 Lumens Headlights Fog Lights Bulb Conversion Kit H11 H8 6000K Xenon White,Automotive Parts and Accessories,http://www.amazon.com/dp/B01J6YGGZ8/,2,1
"JDM ASTAR G2 8000 Lumens Extremely Bright CSP Chips H13 9008 LED Headlights, Xenon White",Automotive Parts and Accessories,http://www.amazon.com/dp/B01JYC0OVO/,1,1
"AUTO-VOX D7 WiFi Dash Cam, Dash Camera with GPS FHD 1080P Night Vision Car Dashboard Camera Driving Recorder with 165 Wide Angle, G-Sensor",Car Audio or Theater,http://www.amazon.com/dp/B01LZZDY35/,1,1
"Rugged Ridge 15201.20 Wheel Spacer (Black, 1.25 inch; 15-16 Renegade)",Automotive Parts and Accessories,http://www.amazon.com/dp/B01M21FIE3/,1,1
Fontic Black Car Center Console Armrest Box Glove Box Secondary Storage for Jeep Renegade 2015-2016,Automotive Parts and Accessories,http://www.amazon.com/dp/B01MQF8YW3/,1,1
Alla Lighting 10pcs Best Value Super Bright High Power 3014 18-SMD for Car License Plate Tag Interior Map Dome Trunk Door Courtesy Light Lamp T10 Miniature Wedge 194 168 2825 W5W 175 White LED Bulbs,Automotive Parts and Accessories,http://www.amazon.com/dp/B01MZ9FTLG/,1,1
InstaMorph - Moldable Plastic - 12oz (Black),Art and Craft Supply,http://www.amazon.com/dp/B06XFDFVLM/,1,1
"LED Light bar, AutoFeel 17"" 396W 8D Quad Row Spot Flood Combo Beam Lightbar Off Road Auto Work LED Light Bar with Slide Mounting Brackets for Truck Jeep ATV UTV",Automotive Parts and Accessories,http://www.amazon.com/dp/B06XHZL3SV/,1,1
"XYZCTEM Towing D-Ring Shackles 3/4""(Set of 2) – Heavy Duty, Load Bearing Jeep or Truck Tow Kit – Off-Road 4.75 Ton (9,500 lb.) Strength Capacity –Red and Black",Automotive Parts and Accessories,http://www.amazon.com/dp/B06XRYYSYT/,1,1
Autou Pack of 2 Pcs 12V ABS White Side Marker Lights Kit with 2 Yellow LED Lamps for Jeep Renegade 2014-2016 Turn Signal Bulbs,Automotive Parts and Accessories,http://www.amazon.com/dp/B071DZS1K4/,1,1
Yakima MegaWarrior Rooftop Cargo Basket,Sports,http://www.amazon.com/dp/B000MCCL4O/,2,1
Apex RLB-2301 Universal Roof Crossbar,Automotive Parts and Accessories,http://www.amazon.com/dp/B002M3KSK0/,3,1
Lifetime Warranty TMS J-Bar Rack HD Kayak Carrier Canoe Boat Surf Ski Roof Top Mounted on Car SUV Crossbar,Automotive Parts and Accessories,http://www.amazon.com/dp/B003V57NUQ/,7,1
Yakima KingJoe Pro 2-Bike Trunk Rack,Sports,http://www.amazon.com/dp/B004NT4BRW/,1,1
ROLA 59504 V-Tex Rooftop Cargo Basket,Automotive Parts and Accessories,http://www.amazon.com/dp/B004R34HDC/,9,1
