name,category,amazon_link,total_mentions,subreddit_mentions
Kodokan Judo: The Essential Guide to Judo by Its Founder Jigoro Kano,Book,http://www.amazon.com/dp/156836539X/,7,7
The Way of Judo: A Portrait of Jigoro Kano and His Students,eBooks,http://www.amazon.com/dp/B00ET924M0/,4,3
Judo Unleashed: Essential Throwing & Grappling Techniques for Intermediate to Advanced Martial Artists,Book,http://www.amazon.com/dp/0071475346/,3,3
Judo Formal Techniques: A Complete Guide to Kodokan Randori no Kata (Tuttle Martial Arts),Book,http://www.amazon.com/dp/080481676X/,2,2
Jiu-Jitsu University,Book,http://www.amazon.com/dp/0981504434/,36,2
Kodokan Judo Throwing Techniques,Book,http://www.amazon.com/dp/4770023308/,2,2
A History of Judo,Book,http://www.amazon.com/dp/095604980X/,2,2
A Slow Boat to Yokohama: A Judo Odyssey,Book,http://www.amazon.com/dp/0956049818/,1,1
"Passing the Guard: Brazilian Jiu-Jitsu Details and Techniques, Vol. 1",Book,http://www.amazon.com/dp/0972109757/,1,1
Self-Defense By Judo,Book,http://www.amazon.com/dp/1258142600/,1,1
Judo Memoirs of Jigoro Kano,Book,http://www.amazon.com/dp/1425163491/,1,1
Judo Memoirs of Jigoro Kano,Book,http://www.amazon.com/dp/1425187714/,1,1
Explosive Lifting for Sports-Enhanced Edition,Book,http://www.amazon.com/dp/1450401686/,1,1
Mind Over Muscle: Writings from the Founder of Judo,Book,http://www.amazon.com/dp/1568364970/,1,1
Falling Hard: A Journey into the World of Judo,Book,http://www.amazon.com/dp/1590307151/,2,1
The Way of Judo: A Portrait of Jigoro Kano and His Students,Book,http://www.amazon.com/dp/1590309162/,1,1
The Fighting Spirit of Judo,Book,http://www.amazon.com/dp/1874572151/,1,1
Tai-otoshi (Judo Masterclass Techniques),Book,http://www.amazon.com/dp/1874572216/,1,1
The Canon of Judo: Classic Teachings on Principles and Techniques,Book,http://www.amazon.com/dp/4770029799/,2,1
"McDavid 512 Elastic Elbow Support, Medium",Sports,http://www.amazon.com/dp/B0000AU1ZO/,1,1
"Universal Nutrition Animal Nitro Sports Nutrition Supplement, 44-Count",Health and Beauty,http://www.amazon.com/dp/B000GOX2KU/,1,1
Kennedy Industries KS Skin Creme-The Original Skin Creme for Wrestlers,Health and Beauty,http://www.amazon.com/dp/B000KZOI9O/,3,1
The Laundry Alternative Mini Portable Countertop Spin Dryer,Major Appliances,http://www.amazon.com/dp/B002HT0958/,7,1
ASICS  Super Sleeve,Apparel,http://www.amazon.com/dp/B005ACKNAK/,2,1
Roll and Stow Martial Arts Belt Holder (Natural Honey Gold),Sports,http://www.amazon.com/dp/B00MENEIWC/,1,1
World Class Judo: Everything You Should Know About Uchi Mata,DVD,http://www.amazon.com/dp/B00RUFIND4/,1,1
10-Minute Toughness: The Mental Training Program for Winning Before the Game Begins,Book,http://www.amazon.com/dp/0071600639/,3,1
A History of the Israeli-Palestinian Conflict (Indiana Series in Arab and Islamic Studies),Book,http://www.amazon.com/dp/025322070X/,4,1
Designing Resistance Training Programs - 3rd,Book,http://www.amazon.com/dp/0736042571/,1,1
The Art of Learning: An Inner Journey to Optimal Performance,Book,http://www.amazon.com/dp/0743277465/,20,1
Best Judo (Illustrated Japanese Classics),Book,http://www.amazon.com/dp/0870117866/,1,1
The Fighting Spirit of Japan: The Esoteric Study of the Martial Arts and Way of Life in Japan,Book,http://www.amazon.com/dp/0879511427/,1,1
