name,category,amazon_link,total_mentions,subreddit_mentions
"When I Say No, I Feel Guilty",Book,http://www.amazon.com/dp/0553263900/,14,8
"No More Mr Nice Guy: A Proven Plan for Getting What You Want in Love, Sex, and Life",Book,http://www.amazon.com/dp/0762415339/,59,7
Why Does He Do That?: Inside the Minds of Angry and Controlling Men,Book,http://www.amazon.com/dp/0425191656/,28,5
The Gift of Fear,eBooks,http://www.amazon.com/dp/B0036Z9U2A/,12,4
Becoming the Narcissist’s Nightmare: How to Devalue and Discard the Narcissist While Supplying Yourself,eBooks,http://www.amazon.com/dp/B01B01O3PA/,8,4
The Gift of Fear: And Other Survival Signals That Protect Us from Violence,Book,http://www.amazon.com/dp/0440226198/,43,3
SABRE Red Pepper Gel Home Protection Kit—Police Strength—17 Bursts & 17-Foot (5 m) Range,Sports,http://www.amazon.com/dp/B0009UXH8S/,4,3
"Haribo Original Gold-Bears Gummi Candy, 5-Pound Bag of Delicious Bears!  Ships to You  in Either Clear Packaging or the New Gold Updated Packaging.  The Same Delicious Gummi Bears in Either Packaging!",Grocery & Gourmet Food,https://www.amazon.com/Haribo-Gummi-Candy-Gold-Bears-5-Pound/dp/B000EVOSE4/ref=sr_1_1?s=grocery&amp;ie=UTF8&amp;qid=1448357625&amp;sr=1-1&amp;keywords=haribo+sugar+free+gummy+bears,20,2
"The Moby, World’s Largest Retail Dildo, 3 Ft",Health and Beauty,http://www.amazon.com/dp/B00MOTE1Y6/,18,2
Orbit 62100 Yard Enforcer Motion Activated Sprinkler with Day and Night Detection Modes,Lawn & Patio,http://www.amazon.com/dp/B009F1R0GC/,15,2
"The WineRack 200-008 The Wine Rack, Medium",Kitchen,http://www.amazon.com/dp/B001FYZZI2/,13,2
Locker Brand Inc 157281 The Original Fridge Locker,Home,http://www.amazon.com/dp/B001UFNCHM/,10,2
"Safety 1st Magnetic Locking System, 1 Key and 8 Locks",Baby Product,http://www.amazon.com/dp/B004GCJMLG/,9,2
The 5 Love Languages: The Secret to Love that Lasts,eBooks,http://www.amazon.com/dp/B00OICLVBI/,6,2
Flying Fuck Helicopter,Toy,http://www.amazon.com/dp/B002P4J2P8/,6,2
Will I Ever Be Good Enough?: Healing the Daughters of Narcissistic Mothers,eBooks,http://www.amazon.com/dp/B001AO0GD6/,6,2
Mama Gena's School of Womanly Arts: Using the Power of Pleasure to Have Your Way with the World (How to Use the Power of Pleasure),Book,http://www.amazon.com/dp/0743439937/,4,2
"Nit Free Terminator Lice Comb,  Professional Stainless Steel Louse and Nit Comb for Head Lice Treatment, Removes Nits",Health and Beauty,http://www.amazon.com/dp/B000HIBPV8/,4,2
"Schlage FE575 PLY 626 ELA Plymouth Keypad Entry with Auto-Lock and Elan Levers, Brushed Chrome",Home Improvement,http://www.amazon.com/dp/B001COEZTU/,3,2
Clip-on Earring Converter. 12 Pair! Turn Any Post or Stud Earring Into a Clip-on Earring!,Art and Craft Supply,http://www.amazon.com/dp/B007X5M55I/,2,2
In Sheep's Clothing: Understanding and Dealing with Manipulative People,Book,http://www.amazon.com/dp/1935166301/,2,2
316L Stainless Steel White Cubic Zirconia CZ Eternity Wedding 3MM Band Ring Sz 8,Jewelry,http://www.amazon.com/dp/B00AAJT40I/,2,2
Don't Get Caught with Your Skirt Down: A Practical Girl's Recession Guide,eBooks,http://www.amazon.com/dp/B001NLKY74/,,1
"Children of the Aging Self-Absorbed: A Guide to Coping with Difficult, Narcissistic Parents and Grandparents",eBooks,http://www.amazon.com/dp/B010CKAF3O/,,1
In Sheep's Clothing: Understanding and Dealing with Manipulative People,eBooks,http://www.amazon.com/dp/B005CN6PJ0/,,1
Disarming the Narcissist: Surviving and Thriving with the Self-Absorbed,eBooks,http://www.amazon.com/dp/B00DMJ768K/,,1
The Original Folk and Fairy Tales of the Brothers Grimm: The Complete First Edition,eBooks,http://www.amazon.com/dp/B00KUCTP5O/,,1
An A-Hole Hosts A Dinner Party (Etiquette For A-Holes Book 1),eBooks,http://www.amazon.com/dp/B00B5MOGK2/,,1
Punderdome: A Card Game for Pun Lovers,Books,https://www.amazon.com/Punderdome-Card-Game-Pun-Lovers/dp/1101905654/ref=sr_1_1?ie=UTF8&amp;qid=1505022207&amp;sr=8-1&amp;keywords=punderdome,,1
When He's Married to Mom: How to Help Mother-Enmeshed Men Open Their Hearts to True Love and Commitment,eBooks,http://www.amazon.com/dp/B000P1KPQS/,,1
"Wet-Stop3 Green Bedwetting Enuresis Alarm with Loud Sound and Strong Vibration for Bedwetters, Potty Training for Boys or Girls, Proven Solutions","Health, Household & Baby Care",https://www.amazon.com/Wet-Stop3-Bedwetting-Vibration-Bedwetters-Solutions/dp/B0013LRVWA/ref=sr_1_1_a_it?ie=UTF8&amp;qid=1504365688&amp;sr=8-1&amp;keywords=bed,,1
Master Lock 265DCCSEN Dual-Function Security Bar,Home Improvement,http://www.amazon.com/dp/B0002YUX8I/,26,1
The Gift of Fear and Other Survival Signals that Protect Us From Violence,Book,http://www.amazon.com/dp/0440508835/,20,1
"The Body Keeps the Score: Brain, Mind, and Body in the Healing of Trauma",Book,http://www.amazon.com/dp/0143127748/,14,1
The Four Agreements: A Practical Guide to Personal Freedom (A Toltec Wisdom Book),Book,http://www.amazon.com/dp/1878424319/,14,1
Complex PTSD: From Surviving to Thriving: A GUIDE AND MAP FOR RECOVERING FROM CHILDHOOD TRAUMA,Book,http://www.amazon.com/dp/1492871842/,14,1
Toxic Parents: Overcoming Their Hurtful Legacy and Reclaiming Your Life,Book,http://www.amazon.com/dp/0553381407/,13,1
"Lodge EC6D43 Enameled Cast Iron Dutch Oven, 6-Quart, Island Spice Red",Kitchen,http://www.amazon.com/dp/B000N501BK/,9,1
"Explore Asia Organic Black Bean Spaghetti, 7.05-Ounce Pouch",Grocery,http://www.amazon.com/dp/B0078DU1CY/,9,1
NoseFrida The Snotsucker Nasal Aspirator,Baby Product,http://www.amazon.com/dp/B00171WXII/,9,1
Why Does He Do That?: Inside the Minds of Angry and Controlling Men,eBooks,http://www.amazon.com/dp/B000Q9J0RO/,8,1
"Understanding the Borderline Mother: Helping Her Children Transcend the Intense, Unpredictable, and Volatile Relationship",Book,http://www.amazon.com/dp/0765703319/,8,1
"Sugar Free Gummy Bears, 5LBS by Albanese Confectionery",Grocery,http://www.amazon.com/dp/B00CMS97YS/,8,1
The Subtle Art of Not Giving a F*ck: A Counterintuitive Approach to Living a Good Life,Books,https://www.amazon.com/Subtle-Art-Not-Giving-Counterintuitive/dp/0062457713,8,1
Codependent No More: How to Stop Controlling Others and Start Caring for Yourself,eBooks,http://www.amazon.com/dp/B00BS027FC/,7,1
"Mack's Pillow Soft Silicone Earplugs Value Pack, 6 Pairs",Tools & Home Improvement,https://www.amazon.com/Macks-Pillow-Silicone-Earplugs-Value/dp/B003LZQGN6/ref=sr_1_9?s=hi&amp;ie=UTF8&amp;qid=1483730583&amp;sr=1-9&amp;keywords=ear,7,1
KOSE SOFTYMO Speedy Cleansing Oil 230ml,Beauty,http://www.amazon.com/dp/B000V2FBAQ/,7,1
On Talking Terms With Dogs Calming Signals,Book,http://www.amazon.com/dp/1929242360/,7,1
Victorinox 8 Inch Swiss Classic Chef's Knife,Kitchen,http://www.amazon.com/dp/B0061SWV8Y/,6,1
ScareCrow Motion Activated Animal Repellent,"Patio, Lawn & Garden",https://www.amazon.com/dp/B000071NUS/ref=wl_it_dp_o_pC_nS_ttl?_encoding=UTF8&amp;colid=35XVJG1YZTMZ&amp;coliid=I27QSEZYC3TNPA,6,1
"Doc Johnson Classic - The Great American Challenge - 15"" Long and 2.9"" Wide - Massive 9.1"" Girth - Great for Size Queens - Dildo - Purple",Health and Beauty,http://www.amazon.com/dp/B002E9I0F2/,6,1
High Cotton Doormat - Come Back with a Warrant,Lawn & Patio,http://www.amazon.com/dp/B00020O572/,6,1
Tinkle Eyebrow Razor Pack of 6,Beauty,http://www.amazon.com/dp/B014HNOXZS/,6,1
"The Drama of the Gifted Child: The Search for the True Self, Revised Edition",Book,http://www.amazon.com/dp/0465016901/,5,1
"Good Omens: The Nice and Accurate Prophecies of Agnes Nutter, Witch",Book,http://www.amazon.com/dp/0060853980/,5,1
AmazonBasics Security Safe - 0.5-Cubic Feet,Home Improvement,http://www.amazon.com/dp/B00UG9HB1Q/,5,1
"How to Cook Everything (Completely Revised 10th Anniversary Edition): 2,000 Simple Recipes for Great Food",eBooks,http://www.amazon.com/dp/B00BS03W5Q/,4,1
Stop Walking on Eggshells: Taking Your Life Back When Someone You Care About Has Borderline Personality Disorder,eBooks,http://www.amazon.com/dp/B004DNXGFQ/,4,1
Best Home Fashion Non-Adhesive Frosted Privacy Window Film - White - 3 ft x 6.5 ft (1 Roll),Home,http://www.amazon.com/dp/B007RCX088/,4,1
The Fist Dildo,Health and Beauty,http://www.amazon.com/dp/B001ZRUUGQ/,4,1
"Masterlink Marketing Black Seatbelt Adjuster, (Pack of 2)",Automotive Parts and Accessories,http://www.amazon.com/dp/B004HMBK5G/,4,1
"Children of Hoarders: How to Minimize Conflict, Reduce the Clutter, and Improve Your Relationship",eBooks,http://www.amazon.com/dp/B00ECLGAKW/,4,1
"Master Series Jizz Water Based Lube, Semen Scented, 8.5 Ounce",Health and Beauty,http://www.amazon.com/dp/B00E1Q8RMC/,4,1
"Infantino Sash Mei Tai Carrier, Black/Gray",Baby,https://www.amazon.com/Infantino-Sash-Carrier-Black-Gray/dp/B005C9ODQ6/ref=redir_mobile_desktop?_encoding=UTF8&amp%3BdpID=81tYPTs9HsL&amp%3BdpPl=1&amp%3Bpsc=1&amp%3BrefRID=CA55NJNJK5D2HD2Q4HA6&ref_=pd_aw_sim_75_1,4,1
Stress Buster Desktop Punching Ball,Sports,http://www.amazon.com/dp/B0051V68DQ/,4,1
Calslock Portable Door & Travel Lock,Home Improvement,http://www.amazon.com/dp/B00GMPFCNC/,4,1
The Club Model 20- The Door Club (Brass),Tools & Home Improvement,https://www.amazon.com/Club-Model-20-Door-Brass/dp/B00007E7LN,3,1
Shomer-Tec Special Ingredients Purple Rain Powder,Sports,http://www.amazon.com/dp/B00ABV7U3I/,3,1
Home Comforts: The Art and Science of Keeping House,Book,http://www.amazon.com/dp/0743272862/,3,1
Boundaries Where You End And I Begin: How To Recognize And Set Healthy Boundaries,eBooks,http://www.amazon.com/dp/B00BS03HD8/,3,1
Gund Grumpy Cat Plush Stuffed Animal Toy,Toy,http://www.amazon.com/dp/B00DVDMRX6/,3,1
"Comfort Zone Feliway Spray, 75 mL, For Cat Calming",Pet Products,http://www.amazon.com/dp/B003E71E24/,3,1
SONY  ICD PX333 Digital Voice Recorder,Office Product,http://www.amazon.com/dp/B00BOXNSRY/,3,1
RETURN TO SENDER Self Inking Rubber Stamp - Red Ink,Office Product,http://www.amazon.com/dp/B003P5MFP0/,3,1
Ring Wi-Fi Enabled Video Doorbell in Satin Nickel,Home Improvement,http://www.amazon.com/dp/B00N2ZDXW2/,3,1
"Prime-Line U 9888 Flip Action Steel Door Lock, White Finish",Home Improvement,http://www.amazon.com/dp/B001LR1YA6/,3,1
"SentrySafe Fire and Water Safe, Fire Resistant File Safe, 0.65 Cubic Feet, HD4100",Home Improvement,http://www.amazon.com/dp/B00GE57DFK/,3,1
"K3 Brands USCG Rated Premium Air Horn - Non-Flammable, 8 oz.",Sports,http://www.amazon.com/dp/B010GNG4L4/,2,1
"National Hardware  N335-984 Door Security Guard, Satin Nickel",Home Improvement,http://www.amazon.com/dp/B001RUEWUQ/,2,1
The Emotionally Absent Mother: How to Recognize and Heal the Invisible Effects of Childhood Emotional Neglect,Book,http://www.amazon.com/dp/1615193820/,2,1
EZSound Module for DIY Audio Cards - Easy to Record - 120 Seconds Recording - High Sound Quality,Office Product,http://www.amazon.com/dp/B006HL1KAU/,2,1
"Noodler's Black Waterproof Fountain Pen Ink - Bulletproof,3 ounce",Office Product,http://www.amazon.com/dp/B000MVZ2E6/,2,1
Hair Brush Diversion Safe Stash with Smell Proof Bag by Stash-it - Can Safe - Secret lid on top opens to store your valuables!,Office Product,http://www.amazon.com/dp/B01LFE2HBY/,2,1
"My Pink Wink Cream for Darker Areas (0.5 oz, My Pink Wink Anal Bleach)",Beauty,http://www.amazon.com/dp/B005Y0AZXI/,2,1
ANNOY-A-TRON Prankster Pack,Toy,http://www.amazon.com/dp/B016J8HE3M/,2,1
WARNING To Avoid Injury Don't Tell Me How To Do My Job © vinyl decal car sticker Do Not Tell Me How To Do My Job,Automotive Parts and Accessories,http://www.amazon.com/dp/B00M3F6PWM/,2,1
"Munchkin Formula Dispenser Combo Pack, Colors May Vary",Baby Product,http://www.amazon.com/dp/B000RFCXIK/,2,1
Love You Forever,eBooks,http://www.amazon.com/dp/B009XHAM8G/,2,1
Breathing Mobile Washer Classic - Portable Clothes Washing Machine - Handheld - Manual - Mobile Hand Powered Laundry Solution - Superior Materials and Construction,Major Appliances,http://www.amazon.com/dp/B002QUAPSO/,2,1
Toxic In-Laws: Loving Strategies for Protecting Your Marriage,Book,http://www.amazon.com/dp/0060507853/,2,1
"The Original 46"" Bozo 3-D Bop Bag",Toy,http://www.amazon.com/dp/B00067TAWG/,2,1
Arlo VMS3130  Indoor/Outdoor Night Vision Security System with 1 Wire-Free HD Camera,Home Improvement,http://www.amazon.com/dp/B00QH0Q8J4/,2,1
"When I Say No, I Feel Guilty",eBooks,http://www.amazon.com/dp/B004IK8Q22/,2,1
"Burning Love Short Plush Material Angry White Cat Go Away Printed Doormat , Non-slip Doormats, Size40X60CM.",Lawn & Patio,http://www.amazon.com/dp/B0199J2KAU/,2,1
"Century Fitness ""B.O.B."" Body Opponent Bag",Toy,http://www.amazon.com/dp/B00022KIYY/,2,1
"Giftpocket Women's Under the Bump Maternity Panties Underwear, Pack of 5, Assorted Random Designs and Colors, XXL",Apparel,http://www.amazon.com/dp/B01GCA3NPU/,2,1
LauKingdom Cast Iron Cleaner - XXL 8x8 More Efficient Stainless Steel Chainmail Scrubber,Home,http://www.amazon.com/dp/B01EHF0G0C/,2,1
"Avery InkJet Iron-On Dark T-Shirt Transfers, White, Five Sheets per Pack (03279)",Office Product,http://www.amazon.com/dp/B0000C0CIR/,2,1
"elope Holy Pope Hat, White/Gold, One Size",Apparel,http://www.amazon.com/dp/B003ZB06PU/,2,1
[20 Pack] 3 Compartment Meal Prep Containers BPA Free Portion Control Bento Boxes (39 Oz.),Kitchen,http://www.amazon.com/dp/B01D0JDZFO/,2,1
"Breathing Mobile Washer Handheld, Portable, Non-Electric, Mobile, Clothes Washing Machine",Home,http://www.amazon.com/dp/B00WVTXVMC/,2,1
22 Things a Woman with Asperger's Syndrome Wants Her Partner to Know,Book,http://www.amazon.com/dp/1849058830/,2,1
National Hardware V807 Door Chains in Brass,Home Improvement,http://www.amazon.com/dp/B000NCWNG4/,2,1
Marcy Cardio Mini Cycle,Sports,http://www.amazon.com/dp/B005CAJ3YM/,2,1
Ice-Phone IPF.GN Green Retro Handset,Office Product,http://www.amazon.com/dp/B009ROZ2TY/,1,1
"HealthSmart Vivi Bridgit Cane Rest Cane Holder, White",Health and Beauty,http://www.amazon.com/dp/B00HJKPKD6/,1,1
HIG water gun for kids Soaker Squirt Games,Toy,http://www.amazon.com/dp/B01E6JF8GG/,1,1
Should I Stay or Should I Go?: A Guide to Knowing if Your Relationship Can--and Should--be Saved,Book,http://www.amazon.com/dp/042523889X/,1,1
"BookFactory Black Journal / Writing Notebook / Blank Diary / Lined Pages Book - 192 Pages, 5.25"" x 8.27, Banded Journal, Hardbound, Bookmark (JOU-192-CCS-K)",Office Product,http://www.amazon.com/dp/B00J7SDKSA/,1,1
Pepto-Bismol Max 5 Symptom Medicine - Including Upset Stomach & Diarrhea Relief 12 oz (Pack of 3),"Health, Household & Baby Care",https://www.amazon.com/dp/B001G7QR26/ref=cm_sw_r_cp_apa_eketyb0YWXWA9,1,1
"Rhode Island Novelty PAVSN24 24-Inch Vinyl Snake, Pack of 12",Toy,http://www.amazon.com/dp/B007P5321C/,1,1
"Air Horn for Boating, Sports, Safety. Loud & Effective Boat Signal & Shoreline Marine USCG Rated - Appropriate for Any Purpose - Non-Flammable, Ozone Safe.",Sports,http://www.amazon.com/dp/B018Y6U3ZS/,1,1
Mead Composition Book pack of 2,Office Product,http://www.amazon.com/dp/B002ZZ4FPY/,1,1
Lucky Dog Uptown Welded Wire Kennel (6'Hx4'Wx8'L),Pet Products,http://www.amazon.com/dp/B002R0F04M/,1,1
BAVISION Wifi IP Camera Wireless Home Security Trailer Cameras Dog/ Baby Monitor Video Nanny Cam Night Vision plug/play Pan/Tilt with Two-Way Audio,Photography,http://www.amazon.com/dp/B014B2WLIG/,1,1
"Ha Ha, Baby! by Kate Petty (2008-03-04)",Book,http://www.amazon.com/dp/B01FIY1FRE/,1,1
The Spirit of Hinduism: A Christian Perspective on Hindu Life and Thought,Book,http://www.amazon.com/dp/0825461103/,1,1
Hinduism and Christianity,Book,http://www.amazon.com/dp/0916356531/,1,1
"iTouchless Bio-Matic Fingerprint Door Lock, Right Handle, Silver",Home Improvement,http://www.amazon.com/dp/B000PELUAU/,1,1
Hot Dudes Reading 2017 Wall Calendar,Book,http://www.amazon.com/dp/1452152578/,1,1
"BIBENE WIFI Home Security Alarm System DIY KIT with Easy App, 2-in-1 PIR Main Panel,0-120dB, 3Modes for IOS Android Smartphone with Alexa Echo Control PIR Motion Sensor,Door/window Contact Sensor",Photography,http://www.amazon.com/dp/B0711X97P6/,1,1
Awaken the Giant Within,Audible,http://www.amazon.com/dp/B000NHG8CO/,1,1
Fox Labs 5.3 Million SHU UV Marking 2 oz Flip-Top Safety Cap Pepper Spray Stream,Sports,http://www.amazon.com/dp/B00YSZZ9K4/,1,1
Pampered Chef Family Heritage Stoneware Rectangular Lid/Bowl #1435,Kitchen,http://www.amazon.com/dp/B000WJ1XV4/,1,1
Professional Baking 6e with Professional Baking Method Card Package Set,Book,http://www.amazon.com/dp/1118254368/,1,1
Bobby and Mandee's Good Touch/Bad Touch: Children's Safety Book,Book,http://www.amazon.com/dp/1935274546/,1,1
"Vaultz Locking Cash Box, 9.875 x 4.875 x 8.5 Inches, Black (VZ01002)",Office Product,http://www.amazon.com/dp/B00063BJ6U/,1,1
"CafePress - If You Didnt Put It Here, Dont Touch It Maternity - Cotton Maternity T-shirt, Cute & Funny Pregnancy Tee","Clothing, Shoes & Jewelry",https://www.amazon.com/dp/B00ICVLCJM/ref=cm_sw_r_cp_apa_gmU9yb88KE370,1,1
Our Generation Bite to Eat Retro Diner,Toys & Games,https://www.amazon.com/Our-Generation-Bite-Retro-Diner/dp/B00POZ0EUM,1,1
How to be a Good Mother-in-Law,Book,http://www.amazon.com/dp/1851240829/,1,1
Samsung SHS-P718  Digital Door Lock Fingerprint Push Pull Two Way Latch Mortise,Electronics,https://www.amazon.com/Samsung-SHS-P718-Digital-Fingerprint-Mortise/dp/B00HYIIFS0,1,1
Avocado Half Glass Handmade Christmas Ornaments Hangers Decoration Fruit Kitchen,Home,http://www.amazon.com/dp/B00P6LWR1I/,1,1
"Helix Prescription Drug Cabinet, White (27050)",Office Product,http://www.amazon.com/dp/B004G8HXW0/,1,1
Liquid Ass Bad Karma in a Bottle Novelty,Toy,http://www.amazon.com/dp/B006FBBM96/,1,1
Mini Crime Scene Tape by Accoutrements,Toy,http://www.amazon.com/dp/B008PE09PY/,1,1
"Sensory Weighted Lap Pad for Kids - 5-pounds - Great for Children with Autism, ADHD, and Sensory Processing Disorder",Office Product,http://www.amazon.com/dp/B01LX9D33Y/,1,1
"OdoBan Odor Eliminator RTU, 1qt Spray Bottle, W1 Gallon Concentrate, Original Eucalyptus Scent",Art and Craft Supply,http://www.amazon.com/dp/B000ZOQ9HY/,1,1
Rabbitgoo 3D Window Films Privacy Film Static Decorative Film Non-Adhesive Heat Control Anti UV 17.7In. By 78.7In. (45 x 200Cm),Home,http://www.amazon.com/dp/B01JFILPIS/,1,1
Families of Two,Books,https://www.amazon.com/Families-Two-Laura-Carroll/dp/0738822620?_encoding=UTF8&%2AVersion%2A=1&%2Aentries%2A=0,1,1
Footed Pajamas - Howling Moon Adult Hoodie Chenille - Large,Apparel,http://www.amazon.com/dp/B00AMKPEN6/,1,1
NOT THE MAMA! Unisex T-shirt / 90s Dinosaur TV Tribute Shirt,Apparel,http://www.amazon.com/dp/B00IJQOUKI/,1,1
Secret Hidden ICE PACK ALCOHOL FLASK to Hide Booze – Holds 36 Ounces (Pack of 3),Home,http://www.amazon.com/dp/B01M8QI8WC/,1,1
Root Naturally Food Grade Diatomaceous Earth - 2 Lb,Lawn & Patio,http://www.amazon.com/dp/B0167NW7FE/,1,1
"Planet Wise Wet Diaper Bag, Jewel Woods, Large",Baby Product,http://www.amazon.com/dp/B00NA8JM58/,1,1
ABDL Pink Adult Pacifier,Baby Product,http://www.amazon.com/dp/B011AMEEPI/,1,1
"SeaSense Large Air Horn, 8oz",Sports,http://www.amazon.com/dp/B0019M5EZ4/,1,1
Star Wars Princess Leia Costume,Apparel,http://www.amazon.com/dp/B005ZD1BMI/,1,1
"Star Wars Romper Obi-Wan Kenobi, 1-2 Years",Apparel,http://www.amazon.com/dp/B002CVEK4C/,1,1
"Earth Friendly Products Pet Stain/Odor Remover, 22oz",Pet Products,http://www.amazon.com/dp/B0002X30Y8/,1,1
The Art of the Apology,Book,http://www.amazon.com/dp/0980084873/,1,1
The Oxford English Dictionary (20 Volume Set) (Vols 1-20),Book,http://www.amazon.com/dp/0198611862/,1,1
"ZAFUL Women's Vintage Christmas Party Dresses Scoop Neck Cocktail Swing Dress (M, White)",Apparel,http://www.amazon.com/dp/B01KZL0F8A/,1,1
Maxwell & Williams William Morris Honeysuckle Design 14floz Ceramic Mug,Kitchen,http://www.amazon.com/dp/B00THDR89M/,1,1
Pee-pee Teepee Jungle Green - Cello Bag,Baby Product,http://www.amazon.com/dp/B00QTXY2SI/,1,1
"City Classified Women's Closed Toe Mary Jane Chunky Heel Pump (White, 6.5 B(M) US)",Shoes,http://www.amazon.com/dp/B06XZJY9SL/,1,1
BUDDY Jesus CHRIST Statue Figurine from Kevin Smith's DOGMA Movie,Toy,http://www.amazon.com/dp/B002065JM6/,1,1
"Knock Nanny Door Bell Cover, White",Baby Product,http://www.amazon.com/dp/B00OABOHRM/,1,1
PuraSleep 10” CoolFlow Memory Foam Mattress – Made In The USA – 10 Year Warranty-Queen,Furniture,http://www.amazon.com/dp/B00PZ22KQA/,1,1
Scientific Explorer Disgusting Science Kit,Toy,http://www.amazon.com/dp/B000BUW7E6/,1,1
Magrath Livestock Prod Yellow Cattle HotShot Handle Swine Prod #22,Home Improvement,http://www.amazon.com/dp/B005R3V770/,1,1
"Godzilla White VINYL 6"" car Decal graphic Grunge Art Wall Sticker Car USA",Home,http://www.amazon.com/dp/B00PQ0WN4K/,1,1
Gallagher AHP2 Handy Shock Cattle Prod Livestock Equipment,Lawn & Patio,http://www.amazon.com/dp/B0089JKAYA/,1,1
King Size SafeRest Premium Hypoallergenic Waterproof Mattress Protector - Vinyl Free,Home,http://www.amazon.com/dp/B003PWK2A8/,1,1
"Gracious: A Practical Primer on Charm, Tact, and Unsinkable Strength: Including instructions on being kind when you don’t feel like it, ignoring the ... and sensible in a world that is neither",Book,http://www.amazon.com/dp/1623367972/,1,1
"Zwipes Professional Premium Microfiber Cleaning Cloth Towels, 16x16 inch, 12-Pack, Yellow",Home Improvement,http://www.amazon.com/dp/B016EYSNOA/,1,1
The Socially Skilled Child Molester: Differentiating the Guilty from the Falsely Accused,Book,http://www.amazon.com/dp/0789028069/,1,1
Earthwise GS70015 15-Amp Electric Garden Chipper/Shredder with Collection Bin,Lawn & Patio,http://www.amazon.com/dp/B00W874Y46/,1,1
"Authentic Sheepskin Car Seat Belt Cover Shoulder Seatbelt Pad for Adults Youth Kids Toddlers - Auto, Truck, SUV, Airplane Accessories - Genuine Natural Soft Merino Wool (Dark Gray)",Automotive Parts and Accessories,http://www.amazon.com/dp/B06XB2YWQ5/,1,1
TooLoud Rooster Silhouette Design Baby Romper Bodysuit - Aquatic Blue - 6 Months,Apparel,http://www.amazon.com/dp/B00QO1A914/,1,1
Ocean Potion Instant Burn Relief Ice-20.5 ounces,Health and Beauty,http://www.amazon.com/dp/B001URL34Y/,1,1
This Is My Faith: Islam (This Is My Faith Books),Book,http://www.amazon.com/dp/0764134752/,1,1
This Is My Faith: Buddhism (This Is My Faith Books),Book,http://www.amazon.com/dp/0764134728/,1,1
TooLoud Locally Grown Organic Sausage Baby Romper Bodysuit - Candy Pink - 12 Months,Apparel,http://www.amazon.com/dp/B01A84DVGC/,1,1
100 % Cotton Long Sleeve Funny Save Gas Ride My Cock Children's Baby Onesies,Apparel,http://www.amazon.com/dp/B01LWW55K1/,1,1
UniquExceptional UDC4silver Fake Security Camera with 30 Illuminating LEDs (Silver),Electronics,https://www.amazon.com/UniquExceptional-UDC4silver-Security-Camera-Illuminating/dp/B00UKV5YDW/ref=redir_mobile_desktop?_encoding=UTF8&amp%3Brefinements=p_72&amp%3Bsr=8-12&qid=1466378914&ref_=mp_s_a_1_12,1,1
"THORVAP Faux Leather Necklace Lanyard with Pouch Holder. [1] Lanyard Necklace + [1] Carabiner for E-shisha pen, Leather Pouch case Necklace (black)",Office Product,http://www.amazon.com/dp/B01L6XNOL6/,1,1
NOT AT THIS ADDRESS Self Inking Rubber Stamp - Red Ink (ExcelMark A1539),Office Product,http://www.amazon.com/dp/B01CERV9XS/,1,1
"Jumbo Size Cat Litter Trapper by iPrimio - Litter Mat, EZ Clean Cat Mat, Litter Box Mat Water Proof Layer and Puppy Pad Option. Patent Pending. (32""x30"" Brown)",Pet Products,http://www.amazon.com/dp/B01AUU90IW/,1,1
Pawliss Dog Mouth Cover Duck Mouth Shape Anti-bite Muzzle Small,Pet Products,http://www.amazon.com/dp/B017EP7BXW/,1,1
"ACEVOG Womens Slim Fit Floral Scoop Neck Sleeveless Midi Dress, Medium",Apparel,http://www.amazon.com/dp/B00WW8D5SM/,1,1
"Sheer Soft Chiffon Bridal Women's Shawl For Special Occasions Light Gray 79"" Long 20"" Wide",Apparel,http://www.amazon.com/dp/B00CTYQPRW/,1,1
How to Murder Your Mother-in-Law (Ellie Haskell),Book,http://www.amazon.com/dp/0553569511/,1,1
Melife® Animal Harness (Red Elmo),Baby Product,http://www.amazon.com/dp/B00N2IFGTW/,1,1
100% Juice No Seeds Men's Premium T-Shirt by Spreadshirt,Apparel,http://www.amazon.com/dp/B00KA86JMA/,1,1
"SACASUSA (TM) Fashion Color Chiffon Soft Long Shawl Sheer Wrap 63""x20"" in Gray",Apparel,http://www.amazon.com/dp/B00EN3U92Y/,1,1
Maisy Goes To Hospital,Book,http://www.amazon.com/dp/1406304905/,1,1
The White Princess (The Plantagenet and Tudor Novels),Book,http://www.amazon.com/dp/145162610X/,1,1
"Morex Ribbon Swirl Wired Sheer Glitter Ribbon, 2-1/2-Inch by 50-Yard Spool, White/Silver",Art and Craft Supply,http://www.amazon.com/dp/B00A23K258/,1,1
Meili Bondage Restraints Forced Orgasm Belt,Health and Beauty,http://www.amazon.com/dp/B017UMGF8G/,1,1
Air Horn,Sports,http://www.amazon.com/dp/B002TR0JEO/,1,1
WearAll Women's Plus Knit Crochet Short Sleeve Open Cardigan - Yellow - US 20-22 (UK 24-26),Apparel,http://www.amazon.com/dp/B01G5S9RGI/,1,1
But I was Full of Pancake and feeling brave,"Clothing, Shoes & Jewelry",https://www.amazon.com/dp/B073T4XTM9,1,1
"BigMouth Inc Crime Scene Caution Tape, 50 Foot Roll",Toy,http://www.amazon.com/dp/B00152R7IK/,1,1
"SUCK UK Ambigram Door Mat - Come in, Go Away",Home,http://www.amazon.com/dp/B0013Z1G1I/,1,1
IMAGE® Removable Decorative Blackboard Chalkboard Wall Paper Sticker Decal 200 x 45cm,Home Improvement,http://www.amazon.com/dp/B00AQUYYBU/,1,1
Barbie Pool,Toy,http://www.amazon.com/dp/B000M0F8AU/,1,1
"Enough About You: The Narcissist's 7-Step, 1-Minute Survival Guide to Sacred Spirituality, a Self-Empowered Career, and Highly Effective Relationships",Book,http://www.amazon.com/dp/0060555939/,1,1
Giant Stress Boob Stress Ball,Toy,http://www.amazon.com/dp/B000ULAO4Q/,1,1
"Half Moon ""Go Away"" Coir Doormat by Castle Mats, Size 18 x 30 inches, Non-Slip, Durable, Made Using Odor-Free Natural Fibers",Lawn & Patio,http://www.amazon.com/dp/B01A7DELU4/,1,1
Lumiparty Cube Money Puzzle Box - Pink,Home,http://www.amazon.com/dp/B01MD12RD8/,1,1
You Might Be a Narcissist If... - How to Identify Narcissism in Ourselves and Others and What We Can Do About It,Book,http://www.amazon.com/dp/1934938742/,1,1
