name,category,amazon_link,total_mentions,subreddit_mentions
"Burning Love Short Plush Material I Have An Idea Go Away Cat Printed Doormat , Non-slip Doormats, Size40X60CM.",Lawn & Patio,http://www.amazon.com/dp/B015MI9WZI/,1,1
"Rubber-Cal ""Wipe Your Feet, Please"" Coir Mat, 18 x 30-Inch",Home,http://www.amazon.com/dp/B00BJQPY5K/,1,1
ZippyPaws IPooch 6-Squeaker No Stuffing Plush Dog Toy,Pet Products,http://www.amazon.com/dp/B00P0YQXCU/,1,1
Purple Thief Detection Powder,Beauty,http://www.amazon.com/dp/B0018E5BI8/,1,1
Wedge-It - The Ultimate Door Stop - Black,Home Improvement,http://www.amazon.com/dp/B00070FYZE/,1,1
Crazy Night Bachelorette Party Decor Naughty Confetti Set of 4 Bag,Kitchen,http://www.amazon.com/dp/B019W5IJG0/,1,1
"SHARPER IMAGE SHP921 Universal Wireless Headphones For TV, Black",Speakers,http://www.amazon.com/dp/B004AWE4D8/,1,1
"StreetWise Ladies Choice 21 Million Volt Rechargeable Stun Gun with Alarm and Flashlight, Pink Stripe",Sports,http://www.amazon.com/dp/B01DL0NEOO/,1,1
"Artaste 59380 Rain 18/10 Stainless Steel Flatware 36pcs set, 3pcs each for 12 service.",Kitchen,http://www.amazon.com/dp/B0149LPCTO/,1,1
"Paradise Galleries Lifelike Realistic Baby Doll, Tall Dreams Gift Set Ensemble, 19-inch Weighted Baby, for Ages 3+",Toy,http://www.amazon.com/dp/B005G14SGU/,1,1
Adult Children Secrets of Dysfunctional Families: The Secrets of Dysfunctional Families,Book,http://www.amazon.com/dp/0932194532/,1,1
Plantar Fasciitis Posterior Night Splint - Medium (Colors May Vary),Health and Beauty,http://www.amazon.com/dp/B00PX5HGPE/,1,1
"Vitech Super Comfortable Wireless Bluetooth LED flash Over Ear Headphones with Mic, Wireless and Wired Dual Mode, active noise cancelling (Pink)",Speakers,http://www.amazon.com/dp/B01M4O1BZ6/,1,1
Try and Make Me!: Simple Strategies That Turn Off The Tantrums and Create Cooperation,Book,http://www.amazon.com/dp/0451206452/,1,1
KitchenAid SSA Sausage Stuffer Kit Attachment,Kitchen,http://www.amazon.com/dp/B00004SGFQ/,1,1
Plano 1719-00 68 Quart Tote (Black),Sports,http://www.amazon.com/dp/B007TOHI7I/,1,1
"Rubbermaid Configurations Custom Closet Add-On Shelving Kit, Titanium, 26"" (FG3H9102TITNM)",Home,http://www.amazon.com/dp/B0009WG32S/,1,1
"Mini Wireless Camera, UOKOO Home WiFi IP Security Surveillance Camera System with Motion Email Alert Black",Wireless,http://www.amazon.com/dp/B01MT0FPPX/,1,1
The Nice Girl Syndrome: Stop Being Manipulated and Abused -- and Start Standing Up for Yourself,Book,http://www.amazon.com/dp/0470579900/,1,1
"Foot Massage Roller for Plantar Fasciitis, Heel & Foot Arch Pain Relief. Stress and Relaxation, through Trigger Point Therapy Includes Downloadable E-Book on Reflexology by Natural Chemistree",Health and Beauty,http://www.amazon.com/dp/B01C4UUSLE/,1,1
"Roamans Women's Plus Size Pull On Bike Shorts Black,L",Apparel,http://www.amazon.com/dp/B005GQ4TYG/,1,1
Petmate Replendish Gravity Waterer w/ Microban,Pet Products,http://www.amazon.com/dp/B0057LAGO2/,1,1
SABRE Door Handle Alarm – 110dB Door Alarm for Home Security – Audible up to 600 Feet (185M) Away – Vibration-Triggered Security Alarm Sounds when Door Knob is Touched from Outside,Home Improvement,http://www.amazon.com/dp/B01L3R5LXE/,1,1
Visible Stain Theft Detection Powder - Purple,Beauty,http://www.amazon.com/dp/B009DMKYIY/,1,1
BS Flag (Uncensored),Lawn & Patio,http://www.amazon.com/dp/B005KKAWQC/,1,1
