name,category,amazon_link,total_mentions,subreddit_mentions
"Tomtoc 360° Protective Laptop Sleeve for 15 Inch MacBook Pro Retina 2012-2015, Shockproof, Spill-Resistant 15 Inch Ultrabook Netbook Tablet Case Cover, Black Blue",PC Accessory,http://www.amazon.com/dp/B01HCF0ZMI/,3,2
ZXUY Hard Drive SATA 2nd HDD Caddy Tray for Unibody 9.5mm Laptop CD/DVD-ROM Drive Slot (Replacement Only for SSD and HDD),PC Accessory,http://www.amazon.com/dp/B0058AH2US/,17,2
Transcend 128GB JetDrive Lite 330 Storage Expansion Card for 13-Inch MacBook Pro with Retina Display (TS128GJDL330),Personal Computer,http://www.amazon.com/dp/B00MTHLURE/,10,2
Tomtoc Laptop Sleeve for 13 Inch New MacBook Pro 2017 & 2016 | Dell XPS 13 | New Surface Pro 2017 | Surface Pro 4/3 and Most 11.6 Inch Chromebook Tablet,PC Accessory,http://www.amazon.com/dp/B01H4ZRGBY/,3,2
Samsung T3 Portable SSD - 250GB - USB 3.1 External SSD (MU-PT250B/AM),Personal Computer,http://www.amazon.com/dp/B01AVF6WN2/,8,2
"USB C Hub, HooToo USB C Adapter 3.1 with Type C Charging Port, HDMI Output, Card Reader, 3 USB 3.0 Ports for MacBook Pro 2015/2016, Google Chromebook 2016/2017 and more USB C Devices – Space Gray",Personal Computer,http://www.amazon.com/dp/B01K7C53K2/,9,2
Akitio Thunder2 PCIe Box - Not intended for the use of Graphic Cards,PC Accessory,http://www.amazon.com/dp/B00LTAUTHE/,27,1
"Sabrent 2.5-Inch SATA to USB 3.0 Tool-free External Hard Drive Enclosure [Optimized For SSD, Support UASP SATA III] Black (EC-UASP)",Personal Computer,http://www.amazon.com/dp/B00OJ3UJ2S/,27,1
8MOBILITY iSlice Aluminum MicroSD Storage Adapter for Macbook Pro Retina 13'' (Late 2012 to Early 2015) - Silver,PC Accessory,http://www.amazon.com/dp/B00TTFOJ4A/,1,1
Clean Screen Wizard Microfiber Screen Cleaner and Protector Kit Bundle with 4 Large Cloths / Keyboard Covers in Protective Pouches and Cleaning Sticker for Laptops - Multi-Size Screens,PC Accessory,http://www.amazon.com/dp/B00UORW12E/,2,1
Cable Matters USB 3.1 Type C (USB-C) to Micro B (Micro USB) Cable in Black 3.3 Feet,Wireless,http://www.amazon.com/dp/B00UUBQ710/,1,1
Adobe Photoshop Lightroom 6,Software,http://www.amazon.com/dp/B00VWCKJVA/,7,1
"Inateck 14-14.1 Inch Laptop Sleeve, Compatible with New MacBook Pro 15 Inch 2016 Version, Water Repellent - Black (LC1400B)",Personal Computer,http://www.amazon.com/dp/B00XJBDM98/,4,1
"Dell Adapter, USB Type C to HDMI/VGA/Ethernet/USB (470-ABQN)",Personal Computer,http://www.amazon.com/dp/B012DT6KW2/,9,1
"ICON Sleeve with TENSAERLITE for MacBook Pro Retina 13""",Personal Computer,http://www.amazon.com/dp/B012E7EV2E/,1,1
"BASEQI aluminum microSD Adapter for MacBook Pro 15"" Retina (Late 2013 onwards)",PC Accessory,http://www.amazon.com/dp/B012F8ALBC/,5,1
"Speck Products See Thru Onyx Case for Macbook Pro 15 Inch with Retina Display, Black Matte",Personal Computer,http://www.amazon.com/dp/B013KKKZI8/,1,1
Window 10 MacBook Air-Pro 11 13 15 17 Stickers,Toy,http://www.amazon.com/dp/B014I1ICX8/,2,1
Kanex USB-C to DVI Adapter 8.25 Inches (21 cm)-White,Personal Computer,http://www.amazon.com/dp/B017GGNU0C/,1,1
"Satechi Type-C USB 3.0 3 in 1 Combo Hub for MacBook 12"" (with USB-C Charging Port) (Space Gray)",Personal Computer,http://www.amazon.com/dp/B019PHF9UY/,6,1
"USB C Hub, HooToo USB C Adapter/Charger USB C to USB 3.1 with Type C Charging Port, USB C to HDMI Output, Card Reader, 3 USB 3.0 Ports – Silver",Personal Computer,http://www.amazon.com/dp/B019R9ILTG/,16,1
"GreenBox New Laptop Replacement Battery for A1278 A1322 [Apple MacBook Pro 13 inch] - (Mid 2009, Mid 2010, Early 2011, Late 2011, Mid 2012), fit MB990LL/A MC724LL/A - [Li-Polymer 6-cell 63.5Wh]",PC Accessory,http://www.amazon.com/dp/B01AKFVS3C/,3,1
Samsung T3 Portable SSD - 500GB - USB 3.1 External SSD (MU-PT500B/AM),Personal Computer,http://www.amazon.com/dp/B01AVF6UQQ/,8,1
"Anker 4-Port USB-C Portable Data Hub, with a Premium Power Delivery Charging Port and Gigabit Ethernet Included for MacBook Pro 2016, Chromebook Pixel and Other Devices",Personal Computer,http://www.amazon.com/dp/B01D0XTF9U/,1,1
LaCie Rugged Thunderbolt and USB 3.0 Portable Hard Drive STEV2000400,Personal Computer,http://www.amazon.com/dp/B01E5YIIWS/,1,1
StarTech.com USB C to DisplayPort Cable – 3 ft / 1m – USB-C DisplayPort Cable– USB Type C Monitor Cable – DP to USB C Cable,Personal Computer,http://www.amazon.com/dp/B01E9RTEI8/,1,1
"CableCreation USB 3.1 Type C/Thunderbolt 3 Multiport 4K UHD Adapter, USB-C to USB 3.0/ HDMI/VGA/Mini DisplayPort/Ethernet/Stereo/SD Card/Micro SD Card and USB-C Female Charger Adapter, Gold",PC Accessory,http://www.amazon.com/dp/B01FJPDWCI/,1,1
Satechi Aluminum 2.5-inch USB Type C 3.1 External HDD Hard Drive Disk Enclosure Case with USB C Interface for HDD and SSD (Silver),Personal Computer,http://www.amazon.com/dp/B01FWT2N4E/,1,1
"Satechi Aluminum Multi-Port Adapter 4K HDMI (30Hz), Type-C Pass Through, Gigabit Ethernet, SD/Micro Card Reader, and 3 USB 3.0 Ports For MacBook 12 and New MacBook Pro 2016 (Space Gray)",Personal Computer,http://www.amazon.com/dp/B01FWT7MEA/,4,1
"Satechi Aluminum Multi-Port Adapter 4K HDMI (30Hz), Type-C Pass Through, Gigabit Ethernet, SD/Micro Card Reader, and 3 USB 3.0 Ports For MacBook 12 and New MacBook Pro 2016 (Silver)",Personal Computer,http://www.amazon.com/dp/B01FWT7MEK/,2,1
Samsung 750 EVO - 500GB - 2.5-Inch SATA III Internal SSD (MZ-750500BW),Personal Computer,http://www.amazon.com/dp/B01G844L88/,4,1
"Avotch Digital AV Multi-port Adapter HDMI 4K Output,3.1 Type C Hub with Power Delivery for Charging,Card Reader,3 USB 3.0 Ports for Apple New MacBook 2015 ,2016",PC Accessory,http://www.amazon.com/dp/B01HA9AVX4/,1,1
"Tomtoc 360° Protective Laptop Sleeve for 15 Inch MacBook Pro Retina 2012-2015, Shockproof, Spill-Resistant 15 Inch Ultrabook Netbook Tablet Case Cover, Gray",PC Accessory,http://www.amazon.com/dp/B01HCF15HC/,1,1
"Mini USB 3.0 Type C Flash Drive, 32GB Rotatable Waterproof USB 3.0 & USB Type C Memory Stick for MacBook Android Phones Tablets by ROOFULL(Red)",Office Product,http://www.amazon.com/dp/B01HG8T7AW/,1,1
LG Electronics External Blu-ray/DVD Writer 3D Blu-ray Disc Playback & M-DISC Support (BE16NU50 ),Personal Computer,http://www.amazon.com/dp/B01IP8IBPE/,2,1
"USB C Hub, HooToo USB C Adapter 3.1 with Type C Charging Port, HDMI Output, Card Reader, 3 USB 3.0 Ports for MacBook Pro 2015/2016, Google Chromebook 2016/2017 and more USB C Devices – Rose Gold",Personal Computer,http://www.amazon.com/dp/B01K7C515O/,1,1
"ProtoShield - Soft-Touch Rubberized Hard Case Shell Cover for The New MacBook Pro 15"" Retina Display with Touch Bar A1707 (2016 VERSION) (Black, 15"" A1707)",Office Product,http://www.amazon.com/dp/B01M2CMAOO/,1,1
"MacBook Pro 15 Case 2016, i-Blason Smooth Soft-Touch Matte Frosted Hard Shell Cover for Apple MacBook Pro 15"" inch A1707 with Retina Display 2016 Release fits Touch Bar & Touch ID Ver. (Frost Clear)",Wireless,http://www.amazon.com/dp/B01M4P3E1N/,1,1
"MacBook Pro 13 Case 2016 & 2017, i-Blason Smooth Matte Frosted Hard Shell Cover for Apple MacBook Pro 13"" inch A1706 A1708 with Retina Display 2016&2017 with or W/O Touch Bar & Touch ID (Frost Clear)",Personal Computer,http://www.amazon.com/dp/B01M8O94AD/,1,1
"MacBook Pro 15 Case 2016 & 2017, i-Blason Smooth Matte Frosted Hard Shell Cover for Apple MacBook Pro 15"" inch A1707 with Retina Display 2016&2017 Release fits Touch Bar & Touch ID Ver. (Frost Black)",Wireless,http://www.amazon.com/dp/B01M8O9OSE/,2,1
"ProCase 13 - 13.5 Inch Sleeve Case Cover for Macbook Pro 2016/ Pro with Retina/ Surface Laptop 2017 / Surface Book, Laptop Slim Bag for 13"" 13.3"" Lenovo Dell Toshiba HP ASUS Acer Chromebook -Black",Personal Computer,http://www.amazon.com/dp/B01MDTCGCP/,1,1
"CERTIFIED USB-C Hub CharJenPro USB-C 3.1 HUB / ADAPTER : HDMI 4K, 3 USB 3.0 Ports, Card Readers, Type-C port, All Aluminum-body for Macbook Pro + all type-c laptops (Space Gray)",PC Accessory,http://www.amazon.com/dp/B01MXKJC4M/,2,1
"Anker USB-C to HDMI Adapter, Supports 4K/60Hz, for The New Macbook/Chromebook Pixel and More",Wireless,http://www.amazon.com/dp/B01MYUCWOK/,6,1
Juiced Systems BizHUB USB-C Multiport Gigabit HDMI Hub - 3x USB 3.0 Ports - Gigabit Ethernet - HDMI 4K - SD/Micro SD - USB-C Power Delivery,PC Accessory,http://www.amazon.com/dp/B01N0J5LSY/,1,1
"MacBook Pro 13 Case 2017 & 2016 Release A1706/A1708, ProCase Hard Case Shell Cover and Keyboard Skin Cover for Apple Macbook Pro 13 Inch with/without Touch Bar and Touch ID –Black",PC Accessory,http://www.amazon.com/dp/B01N1JHPEF/,1,1
"AUKEY USB C Hub with Ethernet, 4K HDMI, VGA, 2 USB 3.0, Type C Power Delivery Charging Port for MacBook Pro 2017 iMac, Google Chromebook Pixelbook",PC Accessory,http://www.amazon.com/dp/B06XFD7VF3/,1,1
"Satechi Aluminum Type-C Pro Hub Adapter for 2016/2017 MacBook Pro 13” and 15” 40Gbs Thunderbolt 3, 4k HDMI, Pass-Through Charging, SD/Micro Card Reader and 2 USB 3.0 Ports (Space Gray)",PC Accessory,http://www.amazon.com/dp/B06XRVX3XM/,2,1
"IOGEAR 4-Port HDMI Multimedia KVM Switch with Audio, USB 2.0 Hub and HDMI KVM Cables, GCS1794",CE,http://www.amazon.com/dp/B001V9LQ52/,2,1
"Multi Charger Cable, Acessorz 3 in 1 Mutiple Nylon Braided 3A Charging Cable, USB Type C to Lightning/Micro/Type-C Cable Cord Adapter for Samsung, iPhone, iPad, Micro and Type-c Device (1.2m/4ft)",Wireless,http://www.amazon.com/dp/B07253JRYZ/,1,1
Transcend Information SuperSpeed USB 3.0 Hub (TS-HUB3K),Personal Computer,http://www.amazon.com/dp/B005D69QD8/,1,1
Apple MacBook Pro ME665LL/A 15.4-Inch Laptop with Retina Display (OLD VERSION),Personal Computer,http://www.amazon.com/dp/B007474DSM/,1,1
CORSAIR Vengeance 16GB (2x8GB) 204-Pin DDR3 SO-DIMM DDR3 1600 (PC3 12800) Laptop Memory Model CMSX16GX3M2A1600C10,Personal Computer,http://www.amazon.com/dp/B0076W9Q5A/,3,1
"Accell Mini DisplayPort to DisplayPort 1.2 Cable with Locking Latch - 6.6 Feet (2 Meters), White, DP 1.2 supports 4K UHD, 1080p, and 3D video up to 2560x1600@60Hz",Speakers,http://www.amazon.com/dp/B00A7R9I22/,8,1
Transcend 128GB JetDrive Lite 350 Storage Expansion Card for 15-Inch MacBook Pro with Retina Display (TS128GJDL350),Personal Computer,http://www.amazon.com/dp/B00K73NT1C/,3,1
