name,category,amazon_link,total_mentions,subreddit_mentions
Nerf N-Strike Elite Stryfe Blaster,Toys & Games,https://www.amazon.com/Nerf-N-Strike-Stryfe-Blaster-Colors/dp/B009T45XNM,3,1
Nerf N-Strike Exclusive Elite Alpha Trooper CS-12,Toys & Games,https://www.amazon.com/Nerf-N-Strike-Exclusive-Elite-Trooper/dp/B00DGAXFJY/,1,1
Nerf N-Strike Elite Retaliator Blaster (Colors May Vary),Toys & Games,https://www.amazon.com/Nerf-N-Strike-Retaliator-Blaster-Colors/dp/B00DW1JT88,1,1
Hasbro Nerf N-Strike Elite XD Rapidstrike CS-18,Toys & Games,https://www.amazon.com/Hasbro-N-Strike-Elite-Rapidstrike-CS-18/dp/B00OR1FWQU,1,1
BCW 1/4 Inch Acrylic Card Holder,Sports & Outdoors,https://www.amazon.com/dp/B000X2BFJU/ref=cm_sw_r_cp_api_9cl9yb02SX8QP,1,1
Rasta Imposta Chili Pepper Costume,"Clothing, Shoes & Jewelry",https://www.amazon.com/Rasta-Imposta-Chili-Pepper-Costume/dp/B00C3DI626,1,1
