name,category,amazon_link,total_mentions,subreddit_mentions
Magic: The Complete Course,Books,https://www.amazon.com/Magic-Complete-Course-Joshua-Jay/dp/0761149872,2,1
By Mark Wilson Mark Wilson's Complete Course in Magic (Fifth or Later Edition),Books,https://www.amazon.com/Wilson-Wilsons-Complete-Course-Magic/dp/B00N4EDQZ0/ref=sr_1_6?ie=UTF8&amp;qid=1479024232&amp;sr=8-6&amp;keywords=mark+wilson+course+magic,1,1
Accmor AC-13TR 18-50-Inch Self-Portrait Extendable Monopod for iOS & Android Phone Bundle with Tripod Stand & Bluetooth Remote Shutter,Electronics,https://www.amazon.com/Accmor-18-50-Inch-Self-Portrait-Extendable-Bluetooth/dp/B00RTHU5BG/ref=sr_1_2?s=electronics&amp;ie=UTF8&amp;qid=1501827943&amp;sr=1-2&amp;keywords=cell+phone+monopod,1,1
Magic For Dummies,Books,https://www.amazon.com/Magic-Dummies-David-Pogue/dp/0764551019,1,1
Magic Cup With Balls,Toys & Games,https://www.amazon.com/Magic-Cup-With-Balls/dp/B00362S0II,1,1
"Fantaseal Ergonomic Cell Phone Smartphone Holder, iPhone Android Phone Selfie Stick Hand Grip Stabilizer Handheld Mount Phone Handle Support Steadycam for iPhone X Nexus LG HTC Huawei Samsung etc",Electronics,https://www.amazon.com/Fantaseal-Ergonomic-Smartphone-Stabilizer-Cellphone/dp/B01M3VRD5Y/ref=sr_1_1?ie=UTF8&amp;qid=1501827802&amp;sr=8-1&amp;keywords=cell+phone+stabilizer,1,1
"JOBY GripTight GorillaPod Stand - Flexible Universal Smartphone Stand for Small Smartphones including iPhone 6, iPhone 7 and iPhone 8",Electronics,https://www.amazon.com/GripTight-GorillaPod-Universal-Smartphone-Smartphones/dp/B009GHYMB6/ref=sr_1_3?ie=UTF8&amp;qid=1501827736&amp;sr=8-3&amp;keywords=joby,1,1
Magic and Showmanship: A Handbook for Conjurers (Dover Magic Books),Books,https://www.amazon.com/Magic-Showmanship-Handbook-Conjurers-Dover/dp/0486410870,1,1
Modern Coin Magic By Magic Makers 170 Coin Tricks & Moves,Toys & Games,https://www.amazon.com/Modern-Magic-Makers-Tricks-Moves/dp/B000JQQKJA,1,1
Strong Magic by Darwin Ortiz - Book,Toys & Games,https://www.amazon.com/Strong-Magic-Creative-Showmanship-Close-Up/dp/B00534I956,1,1
Magic by Misdirection,Books,https://www.amazon.com/Magic-Misdirection-Dariel-Fitzkee/dp/1614278563/,1,1
Ideal 100-Trick Spectacular Magic Show Suitcase,Toys & Games,https://www.amazon.com/Ideal-100-Trick-Spectacular-Magic-Suitcase/dp/B000PWNGV8,1,1
Bicycle Fuchsia Playing Cards with New Box Design,Toys & Games,https://www.amazon.com/Bicycle-Fuchsia-Playing-Cards-Design/dp/B004OAZ2GY,1,1
Woolly Nylon Thread Solids 1000 Meters-Black,"Arts, Crafts & Sewing",https://www.amazon.com/gp/product/B0053BSYJA/ref=oh_aui_detailpage_o05_s00?ie=UTF8&amp;psc=1,1,1
Grand Illusions - The Story of Magic,Movies & TV,https://www.amazon.com/Grand-Illusions-Story-Wilson-Coneybeare/dp/B00008975I,1,1
Big Magic for Little Hands: 25 Astounding Illusions for Young Magicians,Books,https://www.amazon.com/Big-Magic-Little-Hands-Astounding/dp/0761180095,1,1
Practical Mental Magic (Dover Magic Books),Books,https://www.amazon.com/Practical-Mental-Magic-Dover-Books/dp/0486244261/ref=sr_1_3?ie=UTF8&amp;qid=1485796593&amp;sr=8-3&amp;keywords=annemann,1,1
Mark Wilson's Complete Course in Magic,Books,https://www.amazon.com/Mark-Wilsons-Complete-Course-Magic/dp/0762414553,1,1
