name,category,amazon_link,total_mentions,subreddit_mentions
Ideal 100-Trick Spectacular Magic Show Suitcase,Toy,http://www.amazon.com/dp/B000PWNGV8/,2,2
Wilton Silver Color Mist,Kitchen,http://www.amazon.com/dp/B005KTVG86/,35,1
Magic: The Complete Course,Book,http://www.amazon.com/dp/0761149872/,2,1
By Mark Wilson Mark Wilson's Complete Course in Magic (Fifth or Later Edition),Book,http://www.amazon.com/dp/B00N4EDQZ0/,1,1
"Fantaseal Ergonomic Cell Phone Smartphone Holder, iPhone Android Phone Selfie Stick Hand Grip Stabilizer Handheld Mount Phone Handle Support Steadycam for iPhone X Nexus LG HTC Huawei Samsung etc",CE,http://www.amazon.com/dp/B01M3VRD5Y/,1,1
Magic For Dummies,Book,http://www.amazon.com/dp/0764551019/,1,1
Magic Cup With Balls,Toy,http://www.amazon.com/dp/B00362S0II/,1,1
"JOBY GripTight GorillaPod Stand - Flexible Universal Smartphone Stand for Small Smartphones including iPhone 6, iPhone 7 and iPhone 8",Photography,http://www.amazon.com/dp/B009GHYMB6/,1,1
Accmor AC-13TR 18-50-Inch Self-Portrait Extendable Monopod for iOS & Android Phone Bundle with Tripod Stand & Bluetooth Remote Shutter,Wireless,http://www.amazon.com/dp/B00RTHU5BG/,1,1
Magic and Showmanship: A Handbook for Conjurers (Dover Magic Books),Book,http://www.amazon.com/dp/0486410870/,1,1
Modern Coin Magic By Magic Makers 170 Coin Tricks & Moves,Toy,http://www.amazon.com/dp/B000JQQKJA/,1,1
Magic by Misdirection,Book,http://www.amazon.com/dp/1614278563/,1,1
Strong Magic by Darwin Ortiz - Book,Toys & Games,https://www.amazon.com/Strong-Magic-Creative-Showmanship-Close-Up/dp/B00534I956,1,1
Big Magic for Little Hands: 25 Astounding Illusions for Young Magicians,Book,http://www.amazon.com/dp/0761180095/,1,1
Bicycle Fuchsia Playing Cards with New Box Design,Toy,http://www.amazon.com/dp/B004OAZ2GY/,1,1
Woolly Nylon Thread Solids 1000 Meters-Black,"Arts, Crafts & Sewing",https://www.amazon.com/gp/product/B0053BSYJA/ref=oh_aui_detailpage_o05_s00?ie=UTF8&amp;psc=1,1,1
Grand Illusions - The Story of Magic,DVD,http://www.amazon.com/dp/B00008975I/,1,1
Mark Wilson's Complete Course in Magic,Book,http://www.amazon.com/dp/0762414553/,1,1
Practical Mental Magic (Dover Magic Books),Book,http://www.amazon.com/dp/0486244261/,1,1
