name,category,amazon_link,total_mentions,subreddit_mentions
"Baxter of California Clay Pomade, 2 fl. oz.",Prestige Beauty,http://www.amazon.com/dp/B000MIKEZQ/,3,3
Paul Mitchell Matterial Strong Hold Ultra Matte Styling Clay 3 oz,Beauty,http://www.amazon.com/dp/B011BCI87W/,2,2
Pravana Vivids Mood Heat Activated Hair Color Kit - New!,Beauty,http://www.amazon.com/dp/B0756L8V2N/,3,1
"Got2B Glued Spiking Glue, Styling, Original, 6 oz.",Beauty,http://www.amazon.com/dp/B000142OC2/,3,1
TRESemme Thermal Creations Heat Tamer Protective Spray 8 fl oz (236 ml),Beauty,http://www.amazon.com/dp/B000H88QOM/,2,1
Shea Moisture Raw Shea Butter Restorative Conditioner 13 oz,Beauty,http://www.amazon.com/dp/B0097OXE4O/,2,1
"ArtNaturals Argan Oil Hair Mask - Deep Conditioner, 100% Organic Jojoba, Aloe Vera and Keratin, Repair Dry, Damaged or Color Treated Hair after Shampoo for All Hair Types, Sulfate Free, 8 oz.",Beauty,http://www.amazon.com/dp/B012P4D5XM/,2,1
"TIGI Bed Head B for Men Matte Separation Workable Wax, 3 Ounces",Beauty,http://www.amazon.com/dp/B002N5MI2S/,2,1
"Layrite Cement Matte Hair Clay, 4.25 oz.",Prestige Beauty,http://www.amazon.com/dp/B00UM4ZDCY/,2,1
"Tresemme Thermal Creations Volumising Mousse, 6.5 Ounce",Beauty,http://www.amazon.com/dp/B0019J4R6Y/,2,1
Keune Care Line Man Matte Effect 100ml/3.4oz,Beauty,http://www.amazon.com/dp/B003JC1424/,2,1
"L'Oreal Professionnel Homme Force 3 Sculpte Sculpting Fibre Paste Unisex, 5 Ounce",Beauty,http://www.amazon.com/dp/B002PLO7KG/,1,1
"KMS California Hairplay Sea Salt Hair Spray, 6.8 oz/200ml",Beauty,http://www.amazon.com/dp/B005JDPKZI/,1,1
"D:fi D:Struct Molding Creme, 5.3 Ounce",Beauty,http://www.amazon.com/dp/B00E5JXYLO/,1,1
"OGX Hair Spray Moroccan Sea Salt, (1) 6 Ounce Spray Bottle, paraben Free, Sustainable Ingredients, Texturizing Spray for Increased Waves, Weightless Leave-In Formula",Beauty,http://www.amazon.com/dp/B00BB3JZJW/,1,1
"OGX Weightless Hydrating Oil Mist Nourishing Coconut Oil, (1) 4 Ounce Spray Bottle, Paraben Free, Sulfate Free, Sustainable Ingredients, Hydrating and Softening",Beauty,http://www.amazon.com/dp/B00B7W8VPQ/,1,1
Hanz de Fuko Claymation by Hanz de Fuko,Beauty,http://www.amazon.com/dp/7178679743/,1,1
"Remington AC9096 Silk Ceramic Ionic AC Professional Hair Dryer, Red",Beauty & Personal Care,https://www.amazon.com/gp/product/B00BB8ZIW0/ref=oh_aui_detailpage_o02_s01?ie=UTF8&amp;psc=1,1,1
Spornette No.314 Deville Hair Brush,Beauty,http://www.amazon.com/dp/B003LSEQPI/,1,1
"L'Oréal Paris Elnett Satin Extra Strong Hold Hairspray - Unscented, 11 oz.",Beauty,http://www.amazon.com/dp/B006DWF3F6/,1,1
Scentsiv Unscented Fragrance Free Hair Styling Wax,Beauty,http://www.amazon.com/dp/B00I111SU6/,1,1
"Moroccan Argan Oil Shampoo with Restorative Formula 16 fl. oz. Gentle & Sulfate Free for All Hair Types. Cleanses, Revives, Hydrates, Detangles Hair & Revitalizes the Scalp & Split-Ends",Beauty,http://www.amazon.com/dp/B017O34AWE/,1,1
"AXE Messy Look Hair Paste, Flexible 2.64 oz (Pack of 3)",Beauty,http://www.amazon.com/dp/B001FSK8SK/,1,1
"Axe  Styling Cream, Natural, Understated Look, 2.64Ounce (Pack of 2)",Beauty,http://www.amazon.com/dp/B004DBXL7G/,1,1
"D:fi Extreme Cream, 2.6 Ounce",Beauty & Personal Care,https://www.amazon.com/Extreme-Hold-Styling-Cream-2-6/dp/B000H30FHS/ref=sr_1_3?ie=UTF8&amp;qid=1435246403&amp;sr=8-3&amp;keywords=defi+hair,1,1
Specialist Premium Sea Buckthorn Oil by Specialist,Beauty,http://www.amazon.com/dp/B003JN8PNO/,1,1
Sweet Georgia Brown Hair Dressing Pomade RED 4 oz,Beauty,http://www.amazon.com/dp/B002KQ87UM/,1,1
"Kirkland  Minoxidil 5% Extra Strength Hair Regrowth for Men, 6 Month Supply",Beauty,http://www.amazon.com/dp/B002VLZHLI/,1,1
K + S Men’s Hair Conditioner – Stylist-Level Hair Care Products for Men - Infused with Peppermint Oil for All hair types (16 oz Bottle),Beauty,http://www.amazon.com/dp/B00JBE18H0/,1,1
Bayolea by Penhaligon's Hair Pomade 3.3 oz,Beauty,http://www.amazon.com/dp/B00N1MYR3K/,1,1
Magic Mohican NEW men hair setting - Make Your Hair Style Easily,Beauty,http://www.amazon.com/dp/B005VAAR7K/,1,1
"Kevin Murphy Easy Rider Anti Frizz Flexible Hold Cream, 3.4 Ounce",Beauty,http://www.amazon.com/dp/B001DCL4XQ/,1,1
Philip B Nordic Wood 1 Step Hair & Body 11.8-Ounces,Prestige Beauty,http://www.amazon.com/dp/B000X1LRAI/,1,1
"Clubman Pinaud Virgin Island Bay Rum, 12 Ounce",Beauty & Personal Care,https://www.amazon.com/Pinaud-Clubman-Virgin-Island-Bay/dp/B003YJ8LF0/ref=sr_1_1?ie=UTF8&amp;qid=1426359627&amp;sr=8-1&amp;keywords=bay+rum,1,1
Conair Tooth Lift Comb Wide For Thich Hair (6-Pack),Health and Beauty,http://www.amazon.com/dp/B004R7IZGI/,1,1
