name,category,amazon_link,total_mentions,subreddit_mentions
Twitter and Tear Gas: The Power and Fragility of Networked Protest,Book,http://www.amazon.com/dp/0300215126/,1,1
"Why People Believe Weird Things: Pseudoscience, Superstition, and Other Confusions of Our Time",Book,http://www.amazon.com/dp/0805070893/,20,1
"Rust-Oleum 1913830 Chalkboard Spray, Black, 11-Ounce",Home Improvement,http://www.amazon.com/dp/B000RMPLJ6/,1,1
"Springer Atlas SN2 Lightweight Warp Proof Drawing Board, 18"" Length x 24"" Width, 1/4"" Thickness, High Grade Masonite",BISS,http://www.amazon.com/dp/B0042SWQ62/,1,1
Crayola 12 Count Sidewalk Chalk,Toy,http://www.amazon.com/dp/B00AHAJGZ8/,2,1
"Liquid Chalk Markers - Set of 8 Reversible Tip Paint Pens Vivid Bright Neon Colors and White , 6mm Dual Tip",Art and Craft Supply,http://www.amazon.com/dp/B01GIQF1DU/,1,1
