name,category,amazon_link,total_mentions,subreddit_mentions
"The Marine Biology Coloring Book, Second Edition",Book,http://www.amazon.com/dp/006273718X/,2,1
The Cultural Lives of Whales and Dolphins,Book,http://www.amazon.com/dp/022632592X/,1,1
Cetacean Societies: Field Studies of Dolphins and Whales,Book,http://www.amazon.com/dp/0226503410/,1,1
National Audubon Society Guide to Marine Mammals of the World (National Audubon Society Field Guide),Book,http://www.amazon.com/dp/0375411410/,1,1
Ocean: The World's Last Wilderness Revealed,Book,http://www.amazon.com/dp/0756636922/,2,1
Between Pacific Tides: Fifth Edition,Book,http://www.amazon.com/dp/0804720681/,1,1
The Lady Tasting Tea: How Statistics Revolutionized Science in the Twentieth Century,Book,http://www.amazon.com/dp/0805071342/,7,1
"Kraken: The Curious, Exciting, and Slightly Disturbing Science of Squid",Book,http://www.amazon.com/dp/0810984652/,2,1
Lost Antarctica: Adventures in a Disappearing Land (MacSci),Book,http://www.amazon.com/dp/1137278889/,1,1
War of the Whales: A True Story,Book,http://www.amazon.com/dp/1451645015/,1,1
"100 PERFECT VISION BLACK MOUNTING HOLE CABLE TIE ZIP WRAPS 7"" SATELLITE/CABLE CT7BLK-MH",Personal Computer,http://www.amazon.com/dp/B00XUYJZBI/,1,1
