name,category,amazon_link,total_mentions,subreddit_mentions
The Princeton Review Complete MCAT: New for MCAT 2015 (Graduate School Test Preparation),Book,http://www.amazon.com/dp/0804125082/,4,4
"Princeton Review MCAT Subject Review Complete Box Set, 2nd Edition: 7 Complete Books + Access to 3 Full-Length Practice Tests",Book,http://www.amazon.com/dp/045148715X/,1,1
MCAT Psychology and Sociology Review: New for MCAT 2015 (Graduate School Test Preparation),Book,http://www.amazon.com/dp/0804124736/,1,1
MCAT Critical Analysis and Reasoning Skills Review: New for MCAT 2015 (Graduate School Test Preparation),Book,http://www.amazon.com/dp/0804125031/,1,1
Learn to Relax : A Practical Guide to Easing Tension and Conquering Stress,Book,http://www.amazon.com/dp/0811819086/,1,1
"The Princeton Review MCAT, 2nd Edition: Total Preparation for Your Top MCAT Score (Graduate School Test Preparation)",Book,http://www.amazon.com/dp/1101920548/,1,1
MCAT Complete 7-Book Subject Review: Online + Book (Kaplan Test Prep),Book,http://www.amazon.com/dp/1506205593/,1,1
MCAT Complete 7-Book Subject Review 2018-2019: Online + Book (Kaplan Test Prep),Book,http://www.amazon.com/dp/1506223958/,2,1
9th Edition Examkrackers MCAT Complete Study Package,Book,http://www.amazon.com/dp/1893858707/,1,1
"9th Edition Examkrackers MCAT Reasoning Skills:Verbal, Research & Math",Book,http://www.amazon.com/dp/1893858715/,1,1
10th Edition Examkrackers MCAT Reasoning Skills,Book,http://www.amazon.com/dp/1893858898/,1,1
"The Miracle Cube Timer, 5, 15, 30 and 60 Minutes, for Time Management, Kitchen Timer, Kids Timer, Workout Timer, White",Health and Beauty,http://www.amazon.com/dp/B0002U72LS/,6,1
"Gunnar Optiks PPK-00101 PPK Full Rim Advanced Video Gaming Glasses with Headset Compatibility and Amber Lens Tint, Gloss Onyx Frame Finish",Personal Computer,http://www.amazon.com/dp/B004FN1AES/,1,1
"The Health Care Handbook: A Clear and Concise Guide to the United States Health Care System, 1st Edition",eBooks,http://www.amazon.com/dp/B0088CMAUU/,2,1
"3M E-A-R Classic Earplugs 310-1060, Uncorded in Pillow Pack (1 pair per pillow pack, 30 pair per box)",BISS,http://www.amazon.com/dp/B008MCTLJE/,4,1
"Depend FIT-FLEX Incontinence Underwear for Women, Maximum Absorbency, S/M, 60 Count",Health and Beauty,http://www.amazon.com/dp/B008RJV0KK/,2,1
Sennheiser Momentum Headphone - Brown,Speakers,http://www.amazon.com/dp/B009QV15DU/,9,1
The Official Guide to the MCAT Exam (MCAT2015),eBooks,http://www.amazon.com/dp/B00MY67L1E/,1,1
What is a p-value anyway? 34 Stories to Help You Actually Understand Statistics,Book,http://www.amazon.com/dp/0321629302/,1,1
MCAT 2015 Science Workbook,Book,http://www.amazon.com/dp/B01AZW8PGS/,1,1
