name,category,amazon_link,total_mentions,subreddit_mentions
Universal Lazy Bed Desktop Car Mount Kit Holder for All Smartphone Iphone Galaxy,Wireless,http://www.amazon.com/dp/B00BCBRA4K/,1,1
Realforce 87U Tenkeyless 55g (Black),PC Accessory,http://www.amazon.com/dp/B00MV84Y2Y/,1,1
CM Storm QuickFire XT - Full Size Mechanical Gaming Keyboard with CHERRY MX Blue Switches,Personal Computer,http://www.amazon.com/dp/B00DKXXABK/,1,1
Canon DK10i Desktop Calculator with USB Cable,CE,http://www.amazon.com/dp/B0002W01FA/,1,1
KUL ES-87 Tenkeyless Mechanical Keyboard (Cherry MX Brown),PC Accessory,http://www.amazon.com/dp/B00KI1ZAHY/,1,1
LCD Mini Data Terminal 20 Key USB Serial Full Travel Keys Prog,CE,http://www.amazon.com/dp/B000WBNB3K/,1,1
Little Tikes: kidBoard - PC,Video Games,https://www.amazon.com/Little-Tikes-kidBoard-PC/dp/B00002NDQY/ref=redir_mobile_desktop?_encoding=UTF8&ref=olp_product_details,1,1
Dell 2GR91 Slim USB 104-Key Keyboard with Fold-out Feet for Select Dell Models (Black),PC Accessory,http://www.amazon.com/dp/B008C4JA66/,1,1
"Black 3M DI-NOC Carbon Fiber DINOC Flex Wrap CA-421 24""x12""",Automotive Parts and Accessories,http://www.amazon.com/dp/B0062A7M2G/,1,1
Steel Series SteelKeys 6G Gaming Keyboard ( 20071 ),CE,http://www.amazon.com/dp/B000IC2JEU/,1,1
iQunix Lambo 60% Mechanical Keyboard Case Solid Aluminum CNC Keyboard Shell Compatible with Lambo62 Poker2 Pok3r Only Shell Black,CE,http://www.amazon.com/dp/B016ICZC9W/,1,1
"Metal USB Adapter Gaming Keyboard Mechanical Feelling LED Backlight Media keys Keyboards with Rainbow Backlit, 19 Non-conflict Keys for Game Office(Black)",Wireless,http://www.amazon.com/dp/B01N7MWRUE/,1,1
10pcs Dust Cover Guard Protector for 16mm Dia Push Button Switch,Home Improvement,http://www.amazon.com/dp/B00H8TQS5M/,1,1
Happy Hacking Keyboard Lite2 USB (Black),Personal Computer,http://www.amazon.com/dp/B0000U1DJ2/,1,1
Zipper Bags Poly Cloth Value Package of 2 Bags (Burgundy),Office Product,http://www.amazon.com/dp/B00Y1J8NMS/,1,1
"DREVO Calibur 71-Key RGB LED Backlit Wireless Bluetooth 4.0 Mechanical Keyboard (Brown Switch, White)",Personal Computer,http://www.amazon.com/dp/B0749CFD42/,1,1
"Lifetime Jewelry Cuban Link Chain 9MM, Round, 24K Gold with Inlaid Bronze, Fashion Jewelry Necklaces, Guaranteed for Life, 20 Inches",Jewelry,http://www.amazon.com/dp/B017IAU4AK/,1,1
LU-CC 180Pcs M2 Black Nylon Spacers Hex Nut Screw Stand-off Plastic Accesories Assortment Kit,Home Improvement,http://www.amazon.com/dp/B01DMJVQVC/,1,1
Pressure Increasing Springs(+10g) For Electrostatic Capacitive Keyboards (30PCS),Sports,http://www.amazon.com/dp/B06ZXSN2XT/,1,1
"OMorc 6-in-1 60W Soldering Iron Kit - Adjustable Temperature, 5pcs Different Tips, Desoldering Pump,Stand, anti-static Tweezers and Solder Wire",Home Improvement,http://www.amazon.com/dp/B01HSXVR3A/,1,1
SUNKEE 100pcs 1N4148 IN4148 DO-35 switching signal Doide,CE,http://www.amazon.com/dp/B0149K5WH2/,1,1
PFU Happy Hacking Keyboard Professional2 Type-S PD-KB400WNS English keypad-less,PC Accessory,http://www.amazon.com/dp/B008GXT6SK/,1,1
"The ""Nearly"" Universal OH - Cup or Drink Holder",Health and Beauty,http://www.amazon.com/dp/B001YJGDY8/,1,1
"TCBunny 3D Carbon Fiber Vinyl Film Wrap Sticker Sheet, Black - 12 Inch x 60 Inch",Automotive Parts and Accessories,http://www.amazon.com/dp/B0059XCVVO/,1,1
120 * Gateron KS-3 Mechanical MX type Key Switch - clear top [ Black 50g Linear],Personal Computer,http://www.amazon.com/dp/B00YKLK1L8/,1,1
"SE TW-7WB Black Oxidized Non-Magnetic Tweezers Set with Wooden Storage Box, 6-Piece",Home Improvement,http://www.amazon.com/dp/B00C1MF5Q4/,1,1
Alpha Fry AM62964 Cookson Elect Lead-Free Rosin Core Solder,Home Improvement,http://www.amazon.com/dp/B000G35MX6/,1,1
Teensy 2.0,BISS,http://www.amazon.com/dp/B00NC43256/,1,1
"LyonsBlue Desoldering Vacuum Pump ""Solder Sucker"" Solder Removal Tool",Home Improvement,http://www.amazon.com/dp/B003FHYL7I/,1,1
"US Art Supply 24"" x 36"" GREEN/BLACK Professional Self Healing 5-Ply Double Sided Durable Non-Slip PVC Cutting Mat Great for Scrapbooking, Quilting, Sewing and all Arts & Crafts Projects",Art and Craft Supply,http://www.amazon.com/dp/B00L5I8RTW/,1,1
"Music Wire Compression Spring, Steel, Inch, 0.12"" OD, 0.014"" Wire Size, 0.32"" Compressed Length, 0.62"" Free Length, 1.23 lbs Load Capacity, 4.1 lbs/in Spring Rate (Pack of 10)",BISS,http://www.amazon.com/dp/B005KUIBWO/,1,1
DecoBros Mesh Desk Organizer with Double Tray and 5 Upright Sections,Office Product,http://www.amazon.com/dp/B00H5D9J5M/,1,1
"Great Planes Segmented Lead Weights, 6-Ounce",Hobby,http://www.amazon.com/dp/B0015KLJE0/,1,1
"SF Cable, AT Keyboard Cable Adapter, PS/2 (MiniDin6) Male to Din5 Female (6 inches)",Personal Computer,http://www.amazon.com/dp/B0016RTO1M/,1,1
iQunix Lambo 60% Mechanical Keyboard Case Solid Aluminum CNC Keyboard Shell Compatible with Lambo62 Poker2 Pok3r Only Shell Silver,Musical Instruments,http://www.amazon.com/dp/B016ICZC7Y/,1,1
ADESSO AKP-220B Adesso 22 Key Mechanical USB Numeric Keypad - USB and PS/2,Personal Computer,http://www.amazon.com/dp/B0038KN3YY/,1,1
Grifiti Fat Wrist Pad Massdrop Ergodox 2 Piece Set About 6.5 x 4.2 x 0.75 Inch Mirror Image Wrist Rests for Ergodox and Infinity Keyboard Sets (Black Nylon),Office Product,http://www.amazon.com/dp/B01HQXD5OG/,1,1
Stahl Tools SSVT Variable Temperature Soldering Station,Home Improvement,http://www.amazon.com/dp/B0029N70WM/,1,1
Mechanical Keyboard Gaming Keyboard GATERON Blue Switch Wired Backlit Mechanical Mini Design (60%) 68 Keys Keyboard White Silver Magicforce by Qisan,PC Accessory,http://www.amazon.com/dp/B01J708CCG/,1,1
"Click, Clack, Moo: Cows That Type (A Click, Clack Book)",Book,http://www.amazon.com/dp/1442433701/,1,1
40 Volume Clear Developer,Beauty,http://www.amazon.com/dp/B004OKDW5W/,1,1
"Nixeus MODA Mechanical Switch, Soft Tactile Feedback Keyboard for Windows & Mac (MK-BN14)",Personal Computer,http://www.amazon.com/dp/B00L1TLINC/,1,1
"Lindy 2m USB 2.0 Coiled Cable, Type A to mini B, Transparent (31925)",Personal Computer,http://www.amazon.com/dp/B003BMS5LK/,1,1
"Under Armour Men's 3"" Performance Wristbands, Black/White, One Size",Sports,http://www.amazon.com/dp/B00Z83ZEVY/,1,1
"Pictek PPC023B-PTUS Water-Resistant Mechanical Gaming Keyboard with Blue Switch, Key Cap Puller - Black",Personal Computer,http://www.amazon.com/dp/B01EAFSTCQ/,1,1
Gigabyte GK-FORCE K7 Stealth Gaming Keyboard (GK-FORCE K7),Personal Computer,http://www.amazon.com/dp/B00F5VCV60/,1,1
GH60 Solid Wooden Case Wrist Rest For 60% Mini Mechanical Gaming Keyboard Compatible Poker2 Pok3r Faceu 60 (Yellow Rosewood),PC Accessory,http://www.amazon.com/dp/B06ZYBSSBD/,1,1
Tenma 21-8240 Vacuum Desoldering Iron,BISS,http://www.amazon.com/dp/B008DJRYIG/,1,1
"CHERRY Compact Keyboard with USB Interface and Touchpad - 106 Keys, 14"" Wide, Black",BISS,http://www.amazon.com/dp/B0012FIAWW/,1,1
"6pc Hollow Punch 1/8 to 5/16"" Leather Fabric Paper",Art and Craft Supply,http://www.amazon.com/dp/B004BQW4MQ/,1,1
"Kupx Thick Extended Edition Cloth Gaming Mouse Mat with Non-slip Rubber Base and Black Edge, 23.6x11.8x0.08-Inch",Office Product,http://www.amazon.com/dp/B015DY6C40/,1,1
DREVO Calibur 71-Key RGB LED Backlit Wireless Bluetooth 4.0 / Wired USB Gaming Mechanical Keyboard Brown Switch-Black,Personal Computer,http://www.amazon.com/dp/B01N0QAB3V/,1,1
Das Keyboard Model S Professional Clicky MX Blue Mechanical Keyboard (DASK3MKPROCLI),Personal Computer,http://www.amazon.com/dp/B008PFABI8/,1,1
"Mechanical Keyboard HAVIT Backlit Wired Gaming Keyboard Extra-Thin & Light, Kailh Latest Low Profile Blue Switches, 87 Keys N-key Rollover HV-KB390L (Black)",PC Accessory,http://www.amazon.com/dp/B0722GG88M/,1,1
Fascinations Metal Earth Apollo Lunar Module 3D Metal Model Kit,Toy,http://www.amazon.com/dp/B00JMQR448/,1,1
Hakko FR300-05/P Desoldering Tool,BISS,http://www.amazon.com/dp/B00KWM69C4/,1,1
"Makermat ""The Terminal"" 31.4""x19.7""x0.2"" | Linux Desk Mat & Pro-mouse Pad | File System & CLI Reference",Home,http://www.amazon.com/dp/B00MGBN1PC/,1,1
Auawak Rapoo KX 5G Wireless Programmable Smart Backlit LED Mechanical Keyboard With 1.5mm Trigger Stroke MX Yellow Switches for Laptops Desktops PC - White,PC Accessory,http://www.amazon.com/dp/B00NITL8B0/,1,1
AGPtek® Electroplating Sliver Keyset Zinc CS 8 Cherry MX Keycaps for Metal Mechanical Keyboard,Electronics,https://www.amazon.com/Keyset-Silver-Keycaps-mechanical-keyboard/dp/B00Q8DVU0W/ref=sr_1_cc_6?s=aps&amp;ie=UTF8&amp;qid=1420879057&amp;sr=1-6-catcorr&amp;keywords=zinc+keycaps,1,1
StarTech Mini USB Cable - A to Right Angle Mini B - 3 Feet (USB2HABM3RA),CE,http://www.amazon.com/dp/B004W8EIMW/,1,1
"Leopold ""Mini"" 66-key Electrostatic Capacitive Keyboard",PC Accessory,http://www.amazon.com/dp/B00EI52VCS/,1,1
Matias Tactile Pro Keyboard for Mac,Personal Computer,http://www.amazon.com/dp/B003N3HFI6/,1,1
"Sound Blocker Ear Plugs for Sleeping - Can Help You Sleep Through Snoring. Best Hearing Protection for Shooting, Motorbiking, DIY & Loud Concerts. 30 Pair Individually Wrapped Reusable 33NRR Earplugs",Health and Beauty,http://www.amazon.com/dp/B00ZU2VIR2/,1,1
Topre Type Heaven 104-key Keyboard,Personal Computer,http://www.amazon.com/dp/B00DGJALYW/,1,1
Sanvn CNC 3020t Rouer Engraver Drilling/milling Engraving Machine Wood / PCB Hot Selling 3 Axis Router Desktop Router Machine,Home,http://www.amazon.com/dp/B00DFSLOJK/,1,1
YCS Basics 1 foot USB micro male to USB mini female adapter cable,Speakers,http://www.amazon.com/dp/B00D8O8YCG/,1,1
Lightning to USB Camera Adapter,Personal Computer,http://www.amazon.com/dp/B014VGHG0U/,1,1
uxcell AC 660V 10A 40mm Red Sign Emergency Stop Switch Push Button Mushroom PushButton,BISS,http://www.amazon.com/dp/B00FLZ739A/,1,1
"Korlon 100pcs Car Motorcycle Bicycle Skateboard Laptop Luggage Vinyl Sticker Graffiti Laptop Luggage Decals Bumper Stickers, 100 Pieces",Automotive Parts and Accessories,http://www.amazon.com/dp/B01A6QRT2Y/,1,1
"Cooler Master MasterKeys Pro L RGB Mechanical Gaming Keyboard, Cherry MX Blue Switches, Per-Key RGB Lighting, Full Size",Personal Computer,http://www.amazon.com/dp/B01D3BDNF6/,1,1
Pixnor 20 Pcs Stainless Steel Green Crowded Mud Machine Polymer Clay Fimo Extruder Craft Gun Cake Fondant Sculpture Decorating Tool Set,Art and Craft Supply,http://www.amazon.com/dp/B01E3U5VBK/,1,1
CCTKB - Chester Creek Technologies KinderBoard,PC Accessory,http://www.amazon.com/dp/B000OCV8X2/,1,1
Bossi white color 104 keys PBT Double-shot keycaps replacement mechanical keycaps for cherry mechanical MX switch keyboards,PC Accessory,http://www.amazon.com/dp/B01IBM92GQ/,1,1
LIEBIRD Cool Cat Extended Xxxl Gaming Mouse Pad - 31.5Lx11.8Wx0.12H - Portable with Extended XXL Size - Non-slip Rubber Base - Special Treated Textured Weave with Precision Control,PC Accessory,http://www.amazon.com/dp/B01MQ5AGPN/,1,1
"IRWIN VISE-GRIP Original Curved Jaw Locking Pliers with Wire Cutter, 10"", 502L3",Home Improvement,http://www.amazon.com/dp/B00004YO5M/,1,1
SUNKEE 100x Dupont Jumper Wire Cable Female Pin Connector 2.54mm,BISS,http://www.amazon.com/dp/B00CGWVFWW/,1,1
"Cooler Master MasterKeys Pro L RGB Mechanical Gaming Keyboard, Cherry MX Brown Switches, Per-Key RGB Lighting, Full Size",Personal Computer,http://www.amazon.com/dp/B01D3BDN60/,1,1
"Aoyue 937+ 45 Watt Programmable Digital Soldering Station-ESD Safe, C/F Switchable, Configurable Iron Holder, Spare Plug-in Heating Element",Home Improvement,http://www.amazon.com/dp/B000I30QBW/,1,1
"Akwox 9-Key Cherry MX Switch Tester, Keycap puller, keyboard Keycap, O-Ring Sampler Tester Kit",Wireless,http://www.amazon.com/dp/B01GZHU1EG/,1,1
"Rampow USB Cable [6.5ft] Braided Micro USB Cable/Samsung Charging Cable - Android Cable for Galaxy S7/S6, Sony, Motorola and More - Red & Black",Wireless,http://www.amazon.com/dp/B01H2W0576/,1,1
"DREVO 84-Key Gramr Mechanical Keyboard with Backlit Mechanical Gaming Keyboard Blue Switch, Black",Electronics,https://www.amazon.com/Drevo-84-Key-Tenkeyless-Mechanical/dp/B01H6DANI2?th=1,1,1
"EVERMARKET Tweezers 6-piece Precision Anti-static ESD Stainless Steel Tweezers for Electronics, Jewelry-making, Laboratory Work, Hobbies",Home Improvement,http://www.amazon.com/dp/B01CNZSBSM/,1,1
(DUPLICATE w # 6) CHERRY Standard Corded Keyboard (Cherry MX Blue Keyswitches) - 104 Keys,BISS,http://www.amazon.com/dp/B0018ACJXW/,1,1
Sunkee 100pcs Dupont Connector Housing Female 2.54mm 1x2P,BISS,http://www.amazon.com/dp/B00CGXNT0M/,1,1
"Team Wolf [CIY] [ Swappable Switch ] [ Customize Switches ] Mechanical Keyboard, Mix Color Led Backlit, 7 Light Modes 87 Keys Wired Gaming or Office Keyboard--Blue Switch",PC Accessory,http://www.amazon.com/dp/B01AFBJQA8/,1,1
"30 pcs SET 10 pcs. 1mm 10pcs. 2mm 10 pcs. 3mm Diamond Drill Bit Cylindrical Burr Kit Jewelry Beach Sea Glass Shells Gemstones Lapidary 30pcs. 1 mm 2 mm 3mm (1/8"")",Lighting,http://www.amazon.com/dp/B00CNXFUBG/,1,1
"Rosewill 104 Keys Mechanical Double Shot Keycaps with Puller for Mechanical Keyboards, Yellow (RIKC-13005)",Personal Computer,http://www.amazon.com/dp/B00K8CERRM/,1,1
Gardner Bender GSW-22 Normal Off Push Button Switch,Home Improvement,http://www.amazon.com/dp/B000BW0YWG/,1,1
PanaVise 381 Vacuum Base PanaVise,BISS,http://www.amazon.com/dp/B000B63276/,1,1
Caseling Hard Case for Stethoscope. - Includes Mesh Pocket for Accessories.,Health and Beauty,http://www.amazon.com/dp/B019IZZKUC/,1,1
"Graphics and More Remove Before Flight Embroidered Keychain, Red",Office Product,http://www.amazon.com/dp/B001HTU8G4/,1,1
Tai-Hao Hawaii PBT Doubleshot 104 Keys (no Anti-biosis Coating),PC Accessory,http://www.amazon.com/dp/B01JMJHRAK/,1,1
"G.SKILL RIPJAWS KM780R RGB On-the-Fly Macro Mechanical Gaming Keyboard, Cherry MX Red",Personal Computer,http://www.amazon.com/dp/B0186W6PMK/,1,1
V3 Accessory Kit for Kinesis Freestyle2 Keyboard,Personal Computer,http://www.amazon.com/dp/B003F8MDPY/,1,1
Cool Sticker 100pcs Random Music Film Vinyl Skateboard Guitar Travel Case Sticker Door Laptop Luggage Car Bike Bicycle Stickers (150pcs),Art and Craft Supply,http://www.amazon.com/dp/B011BNGPSA/,1,1
AULA Wings of Liberty Mechanical Keyboard Blue Switch Gaming 104 Keys Waterproof,Electronics,https://www.amazon.com/dp/B00YUQABR2/ref=cm_sw_r_other_awd_UMhswbX4H9GJA,1,1
"MOOBOM Real Alloy Mechanical Gaming Keyboard,Anti-ghosting USB Wired Game Keyboard,Clicky Sound & Wrist Holder",PC Accessory,http://www.amazon.com/dp/B01LCWEJ56/,1,1
Expand-Your-Hand Bands 10 Pack: Kiss Elbow Pains Goodbye,Sports,http://www.amazon.com/dp/B00083B79M/,1,1
Rechargeable Original Magic Wand HV-270 2015 and Intimate Earth Green Foaming Toy Cleaner,Health and Beauty,http://www.amazon.com/dp/B00YSSY4SO/,1,1
Impecca KBB500C 100% Bamboo Handcrafted Keyboard & Mouse Combo,Personal Computer,http://www.amazon.com/dp/B003VOOOKY/,1,1
"Grifiti Fat Wrist Pad 12 is a 4 x 12 Inch Wrist Rest for Small Mechanical Keyboards, MacBooks, Laptops, and Notebooks in Black Neoprene and Black Nylon",Office Product,http://www.amazon.com/dp/B004DANDN4/,1,1
"Glorious Gaming Wrist Pad/Rest - TENKEYLESS (TKL) - Black - Mechanical Keyboards,Stitched Edges,Ergonomic | 14x4 inches/25mm Thick (GWR-87) Tenkeyless (Black)",PC Accessory,http://www.amazon.com/dp/B00V5AXNS0/,1,1
"Adesso PS/2 to USB Adapter, connects 2 PS/2 connectors to 1 USB port/hub  (ADP-PU21 )",Personal Computer,http://www.amazon.com/dp/B00008ZPED/,1,1
Handcraft GH60 Solid Wooden Case For 60% Mini Mechanical Gaming Keyboard Compatible Poker2 Pok3r Faceu 60 Wooden Shell (Dark Wenge),PC Accessory,http://www.amazon.com/dp/B0734VKNRC/,1,1
Kikkerland USB Spaceman Light (US65),Personal Computer,http://www.amazon.com/dp/B00HZA8Z7I/,1,1
"TOMOKO LED Backlight Mechanical Gaming Keyboard, 104 Keys Water-Resistant Wired Keyboard, Anti-Ghosting Keys, Blue Switch, Fit for Gamers Typists, Black",PC Accessory,http://www.amazon.com/dp/B01MSIGD1W/,1,1
Cherry Pie Red Replacement Top Case for KUL ES-87,PC Accessory,http://www.amazon.com/dp/B00TKRTC1M/,1,1
Realforce RGB 108-key Backlit Mechanical Keyboard (Black),Personal Computer,http://www.amazon.com/dp/B01MU1LUQD/,1,1
Micro Innovations Micro Stratus Turbo AT/PS2 Win 98/95 Keyboard with Wrist Rest,CE,http://www.amazon.com/dp/B00004Z5UO/,1,1
"USB Heated Warmer Gloves, Black with White / Red Stripe",Sports,http://www.amazon.com/dp/B006JI5GXI/,1,1
NCStar Rangebag Insert/Red - Cases & Bags - Shooting Range [Misc.],Sports,http://www.amazon.com/dp/B004QF5PJG/,1,1
Atlantic Gaming Desk - Not Machine Specific,Furniture,http://www.amazon.com/dp/B0058O8EN8/,1,1
Realforce 87U Tenkeyless 55g (White/Gray),PC Accessory,http://www.amazon.com/dp/B00MV7TMNQ/,1,1
CHERRY MX 3.0 Mechanical USB Keyboard (Cherry MX Brown Keyswitches) - 104 Keys,BISS,http://www.amazon.com/dp/B00MN3MFV4/,1,1
"Backlit gaming keyboard, BAVIER Laser carving characters keyboard,Wired Backlighting Keyboard,114keys Ergonomic keyboard, Adjustable Backlight Red Purple Blue, Switchable Crack Backlit (Black)",Wireless,http://www.amazon.com/dp/B01N63BT21/,1,1
DREVO Excalibur 84-Key Cherry MX Switch Full Metal Mechanical Gaming Keyboard Cherry MX Brown Switch with Specially Coated Keycaps Black Edition,Personal Computer,http://www.amazon.com/dp/B01N6GBUQE/,1,1
"DuPont Teflon Silicone Lubricant Squeeze Bottle, 4 Oz.",Sports,http://www.amazon.com/dp/B00BCVXUVM/,1,1
CHERRY Cherry Kbcv-11900W Plastic Keyboard Cover For All Us Layout G80-11900 Models.,PC Accessory,http://www.amazon.com/dp/B005K49ZL6/,1,1
Tai-Hao Green / Yellow / Black ABS Doubleshot 104 Keycaps (No Anti-Biosis Coating),PC Accessory,http://www.amazon.com/dp/B01NALUX40/,1,1
DREVO Excalibur Tenkeyless 84-Key White Backlit Full Metal Mechanical Gaming Keyboard Brown Switch-White,Personal Computer,http://www.amazon.com/dp/B01NBJYMON/,1,1
dodocool Micro USB Cable Magnetic LED Display USB Charge & Sync Cable 3.9ft / 1.2m for Android (Silver),Wireless,http://www.amazon.com/dp/B01NBUE2WW/,1,1
Feenix Autore Mechanical Gaming Keyboard,PC Accessory,http://www.amazon.com/dp/B00MAIDSRC/,1,1
LESHP Wired Mechanical Gaming Keyboard- USB Luminescent Interface Luminescent 6 Color LED Backlit 87- Key Multimedia Mechanical Game Keyboard Connected Computer for Working or Prime Gaming,PC Accessory,http://www.amazon.com/dp/B06ZXT13WN/,1,1
KUL ES-87 Tenkeyless Mechanical Keyboard (Cherry MX Red),Personal Computer,http://www.amazon.com/dp/B00KI23T8U/,1,1
Weller PSI100K Super-Pro Self-Igniting Cordless Butane Soldering Iron Kit,Home Improvement,http://www.amazon.com/dp/B000ICGN38/,1,1
Self-adhesive Clear Rubber Feet - Clear - 10mm Diameter (0.39 Inch) -121/sheet,Single Detail Page Misc,http://www.amazon.com/dp/B00CBU8XLA/,1,1
"ZEEFO Simple Table Lamp Bedside Desk Lamp With Fabric Shade and Solid Wood for Bedroom, Dresser, Living Room, Baby Room, College Dorm, Coffee Table, Bookcase (square)",Home Improvement,http://www.amazon.com/dp/B01F4Y2932/,1,1
