name,category,amazon_link,total_mentions,subreddit_mentions
"Pilot Fountain Pen, Liquid Ink, Disposable, Fine, 1.0mm, Med, Black (PIL90031)",Office Product,http://www.amazon.com/dp/B002HIEPJ0/,1,1
Sennheiser HD 558 Headphones,Speakers,http://www.amazon.com/dp/B004FEEY9A/,134,1
CM Storm QuickFire Rapid - Tenkeyless Mechanical Gaming Keyboard with CHERRY MX Brown Switches,Personal Computer,http://www.amazon.com/dp/B007VDKLLM/,85,1
"NEW! Replacement Upgrade Headband Comfort Cushion Pad in Leatherette with snap locks. Universal fit most Headphone models; Grado SR SRi-series, Sennheiser HD-series, Beyerdynamic and more.",Speakers,http://www.amazon.com/dp/B00862522A/,6,1
"Pilot Metropolitan Collection Fountain Pen, Silver Barrel, Classic Design, Medium Nib, Black Ink (91108)",Office Product,http://www.amazon.com/dp/B009X9Z0OA/,1,1
V-MODA Crossfade M-100 Over-Ear Noise-Isolating Metal Headphone (Shadow),Speakers,http://www.amazon.com/dp/B00A39PPCG/,18,1
"GAMDIAS Hephaestus Virtual Surround Sound 7.1 Gaming Headset with USB, Blast Source Identifier & Heat Sink System(GHS2000)",Personal Computer,http://www.amazon.com/dp/B00IORDD7S/,4,1
(OLD MODEL) Corsair Gaming K70 RGB LED Mechanical Gaming Keyboard - Cherry MX Red (CH-9000068-NA),Personal Computer,http://www.amazon.com/dp/B00N2ROO2S/,14,1
"Replacement Earpads, Mudder 2 Pieces Foam Ear Pad - Cushion Repair for Bose Quietcomfort 2/ 15/ 25, Ae2, Ae2i - Black",Speakers,http://www.amazon.com/dp/B011BIIO9I/,1,1
Cooler Master Mechanical Key Switch Tester V2 Keyboard (SGK-1010-BBCA1),Personal Computer,http://www.amazon.com/dp/B01FXDV92G/,11,1
"iKBC New Poker II Mechanical Keyboard with Cherry MX Red Switch, PBT Keycaps, Macro Programming, 6 DIP Switch, Win/Mac compatible, NKRO, Detachable USB Type-C Cable, White Case",PC Accessory,http://www.amazon.com/dp/B01N39XFUV/,1,1
LAMY Al-Star PACIFIC Fountain Pen - 2017 Limited Edition - Fine nib,Office Product,http://www.amazon.com/dp/B01N4X1BLE/,1,1
NPKC Top Customized 61 ANSI Keyset OEM Profile Thick PBT Keycap set For Cherry MX Switches Mechanical Gaming Keyboard,PC Accessory,http://www.amazon.com/dp/B06XWWRRXT/,9,1
PBT Keycaps Backlit 108Key Set Doubleshot Translucent Cherry MX Key Caps Top Print with Keycaps Puller for 87/104/108 MX Switches Mechanical Gaming Keyboard (Blue White Combo),PC Accessory,http://www.amazon.com/dp/B06ZZ5RRR6/,2,1
