name,category,amazon_link,total_mentions,subreddit_mentions
CLAW Hanayama Cast Metal Brain Teaser Puzzle (Level 2),Toy,http://www.amazon.com/dp/B0038BCN44/,1,1
MARBLE Hanayama Cast Metal Brain Teaser Puzzle (Level 4),Toy,http://www.amazon.com/dp/B0053163VG/,1,1
6 Wooden Puzzle Gift Set In A Wood Box - 3D Puzzles for Adults and Teens,Toy,http://www.amazon.com/dp/B005JEE3IW/,1,1
DUET Hanayama Cast Metal Brain Teaser Puzzle (Level 5),Toy,http://www.amazon.com/dp/B00BTWEGKI/,1,1
LingAo Mini 8 Panels 3 Rings Black Magic Folding Puzzle Cube Twisty,Toy,http://www.amazon.com/dp/B00H94HVUW/,1,1
