name,category,amazon_link,total_mentions,subreddit_mentions
CM Storm QuickFire Rapid - Tenkeyless Mechanical Gaming Keyboard with Cherry MX Blue Switches,Personal Computer,http://www.amazon.com/dp/B0068INSUM/,15,11
"TOMOKO Mechanical Gaming Keyboard, 87-Key Water-resistant Gaming Keyboard with Blue Switch Attached Anti-ghosting Key Cap Puller for Laptop Computer Macbook",Personal Computer,http://www.amazon.com/dp/B01DBJTZU2/,8,6
"Number Pad,Jelly Comb Mechanical Numeric Keypad USB Braid Cable Numpad 22-key Number Pad - Black (Blue switch)",Personal Computer,http://www.amazon.com/dp/B01E8U8HKW/,8,5
CM Storm NovaTouch TKL - Premium Keyboard with Exclusive Hybrid Capacitive Switches,Personal Computer,http://www.amazon.com/dp/B00MY3S288/,6,5
Vortex White Doubleshot PBT Keycaps with blue infill - 104 Keycaps for Mechanical Keyboards (cherry switches),PC Accessory,http://www.amazon.com/dp/B00XA71BQC/,5,5
Mechanical Keyboard Gaming Keyboard Brown Switch 68-Keys Mini Design (60%) Gaming Wired Keyboard White Silver Magicforce by Qisan,PC Accessory,http://www.amazon.com/dp/B01E8KO2B0/,10,4
Qisan Mechanical Keyboard Gaming Keyboard Blue Switch 68-Keys Mini Design (60%) Gaming Wired Keyboard White Golden Magicforce,Personal Computer,http://www.amazon.com/dp/B01ABUJ0FY/,7,4
"Keyboard & Mouse Wrist Rest Pad, Non Slip Silica Gel Soft to the Touch Support for Office, Computer, Laptop, & Mac - Durable & Comfortable & Lightweight for Easy Typing & Pain Relief",Personal Computer,http://www.amazon.com/dp/B00VFS2KP4/,6,4
SANOXY PS2 Keyboard To USB Adapter,PC Accessory,http://www.amazon.com/dp/B000BSJFJS/,5,4
"Passion Lubes, Natural Water-Based Lubricant, 55 Gallon Drum",Health and Beauty,http://www.amazon.com/dp/B005MR3IVO/,273,3
"008 Buna-N O-Ring, 70A Durometer, Black, 3/16"" ID, 5/16"" OD, 1/16"" Width (Pack of 100)",BISS,http://www.amazon.com/dp/B000FMWLR8/,6,3
"Max Keyboard Keycap, Cherry MX Switch, O-Ring Pro Sampler Tester Kit",PC Accessory,http://www.amazon.com/dp/B00N6DXTW4/,5,3
Mechanical Gaming Keyboard GATERON Brown Switch Wired Backlit Mechanical Mini Design (60%) 68 Keys Keyboard White Silver Magicforce by Qisan,PC Accessory,http://www.amazon.com/dp/B01E57PT4A/,3,3
"Hcman Teamwolf Mechanical Gaming Keyboard Aluminum Alloy Body LED Backlit, 87 Keys, Blue Switch (White Keycap)",PC Accessory,http://www.amazon.com/dp/B0192Z9CJS/,3,3
Engineer SS-02 Solder Sucker,Home Improvement,http://www.amazon.com/dp/B002MJMXD4/,3,3
"Cooler Master MasterKeys Pro S RGB Mechanical Gaming Keyboard, Cherry MX Blue (Clicky), RGB LED, TenKeyless (Small)",Personal Computer,http://www.amazon.com/dp/B01D8ETGJ0/,3,3
"Permatex 22058 Dielectric Tune-Up Grease, 3 oz. Tube",Automotive Parts and Accessories,http://www.amazon.com/dp/B000AL8VD2/,3,3
Azio Levetron Mech5 Mechanical Gaming Keyboard with Cherry Black MX Switches (KB577U),Personal Computer,http://www.amazon.com/dp/B008CXTW5G/,3,3
Redragon K552 KUMARA LED Backlit Mechanical Gaming Keyboard (Black),Personal Computer,http://www.amazon.com/dp/B016MAK38U/,8,2
SE MZ101B Helping Hand with Magnifying Glass,Home Improvement,http://www.amazon.com/dp/B000RB38X8/,7,2
Qisan Gaming Keyboard Mechanical Wired Keyboard Cherry MX Brown Switch Backlight keyboard 68-Keys Mini Design White,PC Accessory,http://www.amazon.com/dp/B01872MCIA/,6,2
Corsair Vengeance K65 Compact Mechanical Gaming Keyboard,Personal Computer,http://www.amazon.com/dp/B00DOWCQ0I/,6,2
Laser Projection Virtual Keyboard,PC Accessory,http://www.amazon.com/dp/B008D6IUG4/,6,2
WASD Keyboards Wire Keycap Puller Tool,PC Accessory,http://www.amazon.com/dp/B00AZCGF7K/,5,2
Mechanical Keyboard Gaming Keyboard GATERON Brown Switch Wired Backlit Mechanical Mini design (60%) 68 Keys Keyboard Black Magicforce by Qisan,PC Accessory,http://www.amazon.com/dp/B01E57PUNA/,4,2
The Seafarer Keyboard,PC Accessory,http://www.amazon.com/dp/B00WDKB2GG/,4,2
Qisan Mechanical Keyboard Gaming Keyboard Black Switch 68-Keys Mini Design (60%) Gaming Wired Keyboard White Silver Magicforce,Personal Computer,http://www.amazon.com/dp/B01ABUIYVU/,3,2
Vortex White Translucent Doubleshot backlit PBT + POM Keycaps - 104 Keycaps for Mechanical Keyboards (cherry switches compatible),Personal Computer,http://www.amazon.com/dp/B00XABE3MC/,3,2
CM Storm QuickFire Rapid - Tenkeyless Mechanical Gaming Keyboard with CHERRY MX Brown Switches,Personal Computer,http://www.amazon.com/dp/B007VDKLLM/,3,2
Happy Hacking Keyboard Professional2 - Dark Grey (PD-KB400B),Personal Computer,http://www.amazon.com/dp/B000EXZ0VC/,3,2
"Glorious Modular Mechanical Gaming Keyboard - Full Size (104 Key) - RGB LED Backlit, Brown Switches, Hot Swap Switches (Black)(GMMK-BRN)",PC Accessory,http://www.amazon.com/dp/B01D8YNJH0/,3,2
PFU Happy Hacking Keyboard Professional JP Japanese USB keyboard Capacitance non-contact N key rollover Black,PC Accessory,http://www.amazon.com/dp/B001KWJTD6/,2,2
iOne Scorpius 32 mechanical keyswitch keypad PS/2 - AT,PC Accessory,http://www.amazon.com/dp/B000UKYSFI/,2,2
Mechanical Numeric Keypad GATERON Brown Switch Wired Ice Blue Backlight Gaming Keypad 21 keys Mini Numpad Portable Keypad Extended layout Black Magicforce by Qisan,PC Accessory,http://www.amazon.com/dp/B01MZ4Z2DK/,2,2
Rosewill Mechanical Gaming Keyboard with Cherry MX Brown Switches (RK-9000V2 BR),Personal Computer,http://www.amazon.com/dp/B00S5E4LX0/,2,2
"iKBC F108 RGB Double-Shot PBT Mechanical Gaming Keyboard with Cherry MX Blue Switches, White Case, Per-Key RGB Lighting, Full Size (K6D75S411007)",Personal Computer,http://www.amazon.com/dp/B01LYV02W8/,2,2
"Plugable Compact 87-Key Mechanical Keyboard for Typing Enthusiasts and Gamers with Adjustable White LED Backlighting, Blue MX Style ""Clicky"" Switches, Double-shot ABS Keycaps, and N-Key Rollover",PC Accessory,http://www.amazon.com/dp/B01M301Q50/,2,2
Vortex White Doubleshot PBT Keycaps Black with White infill - 104 Keycaps for Mechanical Keyboards (cherry switches compatible),PC Accessory,http://www.amazon.com/dp/B00XA8FHRU/,2,2
Taihao 5767457 Sunset Doubleshot PBT 104 Keycaps with Nano Antibiosis Coating,Personal Computer,http://www.amazon.com/dp/B0176NJC9I/,2,2
Mechanical Keyboard Gaming Keyboard Brown Switch 100% Full Size 108 keys GATERON switch with White Backlight Case White Magicforce by Qisan,PC Accessory,http://www.amazon.com/dp/B01HHTFSIK/,2,2
Unicomp Ultra Classic Model M Black Buckling Spring 104 Key USB Keyboard,PC Accessory,http://www.amazon.com/dp/B01M29PYF4/,2,2
Cooler Master Mechanical Key Switch Tester V2 Keyboard (SGK-1010-BBCA1),Personal Computer,http://www.amazon.com/dp/B01FXDV92G/,2,2
"Finish Line Extreme Fluoro 100% DuPont Teflon Grease, 20g Syringe",Sports,http://www.amazon.com/dp/B002L5UL92/,2,2
"Cooler Master MasterKeys Pro S RGB Mechanical Gaming Keyboard, Cherry MX Brown (Silent Tactile), RGB LED, TenKeyless (Small)",CE,http://www.amazon.com/dp/B01D8ETGNQ/,2,2
SANOXY USB / PS/2 Active Adapter [Electronics],PC Accessory,http://www.amazon.com/dp/B000I97N1M/,2,2
"106 Buna-N O-Ring, 70A Durometer, Black, 3/16"" ID, 3/8"" OD, 3/32"" Width (Pack of 100)",BISS,http://www.amazon.com/dp/B000FMYR48/,2,2
Vortex IKBC Double-Shot PBT RGBY Mechanical Keyboard Keycaps,Personal Computer,http://www.amazon.com/dp/B013KPX9E0/,2,2
"Plugable Full Size 104-Key Mechanical Keyboard for Typing Enthusiasts and Gamers with Adjustable White LED Backlighting, Blue MX Style ""Clicky"" Switches, Double-shot ABS Keycaps, and N-Key Rollover",PC Accessory,http://www.amazon.com/dp/B01MA6O13L/,2,2
Seasonic Topre REALFORCE RGB AEAX01 USB Wired 108-Key Keyboard,Personal Computer,http://www.amazon.com/dp/B01MSOPQ54/,2,2
"Click, Clack, Moo (A Click, Clack Book)",eBooks,http://www.amazon.com/dp/B01GD9CO7S/,,1
"iKBC New Poker II Mechanical Keyboard with Cherry MX Brown Switch, Black",Electronics,https://www.amazon.com/Poker-Mechanical-Keyboard-Cherry-Switch/dp/B01MYE85LB/ref=sr_1_1?ie=UTF8&amp;qid=1506445664&amp;sr=8-1&amp;keywords=new,,1
"Morakniv Companion Fixed Blade Outdoor Knife with Carbon Steel Blade, 4.1-Inch, Military Green",Sports,http://www.amazon.com/dp/B004TNWD40/,23,1
"ASUS VG248QE 24"" Full HD 1920x1080 144Hz 1ms HDMI Gaming Monitor",Personal Computer,http://www.amazon.com/dp/B00B2HH7G0/,18,1
Lamy Safari Fountain Pen - Charcoal - Fine,Office Product,http://www.amazon.com/dp/B0002T401Y/,11,1
Hakko FX888D-23BY Digital Soldering Station FX-888D FX-888 (blue & yellow),BISS Basic,http://www.amazon.com/dp/B00ANZRT4M/,9,1
"Glorious Extended Gaming Mouse Mat / Pad - XXL Large, Wide (Long) Black Mousepad, Stitched Edges | 36""x11""x0.12"" (G-E)",Office Product,http://www.amazon.com/dp/B00J2EF4K6/,9,1
Nintendo GameCube ASCII Keyboard Controller,Video Games,http://www.amazon.com/dp/B0000694RM/,7,1
WASD 6-Key Cherry MX Switch Tester,PC Accessory,http://www.amazon.com/dp/B00AZQKCD4/,7,1
"Mack's Ultra Soft Foam Earplugs, 50 Pair - 32dB Highest NRR, Comfortable Ear Plugs for Sleeping, Snoring, Work, Travel and Loud Events",Health and Beauty,http://www.amazon.com/dp/B0051U7W32/,7,1
"Saitek Mad Catz STRIKE7 Modular RGB Backlit Gaming Keyboard with Customizable Metal Frame, 24 Programmable Macros, and LCD Touchscreen",Personal Computer,http://www.amazon.com/dp/B0090ECASW/,7,1
TekMat 12-Inch X 36-Inch Long Gun Cleaning Mat,Sports,http://www.amazon.com/dp/B0036N474S/,6,1
Griffin Technology NA16029 PowerMate USB Multimedia Controller,CE,http://www.amazon.com/dp/B003VWU2WA/,6,1
Xbox One Elite Wireless Controller,Video Games,http://www.amazon.com/dp/B00ZDNNRB8/,6,1
3Dconnexion 3DX-700028 SpaceNavigator 3D Mouse,CE,http://www.amazon.com/dp/B000LB7G00/,6,1
Canless Air System O2 Hurricane 220+ mph Canless Air Duster (Special Edition),Office Product,http://www.amazon.com/dp/B00DYC3EKO/,5,1
"Logitech Wireless Performance Mouse MX for PC and Mac, Large Mouse, Long Range Wireless Mouse",Electronics,https://www.amazon.com/Logitech-Wireless-Performance-Mouse-Large/dp/B002HWRJBM/ref=sr_1_sc_1?s=pc&amp;ie=UTF8&amp;qid=1486325270&amp;sr=1-1-spell&amp;keywords=mx+performamce,5,1
"Anker 2.4G Wireless Vertical Ergonomic Optical Mouse, 800 / 1200 /1600DPI, 5 Buttons - Black",Personal Computer,http://www.amazon.com/dp/B00BIFNTMC/,5,1
Creative Aurvana Live! Headphones,Speakers,http://www.amazon.com/dp/B000ZJZ7OA/,5,1
Gaming Keyboard Mechanical Brown Switches 104-Key Doubleshot ABS Outemu Velocifire VM01 LED Illuminated Backlit Anti-ghosting Keys Full Size (Wired),PC Accessory,http://www.amazon.com/dp/B01M0QEYR4/,4,1
"Corsair STRAFE Mechanical Gaming Keyboard, Red LED, Cherry MX Red",Personal Computer,http://www.amazon.com/dp/B00ZUPOMDQ/,4,1
MechanicalEagle Z-77 Tenkeyless Wired Mechanical Gaming Keyboard with Blue Switches - DIY Replaceable Switches - Black,Electronics,https://www.amazon.com/MechanicalEagle-Multicolor-Mechanical-Keyboard-Tenkeyless/dp/B01I1N6N3U/ref=sr_1_2?s=electronics&amp;ie=UTF8&amp;qid=1505949532&amp;sr=1-2&amp;keywords=mechanical,4,1
"Logitech MX Master Wireless Mouse – High-precision Sensor, Speed-adaptive Scroll Wheel,  Thumb Scroll Wheel, Easy-Switch up to 3 Devices",Personal Computer,http://www.amazon.com/dp/B00TZR3WRM/,4,1
Hakko FX888D-23BY-Kit2 Bundle Includes Soldering Station and CHP170 cutter,BISS Basic,http://www.amazon.com/dp/B00AWUFVY8/,4,1
"uxcell 67"" Desktop Computer Case Power Supply Reset HDD Button Switch",Personal Computer,http://www.amazon.com/dp/B00HG7HO22/,4,1
Mechanical Keyboard - Lolita Spyder 87 [Kailh Blue Switch],PC Accessory,http://www.amazon.com/dp/B00T1P80XY/,3,1
ZIRO 3D Printer Filament PLA 1.75mm Marble Color 1KG(2.2lbs) - White,BISS,http://www.amazon.com/dp/B01IIAC2MW/,3,1
Happy Hacking Keyboard Professional2 (Black No Keytop Print/blank),Personal Computer,http://www.amazon.com/dp/B000F8OECM/,3,1
Hakko 599B-02 Solder Tip Cleaning Wire and Holder,Industrial & Scientific,https://www.amazon.com/Hakko-599B-02-Solder-Cleaning-Holder/dp/B00FZPGDLA/ref=pd_sim_469_6?ie=UTF8&amp;dpID=51B7RqNpe1L&amp;dpSrc=sims&amp;preST=_AC_UL160_SR139,3,1
Logitech G710+ Mechanical Gaming Keyboard with Tactile High-Speed Keys - Black,Personal Computer,http://www.amazon.com/dp/B009C98NPY/,3,1
CM Storm QuickFire Rapid - Tenkeyless Mechanical Gaming Keyboard with CHERRY MX Red Switches,Personal Computer,http://www.amazon.com/dp/B007VDLVD4/,3,1
"DC Fix 346-0037 Adhesive Film, Medium Walnut",Home Improvement,http://www.amazon.com/dp/B001OUX4Z8/,3,1
"Gaming Mechanical Keyboard Led Backlit - Hcman USB Wired Computer Gaming Keyboard Blue Switches with Cool 6 Colors Light for PC or Mac,87 Keys",CE,http://www.amazon.com/dp/B01N57WL39/,3,1
Rosewill Mechanical Gaming Keyboard with Cherry MX Blue Switches (RK-9000V2),Personal Computer,http://www.amazon.com/dp/B00S5E4KH2/,3,1
MIONIX NAOS 7000 Multi-Color Ergonomic Optical Gaming Mouse,Boost,http://www.amazon.com/dp/B00HGKQ6VY/,3,1
Rotary13B1 Insert Before Flight Keychain Red/White - 1 Piece,Office Product,http://www.amazon.com/dp/B007UL4JKE/,3,1
PC USB Foot Switch Keyboard Pedal,PC Accessory,http://www.amazon.com/dp/B008MU0TBU/,3,1
"PanaVise Model 201 ""Junior"" Miniature Vise",BISS Basic,http://www.amazon.com/dp/B000B61D22/,3,1
IBM Keyboard Model M 1391401,PC Accessory,http://www.amazon.com/dp/B00F4FHY64/,2,1
Qisan Gaming Keyboard Mechanical Keyboard Black Switch Backlight keyboard 68-Keys Mini Design (60%) Black Magicforce,PC Accessory,http://www.amazon.com/dp/B017N5SH6S/,2,1
"DURAGADGET Colourful ""Kid's Proof"" Childrens, Special Needs Or Sight Impared PC Keyboard PS2/USB - Great For Teaching / Learning",PC Accessory,http://www.amazon.com/dp/B005GL0PXK/,2,1
CM Storm QuickFire TK - Compact Mechanical Gaming Keyboard with CHERRY MX BLUE Switches and Fully LED Backlit,Personal Computer,http://www.amazon.com/dp/B00A378L4C/,2,1
"Cooler Master MasterKeys Pro M White Mechanical Gaming Keyboard, Cherry MX Brown Switches, Per-Key White LED Lighting, TenKey",Personal Computer,http://www.amazon.com/dp/B01ITE93K6/,2,1
Vortex Pok3r Mechanical Keyboard Sleeve [Fits 61 keys keyboards] [ 60% ] (Brown / Coffee),Personal Computer,http://www.amazon.com/dp/B00WMOIWOI/,2,1
"Nalgene 6140-0010 Faucet Aspirator Vacuum Pump, Polypropylene, 3/8"" NPT Threading",BISS,http://www.amazon.com/dp/B003OBYNBO/,2,1
Vortex Pok3r Mechanical Keyboard Sleeve [Fits 61 Keys Keyboards] [ 60% ] (Black),Personal Computer,http://www.amazon.com/dp/B00WMO9LT8/,2,1
The Keyboard Waffle Iron,Boost,http://www.amazon.com/dp/B015QJPUOA/,2,1
CLEAR DISPLAY SHOW CASE FOR 1/18 SILVER BASE with REPLACEABLE LED LIGHTS by iLLumibox,Toy,http://www.amazon.com/dp/B01C4QUFDE/,2,1
"LAMY Safari Fountain Pen, Charcoal Medium Nib (L17M)",Office Product,http://www.amazon.com/dp/B00133X1V8/,2,1
Lenovo 33L3225 ThinkPad Numeric Keypad For Thinkpad USB,Personal Computer,http://www.amazon.com/dp/B00004Z7F0/,2,1
1STPLAYER Fire Dancing Mechanical Feeling Gaming Keyboard GK3 Black,PC Accessory,http://www.amazon.com/dp/B013SN4AYW/,2,1
Ideazon Battlefield 2 Limited Edition Keyset for Zboard,CE,http://www.amazon.com/dp/B0007VJ7I8/,2,1
Thermaltake Tt e SPORTS Poseidon ZX Tenkeyless Blue Switches with 4-Level Brightness Blue LED Mechanical Gaming Keyboard KB-PZX-KLBLUS-01,Personal Computer,http://www.amazon.com/dp/B00MB0QMJ0/,2,1
Razer BlackWidow Tournament Edition - Essential Mechanical Gaming Keyboard - Compact Layout - Tactile & Clicky Razer Green Switches,Personal Computer,http://www.amazon.com/dp/B00IG3GPC0/,2,1
"Cooler Master MasterKeys Pro L White Mechanical Gaming Keyboard, Cherry MX Brown Switches, Per-Key White LED Lighting, Full Size",Personal Computer,http://www.amazon.com/dp/B01ITE93OM/,2,1
"Mount-It! Dual LCD Monitor Desk Mount Stand Heavy Duty Fully Adjustable Arms Fits  2 / Two Screens up to 27"", VESA 75 and 100 (MI-752)",Office Product,http://www.amazon.com/dp/B0052AWGLE/,2,1
"GT-5000 (6 Strips) Grip Tape for guns, cell phones, cameras, knives, tools - makes anything ""Grippy""",Sports,http://www.amazon.com/dp/B00C7WXTJS/,2,1
"Anker Portable Multi-Angle Stand for Tablets, e-readers and Smartphones, Compatible with iPhone X/8/8 Plus/7/7 Plus, Samsung Galaxy S8/S7/Note 8, iPad Pro 9.7/10.5/Air/mini, Pixel 2 and More (Silver)",Speakers,http://www.amazon.com/dp/B00D856NOG/,2,1
Samsung UN32J5205 32-Inch 1080p Smart LED TV (2015 Model),Home Theater,http://www.amazon.com/dp/B00U9U8RZQ/,2,1
Primacc 87-Key Mechanical Gaming Keyboard Anti-ghosting Compact Water-Resistant Computer Keyboards with Blue Switch for Game,PC Accessory,http://www.amazon.com/dp/B01KFU7EP8/,2,1
"EC Technology Foldable Bluetooth Keyboard Ultra Slim Portable Wireless Keyboard with Pocket-Size Ergonomic Design Built-in Rechargeable Li-polymer Battery for IOS/Android/Windows, Aluminum Alloy",Personal Computer,http://www.amazon.com/dp/B00QT8WQ86/,2,1
CM Storm QuickFire XT - Full Size Mechanical Gaming Keyboard with CHERRY MX Brown Switches,Personal Computer,http://www.amazon.com/dp/B00EQV0W02/,2,1
UGREEN Micro USB 2.0 OTG Cable On The Go Adapter Male Micro USB to Female USB for Samsung S7 S6 Edge S4 S3 Android or Windows Smart Phones Tablets with OTG Function 6 Inch (Black),PC Accessory,http://www.amazon.com/dp/B00LN3LQKQ/,2,1
Das Keyboard 4C Professional Soft Tactile Brown Compact Mechanical Keyboard (DASK4CPROSIL),Personal Computer,http://www.amazon.com/dp/B00SV73J6G/,2,1
"Mechanical keyboards Switch tester, keycap Puller, keyboard Keycap, Cherry MX Switch, O-Ring Sampler Tester Kit",Wireless,http://www.amazon.com/dp/B01G3BJOHO/,2,1
"3M Dual Lock Reclosable Fastener TB3550 250/250 Black, 1 in x 10 ft (1 Mated Strip/Bag)",BISS Basic,http://www.amazon.com/dp/B007OXK1AK/,2,1
Logitech G Pro Gaming FPS Mouse with Advanced Gaming Sensor for Competitive Play,Personal Computer,http://www.amazon.com/dp/B01JPOLLTK/,2,1
"DREVO 84 Key Gramr Backlit Edition Tenkeyless Mechanical Gaming Keyboard, Brown Switch Black",Personal Computer,http://www.amazon.com/dp/B01H6DHITE/,2,1
"AUKEY USB C Adapter, Type C to USB 3.0 Adapter (2-Pack) for MacBook Pro, Samsung Galaxy Note 8 S8 S8+, Nexus 6P 5X, Google Pixel, LG G5, HTC 10 and More (Black)",PC Accessory,http://www.amazon.com/dp/B01AUKU1OO/,2,1
"Kester 24-6337-0027 Solder Roll, Core Size 66, 63/37 Alloy, 0.031"" Diameter",BISS,http://www.amazon.com/dp/B0149K4JTY/,2,1
Good Smile The Legend of Zelda: Majora's Mask 3D Link Nendoroid Action Figure,Toy,http://www.amazon.com/dp/B014213H0C/,2,1
Koolertron 87 Keys Tenkeyless Mechanical Gaming Keyboard Anti-Ghosting Blue Switches White Backlit Chroma Dimmable,PC Accessory,http://www.amazon.com/dp/B0114LL0NO/,2,1
Beer and Soda Guzzler Helmet (Yellow),Toy,http://www.amazon.com/dp/B006CWV17Q/,2,1
"Cooler Master MasterKeys Pro L RGB Mechanical Gaming Keyboard, Cherry MX Red Switches, Per-Key RGB Lighting, Full Size",Personal Computer,http://www.amazon.com/dp/B01D3BDNLU/,1,1
"AIBOO Kitchen Under Cabinet Lighting LED 12Vdc 8 Pack Black Cord Aluminum Puck Lights for Counter Closet Furniture Lighting with Dimmable RF Remote Control(16W, Warm white)",Lighting,http://www.amazon.com/dp/B01MDOU9W2/,1,1
"Crayola® 3-Piece Computer Kit with Keyboard, Mouse & Photo Mouse Pad (11103)",CE,http://www.amazon.com/dp/B001DCDXU8/,1,1
"Oatey 30999 ABS Medium Cement, Black, 4-Ounce",Home Improvement,http://www.amazon.com/dp/B000UG1C74/,1,1
Mechanical Keyboard - KBC Poker 3 - Black Case - ABS Dual Coating Keycaps - Cherry Mx-Blue - White backlit [Metal Casing],Personal Computer,http://www.amazon.com/dp/B014T4NR7U/,1,1
Mechanical Keyboard - KBC Poker 3 - Black Case - ABS Dual Coating Keycaps - Cherry Mx-Brown - White backlit [Metal Casing],PC Accessory,http://www.amazon.com/dp/B014T4O92C/,1,1
Generic 3 Pack of Universal Touch Screen Stylus Pen (Red + Black + Silver),Wireless,http://www.amazon.com/dp/B002BBJMO6/,1,1
Mechanical Keyboard - KBC Poker 3 - Black Case - ABS dual coating Keycaps - Cherry Mx-Clear - White backlit [Metal Casing],Personal Computer,http://www.amazon.com/dp/B014T4PK0M/,1,1
Mechanical Keyboard - KBC Poker 3 - Black Case - ABS dual coating Keycaps - Cherry Mx-Red - White backlit [Metal Casing],PC Accessory,http://www.amazon.com/dp/B014T4OFA8/,1,1
"Multifunctional 3 in 1 Headphones, GranVela A809 Multifunctional Foldable Headphones with Built-in FM Radio, Micro SD Card Player and Detachable Cable - Dark Green",CE,http://www.amazon.com/dp/B00MF8SJX0/,1,1
USA Majestouch MINILA 67 Key Tactile Action Keyboard FFKB67M/EB,Personal Computer,http://www.amazon.com/dp/B00BEVVFD0/,1,1
2.4Ghz Wireless 109 Keys Bamboo Keyboard and Mouse Set Environmental Handmade,PC Accessory,http://www.amazon.com/dp/B00V662014/,1,1
Adonit Jot Touch with Pixelpoint Pressure Sensitive Precision Stylus for iPad - Black,Personal Computer,http://www.amazon.com/dp/B00KFAG64O/,1,1
Tai-Hao Sunset (Sunshine) Doubleshot PBT Keycaps (No Anti-Biosis Coating),PC Accessory,http://www.amazon.com/dp/B01JPRAI50/,1,1
CTRL ALT DEL DELETE KEY FOOD BOWLS COMPUTER KEYBOARD TEA COFFEE CUPS MUGS + TRAY (Black),Kitchen,http://www.amazon.com/dp/B00GVLIUZY/,1,1
Noppoo Choc Mini 84 NKRO 1ms REALKEY (RK) Technology Mechanical Gaming Keyboard (Red Switches/POM KeyCaps),Personal Computer,http://www.amazon.com/dp/B0091QOCNA/,1,1
"Targus 4-Port Hub, Black/Gray (ACH114US)",CE,http://www.amazon.com/dp/B0046TOQ8S/,1,1
Canon DK100i USB Calculator (9722A001AA),CE,http://www.amazon.com/dp/B0002C7WSO/,1,1
DREVO Gramr 84 Key Backlit USB Wired Tenkeyless Mechanical Gaming Keyboard Black Switch-Black,Personal Computer,http://www.amazon.com/dp/B01K1XDTJY/,1,1
"SOLO Cup Company R7NJ Jazz Waxed Paper Cold Cups, 7oz, Tide Design, 100 per Pack (Case of 20 Packs)",BISS,http://www.amazon.com/dp/B0040ZP3PS/,1,1
Razer BlackWidow Chroma V2 - RGB Mechanical Gaming Keyboard - Ergonomic Wrist Rest - Tactile & Silent Razer Orange Switches,Personal Computer,http://www.amazon.com/dp/B01N1SJ9IZ/,1,1
Bastron Bluetooth Keyboard Transparent Touch Glass Keyboard with Mouse&gesture Function Biggest Technological Innovation New Ver.4(Silver),PC Accessory,http://www.amazon.com/dp/B01E5AH6LQ/,1,1
"Sametop Jaws Flex Clamp Mount with Adjustable Gooseneck for Gopro Hero 5, 4, Session, 3+, 3, 2, 1 Cameras",Photography,http://www.amazon.com/dp/B01CQ6PWSA/,1,1
Noppoo Choc Mini 84 NKRO 1ms REALKEY (RK) Technology Mechanical Gaming Keyboard - NOPPOO Blue Switches (Blue Switches/POM KeyCaps),Personal Computer,http://www.amazon.com/dp/B00HLW5DP2/,1,1
Motorola Right Angle Charger Adapter EMU - SKN6182,Wireless,http://www.amazon.com/dp/B000FHBEFS/,1,1
"Chemtronics Desoldering Braid, Chem-Wik, Rosin, 10-50L 0.10"", 50ft.",Home Improvement,http://www.amazon.com/dp/B0019V5MAC/,1,1
"Moobom DB-A8 Mechanical Feel Gaming Keyboard, LED Three Color Backlit USB Wired Game Keyboard",Personal Computer,http://www.amazon.com/dp/B01ELGLOOY/,1,1
Vortex Core 40% - Dark Grey CNC Case - PBT DSA Keycaps - Cherry Mx-Clear [CNC Aluminium Casing],PC Accessory,http://www.amazon.com/dp/B01N0X7COX/,1,1
uxcell 10pcs 3.5mm x 4.5mm x 24mm 4 Pole Male Headphone Soldering Jack Silver Tone,CE,http://www.amazon.com/dp/B00DC4TUL6/,1,1
Dynalon 312635 Water Jet/Faucet Aspirator Vacuum Pump,BISS Basic,http://www.amazon.com/dp/B004AHL77E/,1,1
Vortex Pok3r Mechanical Keyboard Sleeve [Fits 61 keys keyboards] [ 60% ] (Dark Brown),Personal Computer,http://www.amazon.com/dp/B00WMOO6LG/,1,1
Best Value Vacs 2 Quart Stainless Steel Vacuum and Degassing Chamber,Single Detail Page Misc,http://www.amazon.com/dp/B00KSWL29I/,1,1
4PORT USB 2.0 Travel Hub,CE,http://www.amazon.com/dp/B0038PNNIU/,1,1
Vortex Pok3r Mechanical Keyboard Sleeve [Fits 61 Keys Keyboards] [ 60% ] (Grey),Personal Computer,http://www.amazon.com/dp/B00WMO1DU8/,1,1
"ZENY 3,5CFM Single-Stage 5 Pa Rotary Vane Economy Vacuum Pump 3 CFM 1/4HP Air Conditioner Refrigerant HVAC Air tool R410a 1/4"" Flare Inlet Port, Blue",BISS,http://www.amazon.com/dp/B012CFTYX4/,1,1
Food Apples Oranges Pineapple Fruit Keyboard Customized Made to Order Support Ready 16 7/8 inch (430mm) x 4 7/8 inch (125mm) x 15/16 inch (25mm) High Quality Liil Key board Boards desktop laptop Key_board comfortable computer accessories cute gaming gear,PC Accessory,http://www.amazon.com/dp/B00IPP0FBG/,1,1
"United Scientific 55204 Polypropylene Vacuum Dessicators with Polycarbonate Cover, 152.4mm Diameter",BISS,http://www.amazon.com/dp/B00ES3GPMM/,1,1
Kingston Digital Mobility Kit Includes 32 GB Flash Memory Card Reader (MBLY10G2/32GB),CE,http://www.amazon.com/dp/B00519BEQO/,1,1
Alienware TactX Gaming Keyboard (N16TH),Personal Computer,http://www.amazon.com/dp/B003V0RRA2/,1,1
Mechanical Keyboard - KBC Poker 3 - White Case - PBT Keycaps - Cherry Mx-Blue [Metal Casing],PC Accessory,http://www.amazon.com/dp/B00W02J4DA/,1,1
Vortex Pok3r Mechanical Keyboard Sleeve [Fits 61 Keys Keyboards] [ 60% ] (Royal Blue),Personal Computer,http://www.amazon.com/dp/B00WMNA9AY/,1,1
Vortex Pok3r Mechanical Keyboard Sleeve [Fits 61 Keys Keyboards] [ 60% ] (Turquoise),Personal Computer,http://www.amazon.com/dp/B00WMNV0ZW/,1,1
Vortex Pok3r Mechanical Keyboard Sleeve [Fits 61 keys keyboards] [ 60% ] (Fushia),PC Accessory,http://www.amazon.com/dp/B00WMO0EE4/,1,1
DuPont Silicone Lubricant with Teflon Fluoro Polymer,Sports,http://www.amazon.com/dp/B000RGZHFA/,1,1
"The Crafts Outlet MCR-GLS-TRN-TA6-CLR Transparent Glass Microbead, 1 Bag of 1-Ounce, Clear",Art and Craft Supply,http://www.amazon.com/dp/B00929ZZ6E/,1,1
"ADVANTUS Super Stacker Pencil Box, 8.25 x 1.5 x 4 Inches, Clear, 1 Box (40309)",Office Product,http://www.amazon.com/dp/B00B4NPLKG/,1,1
Unsimply Stitched Men's Socks size 8-12 Sliced Boxes Light Blue Multi,Apparel,http://www.amazon.com/dp/B01N76A9MG/,1,1
"GANSS Rainbow RGB Backlit Wired Mechanical Gaming Keyboard,Ganss G.S 87 PRO [Cherry MX—RED Switch]",PC Accessory,http://www.amazon.com/dp/B01M8N78L6/,1,1
"Q-tips Cotton Swabs, 170 ct",Health and Beauty,http://www.amazon.com/dp/B000052XR3/,1,1
Ergonomic Computer Armrest Arm Supporter with Memory Foam Wrist Rest For Desk,Office Product,http://www.amazon.com/dp/B00U1VJEBE/,1,1
AGPtek® Electroplating Sliver Keyset Zinc Transparent WASD 4 Key Caps Cherry MX Keycap for Metal Mechanical Keyboard,PC Accessory,http://www.amazon.com/dp/B00SB6YD2Q/,1,1
