name,category,amazon_link,total_mentions,subreddit_mentions
Khan's Treatment Planning in Radiation Oncology,Book,http://www.amazon.com/dp/1469889978/,2,2
The Anatomy Coloring Book,Book,http://www.amazon.com/dp/0321832019/,17,1
"Practical Radiation Oncology Physics: A Companion to Gunderson & Tepper's Clinical Radiation Oncology, 1e",Book,http://www.amazon.com/dp/0323262090/,1,1
Radiation Therapy Planning,Book,http://www.amazon.com/dp/0070051151/,1,1
Treatment Planning in Radiation Oncology,Book,http://www.amazon.com/dp/1608314316/,1,1
Principles and Practice of Proton Beam Therapy (Medical Physics Monograph),Book,http://www.amazon.com/dp/1936366436/,1,1
Quality and Safety in Radiotherapy (Imaging in Medical Diagnosis and Therapy),Book,http://www.amazon.com/dp/1439804362/,1,1
