name,category,amazon_link,total_mentions,subreddit_mentions
"Felson's Principles of Chest Roentgenology Text with CD-ROM, 3e (Goodman, Felson's Principles of Chest Roentgenology)",Book,http://www.amazon.com/dp/1416029230/,3,3
Crucial Interventions: An Illustrated Treatise on the Principles & Practice of Nineteenth-Century Surgery,Book,http://www.amazon.com/dp/0500518106/,3,2
"Do No Harm: Stories of Life, Death, and Brain Surgery",Book,http://www.amazon.com/dp/125009013X/,3,2
Pocket Medicine: The Massachusetts General Hospital Handbook of Internal Medicine (Pocket Notebook) Fifth Edition,Book,http://www.amazon.com/dp/1451193785/,10,2
"Symptom to Diagnosis: An Evidence Based Guide, Second Edition (LANGE Clinical Medicine)",Book,http://www.amazon.com/dp/0071496130/,4,2
Last Night in the OR: A Transplant Surgeon's Odyssey,Book,http://www.amazon.com/dp/0147515335/,2,2
3-d Negotiation: Powerful Tools to Change the Game in Your Most Important Deals,Book,http://www.amazon.com/dp/1591397995/,5,2
Getting Past No: Negotiating in Difficult Situations,Book,http://www.amazon.com/dp/0553371312/,5,2
Harrison's Principles of Internal Medicine 19/E (Vol.1 & Vol.2),Book,http://www.amazon.com/dp/0071802150/,2,2
"The Spirit Catches You and You Fall Down: A Hmong Child, Her American Doctors, and the Collision of Two Cultures (FSG Classics)",Book,http://www.amazon.com/dp/0374533407/,9,2
"Poisoning and Drug Overdose,  Sixth Edition (Poisoning & Drug Overdose)",Book,http://www.amazon.com/dp/0071668330/,2,1
"Tintinalli's Emergency Medicine: A Comprehensive Study Guide, 8th edition",Book,http://www.amazon.com/dp/007179476X/,3,1
Hallucinations,Book,http://www.amazon.com/dp/0307947432/,6,1
Pathophysiology of Disease: An Introduction to Clinical Medicine 7/E (Lange Medical Books),Book,http://www.amazon.com/dp/0071806008/,1,1
"Fitzpatrick's Color Atlas and Synopsis of Clinical Dermatology, Seventh Edition (Color Atlas & Synopsis of Clinical Dermatology (Fitzpatrick))",Book,http://www.amazon.com/dp/007179302X/,1,1
"Morgan and Mikhail's Clinical Anesthesiology, 5th edition (Lange Medical Books)",Book,http://www.amazon.com/dp/0071627030/,1,1
Physiological Medicine: A Clinical Approach to Basic Medical Physiology,Book,http://www.amazon.com/dp/0070381283/,1,1
"The Ultimate Guide to Choosing a Medical Specialty, Third Edition",Book,http://www.amazon.com/dp/0071790276/,3,1
Awakenings,Book,http://www.amazon.com/dp/0375704051/,2,1
Catastrophic Care: Why Everything We Think We Know about Health Care Is Wrong,Book,http://www.amazon.com/dp/034580273X/,1,1
The Medical War: British Military Medicine in the First World War,Book,http://www.amazon.com/dp/0199575827/,1,1
An Introduction to Medical Statistics,Book,http://www.amazon.com/dp/0199589925/,2,1
Oxford Handbook of Clinical Specialties (Oxford Medical Handbooks),Book,http://www.amazon.com/dp/0199591180/,1,1
Oxford Handbook of Tropical Medicine (Oxford Medical Handbooks),Book,http://www.amazon.com/dp/0199692564/,1,1
"Autism's False Prophets: Bad Science, Risky Medicine, and the Search for a Cure",Book,http://www.amazon.com/dp/023114637X/,2,1
The Last Full Measure: How Soldiers Die in Battle,Book,http://www.amazon.com/dp/0307395855/,2,1
"Infections and Inequalities: The Modern Plagues, Updated with a New Preface",Book,http://www.amazon.com/dp/0520229134/,3,1
"Hot Lights, Cold Steel: Life, Death and Sleepless Nights in a Surgeon's First Years",Book,http://www.amazon.com/dp/0312352697/,1,1
Complications: A Surgeon's Notes on an Imperfect Science,Book,http://www.amazon.com/dp/0312421702/,2,1
"The Man Who Touched His Own Heart: True Tales of Science, Surgery, and Mystery",Book,http://www.amazon.com/dp/0316225797/,1,1
"The Healing of America: A Global Quest for Better, Cheaper, and Fairer Health Care",Book,http://www.amazon.com/dp/0143118218/,10,1
Infectious Diseases A Clinical Short Course 3/E (In Thirty Days Series),Book,http://www.amazon.com/dp/0071789251/,1,1
The Coming Plague: Newly Emerging Diseases in a World Out of Balance,Book,http://www.amazon.com/dp/0140250913/,3,1
"Field Guide to Wilderness Medicine: Expert Consult - Online and Print, 4e",Book,http://www.amazon.com/dp/0323100457/,2,1
"Dermatology DDX Deck, 2e",Book,http://www.amazon.com/dp/0323080790/,1,1
Becoming a Doctor: A Journey of Initiation in Medical School,Book,http://www.amazon.com/dp/0140111166/,1,1
"Netter's Anatomy Flash Cards: with Online Student Consult Access, 4e (Netter Basic Science)",Book,http://www.amazon.com/dp/0323185959/,6,1
"Learning Radiology: Recognizing the Basics, 3e",Book,http://www.amazon.com/dp/0323328075/,9,1
"Human Anatomy & Physiology, 8th Edition",Book,http://www.amazon.com/dp/0805395695/,1,1
"Mountains Beyond Mountains: The Quest of Dr. Paul Farmer, a Man Who Would Cure the World (Random House Reader's Circle)",Book,http://www.amazon.com/dp/0812980557/,4,1
The Puzzle People: Memoirs Of A Transplant Surgeon,Book,http://www.amazon.com/dp/0822958368/,1,1
Cutting for Stone,Book,http://www.amazon.com/dp/0375714367/,4,1
The Truth About the Drug Companies: How They Deceive Us and What to Do About It,Book,http://www.amazon.com/dp/0375760946/,4,1
Plagues and Peoples,Book,http://www.amazon.com/dp/0385121229/,1,1
The Practice of Surgical Pathology: A Beginner's Guide to the Diagnostic Process,Book,http://www.amazon.com/dp/0387744851/,6,1
Spillover: Animal Infections and the Next Human Pandemic,Book,http://www.amazon.com/dp/0393066800/,4,1
Stiff: The Curious Lives of Human Cadavers,Book,http://www.amazon.com/dp/0393324826/,32,1
"Deep Survival: Who Lives, Who Dies, and Why",Book,http://www.amazon.com/dp/0393326152/,11,1
Spillover: Animal Infections and the Next Human Pandemic,Book,http://www.amazon.com/dp/0393346617/,3,1
The Chimp and the River: How AIDS Emerged from an African Forest,Book,http://www.amazon.com/dp/0393350843/,2,1
Spitz and Fisher's Medicolegal Investigation of Death: Guidelines for the Application of Pathology to Crime Investigation,Book,http://www.amazon.com/dp/0398075441/,2,1
"Mandell, Douglas, and Bennett's Principles and Practice of Infectious Diseases: Expert Consult Premium Edition - Enhanced Online Features and Print (Two Volume Set)",Book,http://www.amazon.com/dp/0443068399/,1,1
On Call in Hell: A Doctor's Iraq War Story,Book,http://www.amazon.com/dp/045122308X/,2,1
The Medical Detectives: The Classic Collection of Award-Winning Medical Investigative Reporting (Truman Talley),Book,http://www.amazon.com/dp/0452265886/,2,1
Resident Readiness General Surgery,Book,http://www.amazon.com/dp/0071773193/,1,1
"Anesthesia Secrets, 4e",Book,http://www.amazon.com/dp/0323065244/,1,1
The Death of Ivan Ilyich (Bantam Classics),Book,http://www.amazon.com/dp/0553210351/,1,1
"Pain Assessment and Pharmacologic Management, 1e (Pasero, Pain Assessment and Pharmacologic Management)",Book,http://www.amazon.com/dp/0323056962/,4,1
The Power of a Positive No: Save The Deal Save The Relationship and Still Say No,Book,http://www.amazon.com/dp/0553384260/,3,1
Wit: A Play,Book,http://www.amazon.com/dp/0571198775/,1,1
Struck by Orca: ICD-10 Illustrated,Book,http://www.amazon.com/dp/0615955053/,1,1
The Other Side of Time: A Combat Surgeon In World War II,Book,http://www.amazon.com/dp/067166574X/,1,1
Biostatistics for Medical and Biomedical Practitioners,Book,http://www.amazon.com/dp/0128023872/,1,1
The Man Who Mistook His Wife For A Hat: And Other Clinical Tales,Book,http://www.amazon.com/dp/0684853949/,14,1
Doctors: The Biography of Medicine,Book,http://www.amazon.com/dp/0679760091/,1,1
"Berman's Pediatric Decision Making: Expert Consult - Online and Print, 5e",Book,http://www.amazon.com/dp/0323054056/,1,1
Blind Eye: The Terrifying Story Of A Doctor Who Got Away With Murder,Book,http://www.amazon.com/dp/0684865637/,2,1
"Dermatology: 2-Volume Set: Expert Consult Premium Edition - Enhanced Online Features and Print, 3e (Bolognia, Dermatology)",Book,http://www.amazon.com/dp/0723435715/,1,1
ECG's for the Emergency Physician 1,Book,http://www.amazon.com/dp/0727916548/,4,1
"Basic Physics & Measurement in Anaesthesia, 5e",Book,http://www.amazon.com/dp/0750648287/,1,1
"12-Lead ECG: The Art Of Interpretation (Garcia, Introduction to 12-Lead ECG)",Book,http://www.amazon.com/dp/0763773514/,4,1
Every Patient Tells a Story: Medical Mysteries and the Art of Diagnosis,Book,http://www.amazon.com/dp/0767922476/,2,1
High-Resolution CT of the Lung,Book,http://www.amazon.com/dp/0781769094/,1,1
Medical Spanish Made Incredibly Easy! (Incredibly Easy! Series®),Book,http://www.amazon.com/dp/0781789419/,1,1
Time to Pee!,Book,http://www.amazon.com/dp/0786818689/,2,1
The Magic Circle of Rudolf II: Alchemy and Astrology in Renaissance Prague,Book,http://www.amazon.com/dp/0802715516/,1,1
"ACLS, CPR, and PALS: Clinical Pocket Guide",Book,http://www.amazon.com/dp/0803623143/,1,1
Missing Microbes: How the Overuse of Antibiotics Is Fueling Our Modern Plagues,Book,http://www.amazon.com/dp/0805098100/,3,1
Make It Stick: The Science of Successful Learning,Book,http://www.amazon.com/dp/0674729013/,41,1
Mountains Beyond Mountains,Book,http://www.amazon.com/dp/0812973011/,2,1
Addiction: A Disorder of Choice,Book,http://www.amazon.com/dp/0674057279/,3,1
"America's Bitter Pill: Money, Politics, Back-Room Deals, and the Fight to Fix Our Broken Healthcare System",Book,http://www.amazon.com/dp/081299695X/,1,1
The Anatomy Coloring Book,Book,http://www.amazon.com/dp/0321832019/,17,1
Perinatal Nutrition: Optimizing Infant Health & Development (Nutrition and Disease Prevention),Book,http://www.amazon.com/dp/0824754743/,1,1
The Neurobiology of Opiates (Physiology of Substance Abuse),Book,http://www.amazon.com/dp/0849379326/,1,1
The Entrepreneurial State: Debunking Public vs. Private Sector Myths (Anthem Other Canon Economics),Book,http://www.amazon.com/dp/0857282522/,7,1
Witchdoctors and Psychiatrists: The Common Roots of Psychotherapy and It's Future,Book,http://www.amazon.com/dp/0876689713/,1,1
"Neuroscience, Fifth Edition",Book,http://www.amazon.com/dp/0878936955/,9,1
Orthopaedic Knowledge Update: Musculoskeletal Tumors 3 (Orthopedic Knowledge Update),Book,http://www.amazon.com/dp/089203968X/,1,1
"Rapid Interpretation of EKG's, Sixth Edition",Book,http://www.amazon.com/dp/0912912065/,27,1
"Acid-Base, Fluids, and Electrolytes Made Ridiculously Simple",Book,http://www.amazon.com/dp/0940780984/,1,1
"Where There Is No Doctor: A Village Health Care Handbook, Revised Edition",Book,http://www.amazon.com/dp/0942364155/,9,1
Maxwell Quick Medical Reference,Book,http://www.amazon.com/dp/0964519135/,4,1
Maxwell Quick Medical Reference,Book,http://www.amazon.com/dp/0964519143/,3,1
The Ventilator Book,Book,http://www.amazon.com/dp/098529650X/,4,1
Physician Suicide Letters Answered,Book,http://www.amazon.com/dp/0985710322/,1,1
The Chief Complaint,Book,http://www.amazon.com/dp/0989851915/,1,1
The White Coat Investor: A Doctor's Guide To Personal Finance And Investing,Book,http://www.amazon.com/dp/0991433106/,11,1
Medical Nutrition and Disease: A Case-Based Approach,Book,http://www.amazon.com/dp/1118652436/,1,1
Understanding Value Based Healthcare,Book,http://www.amazon.com/dp/0071816984/,1,1
