name,category,amazon_link,total_mentions,subreddit_mentions
Kojiki (Princeton Legacy Library),Books,https://www.amazon.com/Kojiki-Princeton-Legacy-Library-Philippi/dp/0691622078/ref=mt_paperback?_encoding=UTF8&amp;me=,,1
PlayStation TV,Video Games,https://www.amazon.com/PlayStation-TV/dp/B00KVMHSUM/ref=sr_1_1?ie=UTF8&amp;qid=1482285797&amp;sr=8-1&amp;keywords=playstation+tv,12,1
Final Fantasy XV - PlayStation 4,Video Games,https://www.amazon.com/Final-Fantasy-XV-PlayStation-4/dp/B00DBF829C/ref=sr_1_1?s=videogames&amp;ie=UTF8&amp;qid=1486479787&amp;sr=1-1&amp;keywords=final+fantasy+xv,2,1
Emotional and Behavioral Problems of Young Children: Effective Interventions in the Preschool and Kindergarten Years,Books,https://www.amazon.com/Emotional-Behavioral-Problems-Young-Children/dp/1572308613/ref=sr_1_6?ie=UTF8&amp;qid=1441710517&amp;sr=8-6&amp;keywords=emotional+problems,1,1
Xavier Musketeers Basketball Logo Women's Halter Top Bikini Swimsuit,"Clothing, Shoes & Jewelry",https://www.amazon.com/Xavier-Musketeers-Basketball-Womens-Swimsuit/dp/B01F6JKT9G?ie=UTF8&amp;m=A2HDXN6GVDI3K5&amp;ref_=v_sp_detail_page,1,1
Shin Megami Tensei: Digital Devil Saga - PlayStation 2,Video Games,https://www.amazon.com/gp/product/B00008KTRS/ref=pd_lpo_sbs_dp_ss_3?pf_rd_p=1944687782&amp;pf_rd_s=lpo-top-stripe-1&amp;pf_rd_t=201&amp;pf_rd_i=B00024W1U6&amp;pf_rd_m=ATVPDKIKX0DER&amp;pf_rd_r=0ZM9Y7981V3TJ9Z17DF7,1,1
Shin Megami Tensei IV Apocalypse Toddler Kid's Snapback Adjustable Mesh Hat,"Clothing, Shoes & Jewelry",https://www.amazon.com/Megami-Apocalypse-Toddler-Snapback-Adjustable/dp/B01F3BD7NM,1,1
An Inquiry into the Good,Books,https://www.amazon.com/Inquiry-into-Good-Kitaro-Nishida/dp/0300052332/ref=pd_bxgy_b_img_y,1,1
Kazuma Kaneko Art Book Works Vol.2 Megami Tensei,Books,https://www.amazon.com/Kazuma-Kaneko-Works-Megami-Tensei/dp/4775303503/ref=sr_1_2?s=books&amp;ie=UTF8&amp;qid=1444344060&amp;sr=1-2&amp;keywords=kaneko+art+book,1,1
Kazuma Kaneko Art Book Works Vol.3 Megami Tensei,Books,https://www.amazon.com/Kazuma-Kaneko-Works-Megami-Tensei/dp/477530609X/ref=sr_1_1?s=books&amp;ie=UTF8&amp;qid=1444344060&amp;sr=1-1&amp;keywords=kaneko+art+book,1,1
zeroUV - Vintage Inspired Clear Lens Small Circle Round Sunglasses,"Clothing, Shoes & Jewelry",https://www.amazon.com/zeroUV-Vintage-Inspired-Circle-Sunglasses/dp/B01LZ4MXWD/ref=redir_mobile_desktop?_encoding=UTF8&amp%3BdpID=712KWhi-8aL&amp%3BdpPl=1&amp%3BrefRID=E2BFTNM6TZC9GZTXTEW4&ref_=pd_aw_sbs_309_2,1,1
Shin Megami Tensei Persona 3 Portable : Aegis GEE! Normal Equipment Ver. (Limited Edition) PVC Figure - COSPA,Toys & Games,https://www.amazon.com/Shin-Megami-Tensei-Persona-Portable/dp/B004CJI90S/ref=sr_1_6?ie=UTF8&amp;qid=1478589263&amp;sr=8-6&amp;keywords=persona+3+aigis,1,1
Velvet Room Strip Club Matchbook Vintage Advertising Art Reproduction Men's T-Shirt (5x7 Notecard),Home & Kitchen,https://www.amazon.com/Matchbook-Advertising-Art-Reproduction-Notecard/dp/B01EBFQI5A,1,1
