name,category,amazon_link,total_mentions,subreddit_mentions
Audio Technica ATH-EQ300M SV Silver | Ear-Fit Headphones (Japan Import),CE,http://www.amazon.com/dp/B001DDEJLE/,9,5
PlayStation TV,Video Games,http://www.amazon.com/dp/B00KVMHSUM/,77,4
Kazuma Kaneko Art Book Works Vol.3 Megami Tensei,Book,http://www.amazon.com/dp/477530609X/,3,3
An Inquiry into the Good,Book,http://www.amazon.com/dp/0300052332/,7,2
Metal Gear Solid: The Legacy Collection,Video Games,http://www.amazon.com/dp/B00CTKHXFO/,81,2
"Persona 5 - PlayStation 4 ""Take Your Heart"" Premium Edition",Video Games,http://www.amazon.com/dp/B01GKHJPAC/,15,2
Shin Megami Tensei: Digital Devil Saga - PlayStation 2,Video Games,http://www.amazon.com/dp/B00008KTRS/,3,2
Shin Megami Tensei IV - Nintendo 3DS,Video Games,http://www.amazon.com/dp/B00C1ZBFTW/,7,2
Persona 4 Volume 1 (Persona 4 Gn),Book,http://www.amazon.com/dp/1927925576/,2,2
Bandai Tamashii Nations D-Arts Elizabeth Action Figure,Toy,http://www.amazon.com/dp/B00E8ZK3EG/,2,2
Kazuma Kaneko Art Book Works Vol.2 Megami Tensei,Book,http://www.amazon.com/dp/4775303503/,2,2
Tokyo Mirage Sessions #FE : Special Edition - Wii U Special Edition,Video Games,http://www.amazon.com/dp/B01EO1WURQ/,5,2
Meditations (Dover Thrift Editions),Book,http://www.amazon.com/dp/048629823X/,22,1
Principia Ethica (Principles of Ethics) (Philosophical Classics),Book,http://www.amazon.com/dp/0486437523/,3,1
Utilitarianism: For and Against,Book,http://www.amazon.com/dp/052109822X/,6,1
An Introduction to Hinduism (Introduction to Religion),Book,http://www.amazon.com/dp/0521438780/,3,1
"The History of the Runestaff: The Jewel in the Skull, The Mad God's Amulet, The Sword of the Dawn, The Runestaff (Fantasy Masterworks)",Book,http://www.amazon.com/dp/0575074698/,1,1
Kojiki (Princeton Legacy Library),Book,http://www.amazon.com/dp/0691622078/,1,1
The Elric Saga: Part IV (The Dreamthief's Daughter; The Skrayling Tree; The White Wolf's Son),Book,http://www.amazon.com/dp/0739456911/,1,1
The Three-Body Problem (Remembrance of Earth's Past),Book,http://www.amazon.com/dp/0765377063/,14,1
Shinto the Kami Way,Book,http://www.amazon.com/dp/0804835578/,2,1
The Life You Can Save: How to Do Your Part to End World Poverty,Book,http://www.amazon.com/dp/0812981561/,6,1
"The Methods of Ethics, 7th Edition (Hackett Classics)",Book,http://www.amazon.com/dp/0915145286/,2,1
My View of the World,Book,http://www.amazon.com/dp/0918024307/,10,1
Ten Billion Days and One Hundred Billion Nights,Book,http://www.amazon.com/dp/142154931X/,2,1
"Uzumaki (3-in-1, Deluxe Edition): Includes vols. 1, 2 & 3",Book,http://www.amazon.com/dp/1421561328/,17,1
Stoicism and the Art of Happiness (Teach Yourself: Philosophy & Religion),Book,http://www.amazon.com/dp/1444187104/,29,1
"Mind Over Mood, Second Edition: Change How You Feel by Changing the Way You Think",Book,http://www.amazon.com/dp/1462520421/,13,1
Emotional and Behavioral Problems of Young Children: Effective Interventions in the Preschool and Kindergarten Years,Book,http://www.amazon.com/dp/1572308613/,1,1
The New Gospel of Christian Atheism,Book,http://www.amazon.com/dp/1888570652/,3,1
Shigenori Soejima Artworks,Book,http://www.amazon.com/dp/1926778324/,1,1
Persona 4: Official Design Works,Book,http://www.amazon.com/dp/1926778456/,2,1
Shin Megami Tensei IV: Official Artworks,Book,http://www.amazon.com/dp/1927925584/,1,1
Buddhist Cosmology: Philosophy and Origins,Book,http://www.amazon.com/dp/4333016827/,1,1
Final Fantasy Anthology (Final Fantasy V & VI),Video Games,http://www.amazon.com/dp/B00002R28C/,5,1
Final Fantasy Origins Final Fantasy I & II Remastered Editions - PlayStation,Video Games,http://www.amazon.com/dp/B00008RUYZ/,3,1
Demi-Kids: Dark Version,Video Games,http://www.amazon.com/dp/B00009YXBT/,1,1
Shin Megami Tensei Nocturne,Video Games,http://www.amazon.com/dp/B00024W1U6/,1,1
Shin Megami Tensei Devil Summoner - PlayStation 2,Video Games,http://www.amazon.com/dp/B000FPGZUE/,1,1
Recordable Sound Module -107,Art and Craft Supply,http://www.amazon.com/dp/B000JG902O/,4,1
Shin Megami Tensei Persona Original Soundtrack,Music,http://www.amazon.com/dp/B0037FMVJI/,1,1
Shin Megami Tensei Persona 3 Portable : Aegis GEE! Normal Equipment Ver. (Limited Edition) PVC Figure - COSPA,Toy,http://www.amazon.com/dp/B004CJI90S/,1,1
$20 PlayStation Store Gift Card - PS3/ PS4/ PS Vita [Digital Code],Digital Video Games,http://www.amazon.com/dp/B004RMK4BC/,21,1
SteelSeries Siberia v2 Full-Size Gaming Headset (Blue),CE,http://www.amazon.com/dp/B005B1BE08/,2,1
GCC Mini Persona 2 Innocent Sin Random Keychain Figure,Shoes,http://www.amazon.com/dp/B0069JRLKI/,1,1
FREEing Persona 2: Innocent Sin: Lisa Silverman PVC Figure (1:8 Scale),Toy,http://www.amazon.com/dp/B008M41956/,1,1
D-Arts : Persona 4 Magatsu Izanagi,Toy,http://www.amazon.com/dp/B008SBWWAE/,1,1
Persona 4: The Animation Collection 2 [Blu-ray],DVD,http://www.amazon.com/dp/B009Q6F5FE/,1,1
P4 Persona4 the ANIMATION Happy lottery prize Persona 4 C white bell Naoto figure Happy lottery,Toy,http://www.amazon.com/dp/B00A1HFNI6/,1,1
How to Play a Shin Megami Tensei RPG,eBooks,http://www.amazon.com/dp/B00CS4GP96/,1,1
Dezasukin Shin Megami Tensei IV Skins for 3DS LL design 04,Video Games,http://www.amazon.com/dp/B00D3G768C/,1,1
Final Fantasy XV - PlayStation 4,Video Games,http://www.amazon.com/dp/B00DBF829C/,6,1
Huion H420 Osu Tablet Graphics Drawing Signature Pad with 3 Express Keys (4-by-2.23 Inches),Personal Computer,http://www.amazon.com/dp/B00DM24HNE/,7,1
"Panda 300Mbps Wireless N USB Adapter - Windows Vista/7/8/8.1/10, Mint, Ubuntu, Fedora, openSUSE, CentOS, Lubuntu, Zorin, Kali Linux and Raspbian Wheezy",PC Accessory,http://www.amazon.com/dp/B00EQT0YK2/,13,1
Persona 4 Arena Ultimax - PlayStation 3,Video Games,http://www.amazon.com/dp/B00KBD4SJA/,2,1
"Avatar Tuner, Vol. 1 (Quantum Devil Saga)",eBooks,http://www.amazon.com/dp/B00M9Z3HHM/,2,1
DMC Devil May Cry: Definitive Edition - PlayStation 4,Video Games,http://www.amazon.com/dp/B00R9NWTQO/,1,1
Kisekae plate No.055 (Legend of Zelda),Video Games,http://www.amazon.com/dp/B00T73HPMM/,5,1
Senran Kagura 2: Deep Crimson - 'Double D' - Nintendo 3DS,Video Games,http://www.amazon.com/dp/B00UJ9LSB2/,3,1
"Persona 3 Fuuka Mouse Pad, Mousepad (10.2 x 8.3 x 0.12 inches)",Office Product,http://www.amazon.com/dp/B00WR3IJQA/,1,1
"Persona 4: Dancing All Night ""Disco Fever Collector's Edition""",Video Games,http://www.amazon.com/dp/B00YFAIWYW/,3,1
"CyberpowerPC Gamer Ultra GUA3400A Gaming Desktop - AMD FX-6300 Six Core 3.5GHz, 8GB DDR3 RAM, 1TB HDD, 24X DVD, AMD R7 250 2GB, Windows 10 Home",Personal Computer,http://www.amazon.com/dp/B0111MU5ZA/,5,1
Odin Sphere Leifthrasir: Storybook Edition - PlayStation 4 Storybook Edition,Video Games,http://www.amazon.com/dp/B0186D1U74/,1,1
"Anker PowerCore 10000, One of the Smallest and Lightest 10000mAh External Batteries, Ultra-Compact, High-speed Charging Technology Power Bank for iPhone, Samsung Galaxy and More",Wireless,http://www.amazon.com/dp/B0194WDVHI/,75,1
Velvet Room Strip Club Matchbook Vintage Advertising Art Reproduction Men's T-Shirt (5x7 Notecard),Home,http://www.amazon.com/dp/B01EBFQI5A/,1,1
Shin Megami Tensei IV Apocalypse Toddler Kid's Snapback Adjustable Mesh Hat,Apparel,http://www.amazon.com/dp/B01F3BD7NM/,1,1
Xavier Musketeers Basketball Logo Women's Halter Top Bikini Swimsuit,Apparel,http://www.amazon.com/dp/B01F6JKT9G/,1,1
"kuman 7 Inch HD Display 1024x600 TFT LCD Screen Monitor for Raspberry Pi 3 2B B RPi 1 B+ A+ with HDMI VGA Input, DVD VCR Car and Remote HDMI Cable SC7J",PC Accessory,http://www.amazon.com/dp/B01FFAFMM0/,3,1
Persona 5 - SteelBook Edition - PlayStation 4,Video Games,http://www.amazon.com/dp/B01GKHJPG6/,4,1
"2016 Dell Inspiron 15.6"" Full HD touchscreen 1920x1080 Signature Laptop, Intel Core i5-6200U 2.3GHz, 8GB RAM, 1TB HDD, 802.11ac, Bluetooth, HDMI, Intel RealSense 3D camera, Windows 10 Home",Personal Computer,http://www.amazon.com/dp/B01KN1BGD0/,1,1
zeroUV - Vintage Inspired Clear Lens Small Circle Round Sunglasses,Apparel,http://www.amazon.com/dp/B01LZ4MXWD/,1,1
TCL 43S405 43-Inch 4K Ultra HD Roku Smart LED TV (2017 Model),Home Theater,http://www.amazon.com/dp/B01N29XPO3/,3,1
Shin Megami Tensei: Strange Journey Redux - Nintendo 3DS,Video Games,http://www.amazon.com/dp/B071JQS1MF/,3,1
The Nag Hammadi Scriptures: The Revised and Updated Translation of Sacred Gnostic Texts Complete in One Volume,Book,http://www.amazon.com/dp/0061626007/,5,1
Ku Cuck Klan: The Family Values,eBooks,http://www.amazon.com/dp/B075PL3HTN/,1,1
Utilitarianism and Other Essays,Book,http://www.amazon.com/dp/0140432728/,2,1
Letters from a Stoic (Penguin Classics),Book,http://www.amazon.com/dp/0140442103/,19,1
A Guide to the Good Life: The Ancient Art of Stoic Joy,Book,http://www.amazon.com/dp/0195374614/,72,1
Consequentialism and Its Critics (Oxford Readings in Philosophy),Book,http://www.amazon.com/dp/0198750730/,1,1
The Language of Morals (Oxford Paperbacks),Book,http://www.amazon.com/dp/0198810776/,1,1
The Kojiki: An Account of Ancient Matters (Translations from the Asian Classics),Book,http://www.amazon.com/dp/0231163894/,1,1
Seeing like a State: How Certain Schemes to Improve the Human Condition Have Failed,Book,http://www.amazon.com/dp/0300078153/,10,1
Norse Mythology,Book,http://www.amazon.com/dp/039360909X/,10,1
Consequentialism (New Problems of Philosophy),Book,http://www.amazon.com/dp/0415772583/,2,1
Elric of Melnibone 1,Book,http://www.amazon.com/dp/0441203981/,4,1
The Discourses of Epictetus - The Handbook - Fragments (Everyman's Library),Book,http://www.amazon.com/dp/0460873121/,5,1
