name,category,amazon_link,total_mentions,subreddit_mentions
Metal Gear Solid: The Legacy Collection,Video Games,http://www.amazon.com/dp/B00CTKHXFO/,19,2
Metal Gear Solid HD Collection,Video Games,http://www.amazon.com/dp/B0050SYOOA/,6,2
Microsoft Xbox 360 Wired Controller for Windows & Xbox 360 Console,CE,http://www.amazon.com/dp/B004QRKWLA/,25,1
Microsoft Xbox 360 Wireless Receiver for Windows,Personal Computer,http://www.amazon.com/dp/B000HZFCT2/,15,1
"Musher's Secret Pet Paw Protection Wax, 200-Gram",Pet Products,http://www.amazon.com/dp/B0002XIZXY/,12,1
The Subtle Art of Not Giving a F*ck: A Counterintuitive Approach to Living a Good Life,eBooks,http://www.amazon.com/dp/B019MMUA8S/,7,1
Blackwater: The Rise of the World's Most Powerful Mercenary Army [Revised and Updated],Book,http://www.amazon.com/dp/156858394X/,5,1
Xbox 360 Wireless Controller - Glossy Black,Video Games,http://www.amazon.com/dp/B003ZSP0WW/,3,1
Metal Gear Solid V: The Phantom Pain - PlayStation 4 Collector's Edition,Video Games,http://www.amazon.com/dp/B00UFOYR2I/,2,1
"PS3 Android Phone Clamp, Megadream 180 Degree Adjustable Smartphone Game Clip Mount Stand Holder for Playstation 3 Controller & Samsung Galaxy S7 S6 S5 Note 6 5 Sony Xperia HTC LG - Max Clamp 6 inch",CE,http://www.amazon.com/dp/B00UCS46NC/,2,1
PlayStation 3 Dualshock 3 Wireless Controller (Black),Video Games,http://www.amazon.com/dp/B0015AARJI/,2,1
Casio Men's AE1200WH-1A World Time Multifunction Watch,Watch,http://www.amazon.com/dp/B0094B79PA/,2,1
UNCHARTED: The Nathan Drake Collection - PlayStation 4,Video Games,http://www.amazon.com/dp/B00YQM1PNY/,2,1
Fallout 3: Game of the Year Edition,Video Games,http://www.amazon.com/dp/B001REZLY8/,2,1
"DRSKIN Compression Cool Dry Sports Tights Shirt Baselayer Running Leggings Yoga Rashguard Men (5S, SABB01)",Sports,http://www.amazon.com/dp/B01BS1EL4U/,1,1
"Rothco Leather D3-A Type Gloves, Black, Size 4",Sports,http://www.amazon.com/dp/B00028CGZM/,1,1
"Calorie Mate Calorie Mate Balanced Food, Chocolate, 2.74 Ounce",Grocery,http://www.amazon.com/dp/B000W9CNOK/,1,1
Metal Gear Solid Risk,Toy,http://www.amazon.com/dp/B005OEDTB4/,1,1
Metal Gear Solid V: The Phantom Pain - Xbox One Collector's Edition,Video Games,http://www.amazon.com/dp/B00UFOYR8W/,1,1
Metal Gear Solid,Book,http://www.amazon.com/dp/0345503287/,1,1
Sentinel Metal Gear Solid V: Ground Zeroes iDroid Type iPhone Case,Toy,http://www.amazon.com/dp/B00JUECH5S/,1,1
Insten 90 Degree USB 2.0 A Female to Micro B Male Converter Host OTG Adaptor Cable,Cell Phones & Accessories,https://www.amazon.com/niceeshop-Degree-Female-Converter-Adaptor/dp/B00871Q5PI/ref=sr_1_4?rps=1&amp;ie=UTF8&amp;qid=1439504923&amp;sr=8-4&amp;keywords=micro+usb+otg+cable&amp;refinements=p_85,1,1
The Art of Metal Gear Solid V Limited Edition,Book,http://www.amazon.com/dp/1506702678/,1,1
Assault in Norway: Sabotaging The Nazi Nuclear Program,Book,http://www.amazon.com/dp/1599219123/,1,1
Metal Gear Solid Omnibus,Book,http://www.amazon.com/dp/1600106633/,1,1
Head Transplantation: and the QUEST for IMMORTALITY,Book,http://www.amazon.com/dp/1503243222/,1,1
Shine Itazura Stealing Coin Bank - Panda,Toy,http://www.amazon.com/dp/B004R9K95G/,1,1
