name,category,amazon_link,total_mentions,subreddit_mentions
Hang-Ups: Paintings by Jonathan Winters,Book,http://www.amazon.com/dp/0394570243/,1,1
Danish Modern and Beyond: Scandinavian Inspired Furniture from Heywood-Wakefield (Schiffer Book for Collectors),Book,http://www.amazon.com/dp/0764322168/,2,1
Op to Pop: Furniture of the 1960's,Book,http://www.amazon.com/dp/0821225162/,1,1
Practical & decorative concrete,Book,http://www.amazon.com/dp/0912336382/,1,1
Atomic Ranch Midcentury Interiors,Book,http://www.amazon.com/dp/1423619315/,1,1
A. Quincy Jones: Building for Better Living,Book,http://www.amazon.com/dp/3791352652/,1,1
1000 Chairs,Book,http://www.amazon.com/dp/3836546744/,1,1
Iron Curtain Graphics: Eastern European Design Created without Computers,Book,http://www.amazon.com/dp/3899553942/,1,1
"7048000 12-Foot Swag Kit, Polished Brass Finish",Home Improvement,http://www.amazon.com/dp/B00002NADM/,1,1
"World Confections Candy Cigarettes, Pack of 24",Grocery,http://www.amazon.com/dp/B000BXSRT2/,15,1
"Howard RF4016 Restor-A-Finish, 16-Ounce, Walnut",Home Improvement,http://www.amazon.com/dp/B000LNSIM8/,9,1
"Artscape Etched Glass Window Film 36"" x 72""",Art and Craft Supply,http://www.amazon.com/dp/B000Q3K20O/,6,1
"Howard FW0016 Feed-N-Wax Wood Polish and Conditioner, Beeswax & Orange Oil, 16-Ounce",Home Improvement,http://www.amazon.com/dp/B001BKQYGW/,6,1
Fold Platform Bed - Full,Home,http://www.amazon.com/dp/B001IPVWG2/,3,1
"ACME 02277 Naomi 3-Panel Wooden Screen, Cherry Finish",Furniture,http://www.amazon.com/dp/B002WGJHB8/,2,1
"Umbra FishHotel Mini Aquarium, Great for Goldfish, Bettas, and Other Small Fish, 1.8 Gallon",Pet Products,http://www.amazon.com/dp/B0033FGDRS/,1,1
"Remington Fuzz-Away Fabric Shaver, RTFS-2",Beauty,http://www.amazon.com/dp/B0034BV6KA/,15,1
Toynami Futurama Talking Bender Figure,Toy,http://www.amazon.com/dp/B004I7YVJ2/,1,1
3M 08579 Leather & Vinyl Repair Kit,Automotive Parts and Accessories,http://www.amazon.com/dp/B0058WXNOK/,3,1
Lepai LP-168HA 2.1 2 x 40-Watt Amplifier and 1x68W Sub Output,Speakers,http://www.amazon.com/dp/B0070Z87YO/,14,1
"G7 Power Boulder LED 0.5 Watt (5W) 15 Lumen C7 Night Light Bulb, 2900K Soft White Light, E12 Base 2-Pack",Home Improvement,http://www.amazon.com/dp/B00CRHG63Y/,1,1
FantaSeas Retro Townhouse 1.6 Gallon Fish Bowl,Pet Products,http://www.amazon.com/dp/B00E96EN8G/,1,1
"LED2020 LED Vintage Filament Bulb,A19 Edison Style,4W to Replace 40W Incandescent Bulb,Soft White (2700K), 120VAC, E26 Medium Base, Not Dimmable",Home Improvement,http://www.amazon.com/dp/B00HZC5UOW/,5,1
"Access Lighting 55543-CH Flux Sixteen Light 19-Inch Height Chandelier, Chrome Finish",Home Improvement,http://www.amazon.com/dp/B00I1CQL6Q/,1,1
"WOYBR CHR-JY-VMO WL+E Bent Wood, Woven Fabric, Vintage Mod Chair",Furniture,http://www.amazon.com/dp/B00LNAOQZ6/,1,1
"Porthos Home Monroe Adjustable Office Chair, Black",Furniture,http://www.amazon.com/dp/B00P7T5T8W/,2,1
"Antique Revival KCH001A RED Monroe Adjustable Modern Barstool, Red",Furniture,http://www.amazon.com/dp/B00P7T5TAU/,1,1
ModHaus Premium Quality Handcrafted Mid Century Modern Eames Style Lounge Chair & Ottoman Set - Black Top Grain Aniline Leather & Real Walnut Veneer,Furniture,http://www.amazon.com/dp/B00Q7FZD5O/,1,1
FARTECH Auto Calendar Flip Clock AD-650 (Orange),Home,http://www.amazon.com/dp/B00WO5C4YE/,1,1
"Queen to Full Converter Premium Specialty Bed Frame Rail System, Three Supports, Three Legs",Furniture,http://www.amazon.com/dp/B013UA8AQC/,1,1
"LeatherPlus - Leather and Vinyl Repair and Restoration Kit for Couch, Car Seats, Sofa, Jackets, Purse, Boots - Fast-drying, No heat adhesive",Art and Craft Supply,http://www.amazon.com/dp/B01AVVUHQO/,1,1
"2xhome - Set of Two (2) - White - 28"" Seat Height Eames Chair Eames Stool Style DSW Molded Plastic Bar Stool Modern Barstool Counter Stools with backs and armless Natural Legs Wood Eiffel Legs",Furniture,http://www.amazon.com/dp/B01BL28HAA/,1,1
Mainstays 95-inch Yellow Chevron Panel Pair,Home,http://www.amazon.com/dp/B01EZIAF5W/,1,1
