name,category,amazon_link,total_mentions,subreddit_mentions
GUTS 'N GUNSHIPS: What it was Really Like to Fly Combat Helicopters in Vietnam,eBooks,http://www.amazon.com/dp/B014TUIW7O/,12,2
Inside Delta Force: The Story of America's Elite Counterterrorist Unit,Book,http://www.amazon.com/dp/038573252X/,3,2
Combat and Survival - Complete 28 Volume Set - What it Takes to Fight and Win,Book,http://www.amazon.com/dp/B000HD0MO4/,2,2
Hue 1968: A Turning Point of the American War in Vietnam,eBooks,http://www.amazon.com/dp/B071Y87H9H/,,1
"Bristol's Bastards: In Iraq with the 2nd Battalion, 136th Infantry of Minnesota's National Guard",eBooks,http://www.amazon.com/dp/B004NNUXVG/,,1
Ranger Knowledge: The All-Inclusive Study Guide for Rangers (SOFREP),eBooks,http://www.amazon.com/dp/B00D0N20HK/,,1
Rise of the Warrior Cop: The Militarization of America's Police Forces,Book,http://www.amazon.com/dp/1610394577/,19,1
How to Avoid Huge Ships,Books,https://www.amazon.com/Avoid-Huge-Ships-John-Trimmer/dp/0870334336/ref=sr_1_2?ie=UTF8&amp;qid=1503277399&amp;sr=8-2&amp;keywords=how+to+avoid+huge+ships,10,1
"Pilot G2 Retractable Premium Gel Ink Roller Ball Pens, Fine Pt, Dozen Box, Black",Office Products,https://www.amazon.com/Pilot-Retractable-Premium-Roller-31020/dp/B001GAOTSW,10,1
Images You Should Not Masturbate To,Book,http://www.amazon.com/dp/0399536493/,7,1
"Mack's Pillow Soft Silicone Earplugs Value Pack, 6 Pairs","Health, Household & Baby Care",https://www.amazon.com/Macks-Pillow-Silicone-Earplugs-Value/dp/B003LZQGN6/ref=redir_mobile_desktop?ie=UTF8&amp;dpID=51138MHPBtL&amp;dpPl=1&amp;keywords=silicone,7,1
"Certain Dri Anti-Perspirant, Roll-On, Pack of 1, 1.2 oz","Health, Household & Baby Care",https://www.amazon.com/Certain-Dri-Anti-Perspirant-Roll/dp/B000052X8R/ref=sr_1_1?s=hpc&amp;ie=UTF8&amp;qid=1441666517&amp;sr=1-1&amp;keywords=certain+dri&amp;pebp=1441666521793&amp;perid=0V3ZRGS6ME95GQQ2Q2QP,6,1
"STANLEY J5C09 Jump Starter: 1000 Peak/500 Instant Amps, 120 PSI Air Compressor",Automotive Parts and Accessories,http://www.amazon.com/dp/B002X6VXL4/,6,1
Polywatch Plastic Lens Scratch Remover,Watch,http://www.amazon.com/dp/B0014R9V9O/,4,1
Marine Sniper: 93 Confirmed Kills,Book,http://www.amazon.com/dp/0425103552/,4,1
The Big Coloring Book of Cocks,Book,http://www.amazon.com/dp/B000W8OX6C/,3,1
Sog: The Secret Wars of America's Commandos in Vietnam,Book,http://www.amazon.com/dp/0451195086/,3,1
"Skilcraft 7520-00-935-7136 U.S. Government Retractable Black Barrel Medium Point Ball Point Pen, Black Ink, (Pack of 12)",Art and Craft Supply,http://www.amazon.com/dp/B0055KSO3A/,3,1
Street Without Joy: The French Debacle in Indochina (Stackpole Military History Series),Book,http://www.amazon.com/dp/0811732363/,2,1
The Only Thing Worth Dying For: How Eleven Green Berets Fought for a New Afghanistan (P.S.),Book,http://www.amazon.com/dp/0061661236/,2,1
"Field Jacket Liner, M-65, Olive Drab--Genuine Military Issue, Large - NSN:8415-00-782-2889",Apparel,http://www.amazon.com/dp/B006RKV3US/,2,1
Gold Bond Friction Defense Stick Unscented 1.75 oz,Health and Beauty,http://www.amazon.com/dp/B007VC9DKI/,2,1
Scotch Thermal Laminator 2 Roller System (TL901C),Office Product,http://www.amazon.com/dp/B0010JEJPC/,2,1
Invisible Nation: How the Kurds' Quest for Statehood Is Shaping Iraq and the Middle East,Book,http://www.amazon.com/dp/0802717438/,2,1
"Green Military Log Book, Record Book, Memorandum Book, 5-1/2 X 8 Green LogBook NSN 7530-00-222-3521",Office Product,http://www.amazon.com/dp/B0064M7X30/,2,1
Casio Men's F108WH Illuminator Collection Black Resin Strap Digital Watch,Watch,http://www.amazon.com/dp/B0053HBJBE/,2,1
Stanley 037025H 50 Gallon Mobile Chest,Home Improvement,http://www.amazon.com/dp/B000Q5LZT4/,2,1
"The Mission, the Men, and Me: Lessons from a Former Delta Force Commander",Book,http://www.amazon.com/dp/0425236579/,2,1
"SKILCRAFT B3 Aviator Multi-function Pen Black/Red Ink, Medium Point with Pencil (7520-01-564-9906)",Office Product,http://www.amazon.com/dp/B001KKPGHQ/,2,1
Women in War,Book,http://www.amazon.com/dp/0710420331/,1,1
Maxpedition Rollypoly Folding Dump Pouch (Khaki),Sports,http://www.amazon.com/dp/B004Q5E8YO/,1,1
DECOMIL Flag Display Case with Certificate & Document Holder Frame,Home,http://www.amazon.com/dp/B017MM9MP2/,1,1
"Black Backwards Wall Clock, Runs Counterclockwise and Reverse",Home & Kitchen,https://www.amazon.com/Backwards-Wall-Clock-Counterclockwise-Reverse/dp/B001390H3C,1,1
None Braver: U.S. Air Force Pararescuemen in the War on Terrorism,Book,http://www.amazon.com/dp/0451212959/,1,1
"Belleville 500 USMC Waterproof Desert Tan 8"" Combat Boot, Made in USA, Size 9.5",Shoes,http://www.amazon.com/dp/B00II95HXA/,1,1
Angelia Call of Duty Black Skull Face Tube Mask Neck Gaiter Dust Shield Seamless Bandana Balaclava,Sports,http://www.amazon.com/dp/B00GW9WCBI/,1,1
"Danner Men's USMC Rat 8"" Steel Toe Boot",Shoes,http://www.amazon.com/dp/B006JUY1QE/,1,1
"Silynx Clarus Pro Unique Noise Cancelling, Hearing Protection Headset System",Sports,http://www.amazon.com/dp/B01EEAKHUO/,1,1
"Raine Military Sewing Kit, Black",Sports,http://www.amazon.com/dp/B00PUV5G3K/,1,1
Mizerak Dynasty Space Saver 6.5’ Billiard Table,Sports,http://www.amazon.com/dp/B008U6SCSI/,1,1
North American B-25 Mitchell: The Ultimate Look: From Drawing Board to Flying Arsenal,Book,http://www.amazon.com/dp/0764329308/,1,1
Why is Dad So Mad? (The Why Series) (Volume 1),Book,http://www.amazon.com/dp/0692402683/,1,1
Uxcell Metric Whitworth Screw Pitch Gauge Measuring Tool,Home Improvement,http://www.amazon.com/dp/B00N41CX6G/,1,1
Jansport T501 Superbreak Backpack,Apparel,http://www.amazon.com/dp/B0007QCSKM/,1,1
Rise of the Warrior Cop: The Militarization of America's Police Forces,Book,http://www.amazon.com/dp/1610392116/,1,1
One Bullet Away: The Making of a Marine Officer,Book,http://www.amazon.com/dp/0618773436/,1,1
Fat Cat Frisco II 7.5-Foot Billiard/Pool Game Table,Sports,http://www.amazon.com/dp/B000T06MVW/,1,1
The Burn Pits: The Poisoning of America's Soldiers,Book,http://www.amazon.com/dp/1510705732/,1,1
"Pilot G2 Gel Ink Refill, 2-Pack for Rolling Ball Pens, Fine Point, Black Ink (77240)",Office Product,http://www.amazon.com/dp/B00006IEC6/,1,1
BLACKHAWK! SERPA Quick Disconnect Kit (2 Female/1 Male),Sports,http://www.amazon.com/dp/B004T0YTD6/,1,1
Mobil 1 98E682 5W-30 Synthetic Motor Oil - 55 Gallon Drum,Automotive Parts and Accessories,http://www.amazon.com/dp/B006ZIE8U4/,1,1
"Mexsana Medicated Powder, 11-Ounce Bottle (Pack of 4)",Beauty,http://www.amazon.com/dp/B001EJONSG/,1,1
"Injinji Boot Original Weight OTC (Black, Large)",Sports,http://www.amazon.com/dp/B00O3LBI1C/,1,1
Get Selected! for Special Forces: How to Successfully Train for and Complete Special Forces Assessment & Selection,Books,https://www.amazon.com/Get-Selected-Special-Forces-Successfully/dp/0975355279/ref=sr_1_1?ie=UTF8&amp;qid=1445195140&amp;sr=8-1&amp;keywords=get+selected,1,1
"Sinland Microfiber Ultra Compact Absorbent Fast Drying Travel Sports Towels(Silver grey, 24""x48"")",Sports,http://www.amazon.com/dp/B00GOOEH6E/,1,1
Following Ho Chi Minh: Memoirs of a North Vietnamese Colonel,Book,http://www.amazon.com/dp/0824822331/,1,1
From Enemy to Friend: A North Vietnamese Perspective on the War,Book,http://www.amazon.com/dp/155750881X/,1,1
China's Road to the Korean War,Book,http://www.amazon.com/dp/0231100256/,1,1
Bear Went over the Mountain: Soviet Combat Tactics in Afghanistan,Book,http://www.amazon.com/dp/0788146653/,1,1
Mouthful of Rocks: Through Africa and Corsica in the French Foreign Legion,Book,http://www.amazon.com/dp/0747505799/,1,1
Delta Force: A Memoir by the Founder of the U.S. Military's Most Secretive Special-Operations Unit,Book,http://www.amazon.com/dp/006224969X/,1,1
SHEWEE Extreme (Pink) - Multiple Colours Available,Sports,http://www.amazon.com/dp/B00200LO7Q/,1,1
The Outpost: An Untold Story of American Valor,Book,http://www.amazon.com/dp/031618540X/,1,1
The March Up Country: A Translation of Xenophon's Anabasis (Ann Arbor Paperbacks),Book,http://www.amazon.com/dp/0472060953/,1,1
The Persian Expedition (Penguin Classics),Book,http://www.amazon.com/dp/0140440070/,1,1
"Uxcell Hollow Square Mortiser Chisel Auger Drill Bit Tool, 1/2-Inch",Home Improvement,http://www.amazon.com/dp/B005HNCN1O/,1,1
The Evil Hours: A Biography of Post-Traumatic Stress Disorder,Book,http://www.amazon.com/dp/0544570324/,1,1
"Mechanix Wear - Original Coyote Tactical Gloves (Medium, Brown)",Home Improvement,http://www.amazon.com/dp/B0019I7XAM/,1,1
