name,category,amazon_link,total_mentions,subreddit_mentions
The Third World War,Book,http://www.amazon.com/dp/0025471600/,3,1
Skunk Works: A Personal Memoir of My Years at Lockheed,Book,http://www.amazon.com/dp/0316743003/,50,1
Red Storm Rising,Book,http://www.amazon.com/dp/042510107X/,3,1
Starship Troopers,Book,http://www.amazon.com/dp/0441783589/,20,1
The Last Stand of the Tin Can Sailors: The Extraordinary World War II Story of the U.S. Navy's Finest Hour,Book,http://www.amazon.com/dp/0553381482/,16,1
Neptune's Inferno: The U.S. Navy at Guadalcanal,Book,http://www.amazon.com/dp/0553385127/,3,1
Last Battle: The Classic History of the Battle for Berlin,Book,http://www.amazon.com/dp/0684803291/,3,1
Air Power at the Battlefront: Allied Close Air Support in Europe 1943-45 (Studies in Air Power),Book,http://www.amazon.com/dp/0714642118/,1,1
How to Avoid Being Killed in a War Zone: The Essential Survival Guide for Dangerous Places,Book,http://www.amazon.com/dp/1408816822/,2,1
"Hellcats Don't Leak Oil, They Mark Their Territory!",Book,http://www.amazon.com/dp/141202496X/,2,1
The Dream Machine: The Untold History of the Notorious V-22 Osprey,Book,http://www.amazon.com/dp/1416562966/,5,1
The Blitzkrieg Legend: The 1940 Campaign in the West,Book,http://www.amazon.com/dp/1591142954/,3,1
F-16 Fighting Falcons (Osprey Military Aircraft),Book,http://www.amazon.com/dp/1855322366/,1,1
Daring Young Men: The Heroism and Triumph of The Berlin Airlift-June 1948-May 1949,Book,http://www.amazon.com/dp/B005DI96Q8/,2,1
"Ka-Bar Leather Sheath, 7-Inch, Brown",Sports,http://www.amazon.com/dp/B005GREUD0/,6,1
Skunk Works: A Personal Memoir of My Years of Lockheed,eBooks,http://www.amazon.com/dp/B00A2DIW3C/,5,1
The Freedom Fighter: A memoir of a member of the Donbass Militia in the War in Ukraine,eBooks,http://www.amazon.com/dp/B01HZPULXS/,6,1
