name,category,amazon_link,total_mentions,subreddit_mentions
"The Ultimate Complete BBW Erotic Romance Collection: Big, Bigger, Busty and Curvy Girls Erotica Stories - (Over 800 Pages)",eBooks,http://www.amazon.com/dp/B00SJ9N39O/,,1
Don't Make a Black Woman Take Off Her Earrings: Madea's Uninhibited Commentaries on Love and Life,eBooks,http://www.amazon.com/dp/B004IE9RJY/,,1
CafePress - We Are All Africans Light T-Shirt - 100% Cotton T-Shirt,Apparel,http://www.amazon.com/dp/B00IBH6NGO/,,1
"LifeStraw Personal Water Filter for Hiking, Camping, Travel, and Emergency Preparedness",Sports,http://www.amazon.com/dp/B006QF3TW4/,13,1
"Icetek Sports Ultralight Portable Outdoor Backpacking Camping Stoves with Piezo Ignition, Butane / Butane Propane Canister Compatible",Sports,http://www.amazon.com/dp/B004U8CP88/,2,1
"Avery InkJet Iron-On Dark T-Shirt Transfers, White, Five Sheets per Pack (03279)",Office Product,http://www.amazon.com/dp/B0000C0CIR/,2,1
Shut the Fuck Up Liberal Shirt,Apparel,http://www.amazon.com/dp/B074C5195C/,1,1
Canon PowerShot A2300 IS 16.0 MP Digital Camera with 5x Optical Zoom (Black),Photography,http://www.amazon.com/dp/B0075SUHQC/,1,1
Sony D-FS601 S2 Sports CD Walkman Portable Disc Player,Speakers,http://www.amazon.com/dp/B00006HGY8/,1,1
Rest in Peace RaShawn (Nelson Beats the Odds) (Volume 3),Book,http://www.amazon.com/dp/9780990003/,1,1
"I Can't Even Think Straight Men's Hoodie Sweatshirt (Medium, LIGHT GRAY)",Apparel,http://www.amazon.com/dp/B00M4VX0HS/,1,1
"Nike Mens Air Jordan 11 Retro ""Legend Blue"" White/Legend Blue-Black Leather Size 10",Sports,http://www.amazon.com/dp/B00O19ZH9A/,1,1
Fat Ladies in Spaaaaace: A Body-Positive Coloring Book,Book,http://www.amazon.com/dp/1492647233/,1,1
"Custom & Novelty {1” Inch} 8 Piece Pack, Mid-Size Button Pin-Back Badges for Unique Clothing Accents, Made of Rust-Proof Metal w/ Anti-Nazi Anti-Fascist Anti-KKK Political Statement Style [Multicolor]",Apparel,http://www.amazon.com/dp/B074MH6QY8/,1,1
Green Pasture Blue Ice Royal Butter Oil / Fermented Cod Liver Oil Blend - 120 Capsules,Health and Beauty,http://www.amazon.com/dp/B00OZHWX1I/,1,1
Make A Woman Cum For Once T-Shirt,Apparel,http://www.amazon.com/dp/B01MYBHWNK/,1,1
Thanks For The Memories ... The Truth Has Set Me Free!  The Memoirs of Bob Hope's and Henry Kissinger's Mind-Controlled Slave,Books,https://www.amazon.com/Thanks-Memories-Memoirs-Kissingers-Mind-Controlled/dp/0966891627,1,1
