name,category,amazon_link,total_mentions,subreddit_mentions
Beyond Culture,Book,http://www.amazon.com/dp/0385124740/,2,2
How to Talk Minnesotan: Revised for the 21st Century,eBooks,http://www.amazon.com/dp/B00AEDDRB2/,,1
Minnesota Nice? A Transplant's Guide to Surviving and Thriving in Minnesota,eBooks,http://www.amazon.com/dp/B00K5Y8W4M/,,1
The Terror Factory: Inside the FBI's Manufactured War on Terrorism,Book,http://www.amazon.com/dp/1935439618/,6,1
"AKASO IP Security Wifi Camera 2.4GHz & 1080P Wireless Video Surveillance Monitor Home Indoor Webcam, 1920 ×1080, Pan/Tilt, Night Vision, Two Way Audio, SD Card Slot ( IP2M-903 )",Photography,http://www.amazon.com/dp/B01N2JKZRB/,1,1
A Good Time for the Truth: Race in Minnesota,Book,http://www.amazon.com/dp/168134002X/,1,1
Everything You Need to Know About (Legally) Carrying a Handgun in Minnesota,Book,http://www.amazon.com/dp/0974148008/,1,1
"Kit of (8) HIGH PRESSURE - 18"" Oscillating Mist Fans",Lawn & Patio,http://www.amazon.com/dp/B00COOF7C6/,1,1
