name,category,amazon_link,total_mentions,subreddit_mentions
Tamiya 87038 Extra Thin Cement Glue Fine Tip 40ml,Toy,http://www.amazon.com/dp/B000BMYWYC/,3,3
"Gray Fine Surface Primer L, 180ml Spray Can by Tamiya",Toy,http://www.amazon.com/dp/B000BMXRUM/,,1
SE MH1047L Illuminated Multi-Power LED Head Magnifier,Home Improvement,http://www.amazon.com/dp/B003UCODIA/,5,1
"X-ACTO #1 Knife, Z Series With Safety Cap",Office Product,http://www.amazon.com/dp/B005KRSWM6/,2,1
"Badger Air-Brush Company RK-1 Krome Airbrush 2-in-1 Ultra Fine Airbrush with Additional Fine Tip, Spray Regulator and Needle",Art and Craft Supply,http://www.amazon.com/dp/B0078MEXX8/,2,1
Liquid Cement For Plastics 1 oz,Toy,http://www.amazon.com/dp/B0006N6ODS/,2,1
Masterbox 1:35 - Us And German Paratroopers (the South Of Eu,Toy,http://www.amazon.com/dp/B00MOB20RO/,1,1
"Pledge Floor Care, Multi-Surface Finish, 27-Ounce Bottles (Pack of 6)",Health and Beauty,http://www.amazon.com/dp/B0034792NM/,1,1
Tamiya 24222 1/24 Toyota GT-One TS020,Toy,http://www.amazon.com/dp/B000FG4CVC/,1,1
Revell Corvette C7.R Plastic Model Kit,Hobby,http://www.amazon.com/dp/B01F4K52TY/,1,1
"1/24 Denso Toyota 88C, '89 LM",Toy,http://www.amazon.com/dp/B000M0ZXSW/,1,1
"Micro Kristal Klear, 1 oz by Microscale Industries",Toy,http://www.amazon.com/dp/B0006O029E/,1,1
"Hasegawa 20280 1/24 Omron Porsche 962C, 20280",Toy,http://www.amazon.com/dp/B01IGQQZGM/,1,1
Tamiya 1:35 Jeep Willys MB 1/4 Ton 4x4 Truck,Toy,http://www.amazon.com/dp/B000WN6QAI/,1,1
JMSDF Guided Missile Defense Destroyer Kongo (DDG-173) (Plastic model) Hasegawa 1/700 Water Line|No.009,Toy,http://www.amazon.com/dp/B001TPB3JC/,1,1
"Master Box Models 1/35 ""France 1944"" - 5 Figures Set (3 U.S. Paratroopers, A Girl, Mother And Nun) With 2 Horses And French Telega",Hobby,http://www.amazon.com/dp/B004TQ8D32/,1,1
Badger Air-Brush Co 105 Patriot Fine Gravity Airbrush,Art and Craft Supply,http://www.amazon.com/dp/B002W84GTO/,1,1
INFINITY Two in One Airbrush 2 and 5 ml cup noz set .15 mm and 0.4 mm Nozzle Harder & Steenbeck 126543,Home,http://www.amazon.com/dp/B003Z9WNTO/,1,1
Paasche H-SET Single Action Siphon Feed Airbrush Set,Art and Craft Supply,http://www.amazon.com/dp/B004O7HTYU/,1,1
Staedtler Combo Circle Template 977 110,Office Product,http://www.amazon.com/dp/B000KIBQ46/,1,1
Iwata-Medea Eclipse HP CS Dual Action Airbrush Gun / Gravity Feed,Hobby,http://www.amazon.com/dp/B000BQKFAI/,1,1
CARCD72029 1:72 Caracal Models Decals - F-35A F-35B Joint Strike Fighter [WATERSLIDE DECAL SHEET],Toy,http://www.amazon.com/dp/B0155K9IUW/,1,1
Bond-2 Bondene 2 oz,Toy,http://www.amazon.com/dp/B0006O09M4/,1,1
How to Build Dioramas,Book,http://www.amazon.com/dp/0890245517/,1,1
Ship Modeling Simplified: Tips and Techniques for Model Construction from Kits,Book,http://www.amazon.com/dp/0071558675/,1,1
The Airfix Book of Scale Modelling,Book,http://www.amazon.com/dp/1844861260/,1,1
