name,category,amazon_link,total_mentions,subreddit_mentions
Beginner's Swedish with 2 Audio CDs,Book,http://www.amazon.com/dp/0781811570/,1,1
The Fat Woman Next Door Is Pregnant,Book,http://www.amazon.com/dp/0889221901/,1,1
Flip the Script,Book,http://www.amazon.com/dp/1584234601/,4,1
"The High Cost of Free Parking, Updated Edition",Book,http://www.amazon.com/dp/193236496X/,50,1
"Hopkins 996-35 Mallory Maxx 35"" Snow Brush with Foam Grip and Clear Aluminum Handle (Colors may vary)",Automotive Parts and Accessories,http://www.amazon.com/dp/B000BPEQM2/,2,1
Alps Icegrips Snow Traction Gear Slip on Snow and Ice Cleat Traction Prevent Slipping Plus 10 Extra Replacement Steel Studs (X Large),Sports,http://www.amazon.com/dp/B00HMWZCDO/,2,1
1/2 Gallon Mason Jar Food Fermentation Kit - Create Your Own Delicious and Healthy Pro-biotic Recipes at Home!.,Kitchen,http://www.amazon.com/dp/B00NESY0BA/,1,1
Father Forgive Me For These Gains I'm About To Receive Workout Mens Tank Top,Apparel,http://www.amazon.com/dp/B00OJ92HVI/,2,1
WALI Bullet Dummy Fake Surveillance Security CCTV Dome Camera Indoor Outdoor with one LED Light + Warning Security Alert Sticker Decals WL-TC-B1,Photography,http://www.amazon.com/dp/B01AJSURKK/,2,1
