name,category,amazon_link,total_mentions,subreddit_mentions
AmazonBasics High-Speed HDMI Cable - 6 Feet (Latest Standard),Electronics,https://www.amazon.com/AmazonBasics-High-Speed-HDMI-Cable-Standard/dp/B014I8SSD0/,6,1
The Morrowind Prophecies: Game of the Year Edition Official Strategy Guide,Books,https://www.amazon.com/Morrowind-Prophecies-Official-Strategy-Guide/dp/0929843320,1,1
"The Elder Scrolls 3: Morrowind, Collector's Edition - PC",Video Games,https://www.amazon.com/Elder-Scrolls-Morrowind-Collectors-PC/dp/B00005RD72?th=1,1,1
The Art of Morrowind,Books,https://www.amazon.com/Art-Morrowind-Bethesda-Softworks-Inc/dp/B000SJ6DA4,1,1
Generic Wired Controller for Microsoft Xbox 360 Game System,Electronics,https://www.amazon.com/Generic-Wired-Controller-Microsoft-System/dp/B01J7TBIL4/,1,1
