name,category,amazon_link,total_mentions,subreddit_mentions
Tricholomas of North America: A Mushroom Field Guide (Corrie Herring Hooks Series),Book,http://www.amazon.com/dp/0292742339/,11,1
Ascomycete Fungi of North America: A Mushroom Reference Guide (Corrie Herring Hooks),Book,http://www.amazon.com/dp/0292754523/,11,1
Mushrooms of West Virginia and the Central Appalachians,Book,http://www.amazon.com/dp/0813190398/,18,1
Mushrooms of Northeastern North America,Book,http://www.amazon.com/dp/0815603886/,21,1
Milk Mushrooms of North America: A Field Identification Guide to the Genus Lactarius,Book,http://www.amazon.com/dp/0815632290/,11,1
North American Boletes: A Color Guide To the Fleshy Pored Mushrooms,Book,http://www.amazon.com/dp/0815632444/,11,1
Waxcap Mushrooms of Eastern North America,Book,http://www.amazon.com/dp/0815632681/,11,1
Psilocybin Mushrooms of the World: An Identification Guide,Book,http://www.amazon.com/dp/0898158397/,15,1
Fungi of Switzerland: Vol. 1 Ascomycetes,Book,http://www.amazon.com/dp/091642247X/,11,1
Ascomycetes in Colour: Found and Photographed in Mainland Britain,Book,http://www.amazon.com/dp/1479747556/,11,1
Mushrooms of Northeast North America: Midwest to New England (Lone Pine Field Guide),Book,http://www.amazon.com/dp/1551052016/,22,1
MACROFUNGI ASSOCIATED WITH OAKS OF EASTERN NORTH AMERICA,Book,http://www.amazon.com/dp/193320236X/,19,1
