name,category,amazon_link,total_mentions,subreddit_mentions
"Soul Fingers: The Music & Life of Legendary Bassist Donald ""Duck"" Dunn",Book,http://www.amazon.com/dp/1495052923/,4,3
This Is Your Brain on Music: The Science of a Human Obsession,Book,http://www.amazon.com/dp/0452288525/,11,3
Rip It Up and Start Again: Postpunk 1978-1984,Book,http://www.amazon.com/dp/0143036726/,5,3
"Etymotic High-Fidelity Earplugs, ER20XS Standard Fit, 1 pair, Polybag Packaging",Health and Beauty,http://www.amazon.com/dp/B00RM6Q9XW/,34,3
Roseland NYC Live,Music,http://www.amazon.com/dp/B00000DLV1/,2,2
"Audio Technica AT-LP120BK-USB Direct-Drive Professional Turntable (USB & Analog), Black",Speakers,http://www.amazon.com/dp/B00GA9COMM/,10,2
The Real Frank Zappa Book,Book,http://www.amazon.com/dp/0671705725/,6,2
Duran Duran Tribute Album,Music,http://www.amazon.com/dp/B00080Z64M/,2,2
"Your Pretty Face Is Going to Hell The Dangerous Glitter of David Bowie, Iggy Pop, and Lou Reed",Book,http://www.amazon.com/dp/0879309857/,2,2
FiiO X1 Portable High Resolution Lossless Music Player - Silver,Speakers,http://www.amazon.com/dp/B00NS3MRKC/,22,2
Learning To Flinch,Music,http://www.amazon.com/dp/B001HADDZG/,2,2
"Etymotic ETY-Plugs High Fidelity Earplugs, Standard Fit, Frost Tip",Health and Beauty,http://www.amazon.com/dp/B0015WJQ7A/,103,2
"The Umbrella Academy, Vol. 1",Book,http://www.amazon.com/dp/1593079788/,2,2
How Music Works,Book,http://www.amazon.com/dp/1938073533/,5,2
Sennheiser HD280PRO Headphones (old model),Speakers,http://www.amazon.com/dp/B000065BPB/,68,2
Chasing the Rising Sun: The Journey of an American Song,Book,http://www.amazon.com/dp/0743278984/,2,2
Tartine Bread,Book,http://www.amazon.com/dp/0811870413/,17,2
Ruminations,Digital Music Album,http://www.amazon.com/dp/B01JA6MFTS/,2,2
Culture Crash: The Killing of the Creative Class,Book,http://www.amazon.com/dp/0300195885/,4,1
The Photographer's Eye: Composition and Design for Better Digital Photos,Book,http://www.amazon.com/dp/0240809343/,17,1
English Sounds and Spelling,Book,http://www.amazon.com/dp/0132829541/,1,1
Art of Digital Audio,Book,http://www.amazon.com/dp/0240515870/,1,1
"The Wisdom of Psychopaths: What Saints, Spies, and Serial Killers Can Teach Us About Success",Book,http://www.amazon.com/dp/0374291357/,8,1
Our Band Could Be Your Life: Scenes from the American Indie Underground 1981-1991,Book,http://www.amazon.com/dp/0316787531/,4,1
Saucerful of Secrets: The Pink Floyd Odyssey,Book,http://www.amazon.com/dp/0385306849/,1,1
A Survey of Radial Velocities in the Zodiacal Dust Cloud,Book,http://www.amazon.com/dp/0387777059/,2,1
The Song Machine: Inside the Hit Factory,Book,http://www.amazon.com/dp/0393241920/,9,1
The Price of Inequality: How Today's Divided Society Endangers Our Future,Book,http://www.amazon.com/dp/0393345068/,36,1
What's That Sound?: An Introduction to Rock and Its History (Fourth Edition),Book,http://www.amazon.com/dp/0393937259/,1,1
"Rebel without a Crew: Or How a 23-Year-Old Filmmaker With $7,000 Became a Hollywood Player",Book,http://www.amazon.com/dp/0452271878/,8,1
CD Set Volume I for A History of Music in Western,Book,http://www.amazon.com/dp/0205953557/,1,1
"MEL Scripting for Maya Animators, Second Edition (The Morgan Kaufmann Series in Computer Graphics)",Book,http://www.amazon.com/dp/0120887932/,1,1
The Dirt: Confessions of the World's Most Notorious Rock Band,Book,http://www.amazon.com/dp/0060989157/,5,1
It's a Long Story: My Life,Book,http://www.amazon.com/dp/0316403547/,1,1
Johnny Cash: The Life (ALA Notable Books for Adults),Book,http://www.amazon.com/dp/0316194751/,1,1
Sun Tzu and the Art of Business: Six Strategic Principles for Managers,Book,http://www.amazon.com/dp/0199782911/,2,1
Can't Stop Won't Stop: A History of the Hip-Hop Generation,Book,http://www.amazon.com/dp/0312425791/,17,1
Touched with Fire: Manic-Depressive Illness and the Artistic Temperament,Book,http://www.amazon.com/dp/068483183X/,9,1
The Trouser Press Guide to 90's Rock: The All-New Fifth Edition of the Trouser Press Record Guide,Book,http://www.amazon.com/dp/0684814374/,1,1
"England's Dreaming, Revised Edition: Anarchy, Sex Pistols, Punk Rock, and Beyond",Book,http://www.amazon.com/dp/0312288220/,2,1
The Amory Wars: The Second Stage Turbine Blade Ultimate Edition,Book,http://www.amazon.com/dp/1608860353/,4,1
Rhythm & Meter Patterns: Book & CD,Book,http://www.amazon.com/dp/0769234690/,1,1
Slanted and Enchanted: The Evolution of Indie Culture,Book,http://www.amazon.com/dp/0805088520/,1,1
White Line Fever: The Autobiography,Book,http://www.amazon.com/dp/0806525908/,3,1
Supersexy Swingin' Sounds,Music,http://www.amazon.com/dp/B000000OVC/,1,1
Backstage Passes: Life on the Wild Side with David Bowie,Book,http://www.amazon.com/dp/0815410018/,1,1
Empire of Dirt: The Aesthetics and Rituals of British Indie Music (Music/Culture),Book,http://www.amazon.com/dp/0819568112/,1,1
"This Business of Music, 10th Edition (This Business of Music: Definitive Guide to the Music Industry)",Book,http://www.amazon.com/dp/0823077233/,2,1
The Beastie Boys' Paul's Boutique (33 1/3),Book,http://www.amazon.com/dp/0826417418/,3,1
Joe Strummer and the Legend of The Clash,Book,http://www.amazon.com/dp/085965348X/,1,1
DESPITE EVERYTHING: COMETBUS,Book,http://www.amazon.com/dp/0867195614/,1,1
LAbyrinth: A Detective Investigates the Murders of Tupac Shakur and Notorious B.I.G. The Implication of Death Row Records' Suge Knight and the Origins of the Los Angeles Police Scandal,Book,http://www.amazon.com/dp/0871138387/,2,1
Unknown Legends of Rock 'n' Roll,Book,http://www.amazon.com/dp/0879305347/,1,1
Skydog - The Duane Allman Story,Book,http://www.amazon.com/dp/0879308915/,2,1
Old Possum's Book of Practical Cats,Book,http://www.amazon.com/dp/015668568X/,1,1
Progressive Steps to Syncopation for the Modern Drummer (Ted Reed Publications),Book,http://www.amazon.com/dp/0882847953/,13,1
Taormina: Wilhelm Von Gloeden,Book,http://www.amazon.com/dp/0942642430/,4,1
Krautrocksampler,Book,http://www.amazon.com/dp/0952671913/,1,1
The Raging Storm: The Album Graphics of StormStudios,Book,http://www.amazon.com/dp/0957005407/,1,1
Art & Fear: Observations On the Perils (and Rewards) of Artmaking,Book,http://www.amazon.com/dp/0961454733/,21,1
Vampire Vultures,Book,http://www.amazon.com/dp/0965618374/,1,1
Edly's Music Theory for Practical People,Book,http://www.amazon.com/dp/0966161661/,8,1
The Hacienda: How Not to Run a Club,Book,http://www.amazon.com/dp/0062307959/,1,1
Jazz: A History of America's Music,Book,http://www.amazon.com/dp/0679765395/,1,1
Shakey: Neil Young's Biography,Book,http://www.amazon.com/dp/0679750967/,1,1
All You Need Is Ears: The inside personal story of the genius who created The Beatles,Book,http://www.amazon.com/dp/0312114826/,2,1
Hit Men: Power Brokers and Fast Money Inside the Music Business,Book,http://www.amazon.com/dp/0679730613/,4,1
The Complete Beatles Recording Sessions,Book,http://www.amazon.com/dp/1454910054/,6,1
The New Breed Revision Audio Online,Book,http://www.amazon.com/dp/1423418123/,6,1
"UFOs: Generals, Pilots, and Government Officials Go on the Record",Book,http://www.amazon.com/dp/0307717089/,17,1
Your Band Sucks: What I Saw at Indie Rock's Failed Revolution (But Can No Longer Hear),Book,http://www.amazon.com/dp/014310828X/,1,1
Scar Tissue,Book,http://www.amazon.com/dp/1401307450/,3,1
Billy the Egomaniac: A Smashing Pumpkins Comic,Book,http://www.amazon.com/dp/1469959313/,1,1
My Crazy Beautiful Life,Book,http://www.amazon.com/dp/1476704163/,1,1
"Tune In: The Beatles - All These Years, Vol. 1",Book,http://www.amazon.com/dp/1400083052/,8,1
The Mouse in the Manor House (and other poems),Book,http://www.amazon.com/dp/1512307483/,8,1
Three Dog Nightmare: The Chuck Negron Story,Book,http://www.amazon.com/dp/1580630405/,1,1
"Trust Me, I'm Lying: Confessions of a Media Manipulator",Book,http://www.amazon.com/dp/1591846285/,39,1
The Book of the SubGenius : The Sacred Teachings of J.R. 'Bob' Dobbs,Book,http://www.amazon.com/dp/0671638106/,2,1
The Psychopath Test: A Journey Through the Madness Industry,Book,http://www.amazon.com/dp/1594485755/,22,1
Hunger Makes Me a Modern Girl: A Memoir,Book,http://www.amazon.com/dp/1594486638/,1,1
Hip Hop Family Tree Book 1: 1970s-1981 (Hip Hop Family Tree),Book,http://www.amazon.com/dp/1606996908/,4,1
The Wrecking Crew: The Inside Story of Rock and Roll's Best-Kept Secret,Book,http://www.amazon.com/dp/1250030463/,2,1
Songs That Saved Your Life (Revised Edition): The Art of The Smiths 1982-87,Book,http://www.amazon.com/dp/1781162581/,1,1
Bowie In Berlin: A new career in a new town,Book,http://www.amazon.com/dp/1906002088/,3,1
Barrett: The Definitive Visual Companion to the Life of Syd Barrett,Book,http://www.amazon.com/dp/1906615101/,1,1
"Weird Scenes Inside the Canyon: Laurel Canyon, Covert Ops & the Dark Heart of the Hippie Dream",Book,http://www.amazon.com/dp/1909394122/,17,1
Making Rumours: The Inside Story of the Classic Fleetwood Mac Album,Book,http://www.amazon.com/dp/1118218086/,3,1
Best of Shaqulle O'Neal,Music,http://www.amazon.com/dp/B00000054C/,1,1
Appetite For Destruction,Music,http://www.amazon.com/dp/B000000OQF/,1,1
The Factsheet Five Zine Reader: The Best Writing from the Underground World of Zines,Book,http://www.amazon.com/dp/0609800019/,1,1
The Simpsons Sing The Blues,Music,http://www.amazon.com/dp/B000000OZV/,2,1
"Celtic Twilight, Vol 2",Music,http://www.amazon.com/dp/B000000X8D/,1,1
Jazz At Massey Hall (OJC),Music,http://www.amazon.com/dp/B000000Y2R/,1,1
ATLiens,Music,http://www.amazon.com/dp/B0000013GT/,1,1
Night on Earth: Original Soundtrack Recording,Music,http://www.amazon.com/dp/B000001DU0/,1,1
All The World's A Stage,Music,http://www.amazon.com/dp/B000001ESH/,1,1
Live at Carnegie Hall,Music,http://www.amazon.com/dp/B00000265Z/,2,1
NOFX: The Hepatitis Bathtub and Other Stories,Book,http://www.amazon.com/dp/0306824779/,5,1
How To Ru(i)n A Record Label: The Story of Lookout Records,Book,http://www.amazon.com/dp/0989196348/,1,1
