name,category,amazon_link,total_mentions,subreddit_mentions
"My Little Pony: The Journal of the Two Sisters: The Official Chronicles of Princesses Celestia and Luna (My Little Pony, Friendship Is Magic)",Book,http://www.amazon.com/dp/0316282243/,9,7
My Little Pony: The Art of Equestria,Book,http://www.amazon.com/dp/1419715771/,5,5
My Little Pony: The Daring Do Adventure Collection: A Three-Book Boxed Set with Exclusive Figure,Book,http://www.amazon.com/dp/0316406120/,3,3
My Little Pony Omnibus Volume 1,Book,http://www.amazon.com/dp/1631401408/,4,3
My Little Pony: Friendship is Magic Songs of Harmony,Digital Music Album,http://www.amazon.com/dp/B00V5D34VI/,3,3
The Elements of Harmony: Friendship is Magic (My Little Pony),Book,http://www.amazon.com/dp/0316247545/,4,3
My Little Pony: Friendship is Magic Volume 1,Book,http://www.amazon.com/dp/1613776055/,3,2
My Little Pony: The Castles of Equestria: An Enchanted My Little Pony Pop-Up Book,Book,http://www.amazon.com/dp/0316188328/,2,2
Tiny Horsies: The Role Playing Game,Book,http://www.amazon.com/dp/0989540693/,3,2
"4th Dimension My Little Pony Applejack 12"" Plush",Toy,http://www.amazon.com/dp/B00RGFTGKW/,2,2
"My Little Pony: Art is Magic!, Vol. 1",Book,http://www.amazon.com/dp/1631404679/,3,2
"4th Dimension My Little Pony Fluttershy 12"" Plush",Toy,http://www.amazon.com/dp/B00RGFTGNE/,3,2
Pennyroyal Academy,Book,http://www.amazon.com/dp/0399163247/,1,1
The Animator's Survival Kit,Book,http://www.amazon.com/dp/0571202284/,38,1
Are You My Mother? (Bright & Early Board Books(TM)),Book,http://www.amazon.com/dp/0679890475/,7,1
"Spacecraft, 2000-2100 A.D.: Terran Trade Authority Handbook",Book,http://www.amazon.com/dp/0890092117/,3,1
The Art of My Little Pony: The Movie,Book,http://www.amazon.com/dp/1421596482/,1,1
One-Star Reviews: The Very Best Reviews of the Very Worst Products,Book,http://www.amazon.com/dp/1440579083/,1,1
Phoebe and Her Unicorn (Phoebe and Her Unicorn Series Book 1),Book,http://www.amazon.com/dp/1449446205/,1,1
Unicorn on a Roll (Phoebe and Her Unicorn Series Book 2): Another Phoebe and Her Unicorn Adventure,Book,http://www.amazon.com/dp/1449470769/,1,1
Something Sweet to Bite - Candy,Book,http://www.amazon.com/dp/1533448388/,1,1
My Little Pony: The Magic Begins,Book,http://www.amazon.com/dp/161377754X/,1,1
My Little Pony: Friendship is Magic Volume 2,Book,http://www.amazon.com/dp/1613777604/,2,1
My Little Pony: Friendship is Magic Volume 6,Book,http://www.amazon.com/dp/163140203X/,1,1
My Little Pony: The Movie Adaptation,Book,http://www.amazon.com/dp/1684051169/,1,1
My Little Pony: Where Equestria Comes to Life! (iExplore),Book,http://www.amazon.com/dp/1783122455/,1,1
Nordguard Volume One: Across Thin Ice (hardcover),Book,http://www.amazon.com/dp/1936689111/,2,1
Haibane-Renmei Soundtrack Hanenone,Music,http://www.amazon.com/dp/B0000A4GEI/,1,1
Flames Vinyl Stick Onz Decal,Automotive Parts and Accessories,http://www.amazon.com/dp/B0002NIIPY/,2,1
Sony MDR7506 Professional Large Diaphragm Headphone,Musical Instruments,http://www.amazon.com/dp/B000AJIF4E/,128,1
FBI - Female Body Inspector Heavy Cotton T-Shirt (in 26 colors),Apparel,http://www.amazon.com/dp/B000AYRMLQ/,2,1
Do Androids Dream of Electric Sheep?: The inspiration for the films Blade Runner and Blade Runner 2049,eBooks,http://www.amazon.com/dp/B000SEGTI0/,4,1
"3M Scotch-Weld Epoxy Potting Compound DP270 Clear, 1.69 fl oz (Pack of 1)",BISS Basic,http://www.amazon.com/dp/B000X5G6O6/,3,1
Akai Professional MPK49 | 49-Key USB MIDI Keyboard Controller with MPC Pads,Musical Instruments,http://www.amazon.com/dp/B000Z20J2M/,4,1
"The 4-Hour Workweek, Expanded and Updated: Expanded and Updated, With Over 100 New Pages of Cutting-Edge Content.",eBooks,http://www.amazon.com/dp/B002WE46UW/,5,1
"Brother SE400 Combination Computerized Sewing and 4x4 Embroidery Machine With 67 Built-in Stitches, 70 Built-in Designs, 5 Lettering Fonts",Art and Craft Supply,http://www.amazon.com/dp/B003AVMZA4/,8,1
"Bormioli Rocco Pocket Flask, 17 oz, Clear",BISS,http://www.amazon.com/dp/B003R0GU0E/,1,1
"Pinkie Pie My Little Pony Pinata, Pull String",Toy,http://www.amazon.com/dp/B00427H776/,1,1
Relaxman Relaxation Capsule,Health and Beauty,http://www.amazon.com/dp/B0044LZ1PA/,7,1
"Philips 69126/60/48 Imageo LED Rechargeable Tea Lights with Charging Plate, Clear",Home Improvement,http://www.amazon.com/dp/B0045Y1G6Y/,1,1
Kershaw Ken Onion Leek Folding Knife with Speed Safe,Sports,http://www.amazon.com/dp/B004DS1XF6/,3,1
My Little Pony Blind Bag Set (8 Random Ponies + 2 Glitter Ponies),Toy,http://www.amazon.com/dp/B004JNKCMA/,1,1
Star Wars Poster Phantom Menace Anakin Darth Vader Shadow the,Home,http://www.amazon.com/dp/B004PWD31M/,1,1
Gold Medal Prod. 2045 Flavacol Seasoning Popcorn Salt 35oz.,Grocery,http://www.amazon.com/dp/B004W8LT10/,40,1
My Little Pony Friendship Is Magic: The Friendship Express,DVD,http://www.amazon.com/dp/B0063FGF14/,1,1
My Little Pony Fluttershy Face Hoodie,Apparel,http://www.amazon.com/dp/B008FQQ21W/,1,1
My Little Pony Wedding Set,Toy,http://www.amazon.com/dp/B008H3JJTU/,1,1
My Little Pony Friendship Is Magic: Season 1,DVD,http://www.amazon.com/dp/B0096W47NO/,2,1
Smile Tooth 2 Minute Sand Timer Assorted colors,Kitchen,http://www.amazon.com/dp/B009CCIH48/,1,1
Manga Studio 5,Software,http://www.amazon.com/dp/B00ANH074Y/,5,1
"Vandor 42161 My Little Pony Pinkie Pie 18 oz Oval Ceramic Mug, Pink",Kitchen,http://www.amazon.com/dp/B00BBSZJ7Y/,1,1
Funko My Little Pony: Fluttershy Vinyl Figure,Toy,http://www.amazon.com/dp/B00BMD7TFI/,2,1
"My Little Pony: Sunset Shimmer, Masquerade",Toy,http://www.amazon.com/dp/B00BUQ6XBS/,1,1
My Little Pony Friendship Is Magic: Season 2,DVD,http://www.amazon.com/dp/B00C0YUY4Q/,1,1
Aurora World My Little Pony 10 Inch Applejack Pony,Toy,http://www.amazon.com/dp/B00CS4Y9YY/,1,1
My Little Pony Rainbow Dash Swim Top Size : Large,Apparel,http://www.amazon.com/dp/B00CYGW5TC/,1,1
Funko My Little Pony Cupcake Keepsakes Pinkie Pie Figure,Toy,http://www.amazon.com/dp/B00DHE6NJS/,1,1
"Aurora World My Little Pony Applejack Pony Plush, 6.5""",Toy,http://www.amazon.com/dp/B00DOFTGEO/,1,1
"Aurora World My Little Pony Fluttershy Pony Plush, 6.5""",Toy,http://www.amazon.com/dp/B00DOFTIQ0/,1,1
Gund Teddy Needs a Bath Laundry Bag,Toy,http://www.amazon.com/dp/B00DVDMRPY/,1,1
"My Little Pony Twilight Sparkle 10.5"" Plush Hasbro 4th Dimension Entertainment",Toy,http://www.amazon.com/dp/B00E8IBIZ6/,2,1
Pink Octopus Ceramic 3D Coffee Mug with Tentacle Handle,Kitchen,http://www.amazon.com/dp/B00E9EPDHS/,3,1
"Philips Wake-up Light with Sunrise Simulation alarm clock, White HF3500/60",Health and Beauty,http://www.amazon.com/dp/B00F0W1RIW/,35,1
My Little Pony 20% Cooler Fleece Throw Blanket 50 Inches by 62 Inches,Home,http://www.amazon.com/dp/B00G3JE9JK/,1,1
Aurora World My Little Pony 10 Inch Seated Applejack Pony,Toy,http://www.amazon.com/dp/B00GP0HV0Q/,1,1
"My Little Pony Pinkie Pie 10.5"" Plush Hasbro 4th Dimension Entertainment",Toy,http://www.amazon.com/dp/B00GU3M13A/,3,1
Bravely Default - Nintendo 3DS,Video Games,http://www.amazon.com/dp/B00GV4V8XC/,3,1
"MoKo Case for Kindle Paperwhite, Premium Thinnest and Lightest PU Leather Cover with Auto Wake / Sleep for Amazon All-New Kindle Paperwhite (Fits 2012, 2013, 2015 and 2016 Versions), BLACK",CE,http://www.amazon.com/dp/B00H1OR9RK/,4,1
My Little Pony Cast Playing Cards,Toy,http://www.amazon.com/dp/B00I03L6GQ/,1,1
"Kershaw 8700SNOW Shuffle Multi-Function Tool Knife, White",Sports,http://www.amazon.com/dp/B00I0RUGQ8/,2,1
My Little Pony Twilight Sparkle Licensed Ceramic Coin Bank,Toy,http://www.amazon.com/dp/B00JP7TQ6S/,1,1
Funko My Little Pony: Big Mac Vinyl Figure,Toy,http://www.amazon.com/dp/B00KM80V7W/,1,1
My Little Pony:  The Journal of the Two Sisters: The Official Chronicles of Princesses Celestia and Luna,eBooks,http://www.amazon.com/dp/B00KVK3WNQ/,1,1
Getting Things Done: The Art of Stress-Free Productivity,eBooks,http://www.amazon.com/dp/B00KWG9M2E/,7,1
Corsair Graphite Series 380T Mini-ITX Portable PC Case - Black (CC-9011061-WW),Personal Computer,http://www.amazon.com/dp/B00LA6X38O/,6,1
Diamond Select Toys My Little Pony: Friendship Is Magic: Applejack Vinyl Bank,Toy,http://www.amazon.com/dp/B00LBCVU46/,2,1
My Little Pony - Apple Jack,Toy,http://www.amazon.com/dp/B00LIV66T4/,1,1
Surge Citrus Flavored Soda 16fl oz. 12 cans,Grocery,http://www.amazon.com/dp/B00M2OGS08/,21,1
"Aurora World My Little Pony Spike Plush, 10""",Toy,http://www.amazon.com/dp/B00MB1CX5G/,2,1
"Aurora World My Little Pony Large Seated Pinkie Pie Pony Plush, 26""",Toy,http://www.amazon.com/dp/B00MB1CXGA/,2,1
"Aurora World My Little Pony Large Seated Rainbow Dash Pony Plush, 26""",Toy,http://www.amazon.com/dp/B00MB1CXXI/,3,1
"Aurora World My Little Pony Princess Luna Plush, 14""",Toy,http://www.amazon.com/dp/B00MB6HHJ8/,1,1
"Vandor 42361 My Little Pony Twilight Sparkle 18 oz Oval Ceramic Mug, Multicolor",Kitchen,http://www.amazon.com/dp/B00MEHBHKO/,1,1
My Little Pony Princess Sterling and Fluttershy Figures,Toy,http://www.amazon.com/dp/B00MEOB6OY/,1,1
My Little Pony Lanyard with Rainbow Dash Charm,Toy,http://www.amazon.com/dp/B00MJEV900/,1,1
My Little Pony CCG: Rock 'n Rave 2-Player Starter Set,Toy,http://www.amazon.com/dp/B00MV284DA/,2,1
My Little Pony Clouds Playing Cards,Toy,http://www.amazon.com/dp/B00MWVH7SS/,1,1
"My Little Pony Princess Celestia 8"" Figure",Toy,http://www.amazon.com/dp/B00ND00XY2/,1,1
My Little Pony Cutie Mark Magic Water Cuties Diamond Mint Figure,Toy,http://www.amazon.com/dp/B00ND018PK/,1,1
My Little Pony Cutie Mark Magic Water Cuties Rarity Figure,Toy,http://www.amazon.com/dp/B00ND018QO/,1,1
Hasbro Gaming Monopoly Deal Card Game,Toy,http://www.amazon.com/dp/B00NQQTZCO/,7,1
LEGO(R) Classic Creative Supplement Bright (10694),Toy,http://www.amazon.com/dp/B00NVDNUIC/,1,1
Liberation,Digital Music Album,http://www.amazon.com/dp/B00O0PKIQM/,1,1
"LCD display Touch Screen Digitizer Assembly for iPhone 6 (4.7"") with free tools (White)",Wireless,http://www.amazon.com/dp/B00OB52MJ2/,1,1
My Little Pony Rainbow Dash Sculpted Ceramic Mug 42001,Kitchen,http://www.amazon.com/dp/B00QJUMX78/,1,1
"4th Dimension My Little Pony Rainbow Dash 12"" Plush",Toy,http://www.amazon.com/dp/B00RGFTGL6/,1,1
"4th Dimension My Little Pony Rarity 12"" Plush",Toy,http://www.amazon.com/dp/B00RGFTGR0/,1,1
My Little Pony Friendship is Magic Collection Sweet Apple Juice Stand Set,Toy,http://www.amazon.com/dp/B00SOI652W/,1,1
"Zero Belly Cookbook: 150+ Delicious Recipes to Flatten Your Belly, Turn Off Your Fat Genes, and Help Keep You Lean for Life!",eBooks,http://www.amazon.com/dp/B00SPVZBUA/,1,1
"My Little Pony Temporary Tattoos, 10 sheets 2.5"" by 3.5"", Complete set includes Pinkie Pie, Rainbow Dash, Applejack, Fluttershy, Rarity, Twilight Sparkle, Luna and Princess Celestia",Beauty,http://www.amazon.com/dp/B00TT65E8O/,1,1
