name,category,amazon_link,total_mentions,subreddit_mentions
"Legal Writing in Plain English, Second Edition: A Text with Exercises (Chicago Guides to Writing, Editing, and Publishing)",Books,https://www.amazon.com/Legal-Writing-Plain-English-Second/dp/0226283933/ref=sr_1_1?ie=UTF8&amp;amp;qid=1438782040&amp;amp;sr=8-1&amp;amp;keywords=garner+plain+english,3,2
Getting To Maybe: How to Excel on Law School Exams,Books,https://www.amazon.com/Getting-Maybe-Excel-School-Exams/dp/0890897603/ref=sr_1_1?ie=UTF8&amp;amp;qid=1438782116&amp;amp;sr=8-1&amp;amp;keywords=getting+to+maybe,2,2
Civil Procedure (Law School Legends Audio Series CD),Books,https://www.amazon.com/Civil-Procedure-School-Legends-Audio/dp/0314199780/ref=sr_1_sc_2?ie=UTF8&amp;qid=1471279641&amp;sr=8-2-spell&amp;keywords=richard+freer+civil+procrdure,2,2
MSG Vintage Leather Canvas Travel Toiletry Bag Shaving Dopp Kit #A001 (Grey),Beauty & Personal Care,https://www.amazon.com/dp/B01M69R2WA/ref=cm_sw_r_cp_api_zQplzbGBDHBF6.,2,2
1L of a Ride: A Well-Traveled Professor's Roadmap to Success in the First Year of Law School,Books,https://www.amazon.com/1L-Ride-Well-Traveled-Professors-Roadmap/dp/0314283056/ref=sr_1_1?ie=UTF8&amp;qid=1470245804&amp;sr=8-1&amp;keywords=1L+of+a+ride,2,2
The Shave Well Locker Mirror - Shatterproof Personal Mirror - Unbreakable Hanging Mirror - Locker Accessory,Beauty & Personal Care,https://www.amazon.com/dp/B00E6S48H8/ref=cm_sw_r_sms_c_api_9BplzbKSV09HW,2,2
"Examples & Explanations: Contracts, Sixth Edition",Books,https://www.amazon.com/Examples-Explanations-Contracts-Brian-Blum/dp/1454815477/ref=sr_1_3?ie=UTF8&amp;amp;qid=1438781941&amp;amp;sr=8-3&amp;amp;keywords=contracts+e,3,1
How to Start & Build a Law Practice (Career Series / American Bar Association),Books,https://www.amazon.com/Start-Practice-Career-American-Association/dp/1590312473/ref=sr_1_1?s=books&amp;ie=UTF8&amp;qid=1443241678&amp;sr=1-1,3,1
"Constitutional Law: Principles and Policies, 4th Edition (Aspen Student Treatise Series)",Books,https://www.amazon.com/Constitutional-Law-Principles-Policies-Treatise/dp/0735598975/ref=sr_1_1?ie=UTF8&amp;amp;qid=1438781863&amp;amp;sr=8-1&amp;amp;keywords=chimerensky,2,1
"Trial Techniques, Ninth Edition (Aspen Coursebooks)",Books,https://www.amazon.com/Trial-Techniques-Ninth-Aspen-Coursebooks/dp/1454822333,2,1
Missoula: Rape and the Justice System in a College Town,Books,https://www.amazon.com/gp/product/0385538731/ref=x_gr_w_glide_bb?ie=UTF8&amp;tag=x_gr_w_glide_bb-20&amp;linkCode=as2&amp;camp=1789&amp;creative=9325&amp;creativeASIN=0385538731&amp;SubscriptionId=1MGPYB6YW3HWK55XCGG2,2,1
You Are a Badass: How to Stop Doubting Your Greatness and Start Living an Awesome Life,Books,https://www.amazon.com/You-Are-Badass-Doubting-Greatness/dp/0762447699,2,1
"Contracts, Fourth Edition,  Textbook Treatise Series, Hardcover",Books,https://www.amazon.com/Contracts-Edition-Textbook-Treatise-Hardcover/dp/0735526427,2,1
"Post-it Tabs with On-the-Go Dispenser, 1-Inch Solid, Red, Yellow, Blue, 22-Tabs/Color, 66-Tabs/Dispenser",Office Products,https://www.amazon.com/Post-Dispenser-1-Inch-22-Tabs-66-Tabs/dp/B00006JNMK,1,1
"Devil in the Grove: Thurgood Marshall, the Groveland Boys, and the Dawn of a New America",Books,https://www.amazon.com/Devil-Grove-Thurgood-Marshall-Groveland/dp/0061792268,1,1
"Civil Procedure, 7th Edition (Examples & Explanations)",Books,https://www.amazon.com/Civil-Procedure-7th-Examples-Explanations/dp/1454815485/ref=sr_1_sc_1?ie=UTF8&amp;amp;qid=1438781974&amp;amp;sr=8-1-spell&amp;amp;keywords=civpro+e,1,1
Understanding Property Law,Books,https://www.amazon.com/Understanding-Property-Law-John-Sprankling/dp/1422498735/ref=sr_1_1?ie=UTF8&amp;amp;qid=1438781833&amp;amp;sr=8-1&amp;amp;keywords=understanding+property,1,1
Point Made: How to Write Like the Nation's Top Advocates,Books,https://www.amazon.com/Point-Made-Write-Nations-Advocates/dp/0199943850/ref=sr_1_1?ie=UTF8&amp;amp;qid=1438782075&amp;amp;sr=8-1&amp;amp;keywords=to+the+point+legal+writing,1,1
Constitutional Analysis in a Nutshell (Nutshells),Books,https://www.amazon.com/Constitutional-Analysis-Nutshell-Thomas-Baker/dp/0314265147/ref=sr_1_1?ie=UTF8&amp;amp;qid=1438781901&amp;amp;sr=8-1&amp;amp;keywords=con+law+nutshell+baker,1,1
"Understanding Criminal Law, 6th Edition",Books,https://www.amazon.com/Understanding-Criminal-Law-Joshua-Dressler/dp/0769848931/ref=sr_1_1?ie=UTF8&amp;amp;qid=1438782006&amp;amp;sr=8-1&amp;amp;keywords=crim+law+dressler,1,1
"The Law of Torts: Examples & Explanations, 4th Edition",Books,https://www.amazon.com/Law-Torts-Examples-Explanations-4th/dp/0735588740/ref=sr_1_1?ie=UTF8&amp;amp;qid=1438781921&amp;amp;sr=8-1&amp;amp;keywords=torts+e,1,1
Dismissed Law Student Essays,Books,https://www.amazon.com/Dismissed-Student-Essays-Alaina-Alexander/dp/0975853317,1,1
"OliaDesign Fold-n-Stow Book Stand, Black",Home & Kitchen,https://www.amazon.com/OliaDesign-Fold-n-Stow-Book-Stand-Black/dp/B00OYCUK3M/ref=sxts_k2p_hero3?pf_rd_m=ATVPDKIKX0DER&amp;pf_rd_p=2668835602&amp;pd_rd_wg=V5qsE&amp;pf_rd_r=HNHF5KQAKNYKNF35J0HS&amp;pf_rd_s=desktop-sx-top-slot&amp;pf_rd_t=301&amp;pd_rd_i=B00OYCUK3M&amp;pd_rd_w=4wTG9&amp;pf_rd_i=textbook+stand&amp;pd_rd_r=HJ9Q1ERZ4Q92P00V66Y1&amp;ie=UTF8&amp;qid=1479074432&amp;sr=3,1,1
Nice Production INP-101-O Book Stand (Bookstand / Bookstands / Holder / Cookbook / Music),Office Products,https://www.amazon.com/Nice-Production-INP-101-O-Bookstand-Bookstands/dp/B00ENNKTMO/ref=sr_1_4/130-4494850-4401966?ie=UTF8&amp;qid=1499970823&amp;sr=8-4&amp;keywords=book+stand,1,1
Jagged Rocks of Wisdom: Professional Advice for the New Attorney,Books,https://www.amazon.com/dp/1888960078/?tag=lawschooltransferguide-20,1,1
"Moleskine 2018 Weekly Horizontal Diary / Planner, Large, Black",Books,https://www.amazon.com/Moleskine-Weekly-Horizontal-Diary-Planner/dp/1223132463/ref=sr_1_1?ie=UTF8&amp;qid=1499834846&amp;sr=8-1&amp;keywords=moleskine+horizontal+planner+2017-2018,1,1
"The ""Companion Text"" to Law School: Understanding and Surviving Life with a Law Student (Career Guides)",Books,https://www.amazon.com/Companion-Text-Law-School-Understanding/dp/0314267417,1,1
Open Book: Succeeding on Exams From the First Day of Law School,Books,https://www.amazon.com/Open-Book-Succeeding-Exams-School/dp/1454806079,1,1
"Federal Jurisdiction, Sixth Edition (Aspen Student Treatise Series)",Books,https://www.amazon.com/Federal-Jurisdiction-Sixth-Student-Treatise/dp/1454804025,1,1
"Law School Confidential: A Complete Guide to the Law School Experience: By Students, for Students",Books,https://www.amazon.com/Law-School-Confidential-Complete-Experience/dp/0312605110,1,1
A People's History of the Supreme Court: The Men and Women Whose Cases and Decisions Have Shaped OurConstitution: Revised  Edition,Books,https://www.amazon.com/Peoples-History-Supreme-Court-OurConstitution/dp/0143037382,1,1
Possessory Estates and Future Interests Primer (Coursebook),Books,https://www.amazon.com/Possessory-Estates-Interests-American-Casebook/dp/0314183698,1,1
"Fellowes Booklift Copyholder, Platinum (21100)",Office Products,https://www.amazon.com/dp/B00004Z5QI/ref=cm_sw_r_awd_1xW4vb8DMMD00],1,1
"Sharpie Gel Highlighter, Bullet Tip,Yellow, 4/Pk",Home & Kitchen,https://www.amazon.com/Sharpie-Gel-Highlighter-Bullet-Yellow/dp/B00IX0I1LO,1,1
Deconstructing Legal Analysis: A 1L Primer (Academic Success),Books,https://www.amazon.com/Deconstructing-Legal-Analysis-1L-Primer/dp/0735584753,1,1
Essay Exam Writing for the California Bar Exam,Books,https://www.amazon.com/dp/073550993X/ref=cm_sw_r_sms_awd_Zl70wbZYKMKCX,1,1
"Gideon's Trumpet: How One Man, a Poor Prisoner, Took His Case to the Supreme Court-and Changed the Law of the United States",Books,https://www.amazon.com/gp/product/0679723129/ref=x_gr_w_glide_bb?ie=UTF8&amp;tag=x_gr_w_glide_bb-20&amp;linkCode=as2&amp;camp=1789&amp;creative=9325&amp;creativeASIN=0679723129&amp;SubscriptionId=1MGPYB6YW3HWK55XCGG2,1,1
Making Law Review: The Expert's Guide to Mastering the Write-on Competition,Books,https://www.amazon.com/Making-Law-Review-Write-Competition/dp/1594605203/ref=sr_1_1?ie=UTF8&amp;qid=1488915234&amp;sr=8-1&amp;keywords=law+review,1,1
"Flash Mob Law: The Legal Side of Planning and Participating in Pillow Fights, No Pants Rides, and Other Shenanigans",Books,https://www.amazon.com/Flash-Mob-Law-Participating-Shenanigans/dp/161438956X,1,1
"Academic Legal Writing: Law Rev Articles, Student Notes, Seminar Papers, and Getting on Law Rev (Coursebook)",Books,https://www.amazon.com/Academic-Legal-Writing-Articles-University/dp/1634598881/ref=sr_1_3?ie=UTF8&amp;qid=1488915234&amp;sr=8-3&amp;keywords=law+review,1,1
The Lawyer Bubble: A Profession in Crisis,Books,https://www.amazon.com/Lawyer-Bubble-Profession-Crisis/dp/0465065597,1,1
"VCI Lenovo ThinkPad E560 15.6"" Notebook - Intel Core i5-6200U - 8GB | 240GB SSD",Electronics,https://www.amazon.com/Lenovo-ThinkPad-E560-20EV002FUS-Notebook/dp/B01M2BQR6N,1,1
My Beloved World,Books,https://www.amazon.com/My-Beloved-World-Sonia-Sotomayor/dp/034580483X/ref=sr_1_1?ie=UTF8&amp;qid=1475233404&amp;sr=8-1&amp;keywords=sonia+sotomayor,1,1
El Casco Ink Pot For Fountain Pen And Quills 23 Karat Gold Plated M-656L,Home & Kitchen,https://www.amazon.com/El-Casco-Fountain-Quills-Plated/dp/B0014EB7NK,1,1
"Black Letter Outline on Corporate and Partnership Taxation, 7th (Black Letter Outlines)",Books,https://www.amazon.com/Letter-Outline-Corporate-Partnership-Taxation/dp/0314277560/ref=pd_sim_14_3?ie=UTF8&amp;dpID=51zPaQi,1,1
Logic of Subchapter K: A Conceptual Guide to Taxation of Partnerships (American Casebook Series),Books,https://www.amazon.com/Logic-Subchapter-Conceptual-Taxation-Partnerships/dp/0314199853,1,1
Sisters in Law: How Sandra Day O'Connor and Ruth Bader Ginsburg Went to the Supreme Court and Changed the World,Books,https://www.amazon.com/Sisters-Law-OConnor-Ginsburg-Supreme/dp/0062238477/ref=sr_1_1?ie=UTF8&amp;qid=1475233580&amp;sr=8-1&amp;keywords=Sisters+in+Law,1,1
The Living Constitution (INALIENABLE RIGHTS),Books,https://www.amazon.com/Living-Constitution-INALIENABLE-RIGHTS/dp/0195377273/,1,1
In Chambers: Stories of Supreme Court Law Clerks and Their Justices (Constitutionalism and Democracy),Books,https://www.amazon.com/In-Chambers-Justices-Constitutionalism-Democracy/dp/081393401X,1,1
The Warren Court and the Pursuit of Justice (Hill and Wang Critical Issues),Books,https://www.amazon.com/Warren-Pursuit-Justice-Critical-Issues/dp/0809016257/ref=sr_1_3?ie=UTF8&amp;qid=1475233271&amp;sr=8-3&amp;keywords=warren+court,1,1
