name,category,amazon_link,total_mentions,subreddit_mentions
League of Legends Starter Pack - NA Server Only [Instant Access],Digital Video Games,http://www.amazon.com/dp/B01AMD7HSW/,4,4
"Passion Lubes, Natural Water-Based Lubricant, 55 Gallon Drum",Health and Beauty,http://www.amazon.com/dp/B005MR3IVO/,273,3
League of Legends - PC,Video Games,https://www.amazon.com/League-Legends-PC/dp/B002HOIPCW/ref=sr_1_1?ie=UTF8&amp;qid=1483073528&amp;sr=8-1&amp;keywords=league+of+legends+collectors+edition,2,2
Razor V-17 Adult Multi-Sport Helmet (Black),Sports,http://www.amazon.com/dp/B000I52BUE/,2,2
"CCTRO Adult Cycling Bike Helmet, Eco-Friendly Adjustable Trinity Men Women Mountain Bicycle Road Bike Helmet Safety Protection",Sports,http://www.amazon.com/dp/B01MZZLLEO/,2,2
How to Lie with Statistics,Book,http://www.amazon.com/dp/0393310728/,24,1
"SURGE, 12 ct, 16 FL OZ Cans",Pantry,http://www.amazon.com/dp/B00OK0I4AO/,13,1
"Gaming Mouse, UtechSmart Venus 16400 DPI High Precision Laser MMO Gaming Mouse [ IGN's PICK]",Personal Computer,http://www.amazon.com/dp/B00FNKMVUO/,8,1
Logitech Washable Keyboard K310,Personal Computer,http://www.amazon.com/dp/B008D1JRIO/,7,1
Empires of EVE: A History of the Great Wars of EVE Online,Book,http://www.amazon.com/dp/0990972402/,7,1
"King Callie: Callie's Saga, Book One",eBooks,http://www.amazon.com/dp/B00UE2F072/,6,1
"Continuous Delivery: Reliable Software Releases through Build, Test, and Deployment Automation (Addison-Wesley Signature Series (Fowler))",Book,http://www.amazon.com/dp/0321601912/,6,1
"Anker 2.4G Wireless Vertical Ergonomic Optical Mouse, 800 / 1200 /1600DPI, 5 Buttons - Black",Personal Computer,http://www.amazon.com/dp/B00BIFNTMC/,5,1
Matias Half Keyboard,CE,http://www.amazon.com/dp/B00006IZIL/,5,1
"Lacoste Eau de Lacoste L.12.12 Blanc Eau de Toilette for Men, 3.3 fl. oz.",Prestige Beauty,http://www.amazon.com/dp/B004STJ0UU/,4,1
"Water Snake Wigglies - 9.5 inch, Colors May Vary",Toy,http://www.amazon.com/dp/B004USMJSY/,4,1
Razer Tartarus Chroma Expert RGB Gaming Keypad with 25 Programmable Keys Including an 8-way Thumb-pad,Personal Computer,http://www.amazon.com/dp/B00ZTRW00C/,4,1
Glad Tall Kitchen Drawstring Trash Bag - 13 Gallon,"Health, Household & Baby Care",https://www.amazon.com/Glad-Tall-Kitchen-Drawstring-Trash/dp/B00ASBOP9S/ref=redir_mobile_desktop?_encoding=UTF8&amp%3BdpID=51ZS7Mr1gyL&amp%3BdpPl=1&amp%3Bkeywords=trash%20bag&amp%3Bpi=SY200_QL40&amp%3Bref=plSrch&amp%3Bsr=8-1&qid=1446365766&ref_=mp_s_a_1_1,3,1
The Talent Code: Greatness Isn't Born. It's Grown. Here's How.,Book,http://www.amazon.com/dp/055380684X/,3,1
MIONIX NAOS 7000 Multi-Color Ergonomic Optical Gaming Mouse,Boost,http://www.amazon.com/dp/B00HGKQ6VY/,3,1
BenQ ZOWIE EC1-A E-Sports Ergonomic Optical Gaming Mouse,Personal Computer,http://www.amazon.com/dp/B00S9SH7C4/,2,1
The Count of Monte Cristo (A Penguin Classics Hardcover),Book,http://www.amazon.com/dp/0140449264/,2,1
"Acer Aspire ES 15, 15.6"" HD, Intel Core i3-6100U, 4GB DDR3L, 1TB HDD, Windows 10 Home, ES1-572-31KW",Personal Computer,http://www.amazon.com/dp/B01J42JPL4/,2,1
Nair Men Hair Removal Cream - 13 oz,Beauty,http://www.amazon.com/dp/B00HZ24I18/,2,1
Aquasentials Easy Lotion Applicator,Health and Beauty,http://www.amazon.com/dp/B001D8ZGAM/,2,1
"Ronco ST5500SSGEN Series Stainless Steel Rotisserie Oven, Silver",Kitchen,http://www.amazon.com/dp/B0070ZWG6Y/,1,1
"Rival RO180 18-Quart Roaster Oven, White",Kitchen,http://www.amazon.com/dp/B000G0HPEI/,1,1
Green Screen Backdrop Background by Fancierstudio -6'x9' Chromakey Green Screen,Photography,http://www.amazon.com/dp/B001PCQTDO/,1,1
"Video Lighting Kit Photo Studio Kit 2000 Watt Continuous Portrait studio lighting kit with Carrying Case - 2 light stands, 2 softboxes, 2 Light Heads w/5 bulbs, 10 photo bulbs by Fancierstudio UL9026S",Photography,http://www.amazon.com/dp/B003TY7XJA/,1,1
Release It!: Design and Deploy Production-Ready Software (Pragmatic Programmers),Book,http://www.amazon.com/dp/0978739213/,1,1
League of Legends $10 Gift Card - 1380 Riot Points - NA Server Only [Online Game Code],Digital Video Games,http://www.amazon.com/dp/B014X427WM/,1,1
Dongwon DHA Tuna Can 150g X 3can,Grocery,http://www.amazon.com/dp/B009W9Z6AE/,1,1
Giro Advantage 2 Road Bike Helmet,Sports,http://www.amazon.com/dp/B000X36G6G/,1,1
GB Arts Overwatch Tracer Peach Skin 150cm x 50cm High Quality Pillowcase,Home,http://www.amazon.com/dp/B01J3BNRYW/,1,1
Chess Bitch: Women In The Ultimate Intellectual Sport,Book,http://www.amazon.com/dp/189008509X/,1,1
ActiveWrap Hot/Cold Reusable Compress Therapy Wrist/Hand - Universal - OSFM #BAWH007,Health and Beauty,http://www.amazon.com/dp/B000YC01OE/,1,1
Transformers Complete 4-Movie Collection (Blu-ray+Digital HD),DVD,http://www.amazon.com/dp/B00OI8UUYG/,1,1
Superman Grey S Adult Long Sleeve T-shirt L,Apparel,http://www.amazon.com/dp/B00MH0NLZ2/,1,1
Funny Glasses Straw Kids Party Favor DIY Crazy Drinking Straw Novelty - Clear,Car Audio or Theater,http://www.amazon.com/dp/B00WX1XMG8/,1,1
Reverse Blade Rurouni Kenshin Katana 1060 High Carbon Steel,Sports,http://www.amazon.com/dp/B00M9CPQME/,1,1
Finalmouse 2016 - Classic Ergo,Personal Computer,http://www.amazon.com/dp/B00MX8QSLW/,1,1
I Like Girls Dad Hat 6 Panel Baseball Cap White,Apparel,http://www.amazon.com/dp/B01M5KCHJF/,1,1
UbiGear 4445608 300 Feet RJ45 CAT6 Ethernet LAN Network Patch Cable - Blue,PC Accessory,http://www.amazon.com/dp/B00BNL001Y/,1,1
"One Way Mirror Silver-Silver CHROME Window Film 2 PLY - 5% - Size 36""x 5'",Home Improvement,http://www.amazon.com/dp/B00NKEEM0C/,1,1
"Samyang Bulldark Spicy Chicken Roasted Noodles, 4.9 Oz (Pack of 10) (Package might vary)",Grocery,http://www.amazon.com/dp/B00MCGCDKA/,1,1
"Acer Aspire 15.6"" Laptop, Intel i3-5005U Dual-Core 2GHz,4GB Ram.500GB HD, Win 10 (Certified Refurbished)",Personal Computer,http://www.amazon.com/dp/B01N0YBGAI/,1,1
"Acer Aspire V3-572G-54S6 Gaming Laptop - 15.6"" WLED Backlit Screen, 4th Gen Intel Core i5-4210U (1.70GHz), 8GB DDR3L Memory, 1TB HDD, 2GB NVIDIA GeForce GT 840M Graphics, Windows 8.1",Personal Computer,http://www.amazon.com/dp/B00MM2WA8O/,1,1
"2016 Dell Inspiron i3558-5500BLK 15.6"" Laptop (Core i3-5015U 2.1Ghz, 4GB Memory, 1TB Hard Drive, Windows 10, Black)",Personal Computer,http://www.amazon.com/dp/B01HAQGXVQ/,1,1
HotHands Body & Hand Super Warmer (40 count),Sports,http://www.amazon.com/dp/B0007ZF4Q8/,1,1
RENOVA GREEN TOILET PAPER ROLLS - LUXURY BATH TISSUE - 6 PACK - (Black Toilet Paper Company),Tools & Home Improvement,https://www.amazon.com/RENOVA-GREEN-TOILET-PAPER-ROLLS/dp/B00461K5RC/ref=sr_1_14?ie=UTF8&amp;qid=1422388816&amp;sr=8-14&amp;keywords=colored+toilet+paper,1,1
Little Tikes Turtle Sandbox,Toys & Games,https://www.amazon.com/Little-Tikes-Turtle-Round-Sandbox/dp/B00L4KJEV6/ref=sr_1_3?ie=UTF8&amp;qid=1453914158&amp;sr=8-3&amp;keywords=turtle+sandbox,1,1
"Infi-touch, Heavy Duty, Black Nitrile Gloves, 9.5"" Length, Powder Free, Hypoallergenic, 6 Mil Thickness, 100 Count - Small",Home,http://www.amazon.com/dp/B00S8W7EA6/,1,1
"Analytic Methods in Sports: Using Mathematics and Statistics to Understand Data from Baseball, Football, Basketball, and Other Sports",Book,http://www.amazon.com/dp/1482237016/,1,1
Peak: Secrets from the New Science of Expertise,Book,http://www.amazon.com/dp/0544947223/,1,1
