name,category,amazon_link,total_mentions,subreddit_mentions
"Drawing on the Right Side of the Brain: The Definitive, 4th Edition",Book,http://www.amazon.com/dp/1585429201/,19,1
Wacom Intuos Draw CTL490DW Digital Drawing and Graphics Tablet,Electronics,https://www.amazon.com/Wacom-CTL490DW-Digital-Drawing-Graphics/dp/B010LHRFM2,6,1
Copic Marker 12-Piece Sketch Basic Set,Art and Craft Supply,http://www.amazon.com/dp/B000MRR3GU/,1,1
"Drew Struzan's Illustration Art Lesson ""Conceiving and Creating the Hellboy Movie Poster Art"" Instructional DVD",DVD,http://www.amazon.com/dp/B007GQMANG/,1,1
The Unfeathered Bird,Book,http://www.amazon.com/dp/0691151342/,1,1
