name,category,amazon_link,total_mentions,subreddit_mentions
Figure Drawing: Design and Invention,Book,http://www.amazon.com/dp/0615272819/,34,1
Imaginative Realism: How to Paint What Doesn't Exist (James Gurney Art),Book,http://www.amazon.com/dp/0740785508/,7,1
Color and Light: A Guide for the Realist Painter (James Gurney Art),Book,http://www.amazon.com/dp/0740797719/,45,1
How to Draw: drawing and sketching objects and environments from your imagination,Book,http://www.amazon.com/dp/1933492732/,43,1
"How to Render: the fundamentals of light, shadow and reflectivity",Book,http://www.amazon.com/dp/1933492961/,10,1
