name,category,amazon_link,total_mentions,subreddit_mentions
"Lebanon: A History, 600 - 2011 (Studies in Middle Eastern History)",Book,http://www.amazon.com/dp/0190217839/,1,1
The Bible Came from Arabia,Book,http://www.amazon.com/dp/0224028308/,1,1
Levant: Splendour and Catastrophe on the Mediterranean,Book,http://www.amazon.com/dp/030018171X/,1,1
"House of Stone: A Memoir of Home, Family, and a Lost Middle East",Book,http://www.amazon.com/dp/0544002199/,1,1
701 Lebanese Verbs,Book,http://www.amazon.com/dp/0615751245/,1,1
How to Win Friends & Influence People,Book,http://www.amazon.com/dp/0671027034/,222,1
Training the Best Dog Ever: A 5-Week Program Using the Power of Positive Reinforcement,Book,http://www.amazon.com/dp/0761168850/,7,1
The Arab Awakening: The Story of the Arab National Movement,Book,http://www.amazon.com/dp/0866850007/,1,1
Bet You Didn't Know This About Beirut!,Book,http://www.amazon.com/dp/9953019266/,1,1
Lebanon Country Flag Mini Boxing Gloves to Hang Over Your Automobile Mirror ... New,Lawn & Patio,http://www.amazon.com/dp/B00BIWJ0CI/,1,1
CanaKit Raspberry Pi 3 Complete Starter Kit - 32 GB Edition,PC Accessory,http://www.amazon.com/dp/B01C6Q2GSY/,108,1
Elegoo UNO R3 Board ATmega328P ATMEGA16U2 with USB Cable for Arduino,BISS Basic,http://www.amazon.com/dp/B01EWOE0UU/,3,1
"6pcs Set Arts Fake Temporary Tattoo Arm Sunscreen Sleeves - AKStore - Designs Tiger, Crown Heart, Skull, Tribal and Etc",Toy,http://www.amazon.com/dp/B01G3E1XT8/,3,1
Chinatown - 27 x 40 Framed Movie Poster,Home,http://www.amazon.com/dp/B01IU8MGEQ/,1,1
Oscar Style Trophy,Sports,http://www.amazon.com/dp/B01M1VN7WQ/,1,1
Because I'm The Director That's Why! - Cap,Apparel,http://www.amazon.com/dp/B01N6CPKNM/,1,1
