name,category,amazon_link,total_mentions,subreddit_mentions
"mberry Miracle Fruit Tablets, 10-Count",Grocery,http://www.amazon.com/dp/B001LXYA5Q/,47,2
Pride and Prejudice and Zombies: The Classic Regency Romance - Now with Ultraviolent Zombie Mayhem!,Book,http://www.amazon.com/dp/1594743347/,5,1
Build Your Own Metal Working Shop From Scrap (Complete 7 Book Series),Book,http://www.amazon.com/dp/1878087355/,4,1
Narc - PlayStation 2,Video Games,http://www.amazon.com/dp/B00008XL06/,1,1
KitchenAid Hand Mixer Dough Hooks,Kitchen,http://www.amazon.com/dp/B00014W9QS/,1,1
"Avon SKIN-SO-SOFT Bug Guard PLUS IR3535® Insect Repellent Moisturizing Lotion - SPF 30 Gentle Breeze, 4 oz",Beauty,http://www.amazon.com/dp/B0001ZWPI4/,6,1
"Zojirushi SL-JAE14SA Mr. Bento Stainless Steel Lunch Jar, Silver",Kitchen,http://www.amazon.com/dp/B000246GSE/,39,1
ReadiVac 39454 PowerPan Cordless Dustpan,Home,http://www.amazon.com/dp/B000EOQDFS/,1,1
Daron Shock Ball Hot Potato Game,Toy,http://www.amazon.com/dp/B001074TGS/,3,1
"American Standard 6561.017.020 Trimbrook 0.85-to-1.0-Gallon Per Flush Urinal with Siphon Jet Flush Action, White",Home Improvement,http://www.amazon.com/dp/B001A06IKU/,1,1
Zeo Personal Sleep Manager,Speakers,http://www.amazon.com/dp/B002IY65V4/,3,1
PNY Label Attache 2 GB USB 2.0 Flash Drive P-FD2GB/REDBTS-EF (Red),CE,http://www.amazon.com/dp/B003JGCJ3S/,1,1
FLIPPER - the Most Reliable and Inexpensive Toilet Seat Lifter,Home,http://www.amazon.com/dp/B0052SVSQ0/,2,1
GoldenEye 007: Reloaded,Video Games,http://www.amazon.com/dp/B005DKMC6M/,2,1
NETGEAR WiFi USB 2.0 Adapter - AC Dual Band (A6200),Personal Computer,http://www.amazon.com/dp/B008HO9D7M/,2,1
"SMASH MUTE...The Big, Fat TV Mute Button (a.k.a. Your Happy Button)",Speakers,http://www.amazon.com/dp/B0095TCMVC/,1,1
"COGO Caffeinated Hot Chocolate, 50 one ounce envelopes.",Grocery,http://www.amazon.com/dp/B00A7E0N3S/,2,1
"Swiss Miss Hot Cocoa Mix, Breakfast Blends Pick Me Up with Caffeine, 8-Count Envelopes (5 Boxes)",Grocery,http://www.amazon.com/dp/B00B4K9PXS/,1,1
Rust Oleum 274232 Never Wet Multi Purpose Kit,Home Improvement,http://www.amazon.com/dp/B00DNQBFAW/,8,1
"Grape Solar GS-GoCharger-7.5 Monocrystalline Portable Solar Panel with Micro USB Cable, 7.5-watt",Lawn & Patio,http://www.amazon.com/dp/B00FZIJFCQ/,1,1
Khepler Games Drinking Game Alcoholics Party Deluxe 4 Kings Playing Cards Deck,Toy,http://www.amazon.com/dp/B00GKR36LC/,1,1
Ziploc Slider Storage Bags Gallon Value Pack 32 ct (Pack Of 3),Health and Beauty,http://www.amazon.com/dp/B00HXCNQW2/,1,1
ACR 2278 RapidDitch Abandon Ship Survival Gear Bag,Wireless,http://www.amazon.com/dp/B00IAJGNNG/,1,1
"Glow in the Dark Toilet Seat (Neon Green, Elongated)",Home,http://www.amazon.com/dp/B00IU1RESC/,1,1
"8 Black NFC Stickers NTAG213 by Tagstand - Fully programmable, and works with Android, Samsung Galaxy S7, S6, S5, S4, S3, Nexus 5, HTC, and All Other NFC Enabled Devices",Wireless,http://www.amazon.com/dp/B00KSR0636/,13,1
"Mattress Wedge, Queen",Health and Beauty,http://www.amazon.com/dp/B00L4INP9A/,1,1
"SilverStone Microwave Cookware BPA-Free Microwavable Pressure Cooker, Large, Chili Red",Kitchen,http://www.amazon.com/dp/B00L8XOZU4/,2,1
America Flag Toilet Paper / USA Pattern Roll Paper,Home,http://www.amazon.com/dp/B00Q4IIF22/,5,1
"Dr. Frederick's Original Donut Cushion - 15"" Inflatable Ring Cushion - Hemorrhoid Treatment, Bed Sores, Coccyx & Tailbone Pain, Child Birth, Prostatitis - Red",Health and Beauty,http://www.amazon.com/dp/B00T3TUXTW/,2,1
"Jet-Puffed S'moreMallows Chocolate Stripe Marshmallows, 17.5 oz",Grocery,http://www.amazon.com/dp/B00XLV95AG/,1,1
Lexar JumpDrive V20 16GB USB 2.0 Flash Drive LJDV20-16GABNL3 - 3 Pack,Personal Computer,http://www.amazon.com/dp/B012PLDTGS/,1,1
"Mr. President Billionaire Halloween Costume Wig, Adjustable",Apparel,http://www.amazon.com/dp/B015I452K0/,1,1
Ipro i3185 Unlocked GSM Dual-SIM Cell Phone with Camera and 800 mAh Battery big keypad FM Bluetooth alarm calendar Quad Band (Blue),Wireless,http://www.amazon.com/dp/B01GDA9NOO/,1,1
SaberLight - Revolutionary Flameless Plasma Beam Lighter - Rechargeable - Airport Safe - Butane Free - Flameless - Splash Proof - Windproof - No Harmful Chemicals - Lifetime Warranty,Health and Beauty,http://www.amazon.com/dp/B01M5J44TQ/,1,1
"One Simple Idea, Revised and Expanded Edition: Turn Your Dreams into a Licensing Goldmine While Letting Others Do the Work",Book,http://www.amazon.com/dp/1259589676/,2,1
"SG3120 Push-button piezo Spark Generator, igniter Replacement for Select Gas Grill Models Amana, Aussie, Ducane, Weber and Others",Lawn & Patio,http://www.amazon.com/dp/B01N32GF6J/,1,1
