name,category,amazon_link,total_mentions,subreddit_mentions
Little Black Classics Box Set (Penguin Little Black Classics),Books,https://www.amazon.com/Little-Black-Classics-Box-Set/dp/0141398876/ref=sr_1_1?s=books&amp;ie=UTF8&amp;qid=1424539952&amp;sr=1-1&amp;keywords=,2,1
Dylan's Visions of Sin,Books,https://www.amazon.com/Dylans-Visions-Sin-Christopher-Ricks/dp/0060599243,2,1
The Complete Robot (Robot Series),Books,https://www.amazon.com/Complete-Robot-Isaac-Asimov/dp/0586057242/ref=sr_1_3?ie=UTF8&amp;qid=1430590214&amp;sr=8-3&amp;keywords=asimov,1,1
The Divine Comedy of Dante Alighieri: Volume 1: Inferno,Books,https://www.amazon.com/The-Divine-Comedy-Dante-Alighieri/dp/0195087445,1,1
The Invention of Morel (New York Review Books Classics),Books,https://www.amazon.com/Invention-Morel-Review-Books-Classics/dp/1590170571,1,1
Orphan Train,Books,https://www.amazon.com/Orphan-Train-Christina-Baker-Kline/dp/0061950726,1,1
"The Girl in the Spider's Web: A Lisbeth Salander novel, continuing Stieg Larsson's Millennium Series",Books,https://www.amazon.com/The-Girl-Spiders-Web-continuing/dp/0385354282,1,1
Elric of Melnibone,Books,https://www.amazon.com/Elric-Melnibone-Michael-Moorcock/dp/091541905X/ref=sr_1_3?ie=UTF8&amp;qid=1420247081&amp;sr=8-3&amp;keywords=Elric+of+Melnibone,1,1
The Story of Lucy Gault: A Novel,Books,https://www.amazon.com/Story-Lucy-Gault-Novel/dp/014200331X,1,1
"The Divine Comedy (The Inferno, The Purgatorio, and The Paradiso)",Books,https://www.amazon.com/Divine-Comedy-Inferno-Purgatorio-Paradiso/dp/0451208633/ref=sr_1_2?s=books&amp;ie=UTF8&amp;qid=1458687908&amp;sr=1-2&amp;keywords=inferno+john+ciardi,1,1
After Rain: Stories,Books,https://www.amazon.com/After-Rain-Stories-William-Trevor/dp/0140258345,1,1
The Senses of Walden: An Expanded Edition,Books,https://www.amazon.com/Senses-Walden-Expanded-Stanley-Cavell/dp/0226098133/ref=sr_1_1?ie=UTF8&amp;qid=1445301098&amp;sr=8-1&amp;keywords=senses+of+walden,1,1
Before Night Falls: A Memoir,Books,https://www.amazon.com/Before-Night-Falls-Reinaldo-Arenas/dp/0140157654,1,1
The Inferno,Books,https://www.amazon.com/Inferno-Dante/dp/0385496982/,1,1
Making of Americans (American Literature (Dalkey Archive)),Books,https://www.amazon.com/Making-Americans-American-Literature-Archive/dp/1564780880,1,1
Essays (Everyman's Library Contemporary Classics Series),Books,https://www.amazon.com/Essays-Everymans-Library-Classics-Contemporary/dp/0375415033,1,1
