name,category,amazon_link,total_mentions,subreddit_mentions
AmazonBasics USB 3.0 Cable - A-Male to Micro-B - 6 Feet (1.8 Meters),Personal Computer,http://www.amazon.com/dp/B00NH12R1O/,3,1
Samsung Galaxy S5 Spare Battery Charger with OEM Replacement Battery (Discontinued by Manufacturer),Cell Phones & Accessories,https://www.amazon.com/Samsung-Galaxy-Battery-Charger-Replacement/dp/B00ITI22HY/ref=sr_1_1?ie=UTF8&amp;qid=1428627316&amp;sr=8-1&amp;keywords=galaxy+s5+battery+with+charger,2,1
New Wayzon Samsung Galaxy S5 Sm-g900f USB Cover Flap; for S5 USB Data Charging Port Dust Plug Block Water Proof Cover,Wireless,http://www.amazon.com/dp/B00MV2YK60/,1,1
"Mudder 6 in 1 Replacement Accessories for Samsung Galaxy S5, 2 Pieces USB Charger Port Cover Flap + Plastic Holder + Screw + Screwdriver + Cleaning Cloth",Wireless,http://www.amazon.com/dp/B00YG6H4XA/,1,1
"[NFC/Google Wallet Capable] Anker 2800mAh Li-ion Battery for Samsung Galaxy S5, I9600, Verizon G900V, AT&T G900A, T-Mobile G900T, Sprint G900P [18-Month Warranty]",Wireless,http://www.amazon.com/dp/B00N8ULV7K/,1,1
"Galaxy S5 Battery, Anker 2800mAh Replacement Battery for Samsung Galaxy S5, S5 Active",Wireless,http://www.amazon.com/dp/B00N8V467G/,1,1
AmazonBasics Wall Charger with USB Outlet (2.1 Amp Output),CE,http://www.amazon.com/dp/B005CG2ATQ/,1,1
Samsung Authentic OEM Micro-USB 3.0 Charger 2.0-Amp for Samsung Galaxy S5 and Note 3 - Non-Retail Packaging - White,Wireless,http://www.amazon.com/dp/B00NWP4UB0/,1,1
