name,category,amazon_link,total_mentions,subreddit_mentions
Nintendo Super Smash Bros. White Classic Gamecube Controller,Video Games,http://www.amazon.com/dp/B00O9GW8TC/,18,2
Nintendo Super Smash Bros. Black Classic Gamecube Controller,Video Games,http://www.amazon.com/dp/B00O9GW8VK/,8,2
Official Nintendo White Classic Gamecube Controller,Video Games,http://www.amazon.com/dp/B0017KIBAI/,10,1
Honbay 128MB Black Memory Card Compatible for Wii  Gamecube,Personal Computer,http://www.amazon.com/dp/B011HMIVJ6/,1,1
Monster Wii Cable GameLink Component Video and Stereo Audio A/V Kit,CE,http://www.amazon.com/dp/B002T7XV9Y/,1,1
Nintendo GameCube Component Video Cable,Video Games,http://www.amazon.com/dp/B00005QDJU/,1,1
