name,category,amazon_link,total_mentions,subreddit_mentions
Weller WLC100 40-Watt Soldering Station,Tools & Home Improvement,https://www.amazon.com/dp/B000AS28UC/,7,1
Walnut Hollow Creative Versa Tool with Versa-Temp Variable Temperature Control and 11 Woodburning Points,Toys & Games,https://www.amazon.com/Walnut-Hollow-Versa-Temp-Temperature-Woodburning/dp/B005P1TRAS/,5,1
PMC05228 - Thermal Calculator Paper Rolls,Industrial & Scientific,https://www.amazon.com/PMC05228-Thermal-Calculator-Paper-Rolls/dp/B0000DBMGL,2,1
DeLonghi EW7507EB Oil Filled Radiator Heater Black 1500W,Home & Kitchen,https://www.amazon.com/DeLonghi-EW7507EB-Filled-Radiator-Heater/dp/B004BZFQB8,1,1
Tommy Hilfiger Game Boy Color,Video Games,https://www.amazon.com/Tommy-Hilfiger-Game-Boy-Color/dp/B000050B3K,1,1
OSTENT USB Power Supply Charger Cable Cord for Nintendo GBM Game Boy Micro Console Video Games,Video Games,https://www.amazon.com/gp/product/B00FJ2WR6E/,1,1
Hitech - USB Cable for Charging Gameboy Advance SP & NDS,Video Games,https://www.amazon.com/Hitech-Charging-Gameboy-Advance-Nintendo-DS/dp/B000I1SCMO,1,1
Rosewill Single Parallel (SPP/PS2/EPP/ECP) Universal Low-Profile PCI card Components Other RC-302,Electronics,https://www.amazon.com/Rosewill-Universal-Low-Profile-Components-RC-302/dp/B004B0H69I/ref=pd_lpo_147_tr_t_3?_encoding=UTF8&amp;psc=1&amp;refRID=PX9DDK1SP0R7E0J56BE9,1,1
