name,category,amazon_link,total_mentions,subreddit_mentions
Home Brew Ohio PI-0V33-JSZX Gold Crown Bottle Caps (Pack of 144),BISS,http://www.amazon.com/dp/B00023B72U/,5,1
The Legend of Zelda: Ocarina of Time 3D,Video Games,http://www.amazon.com/dp/B003O6E800/,6,1
"Gator Crunch USB Charge Cable for Nintendo 3DS/DSi/XL (Lifetime Warranty, Bulk Packaging)",PC Accessory,http://www.amazon.com/dp/B0071BJK34/,9,1
Pulse Elite Edition Wireless Stereo Headset,Video Games,http://www.amazon.com/dp/B0087OZ5FG/,11,1
Xbox 360 E 4GB Console,Video Games,http://www.amazon.com/dp/B00D9EPI38/,5,1
"Seagate Backup Plus Slim 2TB Portable External Hard Drive USB 3.0, Red (STDR2000103)",Personal Computer,http://www.amazon.com/dp/B00FRHTTJE/,13,1
Gamestop Gift Cards - E-mail Delivery,Electronic Gift Card,http://www.amazon.com/dp/B00MV9FCFQ/,9,1
"Funko POP Games: Bioshock - Big Daddy 6"" Action Figure",Toy,http://www.amazon.com/dp/B012OWVSC0/,5,1
GalGun: Double Peace - PlayStation 4,Video Games,http://www.amazon.com/dp/B01GOK1H06/,2,1
amFilm Tempered Glass Screen Protector for Nintendo Switch 2017 (2-Pack),Wireless,http://www.amazon.com/dp/B01N3ASPNV/,244,1
Destiny 2 - PlayStation 4 Collector's Edition,Video Games,http://www.amazon.com/dp/B06XPSGV28/,2,1
