name,category,amazon_link,total_mentions,subreddit_mentions
Unity in Action: Multiplatform Game Development in C# with Unity 5,Book,http://www.amazon.com/dp/161729232X/,68,58
"Game Engine Architecture, Second Edition",Book,http://www.amazon.com/dp/1466560010/,42,24
"The Art of Game Design: A Book of Lenses, Second Edition",Book,http://www.amazon.com/dp/1466598646/,36,16
The Art of Game Design: A Book of Lenses,Book,http://www.amazon.com/dp/0123694965/,37,14
"Game Coding Complete, Fourth Edition",Book,http://www.amazon.com/dp/1133776574/,18,10
"3D Math Primer for Graphics and Game Development, 2nd Edition",Book,http://www.amazon.com/dp/1568817231/,20,9
"Mathematics for 3D Game Programming and Computer Graphics, Third Edition",Book,http://www.amazon.com/dp/1435458869/,16,9
Theory of Fun for Game Design,Book,http://www.amazon.com/dp/1449363210/,22,8
Design Patterns: Elements of Reusable Object-Oriented Software,Book,http://www.amazon.com/dp/0201633612/,87,7
Game Engine Architecture,Book,http://www.amazon.com/dp/1568814135/,11,7
The Pragmatic Programmer: From Journeyman to Master,Book,http://www.amazon.com/dp/020161622X/,86,6
Clean Code: A Handbook of Agile Software Craftsmanship,Book,http://www.amazon.com/dp/0132350882/,236,6
"Drawing on the Right Side of the Brain: The Definitive, 4th Edition",Book,http://www.amazon.com/dp/1585429201/,79,6
Multiplayer Game Programming: Architecting Networked Games (Game Design),Book,http://www.amazon.com/dp/0134034309/,6,6
Level Up! The Guide to Great Video Game Design,Book,http://www.amazon.com/dp/1118877160/,13,6
Game Feel: A Game Designer's Guide to Virtual Sensation (Morgan Kaufmann Game Design Books),Book,http://www.amazon.com/dp/0123743281/,22,6
Programming Game AI By Example (Wordware Game Developers Library),Book,http://www.amazon.com/dp/1556220782/,11,6
Real-Time Collision Detection (The Morgan Kaufmann Series in Interactive 3-D Technology),Book,http://www.amazon.com/dp/1558607323/,9,5
Head First Design Patterns: A Brain-Friendly Guide,Book,http://www.amazon.com/dp/0596007124/,51,5
"Code Complete: A Practical Handbook of Software Construction, Second Edition",Book,http://www.amazon.com/dp/0735619670/,85,5
Game Programming Patterns,Book,http://www.amazon.com/dp/0990582906/,14,5
3D Game Engine Design: A Practical Approach to Real-Time Computer Graphics (Morgan Kaufmann Series in Interactive 3D Technology),Book,http://www.amazon.com/dp/0122290631/,5,4
Game Programming Patterns,eBooks,http://www.amazon.com/dp/B00P5URD96/,4,4
"Real-Time Rendering, Third Edition",Book,http://www.amazon.com/dp/1568814240/,15,4
Designing Games: A Guide to Engineering Experiences,Book,http://www.amazon.com/dp/1449337937/,16,4
The Design of Everyday Things: Revised and Expanded Edition,Book,http://www.amazon.com/dp/0465050654/,49,4
Programming: Principles and Practice Using C++ (2nd Edition),Book,http://www.amazon.com/dp/0321992784/,36,4
"The Animator's Survival Kit: A Manual of Methods, Principles and Formulas for Classical, Computer, Games, Stop Motion and Internet Animators",Book,http://www.amazon.com/dp/086547897X/,39,4
Masters of Doom: How Two Guys Created an Empire and Transformed Pop Culture,Book,http://www.amazon.com/dp/0812972155/,38,4
Tricks of the 3D Game Programming Gurus-Advanced 3D Graphics and Rasterization (Other Sams),Book,http://www.amazon.com/dp/0672318350/,4,4
Introduction to 3D Game Programming with DirectX 11,Book,http://www.amazon.com/dp/1936420228/,9,4
Glued to Games: How Video Games Draw Us In and Hold Us Spellbound (New Directions in Media),Book,http://www.amazon.com/dp/0313362246/,8,3
Rules of Play: Game Design Fundamentals (MIT Press),Book,http://www.amazon.com/dp/0262240459/,11,3
"Jab, Jab, Jab, Right Hook: How to Tell Your Story in a Noisy Social World",Book,http://www.amazon.com/dp/006227306X/,9,3
C++ Primer (5th Edition),Book,http://www.amazon.com/dp/0321714113/,55,3
How to Draw: drawing and sketching objects and environments from your imagination,Book,http://www.amazon.com/dp/1933492732/,43,3
"The Mythical Man-Month: Essays on Software Engineering, Anniversary Edition (2nd Edition)",Book,http://www.amazon.com/dp/0201835959/,37,3
"Game Engine Architecture, Second Edition",eBooks,http://www.amazon.com/dp/B00MMOJ076/,3,3
The Ultimate Guide to Video Game Writing and Design,Book,http://www.amazon.com/dp/158065066X/,7,3
Challenges for Game Designers,Book,http://www.amazon.com/dp/158450580X/,12,3
No-Code Video Game Development Using Unity and Playmaker,Book,http://www.amazon.com/dp/1498735657/,3,3
"Essential Mathematics for Games and Interactive Applications, Third Edition",Book,http://www.amazon.com/dp/1482250926/,5,3
OpenGL Superbible: Comprehensive Tutorial and Reference (7th Edition),Book,http://www.amazon.com/dp/0672337479/,5,3
"Foundations of Game Engine Development, Volume 1: Mathematics",Book,http://www.amazon.com/dp/0985811749/,3,3
Effective C++: 55 Specific Ways to Improve Your Programs and Designs (3rd Edition),Book,http://www.amazon.com/dp/0321334876/,16,3
The Illusion of Life: Disney Animation,Book,http://www.amazon.com/dp/0786860707/,18,3
"Physically Based Rendering, Second Edition: From Theory to Implementation",Book,http://www.amazon.com/dp/0123750792/,5,3
Rework,Book,http://www.amazon.com/dp/0307463745/,15,2
Game Physics,Book,http://www.amazon.com/dp/0123749034/,2,2
The Complete Film Production Handbook (American Film Market Presents),Book,http://www.amazon.com/dp/024081150X/,5,2
The Natural Way to Draw: A Working Plan for Art Study,Book,http://www.amazon.com/dp/0395530075/,10,2
Stay Awhile and Listen: Book I Legendary Edition: How Two Blizzards Unleashed Diablo and Forged a Video-Game Empire,eBooks,http://www.amazon.com/dp/B00G8UL474/,12,2
Effective STL: 50 Specific Ways to Improve Your Use of the Standard Template Library,Book,http://www.amazon.com/dp/0201749629/,3,2
Introduction to 3D Game Programming with DirectX 12 (Computer Science),Book,http://www.amazon.com/dp/1942270062/,2,2
Homo Ludens: A Study of the Play-Element in Culture,Book,http://www.amazon.com/dp/1614277060/,2,2
"Essential Mathematics for Games and Interactive Applications: A Programmer's Guide, Second Edition",Book,http://www.amazon.com/dp/0123742978/,3,2
"Universal Principles of Design, Revised and Updated: 125 Ways to Enhance Usability, Influence Perception, Increase Appeal, Make Better Design Decisions, and Teach through Design",Book,http://www.amazon.com/dp/1592535879/,13,2
"ASUS K501LX 15.6 Inch Laptop (Intel Core i7, 8 GB, 256GB SSD) NVIDIA GeForce GTX 950M",Personal Computer,http://www.amazon.com/dp/B00YR6BMS2/,19,2
Designing Virtual Worlds,Book,http://www.amazon.com/dp/0131018167/,5,2
Game Programming Algorithms and Techniques: A Platform-Agnostic Approach (Game Design),Book,http://www.amazon.com/dp/0321940156/,3,2
3D Math Primer For Graphics and Game Development (Wordware Game Math Library),Book,http://www.amazon.com/dp/1556229119/,9,2
"Texturing and Modeling, Third Edition: A Procedural Approach (The Morgan Kaufmann Series in Computer Graphics)",Book,http://www.amazon.com/dp/1558608486/,5,2
The Design of Everyday Things,Book,http://www.amazon.com/dp/1452654123/,25,2
GPU Pro 6: Advanced Rendering Techniques,Book,http://www.amazon.com/dp/1482264617/,2,2
Game Analytics: Maximizing the Value of Player Data,Book,http://www.amazon.com/dp/1447147685/,3,2
OpenGL Insights,Book,http://www.amazon.com/dp/1439893764/,3,2
"Head First C#: A Learner's Guide to Real-World Programming with C#, XAML, and .NET",Book,http://www.amazon.com/dp/1449343503/,10,2
Effective Modern C++: 42 Specific Ways to Improve Your Use of C++11 and C++14,Book,http://www.amazon.com/dp/1491903996/,29,2
Wonderbook: The Illustrated Guide to Creating Imaginative Fiction,Book,http://www.amazon.com/dp/1419704427/,7,2
How to Win Friends & Influence People,Book,http://www.amazon.com/dp/0671027034/,222,2
Building XNA 2.0 Games: A Practical Guide for Independent Game Development (Books for Professionals by Professionals),Book,http://www.amazon.com/dp/1430209798/,3,2
"A Software Engineer Learns HTML5, JavaScript and jQuery",Book,http://www.amazon.com/dp/1493692615/,2,2
Domain-Driven Design: Tackling Complexity in the Heart of Software,Book,http://www.amazon.com/dp/0321125215/,24,1
The Everything Store: Jeff Bezos and the Age of Amazon,Book,http://www.amazon.com/dp/0316219266/,3,1
Core Java Volume I--Fundamentals (10th Edition) (Core Series),Book,http://www.amazon.com/dp/0134177304/,7,1
Computer Systems: A Programmer's Perspective (3rd Edition),Book,http://www.amazon.com/dp/013409266X/,13,1
All Your Base Are Belong to Us: How Fifty Years of Videogames Conquered Pop Culture,Book,http://www.amazon.com/dp/0307463559/,2,1
"Introduction to Algorithms, 3rd Edition (MIT Press)",Book,http://www.amazon.com/dp/0262033844/,112,1
Virtual Economies: Design and Analysis (Information Policy),Book,http://www.amazon.com/dp/0262027259/,1,1
The Non-Designer's Design Book (4th Edition),Book,http://www.amazon.com/dp/0133966151/,17,1
Artificial Intelligence for Games,Book,http://www.amazon.com/dp/0123747317/,3,1
A Composer's Guide to Game Music (MIT Press),Book,http://www.amazon.com/dp/0262026643/,8,1
The Audio Programming Book (MIT Press),Book,http://www.amazon.com/dp/0262014467/,4,1
Racing the Beam: The Atari Video Computer System (Platform Studies),Book,http://www.amazon.com/dp/026201257X/,7,1
Data Structures & Algorithm Analysis in C++,Book,http://www.amazon.com/dp/013284737X/,2,1
Drawn to Life: 20 Golden Years of Disney Master Classes: Volume 2: The Walt Stanchfield Lectures,Book,http://www.amazon.com/dp/0240811070/,2,1
Drawn to Life: 20 Golden Years of Disney Master Classes: Volume 1: The Walt Stanchfield Lectures,Book,http://www.amazon.com/dp/0240810961/,4,1
Chris Crawford on Game Design,Book,http://www.amazon.com/dp/0131460994/,2,1
Producing Games: From Business and Budgets to Creativity and Design,Book,http://www.amazon.com/dp/0240810708/,1,1
"Mindstorms: Children, Computers, And Powerful Ideas",Book,http://www.amazon.com/dp/0465046746/,4,1
"The Art of Computer Programming, Vol. 1: Fundamental Algorithms, 3rd Edition",Book,http://www.amazon.com/dp/0201896834/,5,1
"ADTs, Data Structures, and Problem Solving with C++ (2nd Edition)",Book,http://www.amazon.com/dp/0131409093/,2,1
Game Usability: Advancing the Player Experience,Book,http://www.amazon.com/dp/0123744474/,2,1
Visualizing Quaternions (The Morgan Kaufmann Series in Interactive 3D Technology),Book,http://www.amazon.com/dp/0120884003/,1,1
Neuromancer,Book,http://www.amazon.com/dp/0441569595/,19,1
Chinese Industrial Espionage: Technology Acquisition and Military Modernisation (Asian Security Studies),Book,http://www.amazon.com/dp/0415821428/,1,1
Algorithms and Networking for Computer Games,Book,http://www.amazon.com/dp/0470018127/,1,1
Limited Liability Companies For Dummies,Book,http://www.amazon.com/dp/0470173289/,1,1
Parsing Techniques: A Practical Guide (Monographs in Computer Science),Book,http://www.amazon.com/dp/038720248X/,2,1
The Standard C Library,Book,http://www.amazon.com/dp/0131315099/,3,1
