name,category,amazon_link,total_mentions,subreddit_mentions
Is Gwyneth Paltrow Wrong About Everything?: When Celebrity Culture and Science Clash,Book,http://www.amazon.com/dp/067006758X/,3,1
Scott Pilgrims Precious Little Boxset,Book,http://www.amazon.com/dp/1934964573/,9,1
"ChicoBag Original Reusable Shopping Bag, in Blue",Kitchen,http://www.amazon.com/dp/B0012BPNGC/,1,1
Undercover Silicone Nipple Covers Gel Petals Pasties,Apparel,http://www.amazon.com/dp/B00428ZHRC/,10,1
Swinging Sticks Kinetic Energy Sculpture,BISS,http://www.amazon.com/dp/B005I4VPVG/,2,1
"Passion Lubes, Natural Water-Based Lubricant, 55 Gallon Drum",Health and Beauty,http://www.amazon.com/dp/B005MR3IVO/,713,1
Womens Lingerie Underwear Colorful C-String Thong Panty,Apparel,http://www.amazon.com/dp/B007NG5D88/,4,1
"Kleenex Everyday Facial Tissues, 85 ct, (Pack of 36)",Health and Beauty,http://www.amazon.com/dp/B00B9OYLC4/,4,1
Braza No More Panty Lines - Strapless Panties,Apparel,http://www.amazon.com/dp/B00GDW6Q0C/,1,1
C.o. Bigelow Barber Elixir Blue for MEN By Bath & Body Works - 2.5 Oz EDT Spray,Beauty,http://www.amazon.com/dp/B00H4JNYHG/,1,1
Deconovo Black Thermal Insulated Blackout Panel Curtain 52 By 63 Inch,Home,http://www.amazon.com/dp/B00N70FNPM/,3,1
"Braza Double Sided Flash Tape, Clear, 20' Roll",Apparel,http://www.amazon.com/dp/B00Q3GFKLO/,1,1
Down Dog,TV Series Season Video on Demand,http://www.amazon.com/dp/B00RSI4SLY/,1,1
Red Vacance Black Wedding (English Subtitled),Movie,http://www.amazon.com/dp/B00YK2SKWE/,1,1
Promonline Prom dress Women's Gradient Chiffon Formal Long Party Gown,Apparel,http://www.amazon.com/dp/B018NFXZAA/,1,1
