name,category,amazon_link,total_mentions,subreddit_mentions
"InteVision Foam Wedge Bed Pillow (25"" x 24"" x 12"") with High Quality, Removable Cover",Health and Beauty,http://www.amazon.com/dp/B009HHLBKK/,11,2
Gaviscon Advance Liquid Peppermint Flavour 500ml,Health and Beauty,http://www.amazon.com/dp/B002QEPFKS/,1,1
"Whitmor Bed Risers, S/4, Black",Home,http://www.amazon.com/dp/B004AGP0U0/,1,1
Hot Chocolate Mix Grand Arome by Poulain - 450 grams,Grocery,http://www.amazon.com/dp/B005NRGEUA/,1,1
"Folgers Simply Smooth Coffee, 34.5 Ounce",Grocery,http://www.amazon.com/dp/B009I36KBS/,1,1
"InteVision Foam Wedge Bed Pillow (26"" x 25"" x 7.5"") with High Quality, Removable Cover",Home,http://www.amazon.com/dp/B00AK3VZBA/,5,1
Dropping Acid: The Reflux Diet Cookbook & Cure,Book,http://www.amazon.com/dp/0982708319/,2,1
"Acid Reflux Wedge Pillow (32""x30""x7"") with Memory Foam Overlay and Removable Microfiber Cover ""BIG"" by Medslant. Recommended size for GERD and other sleep issues.",Health and Beauty,http://www.amazon.com/dp/B00E3X5K6Y/,1,1
