name,category,amazon_link,total_mentions,subreddit_mentions
"Vodka: How a Colorless, Odorless, Flavorless Spirit Conquered America",Book,http://www.amazon.com/dp/076278699X/,1,1
"India Tree Candied Violet Petals, 0.5 Ounce",Grocery,http://www.amazon.com/dp/B0006GSXS4/,1,1
Teroforma Whisky Stones,Kitchen,http://www.amazon.com/dp/B002GZX2DE/,7,1
Jokari Healthy Steps Citrus Pro 4-in-1 Multi-Tool,Kitchen,http://www.amazon.com/dp/B003Y3B9AK/,1,1
Tomr's Handcrafted Tonic Syrup Concentrate - 200 ml,Grocery,http://www.amazon.com/dp/B005ELN7HI/,2,1
Set of 9 Grey Beverage Chilling Stones [Chill Rocks] Whiskey Stones for Whiskey and other Beverages - in Gift Box with Velvet Carrying Pouch - Made of 100% Pure Soapstone - by Quiseen,Kitchen,http://www.amazon.com/dp/B014Q2R6GS/,5,1
Bar Amigos Value Box Of 6 Everyday Classic Essentials Copa Gin And Tonic Glasses G&T Cup Large Stemmed Balloon Glass Lead Free Crystal Dishwasher Safe 650Ml,Kitchen,http://www.amazon.com/dp/B06XC5LCZS/,1,1
