name,category,amazon_link,total_mentions,subreddit_mentions
HyperX Cloud II Gaming Headset for PC & PS4 - Pink (KHX-HSCP-PK),Electronics,https://www.amazon.com/HyperX-Cloud-Gaming-Headset-PS4/dp/B00Y09G6H8/,5,2
"E-Element Z-88 RGB LED Backlit Water-Proof Mechanical Gaming Keyboard with 81 Keys Anti-Ghost keys, DIY Blue Switches, Black [2017 Model]",Electronics,https://www.amazon.com/dp/B01FXF7HFC/,,1
Zalman Zm-Mic1 High Sensitivity Headphone Microphone,Electronics,https://www.amazon.com/Zalman-Zm-Mic1-Sensitivity-Headphone-Microphone/dp/B00029MTMQ/,21,1
Pound-O-Dice,Toys & Games,https://www.amazon.com/Chessex-001LBCHX-Pound-O-Dice/dp/B008C0KXYS/ref=sr_1_2?ie=UTF8&amp;qid=1495405725&amp;sr=8-2&amp;keywords=pound+of+dice,12,1
"Logitech G600 MMO Gaming Mouse, RGB Backlit, 20 Programmable Buttons",Electronics,https://www.amazon.com/Logitech-G600-Gaming-Mouse-Black/dp/B0086UK7IQ/ref=sr_1_2?ie=UTF8&amp;qid=1448818912&amp;sr=8-2&amp;keywords=logitec+gaming+mouse,8,1
Microsoft Xbox One Controller + Wireless Adapter for Windows 10,Video Games,https://www.amazon.com/gp/product/B015IX3X3E/ref=oh_aui_search_detailpage?ie=UTF8&amp;psc=1,6,1
DualShock 4 Wireless Controller for PlayStation 4 - Jet Black [Old Model],Video Games,https://www.amazon.com/DualShock-Wireless-Controller-PlayStation-Black-4/dp/B00BGA9X9W/ref=sr_1_1?s=videogames&amp;ie=UTF8&amp;qid=1458923483&amp;sr=1-1&amp;keywords=ps4+controller,5,1
Silverstone Tek 120mm Ultra Fine Fan Filter with Magnet Cooling FF123B (Black),Electronics,https://www.amazon.com/Silverstone-Filter-Magnet-Cooling-FF123B/dp/B00ARB5E8U,3,1
"AmazonBasics Premium Wall Mount Monitor Stand - Lift Engine Arm Mount, Aluminum",Electronics,https://www.amazon.com/gp/product/B010QZCT5W/ref=oh_aui_search_detailpage?ie=UTF8&amp;psc=1,3,1
Logitech Washable Keyboard K310 for Windows PCs - Black,Electronics,https://www.amazon.com/Logitech-Washable-Keyboard-K310-Windows/dp/B008D1JRIO/ref=sr_1_1?ie=UTF8&amp;qid=1433455390&amp;sr=8-1&amp;keywords=k310+washable+keyboard&amp;pebp=1433455392807&amp;perid=0MWSCHEP2JCPAB78GC9M,3,1
"Wall Clip - Xbox, PlayStation, Wii, and Retro Game Controller Organizer - 4 Pack, Black",Video Games,https://www.amazon.com/Wall-Clip-PlayStation-Controller-Organizer-360/dp/B00448VR88,2,1
Rachel Rising Volume 1: The Shadow of Death,Books,https://www.amazon.com/Rachel-Rising-The-Shadow-Death/dp/1892597519,2,1
Vera Bradley Reversible Comforter Set Full/Queen Midnight Blues,Home & Kitchen,https://www.amazon.com/Vera-Bradley-Reversible-Comforter-Midnight/dp/B00C5X9KYM,1,1
SteelSeries Siberia v2 Full-Size Gaming Headset with Built-In USB Sound Card (Frost Blue),Electronics,https://www.amazon.com/SteelSeries-Siberia-Full-Size-Gaming-Headset/dp/B008LT5MFA/,1,1
"Razer Kraken Pro Analog Gaming Headset for PC, Xbox One and Playstation 4, White",Electronics,https://www.amazon.com/Razer-Kraken-Analog-Headset-Playstation/dp/B01CUD2PJI/,1,1
"Mudder Silicone Thumb Stick Grips Caps Protect Cover for PS4, Xbox 360, PS3 Controllers, Mixed Color(Set of 10)",Video Games,https://www.amazon.com/dp/B00ZCEW8P4/ref=cm_sw_r_tw_dp_x_q.DJybJH57MFX,1,1
"ComfySure Contour Memory Foam 2 Pc Chair Armrest Cushion Pads: Ergonomic Armchair Cover Cap Pillows with Adjustable Fit Velcro Strap for Office Chairs, Car & Airplane, Wheelchairs & Arm Dining Chairs",Home & Kitchen,https://www.amazon.com/gp/product/B01N3UUVTD/ref=oh_aui_search_detailpage?ie=UTF8&amp;psc=1,1,1
Handstands 55510 Beaded Ergonomic Add-A-Pad Wrist Cushion,Office Products,https://www.amazon.com/gp/product/B001CWI0XY/ref=oh_aui_search_detailpage?ie=UTF8&amp;psc=1,1,1
Scott Pilgrim vs. The World Ramona Flowers Star Circle Messenger Bag,"Clothing, Shoes & Jewelry",https://www.amazon.com/dp/B005MZ6W8C/ref=twister_B005MZ6WAU?_encoding=UTF8&amp;psc=1,1,1
eLink Pro Deluxe Computer Armrest Wrist Rest - Multifunctional Arm-stand Computer Support - Adjustable for Chair or Desk-Black,Home & Kitchen,https://www.amazon.com/gp/product/B00LWA8TB4/ref=oh_aui_search_detailpage?ie=UTF8&amp;psc=1,1,1
Fancy-fix Window Film Lace Flower Non-Adhesive Static Decorative Glass Privacy for home office 17.7in. By 59in.,Home & Kitchen,https://www.amazon.com/gp/product/B00RZ1XGPS/ref=oh_aui_search_detailpage?ie=UTF8&amp;psc=1,1,1
FLASH SALE! 4 Inches Waterproof Cover Coccyx beats Aylio Everlasting Pressure Sore Relieving Wheelchair Memory Foam Seat Cushion (Large Thick Firm-18x16x4),"Health, Household & Baby Care",https://www.amazon.com/gp/product/B013GPKFM8/ref=oh_aui_search_detailpage?ie=UTF8&amp;psc=1,1,1
"Premium PU Leather Lumbar Support by NorthFall Direct - Lower Back Pillow Cushion for Car Seats, Home, Office Chair, Airplanes and More! Includes Seat Strap - Lifetime Guarantee (Black)","Health, Household & Baby Care",https://www.amazon.com/gp/product/B01CZ4P22E/ref=oh_aui_search_detailpage?ie=UTF8&amp;psc=1,1,1
Orientalism and Occidentalism: Is the Mistranslation of Culture Inevitable?,Books,https://www.amazon.com/gp/product/0974261823,1,1
Aya: Life in Yop City,Books,https://www.amazon.com/Aya-Life-City-Marguerite-Abouet/dp/1770460829,1,1
EUBUY USB2.0 Heated Snowflake Pattern Stripped Half/Full Finger Winter Hand Warmer Gloves Mittens (Gray),Electronics,https://www.amazon.com/EUBUY-Snowflake-Pattern-Stripped-Mittens/dp/B00P3JBEZS/,1,1
"USB 2.0 Heated Warmer Gloves, Pink with Grey",All Departments,https://www.amazon.com/Heated-Warmer-Gloves-Pink-Grey/dp/B007WNXS1G,1,1
