name,category,amazon_link,total_mentions,subreddit_mentions
The How Can It Be Gluten Free Cookbook: Revolutionary Techniques. Groundbreaking Recipes.,Book,http://www.amazon.com/dp/1936493616/,12,7
Gluten-Free Baking Classics,Book,http://www.amazon.com/dp/1572840994/,2,2
"Thai Kitchen Instant Rice Noodle Soup, Garlic and Vegetables, 1.6-Ounce Unit (Pack of 12)",Grocery,http://www.amazon.com/dp/B000GZUFCM/,3,2
The Cake Mix Doctor Bakes Gluten-Free,eBooks,http://www.amazon.com/dp/B00556DU1A/,4,2
Authentic Japanese Gluten Free Fresh Ramen (8-pack) - Just Like Real Ramen!,Grocery,http://www.amazon.com/dp/B00TQPRX78/,3,2
"The How Can It Be Gluten Free Cookbook Volume 2: New Whole-Grain Flour Blend, 75+ Dairy-Free Recipes",Book,http://www.amazon.com/dp/1936493985/,3,2
The Cake Mix Doctor Bakes Gluten-Free,Book,http://www.amazon.com/dp/0761160981/,1,1
Why Isn't My Brain Working?: A Revolutionary Understanding of Brain Decline and Effective Strategies to Recover Your Brain's Health,Book,http://www.amazon.com/dp/0985690437/,5,1
Betty Crocker Gluten-Free Cooking (Betty Crocker Cooking),Book,http://www.amazon.com/dp/1118146077/,1,1
"Gluten-Free Artisan Bread in Five Minutes a Day: The Baking Revolution Continues with 90 New, Delicious and Easy Recipes Made with Gluten-Free Flours",Book,http://www.amazon.com/dp/1250018315/,3,1
"Cooking for Isaiah: Gluten-Free & Dairy-Free Recipes for Easy, Delicious Meals",Book,http://www.amazon.com/dp/1606525654/,1,1
The Complete Low-FODMAP Diet: A Revolutionary Plan for Managing IBS and Other Digestive Disorders,Book,http://www.amazon.com/dp/1615190805/,3,1
"Gluten Is My Bitch: Rants, Recipes, and Ridiculousness for the Gluten-Free",Book,http://www.amazon.com/dp/1617691577/,2,1
User Guide Gf/Cf Diet Autism A,Book,http://www.amazon.com/dp/184310055X/,1,1
Authentic Foods Gluten Free Brown Rice Flour Superfine -- 3 lbs,Grocery,http://www.amazon.com/dp/B00021639Y/,1,1
"Arrowhead Mills Vital Wheat Gluten, 10 oz",Grocery,http://www.amazon.com/dp/B0006OCZ4E/,2,1
Want Want Big Shelly Shenbei Snowy Crispy Rice Cracker Biscuits - Sugar Glazed 5.30 oz.,Grocery,http://www.amazon.com/dp/B0009R0626/,1,1
"Rubbermaid Cooler / Ice Chest, 5-quart, Red",Kitchen,http://www.amazon.com/dp/B000GIIR9M/,1,1
"Pirate's Booty Aged White Cheddar, 1 Ounce (Pack of 24)",Grocery,http://www.amazon.com/dp/B000JIN1H2/,3,1
"Kinnikinnick Gluten Free Cookies, Montana Chocolate Chip, 8 Ounce (Pack of 6)",Grocery,http://www.amazon.com/dp/B000LKXC3Q/,1,1
"NOW Sports Whey Protein, Isolate Pure, 10-Pound",Health and Beauty,http://www.amazon.com/dp/B000MAK59O/,3,1
"Pamela's Products Gluten Free Baking and Pancake Mix, 4-Pound Bags (Pack of 3)",Grocery,http://www.amazon.com/dp/B000NMJWZO/,3,1
"Optimum Nutrition Gold Standard 100% Whey Protein Powder, Double Rich Chocolate, 5 Pound",Health and Beauty,http://www.amazon.com/dp/B000QSNYGI/,68,1
Glutino - Muffins English - 6 Muffins In Each Bag {Case of 6},Grocery,http://www.amazon.com/dp/B000WMTQ7Y/,1,1
Ener-G Egg Replacer -- 16 oz,Grocery,http://www.amazon.com/dp/B0014DZGUQ/,3,1
"Chebe Bread All-Purpose Mix, Gluten Free, 7.5-Ounce Bags (Pack of 8)",Grocery,http://www.amazon.com/dp/B001ACNWY8/,1,1
Soy Sauce Container -15 pcs in a Bag.,Home,http://www.amazon.com/dp/B001AJ8HOG/,11,1
"Tasty Bite Organic Basmati Rice, 8.8 Ounce (Pack of 6)",Grocery,http://www.amazon.com/dp/B001HTIXSO/,1,1
Smoking Brand Rolling Paper Green King Size Full Box,Single Detail Page Misc,http://www.amazon.com/dp/B001N6GIWE/,1,1
The UltraMind Solution: Fix Your Broken Brain by Healing Your Body First,Audible,http://www.amazon.com/dp/B001OR747K/,1,1
"Amy's Mexican Casserole Bowl, Gluten-Free, Organic, 9.5-Ounce Boxes (Pack of 12)",Grocery,http://www.amazon.com/dp/B002HTPZUW/,1,1
Waring WMK600 Double Belgian Waffle Maker,Kitchen,http://www.amazon.com/dp/B0034JU9T6/,3,1
"Kinnikinnick Gluten Free S'moreables Graham Style Crackers, 8 Ounce (Pack of 6)",Grocery,http://www.amazon.com/dp/B003TO9RSU/,1,1
"Pacific Foods Organic Cream of Mushroom Condensed Soup, 12-Ounce Carton, 12-Pack",Grocery,http://www.amazon.com/dp/B003VIJI1A/,1,1
"Jovial Organic Brown Rice Spaghetti, 12-Ounce Packages (Pack of 6)",Grocery,http://www.amazon.com/dp/B0049IT94M/,1,1
"Oster CKSTBR9050 Expressbake Bread Maker, White",Kitchen,http://www.amazon.com/dp/B004DPHKBA/,1,1
"Schar Gluten Free Cheese Bites, 4.4 Ounces (Pack of 3)",Grocery,http://www.amazon.com/dp/B004LQRNT0/,1,1
"\Kellogg's Rice Krispies Gluten Free Cereal, Whole Grain Brown Rice, 12-Ounce Boxes (Pack of 4) (Discontinued By Manufacturer)",Grocery,http://www.amazon.com/dp/B004XAPIOQ/,1,1
"King Arthur Gluten Free Flour Chocolate Cake Mix, 22 oz",Grocery,http://www.amazon.com/dp/B004XM4FGG/,1,1
"Great Lakes Gelatin Collagen Hydrolysate Beef, Kosher, 16 oz.",Grocery,http://www.amazon.com/dp/B005KG7EDU/,23,1
Hodgson Mill Mix Seasoned Coating Gf,Grocery,http://www.amazon.com/dp/B005X4H50Q/,1,1
GoPicnic Gluten Free Ready-to-Eat Meals Variety 6-pack,Grocery,http://www.amazon.com/dp/B00654I0XE/,1,1
"King Soba Noodles Organic Sweet Potato and Buckwheat Noodles, 8.8 Ounce",Grocery,http://www.amazon.com/dp/B006DI87GM/,1,1
"Trader Joe's Gluten Free Granola Cranberry Maple Nut, 12oz, 2 packs",Grocery,http://www.amazon.com/dp/B006OP25FS/,1,1
"Ancient Harvest Quinoa Mac and Cheese, 6-Ounce (Pack of 6)",Grocery,http://www.amazon.com/dp/B006Z65D0U/,1,1
Authentic Foods Superfine Brown Rice Flour - 3lb,Grocery,http://www.amazon.com/dp/B007FGJAIU/,1,1
"Schar Cookie Honeygrams, 5.6-Ounce",Grocery,http://www.amazon.com/dp/B007P2O82M/,1,1
Coleman 40 Quart PowerChill Thermoelectric Cooler,Sports,http://www.amazon.com/dp/B008GOBG1Y/,2,1
"Thermos Stainless King 24 Ounce Food Jar, Midnight Blue",Kitchen,http://www.amazon.com/dp/B008JC76XA/,8,1
"Cup4Cup Gluten Free Flour, 25 Pound -- 1 each.",Grocery,http://www.amazon.com/dp/B008N1QN04/,1,1
Gimbals Licorice Scottie Dogs Red 2 Pounds,Grocery,http://www.amazon.com/dp/B009BGH48U/,1,1
Muscle Pharm Combat Powder Chocolate Milk - 4 lbs,Health and Beauty,http://www.amazon.com/dp/B00CQ7U8SE/,1,1
"Dymatize Elite 100% Whey Protein, Rich Chocolate, 5 lbs",Health and Beauty,http://www.amazon.com/dp/B00CUDYY2U/,1,1
"Annie's Gluten Free Macaroni and Cheese, Microwave Cups, Rice Pasta Cheddar Mac and Cheese, 2.01 oz Cup (Pack of 12)",Grocery,http://www.amazon.com/dp/B00D7D1SKI/,1,1
"Mrs. Crimbles Chocolate Macaroon, 2.2 Ounce (Pack of 20)",Grocery,http://www.amazon.com/dp/B00G661HMM/,1,1
Le Veneziane Gluten Free Lasagne Sheets 250 G 2 Pack,Grocery,http://www.amazon.com/dp/B00HRJNNSS/,1,1
Probiotics 30 Billion Per Capsule; Flora Pro-Health by Naturenetics – 60 Day Supply - Vegan – 3rd Party Tested – No Refrigeration Required,Health and Beauty,http://www.amazon.com/dp/B00I3TFPCI/,4,1
"4C Crumbs-Seasoned, Gluten Free, 12 Ounce",Grocery,http://www.amazon.com/dp/B00I4WP61O/,1,1
The How Can It Be Gluten Free Cookbook: Revolutionary Techniques. Groundbreaking Recipes.,eBooks,http://www.amazon.com/dp/B00IPPIETG/,2,1
"Gluten-Free Artisan Bread in Five Minutes a Day: The Baking Revolution Continues with 90 New, Delicious and Easy Recipes Made with Gluten-Free Flours",eBooks,http://www.amazon.com/dp/B00J6U1DWE/,1,1
Julian Bakery Gluten Free & Keto USDA Organic Paleo Wraps (2 Pack) (14 Individual Wraps),Grocery,http://www.amazon.com/dp/B00J9IUCHA/,2,1
Schar Gluten-Free Artisan Baker White Bread 14.1 Ounce (6 Pack),Grocery,http://www.amazon.com/dp/B00JFWGOKO/,1,1
"The Original Zoodle Slicer - Complete Vegetable Spiralizer Spiral Slicer Bundle (With Cleaning Brush, Peeler & eBook)",Kitchen,http://www.amazon.com/dp/B00M6I6MG0/,12,1
"Gaspari Nutrition Myofusion Advanced Protein, Chocolate, 64 Ounce(Packing may vary)",Health and Beauty,http://www.amazon.com/dp/B00MNAGJNW/,1,1
"Schar Gluten Free Lady Finger Cookies, 5.3 oz",Grocery,http://www.amazon.com/dp/B00N9UFD1O/,1,1
"KIND Healthy Grains Granola Bars, Peanut Butter Dark Chocolate, Gluten Free, 1.2 oz Bars, 5 Count",Pantry,http://www.amazon.com/dp/B00QT7V5RA/,1,1
Honey Nut Chex Gluten Free Cereal 12.5 oz Box,Pantry,http://www.amazon.com/dp/B00S0MBX8S/,1,1
"The How Can It Be Gluten Free Cookbook Volume 2: New Whole-Grain Flour Blend, 75+ Dairy-Free Recipes",eBooks,http://www.amazon.com/dp/B00SED1SNI/,1,1
Authentic Japanese Gluten Free Fresh Miso Ramen w/ Soup Base (2 servings x 3pk),Grocery,http://www.amazon.com/dp/B00TPO6B82/,1,1
Freshbox Lunch Box quality lunch boxes lunch boxes for adults and lunch boxes for kids,Kitchen,http://www.amazon.com/dp/B00XO22JKK/,1,1
"Maseca Corn Flour, 4.4 lb",Pantry,http://www.amazon.com/dp/B00ZQMR7L2/,1,1
Organic Brown Rice Ramen (12 Pack Per Bag),Grocery,http://www.amazon.com/dp/B013MOHYRW/,4,1
"Lance Gluten Free Sandwich Crackers, Peanut Butter, 5 Ounce (Pack of 4)",Grocery,http://www.amazon.com/dp/B016NRIU28/,2,1
"Lance Gluten Free Sandwich Crackers, Cheddar Cheese, 5 Oz (Pack of 4)",Grocery,http://www.amazon.com/dp/B016NRIVKO/,1,1
Westinghouse WWM1SSA Select Series Stainless Steel Waffle Maker,Kitchen,http://www.amazon.com/dp/B01B46GS9K/,1,1
The Autoimmune Solution: Prevent and Reverse the Full Spectrum of Inflammatory Symptoms and Diseases,Book,http://www.amazon.com/dp/0062347470/,1,1
"RxBar Real Food Protein Bars Variety Pack, 7 Flavors (Pack of 14),net weight 22 oz single bar 1.83 oz",Grocery,http://www.amazon.com/dp/B01BW71GBG/,1,1
Brain Maker: The Power of Gut Microbes to Heal and Protect Your Brain–for Life,Book,http://www.amazon.com/dp/0316380105/,3,1
Silvana's Gluten-Free and Dairy-Free Kitchen: Timeless Favorites Transformed,Book,http://www.amazon.com/dp/0544157346/,1,1
Gluten-Free Girl American Classics Reinvented,Book,http://www.amazon.com/dp/0544219880/,3,1
"Minimalist Baker's Everyday Cooking: 101 Entirely Plant-based, Mostly Gluten-Free, Easy and Delicious Recipes",Book,http://www.amazon.com/dp/0735210969/,5,1
"Gluten-Free on a Shoestring Bakes Bread: (Biscuits, Bagels, Buns, and More)",Book,http://www.amazon.com/dp/0738216852/,1,1
