name,category,amazon_link,total_mentions,subreddit_mentions
The Machinery of Freedom: Guide to a Radical Capitalism,eBooks,http://www.amazon.com/dp/B00LNDWWMW/,,1
"Fair Play: What Your Child Can Teach You About Economics, Values and the Meaning of Life",eBooks,http://www.amazon.com/dp/B0053GI7XS/,,1
Dead Aid: Why Aid Is Not Working and How There Is a Better Way for Africa,Book,http://www.amazon.com/dp/0374532125/,8,1
"Thinking, Fast and Slow",eBooks,http://www.amazon.com/dp/B00555X8OA/,7,1
"The Primal Prescription: Surviving The ""Sick Care"" Sinkhole",Book,http://www.amazon.com/dp/1939563097/,2,1
"Huge Nose with a Mustache and Bushy Eyebrows on Glasses. (6 Pack) Plastic. 5""",Apparel,http://www.amazon.com/dp/B007JY57D0/,2,1
None Dare Call It Treason,Book,http://www.amazon.com/dp/0914053116/,2,1
"Anarchy Unbound: Why Self-Governance Works Better Than You Think (Cambridge Studies in Economics, Choice, and Society)",Book,http://www.amazon.com/dp/1107629705/,2,1
The Art of Dramatic Writing,Book,http://www.amazon.com/dp/1434495442/,1,1
"Briggs & Stratton 5 gallon Water Can, Blue",Sports & Outdoors,https://www.amazon.com/Briggs-Stratton-gallon-Water-Blue/dp/B01ITSNH9K/,1,1
The End of the Free Market: Who Wins the War Between States and Corporations?,Book,http://www.amazon.com/dp/1591843014/,1,1
How Children Learn (Classics in Child Development),Book,http://www.amazon.com/dp/0201484048/,1,1
