name,category,amazon_link,total_mentions,subreddit_mentions
Dead Aid: Why Aid Is Not Working and How There Is a Better Way for Africa,Books,https://www.amazon.com/Dead-Aid-Working-Better-Africa/dp/0374532125,3,1
"Huge Nose with a Mustache and Bushy Eyebrows on Glasses. (6 Pack) Plastic. 5""","Clothing, Shoes & Jewelry",https://www.amazon.com/dp/B007JY57D0/ref=cm_sw_r_cp_apa_oBcyzb7MHPNBQ,2,1
The Art of Dramatic Writing,Books,https://www.amazon.com/Art-Dramatic-Writing-Lajos-Egri/dp/1434495442,1,1
"The Primal Prescription: Surviving The ""Sick Care"" Sinkhole",Books,https://www.amazon.com/Primal-Prescription-Surviving-Sick-Sinkhole/dp/1939563097,1,1
"Briggs & Stratton 5 gallon Water Can, Blue",Sports & Outdoors,https://www.amazon.com/Briggs-Stratton-gallon-Water-Blue/dp/B01ITSNH9K/,1,1
The End of the Free Market: Who Wins the War Between States and Corporations?,Books,https://www.amazon.com/End-Free-Market-Between-Corporations/dp/1591843014/ref=sr_1_1?ie=UTF8&amp;qid=1492690332,1,1
"Anarchy Unbound: Why Self-Governance Works Better Than You Think (Cambridge Studies in Economics, Choice, and Society)",Books,https://www.amazon.com/Anarchy-Unbound-Self-Governance-Cambridge-Economics/dp/1107629705,1,1
How Children Learn (Classics in Child Development),Books,https://www.amazon.com/Children-Learn-Classics-Child-Development/dp/0201484048/ref=sr_1_2?ie=UTF8&amp;qid=1473526899&amp;sr=8-2&amp;keywords=john,1,1
