name,category,amazon_link,total_mentions,subreddit_mentions
"Camco Hitch Mount Flagpole Holder, Fits Standard 2-Inch Hitch Receivers",Automotive Parts and Accessories,http://www.amazon.com/dp/B004IVGA0G/,7,1
USB Coupler for GoPro Hero4 Cameras,Photography,http://www.amazon.com/dp/B00RDG61FC/,1,1
SMAKN® 12V 5A Female Car Cigar Cigarette Lighter Socket Plug Connector Adapter,Speakers,http://www.amazon.com/dp/B00RT5TE5Q/,2,1
"USB 20 LED Ring Shooting Night Flash Light for GoPro Hero 3+, Hero 3 Plus, Hero 4 Camera Standard Waterproof Housing",Sports,http://www.amazon.com/dp/B00SY1NZFY/,1,1
RAM Mount Small Tough-Claw™ Mount w/Custom GoPro® Hero Adapter,Photography,http://www.amazon.com/dp/B00SYW72JI/,1,1
Foldable Mini Tripod for Digital Cameras and Smartphones for Self Portrait,Wireless,http://www.amazon.com/dp/B00T17KMBU/,1,1
