name,category,amazon_link,total_mentions,subreddit_mentions
Activated Charcoal Powder by Sagano - Raw Organic Coconut Charcoal Bulk Food Grade - Premium Activated Charcoal Face Mask Coconut Powder - Natural Charcoal Teeth Whitening Toothpaste Detox,Home & Kitchen,https://www.amazon.com/Activated-Charcoal-Powder-Sagano-Effective/dp/B01CHDOY1I,2,1
Encyclopedia Gothica: A Novel,Books,https://www.amazon.com/Encyclopedia-Gothica-Liisa-Ladouceur/dp/1770410244/ref=sr_1_1?s=books&amp;ie=UTF8&amp;qid=1463582248&amp;sr=1-1&amp;keywords=encyclopedia+gothica,1,1
Spiral - Womens - GOTHIC ROCK - Mesh Sleeve Flare-Wrap Dress Black,"Clothing, Shoes & Jewelry",https://www.amazon.com/Spiral-Womens-GOTHIC-Sleeve-Flare-Wrap/dp/B00LMZBZ56?ie=UTF8&amp;psc=1&amp;redirect=true&amp;ref_=oh_aui_detailpage_o00_s01,1,1
Doublju Mens Wool Slim Double Breasted Half Trench Coat,"Clothing, Shoes & Jewelry",https://www.amazon.com/Doublju-Mens-Half-Trench-BLACK/dp/B00453KBHA/ref=sr_1_sc_1?ie=UTF8&amp;qid=1494979495&amp;sr=8-1-spell&amp;keywords=doubljy,1,1
Alma Gourmet Squid Ink Jar 90gr,Grocery & Gourmet Food,https://www.amazon.com/Alma-Gourmet-Squid-Ink-90gr/dp/B00SGCP8A6,1,1
Jaxon Deadman Tophat,"Clothing, Shoes & Jewelry",https://www.amazon.com/Jaxon-Deadman-Tophat/dp/B0036VJKCE,1,1
"Lotus Foods Heirloom Forbidden Rice, 15-Ounce (Pack of 6)",Grocery & Gourmet Food,https://www.amazon.com/Lotus-Foods-Heirloom-Forbidden-15-Ounce/dp/B00480GXY0?th=1,1,1
Begonia.K Women's Long Sleeve Open Front Lightweight Maxi Hooded Duster Cardigan,"Clothing, Shoes & Jewelry",https://www.amazon.com/Begonia-K-Womens-Sleeve-Lightweight-Cardigan/dp/B06VYHDH26/ref=pd_sim_193_1?_encoding=UTF8&amp;pd_rd_i=B06VYHDH26&amp;pd_rd_r=BRSGV1TXNMS4YXNND677&amp;pd_rd_w=UyE7j&amp;pd_rd_wg=RJK7f&amp;refRID=BRSGV1TXNMS4YXNND677,1,1
New Black Lace Embroidery 98%UV Protection Sun Block Light Weight Tri-fold Umbrella Parasol,Sports & Outdoors,https://www.amazon.com/Embroidery-Protection-Tri-fold-Umbrella-Parasol/dp/B00CPJ8NA8,1,1
Women's Killstar Bast Leggings Black L,"Clothing, Shoes & Jewelry",https://www.amazon.com/Womens-Killstar-Bast-Leggings-Black/dp/B017E2RZGS/ref=sr_1_10?ie=UTF8&amp;qid=1459749043&amp;sr=8-10&amp;keywords=killstar+leggings,1,1
Killstar Gothic Death Metal Occult Which Baphomet Idol Leggings Pants (XL),"Clothing, Shoes & Jewelry",https://www.amazon.com/Killstar-Gothic-Occult-Baphomet-Leggings/dp/B01AO8EH6A/ref=sr_1_2?ie=UTF8&amp;qid=1459749043&amp;sr=8-2&amp;keywords=killstar+leggings,1,1
