name,category,amazon_link,total_mentions,subreddit_mentions
"Thinking with Type, 2nd revised and expanded edition: A Critical Guide for Designers, Writers, Editors, & Students",Book,http://www.amazon.com/dp/1568989695/,6,3
Meggs' History of Graphic Design,Books,https://www.amazon.com/Meggs-History-Graphic-Design-Philip/dp/0470168730,3,3
"Grid Systems in Graphic Design: A Visual Communication Manual for Graphic Designers, Typographers and Three Dimensional Designers (German and English Edition)",Book,http://www.amazon.com/dp/3721201450/,6,2
Interaction of Color: 50th Anniversary Edition,Book,http://www.amazon.com/dp/0300179359/,4,2
Lean UX: Applying Lean Principles to Improve User Experience,Book,http://www.amazon.com/dp/1449311652/,2,2
"Design Elements, 2nd Edition: Understanding the rules and knowing when to break them - Updated and Expanded",Book,http://www.amazon.com/dp/1592539270/,2,2
American Trademark Designs (Dover Pictorial Archive S),eBooks,http://www.amazon.com/dp/B00A736J0K/,,1
"Don't Make Me Think, Revisited: A Common Sense Approach to Web Usability (3rd Edition) (Voices That Matter)",Book,http://www.amazon.com/dp/0321965515/,13,1
"Sakura Pigma 30062 Micron Blister Card Ink Pen Set, Black, Ass't Point Sizes 6CT Set",Art and Craft Supply,http://www.amazon.com/dp/B0008G8G8Y/,9,1
1: Trademarks & Symbols of the World: The Alphabet in Design (TRADEMARKS AND SYMBOLS OF THE WORLD),Book,http://www.amazon.com/dp/4760104518/,4,1
Wacom Cintiq 27QHD 27 In. Creative Pen & Touch Display,Personal Computer,http://www.amazon.com/dp/B00R7QJAHY/,4,1
Dell UltraSharp U2715H 27-Inch Screen LED-Lit Monitor,Personal Computer,http://www.amazon.com/dp/B00P0EQD1Q/,3,1
The User Experience Team of One: A Research and Design Survival Guide,Book,http://www.amazon.com/dp/1933820187/,3,1
Designing Type,Book,http://www.amazon.com/dp/0300111509/,3,1
"Don't Make Me Think: A Common Sense Approach to Web Usability, 2nd Edition",Book,http://www.amazon.com/dp/0321344758/,2,1
Chromophobia (Focus on Contemporary Issues),Book,http://www.amazon.com/dp/1861890745/,2,1
Leuchtturm1917 Medium Size Hardcover A5 Notebook - Dotted Pages - Black,Office Product,http://www.amazon.com/dp/B002TSIMW4/,2,1
Creative Workshop: 80 Challenges to Sharpen Your Design Skills,Book,http://www.amazon.com/dp/1600617972/,2,1
"Work for Money, Design for Love: Answers to the Most Frequently Asked Questions About Starting and Running a Successful Design Business (Voices That Matter)",Book,http://www.amazon.com/dp/0321844270/,1,1
How to Be a Graphic Designer without Losing Your Soul (New Expanded Edition),Book,http://www.amazon.com/dp/1568989830/,1,1
Sketching User Experiences: The Workbook,Book,http://www.amazon.com/dp/0123819598/,1,1
100 Things Every Designer Needs to Know About People (Voices That Matter),Book,http://www.amazon.com/dp/0321767535/,1,1
The Essential Persona Lifecycle: Your Guide to Building and Using Personas,Book,http://www.amazon.com/dp/0123814189/,1,1
The UX Book: Process and Guidelines for Ensuring a Quality User Experience,Book,http://www.amazon.com/dp/0123852412/,1,1
"Designing with the Mind in Mind, Second Edition: Simple Guide to Understanding User Interface Design Guidelines",Book,http://www.amazon.com/dp/0124079148/,1,1
"Stop Stealing Sheep & Find Out How Type Works, Third Edition (3rd Edition) (Graphic Design & Visual Communication Courses)",Book,http://www.amazon.com/dp/0321934288/,1,1
"CANON PIXMA iX6820 Wireless Business Printer with AirPrint and Cloud Compatible, Black",CE,http://www.amazon.com/dp/B00HM0IVDY/,1,1
"Letter 44, Vol. 1: Escape Velocity",Book,http://www.amazon.com/dp/1620101335/,1,1
Sagmeister: Made You Look,Book,http://www.amazon.com/dp/0810905973/,1,1
The Non-Designer's Design Book (3rd Edition),Book,http://www.amazon.com/dp/0321534042/,1,1
Interaction of Color: Revised and Expanded Edition,Book,http://www.amazon.com/dp/0300115954/,1,1
"Gusti Leder nature ""Ela"" Genuine Leather Notebook B5 Journal Diary Sketchbook Uni College Book Vintage P17",PC Accessory,http://www.amazon.com/dp/B008WJYGEC/,1,1
Fucked Up + Photocopied: instant art of the punk rock movement,Book,http://www.amazon.com/dp/1584230002/,1,1
"Graphic Design, Referenced: A Visual Guide to the Language, Applications, and History of Graphic Design",Book,http://www.amazon.com/dp/1592537421/,1,1
The Fundamentals of Graphic Design,Book,http://www.amazon.com/dp/2940373825/,1,1
Lion King Movie Poster 24in x36in,Home,http://www.amazon.com/dp/B004BI17Q8/,1,1
Graphic Design,Book,http://www.amazon.com/dp/1568987021/,1,1
Design for Communication: Conceptual Graphic Design Basics,Book,http://www.amazon.com/dp/0471418293/,1,1
A Smile in the Mind,Book,http://www.amazon.com/dp/0714838128/,1,1
"Design School Confidential: Extraordinary Class Projects From the International Design Schools, Colleges, and Institutes",Book,http://www.amazon.com/dp/1592535488/,1,1
"CafePress - Helvetica, In Comic Sans, - 100% Cotton T-Shirt",Apparel,http://www.amazon.com/dp/B00NJLG9E8/,1,1
History of Graphic Design Fourth (4th) Edition- By Philip B. Meggs and Alston W. Purvis,Book,http://www.amazon.com/dp/B003V0STEK/,1,1
Artograph 12-Inch by 17-Inch Light Pad Light Box,Art and Craft Supply,http://www.amazon.com/dp/B003QMAUSQ/,1,1
Studio Designs Ponderosa Glass Topped Table in Sonoma Brown 13280,Art and Craft Supply,http://www.amazon.com/dp/B004N7AXF8/,1,1
Lamy Al-Star CopperOrange Fountain Pen (Fine),Office Product,http://www.amazon.com/dp/B004THU65O/,1,1
Art Alternatives Sketches in the Making Very Big Hardcover Sketchbook-Giant Sketchbook-600 pages ( 300-sheet)-Black Cover,Art and Craft Supply,http://www.amazon.com/dp/B0025TZ30G/,1,1
