name,category,amazon_link,total_mentions,subreddit_mentions
The Complete Annotated Grateful Dead Lyrics,Book,http://www.amazon.com/dp/1501123327/,6,6
A Long Strange Trip: The Inside History of the Grateful Dead,Book,http://www.amazon.com/dp/0767911865/,4,4
"A Box of Rain: Lyrics: 1965-1993 (Poets, Penguin)",Book,http://www.amazon.com/dp/0140134514/,3,3
"Grateful Dead Gear - The Band's Instruments, Sound Systems, and Recording Sessions, From 1965 to 1995 (Softcover)",Book,http://www.amazon.com/dp/0879308931/,3,3
Owsley and Me: My LSD Family,Book,http://www.amazon.com/dp/0983358931/,6,3
Searching for the Sound: My Life with the Grateful Dead,Book,http://www.amazon.com/dp/0316154490/,2,2
So Many Roads: The Life and Times of the Grateful Dead,Book,http://www.amazon.com/dp/0306821702/,2,2
Not for Kids Only,Music,http://www.amazon.com/dp/B000003913/,3,2
"You Can't Always Get What You Want: My Life with the Rolling Stones, the Grateful Dead and Other Wonderful Reprobates",Book,http://www.amazon.com/dp/155022932X/,2,2
"Avery T-Shirt Transfers for Inkjet Printers, 8.5 x 11 Inches, Pack of 12 (03275)",Office Product,http://www.amazon.com/dp/B00007E7D0/,3,2
The Complete Annotated Grateful Dead Lyrics,Book,http://www.amazon.com/dp/074327749X/,2,2
"Truckin' Up To Buffalo, July 4 1989 (2 CD)",Music,http://www.amazon.com/dp/B0009OJAJO/,2,2
Grateful Dead Family Album,Book,http://www.amazon.com/dp/0446391670/,2,2
Clarks Women's Breeze Sea Flip-Flop,Shoes,http://www.amazon.com/dp/B008KK0ZJ8/,2,2
"Acid Dreams: The Complete Social History of LSD: The CIA, the Sixties, and Beyond",Book,http://www.amazon.com/dp/0802130623/,12,1
Grateful Dead and the Art of Rock Improvisation,Book,http://www.amazon.com/dp/0810882558/,1,1
Bear: The Life and Times of Augustus Owsley Stanley III,Book,http://www.amazon.com/dp/1250081211/,2,1
Grateful Dead Guitar Anthology,Book,http://www.amazon.com/dp/1495006972/,1,1
Art of the Dead,Book,http://www.amazon.com/dp/1593765029/,1,1
Grateful Dead FAQ: All That's Left to Know About the Greatest Jam Band in History (FAQ Series),Book,http://www.amazon.com/dp/1617130869/,1,1
Deadbase Ten: The Complete Guide to Grateful Dead Songlists,Book,http://www.amazon.com/dp/1877657204/,1,1
Drumming at the Edge of Magic: A Journey into the Spirit of Percussion,Book,http://www.amazon.com/dp/1888358181/,1,1
Grateful Dead: New Year's Eve [VHS],Video,http://www.amazon.com/dp/630419059X/,1,1
Seastones,Music,http://www.amazon.com/dp/B0000009VN/,1,1
Acadie,Music,http://www.amazon.com/dp/B000002LIE/,1,1
Guitar Artistry of,Music,http://www.amazon.com/dp/B00000390Y/,1,1
Great Explorations Star Explosion,Toy,http://www.amazon.com/dp/B00001LDDR/,2,1
"Beyerdynamic DT 770 PRO, 250 ohms",CE,http://www.amazon.com/dp/B0006NL5SM/,52,1
Garcia,Music,http://www.amazon.com/dp/B0007OQ6RK/,1,1
GRATEFUL DEAD BEAR DARK STAR,Toy,http://www.amazon.com/dp/B000QFMGBK/,1,1
Searching for the Sound: My Life with the Grateful Dead,eBooks,http://www.amazon.com/dp/B000S1LYOW/,1,1
Electro-Harmonix Q-Tron Plus XO Envelope Follower Pedal,Musical Instruments,http://www.amazon.com/dp/B000VDPFT2/,1,1
Diga Rhythm Band,Music,http://www.amazon.com/dp/B0013LKZV4/,1,1
Arriba Cases Ac71 Padded Gear Transport Bag 12X12X12 Inches 12 Inch Mirror Ball Bag,Musical Instruments,http://www.amazon.com/dp/B001RJ8G3Q/,1,1
Grateful Dead: The Official Book of the Deadheads,Book,http://www.amazon.com/dp/B0020D221K/,1,1
"Audio Technica AT-LP60 Fully Automatic Stereo Turntable System, Silver",Musical Instruments,http://www.amazon.com/dp/B002GYTPAE/,41,1
Greatful Dead Bears Traditional Flag,Lawn & Patio,http://www.amazon.com/dp/B002O0WHBY/,1,1
Growing Up Dead: The Hallucinated Confessions of a Teenage Deadhead,eBooks,http://www.amazon.com/dp/B002SZUDES/,1,1
"Crimson, White & Indigo: July 7 1989 JFK Stadium, Philadelphia (3CD/1DVD)",Music,http://www.amazon.com/dp/B0037RBVH4/,1,1
Home Before Daylight: My Life on the Road with the Grateful Dead,eBooks,http://www.amazon.com/dp/B003J5UIK0/,1,1
"Etymotic High Fidelity Earplugs, ER20 ETY-Plugs, Standard Fit Blue Tip, 1 pair",Health and Beauty,http://www.amazon.com/dp/B0044DEESS/,185,1
"iSimple IS32 TranzIt USB Universal Car FM Radio Integration for MP3 Players, Smartphones, and Tablets",Car Audio or Theater,http://www.amazon.com/dp/B004613FCE/,8,1
A Profound Mind: Cultivating Wisdom in Everyday Life,eBooks,http://www.amazon.com/dp/B004KPM1RQ/,1,1
"Man Smart, Woman Smarter (Vol. 1)",Digital Music Album,http://www.amazon.com/dp/B005JJCZAK/,1,1
"Sennheiser HD 419 Headphones, Black",Speakers,http://www.amazon.com/dp/B005N8W1MO/,7,1
Sunshine Joy Grateful Dead 3D Psychedelic Bear Tapestry Tablecloth Wall Art Beach Sheet Huge 60x90 Inches - Amazing 3D Effects,Home,http://www.amazon.com/dp/B005PZ3VYM/,5,1
Closing of Winterland,DVD,http://www.amazon.com/dp/B008PALH1I/,1,1
"Craig Frames 26012 24 by 36-Inch Picture Frame, Smooth Grain Finish, 1.26-Inch Wide, Distressed Off-White",Home,http://www.amazon.com/dp/B008S0RZCA/,1,1
Studio B 100 Dead Songs Poster,Home,http://www.amazon.com/dp/B00A45G00A/,1,1
Truckin Up to Buffalo,DVD,http://www.amazon.com/dp/B00BHWG270/,1,1
Snug Kids Earmuffs / Best Hearing Protectors – Adjustable Headband Ear Defenders For Children and Adults (Pink),Home Improvement,http://www.amazon.com/dp/B00CBDJ84S/,5,1
Grateful Dead Wood Bears Green Hoodie Sweat Shirt,Apparel,http://www.amazon.com/dp/B00CIUOR3Q/,1,1
Pocket Underwear from Stashitware. Pickpocket Proof. Made for Travel.,Apparel,http://www.amazon.com/dp/B00DCEGWZI/,8,1
Clear 12 x 12 x 6 NFL Stadium Approved Tote Bag with Black Handles,Apparel,http://www.amazon.com/dp/B00DNO19CS/,2,1
Sunscreen Bottle Stealth Flask 8 oz,Kitchen,http://www.amazon.com/dp/B00DO91LU2/,1,1
UE MINI BOOM Wireless Bluetooth Speaker - Black,Personal Computer,http://www.amazon.com/dp/B00E9YIFQ4/,5,1
"The Complete Annotated Grateful Dead Lyrics 1st (first) , 1st (first) Edition published by Free Press (2005) Hardcover",Book,http://www.amazon.com/dp/B00ES279R8/,1,1
"Clear 12 x 12 x 6 - NFL Stadium Approved Tote Bag with 35"" Black Handles",Apparel,http://www.amazon.com/dp/B00F2029KW/,1,1
Birth Of The Dead Volume Two-The Live Sides,Music,http://www.amazon.com/dp/B00HR6RFEE/,1,1
"Audio-Technica ATH-M50x Professional Monitor Headphones, Black",Musical Instruments,http://www.amazon.com/dp/B00HVLUR86/,221,1
"BESDATA Universal Car Cassette Player Adapter with 3.5mm Male Jack and 2.5mm Plug Adapter for iPod, iPad, iPhone, MP3, Mobil Device, Black",Network Media Player,http://www.amazon.com/dp/B00JAY397S/,7,1
Positively Garcia: Reflections of the JGB,eBooks,http://www.amazon.com/dp/B00M8WIASW/,1,1
Toshiba Canvio Basics 2TB Portable Hard Drive - Black (HDTB320XK3CA),Personal Computer,http://www.amazon.com/dp/B00N2S6W86/,5,1
Ohuhu Ocean Wave Night Light Projector and Music Player,Lighting,http://www.amazon.com/dp/B00P8T87FI/,12,1
The Complete Annotated Grateful Dead Lyrics,eBooks,http://www.amazon.com/dp/B00QZCTWFG/,1,1
Seagate Expansion 5TB Desktop External Hard Drive USB 3.0 (STEB5000100),Personal Computer,http://www.amazon.com/dp/B00TKFEEBW/,68,1
Rock Band Grateful Dead High Quality Fabric Bathroom Shower Curtain 66 x 72 Inches,Home,http://www.amazon.com/dp/B00V4IBIJO/,1,1
LH Labs GeekOut V2 USB Headphone Amplifier & DAC Black,Boost,http://www.amazon.com/dp/B013KX2R9A/,1,1
Geek Out: Portable USB DAC & 1000mW Headphone Amplifier,Car Audio or Theater,http://www.amazon.com/dp/B013VTS850/,1,1
"TaoTronics TT-BH06 BL Bluetooth Wireless Earphones with Bluetooth 4.1, Balanced Audio, Build-in Mic, aptX, CVC 6.0 Noise-Cancelling - Black",Wireless,http://www.amazon.com/dp/B014OVP09Q/,12,1
Basically Frightened: The Musical Madness of Colonel Bruce Hampton,Movie,http://www.amazon.com/dp/B01CNC7WJ4/,1,1
Zoom H4N PRO Digital Multitrack Recorder - 2016 Version,Musical Instruments,http://www.amazon.com/dp/B01DPOXS8I/,16,1
"Liquid Blue Men's Cosmic Stealie T-Shirt, Black, XX-Large",Apparel,http://www.amazon.com/dp/B01EGR2WEE/,1,1
Powell-Peralta Mighty Pool Skull Black x Large T-Shirt,Sports,http://www.amazon.com/dp/B01JA347HY/,1,1
"Liquid Blue Men's Grateful Dead Watch Tower Tie Dye Short Sleeve T-Shirt, Tie Dye/Multi, Small",Apparel,http://www.amazon.com/dp/B01M7NYHOH/,1,1
"Music Icons Grateful Dead ""The Story Behind Every Album""",Book,http://www.amazon.com/dp/B01MSKS9QY/,1,1
The Grateful Dead (50th Anniversary Deluxe Edition)(2CD),Authority Non Buyable,http://www.amazon.com/dp/B01MXLPL9R/,1,1
"Mpow Kids Safety Ear Muffs, NRR 25dB Professional Noise Reduction Shooter Hearing Protection, Ear Defenders for Shooting Range Hunting for Children, Infants, Small Adults, Women (Green)",Home Improvement,http://www.amazon.com/dp/B01N2RM9AB/,1,1
Cornell 5/8/77 (5LP),Music,http://www.amazon.com/dp/B06W55WYFF/,2,1
Dark Star: An Oral Biography of Jerry Garcia,Book,http://www.amazon.com/dp/0061715727/,1,1
"GarciaLive Volume Nine: August 11th, 1974 Keystone Berkeley",Digital Music Album,http://www.amazon.com/dp/B07319CFPW/,1,1
"Fundamental Accounting Principles, 20th Edition",Book,http://www.amazon.com/dp/0078110874/,1,1
JAMerica: The History of the Jam Band and Festival Scene,Book,http://www.amazon.com/dp/0306820668/,1,1
So Many Roads: The Life and Times of the Grateful Dead,Book,http://www.amazon.com/dp/0306824477/,1,1
"Orange Sunshine: The Brotherhood of Eternal Love and Its Quest to Spread Peace, Love, and Acid to the World",Book,http://www.amazon.com/dp/0312607172/,3,1
"Made With Love: Stories, Recipes and Crafts From Grateful Dead Fans",Book,http://www.amazon.com/dp/0312958005/,1,1
Skeleton Key: A Dictionary for Deadheads,Book,http://www.amazon.com/dp/0385474024/,1,1
The Grateful Dead Family Album,Book,http://www.amazon.com/dp/0446515213/,1,1
Our Dumb Century: The Onion Presents 100 Years of Headlines from America's Finest News Source,Book,http://www.amazon.com/dp/0609804618/,4,1
Grateful Dead,Book,http://www.amazon.com/dp/0688015204/,1,1
DeadBase 50: Celebrating 50 Years of the Grateful Dead,Book,http://www.amazon.com/dp/069247093X/,2,1
The Teddy Bears' Picnic,Book,http://www.amazon.com/dp/0694011827/,1,1
Deadhead Social Science: 'You Ain't Gonna Learn What You Don't Want to Know',Book,http://www.amazon.com/dp/0742502511/,2,1
Killing Yourself to Live: 85% of a True Story,Book,http://www.amazon.com/dp/0743264460/,3,1
