name,category,amazon_link,total_mentions,subreddit_mentions
Hello from Heaven: A New Field of Research-After-Death Communication Confirms That Life and Love Are Eternal,Book,http://www.amazon.com/dp/0553576348/,1,1
I Miss You: A First Look at Death,Book,http://www.amazon.com/dp/0764117645/,5,1
The Invisible String,Book,http://www.amazon.com/dp/0875167349/,18,1
What On Earth Do You Do When Someone Dies?,Book,http://www.amazon.com/dp/1575420554/,1,1
Walking in the Garden of Souls,eBooks,http://www.amazon.com/dp/B000OIZSN2/,1,1
