name,category,amazon_link,total_mentions,subreddit_mentions
"Heavy Grips Set of 3 - 100 lbs, 150 lbs, 200 lbs Resistance - Grip Strengthener - Hand Exerciser - Hand Grippers for Beginners to Professionals",Sports,http://www.amazon.com/dp/B0017OSE1A/,4,3
Robert Baraban Black Adjustable Hand Gripper 50/500lbs Resistance,Sports,http://www.amazon.com/dp/B008FR2W7Y/,3,3
Robert Baraban Chrome Adjustable Hand Gripper 50/500lbs Resistance,Sports,http://www.amazon.com/dp/B008FPZWL4/,2,2
"Fat Gripz - The Ultimate Arm Builder, Blue",Sports,http://www.amazon.com/dp/B005FIS14Y/,8,2
GD GRIP Pro-70 Adjustable Hand Grip Strengthener (55 to 154 lb),Sports,http://www.amazon.com/dp/B009B59OPW/,3,2
"Fabrication 12-0600 Fabrication Jamar Hydraulic Hand Dynamometer, 200 Pound",Health and Beauty,http://www.amazon.com/dp/B00081G60Y/,1,1
Expand-Your-Hand Bands 10 Pack: Kiss Elbow Pains Goodbye,Sports,http://www.amazon.com/dp/B00083B79M/,6,1
"Competition Shot Put, 12 lbs",Sports,http://www.amazon.com/dp/B000A2ZTXG/,1,1
Jackson 8-Pound Sledge Hammer - 1197900,Lawn & Patio,http://www.amazon.com/dp/B000ELWH56/,1,1
"O'Keeffe's Working Hands Hand Cream, 3.4 oz., Jar",Home Improvement,http://www.amazon.com/dp/B00121UVU0/,40,1
WeighMax W-4830 Industrial Postal Scale 330lb,BISS,http://www.amazon.com/dp/B001AKV422/,2,1
Exoform Carpal Tunnel Wrist Brace - Right - Medium by Ossur,Health and Beauty,http://www.amazon.com/dp/B001NDQ2M8/,1,1
"Iron Arms - Get Strong, Powerful Forearms...Fast!",Sports,http://www.amazon.com/dp/B002XG5CD4/,1,1
Ivanko Super Gripper,Sports,http://www.amazon.com/dp/B0037AWU6M/,2,1
"Power Systems Power Web Combo (Medium/Super Heavy, Red/Blue)",Sports,http://www.amazon.com/dp/B003GX3PC8/,1,1
"Sidewinder Pro – Wrist, Forearm, Grip Strengthener #2, Adjustable Resistance",Sports,http://www.amazon.com/dp/B0046EUU56/,1,1
NSD Power Essential Spinner Gyroscopic Wrist and Forearm Exerciser,Sports,http://www.amazon.com/dp/B007GGCLPS/,1,1
NSD Power AutoStart Spinner Gyroscopic Wrist and Forearm Exerciser with Auto Start Feature and Digital LCD Counter,Sports,http://www.amazon.com/dp/B007MEWW6M/,2,1
Digital Hanging Scale 300 Kg / 600 LBS Ocs-l Industrial Crane Scale,BISS,http://www.amazon.com/dp/B007PLTXBE/,1,1
Gillingham High Performance Heavy Duty Hand Gripper (Level 2 (125lbs)),Sports,http://www.amazon.com/dp/B007PUL5AC/,1,1
"NSD Roll 'N Spin Rainbow Lit AutoStart Spinner Gyroscopic Wrist and Forearm Exerciser with AutoStart and Multi-Lit LED, Purple",Sports,http://www.amazon.com/dp/B007XVCRW8/,1,1
Digi-Flex 5-Piece Hand and Finger Exercise System Set,Health and Beauty,http://www.amazon.com/dp/B008N3L4VK/,1,1
Manus Grip (Bat Black),Sports,http://www.amazon.com/dp/B00CDIMUIM/,1,1
"The Hillman Group 591512 Small Box Nail Kit, 85-Pack",Home Improvement,http://www.amazon.com/dp/B00CR8ZQI4/,1,1
"Manus Hand Strengtheners (Sliver or Orange. Random Color)rehabilitation Equipment Finger Rehabilitation Hand Rehabilitation Hand Yoga Finger Extension Exerciser,#hand Exercisers",Health and Beauty,http://www.amazon.com/dp/B00G0Y7724/,1,1
Mueller Athletic Tape White - 1 1/2 x 15 yards (mTape) (6),Health and Beauty,http://www.amazon.com/dp/B00I15JOX0/,3,1
"GD Iron Grip Adjustable Hand Gripper, EXT 90",Sports,http://www.amazon.com/dp/B00IRWR81C/,1,1
Nose Tork Smelling Salts - Powerlifting (1 bottle),Sports,http://www.amazon.com/dp/B00J9PVPW4/,2,1
"Rock Climbing 3"" Wood Training Power Balls, 2 Count",Sports,http://www.amazon.com/dp/B00JJU4ME2/,2,1
"GD GRIP Adjustable Hand Gripper, Hand Strengthener (55 to 154 lb : Ultra 70)",Sports,http://www.amazon.com/dp/B00N9ULAES/,1,1
"The Vatiz Adjustable Hand Gripper, Double-Spring Version",Sports,http://www.amazon.com/dp/B00OE12CZ2/,1,1
MummyFit Grip Strengthener and Adjustable Hand Exerciser. Best Forearm and Finger Exercisers and Grippers. 55-154 lbs Gripper for Forearms. Bonus Workout Included.,Sports,http://www.amazon.com/dp/B00VIGEQXC/,1,1
"Sidewinder Grip Twister — Wrist, Finger, Fat Grip Exerciser, Adjustable Resistance …",Sports,http://www.amazon.com/dp/B00VROBFCU/,1,1
Alpha Grips 2.0 - Extreme Arm Blaster - Best Dumbbell and Barbell Thick Bar Adapter,Sports,http://www.amazon.com/dp/B0116O40KO/,1,1
Heavy Duty PRO Metal Lifting Steel Hooks Double Stitching Non-Slip Resistant Coating Neoprene Padded Best Power WeightLifting Training Set of 2 600LB Pull Rating,Sports,http://www.amazon.com/dp/B0145V6ISM/,3,1
"TheraBand FlexBar Resistance Bar For Medial Epicondylitis, Prevent Tendonitis and Improve Grip Strength, Relieve Pain From Tennis Elbow, Golfers Elbow, and Tendinitis, Assorted Resistances",Sports,http://www.amazon.com/dp/B014VXSED6/,10,1
"Vatiz Hand Gripper, Adjustable Resistance, Double Spring Version; includes Gripper Setting Card",Sports,http://www.amazon.com/dp/B01C3YH5E4/,1,1
Woodpeckers® 3 inch Natural Hardwood Balls - Unfinished Wooden Balls for Crafts and Architectural Work & Design (2),Art and Craft Supply,http://www.amazon.com/dp/B01DFP36WK/,2,1
"Hand Grip Strengthener, Increase Hand Wrist Finger Forearm Strength With The Hand Exerciser, Easy Adjustable Resistance 22 to 88 Lbs, Perfect for Musicians Athletes and Hand Rehabilitation Exercising",Sports,http://www.amazon.com/dp/B01F4SMJME/,1,1
Kootek 2 Pack Hand Grip Strengthener Strength Trainer Adjustable Resistance 22-88 Lbs Arm Hand Exerciser Non-slip Gripper for Athletes Pianists Kids,Sports,http://www.amazon.com/dp/B01FFS1W3U/,2,1
"RMP Cold Rolled 1018 Carbon Steel Flat Bar, 3/16"" x 3/4"" in a 48"" Length",BISS,http://www.amazon.com/dp/B01JKBLHW4/,1,1
Conditioning for Climbers: The Complete Exercise Guide (How To Climb Series),Book,http://www.amazon.com/dp/0762742283/,1,1
NEXSTRONG 3.5-Inch Foam Massage Ball Therapy Roller – Therapy Yoga Roller Balls for Deep Tissue Myofascial Release – Trigger Point Massager – Muscle Pain Relief – EVA Foam Roller,Health and Beauty,http://www.amazon.com/dp/B072QCGY3T/,1,1
Training for Climbing: The Definitive Guide To Improving Your Performance (How To Climb Series),Book,http://www.amazon.com/dp/0762746920/,4,1
"Mastery of Hand Strength, Revised Edition",Book,http://www.amazon.com/dp/0926888811/,2,1
Universal 00184 84-Size Rubber Bands (155 Bands/1lb Pack),Speakers,http://www.amazon.com/dp/B0007893WG/,1,1
Captains of Crush Hand Gripper - Guide,Sports,http://www.amazon.com/dp/B00079YNQQ/,1,1
