name,category,amazon_link,total_mentions,subreddit_mentions
JOYO D-SEED Dual Channel Digital Delay Guitar Effect Pedal with Four Modes,Musical Instruments,https://www.amazon.com/dp/B00HB2ZEUG/ref=wl_it_dp_o_pd_S_ttl?_encoding=UTF8&amp;colid=2SKKO459P8VPC&amp;coliid=I1W4JNMAK1RUJW,4,1
Brother Genuine TN660 High Yield Mono Laser Black Toner Cartridge,Office Products,https://www.amazon.com/Brother-Genuine-TN660-Yield-Cartridge/dp/B00LJO8EQS/ref=redir_mobile_desktop?_encoding=UTF8&amp%3Bpf_rd_i=172641&amp%3Bpf_rd_p=87f3d9f3-69d0-524c-ace4-be3563091f63&amp%3Bpf_rd_r=J9EGP0GPS3YDQ0WEN9XD&amp%3Bpf_rd_s=mobile-hybrid-11&amp%3Bpf_rd_t=30901&ref_=s9_top_hm_awbw_biuX_g229_i1,3,1
Make: Electronics: Learning Through Discovery,Books,https://www.amazon.com/Make-Electronics-Learning-Through-Discovery/dp/1680450263/ref=dp_ob_title_bk,2,1
"Behringer MicroMIX MX400 Low-Noise 4-channel Line Mixer, Black",Musical Instruments,https://www.amazon.com/gp/product/B000KGYAYQ,2,1
CRC 5103 Quick Dry Electronic Cleaner - 11 Wt Oz.,Automotive Parts & Accessories,https://www.amazon.com/dp/B000BXOGNI,2,1
"Clear Vinyl Decal Paper, Inkjet, 5pp","Arts, Crafts & Sewing",https://www.amazon.com/gp/product/B004JZYXXW/ref=oh_aui_detailpage_o00_s00?ie=UTF8&amp;psc=1,1,1
"RAVPower 15000mAh Portable Power Bank Pack External Battery Charger for iPads, Samsung Tablets, iPhones, Android Smart Phones Galaxy S4, S3, (Dual USB Output: 5V, 2A; DC Output: 9V / 12V, 2A)",Electronics,https://www.amazon.com/gp/product/B00DVB7F0S/ref=od_aui_detailpages00?ie=UTF8&amp;psc=1,1,1
Looper easy simple straight Loop recording pedal Maximum recording limit 15 minutes No overdub limit pedal by MUKU,Musical Instruments,https://www.amazon.com/straight-recording-Maximum-minutes-MUKU/dp/B071H6WMMZ/ref=sr_1_10?ie=UTF8&amp;qid=1499351667&amp;sr=8-10&amp;keywords=Loop+Pedal,1,1
MOD 4AB3C1B Reverb Tank,Musical Instruments,https://www.amazon.com/gp/product/B003AZ3E5U,1,1
ammoon I1995332 Nano Loop Electric Guitar Effect Pedal Looper True Bypass Unlimited Overdubs 10 Minutes Recording with USB Cable,Musical Instruments,https://www.amazon.com/ammoon-Electric-Unlimited-Overdubs-Recording/dp/B01GG0YR60/ref=sr_1_3?ie=UTF8&amp;qid=1499351667&amp;sr=8-3&amp;keywords=Loop+Pedal,1,1
Tom'sline Engineering Looper easy simple straight Loop recording pedal EXCITANT ALP3 Max 15 minutes recording time No overdub limit,Musical Instruments,https://www.amazon.com/Tomsline-Engineering-straight-recording-EXCITANT/dp/B01M4QA5QB/ref=sr_1_13?ie=UTF8&amp;qid=1499351667&amp;sr=8-13&amp;keywords=Loop+Pedal,1,1
"Getaria GE-MT-LN-332S Loop Station Looper Effects Pedal Unlimited Overdubs 10 Minutes of Looping, 1/2 time, and Reverse",Musical Instruments,https://www.amazon.com/Getaria-GE-MT-LN-332S-Station-Unlimited-Overdubs/dp/B06XJV5NCT/ref=sr_1_2?ie=UTF8&amp;qid=1499351667&amp;sr=8-2-spons&amp;keywords=Loop+Pedal&amp;psc=1,1,1
Donner Tiny Looper Guitar Effect Pedal 10 minutes of Looping 3 Modes,Musical Instruments,https://www.amazon.com/Donner-Looper-Guitar-minutes-Looping/dp/B06XK7WQK3/ref=sr_1_6?ie=UTF8&amp;qid=1499351667&amp;sr=8-6&amp;keywords=Loop+Pedal,1,1
Tripp Lite LCR2400 Line Conditioner 2400W AVR Surge 120V 20A 60Hz 14 Outlet 12-Feet Cd,Electronics,https://www.amazon.com/gp/product/B0000514M8/ref=oh_aui_search_detailpage?ie=UTF8&amp;psc=1,1,1
Visual Sound 3.5 Milimeter 1 SPOT Converter,Musical Instruments,https://www.amazon.com/Visual-Sound-Milimeter-SPOT-Converter/dp/B0002GZMYG/ref=pd_lpo_vtph_267_lp_t_3?_encoding=UTF8&amp;psc=1&amp;refRID=T2F912YM55BD0JNGRGAA,1,1
Truetone CBAT Converter for One Spot Power Supply,Musical Instruments,https://www.amazon.com/Truetone-CBAT-Converter-Power-Supply/dp/B000EELID0/ref=sr_1_2?s=musical-instruments&amp;ie=UTF8&amp;qid=1502206529&amp;sr=1-2&amp;keywords=9v+battery+adapter,1,1
Digitech CARCOSA Guitar Distortion Effects Pedal,Musical Instruments,https://www.amazon.com/Digitech-CARCOSA-Guitar-Distortion-Effects/dp/B01NAM2GHP/ref=sr_1_1?ie=UTF8&amp;qid=1493078080&amp;sr=8-1&amp;keywords=dod+carcosa,1,1
Xotic RC Booster-V2 Pedal,Musical Instruments,https://www.amazon.com/Xotic-RC-Booster-V2-Pedal/dp/B01IVU9HIG,1,1
Squier by Fender Classic Vibe 50's Stratocaster Electric Guitar - 2-Color Sunburst - Maple Fingerboard,Musical Instruments,https://www.amazon.com/Squier-Fender-Classic-Stratocaster-Electric/dp/B001L8IILI,1,1
Voodoo Lab Pedal Power MONDO Isolated Power Supply,Musical Instruments,https://www.amazon.com/Voodoo-Lab-PPM-MONDO/dp/B00ACZO9VE/,1,1
Pro Co RAT2 Distortion Pedal,Musical Instruments,https://www.amazon.com/Pro-Co-RAT2-Distortion-Pedal/dp/B0002MSQVQ,1,1
Fender Bassbreaker 15 Combo,Musical Instruments,https://www.amazon.com/Fender-2262000000-Bassbreaker-15-Combo/dp/B013G7BLOC,1,1
"Hosa IRG-600.5 Low-Profile Right-Angle Guitar Patch Cable, 6 inch (6-Pack)",Musical Instruments,https://www.amazon.com/Hosa-IRG-600-5-Low-Profile-Right-Angle-Guitar/dp/B0002IAJ56,1,1
Boss DD-500 Digital Delay,Musical Instruments,https://www.amazon.com/BOSS-Audio-DD-500-Digital-Delay/dp/B011B41TAS,1,1
SUPERNIGHT 20keys Infrared Music Controller IR Dimmer Sound Sense Remote Controller for RGB Flexible LED Strip,Tools & Home Improvement,https://www.amazon.com/gp/product/B00JQ4O94Y?psc=1&amp;redirect=true&amp;ref_=oh_aui_detailpage_o01_s00,1,1
"1"" Adhesive Backed Mounting Bases - 50 Pieces - Color: Black",Office Products,https://www.amazon.com/Adhesive-Backed-Mounting-Bases-Pieces/dp/B0071N1YGS?ie=UTF8&amp;psc=1&amp;redirect=true&amp;ref_=oh_aui_detailpage_o01_s00,1,1
Zitrades 10PCS LED 5050 RGB Strip Light Connector 4 Conductor 10 mm Wide Strip to Strip Jumper,Tools & Home Improvement,https://www.amazon.com/gp/product/B00977FHG4?psc=1&amp;redirect=true&amp;ref_=oh_aui_detailpage_o00_s00,1,1
"BBE Two Timer Dual-Mode Analog Delay, 0-330 ms",Musical Instruments,https://www.amazon.com/gp/product/B00B9LDN76/ref=pd_lpo_sbs_dp_ss_1?pf_rd_p=1944687662&amp;pf_rd_s=lpo-top-stripe-1&amp;pf_rd_t=201&amp;pf_rd_i=B0019NKIXQ&amp;pf_rd_m=ATVPDKIKX0DER&amp;pf_rd_r=1QCRAR28VXWECRT7FHRD,1,1
1 To 3 Daisy Chain Cable Guitar Effects Pedal Power Supply Splitter Cable,Musical Instruments,https://www.amazon.com/Daisy-Guitar-Effects-Supply-Splitter/dp/B00C7NTR8E,1,1
Caline USA orange burst overdrive effects pedal,All Departments,https://www.amazon.com/Caline-USA-orange-overdrive-effects/dp/B01ELP3DT4,1,1
"USB Guitar Cable VAlinks USB Interface Male to 6.35mm 1/4"" Mono Male Electric Guitar Cable Studio Audio Cable Connector Cords Adapter for Instruments Recording Singing iPhone GarageBand Game-3m/10ft",Electronics,https://www.amazon.com/Interface-Connector-Instruments-Recording-GarageBand/dp/B01EV0V58A,1,1
"Livewire 1/4"" Angle-1/4"" Angle Patch Cable 3 in.",Electronics,https://www.amazon.com/Live-Wire-Angle-1-Angle-Inches/dp/B001G7C4LE,1,1
"Hammond 1590BBK Black Diecast Aluminum Enclosure -- Inches (4.39"" x 2.34"" x 1.06"") mm (112mm x 60mm x 27mm)",Industrial & Scientific,https://www.amazon.com/Hammond-1590BBK-Diecast-Aluminum-Enclosure/dp/B004TGYW46/ref=sr_1_2,1,1
"Trader Joe's Organic Peppermints, 1.41 oz Tin (Pack of 2)",Grocery & Gourmet Food,https://www.amazon.com/Trader-Joes-Organic-Peppermints-1-41/dp/B00BWGRZHM,1,1
Guitar Amplifier Handbook,Books,https://www.amazon.com/Guitar-Amplifier-Handbook-Understanding-Amplifiers/dp/087930863X,1,1
GOGO Tuners The GOGO Pedal Tuner,Musical Instruments,https://www.amazon.com/GOGO-Tuners-Pedal-Tuner/dp/B008OFGZXE,1,1
Planet Waves 9V Power Adapter,Musical Instruments,https://www.amazon.com/Planet-Waves-9V-Power-Adapter/dp/B00191WVF6,1,1
Seven Star SF500 500W 110v/220v 220v/110v Step Up/Down Automatic Transformer Adapter,Electronics,https://www.amazon.com/Seven-Star-SF500-Automatic-Transformer/dp/B001TPZ294,1,1
BoxWave European to American Outlet Plug Adapter,Electronics,https://www.amazon.com/BoxWave-European-American-Outlet-Adapter/dp/B0019DERAG/ref=pd_lpo_23_bs_t_2?ie=UTF8&amp;psc=1&amp;refRID=YSYX6NW1CZ7NJ7FFE59K,1,1
Donner Guitar Pedal Board Case DB-2 Aluminium Pedalboard with Bag,Musical Instruments,https://www.amazon.com/Donner-Guitar-Pedal-Aluminium-Pedalboard/dp/B01DZPVKFU/ref=sr_1_1?ie=UTF8&amp;qid=1482760062&amp;sr=8-1&amp;keywords=donner+pedalboard,1,1
"GLS Audio 1/4"" Right Angle Plugs TS Mono Flat Low Profile Pancake Style for Speaker Cables, Patch Cables, Snakes - Male 1/4 Inch Phono 6.3mm Phone Plug Bulk - 20 PACK",Electronics,https://www.amazon.com/dp/B003UIC78W/ref=cm_sw_r_awd_qiSEvbZN28BX4,1,1
"Misayar 3 Outlet Long Cord 2/ 3 Prong Surge Protector Power Strip with USB, 6.5 foot Extension Cord Transition Strip with Switch",Electronics,https://www.amazon.com/dp/B01NGYKO4R/ref=cm_sw_r_cp_apa_oW-tzbK6ES2S2,1,1
