name,category,amazon_link,total_mentions,subreddit_mentions
"Mobile Suit Gundam: Awakening, Escalation, Confrontation",Book,http://www.amazon.com/dp/1611720052/,2,2
"Bandai Hobby #18 GN-X HG, Bandai Double Zero Action Figure",Toys & Games,https://www.amazon.com/Bandai-Hobby-Double-Action-Figure/dp/B001AHX5PY/ref=sr_1_1?s=toys-and-games&amp;ie=UTF8&amp;qid=1506513524&amp;sr=1-1&amp;keywords=gn-x+hg,,1
"Bandai Hobby #162 HGAC XXXG-01W Wing Gundam Model Kit, 1/144 Scale",Toy,http://www.amazon.com/dp/B00E36ROZ6/,2,1
Gundam Versus - PlayStation 4,Video Games,http://www.amazon.com/dp/B072L3C3Q1/,1,1
"Bandai Hobby Gunpla Starter Set: Gundam Vs. Zaku II, Bandai HGUC Action Figure",Toy,http://www.amazon.com/dp/B003KX5OWS/,1,1
Xuron 2175 Maxi-Shear Flush Cutter,BISS,http://www.amazon.com/dp/B000IBU0YC/,1,1
Gundam Turn A: DVD Collection Part 1,DVD,http://www.amazon.com/dp/B00V7ORUUG/,1,1
Bandai Hobby Gundam EXIA Bandai Master Grade Action Figure,Toy,http://www.amazon.com/dp/B002BRUGI6/,1,1
Turn A Gundam: Part 2 DVD Collection,DVD,http://www.amazon.com/dp/B00XRFTE16/,1,1
Bandai Hobby #28 RX-78 Gundam GP03 Dendrobium Orchis 1/144 High Grade Universal Century Model Kit,Toy,http://www.amazon.com/dp/B00030EU9Y/,1,1
"Bandai Hobby RX-78 GP03S GUNDAM, Bandai Master Grade Action Figure",Toy,http://www.amazon.com/dp/B00030EU4O/,1,1
Bandai Hobby HGAC Wing Gundam Zero Model Kit (1/144 Scale),Toy,http://www.amazon.com/dp/B00HD4IWJW/,1,1
Animation Soundtrack - Mobile Suit Gundam Thunderbolt Original Soundtrack Feat. Naruyoshi Kikuchi [Japan LTD Blu-spec CD II] VRCL-30088,Music,http://www.amazon.com/dp/B01EK7BHXW/,1,1
Bandai Hobby Wing Gundam Zero Version EW 1/100 - Master Grade,Toy,http://www.amazon.com/dp/B0004EAFWK/,1,1
Bandai Hobby WING Gundam Bandai Master Grade Action Figure,Toy,http://www.amazon.com/dp/B003AH6EPA/,1,1
Tamiya Basic Tool Set by Horizon Hobby,Toy,http://www.amazon.com/dp/B000BMYWXI/,1,1
Bandai Hobby Wing Gundam Ver. EW Bandai MG Action Figure,Toy,http://www.amazon.com/dp/B004KJ41F2/,1,1
"Bandai Hobby MG Wing Gundam Proto Zero Version EW Model Kit, 1/100 Scale",Toy,http://www.amazon.com/dp/B00EOEB908/,1,1
The High Frontier: Human Colonies in Space: Apogee Books Space Series 12,Book,http://www.amazon.com/dp/189652267X/,1,1
Mobile Suit Gundam Unicorn Vol. 2 [Blu-ray],DVD,http://www.amazon.com/dp/B004AJYHPG/,1,1
Bandai 00 Gundam Seven Sword/G 1/100 Master Grade,Toy,http://www.amazon.com/dp/B0058KSCUC/,1,1
Robot Damashii Unicorn Gundam Destroy Mode Full Action Version,Toy,http://www.amazon.com/dp/B0058LT818/,1,1
Gundam 0079 Green Haro 1/1 Scale by Bandai,Toy,http://www.amazon.com/dp/B00Y1C6I3Q/,1,1
