name,category,amazon_link,total_mentions,subreddit_mentions
"Don't Shoot: One Man, A Street Fellowship, and the End of Violence in Inner-City America",Book,http://www.amazon.com/dp/1608194140/,10,2
"More Guns, Less Crime: Understanding Crime and Gun Control Laws, Third Edition (Studies in Law and Economics)",Book,http://www.amazon.com/dp/0226493660/,22,1
Special Forces Foreign Weapons Handbook,Book,http://www.amazon.com/dp/0873640098/,1,1
Special Forces Combat Firing Techniques,Book,http://www.amazon.com/dp/0873640101/,1,1
The fighting rifle:  the complete study of the rifle in combat,Book,http://www.amazon.com/dp/0879473088/,1,1
The Beast Side: Living (and Dying) While Black in America,Book,http://www.amazon.com/dp/1510703357/,1,1
Every Handgun Is Aimed at You: The Case for Banning Handguns,Book,http://www.amazon.com/dp/1565847059/,1,1
Seeing Like a State: How Certain Schemes to Improve the Human Condition Have Failed (The Institution for Social and Policy St),eBooks,http://www.amazon.com/dp/B00D8JJYWA/,3,1
WEN 4208 8 in. 5-Speed Drill Press,Home Improvement,http://www.amazon.com/dp/B00HQONFVE/,5,1
"Guns, Crime, and Freedom",Book,http://www.amazon.com/dp/0060976748/,1,1
Targeted:Exposing the Gun Control Agenda,DVD,http://www.amazon.com/dp/B01KW0VS1M/,1,1
