name,category,amazon_link,total_mentions,subreddit_mentions
Shotgun News Gunsmithing Projects Book,Book,http://www.amazon.com/dp/1934622540/,2,1
Irwin Tools 1221 Irwin High Carbon Steel Machine Screw Bottoming Taps - Tap 6-48NS Bottoming Hanson,Home Improvement,http://www.amazon.com/dp/B000PSDKN6/,1,1
Glock Bench Mat,Sports,http://www.amazon.com/dp/B000U3YWEM/,4,1
Wheeler Firearms Accurizing Torque Wrench,Sports,http://www.amazon.com/dp/B0012AXR4S/,26,1
Pachmayr Master Gunsmith Firearm Screw Kit (277 Piece),Sports,http://www.amazon.com/dp/B00162OKWU/,1,1
Lyman Brass Tapper Hammer,Sports,http://www.amazon.com/dp/B00162SAQ2/,1,1
"SAS Safety 66517 Raven Powder-Free Disposable Black Nitrile 6 Mil Gloves, Medium, 100 Gloves by Weight",Home Improvement,http://www.amazon.com/dp/B002XXO5US/,1,1
Creative Woodburning Special Technique Point-Universal Point,Art and Craft Supply,http://www.amazon.com/dp/B004BPVXII/,1,1
AmazonBasics Microfiber Cleaning Cloth - 24-Pack,Automotive Parts and Accessories,http://www.amazon.com/dp/B009FUF6DM/,25,1
AK Broken Shell Extractor 7.62x39,Sports,http://www.amazon.com/dp/B00FPZTKBA/,1,1
Ruger 10/22 Picatinny Rail Mount for Scopes and Optics,Sports,http://www.amazon.com/dp/B00ME813MA/,2,1
"Handgun sight pusher tool Universal front/rear ""Standard Blocks Only""",Sports,http://www.amazon.com/dp/B0125M9LRS/,2,1
