name,category,amazon_link,total_mentions,subreddit_mentions
Getting Things Done: The Art of Stress-Free Productivity,Book,http://www.amazon.com/dp/0143126563/,24,1
IB Economics Course Book: 2nd Edition: Oxford IB Diploma Program (International Baccalaureate),Book,http://www.amazon.com/dp/0198390009/,1,1
IB Chemistry Study Guide: 2014 Edition: Oxford IB Diploma Program,Book,http://www.amazon.com/dp/0198393539/,1,1
IB Physics Study Guide: 2014 edition: Oxford IB Diploma Program,Book,http://www.amazon.com/dp/0198393555/,1,1
"Sears and Zemansky's University Physics with Modern Physics, 13th Edition",Book,http://www.amazon.com/dp/0321696867/,2,1
"The Feynman Lectures on Physics, boxed set: The New Millennium Edition",Book,http://www.amazon.com/dp/0465023827/,12,1
"Physics, Volume 1",Book,http://www.amazon.com/dp/0471320579/,3,1
Theory of Knowledge for the IB Diploma,Book,http://www.amazon.com/dp/110761211X/,1,1
"Barron's SAT Subject Test: Math Level 2, 12th Edition",Book,http://www.amazon.com/dp/1438007914/,1,1
HIGHER LEVEL CHEMISTRY 2ND EDITION BOOK + EBOOK (Pearson International Baccalaureate Diploma: International E),Book,http://www.amazon.com/dp/1447959752/,1,1
Texas Instruments TI-Nspire CX Graphing Calculator,Office Product,http://www.amazon.com/dp/B004NBZAW0/,8,1
"CLOROX COMPANY, THE 30781 55oz HE Bleach",Home,http://www.amazon.com/dp/B00NWRXZKK/,1,1
Pack Of 300 Range Wholesale Plastic Treasury Tag 25mm - Paper Hole Punch Filing Clips,Art and Craft Supply,http://www.amazon.com/dp/B01AD5LS98/,1,1
