name,category,amazon_link,total_mentions,subreddit_mentions
The Science of Interstellar,Book,http://www.amazon.com/dp/0393351378/,35,5
Interstellar: The Official Movie Novelization,Book,http://www.amazon.com/dp/1783293691/,7,2
Interstellar (Original Motion Picture Soundtrack) [Deluxe Version],Digital Music Album,http://www.amazon.com/dp/B00Q80471Y/,2,2
Interstellar Movie Space Exploration Unknown Universe Endurance Crew Uniform Patch,Single Detail Page Misc,http://www.amazon.com/dp/B00RGRFK8W/,3,2
"Audio Technica AT-LP60 Fully Automatic Stereo Turntable System, Silver",Musical Instruments,http://www.amazon.com/dp/B002GYTPAE/,41,1
"Craig Frames fw2bk1216A 0.765-Inch Wide Picture/Poster Frame in Smooth Finish, 12 by 16-Inch, Matte Black",Home,http://www.amazon.com/dp/B0046DB20E/,1,1
"Members Only Men's Iconic Racer Jacket, Charcoal, XX-Large",Apparel,http://www.amazon.com/dp/B00513T70U/,1,1
Ken Burns: The Dust Bowl,DVD,http://www.amazon.com/dp/B007VYEF04/,2,1
Ken Burns: The Dust Bowl Season 1,TV Series Season Video on Demand,http://www.amazon.com/dp/B00A1ZWUDY/,1,1
Orient Men's FER2A003B0 Flight Stainless Steel Watch with Black Leather Band,Watch,http://www.amazon.com/dp/B00I364JC8/,2,1
The Grand Budapest Hotel [Blu-ray],DVD,http://www.amazon.com/dp/B00JAQJNN0/,1,1
X-men: Days Of Future Past [Blu-ray],DVD,http://www.amazon.com/dp/B00K7IPGS6/,1,1
Alpha Industries Men's NASA Apollo MA-1 Bomber Jacket,Apparel,http://www.amazon.com/dp/B00MRW8RWW/,1,1
Interstellar (Blu-ray + DVD Combo Pack),DVD,http://www.amazon.com/dp/B00SI7GCJK/,2,1
Interstellar: Original Motion Picture Soundtrack [2 LP],Music,http://www.amazon.com/dp/B00UM7SFZS/,2,1
Moebius Interstellar Ranger 1:72 Scale Model Kit,Toy,http://www.amazon.com/dp/B00V33B6TW/,2,1
Seveneves: A Novel,Book,http://www.amazon.com/dp/0062190377/,15,1
Camo Green OD Endurance Space Exploration Interstellar Jacket Backpack Limited Release Patch,Single Detail Page Misc,http://www.amazon.com/dp/B00XFUWC3U/,1,1
The Science of Interstellar,Book,http://www.amazon.com/dp/1494559390/,11,1
NOVA - The Elegant Universe,DVD,http://www.amazon.com/dp/B0000ZG0TA/,1,1
Sony MDR7506 Professional Large Diaphragm Headphone,Musical Instruments,http://www.amazon.com/dp/B000AJIF4E/,128,1
