name,category,amazon_link,total_mentions,subreddit_mentions
The Eagle and the Lion: The Tragedy of American-Iranian Relations,Book,http://www.amazon.com/dp/0300044127/,1,1
"Modern Iran: Roots and Results of Revolution, Updated Edition",Book,http://www.amazon.com/dp/0300121059/,6,1
The Demon-Haunted World: Science as a Candle in the Dark,Book,http://www.amazon.com/dp/0345409469/,79,1
All the Shah's Men: An American Coup and the Roots of Middle East Terror,Book,http://www.amazon.com/dp/0470580410/,4,1
All Fall Down: America's Tragic Encounter With Iran,Book,http://www.amazon.com/dp/0595202535/,1,1
Climatology versus Pseudoscience: Exposing the Failed Predictions of Global Warming Skeptics,Book,http://www.amazon.com/dp/1440832013/,2,1
Journalists for Hire: How the CIA Buys the News,Book,http://www.amazon.com/dp/1944505474/,3,1
"Paper Mate InkJoy 500 Retractable Ballpoint Pen, Medium Point, Black, 12-Count",Office Product,http://www.amazon.com/dp/B005SN74M6/,1,1
"Pentel EnerGel Pearl Deluxe RTX Retractable Liquid Gel Pen, 0.7mm, Black Accent, Black Ink, 3 Pack (BL77WBP3A)",Office Product,http://www.amazon.com/dp/B00CMO1HR2/,1,1
No Agenda - Saving America: Shut Up Slaves,eBooks,http://www.amazon.com/dp/B00JZZHWG6/,1,1
The Man In the High Castle - Season 1,TV Series Season Video on Demand,http://www.amazon.com/dp/B00RSGIVVO/,13,1
