name,category,amazon_link,total_mentions,subreddit_mentions
Quiet: The Power of Introverts in a World That Can't Stop Talking,Book,http://www.amazon.com/dp/0307352153/,17,3
How to Win Friends & Influence People,Book,http://www.amazon.com/dp/0671027034/,63,2
The Introvert Advantage: How Quiet People Can Thrive in an Extrovert World,Book,http://www.amazon.com/dp/0761123695/,4,2
Siddhartha,Book,http://www.amazon.com/dp/0553208845/,3,1
"Nonviolent Communication: A Language of Life, 3rd Edition: Life-Changing Tools for Healthy Relationships (Nonviolent Communication Guides)",Book,http://www.amazon.com/dp/189200528X/,3,1
Exit Strategies: The Perfect Excuse for Any Social Situation,Book,http://www.amazon.com/dp/1435157958/,1,1
Quiet: The Power of Introverts in a World That Can't Stop Talking,Book,http://www.amazon.com/dp/0307352145/,1,1
"Innova - Champion Discs DX Roc Golf Disc, 170-174gm (Colors may vary)",Sports,http://www.amazon.com/dp/B00CGSF9J6/,1,1
Taking the War Out of Our Words,Book,http://www.amazon.com/dp/0982051824/,1,1
