name,category,amazon_link,total_mentions,subreddit_mentions
Stanley Adventure Camp Cook Set 24oz Stainless Steel,Sports,http://www.amazon.com/dp/B005188T90/,15,1
Yaktrax Walker Traction Cleats for Snow and Ice,Sports,http://www.amazon.com/dp/B009LJBEEM/,3,1
Nokia Lumia 520 (AT&T Go Phone) No Annual Contract (Discontinued by Manufacturer),Wireless,http://www.amazon.com/dp/B00E45043A/,10,1
ARRIS SurfBoard SB6141 DOCSIS 3.0 Cable Modem (Certified Refurbished),Personal Computer,http://www.amazon.com/dp/B00OMDZAV0/,10,1
Tile (Gen 2) - Phone Finder. Key Finder. Item Finder  - 1 Pack (Discontinued by Manufacturer),Wireless,http://www.amazon.com/dp/B011HT9AL2/,11,1
YaeTek Compression Tool RCA RG6 RG59 Connector Fitting Cable Coax Coaxial Crimper,Home Improvement,http://www.amazon.com/dp/B01CS7U7K0/,1,1
