name,category,amazon_link,total_mentions,subreddit_mentions
"Hurtta Pet Collection 13-Inch Winter Jacket, Red",Pet Products,http://www.amazon.com/dp/B003TWB8LQ/,2,2
"Musher's Secret Pet Paw Protection Wax, 200-Gram",Pet Products,http://www.amazon.com/dp/B0002XIZXY/,33,1
"Excel Medicated Dental Wipes, 90 wipes (J7412)",Pet Products,http://www.amazon.com/dp/B000FPL0K4/,1,1
"PoochieBells The Original& Trusted Dog Housetraining Doorbell.Potty DogBells to Housetrain & Communicate WithYourDog :Handcrafted in USA Since 2005 : Endorsed by Pet Industry Professionals : Easy 95% Success Rate: Potty Training Instructions Included : Solid Color Collection, Chocolate Brown",Pet Products,http://www.amazon.com/dp/B0016ZP4B8/,3,1
"IRIS Exercise 8 Panel Pen Panel Pet Playpen with Door - 34 Inch, Blue",Pet Products,http://www.amazon.com/dp/B0083ZWZ2K/,1,1
"SmithBuilt Crates Dog Playpen Folding Yard with Door and Carry Bag 8 Panel Metal Wire Popup Portable Fence, 48 Inch High - Black",Pet Products,http://www.amazon.com/dp/B00EF2YAEQ/,1,1
"Hurtta Collection 12-Inch Slush Combat Suit for Pets, Medium, Granite",Pet Products,http://www.amazon.com/dp/B00EZMELX6/,1,1
"Chris Christensen Peace and Kindness Shampoo,16 fl. oz.",Pet Products,http://www.amazon.com/dp/B00GOAP76M/,1,1
"Gooby Every Day Fleece Cold Weather Dog Vest for Small Dogs, Lavender, Medium",Pet Products,http://www.amazon.com/dp/B00RM14VJ6/,1,1
Richell Convertible Elite 6 Panel Pet Gate - Medium,Pet Products,http://www.amazon.com/dp/B00X5L979Q/,1,1
"DuraPaws Water-Resistant Dog Boots - Snow Boots - Paw Protector for Snow, Rain & Salt (Set of 4 available in 5 Sizes) (Blue, Small - 1.93"" Wide x 2.17"" Long)",Pet Products,http://www.amazon.com/dp/B019BJEIRG/,1,1
Italian Greyhound 21st Century,Book,http://www.amazon.com/dp/0961198648/,1,1
Dog Doorbells Premium Quality Training Potty Great Dog Bells Adjustable Door Bell Dog Bells for Potty Training Your Puppy the Easy Way - Premium Quality - 5 Extra Large Loud 1.4 DoorBells by papikin,Pet Products,http://www.amazon.com/dp/B01KG9WMWI/,1,1
