name,category,amazon_link,total_mentions,subreddit_mentions
"Thinking, Fast and Slow",Book,http://www.amazon.com/dp/0374533555/,118,2
Samsung UN85S9 Framed 85-Inch 4K Ultra HD 3D Smart LED TV,Home Theater,http://www.amazon.com/dp/B00CMEN95U/,15,2
"Predictably Irrational, Revised and Expanded Edition: The Hidden Forces That Shape Our Decisions",Book,http://www.amazon.com/dp/0061353248/,44,2
"Passion Lubes, Natural Water-Based Lubricant, 55 Gallon Drum",Health and Beauty,http://www.amazon.com/dp/B005MR3IVO/,713,2
23 Things They Don't Tell You about Capitalism,Book,http://www.amazon.com/dp/0141047976/,4,1
Flowers for Algernon,Book,http://www.amazon.com/dp/0156030306/,5,1
Software Craftsmanship: The New Imperative,Book,http://www.amazon.com/dp/0201733862/,1,1
"Man, the State, and War: A Theoretical Analysis",Book,http://www.amazon.com/dp/0231125372/,1,1
"Hubbub: Filth, Noise, and Stench in England, 1600-1770",Book,http://www.amazon.com/dp/0300137567/,3,1
"Going Clear: Scientology, Hollywood, and the Prison of Belief",Book,http://www.amazon.com/dp/0307745309/,23,1
Our Dumb World,Book,http://www.amazon.com/dp/0316018430/,1,1
Skunk Works: A Personal Memoir of My Years at Lockheed,Book,http://www.amazon.com/dp/0316743003/,50,1
The Undercover Economist,Book,http://www.amazon.com/dp/0345494016/,3,1
"The Pursuit of Italy: A History of a Land, Its Regions, and Their Peoples",Book,http://www.amazon.com/dp/0374533601/,3,1
Salumi: The Craft of Italian Dry Curing,Book,http://www.amazon.com/dp/0393068595/,4,1
Philosophy of Mind: An Introduction,Book,http://www.amazon.com/dp/0415669855/,1,1
"Dauntless (The Lost Fleet, Book 1)",Book,http://www.amazon.com/dp/0441014186/,6,1
The Best and the Brightest,Book,http://www.amazon.com/dp/0449908704/,2,1
Winter of the World: Book Two of the Century Trilogy,Book,http://www.amazon.com/dp/0451468228/,1,1
The Haves and the Have-Nots: A Brief and Idiosyncratic History of Global Inequality,Book,http://www.amazon.com/dp/0465031412/,3,1
Not Your Mama's Stitching: The Cool and Creative Way to Stitch It To 'Em,Book,http://www.amazon.com/dp/0470095164/,1,1
The Little Book That Still Beats the Market,Book,http://www.amazon.com/dp/0470624159/,5,1
Come Into My Trading Room: A Complete Guide to Trading,Book,http://www.amazon.com/dp/0471225347/,3,1
"Mathematics: Its Content, Methods and Meaning (3 Volumes in One)",Book,http://www.amazon.com/dp/0486409163/,21,1
The Talisman Italian Cookbook: Italy's bestselling cookbook adapted for American kitchens,Book,http://www.amazon.com/dp/0517503875/,1,1
Economics in One Lesson: The Shortest and Surest Way to Understand Basic Economics,Book,http://www.amazon.com/dp/0517548232/,37,1
"Aristocrats in Bourgeois Italy: The Piedmontese Nobility, 1861-1930 (Cambridge Studies in Italian History and Culture)",Book,http://www.amazon.com/dp/0521522293/,1,1
Meathead: The Science of Great Barbecue and Grilling,Book,http://www.amazon.com/dp/054401846X/,17,1
"No Fears, No Excuses: What You Need to Do to Have a Great Career",Book,http://www.amazon.com/dp/0544663330/,1,1
slide:ology: The Art and Science of Creating Great Presentations,Book,http://www.amazon.com/dp/0596522347/,3,1
The Italians,Book,http://www.amazon.com/dp/0684825007/,1,1
Liberalism: The Life of an Idea,Book,http://www.amazon.com/dp/0691168393/,1,1
The Silver Spoon New Edition,Book,http://www.amazon.com/dp/0714862568/,6,1
"You Can Draw in 30 Days: The Fun, Easy Way to Learn to Draw in One Month or Less",Book,http://www.amazon.com/dp/0738212415/,14,1
The Gun,Book,http://www.amazon.com/dp/0743271734/,8,1
A Dog's Purpose: A Novel for Humans,Book,http://www.amazon.com/dp/0765330342/,6,1
The Three-Body Problem (Remembrance of Earth's Past),Book,http://www.amazon.com/dp/0765377063/,14,1
"Understanding Physics (Motion, Sound, and Heat / Light, Magnetism, and Electricity / The Electron, Proton, and Neutron)",Book,http://www.amazon.com/dp/0880292512/,5,1
Lords of Chaos: The Bloody Rise of the Satanic Metal Underground New Edition,Book,http://www.amazon.com/dp/0922915946/,5,1
Soluzioni: A Practical Grammar of Contemporary Italian (Routledge Concise Grammars) (Italian Edition),Book,http://www.amazon.com/dp/1138018481/,4,1
Blitzed: Drugs in the Third Reich,Book,http://www.amazon.com/dp/1328663795/,8,1
"One Minute to Midnight: Kennedy, Khrushchev, and Castro on the Brink of Nuclear War",Book,http://www.amazon.com/dp/1400078911/,4,1
The Mystery Method: How to Get Beautiful Women into Bed,Book,http://www.amazon.com/dp/1400154111/,3,1
"The Experience Economy, Updated Edition",Book,http://www.amazon.com/dp/1422161978/,1,1
Forgotten Algebra,Book,http://www.amazon.com/dp/1438001509/,2,1
"How to Win Friends and Influence People (8.5"" x 11"")",Book,http://www.amazon.com/dp/1508569754/,25,1
Subversive Cross Stitch: 50 F*cking Clever Designs for Your Sassy Side,Book,http://www.amazon.com/dp/1576877558/,12,1
"AntiCraft: Knitting, Beading and Stitching for the Slightly Sinister",Book,http://www.amazon.com/dp/1600610307/,1,1
Onward: How Starbucks Fought for Its Life without Losing Its Soul,Book,http://www.amazon.com/dp/1609613821/,1,1
The Influential Mind: What the Brain Reveals About Our Power to Change Others,Book,http://www.amazon.com/dp/1627792651/,1,1
Germany - Culture Smart!: the essential guide to customs & culture,Book,http://www.amazon.com/dp/1857333063/,1,1
"Chemtrails, HAARP, and the Full Spectrum Dominance of Planet Earth",Book,http://www.amazon.com/dp/1936239930/,5,1
Italian With Ease (Assimil Language Learning Programs - Book and CD Edition,Book,http://www.amazon.com/dp/270051064X/,2,1
"Le Corbusier & Pierre Jeanneret: Chandigarh, India",Book,http://www.amazon.com/dp/2909187071/,1,1
Stories of Your Life and Others (Chinese Edition),Book,http://www.amazon.com/dp/754476592X/,1,1
Victorinox 10 Inch Fibrox Pro Chef's Knife,Kitchen,http://www.amazon.com/dp/B0000CF8YO/,16,1
De'Longhi BAR32 Retro 15 BAR Pump Espresso and Cappuccino Maker,Kitchen,http://www.amazon.com/dp/B0002A3S66/,4,1
Pentel GraphGear 500 Automatic Drafting Pencil Black (PG525A),Office Product,http://www.amazon.com/dp/B0006HXQXA/,10,1
Uranium Ore,BISS,http://www.amazon.com/dp/B000796XXM/,109,1
"Delta Cycle Delta Airzound Bike Horn , colors may vary",Sports,http://www.amazon.com/dp/B000ACAMJC/,53,1
"Polo Ralph LaurenBlack, White and gray Casual Socks Sz 6-12 1/2",Apparel,http://www.amazon.com/dp/B000RJ0JLO/,1,1
"Fiasconaro Panettone Traditional Italian Christmas Cake, 35.27 Ounce",Grocery,http://www.amazon.com/dp/B000YHZ0U4/,1,1
"GoGirl Female Urination Device, Lavender",Health and Beauty,http://www.amazon.com/dp/B003BEDUS6/,36,1
"GoPicnic Ready-to-Eat Meals Salami & Cheese, 3.6 Ounce, (Pack of 6)",Grocery,http://www.amazon.com/dp/B003YBNIM4/,1,1
Even a Geek Can Speak: Low-Tech Presentation Skills for High-Tech People,eBooks,http://www.amazon.com/dp/B004GXAZF2/,1,1
100 Feather Razor Blades NEW Hi-stainless Double Edge,Health and Beauty,http://www.amazon.com/dp/B004RWTQTS/,19,1
JavaScript: The Definitive Guide: Activate Your Web Pages (Definitive Guides),eBooks,http://www.amazon.com/dp/B004XQX4K0/,2,1
An Introduction to Italian Dialectology,Book,http://www.amazon.com/dp/B00555LNII/,2,1
"Listerine PocketPaks Breath Strips, Cool Mint, 72 Count (Pack of 2)",Beauty,http://www.amazon.com/dp/B005LVRXLW/,1,1
Brioschi Effervescent - Antacid,Health and Beauty,http://www.amazon.com/dp/B005LX37VU/,1,1
Plugy Earphone Jack Accessory (Panda),Wireless,http://www.amazon.com/dp/B005XGO6JM/,1,1
Vital Vacuum Cleaner Pet Grooming Kit,Home,http://www.amazon.com/dp/B0078598I0/,1,1
Macine Mulino Bianco 400 Gr ( 14.3 Oz.) - Pack of 3,Grocery,http://www.amazon.com/dp/B0095FF574/,1,1
Luxe Bidet Neo 320 - Self Cleaning Dual Nozzle - Hot and Cold Water Non-Electric Mechanical Bidet Toilet Attachment,Home Improvement,http://www.amazon.com/dp/B00A0RX2UI/,49,1
AudioQuest Diamond 16m (52.49 feet) Braided HDMI Cable,CE,http://www.amazon.com/dp/B00IL3TZSQ/,116,1
"Canned Air From Tokyo, Japan (Travel Collectible)",Home,http://www.amazon.com/dp/B00KAJRZEA/,1,1
Samsung UN105S9 Curved 105-Inch 4K Ultra HD 120Hz 3D Smart LED TV,Home Theater,http://www.amazon.com/dp/B00L403O8U/,27,1
Dell Ultra HD 4k Monitor P2715Q 27-Inch Screen LED-Lit Monitor,Personal Computer,http://www.amazon.com/dp/B00PC9HFO8/,40,1
USB 3.1 Type-C Male to USB 3.0 A Plug 1m Cable for Nokia N1 Black,Personal Computer,http://www.amazon.com/dp/B00SWP1EGE/,1,1
Wallmonkeys Senior Woman with Asthma Inhaler Peel and Stick Wall Decals WM335116 (24 in H x 21 in W),Home,http://www.amazon.com/dp/B0150BAJYA/,23,1
HANEBATH Complete Handheld Bidet Sprayer Set with T-adapter Valve for Toilet - 2 Modes - Brushed Nickel,Home Improvement,http://www.amazon.com/dp/B01GBKP8JK/,1,1
Pounded By The Pound: Turned Gay By The Socioeconomic Implications Of Britain Leaving The European Union,eBooks,http://www.amazon.com/dp/B01HJXVP8G/,16,1
"Unisex Professional Slim Business Laptop Backpack, Feskin Fashion Casual Durable Travel Rucksack Daypack (Waterproof Dustproof) with Tear Resistant Design for Macbook, Tablet - Light Green",PC Accessory,http://www.amazon.com/dp/B01LXAJF7I/,1,1
"Influence: The Psychology of Persuasion, Revised Edition",Book,http://www.amazon.com/dp/006124189X/,77,1
Nintendo Switch - Neon Blue and Red Joy-Con,Video Games,http://www.amazon.com/dp/B01MUAGZ49/,53,1
The Honest Truth About Dishonesty: How We Lie to Everyone--Especially Ourselves,Book,http://www.amazon.com/dp/0062183613/,3,1
Dual Momentum Investing: An Innovative Strategy for Higher Returns with Lower Risk,Book,http://www.amazon.com/dp/0071849440/,3,1
Programming With Unix System Calls: Unix Svr 4.2,Book,http://www.amazon.com/dp/0130176745/,2,1
