name,category,amazon_link,total_mentions,subreddit_mentions
"Black Box G1W-C Capacitor Model Dash Cam – Heat Resistant – Full HD 1080P H.264 2.7"" LCD Car DVR Video Recorder – WDR 140° Wide Angle 4x Zoom Motion Detection Night Vision G-Sensor",Car Audio or Theater,http://www.amazon.com/dp/B00MIO2KRC/,60,6
"Black Box G1W-CB ""Black Bezel"" Capacitor Model Dash Camera - Heat Resistant - Full HD 1080P H.264 2.7"" LCD Car DVR Video Recorder - WDR 140° Wide Angle 4x Zoom Motion Detection Night Vision G-Sensor",Car Audio or Theater,http://www.amazon.com/dp/B00P8F3LD0/,49,5
"A118-C 1080p HD Car Dash Camera with Capacitor G-Sensor 1.5"" HD Screen 170 Degree Wide Angle Lens Records at 60 FPS with Loop Recording",Car Audio or Theater,http://www.amazon.com/dp/B00SK8B47W/,82,4
"Rexing V1 Car Dash Cam 2.4"" LCD FHD 1080p 170 Degree Wide Angle Dashboard Camera Recorder with Sony Exmor Video Sensor, G-Sensor, WDR, Loop Recording",Wireless,http://www.amazon.com/dp/B00X528FNE/,97,2
Public-Private Partnerships for Major League Sports Facilities (Routledge Research in Sport Business and Management),Book,http://www.amazon.com/dp/0415806933/,1,1
White Rock Lake (Images of America),Book,http://www.amazon.com/dp/0738578835/,1,1
"Dallas, TX Street Guide",Book,http://www.amazon.com/dp/0762588128/,1,1
"Brothers in Arms: The Epic Story of the 761st Tank Battalion, WWII's Forgotten Heroes",Book,http://www.amazon.com/dp/0767909135/,1,1
"Field of Schemes: How the Great Stadium Swindle Turns Public Money into Private Profit, Revised and Expanded Edition",Book,http://www.amazon.com/dp/0803260164/,5,1
"The Elements of Journalism, Revised and Updated 3rd Edition: What Newspeople Should Know and the Public Should Expect",Book,http://www.amazon.com/dp/0804136785/,2,1
"Public Dollars, Private Stadiums: The Battle over Building Sports Stadiums",Book,http://www.amazon.com/dp/0813533430/,3,1
"60 Hikes Within 60 Miles: Dallas/Fort Worth: Includes Tarrant, Collin, and Denton Counties",Book,http://www.amazon.com/dp/0897326067/,1,1
"Dallas, an illustrated history",Book,http://www.amazon.com/dp/0897810341/,1,1
Network Warrior: Everything You Need to Know That Wasn't on the CCNA Exam,Book,http://www.amazon.com/dp/1449387861/,26,1
Tribe: On Homecoming and Belonging,Book,http://www.amazon.com/dp/1455566381/,10,1
White Rock Lake Revisited (Images of America),Book,http://www.amazon.com/dp/1467131172/,1,1
Vij's: Elegant and Inspired Indian Cuisine,Book,http://www.amazon.com/dp/1553651847/,1,1
Fixin' To Be Texan,Book,http://www.amazon.com/dp/1556226489/,1,1
The Roads of Texas,Book,http://www.amazon.com/dp/156966305X/,1,1
CCENT/CCNA ICND1 100-101 Official Cert Guide,Book,http://www.amazon.com/dp/1587143852/,17,1
Moon Dallas & Fort Worth (Moon Handbooks),Book,http://www.amazon.com/dp/1612385265/,1,1
"Invisible Glass Premium Glass Cleaner - 19 oz, 91164",Automotive Parts and Accessories,http://www.amazon.com/dp/B0007OWD2M/,7,1
Dap 08641 Clear Silicone Sealant 9.8-Ounce,Home Improvement,http://www.amazon.com/dp/B000BD0QAK/,3,1
White Flag 3x5 Brand NEW Blank 3 x 5 Last Lap Banner,Lawn & Patio,http://www.amazon.com/dp/B000G2OYZO/,1,1
Hydro-Turf Oil Extractor 6-Liter OIL01,Automotive Parts and Accessories,http://www.amazon.com/dp/B000GU0MMU/,3,1
Sunforce 11240 1000 Watt Pure Sine Wave Inverter with Remote Control,Automotive Parts and Accessories,http://www.amazon.com/dp/B000WGNNUQ/,3,1
HERCULES HOOK WALL HANGER,Home Improvement,http://www.amazon.com/dp/B001420MVU/,3,1
"Etymotic ETY-Plugs High Fidelity Earplugs, Standard Fit, Frost Tip",Health and Beauty,http://www.amazon.com/dp/B0015WJQ7A/,103,1
HALT Dog Repellant Spray,Lawn & Patio,http://www.amazon.com/dp/B001AZMH46/,8,1
Forum Novelties Headless Man Adult Costume - Choose Size,Apparel,http://www.amazon.com/dp/B001F2E1IE/,1,1
Agent Provocateur,Digital Music Album,http://www.amazon.com/dp/B001KWPA2U/,1,1
"ExOfficio Men's Give-N-Go Boxer Brief, Black, Small",Sports,http://www.amazon.com/dp/B001M0MMZS/,17,1
"Etymotic High Fidelity Earplugs, ER20 ETY-Plugs, Standard Fit Blue Tip, 1 pair",Health and Beauty,http://www.amazon.com/dp/B0044DEESS/,185,1
"ARRIS SURFboard DOCSIS 3.0 Cable Modem (SB6121) Time Warner Cable, Charter, Cox, Cablevision, and more (Black,Retail Packaging)",CE,http://www.amazon.com/dp/B004XC6GJ0/,85,1
Laptop Keyboard for Acer Aspire 5810 5810T 5810TG 5810TZ Series Replacement for Part Number: AS5810T-8929,PC Accessory,http://www.amazon.com/dp/B004Z4UA0W/,1,1
"Big Joe Large Fuf Foam Filled Bean Bag Chair, Comfort Suede, Steel Grey",Furniture,http://www.amazon.com/dp/B0055DXMGQ/,1,1
BAFX Products 34t5 Bluetooth OBDII Scan Tool for Android Devices,Automotive Parts and Accessories,http://www.amazon.com/dp/B005NLQAHS/,136,1
ASUS RT-N66U Dual-Band Wireless-N900 Gigabit Router,Personal Computer,http://www.amazon.com/dp/B006QB1RPY/,69,1
"BigMouth Inc Gigantic Donut Pool Float, Strawberry Frosted with Sprinkles",Toy,http://www.amazon.com/dp/B007Q2KZU0/,7,1
Olympus XZ-2 Digital Camera (Black) (Discontinued by Manufacturer),Photography,http://www.amazon.com/dp/B009AYJQ2U/,1,1
Gold's Gym XRS 20 Olympic Bench,Sports,http://www.amazon.com/dp/B009PA1KJG/,1,1
"10 Reusable Straws - Stainless Steel Drinking - Set of 10 + Cleaner - Eco Friendly, SAFE, NON-TOXIC non-plastic",Kitchen,http://www.amazon.com/dp/B009ZOYCA6/,2,1
Milk Chocolate Hanukkah Gelt Coins (4.94 Oz.) - Gold,Grocery,http://www.amazon.com/dp/B00A9N7NXK/,1,1
"Texas Shaped 24 Hole Stuffed Jalapeno Popper Rack for the Grill, BBQ, Smoker or Oven",Lawn & Patio,http://www.amazon.com/dp/B00BVBJ6UW/,2,1
Reusable Grocery Bags | Foldable w/ Integrated String Pouch | Ripstop Nylon Tote,Apparel,http://www.amazon.com/dp/B00D34TKV0/,1,1
Vehicle Suction Cup Mount for DR32 DVR 207 and Mobius Dash Camera Used on Dashboard & Windshield,Photography,http://www.amazon.com/dp/B00DW9UBDM/,2,1
Mohu Antenna Leaf 30 Paper-Thin Indoor HDTV Antenna (MH-110502),Speakers,http://www.amazon.com/dp/B00EWEHEL8/,4,1
Car Integration System Kit Module Radio Adapter iPod iPhone Auxilary Interface for Toyota,Car Audio or Theater,http://www.amazon.com/dp/B00GFEPJQK/,1,1
Optimum (NRWW2012Q) No Rinse Wash & Wax - 32 oz.,Automotive Parts and Accessories,http://www.amazon.com/dp/B00GG9FB8U/,15,1
Lavatools PT12 Javelin Digital Instant Read Meat Thermometer (Chipotle),Kitchen,http://www.amazon.com/dp/B00GRFHXVQ/,57,1
"""ABC Products"" - Shorty The Powerful - Mini Sink and Drain Plunger - For Plunging Out - Clogged Up Drains - (Fits The Pam Of Your Hand - Small For Easy Storage)m",Home,http://www.amazon.com/dp/B00H5EE0T6/,1,1
51 LED UV Scorpion Detector Hunter Finder Ultra Violet Blacklight Black Light Flashlight AA,Sports,http://www.amazon.com/dp/B00HVOCSTY/,2,1
"Disguise Women's Nintendo Super Mario Bros.Princess Peach Deluxe Costume, Pink, Large/12-14",Apparel,http://www.amazon.com/dp/B00J1O2IQ0/,1,1
"Stealth Cam 7 Megapixel Compact Scouting Camera with Batteries and SD Card, Camouflage",Sports,http://www.amazon.com/dp/B00JWFI83U/,4,1
Inflatable HQ 20 ft. Tall Air Inflatable Dancer Tube Puppet - Yellow (Blower Not Included),Office Product,http://www.amazon.com/dp/B00K34EC20/,1,1
"LaView 6 1080P IP Camera Security System, 8 Channel 1080P IP PoE NVR w/2TB HDD and 6 1080P 2MP White Bullet Surveillance Camera Kit",Photography,http://www.amazon.com/dp/B00KXB496M/,1,1
DOD TECH LS Series LS360W Sony Exmor Powered Full HD Dash Camera Dashcam with WDR Technology,Car Audio or Theater,http://www.amazon.com/dp/B00MCWZ0QI/,2,1
Hiking Texas: A Guide to 85 of the State's Greatest Hiking Adventures (State Hiking Guides Series),eBooks,http://www.amazon.com/dp/B00MJD6EM4/,1,1
"Black Box Mobius Pro Mini Action Camera - 820mAh Battery - 1080P Full HD Mini Sports Action Dash Cam - DVR Video Recorder with WDR (Wide Dynamic Range) Large FOV, Motion Detection & Time Lapse",Photography,http://www.amazon.com/dp/B00N6AWQ5I/,53,1
"UNITEK Multi-in-1 Micro SD Card Reader Adapter with OTG USB 2.0 A Male and Micro B Connector for Android Smartphone Tablets with OTG Function, Laptop Notebook PC",Personal Computer,http://www.amazon.com/dp/B00NL43JAU/,5,1
Transcend 16GB DrivePro 100 Car Video Recorder With Suction Mount (TS16GDP100M),Car Audio or Theater,http://www.amazon.com/dp/B00NUVDVDY/,6,1
"House Cleaning - 2 Hours, Standard Products-1",Installation Services,http://www.amazon.com/dp/B00SPNPZU4/,1,1
"Coca-Cola Cups, Red Plastic Tumbler 24-Ounce Restaurant Grade, Carlisle, Set of 6",Kitchen,http://www.amazon.com/dp/B00WYHR7QC/,1,1
Polaroid PD-E53H 1080P HD DashCam,Photography,http://www.amazon.com/dp/B00ZI7NV6A/,1,1
FalconZero F170HD+ DashCam 1080P 170° Viewing Angle microSD Card Included FULL HD,Photography,http://www.amazon.com/dp/B014S09OKO/,8,1
Car Fire Extinguisher Bracket | Universal Design Fits Most Vehicles,Automotive Parts and Accessories,http://www.amazon.com/dp/B015G3QXMY/,1,1
"ASUS AC5300 Wireless Tri-Band (Dual 5GHz + Single 2.4GHz) Gigabit Router [RT-AC5300] 802.11ac 5334 Mbps Wi-Fi Speed, MU-MIMO, 4 x 4 Antenna Design, 4x Gigabit LAN Ports, WTFast Route Optimization",Personal Computer,http://www.amazon.com/dp/B0167HG1V6/,18,1
Critical Cycles Harper Single-Speed Fixed Gear Urban Commuter Bike,Sports,http://www.amazon.com/dp/B018NWU48O/,2,1
Z-Edge Z3 3-Inch 2K Ultra Full HD1296P 2560x1080 Car Dash Cam with 32GB Card & Parking Monitor,Car Audio or Theater,http://www.amazon.com/dp/B018YRBQSK/,14,1
"Street Guardian SG9665GC v3 2017 edition + 64GB microSD Card + CPL + USB/OTG Android Card Reader + GPS, Supercapacitor Sony Exmor IMX322 WDR CMOS Sensor DashCam 1080P 30FPS (Best Of - DashCamTalk)",Wireless,http://www.amazon.com/dp/B019WXYCMM/,5,1
"Autel Robotics X-Star Premium Drone with 4K Camera, 1.2-Mile HD Live View & Hard Case (Orange)",Boost,http://www.amazon.com/dp/B01B1H8322/,5,1
Bragi - The Dash Truly Wireless Smart Earphones,Boost,http://www.amazon.com/dp/B01BHAU6QO/,4,1
Spy Tec A119 Version 2 Car Dash 60 FPS 1440p Camera with Novate Chipset G Sensor Wide Angle Lens and Low Light Recording,Photography,http://www.amazon.com/dp/B01HMZVYLY/,61,1
SpyTec A119 Version 2 Car Dash 60 FPS 1440p Camera with GPS Logger Mount G-Sensor Wide Angle Lens and Low Light Recording,Photography,http://www.amazon.com/dp/B01HN0HBFG/,35,1
Joking Hazard,Boost,http://www.amazon.com/dp/B01IA9R2TY/,4,1
Nintendo NES Classic Mini EU Console,Video Games,http://www.amazon.com/dp/B01IFJEWTM/,1,1
"Baby Jogger City Tour stroller, Onyx",Baby Product,http://www.amazon.com/dp/B01J258IBQ/,3,1
"LED Headlight Bulbs Reteck Car Headlight Conversion Kit Clear Arc-Beam Kit - 30w 7,200Lm Cool White CREE Light Source - 2 Yr Warranty , 9005/HB3",Automotive Parts and Accessories,http://www.amazon.com/dp/B01KVUNSYS/,1,1
"DBPOWER 2.7"" Dash Cam, 120° Wide Angle 1080P Car On-dash Video Recorder G-sensor Vehicle Camera Camcorder with 4X Zoom Lens Motion Detection Support up to 32GB C10 Micro SD Card (Not Included)",Wireless,http://www.amazon.com/dp/B01L1KL4DE/,4,1
"The Impending Crisis, 1848-1861",Book,http://www.amazon.com/dp/0061319295/,5,1
Rap Snacks Migos Sour Cream with a Dab of Ranch 2.75oz Bag,Grocery,http://www.amazon.com/dp/B01MSSSKJP/,2,1
"Some We Love, Some We Hate, Some We Eat: Why It's So Hard to Think Straight About Animals (P.S.)",Book,http://www.amazon.com/dp/0061730858/,3,1
"What This Cruel War Was Over: Soldiers, Slavery, and the Civil War",Book,http://www.amazon.com/dp/0307277321/,5,1
Fields of Blood: Religion and the History of Violence,Book,http://www.amazon.com/dp/0307957047/,1,1
