name,category,amazon_link,total_mentions,subreddit_mentions
The Believing Brain: From Ghosts and Gods to Politics and Conspiracies---How We Construct Beliefs and Reinforce Them as Truths,Books,https://www.amazon.com/The-Believing-Brain-Conspiracies-How-Construct/dp/1250008808,2,1
After the Ball: How America Will Conquer Its Fear and Hatred of Gays in the 90's (Plume),Books,https://www.amazon.com/After-Ball-America-Conquer-Hatred/dp/0452264987,1,1
The Archaeology of Shamanism,Books,https://www.amazon.com/The-Archaeology-Shamanism-Neil-Price/dp/0415252555,1,1
Nova Europa: European Survival Strategy in a Darkening World,Books,https://www.amazon.com/Nova-Europa-European-Survival-Darkening/dp/1366816609/ref=la_B00L2CD35Y_1_5?s=books&amp;ie=UTF8&amp;qid=1500235630&amp;sr=1-5,1,1
The Biology of Desire: Why Addiction Is Not a Disease,Books,https://www.amazon.com/The-Biology-Desire-Addiction-Disease/dp/1610394372,1,1
