name,category,amazon_link,total_mentions,subreddit_mentions
Star Trek Creator: The Authorized Biography of Gene Roddenberry,Books,https://www.amazon.com/Star-Trek-Creator-Authorized-Roddenberry/dp/0451454189,2,1
Klingon Bird-of-Prey Haynes Manual (Star Trek),Books,https://www.amazon.com/Star-Trek-Klingon-Bird-Prey/dp/145169590X,1,1
Worlds of the Federation (Star Trek),Books,https://www.amazon.com/Worlds-Federation-Star-Trek-Johnson/dp/0671708139,1,1
Star Trek Star Charts: The Complete Atlas of Star Trek,Books,https://www.amazon.com/Star-Trek-Charts-Complete-Atlas/dp/0743437705,1,1
The Buried Age (Star Trek: The Next Generation),Books,https://www.amazon.com/The-Buried-Age-Star-Trek/dp/1416537392,1,1
"Fire Ship (Star Trek Voyager: The Captains Table, Book 4)",Books,https://www.amazon.com/Fire-Ship-Star-Trek-Voyager/dp/0671014676,1,1
Articles of the Federation (Star Trek (Unnumbered Paperback)),Books,https://www.amazon.com/DeCandido-Articles-Federation-Unnumbered-Paperback/dp/B00N4FH22M/ref=sr_1_2?s=books&amp;ie=UTF8&amp;qid=1426695136&amp;sr=1-2&amp;keywords=star+trek+articles+of+the+federation,1,1
