name,category,amazon_link,total_mentions,subreddit_mentions
Governing the Commons: The Evolution of Institutions for Collective Action (Political Economy of Institutions and Decisions),Book,http://www.amazon.com/dp/0521405998/,6,1
Out of the Mountains: The Coming Age of the Urban Guerrilla,Book,http://www.amazon.com/dp/0190230967/,4,1
Social Justice and the City (Geographies of Justice and Social Transformation Ser.),Book,http://www.amazon.com/dp/0820334030/,1,1
COMMUNING WITH THE SPIRITS: The Magical Practice of Necromancy,Book,http://www.amazon.com/dp/1413484379/,1,1
The Zapatista Reader (Nation Books),Book,http://www.amazon.com/dp/1560253355/,1,1
Blood in the Bayou: A Record of the Operations and Blessed Techniques of a Doctor of Conjure-Work,Book,http://www.amazon.com/dp/1936922789/,1,1
A Deck of Spells: Hoodoo Playing Card Magic in Rootwork and Conjure,Book,http://www.amazon.com/dp/097196128X/,1,1
The Sporting Life: How to Help Yourself with Hoodoo from the Streets to the Sheets,Book,http://www.amazon.com/dp/0996147128/,1,1
