name,category,amazon_link,total_mentions,subreddit_mentions
Five Views on Apologetics,Book,http://www.amazon.com/dp/0310224764/,17,11
Classical Apologetics,Book,http://www.amazon.com/dp/0310449510/,16,10
"A History of God: The 4,000-Year Quest of Judaism, Christianity and Islam",Book,http://www.amazon.com/dp/0345384563/,40,5
The Early History of God: Yahweh and the Other Deities in Ancient Israel (The Biblical Resource Series),Book,http://www.amazon.com/dp/080283972X/,23,5
The Origins of Biblical Monotheism: Israel's Polytheistic Background and the Ugaritic Texts,Book,http://www.amazon.com/dp/0195167686/,19,5
The Religion of Ancient Israel (Library of Ancient Israel),Book,http://www.amazon.com/dp/066423237X/,16,5
The Religions of Ancient Israel: A Synthesis of Parallactic Approaches,Book,http://www.amazon.com/dp/0826463398/,16,5
God in Translation: Deities in Cross-Cultural Discourse in the Biblical World,Book,http://www.amazon.com/dp/0802864333/,16,5
Yahweh and the Gods and Goddesses of Canaan (The Library of Hebrew Bible/Old Testament Studies),Book,http://www.amazon.com/dp/0826468306/,16,5
Science and Religion: A Historical Introduction,Book,http://www.amazon.com/dp/0801870380/,8,5
An Illusion of Harmony: Science And Religion in Islam,Book,http://www.amazon.com/dp/1591024498/,7,5
History of the Conflict Between Religion and Science,Book,http://www.amazon.com/dp/1484063163/,7,5
The Demon-Haunted World: Science as a Candle in the Dark,Book,http://www.amazon.com/dp/0345409469/,24,4
A Universe from Nothing: Why There Is Something Rather than Nothing,Book,http://www.amazon.com/dp/1451624468/,14,4
On the Historicity of Jesus: Why We Might Have Reason for Doubt,Book,http://www.amazon.com/dp/1909697494/,8,4
Why Evolution Is True,Book,http://www.amazon.com/dp/0143116649/,22,3
How Jesus Became God: The Exaltation of a Jewish Preacher from Galilee,Book,http://www.amazon.com/dp/0061778184/,8,3
"Thinking, Fast and Slow",Book,http://www.amazon.com/dp/0374533555/,35,2
The Myth of Persecution: How Early Christians Invented a Story of Martyrdom,Book,http://www.amazon.com/dp/0062104551/,8,2
The Miracle of Theism: Arguments For and Against the Existence of God,Book,http://www.amazon.com/dp/019824682X/,5,2
Faces in the Clouds: A New Theory of Religion,Book,http://www.amazon.com/dp/0195098919/,4,2
Arguing about Gods,Book,http://www.amazon.com/dp/0521122643/,3,2
Atheism: The Case Against God (The Skeptic's Bookshelf),Book,http://www.amazon.com/dp/087975124X/,3,2
The Best Argument against God (Palgrave Pivot),Book,http://www.amazon.com/dp/1137354135/,2,2
God in the Age of Science?: A Critique of Religious Reason,Book,http://www.amazon.com/dp/0198701527/,2,2
"Slavery, Abolitionism, and the Ethics of Biblical Scholarship (The Bible in the Modern World)",Book,http://www.amazon.com/dp/1909697184/,2,2
The Non-Existence of God,Book,http://www.amazon.com/dp/0415301076/,2,2
A Physicalist Manifesto: Thoroughly Modern Materialism (Cambridge Studies in Philosophy),Book,http://www.amazon.com/dp/0521038944/,2,2
On the Nature and Existence of God (Cambridge Philosophy Classics),Book,http://www.amazon.com/dp/0521457238/,2,2
Logic and Theism: Arguments for and against Beliefs in God,Book,http://www.amazon.com/dp/0521108667/,2,2
Arguing for Atheism: An Introduction to the Philosophy of Religion,Book,http://www.amazon.com/dp/0415093384/,2,2
Objecting to God,Book,http://www.amazon.com/dp/052118665X/,2,2
The Greatest Show on Earth: The Evidence for Evolution,eBooks,http://www.amazon.com/dp/B002LVVCQM/,,1
Nailed: Ten Christian Myths That Show Jesus Never Existed At All,eBooks,http://www.amazon.com/dp/B007GPG290/,,1
"The Belief Instinct: The Psychology of Souls, Destiny, and the Meaning of Life",eBooks,http://www.amazon.com/dp/B004HW6ADS/,,1
Kidnapped for Christ,Movie,http://www.amazon.com/dp/B00R6Q5TFC/,,1
Have a Nice Doomsday: Why Millions of Americans are Looking,eBooks,http://www.amazon.com/dp/B000W9135A/,,1
Jesus Camp,Movie,http://www.amazon.com/dp/B001AMRHNU/,,1
The Magic of Reality: How We Know What's Really True,Book,http://www.amazon.com/dp/1451675046/,18,1
Misquoting Jesus: The Story Behind Who Changed the Bible and Why,Book,http://www.amazon.com/dp/0060859512/,15,1
A Brief History of Time,Book,http://www.amazon.com/dp/0553380168/,9,1
Finding Darwin's God: A Scientist's Search for Common Ground Between God and Evolution (P.S.),Book,http://www.amazon.com/dp/0061233501/,9,1
God Is Not Great: How Religion Poisons Everything,Book,http://www.amazon.com/dp/0446697966/,7,1
Did Jesus Exist?: The Historical Argument for Jesus of Nazareth,Book,http://www.amazon.com/dp/0062206443/,7,1
Forged: Writing in the Name of God--Why the Bible’s Authors Are Not Who We Think They Are,Book,http://www.amazon.com/dp/0062012622/,6,1
God: The Most Unpleasant Character in All Fiction,Book,http://www.amazon.com/dp/1454918322/,5,1
A Manual for Creating Atheists,eBooks,http://www.amazon.com/dp/B00LKBT0MC/,5,1
The Jesus Toaster,Kitchen,http://www.amazon.com/dp/B0042QRYO8/,5,1
The Bible with Sources Revealed,Book,http://www.amazon.com/dp/006073065X/,4,1
Breaking the Spell: Religion as a Natural Phenomenon,Book,http://www.amazon.com/dp/0143038338/,4,1
The Oxford Handbook of Atheism (Oxford Handbooks),Book,http://www.amazon.com/dp/0199644659/,4,1
The Hidden Reality: Parallel Universes and the Deep Laws of the Cosmos,Book,http://www.amazon.com/dp/0307278123/,3,1
Letter to a Christian Nation,Book,http://www.amazon.com/dp/0307278778/,3,1
The Myth of Persecution: How Early Christians Invented a Story of Martyrdom,Book,http://www.amazon.com/dp/0062104527/,3,1
The Problems of Philosophy,Book,http://www.amazon.com/dp/1604595132/,2,1
"The End of Faith: Religion, Terror, and the Future of Reason",Book,http://www.amazon.com/dp/0393327655/,2,1
"Encyclopedia of Gods: Over 2,500 Deities of the World",Book,http://www.amazon.com/dp/0816029091/,2,1
Why Evolution is True,Book,http://www.amazon.com/dp/146923307X/,2,1
Lost Christianities: The Battles for Scripture and the Faiths We Never Knew,eBooks,http://www.amazon.com/dp/B000SEHQD2/,2,1
Forgery and Counterforgery: The Use of Literary Deceit in Early Christian Polemics,Book,http://www.amazon.com/dp/1511395117/,1,1
"Parallel Worlds: A Journey Through Creation, Higher Dimensions, and the Future of the Cosmos",Book,http://www.amazon.com/dp/1400033721/,1,1
Many Worlds in One: The Search for Other Universes,Book,http://www.amazon.com/dp/0809067226/,1,1
God's Defenders: What They Believe and Why They Are Wrong,Book,http://www.amazon.com/dp/1591020808/,1,1
The Structure of Evolutionary Theory,Book,http://www.amazon.com/dp/0674006135/,1,1
Permutation City: A Novel,Book,http://www.amazon.com/dp/1597805394/,1,1
Science in the Study of Ancient Egypt (Routledge Studies in Egyptology),Book,http://www.amazon.com/dp/0415885744/,1,1
Science in Egyptology,Book,http://www.amazon.com/dp/0719022045/,1,1
The Bad Jesus: The Ethics of New Testament Ethics,Book,http://www.amazon.com/dp/1909697796/,1,1
Think: A Compelling Introduction to Philosophy,Book,http://www.amazon.com/dp/0192100246/,1,1
What Intelligence Tests Miss: The Psychology of Rational Thought,Book,http://www.amazon.com/dp/0300164629/,1,1
Tiny Spy Ear Piece Earbud Device Mini Wireless Earpiece Earphone for Mobile Phone 3.5mm Jack,Wireless,http://www.amazon.com/dp/B00ATDH222/,1,1
Sweet Dreams: Philosophical Obstacles to a Science of Consciousness (Jean Nicod Lectures),Book,http://www.amazon.com/dp/0262541912/,1,1
Hurricane Lantern 15-inch (Uses Lamp Oil or Kerosene) by Kerosene Lantern,Home,http://www.amazon.com/dp/B003NMNDBA/,1,1
Society without God: What the Least Religious Nations Can Tell Us About Contentment,Book,http://www.amazon.com/dp/0814797237/,1,1
AKITA: The Tears and Message of Mary,Health and Beauty,http://www.amazon.com/dp/B000GU2UIO/,1,1
Proving History: Bayes's Theorem and the Quest for the Historical Jesus,Book,http://www.amazon.com/dp/1616145595/,1,1
The Fallacy of Fine-Tuning: Why the Universe Is Not Designed for Us,Book,http://www.amazon.com/dp/1616144432/,1,1
The Case Against The Case For Christ: A New Testament Scholar Refutes the Reverend Lee Strobel,Book,http://www.amazon.com/dp/1578840058/,1,1
Quantum Questions: Mystical Writings of the World's Great Physicists,Book,http://www.amazon.com/dp/1570627681/,1,1
Did Moses Exist? The Myth of the Israelite Lawgiver,Book,http://www.amazon.com/dp/0979963184/,1,1
The Jesus Puzzle: Did Christianity Begin with a Mythical Christ? Challenging the Existence of an Historical Jesus,Book,http://www.amazon.com/dp/096892591X/,1,1
The Cosmic Landscape: String Theory and the Illusion of Intelligent Design,Book,http://www.amazon.com/dp/0316013331/,1,1
Kingdom Coming: The Rise of Christian Nationalism,Book,http://www.amazon.com/dp/0393060942/,1,1
Loftus The Amazing Mystic Smoke Playset,Toy,http://www.amazon.com/dp/B00LB9FLEO/,1,1
