name,category,amazon_link,total_mentions,subreddit_mentions
The Black Folder: Personal Communications on the Mastery of Hoodoo,Book,http://www.amazon.com/dp/0983648379/,2,2
Out of the Mountains: The Coming Age of the Urban Guerrilla,Book,http://www.amazon.com/dp/0190230967/,9,1
Stone Age Economics,Book,http://www.amazon.com/dp/0202010996/,4,1
Political Theology: Four Chapters on the Concept of Sovereignty,Book,http://www.amazon.com/dp/0226738892/,2,1
Governing the Commons: The Evolution of Institutions for Collective Action (Political Economy of Institutions and Decisions),Book,http://www.amazon.com/dp/0521405998/,13,1
Wandering God,Book,http://www.amazon.com/dp/0791444422/,1,1
Social Justice and the City (Geographies of Justice and Social Transformation Ser.),Book,http://www.amazon.com/dp/0820334030/,2,1
Master Book of Candle Burning,Book,http://www.amazon.com/dp/0942272064/,1,1
Hoodoo Herb and Root Magic: A Materia Magica of African-American Conjure,Book,http://www.amazon.com/dp/0971961204/,2,1
A Deck of Spells: Hoodoo Playing Card Magic in Rootwork and Conjure,Book,http://www.amazon.com/dp/097196128X/,2,1
"The Art of Hoodoo Candle Magic in Rootwork, Conjure, and Spiritual Church Services",Book,http://www.amazon.com/dp/0983648360/,2,1
The Sporting Life: How to Help Yourself with Hoodoo from the Streets to the Sheets,Book,http://www.amazon.com/dp/0996147128/,1,1
The Trickster and the Paranormal,Book,http://www.amazon.com/dp/1401000827/,8,1
COMMUNING WITH THE SPIRITS: The Magical Practice of Necromancy,Book,http://www.amazon.com/dp/1413484379/,3,1
Stone Age Wisdom: The Healing Principles of Shamanism,Book,http://www.amazon.com/dp/1450519016/,1,1
A Precariat Charter: From Denizens to Citizens,Book,http://www.amazon.com/dp/1472510399/,1,1
The Precariat: The New Dangerous Class,Book,http://www.amazon.com/dp/1472536169/,8,1
Anti-Judaism: The Western Tradition,Book,http://www.amazon.com/dp/1511397381/,3,1
The Zapatista Reader (Nation Books),Book,http://www.amazon.com/dp/1560253355/,1,1
Stone Age Wisdom: The Healing Principles of Shamanism,Book,http://www.amazon.com/dp/1592330142/,1,1
The Tao of Craft: Fu Talismans and Casting Sigils in the Eastern Esoteric Tradition,Book,http://www.amazon.com/dp/1623170664/,1,1
Bloodstained: One Hundred Years of Leninist Counterrevolution,Book,http://www.amazon.com/dp/1849352968/,1,1
"Anarchism, Marxism and the Future of the Left: Interviews and Essays, 1993-1998",Book,http://www.amazon.com/dp/187317635X/,1,1
Capital - In Manga!,Book,http://www.amazon.com/dp/1926958195/,7,1
Blood in the Bayou: A Record of the Operations and Blessed Techniques of a Doctor of Conjure-Work,Book,http://www.amazon.com/dp/1936922789/,1,1
The Blank Slate: The Modern Denial of Human Nature,Book,http://www.amazon.com/dp/0142003344/,25,1
Edge City: Life on the New Frontier (Anchor Books),eBooks,http://www.amazon.com/dp/B005ACKOWM/,1,1
