name,category,amazon_link,total_mentions,subreddit_mentions
K&H Manufacturing Thermo-Kitty Mat Mocha 12.5-Inch by 25-Inch 6 Watts,Pet Products,http://www.amazon.com/dp/B000S9M2U4/,2,1
Two 11 x 4 1/2 inch Cat Scratch Guards with Pins ---- THE ORIGINAL CAT SCRATCH GUARD FURNITURE PROTECTOR ---- Love Your Furniture AND Your Cat!,Pet Products,http://www.amazon.com/dp/B005C4JZXM/,2,1
Cat Mate C50 Automatic Pet Feeder,Pet Products,http://www.amazon.com/dp/B0002AR0D8/,1,1
"SUNNY SEAT Cat Bed, Cat Window Perch Window Seat Suction Cups Space Saving Cat Hammock Pet Resting Seat Safety Cat Shelves - Providing all Around 360° Sunbath for Cats Weighted up to 30lb",Pet Products,http://www.amazon.com/dp/B00FDU5JO4/,1,1
K&H Manufacturing Pet Bed Warmer Large 11-Inch by 24-Inch 13 Watts,Pet Products,http://www.amazon.com/dp/B001AZLVG6/,1,1
