name,category,amazon_link,total_mentions,subreddit_mentions
"Continuous Delivery: Reliable Software Releases through Build, Test, and Deployment Automation (Addison-Wesley Signature Series (Fowler))",Books,https://www.amazon.com/gp/product/0321601912/,5,3
"The Practice of Cloud System Administration: DevOps and SRE Practices for Web Services, Volume 2",Books,https://www.amazon.com/Practice-Cloud-System-Administration-Practices/dp/032194318X,3,3
The Essential Deming: Leadership Principles from the Father of Quality,Books,https://www.amazon.com/Essential-Deming-Leadership-Principles-Business/dp/0071790225/,,1
The Practice of System and Network Administration: Volume 1: DevOps and other Best Practices for Enterprise IT (3rd Edition),Books,https://www.amazon.com/Practice-System-Network-Administration-Enterprise/dp/0321919165/,7,1
"The Phoenix Project: A Novel about IT, DevOps, and Helping Your Business Win",Books,https://www.amazon.com/Phoenix-Project-DevOps-Helping-Business/dp/0988262509/ref=sr_1_1?ie=UTF8&amp;qid=1455126269&amp;sr=8-1&amp;keywords=the+phoenix+project,6,1
The Goal: A Process of Ongoing Improvement,Books,https://www.amazon.com/Goal-Process-Ongoing-Improvement/dp/0884271951/ref=sr_1_1?ie=UTF8&amp;qid=1455126293&amp;sr=8-1&amp;keywords=The+Goal,4,1
Site Reliability Engineering: How Google Runs Production Systems,Books,https://www.amazon.com/Site-Reliability-Engineering-Production-Systems/dp/149192912X,2,1
"The Phoenix Project: A Novel about IT, DevOps, and Helping Your Business Win",Books,https://www.amazon.com/Phoenix-Project-DevOps-Helping-Business/dp/0988262592,2,1
Lean Enterprise: How High Performance Organizations Innovate at Scale (Lean (O'Reilly)),Books,https://www.amazon.com/Lean-Enterprise-Performance-Organizations-Innovate/dp/1449368425/,1,1
