name,category,amazon_link,total_mentions,subreddit_mentions
Dr. Bernstein's Diabetes Solution: The Complete Guide to Achieving Normal Blood Sugars,Book,http://www.amazon.com/dp/0316182699/,10,6
Think Like a Pancreas: A Practical Guide to Managing Diabetes with Insulin--Completely Revised and Updated,Book,http://www.amazon.com/dp/0738215147/,2,2
Diabetic Athlete's Handbook,Book,http://www.amazon.com/dp/0736074937/,2,2
"Haribo Original Gold-Bears Gummi Candy, 5-Pound Bag of Delicious Bears!  Ships to You  in Either Clear Packaging or the New Gold Updated Packaging.  The Same Delicious Gummi Bears in Either Packaging!",Grocery & Gourmet Food,https://www.amazon.com/Haribo-Gummi-Candy-Gold-Bears-5-Pound/dp/B000EVOSE4/ref=sr_1_1_s_it?s=grocery&amp;ie=UTF8&amp;qid=1469831764&amp;sr=1-1&amp;keywords=haribo+sugar+free+gummi+bears,20,1
One Second After (A John Matherson Novel),Book,http://www.amazon.com/dp/0765356864/,9,1
Dr. Bernstein's Diabetes Solution: The Complete Guide to Achieving Normal Blood Sugars,eBooks,http://www.amazon.com/dp/B004QZ9PC4/,2,1
Precision Kitchenware - Ultra Sharp Stainless Steel Dual Julienne & Vegetable Peeler with Cleaning Brush & Blade Guard,Kitchen,http://www.amazon.com/dp/B00FF75XG4/,2,1
GE100 Blood Glucose Monitoring System,Health and Beauty,http://www.amazon.com/dp/B00CI4KF56/,1,1
GE100 Blood Glucose Test Strips - 4/Boxes of 50 Strips = 200/Total Strips,Health and Beauty,http://www.amazon.com/dp/B00OGXRQWW/,1,1
"Contour-Next Bayer Blood Glucose Test Strips, 100 Count",Health and Beauty,http://www.amazon.com/dp/B0097OY70Y/,1,1
Dynarex Alcohol/Acetone,Health and Beauty,http://www.amazon.com/dp/B00AIQCE3C/,1,1
Bayer Contour NEXT Test Strips + Bayer Microlet Lancets + Lancing Device (100),Health and Beauty,http://www.amazon.com/dp/B00TR1NMHQ/,1,1
MOLLE Sunglasses Eyeglasses Case Padded Soft Lining Double Zipper Closure- BLACK,Sports,http://www.amazon.com/dp/B017O6MDSO/,1,1
"3M Tegaderm Transparent Film Roll , 2"" x 11 Yd., 4/Ca, 3M16002",Health and Beauty,http://www.amazon.com/dp/B001DNTU22/,1,1
Sugar Surfing: How to Manage Type 1 Diabetes in a Modern World,Book,http://www.amazon.com/dp/0996253904/,1,1
Pumping Insulin: Everything You Need for Success with an Insulin Pump,Book,http://www.amazon.com/dp/1884804845/,1,1
Uni-Solve Adhesive Remover 8 Ounce Bottle,Health and Beauty,http://www.amazon.com/dp/B000E5BKVE/,1,1
"3M Tegaderm Transparent Dressing with Label 4"" x 4 3/4"" (10 x 12 cm)50 per Box #1626W",Industrial & Scientific,https://www.amazon.com/Tegaderm-Transparent-Dressing-Label-1626W/dp/B000JJH3MU,1,1
Smith & Nephew OpSite Flexifix Transparent Film 2 Inch Roll (2in x 10.9 yards),Health and Beauty,http://www.amazon.com/dp/B000PQAYZK/,1,1
"TORBOT GROUP Skin-Tac-H Adhesive Barrier Wipes, 50/Box",Health and Beauty,http://www.amazon.com/dp/B000QF81M8/,1,1
>Skin tac adh 4 oz. Skin-Tac-H,Beauty,http://www.amazon.com/dp/B001LZUWP6/,1,1
"3M Tegaderm Transparent Film Dressing, Picture Frame Style, with Label, 2-3/8"" x 2-3/4""",Health and Beauty,http://www.amazon.com/dp/B001QFC1FA/,1,1
"Uxcell Cutter Diagonal Wire Cutting Pliers Nippers, 4.5-Inch, Red",Tools & Home Improvement,https://www.amazon.com/dp/B008FY8GNG/,1,1
"RockTape Kinesiology Tape for Athletes, Water Resistant, Reduce Pain & Injury Recovery, 2"" x 16.4 Feet, Uncut or Pre-Cut Strips",Sports,http://www.amazon.com/dp/B004GTJAMK/,1,1
Vial Protection by Securitee Blanket - Short Royal Blue,Health and Beauty,http://www.amazon.com/dp/B000R81M48/,1,1
Bayer Contour Next Test Strips - Pack of 4 = 200 Strips,Health and Beauty,http://www.amazon.com/dp/B00NUD3HYK/,1,1
"Vial Protection By Securitee Blanket - Tall Royal Blue - Fits Lantus, Apidra and Levimer Bottles",Health and Beauty,http://www.amazon.com/dp/B000R7Z204/,1,1
"Frio Insulin Cooling Case, Reusable Evaporative Medication Cooler - Duo Wallet, Black",Health and Beauty,http://www.amazon.com/dp/B00022628A/,1,1
My Wonderful Life with Diabetes,Book,http://www.amazon.com/dp/1594333939/,1,1
"Bayer Contour Meter, 100 Contour Test Strips, 100 Slight Touch 30g Lancets, 1 Lancing Device, 100 Alcohol Prep Pads and Control Solution",Health and Beauty,http://www.amazon.com/dp/B01D0JNHBG/,1,1
