name,category,amazon_link,total_mentions,subreddit_mentions
Digimon: The Official Seasons 1-4 Collection,DVD,http://www.amazon.com/dp/B00DYEBLYI/,2,2
Digimon Data Squad Season 5,DVD,http://www.amazon.com/dp/B00GOT13BQ/,1,1
Digimon Fusion,DVD,http://www.amazon.com/dp/B00PLYU726/,1,1
Digimon Fusion: Season 2,DVD,http://www.amazon.com/dp/B0192PESEC/,1,1
High Quality Metal Digimon Tag with Crest of Hope,Toy,http://www.amazon.com/dp/B01JPCZWCO/,1,1
Digimon Adventure Tri.: Reunion (Bluray/DVD Combo) [Blu-ray],DVD,http://www.amazon.com/dp/B06VSW8VLQ/,1,1
