name,category,amazon_link,total_mentions,subreddit_mentions
"Dinosaurs: The Most Complete, Up-to-Date Encyclopedia for Dinosaur Lovers of All Ages",Book,http://www.amazon.com/dp/0375824197/,8,6
Dinosaur Art: The World's Greatest Paleoart,Book,http://www.amazon.com/dp/0857685848/,3,3
The Paleoart of Julius Csotonyi,Book,http://www.amazon.com/dp/1781169128/,2,2
Dinosaurs - The Grand Tour: Everything Worth Knowing About Dinosaurs from Aardonyx to Zuniceratops,Book,http://www.amazon.com/dp/1615192123/,4,2
The Dinosaur Heresies: New Theories Unlocking the Mystery of the Dinosaurs and Their Extinction,Book,http://www.amazon.com/dp/0821756087/,2,2
All Yesterdays: Unique and Speculative Views of Dinosaurs and Other Prehistoric Animals,eBooks,http://www.amazon.com/dp/B00A2VS55O/,10,2
"The Complete Illustrated Encyclopedia Of Dinosaurs & Prehistoric Creatures: The Ultimate Illustrated Reference Guide to 1000 Dinosaurs and Prehistoric ... Commissioned Artworks, Maps and Photographs",Book,http://www.amazon.com/dp/1846812097/,2,2
The Dinosauria,Book,http://www.amazon.com/dp/0520242092/,1,1
Dinosaurs: A Concise Natural History,Book,http://www.amazon.com/dp/0521282373/,1,1
The Dinosaurs: A Fantastic View of a Lost Era,Book,http://www.amazon.com/dp/0553013351/,1,1
"The Ultimate Dinosaur: Past, Present, and Future",Book,http://www.amazon.com/dp/0553076760/,1,1
Raptor Red,Book,http://www.amazon.com/dp/0553575619/,10,1
Dinosaur for a Day,Book,http://www.amazon.com/dp/0590428667/,1,1
An Alphabet of Dinosaurs (hc),Book,http://www.amazon.com/dp/0590464868/,1,1
The Bonehunters' Revenge: Dinosaurs and Fate in the Gilded Age,Book,http://www.amazon.com/dp/0618082409/,1,1
Predatory Dinosaurs of the World: A Complete Illustrated Guide,Book,http://www.amazon.com/dp/0671619462/,1,1
The Dinosaur Heresies: New Theories Unlocking the Mystery of the Dinosaurs and Their Extinction,Book,http://www.amazon.com/dp/0688042872/,1,1
The Princeton Field Guide to Dinosaurs (Princeton Field Guides),Book,http://www.amazon.com/dp/069113720X/,2,1
The New Dinosaurs,Book,http://www.amazon.com/dp/0743407245/,1,1
Ray Bradbury Presents Dinosaur World,Book,http://www.amazon.com/dp/0743486536/,1,1
Colossal Book of Dinosaurs,Book,http://www.amazon.com/dp/0874496497/,1,1
Digging Dinosaurs: The Search That Unraveled the Mystery of Baby Dinosaurs,Book,http://www.amazon.com/dp/0894802208/,1,1
"Bone Sharps, Cowboys, And Thunder Lizards",Book,http://www.amazon.com/dp/0966010663/,1,1
A Field Guide to Mesozoic Birds and Other Winged Dinosaurs,Book,http://www.amazon.com/dp/0988596504/,1,1
All Yesterdays: Unique and Speculative Views of Dinosaurs and Other Prehistoric Animals,Book,http://www.amazon.com/dp/1291177124/,1,1
Dinosaur!,Book,http://www.amazon.com/dp/1465420479/,1,1
Dinosaurs Live! The Ultimate Coloring Adventure!,Book,http://www.amazon.com/dp/1560377054/,1,1
Dinosaurs: How They Lived and Evolved,Book,http://www.amazon.com/dp/1588345823/,1,1
"Age of Reptiles Omnibus, Vol. 1",Book,http://www.amazon.com/dp/1595826831/,1,1
What Happened to Brontosaurus?,Book,http://www.amazon.com/dp/1622000196/,1,1
Science Comics: Dinosaurs: Fossils and Feathers,Book,http://www.amazon.com/dp/1626721432/,1,1
A Dynasty of Dinosaurs,Book,http://www.amazon.com/dp/1932926429/,1,1
Dinosaur Adventure 3-D,Video Games,http://www.amazon.com/dp/B0008IST98/,1,1
Safari Ltd  Wild Safari Spinosaurus,Toy,http://www.amazon.com/dp/B000H6H4XI/,1,1
The Age of Reptiles Mural By Zallinger Peabody Museum Framed & Matted Prints,Home,http://www.amazon.com/dp/B0017ONFXC/,1,1
Nordic Ware Pro Cast Dinosaur Cakelette Pan,Kitchen,http://www.amazon.com/dp/B001TI7SAC/,1,1
OWI T-Rex Aluminum Skulpture Kit,Hobby,http://www.amazon.com/dp/B003JD28BE/,1,1
"Super Moss 22430 All Purpose Moss Mat Runners, Instant Green",Lawn & Patio,http://www.amazon.com/dp/B005H1QX5S/,1,1
Towallmark(TM) Steampunk Goth Alloy Dinosaur Skeleton Dead Tyrannosaurus T-Rex Charm Necklace (Silver),Sports,http://www.amazon.com/dp/B01072ABC2/,1,1
"Dinosaur Dilophosaurus Skull Resin Fossil Model Collectibles Home Bar Decoration 2 Color Pick - White , 18cm",Home,http://www.amazon.com/dp/B01GHQE5CO/,1,1
Macmillan Illustrated Encyclopedia of Dinosaurs and Prehistoric Animals: A Visual Who's Who of Prehistoric Life,Book,http://www.amazon.com/dp/0025801910/,1,1
"Blizzard Bay Boys' Arms Too Small Trex, Green, Red Combo, 6",Apparel,http://www.amazon.com/dp/B01M7U65GM/,3,1
Dinosaur Imagery: The Science of Lost Worlds and Jurassic Art:  The Lanzendorf Collection,Book,http://www.amazon.com/dp/0124365906/,1,1
If the Dinosaurs Came Back,Book,http://www.amazon.com/dp/0152380213/,1,1
Feathered Dinosaurs: The Origin of Birds,Book,http://www.amazon.com/dp/0195372662/,2,1
Flying Dinosaurs: How Fearsome Reptiles Became Birds,Book,http://www.amazon.com/dp/0231171781/,1,1
"The Complete Dinosaur, Second Edition (Life of the Past)",Book,http://www.amazon.com/dp/0253357012/,1,1
"My Beloved Brontosaurus: On the Road with Old Bones, New Science, and Our Favorite Dinosaurs",Book,http://www.amazon.com/dp/0374534268/,5,1
