name,category,amazon_link,total_mentions,subreddit_mentions
"FJM Security SPSA80-KA 3-1/8"" Triple Chrome Plated D-Shaped Security Padlock, Keyed Alike",Home Improvement,http://www.amazon.com/dp/B00HR01SSY/,2,2
Helmet Light Go Pro Mount Compatible - Apache 2400 Lumen Outdoor Spotlight for Nighttime Mountain Biking & Dirt Biking,Sports,http://www.amazon.com/dp/B01KH46P0C/,2,2
"Permatex 80070 Silicone Spray Lubricant, 10.25 oz. net Aerosol Can",Automotive Parts and Accessories,http://www.amazon.com/dp/B000HBM5S2/,2,1
Motorola MH230R 23-Mile Range 22-Channel FRS/GMRS Two-Way Radio (Pair),Speakers,http://www.amazon.com/dp/B001UE6MIO/,7,1
Gear Aid Tenacious Tape for Fabric Repair,Sports,http://www.amazon.com/dp/B0045CQELI/,1,1
"- Ranger Products Tire Changer with Wheel Protection Kit - 20in., Model# R-745",Automotive Parts and Accessories,http://www.amazon.com/dp/B0045CRSK4/,1,1
"TMS White Motocross Dirt Bike ATV MX BMX 7/8"" Brush Hand Guard for Suzuki DR DRZ DS RM RMZ RM80 Yamaha WR 250 400 426 450 Kawasaki KX KLX KDX 85 125 250 450",Automotive Parts and Accessories,http://www.amazon.com/dp/B005KKR2B0/,1,1
CruzTOOLS AW142227 14mm x 22mm x 27mm Combo Axle Wrench,Automotive Parts and Accessories,http://www.amazon.com/dp/B005U80C0K/,1,1
MadDog GearComfort Ride Seat Protector,Sports,http://www.amazon.com/dp/B006JMK7N8/,9,1
Valvoline Auto / Industrial Multi-Purpose Grease - 1lb (VV608),Automotive Parts and Accessories,http://www.amazon.com/dp/B000GAP43C/,1,1
Sena 3S Bluetooth Headset and Intercom for Scooters and Motorcycles (Full Face Helmet Kit),Automotive Parts and Accessories,http://www.amazon.com/dp/B00NBSHP2Y/,2,1
Ketofa ALL IN ONE GY6 50CC 125CC 150CC FLYWHEEL MAGNETO STARTER PULLER CHINESE SCOOTER,Automotive Parts and Accessories,http://www.amazon.com/dp/B00NDCIPVI/,1,1
"LE 20W Rechargeable Portable LED Work Light, 100W Halogen Bulb Equivalent, 1400lm, Adapter and Car Charger Included, Waterproof, Outdoor Floodlight",Home Improvement,http://www.amazon.com/dp/B00SF7BNPG/,2,1
"Nilight 2 X 10w Led Work Light Modular Spot Lamp Truck Light for Offroad Led Lights Truck Car ATV SUV Jeep Boat Driving Lamp,2 Years Warranty",Automotive Parts and Accessories,http://www.amazon.com/dp/B00WE47UR6/,1,1
Pellor Wrist Roller Exerciser Trainer Forearm Strength Exerciser,Sports,http://www.amazon.com/dp/B01CG2ZQD0/,1,1
"Morpilot 12V 4000mAh Extended NiMh Battery for Neato Botvac Series and Botvac D Series Robots Botvac 70e, 75, 80, 85 Robotic Vacuum Cleaner 945-0129 945-0174",Home,http://www.amazon.com/dp/B01FRTEWK2/,1,1
Kage Racing ST3401 Hitch Mounted Motorcycle and Dirt Bike Carrier Hauler Rack with Ramp,Automotive Parts and Accessories,http://www.amazon.com/dp/B00B7GHIGA/,2,1
Motion Pro 08-0161 Multi-Purpose Metric Tool,Automotive Parts and Accessories,http://www.amazon.com/dp/B000GTV1V2/,3,1
