name,category,amazon_link,total_mentions,subreddit_mentions
Dishwasher: One Man's Quest to Wash Dishes in All Fifty States (P.S.),Book,http://www.amazon.com/dp/0060896426/,3,1
True Blues Large Blue Ultimate Household Gloves,Kitchen,http://www.amazon.com/dp/B0000CFXSN/,1,1
Birki's Super Birki Unisex Clog,Shoes,http://www.amazon.com/dp/B000XDRJFI/,1,1
"San Jamar 614DVA Vinyl Dish Washing Apron with Heavy-Duty Braided Ties, 43"" Length, 12 Mil Thick, Clear",BISS,http://www.amazon.com/dp/B0037XKSI6/,1,1
"Merrell Men's Jungle Moc Pro Grip Work Shoe,Black,11 M US",Shoes,http://www.amazon.com/dp/B00ED7SVAC/,1,1
Innovative Dish Washing Net Cloths / Scourer - 100% Odor Free / Quick Dry - No More Sponges with Mildew Smell - Perfect Scrubber for Washing Dishes - 11 by 11 inches - 2PCS - Pink/Yellow,Home,http://www.amazon.com/dp/B00Q3K56C8/,1,1
"Best Clean Latex Free Vinyl Free Reusable Nitrile Dishwashing Gloves 15 Mils Thick for Maximum Dexterity and Durability, Small",Health and Beauty,http://www.amazon.com/dp/B01HC1UQ30/,1,1
