name,category,amazon_link,total_mentions,subreddit_mentions
American Weigh Scales LB-501 Digital Kitchen Scale,Home & Kitchen,https://www.amazon.com/gp/product/B005UGBG20/ref=oh_aui_detailpage_o01_s00?ie=UTF8&amp;psc=1,12,7
Glycerin Vegetable Kosher USP - 1 Quart (43 oz.),"Health, Household & Baby Care",https://www.amazon.com/gp/product/B004C7MTLA/ref=oh_aui_detailpage_o00_s00?ie=UTF8&amp;psc=1,9,3
Propylene Glycol 1 Quart - USP - KOSHER - PURE,Industrial & Scientific,https://www.amazon.com/Essential-Depot-Propylene-Glycol-Quart/dp/B005F5OJG6/ref=sr_1_1?ie=UTF8&amp;qid=1455111599&amp;sr=8-1&amp;keywords=essential+depot+propylene+glycol,5,2
"Vestil BTL-RC-8 Low Density Polyethylene (LDPE) Round Squeeze Dispensing Bottle with Removable Red Cap, 8 oz Capacity, Clear",Industrial & Scientific,https://www.amazon.com/gp/product/B00B5138SO?psc=1&amp;redirect=true&amp;ref_=oh_aui_detailpage_o00_s00,2,2
"American Weigh Digital Scale, 100g  [0.01g sensitivity]",Home & Kitchen,https://www.amazon.com/American-Weigh-0-01g-Digital-Scale/dp/B0012LOQUQ/ref=sr_1_1?ie=UTF8&amp;qid=1444206824&amp;sr=8-1&amp;keywords=.01g+scale,15,1
Giottos AA1900 Rocket Air Blaster Large - Black,Electronics,https://www.amazon.com/Giottos-AA1900-Rocket-Blaster-Large/dp/B00017LSPI/ref=sr_1_3?s=electronics&amp;ie=UTF8&amp;qid=1476129140&amp;sr=1-3&amp;keywords=camera+air+blower,9,1
Multi-Level Premium Quality Plastic Nail Polish Organizer | Bella Collection,Home & Kitchen,https://www.amazon.com/gp/product/B00FPOOJL2/ref=oh_aui_detailpage_o05_s01?ie=UTF8&amp;psc=1,3,1
"Norpro Stainless Steel Funnels, Set of 3",Home & Kitchen,https://www.amazon.com/gp/product/B000FKERMW/ref=oh_aui_search_detailpage?ie=UTF8&amp;th=1,2,1
Plastic Squeeze Condiment Bottles with Red Tip Cap 16-ounce Set of 6,Home & Kitchen,https://www.amazon.com/dp/B00OZOW6E0,2,1
"Plastic Transfer Pipettes 1ml, Graduated, Pack of 500",Industrial & Scientific,https://www.amazon.com/Plastic-Transfer-Pipettes-Graduated-Pack/dp/B005CD2I50/ref=sr_1_3?ie=UTF8&amp;qid=1455111474&amp;sr=8-3&amp;keywords=disposable+pipettes,2,1
"SET OF 2 -- 24 Oz. (Ounce) Large Clear Squeeze Bottle, Condiment Squeeze Bottle, Open-Tip, Screw-On Spout, Polyethylene Durable Plastic, Diner Style",Home & Kitchen,https://www.amazon.com/Squeeze-Condiment-Open-Tip-Polyethylene-Durable/dp/B009D9Z7TS/ref=pd_lpo_79_lp_t_3?ie=UTF8&amp;psc=1&amp;refRID=T3T74GR8F539XC8ZDWY9,1,1
"Oreo Golden Sandwich Cookies, Lemon Crème, 15.25 Ounce",Prime Pantry,https://www.amazon.com/Oreo-Sandwich-Cookies-15-25-Ounce-Package/dp/B00R2O4YJU,1,1
Glycerin Vegetable Kosher USP - 1 Gallon - 10.5 lbs. (168 oz.) - USP - KOSHER - Pharmaceutical Grade,Beauty & Personal Care,https://www.amazon.com/Glycerin-Vegetable-Kosher-USP-Gallon/dp/B00PSGWHIO/ref=sr_1_9_a_it?ie=UTF8&amp;qid=1457671736&amp;sr=8-9&amp;keywords=vegetable+glycerine,1,1
"Norpro Cordless Mini Mixer, 5 Piece Set",Home & Kitchen,https://www.amazon.com/Norpro-Cordless-Mini-Mixer-Piece/dp/B000E39LYO/ref=sr_1_fkmr1_1?ie=UTF8&amp;qid=1501917869&amp;sr=8-1-fkmr1&amp;keywords=norpro+wand+mixer,1,1
"Sharpie Peel-Off China Marker, White, 12-Count",Office Products,https://www.amazon.com/Sharpie-Peel-Off-China-Marker-12-Count/dp/B00006IFGG/ref=sr_1_1?ie=UTF8&amp;qid=1476132436&amp;sr=8-1&amp;keywords=white+china+marker,1,1
"Karter Scientific 206H2 3ml Grad Transfer Pipettes, Vol 7ml, 1/2ml Grads, 155mm, (Pack of 500)",Tools & Home Improvement,https://www.amazon.com/gp/product/B00207CO7I/ref=oh_aui_detailpage_o01_s00?ie=UTF8&amp;psc=1,1,1
"Vestil BTL-RC-8-LBL Low Density Polyethylene (LDPE) Round Graduated Dispensing Bottle with Label and Red Cap, 8 oz Capacity, Translucent",Industrial & Scientific,https://www.amazon.com/gp/product/B00B5139AG/ref=oh_aui_detailpage_o01_s00?ie=UTF8&amp;psc=1,1,1
"Loomy Bands 10000-Piece Rainbow Colored Loom Bands - 28 Colors with Kids Fidget Spinner, 500 Clips, 50 Beads, 15 Charms, 4 Hooks and Plastic Loom Band Storage Container",Toys & Games,https://www.amazon.com/gp/product/B00GVGVWAE/ref=ox_sc_sfl_title_2?ie=UTF8&amp;psc=1&amp;smid=AJS7HXJ9MGSD3,1,1
Coolrunner Stainless Steel Mini Funnel for Essential Oil Bottles / Flasks - Pack of 6,Industrial & Scientific,https://www.amazon.com/gp/product/B016D82NFC/ref=oh_aui_search_detailpage?ie=UTF8&amp;psc=1,1,1
SEOH GLASS FUNNEL Neutral glass 50 mm 50 mm stem,Industrial & Scientific,https://www.amazon.com/gp/product/B00191IZB0,1,1
"Vestil BTL-RC-4-LBL Low Density Polyethylene (LDPE) Round Graduated Dispensing Bottle with Label and Red Cap, 4 oz Capacity, Translucent",Industrial & Scientific,https://www.amazon.com/gp/product/B00B5136U4,1,1
10Pcs 150 x 3mm Stainless Steel Cylinder Linear Rail Round Rod Shaft,Tools & Home Improvement,https://www.amazon.com/gp/product/B00JR56KI0/ref=oh_aui_detailpage_o01_s00?ie=UTF8&amp;psc=1,1,1
Mini Digital Jewelry Pocket Kitchen Scale LCD (300g x 0.01g),Home & Kitchen,https://www.amazon.com/Digital-Jewelry-Pocket-Kitchen-Scale/dp/B00K74N9W0/ref=sr_1_9?ie=UTF8&amp;qid=1425905907&amp;sr=8-9&amp;keywords=scale+300+0.01,1,1
"South Shore Libra Collection 3-Drawer Chest, Dark Chocolate",Home & Kitchen,https://www.amazon.com/South-Shore-Collection-3-Drawer-Chocolate/dp/B002V9JIYM/ref=sr_1_1?s=furniture&amp;ie=UTF8&amp;qid=1433139682&amp;sr=1-1&amp;keywords=dresser,1,1
6pcs Plastic Drawer Closet Grid Divider Tidy Organizer Container Home Storage,Home & Kitchen,https://www.amazon.com/Plastic-Divider-Organizer-Container-Storage/dp/B00J9B2LNK/ref=pd_sim_sbs_201_4?ie=UTF8&amp;refRID=0ZW4R7J31TF2B7448Y91,1,1
Steelex D2610 4-Inch 275-Pound Swivel Double Lock Polyurethane Plate Caster,Tools & Home Improvement,https://www.amazon.com/Steelex-D2610-4-Inch-275-Pound-Polyurethane/dp/B0000DD1EG/ref=sr_1_9?ie=UTF8&amp;qid=1433139742&amp;sr=8-9&amp;keywords=4,1,1
"510 Central 30mL LDPE Plastic Thin Tip Dropper Bottles (25 Pack, Multi Color Caps)",Home & Kitchen,https://www.amazon.com/30mL-LDPE-Plastic-Bottle-Childproof/dp/B013IJ98MK/ref=sr_1_2?ie=UTF8&amp;qid=1464796453&amp;sr=8-2&amp;keywords=bottles+squeeze+30ml,1,1
"Lindt LINDOR Milk Chocolate Truffles ,120 Count",Grocery & Gourmet Food,https://www.amazon.com/Lindt-LINDOR-Chocolate-Truffles-Count/dp/B002RO70UK,1,1
"Vestil BTL-RC-16 Low Density Polyethylene (LDPE) Round Squeeze Dispensing Bottle with Removable Red Cap, 16 oz Capacity, Clear",Industrial & Scientific,https://www.amazon.com/gp/product/B00B5134FG/ref=oh_aui_detailpage_o09_s01?ie=UTF8&amp;psc=1,1,1
10ml Syringe Only with Luer Lock Tip - 100 Syringes by Care Touch (No needle),"Health, Household & Baby Care",https://www.amazon.com/dp/B01DARHDV8/,1,1
Badger Air-Brush Co. 121 Paint Mixer,"Arts, Crafts & Sewing",https://www.amazon.com/Badger-Air-Brush-Co-121-Paint/dp/B000BROV02/ref=sr_1_1?ie=UTF8&amp;qid=1456023537&amp;sr=8-1&amp;keywords=badger+mixer,1,1
