name,category,amazon_link,total_mentions,subreddit_mentions
Getting Started in Electronics,Book,http://www.amazon.com/dp/0945053282/,34,1
Make: FPGAs: Turning Software into Hardware with Eight Fun and Easy DIY Projects,Book,http://www.amazon.com/dp/145718785X/,1,1
Elenco  Electronic Playground 50-in-One,Toy,http://www.amazon.com/dp/B00000IUD2/,3,1
Snap Circuits SC-300 Electronics Discovery Kit,Toy,http://www.amazon.com/dp/B0000683A4/,8,1
Snap Circuits Extreme SC-750 Electronics Discovery Kit,Toy,http://www.amazon.com/dp/B0002AHQWS/,1,1
Plano 23700-02 Stowaway with Adjustable Dividers,Sports,http://www.amazon.com/dp/B000E3C3OE/,1,1
"Akro-Mils 10164 64 Drawer Plastic Parts Storage Hardware and Craft Cabinet, 20-Inch by 16-Inch by 6-1/2-Inch, Black",Home Improvement,http://www.amazon.com/dp/B000LDH3JC/,30,1
AOYUE 936 Soldering Station,Home Improvement,http://www.amazon.com/dp/B000VINMRO/,10,1
"Quality Park Coin and Small Parts Envelope, 2.25 x 3.5-inches, Brown Kraft, Pack of 500 (50162)",Office Product,http://www.amazon.com/dp/B000Y50ZD8/,2,1
"Plano Molding 1363 Stow N Go Toolbox, Graphite Gray and Sandstone",Home Improvement,http://www.amazon.com/dp/B001TH8P1E/,6,1
PetSafe Bolt Interactive Laser Cat Toy,Pet Products,http://www.amazon.com/dp/B0021L8W6K/,5,1
PC Internal Mini Onboard Speaker,Speakers,http://www.amazon.com/dp/B002W4M0DW/,16,1
"Belkin Conserve Socket Energy Saving Outlet with Timer, F7C009q",Speakers,http://www.amazon.com/dp/B003P2UMS0/,11,1
"iMAX B6 OEM Battery Balance Charger For 1-6 cell Lipo, Li-ion, LiFe (A123), Pb, 1-15 cells NiCd and NiMH Batteries",Toy,http://www.amazon.com/dp/B005EF15Q4/,17,1
"Edsyn Deluxe Soldapullt, Heavy Duty, High Vacuum, ESD",Home Improvement,http://www.amazon.com/dp/B006GOKVKI/,8,1
Hakko FX888D-23BY-Kit2 Bundle Includes Soldering Station and CHP170 cutter,BISS Basic,http://www.amazon.com/dp/B00AWUFVY8/,34,1
DROK Micro AC 110V 4000W Voltage Regulator SCR 110VAC Dimmer Speed Controller Temperature Governor Power Monitor Dimming Monitor,BISS,http://www.amazon.com/dp/B00BXUCWQG/,2,1
DROK V 3800W High Power Regulator SCR Adjustable Controller Dimmers Speed Controller Thermostat,Home Improvement,http://www.amazon.com/dp/B00CHEXKL8/,1,1
GC ELECTRONICS 560 FIBROID FISH PAPER ELECTRICAL INSULATION,BISS,http://www.amazon.com/dp/B00DJUHBIW/,1,1
"EBL 5000mAh Ni-MH Rechargeable C Batteries, 6 Pack",Speakers,http://www.amazon.com/dp/B00FHVP5OI/,1,1
"United Surgical Tens 7000 Tens Unit - Tens Machine for Pain Management, Back Pain and Rehabilitation",BISS,http://www.amazon.com/dp/B00NCRE4GO/,23,1
Sharpe Cutting Hook knife PCB Board Line Cutting Knife with 3 Blade,Wireless,http://www.amazon.com/dp/B00NNDBUCI/,1,1
Thermaltronics TMT-TC-2 Lead Free Tip Tinner (20g) in 0.8oz Container,Home Improvement,http://www.amazon.com/dp/B00NS4J6BY/,6,1
COOLEAD-5V 5W Camping USB Light Bulb Home Emergency Led Bulb (White),Home,http://www.amazon.com/dp/B00RVGMKL8/,1,1
SanDisk 64GB Connect Wireless Stick Flash Drive - SDWS4-064G-G46,Personal Computer,http://www.amazon.com/dp/B00ZCFYF2W/,6,1
"Bluetooth Adapter Receiver,URANT Car Kit Mini USB Wireless Audio Adapter Bluetooth Music Receiver & Adapter Home /Car Phone iPhone Stereo Speakers Headphones Car (AUX In) Music Sound System",Wireless,http://www.amazon.com/dp/B017CL98X4/,4,1
"Backup Camera and Monitor Kit for Car, Chuanganzhuo 5"" inch High Definition 800(RGB)x480 TFT LCD Monitor +170 degree Wide Angle License Plate Backup Camera",Car Audio or Theater,http://www.amazon.com/dp/B01AT4V0MS/,1,1
Elegoo UNO Project Super Starter Kit with Tutorial for Arduino,BISS Basic,http://www.amazon.com/dp/B01D8KOZF4/,22,1
RGBZONE DC12V 24V PIR Sensor LED Dimmer Switch Motion Function Cotroller for 5050 3528 5630 Flexible LED Strips Light,Home,http://www.amazon.com/dp/B01E3NFOIW/,3,1
"Inateck USB 3.0 to SATA Adapter Cable for 2.5"" SSD/HDD Drives - SATA to USB 3.0 External Converter and Cable(UA1002)",PC Accessory,http://www.amazon.com/dp/B01E4VHSYG/,2,1
Hongbous Nitecore i2 Intellicharge Charger for 18650 AAA AA Li-Ion/NiMH Battery,Home Improvement,http://www.amazon.com/dp/B01F04ZWFI/,2,1
"Cordking 3 Feet 3.5mm audio cable a minute second,RCA Cable Male to Male,3.5mm turn double lotus audio cable for Headphones, Computer speakers, Car Stereo and More - Black",Speakers,http://www.amazon.com/dp/B06Y2PZ5W4/,1,1
