name,category,amazon_link,total_mentions,subreddit_mentions
The Dinosaur Lords: A Novel,Book,http://www.amazon.com/dp/0765332965/,3,1
Grimtooth's Ultimate Traps Collection - Softcover,Book,http://www.amazon.com/dp/0996181318/,1,1
Manual of the Planes (Dungeon & Dragons d20 3.0 Fantasy Roleplaying),Book,http://www.amazon.com/dp/0786918500/,1,1
Halls of Undermountain: A 4th Edition Dungeons & Dragons Supplement,Book,http://www.amazon.com/dp/0786959940/,1,1
"Expedition to Undermountain (Dungeons & Dragons d20 3.5 Fantasy Roleplaying, Adventure)",Book,http://www.amazon.com/dp/078694157X/,1,1
Hape Happy Harp Kid's Wooden Musical Instrument,Toy,http://www.amazon.com/dp/B00IHZYWE0/,1,1
Roots of Evil (AD&D: Ravenloft Adventure RM1),Book,http://www.amazon.com/dp/1560765976/,1,1
