name,category,amazon_link,total_mentions,subreddit_mentions
"Archival Storytelling: A Filmmaker's Guide to Finding, Using, and Licensing Third-Party Visuals and Music",Book,http://www.amazon.com/dp/0240809734/,1,1
Directing the Documentary,Book,http://www.amazon.com/dp/0240810899/,1,1
The Shut Up and Shoot Documentary Guide: A Down & Dirty DV Production,Book,http://www.amazon.com/dp/0240824156/,1,1
Samson BT4 Telescoping Boom Stand,Musical Instruments,http://www.amazon.com/dp/B0002ORP8O/,1,1
Audio-Technica ATR-6550 Video Camera Condenser Shotgun Microphone,Musical Instruments,http://www.amazon.com/dp/B002GYPS3M/,4,1
Canon EOS Rebel T2i 18 MP CMOS APS-C Sensor DIGIC 4 Image Processor Full-HD Movie Mode Digital SLR Camera and EF-S 18-135mm f/3.5-5.6 IS UD Standard Zoom Lens (Discontinued by Manufacturer),Photography,http://www.amazon.com/dp/B003MAKXMA/,1,1
Zoom H1 Handy Portable Digital Recorder,Musical Instruments,http://www.amazon.com/dp/B003QKBVYK/,42,1
Sandbag Sandbags Photography Sandbag Studio Video Equipment Sandbag Sand Bag Saddle Bag for boom stand tripod By Fancierstudio Blue Black Sandbag,Photography,http://www.amazon.com/dp/B003TYDN1C/,1,1
Fancierstudio Light Kit 3 Point Lighting Kit Fluorescent Lighting Kit Umbrella Kit,Photography,http://www.amazon.com/dp/B003Y31FHC/,3,1
"ASUS VS228H-P 21.5"" Full HD 1920x1080 HDMI DVI VGA Back-lit LED Monitor",Personal Computer,http://www.amazon.com/dp/B005BZNDOO/,25,1
"Neewer Acrylic Plastic 10x8""/25x20cm Director's Film Clapboard Cut Action Scene Clapper Board Slate with Color Sticks",Photography,http://www.amazon.com/dp/B00S4QRBZY/,2,1
