name,category,amazon_link,total_mentions,subreddit_mentions
"Doctor Who, Season 9",TV Series Season Video on Demand,http://www.amazon.com/dp/B014CRQIMA/,3,2
Doctor Who: The 50th Anniversary Collection,TV Series Season Video on Demand,http://www.amazon.com/dp/B00G21YLF6/,2,2
Doctor Who: Four Doctors,Book,http://www.amazon.com/dp/1782765964/,2,2
LEGO Ideas Doctor Who 21304 Building Kit,Toy,http://www.amazon.com/dp/B00ZSJMBHS/,3,2
chain supply Doctor Who Silicone Ice Cube Tray Tardis & Daleks,Kitchen,http://www.amazon.com/dp/B00T14X6TS/,2,2
Doctor Who: Engines of War (Doctor Who (BBC)),Book,http://www.amazon.com/dp/0553447661/,2,2
Doctor Who: Summer Falls,eBooks,http://www.amazon.com/dp/B00BGC6GG8/,3,2
Doctor Who: The Vault: Treasures from the First 50 Years,Book,http://www.amazon.com/dp/0062280635/,2,2
The Official Doctor Who Classic Edition 2016 Square Calendar,Book,http://www.amazon.com/dp/1780548265/,1,1
DOCTOR WHO: EARTHWORLD,Book,http://www.amazon.com/dp/1849905207/,1,1
DOCTOR WHO: TALES OF TRENZALORE: The Eleventh Doctor's Last Stand (Doctor Who (BBC)),Book,http://www.amazon.com/dp/1849908443/,1,1
"""Doctor Who"": Endgame: Vol. 1: The Complete Eighth Doctor Comic Strips",Book,http://www.amazon.com/dp/1905239092/,1,1
Doctor Who: The Glorious Dead (Doctor Who (Panini Comics)) (v. 2),Book,http://www.amazon.com/dp/1905239440/,1,1
Doctor Who: Oblivion (Complete Eighth Doctor Comic Strips; Doctor Who a Panini Boo) (v. 3),Book,http://www.amazon.com/dp/1905239459/,1,1
Doctor Who: The Flood (v. 4),Book,http://www.amazon.com/dp/1905239653/,1,1
Doctor Who: Voyager (Doctor Who (Panini Comics)) (v. 1),Book,http://www.amazon.com/dp/1905239718/,1,1
Doctor Who: The World Shapers,Book,http://www.amazon.com/dp/1905239874/,1,1
Doctor Who - The Tom Baker Years [VHS],Video,http://www.amazon.com/dp/6302665191/,1,1
"Tigi Bed Head Hair Stick, 2.7 Ounce",Beauty,http://www.amazon.com/dp/B000141L58/,3,1
Doctor Who: The Two Doctors (Story 141),DVD,http://www.amazon.com/dp/B0001GF24W/,1,1
"Rothco Kids Ranger Vest, Black, Medium",Sports,http://www.amazon.com/dp/B00024EZPK/,1,1
Doctor Who - The Tenth Doctor's Sonic Screwdriver,Toy,http://www.amazon.com/dp/B0009P5YXO/,1,1
Doctor Who: Genesis of the Daleks [Region 2],DVD,http://www.amazon.com/dp/B000EGCD5A/,1,1
Doctor Who: Genesis of the Daleks (Story 78),DVD,http://www.amazon.com/dp/B000EMG918/,1,1
British Police Woman Set,Apparel,http://www.amazon.com/dp/B000LWGG8C/,1,1
"Tigi Bed Head Hard To Get Paste, 1.5 Ounce",Beauty,http://www.amazon.com/dp/B000UTNW3I/,3,1
Apoxie Sculpt 1 Lb. White,Office Product,http://www.amazon.com/dp/B0013UDWXI/,18,1
Doctor Who: The Five Doctors (Story 130) (25th Anniversary Edition),DVD,http://www.amazon.com/dp/B0017XOFGE/,1,1
Doctor Who: The Complete Fourth Series,DVD,http://www.amazon.com/dp/B001DJ7PQ4/,1,1
Doctor Who: The Key to Time (Special Collector's Edition) (Stories 98-103),DVD,http://www.amazon.com/dp/B001K2KM9Q/,1,1
Doctor Who: The Deadly Assassin (Story 88),DVD,http://www.amazon.com/dp/B001QCWQ58/,1,1
Doctor Who: The Complete Specials (The Next Doctor / Planet of the Dead / The Waters of Mars / The End of Time Parts 1 and 2) [Blu-ray],DVD,http://www.amazon.com/dp/B002ZHKZEC/,1,1
Doctor Who: The Complete Specials (The Next Doctor / Planet of the Dead / The Waters of Mars / The End of Time Parts 1 and 2),DVD,http://www.amazon.com/dp/B002ZHKZEM/,1,1
Doctor Who: The Complete Fifth Series [Blu-ray],DVD,http://www.amazon.com/dp/B003EV6DBW/,1,1
Voyage Of The Damned,TV Series Episode Video on Demand,http://www.amazon.com/dp/B003KLGKAA/,1,1
Doctor Who Season 1,TV Series Season Video on Demand,http://www.amazon.com/dp/B003LQ3YXU/,1,1
Doctor Who Exploding Tardis TV Poster Print,Home,http://www.amazon.com/dp/B004CSWUQ8/,1,1
Hopping Jumping chipmunk squirrel Collectible Vintage Wind-Up Tin toy NEW Box,Toy,http://www.amazon.com/dp/B004M97CLK/,1,1
Talking Stress Ball - Relax,Toy,http://www.amazon.com/dp/B004QFG7PW/,1,1
Doctor Who - Personalize Your Own Sonic Screwdriver - Over 80 Combinations,Toy,http://www.amazon.com/dp/B0056EO5IS/,1,1
Doctor Who: The Complete Sixth Series [Blu-ray],DVD,http://www.amazon.com/dp/B005M2A4DE/,1,1
Doctor Who - Exploding Tardis Poster 36 x 24in,Home,http://www.amazon.com/dp/B006BEC9HG/,1,1
Doctor Who Tardis Table Lamp,Home Improvement,http://www.amazon.com/dp/B008PUPGTC/,1,1
"Doctor Who Dalek to Victory TV Television Show Ceramic Boxed Gift Coffee (Tea, Cocoa) 11 Oz. Mug",Kitchen,http://www.amazon.com/dp/B00A9VWVCU/,1,1
"Doctor Who Kurt Adler Battery-Operated 120mm Lighted Water Globe, Doctor Who Tardis",Home,http://www.amazon.com/dp/B00BLM2DR4/,1,1
Doctor Who TARDIS Acrylic Cup with Straw,Kitchen,http://www.amazon.com/dp/B00BOZ95K6/,1,1
"(2x) Christian Dalek Fish Auto Emblem Decal Vinyl Sticker (White 7"" CD-0345)",Automotive Parts and Accessories,http://www.amazon.com/dp/B00BROD3IY/,2,1
"Doctor Who Season 7, Pt. 2",TV Series Season Video on Demand,http://www.amazon.com/dp/B00BW7CCAG/,1,1
Doctor Who Other Ride Is a Tardis Car Magnet,Sports,http://www.amazon.com/dp/B00C3M4KMM/,1,1
Doctor Who: The Complete Seventh Series (Blu-ray),DVD,http://www.amazon.com/dp/B00C6ACVLI/,1,1
Doctor Who: Spearhead from Space (Story 51) Blu-ray Edition,DVD,http://www.amazon.com/dp/B00C6ACWZ8/,1,1
Doctor Who: Series 1-7 Limited Edition Blu-ray Giftset,DVD,http://www.amazon.com/dp/B00DYAE2IY/,1,1
Doctor Who - Disappearing TARDIS Coffee Mug - Add Hot Liquid and Watch The TARDIS Move From London to the Stars - Comes in a Fun Gift Box - by The Unemployed Philosophers Guild,Kitchen,http://www.amazon.com/dp/B00ESHMQ8K/,1,1
Doctor Who Sonic Screwdriver (10th Doctor) - Programmable Universal Remote Control - Collectible Prop Replica With Display Case,Speakers,http://www.amazon.com/dp/B00EU7XW7C/,1,1
Doctor Who 50th Anniversary Special: The Day of the Doctor (Blu-ray 3D / Blu-ray / DVD Combo),DVD,http://www.amazon.com/dp/B00FAVRHBE/,1,1
Doctor Who TARDIS Silicone Gelatin Mold Set of 2 - 1 cup size,Kitchen,http://www.amazon.com/dp/B00FPB7DEA/,1,1
Dr Who Sonic Screwdriver Pizza Cutter (DR248),Kitchen,http://www.amazon.com/dp/B00GQPCCVS/,1,1
Doctor Who: The Time of the Doctor,TV Series Season Video on Demand,http://www.amazon.com/dp/B00H8C5MCE/,1,1
Doctor Who: The Time of the Doctor (Blu-ray),DVD,http://www.amazon.com/dp/B00HCK7ZMM/,1,1
Doctor Who: The Complete Sixth Series (Blu-ray),DVD,http://www.amazon.com/dp/B00HETFP2S/,1,1
Doctor Who: An Adventure in Space and Time (DVD+Blu-ray Combo),DVD,http://www.amazon.com/dp/B00ISSF7S6/,1,1
Doctor Who: Season 8 [Blu-ray],DVD,http://www.amazon.com/dp/B00IT3KQWM/,2,1
Doctor Who Sonic Screwdriver Bottle Opener with Sound Effects,Toy,http://www.amazon.com/dp/B00LB2XSWI/,1,1
Doctor Who Season 8,TV Series Season Video on Demand,http://www.amazon.com/dp/B00MASEPTC/,2,1
"HATCHBOX 3D PLA-1KG1.75-SLV PLA 3D Printer Filament, Dimensional Accuracy +/- 0.05 mm, 1 kg Spool, 1.75 mm, Silver",BISS,http://www.amazon.com/dp/B00MEZEEJ2/,1,1
Deep Breath,TV Series Episode Video on Demand,http://www.amazon.com/dp/B00MWA6WNK/,1,1
"Retro Rewind Classic Polarized Sunglasses (Black | Smoke Polarized, 52)",Apparel,http://www.amazon.com/dp/B00NWJ1OV0/,2,1
Doctor Who Sonic Screwdriver Washing Brush - Dr Who Cleaning Kitchen Tool w/ Handle - 7.5 inch,Kitchen,http://www.amazon.com/dp/B00Q7T3X5M/,1,1
Verbatim Blu Ray Cases Bulk (30 Pack) 98603,Speakers,http://www.amazon.com/dp/B00QTDU20U/,2,1
Doctor Who: Series 1-7 Limited Edition Blu-ray Giftset by BBC Home Entertainment,DVD,http://www.amazon.com/dp/B00UGQMA3S/,2,1
Doctor Who: 12 Doctors 12 Stories,eBooks,http://www.amazon.com/dp/B00XQGTSYO/,1,1
Doctor Who Sonic Screwdriver BBQ Tongs with Sounds - Barbecue In Time and Space,Lawn & Patio,http://www.amazon.com/dp/B00YFFSWME/,1,1
Ripple Junction Doctor Who Tardis And The Sonic Printed Fleece XL Royal,Apparel,http://www.amazon.com/dp/B00YFU7FSQ/,1,1
"Joyoldelf Doctor Who Silicone Ice Cube Tray and Chocolate,Candy,Cookies Mold Maker - Tardis and Daleks",Kitchen,http://www.amazon.com/dp/B013JNDH6I/,2,1
Doctor Who - Series 3 [Blu-ray],DVD,http://www.amazon.com/dp/B013WN2M48/,1,1
"Samsung DVD-E360 Multi-Region Free DVD Player with USB, PAL/NTSC",Home Theater,http://www.amazon.com/dp/B0145QN4F2/,1,1
Doctor Who - Season 2 [Blu-ray],DVD,http://www.amazon.com/dp/B0153RTYIS/,1,1
Doctor Who - Season 4 [Blu-ray],DVD,http://www.amazon.com/dp/B0153S5544/,1,1
Doctor Who: Time Lord Fairy Tales,eBooks,http://www.amazon.com/dp/B017F64368/,2,1
Heaven Sent,TV Series Episode Video on Demand,http://www.amazon.com/dp/B018MSRB4O/,1,1
Doctor Who: Complete Series 9 [Blu-ray],DVD,http://www.amazon.com/dp/B018V1ZWW0/,1,1
Doctor Who: The Legends of Ashildr,eBooks,http://www.amazon.com/dp/B018Y37A7A/,1,1
Doctor Who - Series 9 Complete [Blu-ray] [Import anglais],DVD,http://www.amazon.com/dp/B019N4K10C/,1,1
Doctor Who: The Complete First Series [Blu-ray],DVD,http://www.amazon.com/dp/B01A53Q9LU/,1,1
Doctor Who: The Complete Second Series [Blu-ray],DVD,http://www.amazon.com/dp/B01A53T11U/,1,1
Doctor Who: The Power of the Daleks,DVD,http://www.amazon.com/dp/B01LTHYIAU/,2,1
"Doctor Who Tardis Wooden Jewelry Box with Drawers, Hooks and Ring Inserts",Home,http://www.amazon.com/dp/B01LZZ9CZG/,1,1
Doctor Who: The Return of Doctor Mysterio,TV Series Season Video on Demand,http://www.amazon.com/dp/B01MQOFKRV/,1,1
"Baby Boys Doctor Who 'Future Timelord'Footless Sleepsuit, White Blue, (0-3 Months)",Apparel,http://www.amazon.com/dp/B01MSQXKVB/,1,1
"Doctor Who, Season 10",TV Series Season Video on Demand,http://www.amazon.com/dp/B06XPTWTGN/,1,1
"Doctor Who: 12 Doctors, 12 Stories",Book,http://www.amazon.com/dp/0141359889/,1,1
Dr. Who: The Colouring Book (Doctor Who),Book,http://www.amazon.com/dp/0141367385/,1,1
Doctor Who: Cybermen,Book,http://www.amazon.com/dp/0352327383/,1,1
The Discontinuity Guide (Doctor Who),Book,http://www.amazon.com/dp/0426204425/,1,1
Doctor Who: Illustrated A-Z,Book,http://www.amazon.com/dp/0491034849/,1,1
Dr Who Roleplaying Game,Book,http://www.amazon.com/dp/0857442627/,1,1
Grande Illusions: Books I & II,Book,http://www.amazon.com/dp/0988446898/,2,1
