name,category,amazon_link,total_mentions,subreddit_mentions
Moneyball: The Art of Winning an Unfair Game,Book,http://www.amazon.com/dp/0393324818/,5,1
"Sony ICF-S10MK2 Pocket AM/FM Radio, Silver",Speakers,http://www.amazon.com/dp/B00020S7XK/,2,1
The Kid Who Only Hit Homers (Matt Christopher Sports Classics),Book,http://www.amazon.com/dp/0316139874/,2,1
"MLB Los Angeles Dodgers Player Ugly Sweater, X-Large",Sports,http://www.amazon.com/dp/B013708SC6/,1,1
100 Things Dodgers Fans Should Know & Do Before They Die (100 Things...Fans Should Know),Book,http://www.amazon.com/dp/1600788041/,1,1
Baseball Between the Numbers: Why Everything You Know About the Game Is Wrong,Book,http://www.amazon.com/dp/0465005470/,1,1
The Best Team Money Can Buy: The Los Angeles Dodgers’ Wild Struggle to Build a Baseball Powerhouse,Book,http://www.amazon.com/dp/1476776296/,1,1
"Bissell 38"" Deluxe Triple Brush Push Power Sweeper Turbo, 13.2 Gal. Capacity",BISS,http://www.amazon.com/dp/B016CZJLDS/,1,1
