name,category,amazon_link,total_mentions,subreddit_mentions
Dogecoin - History of the First Year,Book,http://www.amazon.com/dp/1519667353/,3,3
Asshole No More; The Original Self-Help Guide for Recovering Assholes and Their Victims,Book,http://www.amazon.com/dp/0898048044/,5,1
Shiba Inu Calendar - Breed Specific Shiba Inu Calendar - 2015 Wall calendars - Dog Calendars - Monthly Wall Calendar by Avonside,Book,http://www.amazon.com/dp/1782082379/,1,1
The Lean Startup: How Today's Entrepreneurs Use Continuous Innovation to Create Radically Successful Businesses,eBooks,http://www.amazon.com/dp/B004J4XGN6/,6,1
"Perler PBB80-19-19062 Fun Fusion Bead, Turquoise, 1000-Pack",Art and Craft Supply,http://www.amazon.com/dp/B00B2AYI50/,1,1
AutoExec Wheelmate Steering Wheel Attachable Work Surface Tray,Automotive Parts and Accessories,http://www.amazon.com/dp/B00E1D1GY6/,22,1
Sabrent Ultra Slim USB 2.0 to 2.5-Inch SATA External Aluminum Hard Drive Enclosure [Black] (EC-UK25),Personal Computer,http://www.amazon.com/dp/B00E362W9O/,23,1
"StarTech USB 3.0 to 2.5"" SATA III Hard Drive Adapter Cable w/ UASP - SATA to USB 3.0 Converter for SSD/HDD",Personal Computer,http://www.amazon.com/dp/B00HJZJI84/,100,1
Ledger Wallet Nano Bitcoin Security Card (Ledger Wallet Nano),Personal Computer,http://www.amazon.com/dp/B00UA47IIS/,5,1
"Mountain Dew, Kickstart, Pineapple Orange Mango, 12 Oz (12 Pack)",Grocery,http://www.amazon.com/dp/B00UU7A80A/,1,1
"New & Improved! 4 Locks & 1 Key - Vanguard Safety Magnetic Cabinet Locks - Self Sticking 3M Adhesive for Cabinets & Drawers - Drill-Free Easy Installation, Ideal for Home Safety",Baby Product,http://www.amazon.com/dp/B00ZWDURWQ/,1,1
KeepKey: the Simple Cryptocurrency Hardware Wallet,Personal Computer,http://www.amazon.com/dp/B0143M2A5S/,4,1
Miyaya@ Funny Doge Dog Animal Head Mask for Mask Festival、halloween、easter or Dance Party,Toy,http://www.amazon.com/dp/B014U5GBG2/,1,1
CreepyParty Deluxe Novelty Halloween Costume Party Latex Animal Dog Head Mask (Shiba),Toy,http://www.amazon.com/dp/B017OZL1CY/,1,1
"QueenAcc 15000mAh Solar Charger, Solar Power Bank with LED Flashlight Portable Charger, Backup Solar Power Pack, Dual USB Port Solar Battery Charger for Smart phones and Other USB Devices(orange)",Wireless,http://www.amazon.com/dp/B01J9VU7SU/,1,1
"Indonesia, Etc.: Exploring the Improbable Nation",Book,http://www.amazon.com/dp/0393088588/,2,1
Mens Doge Coin T Shirt - Do you even DOGE Tshirt - Dogecoin 2XL Royal Blue,Apparel,http://www.amazon.com/dp/B071RL14KK/,1,1
