name,category,amazon_link,total_mentions,subreddit_mentions
KONG Wobbler Treat Dispensing Dog Toy,Pet Supplies,https://www.amazon.com/KONG-Wobbler-Treat-Dispensing-Large/dp/B003ALMW0M/ref=sr_1_1?s=pet-supplies&amp;ie=UTF8&amp;qid=1462224869&amp;sr=1-1&amp;keywords=kong+wobbler,9,3
Mine! A Practical Guide to Resource Guarding in Dogs,Books,https://www.amazon.com/Mine-Practical-Guide-Resource-Guarding/dp/0970562942/ref=sr_1_1?ie=UTF8&amp;qid=1494247096&amp;sr=8-1&amp;keywords=mine,6,3
PetSafe Busy Buddy Tug-A-Jug Meal Dispensing Dog Toy,Pet Supplies,https://www.amazon.com/PetSafe-Buddy-Dispensing-Medium-Large/dp/B000KV7ZGQ/ref=pd_sim_199_2?ie=UTF8&amp;dpID=41dWL2,5,3
The Puppy Primer,Books,https://www.amazon.com/Puppy-Primer-Patricia-B-McConnell/dp/1891767135/ref=sr_1_1?ie=UTF8&amp;qid=1467317278&amp;sr=8-1&amp;keywords=patricia+mcconnell,4,3
Walky Dog Plus Hands Free Dog Bicycle Exerciser Leash 2017 Newest Model with 550-lbs pull strength Paracord Leash Military Grade,Pet Supplies,https://www.amazon.com/Walky-Dog-Exerciser-strength-Paracord/dp/B003OYIAW4,4,3
The Other End of the Leash: Why We Do What We Do Around Dogs,Books,https://www.amazon.com/The-Other-End-Leash-Around/dp/034544678X,7,2
When Pigs Fly!: Training Success with Impossible Dogs,Books,https://www.amazon.com/When-Pigs-Fly-Training-Impossible/dp/1929242441,7,2
Musher's Secret Pet Paw Protection Wax,Pet Supplies,https://www.amazon.com/Mushers-Secret-Pet-Paw-Protection/dp/B0002XIZXY/ref=sr_1_1?ie=UTF8&amp;qid=1421280096&amp;sr=8-1&amp;keywords=mushers+secret,7,2
"Behavior Adjustment Training 2.0: New Practical Techniques for Fear, Frustration, and Aggression in Dogs",Books,https://www.amazon.com/Behavior-Adjustment-Training-2-0-Frustration/dp/1617811742/ref=pd_sbs_14_t_1?_encoding=UTF8&amp;psc=1&amp;refRID=C6GBRWSYCYK7TG19B821,6,2
Squishy Face Studio Flirt Pole V2 with Braided Fleece Lure - Durable Dog Toy for Fun Obedience Training & Exercise,Pet Supplies,https://www.amazon.com/Squishy-Face-Studio-Exercise-Squeaker/dp/B00HFFXEWE/ref=sr_1_1?ie=UTF8&amp;qid=1495198256&amp;sr=8-1&amp;keywords=flirt+pole,5,2
Wisdom Panel 3.0 Breed Identification DNA Test Kit,Pet Supplies,https://www.amazon.com/dp/B01EHX2BH0/ref=cm_sw_r_cp_api_pLeGyb9WDHQ1T,5,2
The Cautious Canine-How to Help Dogs Conquer Their Fears,Books,https://www.amazon.com/Cautious-Canine-How-Conquer-Their-Fears/dp/1891767003/ref=sr_1_5?ie=UTF8&amp;qid=1487003881&amp;sr=8-5&amp;keywords=fearful+dog,5,2
Dog Food Logic: Making Smart Decisions for Your Dog in an Age of Too Many Choices,Books,https://www.amazon.com/gp/product/1617811386/ref=as_li_tl?ie=UTF8&amp;camp=1789&amp;creative=390957&amp;creativeASIN=1617811386&amp;linkCode=as2&amp;tag=tylerbicom-20&amp;linkId=GT4RJ3YDLQFBNT7U,4,2
HALT Dog Repellant Spray,"Patio, Lawn & Garden",https://www.amazon.com/HALT-91427-Dog-Repellant-Spray/dp/B001AZMH46,4,2
How to Behave So Your Dog Behaves,Books,https://www.amazon.com/gp/product/0793806445/ref=pd_lpo_sbs_dp_ss_1?pf_rd_p=1944579842&amp;pf_rd_s=lpo-top-stripe-1&amp;pf_rd_t=201&amp;pf_rd_i=0964151871&amp;pf_rd_m=ATVPDKIKX0DER&amp;pf_rd_r=1MMDTS9TNB1S9R9FG3HK,4,2
Kong Classic Dog Toy,Pet Supplies,https://www.amazon.com/KONG-Classic-Dog-Toy-Large/dp/B0002AR0I8/ref=sr_1_1?ie=UTF8&amp;qid=1422202981&amp;sr=8-1&amp;keywords=kong,4,2
Dremel 7300-PT 4.8V Pet Nail Grooming Tool,Tools & Home Improvement,https://www.amazon.com/Dremel-7300-PT-4-8-Volt-Pet-Grooming/dp/B003TU0XG4,4,2
Perfect Puppy in 7 Days: How to Start Your Puppy Off Right,Books,https://www.amazon.com/Perfect-Puppy-Days-Start-Right/dp/0964151871/ref=sr_1_7?s=books&amp;ie=UTF8&amp;qid=1484615330&amp;sr=1-7&amp;keywords=puppy,4,2
Omega Paw Tricky Treat Ball,Pet Supplies,https://www.amazon.com/Omega-Paw-Tricky-Treat-Large/dp/B0002DK26M/ref=sr_1_2?s=pet-supplies&amp;ie=UTF8&amp;qid=1454639864&amp;sr=1-2&amp;keywords=treat+ball,4,2
PetSafe Gentle Leader Head Collar with Training DVD,Pet Supplies,https://www.amazon.com/PetSafe-Gentle-Leader-Headcollar-Large/dp/B00074L4W2/ref=sr_1_1?ie=UTF8&amp;qid=1457620654&amp;sr=8-1&amp;keywords=dog+leash+gentle+leader,3,2
Slopper Stopper Dripless Water Bowl for Dogs and Cats,Pet Supplies,https://www.amazon.com/Slopper-Stopper-Dripless-Water-Bowl/dp/B009VNMP50,3,2
"Fired Up, Frantic, and Freaked Out: Training the Crazy Dog from Over the Top to Under Control",Books,https://www.amazon.com/Fired-Up-Frantic-Freaked-Out/dp/0985934921/ref=pd_sim_14_2?ie=UTF8&amp;dpID=51-HL-RzqcL&amp;dpSrc=sims&amp;preST=_AC_UL160_SR107,3,2
Control Unleashed: Creating a Focused and Confident Dog,Books,https://www.amazon.com/Control-Unleashed-Creating-Focused-Confident/dp/B000UCF53A/ref=sr_1_1?ie=UTF8&amp;qid=1467291704&amp;sr=8-1&amp;keywords=control+unleashed,3,2
Redbarn Pet Products Food Roll,Pet Supplies,https://www.amazon.com/Redbarn-Pet-Products-Weight-Pounds/dp/B00008DFOG,3,2
Pawz Water-Proof Dog Boot,Pet Supplies,https://www.amazon.com/Pawz-Water-Proof-Boot-Small-2-Inch/dp/B001J22876/ref=sr_1_1?ie=UTF8&amp;qid=1421280134&amp;sr=8-1&amp;keywords=pawz,3,2
K-9 Break Stick,Pet Supplies,https://www.amazon.com/The-K-9-Center-Break-Stick/dp/B004RU81VY,2,2
Trixie Pet Products,Pet Supplies,https://www.amazon.com/Trixie-Gambling-Tower-Level-1/dp/B002XCTUIQ/ref=sr_1_38?ie=UTF8&amp;qid=1469997634&amp;sr=8-38&amp;keywords=interactive+dog+toys,2,2
"KONG Chase-It Wand Squeaking Dog Toy, Assorted Characters",Pet Supplies,https://www.amazon.com/KONG-Chase--Squeaking-Assorted-Characters/dp/B00AEJANCW/ref=sr_1_4?ie=UTF8&amp;qid=1447220131&amp;sr=8-4&amp;keywords=flirt+pole,2,2
Fight!: A Practical Guide to the Treatment of Dog-dog Aggression,Books,https://www.amazon.com/Fight-Practical-Treatment-Dog-dog-Aggression/dp/0970562969/ref=redir_mobile_desktop?_encoding=UTF8&pc_redir=T1,2,2
"MidWest Homes for Pets Foldable Metal Exercise Pen / Pet Playpen, 8 Panels Each",Pet Supplies,https://www.amazon.com/dp/B002908DX0/ref=cm_sw_r_cp_api_ErCLzbXNS8M12,2,2
JW Ruffians Treat Puzzler Amaze-A-Ball,Pet Supplies,https://www.amazon.com/dp/B00106WXSA/ref=twister_B00XEW4V6U,2,2
K&H Manufacturing Self-Warming Pet Cot - Chocolate/Fleece,Pet Supplies,https://www.amazon.com/Manufacturing-Self-Warming-Fleece-30-Inch-42-Inch/dp/B00KCNUMJY/ref=sr_1_1?ie=UTF8&amp;qid=1485294723&amp;sr=8-1&amp;keywords=self+warming+pet+cot+bed,2,2
"Tail Teaser Dog Toys Squeak Toy Exercise Training Toy with Replacement Squeaker by Outward Hound, Colors may vary",Pet Supplies,https://www.amazon.com/Outward-Hound-41001-Exercise-Replacement/dp/B0042I5G2I/ref=sr_1_2?ie=UTF8&amp;qid=1465406968&amp;sr=8-2&amp;keywords=flirt+pole,2,2
Busy Buddy Magic Mushroom Dog Toy,Pet Supplies,https://www.amazon.com/PetSafe-Buddy-Mushroom-Dispensing-Medium/dp/B00520EJXW,2,2
"Ruffwear - Web Master Secure, Reflective, Multi-Use Harness for Dogs",Home & Kitchen,https://www.amazon.com/Web-Master-Harness-Medium-Currant/dp/B005OTY7A6/ref=sr_1_1?s=home-garden&amp;ie=UTF8&amp;qid=1461692533&amp;sr=8-1&amp;keywords=ruffwear+webmaster,2,2
Petstages Dogwood Natural Wood Flavored Dog Chew Toy,Pet Supplies,https://www.amazon.com/Petstages-219-Dogwood-Stick-Large/dp/B007R1BN56/ref=sr_1_1?ie=UTF8&amp;qid=1455629951&amp;sr=8-1&amp;keywords=stick+dog+toy,2,2
"Bissell Pet Hair Eraser Handheld Vacuum, Corded, 33A1",Home & Kitchen,https://www.amazon.com/gp/product/B001EYFQ28/ref=oh_aui_detailpage_o02_s00?ie=UTF8&amp;psc=1,2,2
Coolaroo Elevated Pet Bed with Knitted Fabric,Pet Supplies,https://www.amazon.com/Original-Elevated-Pet-Bed-Coolaroo/dp/B000P7JKD6/ref=sr_1_1?ie=UTF8&amp;qid=1485294533&amp;sr=8-1&amp;keywords=cot+dog+bed,7,1
Outward Hound Fun Feeder Slow Feed Interactive Bloat Stop Dog Bowl,Pet Supplies,https://www.amazon.com/Outward-Hound-Feeder-Bloat-Large/dp/B00FPKNRF0/ref=sr_1_5?s=pet-supplies&amp;ie=UTF8&amp;qid=1490198534&amp;sr=1-5&amp;keywords=dog+food+bowl,5,1
Baskerville 5-Inch Rubber Ultra Muzzle,Pet Supplies,https://www.amazon.com/Baskerville-2-Inch-Rubber-Muzzle-Size-5/dp/B0051H45GC/ref=sr_1_4?s=pet-supplies&amp;ie=UTF8&amp;qid=1502397845&amp;sr=1-4&amp;keywords=muzzle,4,1
Nature's Miracle Advanced Stain and Odor Remover Gallon,Pet Supplies,https://www.amazon.com/Natures-Miracle-Advanced-Stain-Gallon/dp/B00251GJ5W/ref=sr_1_4?s=pet-supplies&amp;ie=UTF8&amp;qid=1483893927&amp;sr=1-4&amp;keywords=nature,4,1
"MidWest Homes for Pets Foldable Metal Exercise Pen / Pet Playpen, 8 Panels Each",Pet Supplies,https://www.amazon.com/MidWest-Exercise-Pen-30-Inch-Black/dp/B000H8YTJI,4,1
Ruffwear - Approach Full-Day Hiking Pack for Dogs,Pet Supplies,https://www.amazon.com/Ruffwear-Approach-Full-Day-Hiking-Campfire/dp/B00B2KAACK/ref=redir_mobile_desktop?_encoding=UTF8&amp%3Bkeywords=ruffwear&amp%3Bqid=1493834678&amp%3Bsr=1-3&ref_=mp_s_a_1_3,3,1
PetSafe Easy Walk Harness,Pet Supplies,https://www.amazon.com/PetSafe-Harness-Large-Black-Silver/dp/B0009ZBKG4,3,1
OurPets IQ Treat Ball Interactive Food Dispensing Dog Toy,Pet Supplies,https://www.amazon.com/OurPets-Smarter-Interactive-Inches-Colors/dp/B003ARUKTG/ref=sr_1_1?ie=UTF8&amp;qid=1462224830&amp;sr=8-1&amp;keywords=iq+puzzle+ball+dog,3,1
Feisty Fido: Help for the Leash-Reactive Dog,Books,https://www.amazon.com/Feisty-Fido-Help-Leash-Reactive-Dog/dp/1891767070/ref=pd_sim_14_10?ie=UTF8&amp;dpID=51eJIG6XC2L&amp;dpSrc=sims&amp;preST=_AC_UL160_SR104,3,1
Help for Your Fearful Dog: A Step-by-Step Guide to Helping Your Dog Conquer His Fears,Books,https://www.amazon.com/Help-Your-Fearful-Step-Step/dp/0966772679/ref=sr_1_3?ie=UTF8&amp;qid=1482104725&amp;sr=8-3&amp;keywords=fearful+dog,3,1
StarMark Bob-A-Lot Interactive Dog Toy,Pet Supplies,https://www.amazon.com/gp/product/B001JQLNB4/ref=pd_lpo_sbs_dp_ss_3?pf_rd_p=1944687542&amp;pf_rd_s=lpo-top-stripe-1&amp;pf_rd_t=201&amp;pf_rd_i=B000KV7ZGQ&amp;pf_rd_m=ATVPDKIKX0DER&amp;pf_rd_r=0XA62S8K4HDV82VYR0QB,3,1
PetSafe Busy Buddy Kibble Nibble Meal Dispensing Dog Toy,Pet Supplies,https://www.amazon.com/gp/product/B001F0RRUA?psc=1&amp;redirect=true&amp;ref_=oh_aui_detailpage_o01_s00,3,1
Outward Hound Hide-A-Squirrel and Puzzle Plush Squeaking Toys for Dogs,Pet Supplies,https://www.amazon.com/gp/product/B0002I0O60?psc=1&amp;redirect=true&amp;ref_=oh_aui_detailpage_o02_s00,3,1
Pioneer Pet Raindrop Stainless Steel Pet Drinking Fountain,Pet Supplies,https://www.amazon.com/Pioneer-Pet-Stainless-Fountain-Raindrop/dp/B0037NKDSG/ref=sr_1_11?s=pet-supplies&amp;ie=UTF8&amp;qid=1498743775&amp;sr=1-11&amp;keywords=dog+water+fountain,3,1
AmazonBasics Dog Waste Bags with Dispenser and Leash Clip,Pet Supplies,https://www.amazon.com/AmazonBasics-Waste-Bags-Dispenser-Leash/dp/B00NABTGY2/ref=redir_mobile_desktop?_encoding=UTF8&amp%3BdpID=41wU8IMCLcL&amp%3BdpPl=1&amp%3Bkeywords=dog%20poop%20bags&amp%3Bpi=SX200_QL40&amp%3Bref=plSrch&amp%3Bsr=8-1&qid=1447681516&ref_=mp_s_a_1_1,3,1
"Vastar 2 Packs Adjustable Pet Dog Cat Car Seat Belt Safety Leads Vehicle Seatbelt Harness, Made from Nylon Fabric",Pet Supplies,https://www.amazon.com/Vastar-Adjustable-Vehicle-Seatbelt-Harness/dp/B014W40TSW/ref=sxts_k2p_hero1?pf_rd_m=ATVPDKIKX0DER&amp;pf_rd_p=2668835662&amp;pd_rd_wg=7F6eY&amp;pf_rd_r=3DSCKJVC6BJGVW6RYEHW&amp;pf_rd_s=desktop-sx-top-slot&amp;pf_rd_t=301&amp;pd_rd_i=B014W40TSW&amp;pd_rd_w=FZ8yd&amp;pf_rd_i=dog+seatbelt&amp;pd_rd_r=XHA1P34Q42JC63GCB1K1&amp;ie=UTF8&amp;qid=1479411396&amp;sr=1,3,1
Foscam FI8910W Pan & Tilt IP/Network Camera with Two-Way Audio and Night Vision (Black),Electronics,https://www.amazon.com/dp/B006ZP8UOW/ref=cm_sw_r_em_apa_0lpfzbYFYB3P4,3,1
When a Pet Dies,Books,https://www.amazon.com/When-Pet-Dies-Fred-Rogers/dp/0698116666,3,1
Trixie Pet Products,Pet Supplies,https://www.amazon.com/Trixie-Mad-Scientist-Dogs-Level/dp/B003TOKTEG/ref=sr_1_11?ie=UTF8&amp;qid=1469997634&amp;sr=8-11&amp;keywords=interactive+dog+toys,2,1
"GoodSense All Day Allergy, Cetirizine HCL Tablets, 10 mg, 365 Count","Health, Household & Baby Care",https://www.amazon.com/gp/product/B00G9E1GYA?ref_=gb1h_img_m-7_6402_af462b24&amp;smid=ATVPDKIKX0DER,2,1
Evenflo Position and Lock Tall Pressure Mount Wood Gate,Baby,https://www.amazon.com/Evenflo-Position-andLock-Tall-Gate/dp/B0055LV3XW/ref=sr_1_6_s_it?s=baby-products&amp;ie=UTF8&amp;qid=1459692885&amp;sr=1-6&amp;keywords=baby+gate,2,1
"KONG ZoomGroom, Dog Grooming Toy",Pet Supplies,https://www.amazon.com/dp/B0002AR19Q/ref=cm_sw_r_apa_qi2Qxb38W574C,2,1
"Medline Emesis Bags, Blue, 24 Count","Health, Household & Baby Care",https://www.amazon.com/Medline-Emesis-Bags-Blue-Count/dp/B00839SNUE/,2,1
Zuke's Mini Naturals Dog Treats,Pet Supplies,https://www.amazon.com/dp/B000H0ZJHW/ref=cm_sw_r_other_apa_.lApxb9H78B81,2,1
SprayShield Animal Deterrent Spray with Belt Clip,Pet Supplies,https://www.amazon.com/SprayShield-Animal-Deterrent-Spray-Belt/dp/B0002XKIV6,2,1
"Carlson Extra Tall Pet Gate, with small pet door",Pet Supplies,https://www.amazon.com/Carlson-0941PW-Extra-Tall-Walk-Thru-White/dp/B000JJFNJK,2,1
"Ruffwear - Swamp Cooler, Cooling Vest for Dogs, Graphite Gray, Large",Pet Supplies,https://www.amazon.com/Ruffwear-Swamp-Cooler-Medium-Graphite/dp/B00B23SI8K?ie=UTF8&amp;psc=1&amp;redirect=true&amp;ref_=oh_aui_detailpage_o02_s00,2,1
Canine Body Language: A Photographic Guide Interpreting the Native Language of the Domestic Dog,Books,https://www.amazon.com/Canine-Body-Language-Photographic-Interpreting/dp/1929242352,2,1
Petmate Sky Kennel,Pet Supplies,https://www.amazon.com/Petmate-Kennel-Pets-30-Pound-Light/dp/B00AAPGA2W/ref=sr_1_1?s=pet-supplies&amp;ie=UTF8&amp;qid=1480351132&amp;sr=1-1&amp;keywords=airline+crate,2,1
"Freshware KT-402 2-in-1 Onion, Vegetable, Fruit, and Cheese Chopper",Home & Kitchen,https://www.amazon.com/dp/B00FWLJOSG/ref=cm_sw_r_cp_api_q2q3yb75TXKWY,2,1
Evolution Undercoat Rake,Pet Supplies,https://www.amazon.com/Evolution-Double-Undercoat-Rake-Rotating/dp/B0002DIRYG/ref=redir_mobile_desktop?_encoding=UTF8&amp%3Bkeywords=undercoat%20rake%20for%20large%20dogs&amp%3Bqid=1501549397&amp%3Bsr=8-13&ref_=mp_s_a_1_13,2,1
Herm Sprenger Prong Collar,Pet Supplies,https://www.amazon.com/Herm-Sprenger-Prong-Collar-Heavyweight/dp/B0002DGVY4/ref=sr_1_2?s=pet-supplies&amp;ie=UTF8&amp;qid=1437497695&amp;sr=1-2&amp;keywords=pinch+collar&amp;pebp=1437497701735&amp;perid=1JHC3XK4CA7X4GRVJS13,2,1
"Click N' Play Pack of 200 Phthalate Free BPA Free Crush Proof Plastic Ball, Pit Balls - 6 Bright Colors in Reusable and Durable Storage Mesh Bag with Zipper",Toys & Games,https://www.amazon.com/Click-Play-Phthalate-Crush-Plastic/dp/B00PYLU3GG/ref=sr_1_4?s=toys-and-games&amp;ie=UTF8&amp;qid=1496436449&amp;sr=1-4&amp;keywords=ball+pit+balls,2,1
Vet Wrap,Sports & Outdoors,https://www.amazon.com/Gifted-Horse-Vet-Wrap/dp/B0002V47L0,2,1
Decoding Your Dog: Explaining Common Dog Behaviors and How to Prevent or Change Unwanted Ones,Books,https://www.amazon.com/Decoding-Your-Dog-Explaining-Behaviors/dp/0544334604/ref=pd_sim_14_12?ie=UTF8&amp;dpID=51X6KB5sCsL&amp;dpSrc=sims&amp;preST=_AC_UL160_SR105,2,1
"BarksBar Original Pet Seat Cover for Cars - Black, WaterProof & Hammock Convertible",Pet Supplies,https://www.amazon.com/gp/product/B019EOQ6AK,2,1
"Air Stability Wobble Cushion, Blue, 35cm/14in Diameter, Balance Disc, Pump Included",Sports & Outdoors,https://www.amazon.com/Stability-Cushion-Diameter-Balance-Included/dp/B007LX6MPG/ref=sr_1_2?ie=UTF8&amp;qid=1449507319&amp;sr=8-2&amp;keywords=wobble+disc,2,1
Embark Dog DNA Test · Breed Identification · 160 Health Results · 200K Genetic Markers,Pet Supplies,https://www.amazon.com/dp/B01EINBA76/ref=cm_sw_r_cp_api_4MeGyb6R3C2ZR,2,1
"Foscam C1 HD 720P WiFi Security IP Camera with iOS/Android App, Super Wide 115° Viewing Angle, Night Vision Up to 26ft, PIR Motion Detection, and More",Electronics,https://www.amazon.com/dp/B00T7NX6SY/ref=cm_sw_r_em_apa_JkpfzbCR5AYEB,2,1
Virbac C.E.T. Enzymatic Toothpaste,Pet Supplies,https://www.amazon.com/Virbac-C-E-T-Enzymatic-Toothpaste-Poultry/dp/B00RZDXA7K,2,1
StarMark Clicker Dog Training System,Pet Supplies,https://www.amazon.com/StarMark-Clicker-Dog-Training-System/dp/B000FMDIL6,2,1
"Karen Pryor i-Click Dog Training Clicker, 3 Clickers",Pet Supplies,https://www.amazon.com/Karen-i-Click-Training-Clicker-Clickers/dp/B002LAS2KW,2,1
Go Pet Club Dog and Cat Pet Grooming Hair Dryer,Pet Supplies,https://www.amazon.com/dp/B00DX24SD2/ref=cm_sw_r_cp_apa_AoohzbYB8ND6V,2,1
"Slide-On Pet ID Tags. Personalized Dog & Cat Tags. Silent, No Noise Collar Tags made of Stainless Steel. Custom Engraved. Includes up to 4 Lines of Personalized Text.",Pet Supplies,https://www.amazon.com/gp/product/B00416J9F6,2,1
Andis Pet Steel Grooming Comb (65730),Pet Supplies,https://www.amazon.com/Andis-Pet-2-Inch-Steel-65730/dp/B004UTDHP2/ref=sr_1_1?s=pet-supplies&amp;ie=UTF8&amp;qid=1467821937&amp;sr=1-1&amp;keywords=metal+comb+pet,2,1
Outward Hound Port-A-Bowl Collapsible Travel Dog Food and Water Bowl,Pet Supplies,https://www.amazon.com/Collapsible-Hiking-Folding-Outward-Hound/dp/B0081XICJO/ref=sr_1_8?s=pet-supplies&amp;ie=UTF8&amp;qid=1499278135&amp;sr=1-8&amp;keywords=collapsible+dog+bowl,2,1
"Dressing to Go Salad Dressing Containers, Mini Food Storage Containers, Small Dip, Condiment, or Sauce Containers, Leak-Resistant, Set of 3 in Various Colors",Home & Kitchen,https://www.amazon.com/Evriholder-Dressing-Bottle-Various-Colors/dp/B00LPZQUS0/ref=sr_1_1?ie=UTF8&amp;qid=1465914465&amp;sr=8-1&amp;keywords=evriholder+salad+dressing.,2,1
Trixie Pet Products,Pet Supplies,https://www.amazon.com/TRIXIE-Pet-Products-Board-Level/dp/B0054Q9TMA/ref=sr_1_8?ie=UTF8&amp;qid=1469997634&amp;sr=8-8&amp;keywords=interactive+dog+toys,1,1
PetSafe/Premier Dog Quick Release GENTLE LEADER HEAD COLLAR Medium Red,Pet Supplies,https://www.amazon.com/PetSafe-Premier-Release-GENTLE-LEADER/dp/B00H5BVPA6/ref=sr_1_4?s=pet-supplies&amp;ie=UTF8&amp;qid=1469997771&amp;sr=1-4&amp;keywords=gentle+leader,1,1
PetZoom Pet Park Indoor Pet Potty,Pet Supplies,https://www.amazon.com/PetZoom-Pet-Park-Indoor-Potty/dp/B002ZHRTAK,1,1
Vetericyn Plus All Animal Wound & Skin Care 4oz,Pet Supplies,https://www.amazon.com/Vetericyn-Plus-Wound-Skin-Spray/dp/B0045DDN1G/ref=sr_1_1?s=pet-supplies&amp;ie=UTF8&amp;qid=1466998504&amp;sr=1-1&amp;keywords=vetericyn,1,1
"Service Dog Vest Harness with 2 Reflective ""DO NOT PET"" Patches, by Industrial Puppy (XL, Bright Red)",Pet Supplies,https://www.amazon.com/dp/B011J12J70/ref=cm_sw_r_other_awd_0-OswbVHWVH19,1,1
Bullseye Pillgun,Pet Supplies,https://www.amazon.com/Butler-Sales-Bullseye-Pillgun/dp/B000A86YBQ/ref=pd_sim_petsupplies_4?ie=UTF8&amp;refRID=0QG03BXD3TM252HY8Y4E,1,1
PlayaPup Sun Protective/Lightweight Dog Shirts,Pet Supplies,https://www.amazon.com/PlayaPup-Protective-Lightweight-Shirts-Cobalt/dp/B0062ATJ0Y/ref=sr_1_1?ie=UTF8&amp;qid=1438810894&amp;sr=8-1&amp;keywords=dog+sun+shirt,1,1
"GoodNites Disposable Bed Mats, 9 Count","Health, Household & Baby Care",https://www.amazon.com/GoodNites-Disposable-Bed-Mats-Count/dp/B007E500KE,1,1
"The Company of Animals Halti Head Collar, Black",Pet Supplies,https://www.amazon.com/Company-Animals-Halti-Collar-Black/dp/B004XNLCPC,1,1
"Rocco & Roxie All Natural Liver Dog Treats - Made in USA Only - Slow-Smoked Beef - Gluten-Free, Grain-Free - No Fillers - Healthy and Delicious Treats Your Dogs Will Love - 16 oz. Bag (1lb Liver)",Pet Supplies,https://www.amazon.com/gp/product/B00J391SUA?ref_=gb1h_img_m-6_6222_5353c200&amp;smid=ARYDNK3BSOJJ4,1,1
Supreme Bully Sticks by Best Bully Sticks - All Natural Dog Treats,Pet Supplies,https://www.amazon.com/gp/product/B001KEWU6M?redirect=true&amp;ref_=gb1h_img_m-6_6222_59bcf449&amp;smid=A39LSJLBH7NVIQ,1,1
"Rocco & Roxie Gourmet Jerky Dog Treats - Slow Smoked, Delicious, Tender AND Healthy 6"" Jerky Sticks - Choose Beef, Chicken or Turkey - 16 oz. Bag …",Pet Supplies,https://www.amazon.com/gp/product/B00KFLEFE6?ref_=gb1h_img_m-6_6222_ed616ccc&amp;smid=ARYDNK3BSOJJ4,1,1
"Lay3r 3D Pen (Includes 3-Spool of Filament Black, White and Blue)","Arts, Crafts & Sewing",https://www.amazon.com/gp/product/B00L8IBQGA?ref_=gb1h_img_m-6_6222_a98c4f6d&amp;smid=ATVPDKIKX0DER,1,1
"Anigan EvaCup, Top-Quality, Reusable Menstrual Cup, Eco-Friendly Alternative to Tampons, Blizzard Blue, Small","Health, Household & Baby Care",https://www.amazon.com/gp/product/B00MNRAUEO?ref_=gb1h_img_m-7_6402_47b54e1f&amp;smid=AY1UT6GRQ4RM1,1,1
Newmans Own Organic Advance Dry Dog Food 25lb,Grocery & Gourmet Food,https://www.amazon.com/gp/product/B000YQMB1G?ref_=gb1h_img_m-7_6402_00609009&amp;smid=A910SOE1FKRQR,1,1
Carolina Prime - Chicken Breast & Sweet Tater Fillets (1lb.) - Naturally Nutricious Dog Treats,Pet Supplies,https://www.amazon.com/gp/product/B00DSE6J2I?ref_=gb1h_img_m-6_6222_a50bac17&amp;smid=AD6RFAAQRI8WI,1,1
Cat Bed - Abyss Pets Thermal Cat Mat - Dog Bed - Keeps Pets Warm - Brown Leopard,Pet Supplies,https://www.amazon.com/gp/product/B00QSB8CVO?ref_=gb1h_img_m-6_6222_9f852797&amp;smid=A13L9DD3EEYG8X,1,1
Purina Moist & Meaty Burger with Cheddar Cheese Wet Dog Food,Pet Supplies,https://www.amazon.com/gp/product/B0007A67SC?ref_=gb1h_img_m-6_6222_44d6fe79&amp;smid=A910SOE1FKRQR,1,1
Floyd Fetch Toy See Spot Run (Purple/Cream) - Large,Pet Supplies,https://www.amazon.com/gp/product/B0002TA7OS?keywords=B0002TA7OS&amp;qid=1436978979&amp;ref_=gb1h_img_m-6_6222_67a98245&amp;smid=A2701FG002WN6Z&amp;sr=8-1,1,1
"Frigidaire FRA123PT1 12,000 BTU Portable Air Conditioner with Remote Control",Home & Kitchen,https://www.amazon.com/gp/product/B003HGH2ZK?ref_=gb1h_img_m-6_6222_2381f4d5&amp;smid=ATVPDKIKX0DER,1,1
Grade-A Elk and Deer Antler Dog Chews by Best Bully Sticks (1 Pack) Sourced in the USA,Pet Supplies,https://www.amazon.com/gp/product/B00R6YZNSW?redirect=true&amp;ref_=gb1h_img_m-6_6222_d5cbf0e5&amp;smid=A39LSJLBH7NVIQ,1,1
All-Natural Himalayan Yak Cheese Dog Chews by Best Bully Sticks (3 Pack),Pet Supplies,https://www.amazon.com/gp/product/B00S5CBJ3C?redirect=true&amp;ref_=gb1h_img_m-6_6222_5840b96e&amp;smid=A39LSJLBH7NVIQ,1,1
Nature's Recipe Grain Free Dry Dog Food,Pet Supplies,https://www.amazon.com/gp/product/B0045VI034?ref_=gb1h_img_m-7_6402_8a189efe&amp;smid=A910SOE1FKRQR,1,1
"Gaiam Adjustable Custom-Fit Balance Ball Chair, Stability Ball Desk Chair with 55cm Yoga Ball, Inflation Pump and Exercise Guide for Home or Office",Sports & Outdoors,https://www.amazon.com/gp/product/B0047HXMP2?ref_=gb1h_img_m-6_6222_1de9e159&amp;smid=ATVPDKIKX0DER,1,1
Spizzles Beef Trachea Chips (8 oz),Pet Supplies,https://www.amazon.com/gp/product/B00WNH93LA?keywords=B00WNH93LA&amp;qid=1436959308&amp;ref_=gb1h_img_m-6_6222_3d6c5d0e&amp;smid=A2701FG002WN6Z&amp;sr=8-1,1,1
"SOLID GOLD 937185 Sun Dancer Chicken Based Grain and Gluten Free Food for Adult Dogs, 15-Pound",Pet Supplies,https://www.amazon.com/gp/product/B004KN7RWM?keywords=B004KN7RWM&amp;qid=1436306616&amp;ref_=gb1h_img_m-6_6222_84044f32&amp;smid=A910SOE1FKRQR&amp;sr=8-1,1,1
Tuffy's Pet Food NutriSource Grain Free Dog Food,Pet Supplies,https://www.amazon.com/gp/product/B004QVZ6FS?ref_=gb1h_img_m-7_6402_0457931c&amp;smid=A910SOE1FKRQR,1,1
Pet Botanics Training Reward,Pet Supplies,https://www.amazon.com/gp/product/B007VGE2X2?ref_=gb1h_img_m-6_6222_551bceee&amp;smid=ATVPDKIKX0DER,1,1
EZwhelp Washable Belly Bands / Male Wraps (Value 8-Pack),Pet Supplies,https://www.amazon.com/Washable-Belly-Bands-Wraps-8-Pack/dp/B00B90DTI0/ref=sr_1_3?s=pet-supplies&amp;ie=UTF8&amp;qid=1464629029&amp;sr=1-3&amp;keywords=belly+band,1,1
Petperi Breathable Best Fit Dog Muzzles,Pet Supplies,https://www.amazon.com/Petperi-Breathable-Best-Muzzles-mesh1/dp/B01IHBHEUC/ref=redir_mobile_desktop?_encoding=UTF8&amp%3Bkeywords=humane%20dog%20muzzle&amp%3Bqid=1503440808&amp%3Bsr=8-1&ref_=mp_s_a_1_1,1,1
"Premium Magnetic Screen Door - KEEP BUGS OUT, Let Fresh Air In. Instant Mosquito, Insect and Fly Screen with Magic Magnetic Closure. Retractable Mesh Door Screen. (Fits Doors UP TO 34"" x 82"")",Tools & Home Improvement,https://www.amazon.com/Magnetic-Screen-Door-Everyday-Mosquitoes/dp/B00TOG2GQC,1,1
Pet Corrector Pet Behavioral Training Aid,Pet Supplies,https://www.amazon.com/Pet-Corrector-Behavioral-Training-Aid/dp/B000UCH02O,1,1
AmazonBasics Elevated Cooling Pet Bed,Pet Supplies,https://www.amazon.com/AmazonBasics-Elevated-Cooling-Pet-Bed/dp/B00OP6QR7K,1,1
KONG STUFF'N Real,Pet Supplies,https://www.amazon.com/KONG-Peanut-Butter-Treat-5-ounces/dp/B003JVBQ6Y,1,1
"PetSafe Automatic Ball Launcher, Tennis Ball Throwing Machine for Dogs, NEW FRUSTRATION-FREE PACKAGING",Pet Supplies,https://www.amazon.com/PetSafe-Automatic-Launcher-FRUSTRATION-FREE-PACKAGING/dp/B072J4KCVP/ref=redir_mobile_desktop?_encoding=UTF8&amp%3Bkeywords=automatic%20ball%20thrower%20for%20dogs&amp%3Bqid=1497712677&amp%3Bsr=8-5&ref_=mp_s_a_1_5,1,1
Learning About Dogs: Learning Games,Books,https://www.amazon.com/Learning-About-Dogs-Games/dp/1890948365,1,1
Pet Gear Jogger Pet Stroller,Pet Supplies,https://www.amazon.com/Pet-Gear-Jogger-Stroller/dp/B007PPTYXW,1,1
Squishy Face Studio Flirt Pole V2 with Braided Fleece Lure - Durable Dog Toy for Fun Obedience Training & Exercise,Pet Supplies,https://www.amazon.com/Squishy-Face-Studio-Exercise-36-Inch/dp/B00HFFXE5G/ref=sr_1_1?ie=UTF8&amp;qid=1471876464&amp;sr=8-1&amp;keywords=squishy+face+studio,1,1
How to be the Leader of the Pack...And have Your Dog Love You For It.,Books,https://www.amazon.com/Leader-Pack-have-Your-Love/dp/189176702X/ref=sr_1_1?ie=UTF8&amp;qid=1485280470&amp;sr=8-1&amp;keywords=how+to+be+leader+of+the+pack+and+have+your+dog+love+you+for,1,1
Solvit 69996 Wire Safety Cage Top only (BASKET SOLD SEPARATELY) - Made for Wicker Bicycle Basket,Pet Supplies,https://www.amazon.com/Solvit-69996-Wire-Safety-Cage/dp/B0057AETGY,1,1
"ArthriMAXX Liquid Joint Protection Supplement for Dogs, 32 Oz. Bottle",Pet Supplies,https://www.amazon.com/ArthriMaxx-Liquid-Supplement-Glucosamine-Chondroitin/dp/B00076NNSI/ref=pd_ys_sf_s_rp_a1_1_p?ie=UTF8&amp;refRID=0WBZF76C8KYD29327KPJ,1,1
Kong Classic Dog Toy,Pet Supplies,https://www.amazon.com/KONG-Classic-Dog-Toy-X-Large/dp/B0002AR0HO,1,1
Hyper Pet K-9 Kannon,Pet Supplies,https://www.amazon.com/gp/product/B00BQRSBPC/ref=s9_hps_bw_g199_i2,1,1
