name,category,amazon_link,total_mentions,subreddit_mentions
"Big D 1641 Water Soluble Deodorant, Mint Fresh Fragrance, 1 Gallon (Pack of 4)",Industrial & Scientific,https://www.amazon.com/Big-Gallon-Fresh-Soluble-Deodorant/dp/B005NIKL4Y,1,1
"Armor All 2.5 Gallon, 2 Peak HP, Utility Wet/Dry Vacuum, AA255",Tools & Home Improvement,https://www.amazon.com/Armor-Gallon-Utility-Vacuum-AA255/dp/B003M2F7NI/,1,1
Dragon Age Inquisition Battle Nug Plush Stuffed Animal Limited Edition,Toys & Games,https://www.amazon.com/Dragon-Age-Inquisition-Stuffed-Limited/dp/B018RK0R2A/ref=sr_1_1?ie=UTF8&amp;qid=1452196936&amp;sr=8-1&amp;keywords=stuffed+nug+bioware,1,1
10-Minute Dog Training Games: Quick and Creative Activities for the Busy Dog Owner,Books,https://www.amazon.com/10-Minute-Dog-Training-Games-Activities/dp/1592537308,1,1
Comfort Zone Adaptil Diffuser Kit and Refill for Dog Calming,Pet Supplies,https://www.amazon.com/Comfort-Zone-Adaptil-Diffuser-Dogs/dp/B00BLI96DW/ref=sr_1_2?ie=UTF8&amp;qid=1489641951&amp;sr=8-2&amp;keywords=dap+diffuser+for+dogs,1,1
Dogs Bite: But Balloons and Slippers Are More Dangerous,Books,https://www.amazon.com/Dogs-Bite-Balloons-Slippers-Dangerous/dp/1888047186,1,1
"Mutt Muffs DDR337 Hearing Protection for Dogs, Black, Large",Tools & Home Improvement,https://www.amazon.com/Mutt-Muffs-DDR337-Hearing-Protection/dp/B002CZQ1TA,1,1
Collins Dog Rules Decorative Sign,Home & Kitchen,https://www.amazon.com/Collins-Dog-Rules-Decorative-Sign/dp/B00CCUVFLO,1,1
"Fruit Of The Earth Aloe Vera 100 % Gel, 12 oz",Beauty & Personal Care,https://www.amazon.com/gp/product/B00JPQLPO0/ref=pd_sim_194_6?ie=UTF8&amp;psc=1&amp;refRID=ZQJQJZCPMF21QZVW9MHQ,1,1
"Security Camera Wireless by GT ROAD, Home Video Security Surveillance Camera System, Wifi Ip Camera with 960P HD, Night version, Motion detector, Two-way Audio",Electronics,https://www.amazon.com/gp/product/B01ICTLOBO/ref=oh_aui_search_detailpage?ie=UTF8&amp;psc=1,1,1
Gorilla Supply 1000 Pet Poop Bags w Free Dispenser,Pet Supplies,https://www.amazon.com/Gorilla-Supply-Technology-Patented-Dispenser/dp/B00TFYT02G/,1,1
PetSafe Drinkwell Ceramic Avalon Fountain for Pets,Pet Supplies,https://www.amazon.com/Drinkwell-Ceramic-Avalon-Fountain-Pets/dp/B00BD3TO82,1,1
"Seasonals Washable Belly Band/Diaper, Fits Large Dogs, Camouflage",Pet Supplies,https://www.amazon.com/Seasonals-Washable-Belly-Diaper-Camouflage/dp/B00AOHAA5E?ie=UTF8&amp;psc=1&amp;redirect=true&amp;ref_=oh_aui_detailpage_o08_s00,1,1
Brain Games for Dogs: Fun Ways to Build a Strong Bond with Your Dog and Provide It with Vital Mental Stimulation,Books,https://www.amazon.com/Brain-Games-Dogs-Provide-Stimulation/dp/1554074908/ref=sr_1_1?ie=UTF8&amp;qid=1431183929&amp;sr=8-1&amp;keywords=dog+games+book,1,1
"Halo Liv-a-Littles Natural Treats for Dogs and Cats, Freeze-Dried Chicken Breast Protein, 2.2-Ounce",Pet Supplies,https://www.amazon.com/Halo-Littles-Natural-Freeze-Dried-2-2-Ounce/dp/B00027CL5S?ie=UTF8&amp;psc=1&amp;redirect=true&amp;ref_=oh_aui_detailpage_o04_s01,1,1
Kong Classic Dog Toy,Pet Supplies,https://www.amazon.com/KONG-Classic-Dog-Toy-Small/dp/B0002AR15U/ref=sr_1_2?ie=UTF8&amp;qid=1434145853&amp;sr=8-2&amp;keywords=kong+small+puppy,1,1
The Stuff 16oz Conditioner & Detangler,Pet Supplies,https://www.amazon.com/The-Stuff-16oz-Conditioner-Detangler/dp/B0002H3RLU/ref=sr_1_1?s=pet-supplies&amp;ie=UTF8&amp;qid=1462236321&amp;sr=1-1&amp;keywords=the+stuff,1,1
"The Grrrip Two Handled Dog Leash - 1"" x 6' Black",Pet Supplies,https://www.amazon.com/Grrrip-Two-Handled-Dog-Leash/dp/B000ET89MI/ref=redir_mobile_desktop?_encoding=UTF8&amp%3BdpID=41HGX6jUtmL&amp%3BdpPl=1&amp%3Bkeywords=dog%20leash%20dual%20handle&amp%3Bpi=AC_SY200_QL40&amp%3Bref=plSrch&amp%3Bsr=8-1&qid=1431710069&ref_=mp_s_a_1_1,1,1
Simple Solution Washable Male Wrap Dog Diaper,Pet Supplies,https://www.amazon.com/dp/B000FJ9QLA/ref=cm_sw_r_cp_api_5A0rxb40P5EGS,1,1
"TENA Serenity Overnight Ultimate Pads, 28 Count","Health, Household & Baby Care",https://www.amazon.com/TENA-Serenity-Overnight-Ultimate-Count/dp/B000UXDDU6/ref=sr_1_1_s_it?s=hpc&amp;ie=UTF8&amp;qid=1458931775&amp;sr=1-1&amp;keywords=tena,1,1
Treatstik Large Meal and Treat Dispensing Dog Toy,Pet Supplies,https://www.amazon.com/Treatstik-Large-Green-Treat-Dispensing/dp/B0015UX2UY/ref=sr_1_1?ie=UTF8&amp;qid=1446147675&amp;sr=8-1&amp;keywords=treatstik,1,1
Nina Ottosson's Interactive Dog Toy,Pet Supplies,https://www.amazon.com/Company-Animals-Ottosson-Tornado-Interactive/dp/B001KZ8FWE,1,1
Super Flex Model Dog Disc,Sports & Outdoors,https://www.amazon.com/dp/B0022V73DW/ref=psdc_166432011_t2_B001HL7J9G,1,1
OurPets Buster Food Cube Interactive Dog Toy (Colors Vary),Pet Supplies,https://www.amazon.com/gp/product/B003A23HZK?keywords=buster,1,1
OurPets IQ Treat Ball Interactive Food Dispensing Dog Toy,Pet Supplies,https://www.amazon.com/Our-Pets-Smarter-Interactive-Inches/dp/B003ARUKU0/ref=pd_bxgy_199_text_y,1,1
"Hurtta Pet Collection 15S Outdoor Overall, Black",Pet Supplies,https://www.amazon.com/Hurtta-Collection-Outdoor-Overall-Black/dp/B004HDIVH0?ie=UTF8&amp;psc=1&amp;redirect=true&amp;ref_=oh_aui_detailpage_o01_s01,1,1
H2O4K9,Pet Supplies,https://www.amazon.com/H2O4K9-Bottle-Travel-25-Ounce-Stainless/dp/B004VA0WBW/ref=sr_1_1?ie=UTF8&amp;qid=1462233254&amp;sr=8-1&amp;keywords=h20+for+k9,1,1
Fruitables Skinny Minis Apple Bacon,Pet Supplies,https://www.amazon.com/gp/product/B005OTJWUQ/ref=s9_hps_bw_g199_i1,1,1
"ARK Naturals PRODUCTS for PETS 326070 12-Ounce Breath-Less Chewable Brushless Toothpaste, Small/Medium",Pet Supplies,https://www.amazon.com/ARK-PRODUCTS-PETS-326070-Breath-Less/dp/B00626UCAY?ie=UTF8&amp;psc=1&amp;redirect=true&amp;ref_=oh_aui_detailpage_o09_s00,1,1
Starmark Treat Dispensing Pickle Pocket for Dogs,Pet Supplies,https://www.amazon.com/Starmark-Treat-Dispensing-Pickle-Pocket/dp/B007K5CL9Q/ref=sr_1_1?ie=UTF8&amp;qid=1431018931&amp;sr=8-1,1,1
Crazy Dog Train-Me! Training Reward Mini Dog Treats,Pet Supplies,https://www.amazon.com/Crazy-Dog-Training-Treat-Bacon/dp/B007RLDT94/ref=sr_1_1?s=pet-supplies&amp;ie=UTF8&amp;qid=1462236760&amp;sr=1-1&amp;keywords=crazy+dog+bacon,1,1
Busy Buddy Magic Mushroom Dog Toy,Pet Supplies,https://www.amazon.com/PetSafe-Buddy-Magic-Mushroom-Dispensing/dp/B0087PDF02/ref=pd_sim_199_10?ie=UTF8&amp;refRID=0WWHGBYV8FHP8RG6HSEK,1,1
Busy Buddy Barnacle Treat Dispensing Dog Toy,Pet Supplies,https://www.amazon.com/PetSafe-Busy-Buddy-Barnacle-Small/dp/B008JCH2NY/ref=sr_1_3?s=pet-supplies&amp;ie=UTF8&amp;qid=1434145293&amp;sr=1-3&amp;keywords=barnacle+dog+toy,1,1
"OllyDog X-Small Marin Collar, Red",Pet Supplies,https://www.amazon.com/OllyDog-X-Small-Marin-Collar-Red/dp/B008KIG4WM?ie=UTF8&amp;psc=1&amp;redirect=true&amp;ref_=oh_aui_detailpage_o08_s00,1,1
Petlinks Tricky Treater Dog Toy Treat Dispenser,Pet Supplies,https://www.amazon.com/gp/product/B00AQ4C30K/ref=oh_aui_detailpage_o00_s00?ie=UTF8&amp;psc=1,1,1
NERVOUS Yellow Color Coded 2 4 6 Foot Padded Dog Leash (Give Me Space) PREVENTS Accidents By Warning Others of Your Dog in Advance,Pet Supplies,https://www.amazon.com/NERVOUS-PREVENTS-Accidents-Warning-Advance/dp/B00BXL66IU,1,1
"Floppy Disc ""Made in USA"" Soft Flying Disc Toy for Dogs",Pet Supplies,https://www.amazon.com/Floppy-Disc-Soft-Flying-Dogs/dp/B00DFABI8A,1,1
JW Pet Treat Pod Nylon Small,Pet Supplies,https://www.amazon.com/JW-Pet-Company-46137-EverTuff/dp/B00DJRG8M0/ref=pd_sim_199_5?ie=UTF8&amp;dpID=51R4tXei5JL&amp;dpSrc=sims&amp;preST=_AC_UL320_SR168,1,1
"Garden of Life Raw Organic Flax Seed Meal with Chia Seeds - Flaxseed with Omega 3, Lignan and Polyphenol, 12 oz Pouch","Health, Household & Baby Care",https://www.amazon.com/dp/B00DQ5SUSU/ref=cm_sw_r_awd_bzDewb1EP37F4,1,1
Planet Dog Orbee-Tuff Snoop Treat Dispensing Dog Toys,Pet Supplies,https://www.amazon.com/gp/product/B00EE1660O/ref=oh_aui_detailpage_o00_s00?ie=UTF8&amp;psc=1,1,1
KONG Wobbler Treat Dispensing Dog Toy,Pet Supplies,https://www.amazon.com/Kong-Company-292887-Wobbler-Treats/dp/B00HYERF0I/ref=sr_1_2?ie=UTF8&amp;qid=1434145051&amp;sr=8-2&amp;keywords=kong+wobbler,1,1
"The Foobler Timed, Self Reloading Puzzle Feeder for Dog toy Ball Green/red",Pet Supplies,https://www.amazon.com/Foobler-Timed-Reloading-Puzzle-Feeder/dp/B00MXF6OLY,1,1
West Paw Design Zogoflex® Toppl Interactive Treat Dispensing Dog Toy,Pet Supplies,https://www.amazon.com/gp/product/B00N54E9MI/ref=oh_aui_detailpage_o00_s00?ie=UTF8&amp;psc=1,1,1
Pet Zone IQ Treat Ball Dog Toy,Pet Supplies,https://www.amazon.com/gp/product/B00P0MK4UO?psc=1&amp;redirect=true&amp;ref_=oh_aui_detailpage_o06_s00,1,1
"Himalayan Dog Chew, Small",Pet Supplies,https://www.amazon.com/dp/B00UVZM1NS/ref=twister_B00B45L1U8?_encoding=UTF8&amp;psc=1,1,1
"Stella & Chewy's Meal Mixers Variety Pack of 4 - Chicken, Beef, Turkey, and Salmon (3.5oz Each)",Pet Supplies,https://www.amazon.com/Stella-Chewys-Meal-Mixers-Variety/dp/B019WVKEUI/ref=sr_1_2?s=pet-supplies&amp;ie=UTF8&amp;qid=1462235610&amp;sr=1-2&amp;keywords=stella+chewy+meal+mixer,1,1
Andis EasyClip 2-Speed Nail Grinder(65880),Pet Supplies,https://www.amazon.com/Andis-Grinder-Speed-Purple-65880/dp/B003UO2PRY/ref=sr_1_1?ie=UTF8&amp;qid=1433417615&amp;sr=8-1&amp;keywords=nail+dremel+andis,1,1
NERVOUS Yellow Color Coded 6 Foot Dog Padded Leash (Give Me Space) PREVENTS Accidents By Warning Others of Your Dog in Advance,Pet Supplies,https://www.amazon.com/NERVOUS-PREVENTS-Accidents-Warning-Advance/dp/B00MNFGFI6/ref=sr_1_3?ie=UTF8&amp;qid=1447741230&amp;sr=8-3&amp;keywords=yellow+leash,1,1
No Dogs Orange Color Coded Alert L-XL Non pull Dog Harness (Not Good With Other Dogs) Prevents Accidents By Warning Others of Your Dog in Advance,Pet Supplies,https://www.amazon.com/Harness-Prevents-Accidents-Warning-Advance/dp/B00BZTOKQK/ref=redir_mobile_desktop?_encoding=UTF8&amp%3Bpsc=1&ref_=ya_aw_od_pi,1,1
"Hear Doggy Flatties with Chew Guard Technology Dog Toy, Cow",Pet Supplies,https://www.amazon.com/Hear-Doggy-Ultrasonic-Silent-Squeaker/dp/B00MEKC4DA/ref=sr_1_1?ie=UTF8&amp;qid=1462237026&amp;sr=8-1&amp;keywords=silent+squeak+dog+toys,1,1
"The Dog Merchants: Inside the Big Business of Breeders, Pet Stores, and Rescuers",Books,https://www.amazon.com/Dog-Merchants-Business-Breeders-Rescuers/dp/1681771403,1,1
Dogit Go Slow Anti-Gulping Dog Bowl,Pet Supplies,https://www.amazon.com/Dogit-Slow-Anti-Gulping-Bowl-Medium/dp/B0038HLHJU,1,1
Outward Hound Kyjen  Dog Backpack,Pet Supplies,https://www.amazon.com/Outward-Hound-Kyjen-2490-Backpack/dp/B0081XIEHE/ref=sr_1_3?ie=UTF8&amp;qid=1447220276&amp;sr=8-3&amp;keywords=dog+saddle+bag,1,1
CONAIR PRO PET PRODUCTS 741027 Dogs Nail Grinder,Pet Supplies,https://www.amazon.com/CONAIR-PRODUCTS-741027-Dogs-Grinder/dp/B00CXAEX5I/ref=sr_1_fkmr0_3?ie=UTF8&amp;qid=1433417587&amp;sr=8-3-fkmr0&amp;keywords=nail+dremel+conair,1,1
"The Possibility Dogs: What I Learned from Second-Chance Rescues About Service, Hope, and Healing",Books,https://www.amazon.com/Possibility-Dogs-Learned-Second-Chance-Rescues/dp/0544228022/ref=sr_1_1?ie=UTF8&amp;qid=1475538518&amp;sr=8-1&amp;keywords=the+possibility+dogs,1,1
PullyPup Hands Free Walking & Running Dog Leash - Includes Reflective Handle Loop and Pouch,Pet Supplies,https://www.amazon.com/gp/product/B00XH3M9WE?psc=1&amp;redirect=true&amp;ref_=oh_aui_detailpage_o05_s00,1,1
"Indipets Extra Heavy Stainless Steel Non Tip - Anti Skid Health Care Slow Feeding Dish ""Colors May Vary""",Pet Supplies,https://www.amazon.com/Indipets-Extra-Heavy-Piece-Stainless/dp/B0033PR7CI,1,1
"Indian Mandala Tapestry , Indian Hippie Hippy Wall Hanging , Bohemian Queen Wall Hanging, Bedspread Beach Tapestry",Home & Kitchen,https://www.amazon.com/Mandala-Tapestry-Hanging-Bohemian-Bedspread/dp/B00URJJFRI/ref=sr_1_2?ie=UTF8&amp;qid=1462039454&amp;sr=8-2&amp;keywords=indian+bedding,1,1
"Canine Hardware Treat Tote, Assorted Colors",Pet Supplies,https://www.amazon.com/Canine-Hardware-Treat-Small-Colors/dp/B000274692/,1,1
InStep Take 2 Double Bicycle Trailer,Sports & Outdoors,https://www.amazon.com/InStep-Take-Double-Bicycle-Trailer/dp/B002QAVQ14/ref=sr_1_1?s=outdoor-recreation&amp;ie=UTF8&amp;qid=1469980179&amp;sr=1-1&amp;keywords=Bike+trailer,1,1
Jones Natural Chews Beef Center Bone (1 Pack),Pet Supplies,https://www.amazon.com/Jones-Natural-Chews-Center-Beef/dp/B002PNJ4LQ,1,1
PetSafe Busy Buddy Twist 'n Treat Dog Toy,Pet Supplies,https://www.amazon.com/PetSafe-Buddy-Twist-Treat-Small/dp/B0002I0RLW?&amp;th=1,1,1
KONG Classic Medium Dog Toy Red Medium Pack of 2,Pet Supplies,https://www.amazon.com/KONG-Classic-Medium-Dog-Pack/dp/B00PIZ8FOA,1,1
Dog Raincoat,Pet Supplies,https://www.amazon.com/Push-Pushi-Dog-Raincoat-Yellow/dp/B00HU865LI/ref=redir_mobile_desktop?_encoding=UTF8&amp%3Bkeywords=dog%20raincoat&amp%3Bqid=1493500603&amp%3Bsr=8-25&ref_=mp_s_a_1_25,1,1
"Signature K9 Biothane Long Line, Black",Pet Supplies,https://www.amazon.com/dp/B005CXJ2OA/ref=cm_sw_r_apa_NR.ZybJ80KJJ5,1,1
Earth Rated Dispenser with Dog Waste Bags,Pet Supplies,https://www.amazon.com/dp/B008BGRXXM/ref=cm_sw_r_apa_DgPHyb3E7FVK4,1,1
Vet Solutions Universal Medicated Shampoo 16 Oz,Pet Supplies,https://www.amazon.com/Vet-Solutions-Universal-Medicated-Shampoo/dp/B00J4F99OU/ref=sr_1_2?ie=UTF8&amp;qid=1466956613&amp;sr=8-2&amp;keywords=universal+medicated+shampoo,1,1
"MidWest Homes for Pets Foldable Metal Exercise Pen / Pet Playpen, 8 Panels Each",Pet Supplies,https://www.amazon.com/Midwest-Exercise-Pen-24-Inch-Black/dp/B000H904WI/ref=sr_1_1?s=pet-supplies&amp;ie=UTF8&amp;qid=1437572887&amp;sr=1-1&amp;keywords=expen,1,1
"Louisville Ladder L-3016-04 300-Pound Duty Rating Fiberglass Stepladder, 4-Feet",Tools & Home Improvement,https://www.amazon.com/Louisville-Ladder-L-3016-04-Fiberglass-Stepladder/dp/B003OYIWWW/ref=sr_1_1?s=hi&amp;ie=UTF8&amp;qid=1498742712&amp;sr=1-1&amp;keywords=4+ft+ladder,1,1
Guyot Designs Squishy Pet Bowls,Sports & Outdoors,https://www.amazon.com/gp/product/B002NUV4P0?psc=1&amp;redirect=true&amp;ref_=oh_aui_detailpage_o02_s00,1,1
A Dog Who's Always Welcome: Assistance and Therapy Dog Trainers Teach You How to Socialize and Train Your Companion Dog,Books,https://www.amazon.com/Dog-Whos-Always-Welcome-Assistance/dp/0470142480,1,1
Professional Dog Grooming Greyhound Combs for Dogs Chrome Comb - Choose Size,Pet Supplies,https://www.amazon.com/Professional-Grooming-Greyhound-Combs-Chrome/dp/B06Y1MYR2K/ref=redir_mobile_desktop?_encoding=UTF8&amp%3Bkeywords=greyhound&amp%3Bqid=1501549532&amp%3Bsr=8-6&ref_=mp_s_a_1_6,1,1
Isokinetics Inc. PT Peanut Ball - 4 Sizes Available - Multiple Color Choices - For Physical Therapy and Home Exercise,Sports & Outdoors,https://www.amazon.com/Isokinetics-Inc-Brand-Peanut-Ball/dp/B00CMBS9PS/ref=pd_sim_468_7?_encoding=UTF8&amp;pd_rd_i=B00CMBS9PS&amp;pd_rd_r=T6SVCSA5JF5AW6Q8K8ZY&amp;pd_rd_w=fQhOF&amp;pd_rd_wg=Wyc8q&amp;psc=1&amp;refRID=T6SVCSA5JF5AW6Q8K8ZY,1,1
"Lifeunion Saddle Bag Backpack for Dog, Tripper Hound Bag Travel Hiking Camping in 3 Size",Sports & Outdoors,https://www.amazon.com/gp/product/B01DA08WJW/ref=oh_aui_detailpage_o06_s00?ie=UTF8&amp;psc=1,1,1
slackers Balance Blox,Sports & Outdoors,https://www.amazon.com/Slackers-SLA-492-slackers-Balance-Blox/dp/B00NZG74MS,1,1
HEFTY 12.8G Select Step On with Soft Close Lid Stainless Steele Color with Black,Home & Kitchen,https://www.amazon.com/dp/B01MT042ZK/ref=cm_sw_r_cp_api_MKyjzbKYNVE2C,1,1
Master Grooming Tools Xylan Combs with Handles — Coated Combs for Grooming Dogs,Pet Supplies,https://www.amazon.com/dp/B003WGV6SO/ref=wl_it_dp_o_pC_S_ttl?_encoding=UTF8&amp;colid=2SXW7VXU854U2&amp;coliid=IWSVO0DA8MS8Q&amp;psc=1,1,1
Dog & Cat Professional Slicker Brush for Grooming with Extra Long Firm Pins,Pet Supplies,https://www.amazon.com/Professional-Slicker-Brush-Grooming-Extra/dp/B005XAYLE8/ref=redir_mobile_desktop?_encoding=UTF8&amp%3Bkeywords=tuffer%20than%20tangles%20slicker%20brush&amp%3Bqid=1501549669&amp%3Bsr=8-4&ref_=mp_s_a_1_4,1,1
"Petsafe Rip 'N Tug Lotus Dog Toy, Large",Pet Supplies,https://www.amazon.com/Petsafe-Rip-Tug-Lotus-Large/dp/B006QN2TFE,1,1
"AKASO Wireless Wifi IP Security Camera 720P Indoor Home Surveillance System Baby Pet Monitor 2 Way Audio, Day/Night Vision Webcam (IP1M-901)",Electronics,https://www.amazon.com/AKASO-Wireless-Security-Surveillance-IP1M-901/dp/B01J5LE0R8/ref=sr_1_3?ie=UTF8&amp;qid=1494540718&amp;sr=8-3&amp;keywords=akaso+wifi+camera,1,1
Petroad Step-in Harnesses for Dog Classic Solid No Pull Adjustable Dog Harness,Pet Supplies,https://www.amazon.com/ColorPet-Harnesses-Classic-Adjustable-Comfortable/dp/B0114M72Q2/ref=sr_1_8?ie=UTF8&amp;qid=1447272177&amp;sr=8-8&amp;keywords=ColorPet,1,1
48 Extra Large Dog Crate/Kennel by Grip-On-Tools,Pet Supplies,https://www.amazon.com/Extra-Large-Dog-Crate-Kennel/dp/B0018DOIGK,1,1
Stop Sign Do Not Pet Leash Wrap,Pet Supplies,https://www.amazon.com/Stop-Sign-Not-Leash-Wrap/dp/B00DM0OBNM/ref=sr_1_6?ie=UTF8&amp;qid=1503152975&amp;sr=8-6&amp;keywords=do+not+pet,1,1
Dog First Aid: A Field Guide to Emergency Care for the Outdoor Dog,Books,https://www.amazon.com/Dog-First-Aid-Emergency-Outdoor/dp/1885106041,1,1
Julius-K9 IDC Powerharness 15 colors and 9 adjustable sizes - Renowned for the comfort and fit - With removable logo labels - Wide assortment of stock labels are available,Pet Supplies,https://www.amazon.com/Julius-K9-Powerharness-Renowned-Comfort-Removable/dp/B0041W936A/ref=sr_1_1?ie=UTF8&amp;qid=1462222409&amp;sr=8-1&amp;keywords=julius+k9,1,1
Genetics and the Social Behavior of the Dog,Books,https://www.amazon.com/Genetics-Social-Behavior-John-Scott/dp/0226743381/,1,1
Franklin Sports 9-Inch Flexi Cones (Pack of 4),Sports & Outdoors,https://www.amazon.com/Franklin-Sports-9-Inch-Flexi-Cones/dp/B003VIIW44,1,1
Earth Bath Green Tea Dog Grooming Wipes 100ct,Pet Supplies,https://www.amazon.com/Ear-Grmg-Wipes-Tea-100pk/dp/B00BUFW2UK,1,1
Karen Pryor Clicker Training  Terry Ryan Treat Pouch for Pet Training,Pet Supplies,https://www.amazon.com/Karen-Pryor-Clicker-Training-Limited/dp/B00CDSDDWY,1,1
Burt's Bees Oatmeal Dog Shampoo,Pet Supplies,https://www.amazon.com/Burts-Bee-Oatmeal-Shampoo-16-Ounce/dp/B00DTEV54Y,1,1
Sculpey Keepsake Deluxe Pawprint Kit,Pet Supplies,https://www.amazon.com/gp/product/B002NHH6NM/ref=oh_aui_detailpage_o00_s00?ie=UTF8&amp;psc=1,1,1
Epi-Pet Sun Protector Spray for Pets,Pet Supplies,https://www.amazon.com/Epi-Pet-Sun-Protector-Spray-Pets/dp/B002AI39QW,1,1
"Foscam FI9821W V2 2-Pack Bundle with 9dbi Antenna, 10ft Power Extension & Universal Bracket - Black",Electronics,https://www.amazon.com/dp/B00HHGBWCK/ref=cm_sw_r_em_apa_YopfzbPZCAZYD,1,1
"Ruffwear Front Range Harness, Large/X-Large, Pacific Blue by Ruffwear",Pet Supplies,https://www.amazon.com/Ruffwear-Front-Harness-X-Large-Pacific/dp/B01M3U4G66/ref=sr_1_4?ie=UTF8&amp;qid=1479411295&amp;sr=8-4&amp;keywords=ruffwear+front+range+harness,1,1
SNOUT SOOTHER Natural Dog Company - Dry Chapped Cracked and Crusty Dog Nose Remedy for Dry Dog Noses 2 OZ,Pet Supplies,https://www.amazon.com/Snout-Soother-2-Oz-Tin/dp/B00IEDA5S2,1,1
Dog Hair Dye Gel,Pet Supplies,https://www.amazon.com/Top-Performance-Hair-Ounces-Screaming/dp/B001VP57VA,1,1
"Epica Luxury Deluxe Pet Car Seat Cover, Quilted, Water Resistant, and Machine Washable",Pet Supplies,https://www.amazon.com/gp/product/B00K5S8LEE?psc=1&amp;redirect=true&amp;ref_=oh_aui_detailpage_o09_s00,1,1
"Hartz Dura Play Dog Toy Bone, Medium (Pack of 2) Colors May Vary",Pet Supplies,https://www.amazon.com/Hartz-Dura-Play-Medium-Colors/dp/B00K9HI41G/ref=redir_mobile_desktop?_encoding=UTF8&amp%3BdpID=51DyCgXXDHL&amp%3BdpPl=1&amp%3Bkeywords=hartz%20dura%20play%20dog%20toys&amp%3Bpi=AC_SX236_SY340_QL65&amp%3Bref=plSrch&amp%3Bsr=8-4&qid=1454194346&ref_=mp_s_a_1_4,1,1
Razor E300S Seated Electric Scooter,Sports & Outdoors,https://www.amazon.com/Razor-E300S-Seated-Electric-Scooter/dp/B001K3JUFM/ref=sr_1_5?s=outdoor-recreation&amp;ie=UTF8&amp;qid=1432578894&amp;sr=1-5,1,1
"UGREEN 3.5mm Audio Stereo Y Splitter Cable 3.5mm Male to 2 Port 3.5mm Female for Earphone, Headset Splitter Adapter, Compatible for iPhone, Samsung, LG, Tablets, MP3 players, Metal Black",Electronics,https://www.amazon.com/Splitter-Earphone-Headset-Compatible-Smartphones/dp/B00LM0ZGK6/ref=sr_1_1?s=audio-video-accessories&amp;ie=UTF8&amp;qid=1467808516&amp;sr=1-1,1,1
Petmate No Spill Bowl,Pet Supplies,https://www.amazon.com/Doskocil-Bowl-No-Spill-Bl/dp/B00M1UWJ5G/ref=sr_1_1?ie=UTF8&amp;qid=1438798195&amp;sr=8-1&amp;keywords=spill+proof+dog+water+bowl,1,1
"Zymox Ear Cleanser With Bio-Active Enzymes, 4 oz.",Pet Supplies,https://www.amazon.com/dp/B0014HYCM0/ref=cm_sw_r_cp_dp_T2_VDYGzb1T8DF00,1,1
iMBAPrice® 12 Feet Professional Quality Nickel Plated 3.5 mm Male/Female Stereo Audio Extension Cable,Electronics,https://www.amazon.com/dp/B001423GZO/ref=pd_lpo_sbs_dp_ss_1?pf_rd_p=1944687622&amp;pf_rd_s=lpo-top-stripe-1&amp;pf_rd_t=201&amp;pf_rd_i=B0002KR13M&amp;pf_rd_m=ATVPDKIKX0DER&amp;pf_rd_r=P5398SBNCHP2RFPYZXHA,1,1
"Dog Leash Lead Nylon 30"" or 4ft with Reflective DO NOT PET writing",Pet Supplies,https://www.amazon.com/Leash-Lead-Nylon-Reflective-writing/dp/B00NVK1I16/ref=sr_1_3?ie=UTF8&amp;qid=1438104804&amp;sr=8-3&amp;keywords=do+not+pet,1,1
"Pearhead Dog or Cat Paw Print Pet Keepsake Photo Frame With Clay Imprint Kit, Perfect Keepsake Frame for Pet Lovers",Pet Supplies,https://www.amazon.com/gp/product/B00P6NOI0O/ref=oh_aui_detailpage_o00_s00?ie=UTF8&amp;psc=1,1,1
Potty Bells Housetraining Dog Doorbells for Dog Training and Housebreaking Your Doggy. 1.4 Inch Dog Bell with Doggie Doorbell and Potty Training for Puppies Instructional Guide,Pet Supplies,https://www.amazon.com/Housetraining-Doorbells-Housebreaking-Instructional-Pet/dp/B00T4XD0VK/ref=sr_1_3?ie=UTF8&amp;qid=1479232070&amp;sr=8-3&amp;keywords=potty+bells,1,1
New Knowledge of Dog Behavior (Dogwise Classics),Books,https://www.amazon.com/The-Knowledge-Behavior-Dogwise-Classics/dp/1929242042,1,1
"100% Pure Omega 3, 6 & 9 Fish Oil for Dogs and Cats",Pet Supplies,https://www.amazon.com/100-Pure-Omega-Fish-Dogs/dp/B00XIB5Q4S?ie=UTF8&amp;psc=1&amp;redirect=true&amp;ref_=oh_aui_detailpage_o03_s00,1,1
"101 Dog Tricks: Step by Step Activities to Engage, Challenge, and Bond with Your Dog",Books,https://www.amazon.com/101-Dog-Tricks-Activities-Challenge/dp/1592533256,1,1
"Your Labrador Retriever Puppy Month by Month, 2nd Edition: Everything you need to know at each stage to ensure your cute & playful puppy gr",Books,https://www.amazon.com/Your-Labrador-Retriever-Puppy-Month/dp/1465451064/ref=sr_1_1?ie=UTF8&amp;qid=1465213774&amp;sr=8-1&amp;keywords=labrador+month+by+month,1,1
NO DOGS Orange Color Coded L-XL Non-Pull Dog Harness and 2 4 6 Foot Padded Leash Sets (Not Good With Other Dogs) PREVENTS Accidents By Warning Others of Your Dog in Advance,Pet Supplies,https://www.amazon.com/Non-pull-Harness-PREVENTS-Accidents-Warning/dp/B008PFNRDE/ref=sr_1_39?s=pet-supplies&amp;ie=UTF8&amp;qid=1427304462&amp;sr=1-39,1,1
"Rubit The Easy Dog Tag Curve Shape Switch Clip, Large, 1.3-Inch Diameter, Purple",Pet Supplies,https://www.amazon.com/Rubit-Switch-1-3-Inch-Diameter-Purple/dp/B00934EYKG/ref=redir_mobile_desktop?_encoding=UTF8&amp%3Bkeywords=rubit%20dog%20tag%20clip&amp%3Bqid=1496169099&amp%3Bsr=8-1&ref_=mp_s_a_1_1,1,1
Ruffwear - Front Range All-Day Adventure Harness for Dogs,Pet Supplies,https://www.amazon.com/Ruffwear-All-Day-Adventure-Harness-Tillandsia/dp/B01MY7VUXU/ref=sr_1_1?s=pet-supplies&amp;ie=UTF8&amp;qid=1499277808&amp;sr=1-1-spons&amp;keywords=ruffwear+front+range+harness&amp;psc=1,1,1
"Dog Sports Skills, Book 3:  Play! (Volume 3)",Books,https://www.amazon.com/Dog-Sports-Skills-Book-Play/dp/0988781840/ref=sr_1_1?s=books&amp;ie=UTF8&amp;qid=1493417995&amp;sr=1-1&amp;keywords=denise+fenzi+play,1,1
"Dog Rules Metal Sign, Humorous Casual Den, Bar, Gameroom, Kennel Decor",Home & Kitchen,https://www.amazon.com/Rules-Humorous-Casual-Gameroom-Kennel/dp/B00GW4INTS/ref=sr_1_1?ie=UTF8&amp;qid=1446485180&amp;sr=8-1&amp;keywords=Rules+for+the+Dog,1,1
"Decker M83 Mini Rubber Curry Comb for Horses, 5-Inch",Pet Supplies,https://www.amazon.com/Decker-M83-Rubber-Horses-5-Inch/dp/B000CSNK02/ref=sr_1_11?ie=UTF8&amp;qid=1468778519&amp;sr=8-11&amp;keywords=curry+comb,1,1
"Strong Durable Dog Leash Lead, (Blue, Red, Black, Purple, Pink - 6-ft, 4-ft, 2-ft), by Downtown Pet Supply",Pet Supplies,https://www.amazon.com/gp/product/B00QB541JY/ref=oh_aui_detailpage_o06_s01?ie=UTF8&amp;psc=1,1,1
"StarMark Training Collar, Large, Black",Pet Supplies,https://www.amazon.com/StarMark-Training-Collar-Large-Blue/dp/B000A6BD5K,1,1
Kong Paracord Leash,Pet Supplies,https://www.amazon.com/KONG-Kong-Paracord-Leash/dp/B00G9FQWR0,1,1
FOTOWELT Dog Sport Pulling Harnesses Chest Strap Belt Mount for Sony HD Action Cam HDR-AS200V AS100V AS30V AS20V AZ1 FDR-X1000VR,Electronics,https://www.amazon.com/FOTOWELT-Pulling-Harnesses-Silver-Dazzne/dp/B00RMNBNRW/,1,1
Dechra MalAcetic Ultra Spray Conditioner (8 fl oz),Pet Supplies,https://www.amazon.com/dp/B00RNZQUKE/ref=cm_sw_r_awd_tjYVub0TMNWDE,1,1
"Tough By Nature Hol-ee Roller, Assorted",Pet Supplies,https://www.amazon.com/JW-Pet-Company-Hol-ee-5-Inches/dp/B0002DJX44/ref=sr_1_1?ie=UTF8&amp;qid=1427720695&amp;sr=8-1&amp;keywords=dog+toy+holee+roller,1,1
Four Paws Red 30 Foot Medium Weight Dog Tie Out Cable,Pet Supplies,https://www.amazon.com/Four-Paws-Medium-Weight-Cable/dp/B0002APL8O/ref=redir_mobile_desktop?_encoding=UTF8&amp%3BdpID=5197xa&amp%3BdpPl=1&amp%3Bkeywords=dog%20tie-out%20cable&amp%3Bpi=AC_SX110_SY165_QL70&amp%3Bsr=8-6&qid=1450578670&ref_=mp_s_a_1_6,1,1
H2O4K9,Pet Supplies,https://www.amazon.com/H2O4K9-Water-Bottle-Travel-25-Ounce/dp/B004VA1M16/ref=sr_1_3?s=pet-supplies&amp;ie=UTF8&amp;qid=1499278319&amp;sr=1-3-spons&amp;keywords=dog+water+bottle&amp;psc=1,1,1
"ALBCORP Reflective Service Dog Vest / Harness, Woven Polyester & Nylon, Comfy Soft Padding, RED / BLACK",Pet Supplies,https://www.amazon.com/ALBCORP-Reflective-Service-Polyester-Neoprene/dp/B01M1BHGP2,1,1
"Petrodex Enzymatic Toothpaste Dog Poultry Flavor, 6.2 oz",Pet Supplies,https://www.amazon.com/Petrodex-Enzymatic-Toothpaste-Poultry-6-2-Ounce/dp/B00025K0R6,1,1
