name,category,amazon_link,total_mentions,subreddit_mentions
"Dog Lift Harness by AMZpets - Support Sling Helps Dogs With Weak Front or Rear Legs Stand Up, Walk, Get Into Cars, Climb Stairs. Best Alternative to Dog Wheelchair",Pet Supplies,https://www.amazon.com/dp/B01CGF57Q8?psc=1,1,1
Fruitables Crunchy Dog Treats,Pet Supplies,https://www.amazon.com/Fruitables-Pumpkin-Apple-Crunchy-Treats/dp/B002R8SLUY/ref=sr_1_1?s=pet-supplies&amp;ie=UTF8&amp;qid=1496167320&amp;sr=1-1&amp;keywords=fruitables+apple,1,1
Justzon Cotton Web Dog Training Lead black,Pet Supplies,https://www.amazon.com/Justzon-Cotton-Training-black-15-Feet/dp/B01L5REDNG/ref=sr_1_3?ie=UTF8&amp;qid=1499277273&amp;sr=8-3&amp;keywords=15+ft+leash,1,1
DOG for DOG Dogbutter Original Peanut Butter with Flaxseed for Dogs,Pet Supplies,https://www.amazon.com/Peanut-Butter-Dogs-Formula-16-Ounce/dp/B009TNE3AM,1,1
"Surgi Snuggly E Collar Alternative, Created By A Veterinarian Specifically to Fit Your Dog, Medium Long",Pet Supplies,https://www.amazon.com/Surgi-Snuggly-Alternative-Veterinarian-Specifically/dp/B00DQ420N2,1,1
KONG Cloud E-Collar for Cats and Dogs,Pet Supplies,https://www.amazon.com/KONG-Cloud-E-Collar-Collar-Medium/dp/B0045Y1JG6/ref=sr_1_1?s=pet-supplies&amp;ie=UTF8&amp;qid=1465711269&amp;sr=1-1&amp;keywords=dog+cone,1,1
Andis Premium Pet Grooming Tools,Pet Supplies,https://www.amazon.com/Andis-Pet-Premium-Slicker-Brush/dp/B00XJEZG44/ref=sr_1_4?s=pet-supplies&amp;ie=UTF8&amp;qid=1467822469&amp;sr=1-4&amp;keywords=soft+slicker+brush,1,1
"Tuff Mutt - Hands Free Dog Leash for Running, Walking, Hiking, Durable Dual-Handle Bungee Leash, Reflective Stitching, 4-Foot Long, Adjustable Waist Belt (Fits up to 42"" waist)",Pet Supplies,https://www.amazon.com/Tuff-Mutt-Dual-Handle-Reflective-Adjustable/dp/B00YQZGD42/ref=sr_1_2?s=pet-supplies&amp;ie=UTF8&amp;qid=1499277419&amp;sr=1-2-spons&amp;keywords=hands+free+leash&amp;psc=1,1,1
JW Pet Treat Tower Treat Dispensing Dog Toy,Pet Supplies,https://www.amazon.com/JW-Pet-Company-43505-Orange/dp/B00DJRGBZE,1,1
The American Pit Bull Terrier (History of Fighting Dogs Series),Books,https://www.amazon.com/gp/product/1846642566/ref=ox_sc_act_title_3?ie=UTF8&amp;psc=1&amp;smid=A3A3EYBOM51W2,1,1
Pettom Gear Cotton Web Dog Training Lead 30/50 Ft,Pet Supplies,https://www.amazon.com/Pettom-Cotton-Training-Leash-Black/dp/B0140KUUUK/ref=sr_1_4?s=pet-supplies&amp;ie=UTF8&amp;qid=1499277698&amp;sr=1-4&amp;keywords=30+ft+leash,1,1
"Paw Brothers Extra Long Hard Pin Slicker Brush, Large",Pet Supplies,https://www.amazon.com/Paw-Brothers-Extra-Slicker-Brush/dp/B014PFS2VE/ref=sr_1_20?s=pet-supplies&amp;ie=UTF8&amp;qid=1467821892&amp;sr=1-20&amp;keywords=slicker+brush,1,1
Hugs Pet Products Chillz Pad Comfort Cooling Gel Pet Pad,Pet Supplies,https://www.amazon.com/dp/B00C65TXO6/ref=cm_sw_r_cp_apa_a.eAxbYY94VKZ,1,1
Aqua Leisure Aqua Comets,Toys & Games,https://www.amazon.com/Aqua-Leisure-Comets/dp/B014YFB9DS/ref=sr_1_15?ie=UTF8&amp;qid=1471470673&amp;sr=8-15&amp;keywords=pool+toy+sink,1,1
Millers Forge Quality Nail Clipper,Pet Supplies,https://www.amazon.com/gp/product/B004QJYZ52/ref=pd_lpo_sbs_dp_ss_1?pf_rd_p=1944687562&amp;pf_rd_s=lpo-top-stripe-1&amp;pf_rd_t=201&amp;pf_rd_i=B0002ARUKQ&amp;pf_rd_m=ATVPDKIKX0DER&amp;pf_rd_r=03B1V6R4HENN27JX2KAV,1,1
Pet Repeller Furniture Pad Sofa & Couch Mat,Pet Supplies,https://www.amazon.com/Pet-Repeller-Furniture-Sofa-Couch/dp/B0071EM254,1,1
A Guide to Living with & Training a Fearful Dog,Books,https://www.amazon.com/Guide-Living-Training-Fearful-Dog/dp/0615387519,1,1
"Before and After Getting Your Puppy: The Positive Approach to Raising a Happy, Healthy, and Well-Behaved Dog",Books,https://www.amazon.com/Before-After-Getting-Your-Puppy/dp/1577314557/ref=sr_1_17?s=books&amp;ie=UTF8&amp;qid=1484615397&amp;sr=1-17&amp;keywords=puppy,1,1
"Farmers Market Organic Pumpkin, 15 Ounce (Pack of 12)",Grocery & Gourmet Food,https://www.amazon.com/Farmers-Market-Organic-Pumpkin-15-oz/dp/B0062A87HA/ref=sr_1_1?ie=UTF8&amp;qid=1428337500&amp;sr=8-1&amp;keywords=canned+pumpkin,1,1
CAUTION Dexil Friendly Dog Collars Color Coded Dog Accident Prevention Leash 4ft/1.2m Prevents Dog Accidents By Letting Others Know Your Dog In Advance Award Winning,Pet Supplies,https://www.amazon.com/CAUTION-Approach-Prevents-Accidents-Warning/dp/B00BXKW9JQ/ref=pd_sim_petsupplies_4/182-4279735-3224605?ie=UTF8&amp;refRID=0AHG1KFY17HTJ8VF2NW2,1,1
ChuckIt! Amphibious Bumper Floating Fetch Toy,Pet Supplies,https://www.amazon.com/Chuckit-Medium-Amphibious-Bumper-Colors/dp/B001AQZ4FE/ref=sr_1_1?ie=UTF8&amp;qid=1465575346&amp;sr=8-1&amp;keywords=dog+toys+for+the+water,1,1
Ruffwear Hydro Plane,Pet Supplies,https://www.amazon.com/Ruffwear-Hydro-X-Large-Dandelion-Yellow/dp/B003D4MS9Q,1,1
Grabber 7+ Hour Hand Warmers - 40 Pair Box,Sports & Outdoors,https://www.amazon.com/Grabber-Hour-Hand-Warmers-Pair/dp/B001G7QECY/ref=redir_mobile_desktop?_encoding=UTF8&amp%3Bpi=AC_SX110_SY165&amp%3Bsr=1-16&qid=1447700689&ref_=mp_s_a_1_16,1,1
"PetZu Mother's Comfort Heartbeat Pet Pillow, Chocolate/White",Pet Supplies,https://www.amazon.com/PetZu-Mothers-Comfort-Heartbeat-Chocolate/dp/B00K1B6RCI/ref=sr_1_2?ie=UTF8&amp;qid=1485174535&amp;sr=8-2&amp;keywords=heartbeat+pillow+puppy,1,1
"Sticky Master Lint Roller - 2 Piece Value Set - Tapeless, Washable, and Reusable Lint Remover and Travel Size Roller",Home & Kitchen,https://www.amazon.com/Sticky-Master-Lint-Roller-Tapeless/dp/B003L27FM0,1,1
Rubies Costume Company Bunny Ears for Your Pet,Pet Supplies,https://www.amazon.com/Rubies-Costume-Company-Bunny-Medium/dp/B00JSMXD5K,1,1
Adjustable Pet Dog Mouth Cover Muzzles Anti-biting Barking Comfortable Black Or Red Dog Muzzle Mesh Mask,Pet Supplies,https://www.amazon.com/Adjustable-Muzzles-Anti-biting-Barking-Comfortable/dp/B01MTZ1HQU/,1,1
Baskerville 5-Inch Rubber Ultra Muzzle,Pet Supplies,https://www.amazon.com/Baskerville-2-Inch-Rubber-Muzzle-Size-4/dp/B00596TFVA/,1,1
Great-Dealz LED dog Collar to Keep Your Dog Safe  – Flashing Dog Collar with Extra Batteries,Pet Supplies,https://www.amazon.com/dp/B00NMX5B8I/,1,1
COOP COOP Hydro Dive Streamers Game,Toys & Games,https://www.amazon.com/COOP-Hydro-Dive-Streamers-Game/dp/B0050GHPWK/ref=sr_1_34?ie=UTF8&amp;qid=1471470703&amp;sr=8-34&amp;keywords=pool+toy+sink,1,1
"Guardian Gear Cotton Web Dog Training Lead 6'x5/8"", Black",Pet Supplies,https://www.amazon.com/Guardian-Gear-Cotton-Training-20/dp/B001MUI194/ref=sr_1_2?ie=UTF8&amp;qid=1430328170&amp;sr=8-2&amp;keywords=dog+lead+20+ft,1,1
BiteNot Collar,Pet Supplies,https://www.amazon.com/BiteNot-BN6-Collar-27/dp/B001VP87OY/ref=sr_1_16?s=pet-supplies&amp;ie=UTF8&amp;qid=1465711269&amp;sr=1-16&amp;keywords=dog+cone,1,1
