name,category,amazon_link,total_mentions,subreddit_mentions
Nosferatu - The First Vampire,DVD,http://www.amazon.com/dp/B000055XO2/,1,1
Rockin' Bones: 1950s Punk & Rockabily (4CD),Music,http://www.amazon.com/dp/B000FOQ0JG/,1,1
3M Peltor Combat Arms Earplugs,Home Improvement,http://www.amazon.com/dp/B000W2CPCC/,5,1
"Etymotic Research ER20 ETY-Plugs Hearing Protection Earplugs, Large Fit, Red Stem with White Tip (Red)",Health and Beauty,http://www.amazon.com/dp/B0044DEEU6/,1,1
V-MODA Faders VIP Tuned Metal Earplugs (Gunmetal Black),Speakers,http://www.amazon.com/dp/B007TEQNBK/,5,1
Superlux HD-681 EVO (Black),Speakers,http://www.amazon.com/dp/B00CAG1ZAQ/,20,1
"Superlux HD-681 EVO Professional Monitoring Headphones, White",Musical Instruments,http://www.amazon.com/dp/B00CAG1ZG0/,8,1
Grado SR80e Prestige Series Headphones,CE,http://www.amazon.com/dp/B00L1LXOWS/,19,1
Planetary Space Child (Limited Edition Lp),Music,http://www.amazon.com/dp/B071KC71S3/,1,1
