name,category,amazon_link,total_mentions,subreddit_mentions
A Double Bassist’s Guide to Refining Performance Practices,Book,http://www.amazon.com/dp/0253010160/,1,1
"The Real Book: Bass Clef, Sixth Edition",Book,http://www.amazon.com/dp/0634060767/,8,1
O492 - New Method for the Double Bass (English and Japanese Text) - Book 1 - Simandl (English and Japanese Edition),Book,http://www.amazon.com/dp/0825801524/,3,1
Ray Brown - Legendary Jazz Bassist (Artist Transcriptions Bass),Book,http://www.amazon.com/dp/1458412423/,1,1
The Jazz Bass Line Book,Book,http://www.amazon.com/dp/395481000X/,1,1
The Double Bass - Robert Oppelt & Friends,Music,http://www.amazon.com/dp/B000M06NNG/,1,1
"AcuRite 00613 Humidity Monitor with Indoor Thermometer, Digital Hygrometer and Humidity Gauge Indicator",Home,http://www.amazon.com/dp/B0013BKDO8/,56,1
"AIRCARE MA0800 Digital Whole-House Console-Style Evaporative Humidifier, White",Home,http://www.amazon.com/dp/B002AQUK9S/,1,1
J.S. Bach Cello Suite #1 - Jeff Bradetich (Double Bass),DVD,http://www.amazon.com/dp/B002NHNVR2/,1,1
Storch / Hrabe - 57 Studies Volume 1 For Bass Published by International Music Company,Book,http://www.amazon.com/dp/B0049BN666/,1,1
Stagg EDB-3/4 VBR Electric 3/4 Size Double Bass with Gig Bag Included - Violinburst,Musical Instruments,http://www.amazon.com/dp/B004EVO836/,1,1
"Vestil CPRO-800LP Ergonomic Worker Seat/Chair, 13-1/2"" Width, 10"" Depth, 300 lb. Capacity, 18"" - 33"" Height Range",BISS,http://www.amazon.com/dp/B0052PJFCW/,7,1
Chore Boy Copper Scouring Pad (Pack of 10),Home,http://www.amazon.com/dp/B007VGICGK/,1,1
"Korg TM50BK Instrument Tuner and Metronome, Black",Musical Instruments,http://www.amazon.com/dp/B00923H7MA/,3,1
"Upright String Double Bass 10mm End Pin ""Crutch"" Tip",Single Detail Page Misc,http://www.amazon.com/dp/B009ZFF088/,1,1
Radial StageBug SB-4 Piezo DI,Musical Instruments,http://www.amazon.com/dp/B00EIS6VX0/,1,1
