name,category,amazon_link,total_mentions,subreddit_mentions
Fall of Giants: Book One of the Century Trilogy,Book,http://www.amazon.com/dp/0451232852/,3,1
Downton Tabby,Book,http://www.amazon.com/dp/1476765936/,3,1
Past Imperfect: A Novel,eBooks,http://www.amazon.com/dp/B002NANLBK/,1,1
"Poldark, Season 1",TV Series Season Video on Demand,http://www.amazon.com/dp/B00Z61S75S/,1,1
Downton Abbey The Final Season,TV Series Season Video on Demand,http://www.amazon.com/dp/B0191S92UU/,1,1
Masterpiece Classic: Downton Abbey: Seasons 1-6 Complete Collection (UK Edition) [Blu-ray],DVD,http://www.amazon.com/dp/B01GNEQJXI/,1,1
