name,category,amazon_link,total_mentions,subreddit_mentions
"Crafter's Companion The Ultimate Marker Empty Storage Pack, 6/Pack",Art and Craft Supply,http://www.amazon.com/dp/B00B2VC4S2/,4,4
Figure Drawing: Design and Invention,Book,http://www.amazon.com/dp/0615272819/,34,2
Monoprice MP1060-HA60 Graphic Drawing Tablet,Personal Computer,http://www.amazon.com/dp/B004C4ZT0G/,10,2
"Strathmore 300 Series Bristol Smooth Pad, 9""x12"" Tape Bound, 20 Sheets",Home,http://www.amazon.com/dp/B00254AU8Q/,3,2
"Drawing on the Right Side of the Brain: The Definitive, 4th Edition",Book,http://www.amazon.com/dp/1585429201/,79,2
How to Draw: drawing and sketching objects and environments from your imagination,Book,http://www.amazon.com/dp/1933492732/,43,2
"Rendering in Pen and Ink: The Classic Book On Pen and Ink Techniques for Artists, Illustrators, Architects, and Designers",Book,http://www.amazon.com/dp/0823045293/,12,1
Drawing the Head and Hands,Book,http://www.amazon.com/dp/0857680978/,5,1
Figure Drawing for All It's Worth,Book,http://www.amazon.com/dp/0857680986/,26,1
The New Drawing on the Right Side of the Brain,Book,http://www.amazon.com/dp/0874774241/,6,1
Keys to Drawing,Book,http://www.amazon.com/dp/0891343377/,4,1
Drawing Realistic Textures in Pencil,Book,http://www.amazon.com/dp/0891348689/,1,1
Beginner's Guide to Digital Painting in Photoshop,Book,http://www.amazon.com/dp/0955153077/,1,1
The Creative License: Giving Yourself Permission to Be the Artist You Truly Are,Book,http://www.amazon.com/dp/1401307922/,1,1
Constructive Anatomy,Book,http://www.amazon.com/dp/1420934295/,1,1
National Geographic Kids Funny Fill-in: My Animal Adventure (National Geographic Kids Fill-In),Book,http://www.amazon.com/dp/1426313551/,1,1
National Geographic Kids Funny Fill-in: My Pirate Adventure,Book,http://www.amazon.com/dp/1426314809/,1,1
"Drawing on the Right Side of the Brain: The Definitive, 4th Edition",Book,http://www.amazon.com/dp/1585429198/,1,1
The Resurrectionist: The Lost Work of Dr. Spencer Black,Book,http://www.amazon.com/dp/1594746168/,8,1
Fantasy Genesis: A Creativity Game for Fantasy Artists,Book,http://www.amazon.com/dp/1600613373/,2,1
How To Draw Lifelike Portraits From Photographs - Revised: 20 step-by-step demonstrations with bonus DVD,Book,http://www.amazon.com/dp/1600619703/,1,1
500 Drawing Prompts,Book,http://www.amazon.com/dp/1620091356/,1,1
"Moleskine Art Plus Sketchbook, Pocket, Plain, Black, Hard Cover (3.5 x 5.5) (Classic Notebooks)",Book,http://www.amazon.com/dp/8883701054/,1,1
"Avery Top-Load Clear Vinyl Envelopes with Thumb Notch, 9 x 12 inches Insert Size, 10 per Pack (74804)",Office Product,http://www.amazon.com/dp/B00006IC85/,1,1
"Prismacolor Col-Erase Erasable Colored Pencils, 24-Count",Office Product,http://www.amazon.com/dp/B000089DCH/,1,1
"Itoya - Art Profolio ""The Original"" Presentation Books, 9 x 12 Inches (IA129)",Office Product,http://www.amazon.com/dp/B0000AE68P/,1,1
Staedtler Lead Holder (1),Office Product,http://www.amazon.com/dp/B0006HXM8O/,6,1
Faber-Castel 24 Piece Polychromous Colored Pencil Set In Metal Tin,Art and Craft Supply,http://www.amazon.com/dp/B0007OECK8/,3,1
Polychromos 36 Pencil Metal Tin Set,Office Product,http://www.amazon.com/dp/B0007OECKI/,1,1
"Sakura Pigma 30062 Micron Blister Card Ink Pen Set, Black, Ass't Point Sizes 6CT Set",Art and Craft Supply,http://www.amazon.com/dp/B0008G8G8Y/,47,1
"Chameleon Art Products, Chameleon 22-Pen Deluxe Set",Office Product,http://www.amazon.com/dp/B000GT7RZ6/,1,1
Pro Art 18-Piece Sketch/Draw Pencil Set,Art and Craft Supply,http://www.amazon.com/dp/B000HTBBO8/,6,1
"Derwent Graphic Drawing Pencils, Medium, Metal Tin, 12 Count (34214)",Office Product,http://www.amazon.com/dp/B000J69KZQ/,1,1
"Prismacolor Premier Verithin Colored Pencils, 36 Piece",Office Product,http://www.amazon.com/dp/B000MK9YWI/,3,1
Faber-Castell Pitt Artist Pens black brush 199,Art and Craft Supply,http://www.amazon.com/dp/B000WL0UD4/,2,1
"Staedtler Pencil Mars Lumograph, 12 Pieces Set (100 G12)",Office Product,http://www.amazon.com/dp/B0014E2S0Q/,1,1
Faber Castell 9000 Design Pencil FC119064 Pack of 12,Art and Craft Supply,http://www.amazon.com/dp/B0014ZSH0A/,1,1
Art Alternatives Pen & Ink Sketch Fountain Pen Set - Broad,Home,http://www.amazon.com/dp/B0016BLM90/,1,1
Uni Gel Ballpoint Pen Uni-Ball Signo Angelic Color AC White (UM120AC.1),Office Product,http://www.amazon.com/dp/B001AO2T8Q/,1,1
"Krylon K01303A07 Crystal Clear Acrylic Coating Aerosol Spray, 6 Ounce",Home Improvement,http://www.amazon.com/dp/B001K65K26/,7,1
"Staedtler Lumograph Graphite Drawing & Sketching Pencils, Set of all 16 Degrees (100G19)",Office Product,http://www.amazon.com/dp/B001OUVQD0/,1,1
"Prismacolor Premier Illustration Markers, Assorted Tips, Black, 7-Count",Office Product,http://www.amazon.com/dp/B0026HZ4BK/,1,1
Matte Finish Spray Eliminates Glossy Sheen And Provides Permanent Surface Protection (Pkg/2),Art and Craft Supply,http://www.amazon.com/dp/B0029JSGM4/,2,1
"Pentel Arts Pocket Brush Pen, Includes 2 Black Ink Refills (GFKP3BPA)",Office Product,http://www.amazon.com/dp/B002LJRKN8/,18,1
"ArtBin Pencil/Utility Storage Box- Charcoal Container, 6900AB",Art and Craft Supply,http://www.amazon.com/dp/B002PIB0D6/,2,1
"Copic Multiliner SP Black Ink Marker, 0.5 Tip",Art and Craft Supply,http://www.amazon.com/dp/B002UCYCBE/,3,1
"Royal & Langnickel Essentials Sketching Pencil Set, 21-Piece",Art and Craft Supply,http://www.amazon.com/dp/B003DQLFPW/,2,1
Pitt Pigmented Drawing India Ink Artist Pen Box of 4 Line Widths in Black From Faber Castell,Art and Craft Supply,http://www.amazon.com/dp/B003IGID52/,1,1
"Faber-Castell Pitt Artist Pens Essential Set - 4 Black Markers, Variety of Nibs",Art and Craft Supply,http://www.amazon.com/dp/B004PN8HMG/,1,1
"Zig Memory System Millennium Marker Assortment, Black",Art and Craft Supply,http://www.amazon.com/dp/B004W8RW5C/,1,1
"Tombow MONO Zero Eraser, Rectangle 2.5 mm, 1-Pack",Office Product,http://www.amazon.com/dp/B005IQHCKM/,1,1
"Sakura 37488 Gelly Roll Classic 08 (Medium Pt.) 3PK Pen, White",Art and Craft Supply,http://www.amazon.com/dp/B0077RHJSK/,8,1
12 Fantasia Sketch & Drawing Artist Pencils in Tin Storage Case ~Great Gift!,Art and Craft Supply,http://www.amazon.com/dp/B007I84A58/,1,1
Mustek A3 1200S - High Speed A3 Large Format 11.7-inch x 16.5-inch Color Scanner,CE,http://www.amazon.com/dp/B008Y8E1XC/,2,1
"Staedtler Pigment Liner, 0.05mm, Black Ink (308-0.05)",Office Product,http://www.amazon.com/dp/B00AHW3YBS/,1,1
"Nasco 9725407 Foam Geometric Solids Set, Six-Piece, White",BISS,http://www.amazon.com/dp/B00EJSK8G0/,3,1
STUDIO DESIGNS Comet Center with Stool Silver / Black 13325,Art and Craft Supply,http://www.amazon.com/dp/B00EYGR978/,1,1
Wacom Intuos Manga Pen and Touch Small (CTH480S2),Personal Computer,http://www.amazon.com/dp/B00FR8DMU0/,2,1
"Hand Stylus 4mm Retractable Fine Tip Stylus for iPad, iPad Air, iPad Mini, iPhone, Android & Kindle Fire (Silver)",CE,http://www.amazon.com/dp/B00GZ9PM6W/,1,1
"ASUS VivoTab Note M80TA-B1-BK 8"" Tablet with Integrated Professional Wacom Stylus, 32GB",Personal Computer,http://www.amazon.com/dp/B00HWHQKFI/,3,1
"Rendering in Pen and Ink: The Classic Book On Pen and Ink Techniques for Artists, Illustrators, Architects , and Designers",eBooks,http://www.amazon.com/dp/B00IW4XVOI/,1,1
Castle Art Supplies Drawing and Sketching Pencil Art Set (26 Items),Art and Craft Supply,http://www.amazon.com/dp/B00K7KT2E8/,1,1
"Cregle ink - Rechargeable Fine Point Active Stylus for iPad 1/2/3/4/Air, iPhone 4/5/5S, Android, Windows, Kindle Fire, Samsung Galaxy Tab, Note, HP Elite, Google Nexus & many other tablets (Dark Grey)",Wireless,http://www.amazon.com/dp/B00OBSW83Y/,1,1
Sky Ghosts: All for One (Sky Ghosts Series Book 1),eBooks,http://www.amazon.com/dp/B00QQABR5U/,4,1
Ugee M708 Art Design Graphics Drawing Tablet with 10x6 Inch Active Area -Black,Personal Computer,http://www.amazon.com/dp/B00VUHQECU/,6,1
Chunshop 14Pcs Sketch Art Drawing Graphite Pencil 12B 10B 8B 7B 6B 5B 4B 3B 2B 1B 2H HB (01),Art and Craft Supply,http://www.amazon.com/dp/B019I28FUC/,1,1
Fineliner Color Pen Set (HUGE SET OF 60 COLORING PENS) Colorful Ultra Fine 0.4mm Felt Tips in 30 Individual Colors - Porous Point Marker - Perfect for Drawing & Adult Coloring Books,Office Product,http://www.amazon.com/dp/B01ES5D7CU/,1,1
Constructive Anatomy (Dover Anatomy for Artists),Book,http://www.amazon.com/dp/0486211045/,5,1
Zadaro Assorted Paper Blending Stumps And Tortillions Set for Art Sketch Drawing 3Pack of 9pcs,Art and Craft Supply,http://www.amazon.com/dp/B01JFY6D8O/,1,1
The Human Machine (Dover Anatomy for Artists),Book,http://www.amazon.com/dp/0486227073/,3,1
"You Can Draw in 30 Days: The Fun, Easy Way to Learn to Draw in One Month or Less",Book,http://www.amazon.com/dp/0738212415/,14,1
Family Car Song Book,Book,http://www.amazon.com/dp/0762415592/,1,1
Intricate Ink: Animals in Detail Coloring Book,Book,http://www.amazon.com/dp/0764974696/,3,1
Dynamic Wrinkles and Drapery: Solutions for Drawing the Clothed Figure,Book,http://www.amazon.com/dp/0823015874/,3,1
