name,category,amazon_link,total_mentions,subreddit_mentions
"SentrySafe Cash Box, Locking Cash Box With Money Tray, Small, CB-10",Home Improvement,http://www.amazon.com/dp/B000Z8W7I0/,1,1
"American Weigh Scales GEMINI-20 Portable MilliGram Scale, 20 by 0.001 G",Kitchen,http://www.amazon.com/dp/B0012TDNAM/,138,1
"Boston Round Bottles, 1/2 Oz Pack of 12",BISS,http://www.amazon.com/dp/B003FXSUU6/,3,1
BlueQ Recreational Drugs Tin Cigar Box,Home,http://www.amazon.com/dp/B00GLX508W/,1,1
TMS Black Aluminum Makeup Cosmetic Jewelry Storage Case Box Lockable w/ Tiers Strap,Home,http://www.amazon.com/dp/B00KCV1GPA/,1,1
"2x Double Barrel Tube , Nasal Sniffer Snorter Straw by TitanOwl (Silver Color)",Kitchen,http://www.amazon.com/dp/B013JBGZYQ/,4,1
"LabChem LC152201 Hydrochloric Acid Solution, 0.1N (0.1M), 500 mL Volume",BISS,http://www.amazon.com/dp/B01BKWS9QI/,1,1
"DAB Wax discrete Tin, 2-5ml Silicone Dab Container Jars, Stainless Steel Wax Dabber (Green White Black)",Kitchen,http://www.amazon.com/dp/B01LX9Z0EQ/,1,1
