name,category,amazon_link,total_mentions,subreddit_mentions
Understanding Digital Signal Processing (3rd Edition),Book,http://www.amazon.com/dp/0137027419/,3,2
Discrete-Time Signal Processing (3rd Edition) (Prentice Hall Signal Processing),Book,http://www.amazon.com/dp/0131988425/,4,2
Designing Audio Effect Plug-Ins in C++: With Digital Audio Signal Processing Theory,Book,http://www.amazon.com/dp/0240825152/,9,2
Telecommunications Breakdown: Concepts of Communication Transmitted via Software-Defined Radio,Book,http://www.amazon.com/dp/0131430475/,1,1
Discrete-Time Signal Processing (2nd Edition) (Prentice-hall Signal Processing Series),Book,http://www.amazon.com/dp/0137549202/,2,1
Designing Sound (MIT Press),Book,http://www.amazon.com/dp/0262014416/,5,1
The Computer Music Tutorial (MIT Press),Book,http://www.amazon.com/dp/0262680823/,6,1
DAFX: Digital Audio Effects,Book,http://www.amazon.com/dp/0470665998/,1,1
"Signals and Systems, 2nd Edition",Book,http://www.amazon.com/dp/0471164747/,1,1
The DFT: An Owners' Manual for the Discrete Fourier Transform,Book,http://www.amazon.com/dp/0898713420/,1,1
The Scientist & Engineer's Guide to Digital Signal Processing,Book,http://www.amazon.com/dp/0966017633/,4,1
Signals and Systems For Dummies,Book,http://www.amazon.com/dp/111847581X/,2,1
"Designing Software Synthesizer Plug-Ins in C++: For RackAFX, VST3, and Audio Units",Book,http://www.amazon.com/dp/1138787078/,6,1
The Year's Best Science Fiction: Thirty-Third Annual Collection,Book,http://www.amazon.com/dp/1250080835/,1,1
Real Sound Synthesis for Interactive Applications,Book,http://www.amazon.com/dp/1568811683/,1,1
"Fundamentals of Music Processing: Audio, Analysis, Algorithms, Applications",Book,http://www.amazon.com/dp/3319219448/,1,1
Radar Handbook,Book,http://www.amazon.com/dp/007057913X/,1,1
"Designing Software Synthesizer Plug-Ins in C++: For RackAFX, VST3, and Audio Units",eBooks,http://www.amazon.com/dp/B00P2ITFZG/,1,1
"Fundamentals of Radar Signal Processing, Second Edition (McGraw-Hill Professional Engineering)",Book,http://www.amazon.com/dp/0071798323/,1,1
Digital Signal Processing and the Microcontroller,Book,http://www.amazon.com/dp/0130813486/,1,1
