name,category,amazon_link,total_mentions,subreddit_mentions
Brother HL-L2300D Monochrome Laser Printer with Duplex Printing,CE,http://www.amazon.com/dp/B00NQ1CLTI/,22,2
Square Perfect 1050 Sp500 Platinum Photo Studio with 2 Light Tents and 8 Backgrounds for Product Photography,Photography,http://www.amazon.com/dp/B000OZRFR2/,1,1
"Sealed Air Jiffy Lite Cushioned Mailers, f Seal, #2, 8.5 x 12 Inches, Pack of 100 (39093)",BISS,http://www.amazon.com/dp/B000RJXWJU/,1,1
"S.P. Richards Company Handheld Sealing Tape Dispenser, Holds 2-Inch Wide Tape with 3-Inch Core (SPR01752)",Office Product,http://www.amazon.com/dp/B001SIKQG6/,1,1
"Weighmax 2822-75LB postal shipping scale, Battery and AC Adapter Included",BISS,http://www.amazon.com/dp/B002U4OEDS/,9,1
"Brother P-touch Genuine TZe-SE4, ~3/4"" (0.7"") Black on White Tamper Evident Laminated Tape –26.2 ft (8m) (TZESE4)",Office Product,http://www.amazon.com/dp/B0055MBR1Y/,1,1
"Sparco Sealing Tape Transparent Heavy Duty, 48mm x 50m, 6 Rolls (60041)",Office Product,http://www.amazon.com/dp/B005P7P9M2/,15,1
iMBAPrice 50 - 14.5x19 Premium Matte Finish Self-Sealing Non-Padded White Poly Mailers/Mailing Envelopes/Bags (iMBA-6PM-50),Office Product,http://www.amazon.com/dp/B00JKTSIME/,1,1
"USPACKSHOP 175' 3/16"" Small Bubble Cushioning Wrap Perforated Every 12"", 12"" Wide",Office Product,http://www.amazon.com/dp/B00S1R9EM4/,4,1
Sterling Protector Case for Hot Wheels & Matchbox die-cast cars – 12 Pack,Toy,http://www.amazon.com/dp/B01DTLS4Q8/,2,1
100 12x15.5 WHITE POLY MAILERS ENVELOPES BAGS 12 x 15.5,Office Product,http://www.amazon.com/dp/B000HG8720/,4,1
"Tape King Clear Packing Tape - XL 110 Yards Per Roll (Pack of 6 Rolls) - Stronger & Thicker 2.7mil, Heavy Duty Adhesive Industrial Depot Tape for Moving Packaging Shipping, Office & Storage",Office Product,http://www.amazon.com/dp/B01K82EQ54/,1,1
