name,category,amazon_link,total_mentions,subreddit_mentions
The Wages of Destruction: The Making and Breaking of the Nazi Economy,Book,http://www.amazon.com/dp/0143113208/,30,1
A Distant Mirror:  The Calamitous 14th Century,Book,http://www.amazon.com/dp/0345349571/,14,1
The Economic Growth of the United States: 1790-1860 (The Norton Library : Economics/History ; N346),Book,http://www.amazon.com/dp/0393003469/,2,1
Global Capitalism: Its Fall and Rise in the Twentieth Century,Book,http://www.amazon.com/dp/039332981X/,4,1
"Institutions, Institutional Change and Economic Performance (Political Economy of Institutions and Decisions)",Book,http://www.amazon.com/dp/0521397340/,7,1
