name,category,amazon_link,total_mentions,subreddit_mentions
Mixing Secrets for  the Small Studio (Sound On Sound Presents...),Books,https://www.amazon.com/Mixing-Secrets-Small-Studio-Senior/dp/0240815807/ref=sr_1_3?ie=UTF8&amp;qid=1463203085&amp;sr=8-3&amp;keywords=mixing+electronic+music,7,4
Music Theory for Computer Musicians,Books,https://www.amazon.com/Theory-Computer-Musicians-Michael-Hewitt/dp/1598635034,5,3
Sony MDR7506 Professional Large Diaphragm Headphone,Musical Instruments,https://www.amazon.com/gp/product/B000AJIF4E/ref=pd_lpo_sbs_dp_ss_2?pf_rd_p=1944687602&amp;pf_rd_s=lpo-top-stripe-1&amp;pf_rd_t=201&amp;pf_rd_i=B00001W0DH&amp;pf_rd_m=ATVPDKIKX0DER&amp;pf_rd_r=0ZGK64CB13CBPMR3CY2J,11,2
"Designing Software Synthesizer Plug-Ins in C++: For RackAFX, VST3, and Audio Units",Books,https://www.amazon.com/Designing-Software-Synthesizer-Plug-Ins-RackAFX/dp/1138787078/ref=pd_sim_14_1?ie=UTF8&amp;refRID=1906YDF1NESAV4AXH0VQ&amp;dpID=5172kL72hhL&amp;dpSrc=sims&amp;preST=_AC_UL160_SR124,2,2
"Passion Lubes Passion Water and Silicone Blend Hybrid Lubricant, 55 Gallon","Health, Household & Baby Care",https://www.amazon.com/Passion-Lubes-Silicone-Hybrid-Lubricant/dp/B00SZ3O6OU/ref=sr_1_1_a_it?ie=UTF8&amp;qid=1467505340&amp;sr=8-1&amp;keywords=barrel+of+lube,21,1
Sennheiser HD 598 Cs Closed Back Headphone,Electronics,https://www.amazon.com/Sennheiser-HD-598-Cs-Headphone/dp/B01JP436TS/ref=sr_1_1?s=aht&amp;ie=UTF8&amp;qid=1480716583&amp;sr=1-1&amp;keywords=Sennheiser+HD+598Cs,9,1
How to Become a Straight-A Student: The Unconventional Strategies Real College Students Use to Score High While Studying Less,Books,https://www.amazon.com/How-Become-Straight-Student-Unconventional/dp/0767922719/ref=pd_sim_14_1?_encoding=UTF8&amp;psc=1&amp;refRID=EB41PK85VX6F33N7BK9V,6,1
Last Night a DJ Saved My Life: The History of the Disc Jockey,Books,https://www.amazon.com/Last-Night-DJ-Saved-Life/dp/0802146104/ref=sr_1_1?s=books&amp;ie=UTF8&amp;qid=1421350101&amp;sr=1-1&amp;keywords=last+night+a+dj+saved+my+life,4,1
So Good They Can't Ignore You: Why Skills Trump Passion in the Quest for Work You Love,Books,https://www.amazon.com/Good-They-Cant-Ignore-You/dp/1455509124/ref=pd_sim_14_5?_encoding=UTF8&amp;psc=1&amp;refRID=6330FJPAPY4XSJDAAA1F,4,1
JBL LSR305 Professional Studio Monitor (PACK OF 2),Musical Instruments,https://www.amazon.com/dp/B00F1DEI8G/,3,1
"Akai Professional MPK Mini MKII | 25-Key Ultra-Portable USB MIDI Drum Pad & Keyboard Controller with Joystick, VIP Software Download Included",Musical Instruments,https://www.amazon.com/Akai-Professional-MPK-Ultra-Portable-Controller/dp/B00IJ6QAO2/ref=redir_mobile_desktop?_encoding=UTF8&ref_=dp_ob_neva_mobile,3,1
Sennheiser HD280PRO Headphone (new model),Electronics,https://www.amazon.com/Sennheiser-HD280PRO-Headphones-old-model/dp/B00IT0IHOY/ref=sr_1_5?s=electronics&amp;ie=UTF8&amp;qid=1498754692&amp;sr=1-5&amp;keywords=sennheiser&amp;refinements=p_36,3,1
KRK RP5G3-NA Rokit 5 Generation 3 Powered Studio Monitor - Pair,Musical Instruments,https://www.amazon.com/KRK-RP5G3-NA-Generation-Powered-Monitor/dp/B00FX7MMRO/,2,1
Techno Rebels: The Renegades of Electronic Funk (Painted Turtle),Books,https://www.amazon.com/Techno-Rebels-Renegades-Electronic-Painted/dp/0814334385/ref=sr_1_1?s=books&amp;ie=UTF8&amp;qid=1421350046&amp;sr=1-1&amp;keywords=techno+rebels,2,1
Debrox Drops Earwax Removal Aid drops,"Health, Household & Baby Care",https://www.amazon.com/Debrox-Earwax-Removal-Drops-Fluid/dp/B00ANL4Z4I/,2,1
Sabrent 4-Port USB 2.0 Hub with Individual Power Switches and LEDs (HB-UMLS),Electronics,https://www.amazon.com/Sabrent-4-Port-Individual-Switches-HB-UMLS/dp/B00BWF5U0M/ref=redir_mobile_desktop?_encoding=UTF8&amp%3BdpID=51SuZUNPzJL&amp%3BdpSrc=sims&amp%3BpreST=_AC_UL100_SR100&ref_=pd_aw_sim_267_3,2,1
How to Win at College: Surprising Secrets for Success from the Country's Top Students,Books,https://www.amazon.com/How-Win-College-Surprising-Countrys/dp/0767917871/ref=sr_1_1?ie=UTF8&amp;qid=1484643369&amp;sr=8-1&amp;keywords=how+to+win+at+college,2,1
Energy Flash: A Journey Through Rave Music and Dance Culture,Books,https://www.amazon.com/gp/product/1593764073/ref=ox_sc_act_title_1?ie=UTF8&amp;psc=1&amp;smid=ATVPDKIKX0DER,2,1
Deep Work: Rules for Focused Success in a Distracted World,Books,https://www.amazon.com/Deep-Work-Focused-Success-Distracted/dp/1455586692/ref=pd_bxgy_14_img_2?_encoding=UTF8&amp;psc=1&amp;refRID=CBNBFZ5WS3XETD5P1B0T,2,1
The Winter Harvest Handbook: Year Round Vegetable Production Using Deep-Organic Techniques and Unheated Greenhouses,Books,https://www.amazon.com/Winter-Harvest-Handbook-Deep-Organic-Greenhouses/dp/1603580816/ref=sr_1_1?ie=UTF8&amp;qid=1481778002&amp;sr=8-1&amp;keywords=winter+production+book,1,1
Rave America: New School Dancescapes,Books,https://www.amazon.com/Rave-America-New-School-Dancescapes/dp/1550223836/ref=sr_1_1?s=books&amp;ie=UTF8&amp;qid=1421350330&amp;sr=1-1&amp;keywords=rave+america,1,1
Generation Ecstasy: Into the World of Techno and Rave Culture,Books,https://www.amazon.com/Generation-Ecstasy-World-Techno-Culture/dp/0415923735/ref=asap_bc?ie=UTF8,1,1
The Rough Guide to House Music,Books,https://www.amazon.com/Rough-Guide-House-Music/dp/1858284325/ref=sr_1_1?s=books&amp;ie=UTF8&amp;qid=1421350616&amp;sr=1-1&amp;keywords=the+rough+guide+to+house,1,1
The Manual: How to Have a Number One the Easy Way,Books,https://www.amazon.com/Manual-How-Have-Number-Easy/dp/1899858652/ref=sr_1_1?s=books&amp;ie=UTF8&amp;qid=1421350795&amp;sr=1-1&amp;keywords=KLF+the+manual,1,1
"""You Better Work!"" Underground Dance Music in New York City",Books,https://www.amazon.com/Better-Work-Underground-Dance-Music/dp/0819564044/ref=sr_1_1?s=books&amp;ie=UTF8&amp;qid=1421350247&amp;sr=1-1&amp;keywords=you+better+work,1,1
Alfred's Basic Adult Theory Piano Book: Level One (2462),Books,https://www.amazon.com/Alfreds-Basic-Adult-Theory-Piano/dp/0882846353,1,1
Composition for Computer Musicians,Books,https://www.amazon.com/Composition-Computer-Musicians-Michael-Hewitt/dp/1598638610,1,1
Harmony for Computer Musicians,Books,https://www.amazon.com/Harmony-Computer-Musicians-Michael-Hewitt/dp/1435456726/,1,1
BEHRINGER MINIFBQ FBQ800,Musical Instruments,https://www.amazon.com/Behringer-FBQ800-BEHRINGER-MINIFBQ/dp/B000MJ406Y/ref=sr_1_1?ie=UTF8&amp;qid=1453244129&amp;sr=8-1&amp;keywords=behringer+equalizer,1,1
Designing Audio Effect Plug-Ins in C++: With Digital Audio Signal Processing Theory,Books,https://www.amazon.com/Designing-Audio-Effect-Plug-Ins-Processing/dp/0240825152,1,1
JBL Pro LSR308-PAIR Studio Montior,Musical Instruments,https://www.amazon.com/JBL-LSR308-14331-Pro-LSR308-PAIR/dp/B00JZT20U0,1,1
Omaker Omaker M4 Portable Bluetooth 4.0 Speaker with 12 Hour Playtime for Outdoors or Shower - Black,Cell Phones & Accessories,https://www.amazon.com/Omaker-Portable-Bluetooth-Playtime-Outdoors/dp/B01LPF0T6S/,1,1
Avantone Pro MixCube Active Studio Monitor (Single),Musical Instruments,https://www.amazon.com/Avantone-Pro-MixCube-Active-Monitor/dp/B003BQ1Y82/,1,1
Casio LK175 61-Lighted Key USB Personal Keyboard,Musical Instruments,https://www.amazon.com/Casio-LK175-Lighted-Personal-Keyboard/dp/B00MZCES7W/,1,1
How to Be a High School Superstar: A Revolutionary Plan to Get into College by Standing Out (Without Burning Out),Books,https://www.amazon.com/How-High-School-Superstar-Revolutionary/dp/0767932587/ref=pd_bxgy_14_img_3?_encoding=UTF8&amp;psc=1&amp;refRID=6330FJPAPY4XSJDAAA1F,1,1
Ted Greene -- Chord Chemistry,Books,https://www.amazon.com/Ted-Greene-Chord-Chemistry/dp/0898986966,1,1
Rock Band 3 Wireless Keyboard for Xbox 360,Video Games,https://www.amazon.com/Rock-Band-Wireless-Keyboard-Xbox-360/dp/B003RS19N4,1,1
