name,category,amazon_link,total_mentions,subreddit_mentions
The Muslim Brotherhood: Evolution of an Islamist Movement,Books,https://www.amazon.com/The-Muslim-Brotherhood-Evolution-Islamist/dp/0691149402,1,1
The Genius and the Goddess: Arthur Miller and Marilyn Monroe,Books,https://www.amazon.com/Genius-Goddess-Arthur-Miller-Marilyn/dp/0252078543,1,1
Journalism Education in Countries with Limited Media Freedom (Mass Communication and Journalism),Books,https://www.amazon.com/Journalism-Education-Countries-Limited-Communication/dp/1433110849,1,1
Rethinking Nasserism: Revolution and Historical Memory in Modern Egypt,Books,https://www.amazon.com/Rethinking-Nasserism-Revolution-Historical-Memory/dp/161610130X,1,1
Beyond America's Grasp: A Century of Failed Diplomacy in the Middle East,Books,https://www.amazon.com/Beyond-Americas-Grasp-Century-Diplomacy/dp/B008SM4D50,1,1
"HEAROS Ultimate Softness Series Foam Earplugs, 100 Pair","Health, Household & Baby Care",https://www.amazon.com/HEAROS-Ultimate-Softness-Foam-Earplugs/dp/B01JY1TFZQ/,1,1
