name,category,amazon_link,total_mentions,subreddit_mentions
"American Weigh Scale AWS-100 Digital Pocket Scale, 100g X 0.01g Resolution",Kitchen,http://www.amazon.com/dp/B0012LOQUQ/,22,2
Wake & Bake: a cookbook,eBooks,http://www.amazon.com/dp/B00HNJD1RA/,,1
"Etekcity Lasergrip 774 Non-contact Digital Laser Infrared Thermometer Temperature Gun -58℉~ 716℉ (-50℃ ~ 380℃), Yellow and Black",Kitchen,http://www.amazon.com/dp/B00837ZGRY/,91,1
"Smoke Buddy Personal Air Filter, Blue",Home,http://www.amazon.com/dp/B00478UIB2/,32,1
"When Panic Attacks: The New, Drug-Free Anxiety Therapy That Can Change Your Life",Book,http://www.amazon.com/dp/076792083X/,9,1
MarsHydro 300W LED Grow Light Full Spectrum for Hydroponic Indoor Plants Growing Veg and Flower,Lawn & Patio,http://www.amazon.com/dp/B00XC3LBI2/,9,1
"Woods 50006WD Indoor 24hr Mechanical Outlet Timer, 2 Pack, 1 Polarized Outlet",Home Improvement,http://www.amazon.com/dp/B006LYHED0/,6,1
"MILLIARD Horticulture D-Door 30"" x 18"" x 36"" 100% Reflective Mylar Hydroponic Grow Tent with Window, Great for Indoor Planting and Early Seedling Starters",Lawn & Patio,http://www.amazon.com/dp/B00H2ULDR0/,5,1
Chasing the Scream: The First and Last Days of the War on Drugs,Book,http://www.amazon.com/dp/1620408910/,4,1
The Cannabis Encyclopedia: The Definitive Guide to Cultivation & Consumption of Medical Marijuana,Book,http://www.amazon.com/dp/1878823345/,3,1
Vector Thunderbird Butane Torch Insert,Health and Beauty,http://www.amazon.com/dp/B008Z8W714/,3,1
"econoLED Electronic Aluminum Herb Grinder Crusher for Weed Metal Herb Grinder Tabacco Crusher Grinder Cracker, Silver, Zinc Alloy US Seller",Kitchen,http://www.amazon.com/dp/B002E00UVI/,3,1
"Boveda 62-Percent RH 2-Way Humidity Control, 8 gram - 10 Pack",Health and Beauty,http://www.amazon.com/dp/B00JV27MF4/,2,1
Glass Screen Daisy Style Assorted Colors - Pack of 10,Sports,http://www.amazon.com/dp/B008Y9PNAQ/,2,1
"Safety Solution 10, 12 and 20 Gauge GA Stealth 56 Round Shotgun Shotshell Shoulder Bandolier, Black",Sports,http://www.amazon.com/dp/B01MD1RZHR/,1,1
Lorann Hard Candy Flavoring Oils YOU Pick the Flavors 12 Pack + One Dram Dropper by LorAnn Oils,Grocery,http://www.amazon.com/dp/B007HSDNS4/,1,1
If A Peacock Finds A Pot Leaf,Book,http://www.amazon.com/dp/1484107004/,1,1
CK Products Plain Bar Chocolate Mold,Kitchen,http://www.amazon.com/dp/B003QP331O/,1,1
"Ball Heritage Collection Quart Jars with Lids and Bands, Green, Set of 6",Kitchen,http://www.amazon.com/dp/B00GY9HO8W/,1,1
"Ball Heritage Collection Pint Jars with Lids and Bands, Green, Set of 6",Kitchen,http://www.amazon.com/dp/B00H40COY4/,1,1
Cannabis Closet First Hand Accounts of the Marijuana Mainstream,Book,http://www.amazon.com/dp/B005M5SDN4/,1,1
SE MT3001 Deluxe Butane Power Torch with Built-In Ignition System,Home Improvement,http://www.amazon.com/dp/B005FN0ZCK/,1,1
"Zen 3 Bundles Pipe Cleaners, Soft, 132 Count",Home,http://www.amazon.com/dp/B004QKTLNC/,1,1
Games People Play: The Basic Handbook of Transactional Analysis.,Book,http://www.amazon.com/dp/0345410033/,1,1
Butane Pipe Lighter Insert for Flip-top Lighters,Sports,http://www.amazon.com/dp/B003IRLBUA/,1,1
Apex Twice-A-Day Weekly Pill Organizer 1 ea,Health and Beauty,http://www.amazon.com/dp/B000EGKTEW/,1,1
Chromium Crusher 2.2 Inch 4 Piece Tobacco Spice Herb Grinder - Black,Kitchen,http://www.amazon.com/dp/B00QMXB38W/,1,1
Glass jack style smoking screens 20 pieces,Health and Beauty,http://www.amazon.com/dp/B00BVEOJRY/,1,1
"Metrical Poetry Tobacco Spice Herb Grinder, 2.5 Inch 4 Piece Multi-function Herbal Weed Pollen Plant Chromium Crusher (Golden)",Kitchen,http://www.amazon.com/dp/B01I51JM36/,1,1
SMART CRUSHER Cnc Aluminum 4pcs Herb Spice grinder with scraper & grinder pouch,Kitchen,http://www.amazon.com/dp/B005AMJJYQ/,1,1
