name,category,amazon_link,total_mentions,subreddit_mentions
"ORGANIC Cotton Makeup Puff, Medium",Beauty,http://www.amazon.com/dp/B000TCD51A/,30,28
American Weigh Scales LB-501 Digital Kitchen Scale,Kitchen,http://www.amazon.com/dp/B005UGBG20/,16,5
Beadalon 3-Piece Spool Tamer Set,Art and Craft Supply,http://www.amazon.com/dp/B00KAZ139M/,5,5
Glycerin Vegetable Kosher USP - 1 Quart (43 oz.),Health and Beauty,http://www.amazon.com/dp/B004C7MTLA/,12,4
Propylene Glycol 1 Quart - USP - KOSHER - PURE,BISS,http://www.amazon.com/dp/B005F5OJG6/,8,3
"COTTON LABO Organic Cotton Large Puff, 0.23 Pound",Beauty,http://www.amazon.com/dp/B000TCEXOS/,4,3
Graham Professional Cellucotton Beauty Coil (Rayon fiber),Beauty,http://www.amazon.com/dp/B018IYY3I4/,3,3
"Smoke Buddy Personal Air Filter, Blue",Home,http://www.amazon.com/dp/B00478UIB2/,32,2
Nitecore i2 Intellicharge Charger for 18650 AAA AA Li-Ion/NiMH Battery,Home Improvement,http://www.amazon.com/dp/B0096U26QQ/,7,2
Koh Gen Do Organic Cotton 80 sheets for Skin Care,Beauty,http://www.amazon.com/dp/B00NU3H3KE/,3,2
"Samsung INR18650-25R  Lithium Ion Li-Ion Rechargeable Flat Top 2500mAh,3.6V Batteries Pack of 2 (Green assorted)",CE,http://www.amazon.com/dp/B00NUI45AU/,3,2
510 808 Ohm Resistance Reader Meter,Speakers,http://www.amazon.com/dp/B00KY45S3Q/,2,2
Beadalon 25-Piece Spool Tamer Set,Art and Craft Supply,http://www.amazon.com/dp/B00KAZ137Y/,2,2
10400mAh LCD External Battery Power Bank 18650 Battery Charger Box with 2-Port 5A for iPhone 6 Plus 5S Galaxy S6 S5 Nexus 5 HTC One ( 4 x 18650 Li-ion battery not included ),Electronics,https://www.amazon.com/gp/product/B012CN6Q7I,,1
"iSonic P4810 Commercial Ultrasonic Cleaner, 2.1Qt/2L, 110V for DIY Liposomal, Herb Extraction",BISS,http://www.amazon.com/dp/B005GA1I3M/,,1
"Passion Lubes, Natural Water-Based Lubricant, 55 Gallon Drum",Health and Beauty,http://www.amazon.com/dp/B005MR3IVO/,273,1
"Hakko CHP-170 Micro Soft Wire Cutter, 1.5mm Stand-off, Flush Cut, 2.5mm Hardened Carbon Steel Construction, 21-Degree Angled Jaw, 8mm Jaw Length, 16 Gauge Maximum Cutting Capacity",BISS Basic,http://www.amazon.com/dp/B00FZPDG1K/,9,1
"Kidde FA110 Multi Purpose Fire Extinguisher 1A10BC, 1 Pack",Home Improvement,http://www.amazon.com/dp/B00002ND64/,7,1
"X-Long 36"" Flex-Cable Pick-Up Tool 4-Finger Claw End Retriever Snake",BISS,http://www.amazon.com/dp/B006ZEOXJY/,6,1
How Not to Be a Dick: An Everyday Etiquette Guide,Book,http://www.amazon.com/dp/1936976021/,6,1
"Anker 60W 6-Port USB Wall Charger, PowerPort 6 for iPhone X/ 8/ 7 / 6s / Plus, iPad Pro / Air 2 / mini/ iPod, Galaxy S7 / S6 / Edge / Plus, Note 5 / 4, LG, Nexus, HTC and More",Wireless,http://www.amazon.com/dp/B00P936188/,6,1
The Jesus Toaster,Kitchen,http://www.amazon.com/dp/B0042QRYO8/,5,1
Nitecore D2 Digicharger Bundle with EASTSHINE EB182 Battery Box and Car Charger,Speakers,http://www.amazon.com/dp/B00KW2ZDHQ/,4,1
Generic CoBean Silver Large Size Lipo Battery Guard Sleeve/Bag for Charge & Storage,Toy,http://www.amazon.com/dp/B005HTH78W/,4,1
"Holmes HAWF2021 Dual Blade Twin Window 7 Inch Fan, White (Medium)",Home,http://www.amazon.com/dp/B00008XET9/,4,1
"Hakko CHP-170 Micro Soft Wire Cutter, 1.5mm Stand-off, Flush Cut, 2.5mm Hardened Carbon Steel Construction, 21-Degree Angled Jaw, 8mm Jaw Length, 16 Gauge Maximum Cutting Capacity",Home Improvement,http://www.amazon.com/dp/B017ODDPNO/,4,1
Teenitor Fireproof Explosionproof Lipo Battery Safe Bag Lipo Battery Guard Safe Bag Pouch Sack for Charge & Storage 185x75x60mm Large size,Toy,http://www.amazon.com/dp/B00T01LLP8/,4,1
"Optimum Nutrition Opti-Men Daily Multivitamin Supplement, 150 Count","Health, Household & Baby Care",https://www.amazon.com/Optimum-Nutrition-Opti-Men-Supplement-Count/dp/B00K2RJAR0,3,1
"SE 8036TM-NEW Telescopic Magnet Pick-Up, 30""",Home Improvement,http://www.amazon.com/dp/B000RB3XBA/,3,1
Nitecore New i4 2016 Intellicharger Smart Battery Charger for Li-ion IMR Ni-MH NiCd,Speakers,http://www.amazon.com/dp/B00KBFZDI8/,3,1
Private Preserve Wine Preservation Spray,Kitchen,http://www.amazon.com/dp/B0000DCS18/,3,1
Nitecore i2 2016 Intellicharger Smart Battery Charger for Li-ion IMR Ni-MH NiCd,Speakers,http://www.amazon.com/dp/B009JMDD9U/,3,1
"Leegoal Large LiPo Guard Battery Fireproof Safe Safety Charge Charging Pouch Case (Silver, Small)",Sports,http://www.amazon.com/dp/B00B5PXWP4/,3,1
Genuine Lightning Vapes Ceramic Tweezers - Heat Resistant - Pointed,Health and Beauty,http://www.amazon.com/dp/B00KAEWG76/,2,1
"Holmes Small Room HEPA Air Purifier, White, 3 Speeds with Optional Ionizer, Compact Allergy Odor Dust Mold Smoke Pet Cooking Filtration for Cleaner Air",Home,http://www.amazon.com/dp/B0000DK35B/,2,1
AmazonBasics Universal Travel Case for Small Electronics and Accessories -Black,Wireless,http://www.amazon.com/dp/B002VPE1QG/,2,1
MUJI Makeup Facial Soft Cut Cotton Unbleached 60x50 mm 180pcs,Beauty,http://www.amazon.com/dp/B00VHA3ZXQ/,2,1
Datacomm 50-3323-WH-KIT Flat Panel TV Cable Organizer Kit with Power Solution - White,Speakers,http://www.amazon.com/dp/B001PB7UVA/,2,1
Muji Japan 4 Layers Facial Cotton Pad (60 Sheets),Beauty,http://www.amazon.com/dp/B00EWLBAAW/,2,1
Stanley 66-039 6-Piece Jewelers Precision Screwdriver Set,Home Improvement,http://www.amazon.com/dp/B00002X29G/,2,1
"Fiskars 8 Inch Softgrip Scissors Straight, Stainless Steel (01-004761J)",Art and Craft Supply,http://www.amazon.com/dp/B002YIP97K/,2,1
Cobalt Blue Glass Bottles with Droppers 2 Oz - 12 Per Package,Health and Beauty,http://www.amazon.com/dp/B000B9V20W/,2,1
Invisible Glass Spray Window & Glass Cleaner,Health and Beauty,http://www.amazon.com/dp/B000M3V95U/,2,1
Clear Plastic Large Capacity Cosmetic Storage and Makeup Organizer,Beauty,http://www.amazon.com/dp/B001B0YMB6/,2,1
"Plastic Transfer Pipettes 1ml, Graduated, Pack of 500",BISS,http://www.amazon.com/dp/B005CD2I50/,2,1
Hleeduo® Electronic Shisha Charcoal,Lawn & Patio,http://www.amazon.com/dp/B005TQC6S4/,1,1
"GoodSense Coated Aspirin Pain Reliever Tablets, 325 mg, 500 Count",Health and Beauty,http://www.amazon.com/dp/B0091RRORA/,1,1
Battery Storage Case Holder/Organizer for 18650 or CR123A Battery (5 Colors Set),CE,http://www.amazon.com/dp/B00DU7RQP2/,1,1
Marsan Industry Organic Cotton Puff Size M 200 sheets,Single Detail Page Misc,http://www.amazon.com/dp/B00I2GXGAU/,1,1
Nicorette QuickMist Mouthspray 1 x 150 Freshmint,Beauty,http://www.amazon.com/dp/B004UEB65U/,1,1
G2PLUS 100PCS 3ml Disposable Plastic Essential Oils Graduated Transfer Pipettes,BISS,http://www.amazon.com/dp/B00W4QJNYW/,1,1
Body Toolz Cuticle Trimmer,Health and Beauty,http://www.amazon.com/dp/B00PYFZ0BA/,1,1
"Disposable Beard Nets Spun-bonded Polypropylene 100, 500, 1000 Packs",Kitchen,http://www.amazon.com/dp/B00XKKWN6Q/,1,1
"Heavy Duty 700 Watt Fog Machine W/Remote and One Gallon Fog Juice - Impressive 2,500 Cubic ft. per minute",Musical Instruments,http://www.amazon.com/dp/B016QK00WK/,1,1
NASA Space Helmet - Adult Std.,Apparel,http://www.amazon.com/dp/B00HWIKX46/,1,1
7mm X .5 Metric Right Hand Thread Die M7 X 0.5mm Pitch,Tools & Home Improvement,https://www.amazon.com/Metric-Right-Thread-0-5mm-Pitch/dp/B00841OMMY/ref=sr_1_1?s=hi&amp;ie=UTF8&amp;qid=1440473342&amp;sr=1-1&amp;keywords=metric+die+m7+x+.5,1,1
LandAirSea Magnetic Wireless Pocket-Sized GPS Tracking Key Pro System,Wireless,http://www.amazon.com/dp/B00GNFK89O/,1,1
3M 08888 Glass Cleaner,Automotive Parts and Accessories,http://www.amazon.com/dp/B0002JMQ24/,1,1
"Culina 8"" Double Mesh Strainer, Stainless Steel, Wooden Handle",Kitchen,http://www.amazon.com/dp/B00R59S3VC/,1,1
Snorks: Complete Season 1,DVD,http://www.amazon.com/dp/B009H3LNF2/,1,1
Old Spice Fresh Collection Zanzibar Men's Invisible Solid Anti-Perspirant & Deodorant 2.6 Ounce,Beauty,http://www.amazon.com/dp/B00HB2JQZK/,1,1
Iunio Smart Power Bank 4x 18650 Rechargeable Battery Pack Portable Charger with LCD Display Black,Wireless,http://www.amazon.com/dp/B00MB8WUMK/,1,1
Plano 1084 Line Spool Box,Sports,http://www.amazon.com/dp/B00F0XYRE2/,1,1
"Ikea Milk Frother 303.011.67, Black by IKEA",Home & Kitchen,https://www.amazon.com/gp/product/B00UO5ETYO?psc=1&amp;redirect=true&amp;ref_=oh_aui_detailpage_o00_s00,1,1
Metal Spudger Scraper Knife for iPod Touch 4 iPhone iPad (Repair Pry Open Tool),Wireless,http://www.amazon.com/dp/B00A3D2RNC/,1,1
Nitecore D4 Smart Charger with LCD Display and 2 EdisonBright AA to D Type Battery Spacer/Converters,CE,http://www.amazon.com/dp/B00L108SAW/,1,1
George S. Chen Imports SS-G-71329 Dragon Collection with Sword Collectible Fantasy Decoration Figurine,Home,http://www.amazon.com/dp/B003EVQ4A2/,1,1
"Cotton Rolls #2 Medium 1.5"" Non-Sterile 100% High Absorbent Cotton Pack of 50",BISS,http://www.amazon.com/dp/B017QSM8DA/,1,1
"PORTER-CABLE PC1014 Forstner Bit Set, 14-Piece",Home Improvement,http://www.amazon.com/dp/B004TSZEB4/,1,1
Planetary Design - Double Shot French Press Travel Mug - 14 oz - Black,Kitchen,http://www.amazon.com/dp/B00064GSVA/,1,1
XTAR Panzer XP4 - 4 Slot NI-MH/LI-ION Battery Charger including Car Adapter,Sports & Outdoors,https://www.amazon.com/XTAR-Panzer-XP4-Battery-Charger/dp/B00FFCWJ70/ref=sr_1_2?ie=UTF8&amp;qid=1423742652&amp;sr=8-2&amp;keywords=xtar,1,1
Graham CelluCotton Beauty Coil 100% Rayon Fibers 500 ft #44060,Beauty,http://www.amazon.com/dp/B00PBF8PAG/,1,1
Graham Cellucotton Beauty Coil 100% Rayon Fibers 40 ft #44130,Beauty,http://www.amazon.com/dp/B00PBGJT5A/,1,1
Halcyon T. Premium Ceramic Tweezers: Heat and Electricity Resistant (Blunt),Home Improvement,http://www.amazon.com/dp/B00SKPKKGG/,1,1
Black MatchaDNA Handheld Electric Milk Frother - Battery Operated Frother,Kitchen,http://www.amazon.com/dp/B0158P72L6/,1,1
"ORGANIC Cotton Makeup Puff, Medium",Beauty & Personal Care,https://www.amazon.com/Selena-Organic-Cotton-Puff-Size/dp/B007ODLA1O/ref=sr_1_2?ie=UTF8&amp;qid=1440546962&amp;sr=8-2&amp;keywords=selena+organic,1,1
SEOH 3 Pack Glass Borosilicate Graduated Beakers 50ml 100ml and 250ml,BISS,http://www.amazon.com/dp/B00AU6Y6X6/,1,1
Coil Master 100% Authentic Multi-Functional Ceramic Coil Tweezers,Home Improvement,http://www.amazon.com/dp/B01D71MIYO/,1,1
Chauvet Hurricane 1800 FLEX Fogger with Remote,Musical Instruments,http://www.amazon.com/dp/B002WPPOJI/,1,1
Nature's Oil USP Kosher Vegetable Glycerin Gallon - 10 lbs,Art and Craft Supply,http://www.amazon.com/dp/B00WUPUYCC/,1,1
Japanese Organic Cotton Pads for Vaping 100 pieces 100% Organic Unbleached [Made in Japan] (1 Pack),Beauty,http://www.amazon.com/dp/B00X6PQJ2Y/,1,1
7mm X .5 Metric HSS Right Hand Thread Tap M7 X 0.5mm Pitch,Industrial & Scientific,https://www.amazon.com/Metric-Right-Thread-0-5mm-Pitch/dp/B0084B1HKO/ref=sr_1_1?ie=UTF8&amp;qid=1445214462&amp;sr=8-1&amp;keywords=m7x0.5,1,1
Easy Glide 1cc Luer Slip TB Syringe 100/BX (No Needle),Health and Beauty,http://www.amazon.com/dp/B00XZ96DOA/,1,1
BCP 4pcs Clear Color Silicone Protective Case for 18650 Battery (Clear),Home Improvement,http://www.amazon.com/dp/B00ZWWNHDS/,1,1
"Liquid Crystal Sheet, 20-25C Transition (12x12 inch)",BISS,http://www.amazon.com/dp/B009P8CRZO/,1,1
12V 20Amp Black Round Head SPST Momentary Car Push Button Switch 2 Pcs,Home Improvement,http://www.amazon.com/dp/B00HG7FIP2/,1,1
uxcell 20pcs 29.5mm 18.5mm PVC Heat Shrink Tubing for 1 x 18650/18500 Battery,BISS,http://www.amazon.com/dp/B018I08UKU/,1,1
"30-Bottle Essential Oil Carrying Case for 15ml and 30ml bottles - Coral w/Black interior - 4"" high",Beauty,http://www.amazon.com/dp/B00EU6N3K4/,1,1
KKmoon Meter for PPM HTV Portable Formaldehyde Tester Methanal Concentration Detector with LCD Display and Sound-light Alarm,Home Improvement,http://www.amazon.com/dp/B01AUMOC6K/,1,1
"Graham Cellucotton Beauty Coil, 40 Feet",Beauty & Personal Care,https://www.amazon.com/SANEK-Cellucotton-Beauty-Coil-BT42251/dp/B00Q73Y1GI?ie=UTF8&amp;psc=1&amp;redirect=true&amp;ref_=oh_aui_search_detailpage,1,1
SS 316L - 100 ft. 36 Gauge AWG Stainless Steel Resistance Wire 0.13 mm 36g 100’,Home Improvement,http://www.amazon.com/dp/B01J639G74/,1,1
Evervictory 10PCS 18650 16340 CR123A Battery Case Hard Plastic Holder Storage Color Box,Wireless,http://www.amazon.com/dp/B00U39A88C/,1,1
Sodynee Jewelry and Cosmetic Storage  2 Piece Acrylic Makeup Organizer,Home,http://www.amazon.com/dp/B00UEAI3OQ/,1,1
10 Pack of 10ml 10cc 2 Tsp. Oral Medication Syringes with Tip Cap W/o Needle(1 Pack),Industrial & Scientific,https://www.amazon.com/Pack-10ml-Medication-Syringes-Needle/dp/B00OABXLOM/ref=sr_1_1?s=industrial&amp;ie=UTF8&amp;qid=1457508279&amp;sr=1-1&amp;keywords=10ml+oral+syringe,1,1
"Science Purchase 71HA1ST TB Slip-Tip Disposable Syringe MVI without Needle, 1 mL",BISS,http://www.amazon.com/dp/B007ZDHYTK/,1,1
