name,category,amazon_link,total_mentions,subreddit_mentions
Tintinalli's Emergency Medicine Manual 7th Edition (Emergency Medicine (Tintinalli)),Book,http://www.amazon.com/dp/0071781846/,2,2
"Streamlight 65018 Stylus 3-AAAA LED Pen Light, Black with White Light 6-1/4-Inch",Home Improvement,http://www.amazon.com/dp/B00008BFS5/,4,2
"Rapid Interpretation of EKG's, Sixth Edition",Book,http://www.amazon.com/dp/0912912065/,27,2
"The BATCLIP (BLACK) – Premium leather handmade clip-on stethoscope hip holder; no more neck carrying, loss, or misplacement. Proudly carry your high-end stethoscope with taste and style",Health and Beauty,http://www.amazon.com/dp/B0038S8E9U/,6,2
The Kaji Review: Emergency Medicine Clinical Question Book,eBooks,http://www.amazon.com/dp/B00UIEN7IK/,2,2
Pocket Emergency Medicine (Pocket Notebook Series),Book,http://www.amazon.com/dp/1451190654/,2,2
"EMS Field Guide, ALS Version",Book,http://www.amazon.com/dp/1890495573/,2,1
Eveready EVEPLED23AEH Pen LED Energizer,BISS,http://www.amazon.com/dp/B00359PS3M/,1,1
EMT Leather Trauma Shears holder (shears sheath) with metal clip (Right sided),Health and Beauty,http://www.amazon.com/dp/B008ZEA2AG/,1,1
Merrell Men's Jungle Moc Slip-On Shoe,Shoes,http://www.amazon.com/dp/B00D7IDIP6/,1,1
"Carhartt Men's Ripstop Multi-Cargo Scrub Pant, Ceil Blue, 3X-Large",Apparel,http://www.amazon.com/dp/B00DY73SRS/,1,1
"ThruNite Ti3 EDC Cree XP-G2 R5 AAA Torch Max120 Lumens LED Flashlight, Mini, Cool White",Home Improvement,http://www.amazon.com/dp/B00LUO028U/,24,1
Docooler 13.3cm Mini AAA LED Flashlight Pocket Torch Light 120LM 1 Switch Mode,Sports,http://www.amazon.com/dp/B00PU49YXU/,1,1
"CURRENT Diagnosis and Treatment Emergency Medicine, Seventh Edition (LANGE CURRENT Series)",Book,http://www.amazon.com/dp/0071701079/,1,1
"3M Littmann Cardiology IV Stethoscope, Standard-Finish Chestpiece",BISS Basic,http://www.amazon.com/dp/B01D49NI20/,1,1
Resident Readiness Emergency Medicine,Book,http://www.amazon.com/dp/0071780394/,1,1
"Tintinalli's Emergency Medicine: A Comprehensive Study Guide, 8th edition",Book,http://www.amazon.com/dp/007179476X/,3,1
"Emergency Medicine Secrets, 5e",Book,http://www.amazon.com/dp/0323071678/,1,1
ECG's for the Emergency Physician 1,Book,http://www.amazon.com/dp/0727916548/,4,1
"12-Lead ECG: The Art Of Interpretation (Garcia, Introduction to 12-Lead ECG)",Book,http://www.amazon.com/dp/0763773514/,4,1
