name,category,amazon_link,total_mentions,subreddit_mentions
"Liberal Fascism: The Secret History of the American Left, From Mussolini to the Politics of Change",Book,http://www.amazon.com/dp/0767917189/,25,2
Blinded by the Right: The Conscience of an Ex-Conservative,Book,http://www.amazon.com/dp/1400047285/,4,2
Not My President - Gildan Unisex Shirt,Apparel,http://www.amazon.com/dp/B01N28ASG4/,2,2
You've Been Trumped,Movie,http://www.amazon.com/dp/B00BHQLWIK/,,1
A People's History of the United States,Book,http://www.amazon.com/dp/0060838655/,19,1
Islam and the Future of Tolerance: A Dialogue,Book,http://www.amazon.com/dp/0674088700/,15,1
Pounded By The Pound: Turned Gay By The Socioeconomic Implications Of Britain Leaving The European Union,eBooks,http://www.amazon.com/dp/B01HJXVP8G/,7,1
Trumped!: The Inside Story of the Real Donald Trump-His Cunning Rise and Spectacular Fall,Book,http://www.amazon.com/dp/067173735X/,7,1
Anti-Intellectualism in American Life,Book,http://www.amazon.com/dp/0394703170/,7,1
Settle for More,Book,http://www.amazon.com/dp/0062494600/,6,1
The Elephant in the Room: A Journey into the Trump Campaign and the “Alt-Right” (Kindle Single),eBooks,http://www.amazon.com/dp/B01LXOO7UQ/,6,1
Kek Flag by MemeWerks - Kek Republic Flag - The Kek Republic,Lawn & Patio,http://www.amazon.com/dp/B06XNLFGNK/,6,1
Nothing Is True and Everything Is Possible: The Surreal Heart of the New Russia,Book,http://www.amazon.com/dp/1610394550/,6,1
The Brainwashing of My Dad,Movie,http://www.amazon.com/dp/B01C6AFEQG/,6,1
"Disinformation: Former Spy Chief Reveals Secret Strategies for Undermining Freedom, Attacking Religion, and Promoting Terrorism",Book,http://www.amazon.com/dp/1936488604/,5,1
Better Off Without 'Em: A Northern Manifesto for Southern Secession,Book,http://www.amazon.com/dp/145161666X/,5,1
The Sword and the Shield: The Mitrokhin Archive and the Secret History of the KGB,Book,http://www.amazon.com/dp/0465003125/,5,1
Lies: And the Lying Liars Who Tell Them: A Fair and Balanced Look at the Right,Book,http://www.amazon.com/dp/0452285216/,4,1
I Could Tell You But Then You Would Have to Be Destroyed By Me: Emblems from the Pentagon's Black World,Book,http://www.amazon.com/dp/193555414X/,4,1
Donald Trump - Advanced Graphics Life Size Cardboard Standup,Home,http://www.amazon.com/dp/B01BX9Z3KS/,4,1
America Again: Re-becoming the Greatness We Never Weren't,Book,http://www.amazon.com/dp/0446583995/,4,1
The End of Overeating: Taking Control of the Insatiable American Appetite,Book,http://www.amazon.com/dp/1605294578/,4,1
So You've Been Publicly Shamed,eBooks,http://www.amazon.com/dp/B00L9B7IRC/,3,1
March: Book One,Book,http://www.amazon.com/dp/1603093001/,3,1
The World Was Going Our Way: The KGB and the Battle for the the Third World - Newly Revealed Secrets from the Mitrokhin Archive,Book,http://www.amazon.com/dp/0465003133/,3,1
The Hunting of the President: The Ten-Year Campaign to Destroy Bill and Hillary Clinton,Book,http://www.amazon.com/dp/0312273193/,2,1
"Freedom of Mind: Helping Loved Ones Leave Controlling People, Cults, and Beliefs",Book,http://www.amazon.com/dp/0967068819/,2,1
Learn Russian: Rosetta Stone Russian - Level 1-5 Set,Software,http://www.amazon.com/dp/1617168777/,2,1
"Accoutrements 14"" Man Hands Toy",Toy,http://www.amazon.com/dp/B00IV0LJ6K/,2,1
Grammar Expletive Mug Novelty Funny Gift Mug,Kitchen,http://www.amazon.com/dp/B00F2ISH2I/,2,1
Ivanka Trump Women's Erica Gladiator Sandal,Shoes,http://www.amazon.com/dp/B00JUPVOX8/,1,1
"Hitler: Ascent, 1889-1939",Book,http://www.amazon.com/dp/038535438X/,1,1
"Freedom Is a Constant Struggle: Ferguson, Palestine, and the Foundations of a Movement",Book,http://www.amazon.com/dp/1608465640/,1,1
"Jews for Trump 1.25"" Pinback Button Pin President Campaign Vote Election Donald",Apparel,http://www.amazon.com/dp/B0122MOE2I/,1,1
"Hakko CHP 3-SA Stainless Steel Non-Magnetic Precision Tweezers with Very Fine Point Tips for Microelectronics Applications, 4-3/4"" Length",BISS,http://www.amazon.com/dp/B00FZPEWI6/,1,1
The Reactionary Mind: Conservatism from Edmund Burke to Sarah Palin,Book,http://www.amazon.com/dp/0199959110/,1,1
At the Hands of Persons Unknown: The Lynching of Black America (Modern Library Paperbacks),Book,http://www.amazon.com/dp/0375754458/,1,1
what part of illegal immigration do you not understand? 2.25” Bottle Opener Anti,Kitchen,http://www.amazon.com/dp/B01ABFSMVW/,1,1
Himmler,Book,http://www.amazon.com/dp/1909869422/,1,1
DJI Phantom 3 – Hardshell Backpack CP.PT.000239,Photography,http://www.amazon.com/dp/B00ZWY68I2/,1,1
The Plot Against America,Book,http://www.amazon.com/dp/1400079497/,1,1
"Devil's Bargain: Steve Bannon, Donald Trump, and the Storming of the Presidency",Book,http://www.amazon.com/dp/0735225028/,1,1
All Buildings Matter T-Shirt,Apparel,http://www.amazon.com/dp/B01NCERRZD/,1,1
Drift: The Unmooring of American Military Power,Book,http://www.amazon.com/dp/0307460991/,1,1
Pussification: The Effeminization of the American Male,Book,http://www.amazon.com/dp/1618081454/,1,1
To Be a Friend Is Fatal: The Fight to Save the Iraqis America Left Behind,Book,http://www.amazon.com/dp/1476710481/,1,1
Buffett: The Making of an American Capitalist,Book,http://www.amazon.com/dp/0812979273/,1,1
Anti-Semite and Jew: An Exploration of the Etiology of Hate,Book,http://www.amazon.com/dp/0805210474/,1,1
