name,category,amazon_link,total_mentions,subreddit_mentions
Dollarocracy: How the Money and Media Election Complex is Destroying America,Books,https://www.amazon.com/Dollarocracy-Election-Complex-Destroying-America/dp/1568587074,2,1
Breaking The Devil's Heart: A Logic of Demons Novel,Books,https://www.amazon.com/Breaking-Devils-Heart-Logic-Demons/dp/1432790587?ie=UTF8&amp;*Version*=1&amp;*entries*=0,2,1
Monster: The Autobiography of an L.A. Gang Member,Books,https://www.amazon.com/Monster-Autobiography-L-A-Gang-Member/dp/0802141447,1,1
Earlybird Kindergarten Mathematics Textbook A (Standards Edition),Books,https://www.amazon.com/Earlybird-Kindergarten-Mathematics-Textbook-Standards/dp/0761470158,1,1
"Guard Dog Security Titan Metal Baton Stun Gun with Flashlight, 260 Lumen",Sports & Outdoors,https://www.amazon.com/Guard-Dog-Security-Titan-Flashlight/dp/B00I0JF0W6,1,1
Economics For Dummies,Books,https://www.amazon.com/Economics-Dummies-Sean-Masaki-Flynn/dp/0470879483,1,1
The Great Arab Conquests: How the Spread of Islam Changed the World We Live In,Books,https://www.amazon.com/Great-Arab-Conquests-Spread-Changed/dp/0306817403,1,1
