name,category,amazon_link,total_mentions,subreddit_mentions
The Lean Startup: How Today's Entrepreneurs Use Continuous Innovation to Create Radically Successful Businesses,Book,http://www.amazon.com/dp/0307887898/,10,7
"Zero to One: Notes on Startups, or How to Build the Future",Book,http://www.amazon.com/dp/0804139296/,7,3
"Thinking, Fast and Slow",Book,http://www.amazon.com/dp/0374533555/,35,2
The E-Myth Revisited: Why Most Small Businesses Don't Work and What to Do About It,Book,http://www.amazon.com/dp/0887307280/,8,2
"The 4-Hour Workweek: Escape 9-5, Live Anywhere, and Join the New Rich",Book,http://www.amazon.com/dp/0307465357/,5,2
Good to Great: Why Some Companies Make the Leap and Others Don't,Book,http://www.amazon.com/dp/0066620996/,3,2
Built to Sell: Creating a Business That Can Thrive Without You,eBooks,http://www.amazon.com/dp/B004IYISQW/,2,2
Something Really New: Three Simple Steps to Creating Truly Innovative Products,eBooks,http://www.amazon.com/dp/B001REFRZG/,2,2
"Zero to One: Notes on Startups, or How to Build the Future",eBooks,http://www.amazon.com/dp/B00J6YBOFQ/,,1
Walt Disney,eBooks,http://www.amazon.com/dp/B000MAH7N6/,,1
"Get Backed: Craft Your Story, Build the Perfect Pitch Deck, and Launch the Venture of Your Dreams",eBooks,http://www.amazon.com/dp/B012BLTJFM/,,1
The Hard Thing About Hard Things: Building a Business When There Are No Easy Answers,eBooks,http://www.amazon.com/dp/B00DQ845EA/,,1
Hot Seat: The Startup CEO Guidebook,eBooks,http://www.amazon.com/dp/B00XB1P4RE/,,1
The Land Flipper: Turning Dirt into Dollars,eBooks,http://www.amazon.com/dp/B01CEZLS04/,,1
"The 4-Hour Workweek, Expanded and Updated: Expanded and Updated, With Over 100 New Pages of Cutting-Edge Content.",eBooks,http://www.amazon.com/dp/B002WE46UW/,,1
The Fashion Startup Guide: A step by step guide on how to build a fashion brand and business (How to start a fashion company),eBooks,http://www.amazon.com/dp/B00N232QWM/,,1
Buyer Legends: The Executive Storyteller’s Guide,eBooks,http://www.amazon.com/dp/B00OQT8U6M/,,1
How to Win Friends & Influence People,Book,http://www.amazon.com/dp/0671027034/,63,1
The Millionaire Next Door: The Surprising Secrets of America's Wealthy,Book,http://www.amazon.com/dp/1589795474/,28,1
How to Lie with Statistics,Book,http://www.amazon.com/dp/0393310728/,24,1
The Better Angels of Our Nature: Why Violence Has Declined,Book,http://www.amazon.com/dp/0143122010/,23,1
What If?: Serious Scientific Answers to Absurd Hypothetical Questions,Book,http://www.amazon.com/dp/0544272994/,15,1
A Random Walk down Wall Street: The Time-tested Strategy for Successful Investing,Book,http://www.amazon.com/dp/0393352242/,10,1
Thing Explainer: Complicated Stuff in Simple Words,Book,http://www.amazon.com/dp/0544668251/,7,1
"The Black Swan: Second Edition: The Impact of the Highly Improbable: With a new section: ""On Robustness and Fragility"" (Incerto)",Book,http://www.amazon.com/dp/081297381X/,7,1
The Art of Game Design: A Book of Lenses,Book,http://www.amazon.com/dp/0123694965/,7,1
The War of Art: Break Through the Blocks and Win Your Inner Creative Battles,Book,http://www.amazon.com/dp/1936891026/,7,1
"Mistakes Were Made (But Not by Me): Why We Justify Foolish Beliefs, Bad Decisions, and Hurtful Acts",Book,http://www.amazon.com/dp/0156033909/,7,1
Getting Things Done: The Art of Stress-Free Productivity,Book,http://www.amazon.com/dp/0143126563/,6,1
Fooled by Randomness: The Hidden Role of Chance in Life and in the Markets (Incerto),Book,http://www.amazon.com/dp/0812975219/,5,1
How to Talk to Anyone: 92 Little Tricks for Big Success in Relationships,Book,http://www.amazon.com/dp/007141858X/,4,1
Liar's Poker (Norton Paperback),Book,http://www.amazon.com/dp/039333869X/,4,1
Financial Intelligence for Entrepreneurs: What You Really Need to Know About the Numbers,Book,http://www.amazon.com/dp/1422119157/,4,1
"Getting Everything You Can Out of All You've Got: 21 Ways You Can Out-Think, Out-Perform, and Out-Earn the Competition",Book,http://www.amazon.com/dp/0312284543/,3,1
Naked Statistics: Stripping the Dread from the Data,Book,http://www.amazon.com/dp/039334777X/,3,1
Confessions of an Advertising Man,Book,http://www.amazon.com/dp/190491537X/,3,1
Rework,Book,http://www.amazon.com/dp/0307463745/,3,1
"Never Eat Alone, Expanded and Updated: And Other Secrets to Success, One Relationship at a Time",Book,http://www.amazon.com/dp/0385346654/,3,1
Getting Into Medical School: The Ultimate Guide for the Anxious Premed,eBooks,http://www.amazon.com/dp/B00K87UJVU/,2,1
Naked Economics: Undressing the Dismal Science (Fully Revised and Updated),Book,http://www.amazon.com/dp/0393337642/,2,1
"Blue Ocean Strategy, Expanded Edition: How to Create Uncontested Market Space and Make the Competition Irrelevant",Book,http://www.amazon.com/dp/1625274491/,2,1
Antifragile: Things That Gain from Disorder (Incerto),eBooks,http://www.amazon.com/dp/B0083DJWGO/,2,1
"The Art of the Start 2.0: The Time-Tested, Battle-Hardened Guide for Anyone Starting Anything",Book,http://www.amazon.com/dp/1591847842/,2,1
Inspired: How To Create Products Customers Love,Books,https://www.amazon.com/Inspired-Create-Products-Customers-Love/dp/0981690408,2,1
"Satechi Bluetooth Button Series (Media Button) for iPhone 7 Plus/7/6 Plus/6/5S/5C, iPad Pro/Air 2/Air/Mini/3/2/1, Samsung Galaxy S8/S7/S6,Note 4/Edge/Pro/Tab Pro, Google Nexus 9 and more",Wireless,http://www.amazon.com/dp/B00RM75NL0/,2,1
The Goal: A Process of Ongoing Improvement,eBooks,http://www.amazon.com/dp/B002LHRM2O/,2,1
"Hatching Twitter: A True Story of Money, Power, Friendship, and Betrayal",Book,http://www.amazon.com/dp/1591847087/,2,1
Barbarians at the Gate: The Fall of RJR Nabisco,Book,http://www.amazon.com/dp/0061655554/,2,1
Buddhism Without Beliefs: A Contemporary Guide to Awakening,Book,http://www.amazon.com/dp/1573226564/,2,1
The Referral Engine: Teaching Your Business to Market Itself,Book,http://www.amazon.com/dp/1591844428/,2,1
Sway: The Irresistible Pull of Irrational Behavior,Book,http://www.amazon.com/dp/0385530609/,2,1
Choose Yourself!,eBooks,http://www.amazon.com/dp/B00CO8D3G4/,2,1
"Carrington Farms Coconut Cooking Oil, 16 Ounce, Packaging May Vary",Grocery,http://www.amazon.com/dp/B00FW9Y1CW/,2,1
I Am That,Book,http://www.amazon.com/dp/0893860468/,2,1
"Set of Two 6.5"" Kiwi Brand Chef Knives # 172",Kitchen,http://www.amazon.com/dp/B008QPBPLO/,2,1
How I Lost 170 Million Dollars: My Time as #30 at Facebook,Book,http://www.amazon.com/dp/161961300X/,1,1
"Norfolk Island Pine - Christmas Tree - 6"" Pot - Decorated",Lawn & Patio,http://www.amazon.com/dp/B000YSXEYM/,1,1
ORBLUE Propresser Stainless Steel Kitchen Garlic Press,Kitchen,http://www.amazon.com/dp/B00HHLNRVE/,1,1
"LED Headlamp - Great for Camping, Hiking, Kids, and Dog Walking. One of the Lightest (2.6 oz) Headlight. Water and Shock Resistant with Red Strobe. Duracell Batteries Included",Sports,http://www.amazon.com/dp/B00PV0K8OM/,1,1
How to Get Rich: One of the World's Greatest Entrepreneurs Shares His Secrets,Book,http://www.amazon.com/dp/1591842719/,1,1
The Presentation Secrets of Steve Jobs: How to Be Insanely Great in Front of Any Audience,Book,http://www.amazon.com/dp/1491514310/,1,1
DEWALT DCK290L2 20-Volt MAX Li-Ion 3.0 Ah Hammer Drill and Impact Driver Combo Kit,Home Improvement,http://www.amazon.com/dp/B0052MIJN6/,1,1
Confusion de Confusiones [1688]: Portions Descriptive of the Amsterdam Stock Exchange,Book,http://www.amazon.com/dp/1614274517/,1,1
The Hard Thing About Hard Things: Building a Business When There Are No Easy Answers,Audible,http://www.amazon.com/dp/B00I0A6HUO/,1,1
"Co-Active Coaching, 3rd Edition: Changing Business, Transforming Lives",Audible,http://www.amazon.com/dp/B00DWBN12I/,1,1
"Crossing the Chasm, 3rd Edition: Marketing and Selling Disruptive Products to Mainstream Customers (Collins Business Essentials)",Book,http://www.amazon.com/dp/0062292986/,1,1
Understanding Michael Porter: The Essential Guide to Competition and Strategy,Audible,http://www.amazon.com/dp/B006KZ8H0Y/,1,1
The Art of Acting,Book,http://www.amazon.com/dp/1557833737/,1,1
Only the Paranoid Survive: How to Exploit the Crisis Points That Challenge Every Company,Book,http://www.amazon.com/dp/0385483821/,1,1
"Accounting for Non-Accountants, 3E: The Fast and Easy Way to Learn the Basics (Quick Start Your Business)",Book,http://www.amazon.com/dp/1402273045/,1,1
Your Strategy Needs a Strategy: How to Choose and Execute the Right Approach,Audible,http://www.amazon.com/dp/B019P9J9T4/,1,1
"The Gone Fishin' Portfolio: Get Wise, Get Wealthy...and Get on With Your Life",Book,http://www.amazon.com/dp/0470598190/,1,1
SDADI 2 Inches Carpet Wheel Mobile Stand Up Desk Height Adjustable Home Office Desk With Standing and Seating 2 Modes 3.0 Edition Dark Grain,Furniture,http://www.amazon.com/dp/B01B9OO010/,1,1
"We Go High, Love Trumps Hate Anti-Trump T-Shirt",Apparel,http://www.amazon.com/dp/B01MTKZDJA/,1,1
The Score Takes Care of Itself: My Philosophy of Leadership,Book,http://www.amazon.com/dp/1591843472/,1,1
"Calvin Klein Men's Micro Modal Trunk,Mink,Medium",Apparel,http://www.amazon.com/dp/B00317CDVI/,1,1
Business Adventures: Twelve Classic Tales from the World of Wall Street,Book,http://www.amazon.com/dp/1497644895/,1,1
Convert!: Designing Web Sites to Increase Traffic and Conversion,Book,http://www.amazon.com/dp/0470616334/,1,1
"Bold: How to Go Big, Create Wealth and Impact the World",Book,http://www.amazon.com/dp/1476709564/,1,1
Double Double: How to Double Your Revenue and Profit in 3 Years or Less,Book,http://www.amazon.com/dp/1608320995/,1,1
Something Really New: Three Simple Steps to Creating Truly Innovative Products,Book,http://www.amazon.com/dp/0814400329/,1,1
"Business Model Generation: A Handbook for Visionaries, Game Changers, and Challengers",Book,http://www.amazon.com/dp/0470876417/,1,1
A History of Western Philosophy,Book,http://www.amazon.com/dp/B007I0GVXA/,1,1
The Mom Test: How to talk to customers & learn if your business is a good idea when everyone is lying to you,Book,http://www.amazon.com/dp/1492180742/,1,1
Mortal Questions (Canto Classics),Book,http://www.amazon.com/dp/1107604710/,1,1
The Last Word,Book,http://www.amazon.com/dp/0195149831/,1,1
The Interpretation of Financial Statements,Book,http://www.amazon.com/dp/0887309135/,1,1
The Flight of the Garuda: The Dzogchen Tradition of Tibetan Buddhism,Book,http://www.amazon.com/dp/0861713672/,1,1
"Humiliation: And Other Essays on Honor, Social Discomfort, and Violence",Book,http://www.amazon.com/dp/0801481171/,1,1
The Anatomy of Disgust,Book,http://www.amazon.com/dp/0674031555/,1,1
Reasons and Persons,Book,http://www.amazon.com/dp/019824908X/,1,1
Silhouette Cameo Starter Bundle (Old Model),Art and Craft Supply,http://www.amazon.com/dp/B007R83VKE/,1,1
"Offshoring IT Services: Offshoring Management, 2nd revised edition",Book,http://www.amazon.com/dp/0615677118/,1,1
The Psychology of Selling: Increase Your Sales Faster and Easier Than You Ever Thought Possible,Book,http://www.amazon.com/dp/0785288066/,1,1
Mind Reader 'Mounty' Fridge/Wall mount coffee pod dispenser with Cork top-Black,Kitchen,http://www.amazon.com/dp/B00I3CZ5KW/,1,1
The Secrets of Consulting: A Guide to Giving and Getting Advice Successfully,Book,http://www.amazon.com/dp/0932633013/,1,1
"Emoji Universe: 12"" Emoji Inflatable Beach Balls, 12-Pack",Toy,http://www.amazon.com/dp/B0182WBENE/,1,1
Linchpin: Are You Indispensable?,Book,http://www.amazon.com/dp/1591844096/,1,1
Crossing the Chasm: Marketing and Selling High-Tech Products to Mainstream Customers,Book,http://www.amazon.com/dp/0060517123/,1,1
Behind the Cloud: The Untold Story of How Salesforce.com Went from Idea to Billion-Dollar Company-and Revolutionized an Industry,Book,http://www.amazon.com/dp/0470521163/,1,1
"Fit Spirit Printed Yoga Mat, 3mm - Black - 7 Chakra",Sports,http://www.amazon.com/dp/B01E5Z0YXI/,1,1
