name,category,amazon_link,total_mentions,subreddit_mentions
Microsoft Natural Keyboard Elite,CE,http://www.amazon.com/dp/B0000642RX/,5,1
uxcell 2 x 3 x 4mm Square Head Blue LED Bulb Emitting Diodes 30 Pcs,Lighting,http://www.amazon.com/dp/B00YCEWH74/,1,1
USB Type C Female Receptacle Breakout board,BISS,http://www.amazon.com/dp/B01N0LDV0D/,1,1
NPKC Black Gray mixed Dolch Thick PBT 104 87 61 Keycaps Mac Keys OEM Profile Key caps For MX Mechanical Keyboard (104 Side print),PC Accessory,http://www.amazon.com/dp/B072Q9V3YX/,3,1
YMDK Cherry Profile Thick PBT Blank Ergodox Keycap Set For Ergo Ergodox Keyboard,PC Accessory,http://www.amazon.com/dp/B0751JG6SF/,1,1
