name,category,amazon_link,total_mentions,subreddit_mentions
Good Luck Have Fun: The Rise of eSports,Book,http://www.amazon.com/dp/163450657X/,2,2
Playing to Win: Becoming the Champion,Book,http://www.amazon.com/dp/1411666798/,6,2
Raising the Stakes: E-Sports and the Professionalization of Computer Gaming (MIT Press),Book,http://www.amazon.com/dp/0262527588/,1,1
Game Boys: Professional Videogaming's Rise from the Basement to the Big Time,Book,http://www.amazon.com/dp/0670018961/,2,1
"The Invisible Game: Mindset of a Winning Team (eSports & Competitive Gaming, Dota 2, League of Legends, CS:GO)",Book,http://www.amazon.com/dp/1517457017/,2,1
Blue Snowball USB Microphone (Textured White),Musical Instruments,http://www.amazon.com/dp/B000EOPQ7E/,57,1
Blue Yeti USB Microphone - Silver,Musical Instruments,http://www.amazon.com/dp/B002VA464S/,102,1
Korea's Online Gaming Empire (MIT Press),Book,http://www.amazon.com/dp/0262014769/,1,1
"Game Boys: Triumph, Heartbreak, and the Quest for Cash in the Battleground of Competitive Videogaming",Book,http://www.amazon.com/dp/B0042P587E/,2,1
Raising the Stakes: E-Sports and the Professionalization of Computer Gaming,Book,http://www.amazon.com/dp/0262017377/,1,1
