name,category,amazon_link,total_mentions,subreddit_mentions
American Nations: A History of the Eleven Rival Regional Cultures of North America,Book,http://www.amazon.com/dp/0143122029/,13,2
Nothing Is True and Everything Is Possible: The Surreal Heart of the New Russia,Book,http://www.amazon.com/dp/1610394550/,6,2
Turkish Foreign Policy during the Second World War: An 'Active' Neutrality (LSE Monographs in International Studies),Book,http://www.amazon.com/dp/052152329X/,2,2
"The Reconstruction of Nations: Poland, Ukraine, Lithuania, Belarus, 1569–1999",Book,http://www.amazon.com/dp/030010586X/,2,2
The Revolt of the Public and the Crisis of Authority in the New Millennium,eBooks,http://www.amazon.com/dp/B00KQMVOPM/,,1
The Clinton Tapes: Wrestling History with the President,eBooks,http://www.amazon.com/dp/B002POEQTK/,,1
"eSmart Novelty Biscuit Pocket Coffee Mug Funny Cup Cookie Holder 100% Ceramic - Hot Chocolate Milk Coffee Tea Water Drinks Beverages, Holiday Gift",Home & Kitchen,https://www.amazon.com/Novelty-Biscuit-Pocket-Coffee-Mug/dp/B017AM785A,,1
Privatizing Pensions: The Transnational Campaign for Social Security Reform,eBooks,http://www.amazon.com/dp/B007Q08NM4/,,1
THE DESCENDANTS OF ALEXANDER THE GREAT OF MACEDON,eBooks,http://www.amazon.com/dp/B013WGG872/,,1
Building Stone Walls: Storey's Country Wisdom Bulletin A-217,eBooks,http://www.amazon.com/dp/B00ESCJVQK/,,1
"Limonov: The Outrageous Adventures of the Radical Soviet Poet Who Became a Bum in New York, a Sensation in France, and a Political Antihero in Russia",eBooks,http://www.amazon.com/dp/B00J6U7JVS/,,1
The Price of Inequality: How Today's Divided Society Endangers Our Future,Book,http://www.amazon.com/dp/0393345068/,21,1
"Surely You're Joking, Mr. Feynman! (Adventures of a Curious Character)",Book,http://www.amazon.com/dp/0393316041/,16,1
Islam and the Future of Tolerance: A Dialogue,Book,http://www.amazon.com/dp/0674088700/,15,1
The Anatomy of Fascism,Book,http://www.amazon.com/dp/1400033918/,14,1
PlayStation 4 Slim 500GB Console - Uncharted 4 Bundle [Discontinued],Video Games,http://www.amazon.com/dp/B01LRLJV28/,12,1
Bad Samaritans: The Myth of Free Trade and the Secret History of Capitalism,Book,http://www.amazon.com/dp/1596915986/,9,1
Jameson on Jameson: Conversations on Cultural Marxism (Post-Contemporary Interventions),Book,http://www.amazon.com/dp/0822341093/,6,1
"Cultural Marxism in Postwar Britain: History, the New Left, and the Origins of Cultural Studies (Post-Contemporary Interventions)",Book,http://www.amazon.com/dp/0822319144/,6,1
Austerity: The History of a Dangerous Idea,Book,http://www.amazon.com/dp/019982830X/,5,1
"The Wehrmacht: History, Myth, Reality",Book,http://www.amazon.com/dp/0674025776/,5,1
The Coming War With Japan,Book,http://www.amazon.com/dp/0312058365/,5,1
Cultural Marxism and Political Sociology (SAGE Library of Social Research),Book,http://www.amazon.com/dp/0803916450/,4,1
Marxism and the Interpretation of Culture,Book,http://www.amazon.com/dp/0252014014/,4,1
Stalin: The Court of the Red Tsar,Book,http://www.amazon.com/dp/1400076781/,4,1
Letter to a Christian Nation,Book,http://www.amazon.com/dp/0307278778/,3,1
$2.00 a Day: Living on Almost Nothing in America,Book,http://www.amazon.com/dp/054481195X/,3,1
"Marriage, a History: How Love Conquered Marriage",Book,http://www.amazon.com/dp/014303667X/,3,1
War of Extermination: The German Military in World War II (War and Genocide),Book,http://www.amazon.com/dp/1571814930/,3,1
Power: Why Some People Have It and Others Don't,Book,http://www.amazon.com/dp/0061789089/,2,1
"Open Letter: On Blasphemy, Islamophobia, and the True Enemies of Free Expression",Book,http://www.amazon.com/dp/0316311332/,2,1
Countercoup: The Struggle for the Control of Iran,Book,http://www.amazon.com/dp/0070535906/,2,1
Claiming Society for God: Religious Movements and Social Welfare,Book,http://www.amazon.com/dp/0253002389/,2,1
MeeToy Putin Riding On a Bear Action Figure,Toy,http://www.amazon.com/dp/B00X61MVE8/,2,1
Adolf Hitler: The Definitive Biography,Book,http://www.amazon.com/dp/0385420536/,2,1
Trump: The Art of the Deal,eBooks,http://www.amazon.com/dp/B000SEGE6M/,2,1
Wall Street and the Bolshevik Revolution: The Remarkable True Story of the American Capitalists Who Financed the Russian Communists,Book,http://www.amazon.com/dp/190557035X/,2,1
Black Earth: The Holocaust as History and Warning,Book,http://www.amazon.com/dp/1101903473/,2,1
Rasta Imposta Adult Turkey Costume,Apparel,http://www.amazon.com/dp/B002OGPXGE/,1,1
A Military History of the Ottomans: From Osman to Atatürk (Praeger Security International),Book,http://www.amazon.com/dp/0275988767/,1,1
1916: The Easter Rising,Book,http://www.amazon.com/dp/0753818523/,1,1
"De Valera - Long Fellow, Long Shadow",Book,http://www.amazon.com/dp/0099958600/,1,1
Michael Collins,Book,http://www.amazon.com/dp/1784753262/,1,1
Maple Bacon Popcorn 5 Ounces (Case of 6),Grocery & Gourmet Food,https://www.amazon.com/KETTLE-FOODS-POPCORN-MAPLE-BACON/dp/B00S98ENPS/ref=sr_1_fkmr1_1_a_it,1,1
MREs (Meals Ready-to-Eat) Genuine U.S. Military Surplus (1 Pack) Assorted Flavor,Sports,http://www.amazon.com/dp/B009ZIDU0U/,1,1
The Latino Wave                                                                  : How Hispanics Will Elect the Next American President,Book,http://www.amazon.com/dp/B0007D9VC8/,1,1
Crude Nation: How Oil Riches Ruined Venezuela,Book,http://www.amazon.com/dp/1612347703/,1,1
Valandre Thor Sleeping Bag - Men's Grey Long Right Zip,Sports,http://www.amazon.com/dp/B0080JPUSA/,1,1
The Full Catastrophe: Travels Among the New Greek Ruins,Book,http://www.amazon.com/dp/0385346484/,1,1
Questions of Meaning: Theme and Motif in Dutch Seventeenth-Century Painting,Book,http://www.amazon.com/dp/9074310672/,1,1
The Art of Describing: Dutch Art in the Seventeenth Century,Book,http://www.amazon.com/dp/0719540631/,1,1
Ataturk,Book,http://www.amazon.com/dp/1842125990/,1,1
The Slave Across the Street,Book,http://www.amazon.com/dp/0982328680/,1,1
"Karo Light Corn Syrup, 128-Ounce",Grocery,http://www.amazon.com/dp/B004UEKLZ6/,1,1
Apostles of Disunion: Southern Secession Commissioners and the Causes of the Civil War (A Nation Divided: Studies in the Civil War Era),Book,http://www.amazon.com/dp/081392104X/,1,1
"The Road to Disunion: Volume II: Secessionists Triumphant, 1854-1861",Book,http://www.amazon.com/dp/019537018X/,1,1
A Billion Wicked Thoughts: What the World's Largest Experiment Reveals about Human Desire,Book,http://www.amazon.com/dp/0525952098/,1,1
Venco Double Salt Licorice Dubbelzout 6.1 Oz Pack of 2,Grocery,http://www.amazon.com/dp/B00N15J1JC/,1,1
Nobody Poops But You,Book,http://www.amazon.com/dp/1480296988/,1,1
European Union Readings on the Theory and Practice of European Integration,Book,http://www.amazon.com/dp/1588262316/,1,1
The European Union: Readings on the Theory and Practice of European Integration,Book,http://www.amazon.com/dp/1626370338/,1,1
The Cyclist Conspiracy,Book,http://www.amazon.com/dp/1934824585/,1,1
"Germany and the Holy Roman Empire: Volume I: Maximilian I to the Peace of Westphalia, 1493-1648 (Oxford History of Early Modern Europe) (Volume 1)",Book,http://www.amazon.com/dp/0199688826/,1,1
Dronningholm Cloudberry - Original - Finnish - Jam 340 g,Grocery,http://www.amazon.com/dp/B06XXMBJNR/,1,1
The winter war: Russia against Finland (Ballantine's illustrated history of the violent century),Book,http://www.amazon.com/dp/0345028902/,1,1
Against Elections: The Case for Democracy,Book,http://www.amazon.com/dp/1847924220/,1,1
Heavenly Serbia: From Myth to Genocide,Book,http://www.amazon.com/dp/0814706711/,1,1
Children of War: diaries 1941-1945,Book,http://www.amazon.com/dp/5852722596/,1,1
Black Belt Patriotism: How to Reawaken America,Book,http://www.amazon.com/dp/0805464360/,1,1
"Spanish Republic and the Civil War, 1931-1939",Book,http://www.amazon.com/dp/0691007578/,1,1
President Barack Obama 2016 Square 12x12,Book,http://www.amazon.com/dp/1465041850/,1,1
Generation Identity,Book,http://www.amazon.com/dp/1907166416/,1,1
The Nature of Fascism,Book,http://www.amazon.com/dp/0415096618/,1,1
Mecca: The Sacred City,Book,http://www.amazon.com/dp/1620402661/,1,1
Microsoft Fingerprint Reader,CE,http://www.amazon.com/dp/B0002WPSB2/,1,1
Orhan's Inheritance,Book,http://www.amazon.com/dp/1616203749/,1,1
An atlas of economic geography,Book,http://www.amazon.com/dp/B007QF2GQI/,1,1
Medela Lactina Select Hospital Grade Breast Pump - BPA Free #016SC01,Baby Product,http://www.amazon.com/dp/B001US6OV0/,1,1
The Impact of Science on Society,Book,http://www.amazon.com/dp/041510906X/,1,1
A Companion to Britain in the Later Middle Ages,Book,http://www.amazon.com/dp/1405189738/,1,1
The Tragedy of the European Union: Disintegration or Revival?,Book,http://www.amazon.com/dp/1610394216/,1,1
Wiggle Seat Inflatable Sensory Chair Cushion for Kids - Blue,Toy,http://www.amazon.com/dp/B00EP4XIAQ/,1,1
Richard Scarry's Best Word Book Ever (Giant Golden Book),Book,http://www.amazon.com/dp/0307155102/,1,1
Ethnic Conflicts: Their Biological Roots in Ethnic Nepotism,Book,http://www.amazon.com/dp/0957391315/,1,1
Animal Homosexuality: A Biosocial Perspective,Book,http://www.amazon.com/dp/0521145147/,1,1
Caligula: A Biography,Book,http://www.amazon.com/dp/0520287592/,1,1
"The Macedonian State: Origins, Institutions, and History (Clarendon Paperbacks)",Book,http://www.amazon.com/dp/0198149271/,1,1
A Taste For War: The Culinary History of the Blue and the Gray,Book,http://www.amazon.com/dp/0811700186/,1,1
BaoFeng UV-5R VHF/UHF Dual Band Radio 136-174 400-480Mhz Transceiver,Wireless,http://www.amazon.com/dp/B007UYKG4E/,1,1
Hitler's Secret Bankers: The Myth Of Swiss Neutrality During The Holocau: The Myth of Swiss Neutrality During the Holocaust,Book,http://www.amazon.com/dp/080652121X/,1,1
"Who Financed Hitler: The Secret Funding of Hitler's Rise to Power, 1919-1933",Book,http://www.amazon.com/dp/0671760831/,1,1
The Reality of Precaution: Comparing Risk Regulation in the United States and Europe,Book,http://www.amazon.com/dp/1933115858/,1,1
The Jewish War: Revised Edition (Penguin Classics),Book,http://www.amazon.com/dp/0140444203/,1,1
Starving the South: How the North Won the Civil War,Book,http://www.amazon.com/dp/0312601816/,1,1
