name,category,amazon_link,total_mentions,subreddit_mentions
The Republican War on Science,Book,http://www.amazon.com/dp/0465046762/,9,2
Sapiens: A Brief History of Humankind,Book,http://www.amazon.com/dp/0062316095/,40,1
The Rat,Book,http://www.amazon.com/dp/015675830X/,1,1
"Shaping Humanity: How Science, Art, and Imagination Help Us Understand Our Origins",Book,http://www.amazon.com/dp/0300182023/,2,1
"The N.D.D. Book: How Nutrition Deficit Disorder Affects Your Child's Learning, Behavior, and Health, and What You Can Do About It--Without Drugs (Sears Parenting Library)",Book,http://www.amazon.com/dp/0316043443/,1,1
"Thinking, Fast and Slow",Book,http://www.amazon.com/dp/0374533555/,118,1
Probability Theory: The Logic of Science,Book,http://www.amazon.com/dp/0521592712/,13,1
Understanding Nutrition (Available Titles CourseMate),Book,http://www.amazon.com/dp/0538734655/,1,1
Thing Explainer: Complicated Stuff in Simple Words,Book,http://www.amazon.com/dp/0544668251/,22,1
A Brief History of Time,Book,http://www.amazon.com/dp/0553380168/,20,1
Democracy for Realists: Why Elections Do Not Produce Responsive Government (Princeton Studies in Political Behavior),Book,http://www.amazon.com/dp/0691169446/,4,1
The Family That Couldn't Sleep: A Medical Mystery,Book,http://www.amazon.com/dp/081297252X/,5,1
Nebraska Atlas and Gazetteer (Nebraska Atlas & Gazetteer),Book,http://www.amazon.com/dp/0899333281/,1,1
Every Third Woman in America: How Legal Abortion Transformed Our Nation,Book,http://www.amazon.com/dp/0990833607/,1,1
Cracking the Aging Code: The New Science of Growing Old - And What It Means for Staying Young,Book,http://www.amazon.com/dp/1250061709/,4,1
The Case for Mars: The Plan to Settle the Red Planet and Why We Must,Book,http://www.amazon.com/dp/145160811X/,23,1
Melanie's Marvelous Measles,Book,http://www.amazon.com/dp/1466938897/,19,1
Catching Fire: How Cooking Made Us Human,Book,http://www.amazon.com/dp/1491574615/,3,1
GreenWorks 25302 G-MAX 40V Twin Force 20-Inch Cordless Lawn Mower,Lawn & Patio,http://www.amazon.com/dp/B00GX9WNP2/,3,1
I Think You'll Find It's a Bit More Complicated Than That,Book,http://www.amazon.com/dp/0007462484/,2,1
"USB Endoscope, Depstech 2 in 1 Semi-rigid Borescope Inspection Camera 2.0MP CMOS HD Waterproof Snake Camera with 6 Adjustable Led for Android Device, Windows & Macbook OS Computer - Black（23FT）",Photography,http://www.amazon.com/dp/B06WCZDZGY/,1,1
