name,category,amazon_link,total_mentions,subreddit_mentions
"Keep Your Wives Away from Them: Orthodox Women, Unorthodox Desires",Book,http://www.amazon.com/dp/1556438796/,1,1
The Bible Unearthed: Archaeology's New Vision of Ancient Isreal and the Origin of Sacred Texts,eBooks,http://www.amazon.com/dp/B000FBJG86/,7,1
"A History of God: The 4,000-Year Quest of Judaism, Christianity and Islam",eBooks,http://www.amazon.com/dp/B005DB6LSG/,6,1
The Rocks Don't Lie: A Geologist Investigates Noah's Flood: A Geologist Investigates Noah's Flood,eBooks,http://www.amazon.com/dp/B007HXFHI8/,1,1
Who Wrote the Bible?,eBooks,http://www.amazon.com/dp/B00EHN47EG/,7,1
