name,category,amazon_link,total_mentions,subreddit_mentions
Sex Trafficking: Inside the Business of Modern Slavery,Book,http://www.amazon.com/dp/0231139616/,2,1
Jesus and the Zealots : A Study of the Political Factor in Primitive Christianity,Book,http://www.amazon.com/dp/0684310104/,1,1
ESV Study Bible,Book,http://www.amazon.com/dp/1433502410/,9,1
Waking Up: A Guide to Spirituality Without Religion,Book,http://www.amazon.com/dp/1451636024/,41,1
Ignatius Catholic Study Bible: New Testament,Book,http://www.amazon.com/dp/1586172506/,22,1
