name,category,amazon_link,total_mentions,subreddit_mentions
Tactical Barbell Presents: Ageless Athlete,Book,http://www.amazon.com/dp/1544080824/,2,1
Meditations on Violence: A Comparison of Martial Arts Training & Real World Violence,Book,http://www.amazon.com/dp/1594391181/,7,1
Facing Violence: Preparing for the Unexpected,Book,http://www.amazon.com/dp/1594392137/,7,1
Fear: The Friend of Exceptional People - Techniques in Controlling Fear,Book,http://www.amazon.com/dp/1840241934/,1,1
Kill Or Get Killed,eBooks,http://www.amazon.com/dp/B003GGSTFI/,1,1
Defendu,eBooks,http://www.amazon.com/dp/B004P5O7LY/,1,1
"Combatives for Street Survival: Volume 1: Index Positions, the Guard and Combatives Strikes",eBooks,http://www.amazon.com/dp/B0052FYPBI/,1,1
"Arwrology: All-Out Hand-to-Hand Fighting for Commandos, Military, and Civilians",eBooks,http://www.amazon.com/dp/B006JVO1OA/,1,1
Kapap Combat Concepts: Martial Arts of the Israeli Special Forces,eBooks,http://www.amazon.com/dp/B008JPR9U2/,1,1
Left of Bang: How the Marine Corps' Combat Hunter Program Can Save Your Life,eBooks,http://www.amazon.com/dp/B00L45NXF4/,2,1
Surviving Inside the Kill Zone,eBooks,http://www.amazon.com/dp/B00VTY17LC/,1,1
Tactical Barbell: Definitive Strength Training for the Operational Athlete,eBooks,http://www.amazon.com/dp/B01G195QU2/,3,1
