name,category,amazon_link,total_mentions,subreddit_mentions
"The Ultimate Guide to Tarot: A Beginner's Guide to the Cards, Spreads, and Revealing the Mystery of the Tarot",Book,http://www.amazon.com/dp/1592336574/,7,7
Understanding Aleister Crowley's Thoth Tarot,Book,http://www.amazon.com/dp/1578632765/,7,5
The Wild Unknown Tarot Deck and Guidebook (Official Keepsake Box Set),Book,http://www.amazon.com/dp/0062466593/,4,3
Golden Dawn Magical Tarot,Book,http://www.amazon.com/dp/0738723398/,4,3
Mystical Origins of the Tarot: From Ancient Roots to Modern Usage,Book,http://www.amazon.com/dp/0892811900/,5,3
Tarot Secrets: A Fast and Easy Way to Learn a Powerful Ancient Art,Book,http://www.amazon.com/dp/1402770863/,3,3
The Rider Tarot Deck,Book,http://www.amazon.com/dp/091386613X/,6,3
Meditations on the Tarot: A Journey into Christian Hermeticism,Book,http://www.amazon.com/dp/1585421618/,6,3
The Tarot and Transformation,Book,http://www.amazon.com/dp/087516238X/,2,2
Swiss 1JJ Tarot Deck,Book,http://www.amazon.com/dp/0913866512/,2,2
Aquarian Tarot Deck Cards,Book,http://www.amazon.com/dp/0913866695/,2,2
The Essential Lenormand: Your Guide to Precise & Practical Fortunetelling,Book,http://www.amazon.com/dp/0738736627/,2,2
DC Comics Justice League Tarot Card Deck,Toy,http://www.amazon.com/dp/B00X2VIXDK/,2,2
Mystical Manga Tarot,Book,http://www.amazon.com/dp/073875353X/,2,2
Seventy-Eight Degrees of Wisdom: A Book of Tarot,Book,http://www.amazon.com/dp/1578634083/,11,2
Thoth Tarot Deck,Book,http://www.amazon.com/dp/1572815108/,4,2
The Complete Lenormand Oracle Handbook: Reading the Language and Symbols of the Cards,Book,http://www.amazon.com/dp/1620553252/,2,2
The Qabalistic Tarot: A Textbook of Mystical Philosophy,Book,http://www.amazon.com/dp/0971559139/,5,2
Ancient Italian Tarot,Book,http://www.amazon.com/dp/0738700266/,2,2
Jung and Tarot: An Archetypal Journey,Book,http://www.amazon.com/dp/0877285152/,2,1
The Qabalistic Tarot: A Textbook of Mystical Philosophy,Book,http://www.amazon.com/dp/0877286728/,2,1
"Magick: Liber ABA, Book 4",Book,http://www.amazon.com/dp/0877289190/,8,1
Tarot of the Bohemians,Book,http://www.amazon.com/dp/0879801581/,1,1
Hanson-Roberts Tarot Deck,Book,http://www.amazon.com/dp/0880790792/,1,1
Tarot Of The Old Path Deck,Book,http://www.amazon.com/dp/0880794909/,1,1
Russian Tarot of St. Petersburg: 78-Card Deck,Book,http://www.amazon.com/dp/0880795832/,1,1
The Original Rider Waite Tarot Pack,Book,http://www.amazon.com/dp/0880796863/,2,1
The Pictorial Key to the Tarot,Book,http://www.amazon.com/dp/0913866083/,2,1
Morgan Greer Tarot Deck English,Book,http://www.amazon.com/dp/0913866911/,3,1
The Hermetic Tarot,Book,http://www.amazon.com/dp/091386692X/,3,1
Prairie Tarot,Book,http://www.amazon.com/dp/0972878831/,1,1
Fortune Stellar: What Every Professional Tarot Reader Needs to Know,Book,http://www.amazon.com/dp/0983090440/,1,1
The Good Tarot: A 78-Card Deck and Guidebook,Book,http://www.amazon.com/dp/1401949509/,1,1
Fifty-four Devils: The Art & Folklore of Fortune-telling with Playing Cards,Book,http://www.amazon.com/dp/1491225785/,1,1
Lenormand Thirty Six Cards: An Introduction to the Petit Lenormand,Book,http://www.amazon.com/dp/1500582484/,1,1
The Ultimate Guide to Tarot Card Meanings,Book,http://www.amazon.com/dp/1542993407/,1,1
"The Western Mysteries: An Encyclopedic Guide to the Sacred Languages & Magickal Systems of the World- The Key of It All, Book 2 (Llewellyn Sourcebook Series)",Book,http://www.amazon.com/dp/1567184294/,1,1
The Sacred Circle Tarot: A Celtic Pagan Journey,Book,http://www.amazon.com/dp/156718457X/,1,1
Quick & Easy Tarot,Book,http://www.amazon.com/dp/1572812443/,1,1
Deviant Moon Tarot Deck,Book,http://www.amazon.com/dp/1572816368/,1,1
Pamela Colman Smith Commemorative Set,Book,http://www.amazon.com/dp/1572816392/,1,1
Joie de Vivre Tarot,Book,http://www.amazon.com/dp/1572816627/,1,1
Smith-Waite Centennial Tarot Deck,Book,http://www.amazon.com/dp/1572817623/,1,1
Pixie's Astounding Lenormand,Book,http://www.amazon.com/dp/1572818050/,2,1
Smith-Waite Centennial Tarot Deck in a Tin,Book,http://www.amazon.com/dp/1572818123/,2,1
Learning the Tarot: A Tarot Book for Beginners,Book,http://www.amazon.com/dp/1578630487/,2,1
The English Magic Tarot,Book,http://www.amazon.com/dp/1578636000/,1,1
"The Tarot: History, Symbolism, and Divination",Book,http://www.amazon.com/dp/1585423491/,2,1
The Tarot: A Key to the Wisdom of the Ages,Book,http://www.amazon.com/dp/1585424919/,3,1
"The Complete Idiot's Guide to Tarot, 2nd Edition",Book,http://www.amazon.com/dp/1592570666/,1,1
The Way of Tarot: The Spiritual Teacher in the Cards,Book,http://www.amazon.com/dp/1594772630/,1,1
The Enchanted Tarot: 25th Anniversary Edition,Book,http://www.amazon.com/dp/1631063715/,1,1
The Tarot Revealed: A Beginner's Guide,Book,http://www.amazon.com/dp/1741752590/,1,1
A Cultural History of Tarot: From Entertainment to Esotericism,Book,http://www.amazon.com/dp/1848850530/,2,1
The Housewives Tarot: A Domestic Divination Kit,Book,http://www.amazon.com/dp/1931686998/,1,1
The Emerald Tablet: Alchemy of Personal Transformation (Compass),eBooks,http://www.amazon.com/dp/B002VFPRYG/,1,1
Crowley Thoth Tarot Deck (large),Toy,http://www.amazon.com/dp/B003975X4O/,1,1
Tarot in Ten Minutes,eBooks,http://www.amazon.com/dp/B003YCOP3Y/,1,1
Mystical Origins of the Tarot: From Ancient Roots to Modern Usage,eBooks,http://www.amazon.com/dp/B0098O9BHW/,1,1
The Rider-Waite Tarot Deck,Toy,http://www.amazon.com/dp/B00B3XW1VO/,1,1
Path of the Fool: Meanings of the Major and Minor Arcana,eBooks,http://www.amazon.com/dp/B00BCY1F7U/,1,1
Holistic Tarot: An Integrative Approach to Using Tarot for Personal Growth,eBooks,http://www.amazon.com/dp/B00LRHUJ9C/,1,1
The High Priestess Major Arcana Tarot Card deck print over an upcycled vintage dictionary page book art,Guild Product,http://www.amazon.com/dp/B01G4VTI5G/,1,1
History of the Occult Tarot,Book,http://www.amazon.com/dp/0715631225/,1,1
Tarot Art Nouveau (English and Spanish Edition),Book,http://www.amazon.com/dp/0738700088/,2,1
Tarot of Marseille (Lo Scarabeo Decks),Book,http://www.amazon.com/dp/0738700118/,1,1
Nefertari's Tarots (Multilingual Edition),Book,http://www.amazon.com/dp/0738700207/,1,1
Tarot of the New Vision (English and Spanish Edition),Book,http://www.amazon.com/dp/073870413X/,1,1
The Gilded Tarot (Book and Tarot Deck Set),Book,http://www.amazon.com/dp/0738705209/,1,1
Easy Tarot: Learn to Read the Cards Once and For All!,Book,http://www.amazon.com/dp/0738711500/,1,1
Initiatory Tarot of the Golden Dawn Deck (Lo Scarabeo Decks) (English and Spanish Edition),Book,http://www.amazon.com/dp/0738713872/,1,1
Around the Tarot in 78 Days: A Personal Journey Through the Cards,Book,http://www.amazon.com/dp/0738730440/,1,1
Michelangelo Tarot Deck,Book,http://www.amazon.com/dp/0738733628/,1,1
Astrological Oracle,Book,http://www.amazon.com/dp/0738735043/,1,1
Golden Universal Tarot Deck,Book,http://www.amazon.com/dp/0738737429/,2,1
Animal Totem Tarot,Book,http://www.amazon.com/dp/0738743488/,1,1
The Linestrider Tarot,Book,http://www.amazon.com/dp/0738748293/,1,1
Tarot (Miniature Editions),Book,http://www.amazon.com/dp/0762404183/,1,1
Ostara Tarot,Book,http://www.amazon.com/dp/0764352822/,1,1
"The New Golden Dawn Ritual Tarot: Keys to the Rituals, Symbolism, Magic and Divination (Llewellyn's New Age Tarot Series)",Book,http://www.amazon.com/dp/0875421393/,1,1
"The Book of Thoth: A Short Essay on the Tarot of the Egyptians, Being the Equinox Volume III No. V",Book,http://www.amazon.com/dp/0877282684/,2,1
