name,category,amazon_link,total_mentions,subreddit_mentions
Winning Ugly: Mental Warfare in Tennis--Lessons from a Master,Book,http://www.amazon.com/dp/067188400X/,3,3
The Inner Game of Tennis: The Classic Guide to the Mental Side of Peak Performance,Book,http://www.amazon.com/dp/0679778314/,5,2
Andy Roddick Beat Me with a Frying Pan: Taking the Field with Pro Athletes and Olympic Legends to Answer Sports Fans' Burning Questions,Book,http://www.amazon.com/dp/0307352803/,2,1
"Strokes of Genius: Federer, Nadal, and the Greatest Match Ever Played",Book,http://www.amazon.com/dp/0547336942/,1,1
Open: An Autobiography,Book,http://www.amazon.com/dp/0307388409/,1,1
Internet Gift Store Novak Djokovic Celebrity Party Mask,Apparel,http://www.amazon.com/dp/B008G0N530/,1,1
String Theory: David Foster Wallace on Tennis: A Library of America Special Publication,Book,http://www.amazon.com/dp/1598534807/,1,1
Mka Roger Federer Celebrity Mask,Apparel,http://www.amazon.com/dp/B0054IZP4E/,1,1
Celebrity Masks - Rafael Nadal,Apparel,http://www.amazon.com/dp/B0054J0U1G/,1,1
Partyrama Andy Murray Cardboard Celebrity Party Mask,Toy,http://www.amazon.com/dp/B00577GWOY/,1,1
Unstoppable: My Life So Far,Book,http://www.amazon.com/dp/0374279799/,1,1
Rafa,Book,http://www.amazon.com/dp/B006CDCWDM/,1,1
