name,category,amazon_link,total_mentions,subreddit_mentions
Yeast: The Practical Guide to Beer Fermentation (Brewing Elements),Book,http://www.amazon.com/dp/0937381969/,32,6
Water: A Comprehensive Guide for Brewers (Brewing Elements),Book,http://www.amazon.com/dp/0937381993/,19,5
New Brewing Lager Beer: The Most Comprehensive Book for Home and Microbrewers,Book,http://www.amazon.com/dp/0937381829/,8,3
Quality Management: Essential Planning for Breweries,Book,http://www.amazon.com/dp/1938469151/,4,3
Principles of Brewing Science: A Study of Serious Brewing Issues,Book,http://www.amazon.com/dp/0937381748/,7,3
Brewing Yeast and Fermentation,Book,http://www.amazon.com/dp/1405152680/,4,3
Beer School: Bottling Success at the Brooklyn Brewery,Book,http://www.amazon.com/dp/0470068671/,4,3
"For The Love of Hops: The Practical Guide to Aroma, Bitterness and the Culture of Hops (Brewing Elements)",Book,http://www.amazon.com/dp/1938469011/,14,3
The Brewers Association's Guide to Starting Your Own Brewery,Book,http://www.amazon.com/dp/1938469054/,7,3
American Sour Beers,Book,http://www.amazon.com/dp/1938469119/,24,3
Brewing with Wheat,Book,http://www.amazon.com/dp/0937381950/,6,2
Sacred and Herbal Healing Beers: The Secrets of Ancient Fermentation,Book,http://www.amazon.com/dp/0937381667/,16,2
Brewing Better Beer: Master Lessons for Advanced Homebrewers,Book,http://www.amazon.com/dp/0937381985/,6,2
Designing Great Beers: The Ultimate Guide to Brewing Classic Beer Styles,Book,http://www.amazon.com/dp/0937381500/,25,2
Beyond the Pale: The Story of Sierra Nevada Brewing Co.,Book,http://www.amazon.com/dp/1118007360/,4,2
Brewery Operations Manual,Book,http://www.amazon.com/dp/B00EGTTE6W/,5,2
Malt: A Practical Guide from Field to Brewhouse (Brewing Elements),Book,http://www.amazon.com/dp/1938469127/,9,2
Brewing,Book,http://www.amazon.com/dp/0306472740/,5,2
2: Malting and Brewing Science: Volume II Hopped Wort and Beer,Book,http://www.amazon.com/dp/1461357276/,3,2
Experimental Homebrewing: Mad Science in the Pursuit of Great Beer,Book,http://www.amazon.com/dp/0760345384/,7,2
"Malting and Brewing Science, Volume 1 : Malt and Sweet Wort",Book,http://www.amazon.com/dp/0412165805/,3,2
So You Want to Start a Brewery?: The Lagunitas Story,Book,http://www.amazon.com/dp/1556525621/,3,2
CNBTR LZQ-3 Tube Type Acylic Flowmeter Gas Acrylic Metal Fitting Oxygen Rotameter 0-10 LPM,Home Improvement,http://www.amazon.com/dp/B017YVS2WU/,2,2
Drink: A Cultural History of Alcohol,Book,http://www.amazon.com/dp/1592404642/,3,2
Brewing Up a Business: Adventures in Beer from the Founder of Dogfish Head Craft Brewery,Book,http://www.amazon.com/dp/0470942312/,5,2
"IPA: Brewing Techniques, Recipes and the Evolution of India Pale Ale",Book,http://www.amazon.com/dp/1938469003/,9,2
The Complete Joy of Homebrewing Fourth Edition: Fully Revised and Updated,Book,http://www.amazon.com/dp/0062215752/,25,2
"Radical Brewing: Recipes, Tales and World-Altering Meditations in a Glass",Book,http://www.amazon.com/dp/0937381837/,4,2
Farmhouse Ales: Culture and Craftsmanship in the Belgian Tradition,Book,http://www.amazon.com/dp/0937381845/,7,2
"Brew Like a Monk: Trappist, Abbey, and Strong Belgian Ales and How to Brew Them",Book,http://www.amazon.com/dp/093738187X/,6,2
How to Brew: Everything You Need To Know To Brew Beer Right The First Time,Book,http://www.amazon.com/dp/0937381888/,34,2
Brewing Classic Styles: 80 Winning Recipes Anyone Can Brew,Book,http://www.amazon.com/dp/0937381926/,31,2
Ansell Thermaprene 19-024 18Inch - Size 10 [PRICE is per PAIR],Home Improvement,http://www.amazon.com/dp/B001VXTF5Q/,1,1
CDN DTQ450X Digital ProAccurate Instant-Read Thermometer-NSF Certified,Kitchen,http://www.amazon.com/dp/B0021AEAG2/,38,1
"Oxy-Sorb Oxygen Absorbers for Food Storage, 100cc, 100-Pack",Home,http://www.amazon.com/dp/B0028AG8RO/,6,1
"Baffin Men's Maximum Work Boot,Black/Yellow/Black,12 M US",Shoes,http://www.amazon.com/dp/B002D48SCI/,1,1
Bel-Art Tall Form 3000ml Polypropylene Graduated Pitcher; 50ml Graduation (F28993-0000),Office Product,http://www.amazon.com/dp/B002VBW3UQ/,1,1
1 Pair Ball Lock Disconnects for Corny Kegs 1 Gas1 Liquid,BISS,http://www.amazon.com/dp/B002VLD7QU/,3,1
Carlisle Ausable Wooden Canoe Paddle (54-Inch),Sports,http://www.amazon.com/dp/B003L30I4G/,1,1
"Bunn 04238.0000 Water Pitcher for Pourover Coffee Brewer, 64 Oz",BISS,http://www.amazon.com/dp/B003OWMAJU/,1,1
Obenauf's Heavy Duty LP 4oz - Preserves and Protects Leather - Made in the US,Automotive Parts and Accessories,http://www.amazon.com/dp/B003SKCARK/,6,1
"Adam Equipment CPWplus 200W Wheeled Floor Scale, 440lb/200kg Capacity, 0.1lb/50g Readability",BISS,http://www.amazon.com/dp/B0048BOWBK/,1,1
Brewing Up a Business: Adventures in Beer from the Founder of Dogfish Head Craft Brewery,eBooks,http://www.amazon.com/dp/B004GB15X0/,1,1
Uxcell a11021800ux0120 Micro Limit Switch Long Straight Hinge Lever Arm SPDT Snap Action LOT,BISS,http://www.amazon.com/dp/B0050HKB8O/,1,1
"ARO R37121-600-VS Air Regulator 1/4"" NPT, w/ Gauge - 250 psi Max Inlet",Home Improvement,http://www.amazon.com/dp/B0057D8LMY/,1,1
"Allstar ALL13010 3"" Diameter 5"" Length 140 CFM Rating Compact Model In-line Duct Blower",Automotive Parts and Accessories,http://www.amazon.com/dp/B006K8GRVM/,1,1
SainSmart 5V 2-Channel Solid State Relay Board for Arduino Uno Duemilanove MEGA2560 MEGA1280 ARM DSP PIC,Wireless,http://www.amazon.com/dp/B0079WI2ZC/,1,1
"ForeverOzone 20,000 Mg/H Solid State Ozone Generator / Timer",Home,http://www.amazon.com/dp/B007GS3T8O/,12,1
"MettleAir SHF-N04-1PK Pneumatic High Flow Silencer, Stainless Steel, 1/2"" NPT",BISS Basic,http://www.amazon.com/dp/B007IUBXFG/,1,1
SainSmart IIC/I2C/TWI Serial 2004 20x4 LCD Module Shield For Arduino UNO MEGA R3,Wireless,http://www.amazon.com/dp/B0080DYTZQ/,1,1
"Bogs Men's Food Pro Tall Extreme Steel Toe Waterproof Work Boot, Black",Shoes,http://www.amazon.com/dp/B008I6V4OE/,1,1
Awarded Best Compound Microscope 2016 - OMAX 40X-2000X Lab LED Binocular Microscope with Double Layer Mechanical Stage w Blank Slides Covers and Lens Cleaning Paper,BISS,http://www.amazon.com/dp/B0094JTZOU/,3,1
"AmScope T120B-P Digital Professional Siedentopf Trinocular Compound Microscope, 40X-2000X Magnification, WF10x and WF20x Eyepieces, Brightfield, LED Illumination, Abbe Condenser with Iris Diaphragm, Double-Layer Mechanical Stage, 100-240VAC, Includes 0.3MP Camera with Reduction Lens and Software",CE,http://www.amazon.com/dp/B009VVWLS8/,1,1
Sankey to Ball Lock Quick Disconnect Conversion Kit,BISS,http://www.amazon.com/dp/B00C30F75I/,11,1
BEAPCO  10036 - 6 Pack Fruit Fly Trap  -Drop Ins,Lawn & Patio,http://www.amazon.com/dp/B00CRYOPMQ/,8,1
Pelican 2350 Pocket Size Flashlight,Sports,http://www.amazon.com/dp/B00J8UCH8G/,1,1
"IFM Efector SM8001 Magnetic-Inductive Flow Meter, 0.10 to 26.40 GSM, -4 to 176 degrees F Measuring Range",BISS,http://www.amazon.com/dp/B00MIVOREO/,1,1
ThruNite Archer 2A V3 Cool White 500 Lumens AA LED Flashlight,Home,http://www.amazon.com/dp/B00OLTAGZ0/,7,1
OSOYOO MEGA2560 R3 Control Board ATMEGA2560-16AU For Arduino Compatible with USB Cable,Personal Computer,http://www.amazon.com/dp/B00PD92EJ8/,1,1
Eyourlife Universal 30PSI Pressure Transducer Sender Solenoid for Oil Fuel Gas Air Water G7,Automotive Parts and Accessories,http://www.amazon.com/dp/B00RCPDE40/,1,1
SHOWA Best® Glove Size 8 Foam Grip 377 13 Gauge Oil And Chemical Resistant Black And Blue Nitrile Foam Fully Dipped Palm Coated Work Gloves With White Polyester And Nylon Liner And Elastic Knit Wrist,Home Improvement,http://www.amazon.com/dp/B00SAGILAM/,1,1
Accuteck All-In-One Series W-8250-50BS  A-PT 50 Digital with AC Adapter (Silver),Office Product,http://www.amazon.com/dp/B00SMHWZ42/,8,1
"Kalsec Craft Brew Solutions Trop Hopical™ Advanced Hop Extract [Liquid, 8 Oz. Bottle]",Grocery,http://www.amazon.com/dp/B00VKL8R3A/,2,1
Tepezcohuite Ointment Natural Skin Healing Unguento De Tepezcohuite De Chiapas Mex.,Beauty,http://www.amazon.com/dp/B012CBA2CK/,1,1
"Rectorseal 97402 Sureseal Trap Seal, 3"", Black",Home Improvement,http://www.amazon.com/dp/B0130EAYL2/,1,1
"Digiweigh Industrial Grade Bench Scale, 400 lb (DWP-440)",Office Product,http://www.amazon.com/dp/B013BLREIK/,1,1
"Inkbird Dual Stage Digital Temperature Controller Fahrenheit Thermostat with Sensor for 3D Printer,Freezer,Fridge,Hatching ect",Home Improvement,http://www.amazon.com/dp/B0152LYY0I/,1,1
Qinlee 500mL Scientific Safety Wash Bottle Narrow Mouth Polypropylene/Plastic Squeeze Bottle Medical Label Tattoo Wash Bottle,Home Improvement,http://www.amazon.com/dp/B01K1SYQK0/,2,1
"BACOENG 1/4"",3/8"",1/2"",3/4"",1"" AC110V Solenoid Valve (NPT, Normally Closed)",Home Improvement,http://www.amazon.com/dp/B01MRC51FD/,1,1
"ATACTICAL A1 550 lm Pocket-Sized LED Torch Super Bright LED Flashlight, Black",Home Improvement,http://www.amazon.com/dp/B01NBKWBU8/,27,1
Beer: Tap into the Art and Science of Brewing,Book,http://www.amazon.com/dp/0195305426/,1,1
The Oxford Companion to Beer (Oxford Companion To... (Hardcover)),Book,http://www.amazon.com/dp/0195367138/,2,1
Brewery Operations Manual,Book,http://www.amazon.com/dp/0578143747/,1,1
"Speed Brewing: Techniques and Recipes for Fast-Fermenting Beers, Ciders, Meads, and More",Book,http://www.amazon.com/dp/0760347379/,3,1
The E-Myth Revisited: Why Most Small Businesses Don't Work and What to Do About It,Book,http://www.amazon.com/dp/0887307280/,47,1
Winery Technology and Operations:A Handbook for Small Wineries,Book,http://www.amazon.com/dp/0932664660/,1,1
"Cleaning-in-Place: Dairy, Food and Beverage Operations",Book,http://www.amazon.com/dp/1405155035/,1,1
"A Brewer's Guide to Opening a Nano Brewery: Your $10,000 Brewery Consultant for $15, Vol. 1",Book,http://www.amazon.com/dp/1470087960/,2,1
Operation Brewery: A Step-by-Step Guide to Building a Brewery on a Budget,Book,http://www.amazon.com/dp/1535548614/,1,1
The Homebrewer's Almanac: A Seasonal Guide to Making Your Own Beer from Scratch,Book,http://www.amazon.com/dp/1581573499/,1,1
Tasting Beer: An Insider's Guide to the World's Greatest Drink,Book,http://www.amazon.com/dp/1603420894/,20,1
Wood & Beer: A Brewer's Guide,Book,http://www.amazon.com/dp/1938469216/,1,1
"Polder Portable Kitchen Timer, Clock, and Stopwatch Combination - Easy to read digital display and includes carrying strap",Kitchen,http://www.amazon.com/dp/B00004S4U7/,2,1
Beer Keg Dolly,Kitchen,http://www.amazon.com/dp/B0002EAL9E/,1,1
"Leatherman 830039 Wave Multitool with Leather/Nylon Combination Sheath, Silver",Home Improvement,http://www.amazon.com/dp/B0002H49BC/,17,1
"3M 8511PB1-A-PS Particulate N95 Respirator with Valve, 10-Pack",Home Improvement,http://www.amazon.com/dp/B0002YKBV2/,32,1
Uvex Stealth Safety Goggles with Uvextreme Anti-Fog Coating (S39610C),Home Improvement,http://www.amazon.com/dp/B000BQUTQS/,1,1
Gerber Suspension Multi-Plier [22-01471],Home Improvement,http://www.amazon.com/dp/B000EDPT9K/,11,1
SHURFLO 3/4 Raw Water Strainer - 50 Mesh Screen,Sports,http://www.amazon.com/dp/B000FPZQ1I/,1,1
"Woodlore Adjustable Men's Shoe Tree,Cedar,Large (10 - 11 M US)",Shoes,http://www.amazon.com/dp/B000PEEAOS/,7,1
Zinsser 98030 30-Inch Wallpaper Prep Tray,Home Improvement,http://www.amazon.com/dp/B000RXA8IY/,4,1
"Pino Silvestre By Pino Silvestre For Men, Aftershave, 4.2-Ounce Bottle",Beauty,http://www.amazon.com/dp/B000VOHS6O/,1,1
"Timberland PRO Men's 53539 Power Welt Waterproof 8"" Steel Toe Boot,Brown,9 M",Shoes,http://www.amazon.com/dp/B000XEHM9K/,1,1
Leatherman 830850 Skeletool CX Multitool,Home Improvement,http://www.amazon.com/dp/B000XU43IC/,11,1
"Leatherman - Skeletool Multitool, Stainless Steel",Home Improvement,http://www.amazon.com/dp/B000XU9NXW/,22,1
"Streamlight 66118 Stylus Pro LED PenLight with Holster, Black",BISS,http://www.amazon.com/dp/B0015UC17E/,36,1
Casio Men's W800H-1AV Classic Sport Watch with Black Band,Watch,http://www.amazon.com/dp/B001AWZDA4/,21,1
Kershaw 1760 Skyline Knife (Stainless Steel),Sports,http://www.amazon.com/dp/B001CZBDF8/,28,1
Milwaukee MW102 PH and Temperature Meter,Lawn & Patio,http://www.amazon.com/dp/B001DTNDME/,13,1
"Weston Pro-2300 Commercial Grade Stainless Steel Vacuum Sealer (65-0201), Double Piston Pump",Kitchen,http://www.amazon.com/dp/B001GP81R2/,5,1
