name,category,amazon_link,total_mentions,subreddit_mentions
Hobbit: The Motion Picture Trilogy (Extended Edition),DVD,http://www.amazon.com/dp/B014GJBTWI/,7,4
The Lord of the Rings: A Book of 20 Postcards,Book,http://www.amazon.com/dp/0261104039/,2,2
The Princess and the Goblin (Puffin Classics),Book,http://www.amazon.com/dp/0141332484/,1,1
The Hobbit 3D: The Motion Picture Trilogy [Blu-ray 3D + Blu-ray + Digital HD],DVD,http://www.amazon.com/dp/B015GKSXD4/,1,1
J. R. R. Tolkien: The Hobbit : Or There and Back Again (Hardcover - Collectors Ed.); 1973 Edition,Book,http://www.amazon.com/dp/B01FMVXXWI/,1,1
The Hobbit: The Desolation of Smaug Limited Edition with Book Ends (Blu-ray 3D + Blu-ray + DVD),DVD,http://www.amazon.com/dp/B00HWWUQXU/,1,1
"The Hobbit, Student Study Guide",Book,http://www.amazon.com/dp/1615380647/,1,1
