name,category,amazon_link,total_mentions,subreddit_mentions
"The Last of Us, Vol. 2 (Video Game Soundtrack)",Digital Music Album,http://www.amazon.com/dp/B00I8LL0LQ/,,1
Topsung Vintage Canvas Backpack Rucksack school bag Satchel Hiking bag,Apparel,http://www.amazon.com/dp/B00WDOO1LU/,1,1
Last Of Us 2 ELLIE TATTOO props cosplay Temporary waterproof,Art and Craft Supply,http://www.amazon.com/dp/B01N4NUOO1/,1,1
The Last of Us: The Poster Collection (Insights Poster Collections),Book,http://www.amazon.com/dp/160887379X/,1,1
The Last of Us: American Dreams,Book,http://www.amazon.com/dp/1616552123/,1,1
Evercool Defender Turbo Cooling Fan - Playstation 3 (Not compatible with PS3 Slim),Video Games,http://www.amazon.com/dp/B001DNGCN2/,1,1
