name,category,amazon_link,total_mentions,subreddit_mentions
The Last of Us: The Poster Collection (Insights Poster Collections),Book,http://www.amazon.com/dp/160887379X/,7,7
The Last of Us: American Dreams,Book,http://www.amazon.com/dp/1616552123/,6,5
Vintage Canvas Backpack School Book Bag Casual Travel Rucksack - Khaki,Apparel,http://www.amazon.com/dp/B00T75FQZS/,2,2
Cool The Last Of Us Joel Ellie Women's Sleeveless Shirt Black Size M,Apparel,http://www.amazon.com/dp/B00YUR5RDE/,2,2
Timex Men's T29321 Elevated Classics Dress Black Leather Strap Watch,Watch,http://www.amazon.com/dp/B0000TIIQ4/,1,1
"Jasmine S35 Acoustic Guitar, Natural",Musical Instruments,http://www.amazon.com/dp/B0002F58TG/,6,1
Shake Flashlight,Home Improvement,http://www.amazon.com/dp/B000BPJ262/,2,1
PlayStation Network Card / Ticket (3000 YEN / for Japanese network only) [Japan Import],Video Games,http://www.amazon.com/dp/B000YED3F6/,1,1
Evercool Defender Turbo Cooling Fan - Playstation 3 (Not compatible with PS3 Slim),Video Games,http://www.amazon.com/dp/B001DNGCN2/,2,1
Timex Unisex T2N647 Weekender Black Nylon Slip-Thru Strap Watch,Watch,http://www.amazon.com/dp/B004VR9GCQ/,26,1
Timex Unisex T2N651 Weekender Olive Nylon Slip-Thru Strap Watch,Watch,http://www.amazon.com/dp/B004VR9HP2/,45,1
U.S. Polo Assn. Classic Men's US5207 Silver-Tone Watch with Black Faux Leather Band,Watch,http://www.amazon.com/dp/B008MVVA2Q/,1,1
The Last of Us Post-Pandemic Edition,Video Games,http://www.amazon.com/dp/B00DE9D1FK/,1,1
Vintage Canvas Backpack Rucksack school bag Satchel Hiking bag,Sports,http://www.amazon.com/dp/B00DQCX0CY/,1,1
"The Last of Us, Vol. 2 (Video Game Soundtrack)",Digital Music Album,http://www.amazon.com/dp/B00I8LL0LQ/,1,1
The Last of Us Ellie Joel Nice Silk Fabric Cloth Wall Poster Print (36x24inch),Home,http://www.amazon.com/dp/B00J6ZW2WO/,1,1
"Vagabond Traveler 20"" Large Sport Washed Canvas Backpack C04.GRN",Sports,http://www.amazon.com/dp/B00JG57T4U/,1,1
Topsung Vintage Canvas Backpack Rucksack school bag Satchel Hiking bag,Apparel,http://www.amazon.com/dp/B00WDOO1LU/,1,1
JOEL'S WATCH: The Last of Us Character-Inspired Timepiece,Watch,http://www.amazon.com/dp/B016P15MEQ/,1,1
EcoCity Vintage Canvas Backpack Hiking Rucksack Casual Daypacks BP0030C2(Coffee),Apparel,http://www.amazon.com/dp/B017IGM7ZO/,1,1
Benchmark Straps 20mm Army Green Ballistic Nylon NATO Watchband + Spring Bar Removal Tool,Watch,http://www.amazon.com/dp/B01FEY91GK/,1,1
The Road,Book,http://www.amazon.com/dp/0307387895/,16,1
Last Of Us 2 ELLIE TATTOO props cosplay Temporary waterproof,Art and Craft Supply,http://www.amazon.com/dp/B01N4NUOO1/,1,1
The World Without Us,Book,http://www.amazon.com/dp/0312427905/,13,1
I Am An Ice Cream Truck,Book,http://www.amazon.com/dp/0545137160/,1,1
The Art of The Last of Us,Book,http://www.amazon.com/dp/161655164X/,1,1
