name,category,amazon_link,total_mentions,subreddit_mentions
Joy on Demand: The Art of Discovering the Happiness Within,Book,http://www.amazon.com/dp/0062378856/,7,1
A Place for Consciousness: Probing the Deep Structure of the Natural World (Philosophy of Mind),Book,http://www.amazon.com/dp/0195168143/,1,1
"Hardwiring Happiness: The New Brain Science of Contentment, Calm, and Confidence",Book,http://www.amazon.com/dp/0385347316/,3,1
Solving the Procrastination Puzzle: A Concise Guide to Strategies for Change,Book,http://www.amazon.com/dp/0399168125/,9,1
The Way of Energy:  Mastering the Chinese Art of Internal Strength with Chi Kung Exercise (A Gaia Original),Book,http://www.amazon.com/dp/0671736450/,1,1
"The Heart of the Buddha's Teaching: Transforming Suffering into Peace, Joy, and Liberation",Book,http://www.amazon.com/dp/0767903692/,15,1
Core Transformation: Reaching the Wellspring Within,Book,http://www.amazon.com/dp/0911226338/,1,1
There Is Nothing Wrong with You: Going Beyond Self-Hate,Book,http://www.amazon.com/dp/0971030901/,10,1
What You Practice Is What You Have: A Guide to Having the Life You Want,Book,http://www.amazon.com/dp/0971030979/,1,1
Satipaṭṭhāna: The Direct Path to Realization,Book,http://www.amazon.com/dp/1899579540/,6,1
Carefree Dignity: Discourses on Training in the Nature of Mind,Book,http://www.amazon.com/dp/9627341320/,1,1
YOGA SHORT FORMS The Practice Ashtanga Yoga David Swenson,DVD,http://www.amazon.com/dp/B0002444ZQ/,1,1
"PureGuardian Ultrasonic Cool Mist Humidifier, Baby Room, Nursery Humidifier, Portable Humidifier, Travel Humidifier, Small Humidifier, Desk Humidifier, Pure Guardian H920BL",Health and Beauty,http://www.amazon.com/dp/B009COIFAC/,3,1
Transforming Your Self: Becoming Who You Want to Be,eBooks,http://www.amazon.com/dp/B009Y5HS7K/,1,1
"ClearArmor 141001 Shooters Hearing Protection Safety Ear Muffs Folding-Padded Head Band Ear Cups, Black",Home Improvement,http://www.amazon.com/dp/B00NKSMPZW/,25,1
The Mind Illuminated: A Complete Meditation Guide Integrating Buddhist Wisdom and Brain Science for Greater Mindfulness,eBooks,http://www.amazon.com/dp/B01INMZKAQ/,11,1
