name,category,amazon_link,total_mentions,subreddit_mentions
First Aid for the USMLE Step 1 2015 (First Aid USMLE),Book,http://www.amazon.com/dp/0071840060/,1,1
"Delta Cycle Delta Airzound Bike Horn , colors may vary",Sports,http://www.amazon.com/dp/B000ACAMJC/,53,1
"Sleepypod Medium Mobile Pet Bed, Dark Chocolate",Pet Products,http://www.amazon.com/dp/B000SIJT42/,1,1
Dremel 7300-PT 4.8V Pet Nail Grooming Tool,Home Improvement,http://www.amazon.com/dp/B003TU0XG4/,19,1
"Moso Natural Air Purifying Bag. Odor Eliminator for Cars, Closets, Bathrooms and Pet Areas. Captures and Eliminates Odors. Charcoal Color, 200-G",Automotive Parts and Accessories,http://www.amazon.com/dp/B004BOH6BM/,12,1
"DakPets Dog Brush & Cat Brush For Small, Medium & Large Dogs and Cats, With Short to Long Hair. Dramatically Reduces Shedding In Minutes",Pet Products,http://www.amazon.com/dp/B00CD0H1ZC/,4,1
"Andis Premium Firm Slicker Brush, Pet Grooming (80585)",Pet Products,http://www.amazon.com/dp/B00O0WOME4/,3,1
