name,category,amazon_link,total_mentions,subreddit_mentions
Feeling Good: The New Mood Therapy,Book,http://www.amazon.com/dp/0380810336/,228,1
"In Ghostly Japan: Spooky Stories with the Folklore, Superstitions and Traditions of Old Japan (Tuttle Classics)",Book,http://www.amazon.com/dp/0804836612/,2,1
Kwaidan: Stories and Studies of Strange Things,Book,http://www.amazon.com/dp/0804836620/,1,1
Glimpses of Unfamiliar Japan: Two Volumes in One (Tuttle Classics),Book,http://www.amazon.com/dp/080484755X/,1,1
"Wausau Cardstock, 96 Brightness, 65 lb, 8.5 x 11 Inches, Bright White, 250 Sheets (91904)",Office Product,http://www.amazon.com/dp/B00006IDRW/,2,1
"Alvin Professional Self-Healing Cutting Mat, 12"" x 18"", Green/Black (GBM1218)",Office Product,http://www.amazon.com/dp/B0015AOIYI/,14,1
Touhou Koumakyou: Embodiment of Scarlet Devil [Import],Video Games,http://www.amazon.com/dp/B005HWXCL0/,1,1
Third Rock Fire Pit,Lawn & Patio,http://www.amazon.com/dp/B005J4KHYQ/,1,1
(Old Model) Seagate 1TB Desktop HDD SATA 6Gb/s 64MB Cache 3.5-Inch Internal Bare Drive (ST1000DM003),CE,http://www.amazon.com/dp/B005T3GRNW/,23,1
Ballistix Sport 4GB Single DDR3 1600 MT/s (PC3-12800) UDIMM 240-Pin Memory - BLS4G3D1609DS1S00,Personal Computer,http://www.amazon.com/dp/B006WAGG14/,5,1
JBtek 3D Effect Bathroom Curtain 3D Water Cube Mold & Mildew Free Shower Curtain Shower Liner 100% EVA with Plastic Hooks (Blue),Home,http://www.amazon.com/dp/B00PAHPTXQ/,1,1
Bakemonogatari Hachikuji Mayoi Schoolbag Backpack Bag shoulder Cosplay Anime N1,Sports,http://www.amazon.com/dp/B00ZBQQN0Y/,1,1
Nendoroid Plus : Touhou Project Reimu Hakurei Plush Doll by Gift,Toy,http://www.amazon.com/dp/B017O4BPBW/,1,1
Good Smile Touhou Project: Satori Komeiji Nendoroid Action Figure,Toy,http://www.amazon.com/dp/B01CQTX84M/,1,1
