name,category,amazon_link,total_mentions,subreddit_mentions
"The Club 1000 Original Club Steering Wheel Lock, Red",Automotive Parts and Accessories,http://www.amazon.com/dp/B0000CBILL/,19,1
"3M Safety-Walk Slip Resistant Tread, Black, 2-Inch by 180-Inch Roll, 7635NA",Home Improvement,http://www.amazon.com/dp/B0006HVKM4/,1,1
HELLA 003399801 Supertone 12V High Tone/Low Tone Twin Horn Kit with Bracket,Automotive Parts and Accessories,http://www.amazon.com/dp/B000CRZXPI/,31,1
Malone Deluxe Foam Block Universal Car Top Large Kayak Carrier Kit,Sports,http://www.amazon.com/dp/B000OZJCO6/,1,1
Bosal 294-725 Exhaust Silencer,Automotive Parts and Accessories,http://www.amazon.com/dp/B00180OYAI/,1,1
"Rust-Oleum 248904 Automotive 12-Ounce High Heat 2000 Degree Spray Paint, Flat Aluminum",Home Improvement,http://www.amazon.com/dp/B003CT4AKM/,1,1
kenable 5 Pin Din Plug To 3.5mm Jack Stereo Plug Audio Cable 1.5m (~5 feet),Speakers,http://www.amazon.com/dp/B003OSNVC4/,2,1
"NEW KICKER 11HS8 8"" 150W Hideaway Car Audio Powered Subwoofer Sub Enclosure HS8",Car Audio or Theater,http://www.amazon.com/dp/B007LQWSYC/,6,1
JBL Stereo Wire Harness Toyota Camry 2002 2003 2004 2005 2006 (car radio wiring installation parts),Automotive Parts and Accessories,http://www.amazon.com/dp/B008FUB26S/,1,1
Nite Ize Original Steelie Dash Mount Kit - Magnetic Car Dash Mount for Smartphones,Wireless,http://www.amazon.com/dp/B00BAQKRHY/,21,1
Genuine Toyota Fluid 00289-3FS00 Fabric Spot Remover - 8 oz. Can,Automotive Parts and Accessories,http://www.amazon.com/dp/B00C392TZK/,1,1
Vehicle Brake Light Flasher Module. Safety Flash Light Alert. Universal. For Motorcycles and Cars.,Automotive Parts and Accessories,http://www.amazon.com/dp/B00FADDOL4/,3,1
Koomus Magnetos CD Magnetic Cradle-less Smartphone Car Mount,Wireless,http://www.amazon.com/dp/B00HUIL310/,15,1
"PYvideo Rear Backup Camera Kit for Toyota Camry, Corolla, Prius, Rav4 and more (2012, 2013, 2014) - (Color: Black)",Wireless,http://www.amazon.com/dp/B00IW8B29K/,4,1
"Car Mount, Vena Clip-Grip 360 Degree Strong Suction Cup Car Mount Holder for iPhone X 8 Plus 8 7 Plus 7, Galaxy Note 8 S8 Plus, Moto G5 Plus, Google Pixel 2 XLL, LG G6/V30 (Up to 90mm Wide)",Wireless,http://www.amazon.com/dp/B00J40E3WS/,1,1
"Belkin Car Vent Mount for Smartphones, including all Samsung S Series and Apple iPhones (Older Model)",Wireless,http://www.amazon.com/dp/B00O5JARCI/,5,1
"Pet Zen Garden Premium Artificial Grass Patch w/ Drainage Holes & Rubber Backing | 4-Tone Realistic Synthetic Grass Mat | Extra-Heavy & Soft Pet Turf | Lead-Free Fake Grass for Dogs or Outdoor Décor | Size: 40"" x 28""",Pet Products,http://www.amazon.com/dp/B00PH9ZLGC/,1,1
Koomus Magnetos Universal Dashboard Windshield Magnetic Cradle-less Smartphone Car Mount Holder,Wireless,http://www.amazon.com/dp/B00SZ2XAYS/,1,1
"AUKEY Car Phone Mount, Air Vent Magnetic Phone Holder for iPhone X / 8 / 7 / 7plus / 6s, Samsung, LG, Nexus and More (Grey)",Wireless,http://www.amazon.com/dp/B00WU3W43G/,9,1
"Aux Adapter,Yomikoo Car MP3 Player Radio Adapter Audio Music Cd Changer AUX In Input 3.5mm Aux interface Fit for Toyota 5+7 Pin 1998-2002 Corolla 1998-2004 Avalon RAV4 1994-2003 Lexus LX 470 2001-2003",Car Audio or Theater,http://www.amazon.com/dp/B016BD7P8Y/,1,1
KINGLAKE 40 Pcs Toyota Replacement Toyota Trim Panel Retainer Clips 90467-10188 Sienna,Automotive Parts and Accessories,http://www.amazon.com/dp/B01CJGJAKI/,1,1
Bstean 100ml Large Plastic-Steel Syringe Pump with 150cm/59inch Tubing and Matching Cap for Oil Liquid Injection,BISS,http://www.amazon.com/dp/B01HFTYIMO/,2,1
