name,category,amazon_link,total_mentions,subreddit_mentions
Elecom optical trackball [USB] (5 button Black) M-XT1URBK,PC Accessory,http://www.amazon.com/dp/B00O1HYX9C/,14,11
Logitech Wireless Trackball M570,CE,http://www.amazon.com/dp/B0043T7FXE/,56,6
SANWA SUPPLY PC Trackball Mouse USB MA-TB39 Black,Personal Computer,http://www.amazon.com/dp/B0042UINC6/,6,4
"ELECOM Wireless index finger Trackball mouse , EX-G series L size 2.4GHz 8 buttons Black M-DT2DRBK",Personal Computer,http://www.amazon.com/dp/B0171QQ7FM/,5,3
Scorpius 32 Keypad Professional Numeric Keypad,PC Accessory,http://www.amazon.com/dp/B0016PB994/,4,2
"ELECOM M-XT3URBK Mouse Wired Trackball grip 6 button, Black",Personal Computer,http://www.amazon.com/dp/B016QCPO0G/,4,2
Kensington Orbit Trackball Mouse with Scroll Ring (K72337US),CE,http://www.amazon.com/dp/B002OOWB3O/,11,2
SANWA SUPPLY Wireless Optical Trackball Black MA-WTB40BK,PC Accessory,http://www.amazon.com/dp/B006JHZO18/,2,2
ELECOM Wireless Trackball Mouse w/5 button & tilt function Black M-XT1DRBK from Japan,PC Accessory,http://www.amazon.com/dp/B00O1HYXSI/,4,2
"ELECOM M-DT2URBK Wired Trackball mouse for the index finger 8 button tilt function, Black",Personal Computer,http://www.amazon.com/dp/B0171QQ7IY/,4,2
"Grand Ground Coffee, Aroma, 17.5 Ounce",Grocery,http://www.amazon.com/dp/B001PQG1ZG/,1,1
NOVUS 7100 Plastic Polish Kit - 8 oz.,Automotive Parts and Accessories,http://www.amazon.com/dp/B002UCYRZU/,29,1
Adesso Trackball Mouse (iMouse T1),Personal Computer,http://www.amazon.com/dp/B0038KLG5C/,1,1
SANWA SUPPLY Optical Trackball USB Mouse MA-TB39S (Silver),PC Accessory,http://www.amazon.com/dp/B0042505N6/,1,1
Max Professional 2015 Contact Cleaner (DPC) - 11 oz.,Automotive Parts and Accessories,http://www.amazon.com/dp/B004PHDLQY/,2,1
"Perixx PERIDUO-707W PLUS, Wireless Mini Keyboard and Mouse Combo - Piano White - 12.60""x5.55""x0.98"" Dimension - Brand Batteries Included - 128 Bit AES Encryption",Personal Computer,http://www.amazon.com/dp/B0053V17C6/,1,1
2X OMRON Micro Switch Microswitch D2FC-F-7N for Mouse by COOLTOOL,PC Accessory,http://www.amazon.com/dp/B005NYGK16/,2,1
Original Logitech Replacement Ball for Logitech M570 Wireless Trackball,Personal Computer,http://www.amazon.com/dp/B007UCBIBG/,1,1
Acrylic Contact Juggling Ball 2 5/32 Inch (55mm) - Clear,Sports,http://www.amazon.com/dp/B009KVBBNA/,1,1
"DuPont Teflon Non-Stick Dry-Film Lubricant, 14-Ounce",Sports,http://www.amazon.com/dp/B00D3G6IFE/,3,1
Lenovo ThinkPad Compact USB Keyboard with TrackPoint - US English,Personal Computer,http://www.amazon.com/dp/B00F3U4TQS/,20,1
"Computer Mouse Wrist Cushion, Gray",Office Product,http://www.amazon.com/dp/B00KZOWO28/,1,1
"Corsair Gaming K95 Mechanical Keyboard with Back-Lit White LED, Cherry MX Red (CH-9000081-NA)",Personal Computer,http://www.amazon.com/dp/B00N4OBBG6/,2,1
Sanwa Wireless Trackball Mouse laser black MA-WTB43BK,PC Accessory,http://www.amazon.com/dp/B00QSZXI28/,1,1
"ELECOM M-XT3DRBK Wireless Trackball Mouse, 6-Button with Smooth Tracking Function, Video Gaming Sensor, Black",Personal Computer,http://www.amazon.com/dp/B016QCPNUW/,5,1
"ELECOM Wireless Trackball mouse for Left-Handed, EX-G series L size 2.4GHz 6 buttons Black M-XT4DRBK",Personal Computer,http://www.amazon.com/dp/B016QCPRBM/,1,1
DuPont Teflon Non-Stick Dry-Film Lubricant,Sports,http://www.amazon.com/dp/B018FTA5WA/,5,1
Tesoro G6TL Ergonomic Backlit Mechanical Keyboard with Optical Trackball Mouse,Boost,http://www.amazon.com/dp/B01D28DX46/,1,1
For Kensington Orbit Wireless Trackball Mouse K72352US Travel EVA Protective Case Carrying Pouch Cover Bag Compact size by Hermitshell,PC Accessory,http://www.amazon.com/dp/B01D302Y5M/,1,1
"Perixx PERIMICE-517 Wired USB Ergonomic Trackball Mouse - 1.34"" Matte and Glossy Trackball Included [Major Update 2017 Sep]",PC Accessory,http://www.amazon.com/dp/B01EV02HP0/,1,1
"Perixx PERIMICE-717, Wireless Programmable Trackabll Mouse - 34mm Trackball - 7 Button Design with 5 Programmable Buttons - 1000/1600/2000 Resolution - Silent Click",PC Accessory,http://www.amazon.com/dp/B01EV02RNM/,1,1
Parblo PR200w USB Wired one-hand Mechanical Gaming Keyboard PET texture USB for Art Drawing device Desktop Computer PC,Wireless,http://www.amazon.com/dp/B01HXQDK2S/,1,1
"XCEL 54""in. Wide x 1'ft. Length x 1/4"" Thick Soft/Medium Neoprene Sponge Foam Rubber Sheets for Cosplay Armor, DIY Projects, and Gaskets",BISS,http://www.amazon.com/dp/B01JSWJTNY/,1,1
"Nakabayashi Co.,Ltd. Digio2 Bluetooth Wireless Trackball for Window PC and Mac and Android (Blue)",PC Accessory,http://www.amazon.com/dp/B01N168WTK/,1,1
Microsoft Trackball Explorer,CE,http://www.amazon.com/dp/B00005853Z/,4,1
"Koolertron Cherry MX Red Programmable Gaming Keypad, Mechanical Gaming Keyboard with 43 Programmable Keys, Single-Handed Keypad Macro Setting, Golden Backlit Can be Turned OFF",PC Accessory,http://www.amazon.com/dp/B071VRV8FW/,1,1
"LOG9043690403 - LOGITECH, INC. Optical TrackMan Cordless Mouse",CE,http://www.amazon.com/dp/B00006B9CR/,5,1
Kensington Expert Trackball Mouse (K64325),CE,http://www.amazon.com/dp/B00009KH63/,12,1
"Coghlan's Nylon Mesh Organizer Bags, 3-Piece Set",Sports,http://www.amazon.com/dp/B000GGTWG6/,1,1
The Ball Bluetooth Wireless Trackball,PC Accessory,http://www.amazon.com/dp/B000GX0QVY/,1,1
Kensington Orbit Trackball Mouse (K64327F),CE,http://www.amazon.com/dp/B000HEW0KW/,3,1
Kensington SlimBlade Trackball Mouse with Bluetooth Wireless (Graphite) K72281US,CE,http://www.amazon.com/dp/B000VE4MM2/,1,1
"Allen Knit  Hangun Gun Sock, 14""",Sports,http://www.amazon.com/dp/B0013LM2P6/,5,1
"CRC Food Grade Silicone Lubricant, (Net Weight: 10 oz) 16oz Aerosol",BISS,http://www.amazon.com/dp/B00192D0TQ/,2,1
"Vaultz Mesh Storage Bags, Assorted Colors and Sizes, 4 Bags (VZ01211)",Office Product,http://www.amazon.com/dp/B001CDD0X8/,5,1
