name,category,amazon_link,total_mentions,subreddit_mentions
(A)Sexual,Movie,http://www.amazon.com/dp/B008F5IM0M/,,1
As Nature Made Him: The Boy Who Was Raised as a Girl,Book,http://www.amazon.com/dp/0061120561/,6,1
My New Gender Workbook: A Step-by-Step Guide to Achieving World Peace Through Gender Anarchy and Sex Positivity,Book,http://www.amazon.com/dp/0415538653/,5,1
Sexing the Body: Gender Politics and the Construction of Sexuality,Book,http://www.amazon.com/dp/0465077145/,3,1
Whipping Girl: A Transsexual Woman on Sexism and the Scapegoating of Femininity,Book,http://www.amazon.com/dp/1580056229/,3,1
Gender Outlaws: The Next Generation,Book,http://www.amazon.com/dp/1580053084/,2,1
Gender Failure,Book,http://www.amazon.com/dp/1551525364/,2,1
You and Your Gender Identity: A Guide to Discovery,Book,http://www.amazon.com/dp/0997455217/,2,1
Stone Butch Blues: A Novel,Book,http://www.amazon.com/dp/1555838537/,2,1
"Gender Outlaw: On Men, Women, and the Rest of Us",Book,http://www.amazon.com/dp/1101973242/,2,1
Queer Theory: An Introduction,Book,http://www.amazon.com/dp/0814742343/,1,1
S/He,Book,http://www.amazon.com/dp/155583888X/,1,1
Transgender Warriors : Making History from Joan of Arc to Dennis Rodman,Book,http://www.amazon.com/dp/0807079413/,1,1
