name,category,amazon_link,total_mentions,subreddit_mentions
The Gender Game,eBooks,http://www.amazon.com/dp/B01I77SNR4/,2,1
"Next Generation Universal Semen Extender Plain Dose for Dogs and Horses, 150ml",Pet Products,http://www.amazon.com/dp/B00AOORJAQ/,1,1
"DYMO LetraTag Labeling Tape for LetraTag Label Makers, Black print on White paper tape, 1/2'' W x 13' L, 2 rolls (10697)",Office Product,http://www.amazon.com/dp/B000067SPR/,1,1
"Pinaud Clubman styptic pencil for nick relief - 0.33 oz, 2 pack",Beauty,http://www.amazon.com/dp/B000YM76VU/,1,1
Pulled Pork Shredder Magic Claws Meat Handling BBQ Forks,Kitchen,http://www.amazon.com/dp/B00MELG2XW/,1,1
"Dual Julienne Peeler and Vegetable Peeler, Premium Ultra Sharp Stainless Steel Vegetable Grater & Slicer with Non-slip Rubber Handle, Cleaning Brush Included, Potato Peeler",Kitchen,http://www.amazon.com/dp/B06Y22VMX3/,1,1
