name,category,amazon_link,total_mentions,subreddit_mentions
Star Trek Star Charts: The Complete Atlas of Star Trek,Book,http://www.amazon.com/dp/0743437705/,10,2
Star Ship Simulation (DP series in games ; no. 1),Book,http://www.amazon.com/dp/091839810X/,1,1
Star Trek Energy Drink Romulan Ale,Grocery,http://www.amazon.com/dp/B00290DOQ6/,1,1
"Augusta Sportswear Mens Medalist Pant, Black/Gold, XX-Large",Apparel,http://www.amazon.com/dp/B00469ERG4/,1,1
Star Trek Original (Remastered) Season 1,TV Series Season Video on Demand,http://www.amazon.com/dp/B005HED11Y/,1,1
Redshirts: A Novel with Three Codas (Hugo Award Winner - Best Novel),eBooks,http://www.amazon.com/dp/B0079XPUOW/,8,1
Augusta Sportswear MEN'S VOLT HOODIE 3XL Black/Gold,Sports,http://www.amazon.com/dp/B00EYYZG34/,1,1
Augusta Sportswear Women's Medalist Pant S Black/Gold,Sports,http://www.amazon.com/dp/B00EZN4SOC/,1,1
Augusta Sportswear WOMEN'S FREEDOM JACKET 2XL Black/Gold,Sports,http://www.amazon.com/dp/B00EZNAGAC/,1,1
Star Trek Hot Wheels Pop Culture Set Of 6,Toy,http://www.amazon.com/dp/B00JVBPCCU/,1,1
Tri-Mountain Performance K147 Mens S/S Golf Shirt - Gold/Black/White - 3XL,Apparel,http://www.amazon.com/dp/B00KPOIA58/,1,1
"Homeyee Women's Retro Chic Colorblock Lapel Career Tunic Dress B238 (S, Blue)",Apparel,http://www.amazon.com/dp/B01B5IR184/,1,1
Augusta Sportswear 4760 Men's Zeal Pullover Black/Gold 3XL,Apparel,http://www.amazon.com/dp/B01BX7YI1K/,1,1
Augusta Sportswear 3780 Men's Quantum Jacket Black/Gold 3XL,Apparel,http://www.amazon.com/dp/B01BXBEAKK/,1,1
Augusta Sportswear 3417 Men's Promentum Pullover - Black/Gold 3417A 3XL,Apparel,http://www.amazon.com/dp/B01BXCI8LQ/,1,1
Augusta Sportswear 243 Adult's Wicking Soccer Shirt Gold/Black XL,Sports,http://www.amazon.com/dp/B01DPYIWFM/,1,1
Star Trek Cookbook,Book,http://www.amazon.com/dp/0671000225/,2,1
"HOMEYEE Women's Elegant Chic Bodycon Formal Dress B288 (XXL, Yellow + Black)",Apparel,http://www.amazon.com/dp/B01IR5PIBK/,1,1
