name,category,amazon_link,total_mentions,subreddit_mentions
I Contain Multitudes: The Microbes Within Us and a Grander View of Life,Book,http://www.amazon.com/dp/0062368591/,2,1
The Hair-Pulling Problem: A Complete Guide to Trichotillomania,Book,http://www.amazon.com/dp/0195149424/,1,1
Life is Trichy: Memoir of a mental health therapist with a mental health disorder,Book,http://www.amazon.com/dp/0692322442/,2,1
"The Hair Pulling ""Habit"" and You: How to Solve the Trichotillomania Puzzle, Revised Edition",Book,http://www.amazon.com/dp/0967305020/,1,1
Pearls: Meditations on recovery from hair pulling and skin picking,Book,http://www.amazon.com/dp/1452802548/,1,1
"Gripmaster Hand Exerciser Black, Heavy Tension (9-Pounds per Finger)",Sports,http://www.amazon.com/dp/B0006GCBL4/,11,1
Sensory Brushes (6 Pack),Health and Beauty,http://www.amazon.com/dp/B001U1UFYE/,2,1
"Gripmaster Hand Exerciser Green, XX-Light Tension (1.5-Pounds per Finger)",Sports,http://www.amazon.com/dp/B002HOOGWU/,1,1
Ultimate Flora Extra Care Probiotic Supplement Vegetable Capsules - 30 Ct,Health and Beauty,http://www.amazon.com/dp/B005GRGCWM/,2,1
Aquaphor Advanced Therapy Healing Ointment Skin Protectant 14 Ounce Jar,Beauty,http://www.amazon.com/dp/B006IB5T4W/,14,1
"Viviscal Hair Filler Fibers, Light Brown  0.53oz 15g",Beauty,http://www.amazon.com/dp/B009ZRFJKK/,1,1
"ReNew Life Ultimate Flora Extra Care Probiotic, 30 Billion, Veggie Capsules 30 ea",Health and Beauty,http://www.amazon.com/dp/B00AU1EXMU/,1,1
Abilitations Gel E Fidget,BISS,http://www.amazon.com/dp/B00BCON5IW/,1,1
Pastel Star Origami Star Papers with Coin Bank,Office Product,http://www.amazon.com/dp/B00D4ZA1D4/,1,1
NuoYa001 New Womens Fashion Sexy long Full Curly Wavy Hair Wigs Cosplay Party Light Brown by NuoYa,Beauty,http://www.amazon.com/dp/B00LP3VRQM/,1,1
