name,category,amazon_link,total_mentions,subreddit_mentions
"Skip Hop Duo Signature Carry All Travel Diaper Bag Tote with Multipockets, One Size, Black",Baby,https://www.amazon.com/Skip-Hop-Signature-Diaper-Black/dp/B00J4J243Y/ref=sr_1_19_s_it?s=baby-products&amp;srs=2600671011&amp;ie=UTF8&amp;qid=1502929133&amp;sr=1-19,1,1
"Skip Hop Duo Signature Carry All Travel Diaper Bag Tote with Multipockets, One Size, Heather Grey",Baby,https://www.amazon.com/Skip-Hop-Signature-Diaper-Heather/dp/B00J4J2CLS/ref=sr_1_3_s_it?s=baby-products&amp;srs=2600671011&amp;ie=UTF8&amp;qid=1502929133&amp;sr=1-3&amp;th=1,1,1
4 Pairs Dr. Motion Therapeutic Graduated Compression Women's Knee-hi Socks…,"Clothing, Shoes & Jewelry",https://www.amazon.com/Dr-Motion-Therapeutic-Graduated-Compression/dp/B01LVTKDSW/ref=cts_ap_1_vtp?pf_rd_m=ATVPDKIKX0DER&amp;pf_rd_p=2601945442&amp;pf_rd_r=Z6SFVPG0ZNYQJWS9T50R&amp;pd_rd_wg=8YcGn&amp;pf_rd_s=desktop-detail-softlines&amp;pf_rd_t=40701&amp;pd_rd_i=B01LTHKDLI&amp;pd_rd_w=GpQb3&amp;pf_rd_i=desktop-detail-softlines&amp;pd_rd_r=Z6SFVPG0ZNYQJWS9T50R&amp;_encoding=UTF8,1,1
Soxland Women's 2-Pack Dr. Motion Compression Socks-Nylon Diamonds/Solid,"Clothing, Shoes & Jewelry",https://www.amazon.com/dp/B01LX7JE1X?psc=1,1,1
Funny Money Ceramic Word Jar with Cork Top,Home & Kitchen,https://www.amazon.com/Funny-Money-Ceramic-Word-Cork/dp/B01IDNY0HO,1,1
