name,category,amazon_link,total_mentions,subreddit_mentions
"Becoming a Supple Leopard 2nd Edition: The Ultimate Guide to Resolving Pain, Preventing Injury, and Optimizing Athletic Performance",Book,http://www.amazon.com/dp/1628600837/,40,1
Vegan Richa's Indian Kitchen: Traditional and Creative Recipes for the Home Cook,Book,http://www.amazon.com/dp/1941252095/,7,1
"Isopure Low Carb Protein Powder, 100% Whey Protein Isolate, Flavor: Dutch Chocolate, 3 Pounds (Packaging May Vary)",Health and Beauty,http://www.amazon.com/dp/B000E8ZJGS/,10,1
"Isopure Zero Carb Protein Powder, 100% Whey Protein Isolate, Flavor: Creamy Vanilla, 3 Pounds (Packaging May Vary)",Health and Beauty,http://www.amazon.com/dp/B000E95HP0/,24,1
"Boiron Arnica Gel, 1.5 oz",Grocery,http://www.amazon.com/dp/B000GG5NAU/,1,1
"PB2 Powdered Peanut Butter,6.5 oz",Grocery,http://www.amazon.com/dp/B002GJ9JWS/,44,1
Mybat UNIVP255NP Sport Armband Case for Cell Phones and Smartphones - Retail Packaging - Neon Green,Wireless,http://www.amazon.com/dp/B00A4496CK/,1,1
"Quaker Popped Chips, Hummus, Salsa Fresca Flavor, 4 oz (Pack of 8)",Grocery,http://www.amazon.com/dp/B00CFR4BH4/,1,1
"Freya Women's Active Underwire Moulded Sports Bra, Hot Crimson, 36FF",Apparel,http://www.amazon.com/dp/B00EVOIR42/,1,1
"Bitbelt Disney Magic band- 2 pack 90 day warranty. We invented the ""fitbit clasp fix"". (Yellow)",Sports,http://www.amazon.com/dp/B00LBKHJN4/,1,1
Dealgadgets Galaxy Note 4 Armband Case Cover Black Protective Gym Jogging Sports Armband Case Cover for Samsung Galaxy Note 4 (Black),Wireless,http://www.amazon.com/dp/B00NBLO9UW/,1,1
Workoutclothing Women's Workout Fitness Gym Tank Top,Apparel,http://www.amazon.com/dp/B00XBTU9KS/,1,1
Baleaf Women's Workout Fitness Yoga Shorts Inner Pocket Black Purple Size L,Apparel,http://www.amazon.com/dp/B01AUQI3UM/,1,1
