name,category,amazon_link,total_mentions,subreddit_mentions
d20 Cyberscape : A d20 Modern Supplement,Book,http://www.amazon.com/dp/0786936959/,2,1
"Buckwheat Zafu and Zabuton Meditation Cushion Set (2pc), Black",Beauty,http://www.amazon.com/dp/B000GOAEH4/,1,1
Tron DJ Lunch Bag,Kitchen,http://www.amazon.com/dp/B005OCTCIK/,1,1
TRON: Uprising Volume 1,TV Series Season Video on Demand,http://www.amazon.com/dp/B0098VXR1Q/,1,1
"FLYNN LIVES - retro movie funny user program Tee Shirt T-Shirt, XL, Black",Apparel,http://www.amazon.com/dp/B00M24F7UU/,1,1
