name,category,amazon_link,total_mentions,subreddit_mentions
Leland Lures 87659 Neon TM 85pc Kit,Sports,http://www.amazon.com/dp/B0010FFKXG/,4,4
Pflueger 6920 President Spinning Fishing Reel,Sports,http://www.amazon.com/dp/B005OU1BOK/,4,3
"Leland Lures E.F. Lead Free Trout Magnet Jig Head, Pink",Sports,http://www.amazon.com/dp/B003OBDD1K/,2,2
Ugly Stik Elite Spinning Rod 5' - Ultra Light - 2pc,Sports,http://www.amazon.com/dp/B00UR94BG8/,2,2
Rio Fluoroflex Plus Tippet 5x - 5lb - 30yd,Sports,http://www.amazon.com/dp/B0007PNES8/,2,2
"Panther Martin 2PMR-S 1/16-Ounce Spinner Spinbait, Size 11 Hook, Silver Finish",Sports,http://www.amazon.com/dp/B0000AUUJT/,1,1
"Eagle Claw 139GEH-8 Snelled Hooks, 6-Pack, Sz8, Red Classic Baitholder",Sports,http://www.amazon.com/dp/B0000AUYFJ/,1,1
Mepps Plain Lure Assortment Trouter Kit,Sports,http://www.amazon.com/dp/B00019N1AQ/,1,1
Ugly Stik Spinning Combo,Sports,http://www.amazon.com/dp/B000DT7GGE/,1,1
"Redington Clark Fork Mesh Fishing Vest, Sage Large/X-Large",Sports,http://www.amazon.com/dp/B000E22886/,1,1
"Okuma Celilo Graphite Lightweight Ultra Light Trout Rods, CE-S-662UL-1",Sports,http://www.amazon.com/dp/B000JUGU78/,2,1
Okuma VS-605-20 Voyager Spinning Travel Kit,Sports,http://www.amazon.com/dp/B000MQTJW2/,13,1
Panther Martin Best of the Best Kit.,Sports,http://www.amazon.com/dp/B000ZKNFW0/,1,1
Leland Lures 87670 E-Z Trout Float 4 Slotted Floats,Sports,http://www.amazon.com/dp/B0010FBVGQ/,1,1
Trout Crappie Magnet Kit (96-Piece),Sports,http://www.amazon.com/dp/B0010FHH00/,1,1
"Berkley Trilene XL Smooth Casting Monofilament Service Spools (XLPS6-15), 110 Yd, pound test 6 - Clear",Sports,http://www.amazon.com/dp/B001F5EZ8W/,1,1
Stearns 33 Gram Manual Fishing Vest,Sports,http://www.amazon.com/dp/B00364PDQS/,1,1
Thomas T101-PCH Bouyant,Sports,http://www.amazon.com/dp/B003CTUDJ4/,1,1
Eagle Claw Classic Bamboo Trout Net (15 x 11 x 9-Inch),Sports,http://www.amazon.com/dp/B003JSO18C/,1,1
"SE 651FC 5"" Self Locking Curved Forceps, Stainless Steel",Home Improvement,http://www.amazon.com/dp/B003L8H0TC/,1,1
RadioShack Waterproof Pocket Infrared Thermometer,Kitchen,http://www.amazon.com/dp/B007Z7YACK/,1,1
Gamakatsu Octopus Circle Hook,Sports,http://www.amazon.com/dp/B008DDCYJ6/,1,1
Trilene XL,Sports,http://www.amazon.com/dp/B0091HDAU0/,1,1
"Beadaholique 500 Count Resealable Zipper Poly Bags, 2 by 3-Inch, 50mm by 100mm, Clear",Art and Craft Supply,http://www.amazon.com/dp/B00AFRWKRO/,7,1
"Panther Martin PMHD_1_SGH Deluxe Holographic Fishing Spinner, Silver/Blue",Sports,http://www.amazon.com/dp/B00CO98H5K/,1,1
"Shakespeare USSP481UL/20CBO Ugly Stik GX2 1-Piece Fishing Rod and Spinning Reel Combo, 4 Feet 8 Inch, Ultra-Light Power",Sports,http://www.amazon.com/dp/B00F0KMC4M/,1,1
Ugly Stik GX2 Spinning Combo,Sports,http://www.amazon.com/dp/B00IW5YDP8/,1,1
"Ugly Stik Elite Spinning Rod 5'6"" - Light - 2pc",Sports,http://www.amazon.com/dp/B00QMSTHVW/,1,1
Riptail Rolling Barrel Swivels (Size #7 (30lb) - 10 Pack),Sports,http://www.amazon.com/dp/B07146LTV6/,1,1
An Entirely Synthetic Fish: How Rainbow Trout Beguiled America and Overran the World,Book,http://www.amazon.com/dp/0300140886/,1,1
Riptail Rolling Barrel Swivels (Size #7 (30lb) - 5 Pack),Sports,http://www.amazon.com/dp/B071L9FSRW/,1,1
Fly Patterns by Fishing Guides: 200 Flies That Really Work,Book,http://www.amazon.com/dp/0764165631/,1,1
Fly-fishing Guide to the Upper Delaware River,Book,http://www.amazon.com/dp/0811708799/,1,1
Reading Trout Water,Book,http://www.amazon.com/dp/081173644X/,3,1
Panther Martin 2PMR-G Regulars,Sports,http://www.amazon.com/dp/B0000AUUHN/,1,1
