name,category,amazon_link,total_mentions,subreddit_mentions
"Taking Charge of Your Fertility, 20th Anniversary Edition: The Definitive Guide to Natural Birth Control, Pregnancy Achievement, and Reproductive Health",Book,http://www.amazon.com/dp/0062326031/,7,2
"Restoring Fertility by Drs. Brandon Horn, PhD, LAc (FABORM) and Wendy Yu PhD(c), LAc (FABORM)",DVD,http://www.amazon.com/dp/B001OVFAA4/,2,2
The Scandalous Mrs. Wilson (Fraser Springs Book 1),eBooks,http://www.amazon.com/dp/B06XJWSNYN/,,1
Baby Catcher: Chronicles of a Modern Midwife,Book,http://www.amazon.com/dp/0743219341/,2,1
The Happiest Baby on the Block; Fully Revised and Updated Second Edition: The New Way to Calm Crying and Help Your Newborn Baby Sleep Longer,Book,http://www.amazon.com/dp/0553393235/,2,1
Boppy Cuddle Pillow,Baby,https://www.amazon.com/Boppy-5100205K-2PK-Cuddle-Pillow/dp/B00AIVN87I,1,1
Ezy Dose Calibrated Oral Medicine Syringe 1 TSP (5 mL) with Bottle Adapter,Health and Beauty,http://www.amazon.com/dp/B000VCF6FG/,1,1
"Baby ASAP for Men: Premium Male Fertility Supplement. Support for low Sperm Count, Low Sperm Motility, and Sperm Morphology",Health and Beauty,http://www.amazon.com/dp/B00OQR8HLC/,1,1
"Lansinoh TheraPearl 3-in-1 Hot or Cold Breast Therapy, 2 Count",Baby,https://www.amazon.com/Lansinoh-THERA-PEARL-Breast-Therapy/dp/B00AV9P44C,1,1
Pushed: The Painful Truth About Childbirth and Modern Maternity Care,Book,http://www.amazon.com/dp/0738211664/,1,1
Wondfo 100 Ovulation Tests And 20 Pregnancy Tests by Wondfo,BISS,http://www.amazon.com/dp/B001E1Y1X6/,1,1
Veridian 08-365 Basal Digital Thermometer,Health and Beauty,http://www.amazon.com/dp/B003SLX2NU/,1,1
Bluebird,Book,http://www.amazon.com/dp/1927018331/,1,1
"Heading Home With Your Newborn: From Birth to Reality, 2nd Edition",Book,http://www.amazon.com/dp/1581104448/,1,1
"Hi, Koo!: A Year of Seasons",Book,http://www.amazon.com/dp/0545166683/,1,1
