name,category,amazon_link,total_mentions,subreddit_mentions
"A118-C 1080p HD Car Dash Camera with Capacitor G-Sensor 1.5"" HD Screen 170 Degree Wide Angle Lens Records at 60 FPS with Loop Recording",Car Audio or Theater,http://www.amazon.com/dp/B00SK8B47W/,23,1
Samsung EVO 32GB Class 10 Micro SDHC Card with Adapter (MB-MP32DA/AM),Electronics,https://www.amazon.com/Samsung-Class-Adapter-MB-MP32DA-AM/dp/B00IVPU786/ref=pd_sim_107_2,12,1
Spy Tec Mini USB Dash Cam 10 Foot Hardwire and Fuse Kit for A119 A119S G1W G1WS,Wireless,http://www.amazon.com/dp/B01N0GR4ON/,11,1
An Oklahoma I Had Never Seen Before: Alternative Views of Oklahoma History,Book,http://www.amazon.com/dp/080612945X/,1,1
Alternative Oklahoma: Contrarian Views of the Sooner State,Book,http://www.amazon.com/dp/080613819X/,1,1
