name,category,amazon_link,total_mentions,subreddit_mentions
"Indoor Bike Trainer Exercise Stand, Orange",Sports,http://www.amazon.com/dp/B004E1SVOI/,8,2
"Quaker Instant Oatmeal, Dinosaur Eggs and Brown Sugar, Breakfast Cereal, 14.1 Ounce (Pack of 4)",Grocery,http://www.amazon.com/dp/B001M0AKE8/,5,2
"Jokari Whale Faucet Fountains, 3-Pack",Kitchen,http://www.amazon.com/dp/B0020ML3PW/,3,2
Wyrd Sisters (Discworld),Book,http://www.amazon.com/dp/0062225731/,2,1
Men at Arms (Discworld),Book,http://www.amazon.com/dp/0062237403/,1,1
The Fifth Elephant: A Novel of Discworld,Book,http://www.amazon.com/dp/0062280139/,1,1
Jingo: A Novel of Discworld,Book,http://www.amazon.com/dp/0062280201/,2,1
Welcome to Night Vale: A Novel,Book,http://www.amazon.com/dp/0062351427/,7,1
Alexander Hamilton,Book,http://www.amazon.com/dp/0143034758/,15,1
How to Train Your Dragon: How to Betray a Dragon's Hero,Book,http://www.amazon.com/dp/0316244112/,1,1
Go Hang a Salami! I'm a Lasagna Hog!: and Other Palindromes,Book,http://www.amazon.com/dp/0374444730/,3,1
Friend or Foe?  (Outernet #1),Book,http://www.amazon.com/dp/0439343518/,1,1
The Revolution: A Manifesto,Book,http://www.amazon.com/dp/0446537527/,4,1
"Agent Garbo: The Brilliant, Eccentric Secret Agent Who Tricked Hitler and Saved D-Day",Book,http://www.amazon.com/dp/0544035011/,4,1
Dragonsdale #1,Book,http://www.amazon.com/dp/0545034035/,1,1
Teen Boat! The Race for Boatlantis,Book,http://www.amazon.com/dp/0547865635/,1,1
The Depression Cure: The 6-Step Program to Beat Depression without Drugs,Book,http://www.amazon.com/dp/0738213888/,17,1
The Action Bible,Book,http://www.amazon.com/dp/0781444993/,8,1
"New X-Men, Vol. 1",Book,http://www.amazon.com/dp/0785132511/,142,1
"New X-Men, Vol. 2",Book,http://www.amazon.com/dp/078513252X/,2,1
"New X-Men, Vol. 3",Book,http://www.amazon.com/dp/0785132538/,2,1
"Daredevil, Vol. 1",Book,http://www.amazon.com/dp/0785152385/,29,1
"X-Men: God Loves, Man Kills",Book,http://www.amazon.com/dp/0785157263/,7,1
Astonishing X-Men By Joss Whedon & John Cassaday Ultimate Collection - Book 1,Book,http://www.amazon.com/dp/0785161945/,21,1
Astonishing X-Men By Joss Whedon & John Cassaday Ultimate Collection Book 2,Book,http://www.amazon.com/dp/0785161953/,3,1
X-Men: Dark Phoenix Saga,Book,http://www.amazon.com/dp/0785164219/,9,1
X-Men: Days of Future Past,Book,http://www.amazon.com/dp/0785164537/,4,1
Dungeons & Dragons Starter Set,Book,http://www.amazon.com/dp/0786965592/,355,1
Player's Handbook (Dungeons & Dragons),Book,http://www.amazon.com/dp/0786965606/,137,1
Dungeon Master's Guide (D&D Core Rulebook),Book,http://www.amazon.com/dp/0786965622/,49,1
Even Monsters Need Haircuts,Book,http://www.amazon.com/dp/0802738397/,1,1
The Boss Baby,Book,http://www.amazon.com/dp/1442401672/,1,1
"The Disaster Artist: My Life Inside The Room, the Greatest Bad Movie Ever Made",Book,http://www.amazon.com/dp/1451661193/,7,1
F for Effort: More of the Very Best Totally Wrong Test Answers,Book,http://www.amazon.com/dp/145211322X/,2,1
Natural Harvest: A collection of semen-based recipes,Book,http://www.amazon.com/dp/1481227041/,160,1
The Forest,Book,http://www.amazon.com/dp/1519404816/,3,1
"Graph Paper Notebook - Square Grid Journal - Blue Purple Watercolor: extra large 8.5 x 11, 110 pages, soft cover (Squared Notebooks)",Book,http://www.amazon.com/dp/1542724147/,1,1
"Graph Paper Notebook - Flowers and Birds: Square Grid Journal, Large 8 1/2 by 11 inches, 150 pages",Book,http://www.amazon.com/dp/1546498206/,1,1
"Get Shit Done: Graph Paper Journal, Unicorn, 150 Graph Pages, 8""x10"", 1/4 Inch Grid, Professionally Designed",Book,http://www.amazon.com/dp/1546612548/,1,1
Who Cut the Cheese?: A Cultural History of the Fart,Book,http://www.amazon.com/dp/1580080111/,2,1
Vampire A Hunger Like Fire (1) (VAMPIRE THE REQUIEM),Book,http://www.amazon.com/dp/1588468623/,1,1
The Old Man and His Sons,Book,http://www.amazon.com/dp/1846590736/,1,1
"Fisher Space Pen Bullet Chrome Finish, Gift Boxed (400)",Office Product,http://www.amazon.com/dp/B000095K9D/,9,1
Glico - Men's Chocolate Pocky 2.53 Oz.,Grocery,http://www.amazon.com/dp/B0002JAW8E/,2,1
Krypt Silver 654 Piece Blank Puzzle Challenge,Toy,http://www.amazon.com/dp/B0009QXXB8/,9,1
Fang Gamepad by Ideazon,CE,http://www.amazon.com/dp/B000FRW8KS/,3,1
"Fisher Space Pen Model# 400PK Bullet Space Pen, Pink Lacquered, 1 Piece",Office Product,http://www.amazon.com/dp/B000HLD806/,1,1
Ideazon Merc Stealth Illuminated Gaming Keyboard,CE,http://www.amazon.com/dp/B000V62BZU/,1,1
"Pilot G2 Retractable Premium Gel Ink Roller Ball Pens, Ultra Fine, Dozen Box, Black",Office Product,http://www.amazon.com/dp/B0017TMMLS/,11,1
Jokari Whale Faucet Fountain,Home Improvement,http://www.amazon.com/dp/B0019TUKV0/,5,1
Clairefontaine Wirebound Book 6X8.25 Graph Assorted colors,Office Product,http://www.amazon.com/dp/B002TDO07A/,2,1
Nerf N-Strike Elite Longshot CS-6 (Blue Version),Toy,http://www.amazon.com/dp/B002VSU2FM/,3,1
"Bandai Hobby MG Figurerise Son Goku ""Dragonball Z"" Model Kit (1/8 Scale)",Toy,http://www.amazon.com/dp/B0035MOFTW/,2,1
Strawberry Candy Wrapped: 5LB,Grocery,http://www.amazon.com/dp/B003EMSRLK/,19,1
Bound By Blood (Bound - Vampire & Werewolf Romance Book 1),eBooks,http://www.amazon.com/dp/B004VF69LY/,1,1
Heinz Ketchup Packet - 200 Case,Grocery,http://www.amazon.com/dp/B004X6TWQA/,1,1
Love Is Art Canvas and Paint Kit - Abstract Art Through Intimacy,Health and Beauty,http://www.amazon.com/dp/B005PR28AS/,6,1
"FLIPPER Faucet Fountain, Chrome Finish",Home Improvement,http://www.amazon.com/dp/B005TJOA5S/,1,1
"Hazer Baba Turkish Delight with Rose, 16 oz",Grocery,http://www.amazon.com/dp/B0062857M0/,4,1
SNICKERS Slice n' Share Giant Chocolate Candy Bar 1-Pound Bar,Grocery,http://www.amazon.com/dp/B0063HMIRW/,11,1
Kervan Assorted Gummi Lighthouses - 5lb,Grocery,http://www.amazon.com/dp/B007XJE61K/,2,1
Pound-O-Dice,Toy,http://www.amazon.com/dp/B008C0KXYS/,63,1
Raspberry Great Garden Fruit Bush 15 Seeds,Lawn & Patio,http://www.amazon.com/dp/B008N2XVI0/,1,1
10 in 1 Multi Phone USB Charger Cable Car Charger Wall Charger - US Plug,Wireless,http://www.amazon.com/dp/B008OBT3UK/,2,1
Wiz Dice Random Polyhedral Dice in Multiple Colors (100 + Pack) Bundle with Wiz Dice Pouch,Sports,http://www.amazon.com/dp/B009R6J8RY/,84,1
All Yesterdays: Unique and Speculative Views of Dinosaurs and Other Prehistoric Animals,eBooks,http://www.amazon.com/dp/B00A2VS55O/,10,1
"Demeter Paperback Cologne Spray for Unisex, 4 Ounce",Beauty,http://www.amazon.com/dp/B00C9ER8F0/,1,1
Kwik Sip Brass In Home Faucet Attachment Water Fountain,Home Improvement,http://www.amazon.com/dp/B00CH4TYXQ/,4,1
Mine To Keep (Mine- Romantic Suspense Book 2),eBooks,http://www.amazon.com/dp/B00EL02CBK/,1,1
"Amazon Fire Phone, 32GB (AT&T)",Amazon Tablets,http://www.amazon.com/dp/B00EOE0WKQ/,3,1
"Box of Famous Idaho Spud Chocolate Candy Bars - Full Size Bar, Bulk, Specialty Candy Boxes, Soft Marshmallo Center Drenched with a Dark Chocolate Coating Sprinkled with Coconut",Grocery,http://www.amazon.com/dp/B00G2V7UXQ/,1,1
Sea Waffle Waffle Maker - Make Fun Sea Animal Shaped Waffles in Minutes!,Kitchen,http://www.amazon.com/dp/B00HJUD2WW/,1,1
Accoutrements Santaur Ornament,Toy,http://www.amazon.com/dp/B00LY8KNO0/,3,1
"I Could Eat a T-Rex Spaghetti Noodle Pasta Measurer Tool, Measure Quantity by doiy",Kitchen,http://www.amazon.com/dp/B00ON8Y1LO/,3,1
Field Notes Cherry Graph 3-Pack,Office Product,http://www.amazon.com/dp/B00ORZFPWC/,3,1
Set Of 4 Classic Hats Pencil Eraser Novelty Toppers,Office Product,http://www.amazon.com/dp/B00RW5AYKC/,1,1
And Tango Makes Three,eBooks,http://www.amazon.com/dp/B00WEZR0KC/,1,1
"Northbooks Notebook / Journal, 96 Square Grid Pages, Acid Free Sheets, 5x8 | Made in USA",Office Product,http://www.amazon.com/dp/B015JQZS2O/,1,1
Shark Attack Bowl,Kitchen,http://www.amazon.com/dp/B018RKMH46/,3,1
"6 HOUR SLEEP Natural Sleep Aid, GABA, MELATONIN, 5-HTP - 12 Pack",Health and Beauty,http://www.amazon.com/dp/B0195J4K1G/,1,1
A Girl Corrupted by the Internet is the Summoned Hero?!,eBooks,http://www.amazon.com/dp/B01B2BP726/,6,1
Sesame Street T-Shirt,Apparel,http://www.amazon.com/dp/B01EHQR3XO/,1,1
3pcs/lot mens fashion wolf underwear funny 3D print boxers shorts,Toy,http://www.amazon.com/dp/B01ERC3PWQ/,2,1
"Scable Mugmee Invisible Mini Wireless Bluetooth Earbud Earphone Headset Support Hands-Free Calling for iPhone, Samsung, Sony, HTC, LG, Blackberry Smartphones",Wireless,http://www.amazon.com/dp/B01GPZ3HE4/,1,1
Wiz Dice Bag of Devouring: 140 Polyhedral Dice in 20 Guaranteed Complete Sets,Toy,http://www.amazon.com/dp/B01KP4T6TQ/,9,1
The Last Hero: A Discworld Fable,Book,http://www.amazon.com/dp/0060507772/,4,1
"Unisex Cat Ear Big Kangaroo Pouch Hoodie Long Sleeve Pet Cat Dog Holder Carrier Sweatshirt (L, Grey)",Apparel,http://www.amazon.com/dp/B01MR44Q8Y/,1,1
How Not to Write a Novel: 200 Classic Mistakes and How to Avoid Them--A Misstep-by-Misstep Guide,Book,http://www.amazon.com/dp/0061357952/,2,1
The Golem and the Jinni: A Novel (P.S.),Book,http://www.amazon.com/dp/0062110845/,4,1
