name,category,amazon_link,total_mentions,subreddit_mentions
ART Pro Audio DJPRE II Phono Turntable Preamplifier,Musical Instruments,http://www.amazon.com/dp/B000AJR482/,120,3
Shure SFG-2 Stylus Tracking Force Gauge,Musical Instruments,http://www.amazon.com/dp/B00006I5SD/,19,1
Pyramid PS3KX 3-Amp 12-Volt Power Supply,Car Audio or Theater,http://www.amazon.com/dp/B0002JTD2K/,3,1
Audio-Technica AT92ECD Universal Replacement Magnetic Phono Cartridge,Musical Instruments,http://www.amazon.com/dp/B00006HO3L/,30,1
"Auralex Acoustics MoPAD-XL Monitor Acoustic Isolation Pads, 2"" x 8.75"" x 12"",  1 Pair, Charcoal",Musical Instruments,http://www.amazon.com/dp/B00266HBSU/,3,1
Project Essential II Turntable - Matte Black,Receiver or Amplifier,http://www.amazon.com/dp/B00DKSUHO8/,6,1
UpBright NEW Global AC/DC Adapter For Teac TN-300 TN-300-R TN-300-TB TN-300-CH TN-300-NA TN-300W TN300 TN300R TN300TB TN300CH TN300NA TN300W Analog Turntable Power Supply Cord Charger,Speakers,http://www.amazon.com/dp/B01H5AJPIA/,1,1
