name,category,amazon_link,total_mentions,subreddit_mentions
"Taking Charge of Your Fertility, 10th Anniversary Edition: The Definitive Guide to Natural Birth Control, Pregnancy Achievement, and Reproductive Health",Book,http://www.amazon.com/dp/0060881909/,280,25
The Gift of Fear: And Other Survival Signals That Protect Us from Violence,Book,http://www.amazon.com/dp/0440226198/,89,12
Come as You Are: The Surprising New Science that Will Transform Your Sex Life,Book,http://www.amazon.com/dp/1476762090/,133,10
"The Care and Keeping of You: The Body Book for Younger Girls, Revised Edition",Book,http://www.amazon.com/dp/1609580834/,29,7
The Gift of Fear and Other Survival Signals that Protect Us From Violence,Book,http://www.amazon.com/dp/0440508835/,44,6
The Impatient Woman's Guide to Getting Pregnant,Book,http://www.amazon.com/dp/1451620705/,165,6
"Wondfo Pregnancy Test Strips, 25-count medical",Health and Beauty,http://www.amazon.com/dp/B0002YIQEQ/,25,6
Why Does He Do That?: Inside the Minds of Angry and Controlling Men,Book,http://www.amazon.com/dp/0425191656/,68,5
Where Did I Come From?,Book,http://www.amazon.com/dp/0818402539/,15,5
In the Company of Women: Indirect Aggression Among Women:  Why We Hurt Each Other and How to Stop,Book,http://www.amazon.com/dp/1585422231/,8,5
"Plan B One-step Emergency Contraceptive 1 Tablet,1.5 mg",Health and Beauty,http://www.amazon.com/dp/B00H2D6WUA/,16,4
Living in the Crosshairs: The Untold Stories of Anti-Abortion Terrorism,Book,http://www.amazon.com/dp/0199377553/,4,3
The Care and Keeping of You 2: The Body Book for Older Girls,Book,http://www.amazon.com/dp/1609580427/,16,3
Self-Made Man: One Woman's Year Disguised as a Man,Book,http://www.amazon.com/dp/0143038702/,49,3
"NOW D-Mannose Powder,3-Ounce",Health and Beauty,http://www.amazon.com/dp/B000HCMK90/,9,3
Nippies Skin ORIGINAL Hypoallergenic Nipple Covers Pasties with ADHESIVE CREME COLOR SIZE 1,Apparel,http://www.amazon.com/dp/B001PU9A9Q/,14,3
Woman's Inhumanity to Woman,Book,http://www.amazon.com/dp/1556529465/,5,3
"MABIS Basal Thermometer, Digital BBT Thermometer, Basal Body Temperature Thermometer For Natural Family Planning, White and Pink",Health and Beauty,http://www.amazon.com/dp/B000O6YCZY/,112,3
Magic Wand Massager,Health and Beauty,http://www.amazon.com/dp/B00005M1WE/,48,3
"""What's Happening to Me?"" A Guide to Puberty",Book,http://www.amazon.com/dp/0818403128/,3,3
"ClinicalGuard® HCG Pregnancy Test Strips (Individually-Sealed, Pack of 50)",Health and Beauty,http://www.amazon.com/dp/B007VT3BUE/,4,3
"It's Perfectly Normal: Changing Bodies, Growing Up, Sex, and Sexual Health (The Family Library)",Book,http://www.amazon.com/dp/0763668729/,25,3
"Deal with It!  A Whole New Approach to Your Body, Brain, and Life as a gURL",Book,http://www.amazon.com/dp/0671041576/,3,3
"Delusions of Gender: How Our Minds, Society, and Neurosexism Create Difference",Book,http://www.amazon.com/dp/0393340244/,27,2
Missoula: Rape and the Justice System in a College Town,Book,http://www.amazon.com/dp/0385538731/,15,2
"Full Catastrophe Living (Revised Edition): Using the Wisdom of Your Body and Mind to Face Stress, Pain, and Illness",Book,http://www.amazon.com/dp/0345536932/,24,2
Extraordinary Popular Delusions,Book,http://www.amazon.com/dp/0486432238/,3,2
"Passion Lubes, Natural Water-Based Lubricant, 55 Gallon Drum",Health and Beauty,http://www.amazon.com/dp/B005MR3IVO/,713,2
Corporate Confidential: 50 Secrets Your Company Doesn't Want You to Know---and What to Do About Them,Book,http://www.amazon.com/dp/0312337361/,11,2
"SABRE Red Pepper Gel - Police Strength - Tactical Series with 18-Foot (5.5M) Range, 18 Bursts & Belt Holster",Sports,http://www.amazon.com/dp/B004NKSPR8/,27,2
The Monzcare R-CUP Reusable Menstrual Cup Cyan Size 1,Health and Beauty,http://www.amazon.com/dp/B00JY6WFWW/,10,2
"J5 Tactical V1-Pro Flashlight The Original 300 Lumen Ultra Bright, LED 3 Mode Flashlight",Home Improvement,http://www.amazon.com/dp/B00V7T1YRQ/,9,2
Mean Girls at Work: How to Stay Professional When Things Get Personal,eBooks,http://www.amazon.com/dp/B009Q0CQ3Y/,2,2
Vipertek VTS-989B V Mini Stun Gun Rechargeable with LED Flashlight (Black),Sports,http://www.amazon.com/dp/B00FPE6UN2/,7,2
"ThermaCare Menstrual Cramp Relief Heat Wraps, 1 Count",Health and Beauty,http://www.amazon.com/dp/B002L24BDM/,12,2
"ClinicalGuard® HCG Pregnancy Test Strips (Individually-Sealed, Pack of 25)",Health and Beauty,http://www.amazon.com/dp/B007VT30C8/,5,2
"babi One Step HCG Urine Pregnancy Test Strips, 50-count",Beauty,http://www.amazon.com/dp/B008B1B3LK/,2,2
"Merkur Futur MK 23C Long-Handled Traditional Double Edge Safety Razor - Excellent Comfort, Control, and Design - 4.2 Inches, Chrome Finish",Beauty,http://www.amazon.com/dp/B000NL0T1G/,98,2
She Comes First: The Thinking Man's Guide to Pleasuring a Woman (Kerner),Book,http://www.amazon.com/dp/0060538260/,143,2
"ClinicalGuard® HCG Pregnancy Test Strips (Individually-Sealed, Pack of 20)",Health and Beauty,http://www.amazon.com/dp/B007VT2OQG/,17,2
"ClinicalGuard® HCG Pregnancy Test Strips (Individually-Sealed, Pack of 100)",Health and Beauty,http://www.amazon.com/dp/B007VT4F0E/,4,2
FACILLA® 20 Home Early Pregnancy Urine hCG Test Strip High Accuracy,Health and Beauty,http://www.amazon.com/dp/B00ATWFO1Y/,2,2
OXO Good Grips Silicone Drain Protector for Pop-Up & Regular Drains,Home,http://www.amazon.com/dp/B00OCEBMFM/,9,2
"Black Box G1W-CB ""Black Bezel"" Capacitor Model Dash Camera - Heat Resistant - Full HD 1080P H.264 2.7"" LCD Car DVR Video Recorder - WDR 140° Wide Angle 4x Zoom Motion Detection Night Vision G-Sensor",Car Audio or Theater,http://www.amazon.com/dp/B00P8F3LD0/,49,2
"Leachco Snoogle Total Body Pillow, Ivory",Home,http://www.amazon.com/dp/B0000635WI/,37,2
Come as You Are: The Surprising New Science that Will Transform Your Sex Life,eBooks,http://www.amazon.com/dp/B00LD1ORBI/,16,2
Master Lock 265DCCSEN Dual-Function Security Bar,Home Improvement,http://www.amazon.com/dp/B0002YUX8I/,62,2
Tomboy: A Graphic Memoir,Book,http://www.amazon.com/dp/1936976552/,2,2
Stop Walking on Eggshells: Taking Your Life Back When Someone You Care About Has Borderline Personality Disorder,Book,http://www.amazon.com/dp/1572246901/,72,2
"Instead Softcups 12 Hour Feminine Protection,14 Count",Health and Beauty,http://www.amazon.com/dp/B000X29GY6/,9,2
The Female Assumption: A Mother's Story: Freeing Women from the View that Motherhood is a Mandate,Book,http://www.amazon.com/dp/1500933058/,4,2
What's Happening to My Body? Book for Girls: Revised Edition,Book,http://www.amazon.com/dp/1557047642/,6,2
"Convicted Survivors: The Imprisonment of Battered Women Who Kill (Suny Series in Women, Crime, and Criminology)",Book,http://www.amazon.com/dp/0791453278/,2,2
"It's So Amazing!: A Book about Eggs, Sperm, Birth, Babies, and Families (The Family Library)",Book,http://www.amazon.com/dp/0763668745/,11,2
Couple Skills: Making Your Relationship Work,Book,http://www.amazon.com/dp/157224481X/,3,2
Plan B Emergency Contraceptive Tablet (Contains 1 Tablet 1.5mg),Health and Beauty,http://www.amazon.com/dp/B001BKRG46/,4,2
Displacing Human Rights: War and Intervention in Northern Uganda,Book,http://www.amazon.com/dp/0199782083/,1,1
Naked Economics: Undressing the Dismal Science,Book,http://www.amazon.com/dp/0393049825/,1,1
Better Never to Have Been: The Harm of Coming into Existence,Book,http://www.amazon.com/dp/0199549265/,36,1
Animal Liberation: The Definitive Classic of the Animal Movement,Book,http://www.amazon.com/dp/0061711306/,7,1
I Hate You--Don't Leave Me: Understanding the Borderline Personality,Book,http://www.amazon.com/dp/0399536213/,22,1
Goldie Blox Rules the School! (GoldieBlox) (A Stepping Stone Book(TM)),Book,http://www.amazon.com/dp/0399556346/,1,1
Nine Parts of Desire: The Hidden World of Islamic Women,Book,http://www.amazon.com/dp/0385475772/,1,1
Feeling Good: The New Mood Therapy,Book,http://www.amazon.com/dp/0380810336/,228,1
"The Premature Menopause Book:: When The ""change Of Life"" Comes Too Early",Book,http://www.amazon.com/dp/0380805413/,1,1
The Hippocratic Oath and the Ethics of Medicine,Book,http://www.amazon.com/dp/0195188209/,1,1
Snakes in Suits: When Psychopaths Go to Work,Book,http://www.amazon.com/dp/0061147893/,6,1
Quirkyalone: A Manifesto for Uncompromising Romantics,Book,http://www.amazon.com/dp/0060750618/,1,1
Fasting Girls: The History of Anorexia Nervosa,Book,http://www.amazon.com/dp/0375724486/,4,1
The Complete Persepolis,Book,http://www.amazon.com/dp/0375714839/,9,1
"The Body Keeps the Score: Brain, Mind, and Body in the Healing of Trauma",Book,http://www.amazon.com/dp/0143127748/,55,1
MWF Seeking BFF: My Yearlong Search for a New Best Friend,Book,http://www.amazon.com/dp/0345524942/,2,1
Expecting Better: Why the Conventional Pregnancy Wisdom Is Wrong--and What You Really Need to Know,Book,http://www.amazon.com/dp/0143125702/,79,1
Allies in Healing: When the Person You Love Was Sexually Abused as a Child,Book,http://www.amazon.com/dp/0060968834/,4,1
"Strong Fathers, Strong Daughters: 10 Secrets Every Father Should Know",Book,http://www.amazon.com/dp/0345499395/,2,1
Drowning Girls in China: Female Infanticide in China since 1650,Book,http://www.amazon.com/dp/0742555313/,1,1
"Unmentionable: The Victorian Lady's Guide to Sex, Marriage, and Manners",Book,http://www.amazon.com/dp/031635791X/,3,1
Daughter of Smoke & Bone (Daughter of Smoke and Bone),Book,http://www.amazon.com/dp/031613399X/,1,1
Spark: The Revolutionary New Science of Exercise and the Brain,Book,http://www.amazon.com/dp/0316113514/,44,1
Skippyjon Jones,Book,http://www.amazon.com/dp/0142404039/,3,1
The Courage to Heal Workbook: A Guide for Women and Men Survivors of Child Sexual Abuse,Book,http://www.amazon.com/dp/0060964375/,2,1
"Bearing the Cross: Martin Luther King, Jr., and the Southern Christian Leadership Conference",Book,http://www.amazon.com/dp/0060566922/,2,1
"The Intimacy Factor: The Ground Rules for Overcoming the Obstacles to Truth, Respect, and Lasting Love",Book,http://www.amazon.com/dp/0060095806/,1,1
"Abused Men: The Hidden Side of Domestic Violence, 2nd Edition",Book,http://www.amazon.com/dp/0313356718/,3,1
What's Up Down There?: Questions You'd Only Ask Your Gynecologist If She Was Your Best Friend,Book,http://www.amazon.com/dp/0312644361/,1,1
"Emotional First Aid: Healing Rejection, Guilt, Failure, and Other Everyday Hurts",Book,http://www.amazon.com/dp/0142181072/,2,1
My Mama's Waltz,Book,http://www.amazon.com/dp/0671013866/,1,1
Resurrection After Rape: A guide to transforming from victim to survivor,Book,http://www.amazon.com/dp/0615209661/,1,1
Forbidden Heat,Book,http://www.amazon.com/dp/0312580134/,1,1
The Finishing School: Earning the Navy SEAL Trident,Book,http://www.amazon.com/dp/0609810464/,2,1
How to Win Friends & Influence People,Book,http://www.amazon.com/dp/0671027034/,222,1
Getting Past No: Negotiating in Difficult Situations,Book,http://www.amazon.com/dp/0553755587/,1,1
Shoot the Women First,Book,http://www.amazon.com/dp/0679415963/,1,1
Dick for a Day: What Would You Do If You Had One?,Book,http://www.amazon.com/dp/0679773533/,2,1
Millie's Book,Book,http://www.amazon.com/dp/0688119131/,2,1
Liquid Life: Abortion and Buddhism in Japan,Book,http://www.amazon.com/dp/0691029652/,1,1
New Complete Guide to Gardening (Better Homes & Gardens),Book,http://www.amazon.com/dp/0696214571/,1,1
"Making it big in the city: A woman's guide to living, loving, and working there",Book,http://www.amazon.com/dp/0698112288/,1,1
"Less Than Human: Why We Demean, Enslave and Exterminate Others",Book,http://www.amazon.com/dp/0312532725/,1,1
Salt: A World History,Book,http://www.amazon.com/dp/0142001619/,31,1
