name,category,amazon_link,total_mentions,subreddit_mentions
"Battery Tender Plus 021-0128, 1.25 Amp Battery Charger is a Smart Charger, it will Fully Charge and Maintain a Battery at Proper Storage Voltage without the Damaging Effects Caused by Trickle Chargers",Automotive Parts and Accessories,http://www.amazon.com/dp/B00068XCQU/,14,1
Everydaysource Car Cassette Adapter Converter+Charger Compatible With iPod MP3,Network Media Player,http://www.amazon.com/dp/B008H2GQI8/,1,1
Dorman 603-133 Coolant Reservoir,Automotive Parts and Accessories,http://www.amazon.com/dp/B00HEAHKNE/,1,1
Coodio USB Bluetooth Music Audio Stereo Receiver Fit for Car AUX in Home Mp3 Speaker Iphone.,Wireless,http://www.amazon.com/dp/B00HT07QXI/,7,1
"Techno Earth Premium Low Profile Compact Powerfull Auto Car Charger for Apple, Android, Tablets, Mobile Phones, Ebook-readers, iPod Black",Wireless,http://www.amazon.com/dp/B00RXVVDT6/,1,1
"TaoTronics Bluetooth Receiver / Car Kit, Portable Wireless Audio Adapter 3.5mm Aux Stereo Output (Bluetooth 4.0, A2DP, Built-in Microphone) for Home Audio Music Streaming Sound System",Wireless,http://www.amazon.com/dp/B013QJ0W8Q/,19,1
SiriusLED Extremely Bright 3030 Chipset LED Bulbs for Car Interior Dome Map Door Courtesy License Plate Lights Compact Wedge T10 168 194 2825 Xenon White Pack of 10,Automotive Parts and Accessories,http://www.amazon.com/dp/B0186P1MUW/,1,1
