name,category,amazon_link,total_mentions,subreddit_mentions
"Mastering Copperplate Calligraphy: A Step-by-Step Manual (Lettering, Calligraphy, Typography)",Book,http://www.amazon.com/dp/0486409511/,12,10
"Medieval Calligraphy: Its History and Technique (Lettering, Calligraphy, Typography)",Book,http://www.amazon.com/dp/0486261425/,8,8
"Pilot Parallel Calligraphy Pen Set, 1.5 mm, 2.4 mm, 3.8 mm and 6 mm with Bonus Ink Cartridge (P9005SET)",Office Product,http://www.amazon.com/dp/B004O7FYHY/,15,5
Modern Calligraphy: Everything You Need to Know to Get Started in Script Calligraphy,Book,http://www.amazon.com/dp/1250016320/,5,4
Italic Calligraphy and Handwriting: Exercises and Text,Book,http://www.amazon.com/dp/0800842847/,5,4
Written Letters: 33 Alphabets for Calligraphers,Book,http://www.amazon.com/dp/0800887352/,4,4
"The Art and Craft of Hand Lettering: Techniques, Projects, Inspiration",Book,http://www.amazon.com/dp/0615466966/,3,3
"Manuscript Leonardt Round Hand Set, Number-1",Art and Craft Supply,http://www.amazon.com/dp/B003TWAGJ6/,2,2
The Historical Source Book for Scribes,Book,http://www.amazon.com/dp/1442629258/,2,2
Layout and Design for Calligraphers,Book,http://www.amazon.com/dp/0800845730/,2,2
Manuscript Student Art Set,Art and Craft Supply,http://www.amazon.com/dp/B002BB1ES8/,2,2
Rhodia Classic Orange Notepad 8.3x11.7 Lined,Office Product,http://www.amazon.com/dp/B004ZEJZIU/,5,2
"Canson XL Mix Media Pad,9""X12"" Side Wire",Art and Craft Supply,http://www.amazon.com/dp/B002NQ2K16/,3,2
"Rhodia Black Dot Pad Nº 19, 8.3 x 12.5",Office Product,http://www.amazon.com/dp/B005IAZXUO/,6,2
"Spencerian Copybooks 1-5, Set, without Theory Book (Spencerian Penmanship)",Book,http://www.amazon.com/dp/0880620951/,17,2
"Left-Handed Calligraphy (Lettering, Calligraphy, Typography)",Book,http://www.amazon.com/dp/0486267024/,2,2
The Universal Penman,Book,http://www.amazon.com/dp/1607964082/,3,2
The Speedball Textbook:  A Comprehensive Guide to Pen and Brush Lettering,Book,http://www.amazon.com/dp/096315320X/,2,2
"Armour Etch Cream, 10-Ounce",Art and Craft Supply,http://www.amazon.com/dp/B001BE3UM4/,8,2
Lettering & Calligraphy Workbook,Book,http://www.amazon.com/dp/1402741014/,1,1
Writing & Illuminating & Lettering,Book,http://www.amazon.com/dp/1475299931/,1,1
"The White Cat and the Monk: A Retelling of the Poem ""Pangur Bán""",Book,http://www.amazon.com/dp/1554987806/,1,1
Brush Lettering: An Instructional Manual Of Western Brush Lettering,Book,http://www.amazon.com/dp/1558212698/,1,1
The Art of Calligraphy: A Practical Guide to the Skills and Techniques,Book,http://www.amazon.com/dp/1564588491/,2,1
The Golden Thread: A History of Writing,Book,http://www.amazon.com/dp/1619022427/,1,1
Historical Scripts: From Classical Times to the Renaissance,Book,http://www.amazon.com/dp/1884718566/,1,1
"HP 113100 Premium Choice LaserJet Paper, 98 Brightness, 32lb, 8-1/2x11, White, 500 Shts per Ream",Office Product,http://www.amazon.com/dp/B000099O2W/,31,1
"SHEET .010X6X12"" BRASS by K & S MfrPartNo 16402",Home,http://www.amazon.com/dp/B0006MZOB2/,1,1
Higgins Eternal Black Writing Ink 2 1/2 oz. (black),Office Product,http://www.amazon.com/dp/B00095OFXO/,1,1
Sumi Ink 2 Ounces-Black,Home,http://www.amazon.com/dp/B000AMLR8M/,1,1
"Yasutomo KY2 Sumi Ink, 2 oz, Black",Art and Craft Supply,http://www.amazon.com/dp/B000AMPD5A/,1,1
Pearl Ex Powdered Pigment Color: Pink Gold by Jacquard,Home,http://www.amazon.com/dp/B000AP6OHS/,1,1
Speedball 6-Nib Calligraphy Lettering Set,Art and Craft Supply,http://www.amazon.com/dp/B000BYQLT4/,4,1
Speedball Oblique Pen Point Holder (ANH9455),Art and Craft Supply,http://www.amazon.com/dp/B000BYT4FC/,3,1
"Waterman 1.7 oz Ink Bottle for Fountain Pens, Intense Black (S0110710)",Office Product,http://www.amazon.com/dp/B000J3VKH0/,1,1
Porcelain 6 Well Floral Palette Dish,Art and Craft Supply,http://www.amazon.com/dp/B000KNPNA4/,1,1
Jacquard Products 1 Ounce Arabic Gum,Art and Craft Supply,http://www.amazon.com/dp/B000WWK844/,1,1
Winsor & Newton Calligraphy Ink Collection Set,Art and Craft Supply,http://www.amazon.com/dp/B000YQJVH8/,1,1
"Winsor & Newton Calligraphy Ink Bottle, 30ml, Dark Blue",Art and Craft Supply,http://www.amazon.com/dp/B0012F1YHA/,1,1
GE Battery Operated Push On/Off Round Closet Light 54807,Lighting,http://www.amazon.com/dp/B0018QDJ8K/,1,1
1 X Magic Water Painting Paper,Art and Craft Supply,http://www.amazon.com/dp/B001C0Q9MA/,1,1
Alvin Rolling Parallel Ruler (306),Office Product,http://www.amazon.com/dp/B001DKM8CO/,1,1
Kuretake No. 40 Fountain Hair Brush Pen - Sable Hair,Office Product,http://www.amazon.com/dp/B001DMQIOG/,2,1
Excelsior Mini Lathe,Home Improvement,http://www.amazon.com/dp/B001DT1MR2/,1,1
"Holbein Artists Gouache Set of 12, 5ml tubes",Art and Craft Supply,http://www.amazon.com/dp/B001G7PCMC/,1,1
"Winsor & Newton Calligraphy Ink Bottle, 30ml, Green",Art and Craft Supply,http://www.amazon.com/dp/B001IRUGJY/,1,1
Bienfang 9 x 12 Inches Calligraphic Practice Paper Pad (R400145),Art and Craft Supply,http://www.amazon.com/dp/B001KZH2C8/,1,1
Sakura 57370 10-Piece Gelly Roll Blister Card Assorted Colors Metallic Gel Ink Pen Set,Office Product,http://www.amazon.com/dp/B001LXK5HS/,1,1
Speedball Calligraphy No-5 Artists Project Set,Art and Craft Supply,http://www.amazon.com/dp/B001QWUHF4/,2,1
Dritz Quilting Soapstone Marking Pencil,Art and Craft Supply,http://www.amazon.com/dp/B001UAKKZO/,1,1
"Fons and Porter Mechanical Fabric Pencil, White",Art and Craft Supply,http://www.amazon.com/dp/B001UAKL4Y/,1,1
Leuchtturm1917 Classic Hardcover Master Sketchbook Black,Office Product,http://www.amazon.com/dp/B001VD19K0/,1,1
Fw Acrylic Artists Ink Primary Colors Set/6,Home,http://www.amazon.com/dp/B0023SKXS6/,1,1
"Strathmore 300 Series Bristol Smooth Pad, 9""x12"" Tape Bound, 20 Sheets",Home,http://www.amazon.com/dp/B00254AU8Q/,3,1
Canson Biggie Newsprint Pad - 18 x 24 Inches - 100 Sheet Pad,BISS,http://www.amazon.com/dp/B0025TX394/,3,1
"Bee Paper Calligraphy Practice Pad, 9-Inch by 12-Inch",Art and Craft Supply,http://www.amazon.com/dp/B0027A3CII/,1,1
Matte Finish Spray Eliminates Glossy Sheen And Provides Permanent Surface Protection (Pkg/2),Art and Craft Supply,http://www.amazon.com/dp/B0029JSGM4/,2,1
"Pilot Parallel Pen 2-Color Calligraphy Pen Set with Red and Black Ink Cartridges, 2.4mm Nib (90051)",Office Product,http://www.amazon.com/dp/B002RJLS0S/,4,1
"Liquid Silver Plating System, Silverware Kit, Medallion Brand",Home,http://www.amazon.com/dp/B002SHXJTM/,2,1
"Clairefontaine Classic Wirebound Notebooks 5 4/5 in. x 8 1/4 in. ruled 90 sheets,colors may vary",Office Product,http://www.amazon.com/dp/B002TDK56U/,1,1
"Pilot Parallel Pen Ink Refills for Calligraphy Pens, Turquoise, 6 Cartridges per Pack (77311)",Office Product,http://www.amazon.com/dp/B002UNMZSU/,1,1
Manuscript Deluxe Calligraphy Set,Art and Craft Supply,http://www.amazon.com/dp/B002Z135YK/,2,1
SE 87136DB 30-Piece Plastic Storage Container Set,Home Improvement,http://www.amazon.com/dp/B0036C0RT8/,1,1
"XL Mix Media Pad, 7""X10"" Side Wire",Art and Craft Supply,http://www.amazon.com/dp/B0039UMRMW/,1,1
Wooden Ink Blotter,Office Product,http://www.amazon.com/dp/B003ACR0VM/,1,1
"Pilot Iroshizuku Bottled Fountain Pen Ink, Kon-Peki, Deep Blue, Turquoise Blue (69212)",Office Product,http://www.amazon.com/dp/B003MVKFRW/,7,1
"Canson Artist Series Universal Sketch Pad, 9""X12"" Side Wire",Art and Craft Supply,http://www.amazon.com/dp/B004IXJ7CM/,2,1
"J Herbin 1670 Anniversary Bottled Fountain Pen Ink, 50ml - Red",Office Product,http://www.amazon.com/dp/B004K0LOWO/,1,1
Walnut Ink Crystals 2 Ounces/Jar-,Art and Craft Supply,http://www.amazon.com/dp/B004L6HRZU/,1,1
"Judikins GT026 Micro Glaze, 1-Ounce",Art and Craft Supply,http://www.amazon.com/dp/B004M5B3NM/,1,1
Bohin Extra-Fine Chalk Pencil,Office Product,http://www.amazon.com/dp/B004M5BGD4/,4,1
Zig Memory System Calligraphy Marker,Art and Craft Supply,http://www.amazon.com/dp/B004W8V1BS/,1,1
"Winsor & Newton Art Masking Fluid, 75ml",Office Product,http://www.amazon.com/dp/B005P1ROEY/,7,1
Luxury Brands Noodlers Ahab Fountain Pen Demo (15021),Office Product,http://www.amazon.com/dp/B0065QZKMG/,1,1
"Zebra Comic G Model Chrome Pen Nib, 10 Nibs (1 Pack) (PG-6B-C-K)",Office Product,http://www.amazon.com/dp/B006CQW428/,17,1
"Dr. Ph. Martin's Bleedproof White, 1.0 oz",Art and Craft Supply,http://www.amazon.com/dp/B008CRS1CM/,2,1
"Westcott Engineers' Protractor Ruler, 6"", 15cm, Transparent (W-8)",Office Product,http://www.amazon.com/dp/B0091G6U9Y/,1,1
"Canson XL Series Marker Pad, 9""X12"" Fold Over",Art and Craft Supply,http://www.amazon.com/dp/B00BN9PFRK/,2,1
TWSBI Notebooks Medium (BLANK),Office Product,http://www.amazon.com/dp/B00CWGLRMA/,1,1
"Con-Tact Brand Clear Covering Self-Adhesive Privacy Film and Liner, 18-Inches by 9-Feet, Clear Matte",Home,http://www.amazon.com/dp/B00D8GBO2G/,7,1
"ProTapes Pro Drafting Crepe Paper Industrial Grade Masking Tape, 60 yds Length x 1/2"" Width (Pack of 1)",BISS,http://www.amazon.com/dp/B00DVBPA1E/,1,1
Shinhan Watercolors Artist Paint Tubes Set 30 Colors 7.5ml Each,Art and Craft Supply,http://www.amazon.com/dp/B00E6KGIBK/,1,1
Gaunt Industries HYPO-200 - Oiler Boiler- Watercolor & Thin Acrylic Paint Applicator- 1-1/4 Ounce Clear Oval Plastic Bottle with 25 Gauge Blunt Needle- Precision Paint Dispenser- Use with Thin Liquids,Art and Craft Supply,http://www.amazon.com/dp/B00EXP082S/,2,1
Huion L4S LED Light Box for Tracing,Art and Craft Supply,http://www.amazon.com/dp/B00J3NRAV2/,7,1
"US Art Supply Premium Calligraphic Practice Paper Pad, Calligraphy Paper With Printed Practice Rule And Slanted Grid, 19 lbs. Bond (70 gsm), Pad Of 50-Sheets, 2 Pads",Office Product,http://www.amazon.com/dp/B00PGBVNM2/,1,1
Pilot Fountain Pen Converter (CON-50) Set of 3,Office Product,http://www.amazon.com/dp/B00WE6658O/,1,1
J.Herbin 1670 Anniversary Fountain Pen Ink - Emerald of Chivor,Home,http://www.amazon.com/dp/B0124DT9L6/,5,1
Old Forge Whittlin Fun 3pc Woodcarving Kit with Carry Case,Art and Craft Supply,http://www.amazon.com/dp/B019OXK59E/,1,1
The Italic Way to Beautiful Handwriting: Cursive and Calligraphic,Book,http://www.amazon.com/dp/002079990X/,1,1
Ecoline Liquid Watercolor Brush Pen Set Of 10,CE,http://www.amazon.com/dp/B01GD0OPUQ/,1,1
Tales from Ovid: 24 Passages from the Metamorphoses,Book,http://www.amazon.com/dp/0374525870/,1,1
Celtic Art: The Methods of Construction (Dover Art Instruction),Book,http://www.amazon.com/dp/0486229238/,3,1
"The Technique of Copperplate Calligraphy: A Manual and Model Book of the Pointed Pen Method (Lettering, Calligraphy, Typography)",Book,http://www.amazon.com/dp/0486255123/,1,1
Latin Bookhands of the Later Middle Ages 1100-1500,Book,http://www.amazon.com/dp/0521086744/,1,1
Book of Scripts,Book,http://www.amazon.com/dp/0571110800/,1,1
An Usborne Guide Calligraphy: From Beginner to Expert (Usborne Practical Guides),Book,http://www.amazon.com/dp/0746004265/,1,1
Learn Calligraphy: The Complete Book of Lettering and Design,Book,http://www.amazon.com/dp/0767907329/,1,1
Written letters: 29 alphabets for calligraphers,Book,http://www.amazon.com/dp/0800887344/,1,1
A Guide to Western Historical Scripts from Antiquity to 1600,Book,http://www.amazon.com/dp/0802072062/,2,1
Using Calligraphy: Layout & Design Ideas,Book,http://www.amazon.com/dp/0806984287/,1,1
