name,category,amazon_link,total_mentions,subreddit_mentions
Nail Tek Citra 2 for Soft Peeling Nails,Beauty & Personal Care,https://www.amazon.com/Nail-Tek-Citra-Peeling-Nails/dp/B007KSW990,1,1
STR-0451 Stainless Steel Rainbow Spinner Surgical Steel Ring,"Clothing, Shoes & Jewelry",https://www.amazon.com/dp/B014HLBULK/ref=cm_sw_r_cp_apa_GhwyybMAT18HX],1,1
Burt's Bees Lemon Butter Cuticle Cream,Beauty & Personal Care,https://www.amazon.com/Burts-Bees-Lemon-Butter-Cuticle/dp/B00013YYS0,1,1
"Men's Stainless Steel Spinner Ring, Size 8","Clothing, Shoes & Jewelry",https://www.amazon.com/Mens-Stainless-Steel-Spinner-Ring/dp/B00TQLVA5I,1,1
"OPI Nail Envy Nail Strengthener, 0.5 fl. oz.",Beauty & Personal Care,https://www.amazon.com/OPI-Nail-Matte-0-5-Fluid-Ounce/dp/B001ARQWW2/ref=sr_1_1_a_it?ie=UTF8&amp;qid=1458834937&amp;sr=8-1&amp;keywords=opi+matte+nail+envy,1,1
"Raindrop - Rainforest - Chew Necklace for Sensory, Oral Motor, Anxiety, Autism, ADHD","Health, Household & Baby Care",https://www.amazon.com/Raindrop-Rainforest-Necklace-Sensory-Anxiety/dp/B00IIEK68Q/ref=sr_1_6?ie=UTF8&amp;qid=1447741962&amp;sr=8-6&amp;keywords=chewy+necklace&amp;pebp=1447741971172&amp;perid=0PRM0AWNRSCJGTHJHRPC,1,1
