name,category,amazon_link,total_mentions,subreddit_mentions
Sawyer Products PointOne Squeeze Water Filter System,Sports & Outdoors,https://www.amazon.com/Sawyer-Products-SP131-PointOne-Squeeze/dp/B005EHPVQW/,5,3
Etekcity Ultralight Portable Outdoor Backpacking Camping Stoves with Piezo Ignition (Orange),Sports & Outdoors,https://www.amazon.com/Etekcity-Ultralight-Portable-Backpacking-Compatible/dp/B00B4FY8YO/ref=sr_1_14?ie=UTF8&amp;qid=1433874680&amp;sr=8-14&amp;keywords=gas+stove,13,2
RioRand Portable Cookware Backpacking Bowl Pot Pan Cooking Kit,Sports & Outdoors,https://www.amazon.com/gp/product/B00FQZEYWE?psc=1&amp;redirect=true&amp;ref_=oh_aui_detailpage_o03_s00,4,2
Ultralight Backpacking Canister Camp Stove with Piezo Ignition 3.9oz,Sports & Outdoors,https://www.amazon.com/Ultralight-Backpacking-Canister-Ignition-silvery/dp/B00ENDRORM/ref=sr_1_1?ie=UTF8&amp;qid=1426178922&amp;sr=8-1&amp;keywords=backpacking+stove,4,2
Klymit Insulated Static V Sleeping Pad,Sports & Outdoors,https://www.amazon.com/Klymit-Insulated-Static-Sleeping-Orange/dp/B00ANRW7DI/ref=lp_6764188011_1_3?srs=6764188011&amp;ie=UTF8&amp;qid=1498060079&amp;sr=8-3,3,2
"Anker PowerCore 10000, One of the Smallest and Lightest 10000mAh External Batteries, Ultra-Compact, High-speed Charging Technology Power Bank for iPhone, Samsung Galaxy and More",Cell Phones & Accessories,https://www.amazon.com/gp/product/B0194WDVHI/ref=oh_aui_detailpage_o02_s00?ie=UTF8&amp;psc=1,14,1
"Morakniv Companion Fixed Blade Outdoor Knife with Carbon Steel Blade, Military Green, 4.1-Inch",Sports & Outdoors,https://www.amazon.com/gp/product/B004TNWD40?psc=1&amp;redirect=true&amp;ref_=oh_aui_detailpage_o00_s00,14,1
Sawyer Products Mini Water Filtration System,Sports & Outdoors,https://www.amazon.com/Sawyer-Products-SP103-Filtration-System/dp/B00MPH1LEU/ref=sr_1_1?ie=UTF8&amp;qid=1428804904&amp;sr=8-1&amp;keywords=sawyer+mini,10,1
Sawyer Products Mini Water Filtration System,Sports & Outdoors,https://www.amazon.com/Sawyer-Products-SP128-Filtration-System/dp/B00FA2RLX2,7,1
"Anker 21W Dual USB Solar Charger, PowerPort Solar for iPhone 7 / 6s / Plus, iPad Pro / Air 2 / mini, Galaxy S7 / S6 / Edge / Plus, Note 5 / 4, LG, Nexus, HTC and More",Cell Phones & Accessories,https://www.amazon.com/Anker-Charger-PowerPort-iPhone-Galaxy/dp/B012YUJJM8/ref=sr_1_1?ie=UTF8&amp;qid=1499051318&amp;sr=8-1&amp;keywords=anker+solar+21,6,1
"Leatherman 830039 Wave Multitool with Leather/Nylon Combination Sheath, Silver",Tools & Home Improvement,https://www.amazon.com/Leatherman-830039-Multitool-Leather-Combination/dp/B0002H49BC,5,1
Vapur Eclipse Water Bottle,Sports & Outdoors,https://www.amazon.com/Vapur-Eclipse-Water-Bottle-1-Liter/dp/B00BI9AM3C/ref=sr_1_2?ie=UTF8&amp;qid=1460927648&amp;sr=8-2&amp;keywords=vapur+water+bottle,5,1
HotHands Hand Warmers,Sports & Outdoors,https://www.amazon.com/HotHands-Hand-Warmers-40-pairs/dp/B0007ZF4OA/ref=sr_1_3?s=outdoor-recreation&amp;ie=UTF8&amp;qid=1474005940&amp;sr=1-3&amp;keywords=hand,4,1
RoyalMeerschaumPipes VKTHI-G Regular Vector Thunderbird Lighter Insert,All Departments,https://www.amazon.com/Thunderbird-Vector-Lighter-Insert-Regular/dp/B009Z2GB16/ref=pd_sim_121_3?ie=UTF8&amp;dpID=31pq1fa90ML&amp;dpSrc=sims&amp;preST=_AC_UL160_SR118,4,1
AEGISMAX Outdoor Urltra-Light Goose Down Sleeping Bag Three-Season Down Sleeping Bag Mummy Down Sleeping Bag Green L200cmW86cm,Sports & Outdoors,https://www.amazon.com/AEGISMAX-Outdoor-Urltra-Light-sleeping-Urltra-compactable/dp/B00XE2SKG2/,3,1
Sundome 3 Person Tent (Green and Navy color options),Sports & Outdoors,https://www.amazon.com/gp/product/B004J2KDHK/ref=oh_aui_search_detailpage?ie=UTF8&amp;psc=1,3,1
"ARCTIC Breeze Mobile - Mini USB Desktop Fan with Flexible Neck and Adjustable Fan Speed I Portable Desk Fan for Home, Office I Silent USB Fan I Fan Speed 1700 RPM - White",Electronics,https://www.amazon.com/ARCTIC-USB-Powered-Portable-Solution-Gooseneck/dp/B003XN24GY/ref=zg_bs_3015416011_5,3,1
"Etekcity 2 Pack Portable Outdoor LED Camping Lantern Flashlights with 6 AA Batteries - Survival Kit for Emergency, Hurricane, Storm, Outage (Black, Collapsible)",Sports & Outdoors,https://www.amazon.com/Etekcity-Portable-Outdoor-Batteries-Collapsible/dp/B00XM8HTIS,3,1
Therm-a-Rest RidgeRest Classic,Sports & Outdoors,https://www.amazon.com/Therm-A-Rest-6432-Therm-a-Rest-RidgeRest-Classic/dp/B00HANOY9I/ref=sr_1_1?ie=UTF8&amp;qid=1492572762&amp;sr=81&amp;keywords=closed,2,1
Eureka! Solitaire Tent,Sports & Outdoors,https://www.amazon.com/Eureka-Solitaire-Tent-sleeps-1/dp/B000EQCVNY/ref=sr_1_1?ie=UTF8&amp;qid=1492573017&amp;sr=8-1&amp;keywords=eureka+tent,2,1
Cascade Mountain Tech 100% Carbon Fiber Twist Lock Trekking Poles,Sports & Outdoors,https://www.amazon.com/Cascade-Mountain-Tech-Twist-Lock/dp/B007E0ZBZI/ref=sr_1_2?ie=UTF8&amp;qid=1489680127&amp;sr=8-2-spons&amp;keywords=cascade+mountain+trekking+poles&amp;psc=1,2,1
BRS Outdoor Camping Gas Cooking Stove Portable Ultralight Burner 25g,Sports & Outdoors,https://www.amazon.com/BRS-Ultralight-Camping-Outdoor-Cooking/dp/B00NNMF70U?sa-no-redirect=1,2,1
"Coleman Water Carrier, 5-Gallon",Sports & Outdoors,https://www.amazon.com/Coleman-5-Gallon-Collapsible-Water-Carrier/dp/B000088O9Y,2,1
Coleman Montana 8-Person Tent,Sports & Outdoors,https://www.amazon.com/Coleman-2000001594-Parent-Montana-8-Person-Tent/dp/B00W05C8HQ,2,1
Sawyer Products PointOne Squeeze Water Filter System,Sports & Outdoors,https://www.amazon.com/Sawyer-Products-SP129-Filtration-Squeezable/dp/B00B1OSU4W/ref=redir_mobile_desktop?_encoding=UTF8&amp%3Bkeywords=sawyer&amp%3Bpi=AC_SX236_SY340_QL65&amp%3Bqid=1484029191&amp%3Bsr=8-1&ref_=mp_s_a_1_1,2,1
"Husqvarna 576926501 19"" Wooden Carpenter's Axe","Patio, Lawn & Garden",https://www.amazon.com/gp/product/B004SN1HGQ,2,1
Coghlans 8770 Folding Pack Grill,Sports & Outdoors,https://www.amazon.com/gp/product/B001OPHA0S?psc=1&amp;redirect=true&amp;ref_=oh_aui_detailpage_o00_s00,2,1
Coleman 10-In. Enamel Plate,Sports & Outdoors,https://www.amazon.com/gp/product/B0009PUSPI?psc=1&amp;redirect=true&amp;ref_=oh_aui_detailpage_o00_s00,2,1
"Pack of 4 Flashlights, BYBLIGHT 150 Lumen Ultra Bright LED Flashlight, Zoomable Tactical Flashlight with 3 Modes for Indoors and Outdoors (Camping, Cycling, Emergency, and Gift-Giving)",Tools & Home Improvement,https://www.amazon.com/gp/product/B00V639BNC?psc=1&amp;redirect=true&amp;ref_=oh_aui_detailpage_o01_s01,2,1
Sawyer Products Mini Water Filtration System,Sports & Outdoors,https://www.amazon.com/gp/product/B00TOX6UM6?psc=1&amp;redirect=true&amp;ref_=oh_aui_detailpage_o00_s00,2,1
ALPS Mountaineering Lynx 1-Person Tent,Sports & Outdoors,https://www.amazon.com/gp/product/B00BMKD1DU?psc=1&amp;redirect=true&amp;ref_=oh_aui_search_detailpage,2,1
Victorinox Swiss Army Cadet Knife,Sports & Outdoors,https://www.amazon.com/Victorinox-53044-Cadet-Black-Swiss/dp/B000WEG8PA/ref=sr_1_1?ie=UTF8&amp;qid=1466121296&amp;sr=8-1&amp;keywords=victorinox+cadet,2,1
Naturehike 2 Person Outdoor Tent Double-layer Tent Waterproof Camping Tent Lightweight Tent,Sports & Outdoors,https://www.amazon.com/Naturehike-Double-layer-Waterproof-Lightweight-Silicone/dp/B00W32LFZW/191-5235683-8984267?ie=UTF8&amp;*Version*=1&amp;*entries*=0,2,1
BRS Ultralight Camping Gas Stove Outdoor Gas Burner Cooking Stove Portable Folding Titanium Atove 25g,Sports & Outdoors,https://www.amazon.com/Ultralight-Camping-Outdoor-Portable-Titanium/dp/B01077AGC2/ref=sr_1_1?ie=UTF8&amp;qid=1460557453&amp;sr=8-1&amp;keywords=brs+stove,2,1
MSR PocketRocket Stove,Sports & Outdoors,https://www.amazon.com/MSR-11792-PocketRocket-Stove/dp/B000A8C5QE,2,1
Therm-a-Rest Z Lite Sol Mattress,Sports & Outdoors,https://www.amazon.com/Therm-a-Rest-Z-Lite-Mattress-Regular/dp/B00453NA1E,2,1
"Morakniv Companion Heavy Duty Knife with Carbon Steel Blade, 0.125/4.1-Inch",Sports & Outdoors,https://www.amazon.com/Morakniv-Companion-Heavy-Carbon-4-1-Inch/dp/B00EF2RX2C,1,1
"Outdoor Speakers Portable Bluetooth Bicycle Speaker Zealot S1 4000mAh Power Bank Waterproof Speakers with Full Outdoor Accessories(Bike Mount, Carabiner...)(Gray)",Electronics,https://www.amazon.com/Speakers-Bluetooth-Waterproof-Accessories-Carabiner/dp/B0187ADGL4/ref=sr_1_6?ie=UTF8&amp;qid=1499051651&amp;sr=8-6&amp;keywords=waterproof+bluetooth+power+bank,1,1
Fire-Maple Star FMS-X2 Outdoor Cooking System Portable Camp Stove with Piezo Ignition POT Support & Stand - Ultralight Compact Windproof High Heating Efficiency - Propane & Butane Canisters - Camping,Sports & Outdoors,https://www.amazon.com/Fire-Maple-Outdoor-Cooking-Portable-Ignition/dp/B013PRD4IE?sa-no-redirect=1,1,1
Darn Tough Vermont Men's 1/4 Merino Wool Cushion Hiking Socks,Sports & Outdoors,https://www.amazon.com/Darn-Tough-Vermont-Merino-Cushion/dp/B00F0NCMQM,1,1
Snow Peak Titanium Mini Flame Lantern,Sports & Outdoors,https://www.amazon.com/Snow-Peak-Flame-Nocturne-Lantern/dp/B01J4KACZO/ref=redir_mobile_desktop?_encoding=UTF8&%2AVersion%2A=1&%2Aentries%2A=0,1,1
Zippo Outdoor Utility Lighter,Sports & Outdoors,https://www.amazon.com/Zippo-121399-Outdoor-Utility-Lighter/dp/B002U0N2E4/ref=sr_1_10?ie=UTF8&amp;qid=1500092100&amp;sr=8-10&amp;keywords=zippo+butane+lighter,1,1
"MPOWERD Luci Solar Chargeable Lantern,One Size,Clear by MPOWERD","Patio, Lawn & Garden",https://www.amazon.com/MPOWERD-Solar-Chargeable-Lantern-Clear/dp/B0149KAOK2,1,1
TOAKS LIGHT Titanium 550ml Pot (Ultralight Version),Sports & Outdoors,https://www.amazon.com/TOAKS-LIGHT-Titanium-550ml-Pot/dp/B00CYA26BU?sa-no-redirect=1,1,1
Coleman Perfect Flow Grill Stove,Sports & Outdoors,https://www.amazon.com/Coleman-Camp-Propane-Grill-Stove/dp/B000W4VD8C,1,1
Katadyn Hiker Microfilter,Sports & Outdoors,https://www.amazon.com/Katadyn-Hiker-Microfilter/dp/B009T7IYIA,1,1
Car Jump Starter RAVPower 1000A Peak Current Quick Charge 3.0 12V (for All 12V Gas & Diesel Engines up to 7L) Power Bank with 2.4A iSmart Ports Built-in LED Flashlight Car Battery Booster,Automotive Parts & Accessories,https://www.amazon.com/Starter-RAVPower-Current-14000mAh-Flashlight/dp/B06W2LRQNR,1,1
GSI Outdoors Java Press Coffee Maker,Sports & Outdoors,https://www.amazon.com/GSI-Outdoors-Javapress-French-Coffee/dp/B001LF3I48,1,1
Osprey Adult Airporter LZ Backpack Travel Cover,Sports & Outdoors,https://www.amazon.com/gp/product/B0178BCSIA/,1,1
"Trekology Ultralight Inflating Travel / Camping Pillows - Compressible, Compact, Inflatable, Comfortable, Ergonomic Pillow for Neck & Lumbar Support and a Good Night Sleep while Camp, Backpacking",Sports & Outdoors,https://www.amazon.com/Trekology-Ultralight-Inflating-Camping-Pillows/dp/B01LW5LYEN/ref=redir_mobile_desktop?_encoding=UTF8&amp%3Bpf_rd_i=3401681&amp%3Bpf_rd_p=23b12081-ff1f-5c69-b27b-2635ef11bab7&amp%3Bpf_rd_r=5Q7F3C4469CFXGYW4JJB&amp%3Bpf_rd_s=mobile-hybrid-3&amp%3Bpf_rd_t=30901&ref_=mh_s9_acsd_top_bEGvp_c_x_3_w,1,1
SPACE SAVER MUG HARD ANODIZED,Sports & Outdoors,https://www.amazon.com/gp/product/B007S3N5PE?psc=1&amp;redirect=true&amp;ref_=oh_aui_detailpage_o01_s02,1,1
CamelBak 2016 Hydrobak Hydration Pack,Sports & Outdoors,https://www.amazon.com/Camelbak-Products-HydroBak-Hydration-Graphite/dp/B00EPGSIAE/ref=sr_1_3,1,1
Coleman Classic Propane Stove,Sports & Outdoors,https://www.amazon.com/Coleman-2000020943NP-Classic-Propane-Stove/dp/B00005OU9D,1,1
Coghlan's Zipper Pull Thermometer,Cell Phones & Accessories,https://www.amazon.com/Coghlans-9712-Zipper-Pull-Thermometer/dp/B000ECQ9KY/ref=sr_1_1?ie=UTF8&amp;qid=1500759812&amp;sr=8-1,1,1
Kestrel 2000 Pocket Wind Meter,Sports & Outdoors,https://www.amazon.com/Kestrel-Pocket-Temperature-Digital-Anemometer/dp/B001JEPJZM/ref=sr_1_1?ie=UTF8&amp;qid=1500759875&amp;sr=8-1,1,1
Sterilite White 12Qt Dishpan,Home & Kitchen,https://www.amazon.com/STERILITE-06578012-Sterilite-White-Dishpan/dp/B0039V2G5E,1,1
Coleman Xtreme Cooler,Sports & Outdoors,https://www.amazon.com/Coleman-70-Quart-Xtreme-Cooler/dp/B00AU6G81Y,1,1
Coleman Northstar Propane Lantern with Case,Sports & Outdoors,https://www.amazon.com/Coleman-Northstar-Propane-Lantern-Case/dp/B00HUG7OZQ,1,1
Baby Back Pack Cross Country Carrier Stand Child Kid Sun Shade Visor Green,Baby,https://www.amazon.com/Cross-Country-Carrier-Stand-Child/dp/B00LH7MVM0/ref=sr_1_3?s=baby-products&amp;ie=UTF8&amp;qid=1428027437&amp;sr=1-3&amp;keywords=baby+backpack,1,1
Energizer Vision HD LED Headlamp (Batteries Included),Sports & Outdoors,https://www.amazon.com/dp/B00TI8GSHY,1,1
Tubism Resealing Zip Lock Tubes 1.7 Fl Oz 3-pack,Baby,https://www.amazon.com/dp/B00UAZ0FB4/,1,1
Black Diamond Spot Headlamp,Sports & Outdoors,https://www.amazon.com/dp/B011K7JCXC/ref=twister_B0049Y0YTU,1,1
"ODOLAND Windproof Camping Stove - Backpacking Gear, Collapsible Portable Outdoor Camping Gear, Propane Gas Burner with Electronic Ignition for Camping, Hiking, Hunting Outdoor Activities",Sports & Outdoors,https://www.amazon.com/gp/product/B01D8IB2MA,1,1
Arc'teryx Atom LT Hoody - Men's,Sports & Outdoors,https://www.amazon.com/Arcteryx-Atom-LT-Hoody-Mens/dp/B002K0MQWI,1,1
Columbia Men's Silver Ridge Convertible Pant,Sports & Outdoors,https://www.amazon.com/Columbia-Mens-Silver-Ridge-Convertible/dp/B00AHLXHC0,1,1
Kelty Cosmic 20 Degree Sleeping Bag,Sports & Outdoors,https://www.amazon.com/Kelty-Cosmic-Degree-Sleeping-Bag/dp/B014JQA9VU?th=1,1,1
Platypus Big Zip LP Reservoir,Sports & Outdoors,https://www.amazon.com/Platypus-Big-Zip-Reservoir-3-Liter/dp/B00F5IADN6/ref=sr_1_1?ie=UTF8&amp;qid=1437172935&amp;sr=8-1&amp;keywords=platypus+bladder&amp;pebp=1437172953554&amp;perid=1YC8HAVB31C1PYK9NK2W,1,1
ALPS Mountaineering Meramac 2 Tent,Sports & Outdoors,https://www.amazon.com/dp/B004QCMAOC/ref=cm_sw_r_cp_api_thXuxbKNJSWEY,1,1
BRS Ultralight Camping Gas Stove Outdoor Gas Burner Cooking Stove Portable Folding Titanium Atove 25g,Sports & Outdoors,https://www.amazon.com/BRS-Ultralight-Camping-Portable-Titanium/dp/B01AKF4USW/ref=redir_mobile_desktop?_encoding=UTF8&amp%3BdpID=51G5cBrltwL&amp%3BdpPl=1&amp%3Bkeywords=brs%203000&amp%3Bpi=AC_SX236_SY340_QL65&amp%3Bqid=1484030308&amp%3Bref=plSrch&amp%3Bsr=8-3&ref_=mp_s_a_1_3,1,1
"Suunto Core Wrist-Top Computer Watch with Altimeter, Barometer, Compass, and Depth Measurement","Clothing, Shoes & Jewelry",https://www.amazon.com/Suunto-Wrist-Top-Altimeter-Barometer-Measurement/dp/B004PBZI16,1,1
TETON Sports Explorer 4000 Internal Frame Backpack; Great Backpacking Gear; Backpack for Men and Women; Hiking Backpacks for Camping and Hunting; with a New Limited Edition Color; Free Rain Cover Included,Sports & Outdoors,https://www.amazon.com/TETON-Sports-Explorer-Internal-Backpack/dp/B001947FG8/ref=sr_1_1?ie=UTF8&amp;qid=1428466414&amp;sr=8-1&amp;keywords=teton+explorer+4000,1,1
Coleman Evanston Screened Tent,Sports & Outdoors,https://www.amazon.com/Coleman-Evanston-Screened-Green-6-Person/dp/B004E4AW1K/ref=redir_mobile_desktop?_encoding=UTF8&amp%3BdpID=31zIFun6x0L&amp%3BdpPl=1&amp%3Bkeywords=coleman%20tent%20porch&amp%3Bpi=SX200_QL40&amp%3Bqid=1472898192&amp%3Bref=plSrch&amp%3Bsr=8-1&ref_=mp_s_a_1_1,1,1
Ledmark Aluminum Alcohol Cookset,Sports & Outdoors,https://www.amazon.com/Ledmark-Aluminum-Alcohol-Cookset/dp/B001W2AOJC/ref=sr_1_176?ie=UTF8&amp;qid=1433875350&amp;sr=8-176&amp;keywords=alcohol+stove,1,1
Inkbird High Accuracy Digital Thermometer & Humidity Meter Hygrometer,Home & Kitchen,https://www.amazon.com/gp/product/B0140UC9XQ/ref=oh_aui_detailpage_o01_s00?ie=UTF8&amp;psc=1,1,1
Lansky Puck - Dual Grit Multi-Purpose Sharpener - Blade & Tool Sharpener,Sports & Outdoors,https://www.amazon.com/gp/product/B000B8FW0Y?psc=1&amp;redirect=true&amp;ref_=oh_aui_detailpage_o02_s00,1,1
UDAP 12HP Bear Spray,Sports & Outdoors,https://www.amazon.com/Udap-12HP-UDAP-Bear-Spray/dp/B001QGYH7Y,1,1
Laken - Spanish Leather Wine Bota Water Canteen,Sports & Outdoors,https://www.amazon.com/gp/product/B00CN4RN42?psc=1&amp;redirect=true&amp;ref_=oh_aui_detailpage_o02_s00,1,1
Ape Case ACLC12 Zippered Adjustable or Attachable Large Case for Lenses (Black/Yellow),Electronics,https://www.amazon.com/Ape-Case-ACLC12-Adjustable-Attachable/dp/B009GA6CH0/ref=sr_1_27?ie=UTF8&amp;qid=1490981043&amp;sr=8-27&amp;keywords=lens+case,1,1
"OSiS+ MESS UP Matte Gum, 3.38-Ounce",Beauty & Personal Care,https://www.amazon.com/OSiS-MESS-Matte-Gum-3-38-Ounce/dp/B003H7FOEU?th=1,1,1
Carhartt Men's Midweight Cotton Union Suit,"Clothing, Shoes & Jewelry",https://www.amazon.com/Carhartt-Midweight-Cotton-XX-Large-Regular/dp/B000VQWIM6/ref=sr_1_6?ie=UTF8&amp;qid=1474005462&amp;sr=8-6&amp;keywords=wool+union+suit,1,1
Sundome 4 Person Tent (Green and Navy color options),Sports & Outdoors,https://www.amazon.com/dp/B019N9W7WC/ref=twister_B01D9EQ804?_encoding=UTF8&amp;psc=1,1,1
Source Tactical Universal Tube Adapter for Hydration Systems,Sports & Outdoors,https://www.amazon.com/Source-Tactical-Universal-Adapter-Hydration/dp/B008S9EH04/ref=pd_sim_468_3?_encoding=UTF8&amp;pd_rd_i=B008S9EH04&amp;pd_rd_r=F5P2PYX259898G78PGQ8&amp;pd_rd_w=qjplc&amp;pd_rd_wg=hTnh5&amp;refRID=F5P2PYX259898G78PGQ8,1,1
Stalwart 75-MOV1001 72 x 80 inch Non-Woven Padded Moving Blanket,Tools & Home Improvement,https://www.amazon.com/Stalwart-75-MOV1001-Non-Woven-Padded-Blanket/dp/B01MTVGT4K/ref=sr_1_5?s=hi&amp;ie=UTF8&amp;qid=1493605011&amp;sr=1-5&amp;keywords=moving+blanket,1,1
TNH Outdoors 10X Aluminum Tri-Beam Tent Stakes and Bag - Made for Camping - Support A Start Up,Sports & Outdoors,https://www.amazon.com/Aluminum-Lightweight-Reflective-Superior-Lifetime/dp/B01D2VHN5I/ref=sr_1_6?s=outdoor-recreation&amp;ie=UTF8&amp;qid=1463502203&amp;sr=1-6&amp;keywords=tent+stakes,1,1
The Tick Key,Pet Supplies,https://www.amazon.com/Tick-Key-Products-TickKey-Remover/dp/B000R1D3KQ,1,1
Coleman 50 Quart Xtreme 5 Wheeled Cooler,Sports & Outdoors,https://www.amazon.com/dp/B00AU6G4QS/ref=cm_sw_r_cp_api_O7bezb8JSEVC5,1,1
"BLACK+DECKER PPRH5B Portable Power Station: 900 Peak/450 Instant Amps, 500W Inverter, 120 PSI Air Compressor",Automotive Parts & Accessories,https://www.amazon.com/dp/B00BR1TO80/ref=cm_sw_r_cp_api_hb7RxbFFF7HE3,1,1
Therm-a-Rest RidgeRest Classic,Sports & Outdoors,https://www.amazon.com/Therm-A-Rest-6433-Parent-RidgeRest-Classic-Mattress/dp/B00HZ13OYG,1,1
Survivor Filter Collapsible Canteens (33oz) 2 Pack (2L Total) - with Extra Durable Carabiners and Handles. Squeeze Water through your Survivor Filter or Use as Water Bottles. Light and BPA Free.,Sports & Outdoors,https://www.amazon.com/gp/product/B010OLZ3E2?psc=1&amp;redirect=true&amp;ref_=oh_aui_detailpage_o05_s00,1,1
"[Solar Rechargeable LED Collapsible camping Lantern] Outlite 300 Lumen Portable camping light ( Water resistant Outdoor Survival lighting Lamp ) with 2 ""S"" Hook for Hiking Emergency Hurricane Outages",Sports & Outdoors,https://www.amazon.com/gp/product/B01178FLM0?psc=1&amp;redirect=true&amp;ref_=oh_aui_detailpage_o01_s00,1,1
ALPS Mountaineering Lightweight Self Inflating Sleeping Pad - Double,Sports & Outdoors,https://www.amazon.com/Alps-Mountaineering-Lightweight-Inflating-Sleeping/dp/B00J540U02,1,1
ALPS Mountaineering Taurus 4 Person Tent,Sports & Outdoors,https://www.amazon.com/ALPS-Mountaineering-Taurus-Person-Tent/dp/B00AU6JUXM/ref=sr_1_2?s=sporting-goods&amp;ie=UTF8&amp;qid=1495025200&amp;sr=1-2&amp;keywords=alps+four+person+tent,1,1
Victorinox Swiss Army Classic SD Pocket Knife,Sports & Outdoors,https://www.amazon.com/Victorinox-Swiss-Classic-Pocket-Knife/dp/B000FNFXDG,1,1
Ontario Knives Sawback Machete,Sports & Outdoors,https://www.amazon.com/Moteng-6120-Ontario-Sawback-Machete/dp/B0001WBIFI,1,1
TETON Sports Scout 3400 Internal Frame Backpack; Great Backpacking Gear or Pack for Camping or Hiking; Hunter Green,Sports & Outdoors,https://www.amazon.com/Sports-Internal-Backpack-Backpacking-Camping/dp/B000F34ZKS/ref=redir_mobile_desktop?_encoding=UTF8&amp%3BdpID=41nfKnKHUoL&amp%3BdpPl=1&amp%3Bkeywords=teton%20backpack%20mens&amp%3Bpi=AC_SX236_SY340_QL65&amp%3Bqid=1503897494&amp%3Bref=plSrch&amp%3Bsr=8-2&ref_=mp_s_a_1_2,1,1
"Coleman 5319-700 MicroPacker LED Mini Lantern, Yellow",Sports & Outdoors,https://www.amazon.com/Coleman-5319-700-MicroPacker-Lantern-Yellow/dp/B000EH0NLK,1,1
Kelty Cosmic 20 Degree Sleeping Bag,Sports & Outdoors,https://www.amazon.com/Kelty-Sleeping-Regular-Paradise-Twilight/dp/B014JQA4WE,1,1
Snow Peak Trek 700,Sports & Outdoors,https://www.amazon.com/Snow-Peak-Trek-Titanium-Cookset/dp/B000AR2N7Q/,1,1
Coleman 54-Quart Steel-Belted Cooler,Sports & Outdoors,https://www.amazon.com/Coleman-54-Quart-Steel-Belted-Cooler-Green/dp/B0009PURKO,1,1
Victorinox Swiss Army Compact Pocket Knife,Sports & Outdoors,https://www.amazon.com/Victorinox-Swiss-Compact-Pocket-Knife/dp/B0007QCOMY/ref=sr_1_1?ie=UTF8&amp;qid=1466121429&amp;sr=8-1&amp;keywords=victorinox+compact,1,1
Mountaintop 65L Internal Frame Backpack Hiking Backpack with Rain Cover-5822III,Sports & Outdoors,https://www.amazon.com/Mountaintop-Outdoor-Backpack-Camping-Internal/dp/B01B76LPUE/ref=redir_mobile_desktop?_encoding=UTF8&amp%3BdpID=41u9q4XOqWL&amp%3BdpPl=1&amp%3Bkeywords=mountaintop%20backpacks&amp%3Bpi=AC_SX236_SY340_QL65&amp%3Bqid=1503897591&amp%3Bref=plSrch&amp%3Bsr=8-1&ref_=mp_s_a_1_1,1,1
Mountaintop 40 Liter Hiking Backpack with Rain Cover for Outdoor Camping,Sports & Outdoors,https://www.amazon.com/Mountaintop-Hiking-Backpack-Outdoor-Camping/dp/B072PYF2S4/ref=redir_mobile_desktop?_encoding=UTF8&amp%3Bkeywords=mountaintop&amp%3Bpi=AC_SX236_SY340_QL65&amp%3Bqid=1503896441&amp%3Bsr=8-4&ref_=mp_s_a_1_4,1,1
Coleman Soft Plush Top Inflated Quickbed,Sports & Outdoors,https://www.amazon.com/dp/B006JH1M9G,1,1
SE BG107 Portable Folding Barbecue Grill,Tools & Home Improvement,https://www.amazon.com/SE-BG107-Portable-Folding-Barbecue/dp/B008187KA6,1,1
Darn Tough Vermont Men's 1/4 Merino Wool Cushion Hiking Socks,Sports & Outdoors,https://www.amazon.com/Darn-Tough-Vermont-Merino-Cushion/dp/B008RSF5RK/,1,1
Therm-a-Rest ProLite Plus Mattress,Sports & Outdoors,https://www.amazon.com/Therm-a-Rest-ProLite-Plus-Sleeping-Pad/dp/B005I6UN62,1,1
Camp Chef Everest High Output 2 Burner Stove,Sports & Outdoors,https://www.amazon.com/Camp-Chef-Everest-Output-Burner/dp/B00A0M2O16,1,1
YETI Roadie 20 Cooler,Sports & Outdoors,https://www.amazon.com/Yeti-Roadie-20-Cooler-White/dp/B004YIBWNS,1,1
Camp Chef Everest High Output 2 Burner Stove,Sports & Outdoors,https://www.amazon.com/Camp-Chef-Mountain-Burner-Pressure/dp/B004S3HDBO,1,1
"Morakniv Garberg Full Tang Fixed Blade Knife with Sandvik Stainless Steel Blade, 4.3-Inch",Sports & Outdoors,https://www.amazon.com/Morakniv-Garberg-Sandvik-Stainless-4-3-inch/dp/B01I1GITMA/ref=redir_mobile_desktop?_encoding=UTF8&amp%3BdpID=41a9O3roZZL&amp%3BdpPl=1&amp%3Bkeywords=morakniv%20full%20tang&amp%3Bpi=AC_SX236_SY340_QL65&amp%3Bqid=1486316246&amp%3Bref=plSrch&amp%3Bsr=8-1&ref_=mp_s_a_1_1,1,1
TIKKA R+ headlamp recharg blue E92RB,Sports & Outdoors,https://www.amazon.com/Petzl-Tikka-R-Headlamp-Blue/dp/B00BA4QMNY/ref=sr_1_1?ie=UTF8&amp;qid=1420849788&amp;sr=8-1&amp;keywords=petzl+tikka+r,1,1
"Brunton 7X18 Echo Pocket Scope, Blue",Sports & Outdoors,https://www.amazon.com/Brunton-7X18-Echo-Pocket-Scope/dp/B004O9F2JC/ref=sr_1_73,1,1
Salomon Men's Speedcross 3 Trail Running Shoe,"Clothing, Shoes & Jewelry",https://www.amazon.com/Salomon-Speedcross-Running-Silver-Metallic-X/dp/B004LB4V72/,1,1
Belleville Tactical Research 'TR103 Minimalist Training Boot,"Clothing, Shoes & Jewelry",https://www.amazon.com/Belleville-Tactical-Research-Minimalist-Training/dp/B00BPWOP8U/ref=cts_sh_1_vtp?pf_rd_m=ATVPDKIKX0DER&amp;pf_rd_p=2601945442&amp;pf_rd_r=GMG82KK16DP4M4VX77F8&amp;pd_rd_wg=G3f9B&amp;pf_rd_s=desktop-detail-softlines&amp;pf_rd_t=40701&amp;pd_rd_i=B00BPWOP8U&amp;pd_rd_w=w5tAU&amp;pf_rd_i=desktop-detail-softlines&amp;pd_rd_r=GMG82KK16DP4M4VX77F8&amp;_encoding=UTF8,1,1
ALPS Mountaineering Green/Clay Crescent Lake +20 Degree Mummy Sleeping Bag,Sports & Outdoors,https://www.amazon.com/ALPS-Mountaineering-Crescent-Degree-Sleeping/dp/B004EQ6WH6?sa-no-redirect=1,1,1
Optimus Titanium Long Spoon,Sports & Outdoors,https://www.amazon.com/Optimus-8016166-Titanium-long-spoon/dp/B0045UA8G2/,1,1
"Brand New Green Shikibuton Trifold Foam Beds 3"" Thick X 27"" Wide X 75"" Long, 1.8 lbs high density resilient white foam, Floor Foam Folding Mats.",Home & Kitchen,https://www.amazon.com/Shikibuton-Trifold-density-resilient-Folding/dp/B0040VPLJK/?ie=UTF8,1,1
Eureka Copper Canyon 6 Tent - 6 Person,Sports & Outdoors,https://www.amazon.com/Eureka-Copper-Canyon-Person-Tent/dp/B003NX9VTM,1,1
Celsius Long Lasting Warmth 507/HW Solid Fuel Hand Warmer Safe & Odorless,Sports & Outdoors,https://www.amazon.com/dp/B00305KAUW/ref=cm_sw_r_other_apa_Gu.vyb8ME1B6A,1,1
"Black Diamond Orbit Lantern, Matte Black",Sports & Outdoors,https://www.amazon.com/Black-Diamond-Orbit-Lantern-Matte/dp/B00FYK5H8Q,1,1
Kelty TN 3 Person Tent,Sports & Outdoors,https://www.amazon.com/Kelty-TN-3-Person-Tent/dp/B00G6KUR7Y/,1,1
Black Diamond Storm Head Lamp,Sports & Outdoors,https://www.amazon.com/Black-Diamond-Storm-Vibrant-Orange/dp/B00H3MY1EY/,1,1
AmazonBasics Foldable Drying Rack - White,Home & Kitchen,https://www.amazon.com/AmazonBasics-Foldable-Drying-Rack-Chrome/dp/B00H7P1G7C/ref=sr_1_4?ie=UTF8&amp;qid=1473875559&amp;sr=8-4&amp;keywords=hanging+folding+rack,1,1
Sea to Summit Ultra-Sil Compression Dry Sacks,Sports & Outdoors,https://www.amazon.com/Sea-Summit-Ultra-Sil-eVENT-Compression/dp/B00HS3AT1M/,1,1
Bantam,Sports & Outdoors,https://www.amazon.com/Victorinox-Swiss-Bantam-Pocket-Knife/dp/B0007QCO4M/ref=sr_1_1?ie=UTF8&amp;qid=1466121367&amp;sr=8-1&amp;keywords=victorinox+bantam,1,1
Zippo Black Crackle Lighter,Sports & Outdoors,https://www.amazon.com/Zippo-236-Black-Crackle-Lighter/dp/B0006L8MTY/ref=sr_1_1?s=sporting-goods&amp;ie=UTF8&amp;qid=1459002537&amp;sr=1-1&amp;keywords=zippo+black+crackle,1,1
Therm-a-Rest ProLite Mattress,Sports & Outdoors,https://www.amazon.com/Therm-A-Rest-06091-Therm-a-Rest-ProLite-Mattress/dp/B00NW2W5VK,1,1
