name,category,amazon_link,total_mentions,subreddit_mentions
Magic: The Gathering - Kaladesh Bundle Box with 10 Booster Packs,Toy,http://www.amazon.com/dp/B01LDELE0Q/,4,2
Magic the Gathering - Commander 2013 - Power Hungry Deck,Toy,http://www.amazon.com/dp/B00FUSEEH2/,3,1
MTG Magic the Gathering Origins Deck Builders Toolkit,Toy,http://www.amazon.com/dp/B00Y0ZVNFM/,11,1
Get both Aether Revolt Planeswalker Decks: Ajani & Tezzeret!,Toy,http://www.amazon.com/dp/B01NAL0OHZ/,3,1
Magic The Gathering Amonkhet Planeswalker Decks Set - 150 cards - Gideon & Liliana,Toy,http://www.amazon.com/dp/B06XWJMDC6/,3,1
