name,category,amazon_link,total_mentions,subreddit_mentions
1500 Live Ladybugs - Good Bugs - Ladybugs - Guaranteed Live Delivery!,"Patio, Lawn & Garden",https://www.amazon.com/1500-Live-Ladybugs-Guaranteed-Delivery/dp/B00533KOIC/ref=sr_1_1/176-9397632-8681826?ie=UTF8&amp;qid=1423622769&amp;sr=8-1&amp;keywords=live+lady+bugs,18,1
"Anker PowerCore+ mini, 3350mAh Lipstick-Sized Portable Charger (3rd Generation, Premium Aluminum Power Bank), One of the Most Compact External Batteries",Cell Phones & Accessories,https://www.amazon.com/Anker-PowerCore-Lipstick-Sized-Generation-Batteries/dp/B005X1Y7I2/ref=redir_mobile_desktop?_encoding=UTF8&amp%3BdpID=41PXK5QqB7L&amp%3BdpPl=1&amp%3Bkeywords=portable%20charger&amp%3Bpi=SY200_QL40&amp%3Bref=plSrch&amp%3Bsr=8-1&qid=1459952198&ref_=mp_s_a_1_1,12,1
House of Leaves,Books,https://www.amazon.com/House-Leaves-Mark-Z-Danielewski/dp/0375703764/,8,1
Otamatone from Maywa Denki (White),Toys & Games,https://www.amazon.com/Otamatone-from-Maywa-Denki-White/dp/B002IGTOZQ,6,1
Betrayal At House On The Hill - 2nd Edition,Toys & Games,https://www.amazon.com/Betrayal-At-House-The-Hill/dp/B003HC9734,6,1
Wahl Color Pro Complete Hair Cutting Kit 79300-400T,Beauty & Personal Care,https://www.amazon.com/Wahl-Color-Complete-Cutting-79300-400T/dp/B000JNQSIQ/ref=sr_1_3_a_it?ie=UTF8&amp;qid=1480860211&amp;sr=8-3&amp;keywords=electric+clipper,5,1
Codependent No More: How to Stop Controlling Others and Start Caring for Yourself,Books,https://www.amazon.com/Codependent-No-More-Controlling-Yourself/dp/0894864025/ref=sr_1_1?ie=UTF8&amp;qid=1434999254&amp;sr=8-1&amp;keywords=codependent+no+more+by+melody+beattie,4,1
"I Don't Care if My Best Friend's Mom is a Sasquatch, She's Hot and I'm Taking a Shower With Her (...Because It's the New Millennium) (Volume 1)",Books,https://www.amazon.com/Friends-Sasquatch-Taking-Because-Millennium/dp/150758833X/ref=redir_mobile_desktop?_encoding=UTF8&amp%3Bkeywords=my%20best%20friends%20mom%20is%20a%20sasquatch&amp%3Bpi=AC_SX110_SY165_QL70&amp%3Bsr=8-1&qid=1440443608&ref_=mp_s_a_1_1,3,1
Merkur Heavy Duty Double Edge Razor (Blade Included),Beauty & Personal Care,https://www.amazon.com/Merkur-Heavy-Double-Razor-Included/dp/B000QYEK88/ref=sr_1_6_a_it?ie=UTF8&amp;qid=1480860653&amp;sr=8-6&amp;keywords=safety+razor,3,1
Gros Michel Banana Plant - RARE Variety,"Patio, Lawn & Garden",https://www.amazon.com/Gros-Michel-Banana-Plant-Variety/dp/B0094JDSAC,2,1
How to Boil Water,Books,https://www.amazon.com/Boil-Water-Food-Network-Kitchens/dp/0696226863,2,1
Carson 60X-75X MicroMax LED Lighted Pocket Microscope (MM-200),Electronics,https://www.amazon.com/Carson-60X-100X-MicroMax-Microscope-MM-200/dp/B000P8AUMU/ref=sr_1_1?ie=UTF8&amp;qid=1423447397&amp;sr=8-1&amp;keywords=mini+microscope,2,1
Letters from a Stoic (Penguin Classics),Books,https://www.amazon.com/Letters-Penguin-Classics-Lucius-Annaeus/dp/0140442103,2,1
"The Name of the Wind (Kingkiller Chronicles, Day 1)",Books,https://www.amazon.com/The-Name-Wind-Kingkiller-Chronicles/dp/0756405890/ref=tmm_pap_title_0,2,1
"Razer BlackWidow Chroma, Clicky RGB Mechanical Gaming Keyboard, 5 Macro Keys - Razer Green Switches",Electronics,https://www.amazon.com/Razer-BlackWidow-Chroma-Mechanical-Keyboard/dp/B00MTWV0II,1,1
Melissa & Doug Giant Boa Constrictor - Lifelike Stuffed Animal Snake (over 14 feet long),Toys & Games,https://www.amazon.com/dp/B00L5LDF8M/,1,1
"Mikayoo Pet Dog Cat Halloween costumes,The Cowboy for Party Christmas Special Events Costume,West CowBoy Uniform with Hat,Funny Pet Cowboy Outfit Clothing for dog cat",Pet Supplies,https://www.amazon.com/gp/product/B01LZMEAHD/ref=oh_aui_detailpage_o01_s00?ie=UTF8&amp;psc=1,1,1
Kind Ash Cache Blue,Automotive Parts & Accessories,https://www.amazon.com/Herbal-Innovations-Kind-Cache-Z-KAC-BLU/dp/B009ZD5SCI,1,1
Ghillie Suit 3 Piece Set - One Size Fits All Teens By Modern Warrior,Sports & Outdoors,https://www.amazon.com/Ghillie-Suit-Piece-Child-Size/dp/B0086QFYYW/ref=sr_1_11?s=hunting-fishing&amp;ie=UTF8&amp;qid=1449531637&amp;sr=1-11&amp;keywords=Ghillie+suit,1,1
T68 M240 Paintball Machine Gun,Sports & Outdoors,https://www.amazon.com/T68-M240-Paintball-Machine-Gun/dp/B003BM5HMA/ref=sr_1_1?s=sporting-goods&amp;ie=UTF8&amp;qid=1449531804&amp;sr=1-1&amp;keywords=Paintball+minigun,1,1
Stanley 55-515 12-3/4-inch Wonderbar Pry Bar,Tools & Home Improvement,https://www.amazon.com/Stanley-55-515-12-3-4-inch-Wonderbar/dp/B00002X1XT,1,1
"MindWorks: A Practical Guide for Changing Thoughts Beliefs, and Emotional Reactions",Books,https://www.amazon.com/MindWorks-Practical-Changing-Emotional-Reactions/dp/0990584607,1,1
When Sex Hurts: A Woman's Guide to Banishing Sexual Pain,Books,https://www.amazon.com/When-Sex-Hurts-Womans-Banishing/dp/0738213985,1,1
"Dehydrated Egg White Powder, 2Lbs Dried Powdered Egg Whites, Stay Fresh Zipper Bag-(32oz)",Grocery & Gourmet Food,https://www.amazon.com/Dehydrated-Powder-Powdered-Whites-Zipper/dp/B01MRFU38C?th=1,1,1
ASUS CHROMEBIT CS10 Stick-Desktop PC with RockChip 3288-C 2 GB LPDDR3L 16 GB eMMC Google Chrome OS,Electronics,https://www.amazon.com/dp/B0181JTPCU/ref=wl_it_dp_o_pC_nS_ttl?_encoding=UTF8&amp;colid=1D9SJ5L6FTJYE&amp;coliid=I1TJ4WFUIQ7EJL,1,1
Yo! Yes? (Scholastic Bookshelf),Books,https://www.amazon.com/Yes-Scholastic-Bookshelf-Chris-Raschka/dp/0439921856,1,1
Fleischmann's Instant Yeast - 2/16 oz. bags,Grocery & Gourmet Food,https://www.amazon.com/Fleischmanns-Instant-Yeast-oz-bags/dp/B001BZEGN0/ref=sr_1_4_a_it?ie=UTF8&amp;qid=1461940804&amp;sr=8-4&amp;keywords=yeast,1,1
"Sparco SPR01796 Heavy-Duty Adjustable 9/32"" 3-Hole Punch",Office Products,https://www.amazon.com/gp/product/B000Q5Z5DG/ref=pd_lpo_sbs_dp_ss_2/189-2045901-0187520?pf_rd_m=ATVPDKIKX0DER&amp;pf_rd_s=lpo-top-stripe-1&amp;pf_rd_r=0YEB1DVD226S1ERQYWQW&amp;pf_rd_t=201&amp;pf_rd_p=1944687762&amp;pf_rd_i=B004I2EB24,1,1
Viral Extreme Purple Color Wash 8.25 fl. oz. (244ml),Beauty & Personal Care,https://www.amazon.com/dp/B01J6FD696/ref=cm_sw_r_cp_awdb_dgGIzbPDVTJKF,1,1
KORE Men’s Track Belt | “Epic” Buckle & Full-Grain Leather Belt,"Clothing, Shoes & Jewelry",https://www.amazon.com/Mens-Leather-Ratchet-Alloy-Buckle/dp/B00PGIF182/ref=sr_1_11?ie=UTF8&amp;qid=1483896715&amp;sr=8-11&amp;keywords=kore+essentials+belt,1,1
"Kinder Bueno, CASE, 43 g x 30 bars, chocolate bueno",Grocery & Gourmet Food,https://www.amazon.com/dp/B000LQJJXM/ref=cm_sw_r_cp_apa_H7h2xbZYQ50AS,1,1
"GEM LITES Viral Pastel Light Color Wash, Pink",Beauty & Personal Care,https://www.amazon.com/dp/B01JPTF1ZA/ref=cm_sw_r_cp_apa_NcGIzbRGYKBP8,1,1
"Digital Meat Thermometer Fork Instant Read Meat Thermometer with LED Screen and Ready Alarm - Long Fork for Grilling, Barbecue and Cooking | Perfect Gift Idea. By: Belmint","Patio, Lawn & Garden",https://www.amazon.com/Belmint-Advanced-Thermometer-Selectable-Birthdays/dp/B018GOI7TW,1,1
Mini Purple Gift Bag (2 dozen) - Bulk [Toy],Industrial & Scientific,https://www.amazon.com/Mini-Purple-Gift-Bag-dozen/dp/B005TMM0WU,1,1
Home-Complete Ice Ball Maker Mold - 4 Whiskey Ice Balls -Premium Round Spheres Tray,Home & Kitchen,https://www.amazon.com/gp/product/B00H8RVMC8/,1,1
"Lindt LINDOR truffles Milk Chocolate Token Gift Box, 4.7oz",Grocery & Gourmet Food,https://www.amazon.com/Lindt-LINDOR-truffles-Chocolate-Token/dp/B009ZJGNNA,1,1
"Maybe You Touched Your Genitals"" Hand Sanitizer",Beauty & Personal Care,https://www.amazon.com/Maybe-Touched-Your-Genitals-Sanitizer/dp/B004CPQBRA,1,1
Star Wars Giga Pets,Toys & Games,https://www.amazon.com/Star-Wars-Giga-Pets/dp/B000TFQMFS,1,1
Kala Makala Shark Soprano Ukulele,Musical Instruments,https://www.amazon.com/Makala-Shark-Soprano-Ukulele-Green/dp/B00FYX8QCW/ref=sr_1_5?s=musical-instruments&amp;ie=UTF8&amp;qid=1451175846&amp;sr=1-5&amp;keywords=ukulele,1,1
"HTC One M8 Case, SUPCASE [Heavy Duty] HTC One M8 Case 2014 Release [Unicorn Beetle PRO Series] Full-body Rugged Hybrid Protective Case with Built-in Screen Protector (Blue/Black), Dual Layer Design + Impact Resistant Bumper",Cell Phones & Accessories,https://www.amazon.com/SUPCASE-Full-body-Protective-Protector-Resistant/dp/B00IUILDNC/ref=sr_1_6?ie=UTF8&amp;qid=1423078021&amp;sr=8-6&amp;keywords=unicorn+beetle+htc+one+m8,1,1
"Waterproof Case, 2 Pack Ace Teah Clear Universal Waterproof Case, Dry Bag, Pouch, Transparent Snowproof Dirtproof for iPhone 8 7 6 6S Plus X SE 5S 5C, Samsung Galaxy S8, S7 S6 edge , - Blue, Green",Cell Phones & Accessories,https://www.amazon.com/Waterproof-Ace-Teah-Universal-Transparent/dp/B0118QANQK/ref=lp_10161061011_1_3?srs=10161061011&amp;ie=UTF8&amp;qid=1454971895&amp;sr=8-3,1,1
100 ct Yellow Feather Safety Double Edge Blades - Original Japan Made,Beauty & Personal Care,https://www.amazon.com/Feather-Razor-Blades-100-Feather/dp/B014YHD272/ref=sr_1_8_a_it?ie=UTF8&amp;qid=1480860778&amp;sr=8-8&amp;keywords=safety+razor+blades&amp;refinements=p_89,1,1
"JunXin European Style Purple Amethyst Two Pieces Black Couple Rings for Women Mens(Women Sz5-10,Men Sz5-12)","Clothing, Shoes & Jewelry",https://www.amazon.com/Junxin-Jewelry-Amethyst-Wedding-Pieces/dp/B016ZJLX1O/ref=sr_1_8?s=apparel&amp;ie=UTF8&amp;qid=1460734663&amp;sr=1-8&amp;nodeID=7141123011&amp;keywords=amethyst+ring,1,1
"Stonewall Kitchen Sauce, Dark Chocolate Sea Salt Caramel, 12.5 Ounce",Grocery & Gourmet Food,https://www.amazon.com/Stonewall-Kitchen-Sauce-Chocolate-Caramel/dp/B004D03WCG/ref=redir_mobile_desktop?_encoding=UTF8&amp%3BdpID=51U8o9BNV5L&amp%3BdpPl=1&amp%3Bkeywords=stonewall%20kitchen&amp%3Bpi=AC_SX110_SY165_QL70&amp%3Bref=plSrch&amp%3Bsr=8-4&qid=1434274039&ref_=mp_s_a_1_4,1,1
Microplane Grater-Zester without Grip 40001 CASE/96,Home & Kitchen,https://www.amazon.com/Microplane-Grater-Zester-without-Grip-40001/dp/B005GQZ3TQ,1,1
Fluker Labs SFK32000 Cricket Measuring Tube and Funnel,Pet Supplies,https://www.amazon.com/Fluker-Labs-SFK32000-Cricket-Measuring/dp/B0006G5AW6,1,1
"Lambs and Ivy Enchanted Forest Plush Owl, Green",Baby,https://www.amazon.com/Lambs-Ivy-Enchanted-Forest-Plush/dp/B001JJCMJ8/ref=sr_1_13?ie=UTF8&amp;qid=1422685716&amp;sr=8-13&amp;keywords=stuffed+owl,1,1
TAYTHI Professional Cutaway Inside View of Practice Padlocks Lock Training Trainer Skill Pick for Locksmith with Three Keys,Tools & Home Improvement,https://www.amazon.com/TAYTHI-Professional-Practice-Padlocks-Locksmith/dp/B0105S3F6W/ref=sr_1_1?ie=UTF8&amp;qid=1440691391&amp;sr=8-1&amp;keywords=cutaway+lock&amp;pebp=1440691394028&amp;perid=1X2NC2BDCX713Q63ASYF,1,1
Doublju Women Casual Short Sleeve Round Neck Flare Mini Dress,"Clothing, Shoes & Jewelry",https://www.amazon.com/Doublju-Sleeve-Casual-Dress-CWDSD093_Cocoa/dp/B010LWZPEW?ie=UTF8&amp;psc=1&amp;redirect=true&amp;ref_=nav_timeline_asin,1,1
"MyGift Metal Nail Polish Mountable 6 Tier Organizer Display Rack, Black",Home & Kitchen,https://www.amazon.com/MyGift-Polish-Mountable-Organizer-Display/dp/B00J2JK34S/ref=sr_1_1?s=home-garden&amp;ie=UTF8&amp;qid=1455639376&amp;sr=1-1&amp;keywords=nail+polish+racks+for+the+wall,1,1
Koomus CD-Eco Universal CD Slot Smartphone Car Mount Holder for all iPhones and Android Devices,Cell Phones & Accessories,https://www.amazon.com/gp/product/B00JP0RTB4,1,1
The Evolutionary Void (Void Trilogy),Books,https://www.amazon.com/Evolutionary-Void-Trilogy/dp/1400161843?ie=UTF8&amp;ref_=asap_bc,1,1
