name,category,amazon_link,total_mentions,subreddit_mentions
"Go Pet Club Cat Tree, 50W x 26L x 72H, Beige",Pet Products,http://www.amazon.com/dp/B003WGGWQA/,4,4
"Grey Shark Bed for Small Cat Dog Cave Bed Removable Cushion,waterproof Bottom Most Lovely Pet House Gift for Pet",Pet Products,http://www.amazon.com/dp/B00DZITYGU/,8,3
"Taste of the Wild, Rocky Mountain Feline Formula with Roasted Venison & Smoked Salmon, Net Wt 15 Lbs",Pet Products,http://www.amazon.com/dp/B0018CJYCO/,4,3
"Bags on Board Dog Waste Pick-up Refill Bags, 120 count",Pet Products,http://www.amazon.com/dp/B000UCU53U/,3,3
"Tower of Tracks Ball and Track Interactive Toy for Cats, Fun Cat Game by Petstages",Pet Products,http://www.amazon.com/dp/B00DT2WL26/,3,3
FAT CAT Crazy Circle Interactive Cat Toy,Pet Products,http://www.amazon.com/dp/B0002AT5AO/,3,3
PetSafe SSSCAT Spray Deterrent,Pet Products,http://www.amazon.com/dp/B000RIA95G/,20,2
"FURminator Long Hair deShedding Tool for Cats, Large",Pet Products,http://www.amazon.com/dp/B0040QS3PO/,4,2
Catit Senses 2.0 Food Tree,Pet Products,http://www.amazon.com/dp/B00D3NI31Y/,4,2
"Foscam FI9821P HD 720P WiFi Security IP Camera with iOS/Android App, Pan, Tilt, Zoom, Two-Way Audio, Night Vision up to 26ft, and More (Black)",Photography,http://www.amazon.com/dp/B00H3Q8QB4/,2,2
"Jumbo Size Cat Litter Trapper by iPrimio - Litter Mat, EZ Clean Cat Mat, Litter Box Mat Water Proof Layer and Puppy Pad Option. Patent Pending. (32""x30"" Black)",Pet Products,http://www.amazon.com/dp/B01AUU90K0/,2,2
"NOW Glucosamine 1.1g, Chondroitin 1.2g, with MSM 300mg, 180 Capsules",Health and Beauty,http://www.amazon.com/dp/B0013OSMRK/,2,2
Easyology Jumbo Size Cat Litter Mat - 47 x 36 Inch (Gray),Pet Products,http://www.amazon.com/dp/B016PHLNRA/,2,2
Best Dematting Tool Deshedding Tool for Cats and Dogs by Marvins Pet Products Professional 2 Sided Grooming Rake Easy Painless Undercoat Rake Blue Silica Gel Handle Comfy Grip,Pet Products,http://www.amazon.com/dp/B014DY5YNG/,2,2
OurPets Play-N-Squeak Wee MouseHunter Kitten Toy,Pet Products,http://www.amazon.com/dp/B002DZI0NO/,2,2
Oster Sunny Seat Window-Mounted Cat Bed 50 lbs,Pet Products,http://www.amazon.com/dp/B005AUM8U0/,2,2
HEXBUG AquaBot Single,Toy,http://www.amazon.com/dp/B00DK25JMO/,,1
My Pet Remembrance Journal,eBooks,http://www.amazon.com/dp/B012TOFL5I/,,1
Crafting with Cat Hair: Cute Handicrafts to Make with Your Cat,Book,http://www.amazon.com/dp/1594745250/,13,1
"PetSafe Drinkwell Original Dog and Cat Water Fountain, 50 oz.",Pet Products,http://www.amazon.com/dp/B00063446M/,9,1
"PetSafe SlimCat Meal Dispensing Cat Toy, Blue",Pet Products,http://www.amazon.com/dp/B0018CG40O/,9,1
"GoCat Da Bird Pull Apart Rod and Bird Cat Feather Toys, Assorted Colors",Pet Products,http://www.amazon.com/dp/B000F9JJJE/,8,1
"PetSafe Drinkwell Platinum Dog and Cat Water Fountain, 168 oz.",Pet Products,http://www.amazon.com/dp/B000L3XYZ4/,7,1
"PetSafe Healthy Pet Simply Feed Automatic Pet Feeder, Dispenses Dog Food or Cat Food, Digital Clock",Pet Products,http://www.amazon.com/dp/B00VIXRB6O/,7,1
Catit Flower Fountain: 3L Drinking Fountain with Triple-Action Filter,Pet Products,http://www.amazon.com/dp/B0146QXOB0/,7,1
Hand Held Scalp Head Massager - Pack of Two (Colors May Vary),Health and Beauty,http://www.amazon.com/dp/B003NTELC8/,7,1
3M Lint Roller,Health and Beauty,http://www.amazon.com/dp/B00006IA8Q/,5,1
"Kirkland Signature Non Drowsy Allerclear Loratadine Tablets, Antihistamine, 10mg, 365-Count",Health and Beauty,http://www.amazon.com/dp/B004ASER98/,4,1
"Kirkland Signature Aller-Tec Cetirizine Hydrochloride Tablets, 10 mg, 365 Count",Health and Beauty,http://www.amazon.com/dp/B0036DEALS/,4,1
Qpets 6-Meal Automatic Pet Feeder,Pet Products,http://www.amazon.com/dp/B005POODL8/,4,1
Snuggle Safe Pet Bed Microwave Heating Pad,Pet Products,http://www.amazon.com/dp/B00008AJH9/,4,1
"PetSafe ScoopFree Self-Cleaning Cat Litter Box, Automatic with Disposable Tray",Pet Products,http://www.amazon.com/dp/B000ELUQQS/,3,1
"Virbac C.E.T. Enzymatic Toothpaste, Poultry Flavor, 2.5 oz",Pet Products,http://www.amazon.com/dp/B00RZDXA7K/,3,1
Comfort Zone Feliway Diffuser Kit for Cat Calming,Pet Supplies,https://www.amazon.com/Comfort-Zone-100512641-Feliway-Diffuser/dp/B00I9SI40S,3,1
Kitty Convict Cat ID Collars,Pet Products,http://www.amazon.com/dp/B018IRQ316/,3,1
"K&H Thermo-Kitty Heated Cat Bed, 20-Inch, Sage",Pet Products,http://www.amazon.com/dp/B00403MXBC/,3,1
"Catit Design Senses Play Circuit, Original",Pet Products,http://www.amazon.com/dp/B001LWRFW2/,3,1
"Nutramax Cosequin Capsules, 80 Count",Pet Products,http://www.amazon.com/dp/B000F4W02M/,2,1
K&H Manufacturing Thermo-Kitty Mat Mocha 12.5-Inch by 25-Inch 6 Watts,Pet Products,http://www.amazon.com/dp/B000S9M2U4/,2,1
"K&H Manufacturing Extreme Weather Kitty Pad Black 12.5"" x 18.5"" 40W",Pet Products,http://www.amazon.com/dp/B0009YWJRE/,2,1
BIAL Massage Facial Massager Thin Face-lift Elastic Facial Roller Massage Cogit Cellulose Roller for Face Up (Pink),Beauty,http://www.amazon.com/dp/B00M2GJDWG/,2,1
"Petsfit Comfort Dogs Carriers/Backpack, Hold Pets up to 15LBS,Go for Walk, Hiking and Cycling Black 17""H x13""L x11""D",Pet Products,http://www.amazon.com/dp/B00R71116C/,2,1
Nature's Miracle High-Sided Litter Box (P-82035),Pet Products,http://www.amazon.com/dp/B0087Y5NKS/,2,1
The Ripple Rug - Made in USA - Cat Activity Play Mat - Fun Interactive Play - Training - Scratching - Multi Use Habitat Bed Mat,Pet Products,http://www.amazon.com/dp/B016H3T8EC/,2,1
"K&H Manufacturing Outdoor Kitty House, 18 x 22 x 17-Inches, Heated - Olive",Pet Products,http://www.amazon.com/dp/B004ZJOH06/,2,1
"Joybies Navy Blue Piddle Pants(tm) for Small Cat (Measuring 13""-15"" Along Back from Collar to Base of Tail)",Pet Products,http://www.amazon.com/dp/B000SE7AZG/,2,1
"Yosoo Shark Round House Puppy Bed with Pet Bed Mat, Small to Medium (Medium)",Pet Products,http://www.amazon.com/dp/B00CSJAIRG/,2,1
"Pioneer Pet Raindrop Ceramic Drinking Fountain for Pets, White",Pet Products,http://www.amazon.com/dp/B005LVJM4I/,2,1
Cat Mate Pet Fountain - 70 Fluid Oz.,Pet Products,http://www.amazon.com/dp/B001TY5D6C/,2,1
Catit Senses 2.0 Digger for Cats,Pet Products,http://www.amazon.com/dp/B015P13QMM/,2,1
"Kikkerland Cat Butt Magnets, Set of 6 (MG53)",Kitchen,http://www.amazon.com/dp/B00NZTJX56/,2,1
"GlycoFlex 3 Hip and Joint Support for Dogs, 120 Bite Sized Chews",Pet Products,http://www.amazon.com/dp/B002LVTTYE/,2,1
FurHaven Tiger Tough 33 Styles of Scratching Posts and Cat Tree House Furniture Condos for Cats and Kittens,Pet Products,http://www.amazon.com/dp/B00XIKSN3K/,2,1
"Vetri-Lysine Plus, 120 Bite-Sized Chews",Pet Products,http://www.amazon.com/dp/B002ALE9RM/,2,1
HEXBUG Zombie AquaBot,Toy,http://www.amazon.com/dp/B00K00O38K/,1,1
"EVO 15.4 lb Grain Free Turkey and Chicken Formula Cat & Kitten Food (1 Pack), One Size",Pet Products,http://www.amazon.com/dp/B000WFEMHK/,1,1
"Wellness Natural Grain Free Wet Canned Cat Food, Chicken Pate, 12.5-Ounce Can (Pack of 12)",Pet Products,http://www.amazon.com/dp/B000WFORH0/,1,1
"KONG Cloud E-Collar for Cats and Dogs, Small",Pet Products,http://www.amazon.com/dp/B0045Y1JGQ/,1,1
"Automatic Cat Feeder, CSF-3 Super Feeder with Analog Timer, Chute Cover, Stand and Bowl--Up to 48 Daily Meals 4 3/4 Cups Capacity Optionally Expandable",Pet Products,http://www.amazon.com/dp/B00428TOBC/,1,1
"Blue Buffalo Wilderness Soft-Moist Grain-Free Cat Treats Variety Pack - 4 Flavors (Chicken & Duck, Chicken & Trout, Chicken & Salmon, and Chicken & Turkey) - 2 Oz Each (4 Total Pouches)",Pet Products,http://www.amazon.com/dp/B00RM9U43A/,1,1
"Petmate Jackson Galaxy Plush Twisted Kicker Toy, Large",Pet Products,http://www.amazon.com/dp/B00O3GWKDM/,1,1
"The Honest Kitchen Wishes: Natural Human Grade Dehydrated Grain Free Fish Filets, Treats for Dogs and Cats, 2 oz",Pet Products,http://www.amazon.com/dp/B009LQHSZY/,1,1
"Insane Sale Only $14.99! Lucson Ear & Nose Hair Trimmer for Men and Women - Safe, Sharp Stainless Steel Blade with Precision Tip",Health and Beauty,http://www.amazon.com/dp/B016QUA6RO/,1,1
1 Dozen Wind-Up Jumping Chicken and Bunnies Party Favors (Pack of 12),Toy,http://www.amazon.com/dp/B01A4K79BI/,1,1
Burlybands - The Ultimate Hair Ties for Thick Heavy or Curly Hair. No Slipping Damage Breaking or Stretching Out. Seamless Ponytail Holders Scrunchies Sports Hair Ties for Thick Hair (Black),Beauty,http://www.amazon.com/dp/B00HZ653YA/,1,1
James Herriot's Cat Stories,Book,http://www.amazon.com/dp/1250061857/,1,1
Universal Selectorized 445 Dumbbells and Stand,Sports,http://www.amazon.com/dp/B003UO1DLS/,1,1
Suburban Cat Hammock with Solid Pine Wood Stand,Lawn & Patio,http://www.amazon.com/dp/B00U1W91MA/,1,1
"Safety Furniture Straps - Anti-Tip Anchors for Any Furniture, Extra Strong Hold - 8 Pack White - Childproofing for Light & Heavy Furniture - Door Slam Stopper Included",Baby Product,http://www.amazon.com/dp/B014R5XIDY/,1,1
Suitical Recovery Suit for Cats Camo XXSmall,Pet Products,http://www.amazon.com/dp/B00NHNF5SY/,1,1
DOGTEK Eyenimal Cat Video Camera with Built-In Night Vision,Pet Products,http://www.amazon.com/dp/B009MKVHOC/,1,1
"Vvhome Elizabeth Soft Foam Protective Collar Wound Healing Cone recovery E-Collar for Small Medium Large Dog Cat (XS, Green)",Pet Products,http://www.amazon.com/dp/B0111DLJNQ/,1,1
Milliard 20in x 12in Pet Bed Warmer with Power Indicator On/Off Switch - Great for Keeping your Pets Warm,Pet Products,http://www.amazon.com/dp/B00EKL3FTI/,1,1
Think Like a Cat: How to Raise a Well-Adjusted Cat--Not a Sour Puss,Book,http://www.amazon.com/dp/0143119796/,1,1
The Kitty Tube Gen 3 Outdoor Insulated Cat House with Custom Pet Pillow,Pet Products,http://www.amazon.com/dp/B0049WPZX2/,1,1
"Instinct Original Grain Free Chicken Meal Formula Natural Dry Cat Food by Nature's Variety, 12.1 lb. Bag",Pet Products,http://www.amazon.com/dp/B00IKOSLL8/,1,1
SmartCat Multi-Level Cat Climber,Pet Products,http://www.amazon.com/dp/B001362AFS/,1,1
Magnetic 3 LED Flash Light 5 Pound Magnet Telescopic Flexible Neck Pick Up Tool (Extra Batteries Included) by GEN,Home Improvement,http://www.amazon.com/dp/B0057P8OUQ/,1,1
The Original Scratch Lounge - Worlds Best Cat Scratcher - Includes Catnip,Pet Products,http://www.amazon.com/dp/B000EIHQU0/,1,1
"Our Name is Mud “Cat Hair” Stoneware Mug, 16 oz.",Kitchen,http://www.amazon.com/dp/B006ZLVD68/,1,1
Panasonic KX-HN6001W Smart Home Monitoring System Baby Monitor Kit (White),Photography,http://www.amazon.com/dp/B00PJ1XY7G/,1,1
"Vitakraft Purrk Playfuls Silvervine Powder Packets with Toy Mouse, .5 grams, 5 Pack",Pet Products,http://www.amazon.com/dp/B00MHTYRQU/,1,1
"Lotus & Windoware 2-Inch Faux Wood Blind, 35 by 36-Inch, White",Home Improvement,http://www.amazon.com/dp/B00LXCL2GK/,1,1
Solvit PupSTEP Plus Pet Stairs,Pet Products,http://www.amazon.com/dp/B000MD57OO/,1,1
"Built In Cat Door for Medium & Large Cats | Fits Interior Hollow Core or Solid Wood Doors | Template, Self Drilling Screws, Instructions Included | 8x6.5 Inches from Purrfect Portal",Pet Products,http://www.amazon.com/dp/B01LWV0VEC/,1,1
Tinkle Hair Cutter,Beauty,http://www.amazon.com/dp/B001DYM62C/,1,1
Madcap Crunch and Wrestle Catnip Toy for Cats by Petstages,Pet Products,http://www.amazon.com/dp/B0107XUMJI/,1,1
Milescraft 5337 1/4-Inch Dowel Kit,Home Improvement,http://www.amazon.com/dp/B0055HPZ3A/,1,1
Viralys Oral Gel For Cats 5oz,Pet Products,http://www.amazon.com/dp/B00E8GKCGY/,1,1
"PetSafe Come With Me Kitty Harness and Bungee Leash, Medium, Royal Blue",Grocery,http://www.amazon.com/dp/B000OBFI0M/,1,1
"NaturVet Bitter Yuck! No Chew Spray for Dogs and Cats, 16 oz Liquid , Made in USA",Pet Products,http://www.amazon.com/dp/B000EHXD6M/,1,1
K&H Manufacturing Lectro-Soft Outdoor Heated Bed Small with FREE Cover,Pet Products,http://www.amazon.com/dp/B000ICGJZK/,1,1
"Pawaboo Pet Carrier Backpack, Adjustable Pet Front Cat Dog Carrier Backpack Travel Bag, Legs Out, Easy-Fit for Traveling Hiking Camping, Medium Size, BLACK",Pet Products,http://www.amazon.com/dp/B01KNULJLU/,1,1
"Feline Skeletal System Anatomical Chart 20"" X 26"" Laminated",BISS,http://www.amazon.com/dp/B000FH1FNO/,1,1
"Chemical Free Hard Red Wheat Seed - 5 Lbs - Plant & Grow Wheatgrass, Flour, Grain & Bread, Emergency Preparation Food Storage - Excellent Germination",Lawn & Patio,http://www.amazon.com/dp/B000E7OYVA/,1,1
Ravensburger 81461RVN Stow and Go Storage System Puzzle (Discontinued by manufacturer),Toy,http://www.amazon.com/dp/B0012G9FY8/,1,1
"Nutramax Dasuquin with MSM Chewables, Large Dog, 150 Count",Pet Products,http://www.amazon.com/dp/B000MCVGEA/,1,1
"Premium Charcoal Filters for PetSafe Drinkwell 360 Fountains, Pack of 10",Pet Products,http://www.amazon.com/dp/B0137RB2G8/,1,1
Pet Stairs 3 Steps Stairs Small Dog Cat Steps Pet Ramp Ladder Portable Travel Up to 20 lbs,Pet Products,http://www.amazon.com/dp/B000H7K2MM/,1,1
"3/8"" X 100' Sisal Rope CAT SCRATCHING POST other uses",Lawn & Patio,http://www.amazon.com/dp/B0029N1DZM/,1,1
Kraft Macaroni and Cheese Dash Button,Amazon Devices,https://www.amazon.com/gp/product/B0187TMR56/,1,1
"Pounce Cat Treats, Moist Seafood Medley Flavor, 6.5 ounce (Pack of 5)",Pet Products,http://www.amazon.com/dp/B004D1YG1Q/,1,1
The Humane Society of the United States Complete Guide to Cat Care,Book,http://www.amazon.com/dp/0312326084/,1,1
"PetSafe Drinkwell Stainless Steel Multi-Pet Dog and Cat Water Fountain, 128 oz.",Pet Products,http://www.amazon.com/dp/B002SB91QS/,1,1
The Original Magic Wand with Free Wand Essentials Travel Massager,Health and Beauty,http://www.amazon.com/dp/B01DCHMIF2/,1,1
"Wooden Armoire Wardrobe for 18"" Doll",Toy,http://www.amazon.com/dp/B0010AI19G/,1,1
"St Justin, Pewter Sleeping Cat Necklace - 18""",Jewelry,http://www.amazon.com/dp/B00ANNJAAK/,1,1
"Petego Pet Tube Car Kennel, Large",Pet Products,http://www.amazon.com/dp/B000HVV3OE/,1,1
"L-Lysine Chews for Cats, Immune and Respiratory Support Supplement, 60 Bite Sized Chews (3.74oz)",Pet Products,http://www.amazon.com/dp/B006OCG4JY/,1,1
"Automatic Cat Feeder, CSF-3XL Super Feeder, Large Hopper, Digital Timer, Chute Cover, Stand/Bowl. Up to 8 Daily Meals--(Approximately 5 lbs food)",Pet Products,http://www.amazon.com/dp/B005XCWVPC/,1,1
L Lysine for Cats - Tasty Chews for Immune System Support 3.74oz,Pet Products,http://www.amazon.com/dp/B012F1RAXQ/,1,1
