name,category,amazon_link,total_mentions,subreddit_mentions
"Zoo Med ReptiBreeze Open Air Screen Cage, Extra Large, 24 x 24 x 48-Inches",Pet Products,http://www.amazon.com/dp/B001PHABI8/,3,3
"Exo Terra Jungle Vine, Large",Pet Products,http://www.amazon.com/dp/B003PAY0B2/,4,3
T8 ReptiSun 5.0 UVB Fluorescent Bulb,Pet Products,http://www.amazon.com/dp/B000255OS6/,3,2
Zoo Med Labs Drip System - Little Dripper,Pet Products,http://www.amazon.com/dp/B0002AQE6C/,2,2
Safari Ltd Incredible Creatures Veiled Chameleon Baby Hand-Painted Toy Figurine For Ages 3 And Up,Toy,http://www.amazon.com/dp/B00BB8Q46E/,2,2
"Exo Terra Repti-Glo 5.0 Fluorescent Lamp, 15-Watt/18-Inch",Pet Products,http://www.amazon.com/dp/B0006L11A6/,1,1
"HERPTIVITE Multivitamin for reptiles and amphibians (3.3 oz) Blue Bottle, 1 Pack",Pet Products,http://www.amazon.com/dp/B00076HT3S/,7,1
"Zoo Med Reptile Calcium without Vitamin D3, 8-Ounce",Pet Products,http://www.amazon.com/dp/B000UJPHL8/,3,1
"Zoo Med ReptiBreeze Open Air Screen Cage, Large, 18 x 18 x 36-Inches",Pet Products,http://www.amazon.com/dp/B0027J0VZ6/,1,1
"Chlorhexidine 2% Disinfectant, Cleansing Solution - Gallon",Pet Products,http://www.amazon.com/dp/B0035XR8OU/,1,1
"Mist'r Lizard Junior - 3"" x 11""",Pet Products,http://www.amazon.com/dp/B003M7JQUS/,1,1
Zoo Med Economy Analog Dual Thermometer and Humidity Gauge,Pet Products,http://www.amazon.com/dp/B004PBB1JE/,4,1
192 Feet - 24 Artificial Ivy Vine Fake ivy Silk Greenery Wedding Party Garlands,Home,http://www.amazon.com/dp/B0051QLAMA/,1,1
"Exo Terra Cricket Pen Size: Large (12"" x 8"" x 7.6"")",Pet Products,http://www.amazon.com/dp/B0073KOGOG/,1,1
"Zilla Reptile Habitat Lighting, Terrarium Heat Lamp Halogen Mini Dome",Pet Products,http://www.amazon.com/dp/B009GHI32K/,1,1
"Zilla Reptile Terrarium Heat Lamps Mini Halogen Bulb, Day White, 25W",Pet Products,http://www.amazon.com/dp/B009GHIA6Y/,1,1
"Zoo Med 26053 Reptisun T5-Ho Terrarium Hood, 24""",Pet Products,http://www.amazon.com/dp/B00AQU8F2O/,3,1
"4.25"" Noble Gems Glass Chameleon Lizard Christmas Ornament",Home,http://www.amazon.com/dp/B00EDR8CVK/,1,1
Century Surge Protector with 8 Outlets & Timer,Speakers,http://www.amazon.com/dp/B00MWHQZX0/,1,1
Zoo Med ReptiBreeze Chameleon Kit,Pet Products,http://www.amazon.com/dp/B00PF5PI52/,1,1
"Kingplast Twist Tie with Cutter, Sturdy Green Coated Wire,164-feet,(50 meter) (1960 inch)",Lawn & Patio,http://www.amazon.com/dp/B00Z98X4MO/,1,1
Chameleons: Their Care and Breeding,Book,http://www.amazon.com/dp/0888393539/,1,1
Exo Terra PT2493 Monsoon Multi System,Pet Products,http://www.amazon.com/dp/B01M1BLK2F/,1,1
Mountain Dragons: In Search of Chameleons in the Highlands of Kenya,Book,http://www.amazon.com/dp/0992817609/,1,1
Chameleons: Nature's Hidden Jewels,Book,http://www.amazon.com/dp/1575241374/,1,1
"Zoo Med Deluxe Porcelain Clamp Lamp with 8.5-Inch Dome, Black",Pet Products,http://www.amazon.com/dp/B0002AQCXM/,151,1
"Zilla Slimline Reptile Fluorescent Lighting Fixture with 3-Percent UVB Lamp, 18-Inch",Pet Products,http://www.amazon.com/dp/B0002QI86U/,2,1
