name,category,amazon_link,total_mentions,subreddit_mentions
"South Shore Step One Night Stand, Pure Black",Furniture,http://www.amazon.com/dp/B002TSAE70/,2,2
Black & Decker CM1836 18-Inch 36-Volt Cordless Electric Lawn Mower,Lawn & Patio,http://www.amazon.com/dp/B002YK4V04/,2,2
The Minotaur Takes a Cigarette Break: A Novel,Book,http://www.amazon.com/dp/0312308922/,1,1
"Yesterday, Today, and Tomorrow: School Desegregation and Resegregation in Charlotte",Book,http://www.amazon.com/dp/1612507565/,1,1
Shure SFG-2 Stylus Tracking Force Gauge,Musical Instruments,http://www.amazon.com/dp/B00006I5SD/,19,1
CycleOps Wind Indoor Bicycle Trainer,Sports,http://www.amazon.com/dp/B000BT7HWO/,1,1
"Marpac Dohm-DS All-Natural White Noise Sound Machine, Tan",Health and Beauty,http://www.amazon.com/dp/B000KUHFGM/,64,1
"Intex River Run I Sport Lounge, Inflatable Water Float, 53"" Diameter",Toy,http://www.amazon.com/dp/B000PEOMC8/,7,1
HDTV Antenna Mount - 30in,Speakers,http://www.amazon.com/dp/B000WOVD1Y/,1,1
"Walker Edison 35"" Glass Media Storage Tower, Black",Furniture,http://www.amazon.com/dp/B00166BWZ4/,3,1
Hario Skerton Ceramic Coffee Mill (100g),Kitchen,http://www.amazon.com/dp/B001802PIQ/,122,1
3M 39008 Headlight Lens Restoration System,Automotive Parts and Accessories,http://www.amazon.com/dp/B001AIZ5HY/,40,1
Sigma BC 1009 Bicycle Speedometer,Sports,http://www.amazon.com/dp/B003BCG9EK/,1,1
Daisy MFG Model 10 Air Rifle,Sports,http://www.amazon.com/dp/B003GN8QXG/,1,1
Brush Strokes Firm Military Style Boar Bristle Brush,Health and Beauty,http://www.amazon.com/dp/B0041TBQUO/,13,1
"Office Star High Back ProGrid Back FreeFlex Seat with Adjustable Arms and Multi-Function and Seat Slider, Black Managers Chair",Furniture,http://www.amazon.com/dp/B00450P182/,3,1
Cable Matters Gold Plated DisplayPort to HDTV Cable 6 Feet,PC Accessory,http://www.amazon.com/dp/B004C9P9TM/,25,1
Magnet Steel Bike Bicycle Indoor Exercise Trainer Stand by FDW,Sports,http://www.amazon.com/dp/B004I576SM/,13,1
"Sphere Gadget Technologies Lightphoria, 10,000 Lux Energy Light Lamp",Health and Beauty,http://www.amazon.com/dp/B004JF3G08/,18,1
Kumho Solus KR21 All-Season Tire - 205/65R16  94T,Automotive Parts and Accessories,http://www.amazon.com/dp/B004QL6HH4/,1,1
Sawyer Products SP131 PointOne Squeeze Water Filter System with 3 Pouches,Sports,http://www.amazon.com/dp/B005EHPVQW/,40,1
Zinus 14 Inch SmartBase Mattress Foundation / Platform Bed Frame / Box Spring Replacement / Quiet Noise-Free / Maximum Under-bed Storage,Furniture,http://www.amazon.com/dp/B006MIUM20/,26,1
"Nordic Pure 12x20x1 MERV 10 Pleated AC Furnace Air Filter, Box of 6",Home Improvement,http://www.amazon.com/dp/B006NWO9EM/,1,1
RioRand 4 Mode 1200 Lm Cree Xml T6 Bulb LED Bicycle Bike Headlight Lamp Flashlight Light Headlamp,Sports,http://www.amazon.com/dp/B006QQX3C4/,5,1
Foscam FI8910W Pan & Tilt IP/Network Camera with Two-Way Audio and Night Vision (White),Photography,http://www.amazon.com/dp/B006ZPWS4U/,4,1
4 Element Bowtie Indoor/Outdoor HDTV Antenna - 60 Mile Range,Speakers,http://www.amazon.com/dp/B0074H3IU6/,6,1
WD My Net N750 HD Dual Band Router Wireless N WiFi Router Accelerate HD,Personal Computer,http://www.amazon.com/dp/B007KZQM9Q/,1,1
iFixit Pro Tech Toolkit 70 pcs,Home Improvement,http://www.amazon.com/dp/B007XGWQ2Y/,8,1
Zenaro RSLT81-4FT-15W-5000-ND-IDS-CL LED Tube Lighting T8 Tube,Home Improvement,http://www.amazon.com/dp/B00A3Z6Z5Q/,1,1
Paracord Planet Mil-Spec Commercial Grade 550lb Type III Nylon Paracord 50 feet Orange,Sports,http://www.amazon.com/dp/B00ACL45BW/,1,1
Allen Sports Deluxe 2-Bike Trunk Mount Rack,Automotive Parts and Accessories,http://www.amazon.com/dp/B00ASSQYK4/,2,1
"ASUS VG248QE 24"" Full HD 1920x1080 144Hz 1ms HDMI Gaming Monitor",Personal Computer,http://www.amazon.com/dp/B00B2HH7G0/,312,1
FineVu PRO Full-HD 1080p Car Black Box Video In-Dash CAM w/SONY Exmor CMOS Sensor,Car Audio or Theater,http://www.amazon.com/dp/B00C03QQ4O/,1,1
Gold's Gym 410 Elliptical Stride Trainer,Sports,http://www.amazon.com/dp/B00E9505YI/,1,1
Mohu Antenna Leaf 30 Paper-Thin Indoor HDTV Antenna (MH-110502),Speakers,http://www.amazon.com/dp/B00EWEHEL8/,4,1
"Marpac Dohm-DS All Natural Sound Machine, White",Health and Beauty,http://www.amazon.com/dp/B00HD0ELFK/,40,1
"1byone TV Antenna, 50 Mile Range Amplified HDTV Antenna with Detachable Amplifier Signal Booster, USB Power Supply and 10 Feet Highest Performance Coaxial Cable-Black",Speakers,http://www.amazon.com/dp/B00IF70T4M/,42,1
Motorola IT6-2  DECT 6.0 2-Handset Digital Cordless Home Phone,CE,http://www.amazon.com/dp/B00L61Y864/,1,1
Ergotron 33-396-085 Neo-Flex Dual LCD Lift Stand,Speakers,http://www.amazon.com/dp/B00M1BV1AE/,1,1
"BlackVue DR650S-2CH 16GB with Power Magic Pro, Car Black Box/Car DVR Recorder, Wi-Fi, Full HD, G Sensor, GPS, 16GB SD Card Included, Up To 128GB Support",Speakers,http://www.amazon.com/dp/B00MC4XL2G/,17,1
"BlackVue DR650S-2CH 64GB with Power Magic Pro, Car Black Box/Car DVR Recorder, Wi-Fi, Full HD, G Sensor, GPS, 64GB SD Card Included, Up To 128GB Support",Photography,http://www.amazon.com/dp/B00MC56AXM/,19,1
Spy Tec Mini USB Dash Cam 10 Foot Hardwire Kit for A119 A119S G1W G1WS,Wireless,http://www.amazon.com/dp/B00MH4ZVHO/,35,1
Learn Spanish: Rosetta Stone Spanish (Latin America) - Power Pack,Software,http://www.amazon.com/dp/B00NH9YDPE/,1,1
ARRIS SurfBoard SB6141 DOCSIS 3.0 Cable Modem (Certified Refurbished),Personal Computer,http://www.amazon.com/dp/B00OMDZAV0/,10,1
Thermal Radiation 1000 Degree Heat Resistant Aluminized Suit Fireproof Clothes,Health and Beauty,http://www.amazon.com/dp/B00R8WVSRC/,1,1
"1byone Window Antenna 50 Miles Super Thin Amplified Digital HDTV Antenna with 20ft Coaxial Cable, Extreme Soft Design and Lightweight",Speakers,http://www.amazon.com/dp/B00RFLXC1G/,3,1
"Undetectable Plastic Flask Full Cruise Kit, 9 Pouches in total 3) 8 oz, 3) 16 oz, and 3) 32 oz",Kitchen,http://www.amazon.com/dp/B00SLUOC14/,5,1
Roku 3 Streaming Media Player (4230R) with Voice Search (2015 Model),Home Theater,http://www.amazon.com/dp/B00UJ3IULO/,6,1
"Rexing V1 Car Dash Cam 2.4"" LCD FHD 1080p 170 Degree Wide Angle Dashboard Camera Recorder with Sony Exmor Video Sensor, G-Sensor, WDR, Loop Recording",Wireless,http://www.amazon.com/dp/B00X528FNE/,97,1
"OBD2 Scanner OBDII Code Reader - Scan Tool for Check Engine Light - MS300 Universal Diagnostic for Car, SUV, Truck and Van",Automotive Parts and Accessories,http://www.amazon.com/dp/B011Q18D14/,15,1
V1 Motor 12 Volt DC Portable Mini Air Inflator / Deflator Electric Pump,Sports,http://www.amazon.com/dp/B0122A2XM8/,1,1
"HyperGo After Sports Wipes, Full Body Wipes, Unscented, Hypoallergenic, All Natural Ingredients, Biodegradable (20 Wipes in Resealable Package) (1 Pack)",Boost,http://www.amazon.com/dp/B013VIPNS6/,2,1
"Pettom® Gear Gear 50'x3/4"" Cotton Web Dog Training Leash Lead Black",Pet Products,http://www.amazon.com/dp/B0140KUUSM/,1,1
INNOCUBE Pico Projector DLP 50 Lumens Small Pocket Size HDMI MHL Home Cinema Business Presentation Camping,Office Product,http://www.amazon.com/dp/B014H32TTK/,1,1
ViewTV Outdoor Amplified Antenna - 150 Miles Range - 360° Rotation - Wireless Remote,Speakers,http://www.amazon.com/dp/B017JEF126/,9,1
Samsung C24F390 24-Inch Curved Monitor (Super Slim Design),Personal Computer,http://www.amazon.com/dp/B01CX26WPY/,5,1
Nextbit Robin Factory Unlocked GSM Smartphone - Midnight,Wireless,http://www.amazon.com/dp/B01D3Q8EGY/,13,1
DLPIN External CD Drive Protable External CD-RW Drive DVD-R Combo Burner Writer Player for Laptop Notebook PC Desktop Computer,PC Accessory,http://www.amazon.com/dp/B01EL51X4Q/,2,1
"Nest Cam Outdoor Security Camera, Works with Amazon Alexa",Home Improvement,http://www.amazon.com/dp/B01I3I9L8M/,6,1
"Google Pixel Case, Ringke [FUSION] Precisely Outfitted [Smoke Black][Vital Lift Design] Ultimate Crystal Durable PC Back Flexible Soft Rubber TPU Side Edge Bumper [Drop Protection] Defensive Cover",CE,http://www.amazon.com/dp/B01LXL2O9K/,3,1
4 Pack - Monster THX 900 Ultra-High Speed HDMI Cable - 12 Ft (No Frills Packaging),Speakers,http://www.amazon.com/dp/B01M0QQASS/,1,1
Monoprice Essential Triple Monitor Articulating Arm Desk Mount (116247),Home Theater,http://www.amazon.com/dp/B01M716C56/,1,1
"Soluna Solar Eclipse Glasses - CE and ISO Certified Safe Shades for Direct Sun Viewing, (10 Pack)",Home Improvement,http://www.amazon.com/dp/B01N9T9CZL/,6,1
Captive Audience: The Telecom Industry and Monopoly Power in the New Gilded Age,Book,http://www.amazon.com/dp/0300205708/,1,1
Eclipse Glasses - CE Certified Safe Solar Eclipse Glasses – 10pk Get Mooned Style - Eye Protection,Home Improvement,http://www.amazon.com/dp/B074CH32F9/,1,1
Traffic: Why We Drive the Way We Do (and What It Says About Us),Book,http://www.amazon.com/dp/0307277194/,32,1
