name,category,amazon_link,total_mentions,subreddit_mentions
Budding Heroes - Pocket Reference,Book,http://www.amazon.com/dp/099608133X/,1,1
Wyverns and Watchtowers: Book of Coloring +1,Book,http://www.amazon.com/dp/1547079134/,4,1
Feliciana Meets d'Loup Garou: A Cajun Tall Tale,Book,http://www.amazon.com/dp/158980287X/,1,1
Wacom Bamboo CTL471 Pen Tablet for PC/MAC (Black and Lime),Home Improvement,http://www.amazon.com/dp/B00EVOXM3S/,20,1
XP-Pen Artist22 22-Inch Pen Display Graphic Monitor IPS Monitor Drawing Tablet Dual Monitor,PC Accessory,http://www.amazon.com/dp/B015FP25V6/,2,1
Sea Creature Tiny Giant Isopod Plush Beanbag Stuffed Handfull Size / 6 cm by TSTADVANCE,Toy,http://www.amazon.com/dp/B01N587GJG/,1,1
