name,category,amazon_link,total_mentions,subreddit_mentions
Pixnor Ceramic Glaze Incense Smoke Cone Burner Backflow Censer Tower Holder,Home,http://www.amazon.com/dp/B01LY8KOA4/,5,1
"Crazy Aaron's Thinking Putty, 3.2 Ounce, Super Magnetic Strange Attractor",Toy,http://www.amazon.com/dp/B001BS3FHU/,4,1
Idaho Falls: The Untold Story of America's First Nuclear Accident,Book,http://www.amazon.com/dp/1550225626/,2,1
2LBS Copper Sulfate 99% Pure Powder,Lawn & Patio,http://www.amazon.com/dp/B00KKT8UYY/,1,1
"Blubonic Industries 100% Orange Oil d-Limonene HIGH PURITY Food Grade, Solvent, Medicinal, Cleaner, Degreaser, dLimonene (gallon (32 fl oz x 4))",BISS,http://www.amazon.com/dp/B00508BM18/,1,1
"3-1/2"" Tall Crystal Like Magic Growing Tree",Toy,http://www.amazon.com/dp/B000W9ZC48/,1,1
"Quick Dam  Water Activated Flood Barrier 10 feet, 1-Pack",Home Improvement,http://www.amazon.com/dp/B0085S1VCK/,1,1
"Liquid Crystal Sheet, 30-35C Transition (4x4 inch)",BISS,http://www.amazon.com/dp/B009P8CUAG/,1,1
Uncle Tungsten: Memories of a Chemical Boyhood,Book,http://www.amazon.com/dp/0375704043/,1,1
"Lichtenberg Figures Size 2 x 2 x 3/4""",BISS,http://www.amazon.com/dp/B008DWHOLU/,1,1
Copper Sulfate Pentahydrate - Crystals - 25.2% Cu - 10 Pounds - 99% Pure,Single Detail Page Misc,http://www.amazon.com/dp/B006QFLBJC/,1,1
CHEMILUMINESCENCE KIT BLUE LIGHT KIT,Toy,http://www.amazon.com/dp/B0016P9B4Y/,1,1
In The Swim Pool Bromine Tablets 8 lbs.,Lawn & Patio,http://www.amazon.com/dp/B002WKM3FG/,1,1
"Potassium Iodide, High Purity Crystals, 99.8 % min., 100 grams",BISS,http://www.amazon.com/dp/B008D8161I/,1,1
Learning Resources Primary Science Safety Glasses,Office Product,http://www.amazon.com/dp/B006ZLSWFI/,1,1
"2000ml Graduated Cylinder, Borosilicate 3.3 Glass, Single Metric Scale, Karter Scientific 213I16 (Single)",BISS,http://www.amazon.com/dp/B006UKIBKU/,1,1
"Atlas Glove 620 Atlas Vinylove 12"" Double Dipped Gloves - Small",Home Improvement,http://www.amazon.com/dp/B002PJ0WRK/,1,1
2000ml / 2L Narrow Mouth Erlenmeyer Flask with Heavy Duty Rim,BISS,http://www.amazon.com/dp/B00Q34D0HC/,1,1
"Heathrow Scientific HD15909 Spatula with Flat End and Spoon End, 9"" Overall Length",BISS Basic,http://www.amazon.com/dp/B0061OT1A4/,1,1
Pure Health Discounts Certified 35% Hydrogen Peroxide with 1 oz Bottle Dropper - 32 oz,Health and Beauty,http://www.amazon.com/dp/B01AKIGJW4/,1,1
"ONEDONE Urine Bag Disposable Travel Collection Pee Bag Car Toilet for Men,Women& Children(Pack of 8)",Baby Product,http://www.amazon.com/dp/B01M1I84MH/,1,1
"Potassium Permanganate 150 Grams, Manofohm, READ THE DESCRIPTION",BISS,http://www.amazon.com/dp/B011PNQB5I/,1,1
Mcusta Knives Tactility Knife with Damascus Blade and Indian Rosewood Handle Model 122DR / MC-0122DR,Sports,http://www.amazon.com/dp/B013YRP3A2/,1,1
"Newstone Sodium Polyacrylate - Superabsorbent Diaper Polymer (White, 0.38mm granulars, 50g,1.76oz.)",Major Appliances,http://www.amazon.com/dp/B00DEAL854/,1,1
