name,category,amazon_link,total_mentions,subreddit_mentions
"Oh Joy Sex Toy, Volume 1",Book,http://www.amazon.com/dp/0982343787/,1,1
"Oh Joy Sex Toy, Volume 2",Book,http://www.amazon.com/dp/0982343795/,1,1
"Starting Strength:  Basic Barbell Training, 3rd edition",Book,http://www.amazon.com/dp/0982522738/,141,1
Girl Sex 101,Book,http://www.amazon.com/dp/0983830959/,14,1
Come as You Are: The Surprising New Science that Will Transform Your Sex Life,Book,http://www.amazon.com/dp/1476762090/,133,1
The Boss,eBooks,http://www.amazon.com/dp/B00ENTIAJM/,5,1
"Flameless Candles, Battery Candles Set 4"" 5"" 6"" 7"" 8"" 9"" Pillar Candles Dancing Flame Effect With Remote Timer by Comenzar (Ivory )",Home,http://www.amazon.com/dp/B01M6Z9HTU/,1,1
"Philips Hue 464479 60W Equivalent White and Color Ambiance A19 Starter Kit, 3rd Generation, Works with Amazon Alexa",Home Improvement,http://www.amazon.com/dp/B06Y3QXSGX/,2,1
