name,category,amazon_link,total_mentions,subreddit_mentions
Trashy Town,Book,http://www.amazon.com/dp/0060271396/,1,1
Birds,Book,http://www.amazon.com/dp/0061363049/,1,1
I Stink!,Book,http://www.amazon.com/dp/0064438368/,1,1
"The Chronicles of Chrestomanci, Volume 1: Charmed Life / The Lives of Christopher Chant",Book,http://www.amazon.com/dp/006447268X/,4,1
Pippi Longstocking,Book,http://www.amazon.com/dp/0142402494/,2,1
Danny the Champion of the World,Book,http://www.amazon.com/dp/0142410330/,1,1
Everywhere Babies,Book,http://www.amazon.com/dp/0152053158/,1,1
Just Me and My Dad (Little Critter),Book,http://www.amazon.com/dp/0307118398/,6,1
Richard Scarry's Cars and Trucks and Things That Go,Book,http://www.amazon.com/dp/0307157857/,4,1
Cecil the Pet Glacier,Book,http://www.amazon.com/dp/0375867732/,1,1
Ella Minnow Pea: A Novel in Letters,Book,http://www.amazon.com/dp/0385722435/,6,1
My Book About Me,Book,http://www.amazon.com/dp/0394800931/,1,1
"Needle and Noodle, and other silly stories",Book,http://www.amazon.com/dp/0394841700/,1,1
Mike Mulligan and His Steam Shovel,Book,http://www.amazon.com/dp/0395259398/,1,1
The Mysteries of Harris Burdick,Book,http://www.amazon.com/dp/0395353939/,3,1
Owl Moon,Book,http://www.amazon.com/dp/0399214577/,1,1
Monster mama,Book,http://www.amazon.com/dp/0440832675/,1,1
Everywhere Babies lap board book,Book,http://www.amazon.com/dp/0547510748/,1,1
The Tenth Good Thing About Barney,Book,http://www.amazon.com/dp/0689712030/,9,1
Pitfalls: A Quick Guide to Identifying Logical Fallacies for Families,Book,http://www.amazon.com/dp/0692561390/,1,1
Ten Dogs in the Window,Book,http://www.amazon.com/dp/0735813019/,1,1
The Tale of Three Trees: A Traditional Folktale,Book,http://www.amazon.com/dp/0745917437/,1,1
A Port Through Time,Book,http://www.amazon.com/dp/0756622212/,1,1
A Street Through Time,Book,http://www.amazon.com/dp/0756697921/,1,1
Infinity and Me (Carolrhoda Picture Books),Book,http://www.amazon.com/dp/0761367268/,1,1
Guess How Much I Love You,Book,http://www.amazon.com/dp/0763642649/,7,1
Charley Harper's Count the Birds,Book,http://www.amazon.com/dp/0764972464/,1,1
A Journey Through Time,Book,http://www.amazon.com/dp/0789478870/,1,1
"Goodnight, Goodnight Construction Site",Book,http://www.amazon.com/dp/0811877825/,3,1
The Twins,Book,http://www.amazon.com/dp/0873063406/,1,1
Love You Forever,Book,http://www.amazon.com/dp/0920668372/,8,1
The Fall of Freddie the Leaf: A Story of Life for All Ages,Book,http://www.amazon.com/dp/0943432898/,4,1
Bedtime Math: A Fun Excuse to Stay Up Late (Bedtime Math Series),Book,http://www.amazon.com/dp/1250035856/,1,1
The 13-Story Treehouse (The Treehouse Books),Book,http://www.amazon.com/dp/1250070651/,1,1
My Father Knows the Names of Things,Book,http://www.amazon.com/dp/1416948953/,1,1
National Geographic Kids Bird Guide of North America,Book,http://www.amazon.com/dp/1426310943/,1,1
A City Through Time,Book,http://www.amazon.com/dp/1465402497/,1,1
PAJAMA BEDTIME BEAR'S BIRTHDAY PARTY (Pajama Bedtime P.B. Bear),Book,http://www.amazon.com/dp/1564583805/,2,1
The Sea Tiger,Book,http://www.amazon.com/dp/1783700076/,1,1
Fantastic Stories (Fantastic World of Terry Jones),Book,http://www.amazon.com/dp/1843651629/,1,1
I Found a Dead Bird: The Kids' Guide to the Cycle of Life and Death,Book,http://www.amazon.com/dp/1897066708/,1,1
Milo's Special Words,Book,http://www.amazon.com/dp/B0064XPXV8/,1,1
Greatest Hits,Digital Music Album,http://www.amazon.com/dp/B01I5UOV9C/,1,1
Greatest Hits (Amazon Exclusive),Music,http://www.amazon.com/dp/B01K2AIKZY/,1,1
