name,category,amazon_link,total_mentions,subreddit_mentions
"Marshall Pet Products Pet Deluxe Play Pen, Small",Pet Products,http://www.amazon.com/dp/B0013TT2SS/,6,2
ABO Gear Happy Habitat for Indoor Cats,Pet Products,http://www.amazon.com/dp/B002KWHE1E/,10,2
Kaytee Lava Ledge (Assorted Colors),Pet Products,http://www.amazon.com/dp/B00176F466/,9,2
"Chinchilla Metal Wheel, 16 Inch Chinchilla Exercise Wheel: the Upgraded ChillaWheel",Pet Products,http://www.amazon.com/dp/B00O74S7IC/,2,2
"Kaytee Chinchilla Bath House, Colors Vary",Pet Products,http://www.amazon.com/dp/B0002AS5M8/,3,2
"ProSelect Stainless Steel Coop Cups — Versatile Coop Cups for Pet and Animal Cages, 16-Ounce",Pet Products,http://www.amazon.com/dp/B000GDVUE6/,1,1
"MidWest Foldable Metal Exercise Pen / Pet Playpen, 24""W x 24""H",Pet Products,http://www.amazon.com/dp/B000H904WI/,10,1
"Kaytee Small Animal Ka-Bob Chew Dispenser Toy, Large",Pet Products,http://www.amazon.com/dp/B00176F664/,1,1
3M 6391 P100 Reusable Respirator Gas Mask - Large,Home Improvement,http://www.amazon.com/dp/B001NDN29O/,15,1
"Prevue Hendryx 490 Pet Products Corner Ferret Cage, Black Hammertone",Pet Products,http://www.amazon.com/dp/B001W8TZ8W/,2,1
"SupremePetfoods Charlie Chinchilla Food, 2-Pound",Pet Products,http://www.amazon.com/dp/B0030N1QZ2/,1,1
"GermGuardian AC4825 3-in-1 Air Purifier with True HEPA Filter, UV-C Sanitizer, Captures Allergens, Smoke, Odors, Mold, Dust, Germs, Pets, Smokers, 22-Inch Germ Guardian Air Purifier",Health and Beauty,http://www.amazon.com/dp/B004VGIGVY/,32,1
"MidWest Deluxe Ferret Nation Double Unit Ferret Cage (Model 182) Includes 2 leak-Proof Pans, 2 Shelves, 3 Ramps w/ Ramp Covers & 4 locking Wheel Casters, Measures 36""L x 25""W x 62.5""H Inches",Pet Products,http://www.amazon.com/dp/B0054U8UGW/,3,1
Hemp Rope 4mm 9.84 Feet/Pkg-Natural,Art and Craft Supply,http://www.amazon.com/dp/B006FZ3DPS/,1,1
"Lixit Animal Care Savic Toilet Home Nestor Cat Litter Box, Cold Grey/White",Pet Products,http://www.amazon.com/dp/B008B9ZMBO/,1,1
"3M Half Facepiece Reusable Respirator Assembly 6191/07001(AAD), P100 Respiratory Protection, Small",BISS Basic,http://www.amazon.com/dp/B008MCUVN4/,2,1
The Original ChillaWheel Large Metal 16 Inch Chinchilla Exercise Wheel,Pet Products,http://www.amazon.com/dp/B00KQ078Q8/,1,1
"ToysOpoly Pet Playpen 45"" Exercise Puppy Pen Kennel - Best for Dogs and Cats Safe in Their Play-pen While Protecting The Little Kids - Folding Design Easy Storage (Pink)",Pet Products,http://www.amazon.com/dp/B013Q7FGEI/,2,1
"Amcrest IP2M-841 ProHD 1080P (1920TVL) Wireless WiFi IP Camera, Black",Photography,http://www.amazon.com/dp/B0145OQTPG/,21,1
"ESK Collection 48"" Pet Puppy Dog Playpen Exercise Pen Kennel 600d Oxford Cloth Black",Pet Products,http://www.amazon.com/dp/B0154M1VWE/,3,1
Uber Appliance UB-XL1-RED Chill 12 Can Retro Personal Mini Fridge,Kitchen,http://www.amazon.com/dp/B01FCKJ9JK/,1,1
WINOMO Small Pet Hammock Hamster Hanging Toy Snuggle Hut for Squirrel Chinchilla Guinea Pig Rat Mice,Pet Products,http://www.amazon.com/dp/B01NAPQIGL/,1,1
"Lixit 30-0370-024 Glass Water Bottle for Birds and Small Animals, 8-Ounce",Pet Products,http://www.amazon.com/dp/B0002RSX64/,1,1
"Oxbow Animal Health Chinchilla Deluxe Fortified Small Animal Feeds, 5-Pound",Pet Products,http://www.amazon.com/dp/B0009X49J6/,1,1
Kaytee My First Home Deluxe Multi-Level Pet Home with Casters,Pet Products,http://www.amazon.com/dp/B000CMHWZC/,1,1
Cord Protector - CritterCord - A New Way to Protect Your Pet from Chewing Hazardous Cords,Pet Products,http://www.amazon.com/dp/B000EH2I5O/,4,1
