name,category,amazon_link,total_mentions,subreddit_mentions
Healing Back Pain: The Mind-Body Connection,Book,http://www.amazon.com/dp/0446557684/,3,2
"Full Catastrophe Living (Revised Edition): Using the Wisdom of Your Body and Mind to Face Stress, Pain, and Illness",Book,http://www.amazon.com/dp/0345536932/,6,1
The Mountain Krakitten Kitten Kraken Adult Blue T-shirt L,Apparel,http://www.amazon.com/dp/B00WF8U0WI/,2,1
The Pain Survival Guide: How to Reclaim Your Life (APA Lifetools),Book,http://www.amazon.com/dp/1591470498/,1,1
"Home Basics Bamboo Breakfast Bed Tray, Natural",Home,http://www.amazon.com/dp/B004RF1UJO/,1,1
