name,category,amazon_link,total_mentions,subreddit_mentions
The Coming of Conan the Cimmerian: The Original Adventures of the Greatest Sword and Sorcery Hero of All Time!,Book,http://www.amazon.com/dp/0345461517/,16,3
"The Bloody Crown of Conan (Conan of Cimmeria, Book 2)",Book,http://www.amazon.com/dp/0345461525/,6,1
"The Conquering Sword of Conan (Conan of Cimmeria, Book 3)",Book,http://www.amazon.com/dp/0345461533/,6,1
The Horror Stories of Robert E. Howard,Book,http://www.amazon.com/dp/0345490207/,4,1
Conan's Brethren: The Complete Collection,Book,http://www.amazon.com/dp/0575089873/,2,1
The Robert E. Howard Omnibus: 99 Collected Stories (Halcyon Classics),eBooks,http://www.amazon.com/dp/B003O86R5M/,1,1
