name,category,amazon_link,total_mentions,subreddit_mentions
Sennheiser GAME ONE Gaming Headset - Black,Personal Computer,http://www.amazon.com/dp/B00KK8ZLEC/,14,2
D'Addario Varigrip Adjustable Hand Exerciser,Musical Instruments,http://www.amazon.com/dp/B001OCGGEM/,13,1
AmazonBasics HDMI to DVI  Adapter Cable - 9.8 Feet (3 Meters),Speakers,http://www.amazon.com/dp/B001TH7T2U/,12,1
"Paco Rabanne 1 Million Eau de Toilette Spray for Men, 3.4 Fluid Ounce",Beauty,http://www.amazon.com/dp/B002XQ1X4G/,1,1
"ASUS VS248H-P 24"" Full HD 1920x1080 2ms HDMI DVI VGA Back-lit LED Monitor",Personal Computer,http://www.amazon.com/dp/B0058UUR6E/,31,1
"ASUS VS238H-P 23"" Full HD 1920x1080 2ms HDMI DVI VGA Back-lit LED Monitor",Personal Computer,http://www.amazon.com/dp/B005BZNEVQ/,15,1
"TP-Link N300 Wireless Mini USB Adapter, Ideal for Raspberry Pi (TL-WN823N)",Personal Computer,http://www.amazon.com/dp/B0088TKTY2/,5,1
Call of Duty: Ghosts - PlayStation 4,Video Games,http://www.amazon.com/dp/B00D4WTO1M/,4,1
"ASUS 22-inch Full HD Ultra Slim Gaming Monitor [VX228H] 1080p, 1ms Rapid Response Time, Dual HDMI, Built in Speakers, Low Blue Light, Fliker Free, ASUS EyeCare",Personal Computer,http://www.amazon.com/dp/B00FXOTJAA/,6,1
"Vayper Computer gaming glasses - block blue light, Anti-glare and minimize digital eye strain - Perform better, target objects on screen easier, prevent headaches, sleep better, reduce eye fatigue",Video Games,http://www.amazon.com/dp/B00GC1WFEA/,1,1
"HyperX KHX-H3CL/WR Cloud Gaming Headset for PC, Xbox One, Xbox One S, PS4, PS4 Pro, Mac, Mobile and VR - Black",Personal Computer,http://www.amazon.com/dp/B00JJNQG98/,145,1
"HyperX KHX-H3CLW Cloud Gaming Headset for PC, Xbox One, Xbox One S, PS4, PS4 Pro, Mac, Mobile and VR - White",Personal Computer,http://www.amazon.com/dp/B00KX3TLF4/,16,1
"ConsoleTuner Titan One for PS4, Xbox One, PS3 and Xbox 360",Video Games,http://www.amazon.com/dp/B00LH5XZQS/,9,1
MSI GE Series GE70 Apache Pro-681 17.3-Inch Gaming Laptop (Aluminum Black),Personal Computer,http://www.amazon.com/dp/B00TI6TASK/,8,1
ASTRO Gaming A40 TR Headset + MixAmp Pro TR for PlayStation 4,Video Games,http://www.amazon.com/dp/B014F77FGA/,5,1
Sentey Headphones with Microphone Audiophile Headset Metal Band for Travel Work Gaming Running Sport Transport Carrying Case Included Over the Ear Cups Rotation Volume Control Portable,Speakers,http://www.amazon.com/dp/B014LMX5AY/,6,1
Aurum Cables 6 Feet Cat6 Snagless Network Ethernet Patch Cable - Green - 5 Pack,PC Accessory,http://www.amazon.com/dp/B0186AVWCU/,1,1
PlayStation Gold Wireless Headset - Uncharted 4 Limited Edition,Video Games,http://www.amazon.com/dp/B01BEELH70/,2,1
"BenQ ZOWIE 24 inch Full HD Gaming Monitor - 1080p 1ms Response Time for Competitive eSports Gaming, Dual HDMI, DVI-D, D-Sub (RL2455)",Personal Computer,http://www.amazon.com/dp/B01H5KKRLO/,30,1
Tite Grip II All-Sport Topical Antiperspirant Hand Lotion/Non-Slip Grip Enhancement,Sports,http://www.amazon.com/dp/B0015R4AUS/,3,1
Call of Duty: WWII - Xbox One Standard Edition,Video Games,http://www.amazon.com/dp/B072NQJCW5/,1,1
