name,category,amazon_link,total_mentions,subreddit_mentions
Body Mind Mastery: Training For Sport and Life,Book,http://www.amazon.com/dp/1577310942/,5,1
BenQ GL2460HM 24-Inch FHD 1920x1080 LED Monitor 2ms Response Time HDMI DVI,Personal Computer,http://www.amazon.com/dp/B00IKDFL4O/,38,1
"HyperX Cloud Gaming Headset for PC, Xbox One¹, PS4, PS4 PRO, Xbox One S¹, Nnintedo Switch (KHX-H3CL/WR) - Black",Personal Computer,http://www.amazon.com/dp/B00JJNQG98/,145,1
"Microsoft Lumia 650 (RM-1154) 16GB Black, 5"", Dual Sim, Unlocked International Model, No Warranty",Wireless Device,http://www.amazon.com/dp/B01DV48PCQ/,2,1
"BenQ ZOWIE 24 inch Full HD Gaming Monitor - 1080p 1ms Response Time for Competitive eSports Gaming, Dual HDMI, DVI-D, D-Sub (RL2455)",Personal Computer,http://www.amazon.com/dp/B01H5KKRLO/,30,1
BenQ ZOWIE 24 inch Full HD Gaming Monitor - 1080p 1ms Response Time Head-to-Head Console Gaming (RL2460),Personal Computer,http://www.amazon.com/dp/B01H5KKRLY/,3,1
