name,category,amazon_link,total_mentions,subreddit_mentions
The Analects (Penguin Classics),Book,http://www.amazon.com/dp/0140443487/,1,1
Mencius (Penguin Classics),Book,http://www.amazon.com/dp/014044971X/,1,1
"Zhu Xi's Reading of the Analects: Canon, Commentary, and the Classical Tradition (Asian Studies)",Book,http://www.amazon.com/dp/0231128657/,1,1
"Learning to Be A Sage: Selections from the Conversations of Master Chu, Arranged Topically",Book,http://www.amazon.com/dp/0520065255/,1,1
Utilitarian Confucianism: Ch'en Liang's Challenge to Chu Hsi (Harvard East Asian Monographs),Book,http://www.amazon.com/dp/0674931769/,1,1
