name,category,amazon_link,total_mentions,subreddit_mentions
"At the Dark End of the Street: Black Women, Rape, and Resistance--A New History of the Civil Rights Movement from Rosa Parks to the Rise of Black Power",Books,https://www.amazon.com/At-Dark-End-Street-Resistance-A/dp/0307389243/ref=cm_cr_pr_product_top?ie=UTF8,5,2
"SSK Black Power - African American Outdoor Flag - Black Lives Matter Banner - Large 3' x 5', Weather-Resistant Polyester","Patio, Lawn & Garden",https://www.amazon.com/SSK-Black-Power-Weather-Resistant-Polyester/dp/B00563C7H0/ref=redir_mobile_desktop?_encoding=UTF8&amp%3Bamp%3Bkeywords=Black%20Power%20flag&amp%3Bamp%3Bpi=SL75_QL70&amp%3Bamp%3Bsr=8-1&qid=1435773131&ref_=mp_s_a_1_1,2,2
Red Republicans and Lincoln's Marxists: Marxism in the Civil War,Books,https://www.amazon.com/dp/0595446981/?tag=mh0b-20&amp;hvadid=3487913313&amp;hvqmt=e&amp;hvbmt=be&amp;hvdev=c&amp;ref=pd_sl_gt0qb4oqf_e,2,1
New Badge Button Pin Black Panther Party for Self-defense Bpp Retro 60s 1960s,"Clothing, Shoes & Jewelry",https://www.amazon.com/Badge-Button-Black-Panther-Self-defense/dp/B00W4TSW6O/ref=sr_1_9?ie=UTF8&amp;amp;qid=1435089421&amp;amp;sr=8-9&amp;amp;keywords=black+panther+party,1,1
Tribute To The Black Panther Party T-Shirt 100% Premium Cotton,"Clothing, Shoes & Jewelry",https://www.amazon.com/Black-Panther-T-Shirt-Colours-Medium/dp/B00KDBAKZQ/ref=sr_1_2?ie=UTF8&amp;amp;qid=1435089421&amp;amp;sr=8-2&amp;amp;keywords=black+panther+party,1,1
Lewispaul Kids Design X-small Tshirts Particular Black Panther Party White,Sports & Outdoors,https://www.amazon.com/Lewispaul-X-small-Tshirts-Particular-Panther/dp/B00ZXS50UE/ref=sr_1_16?ie=UTF8&amp;amp;qid=1435089421&amp;amp;sr=8-16&amp;amp;keywords=black+panther+party,1,1
Patch Iron on Sew on Black Panther Party 2.76 Inch / 2.76 Inch,Home & Kitchen,https://www.amazon.com/Patch-Iron-Black-Panther-Party/dp/B00X5T3Z32/ref=sr_1_30?ie=UTF8&amp;amp;qid=1435089534&amp;amp;sr=8-30&amp;amp;keywords=black+panther+party,1,1
Glome's Saga: Vikings in America,Books,https://www.amazon.com/Glomes-Saga-Vikings-Billy-Roper/dp/1507845871/ref=la_B00NQC39C0_1_7?s=books&amp;ie=UTF8&amp;qid=1437663602&amp;sr=1-7,1,1
PaleoAmerican Ethnic Diversity: Ancient Europeans in North America,Books,https://www.amazon.com/PaleoAmerican-Ethnic-Diversity-Ancient-Europeans/dp/1502721570/ref=sr_1_5?ie=UTF8&amp;qid=1437663560&amp;sr=8-5&amp;keywords=billy+roper,1,1
The Mayan Prophecies : Unlocking the Secrets of a Lost Civilization,Books,https://www.amazon.com/The-Mayan-Prophecies-Unlocking-Civilization/dp/1852309067,1,1
"Clorox Disinfecting Wipes, Fresh Scent - 4 Pack - 105 Each","Health, Household & Baby Care",https://www.amazon.com/Clorox-Disinfecting-Wipes-Fresh-Canister/dp/B0036B89QC/,1,1
Custom Leathercraft 1100 Multi-Purpose Clip-on Zippered Poly Bags,Tools & Home Improvement,https://www.amazon.com/Custom-Leathercraft-1100-Multi-Purpose-Zippered/dp/B0002YVBC0,1,1
Occasional discourse on the Nigger question,Books,https://www.amazon.com/Occasional-discourse-Nigger-question-Carlyle/dp/1429718218,1,1
"Connect Core Concepts in Health, Brief, 13th Edition",Books,https://www.amazon.com/Connect-Core-Concepts-Health-Brief/dp/0078028531/ref=sr_1_2?s=books&amp;ie=UTF8&amp;qid=1437581057&amp;sr=1-2,1,1
Governor Henry Ellis and the Transformation of British North America,Books,https://www.amazon.com/Governor-Henry-Transformation-British-America/dp/0820331252,1,1
Why Black Men Love White Women: Going Beyond Sexual Politics to the Heart of the Matter,Books,https://www.amazon.com/Why-Black-Love-White-Women/dp/1416595422,1,1
"Fruit of the Earth Aloe Vera 100% Gel, 24 oz (680 g)",Beauty & Personal Care,https://www.amazon.com/Fruit-Earth-Aloe-Vera-100/dp/B000ALDK1A,1,1
