name,category,amazon_link,total_mentions,subreddit_mentions
Seiko 5 Black Dial Stainless Steel Automatic Mens Watch SNZF17,Watch,http://www.amazon.com/dp/B001IBF15Y/,13,1
Daniel Wellington Men's 0206DW Sheffield Watch with Black Leather Band,Watch,http://www.amazon.com/dp/B00BKQT85G/,4,1
"Carhartt Men's Rain Defender Paxton Heavyweight Hooded Sweatshirt,Black,X-Large",Apparel,http://www.amazon.com/dp/B00FXPSE96/,1,1
"Hanes Men's Pullover EcoSmart Fleece Hoodie, Light Blue, Large",Apparel,http://www.amazon.com/dp/B00JUM42L2/,1,1
Gildan Heavy Blend Adult Unisex Hooded Sweatshirt / Hoodie Black - X-Large,Apparel,http://www.amazon.com/dp/B011LNK2ZM/,7,1
"Fruit of the Loom Men's Hooded Sweatshirt, Navy, Medium",Apparel,http://www.amazon.com/dp/B0196XANN0/,1,1
