name,category,amazon_link,total_mentions,subreddit_mentions
The Best Ever Book of Norwegian Jokes: Lots and Lots of Jokes Specially Repurposed for You-Know-Who,Book,http://www.amazon.com/dp/1469916207/,1,1
The Best Ever Book of Swedish Jokes: Lots and Lots of Jokes Specially Repurposed for You-Know-Who,Book,http://www.amazon.com/dp/1469916967/,1,1
Putin's Kleptocracy: Who Owns Russia?,Book,http://www.amazon.com/dp/1476795193/,4,1
Inverting The Pyramid: The History of Soccer Tactics,Book,http://www.amazon.com/dp/1568587384/,24,1
A People's History of Tottenham Hotspur Football Club: How Spurs Fans Shaped the Identity of One of the World’s Most Famous Clubs,Book,http://www.amazon.com/dp/1785311883/,1,1
The Biography of Tottenham Hotspur: the incredible story of the world famous Spurs,Book,http://www.amazon.com/dp/1909534501/,1,1
"The WineRack 200-008 The Wine Rack, Medium",Kitchen,http://www.amazon.com/dp/B001FYZZI2/,40,1
"TOTTENHAM HOTSPUR Official Merchandise Football Club Sports Accessories, Gifts & Stationary Items. (Tottenham Official Crest Pin Badge)",Sports,http://www.amazon.com/dp/B00F52BX36/,1,1
Tottenham Established Flag,Sports,http://www.amazon.com/dp/B00O30ECKW/,1,1
Manchester United Season Review 2014/15 [DVD],DVD,http://www.amazon.com/dp/B00XNKTTU6/,1,1
Liverpool Football Club Season Review 2014/2015 [2 DVDs] [UK Import],DVD,http://www.amazon.com/dp/B00Y30QE3K/,1,1
Everton Season Review 2013/14,DVD,http://www.amazon.com/dp/B01GWEB0U6/,1,1
