name,category,amazon_link,total_mentions,subreddit_mentions
Crash Bandicoot N. Sane Trilogy - PlayStation 4 Standard Edition,Video Games,http://www.amazon.com/dp/B01NAGTKX3/,5,3
The Sly Collection - Playstation 3,Video Games,http://www.amazon.com/dp/B003O680RM/,4,1
DualShock 4 Wireless Controller for PlayStation 4 - 20th Anniversary Edition,Video Games,http://www.amazon.com/dp/B00ZSDTIGG/,5,1
Official Crash Bandicoot Pin Badge Set,Apparel,http://www.amazon.com/dp/B071SDBBQV/,1,1
Official Crash Bandicoot Crash Wallet,Apparel,http://www.amazon.com/dp/B072C2N3N1/,1,1
