name,category,amazon_link,total_mentions,subreddit_mentions
Bev and Bob Style Worldwide Baby! [Explicit],Digital Music Album,http://www.amazon.com/dp/B0178TJMSG/,3,2
"The Moby, World’s Largest Retail Dildo, 3 Ft",Health and Beauty,http://www.amazon.com/dp/B00MOTE1Y6/,36,2
Stop Hoping... Start Hunting! A Job Seeker's Guide to Finding Their Job,Book,http://www.amazon.com/dp/0986041602/,1,1
Hollywood Causes Cancer: The Tom Green Story,Book,http://www.amazon.com/dp/1400052777/,1,1
Not Guilty by Reason of Insanity,Book,http://www.amazon.com/dp/144047558X/,2,1
Shot of Tequila: A Jack Daniels Thriller (Jacqueline Jack Daniels Mystery),Book,http://www.amazon.com/dp/1453885765/,1,1
The Future Capitalist: A Guide to Success,Book,http://www.amazon.com/dp/146116916X/,1,1
Natural Harvest: A collection of semen-based recipes,Book,http://www.amazon.com/dp/1481227041/,160,1
AKG K 240 Semi-Open Studio Headphones,Musical Instruments,http://www.amazon.com/dp/B0001ARCFA/,53,1
Royal Magic Silver Appearing Cane From by Royal Magic,Jewelry,http://www.amazon.com/dp/B000TGSROQ/,1,1
"Original Looks Silicone Bra Inserts and Enhancers, One Size Fits All",Health and Beauty,http://www.amazon.com/dp/B000VSGPBO/,6,1
Appearing 8 Foot Pole,Toy,http://www.amazon.com/dp/B0016A4TNM/,1,1
"Comply Foam Premium Earphone Tips - Isolation T-400 (Platinum, 3 Pairs, Medium)",Speakers,http://www.amazon.com/dp/B001DXGBII/,4,1
BAGGY GYM WORKOUT PANTS-USA FLAG PRINT,Apparel,http://www.amazon.com/dp/B001KWAGXI/,3,1
Egg Topper Cutter Clipper Stainless Kitchen Gadget,Kitchen,http://www.amazon.com/dp/B002R7O190/,8,1
Music from the Original Series Breaking Bad,Music,http://www.amazon.com/dp/B003MQNDVM/,1,1
Sennheiser HD 558 Headphones,Speakers,http://www.amazon.com/dp/B004FEEY9A/,134,1
Tascam TA1VP Vocal Producer Processor With Antares Autotune,Musical Instruments,http://www.amazon.com/dp/B004OA6JU2/,2,1
OXO Good Grips Zester and Grater,Kitchen,http://www.amazon.com/dp/B004VLYQGS/,1,1
"Passion Lubes, Natural Water-Based Lubricant, 55 Gallon Drum",Health and Beauty,http://www.amazon.com/dp/B005MR3IVO/,713,1
BACH & ODIN HDX-707 PROFESSIONAL SERIES 5.1 HOME THEATER SYSTEM,CE,http://www.amazon.com/dp/B008LUM1DU/,1,1
PanOxyl Acne Foaming Wash 10% Benzoyl Peroxide 5.5 oz (156 g),Beauty,http://www.amazon.com/dp/B00BD1BXJM/,2,1
Pocket Underwear from Stashitware. Pickpocket Proof. Made for Travel.,Apparel,http://www.amazon.com/dp/B00DCEGWZI/,8,1
"Mini Thin 2 Way Action 8 X 4's Hi Speed Energy, Enhanced Stamina",Health and Beauty,http://www.amazon.com/dp/B00E44GZKM/,1,1
Pappalach Mitzvah Puppets Set of 4 Hand,Toy,http://www.amazon.com/dp/B00GPYK1T0/,1,1
"EVGA SuperNOVA 750 G2, 80+ GOLD 750W, Fully Modular, EVGA ECO Mode, 10 Year Warranty, Includes FREE Power On Self Tester Power Supply 220-G2-0750-XR",Personal Computer,http://www.amazon.com/dp/B00IKDETOW/,34,1
"Elon Musk: Tesla, SpaceX, and the Quest for a Fantastic Future",eBooks,http://www.amazon.com/dp/B00KVI76ZS/,4,1
Grado SR80e Prestige Series Headphones,CE,http://www.amazon.com/dp/B00L1LXOWS/,19,1
The Burned-Out Blogger's Guide to PR,eBooks,http://www.amazon.com/dp/B00NFAT238/,1,1
"NZXT S340 Mid Tower Computer Case,  Matte Black/Blue (CA-S340MB-GB)",Personal Computer,http://www.amazon.com/dp/B00T4BWV6C/,2,1
Million Dollar Cup of Water: Discovering the Wealth in Authenticity,eBooks,http://www.amazon.com/dp/B00UIFEHV0/,3,1
Dominated on Video: A Double Bundle (Captured On Video Book 6),eBooks,http://www.amazon.com/dp/B015L7L6F4/,1,1
Homall Gaming Chair Executive Swivel Office Chair Leather Desk Chair Racing Style High-back Gaming Chair Padded Armrests Task Chair Mesh Bucket Seat and Computer Lumbar Support (Red),Office Product,http://www.amazon.com/dp/B017VQAXIY/,10,1
Titanfall 2 Officially Licensed OGIO Backpack,Sports,http://www.amazon.com/dp/B01GVJU0OY/,4,1
"Gimars Memory Foam Set Keyboard Wrist Rest Pad & Mouse Wrist Rest Support For Office, Computer, Laptop, & Mac - Durable & Comfortable & Lightweight For Easy Typing & Pain Relief",Office Product,http://www.amazon.com/dp/B01M11FLUJ/,3,1
QuiqLiteX Hands Free Pocket Concealable Flashlight (Various LED Color Options),Sports,http://www.amazon.com/dp/B01MZZ7JXR/,1,1
Tears of a Clown: Glenn Beck and the Tea Bagging of America,Book,http://www.amazon.com/dp/0385533888/,1,1
"Self Balancing Scooter Hoverboard UL2272 Certified, w/ Bluetooth Speaker and LED Light (Rose Gold)",Sports,http://www.amazon.com/dp/B06X14QSX1/,1,1
The Boy Who Cried Wolf,Book,http://www.amazon.com/dp/0689874332/,1,1
