name,category,amazon_link,total_mentions,subreddit_mentions
"Clover 3672 Amour Crochet Hook Set, 10 sizes",Art and Craft Supply,http://www.amazon.com/dp/B00B2CCA6W/,10,8
"Stanwood Needlecraft Large Metal Yarn/Fiber/Wool/String Ball Winder, 10-Ounce",Art and Craft Supply,http://www.amazon.com/dp/B0078T6KQY/,3,3
"Clover Takumi Getaway Soft Touch Crochet Hooks Gift Set, 8 Sizes",Art and Craft Supply,http://www.amazon.com/dp/B0016N3PKW/,3,3
"Blue Demon  ER316L X 1/16"" X 36"" X 1# Tube stainless steel TIG welding rod",Home Improvement,http://www.amazon.com/dp/B00GJU7HTW/,3,2
Crocheted Sea Creatures: A Collection of Marine Mates to Make,Book,http://www.amazon.com/dp/1861087578/,2,2
"Crochet Hooks Set,Ergonomic Grip,Best Crochet Hook in Case,Great Crochet Starter Kit,Easy Handle Crochet Needles,Large-eye Blunt Needles Steel Yarn Knitting Needles Sewing Needles",Art and Craft Supply,http://www.amazon.com/dp/B00UC0QETY/,2,2
"Freeform Crochet and Beyond: Bags, Cushions, Hats, Scarves and More (Milner Craft Series)",Book,http://www.amazon.com/dp/186351385X/,2,2
Singer Knitting Machine,Art and Craft Supply,http://www.amazon.com/dp/B000GPTR62/,2,2
Amigurumi Two!: Crocheted Toys for Me and You and Baby Too,eBooks,http://www.amazon.com/dp/B00FQWB1AA/,,1
Cats in Hats: 30 Knit and Crochet Hat Patterns for Your Kitty,Book,http://www.amazon.com/dp/0762456639/,3,1
From Needles to Hook: Complete Guide to Converting Knit Patterns to Crochet,Book,http://www.amazon.com/dp/157367124X/,2,1
"Susan Bates Finishing Value Pack Knitting Needle, Assorted",Art and Craft Supply,http://www.amazon.com/dp/B009CFU48W/,2,1
"Stanwood Needlecraft Wooden Umbrella Swift Yarn Winder, Medium",Art and Craft Supply,http://www.amazon.com/dp/B000IG1I8O/,2,1
Yarn Ball Winder,Art and Craft Supply,http://www.amazon.com/dp/B015HR7X9G/,2,1
Animal Heads: Trophy Heads to Crochet,Book,http://www.amazon.com/dp/178494064X/,1,1
Every Which Way Crochet Borders: 139 Patterns for Customized Edgings,Book,http://www.amazon.com/dp/1612127401/,1,1
Kays Crochet Hook Key Chain Red Size 5.00 mm,Art and Craft Supply,http://www.amazon.com/dp/B00KIPCZT6/,1,1
Literary Yarns: Crochet Projects Inspired by Classic Books,Book,http://www.amazon.com/dp/1594749604/,1,1
Once Upon a Time . . . in Crochet: 30 Amigurumi Characters from Your Favorite Fairytales,Book,http://www.amazon.com/dp/178221092X/,1,1
Retro Crochet Hooks Set Ergonomic Grip Handle - Crochet Knitting Needles Knit Kit in Case - Great Gift for Her!,Art and Craft Supply,http://www.amazon.com/dp/B06W5MS6KP/,1,1
Artistic Wire Nylon Jaw Pliers,Art and Craft Supply,http://www.amazon.com/dp/B0018N61JM/,1,1
"Damero New Canvas Crochet Hooks Wrap Knitting/Crochet Accessories Pouch Craft Tools Organizer Bag, Plum Flowers--(Not Accessories Included)",Art and Craft Supply,http://www.amazon.com/dp/B01H6ZTDK4/,1,1
"Knitter's Pride N/10mm Trendz Tunisian Double Ended Crochet Hook, 12""",Art and Craft Supply,http://www.amazon.com/dp/B0176DI7SA/,1,1
"Lion Brand Yarn 400-5-5002 Large-Eye Blunt Needles, Set of 6",Art and Craft Supply,http://www.amazon.com/dp/B0021GN2BA/,1,1
"Clover 3673 Amour Crochet Hook Set with Zippered Case, Size 10, Neon Green with Hot Pink Trim",Art and Craft Supply,http://www.amazon.com/dp/B00B2CECEU/,1,1
Susan Bates Yarn and Thread Cutter Pendant,Art and Craft Supply,http://www.amazon.com/dp/B0052YV1S4/,1,1
"Knitter's Pride K/6.5mm Trendz Tunisian Double Ended Crochet Hook, 12""",Art and Craft Supply,http://www.amazon.com/dp/B0176DI3JS/,1,1
"Knitter's Pride L/8mm Trendz Tunisian Double Ended Crochet Hook, 12""",Art and Craft Supply,http://www.amazon.com/dp/B0176DI7N0/,1,1
elann Soft Embrace 4-Ply Yarn | 10 Ball Bag | Limoges Blue-13,Art and Craft Supply,http://www.amazon.com/dp/B00UQY1O2S/,1,1
Contemporary Crochet: 37 European Designs,Book,http://www.amazon.com/dp/1564778975/,1,1
"Around the Corner Crochet Borders: 150 Colorful, Creative Edging Designs with Charts and Instructions for Turning the Corner Perfectly Every Time",Book,http://www.amazon.com/dp/1603425381/,1,1
"Clover Yarn Cutter Pendant, Antique Silver",Art and Craft Supply,http://www.amazon.com/dp/B000WV1YC0/,1,1
Bulk Buy: Red Heart Boutique Unforgettable Yarn (3-Pack) Sunrise E793-3977,Art and Craft Supply,http://www.amazon.com/dp/B012Y1HLGI/,1,1
"Bobbin Winder Yarn Winder Table Clasp, Marrywindix Hand Operated Manual Wool Winder Holder for Swift Yarn Fiber String Ball",Art and Craft Supply,http://www.amazon.com/dp/B00R7GGTCI/,1,1
MassMall® Mix Color Knitting Stitch Counter Crochet Locking Stitch Markers Stitch Needle Clip (Color Ship Randomly) (100Pcs),Art and Craft Supply,http://www.amazon.com/dp/B00R5N89KI/,1,1
Lacis Wool Yarn Ball Winder Plastic,Home & Kitchen,https://www.amazon.com/gp/product/B000WV5ZJS/ref=oh_aui_detailpage_o09_s01?ie=UTF8&amp;psc=1,1,1
Twinkie Chan's Crochet Goodies for Fashion Foodies: 20 Yummy Treats to Wear,Book,http://www.amazon.com/dp/0740797581/,1,1
Boye Crochet Dude Ergonomic Aluminum Crochet Handle,Home,http://www.amazon.com/dp/B004ALF72G/,1,1
Clover 3675 Amour Steel Crochet Hook Set,Art and Craft Supply,http://www.amazon.com/dp/B00KB68U3C/,1,1
"LiLiSew 11 Crochet Hook Set Case with 7, 8 mm Sizes Crochet Hooks,10 Stich Markers.Ergonomic Comfortable Soft Rubber Grip And Smooth Aluminum Needle Kit for Pain Free Crocheting",Home,http://www.amazon.com/dp/B016V35TD2/,1,1
"Woodland Crochet, by Kristen Rask",Book,http://www.amazon.com/dp/1435153979/,1,1
Clover Amour Crochet Hooks - Set of 5 - For Working with Thick Yarns,Art and Craft Supply,http://www.amazon.com/dp/B00S05Z2MI/,1,1
"Yarn Keys by Yarn Valet - Yarn Label Saver, 2 pack- 12 keys",Art and Craft Supply,http://www.amazon.com/dp/B01DCCU9QW/,1,1
"Zenna Home 7617WW, Over-the-Showerhead Caddy, White",Home,http://www.amazon.com/dp/B000ZOFV8W/,1,1
Gingher 4.5 Inch Knife Edge Thread Nippers,Art and Craft Supply,http://www.amazon.com/dp/B001DEJLVQ/,1,1
"Deluxe Razor Sharp Quick-Snip - 4-1/2"" - All Metal - GREAT Bonzai Scissor",Sports,http://www.amazon.com/dp/B002AQC8S4/,1,1
Greenland Home Blooming Prairie King Quilt Set,Home,http://www.amazon.com/dp/B003G2ZVT4/,1,1
"Lily Sugar 'N Cream Yarn, 14 Ounce Cone, White, Single Ball",Art and Craft Supply,http://www.amazon.com/dp/B0050FHZAI/,1,1
"Red Heart Super Saver Jumbo Yarn, Cafe Latte",Art and Craft Supply,http://www.amazon.com/dp/B0083LE41Y/,1,1
"Command Utility Hooks Value Pack, Medium, White, 6-Hooks (17001-6ES)",Tools & Home Improvement,https://www.amazon.com/Command-Utility-Medium-6-Hooks-17001-6ES/dp/B000FSORW4/ref=redir_mobile_desktop?_encoding=UTF8&amp%3Bkeywords=3m%20hooks&amp%3Bsr=8-1&qid=1423332335&ref_=mp_s_a_1_1,1,1
Grannick Bitter Apple with Dabber Top for Dogs 8ounce,Pet Products,http://www.amazon.com/dp/B0006L0UEO/,1,1
Ultimate Crochet Bible: A Complete Reference with Step-by-Step Techniques (C&B Crafts Bible Series),Book,http://www.amazon.com/dp/1843405636/,1,1
5 Pieces/lot New Clippers Sewing Trimming Scissors Nipper Embroidery Thrum Yarn Fishing Thread Beading Cutter,Office Product,http://www.amazon.com/dp/B00HMQ8HB4/,1,1
HIGHROCK Colorful Plastic Sewing Needles - 16picks,Network Media Player,http://www.amazon.com/dp/B00Q9Q9L86/,1,1
Wood Yarn Holder With Twirling Mechanism,Art and Craft Supply,http://www.amazon.com/dp/B00SNWDJGY/,1,1
"SUPER BLOWOUT SALE! Ergonomic Crochet Hook 29 Piece Set From Two Twigs. Cushion Grip Handles Reduce Fatigue & Pain. Quality Lightweight Aluminum Hooks & Bold, Elegant Case Keeps You Organized.",Art and Craft Supply,http://www.amazon.com/dp/B00YB1ZQ5I/,1,1
"Yarn Dispenser by Yarn Valet – Non-Slip Base with Built-In Holder for Markers, Pattern and 4” Gauge Ruler",Art and Craft Supply,http://www.amazon.com/dp/B014G1CQP0/,1,1
Annie's Favorite Special Occasions Crochet Projects,Book,http://www.amazon.com/dp/0965526976/,1,1
