name,category,amazon_link,total_mentions,subreddit_mentions
Anatomy for Sculptors Understanding the Human Form,Book,http://www.amazon.com/dp/0990341100/,4,2
Human Anatomy for Artists: The Elements of Form,Book,http://www.amazon.com/dp/0195052064/,3,1
Introducing ZBrush,Book,http://www.amazon.com/dp/0470262796/,1,1
ZBrush Digital Sculpting Human Anatomy,Book,http://www.amazon.com/dp/0470450266/,1,1
Anatomy for the Artist,Book,http://www.amazon.com/dp/078948045X/,3,1
Artistic Anatomy: The Great French Classic on Artistic Anatomy,Book,http://www.amazon.com/dp/0823002977/,1,1
ZBrush Professional Tips and Techniques,Book,http://www.amazon.com/dp/1118066804/,1,1
Bridgman's Complete Guide to Drawing from Life,Book,http://www.amazon.com/dp/1402766785/,15,1
An Atlas of Anatomy for Artists (Dover Anatomy for Artists),eBooks,http://www.amazon.com/dp/B00COGXUNC/,1,1
Atlas of Human Anatomy for the Artist,Book,http://www.amazon.com/dp/0195030958/,6,1
Gigabyte GeForce GTX 1070 8 GB GDDR5 256 bit PCI-E 3.0 x 16 Windforce OC (GV-N1070WF2OC-8GD),Personal Computer,http://www.amazon.com/dp/B01HHCA1IO/,11,1
