name,category,amazon_link,total_mentions,subreddit_mentions
ZOIDS EZ-034: Jenobreaker Raven Custom (Plastic model) by Kotobukiya,Toy,http://www.amazon.com/dp/B008MU8BS8/,2,2
Nipper Thin Blade Premium (D-25),Health and Beauty,http://www.amazon.com/dp/B00318PWL0/,2,2
Squadron Products Value Pack Sanding Stick,Hobby,http://www.amazon.com/dp/B000CDR5K8/,3,1
"Bandai Hobby Action Base 1 Display Stand (1/100 Scale), Black",Toy,http://www.amazon.com/dp/B000KG499M/,5,1
Command Wolf LC Zenebas Empire Type Irisawa Limited Ver.,Toy,http://www.amazon.com/dp/B000QS6NBQ/,1,1
Tamiya TAM87012 Plastic Cement 20ml,Toy,http://www.amazon.com/dp/B002CDPZDK/,5,1
ZOIDS Buster Tortoise,Single Detail Page Misc,http://www.amazon.com/dp/B002HEXCM0/,1,1
Kotobukiya 1/72 Scale HMM Zoids RZ-028 Blade Liger AB Bang Ver Construction Kit (Limited Edition),Toy,http://www.amazon.com/dp/B002P67A9G/,2,1
Zoids: Gun Sniper Naomi Custom with Wild Wiesel Unit Plastic Kit 1/72 Scale,Single Detail Page Misc,http://www.amazon.com/dp/B002X79LAS/,1,1
Transparent Blue Enamel Paint 3oz Spray Can,Toy,http://www.amazon.com/dp/B0035LHAKE/,1,1
Zoids Zabat Action Figure Model Kit 1/72 Scale - Japanese Release,Toy,http://www.amazon.com/dp/B0035VQC2Q/,1,1
Zoids Japanese Kotobukiya Model Kit RZ041 Liger Zero,Single Detail Page Misc,http://www.amazon.com/dp/B003UTUEVI/,3,1
"X-ACTO #1 Knife, Z Series With Safety Cap",Office Product,http://www.amazon.com/dp/B005KRSWM6/,13,1
HT-196 parts opener by Wave,Toy,http://www.amazon.com/dp/B0071GZXQC/,2,1
HMM Zoids 1/72 Liger Zero Panzer Unit,Toy,http://www.amazon.com/dp/B007CUHBS0/,1,1
HMM Zoids 1/72 Rz-041 Liger Zero Panzer,Toy,http://www.amazon.com/dp/B007CUHBYY/,1,1
HMM Zoids 1/72 Ez-049 Berserk Fuhrer,Toy,http://www.amazon.com/dp/B007XP6K40/,1,1
ZOIDS - RZ-046 Shadow Fox (Plastic model) by Kotobukiya,Toy,http://www.amazon.com/dp/B008ESKQ5E/,2,1
SRDX Zoids New Century / ZERO Naomi Flugel,Toy,http://www.amazon.com/dp/B00AKR41C6/,1,1
ZOIDS RZ-001 Gojulas [1/72 Scale Plastic Kit],Toy,http://www.amazon.com/dp/B00ENYXW7M/,1,1
"Beadalon Nipper Tool, Classic",Art and Craft Supply,http://www.amazon.com/dp/B0001DSHF6/,1,1
Tamiya Sharp Pointed Side Cutter NO.123 (74123),Toy,http://www.amazon.com/dp/B010PG73J4/,7,1
Tamiya Basic Tool Set by Horizon Hobby,Toy,http://www.amazon.com/dp/B000BMYWXI/,9,1
