name,category,amazon_link,total_mentions,subreddit_mentions
"Confronting Animal Abuse: Law, Criminology, and Human-Animal Relationships",Book,http://www.amazon.com/dp/0742547442/,1,1
"Why We Love Dogs, Eat Pigs, and Wear Cows: An Introduction to Carnism",Book,http://www.amazon.com/dp/1573245054/,23,1
Red Rocket Bicycle Reflective Reflector Sticker Decal,Sports,http://www.amazon.com/dp/B0030IYUD2/,1,1
Amazon eGift Card,Electronic Gift Card,http://www.amazon.com/dp/B004LLIKVU/,26,1
I Sleep With Dogs Paw Magnet,Kitchen,http://www.amazon.com/dp/B005BU6WZQ/,1,1
Awkward Conversations with Animals I’ve Fucked (Oberon Modern Plays),eBooks,http://www.amazon.com/dp/B00LXJELPW/,1,1
The Sexual Politics of Meat: A Feminist-Vegetarian Critical Theory (Bloomsbury Revelations),eBooks,http://www.amazon.com/dp/B016N2QTU8/,2,1
