name,category,amazon_link,total_mentions,subreddit_mentions
2-Pack Eagle Jet Torch Jumbo Gun Pen Torch Lighter Butane,"Health, Household & Baby Care",https://www.amazon.com/2-Pack-Eagle-Torch-Lighter-Butane/dp/B01LZ53XAZ/ref=redir_mobile_desktop?_encoding=UTF8&amp%3Bkeywords=eagle%20torch%20lighter&amp%3Bqid=1496412609&amp%3Bsr=8-4&ref_=mp_s_a_1_4_a_it,2,2
2pcs 18650 2500mah 20A discharge Samsung INR18650-25R li-ion power cell,Electronics,https://www.amazon.com/dp/B00QKD4V4C/ref=cm_sw_r_cp_apa_sYALzbEXT385J,2,2
"American Weigh Digital Scale, 100g  [0.01g sensitivity]",Home & Kitchen,https://www.amazon.com/American-Weigh-Digital-Scale-sensitivity/dp/B0012LOQUQ/ref=redir_mobile_desktop?_encoding=UTF8&ref_=psdcmw_678508011_t1_B0012TDNAM,15,1
Chromium Crusher 2.5 Inch Zinc 4 Piece Tobacco Spice Herb Grinder - Gun Metal Color,Home & Kitchen,https://www.amazon.com/dp/B00700W0TW/ref=cm_sw_r_cp_apa_Hx-.xbDR9CRDH,6,1
100% Authentic Czech Pipe Tool - Tobacco Pipe Reamer Tamper Pokers Tool,Industrial & Scientific,https://www.amazon.com/gp/product/B004M02K7A/ref=oh_aui_detailpage_o05_s00?ie=UTF8&amp;psc=1,5,1
Nitecore i2 Intellicharge Charger for 18650 AAA AA Li-Ion/NiMH Battery,Tools & Home Improvement,https://www.amazon.com/Nitecore-i2-Intellicharge-Charger-Battery/dp/B0096U26QQ/ref=sr_1_1?ie=UTF8&amp;qid=1426937077&amp;sr=8-1&amp;keywords=18650+charger,5,1
NiteCore-i2-V2014 Universal Intelligent Charger for two Batteries Compatible With IMR/Li-ion (Black),Electronics,https://www.amazon.com/NiteCore-i2-V2014-Universal-Intelligent-Batteries-Compatible/dp/B009JMDD9U/ref=sr_1_2?ie=UTF8&amp;qid=1461093202&amp;sr=8-2&amp;keywords=vape+battery+charger,3,1
JanSport Unisex Digital Wrap,Sports & Outdoors,https://www.amazon.com/Jansport-Digital-Burrito-Accessory-Stickers/dp/B00WG0JZOE/ref=redir_mobile_desktop?_encoding=UTF8&amp%3BdpID=41z1KBmNHCL&amp%3BdpPl=1&amp%3Bkeywords=jansport%20burrito%20pouch&amp%3Bpi=AC_SX236_SY340_QL65&amp%3Bqid=1502494188&amp%3Bref=plSrch&amp%3Bsr=8-1&ref_=mp_s_a_1_1,2,1
OuterEQ Portable Parachute Nylon Fabric Travel Camping Hammock,Sports & Outdoors,https://www.amazon.com/OuterEQ-Portable-Parachute-Camping-Hammock/dp/B00G3ZURYU/,2,1
"Reynolds Oven Cooking Bags, Turkey Size, 2 Count",Home & Kitchen,https://www.amazon.com/Reynolds-Turkey-Size-Oven-Bags/dp/B0007M45XE/ref=sr_1_1?ie=UTF8&amp;qid=1468205334&amp;sr=8-1&amp;keywords=reynolds+turkey+bag,2,1
"Mr. Clean Magic Eraser Cleaning Pads, 8-Count Box",Industrial & Scientific,https://www.amazon.com/dp/B001339ZMW/ref=cm_sw_r_cp_apa_FaJEzbEEMFP0F,2,1
"Capsule Connection 1000 Bulk Wholesale Empty Clear Gelatin Capsules, ""00"" size,","Health, Household & Baby Care",https://www.amazon.com/Capsule-Connection-Wholesale-Gelatin-Capsules/dp/B00428B6X6,2,1
NiteCore NIT-D2+BBOX Bundle D2 Charger with LCD Display Universal Smart Charger with Bonus Battery Box,Electronics,https://www.amazon.com/gp/product/B00QF3YRZ0,2,1
Cobalt Blue Glass Bottles with Droppers 2 Oz - 12 Per Package,"Health, Household & Baby Care",https://www.amazon.com/Cobalt-Blue-Glass-Bottles-Droppers/dp/B000B9V20W,2,1
"LeadCheck LC-2SDC Disposable Non-Staining Lead Detection Swabs, 2 Per Pack",Tools & Home Improvement,https://www.amazon.com/dp/B009NQNL0I/ref=cm_sw_r_cp_apa_GCgPyb0J4J0KN,2,1
"Holmes HEPA Type Desktop Air Purifier, 3 Speeds plus Optional Ionizer, HAP242-NUC",Home & Kitchen,https://www.amazon.com/gp/product/B0000DK35B?psc=1&amp;redirect=true&amp;ref_=oh_aui_detailpage_o04_s00,2,1
"Case Star ® Black Color Hard Shell Protective EVA Carrying Case/Bag/Pouch/Holder for Pencils, Graphics Tablet Stylus, Digital Touch Pen, Ballpoint Pen (EVA Case)",Office Products,https://www.amazon.com/Protective-Carrying-Pencils-Graphics-Ballpoint/dp/B00VLP8H94?ie=UTF8&amp;psc=1&amp;redirect=true&amp;ref_=oh_aui_detailpage_o00_s00,2,1
"Kikkerland Contact Case, Yellow Sub","Health, Household & Baby Care",https://www.amazon.com/Kikkerland-Contact-Case-Yellow-Sub/dp/B00TG1H9YY/ref=redir_mobile_desktop?_encoding=UTF8&%2AVersion%2A=1&%2Aentries%2A=0,1,1
ICOLOR Kids Pink Dog Soft Friendly Insulated Lunch box Food Bag Neoprene Gourmet Handbag lunchbox Cooler warm Pouch Tote bag For School work LB-005,Toys & Games,https://www.amazon.com/ICOLOR-Friendly-Insulated-Neoprene-lunchbox/dp/B00EWUMTX0/ref=sr_1_68?s=toys-and-games&amp;ie=UTF8&amp;qid=1497473140&amp;sr=1-68&amp;keywords=Lunchbox,1,1
Aomai Slim Metal Jet Torch Flame Lighter Grinding Flint Butane Gas Windproof Cigarette Lighter - Silver,Sports & Outdoors,https://www.amazon.com/Lighter-Grinding-Butane-Windproof-Cigarette/dp/B01LJBINES/ref=redir_mobile_desktop?_encoding=UTF8&amp%3BdpID=410U6bW8WHL&amp%3BdpPl=1&amp%3Bpsc=1&amp%3BrefRID=RV3RDFCBF9QASZ6K3P0J&ref_=pd_aw_sim_sbs_468_1,1,1
DÜGOUT Box Öne Slide Top Solid Mahogany-Tall by WÜD,"Health, Household & Baby Care",https://www.amazon.com/D%C3%9CGOUT-Box-Slide-Solid-Mahogany-Tall/dp/B01KQRKV6O/ref=redir_mobile_desktop?_encoding=UTF8&amp%3Bpsc=1&amp%3BrefRID=1XB7G32ZR24TRPSRQ2C5&ref_=pd_aw_sim_201_2,1,1
"Lucid Dreaming, Plain and Simple: Tips and Techniques for Insight, Creativity, and Personal Growth",Books,https://www.amazon.com/Lucid-Dreaming-Plain-Simple-Techniques/dp/1573246417/ref=redir_mobile_desktop?_encoding=UTF8&amp%3Bpsc=1&amp%3BrefRID=M324YW5R3NPSYVKTVX4B&ref_=pd_aw_fbt_14_img_3,1,1
Naughty Pantry Marijuana Pot Leaf Cookie Cutter Set of 2 Stainless Steel,Home & Kitchen,https://www.amazon.com/dp/B01F9AENM6,1,1
Lucid Dreaming: A Concise Guide to Awakening in Your Dreams and in Your Life,Books,https://www.amazon.com/Lucid-Dreaming-Concise-Awakening-Dreams/dp/159179675X,1,1
Steinel Heat Gun HG3002 LCD w/Three Nozzles,Tools & Home Improvement,https://www.amazon.com/Steinel-Heat-HG3002-Three-Nozzles/dp/B0041H1B9W/ref=sr_1_2?ie=UTF8&amp;qid=1468205061&amp;sr=8-2&amp;keywords=steinel+heat+gun,1,1
LEGO City Seaplane (3178),Toys & Games,https://www.amazon.com/LEGO-4567621-City-Seaplane/dp/B002RL7VOS,1,1
"Frontier Co-op Organic Chamomile Flowers, German, Whole, 1 Pound Bulk Bag",Grocery & Gourmet Food,https://www.amazon.com/Frontier-Chamomile-Flowers-Certified-Organic/dp/B001VNGN9C/ref=pd_nav_hcs_bia_t_2?_encoding=UTF8&amp;refRID=52NDQXSHXCZ44QKY381C&amp;th=1,1,1
"XFasten Polyimide Film Tape, High Heat Kapton Tape For 3D Printing Bed and Electronics Repair, 1/2-Inch by 36-Yard, Pack of 2, 7500V Dielectric Strength",Tools & Home Improvement,https://www.amazon.com/XFasten-Polyimide-Printing-Electronics-Dielectric/dp/B06X6L9V7V/ref=sr_1_5?s=hi&amp;ie=UTF8&amp;qid=1502285648&amp;sr=1-5&amp;keywords=heat+resistant+kapton+tape,1,1
"Oil Slick Pad Platinum Cured Medical Grade Silicone Pad 12x8.5""",Home & Kitchen,https://www.amazon.com/Oil-Slick-Platinum-Medical-Silicone/dp/B0080S1JWW,1,1
Chromium Crusher Zinc Tobacco Spice Herb 2.2 Inch 4 Piece Grinder in Metal Color,Home & Kitchen,https://www.amazon.com/Chromium-Crusher-Tobacco-Spice-Grinder/dp/B004LH3DYI,1,1
"Mr. Herb Grinders - Best Grinder For Spice and tobacco - Crusher for Herbs with Keef Catcher Tool - Silicone Kief, 4 Pieces 2.5 inch (Black)",Home & Kitchen,https://www.amazon.com/Mr-Herb-Grinders-Grinder-Silicone/dp/B01N8QT4UW/ref=sr_1_102?s=kitchen&amp;ie=UTF8&amp;qid=1496866594&amp;sr=1-102&amp;keywords=herb+grinder,1,1
Weed Grinder - Grind Your Spices Weed Marijuana With Ease-Diamond Sharp Teeth 2.1 x 2 x 1.8 inches - Cannabis Crusher- Ultimate Set For Smokers. Herb Tobacco Grinder,Home & Kitchen,https://www.amazon.com/TobaccoHub-Tobacco-Marijuana-Grinder-Ease-Diamond/dp/B06X9HVD3X/ref=sr_1_70?s=kitchen&amp;ie=UTF8&amp;qid=1496866450&amp;sr=1-70&amp;keywords=herb+grinder,1,1
"R106 Single Color LED Light Strip Controller with RF Remote - Reliable PWM Dimming and Control Options for LED Light Strips, Tape Lights, and other 12V DC LEDs",Musical Instruments,https://www.amazon.com/gp/product/B00QKVVUZ2/ref=oh_aui_detailpage_o01_s00?ie=UTF8&amp;psc=1,1,1
Masterdam Grinders Premium Large 2.5 Inch Herb Grinder with Pollen Catcher - 4 Piece  Purple Aluminum,Home & Kitchen,https://www.amazon.com/Masterdam-Grinders-Premium-Grinder-Catcher/dp/B01ET9VJUW/ref=sr_1_50?s=kitchen&amp;ie=UTF8&amp;qid=1496866322&amp;sr=1-50&amp;keywords=herb+grinder,1,1
RSVP White Marble Mortar and Pestle,Home & Kitchen,https://www.amazon.com/RSVP-White-Marble-Mortar-Pestle/dp/B000BUB58K,1,1
Bluecell Pack of Clear/Blue/Green Battery Storage Case Holder/Organizer for 18650 or CR123A Battery,Electronics,https://www.amazon.com/dp/B007Q6PJO8/,1,1
Mantello Catador Triple Jet Flame Butane Cigarette Torch Lighter with Cigar Punch Cutter,"Health, Household & Baby Care",https://www.amazon.com/Mantello-Catador-Triple-Cigarette-Lighter/dp/B01M6C8F34/ref=sr_1_5_a_it?ie=UTF8&amp;qid=1498156065&amp;sr=8-5&amp;keywords=torch+lighter,1,1
Prestige Import Group Typhoon Triple Flame Cigar Torch Lighter with Cigar Punch Cutter (Gun Metal),"Health, Household & Baby Care",https://www.amazon.com/Prestige-Group-Typhoon-Triple-Lighter/dp/B00FP0ZE7E/ref=sr_1_6_a_it?ie=UTF8&amp;qid=1498156065&amp;sr=8-6&amp;keywords=torch,1,1
True Liberty Bags - Goose 10 Pack - All Purpose Home and Garden Bags,"Patio, Lawn & Garden",https://www.amazon.com/gp/product/B006ZD0SN0/,1,1
Tenergy 7.4V Li-ion 18650 2200mAh Rechargeable Battery Module with PCB,Electronics,https://www.amazon.com/dp/B002Y2LJW0/ref=cm_sw_r_cp_apa_6s2wybPY3V70T,1,1
Chromium Crusher 1.6 Inch 4 Piece Tobacco Spice Herb Grinder - Gold,Home & Kitchen,https://www.amazon.com/Chromium-Crusher-Piece-Tobacco-Grinder/dp/B00RER768Q/ref=sr_1_8?ie=UTF8&amp;qid=1451023009&amp;sr=8-8&amp;keywords=grinder,1,1
"Nicholson 6 Piece Hobby File Set (Carded), 5-1/2"" Length",Industrial & Scientific,https://www.amazon.com/Nicholson-Piece-Hobby-Carded-Length/dp/B00002N5JT,1,1
"Bo-Bo Head 5-piece Aluminum Herb and Tobacco Grinder - Best Quality - Aircraft Anodized Aluminum - CNC Cut - Pollen and Kief Catcher - For Smokers, Gardeners, Cooks and Chefs - Portable Size - Magnetic Lid",Home & Kitchen,https://www.amazon.com/Bo-Bo-Head-5-piece-Aluminum-Tobacco/dp/B00VSDLRIW/ref=sr_1_11?s=kitchen&amp;ie=UTF8&amp;qid=1446839130&amp;sr=1-11&amp;keywords=herb+grinder,1,1
"Duda Energy Syringepk010 Industrial Syringes with 15G x 1-1/2"" Blunt Tip Fill Needle and Plastic Cover, 10 mL (Pack of 10)",Industrial & Scientific,https://www.amazon.com/Industrial-Syringes-Blunt-Needle-plastic/dp/B00DXPRTHG/ref=sr_1_1?ie=UTF8&amp;qid=1444936492&amp;sr=8-1&amp;keywords=blunt+tip+syringe,1,1
"Botanic Choice Alcohol Free Liquid Extract Herbal Supplements, Cranberry, 1 Ounce","Health, Household & Baby Care",https://www.amazon.com/Botanic-Choice-Alcohol-Supplements-Cranberry/dp/B009Z8SFWI,1,1
Quick Pack Cotton Candy Plain Bags (100 ct.),"Health, Household & Baby Care",https://www.amazon.com/Quick-Pack-Cotton-Candy-Plain/dp/B00MYGFM7E/ref=sr_1_3_a_it?ie=UTF8&amp;qid=1489080517&amp;sr=8-3&amp;keywords=cotton+candy+bags,1,1
"Can Lite Carbon Filter With Pre Filter, 6-Inch 600 Cubic Feet Per Minute","Patio, Lawn & Garden",https://www.amazon.com/Can-Carbon-Filter-6-Inch-Minute/dp/B005GZ1W3S/ref=redir_mobile_desktop?_encoding=UTF8&amp%3BdpID=41jtCeF9ykL&amp%3BdpPl=1&amp%3Bkeywords=active%20carbon%20air%20filter&amp%3Bpi=AC_SX236_SY340_FMwebp_QL65&amp%3Bref=plSrch&amp%3Bsr=8-6&qid=1453679826&ref_=mp_s_a_1_6,1,1
"420 Science RezBlock Concentrate Resin Preventer, 15ml",Home & Kitchen,https://www.amazon.com/RezBlock-Concentrate-420-Science-Cleaner/dp/B00C6L66CC/,1,1
Nitecore i4 Intelligent Charger for Li-Ion / NiMH NiCD 18560 500 350 AA AAA C,"Health, Household & Baby Care",https://www.amazon.com/Nitecore-Intelligent-Charger-Li-Ion-18560/dp/B0109LD8OY/ref=sr_1_9_a_it?ie=UTF8&amp;qid=1489356844&amp;sr=8-9&amp;keywords=nitecore+i4+charger,1,1
