name,category,amazon_link,total_mentions,subreddit_mentions
Artisan Vegan Cheese,Book,http://www.amazon.com/dp/1570672830/,46,38
"The Starch Solution: Eat the Foods You Love, Regain Your Health, and Lose the Weight for Good!",Book,http://www.amazon.com/dp/1623360277/,40,26
Eating Animals,Book,http://www.amazon.com/dp/0316069884/,40,24
Veganomicon: The Ultimate Vegan Cookbook,Book,http://www.amazon.com/dp/156924264X/,35,23
Deva Vegan Vitamins Daily Multivitamin & Mineral Supplement  90 tablets (Pack of 2),Health and Beauty,http://www.amazon.com/dp/B001GAOHVG/,28,21
The Homemade Vegan Pantry: The Art of Making Your Own Staples,Book,http://www.amazon.com/dp/1607746778/,30,20
Vegan for Life: Everything You Need to Know to Be Healthy and Fit on a Plant-Based Diet,Book,http://www.amazon.com/dp/0738214930/,28,19
Thug Kitchen: The Official Cookbook: Eat Like You Give a F*ck,Book,http://www.amazon.com/dp/1623363586/,54,18
Deva Vegan Vitamin B-12 Fast Dissolve Lozenges 90 Tablets (2 Pack),Health and Beauty,http://www.amazon.com/dp/B001GAOHTS/,22,17
"Dominion: The Power of Man, the Suffering of Animals, and the Call to Mercy",Book,http://www.amazon.com/dp/0312319738/,24,17
How Not to Die: Discover the Foods Scientifically Proven to Prevent and Reverse Disease,Book,http://www.amazon.com/dp/1250066115/,54,15
Eat Like You Care: An Examination of the Morality of Eating Animals,eBooks,http://www.amazon.com/dp/B00DLTN43C/,14,14
"Explore Asia Organic Black Bean Spaghetti, 7.05-Ounce Pouch",Grocery,http://www.amazon.com/dp/B0078DU1CY/,36,12
"Garden of Life B12 Vitamin - mykind Organic Whole Food B-12 for Metabolism and Energy, Raspberry, 2oz Liquid",Health and Beauty,http://www.amazon.com/dp/B00K5NEPJY/,13,11
"But I Could Never Go Vegan!: 125 Recipes That Prove You Can Live Without Cheese, It's Not All Rabbit Food, and Your Friends Will Still Come Over for Dinner",Book,http://www.amazon.com/dp/1615192107/,13,11
"Why We Love Dogs, Eat Pigs, and Wear Cows: An Introduction to Carnism",Book,http://www.amazon.com/dp/1573245054/,23,10
Change of Heart: What Psychology Can Teach Us About Spreading Social Change,Book,http://www.amazon.com/dp/159056233X/,12,10
EZ Tofu Press - Removes Water from Tofu for Better Flavor and Texture.,Kitchen,http://www.amazon.com/dp/B007LLGMG2/,16,8
"Slaughterhouse: The Shocking Story of Greed, Neglect, and Inhumane Treatment Inside the U.S. Meat Industry",Book,http://www.amazon.com/dp/1591024501/,11,8
"Isa Does It: Amazingly Easy, Wildly Delicious Vegan Recipes for Every Day of the Week",Book,http://www.amazon.com/dp/0316221902/,17,8
"Doctor's Best Vitamin D3 2500IU with Vitashine D3, Non-GMO, Vegan, Gluten Free, Soy Free, Regulates Immune Function, Supports Healthy Bones, 60 Veggie Caps",Health and Beauty,http://www.amazon.com/dp/B00E816ROU/,9,8
Becoming Vegan: The Complete Reference to Plant-Based Nutrition (Comprehensive Edition),Book,http://www.amazon.com/dp/1570672970/,9,8
"Aroma Housewares ARC-914SBD 8-Cup (Cooked) Digital Cool-Touch Rice Cooker and Food Steamer, Stainless Steel",Kitchen,http://www.amazon.com/dp/B007WQ9YNO/,60,8
VeganSafe B-12 - Vegan Vitamin B12 by Global Healing by GHCHealth,Health and Beauty,http://www.amazon.com/dp/B00RXEW7R0/,9,8
"Natural Balance Vegetarian Formula Dry Dog Food, 28-Pound",Pet Products,http://www.amazon.com/dp/B000634HD2/,9,7
"MRM - Veggie Elite Performance Protein, 24 Grams of Plant-Based Protein, Soy-Free, Vegetarian & Vegan Friendly, Non-GMO Project Verified (Chocolate Mocha, 2.45 lbs)",Health and Beauty,http://www.amazon.com/dp/B00FD2WKQM/,20,7
Appetite for Reduction: 125 Fast and Filling Low-Fat Vegan Recipes,Book,http://www.amazon.com/dp/1600940498/,17,7
"VeganEgg by Follow Your Heart, 4-Ounce Carton Egg Replacer",Grocery,http://www.amazon.com/dp/B016V9W6QE/,10,6
"Eat to Live: The Amazing Nutrient-Rich Program for Fast and Sustained Weight Loss, Revised Edition",Book,http://www.amazon.com/dp/031612091X/,18,6
Dr. Neal Barnard's Program for Reversing Diabetes: The Scientifically Proven System for Reversing Diabetes without Drugs,Book,http://www.amazon.com/dp/1594868107/,11,6
Seitan and Beyond: Gluten and Soy-Based Meat Analogues for the Ethical Gourmet,Book,http://www.amazon.com/dp/1516860888/,8,6
"Jarrow Formulas Methylcobalamin (Methyl B12), Supports Brain Cells, 5000 mcg, 60 Lozenges",Health and Beauty,http://www.amazon.com/dp/B0013OQGO6/,10,6
"Afro-Vegan: Farm-Fresh African, Caribbean, and Southern Flavors Remixed",Book,http://www.amazon.com/dp/1607745313/,10,6
"21st Century B 12 2500 mcg Sublingual Tablets, 110 Count",Health and Beauty,http://www.amazon.com/dp/B001RN9BY0/,6,6
"MRM - Vegan Vitamin D3, Meets Calcium and Bone Health Needs (2500IU 60 Count)",Health and Beauty,http://www.amazon.com/dp/B00CYA8HD6/,6,6
Disease-Proof Your Child: Feeding Kids Right,Book,http://www.amazon.com/dp/0312338082/,6,6
The Spice Lab Himalayan Black Crystal Salt - Kala Namak Mineral - Fine Ground - 16 Oz,Grocery,http://www.amazon.com/dp/B001O1VDXM/,7,6
The Vegan Stoner Cookbook: 100 Easy Vegan Recipes to Munch,Book,http://www.amazon.com/dp/1607744643/,8,5
"It's Omega 3, but Better - much Healthier than Fish Oil - plant based DHA + EPA from Algae oil - Pure and Vegan Omega-3 - Testa Omega 3 - 60 capsules",Health and Beauty,http://www.amazon.com/dp/B01H405UBM/,9,5
"Orgain Organic Plant Based Protein Powder, Creamy Chocolate Fudge, 2.03 Pound, Packaging May Vary",Grocery,http://www.amazon.com/dp/B00J074W94/,28,5
"The Cheese Trap: How Breaking a Surprising Addiction Will Help You Lose Weight, Gain Energy, and Get Healthy",Book,http://www.amazon.com/dp/1455594687/,8,5
"PlantFusion Complete Protein Powder, Vanilla Bean, No Soy or Rice, 30 Servings, 21g Protein, 2lb Tub",Health and Beauty,http://www.amazon.com/dp/B0021FEMZG/,11,5
Bragg Organic Yeast Seasoning-4.5 oz,Grocery,http://www.amazon.com/dp/B002863BIW/,16,5
Artisan Vegan Cheese,eBooks,http://www.amazon.com/dp/B009963DVE/,5,5
"That's Why We Don't Eat Animals: A Book About Vegans, Vegetarians, and All Living Things",Book,http://www.amazon.com/dp/1556437854/,5,5
"Meatonomics: How the Rigged Economics of Meat and Dairy Make You Consume Too Much–and How to Eat Better, Live Longer, and Spend Smarter",Book,http://www.amazon.com/dp/1573246204/,9,5
"Chloe's Vegan Italian Kitchen: 150 Pizzas, Pastas, Pestos, Risottos, & Lots of Creamy Italian Classics",Book,http://www.amazon.com/dp/1476736073/,9,5
Eat Like You Care: An Examination of the Morality of Eating Animals,Book,http://www.amazon.com/dp/1492386510/,5,5
Eternal Treblinka: Our Treatment of Animals and the Holocaust,Book,http://www.amazon.com/dp/1930051999/,9,5
Vegan Richa's Indian Kitchen: Traditional and Creative Recipes for the Home Cook,Book,http://www.amazon.com/dp/1941252095/,7,5
The Sexual Politics of Meat: A Feminist-Vegetarian Critical Theory (Bloomsbury Revelations),Book,http://www.amazon.com/dp/1501312839/,7,5
Animal Liberation,Book,http://www.amazon.com/dp/0060011572/,6,5
"Deva Nutrition Vegan Sublingual Fast Dissolve B-12 Tablets, 2500 mcg, 90 Count",Health and Beauty,http://www.amazon.com/dp/B00EW1BVIS/,9,4
"Garden of Life D3 Vitamin - mykind Organic Whole Food Vitamin D Supplement with Plant Omegas, Vegan, Vanilla, 2oz Liquid Spray",Health and Beauty,http://www.amazon.com/dp/B00K5NEPLW/,4,4
"NOW Sports Pea Protein Natural Unflavored Powder,7-Pound",Health and Beauty,http://www.amazon.com/dp/B00JL6ZKFE/,10,4
The Oh She Glows Cookbook: Over 100 Vegan Recipes to Glow from the Inside Out,Book,http://www.amazon.com/dp/1583335277/,7,4
The Homemade Vegan Pantry: The Art of Making Your Own Staples,eBooks,http://www.amazon.com/dp/B00NRQXT70/,5,4
"Explore Asian Organic Black Bean Spaghetti, 7.05-Ounce (Pack of 6)",Grocery,http://www.amazon.com/dp/B004NSG8F6/,25,4
Vegan Cupcakes Take Over the World: 75 Dairy-Free Recipes for Cupcakes that Rule,Book,http://www.amazon.com/dp/1569242739/,6,4
"Compassion, by the Pound: The Economics of Farm Animal Welfare",Book,http://www.amazon.com/dp/0199551162/,4,4
"DEVA Vegan Vitamins Vegan DHA (Algae) 200mg Vegan Softgels, 90-Count Bottle",Health and Beauty,http://www.amazon.com/dp/B002XDQSSK/,9,4
"Vegan Soul Kitchen: Fresh, Healthy, and Creative African-American Cuisine",Book,http://www.amazon.com/dp/0738212288/,6,4
"Meat Is for Pussies: A How-To Guide for Dudes Who Want to Get Fit, Kick Ass, and Take Names",Book,http://www.amazon.com/dp/0062320327/,4,4
"Fresh from the Vegan Slow Cooker: 200 Ultra-Convenient, Super-Tasty, Completely Animal-Free Recipes",Book,http://www.amazon.com/dp/1558327908/,6,4
"Bob's Red Mill Vital Wheat Gluten Flour, 22-ounce (Pack of 4)",Grocery,http://www.amazon.com/dp/B000EDK5LM/,16,4
"The Sexual Politics of Meat: A Feminist-vegetarian Critical Theory, 20th Anniversary Edition",Book,http://www.amazon.com/dp/1441173285/,7,4
"The Non-Dairy Evolution Cookbook: A Modernist Culinary Approach to Plant-Based, Dairy Free Foods",Book,http://www.amazon.com/dp/1499590423/,9,4
"Nature's Way Vitamin B12 Lozenge, 100 Count",Health and Beauty,http://www.amazon.com/dp/B000Q40C6M/,4,4
"Country Life Vegan D3 Capsules, 60 Count",Health and Beauty,http://www.amazon.com/dp/B009MHS9RI/,4,4
Never Too Late to Go Vegan: The Over-50 Guide to Adopting and Thriving on a Plant-Based Diet,Book,http://www.amazon.com/dp/1615190988/,4,4
"The Veggie-Lover's Sriracha Cookbook: 50 Vegan ""Rooster Sauce"" Recipes that Pack a Punch",Book,http://www.amazon.com/dp/1607744600/,3,3
"The Vegan Slow Cooker: Simply Set It and Go with 150 Recipes for Intensely Flavorful, Fuss-Free Fare Everyone (Vegan or Not!) Will Devour",Book,http://www.amazon.com/dp/1592334644/,6,3
"Hearty Vegan Meals for Monster Appetites: Lip-Smacking, Belly-Filling, Home-Style Recipes Guaranteed to Keep Everyone-Even the Meat Eaters-Fantastically Full",Book,http://www.amazon.com/dp/1592334555/,3,3
Foods That Cause You to Lose Weight: The Negative Calorie Effect,Book,http://www.amazon.com/dp/0062570366/,3,3
World Peace Diet: Eating for Spiritual Health and Social Harmony,Book,http://www.amazon.com/dp/1590560833/,3,3
An Unnatural Order: Roots of Our Destruction of Nature,Book,http://www.amazon.com/dp/1590560817/,3,3
"Vega One All in One Nutritional Shake Tub, French Vanilla, Large, 29.2 Ounce",Health and Beauty,http://www.amazon.com/dp/B00R0Y0V94/,5,3
"The Prevent and Reverse Heart Disease Cookbook: Over 125 Delicious, Life-Changing, Plant-Based Recipes",Book,http://www.amazon.com/dp/1583335587/,3,3
Proteinaholic: How Our Obsession with Meat Is Killing Us and What We Can Do About It,Book,http://www.amazon.com/dp/0062279300/,4,3
"Vegan with a Vengeance, 10th Anniversary Edition: Over 150 Delicious, Cheap, Animal-Free Recipes That Rock",Book,http://www.amazon.com/dp/0738218332/,5,3
"MRM - Vegan Vitamin D3, Meets Calcium and Bone Health Needs (5000IU 60 Count)",Health and Beauty,http://www.amazon.com/dp/B00CYA8HMW/,5,3
The Animal Activist's Handbook: Maximizing Our Positive Impact in Today's World (Flashpoint (Lantern)),Book,http://www.amazon.com/dp/1590561201/,4,3
Bean-zyme VEGAN anti-gas 300 GALU/cap vs Beano 150 GALU/tab. Bean-zyme contains 150 caps/bottle,Health and Beauty,http://www.amazon.com/dp/B0085XXNSA/,3,3
"Nature's Plus Sol Garden Vit D3 5000 IU Tablets, 60 Count",Health and Beauty,http://www.amazon.com/dp/B0042DDP44/,4,3
"Honee 100% All-Natural Bee-Free, 12-Ounce (Pack of 4)",Grocery,http://www.amazon.com/dp/B004I8YTUW/,4,3
The End of Diabetes: The Eat to Live Plan to Prevent and Reverse Diabetes,eBooks,http://www.amazon.com/dp/B0089LOG7U/,4,3
"Pure Hawaiian Spirulina Powder 16 oz – Boosts Energy and Supports Immunity – Vegan, Non GMO – Natural Superfood Grown in Hawaii",Health and Beauty,http://www.amazon.com/dp/B0039ITKR4/,5,3
The Book of Tofu: Protein Source of the Future... Now!,Book,http://www.amazon.com/dp/1479287350/,3,3
The Most Good You Can Do: How Effective Altruism Is Changing Ideas About Living Ethically,Book,http://www.amazon.com/dp/0300180276/,16,3
Black Salt 3.5 oz.,Grocery,http://www.amazon.com/dp/B003WLZXBU/,4,3
The Vegan Teen Cookbook: Easy vegan meals from what's already in your kitchen,Book,http://www.amazon.com/dp/1492164771/,3,3
Esther the Wonder Pig: Changing the World One Heart at a Time,Book,http://www.amazon.com/dp/1455560782/,6,3
"Nutribiotic Rice Protein, Vanilla, 3 Pound",Health and Beauty,http://www.amazon.com/dp/B00014DLC4/,5,3
Thug Kitchen 101: Fast as F*ck,Book,http://www.amazon.com/dp/1623366348/,4,3
"Vegan for Everybody: Foolproof Plant-Based Recipes for Breakfast, Lunch, Dinner, and In-Between",Book,http://www.amazon.com/dp/194035286X/,7,3
Forks Over Knives - The Cookbook: Over 300 Recipes for Plant-Based Eating All Through the Year,Book,http://www.amazon.com/dp/1615190619/,3,3
Disease-Proof Your Child: Feeding Kids Right,eBooks,http://www.amazon.com/dp/B000VY4ZBU/,4,3
Eat and Run: My Unlikely Journey to Ultramarathon Greatness,Book,http://www.amazon.com/dp/0544002318/,9,2
Vegan Cookies Invade Your Cookie Jar: 100 Dairy-Free Recipes for Everyone's Favorite Treats,Book,http://www.amazon.com/dp/160094048X/,2,2
"Influence: The Psychology of Persuasion, Revised Edition",Book,http://www.amazon.com/dp/006124189X/,77,2
