name,category,amazon_link,total_mentions,subreddit_mentions
Flags through the ages and across the world,Book,http://www.amazon.com/dp/0070590931/,3,3
magFlags Large Flag Zheleznogorsk Krasnoyarsk krai | landscape flag | 1.35qm | 14.5sqft | 90x150cm | 3x5ft -- 100% Made in Germany -- long lasting outdoor flag,Lawn & Patio,http://www.amazon.com/dp/B00N17U1VW/,2,2
Marx: A Very Short Introduction,Book,http://www.amazon.com/dp/0192854054/,3,1
"The Republic of Labor: Philadelphia Artisans and the Politics of Class, 1720-1830",Book,http://www.amazon.com/dp/0195075854/,2,1
From Disgust to Humanity: Sexual Orientation and Constitutional Law (Inalienable Rights Series),Book,http://www.amazon.com/dp/0195305310/,1,1
The Moon Is a Harsh Mistress,Book,http://www.amazon.com/dp/0312863551/,12,1
Strength through Joy: Consumerism and Mass Tourism in the Third Reich,Book,http://www.amazon.com/dp/0521705991/,1,1
Flags of the World,Book,http://www.amazon.com/dp/0723227977/,1,1
"The World Encyclopedia of Flags: The definitive guide to international flags, banners, standards and ensigns, with over 400 illustrations",Book,http://www.amazon.com/dp/0754826295/,1,1
"The Wall Chart of World History: From Earliest Times to the Present, Facsimile Edition",Book,http://www.amazon.com/dp/076070970X/,1,1
To Russia With Fries: My Journey from Chicago's South Side to Moscow's Red Square - Having Fun Along the Way,Book,http://www.amazon.com/dp/0771021984/,1,1
American City Flags: 150 Flags from Akron to Yonkers,Book,http://www.amazon.com/dp/0974772801/,1,1
Complete Flags of the World,Book,http://www.amazon.com/dp/1465419675/,1,1
The Golden Age of Piracy,Book,http://www.amazon.com/dp/1519315953/,1,1
The Stars and the Stripes: The American Flag as Art and as History from the Birth of the Republic to the Present,Book,http://www.amazon.com/dp/1568523823/,1,1
Worth Dying for: The Power and Politics of Flags,Book,http://www.amazon.com/dp/1783963034/,1,1
Virtue and Terror (Revolutions),Book,http://www.amazon.com/dp/184467584X/,1,1
World Encyclopedia of Flags,Book,http://www.amazon.com/dp/1844768953/,1,1
The Cleanest Race: How North Koreans See Themselves and Why It Matters,Book,http://www.amazon.com/dp/1935554344/,6,1
Blue PEACE Flag 3x5 BRAND NEW 3 x 5 foot Huge Banner,Lawn & Patio,http://www.amazon.com/dp/B000EOH9OC/,1,1
New 3x5 United Nations Flag UN Peace Keeping Flags NIP,Lawn & Patio,http://www.amazon.com/dp/B000FAGHDE/,1,1
USA Flag and UK Flag Lapel Pin,Lawn & Patio,http://www.amazon.com/dp/B0014C8E1K/,1,1
"Scotch Mailing Tube 7982, 4 x 48-Inches",Office Product,http://www.amazon.com/dp/B001LVBQIM/,1,1
"Charles Leonard 2 Sided Ink and Pencil Eraser, Gray/White (80795)",Office Product,http://www.amazon.com/dp/B001T8SAB8/,1,1
NEOPlex 3' x 5' Fiesta Business Flag,Office Product,http://www.amazon.com/dp/B002NVQ9HW/,1,1
Design Toscano Isis Egyptian Sculptural Table Lamp,Furniture,http://www.amazon.com/dp/B002ZPSIKW/,1,1
LSU Flag for Louisiana State University Large Purple College Flag,Lawn & Patio,http://www.amazon.com/dp/B006BGS8RE/,1,1
Box of 100 Different Wold Flags Country Flags Toothpick Flags Perfect for the Olympics,Lawn & Patio,http://www.amazon.com/dp/B008UXY5FA/,1,1
Chinese Imperial Dragon flag - - 3x5 foot YELLOW - - China Dragon flag,Lawn & Patio,http://www.amazon.com/dp/B009I2XBJI/,1,1
Decorative Wrap 20X28 Usa Map,Art and Craft Supply,http://www.amazon.com/dp/B009Y7WFB2/,2,1
North Texas Mean Green UNT Texas State Flag,Sports,http://www.amazon.com/dp/B00B1WB76W/,1,1
3x5 George Washington Irish American Flag Banner Pennant,Lawn & Patio,http://www.amazon.com/dp/B00CYSAS80/,1,1
UNC Tar Heels Alumni Nation Stripes Flag,Sports,http://www.amazon.com/dp/B00DTW0YY8/,1,1
magFlags Large Flag Galactic Empire Star Wars | landscape flag | 1.35qm | 14.5sqft -- 100% Made in Germany -- long lasting outdoor flag,Lawn & Patio,http://www.amazon.com/dp/B00G7N2ZCK/,3,1
magFlags Large Flag Galactic Empire Star Wars | landscape flag | 1.35qm | 14.5sqft -- 100% Made in Germany -- long lasting outdoor flag,Lawn & Patio,http://www.amazon.com/dp/B00G7N2ZO8/,2,1
magFlags Large Flag Alliance to Restore the Republic a | landscape flag | 1.35qm | 14.5sqft -- 100% Made in Germany -- long lasting outdoor flag,Lawn & Patio,http://www.amazon.com/dp/B00G7N3LHS/,1,1
magFlags Large Flag The Byzantine imperial ensign ????????? ????????? | landscape flag | 1.35qm | 14.5sqft -- 100% Made in Germany -- long lasting outdoor flag,Lawn & Patio,http://www.amazon.com/dp/B00G7N5040/,1,1
Germany WWI Naval - 3' x 5' Polyester Flag (Jack),Lawn & Patio,http://www.amazon.com/dp/B00G9B2F0W/,1,1
Rainbow Love Flag 3x5ft Poly,Lawn & Patio,http://www.amazon.com/dp/B00GWR46UK/,1,1
Maryland State Flag Mouse pad,PC Accessory,http://www.amazon.com/dp/B00K590OHA/,1,1
"Cool Gadsden Flag Don't Tread On Me Snake Design Custom Non-Woven Fabric Top,Indoors/Outdoors Doormat 23.6 x 15.7",Home,http://www.amazon.com/dp/B00KVUX9BG/,1,1
magFlags Large Flag Arms of the Cossack Hetmanate 1649-1764 | landscape flag | 1.35qm | 14.5sqft | 90x150cm | 3x5ft -- 100% Made in Germany -- long lasting outdoor flag,Lawn & Patio,http://www.amazon.com/dp/B00N17Z1GC/,1,1
Thin Blue Line American Flag - 3 x 5 ft with Grommets,Lawn & Patio,http://www.amazon.com/dp/B00QY7F6QQ/,3,1
"Rothco Molon Labe Flag, 3' x 5'",Sports,http://www.amazon.com/dp/B00V3LDT26/,1,1
Maryland State Flag Mouse Pad Mousepad,PC Accessory,http://www.amazon.com/dp/B00VF2OYM2/,1,1
The Loud Packs Mens Graphic Custom Map Socks Worldwide Large Multicoloured,Apparel,http://www.amazon.com/dp/B00WFO8UBU/,1,1
Saving Hitler: An Alternate History Book,eBooks,http://www.amazon.com/dp/B011ZCUD6M/,4,1
New Earth Flag Proposed 3' x 5' Ft 210D Nylon Premium Outdoor Embroidered Flag,Lawn & Patio,http://www.amazon.com/dp/B0187Z5UG8/,1,1
Star Wars Flag | First Order Landscape | 3x5 Ft / 90x150 cm | Large Long Lasting Flag,Lawn & Patio,http://www.amazon.com/dp/B01925U8YG/,1,1
Futurama flag of Earth Re-creation of the Earth Flag Old Freebie flag 3x5ft,Lawn & Patio,http://www.amazon.com/dp/B01FPBUJMM/,1,1
Worth Dying For: The Power and Politics of Flags,eBooks,http://www.amazon.com/dp/B01G43GEA6/,1,1
Large Flag Allied States of America Jericho Flag Allied States of America from the TV series Jericho Flag outdoor flag flying flag 3x5ft banner,Lawn & Patio,http://www.amazon.com/dp/B01GPLAVMO/,1,1
Large Flag Zheleznogorsk Krasnoyarsk krai Flag outdoor Flag Flying flag 3x5ft banner,Lawn & Patio,http://www.amazon.com/dp/B01GWTGTOS/,1,1
Arthur C.Clarke's Chronicles of the Strange and Mysterious,Book,http://www.amazon.com/dp/0002176181/,1,1
No Step On Snek Flag 3' x 5',Lawn & Patio,http://www.amazon.com/dp/B06Y5S92J5/,2,1
American Nations: A History of the Eleven Rival Regional Cultures of North America,Book,http://www.amazon.com/dp/0143122029/,46,1
