name,category,amazon_link,total_mentions,subreddit_mentions
"The Art and Science of Digital Compositing, Second Edition: Techniques for Visual Effects, Animation and Motion Graphics (The Morgan Kaufmann Series in Computer Graphics)",Book,http://www.amazon.com/dp/0123706386/,9,8
Essential Mathematics for Computer Graphics Fast,Book,http://www.amazon.com/dp/1852333804/,2,2
The VES Handbook of Visual Effects: Industry Standard VFX Practices and Procedures,Book,http://www.amazon.com/dp/0240812425/,4,2
The Visual Effects Producer: Understanding the Art and Business of VFX,Book,http://www.amazon.com/dp/0240812638/,2,2
Digital Compositing for Film and Video,Book,http://www.amazon.com/dp/024081309X/,3,2
Nuke 101: Professional Compositing and Visual Effects (2nd Edition) (Digital Video & Audio Editing Courses),Book,http://www.amazon.com/dp/0321984129/,2,2
"Fluid Simulation for Computer Graphics, Second Edition",Book,http://www.amazon.com/dp/1482232839/,2,2
"3D Math Primer for Graphics and Game Development, 2nd Edition",Book,http://www.amazon.com/dp/1568817231/,20,2
Production Pipeline Fundamentals for Film and Games,Book,http://www.amazon.com/dp/0415812291/,1,1
The Invisible Art: The Legends of Movie Matte Painting,Book,http://www.amazon.com/dp/081184515X/,1,1
Introducing ZBrush 3rd Edition,Book,http://www.amazon.com/dp/1118244826/,1,1
Masters of FX: Behind the Scenes with Geniuses of Visual and Special Effects,Book,http://www.amazon.com/dp/1138845965/,1,1
"Understanding Exposure, Fourth Edition: How to Shoot Great Photographs with Any Camera",eBooks,http://www.amazon.com/dp/B0104EOJSK/,3,1
Inside VFX: An Insider's View Into The Visual Effects And Film Business,Book,http://www.amazon.com/dp/1503349241/,1,1
"Contrasting Brightly: Getting In, Surviving, and Thriving in Hollywood Visual Effects",Book,http://www.amazon.com/dp/1530119952/,1,1
Advanced RenderMan: Creating CGI for Motion Pictures (The Morgan Kaufmann Series in Computer Graphics),Book,http://www.amazon.com/dp/1558606181/,1,1
Complete Maya Programming: An Extensive Guide to MEL and C++ API (The Morgan Kaufmann Series in Computer Graphics),Book,http://www.amazon.com/dp/1558608354/,1,1
"LED Strip Lights,Shopping Festival QM-STAR Waterproof Flexible Color Changing RF Wireless Remote Controller With 10 Keys Mini RGB SMD 5050 Battery Powered Rope lights with Mini Controller 6.56ft(2M)",Home,http://www.amazon.com/dp/B06XHF7VGS/,1,1
"Python Crash Course: A Hands-On, Project-Based Introduction to Programming",Book,http://www.amazon.com/dp/1593276036/,19,1
"Physically Based Rendering, Third Edition: From Theory to Implementation",Book,http://www.amazon.com/dp/0128006455/,2,1
Character Animation Crash Course!,Book,http://www.amazon.com/dp/1879505975/,7,1
"ErgoRest - 330-016-BK - ErgoRest Articulating Arm Support - Black - Long Arm, Long Pad",Office Product,http://www.amazon.com/dp/B000PSUXLS/,2,1
Lowepro Fastpack 350 DSLR Camera Backpack,Photography,http://www.amazon.com/dp/B000YIWR8G/,6,1
Logitech MX Performance Mouse,Home,http://www.amazon.com/dp/B002HWRJBM/,8,1
RTGS 20 Cold White Color Micro LED String Lights Battery Operated on 7 Feet Silver Color Wire,Home,http://www.amazon.com/dp/B004DZBYXK/,9,1
"The Art and Science of Digital Compositing: Techniques for Visual Effects, Animation and Motion Graphics (The Morgan Kaufmann Series in Computer Graphics)",eBooks,http://www.amazon.com/dp/B004HHOC8I/,1,1
"Professional Photoshop: The Classic Guide to Color Correction, Fifth Edition",eBooks,http://www.amazon.com/dp/B004USQQOC/,1,1
Maya Python for Games and Film: A Complete Reference for Maya Python and the Maya Python API,eBooks,http://www.amazon.com/dp/B005OI23OO/,1,1
Digital Modeling ([digital]),eBooks,http://www.amazon.com/dp/B006QRYPC0/,1,1
GAMMA RAY 003 UV Glare Protection Amber Tinted Computer Readers Glasses Anti Harmful Blue Rays in Shatterproof Memory Flex Frame - +0.00 Magnification,Apparel,http://www.amazon.com/dp/B00BQ7KBV4/,10,1
ASUS MB MB168B+ 15.6-Inch Screen LED-Lit Monitor,Personal Computer,http://www.amazon.com/dp/B00H0FK2A6/,5,1
Production Pipeline Fundamentals for Film and Games,eBooks,http://www.amazon.com/dp/B00IOPYVIU/,1,1
"Elemental Magic, Volume I: The Art of Special Effects Animation",Book,http://www.amazon.com/dp/0240811631/,2,1
"Neewer Photography 160 LED Studio Lighting Kit, including (2)CN-160 Dimmable Ultra High Power Panel Digital Camera DSLR Camcorder LED Video Light (2)32"" / 80cm Tall Studio Light Stand",Photography,http://www.amazon.com/dp/B00LVTZH9I/,2,1
Ricoh Theta M15 360 Degree Spherical Panorama Camera (White),Photography,http://www.amazon.com/dp/B00OZCM70K/,4,1
The HDRI Handbook 2.0: High Dynamic Range Imaging for Photographers and CG Artists,eBooks,http://www.amazon.com/dp/B00VB46ACG/,1,1
Rotoscoping: Techniques and Tools for the Aspiring Artist,Book,http://www.amazon.com/dp/0240817044/,1,1
"Neewer 2x160 LED Dimmable Ultra High Power Panel Lighting Kit for Digital Camera Camcorder Includes: (2)CN-160 Light, (2)5.9x6.7 inches Softbox, (2)Battery Replacement, (2)6 feet Light Stand, (1)Bag",Photography,http://www.amazon.com/dp/B00Z8YDRTY/,2,1
