name,category,amazon_link,total_mentions,subreddit_mentions
Seasons They Change: The story of acid and pyschedelic folk (Genuine Jawbone Books),Book,http://www.amazon.com/dp/1906002320/,1,1
Monster Bop,Music,http://www.amazon.com/dp/B000001CCI/,1,1
Horror Hop,Music,http://www.amazon.com/dp/B00000AW49/,1,1
Villa-Lobos: Obra Completa Para Violao Solo,Music,http://www.amazon.com/dp/B00000G9MD/,1,1
Midnight Moon,Music,http://www.amazon.com/dp/B00004SSVW/,1,1
These Ghoulish Things: Horror Hits for Halloween,Music,http://www.amazon.com/dp/B000A8SXN8/,1,1
Mostly Ghostly: More Horror for Halloween,Music,http://www.amazon.com/dp/B0042FXIIU/,1,1
Halloween Nuggets: Monsters Sixties A Go-Go,Music,http://www.amazon.com/dp/B00LWWB02W/,1,1
"Wilco Ground Squirrel Bait, 4 lb",Lawn & Patio,http://www.amazon.com/dp/B01CPX5XD8/,1,1
