name,category,amazon_link,total_mentions,subreddit_mentions
Stanley 014725 25-Removable Compartment Professional Organizer,Home Improvement,http://www.amazon.com/dp/B00005QWYF/,51,19
Plano 1374 4-By Rack System 3700 Size Tackle Box,Sports,http://www.amazon.com/dp/B000E3FKTO/,17,14
"Plano Molding 5231 Double Cover Stow N Go Organizer, Porsche Red",Home Improvement,http://www.amazon.com/dp/B000HJ9514/,18,13
Ultra Pro Black PRO Dual Standard Deck Box,Apparel,http://www.amazon.com/dp/B004I0Z53U/,12,7
"Yoga Direct Extra Wide Yoga Mat, Black",Sports,http://www.amazon.com/dp/B007MTWI48/,18,7
"Ultra PRO Platinum 16 Pocket Platinum Mini American Cards, 41mm x 63mm, Clear",Sports,http://www.amazon.com/dp/B01ARJ9AT0/,7,7
Plano Double Cover Two Sided Tackle Organizer,Sports,http://www.amazon.com/dp/B001ECQPVQ/,8,7
BCW Vinyl 20 Pocket Pages With Thumb Cut 10 Ct. Pack,Hobby,http://www.amazon.com/dp/B002ZUI8PM/,7,6
"BCW Pro 20-Pocket Pages, Pocket Size: 2"" x2"", 20 Pages - Coin Collecting Supplies",Hobby,http://www.amazon.com/dp/B002KDNAU2/,30,6
Star Wars: The Force Awakens X-Wing Miniatures Game Core Set,Toy,http://www.amazon.com/dp/B014TKHEPA/,10,5
Extra Wide and Extra Long 1/4'' Deluxe Yoga Mat - Black,Sports,http://www.amazon.com/dp/B002PA1KWK/,10,5
"Pages 32 Pocket Stand Card Sleeves (10 Piece), Black, Mini",Toy,http://www.amazon.com/dp/B01CS0ZUCC/,4,4
Feldherr MINI PLUS for X-Wing Miniatures,Toy,http://www.amazon.com/dp/B00KAAXN90/,3,3
25 Ultra Pro Platinum Storage Pages: Baseball and other Sports Trading Cards Collecting Pages (PLATINUM SERIES 9-Pocket Pages),Sports,http://www.amazon.com/dp/B002XH8DV6/,3,3
"Gorilla Super Glue, 15 g",Home Improvement,http://www.amazon.com/dp/B001IY82FM/,11,3
BCW PRO 16-POCKET PAGE - TOPLOAD - (20 CT. PACK) FOR X-WING AND ARMADA UPGRADES,Health and Beauty,http://www.amazon.com/dp/B018OM5MGC/,10,3
"Plano Molding 1354 Stow N Go Tool Box with 4 23500 Series StowAways, Graphite Gray and Sandstone",Home Improvement,http://www.amazon.com/dp/B000OES590/,10,3
"Ultra Pro PRO-Binder, 4-Pocket, Black",Sports,http://www.amazon.com/dp/B0094J1PJ8/,13,3
"Case-it Dual 2-in-1 Zipper D-Ring Binder, 2 Sets of 1.5-Inch Rings with Pencil Pouch, Black, DUAL-101-BLK",Office Product,http://www.amazon.com/dp/B005O3MCQI/,3,3
Star Wars X-Wing Miniatures Game Core Set,Toy,http://www.amazon.com/dp/1616613769/,9,3
Star Wars X-Wing: TIE Interceptor Expansion Pack,Toy,http://www.amazon.com/dp/1616615389/,2,2
"Sunlite Bicycle Loose Ball Bearings 1/4"" Bag Of 144",BISS Basic,http://www.amazon.com/dp/B0012LHL9O/,2,2
"Plano 732 FTO Elite Extreme Angle ""R"" Tackle System",Sports,http://www.amazon.com/dp/B009JG53S0/,4,2
"Logan Foam Werks Foam Cutting Tool, Straight/Bevel",Art and Craft Supply,http://www.amazon.com/dp/B001JSQX3K/,5,2
Performix 12219 Plasti Dip Clear - 22 oz. Dip Can,Automotive Parts and Accessories,http://www.amazon.com/dp/B00I9SK8WK/,3,2
"Con-Tact Brand Grip Premium Non-Adhesive Non-Slip Shelf and Drawer Liner, 12-Inches by 4-Feet, Black",Home,http://www.amazon.com/dp/B001AH8PLI/,13,2
"Case-it King Sized Zip Tab 4-Inch D-Ring Zipper Binder with 5-Tab File Folder, Black, D-186-BLK",Office Product,http://www.amazon.com/dp/B005FUGOQE/,3,2
Star Wars X-Wing: Millennium Falcon Expansion Pack,Toy,http://www.amazon.com/dp/1616615354/,2,2
Plano Angled Tackle System,Sports,http://www.amazon.com/dp/B006PKXVAA/,6,2
Ultra Pro 9-Pocket Black PRO-Binder,Sports,http://www.amazon.com/dp/B004T2CBD4/,8,2
"Pages 14 Pocket Stand Card Sleeves (10 Piece), Black, Mini",Toy,http://www.amazon.com/dp/B01CS104FE/,2,2
"XL Series 38"" Square Folding Card and Game Table, Extra Large, Wheelchair Accessible (Black)",Furniture,http://www.amazon.com/dp/B016IPZI4S/,2,2
Star Wars Upgrade Card Display Pages 16 Pocket (Pack of 10) Star Wars X-Wing & Imperial Assault for Small and Mini American sized Cards,Toy,http://www.amazon.com/dp/B01CR8I2HU/,2,2
Star Wars: X-Wing - C-Roc Cruiser Expansion Pack,Toy,http://www.amazon.com/dp/B01MZBQPE6/,2,2
"Feldherr MEDIUM Star Wars X-Wing Rebel / Rebel Transpor, YT-2400, Falcon, 15 Ships by Feldherr",Toy,http://www.amazon.com/dp/B00PW7T6N8/,2,2
"Flexxfolio American 9 Pocket Card Sleeves, Black, Mini",Toy,http://www.amazon.com/dp/B019GQ9EPA/,2,2
"Post-it Tabs, 2-Inch Angled Solid, White, 50-Tabs/Pack",Office Product,http://www.amazon.com/dp/B002VL5WBS/,2,2
"Pages 32 Pocket Card Sleeves (10 Piece), Black",Toy,http://www.amazon.com/dp/B01CS0ZWC0/,2,2
"72"" HD StrapaHandle",Sports,http://www.amazon.com/dp/B00CHUAHQ8/,2,2
"Feldherr MAXI Star Wars X-Wing Imperial / Decimator, Lambda Shuttle, 50 Ships by Feldherr",Toy,http://www.amazon.com/dp/B00PW7TCJG/,2,2
Loctite Super Glue Liquid 10-Gram Longneck Bottle (234796 ),Home Improvement,http://www.amazon.com/dp/B0002YXG78/,2,2
"Sunstar Kadomaru Pro, Corner Cutter (S4765036)",Office Product,http://www.amazon.com/dp/B0076FJ7SS/,8,2
"Elmer's Tri-Fold Premium Foam Display Board, Black, 36x48 Inch",Office Product,http://www.amazon.com/dp/B00753IXV8/,3,2
Clear Sleeves: Mini American Board Game Pack (50 Sleeves),Toy,http://www.amazon.com/dp/1589945115/,2,2
100 3/16 inch Diameter Chrome Steel Bearing Balls G25 Ball Bearings VXB Brand,BISS,http://www.amazon.com/dp/B002BBD4P4/,2,2
100 count box of Ultra Pro 16 pocket sheets,Sports,http://www.amazon.com/dp/B0002AHFM4/,1,1
Krylon K01303007 Acrylic Spray Paint Crystal Clear in 11-Ounce Aerosol,Home Improvement,http://www.amazon.com/dp/B00023JE7K/,6,1
Star Wars X-Wing: Rebel Aces,Toy,http://www.amazon.com/dp/1616619112/,1,1
Tamiya USA TAM87044 Surface Primer L White,Toy,http://www.amazon.com/dp/B0000WS01E/,3,1
"Avery  Business Card Pages, Pack of 10 (76009)",Office Product,http://www.amazon.com/dp/B00006IC8I/,4,1
Star Wars X-Wing: HWK-290 Light Freighter Expansion Pack,Toy,http://www.amazon.com/dp/1616617047/,1,1
Fantasy Flight Supply Deck Boxes (Black),Toy,http://www.amazon.com/dp/161661370X/,2,1
Plano 3450-23 Double-Sided Tackle Box,Sports,http://www.amazon.com/dp/B000Y8G37C/,1,1
"Alvin Ice Tubes 37-Inches, Green (MT37-GR)",Office Product,http://www.amazon.com/dp/B000UU8O8U/,1,1
Plano 23780-00 Deep Stowaway Box with Adjustable Dividers,Sports,http://www.amazon.com/dp/B0010XFKF6/,3,1
Alvin MT37-CL Ice Tubes Clear Storage & Transport Tube  2 3/4 inches I.D. x 37 inches,Single Detail Page Misc,http://www.amazon.com/dp/B000UU6O2I/,2,1
"Alvin Professional Self-Healing Cutting Mat, 12"" x 18"", Green/Black (GBM1218)",Office Product,http://www.amazon.com/dp/B0015AOIYI/,14,1
Ultimate Mirror Chrome Aerosol Paint 3.5oz,Hobby,http://www.amazon.com/dp/B0015H1FGA/,4,1
Manfrotto 035RL Super Clamp with 2908 Standard Stud - Replaces 2900 - Black,Photography,http://www.amazon.com/dp/B0018LQVIA/,5,1
"Case-it 2-in-1 Zipper D-Ring Binder, Blue (DUAL-101-BLU)",Office Product,http://www.amazon.com/dp/B000SE0TA4/,2,1
Hobby Plasticard Variety Pack of 9 GF9 Gale Force Nine,Toy,http://www.amazon.com/dp/B001DT3VYO/,3,1
"Avery Economy Clear Sheet Protectors, Acid Free (75091)",Office Product,http://www.amazon.com/dp/B00006IC89/,5,1
Wargames Basic Paint Set,Hobby,http://www.amazon.com/dp/B000PHCTR0/,1,1
Plano Protector Four Pistol Case,Sports,http://www.amazon.com/dp/B000P3WPKK/,9,1
Xacto X5282 Basic Knife Set,Home Improvement,http://www.amazon.com/dp/B00004Z2UB/,2,1
Plano Angled Stowaway System,Sports,http://www.amazon.com/dp/B006UTVKWW/,1,1
Small Clear 9.5mm (Dia) X 3.8mm (H) Round Cabinet and Furniture Bumpers - 144 Pack,Home Improvement,http://www.amazon.com/dp/B005S1TJLC/,1,1
Manfrotto 196B-2 143BKT 2-Section Single Articulated Arm with Camera Bracket (Black),Photography,http://www.amazon.com/dp/B000OPWSYM/,4,1
Xacto X75300 Precision Razor Saw Set,Home Improvement,http://www.amazon.com/dp/B00004Z2U4/,5,1
Star Wars X-Wing: Slave I Expansion Pack (SWX07),Toy,http://www.amazon.com/dp/1616615362/,1,1
Star Wars Millennium Falcon: Owner's Workshop Manual,Book,http://www.amazon.com/dp/0345533046/,4,1
Star Wars Tusken Raiders Micro Machines Collection,Toy,http://www.amazon.com/dp/B000N76COI/,1,1
Dremel 689-01 11-Piece Rotary Tool Carving and Engraving Kit,Home Improvement,http://www.amazon.com/dp/B000L9T4C0/,2,1
Kobold Guide to Board Game Design,Book,http://www.amazon.com/dp/1936781042/,10,1
Strong Tone Quick Shade,Toy,http://www.amazon.com/dp/B004UVVTXM/,3,1
"Darice 106-118 40/Pack Foam Sheets, 6 by 9-Inch, Assorted",Art and Craft Supply,http://www.amazon.com/dp/B004LOHW6G/,2,1
100 BCW 3-Pocket Currency Size Binder Pages,Office Product,http://www.amazon.com/dp/B000IKB8TY/,1,1
Star Wars X-Wing: K-Wing Expansion Pack,Toy,http://www.amazon.com/dp/1633440710/,1,1
"Amscan Sticky Tack Party Decoration Adhesive, Blue, 6"" X 3.8""",Toy,http://www.amazon.com/dp/B000HAZCS8/,2,1
"Ultra Pro Premium PRO-BINDER Padded Leatherette Sideloading 9-Pocket Album for Pokemon, YuGiOh & Magic Cards! Also for Baseball & Sports Cards!",Toy,http://www.amazon.com/dp/B004FVJDV2/,3,1
Loctite Ultra Gel Control Super Glue 4-Gram (1363589),Office Product,http://www.amazon.com/dp/B003Y49R7G/,9,1
"Ultra Pro 12-Pocket Platinum Page with 2-1/4"" X 2-1/2"" Pockets 100 ct.",Sports,http://www.amazon.com/dp/B000ETN7N4/,2,1
Star Wars: X-Wing: Hound's Tooth Board Game,Toy,http://www.amazon.com/dp/1633440699/,1,1
"Ultra Stop Non-Slip Indoor Rug Pad, Size: 4' x 6'",Furniture,http://www.amazon.com/dp/B003UV3FJ4/,2,1
"BCW Pro 4-Pocket Photo Page, 3.5-Inch x 5.25-Inch (20 Pages)",Toy,http://www.amazon.com/dp/B003AOG42Q/,3,1
"20 (Twenty) Single Ultra Pro 8-Pocket Pages - Eight Pockets Page (1952-1956 Topps, Bowman Cards & Other Sports Cards)",Sports,http://www.amazon.com/dp/B004L5KKMI/,1,1
"Alvin ALTUBE Expandable Tube - 3 4"" I.D",CE,http://www.amazon.com/dp/B0039KHTQQ/,1,1
The Army Painter Miniature and Model Drill,Home Improvement,http://www.amazon.com/dp/B0037V3S08/,8,1
Plano 3770 Size CDS StowAway,Sports,http://www.amazon.com/dp/B000E3C3NA/,1,1
Tackle Bag - PowerBait,Sports,http://www.amazon.com/dp/B0053YR6WS/,1,1
"Helix Large Expanding Document Tube 3"" / 7.6cm Diameter",Home,http://www.amazon.com/dp/B0056HRKDW/,6,1
Ultra Pro 41mm X 63mm Mini American Board Game Sleeves 50ct,Sports,http://www.amazon.com/dp/B005D1W9CI/,1,1
Star Wars: Armada Game,Toy,http://www.amazon.com/dp/1616619937/,2,1
Star Wars X-Wing: TIE Advanced Expansion Pack,Toy,http://www.amazon.com/dp/1616613807/,1,1
Journey to Star Wars: The Force Awakens Lost Stars,Book,http://www.amazon.com/dp/1484724984/,12,1
Army Painter CP3003 Anti-Shine Matte Varnish,Toy,http://www.amazon.com/dp/B005WH4C2S/,9,1
"Light Duty Blades,Carded (5)",Toy,http://www.amazon.com/dp/B000BRBZR4/,1,1
"Elmer's Poster Tack, Reusable, 2 Ounces",Office Product,http://www.amazon.com/dp/B000BKQDB4/,9,1
Star Wars X-Wing: Imperial Raider Expansion Pack,Toy,http://www.amazon.com/dp/1616619678/,1,1
Star Wars CCG Special Edition Rare Jabba's Space Cruiser,Toy,http://www.amazon.com/dp/B0073SSBUS/,1,1
