name,category,amazon_link,total_mentions,subreddit_mentions
"Wacom Intuos Art Pen and Touch digital graphics, drawing & painting tablet Medium: (CTH690AK)",Personal Computer,http://www.amazon.com/dp/B010LHRVOY/,5,2
StarTech.com DP2MDPMF6IN 6in DisplayPort to Mini DisplayPort Video Cable Adapter - M/F,CE,http://www.amazon.com/dp/B003N3DTKY/,9,2
"Wacom Intuos Art Pen and Touch digital graphics, drawing & painting tablet",Personal Computer,http://www.amazon.com/dp/B010LHRFYU/,11,2
Cable Matters DisplayPort to Mini DisplayPort Male to Female Adapter - 6 Inches,PC Accessory,http://www.amazon.com/dp/B014DV2RGG/,2,2
StarTech.com 6 ft Mini DisplayPort to DisplayPort 1.2 Adapter Cable M/M - DisplayPort 4k with HBR2 support - 6 feet Mini DP to DP Cable,CE,http://www.amazon.com/dp/B002XVYZ82/,16,1
LX Desk Mount LCD Arm,Personal Computer,http://www.amazon.com/dp/B00358RIRC/,12,1
Datacolor DC S3P100 Spyder 3 Pro,Photography,http://www.amazon.com/dp/B0037258L4/,1,1
StarTech.com 3 ft Mini DisplayPort 1.2 Cable M/M - Mini DisplayPort 4k with HBR2 support - 3 feet Mini DP to Mini DP 1.2 Cable,CE,http://www.amazon.com/dp/B003D1BVVA/,2,1
"C&E Mini_Dis-HDMI-CB6 Mini DisplayPort to HDMI Adapter Cable, 6 feet",CE,http://www.amazon.com/dp/B003OC6LWM/,7,1
EZM Notebook/Laptop Arm Extenstion Mount Desktop Stand Clamp (002-0005),Office Product,http://www.amazon.com/dp/B0057GJ2II/,1,1
2LL3049 - Wacom Bamboo Create Pen (Silver/Black),Personal Computer,http://www.amazon.com/dp/B006SYG38U/,2,1
Wacom Wacom Pen Nib In Black (5 Pack),PC Accessory,http://www.amazon.com/dp/B007FEFNJM/,3,1
LINDY 41540 0.5m CROMO Mini Display Port Cable,Speakers,http://www.amazon.com/dp/B007FKMQ7S/,1,1
"TP-Link N300 Wireless Mini USB Adapter, Ideal for Raspberry Pi (TL-WN823N)",Personal Computer,http://www.amazon.com/dp/B0088TKTY2/,5,1
Laptop Stand (Black),Health and Beauty,http://www.amazon.com/dp/B008YKM13M/,1,1
StarTech.com Mini DisplayPort to HDMI Active Adapter - Mini DP to HDMI Video Converter 1920x1200 M/F - White,Speakers,http://www.amazon.com/dp/B00AYAF3MQ/,2,1
"Stagg SUVM-A100BK Foldable ""A"" Stand for Ukuleles, Mandolins and Violins",Musical Instruments,http://www.amazon.com/dp/B00B8ZFDQW/,1,1
"Wacom Intuos Pro Pen and Touch Tablet, Medium (PTH651) OLD MODEL",Personal Computer,http://www.amazon.com/dp/B00EN27SHY/,13,1
Wacom Intuos Pro Pen and Touch Small Tablet (PTH451),Personal Computer,http://www.amazon.com/dp/B00EN27ULS/,3,1
Wacom Wireless Bamboo Touch-Pad with Digital Stylus (CTH300K),Personal Computer,http://www.amazon.com/dp/B00EQW6M2S/,1,1
Microsoft Arc Touch Mouse Surface Edition,Personal Computer,http://www.amazon.com/dp/B00FG7MZP0/,11,1
POSRUS NibSaver Surface Cover for Wacom Intuos Pro Pen and Touch Medium (PTH651) Pen Tablet,PC Accessory,http://www.amazon.com/dp/B00HPYZ0CM/,1,1
Wacom Bamboo Stylus Feel for Galaxy Note Black,Personal Computer,http://www.amazon.com/dp/B00IWJM9SW/,12,1
"SoHo Urban Artist Extra Large Adjustable Solid Wood Drawing Board for Painting & Sketching Artist Easel- Natural Finish 19.75"" x 30""",Home,http://www.amazon.com/dp/B00IWOQ2O4/,2,1
"Wacom Intuos LP-180E Pen for Intuos CTH-480, CTH-680, CTH-480S1 with eraser",Wireless,http://www.amazon.com/dp/B00JMJEVW8/,3,1
Wacom Intuos Pen and Touch Medium Tablet CTH680 (Certified Refurbished),Personal Computer,http://www.amazon.com/dp/B00MJSAIH6/,3,1
Cable Matters Gold Plated Active Mini DisplayPort to HDMI Male to Female Adapter Supporting Eyefinity Technology & 4K Resolution,Personal Computer,http://www.amazon.com/dp/B00PJ3LSIG/,8,1
"Huion Artist Glove for Drawing Tablet (1 Unit of Free Size, Good for Right Hand or Left Hand) - Cura CR-01",Personal Computer,http://www.amazon.com/dp/B00VTHAS00/,6,1
AmazonBasics Notebook Arm Mount Tray,Personal Computer,http://www.amazon.com/dp/B010QZD6I6/,3,1
Logitech K380 Multi-Device Bluetooth Keyboard – with FLOW Cross-Computer Control and Easy-Switch up to 3 Devices – Dark Grey,Personal Computer,http://www.amazon.com/dp/B0148NPH9I/,7,1
"Accell Mini DisplayPort to DisplayPort 1.2 Cable with Locking Latch - 3.3 Feet (1 Meter), Black, DP 1.2 supports 4K UHD, 1080p, and 3D video up to 2560x1600@60Hz",Speakers,http://www.amazon.com/dp/B0163LN18M/,3,1
Artisul D13 Portable Slim Pen Digitizer Display Sketch Pad,Personal Computer,http://www.amazon.com/dp/B017OMDHN8/,1,1
"IOGEAR 2-port USB 3.1 Gen II, 10Gbps SuperSpeed+ USB-C PCI-Express Card, GIC3C2",Personal Computer,http://www.amazon.com/dp/B018YPYCOW/,1,1
Stargoods Digital Artist Drawing Glove for Graphics Tablet- 2 Woman Gloves,Art and Craft Supply,http://www.amazon.com/dp/B019VP6YV8/,2,1
"Thule Stravan 13"" MacBook Pro Sleeve (TSMS-113)",Personal Computer,http://www.amazon.com/dp/B019WHZ5LU/,1,1
IO Crest IOCrest USB 3.1 Gen II 10Gbps 2-Port Full-Duplex Controller X4 Slot Card Type-C and Type-A Ports Components Other SI-PEX20189,Personal Computer,http://www.amazon.com/dp/B01BEZ04Y6/,1,1
"gofanco 4K x 2K HDMI to DisplayPort Converter Adapter with USB Power for HDMI equipped systems to connect to DisplayPort displays, Compliant with VESA Dual-Mode DisplayPort 1.2, HDMI 1.4 and HDCP",PC Accessory,http://www.amazon.com/dp/B01BXMOREI/,5,1
Stagg SG-105 BK Violin Stand,Musical Instruments,http://www.amazon.com/dp/B01CU0YZZI/,1,1
CLIP STUDIO PAINT PRO [Download],Digital Software,http://www.amazon.com/dp/B01ESKIDZ6/,1,1
"Plugable USB-C to DisplayPort Adapter Cable (6'/1.8m) for 2016 / 2017 MacBook Pro, MacBook Retina 2015 / 2016, Chromebook Pixel, Thunderbolt 3 & More (Supports 4K / UHD Displays up to 3840x2160@60Hz)",Personal Computer,http://www.amazon.com/dp/B01EXKDRAC/,14,1
Wacom 15.6 Full HD Resolution LCD Display,Personal Computer,http://www.amazon.com/dp/B01JEO73O8/,1,1
"[Certified] Plugable Thunderbolt 3 20Gbps USB-C Cable (6.6'/2m, 3A/60W, Thunderbolt and USB Compatible)",PC Accessory,http://www.amazon.com/dp/B01KGTGXQO/,2,1
"[Certified] Plugable Thunderbolt 3 40Gbps USB-C Cable (1.65'/0.5m, 3A/60W, Thunderbolt and USB Compatible)",PC Accessory,http://www.amazon.com/dp/B01KGU0R9W/,1,1
"Naztech USB-C to USB-C Cable, Certified USB 3.1 SuperSpeed+ Supports 10Gbps Data Transfer & 100W/5A Power Delivery! 3ft. Compatible with all USB Type-C devices (New Macbook)",Personal Computer,http://www.amazon.com/dp/B01M011AMZ/,1,1
"Wacom DTHW1320H Mobile studio Pro 13 Windows 10, Intel Core i7, 512GB SSD",Personal Computer,http://www.amazon.com/dp/B01M2X7882/,1,1
"Easi-Twist Easy Grip Jar Opener, Quick Opening For Cooking or Everyday Use - Simple To Use For Children, Elderly and Arthritis Sufferers - Open any Jar or Bottle With Ease - Colors May Vary",Kitchen,http://www.amazon.com/dp/B000BKZUJK/,2,1
TriGear Premier 81 Adjustable Height & Angle Options Laptop Desk Stand w/ Over 100LBS Capacity - Black,Office Product,http://www.amazon.com/dp/B01NA9LS1P/,1,1
"Gibson Holders Two Wire Display Stand, Set of 2, Black (6A-B)",Office Product,http://www.amazon.com/dp/B000RO6CEC/,7,1
"Aidata LHA-3 LAPstand Aluminum Portable Laptop Ultrastand; Elevate your notebook to an optimal angle and height; Adjustable platform with 6 viewing angles: 20°, 22.5°, 25°, 35°, 40° and 45°",Personal Computer,http://www.amazon.com/dp/B0016LKWLO/,1,1
6 ft USB A to MicroUSB B Cable,CE,http://www.amazon.com/dp/B001AR6MI6/,5,1
