name,category,amazon_link,total_mentions,subreddit_mentions
The First American Revolution: Before Lexington and Concord,Book,http://www.amazon.com/dp/1565848152/,3,2
"Great Lakes Conflagration: Second Congo War, 1998–2003 (Africa @ War Series)",Book,http://www.amazon.com/dp/1909384666/,3,2
Paul Revere's Ride,eBooks,http://www.amazon.com/dp/B003V8AFBW/,2,2
Special Tasks,Book,http://www.amazon.com/dp/0316821152/,2,2
"Powder Alarm, 1774 (Great Events in World History)",Book,http://www.amazon.com/dp/0877690731/,2,2
"Air Wars and Aircraft: A Detailed Record of Air Combat, 1945 to the Present",Book,http://www.amazon.com/dp/0816023565/,2,2
"Arab MiGs. Volume 5: October 1973 War, Part 1",Book,http://www.amazon.com/dp/0985455446/,2,2
"Arab MiGs. Volume 6: October 1973 War, Part 2",Book,http://www.amazon.com/dp/0985455462/,2,2
"CREW-SERVED MACHINE GUNS, 5.56-mm AND 7.62-mm, M249, 5.56-MM MACHINE GUN, M60, 7.62-MM MACHINE GUN, M240B, 7.62-MM MACHINE GUN, Plus 500 free US military ... field manuals when you sample this book",eBooks,http://www.amazon.com/dp/B005D7TUO2/,,1
"Admiral Gorshkov on ""Navies in War and Peace"" - Analysis of the Cold War Soviet Navy, Use of Russian Naval Forces in Wartime and Peacetime, USSR Military Strategy, Politico-Strategic Approach to War",eBooks,http://www.amazon.com/dp/B01FOQUUHM/,,1
Battle of the Frontiers: Ardennes 1914 (Battles & Campaigns),eBooks,http://www.amazon.com/dp/B01HFL0J1Q/,,1
"Arabs at War: Military Effectiveness, 1948-1991 (Studies in War, Society, and the Military)",Book,http://www.amazon.com/dp/0803287836/,7,1
D DAY Through German Eyes - The Hidden Story of June 6th 1944,eBooks,http://www.amazon.com/dp/B00VX372UE/,6,1
War with Iraq: Critical Lessons,Book,http://www.amazon.com/dp/0972911707/,4,1
Battle Cry of Freedom: The Civil War Era,Book,http://www.amazon.com/dp/019516895X/,4,1
Out of the Mountains: The Coming Age of the Urban Guerrilla,Book,http://www.amazon.com/dp/0190230967/,4,1
Commanding the Red Army's Sherman Tanks: The World War II Memoirs of Hero of the Soviet Union Dmitriy Loza,Book,http://www.amazon.com/dp/0803229208/,4,1
"Syrian Conflagration: The Syrian Civil War, 2011-2013 (Middle East@War)",Book,http://www.amazon.com/dp/1910294101/,3,1
Stealth Aircraft: Secrets of Future Airpower,Book,http://www.amazon.com/dp/0879382082/,3,1
Continent Ablaze: The Insurgency Wars in Africa 1960 to the Present,Book,http://www.amazon.com/dp/185409128X/,2,1
"Great Lakes Holocaust: First Congo War, 1996–1997 (Africa @ War Series)",Book,http://www.amazon.com/dp/1909384658/,2,1
Wars and Insurgencies of Uganda 1971-1994 (Africa @ War Series),Book,http://www.amazon.com/dp/1910294551/,2,1
The Rwandan Patriotic Front 1990-1994 (Africa @ War Series),Book,http://www.amazon.com/dp/191029456X/,2,1
The Yom Kippur War: The Arab-Israeli War of 1973 (General Military),Book,http://www.amazon.com/dp/1846032881/,2,1
Armored Thunderbolt: The U.S. Army Sherman in World War II,Book,http://www.amazon.com/dp/0811704246/,2,1
Libyan Air Wars. Part 2: 1985–1986 (Africa @ War Series),Book,http://www.amazon.com/dp/1910294535/,2,1
Arab MiGs. Volume 3: The June 1967 War,Book,http://www.amazon.com/dp/0982553994/,2,1
Taking Sides: America's Secret Relations With a Militant Israel,Book,http://www.amazon.com/dp/0915597543/,2,1
Six Days: How the 1967 War Shaped the Middle East,Book,http://www.amazon.com/dp/0312338643/,2,1
Strategy: Second Revised Edition (Meridian),Book,http://www.amazon.com/dp/0452010713/,2,1
The Soviet Conduct of Tactical Maneuver: Spearhead of the Offensive (Soviet (Russian) Military Theory and Practice),eBooks,http://www.amazon.com/dp/B00GHJHH9U/,2,1
The Napoleonic Wars (Smithsonian History of Warfare),Book,http://www.amazon.com/dp/006085121X/,2,1
The Campaigns of Napoleon,Book,http://www.amazon.com/dp/0025236601/,2,1
"Israeli Phantoms: The 'Kurnass' in IDF/AF Service 1969 - 1988: The Ultimate F-4 Phantom II Collection, Volume 1",Book,http://www.amazon.com/dp/3935687818/,1,1
The Egyptian Strategy for the Yom Kippur War: An Analysis,Book,http://www.amazon.com/dp/0786442530/,1,1
"The Ramadan War, 1973",Book,http://www.amazon.com/dp/0882544608/,1,1
On Infantry (The Military Profession Series) (Military Profession (Paperback)),Book,http://www.amazon.com/dp/0275949729/,1,1
Russia's Air Power at the Crossroads,Book,http://www.amazon.com/dp/0833024264/,1,1
Stalin's Guerrillas: Soviet Partisans in World War II (Modern War Studies (Hardcover)),Book,http://www.amazon.com/dp/070061480X/,1,1
"The Soviet Partisan Movement, 1941-1944: A Critical Historiographical Analysis (Soviet (Russian) Military Experience)",Book,http://www.amazon.com/dp/0714644285/,1,1
The Price of Glory: Verdun 1916,Book,http://www.amazon.com/dp/0140170413/,1,1
"The Russian turmoil; memoirs: military, social, and political",Book,http://www.amazon.com/dp/1178450988/,1,1
War in Uganda: Legacy of Idi Amin,Book,http://www.amazon.com/dp/0862321468/,1,1
"Politics and the Military in Uganda, 1890–1985 (St Antony's Series)",Book,http://www.amazon.com/dp/1349187380/,1,1
Sowing the Mustard Seed: The Struggle for Freedom and Democracy in Uganda,Book,http://www.amazon.com/dp/0333642341/,1,1
Stumbling Colossus: The Red Army on the Eve of World War (Modern War Studies (Paperback)),Book,http://www.amazon.com/dp/0700617892/,1,1
Israel's Best Defense: The First Full Story of the Israeli Air Force,Book,http://www.amazon.com/dp/0517587904/,1,1
"No Victor, No Vanquished: The Yom Kippur War",Book,http://www.amazon.com/dp/0891410171/,1,1
"Elusive Victory: The Arab-Israeli Wars, 1947-1974",Book,http://www.amazon.com/dp/0060111127/,1,1
The Combat History of German Heavy Anti-Tank Unit 653 in World War II,Book,http://www.amazon.com/dp/0811732428/,1,1
The GI Offensive in Europe: The Triumph of American Infantry Divisions (Modern War Studies (Paperback)),Book,http://www.amazon.com/dp/0700612262/,1,1
After D-Day: Operation Cobra and the Normandy Breakout (Stackpole Military History Series),Book,http://www.amazon.com/dp/0811734870/,1,1
The Russians at sea; a history of the Russian Navy,Book,http://www.amazon.com/dp/B00005XU1K/,1,1
Colossus Reborn: The Red Army at War (Modern War Studies (Hardcover)),Book,http://www.amazon.com/dp/0700613536/,1,1
"Zhukov's Greatest Defeat: The Red Army's Epic Disaster in Operation Mars, 1942 (Modern War Studies)",Book,http://www.amazon.com/dp/070060944X/,1,1
"The Rzhev Slaughterhouse: The Red Army's Forgotten 15-Month Campaign Against Army Group Center, 1942-1943",Book,http://www.amazon.com/dp/1911096141/,1,1
Afgantsy: The Russians in Afghanistan 1979-89,Book,http://www.amazon.com/dp/0199322481/,1,1
The Bear Went Over the Mountain: Soviet Combat Tactics in Afghanistan,Book,http://www.amazon.com/dp/190752102X/,1,1
Stalin's Spy: Richard Sorge and the Tokyo Espionage Ring,Book,http://www.amazon.com/dp/1845113101/,1,1
Modern Naval Combat,Book,http://www.amazon.com/dp/0517613506/,1,1
An Illustrated Guide to the Modern Soviet Navy,Book,http://www.amazon.com/dp/0668055049/,1,1
Sea Power: A Naval History,Book,http://www.amazon.com/dp/B0000CKWZ7/,1,1
Carrier Air Power,Book,http://www.amazon.com/dp/0851772161/,1,1
Grant,Book,http://www.amazon.com/dp/0684849275/,1,1
The Accidental Guerrilla: Fighting Small Wars in the Midst of a Big One,Book,http://www.amazon.com/dp/0199754098/,1,1
Counterinsurgency,Book,http://www.amazon.com/dp/0199737495/,1,1
The Spanish Civil War: Revised Edition (Modern Library Paperbacks),Book,http://www.amazon.com/dp/0375755152/,1,1
"Arab MiGs. Volume 2: Supersonic Fighters, 1956-1967",Book,http://www.amazon.com/dp/098255396X/,1,1
The Israeli AF in the Yom Kippur War Facts and Figures,Book,http://www.amazon.com/dp/B00QXASN5K/,1,1
The Armies and Enemies of Imperial Rome,Book,http://www.amazon.com/dp/1326224824/,1,1
Six Days: How the 1967 War Shaped the Middle East,Book,http://www.amazon.com/dp/074344969X/,1,1
Weapons and Tactics of the Soviet Army,Book,http://www.amazon.com/dp/0710603525/,1,1
Taking Sides: America's Secret Relations with a Militant Israel 1948/1967,Book,http://www.amazon.com/dp/0571132715/,1,1
The German Air War in Russia,Book,http://www.amazon.com/dp/1877853135/,1,1
The Origins of the Arab Israeli Wars,Book,http://www.amazon.com/dp/058282320X/,1,1
Strategy: A History,Book,http://www.amazon.com/dp/1501227726/,1,1
Juan Negrin: La Republica En Guerra (Spanish Edition),Book,http://www.amazon.com/dp/8484603016/,1,1
Mind of Napoleon: A Selection of His Written and Spoken Words,Book,http://www.amazon.com/dp/0231085230/,1,1
The Grand Old Lady of No Man's Land: The Vickers Machinegun,Book,http://www.amazon.com/dp/0889351473/,1,1
The Napoleonic Wars,Book,http://www.amazon.com/dp/1780976143/,1,1
