name,category,amazon_link,total_mentions,subreddit_mentions
Sony MDR7506 Professional Large Diaphragm Headphone,Musical Instruments,https://www.amazon.com/Sony-MDR7506-Professional-Diaphragm-Headphone/dp/B000AJIF4E/ref=sr_1_1?ie=UTF8&amp;qid=1444421118&amp;sr=8-1&amp;keywords=mdr+7506,11,2
Focusrite Scarlett 2i2 (1st GENERATION) USB Recording Audio Interface,Musical Instruments,https://www.amazon.com/Focusrite-2i2-USB-Recording-Interface/dp/B005OZE9SA/ref=sr_1_1?s=musical-instruments&amp;ie=UTF8&amp;qid=1450379687&amp;sr=1-1&amp;keywords=focusrite+scarlett+2i2,8,2
The War of Art: Break Through the Blocks and Win Your Inner Creative Battles,Books,https://www.amazon.com/The-War-Art-Through-Creative/dp/1936891026,6,2
Shure SM57-LC Cardioid Dynamic Microphone,Musical Instruments,https://www.amazon.com/Shure-SM57-LC-Cardioid-Dynamic-Microphone/dp/B0000AQRST,4,2
Audio-Technica AT2020 Cardioid Condenser Studio Microphone,Musical Instruments,https://www.amazon.com/Audio-Technica-AT2020-Cardioid-Condenser-Microphone/dp/B0006H92QK,3,2
"Dance Music Manual: Tools, Toys, and Techniques",Books,https://www.amazon.com/Dance-Music-Manual-Tools-Techniques/dp/0415825644/ref=sr_1_1?s=books&amp;ie=UTF8&amp;qid=1455828296&amp;sr=1-1&amp;keywords=dance+music+manual,2,2
"Etymotic High Fidelity Earplugs, ER20 ETY-Plugs, Standard Fit Blue Tip, 1 pair","Health, Household & Baby Care",https://www.amazon.com/Etymotic-Research-ETY-Plugs-Protection-Earplugs/dp/B0044DEESS/ref=sr_1_1?ie=UTF8&amp;qid=1421889556&amp;sr=8-1&amp;keywords=musician+earplugs,35,1
"Etymotic ETY-Plugs High Fidelity Earplugs, Standard Fit, Frost Tip","Health, Household & Baby Care",https://www.amazon.com/Etymotic-Research-ETY-Plugs-Protection-Earplugs/dp/B0015WJQ7A/ref=sr_1_1?ie=UTF8&amp;qid=1440217148&amp;sr=8-1&amp;keywords=etymotic,29,1
"VELCRO Brand One Wrap Thin Ties, Black, 8 x 1/2-Inch, 100 Count (91140)",Office Products,https://www.amazon.com/VELCRO-Brand-ONE-WRAP-Management-Self-Gripping/dp/B001E1Y5O6/ref=sr_1_1?ie=UTF8&amp;qid=1475766189&amp;sr=8-1&amp;keywords=velcro+straps,23,1
"Audio-Technica ATH-M50x Professional Monitor Headphones, Black",Musical Instruments,https://www.amazon.com/Audio-Technica-ATH-M50x-Professional-Monitor-Headphones/dp/B00HVLUR86/ref=sr_1_1?ie=UTF8&amp;qid=1436327044&amp;sr=8-1&amp;keywords=audio+technica+ath-m50x,17,1
Mixing Secrets for  the Small Studio (Sound On Sound Presents...),Books,https://www.amazon.com/Mixing-Secrets-Small-Studio-Senior/dp/0240815807/ref=sr_1_1?s=books&amp;ie=UTF8&amp;qid=1455828325&amp;sr=1-1&amp;keywords=mike+senior+mixing,7,1
Audio-Technica AT2020USB Cardioid Condenser USB Microphone (Discontinued),Musical Instruments,https://www.amazon.com/Audio-Technica-AT2020USB-Cardioid-Condenser-Microphone/dp/B001AS6OYC/ref=sr_1_1?ie=UTF8&amp;qid=1432306459&amp;sr=8-1&amp;keywords=at2020+usb,5,1
CAD U37 USB Studio Condenser Recording Microphone,Musical Instruments,https://www.amazon.com/CAD-U37-Condenser-Recording-Microphone/dp/B001AIQGUO/ref=sr_1_1?ie=UTF8&amp;qid=1432306569&amp;sr=8-1&amp;keywords=usb+microphone,5,1
Music Theory for Computer Musicians,Books,https://www.amazon.com/Theory-Computer-Musicians-Michael-Hewitt/dp/1598635034/ref=sr_1_1?ie=UTF8&amp;qid=1496368915&amp;sr=8-1&amp;keywords=music+theory+for+computer+musicians,5,1
PreSonus AudioBox USB 2x2 Audio Interface - Includes Studio One,Musical Instruments,https://www.amazon.com/PreSonus-AudioBox-USB-Recording-Interface/dp/B00154KSA2/ref=sr_1_1?ie=UTF8&amp;qid=1432309297&amp;sr=8-1&amp;keywords=presonus,4,1
The Real Book: Sixth Edition,Books,https://www.amazon.com/Real-Book-Hal-Leonard-Corporation/dp/0634060384/ref=sr_1_1?s=books&amp;ie=UTF8&amp;qid=1457843799&amp;sr=1-1&amp;keywords=real+book,3,1
JBL LSR305 Professional Studio Monitor (PACK OF 2),Musical Instruments,https://www.amazon.com/JBL-LSR305-Professional-Studio-Monitor/dp/B00F1DEI8G,3,1
"Hal Leonard Bass Method - Complete Edition: Books 1, 2 and 3 Bound Together in One Easy-to-Use Volume!",Books,https://www.amazon.com/Leonard-Bass-Method-Easy---Use/dp/0793563836/ref=sr_1_1?s=books&amp;ie=UTF8&amp;qid=1376401177&amp;sr=1-1&amp;keywords=bass+method,3,1
Essential Dictionary of Orchestration: Pocket Size Book (Essential Dictionary Series),Books,https://www.amazon.com/Essential-Dictionary-Orchestration-Pocket-Series/dp/0739000217,2,1
Mastering Audio: The Art and the Science,Books,https://www.amazon.com/Mastering-Audio-Science-Bob-Katz/dp/0240818962/ref=sr_1_1?ie=UTF8&amp;qid=1423671245&amp;sr=8-1&amp;keywords=bob+katz+mastering+audio+the+art+,2,1
Tascam DR-22WL Portable Handheld Recorder with WiFi,Musical Instruments,https://www.amazon.com/Tascam-DR-22WL-Portable-Handheld-Recorder/dp/B00MIXFBKG/ref=redir_mobile_desktop?_encoding=UTF8&ref_=psd_mlt_nbc_B005NACC6M_pbi,2,1
"HEAROS High Fidelity Series Ear Plugs for Comfortable Long Term Use with Free Case, 1 Pair","Health, Household & Baby Care",https://www.amazon.com/Hearos-Fidelity-Series-Comfortable-1-Pair/dp/B0037KM8QY,2,1
On the Track: A Guide to Contemporary Film Scoring,Books,https://www.amazon.com/On-Track-Guide-Contemporary-Scoring/dp/0415941369,1,1
"On Piano Playing: Motion, Sound, and Expression",Books,https://www.amazon.com/Piano-Playing-Motion-Sound-Expression/dp/0028722809,1,1
"Neumann KU 100 Binaural Dummy Head Pressure Condenser Microphone with Plug-in Mains Unit/Cables/Case, 20Hz - 20kHz, 1000 Load Ohms Impedance",Musical Instruments,https://www.amazon.com/Neumann-Binaural-Microphone-Refurbished-Manufacturers/dp/B00C6O8WA8/ref=sr_1_1?ie=UTF8&amp;qid=1477495236&amp;sr=8-1&amp;keywords=neumann+head+mic,1,1
Sonic Seasonings + [Enhanced CD],CDs & Vinyl,https://www.amazon.com/Sonic-Seasonings-Enhanced-Wendy-Carlos/dp/B00000DGXY,1,1
The Song Machine: Inside the Hit Factory,Books,https://www.amazon.com/Song-Machine-Inside-Hit-Factory/dp/0393353281/ref=sr_1_1?ie=UTF8&amp;qid=1487535123&amp;sr=8-1&amp;keywords=song+factory,1,1
Vsonic GR02 Bass Edition,Electronics,https://www.amazon.com/VSONIC-748252255488-Vsonic-GR02-Edition/dp/B00NKGFGIW/,1,1
ART Auto-Tune Pre,Musical Instruments,https://www.amazon.com/ART-AUTOTUNEPRE-Auto-Tune-Pre/dp/B00D6PF23G/ref=sr_1_1?ie=UTF8&amp;qid=1427142211&amp;sr=8-1&amp;keywords=autotune+preamp,1,1
Focusrite VRM Box USB Interface with Headphone Output Featuring Virtual Reference Monitoring Technology,Musical Instruments,https://www.amazon.com/Focusrite-VRM-Box-Monitoring-Technology/dp/B004MVZ4XG,1,1
Complete Audio Mastering: Practical Techniques (Electronics),Books,https://www.amazon.com/Complete-Audio-Mastering-Practical-Techniques/dp/0071819576,1,1
PreSonus HP4 4-Channel Compact Headphone Amplifier,Musical Instruments,https://www.amazon.com/PreSonus-HP4-4-Channel-Headphone-Amplifier/dp/B0002D0QDQ,1,1
All You Need to Know About the Music Business: Ninth Edition,Books,https://www.amazon.com/Need-Know-About-Music-Business/dp/1501104896/ref=sr_1_1?ie=UTF8&amp;qid=1472492171&amp;sr=8-1&amp;keywords=don+passman,1,1
Mel Bay's Modern Guitar Method: Grade 1 (Grade 1),Books,https://www.amazon.com/Mel-Bays-Modern-Guitar-Method/dp/0871663546,1,1
Korg nanoKEY2 Slim-Line USB Keyboard in White,Musical Instruments,https://www.amazon.com/Korg-nanoKEY2-Slim-Line-Keyboard-White/dp/B004M8YOMQ,1,1
The Study of Orchestration (Third Edition),Books,https://www.amazon.com/Study-Orchestration-Third-Samuel-Adler/dp/039397572X/ref=sr_1_1?s=books&amp;ie=UTF8&amp;qid=1424741858&amp;sr=1-1&amp;keywords=the+study+of+orchestration,1,1
"M-Audio Oxygen 49 MKIV | 49-Key USB MIDI Keyboard & Drum Pad Controller (8 Pads / 8 Knobs / 9 Faders), VIP Software Download Included",Musical Instruments,https://www.amazon.com/dp/B00IWU2CBA/ref=psdc_11973721_t2_B00IJ6QAO2,1,1
"GLS Audio Instrument Microphone ES-57 & Mic Clip - Professional Series ES57 Dynamic Cardioid Mike Unidirectional - For Instruments, Drums, Percussion, Vocals, and more",Musical Instruments,https://www.amazon.com/GLS-Audio-Instrument-Microphone-ES-57/dp/B001W99HE8/ref=sr_1_2?s=musical-instruments&amp;ie=UTF8&amp;qid=1436326768&amp;sr=1-2&amp;keywords=gls+audio,1,1
Digitech PS0913DC Power Supply,Musical Instruments,https://www.amazon.com/DigiTech-PS0913DC-Digitech-Power-Supply/dp/B00866989Y/ref=redir_mobile_desktop?_encoding=UTF8&amp%3Bkeywords=digitech%20whammy%20power%20supply&amp%3Bpi=AC_SX236_SY340_QL65&amp%3Bqid=1490846434&amp%3Bsr=8-1&ref_=mp_s_a_1_1,1,1
Roland UM-ONE MK2 USB MIDI Interface,Musical Instruments,https://www.amazon.com/Roland-UM-ONE-MK2-MIDI-Interface/dp/B00967UN50/,1,1
WD 2TB Black My Passport Ultra Portable External Hard Drive - USB 3.0 - WDBBKD0020BBK-NESN [Old Model],Electronics,https://www.amazon.com/Black-Passport-Ultra-Portable-External/dp/B00W8XXYSM/ref=sr_1_2?ie=UTF8&amp;qid=1456927867&amp;sr=8-2&amp;keywords=2tb+western+digital+external+hard+drive,1,1
Building Walking Bass Lines (Bass Builders),Books,https://www.amazon.com/Building-Walking-Bass-Lines-Builders/dp/0793542049,1,1
Presonus Eris E5 Pair - Pair of High-Definition 2-way 5.25 inch Near Field Studio Monitors,Musical Instruments,https://www.amazon.com/Presonus-Eris-E5-Pair-High-Definition/dp/B00DP1RDHY/ref=pd_lpo_267_tr_t_3?_encoding=UTF8&amp;psc=1&amp;refRID=CHY4PMBEFZNK6C7MPZ2B,1,1
Writing Better Lyrics,Books,https://www.amazon.com/Writing-Better-Lyrics-Pat-Pattison/dp/1582975779,1,1
Zoom H4N Handy Portable Digital Recorder - 2009 Version,Musical Instruments,https://www.amazon.com/Zoom-Handy-Portable-Digital-Recorder/dp/B001QWBM62,1,1
Through Chord Melody and Beyond,Books,https://www.amazon.com/Through-Melody-Beyond-Howard-Morgen/dp/0739049844,1,1
Songwriters On Songwriting: Revised And Expanded,Books,https://www.amazon.com/Songwriters-Songwriting-Expanded-Paul-Zollo/dp/0306812657,1,1
"Stoic Synth Trail No-Show Sock - 2-Pack Nickel/Charcoal/Basin Blue, L/XL","Clothing, Shoes & Jewelry",https://www.amazon.com/Stoic-Synth-Trail-No-Show-Sock/dp/B00G3T2H1M/ref=redir_mobile_desktop?_encoding=UTF8&ref_=cm_cr_arp_mb_bdcrb_top,1,1
Vicks Personal Steam Inhaler,"Health, Household & Baby Care",https://www.amazon.com/Vicks-V1200-Personal-Steam-Inhaler/dp/B0000TN7MY,1,1
Alesis Q25 25-Key USB MIDI Keyboard Controller,Musical Instruments,https://www.amazon.com/Alesis-Q25-25-Key-Keyboard-Controller/dp/B00466HLXI/ref=sr_1_8?s=musical-instruments&amp;ie=UTF8&amp;qid=1442382721&amp;sr=1-8&amp;refinements=p_n_feature_keywords_two_browse-bin,1,1
Free Space - Binaural Microphone,Musical Instruments,https://www.amazon.com/3Dio-FSMobile-Free-Space-Microphone/dp/B00HDOOCB4/ref=pd_sbs_267_1/158-2892857-4193402?_encoding=UTF8&amp;psc=1&amp;refRID=27WNASD8AA3BJDZRM3KK,1,1
WD 12TB My Book Duo Desktop RAID External Hard Drive - USB 3.0 - WDBLWE0120JCH-NESN,Electronics,https://www.amazon.com/dp/B00LEF28CI,1,1
