name,category,amazon_link,total_mentions,subreddit_mentions
OLFA perforation cutter 28,Art and Craft Supply,http://www.amazon.com/dp/B001GLP39A/,2,1
"Palm Leaf Plates 10"" Round, 20 Pcs - Natural, Disposable, Biodegradable, Eco-Friendly Dinnerware. Microwave Safe, Fully Compostable-for Parties, Weddings and Dinner Events",Kitchen,http://www.amazon.com/dp/B01HI1Z0NA/,1,1
Reflections 160-Piece Plastic Silverware,Kitchen,http://www.amazon.com/dp/B008UZD4ZU/,1,1
40 White Square Plastic Plates - Includes 20 Dinner Plates and 20 Salad Plates by Select Settings,Kitchen,http://www.amazon.com/dp/B0184QJKBG/,1,1
"""OCCASIONS"" 50 Pack, Premium Disposable Plastic plates,( 25 Dinner + 25 Salad plates) White/ Silver Rim",Kitchen,http://www.amazon.com/dp/B01DDQ6GMS/,1,1
"Maidenform Women's Sexy Plunge Bra, Nude, 5 (38B, 36C, 34D)",Apparel,http://www.amazon.com/dp/B0083QNPBY/,1,1
Buffalo Bills Natural (White) Rock Candy On A Stick (36-ct tub white rock candy crystal sticks),Grocery,http://www.amazon.com/dp/B00LTTK8W6/,1,1
"Jiimz 30 Assorted 2"" Succulent Plants",Lawn & Patio,http://www.amazon.com/dp/B01AIMWCB4/,1,1
