name,category,amazon_link,total_mentions,subreddit_mentions
Wilton Silver Border Place Cards,Kitchen,http://www.amazon.com/dp/B002PNR0D0/,1,1
"Libbey 10 1/2 Inch Cylinder Vase in Clear, Set of 4",Home,http://www.amazon.com/dp/B003Q0G8C0/,1,1
"Luna Bazaar Mexican Papel Picado Tissue Paper Banner (ONE 13-Foot Strand with 10 Cut-Out Designs, Multicolor) - For Fiesta Decorations and Cinco de Mayo Parties",Toy,http://www.amazon.com/dp/B004QDLKLU/,1,1
"Whitehall Products Classic 6 Inch number 6 Polished Brass, 6 Inch",Home,http://www.amazon.com/dp/B005133UQ2/,1,1
White Wedding Mexican Banner Papel Picado,Kitchen,http://www.amazon.com/dp/B005IPLROU/,1,1
50 pc Polyester Banquet CHAIR COVERS Wedding Supplies,Home,http://www.amazon.com/dp/B005LXP2N6/,1,1
ElegantPark A610 Women Wedge Heel Pumps Closed Toe Ankle Strap Satin Bridal Wedding Shoes White US 7,Shoes,http://www.amazon.com/dp/B00AZXP390/,1,1
"Donna Morgan Women's Rhea Short One Shoulder Dress, Midnight, 14",Apparel,http://www.amazon.com/dp/B00C39DE36/,1,1
"Fujifilm Instax Mini Instant Film, 10 Sheets of 5 Pack × 2 (100 Sheets)",Photography,http://www.amazon.com/dp/B00G6C7XUG/,1,1
Dressystar Straps Bridesmaid Dresses Beaded Pleated Chiffon Gowns Size 10 Champagne,Apparel,http://www.amazon.com/dp/B00KVS48UO/,1,1
"Diyouth Bridal Mermaid/trumpet Gown Slips Wedding Dress Petticoat one hoop/underskirt White, Medium",Apparel,http://www.amazon.com/dp/B00M8YECO6/,1,1
"25Ft G40 Globe String Lights with Clear Bulbs, UL listed Backyard Patio Lights, Hanging Indoor/Outdoor String Light for Bistro Pergola Deckyard Tents Market Cafe Gazebo Porch Letters Party Decor, Black",Home Improvement,http://www.amazon.com/dp/B00RQHBZVS/,3,1
Getmorebeauty Women's Kitten Heel Lace Pearls Glitter Wedding Shoes 7 B(M) US,Shoes,http://www.amazon.com/dp/B010PUXG8C/,1,1
ElegantPark WP1547 Women Wedge Heel Pumps Peep Toe Rhinestones Removable Clips Satin Bridal Wedding Shoes Ivory US 9,Shoes,http://www.amazon.com/dp/B014ORX7PY/,1,1
"Skyfitting Women's Cotton Kimono Robe, Floral Bridesmaid Robes, Short Bathrobe Plus Size / 38"" Length Turquoise",Apparel,http://www.amazon.com/dp/B017XHSCPM/,1,1
"Short One Shoulder Crinkle Chiffon Bridesmaid Dress Style W10941, Malibu, 8",Apparel,http://www.amazon.com/dp/B01CMKYN5I/,1,1
ZOIC 500 LEDs Christmas Wedding Party Fairy String Light Lamp 100M(328feet) 8 Modes 31V Memory Function Warm White,Lawn & Patio,http://www.amazon.com/dp/B01DU4ROZQ/,1,1
"AMOMA Women's Plus Size Satin Peacock Design Kimono Robe Long Sleepwear S~2XL (XXX-Large, Black)",Apparel,http://www.amazon.com/dp/B01G56MIZM/,1,1
Leekida Ivory Long Cathedral Crystal Wedding Veils with Free Comb,Apparel,http://www.amazon.com/dp/B01MR6G0S1/,1,1
"Fuhaieec 50pcs 2.8-3.2"" Unfinished Natural Wood Circles with Tree Bark Log Discs for DIY Craft Christmas Rustic Wedding Ornaments",Art and Craft Supply,http://www.amazon.com/dp/B01NBFCO8U/,1,1
"Samantha Paige Sweetheart Neckline Lace Shoulder Strap Pleated A-line Chiffon Formal Dress,Champagne,4",Apparel,http://www.amazon.com/dp/B06X95SYPN/,1,1
