name,category,amazon_link,total_mentions,subreddit_mentions
Troika Patent Keyholder with 6 Rings (KYR60MC),Office Product,http://www.amazon.com/dp/B00009R4CM/,4,1
Victorinox 6 Inch Curved Fibrox Pro Boning Knife with Semi-stiff Blade,Kitchen,http://www.amazon.com/dp/B0000CF94L/,5,1
"Norton IM313 -11.5"" Three Stone Sharpening System - Fine India, Medium Crystolon, and Coarse Crystolon stones",BISS,http://www.amazon.com/dp/B0001MSA72/,2,1
"Leatherman 830039 Wave Multitool with Leather/Nylon Combination Sheath, Silver",Home Improvement,http://www.amazon.com/dp/B0002H49BC/,17,1
Obenauf's LP Boot Preservative 8 oz - Preserves and Protects Leather - Made in the US,Automotive Parts and Accessories,http://www.amazon.com/dp/B0002X520S/,19,1
"Lexol 1013 Leather Conditioner, 1-Liter",Automotive Parts and Accessories,http://www.amazon.com/dp/B000637TNM/,14,1
"Sheffield 12614 One Hand Opening Lock-Back Utility Knife, Red",Home Improvement,http://www.amazon.com/dp/B000KSR8LQ/,1,1
Cap Shaper The Cap Washing Aid,Sports,http://www.amazon.com/dp/B000NX3XTO/,5,1
Field Notes Kraft Ruled 3-Pack,Office Product,http://www.amazon.com/dp/B0034KDEMO/,15,1
Spyderco Endura4 Lightweight FRN Flat Ground PlainEdge Knife (Blue),Sports,http://www.amazon.com/dp/B003CH77WW/,7,1
UltraFire 7w 300lm Mini Cree Led Flashlight Torch Adjustable Focus Zoom Light Lamp,Home Improvement,http://www.amazon.com/dp/B006E0QAFY/,34,1
Luckies of London Brown Paper Lunch Bag (USLUKBRW),Kitchen,http://www.amazon.com/dp/B006UH4D9G/,3,1
"Camelbak Genuine Issue Fire Resistant MXC DFAR Combat Gloves, Sage Green",Apparel,http://www.amazon.com/dp/B00JAOWGMC/,1,1
Audio-Technica HP-EP Replacement Ear Pads for M Series Headphones,Musical Instruments,http://www.amazon.com/dp/B00LICYRVW/,1,1
Rosewill Mechanical Gaming Keyboard with Cherry MX Blue Switches (RK-9000V2),Personal Computer,http://www.amazon.com/dp/B00S5E4KH2/,35,1
Limited Edition Pentel P205 Gilded Series Mechanical Pencil for Drafting Color Choice (Gift Boxes) (Red),Office Product,http://www.amazon.com/dp/B01AL2XJG8/,1,1
