name,category,amazon_link,total_mentions,subreddit_mentions
John Lennon: The Life,Book,http://www.amazon.com/dp/0060754028/,4,1
Fight: Everything You Ever Wanted to Know About Ass-Kicking but Were Afraid You'd Get Your Ass Kicked for Asking,Book,http://www.amazon.com/dp/0061189227/,2,1
Pathfinders: The Golden Age Of Arabic Science,Book,http://www.amazon.com/dp/0141038365/,1,1
Traffic: Why We Drive the Way We Do (and What It Says About Us),Book,http://www.amazon.com/dp/0307277194/,32,1
The Power Broker: Robert Moses and the Fall of New York,Book,http://www.amazon.com/dp/0394720245/,23,1
White Trash: The 400-Year Untold History of Class in America,Book,http://www.amazon.com/dp/0670785970/,6,1
The Professional's Guide to Fire Eating,Book,http://www.amazon.com/dp/0971364605/,3,1
Rocks: My Life in and out of Aerosmith,Book,http://www.amazon.com/dp/1476714541/,1,1
Monkey House Blues: A Shanghai Prison Memoir,Book,http://www.amazon.com/dp/1845965663/,1,1
POOF Blasteroid Rocket,Toy,http://www.amazon.com/dp/B00000IV4X/,1,1
Putt-Putt Saves the Zoo - PC,Video Games,http://www.amazon.com/dp/B00002S6GE/,1,1
Red Devil 106370 DIY Glass Cutter,Home Improvement,http://www.amazon.com/dp/B00004YNNP/,6,1
Step 2 Up & Down Roller Coaster,Toy,http://www.amazon.com/dp/B00005KBVD/,3,1
Dave's Ghost Pepper Jolokia Private Reserve Hot Sauce,Grocery,http://www.amazon.com/dp/B000CBFTC6/,1,1
"Marpac Dohm-DS All-Natural White Noise Sound Machine, Tan",Health and Beauty,http://www.amazon.com/dp/B000KUHFGM/,64,1
Seal Shield Medical Grade Keyboard (SSKSV107),Personal Computer,http://www.amazon.com/dp/B001JBVRCY/,1,1
Klein Tools NCVT-1 Non Contact Voltage Tester,Home Improvement,http://www.amazon.com/dp/B001UAHZAM/,3,1
"Satan's Blood Hot Sauce, 1.35 Ounce",Grocery,http://www.amazon.com/dp/B0033P2RN2/,11,1
"Clean & Clear Oil Absorbing Sheets, 50 Count",Beauty,http://www.amazon.com/dp/B003V57Q5I/,9,1
Portable Urinal (Red),Sports,http://www.amazon.com/dp/B003VSCIJ4/,5,1
Air locker ap700 professional Punch Nailer/Nail Remover,Home Improvement,http://www.amazon.com/dp/B003X2QM3G/,2,1
PULL-PAL WINCH ANCHOR 11000 - Heavy-Duty,Automotive Parts and Accessories,http://www.amazon.com/dp/B004WFX8HQ/,2,1
Steel Gorget - Neck Armor - Wearable Costume Armor,Home,http://www.amazon.com/dp/B0050BK748/,1,1
Aketek 2.5-Inch HD Rotatable LED IR DVR Video Camcorder with Camera Holder,Wireless,http://www.amazon.com/dp/B0053DDNW6/,21,1
Lamplight Ultra-Pure Clear Lamp Oil - 32oz,Home,http://www.amazon.com/dp/B005CBWIMK/,3,1
Smiffy's Men's Borat Mankini,Apparel,http://www.amazon.com/dp/B005HMHNX8/,9,1
"Great Lakes Gelatin Collagen Hydrolysate Beef, Kosher, 16 oz.",Grocery,http://www.amazon.com/dp/B005KG7EDU/,23,1
"ClearMax CF-892 Electric 3-Tier Stainless Steel Chocolate Fountain, Silver",Kitchen,http://www.amazon.com/dp/B00631JGD2/,1,1
Smart Planet NCF-1 Nesquik Mini-Chocolate Fountain,Kitchen,http://www.amazon.com/dp/B0090X0RB0/,1,1
Renaissance Armor Gorget Neck Plate 18 Gauge Steel,Sports,http://www.amazon.com/dp/B009BA4HKY/,1,1
Hornet Zip Line Kit w/ Seat - 150',Sports,http://www.amazon.com/dp/B009LA29BI/,1,1
"Benchmade - Bali-Song 62 Trainer, Red Finish",Sports,http://www.amazon.com/dp/B00B29WLGE/,2,1
"Le Village Sparkling Clear Lemonade, 11.18 Oz (Pack of 24)",Grocery,http://www.amazon.com/dp/B00BWWL8YM/,1,1
LUKAS LK-530-12V Dash Cam Smart Power Supply Battery Pack (All in one Potable UPS) For Car Blackbox,GPS or Navigation System,http://www.amazon.com/dp/B00CHYKOD0/,1,1
"Timetec 62RHG680-B8G Road Hawk HD 1080P Automobile Digital Video Recorder System with GPS, Gsensor & Google Maps, Black",Car Audio or Theater,http://www.amazon.com/dp/B00CXB186Y/,12,1
2 PCS IPOW Car Safety Antiskid Hammer Seatbelt Cutter Emergency Class/Window Punch Breaker Auto Rescue Disaster Escape Tool,Home Improvement,http://www.amazon.com/dp/B00F7YMUWU/,3,1
"Black Box G1W-H Hidden Dash Cam - WDR 160° Wide Angle 4X ZOOM - Full HD 1080P H.264 2.7"" LCD Car DVR Video Recorder - Night Vision Motion Detection G-Sensor - NT96650 + AR0330",Car Audio or Theater,http://www.amazon.com/dp/B00HMNFWYW/,33,1
"PALLET JACK 27x48. CAPACITY - 5,500 Lbs. HAND PALLET TRUCK STANDARD.",Home Improvement,http://www.amazon.com/dp/B00HUX58E8/,1,1
"Star Kay White Extracts Pure Extract, Rose, 2 Ounce",Grocery,http://www.amazon.com/dp/B00IDXRNJM/,1,1
"Hot Headz Fire Blanket, 36 x 36-Inch, Red",Sports,http://www.amazon.com/dp/B00IYCE7IC/,3,1
Solar Powered Happy Dancing Flower in the Pot - A white sunflower in a RED POT,Toy,http://www.amazon.com/dp/B00KGOKAE6/,1,1
"Searzall Torch Attachment, Small, Stainless",Kitchen,http://www.amazon.com/dp/B00L2P0KNO/,28,1
"Best Choice Products Double Hammock With Space Saving Steel Stand Includes Portable Carrying Case, Desert Stripe",Lawn & Patio,http://www.amazon.com/dp/B00LOZNXRC/,9,1
"Maxx Action 30"" Toy Bolt Action Rifle with Electronic Sound",Toy,http://www.amazon.com/dp/B00LVP64FS/,1,1
10 lb Black Iron Oxide - Fe3O4 - Thermite / Magnetic Silly Putty / Pigment,Single Detail Page Misc,http://www.amazon.com/dp/B00NODXNXQ/,1,1
Zing Air Hunterz Z-Curve Bow Set,Sports,http://www.amazon.com/dp/B00U2NA2A8/,1,1
"Mpow Pro Trucker Bluetooth Headset/Cell Phone Headset with Microphone, Office Wireless Headset, Over the Head Earpiece, On Ear Car Bluetooth Headphones for Cell Phone, Skype, Truck Driver, Call Center",Wireless,http://www.amazon.com/dp/B00UYL7LIY/,2,1
OrangeA Metal Detector Waterproof MD-3010II Gold Detector Professional Automatic with LCD Display Treasure Hunter Metal Detector,Lawn & Patio,http://www.amazon.com/dp/B012S3JCY6/,1,1
DJI Phantom P3-STANDARD Quadcopter Drone with 2.7K HD Video Camera,Photography,http://www.amazon.com/dp/B013U0F6EQ/,13,1
Ubiquiti UAP-AC-LR Networks Enterprise Wi-Fi System,Personal Computer,http://www.amazon.com/dp/B015PRCBBI/,24,1
Varmint Air Rifle .177 Cal,Sports,http://www.amazon.com/dp/B01APG0SXW/,1,1
"Nexlevl Extreme Power Round Base Neodymium Magnets - 88lb+ Holding Force - 1.26"" Diameter - 2 Industrial Strength Rare Earth Magnets - Countersunk Hole for #10 Bolt - Includes 2 Free Premium Screws",Home,http://www.amazon.com/dp/B01BN7QFX4/,2,1
9/16 in X 50 ft Black Polyester Double Braided Rope,Sports,http://www.amazon.com/dp/B01D961W4E/,1,1
"Bessmate 2-Pack Star Wars Death Star Silicone Sphere Ice Ball Maker Mold,Ice Mold Tray",Kitchen,http://www.amazon.com/dp/B01J3AVOCK/,1,1
"500LBS Pulling Force, Brute Magnetics Round Neodymium Fishing Magnet with Countersunk Hole and Eyebolt, 3.54"" Diameter - Includes Threadlocker",BISS,http://www.amazon.com/dp/B01LYU81DB/,1,1
"NEXGADGET Car Dash Cam, 2.7"" Full HD 1080P Dashboard Camera Vehicle Recorder DVR Camcorder with G-Sensor, Loop Recording, Parking Mode, Motion Detection (Black)",Car Audio or Theater,http://www.amazon.com/dp/B01N3UR72C/,1,1
