name,category,amazon_link,total_mentions,subreddit_mentions
"Gator Sports Tip Toes Socks, Black, One Size",Sports,http://www.amazon.com/dp/B00341N6CG/,1,1
"Honeywell Safety TRS7-XXL NEOS Trekker Hi Nylon Overshoe, XX-Large, Mushroom",Shoes,http://www.amazon.com/dp/B004FNN6TK/,1,1
Progold Xtreme Chain Lube (4-Ounce),Sports,http://www.amazon.com/dp/B008AV2YIC/,1,1
"Ergodyne N-Ferno 6823 Wind-Resistant Hinged Balaclava, Black",Automotive Parts and Accessories,http://www.amazon.com/dp/B0091CC1OG/,7,1
4pairs Merino Wool Socks Heather Charcoal Black Large,Apparel,http://www.amazon.com/dp/B009CCRK8C/,3,1
Shimano PD-M324 SPD Dual Platform Pedal,Sports,http://www.amazon.com/dp/B00AZ2OID8/,14,1
Lowa Men's Innox Goretex Mid Hiking Boot,Shoes,http://www.amazon.com/dp/B00DZMNCBY/,1,1
"Pearl Izumi - Ride Pro Softshell Web Shoe Cover, Black, Small",Sports,http://www.amazon.com/dp/B00KJGNX1S/,1,1
Veglo Commuter X4 Wearable Rear Light,Sports,http://www.amazon.com/dp/B00QSFCL6C/,1,1
CatEye  HL-EL471RC Volt 800 Rechargeable Headlight,Sports,http://www.amazon.com/dp/B0145Z7ULW/,1,1
CatEye Rapid X3 Rear Safety Light,Sports,http://www.amazon.com/dp/B018IAS9QU/,2,1
"Reusable Heating Packs Hand Warmers - by Snappy Heat® - Instantly Hot Portable Pocket Heaters Soothing Heat Therapy For Cramps, Arthritis, Joint, Back And Muscle Pain",Health and Beauty,http://www.amazon.com/dp/B01BMZQHAS/,1,1
