name,category,amazon_link,total_mentions,subreddit_mentions
Brute Lycra Tights - Black - XXL,Sports,http://www.amazon.com/dp/B000P0QI5G/,2,2
Brute Toughtex Lycra Brief,Sports,http://www.amazon.com/dp/B0088O553W/,2,2
"Brute Men's Lycra(r) High Cut Wrestling Singlet - Black Large,Black,Large",Sports,http://www.amazon.com/dp/B00015K928/,1,1
Ten Pounds of Gold (2nd Edition): A Close Look at the NWA World Championship Belt,Book,http://www.amazon.com/dp/147752181X/,1,1
Fall Guys: The Barnums of Bounce,eBooks,http://www.amazon.com/dp/B00RKMYUSO/,2,1
"Clear Gear Sports Spray 24 Ounce Bottle - Disinfect, Clean and Deodorize Sports and Protective Gear and Eliminate the Funk",Sports,http://www.amazon.com/dp/B00BMLJOLM/,4,1
"The Squared Circle: Life, Death, and Professional Wrestling",Book,http://www.amazon.com/dp/1592408818/,4,1
