name,category,amazon_link,total_mentions,subreddit_mentions
Gorilla Mindset,Book,http://www.amazon.com/dp/1514672111/,6,3
Invisible TOKYO Season 1,TV Series Season Video on Demand,http://www.amazon.com/dp/B01J8XUU86/,3,2
"Buckingham: The Life and Political Career of George Villiers, First Duke of Buckingham, 1592-1628",Book,http://www.amazon.com/dp/0582502969/,1,1
When Breath Becomes Air,Book,http://www.amazon.com/dp/081298840X/,7,1
English Society: 1580-1680,Book,http://www.amazon.com/dp/0813532884/,1,1
Sodomy and the Pirate Tradition: English Sea Rovers in the Seventeenth-Century Caribbean,Book,http://www.amazon.com/dp/0814712363/,6,1
A Tour Through Mathematical Logic (Carus Mathematical Monographs),Book,http://www.amazon.com/dp/0883850362/,1,1
Nietzsche's Culture of Humanity: Beyond Aristocracy and Democracy in the Early Period,Book,http://www.amazon.com/dp/1107120268/,1,1
Pretentiousness: Why It Matters,Book,http://www.amazon.com/dp/156689428X/,1,1
Objectivity,Book,http://www.amazon.com/dp/189095179X/,2,1
"The Topos of Music: Geometric Logic of Concepts, Theory, and Performance",Book,http://www.amazon.com/dp/3764357312/,1,1
Sony MDRV6 Studio Monitor Headphones with CCAW Voice Coil,Speakers,http://www.amazon.com/dp/B00001WRSJ/,36,1
"Talking 12"" Donald J. Trump ""The Apprentice"" Collectible",Toy,http://www.amazon.com/dp/B0002UADAK/,3,1
Hario Skerton Ceramic Coffee Mill (100g),Kitchen,http://www.amazon.com/dp/B001802PIQ/,122,1
Rockwell RK9000 Jawhorse,Home Improvement,http://www.amazon.com/dp/B0018MRUN4/,1,1
"Indiana Jones Men's Water Repellent Wool Felt Fedora, Brown, Large",Apparel,http://www.amazon.com/dp/B001AERQZ2/,1,1
Looza Banana Juice - 33.8 Oz Pack -- 6 Case,Grocery,http://www.amazon.com/dp/B001HTJHIE/,2,1
California Exotics Butt Banger Masturbator,Health and Beauty,http://www.amazon.com/dp/B002JINHGA/,1,1
Astor Bidet Fresh Water Spray Non-Electric Mechanical Bidet Toilet Seat Attachment CB-1000,Home Improvement,http://www.amazon.com/dp/B003TPGPUW/,178,1
"Signature Sleep Memoir 8 Inch Memory Foam Mattress with Low VOC CertiPUR-US Certified Foam, 8 Inch Full Memory Foam Mattress - Available in Multiple Sizes",Furniture,http://www.amazon.com/dp/B005A4ON4K/,3,1
Paul Mitchell Tea Tree Special Shampoo and Conditioner 10.14oz Set,Prestige Beauty,http://www.amazon.com/dp/B007UKCOL6/,1,1
"Oster Rapid Blend 8-Speed Blender with Glass Jar and Bonus 3-Cup Food Processor, Metallic Red, BCCG08-RFP-NP9",Kitchen,http://www.amazon.com/dp/B009NIN2UU/,1,1
Bravo Audio V2 Class A 12AU7 Tube Multi-Hybrid Headphone Amplifier,Speakers,http://www.amazon.com/dp/B00ADR2DTG/,9,1
Hamilton Beach TrueAir Allergen-Reducing Ultra Quiet Air Cleaner Purifier with Permanent HEPA Filter (04383A),Home,http://www.amazon.com/dp/B00EIDFSBG/,6,1
Indiana Jones and The Last Crusade,Movie,http://www.amazon.com/dp/B00GIVOXVW/,1,1
Lavatools PT12 Javelin Digital Instant Read Meat Thermometer (Chipotle),Kitchen,http://www.amazon.com/dp/B00GRFHXVQ/,57,1
Creativity for Kids Fedora-ble Fashion,Toy,http://www.amazon.com/dp/B00IA8M0E8/,3,1
"Texas Instruments Nspire CX CAS Graphing Calculator, Frustration Free Package",CE,http://www.amazon.com/dp/B00IQBSXN6/,3,1
"Custom Nicolas Cage Pillowcase Standard Size 20""X30"" Design Pillow Case Cover",Home,http://www.amazon.com/dp/B00JF0HRLG/,12,1
"Columbia Men's Bugaboot Plus III Oh Wide Cold Weather Boot, Black/Charcoal, 13 EE US",Shoes,http://www.amazon.com/dp/B00Q7JMW1S/,1,1
Maxware 8-Inch Aluminum Specialty Professional PFOA Free Non-stick Coating Fry Pan Skillet/ Saute Pan Cookware,Kitchen,http://www.amazon.com/dp/B00QVTQLC0/,1,1
Sony HDR-AS200V/W Action Cam with Wi-Fi & GPS,Photography,http://www.amazon.com/dp/B00R1COCVI/,6,1
Kevin Murphy Young Again Wash And Rinse Duo 8.4 oz,Health and Beauty,http://www.amazon.com/dp/B00RJ4M6HA/,1,1
Eat Pray Love Wooden Sign with Jute Rope Hanger,Home,http://www.amazon.com/dp/B00TKVMGZ2/,1,1
Gorilla Mindset: How to Control Your Thoughts and Emotions and Live Life on Your Terms,eBooks,http://www.amazon.com/dp/B0100Q4S7E/,15,1
Wacom Intuos CTH690AB Art Pen and Touch Digital Graphics Drawing and Painting Medium Tablet,Personal Computer,http://www.amazon.com/dp/B010LHS5JO/,1,1
Free Will (Oxford Readings in Philosophy),Book,http://www.amazon.com/dp/019925494X/,2,1
ZZLL Toddler's Pray For Paris Short Sleeve T Shirt (For 2-6 Years),Apparel,http://www.amazon.com/dp/B0180IJYV4/,1,1
"Naughty Cock 8"" Premium Silicone Realistic Suction Cup Dildo (Flesh)",Health and Beauty,http://www.amazon.com/dp/B0190OWRR0/,2,1
Slammed In The Butthole By My Concept Of Linear Time,eBooks,http://www.amazon.com/dp/B01A92WFXI/,11,1
Sushi,TV Series Episode Video on Demand,http://www.amazon.com/dp/B01IIPMDDU/,1,1
Instant Read Thermometer Innoo Tech - BBQ Meat Thermometer Barbeque Recipes Ebook Included Super Fast Instant Read Digital Electronic Cooking & Food Thermometer with Collapsible Internal Probe,Kitchen,http://www.amazon.com/dp/B014SBG9BU/,2,1
Cooking Comically: Recipes So Easy You'll Actually Make Them,Book,http://www.amazon.com/dp/0399164049/,7,1
