name,category,amazon_link,total_mentions,subreddit_mentions
"Poilu: The World War I Notebooks of Corporal Louis Barthas, Barrelmaker, 1914-1918",Book,http://www.amazon.com/dp/0300212488/,2,1
The Guns of August: The Pulitzer Prize-Winning Classic About the Outbreak of World War I,Book,http://www.amazon.com/dp/0345476093/,8,1
Good-Bye to All That: An Autobiography,Book,http://www.amazon.com/dp/0385093306/,2,1
"A World Undone: The Story of the Great War, 1914 to 1918",Book,http://www.amazon.com/dp/0553382403/,9,1
The Outbreak Of World War I (Problems in European Civilization Series),Book,http://www.amazon.com/dp/0669416924/,1,1
Soissons 1918,Book,http://www.amazon.com/dp/0890968934/,1,1
Angel of the Somme,Book,http://www.amazon.com/dp/161922948X/,1,1
"Ghosts Have Warm Hands: A Memoir of the Great War, 1916-1919",Book,http://www.amazon.com/dp/1896979009/,1,1
The Wipers Times: The Complete Series of the Famous Wartime Trench Newspaper,Book,http://www.amazon.com/dp/1904435602/,1,1
Aircraft of World War 1: 1914–1918 (The Essential Aircraft Identification Guide),Book,http://www.amazon.com/dp/1906626650/,1,1
The Hundred Days Offensive: The History of the Final Campaign of World War I,eBooks,http://www.amazon.com/dp/B00VATUH12/,1,1
Germany Ascendant: The Eastern Front 1915,eBooks,http://www.amazon.com/dp/B01BY2ZYAI/,1,1
Collision of Empires: The War on the Eastern Front in 1914,eBooks,http://www.amazon.com/dp/B01DPPQ30W/,1,1
Russia's Last Gasp: The Eastern Front 1916–17,eBooks,http://www.amazon.com/dp/B01HI8M2WK/,1,1
