name,category,amazon_link,total_mentions,subreddit_mentions
Misfits of Science: An Oral History,eBooks,http://www.amazon.com/dp/B00CH7QHQ0/,,1
There Are No Children Here: The Story of Two Boys Growing Up in The Other America,Book,http://www.amazon.com/dp/0385265565/,4,1
Xavier: The Renegade Angel Season 1 & 2,DVD,http://www.amazon.com/dp/B002GSXKRO/,1,1
"Nightmare of Ecstasy: Life and Art of Edward D. Wood, Jr.",Book,http://www.amazon.com/dp/0922915040/,1,1
The Maxx Volume 1 (Wildstorm/DC Comics)),Book,http://www.amazon.com/dp/1401201245/,1,1
The Adventures of Buckaroo Banzai Across the Eighth Dimension,DVD,http://www.amazon.com/dp/B00005JKEX/,1,1
Amazing Stories: Season 2,DVD,http://www.amazon.com/dp/B01KHUXO64/,1,1
The Annotated Archy and Mehitabel (Penguin Classics),Book,http://www.amazon.com/dp/014303975X/,1,1
