name,category,amazon_link,total_mentions,subreddit_mentions
Once Upon a Time: Red's Untold Tale,Book,http://www.amazon.com/dp/1484727460/,2,2
ClearStream 2V Indoor/Outdoor HDTV Antenna with Mount - 60 Mile Range,Speakers,http://www.amazon.com/dp/B007RH5GZI/,22,1
Once Upon a Time: Shadow of the Queen,Book,http://www.amazon.com/dp/0785183930/,2,1
Once Upon a Time in Wonderland Season 1,TV Series Season Video on Demand,http://www.amazon.com/dp/B00FS6COPU/,1,1
14mm Cushion Stud Earrings - Green,Jewelry,http://www.amazon.com/dp/B00SVEZMYG/,1,1
Lost in Oz - Season 1,TV Series Season Video on Demand,http://www.amazon.com/dp/B00Z89N7IU/,1,1
"Winegard LNA-200 Boost XT HDTV Preamplifier, TV Antenna Amplifier Signal Booster, HD Digital VHF UHF Amplifier (10x Power, Low Noise, 18 dB Max Gain) - USA",Speakers,http://www.amazon.com/dp/B00DQN3R9O/,10,1
