name,category,amazon_link,total_mentions,subreddit_mentions
"Anker USB-C to USB 3.0 Cable (3.3ft) for USB Type-C Devices Including the MacBook, ChromeBook Pixel, Nexus 5X, Nexus 6P, Nokia N1 Tablet, OnePlus 2 and More",Wireless,http://www.amazon.com/dp/B0119EIHTG/,8,3
Spigen Rugged Armor OnePlus 3 Case / OnePlus 3T Case with Resilient Shock Absorption and Carbon Fiber Design for OnePlus 3 2016 - Black,Wireless,http://www.amazon.com/dp/B01H3PEWDK/,3,3
Diztronic Full Matte Black Flexible TPU Case for OnePlus One - Retail Packaging,Wireless,http://www.amazon.com/dp/B00MBS1NA0/,3,3
Orzly 0.24mm Tempered Glass Screen Protector for OnePlus ONE,Wireless,http://www.amazon.com/dp/B00KQKATH8/,3,2
TUDIA Ultra Tough OMNIX [Heavy Duty] Hybrid Full-body Protective Case with Front Cover and Built-in Screen Protector / Impact Resistant Bumpers Cover for OnePlus One (Metallic Slate),Wireless,http://www.amazon.com/dp/B00SO4XY52/,2,2
"TechMatte Micro USB to USB Type C Adapter Connector for Galaxy Note 8, S8, S8 Plus +, Google Pixel, Pixel 2, Pixel 2 XL, with 56k Resistor; Approved to Meet USB Type-C Standard (2-Pack, Black)",Personal Computer,http://www.amazon.com/dp/B0151RKYBG/,13,1
"Universal Waterproof Case, JOTO CellPhone Dry Bag Phone Pouch for iPhone 8/7/7 Plus/6S/6/6S Plus/SE/5S, Samsung Galaxy S8/S8 Plus/Note 8 6 5 4, Google Pixel 2 HTC LG Sony MOTO up to 6.0"" -Black",Wireless,http://www.amazon.com/dp/B00LBK7OSY/,5,1
"Cable Matters Micro-USB 2.0 On-The-Go (OTG) Adapter 6-Inch, Black, Pack of 2",Wireless,http://www.amazon.com/dp/B00GM0OZ4O/,3,1
iOttie Easy One Touch 2 Car Mount Holder for iPhone X 8/8s 7 7 Plus 6s Plus 6s 6 SE Samsung Galaxy S8 Plus S8 Edge S7 S6 Note 8 5,Wireless,http://www.amazon.com/dp/B00JRGOKQ8/,3,1
Cheerson CX-10 Mini 29mm 4CH 2.4GHz 6-Axis Gyro LED RC Quadcopter Bright Orange,Toys & Games,https://www.amazon.com/Cheerson-2-4GHz-6-Axis-Quadcopter-Bright/dp/B00KHGXDMO,2,1
"USB C, Veckle Type C Cable 6.6 Ft Braided Cable for Nintendo Switch, Samsung Galaxy Note 8 s8, Macbook 12 inch, ChromeBook Pixel, LG G5, Nokia N1, OnePlus 5, HTC U11, Asus Zen AiO and More, Gold",Wireless,http://www.amazon.com/dp/B010VFFRCE/,2,1
Cyber Clean 25054 Home & Office Foil Zip Bag - 2.65 oz.,Office Product,http://www.amazon.com/dp/B002C03AIA/,2,1
Casebase Premium Tempered Glass Screen Protector Twin Pack for Oneplus One,Wireless,http://www.amazon.com/dp/B00O6EQIIO/,1,1
Spigen Ultra Hybrid OnePlus 3 Case / OnePlus 3T Case with Air Cushion Technology and Hybrid Drop Protection for OnePlus 3 2016 - Crystal Clear,Wireless,http://www.amazon.com/dp/B01H3PF2AM/,1,1
"Sharpie 1829198 Metallic Fine Point Permanent Marker, Gold, 4 Count.",Office Product,http://www.amazon.com/dp/B007SYVBVI/,1,1
Efanr® Brand New Ultra Thin Aluminum Alloy Metal Protective Bumper Frame Case Cover Shield Shell for OnePlus One 1+ One Plus One (Silver),Wireless,http://www.amazon.com/dp/B00PQUFYUK/,1,1
"Poetic Revolution OnePlus 3T Case, Premium Rugged, Shock Absorption, Dust Resistant, Hybrid Case with Built-In Screen Protector for OnePlus 3T / OnePlus 3 - Black",Wireless,http://www.amazon.com/dp/B01HAPB0N8/,1,1
"OnePlus 3T / OnePlus 3 Case, TUDIA OMNIX [Heavy Duty] Hybrid [Full-body] Case with Front Cover and Built-in Screen Protector / Impact Resistant Bumpers for OnePlus 3T, OnePlus 3 (Matte Black)",Wireless,http://www.amazon.com/dp/B01IA7TEQA/,1,1
Oneplus 3 Dash Type C USB Data Fast Charge Cable,PC Accessory,http://www.amazon.com/dp/B01K43UTWG/,1,1
New Original Gold Xiaomi 2nd Piston Earphone Ii Headphone Headset Earbud with Remote & Mic for Smartphone - Gold,Wireless,http://www.amazon.com/dp/B00O9SK874/,1,1
Sabrent 22AWG USB 3.0 Extension Cable - A-Male to A-Female [Black] 3 Feet (CB-3030),PC Accessory,http://www.amazon.com/dp/B017XUSKVK/,1,1
Internal 3.8V 3100mAh Replacement Battery Fit for A0001 Oneplus One 1+ BLP571,Wireless,http://www.amazon.com/dp/B015U8VK46/,1,1
TUDIA LITE TPU Bumper Protective Case for OnePlus One Smartphone (Black),Wireless,http://www.amazon.com/dp/B00LWSRVN8/,1,1
Anker AK-71AN10W-BA USB Wall Charger Adapter - Standard Packaging - Black,Wireless,http://www.amazon.com/dp/B00OHDVXAM/,1,1
Middle Frame for Oneplus One LCD Display Touch Screen Assembly with Screen Digitizer Replacement Parts + Install Tools,Wireless,http://www.amazon.com/dp/B00V9UBOSW/,1,1
Monoprice 10' USB 2.0 A Male to Micro 5pin Male 28/24AWG Cable (8642),Personal Computer,http://www.amazon.com/dp/B00ANAR94C/,1,1
PortaPow 100cm Sync+Charge 20AWG USB-C Cable,Personal Computer,http://www.amazon.com/dp/B01BFIELVO/,1,1
"AUKEY USB C Cable 3ft, Type C to USB 3.0 Fast Charging Cable 3-Pack for Samsung Galaxy Note 8 S8 S8+, LG G5 G6 V20, HTC 10, Google Pixel 2",PC Accessory,http://www.amazon.com/dp/B01C2O1TOC/,1,1
"Comply Foam Premium Earphone Tips - Isolation T-400 (Black, 3 Pairs, S/M/L)",Speakers,http://www.amazon.com/dp/B002P7DBCK/,1,1
"OnePlus 3 / 3t Case, Diztronic Full Matte Slim-Fit Flexible TPU Case for OnePlus 3 - Black",Wireless,http://www.amazon.com/dp/B01HWTWREI/,1,1
"For OnePlus 3 case,Lucoo® Original Pelosi Sandstone Skin Case Cover For Oneplus Three / OnePlus 3 (Black)",Wireless,http://www.amazon.com/dp/B01HZC8X9K/,1,1
"OnePlus 3 / OnePlus 3T Screen Protector, Orzly 2.5D Pro-Fit V2 Tempered Glass Screen Protector for Oneplus 3 & 3T (2016 Models of Oneplus THREE / Dual SIM Version) - Transparent with BLACK Rim",Wireless,http://www.amazon.com/dp/B01LLDXJRU/,1,1
SCOSCHE MAGFMB MagicMount Flush Mount for Mobile Devices,Car Audio or Theater,http://www.amazon.com/dp/B00I608BFW/,1,1
TUDIA Slim-Fit CYGEN Dual Layer Protective Case for OnePlus One (Red),Wireless,http://www.amazon.com/dp/B00NJBVHA4/,1,1
"OnePlus 3 / OnePlus 3T Screen Protectors, TWIN PACK of Orzly 2.5D Pro-Fit V2 Tempered Glass Screen Protector for Original 2016 Model Oneplus THREE & OnePlus 3T Version - Transparent with BLACK Rim",Wireless,http://www.amazon.com/dp/B01LWOYYYZ/,1,1
"USB C Adapter, Rankie Hi-speed 3.0 USB-C to USB-A Adapter with 3.2ft Extended Cable for USB Type-C Devices Including MacBook Pro, ChromeBook Pixel, Nexus 5X, Nexus 6P, Nokia N1 Tablet and More",Wireless,http://www.amazon.com/dp/B01EL3JYKI/,1,1
"Cruzerlite OnePlus 3 / 3t Case, Bugdroid Circuit TPU Case for OnePlus Three / OnePlus 3/3T - Retail Packaging - Black",Wireless,http://www.amazon.com/dp/B01GPJCKXE/,1,1
TUDIA Slim-Fit CYGEN Dual Layer Protective Case for OnePlus One –  Metal Slate,Wireless,http://www.amazon.com/dp/B00NJBVHIG/,1,1
2.1A Micro USB Sync & Charging Cable (2M),Personal Computer,http://www.amazon.com/dp/B009Z9A32W/,1,1
