name,category,amazon_link,total_mentions,subreddit_mentions
What Every BODY is Saying: An Ex-FBI Agent’s Guide to Speed-Reading People,Book,http://www.amazon.com/dp/0061438294/,42,1
Officer Survival for Correctional Officers,Book,http://www.amazon.com/dp/1542616654/,1,1
Game over: Strategies for Redirecting Inmate Deception,Book,http://www.amazon.com/dp/1569911606/,1,1
"Streamlight 66118 Stylus Pro LED PenLight with Holster, Black",BISS,http://www.amazon.com/dp/B0015UC17E/,36,1
"Bates Men's Delta Side Zip 6 Inch Uniform Boot, Black, 11.5 M US",Shoes,http://www.amazon.com/dp/B001P4E6IC/,1,1
"Streamlight 88850 PolyTac LED Flashlight with Lithium Batteries, Black",Home Improvement,http://www.amazon.com/dp/B001S0IN46/,10,1
"Streamlight 66122 Stylus Pro Pen Light with White LED and Holster, Blue",Home Improvement,http://www.amazon.com/dp/B002E1AUEY/,2,1
Tough Gloves Men's Ultra Thin Patrol-X Cabretta unlined leather gloves no points,Apparel,http://www.amazon.com/dp/B004J0C9T2/,1,1
Fenix PD35 TAC 1000 Lumen CREE XP-L LED Tactical Flashlight with Two EdisonBright CR123A Lithium Batteries,CE,http://www.amazon.com/dp/B00DR9GWX0/,15,1
Dr. Scholl's P.R.O. Pain Relief Orthotics for Heavy Duty Support,Health and Beauty,http://www.amazon.com/dp/B016I2JFSQ/,1,1
