name,category,amazon_link,total_mentions,subreddit_mentions
Bianchi M12 Comercial Holster Hip Pistol (Green),Sports,http://www.amazon.com/dp/B000AL9CTY/,2,1
"Safariland Mid-Ride Belt Loop Adapter - UBL Style Loop, Mid-Ride Drop UBL",Sports,http://www.amazon.com/dp/B000MF48AQ/,2,1
"Safariland Low-Ride Universal Belt Loop with 2.5"" Belt Width, Black",Sports,http://www.amazon.com/dp/B000MF48C4/,5,1
"Safariland Glock 19, 23 6378 ALS Concealment Paddle Holster, Plain Black, Right Handed",Sports,http://www.amazon.com/dp/B00269ZVGG/,3,1
"Safariland 6360 ALS/SLS Level-III Retention, Mid-Ride Duty Holster, Glock 19, 23, 32, STX Basket Weave Black, Right Hand",Sports,http://www.amazon.com/dp/B002WGHJ54/,1,1
"Safariland 6360 ALS/SLS Level-III Retention, Mid-Ride Duty Holster, Glock 19, 23, 32, STX Tactical Black, Right Hand",Sports,http://www.amazon.com/dp/B003J01WMI/,1,1
"Gould & Goodrich B803-G19 Gold Line Three Slot Pancake Holster (Black) Fits GLOCK 19, 23, 32",Sports,http://www.amazon.com/dp/B004WB6K02/,2,1
Safariland 6378-477-411 ALS Paddle Holster,Sports,http://www.amazon.com/dp/B00HQSL94U/,2,1
Weckworth US Military M12 Holster,Sports,http://www.amazon.com/dp/B00K6Z33I0/,1,1
