name,category,amazon_link,total_mentions,subreddit_mentions
TravelJohn-Disposable Urinal (6 pack),Sports,http://www.amazon.com/dp/B000NV878S/,8,2
How to Win Friends & Influence People,Book,http://www.amazon.com/dp/0671027034/,222,1
Inside the White House,Book,http://www.amazon.com/dp/0671879197/,1,1
Suburban Warriors: The Origins of the New American Right (Politics and Society in Modern America),Book,http://www.amazon.com/dp/0691165734/,1,1
Anaheim's Dead: Ghostly Encounters with the Passed,Book,http://www.amazon.com/dp/0988800101/,1,1
"Jellycat Bashful Beige Bunny, Medium, 12 inches",Toy,http://www.amazon.com/dp/B00163U4LK/,3,1
Springer Dog Exerciser,Pet Products,http://www.amazon.com/dp/B0017NM4OE/,6,1
Cold Steel Brooklyn Crusher,Sports,http://www.amazon.com/dp/B001DRNLE6/,7,1
"Aspen Mulling Eggnog Mix, Original  5-Ounces Cartons (Pack of 9)",Grocery,http://www.amazon.com/dp/B001EQ4LEA/,1,1
Advion Syngenta Cockroach Gel Bait 1 Box(4 Tubes),Lawn & Patio,http://www.amazon.com/dp/B002Y2GNVM/,93,1
Cold Steel US Army Officer's Saber with All Steel Scabbard,Sports,http://www.amazon.com/dp/B0030DBHD8/,2,1
"Alera Elusion Series Mesh Mid-Back Multifunction Chair, Black",Furniture,http://www.amazon.com/dp/B003G4OJK4/,7,1
ICO Professional Whipped Cream Dispenser (1 Pint),Kitchen,http://www.amazon.com/dp/B003VOMHPS/,5,1
"Intex Jumbo Inflatable 42"" Giant Beach Ball - Crystal Clear with Translucent Dots - 59065EP / 2016",Toy,http://www.amazon.com/dp/B004EIZRZ2/,1,1
"ARRIS SURFboard DOCSIS 3.0 Cable Modem (SB6121) Time Warner Cable, Charter, Cox, Cablevision, and more (Black,Retail Packaging)",CE,http://www.amazon.com/dp/B004XC6GJ0/,85,1
InCharacter Costumes Men's Bavarian Guy,Apparel,http://www.amazon.com/dp/B0050ALKS6/,1,1
Trader Joe's Sipping Chocolate Inspired By European Tradition Decadent Chocolate Elixir Great for the Festive Season Net Wt. 9 oz.,Grocery,http://www.amazon.com/dp/B006BMOEEE/,2,1
Mohu Leaf 50 TV Antenna Amplified 50 Mile Range MH-110584,Speakers,http://www.amazon.com/dp/B00APPDX86/,12,1
"Honeywell MN10CESWW MN Series 10,000 BTU Portable Air Conditioner with Dehumidifier & Fan in White",Home,http://www.amazon.com/dp/B00B2BTAV6/,13,1
"Earth Rated 225-Count X-Large Dog Waste Bags, Lavender-Scented Poop Bags for Large Breeds and Cat Litter",Pet Products,http://www.amazon.com/dp/B00B5JJZG0/,1,1
Pizzacraft PizzaQue PC6500 Outdoor Pizza Oven,Lawn & Patio,http://www.amazon.com/dp/B00FYO368K/,3,1
"Rear View Mirror Mount for G1W, G1W-C, G1WH, GT550S and LS300W",Car Audio or Theater,http://www.amazon.com/dp/B00KM9A5F4/,4,1
"Black Box G1W-C Capacitor Model Dash Cam – Heat Resistant – Full HD 1080P H.264 2.7"" LCD Car DVR Video Recorder – WDR 140° Wide Angle 4x Zoom Motion Detection Night Vision G-Sensor",Car Audio or Theater,http://www.amazon.com/dp/B00MIO2KRC/,60,1
"IK Multimedia iRig 2 guitar interface adaptor for iPhone, iPod touch, iPad, Mac and Android",Musical Instruments,http://www.amazon.com/dp/B00T631UTC/,10,1
Shake-Away All Natural Deer & Large Animal Repellent (Coyote Urine Granules) 28.5 oz size - New EZPour Bottle & Cap,Lawn & Patio,http://www.amazon.com/dp/B00UJYAS4U/,2,1
AmazonBasics Ultra Thin Indoor TV Antenna - 50 Mile Range,Speakers,http://www.amazon.com/dp/B00X4RAEZC/,11,1
Cheerwing Syma X5SW-V3 FPV 2.4Ghz 4CH 6-Axis Gyro RC Headless Quadcopter Drone UFO with HD Wifi Camera (Black),Photography,http://www.amazon.com/dp/B011JV9GN0/,2,1
Sony XBR55X900E 55-Inch 4K Ultra HD Smart LED TV (2017 Model),Home Theater,http://www.amazon.com/dp/B01MUG21R7/,2,1
"LEVIN Dash Cam, Discreet Design High Temperature Resistance 1080P FHD 170° Wide Angle Lens with Night vision G-SENSOR Loop Recording and LCD Screen",Car Audio or Theater,http://www.amazon.com/dp/B01MY9VKEJ/,7,1
Nickel and Dimed: On (Not) Getting By in America,Book,http://www.amazon.com/dp/0312626681/,21,1
Mens San Clemente Shark T-Shirt - Stand Up Paddle Board 2XL Black,Apparel,http://www.amazon.com/dp/B072M5K2WF/,1,1
