name,category,amazon_link,total_mentions,subreddit_mentions
Autobiography of a Spiritually Incorrect Mystic,Book,http://www.amazon.com/dp/0312280718/,1,1
Passionate Journeys: Why Successful Women Joined a Cult,Book,http://www.amazon.com/dp/0472111019/,1,1
"Zorba the Buddha: Sex, Spirituality, and Capitalism in the Global Osho Movement",Book,http://www.amazon.com/dp/0520286677/,1,1
Osho The First Buddha in the Dental Chair: Amusing Anecdotes By His Personal Dentist,Book,http://www.amazon.com/dp/0615632238/,1,1
PROMISE OF PARADISE,Book,http://www.amazon.com/dp/0882681362/,1,1
"Hellbent for Enlightenment: Unmasking Sex, Power, and Death with a Notorious Master",Book,http://www.amazon.com/dp/1883991153/,1,1
