name,category,amazon_link,total_mentions,subreddit_mentions
"Passion Lubes Passion Water and Silicone Blend Hybrid Lubricant, 55 Gallon",Health and Beauty,http://www.amazon.com/dp/B00SZ3O6OU/,23,1
The Mountain Three Wolf Moon Short Sleeve Tee,Apparel,http://www.amazon.com/dp/B002HJ377A/,20,1
Promises I Can Keep: Why Poor Women Put Motherhood Before Marriage,Book,http://www.amazon.com/dp/0520241134/,5,1
Classic USB Super Nintendo Controller,Video Games,http://www.amazon.com/dp/B002JAU20W/,2,1
#15 Grizzly Bear Trap,Sports,http://www.amazon.com/dp/B00021UX68/,2,1
Sweet Sue Canned Whole Chicken without Giblets 50oz Can (Pack of 1),Grocery,http://www.amazon.com/dp/B00E3AYVA8/,2,1
"Bacon Smell - Bacon Fragrance Room Spray - Bacon Scent, by Sensory Decisions",Home,http://www.amazon.com/dp/B0118FAS1G/,1,1
