name,category,amazon_link,total_mentions,subreddit_mentions
Collapse: How Societies Choose to Fail or Succeed: Revised Edition,Book,http://www.amazon.com/dp/0143117009/,10,1
Overshoot: The Ecological Basis of Revolutionary Change,Book,http://www.amazon.com/dp/0252009886/,3,1
"Countdown: Our Last, Best Hope for a Future on Earth?",Book,http://www.amazon.com/dp/0316097756/,3,1
How Many People Can the Earth Support?,Book,http://www.amazon.com/dp/0393314952/,3,1
Limits to Growth: The 30-Year Update,Book,http://www.amazon.com/dp/193149858X/,8,1
"Overdevelopment, Overpopulation, Overshoot",Book,http://www.amazon.com/dp/1939621232/,2,1
