name,category,amazon_link,total_mentions,subreddit_mentions
The Selection,Book,http://www.amazon.com/dp/0062059947/,4,1
"Angus, Thongs and Full-Frontal Snogging: Confessions of Georgia Nicolson (Confessions of Georgia Nicolson, Book 1)",Book,http://www.amazon.com/dp/0064472272/,2,1
The Secret of Platform 13,Book,http://www.amazon.com/dp/0141302860/,1,1
The Enchanted Forest Chronicles: Dealing with Dragons / Searching for Dragons / Calling on Dragons / Talking to Dragons,Book,http://www.amazon.com/dp/0152050523/,7,1
Capital Mysteries #1: Who Cloned the President?,Book,http://www.amazon.com/dp/0307265102/,1,1
World War Z: An Oral History of the Zombie War,Book,http://www.amazon.com/dp/0307346617/,11,1
The Red Pencil,Book,http://www.amazon.com/dp/0316247804/,2,1
The Unfortunate Decisions of Dahlia Moss (A Dahlia Moss Mystery),Book,http://www.amazon.com/dp/0316385972/,1,1
Habibi (Pantheon Graphic Novels),Book,http://www.amazon.com/dp/0375424148/,6,1
On the Dog (Andrew Lost #1),Book,http://www.amazon.com/dp/0375812776/,1,1
"January Joker (Calendar Mysteries, No. 1)",Book,http://www.amazon.com/dp/0375856617/,1,1
Audacity,Book,http://www.amazon.com/dp/0399168990/,2,1
Akiko on the Planet Smoo,Book,http://www.amazon.com/dp/0440416485/,2,1
"The New Kid at School (Dragon Slayers' Academy, No. 1)",Book,http://www.amazon.com/dp/0448431084/,1,1
Attachments: A Novel,Book,http://www.amazon.com/dp/0452297540/,1,1
Twice Told: Original Stories Inspired by Original Artwork,Book,http://www.amazon.com/dp/0525468188/,1,1
"Flight of the Phoenix (Nathanial Fludd, Beastologist) (Nathaniel Fludd, Beastologist)",Book,http://www.amazon.com/dp/0547408455/,1,1
"Au Revoir, Crazy European Chick",Book,http://www.amazon.com/dp/0547856326/,1,1
The Absent Author (A to Z Mysteries),Book,http://www.amazon.com/dp/0679881689/,3,1
Feed,Book,http://www.amazon.com/dp/0763662623/,8,1
Same Sun Here,Book,http://www.amazon.com/dp/0763664510/,1,1
Egg and Spoon,Book,http://www.amazon.com/dp/0763672203/,1,1
Landline: A Novel,Book,http://www.amazon.com/dp/1250049547/,1,1
Persona (The Persona Sequence),Book,http://www.amazon.com/dp/1481425129/,2,1
Percy Jackson and the Olympians 5 Book Paperback Boxed Set (new covers w/poster) (Percy Jackson & the Olympians),Book,http://www.amazon.com/dp/1484707230/,4,1
Disconnected (Books for Young Readers),Book,http://www.amazon.com/dp/155143105X/,1,1
"Across the Nightingale Floor (Tales of the Otori, Book 1)",Book,http://www.amazon.com/dp/1573223328/,8,1
Blankets,Book,http://www.amazon.com/dp/1891830430/,9,1
"Oryx and Crake (MaddAddam Trilogy, Book 1)",eBooks,http://www.amazon.com/dp/B000FC1BNI/,4,1
The Things They Carried,eBooks,http://www.amazon.com/dp/B002TWIVNA/,5,1
Between Shades of Gray,eBooks,http://www.amazon.com/dp/B004H4XCTQ/,3,1
Fahrenheit 451: A Novel,eBooks,http://www.amazon.com/dp/B0064CPN7I/,2,1
Girl Meets Boy: Because There Are Two Sides to Every Story,eBooks,http://www.amazon.com/dp/B006OLOU8W/,1,1
Out of The Easy,eBooks,http://www.amazon.com/dp/B008EXJYT8/,2,1
Fangirl: A Novel,eBooks,http://www.amazon.com/dp/B00BMKH5NW/,2,1
Lock In: A Novel of the Near Future (Lock In Series),eBooks,http://www.amazon.com/dp/B00IHCBE1C/,5,1
Brown Girl Dreaming (Newbery Honor Book),eBooks,http://www.amazon.com/dp/B00M3Q6ONG/,2,1
5 to 1,eBooks,http://www.amazon.com/dp/B00N6PD5JO/,1,1
Lingus,eBooks,http://www.amazon.com/dp/B013M3IUSU/,1,1
Spotless (4 Book Series),Ebook Bundle,http://www.amazon.com/dp/B06XC494X5/,1,1
