name,category,amazon_link,total_mentions,subreddit_mentions
Metra 70-1761 Radio Wiring Harness For Toyota 87-Up Power 4 Speaker,Car Audio or Theater,http://www.amazon.com/dp/B0002BEQJ8/,5,1
Metra 95-8202 Toyota DDIN Multi Dash Kit,Car Audio or Theater,http://www.amazon.com/dp/B000K52CY2/,3,1
Bando 4PK1180 OEM Quality Serpentine Belt,Automotive Parts and Accessories,http://www.amazon.com/dp/B002EC570A/,1,1
Brica Seat Guardian Car Seat Protector,Baby Product,http://www.amazon.com/dp/B00B7M7BKW/,2,1
Yatour Digital Music CD Changer Bluetooth Car Adapter Hands Fress Call Adapter USB charging For Small 6+6 Toyota and LEXUS series,Car Audio or Theater,http://www.amazon.com/dp/B014PBXLYQ/,1,1
