name,category,amazon_link,total_mentions,subreddit_mentions
CUSTOM Playmat Any image you want,Toys & Games,https://www.amazon.com/CUSTOM-Playmat-Any-image-want/dp/B00L9EZC2C/ref=sr_1_1?ie=UTF8&amp;qid=1475542257&amp;sr=8-1&amp;keywords=custom+playmat,2,2
"Yu-Gi-Oh!: Legendary Decks II Themed Starters (Yugi, Kaiba, Joey)",Toys & Games,https://www.amazon.com/Yu-Gi-Oh-Legendary-Decks-Themed-Starters/dp/B01HVRXTXE/ref=sr_1_4?ie=UTF8&amp;qid=1475759081&amp;sr=8-4&amp;keywords=legendary+collection+2,1,1
"Card Divider (10 Pack), Blue",Toys & Games,https://www.amazon.com/Card-Divider-10-Pack-Blue/dp/B00YRSH36K/ref=sr_1_8?ie=UTF8&amp;qid=1461943907&amp;sr=8-8&amp;keywords=card+dividers,1,1
Yu-Gi-Oh! YAP1-JP006 Dark Magician Girl Ultra Rare,Toys & Games,https://www.amazon.com/Yu-Gi-Oh-YAP1-JP006-Dark-Magician-Ultra/dp/B004547COY,1,1
Ghost in the Shell: Stand Alone Complex Season 1 [Blu-ray],Movies & TV,https://www.amazon.com/Ghost-Shell-Complex-Season-Blu-ray/dp/B01NBHMO5B,1,1
Orblue Bag Heat Sealer - Food Saver and Creates Airtight Containers - Cabinet Accessory (Orange),Home & Kitchen,https://www.amazon.com/Orblue-Bag-Heat-Sealer-Containers/dp/B00SHK7M9M,1,1
Yu-Gi-Oh! Noble Knights of the Round Table Box Set Not Include Sleeves,Toys & Games,https://www.amazon.com/Yu-Gi-Oh-Noble-Knights-Round-Table/dp/B00PG2TJDQ/ref=sr_1_1?ie=UTF8&amp;qid=1443681131&amp;sr=8-1&amp;keywords=Noble+Knight+Round+Table,1,1
"TekMat 12-Inch X 36-Inch Long Gun Cleaning Mat with AK-47 Imprint, Black, ,",Sports & Outdoors,https://www.amazon.com/TekMat-12-Inch-36-Inch-Cleaning-Imprint/dp/B003JOLCAG/ref=sr_1_15?ie=UTF8&amp;qid=1456760834&amp;sr=8-15&amp;keywords=gun+mat,1,1
"God Horuakuti creation of light YGOPR-JP001-UR [Yu-Gi-Oh card] [Ultra Rare] ""campaign winning article"" ""winning notice included"" (japan import)",Toys & Games,https://www.amazon.com/Horuakuti-creation-YGOPR-JP001-UR-Yu-Gi-Oh-campaign/dp/B00DFTANHS,1,1
Yu-Gi-Oh! - Odd-Eyes Fusion (DOCS-EN063) - Dimension of Chaos - 1st Edition - Secret Rare,Toys & Games,https://www.amazon.com/Yu-Gi-Oh-Odd-Eyes-Fusion-DOCS-EN063-Dimension/dp/B017AKM5GY/ref=sr_1_1?ie=UTF8&amp;qid=1448174098&amp;sr=8-1&amp;keywords=odd+eyes+fusion,1,1
Twin FlipnTray Deck Case 160+ Standard Size XenoSkin Grey Card Game,Toys & Games,https://www.amazon.com/Twin-FlipnTray-Deck-Standard-XenoSkin/dp/B00VBQI9K0/ref=sr_1_6?s=toys-and-games&amp;ie=UTF8&amp;qid=1483030174&amp;sr=1-6&amp;keywords=ultimate+guard,1,1
Yu-Gi-Oh Secrets of Eternity Booster Box,Toys & Games,https://www.amazon.com/Yu-Gi-Oh-Secrets-Eternity-Booster-Box/dp/B00OPEPIQS,1,1
Yugioh Card Game SYNCHRON EXTREME English 1st Edition Structure Deck Inspired by Yusei Fudo's deck! 41 cards,Toys & Games,https://www.amazon.com/SYNCHRON-EXTREME-English-Structure-Inspired/dp/B013GX1V2S,1,1
Yu-Gi-Oh Card TCG LEGACY OF THE VALIANT BOOSTER BOX,Toys & Games,https://www.amazon.com/gp/product/B00HD7CID0?psc=1&amp;redirect=true&amp;ref_=oh_aui_detailpage_o04_s00,1,1
Yu-Gi-Oh Number 29 Master Of Pendulum Structure Deck Card Game,Toys & Games,https://www.amazon.com/Yugioh-Master-Pendulum-Structure-English/dp/B01807W1JW,1,1
Yu-Gi-Oh! Legendary Card Sleeves (70 sleeves per pack),Toys & Games,"https://www.amazon.com/Yu-Gi-Oh-Legendary-Card-Sleeves-sleeves/dp/B00KDMH6GG/ref=sr_1_6?ie=UTF8&amp;qid=1433874338&amp;sr=8-6&amp;keywords=yugioh+deck+sleeves,",1,1
Yu-Gi-Oh Japan Japanese import 15AX-JPM01 Dark Magician Girl Secret Rare,Toys & Games,https://www.amazon.com/Yu-Gi-Oh-Japanese-15AX-JPM01-Magician-Secret/dp/B00S3LEOHI/ref=sr_1_1?ie=UTF8&amp;qid=1477096067&amp;sr=8-1&amp;keywords=dark+magician+girl+rare,1,1
