name,category,amazon_link,total_mentions,subreddit_mentions
JT Sprockets JTF270.15 15T Steel Front Sprocket,Automotive Parts and Accessories,http://www.amazon.com/dp/B001AVVWKK/,2,2
K&L Supply Carburetor Repair Kit 18-2639,Automotive Parts and Accessories,http://www.amazon.com/dp/B000GU7DNG/,3,1
JT Sprockets JTR273.30 30T Steel Rear Sprocket,Automotive Parts and Accessories,http://www.amazon.com/dp/B0031703P6/,1,1
RK Racing Chain 520-SO-110 110-Links O-Ring Chain with Connecting Link,Automotive Parts and Accessories,http://www.amazon.com/dp/B007A8OOKW/,1,1
Starter Relay Solenoid KAWASAKI Ninja 250R EX250E EX 250 E 1986 1987 /B,Automotive Parts and Accessories,http://www.amazon.com/dp/B00OED0BGC/,1,1
