name,category,amazon_link,total_mentions,subreddit_mentions
"CompTIA A+ Certification All-in-One Exam Guide, Ninth Edition (Exams 220-901 & 220-902)",Books,https://www.amazon.com/CompTIA-Certification-Guide-220-901-220-902/dp/125958951X/ref=pd_lpo_sbs_14_img_0?_encoding=UTF8&amp;psc=1&amp;refRID=2DDGDT18ERRTKDJHRPK9,3,1
Flash Furniture HERCULES Series Triple Braced & Double Hinged Red Metal Folding Chair,Home & Kitchen,https://www.amazon.com/dp/B004K7DS76/ref=cm_sw_r_cp_api_dUgNzb4WH2QPB,1,1
"SGT KNOTS Twisted Sisal Rope 3/16-Inch, 1/4-Inch, 3/8-Inch, 1/2-Inch x Several Lengths (1/4""x10')",Tools & Home Improvement,https://www.amazon.com/dp/B01JTT61YG/ref=cm_sw_r_cp_api_lVgNzbFY0XJTH,1,1
"When I Die, Will I Get Better?",Books,https://www.amazon.com/When-Die-Will-Get-Better/dp/0872263754,1,1
Gold Fish Dog Costume,Pet Supplies,https://www.amazon.com/Rubies-Gold-Fish-Dog-Costume/dp/B00WBBFINK,1,1
