name,category,amazon_link,total_mentions,subreddit_mentions
"Skip Hop Baby Treetop Friends Nursery Blanket, Multi",Baby,https://www.amazon.com/Skip-Hop-Nursery-Discontinued-Manufacturer/dp/B006505AHW/ref=sr_1_3ie=UTF8&amp;qid=1450133142&amp;sr=8-3&amp;keywords=skip+hop+baby+blanket,1,1
"4TH Emotion Rabbits Like Dandelion Floral ""As You Wish"" Green Home Decor Throw Pillow Cover Pillow Case 18 x 18 Inch Cotton Linen for Sofa(Easter & Fathers' Day Gift)",Home,http://www.amazon.com/dp/B01B2EA2QY/,1,1
"Shelving Solution Large ""L"" Shaped Floating Shelf (White 45 1/4 Inch)",Home,http://www.amazon.com/dp/B00Y2EVU04/,1,1
Mother Ease 6 Pack Premium Reusable Nursing Pads I Stops Embarrassing Leaks I All Day Comfort With No Itching Or Sticking I Washable Nursing Pads That Dont Bunch or Show Through,Baby Product,http://www.amazon.com/dp/B005EYRJ8I/,1,1
"Sleeping Lamb Baby 16 Pockets Waterproof Travel Backpack Diaper Bag, Black",Baby Product,http://www.amazon.com/dp/B01DB96WYO/,1,1
"Bright Starts 5-in-1 Your Way Ball Play Activity Gym, Pink",Baby Product,http://www.amazon.com/dp/B01DCUQ0O4/,1,1
"American Baby Company Waterproof Quilted Crib Size Fitted Mattress Cover made with Organic Cotton, Natural Color",Baby Product,http://www.amazon.com/dp/B001KZH69C/,1,1
Cloud B Twilight Turtle - Purple,Baby,https://www.amazon.com/gp/product/B0054G553W/ref=s9_hps_bw_g75_i1,1,1
"Boxum 3 in 1 Portable Bassinet Diaper Change Station, Blue/Grey",Baby Product,http://www.amazon.com/dp/B00ZHMQNT8/,1,1
Belevation Womens Maternity Support Belly Band Medium Black,Apparel,http://www.amazon.com/dp/B007T993US/,1,1
"Mystery Portable Silicone LED Pusheen Cat Night Light Lamp, USB Rechargeable Children Kitty Nightlight with Warm White, Single Color and 7-Color Breathing 3-Modes for Baby Adults Bedroom (Tap Control)",Home,http://www.amazon.com/dp/B01E8M302U/,1,1
"Window Treatment Blackout Curtains Thermal Insulated Room Darkening Solid Grommet Panels / Drapes for Bedroom Living Room (Set of 2, 52 by 96 Inch Long , Coral)",Home,http://www.amazon.com/dp/B01EA62SW2/,1,1
"Graco Pack 'n Play Playard Nimble Nook, Pierce",Baby Product,http://www.amazon.com/dp/B00PX8PPQS/,1,1
"aden by aden + anais Disney Baby swaddles, winnie",Baby Product,http://www.amazon.com/dp/B01M9IT1EZ/,1,1
"Sassy Baby Disposable Diaper Sacks, 200 Count",Baby Product,http://www.amazon.com/dp/B0007V644S/,1,1
"InsideSmarts Delicates Laundry Wash Bags, Set of 4 (2 Medium & 2 Large)",Home,http://www.amazon.com/dp/B00PE1JJJI/,1,1
Gerber Unisex Baby 3 Pack Short-Sleeve Shirts with Side Snaps,Apparel,http://www.amazon.com/dp/B007C2PV4O/,1,1
What to Expect the First Year,Book,http://www.amazon.com/dp/0761181504/,1,1
I Love My Daddy Because...,Book,http://www.amazon.com/dp/0525472509/,1,1
Cotton Whisper 3 Pack Pregnancy Maternity Printing Smile Adjustable （S / 3XL）,Apparel,http://www.amazon.com/dp/B01I89S11E/,1,1
"Don't Be An Asshole!: Creating a Better World through Self Awareness, Common Sense and Decency",Book,http://www.amazon.com/dp/1481809199/,1,1
Carter's Baby Boys' Hooded Romper (Baby) - Fairisle Print - 9 Months,Apparel,http://www.amazon.com/dp/B013SLNMJ8/,1,1
Intimate Portal Women Under the Bump Maternity Panties Pregnancy Underwear 5-pk Black White Large,Apparel,http://www.amazon.com/dp/B01J760I54/,1,1
"Graco Pack 'N Play Playard with Reversible Napper and Changer, Nyssa",Baby Product,http://www.amazon.com/dp/B00H8MRBIW/,1,1
"Safety 1st Heavenly Dreams White Crib Mattress, Lightweight, Water Resistant, White",Baby Product,http://www.amazon.com/dp/B004044LD4/,1,1
Just Me and My Dad (Little Critter),Book,http://www.amazon.com/dp/0307118398/,1,1
My Neighbor Totoro Stuffed plush Small Totoro size S /Studio Ghibli by COSPA,Toy,http://www.amazon.com/dp/B00I2QLU1W/,1,1
"Dream On Me Violet 7 in 1 Convertible Life Style Crib, Black",Baby Product,http://www.amazon.com/dp/B00GULAQ4S/,1,1
simplicam HD WiFi Home Video Monitoring Camera,Photography,http://www.amazon.com/dp/B00G084VBA/,1,1
"JJ Cole Car Seat Cover, Black",Baby Product,http://www.amazon.com/dp/B00EYDBPNK/,1,1
Fruit of the Loom Women's 4 Pack Breathable Low-Rise Brief Panties,Apparel,http://www.amazon.com/dp/B00W3ODMRO/,1,1
"Ballucci Classic Floating Wall Shelves Ledge, Set of 3, White",Home,http://www.amazon.com/dp/B06ZYLFQTJ/,1,1
The Human Infant Project - Baby Keepsake Journal Memory Book,Book,http://www.amazon.com/dp/098380415X/,1,1
"Medela Calma Breastmilk Feeding Set, 5 Ounce",Baby Product,http://www.amazon.com/dp/B006T899QI/,1,1
"Union 3-in-1 Convertible Crib, Grey",Baby Product,http://www.amazon.com/dp/B00JL6LOT0/,1,1
"2XU Women's Performance Compression Run Sock, Hot Pink/Grey, Small",Sports,http://www.amazon.com/dp/B00A8EZIAA/,1,1
HALO Bassinest Swivel Sleeper – Premiere Series Bassinet,Baby Product,http://www.amazon.com/dp/B00JXN54DI/,1,1
"Munchkin Sarabear Portable Diaper Caddy, White Waffle",Baby Product,http://www.amazon.com/dp/B00674S4LU/,1,1
"SPANX Women's Power Mama Maternity Shaper, Black, A",Apparel,http://www.amazon.com/dp/B000XXL01C/,1,1
"Natural Vitality Natural Calm Magnesium Anti Stress, Original, 16 oz",Health and Beauty,http://www.amazon.com/dp/B000OQ2DL4/,1,1
"Earth Mama, Mama Bottom Balm, Safe for Pregnancy and Postpartum (2 Fl. Oz.)",Health and Beauty,http://www.amazon.com/dp/B000JVEEZC/,1,1
Summer Infant Comfy Bath Sponge,Baby Product,http://www.amazon.com/dp/B000H953Y2/,1,1
Safety 1st Easy Saver Diaper Pail,Baby Product,http://www.amazon.com/dp/B0009A4FBQ/,1,1
"Ting Ting Jahe Ginger Candy, 5.25 Ounce",Grocery,http://www.amazon.com/dp/B00029JDDE/,1,1
"The Wonder Weeks: How to Stimulate Your Baby's Mental Development and Help Him Turn His 10 Predictable, Great, Fussy Phases into Magical Leaps Forward",Book,http://www.amazon.com/dp/9491882007/,1,1
Doodle Stitching: Fresh & Fun Embroidery for Beginners,Book,http://www.amazon.com/dp/1600590616/,1,1
Retro Baby: Cut Back on All the Gear and Boost Your Baby's Development With More Than 100 Time-tested Activities (Retro Development),Book,http://www.amazon.com/dp/1581108117/,1,1
A Child's First Book of Trump,Book,http://www.amazon.com/dp/1481488007/,1,1
When Men Batter Women,Book,http://www.amazon.com/dp/1416551336/,1,1
AmazonBasics Double Rod Freestanding Closet - White,Home,http://www.amazon.com/dp/B00H7P1HC6/,1,1
"Peg Perego Primo Viaggio 4/35 Infant Car Seat with base, Atmosphere",Baby Product,http://www.amazon.com/dp/B00J3KL4HG/,1,1
"Danco 10062 Toilet Seat Bumper Kit, 4-Piece",Home Improvement,http://www.amazon.com/dp/B00EA080X0/,1,1
"Peg Perego Book Pop Up Stroller, Atmosphere",Baby Product,http://www.amazon.com/dp/B00JDSH0VC/,1,1
Olga Women's Butterfly Effect Minimizer Bra,Apparel,http://www.amazon.com/dp/B00JFV6WQG/,1,1
"Stork Craft Mission Ridge Fixed Side Convertible Crib, Gray",Baby Product,http://www.amazon.com/dp/B00JL6LPD0/,1,1
"Abuelita Mexican Chocolate Tablets, 19 oz",Grocery,http://www.amazon.com/dp/B00E0MX47U/,1,1
Philips Avent DECT Baby Monitor with Temperature Sensor,Baby Product,http://www.amazon.com/dp/B00E9RMHD8/,1,1
"Unrefined Cocoa Butter by Better Shea Butter - Raw & 100% Pure - Natural Cocoa Scent - Use in DIY Lotion, Lotion Bars and Sticks, Lip Balm, Body Butter and Many More Skin Care Creations - 1 lb (16 oz)",Beauty,http://www.amazon.com/dp/B00L3FP10K/,1,1
Fruit of the Loom Women's 6 Pack Beyond Soft Brief Panties,Apparel,http://www.amazon.com/dp/B00L66KOTO/,1,1
"Mango Butter Pure Raw Unrefined - 16 Oz Jar - All Natural Skin Moisturizer with Intensive Healing Properties - Unscented - Use for Body Butter, Lotions, Cream, Hair Products - Aspen Naturals Brand",Beauty,http://www.amazon.com/dp/B00L9DUHQE/,1,1
"Bucilla My 1st Stitch Mini Counted Cross Stitch Kit, 45641 Owl",Art and Craft Supply,http://www.amazon.com/dp/B00C2O7M1M/,1,1
"Arm's Reach  Euro Mini Arc Co-Sleeper Bedside Bassinet, Natural",Baby Product,http://www.amazon.com/dp/B00BFBUYFE/,1,1
"Spectra Baby USA All New Spectra 9 Plus Advanced Electric Breast Pump with Rechargeable Battery, 3.3 Pound",Health and Beauty,http://www.amazon.com/dp/B00MJLIW4O/,1,1
Push Back: Guilt in the Age of Natural Parenting,Book,http://www.amazon.com/dp/0062407341/,1,1
Nojo Love Birds 100% Cotton Crib Sheet,Baby Product,http://www.amazon.com/dp/B00B53KFEW/,1,1
Intimate Portal Women Under the Bump Maternity Panties Pregnancy Underwear 5-pk Plain Multicolor Small,Apparel,http://www.amazon.com/dp/B01LWKDR5X/,1,1
MamaRoo 4 Classic Infant Seat in Grey Natural Body Movements with Bluetooth by 4moms,Baby Product,http://www.amazon.com/dp/B00PK3EO1S/,1,1
sugarSNAP Files A Set of 5 Mesh Diaper Bag Organizer Inserts gray+yellow,Baby Product,http://www.amazon.com/dp/B00AZK87M8/,1,1
Your Baby's First Word Will Be DADA,Book,http://www.amazon.com/dp/125007181X/,1,1
Kernels All Dressed Popcorn Seasoning,Grocery,http://www.amazon.com/dp/B00Q3CL8KK/,1,1
"Planet Wise Reusable Diaper Pail Liner, Hedgehog",Baby Product,http://www.amazon.com/dp/B00A3V33TQ/,1,1
"Safety 1st Amble Quad Travel System with Onboard 22 Infant Car Seat, Polynesian",Baby Product,http://www.amazon.com/dp/B00R7Q3B5G/,1,1
"Baby Mushroom Baby Bello Organic Play Mat for Babies, Toddlers and Kids, Ivory",Baby Product,http://www.amazon.com/dp/B00RNOKRKE/,1,1
"Rubie's Costume Trick Or Treat Sweeties Going Bananas Bunting Costume, Yellow, Newborn",Apparel,http://www.amazon.com/dp/B007JAAA72/,1,1
"Genuine Australian Sheepskin Rug Four Pelt Ivory Fur, Quarto",Furniture,http://www.amazon.com/dp/B00URV4K80/,1,1
"Freemie Collection Cups The Only Hands Free and Concealable Breast Pump Milk Collection System, Clear, 25/28 mm Funnels",Baby Product,http://www.amazon.com/dp/B00UV6JDN8/,1,1
"Navy Stars Kids Room Curtain - NICETOWN Space Inspired Night Sky Twinkle Star Curtain, Creative Blackout Window Drape for Bedroom (1 Panel, 52 x 63 inch Panel, Navy Blue)",Home,http://www.amazon.com/dp/B01M2UIE22/,1,1
"Montessori from the Start: The Child at Home, from Birth to Age Three",Book,http://www.amazon.com/dp/0805211128/,1,1
"Snuggle Me Organic The Original Co-Sleeping Baby Bed, Infant Lounger, Portable Crib and Bassinet Mattress Pad for Newborn to 6 Months",Baby Product,http://www.amazon.com/dp/B00V2LVE5Q/,1,1
Saridjo Maternity Air Mattress / Bed Maternity Pillow / Float Surf Pool Bed Inflatable Pregnancy Swim Lounger - Baby Shower Gift,Toy,http://www.amazon.com/dp/B00XB33EL0/,1,1
Amelia And Eleanor Go For A Ride,Book,http://www.amazon.com/dp/059096075X/,1,1
Carter's Unisex Baby 3 Pack Side Snap Bodysuits (Baby) - Multi - 9M,Apparel,http://www.amazon.com/dp/B00XZA5MZU/,1,1
"GoodSense Clearlax, Polyethylene Glycol, Osmotic Laxative 3350 Powder for Solution, 17.9 Ounce",Health and Beauty,http://www.amazon.com/dp/B004AI9CM0/,1,1
Foscam FI8918W Wireless/Wired Pan & Tilt IP/Network Camera with 8 Meter Night Vision and 3.6mm Lens (67° Viewing Angle),Photography,http://www.amazon.com/dp/B0046710G6/,1,1
Six Practical Lessons for an Easier Childbirth: The Classic Book on the Lamaze Method,Book,http://www.amazon.com/dp/0553373692/,1,1
Intimate Portal Women Under the Bump Maternity Panties Pregnancy Underwear 2-Pk Gray Black Large,Apparel,http://www.amazon.com/dp/B011NVQ9DQ/,1,1
"Alva Baby 2 Pack Baby Wet Bag, Wet and Dry Cloth Diaper Bags, Hanging Wet Bag For Travel L0537",Baby Product,http://www.amazon.com/dp/B0126AACZE/,1,1
"Luvable Friends 10-Piece Baby Socks Gift Set, Blue, 0-9 Months",Apparel,http://www.amazon.com/dp/B003Y7SFAI/,1,1
Luxe Spray Bidet Attachment Handheld Kit All Metal Hose & Adapter,Home Improvement,http://www.amazon.com/dp/B016BZ338I/,1,1
"Angelcare Baby Sound Monitor, White",Baby Product,http://www.amazon.com/dp/B003FGWA8G/,1,1
"Windsor Glider and Ottoman, White with Gray Cushion",Baby Product,http://www.amazon.com/dp/B017XRDV5S/,1,1
Dermoplast Pain Relieving Spray-2.75 Oz,Health and Beauty,http://www.amazon.com/dp/B002MCD16O/,1,1
"100% Pure Organic & Natural Vitamin E Oil- 30,000 IU infused w/Extra Virgin Olive Oil-Lge 2oz. Daily Moisturizer for Anti Aging- Reduces Wrinkles & Scars. Best Skin Care Product for Women & Men",Beauty,http://www.amazon.com/dp/B018PNHQZ0/,1,1
"Premium Stainless Steel Bathroom Handheld Bidet Toilet Sprayer - Shattaf Sprayer Best Used for Personal Hygiene and Potty Toilet Spray - Perfect Bottom Cleaner Spray & Shower Attachment, by Aqua Nexis",Home Improvement,http://www.amazon.com/dp/B01A9A9MUO/,1,1
10015 Blue 6'5x9'2 Area Rug Carpet Large New,Furniture,http://www.amazon.com/dp/B01A9DZIYK/,1,1
Animal Adventure Dinosaur Rocker - Triceratops,Toy,http://www.amazon.com/dp/B01B5DIFA2/,1,1
"Always Maxi Overnight Extra Heavy Flow With Wings, Unscented Pads 20 Count (Pack of 2)",Health and Beauty,http://www.amazon.com/dp/B0029NYQ6A/,1,1
