name,category,amazon_link,total_mentions,subreddit_mentions
Expecting Better: Why the Conventional Pregnancy Wisdom Is Wrong--and What You Really Need to Know,Book,http://www.amazon.com/dp/0143125702/,34,19
"Taking Charge of Your Fertility, 10th Anniversary Edition: The Definitive Guide to Natural Birth Control, Pregnancy Achievement, and Reproductive Health",Book,http://www.amazon.com/dp/0060881909/,53,8
"The Baby Owner's Manual: Operating Instructions, Trouble-Shooting Tips, and Advice on First-Year Maintenance",Book,http://www.amazon.com/dp/1594745978/,14,6
"The Birth Partner - Revised 4th Edition: A Complete Guide to Childbirth for Dads, Doulas, and All Other Labor Companions",Book,http://www.amazon.com/dp/155832819X/,6,6
The Impatient Woman's Guide to Getting Pregnant,Book,http://www.amazon.com/dp/1451620705/,42,5
Ina May's Guide to Childbirth,Book,http://www.amazon.com/dp/0553381156/,6,4
"Leachco Snoogle Total Body Pillow, Ivory",Home,http://www.amazon.com/dp/B0000635WI/,7,3
The Expectant Father: The Ultimate Guide for Dads-to-Be,Book,http://www.amazon.com/dp/0789212137/,5,3
"Carebag Medical Grade Vomit Bag with Super Absorbent Pad, 20 Count",Health and Beauty,http://www.amazon.com/dp/B0051AZZCM/,5,2
"When You're Expecting Twins, Triplets, or Quads: Proven Guidelines for a Healthy Multiple Pregnancy, 3rd Edition",Book,http://www.amazon.com/dp/0061803073/,3,2
"Giftpocket Women's Under the Bump Maternity Panties Underwear, Pack of 5, Assorted Random Designs and Colors, M",Apparel,http://www.amazon.com/dp/B01GCA3LY8/,3,2
The Womanly Art of Breastfeeding: Completely Revised and Updated 8th Edition,Book,http://www.amazon.com/dp/0345518446/,3,2
"Fisher-Price Rock 'n Play Sleeper, Luminosity",Baby Product,http://www.amazon.com/dp/B00HWVTY6G/,3,2
Natural Nipple Butter Organic Breastfeeding Cream (2 Fl. Oz.),Health and Beauty,http://www.amazon.com/dp/B000JVCBBG/,3,2
"Lansinoh Soothies Gel Pads for Breastfeeding Mothers, 2 Count",Baby Product,http://www.amazon.com/dp/B002KGHUL4/,3,2
Melissa & Doug Giant Giraffe - Lifelike Stuffed Animal (over 4 feet tall),Toy,http://www.amazon.com/dp/B00009YEGL/,3,2
Debunking the Bump: A Mathematician Mom Explodes Myths About Pregnancy,Book,http://www.amazon.com/dp/1505393124/,2,2
When Survivors Give Birth: Understanding and Healing the Effects of Early Sexual Abuse on Childbearing Women,Book,http://www.amazon.com/dp/1594040222/,2,2
"Bamboobies Washable Reusable Nursing Pads with Leak-Proof Backing for Breastfeeding, 3 Regular Pairs and 3 Overnight Pairs, 12 Count",Baby,https://www.amazon.com/gp/product/B004H60BZW/ref=oh_aui_search_detailpage?ie=UTF8&amp;psc=1,2,2
Fisher-Price Moonlight Meadow Deluxe Bouncer,Baby Product,http://www.amazon.com/dp/B00NFETGSU/,2,2
"The Birth Partner - Revised 4th Edition: A Complete Guide to Childbirth for Dads, Doulas, and All Other Labor Companions",eBooks,http://www.amazon.com/dp/B00E78IGUW/,,1
"Bumkins Nintendo Silicone Teether, NES Controller",Baby,https://www.amazon.com/dp/B01M5IW4EO/ref=cm_sw_r_cp_tai_2vkUzbDQABXWZ,,1
The M Word: Conversations about Motherhood,eBooks,http://www.amazon.com/dp/B00HAKX5EQ/,,1
Expecting Better: Why the Conventional Pregnancy Wisdom Is Wrong--and What You Really Need to Know,eBooks,http://www.amazon.com/dp/B00AEBEQUK/,,1
"Far From the Tree: Parents, Children and the Search for Identity",eBooks,http://www.amazon.com/dp/B007EDOLJ2/,,1
Ina May's Guide to Childbirth: Updated With New Material,eBooks,http://www.amazon.com/dp/B000S1LT1A/,,1
Natural Hospital Birth: The Best of Both Worlds,eBooks,http://www.amazon.com/dp/B005ZSIGEO/,,1
Astor Bidet Fresh Water Spray Non-Electric Mechanical Bidet Toilet Seat Attachment CB-1000,Home Improvement,http://www.amazon.com/dp/B003TPGPUW/,63,1
The Life-Changing Magic of Tidying Up: The Japanese Art of Decluttering and Organizing,Book,http://www.amazon.com/dp/1607747308/,39,1
Luxe Bidet Neo 120 - Self Cleaning Nozzle - Fresh Water Non-Electric Mechanical Bidet Toilet Attachment (blue and white),Home Improvement,http://www.amazon.com/dp/B00A0RHSJO/,30,1
PetSafe SSSCAT Spray Deterrent,Pet Products,http://www.amazon.com/dp/B000RIA95G/,20,1
"MABIS Basal Thermometer, Digital BBT Thermometer, Basal Body Temperature Thermometer For Natural Family Planning, White and Pink",Health and Beauty,http://www.amazon.com/dp/B000O6YCZY/,18,1
"It's Not the Stork!: A Book About Girls, Boys, Babies, Bodies, Families and Friends (The Family Library)",Book,http://www.amazon.com/dp/0763633313/,12,1
"Albanese Candy, Sugar Free Assorted Fruit Gummi Bears, 5-pound Bag",Grocery,http://www.amazon.com/dp/B00DE4GWWY/,9,1
"Bergan Turbo Scratcher Cat Toy, Colors may vary",Pet Products,http://www.amazon.com/dp/B000IYSAIW/,9,1
"Howard Leight by Honeywell Laser Lite High Visibility Disposable Foam Earplugs, 200-Pairs (LL-1)",Home Improvement,http://www.amazon.com/dp/B0007XJOLG/,9,1
Bottomless Bath Overflow Drain Cover - Recyclable,Home Improvement,http://www.amazon.com/dp/B00314WHW6/,8,1
Secret Garden: An Inky Treasure Hunt and Coloring Book,Book,http://www.amazon.com/dp/1780671067/,7,1
"Harry Potter and the Sorcerer's Stone: The Illustrated Edition (Harry Potter, Book 1)",Book,http://www.amazon.com/dp/0545790352/,7,1
The Happiest Baby on the Block,Book,http://www.amazon.com/dp/0553381466/,7,1
"Breville BOV800XL Smart Oven 1800-Watt Convection Toaster Oven with Element IQ, Silver",Kitchen,http://www.amazon.com/dp/B001L5TVGW/,7,1
"Panasonic ES246AC Bikini Shaper & Trimmer for Women with Compact, Portable Design and Adjustable Trim Settings, Battery Operated",Beauty & Personal Care,https://www.amazon.com/gp/product/B00005JS5C?psc=1&amp;redirect=true&amp;ref_=oh_aui_detailpage_o08_s00,6,1
The Seven Principles for Making Marriage Work: A Practical Guide from the Country's Foremost Relationship Expert,Book,http://www.amazon.com/dp/0609805797/,6,1
Mirari OK to Wake!  Alarm Clock & Night-Light,Home,http://www.amazon.com/dp/B00EAHSBV4/,6,1
"NOW  Organic Jojoba Oil,4-Ounce",Health and Beauty,http://www.amazon.com/dp/B0019LTGOU/,5,1
"MOD Complete MDC77037 Double Basket Flat Folding Shopping Cart with Swivel Wheels, Black",Home,http://www.amazon.com/dp/B0000UZ58C/,4,1
"Squatty Potty The Original Bathroom Toilet Stool 7""- White",Health and Beauty,http://www.amazon.com/dp/B00ESKVN7W/,4,1
Snuza Hero Baby Movement Monitor,Baby,https://www.amazon.com/Snuza-ILSHER-Baby-Monitor-Hero/dp/B008OJ7C6Y/ref=sr_1_1?ie=UTF8&amp;qid=1436887704&amp;sr=8-1&amp;keywords=Snuza,4,1
"Natural Vitality Natural Calm Diet Supplement, Raspberry Lemon, 16 Ounce",Health and Beauty,http://www.amazon.com/dp/B00BPUY3W0/,4,1
"Lansinoh HPA Lanolin Minis for Breastfeeding Mothers, 3 Count",Baby Product,http://www.amazon.com/dp/B00FNZQHJA/,4,1
"LUTRON Credenza Plug-In Lamp Dimmer with Night Light, TT-300NLH-WH, White",Home Improvement,http://www.amazon.com/dp/B0000DI241/,3,1
Bidet Attachment With Dual Nozzles and Self Cleaning,Home Improvement,http://www.amazon.com/dp/B00BMAQH6S/,3,1
Generic Folding Helping Hand Long Reach Pick Up Gripper Light Weight Aluminum Body,Home Improvement,http://www.amazon.com/dp/B0002VUQPG/,3,1
Better Bath Deep Water Bath,Home,http://www.amazon.com/dp/B0001YJIGW/,3,1
SwaddleMe By Your Side Sleeper,Baby Product,http://www.amazon.com/dp/B00YBADM1O/,3,1
Munchkin White Hot Inflatable Duck Tub,Baby Product,http://www.amazon.com/dp/B000066665/,3,1
"Wondfo One Step Ovulation (LH) Test Strips, 50-Count",Health and Beauty,http://www.amazon.com/dp/B004IJHDN6/,3,1
"Mayo Clinic Guide to a Healthy Pregnancy: From Doctors Who Are Parents, Too!",Book,http://www.amazon.com/dp/1561487171/,3,1
"Gerber Birdseye 3-Ply Prefold Cloth Diapers, White, Pack of 10",Baby Product,http://www.amazon.com/dp/B007VBYVWE/,2,1
The Littlest Peanut: A Journal Milestone Babybook for Preemies,Book,http://www.amazon.com/dp/1612540236/,2,1
"Medline MDS148055 Deluxe Perineal Cold Packs with Adhesive, 4.5"" x 14.25"" (Pack of 24)",BISS Basic,http://www.amazon.com/dp/B00BLE60T4/,2,1
"BreathableBaby Breathable Mesh Crib Liner, White",Baby,https://www.amazon.com/BreathableBaby-Breathable-Mesh-Liner-White/dp/B0013FGWD0/ref=sr_1_2_s_it?s=baby-products&amp;ie=UTF8&amp;qid=1486535266&amp;sr=1-2&amp;keywords=crib,2,1
"Best Video Baby Monitor -7"" screen across and total unit is 10.5"" - Premium Version - Designer Style, Feature Rich Premium High End Digital Camera with Long Range Wireless / WiFi Signal",Baby Product,http://www.amazon.com/dp/B01FL4KW3O/,2,1
"Giftpocket Women's Under the Bump Maternity Panties Underwear, Pack of 5, Assorted Random Designs and Colors, XXL",Apparel,http://www.amazon.com/dp/B01GCA3NPU/,2,1
"The First Years Sure Comfort Deluxe Newborn To Toddler Tub, Blue",Baby Product,http://www.amazon.com/dp/B000067EH7/,2,1
"Medline Cleansing Bottle, 8oz.",Industrial & Scientific,https://www.amazon.com/Medline-DYND70125H-Perineal-Irrigation-Bottle/dp/B00UCEY8CA/ref=sr_1_1?ie=UTF8&amp;qid=1443465603&amp;sr=8-1&amp;keywords=peri+bottle,2,1
Boss Bidet Toilet Attachment | Cleans Your Tushy | Warranty - Lifetime | 30 Day Guarantee Dual Nozzle | Self Cleaning Feature | Water Sprayer | 15 Minute Installation | Luxury Black & White,Home Improvement,http://www.amazon.com/dp/B01DXE2BEC/,2,1
"Chicco Lullago Travel Crib, Acorn",Baby Product,http://www.amazon.com/dp/B00KHR84YK/,2,1
"Maymom Flange Adapter for Spectra S1 Pumps, Spectra S2 Pump to Use Medela Breastshield and Bottles; Connects Between Maymom or Medela Breastshield and Spectra Backflow Protector (Yellow)",Baby Product,http://www.amazon.com/dp/B01DGEDVUM/,2,1
Twelve Hours' Sleep by Twelve Weeks Old: A Step-by-Step Plan for Baby Sleep Success,Book,http://www.amazon.com/dp/0525949593/,2,1
"Boon Grass Countertop Drying Rack,Green",Baby,https://www.amazon.com/gp/product/B0032G9E0G/ref=br_it_dp_o_nS_ttl,2,1
Summer Infant Contoured Changing Pad,Baby Product,http://www.amazon.com/dp/B009EDSWJA/,2,1
Munchkin Warm Glow Wipe Warmer,Baby,https://www.amazon.com/Munchkin-Warm-Glow-Wipe-Warmer/dp/B000CNOIQ2/,2,1
"Whitmor 36-Pair OTD Shoe Rack, White",Home,http://www.amazon.com/dp/B0019FOUQ0/,2,1
"Hamilton Beach 25475 Breakfast Sandwich Maker, Gray (Discontinued)",Kitchen,http://www.amazon.com/dp/B00BTIUYOO/,2,1
"Unrefined Shea Butter by Better Shea Butter - African, Raw, Pure - Use Alone or in DIY Body Butters, Lotions, Soap, Eczema & Stretch Marks Products, Lotion Bars, Lip Balms and More! - 1 lb (16 oz)",Beauty,http://www.amazon.com/dp/B00D9NV2D4/,2,1
Big Berkey BK4X2 Countertop Water Filter System with 2 Black Berkey Elements and 2 Fluoride Filters,Home Improvement,http://www.amazon.com/dp/B00BWIX1EQ/,2,1
Baby Catcher: Chronicles of a Modern Midwife,Book,http://www.amazon.com/dp/0743219341/,2,1
Cozy Bump Maternity Pillow - Lie on Your Stomach During Pregnancy (Blue),Home,http://www.amazon.com/dp/B01FASX1T8/,2,1
"DYANAREX 4707 Blue Emesis - Vomit Bag ""Dynarex"" 1000 mL",Industrial & Scientific,https://www.amazon.com/Blue-Emesis-Vomit-Dynarex-1000ml/dp/B00BDVIVLU/ref=sr_1_2_a_it?ie=UTF8&amp;qid=1456765286&amp;sr=8-2&amp;keywords=Barf+bags,2,1
"Majestic Pure Rosehip Oil for Face, Nails, Hair and Skin, 100% Pure & Natural, Cold Pressed Premium Rose Hip Seed Oil, 4 oz",Beauty,http://www.amazon.com/dp/B00QR7FTLU/,2,1
Waste Canvas 14ct 12in x 18in,Art and Craft Supply,http://www.amazon.com/dp/B003W0F2RQ/,2,1
"Boppy Newborn Lounger, Elephant Love Gray",Baby Product,http://www.amazon.com/dp/B014A7MABU/,2,1
Medela Breastmilk Collection Shells,Baby Product,http://www.amazon.com/dp/B000WHL2RQ/,1,1
"Organic No More Milk Tea for Weaning from Breastmilk, 16 Teabags/Box, Pack of 3",Health and Beauty,http://www.amazon.com/dp/B0032AM8JQ/,1,1
"Itzy Ritzy Nursing Happens Infinity Breastfeeding Scarf, Pink Kiss Chevron",Baby Product,http://www.amazon.com/dp/B00IVPN3MS/,1,1
Times Two: Two Women in Love and the Happy Family They Made,Book,http://www.amazon.com/dp/1439176418/,1,1
"The Bilingual Edge: Why, When, and How to Teach Your Child a Second Language",Book,http://www.amazon.com/dp/0061246565/,1,1
Pretty Pushers Cotton Jersey Labor Gown Plus Size (18-26 pre-pregnancy) Plum,Apparel,http://www.amazon.com/dp/B00XCK326E/,1,1
Avidlove Women Sexy Nightwear Halter Lace Strap Chemise Babydoll Lingerie Set Black L,Apparel,http://www.amazon.com/dp/B01FFXM1DA/,1,1
"Giftpocket Women's Under the Bump Maternity Panties Underwear, Pack of 5, Assorted Random Designs and Colors, XL",Apparel,http://www.amazon.com/dp/B01GCA3N82/,1,1
Hold On to Your Kids: Why Parents Need to Matter More Than Peers,Book,http://www.amazon.com/dp/0375760288/,1,1
Inktastic - Daddy Loves Me Infant Creeper 6 Months Baby Blue,Apparel,http://www.amazon.com/dp/B00QO0YS62/,1,1
"3 in 1 Labor / Delivery / Nursing Hospital Gown, Baby Shower Gift(XS, Black)",Apparel,http://www.amazon.com/dp/B01K5VNVNQ/,1,1
CafePress - I love my Two Grandmas Infant Bodysuit - Cute Infant Bodysuit Baby Romper,Apparel,http://www.amazon.com/dp/B00YM2N6BM/,1,1
"PinkBlush Maternity Aqua Floral Draped Maternity/Nursing Maxi Dress, Medium",Apparel,http://www.amazon.com/dp/B00Y0ALBP4/,1,1
"Girl Preemie sign, newborn, baby car seat tag, baby shower gift, stroller tag, baby Preemie no touching car seat sign",Baby Product,http://www.amazon.com/dp/B07215HWF1/,1,1
"Baby Vida Oxygen Monitor, White",Baby Product,http://www.amazon.com/dp/B00VBI42HM/,1,1
"Curad Antiviral Face Mask, 10 Count",Health and Beauty,http://www.amazon.com/dp/B009GGUIK6/,1,1
"Fisher-Price Newborn Rock 'n Play Sleeper, Yellow (Discontinued by Manufacturer)",Baby,https://www.amazon.com/Fisher-Price-Newborn-Rock-Sleeper-Yellow/dp/B002M77N22,1,1
"It's You Babe V2 Supporter, Medium (36"" - 44"" Below Belly Hip Measurement)",Health and Beauty,http://www.amazon.com/dp/B000I5ZTAI/,1,1
Kiddo Care Nursing Cover Infinity Nursing Scarf for Breastfeeding (Elegant Grey),Baby Product,http://www.amazon.com/dp/B010FWLI5I/,1,1
"Evenflo Portable Babysuite Deluxe Playard, Koi",Baby Product,http://www.amazon.com/dp/B00ZKZSYI0/,1,1
"Comotomo Natural Feel Baby Bottle, Green, 8 Ounces",Baby Product,http://www.amazon.com/dp/B004C053AQ/,1,1
"Boudreaux's Boudreaux's Butt Paste, Diaper Rash Ointment, Tube 4 oz (Quantity of 3)",Health and Beauty,http://www.amazon.com/dp/B0064FZAQY/,1,1
The First Years American Red Cross Baby Healthcare And Grooming Kit,Baby Product,http://www.amazon.com/dp/B000LZFZVS/,1,1
"Puj Tub - The Soft, Foldable Baby Bathtub - Newborn, Infant, 0-6 Months, In-Sink Baby Bathtub, BPA free, PVC free (Aqua)",Baby Product,http://www.amazon.com/dp/B005OAF6RS/,1,1
"Graco Blossom 4-in-1 Convertible High Chair Seating System, Sapphire",Baby Product,http://www.amazon.com/dp/B00H8MSEXS/,1,1
"Graco Glider LX Gliding Swing, Affinia",Baby Product,http://www.amazon.com/dp/B00PTL1MD4/,1,1
"BABYBJORN Soft Bib, Green/Yellow, 2 Pack",Baby Product,http://www.amazon.com/dp/B000CSBP3G/,1,1
"CAMIRUS Pacifier Clip Teething Soother Holder, 4-Pack",Baby Product,http://www.amazon.com/dp/B01IP6BRU2/,1,1
"Philips Avent Natural Newborn Baby Bottle Starter Set, SCD296/02",Baby Product,http://www.amazon.com/dp/B00E1CI2TO/,1,1
"Philips AVENT Bottle Warmer, Fast",Baby Product,http://www.amazon.com/dp/B00LJ64JR4/,1,1
"Philips Avent Soothie Pacifier, 0-3 Months, Green - 6 Pack",Baby Product,http://www.amazon.com/dp/B007GUI0CM/,1,1
Kenox Unisex Multifunction Diaper Backpack Mummy Baby Bag,Baby Product,http://www.amazon.com/dp/B017J9P94Q/,1,1
"My Brest Friend Original Nursing Pillow, Fireworks",Baby Product,http://www.amazon.com/dp/B003TSDMH8/,1,1
Philips AVENT 3-in-1 Electric Steam Sterilizer,Baby Product,http://www.amazon.com/dp/B0057ECYS0/,1,1
Green BabyBum Diaper Cream Brush & Pink Travel Case,Baby Product,http://www.amazon.com/dp/B01ICS14YM/,1,1
Panda Portable Dryer 2.65 cu.ft 110v Compact Apartment Size Stainless Steel Drum See Through Window,Major Appliances,http://www.amazon.com/dp/B0092JSGXI/,1,1
"The Hamptons Baby Caring Corner Guards | Premium Clear Corner Protectors | Safety Furniture Bumpers | Long Lasting, Pre-Applied Gel Adhesive | Sharp Corner Cushion (8 Pack)",Baby Product,http://www.amazon.com/dp/B013TTNB1I/,1,1
"ARKSEN Portable Mini Laundry Washing Machine, 7.9LBS Capacity, Clear Blue",Major Appliances,http://www.amazon.com/dp/B00XYVE026/,1,1
How Not to Hate Your Husband After Kids,Book,http://www.amazon.com/dp/0316267104/,1,1
Fisher-Price Auto Rock 'n Play Sleeper - Glossy Gem,Baby Product,http://www.amazon.com/dp/B01M0WUOLS/,1,1
Doublju Loose Fit Floral Lace Tank Blouse Top For Women With Plus Size IVORY MEDIUM,Apparel,http://www.amazon.com/dp/B06XSZVQW4/,1,1
"Graco Travel Lite Crib with Stages, Manor",Baby Product,http://www.amazon.com/dp/B00HAZUJLI/,1,1
"Lansinoh Breastmilk Storage Bags With Convenient Pour Spout and Patented Double Zipper Seal, Ideal for Storing and Freezing Breastmilk, 50 Count, BPA and BPS Free",Health and Beauty,http://www.amazon.com/dp/B00198I2WU/,1,1
"Avalon Papers 1053 Dental Bib Polyback Towel, 2-Ply Tissue + Poly, 13'' x 18"", Blue (Pack of 500)",BISS,http://www.amazon.com/dp/B0025TWH8C/,1,1
"Melansay Beatiful Bow Tie Summer Beach Chiffon High Waist Maxi Skirt XXL,Khaki",Apparel,http://www.amazon.com/dp/B06X9HJZ3C/,1,1
"""Grandpa"" Porcelain 16 Oz Coffee Mug with Gift Box",Kitchen,http://www.amazon.com/dp/B00I8MVGI2/,1,1
"Puj Tub - The Soft, Foldable Baby Bathtub - Newborn, Infant, 0-6 Months, In-Sink Baby Bathtub, BPA free, PVC free (White)",Baby Product,http://www.amazon.com/dp/B002WWF4IM/,1,1
1 X Grandma Teal Porcelain Coffee Tea Mug Cup 16oz Gift Box,Kitchen,http://www.amazon.com/dp/B00I9HZQ9Q/,1,1
Maggie Tang Women's Long Sleeves Floral Lace Off Shoulder Twin Set Top White L,Apparel,http://www.amazon.com/dp/B01N6GMNNV/,1,1
"Dynarex Disposable Underpad, 17 inches X 24 inches, 100 Count",BISS,http://www.amazon.com/dp/B005X0U43K/,1,1
"Simplicity Maternity Cotton Over Bump Leggings, Black,XL",Apparel,http://www.amazon.com/dp/B00EB3YMD8/,1,1
Taylor Salter 914-WHLKR Baby Toddler Scale,Health and Beauty,http://www.amazon.com/dp/B00009KX5U/,1,1
"Thirsties Duo Wrap Snap, Blackbird, Size One",Baby Product,http://www.amazon.com/dp/B003GSLCOG/,1,1
"Skip Hop Forma Travel Carry All Diaper Backpack with Insulated Bag, One Size, Black",Baby Product,http://www.amazon.com/dp/B00R4PXGQ4/,1,1
"Thirsties Wet Bag, Aspen Grove",Baby Product,http://www.amazon.com/dp/B0182PQNW8/,1,1
Snug Baby Monitor v2 - WiFi Video Camera with Audio for iPhone/Samsung,Baby Product,http://www.amazon.com/dp/B01E8BZH4K/,1,1
"Ubbi Steel Diaper Pail, Hot Pink",Baby Product,http://www.amazon.com/dp/B00821FLTY/,1,1
hiccapop Wipe Warmer and Baby Wet Wipes Dispenser | Holder | Case with Changing Light,Baby Product,http://www.amazon.com/dp/B01LZJVSTE/,1,1
The Sh!t No One Tells You: A Guide to Surviving Your Baby's First Year,Book,http://www.amazon.com/dp/1580054846/,1,1
Keekaroo Peanut Changer - Vanilla,Baby Product,http://www.amazon.com/dp/B00KSW970Y/,1,1
"HapTim Multi-function Baby Diaper Bag Backpack with Stroller Straps, Gray",Baby Product,http://www.amazon.com/dp/B01M9E9UNV/,1,1
Aivtalk Pregnant Women Comfortable Cotton Flexible Pregnancy Panties Underwear Adjustable Maternity Underpants 3 Pieces,Sports,http://www.amazon.com/dp/B01DPCQYKO/,1,1
"Avery T-shirt Transfers for Inkjet Printers, 8.5 x 11 Inches, for use with White or Light Colored Fabric, 6 Sheets (03271)",Office Product,http://www.amazon.com/dp/B00006B8FS/,1,1
"Nursery Custom Name and Initial Wall Decal Sticker 23"" W by 17"" H, Girl Name Wall Decal, Girls Name, Wall Decor, Personalized, Girls Name Decor, Nursery Bedroom Baby Decor PLUS FREE HELLO DOOR DECAL",Baby Product,http://www.amazon.com/dp/B01M3TCY7J/,1,1
Large Family Logistics: The Art and Science of Managing the Large Family,Book,http://www.amazon.com/dp/1934554782/,1,1
Birthing from Within: An Extra-Ordinary Guide to Childbirth Preparation,Book,http://www.amazon.com/dp/0965987302/,1,1
"Evenflo Convertible High Chair, Dottie Rose",Baby Product,http://www.amazon.com/dp/B00DB6B13A/,1,1
Commando Dad: A Basic Training Manual for the First Three Years of Fatherhood,Book,http://www.amazon.com/dp/1452127395/,1,1
"VTech DM221 Audio Baby Monitor with up to 1,000 ft of Range, Vibrating Sound-Alert, Talk Back Intercom & Night Light Loop",Baby Product,http://www.amazon.com/dp/B007NG5UF4/,1,1
"Delta Children Portable Mini Crib, Natural",Baby Product,http://www.amazon.com/dp/B006LNWURQ/,1,1
"SweetGourmet Seedling Gum Assorted Fruit (Filled), 3 LB",Grocery,http://www.amazon.com/dp/B0050W6J80/,1,1
Baby Einstein Baby Neptune Ocean Orchestra Musical Toy,Baby Product,http://www.amazon.com/dp/B004G8QSY4/,1,1
"Emjoi AP-18R Emagine Dual Opposed 72 Tweezer Head Epilator, Violet",Beauty,http://www.amazon.com/dp/B003YSL9LE/,1,1
"Mr. Clean 446268, Magic Eraser Power Squeeze Mop",Home,http://www.amazon.com/dp/B00313UD5U/,1,1
"G2 Chic Women's Spring and Summer Floral Festival Dress - Regular and Plus Sizes(DRS-MAX,BLUA10-S)",Apparel,http://www.amazon.com/dp/B01C35AKIG/,1,1
"Home-X Easy Fit Hooks & Buttons. Extend Your Trousers or Skirt 1/2"" to 2"". Set Includes 5 Colors of Each",Art and Craft Supply,http://www.amazon.com/dp/B00EFZ5DTY/,1,1
"Leachco Snoogle Mini Compact Side Sleeper, Sage/White dot",Baby Product,http://www.amazon.com/dp/B000KJZOWU/,1,1
"Princess Paradise Unisex Baby Anna Banana, Yellow, 0/3 Months",Apparel,http://www.amazon.com/dp/B00J4X2JWG/,1,1
CafePress - Level 1 Human Body Suit - Cute Infant Bodysuit Baby Romper,Apparel,http://www.amazon.com/dp/B00LNLQHZM/,1,1
Cotton Whisper Maternity Funny Print Underwear Soft and Support Briefs Adjustable L,Apparel,http://www.amazon.com/dp/B01FDLZ0W8/,1,1
"Mazda 626 & MX-6, and Ford Probe (1993-2001) Automotive Repair Manual (Haynes Repair Manual)",Book,http://www.amazon.com/dp/1563924404/,1,1
"Dude, You're Gonna Be a Dad!: How to Get (Both of You) Through the Next 9 Months",Book,http://www.amazon.com/dp/1440505365/,1,1
"The Nursing Mother's Companion - 7th Edition: The Breastfeeding Book Mothers Trust, from Pregnancy through Weaning",Book,http://www.amazon.com/dp/1558328491/,1,1
"Philips Avent Comfort Breast Shell Set, 2 Count",Baby Product,http://www.amazon.com/dp/B000058DQJ/,1,1
Dermoplast Pain Relieving Spray-2.75 oz.,Health and Beauty,http://www.amazon.com/dp/B0006GWSTO/,1,1
"Snoozer Cozy Cave, Olive, Small",Pet Products,http://www.amazon.com/dp/B0006NEGQ0/,1,1
"Maidenform Flexees Women's Shapewear Waist Nipper Firm Control, Black, Medium",Apparel,http://www.amazon.com/dp/B0007QMK3C/,1,1
"Natracare New Mother Natural Maternity Pads, 10 Count",Health and Beauty,http://www.amazon.com/dp/B0010XCJ1E/,1,1
elope T-Rex Dinosaur Hat,Apparel,http://www.amazon.com/dp/B001F29HR4/,1,1
Jolt Bug Zapping Racket - Zapper,Lawn & Patio,http://www.amazon.com/dp/B002IE7AKE/,1,1
"Garden of Life Vegetarian Prenatal Multivitamin Supplement with Folate - Vitamin Code Raw Prenatal Whole Food Vitamin for Mom and Baby, 90 Capsules",Health and Beauty,http://www.amazon.com/dp/B0032EZOAM/,1,1
"Dreambaby Stroller Fan, White/Blue",Baby,https://www.amazon.com/Dreambaby-Stroller-Fan-White-Blue/dp/B0043IS18I,1,1
"Three Lollies Preggie Pop Drops Assorted for Morning Sickness Relief, 21 Count",Health and Beauty,http://www.amazon.com/dp/B005AYE8UE/,1,1
"Guard Dog Security Dual-Spark 6,000,000 Volt Flashlight Stun Gun with LED light",Sports,http://www.amazon.com/dp/B00DYSVY8C/,1,1
"Organic Bodysuit - Apple, Newborn",Apparel,http://www.amazon.com/dp/B00GAAGS96/,1,1
"Zone Tech ""Baby Up On This Bitch"" Vehicle Safety Sticker - Premium Quality Convenient Reflective ""Baby Up On This Bitch"" Vehicle Safety Funny Sign Sticker",Automotive Parts and Accessories,http://www.amazon.com/dp/B00HM92O06/,1,1
AmazonBasics Dog Waste Bags with Dispenser and Leash Clip - 300-Count,Pet Products,http://www.amazon.com/dp/B00NABTC8M/,1,1
"QuickZip Easy Change Crib Sheet With Wraparound Total Security Base, Gray",Baby Product,http://www.amazon.com/dp/B00NSCXRW0/,1,1
"Lansinoh Stay Dry Disposable Nursing Pads, Number One Selling Breastfeeding Pad For Breastfeeding Mothers, Leak Proof Protection, Maximum Comfort and Discretion, 60 Count",Health and Beauty,http://www.amazon.com/dp/B00PWMTVEM/,1,1
Shout Color Catcher Sheets 24ct,Pantry,http://www.amazon.com/dp/B00Q8J418O/,1,1
"Graco Fastaction Fold Sport Click Connect Travel System Stroller, Gotham",Baby Product,http://www.amazon.com/dp/B00UVW3PQI/,1,1
Ann Chery Women's Faja Deportiva Workout Waist Cincher,Apparel,http://www.amazon.com/dp/B00UYJVW3G/,1,1
EcoDrink Complete Multivitamin Mix Drink. Peach Mango - 30 Count Refill Pack (Bottle not included),Health and Beauty,http://www.amazon.com/dp/B00VFD70AO/,1,1
"Three Lollies Preggie Naturals Chews for Morning Sickness Relief, 48 count",Health and Beauty,http://www.amazon.com/dp/B00XLUV2KS/,1,1
"Vaseline Petroleum Jelly, Original, 2.5 Ounce",Prime Pantry,https://www.amazon.com/Vaseline-Petroleum-Jelly-Original-Ounce/dp/B011BHTJAM/,1,1
"Ziggy Baby Muslin Baby Swaddle Blankets, 48x48 (3 Pack) Chevron, Arrow, Cross, Grey/White",Baby Product,http://www.amazon.com/dp/B011J68S4S/,1,1
PUEEN 2 Pack Push Down Empty Pump Dispenser For ACETONE Nail Polish Remover Alcohol - Clear Bottle - 6 Oz Bottle (PINK) - Set of 2-BH000527,Beauty,http://www.amazon.com/dp/B0129DMUF8/,1,1
Baby Krang Maternity: Maternity Cotton T-Shirt,Apparel,http://www.amazon.com/dp/B0141AY7NA/,1,1
I charge 10$ to touch my belly Maternity T-Shirt,Apparel,http://www.amazon.com/dp/B015TREBPI/,1,1
"hiccapop Pregnancy Pillow Wedge for Maternity | Memory Foam Maternity Pillows Support Body, Belly, Back, Knees",Home,http://www.amazon.com/dp/B01KG84CLI/,1,1
Carter's Baby Boys' 4 Piece Layette Set (Baby) - Orange - 3 Months,Apparel,http://www.amazon.com/dp/B00LES0UPM/,1,1
"Columbia Baby Tiny Bear II Bunting, Camellia Rose, 18-24 Months",Apparel,http://www.amazon.com/dp/B018WNIIVY/,1,1
Carter's Unisex Baby 3 Piece Terry Footed Set (Baby) - Ivory - 6M,Apparel,http://www.amazon.com/dp/B00XZA7ECY/,1,1
