name,category,amazon_link,total_mentions,subreddit_mentions
"The Midas Paradox: Financial Markets, Government Policy Shocks, and the Great Depression",Books,https://www.amazon.com/Midas-Paradox-Financial-Government-Depression/dp/1598131508,3,3
Economics Rules: The Rights and Wrongs of the Dismal Science,Books,https://www.amazon.com/Economics-Rules-Rights-Wrongs-Science/dp/0393246418,2,2
The Courage to Act: A Memoir of a Crisis and Its Aftermath,Books,https://www.amazon.com/Courage-Act-Memoir-Crisis-Aftermath/dp/039324721X?ie=UTF8&amp;ref_=asap_bc,2,2
"The Economics of Money, Banking and Financial Markets (11th Edition) (The Pearson Series in Economics)",Books,https://www.amazon.com/dp/0133836797,,1
Capital in the Twenty First Century,Books,https://www.amazon.com/Capital-Twenty-Century-Thomas-Piketty/dp/067443000X/ref=sr_1_1?s=books&amp;ie=UTF8&amp;qid=1474369403&amp;sr=1-1&amp;keywords=piketty,6,1
The Two-Income Trap: Why Middle-Class Parents are Going Broke,Books,https://www.amazon.com/Two-Income-Trap-Middle-Class-Parents-Going/dp/0465090907,4,1
The Myth of the Rational Voter: Why Democracies Choose Bad Policies,Books,https://www.amazon.com/Myth-Rational-Voter-Democracies-Policies/dp/0691138737/ref=sr_1_1?s=books&amp;ie=UTF8&amp;qid=1456931497&amp;sr=1-1&amp;keywords=myth+of+the+rational+voter,4,1
Adult Size Baseball Style Multi-Color Propeller Hat,Toys & Games,https://www.amazon.com/Adult-Baseball-Multi-Color-Propeller-Hat/dp/B003H2L75U/ref=pd_sim_21_1/191-5686831-4622035?ie=UTF8&amp;dpID=41adfxB4ObL&amp;dpSrc=sims&amp;preST=_AC_UL160_SR160,4,1
The Politically Incorrect Guide to American History,Books,https://www.amazon.com/gp/product/0895260476?ie=UTF8&amp;tag=thomacom-20&amp;linkCode=xm2&amp;camp=1789&amp;creativeASIN=0895260476,3,1
Hillbilly Elegy: A Memoir of a Family and Culture in Crisis,Books,https://www.amazon.com/Hillbilly-Elegy-Memoir-Family-Culture/dp/0062300547,3,1
"Triumph of the City: How Our Greatest Invention Makes Us Richer, Smarter, Greener, Healthier, and Happier",Books,https://www.amazon.com/Triumph-City-Greatest-Invention-Healthier/dp/0143120549/,3,1
Advanced Macroeconomics (The Mcgraw-Hill Series in Economics),Books,https://www.amazon.com/Advanced-Macroeconomics-Mcgraw-Hill-Economics-David/dp/0073511374/ref=sr_1_1?s=books&amp;ie=UTF8&amp;qid=1480401074&amp;sr=1-1&amp;keywords=advanced+macroeconomics,3,1
"Principles of Economics, 7th Edition (Mankiw's Principles of Economics)",Books,https://www.amazon.com/Principles-Economics-7th-Mankiws/dp/128516587X,2,1
"Macroeconomics, 3rd Edition",Books,https://www.amazon.com/Macroeconomics-3rd-Paul-Krugman/dp/1429283432,2,1
Solar System Dynamics,Books,https://www.amazon.com/Solar-System-Dynamics-Carl-Murray/dp/0521575974/ref=sr_1_1?ie=UTF8&amp;qid=1466303737&amp;sr=8-1&amp;keywords=murray+dermott+solar+system+dynamics,2,1
Average Is Over: Powering America Beyond the Age of the Great Stagnation,Books,https://www.amazon.com/Average-Is-Over-Powering-Stagnation/dp/0525953736/,2,1
The Moral Economy of the Peasant: Rebellion and Subsistence in Southeast Asia,Books,https://www.amazon.com/The-Moral-Economy-Peasant-Subsistence/dp/0300021909,2,1
White Trash: The 400-Year Untold History of Class in America,Books,https://www.amazon.com/gp/product/0670785970/ref=pd_sbs_14_t_0?ie=UTF8&amp;psc=1&amp;refRID=KVVG715GW9KK2YF59QQE,2,1
Poor Economics: A Radical Rethinking of the Way to Fight Global Poverty,Books,https://www.amazon.com/Poor-Economics-Radical-Rethinking-Poverty/dp/1610390938/,2,1
"Animal Spirits: How Human Psychology Drives the Economy, and Why It Matters for Global Capitalism",Books,https://www.amazon.com/Animal-Spirits-Psychology-Economy-Capitalism/dp/069114592X,2,1
"The Worldly Philosophers: The Lives, Times And Ideas Of The Great Economic Thinkers, Seventh Edition",Books,https://www.amazon.com/Worldly-Philosophers-Economic-Thinkers-Seventh/dp/068486214X/ref=asap_bc?ie=UTF8,2,1
Thai Sticky Rice (Sweet Rice) 5 Lbs,Grocery & Gourmet Food,https://www.amazon.com/Thai-Sticky-Rice-Sweet-Lbs/dp/B000F2VESU,2,1
Governing the Commons: The Evolution of Institutions for Collective Action (Political Economy of Institutions and Decisions),Books,https://www.amazon.com/Governing-Commons-Evolution-Institutions-Collective/dp/0521405998,2,1
"A Monetary History of the United States, 1867-1960",Books,https://www.amazon.com/Monetary-History-United-States-1867-1960/dp/0691003548/ref=sr_1_1?ie=UTF8&amp;qid=1458870911&amp;sr=8-1&amp;keywords=a+monetary+history+of+the+united+states,2,1
Audio-Technica ATH-ANC33iS QuietPoint Active Noise-Cancelling In-Ear Headphones,Electronics,https://www.amazon.com/Audio-Technica-ATH-ANC33iS-QuietPoint-Noise-Cancelling-Headphones/dp/B00CL3TAOQ,2,1
Success and Luck: Good Fortune and the Myth of Meritocracy,Books,https://www.amazon.com/Success-Luck-Good-Fortune-Meritocracy/dp/0691167400/ref=sr_1_1?s=books&amp;ie=UTF8&amp;qid=1474369087&amp;sr=1-1&amp;keywords=Success+and+Luck+by+Robert+Frank,2,1
"After the Music Stopped: The Financial Crisis, the Response, and the Work Ahead",Books,https://www.amazon.com/After-Music-Stopped-Financial-Response/dp/1491536217,2,1
Global Inequality: A New Approach for the Age of Globalization,Books,https://www.amazon.com/Global-Inequality-New-Approach-Globalization/dp/067473713X/ref=sr_1_1?s=books&amp;ie=UTF8&amp;qid=1474369244&amp;sr=1-1&amp;keywords=branko+milanovic,2,1
Human Action: The Scholar's  Edition,Books,https://www.amazon.com/Human-Action-The-Scholars-Edition/dp/1610161459,2,1
The Road from Mont Pelerin: The Making of the Neoliberal Thought Collective,Books,https://www.amazon.com/Road-Mont-Pelerin-Neoliberal-Collective/dp/0674033183,1,1
A Farewell to Alms: A Brief Economic History of the World (The Princeton Economic History of the Western World),Books,https://www.amazon.com/Farewell-Alms-Economic-History-Princeton/dp/0691141282,1,1
"Microeconomics: Behavior, Institutions, and Evolution (The Roundtable Series in Behavioral Economics)",Books,https://www.amazon.com/Microeconomics-Institutions-Evolution-Roundtable-Behavioral/dp/0691126380/ref=sr_1_1?ie=UTF8&amp;qid=1480947250&amp;sr=8-1&amp;keywords=bowles+microeconomics,1,1
The Race between Education and Technology,Books,https://www.amazon.com/Race-between-Education-Technology/dp/0674028678,1,1
"The Conservative Heart: How to Build a Fairer, Happier, and More Prosperous America",Books,https://www.amazon.com/Conservative-Heart-Happier-Prosperous-America/dp/0062319752/ref=sr_1_1?s=books&amp;ie=UTF8&amp;qid=1455909155&amp;sr=1-1&amp;keywords=the+conservative+heart,1,1
Economics: A Very Short Introduction,Books,https://www.amazon.com/Economics-A-Very-Short-Introduction/dp/0192853457,1,1
Economic Literacy: Basic Economics with an Attitude,Books,https://www.amazon.com/Economic-Literacy-Basic-Economics-Attitude/dp/1442204222,1,1
The Manga Guide to Linear Algebra,Books,https://www.amazon.com/gp/product/1593274130/,1,1
End The Fed,Books,https://www.amazon.com/End-Fed-Ron-Paul/dp/B006J3V150,1,1
Fuzzy Math: The Essential Guide to the Bush Tax Plan,Books,https://www.amazon.com/Fuzzy-Math-Essential-Guide-Bush/dp/0393339467,1,1
"The Economic Way of Thinking, 12th Edition",Books,https://www.amazon.com/The-Economic-Thinking-12th-Edition/dp/0136039855,1,1
Advanced Calculus (5th Edition),Books,https://www.amazon.com/Advanced-Calculus-5th-Wilfred-Kaplan/dp/0201799375,1,1
Lectures on Celestial Mechanics (Classics in Mathematics),Books,https://www.amazon.com/Lectures-Celestial-Mechanics-Classics-Mathematics/dp/3540586563/ref=sr_1_1?ie=UTF8&amp;qid=1466303645&amp;sr=8-1&amp;keywords=celestial+mechanics+siegel,1,1
"The Tragicomical History of Thermodynamics, 1822–1854 (Studies in the History of Mathematics and Physical Sciences)",Books,https://www.amazon.com/Tragicomical-Thermodynamics-1822-1854-Mathematics-Physical/dp/0387904034?ie=UTF8&amp;ref_=asap_bc,1,1
Friends Or Strangers: The Impact Of Immigrants On The Us Economy,Books,https://www.amazon.com/Friends-Strangers-Impact-Immigrants-Economy/dp/0465025684/ref=asap_bc?ie=UTF8,1,1
Immigration Economics,Books,https://www.amazon.com/Immigration-Economics-George-J-Borjas/dp/0674049772/ref=asap_bc?ie=UTF8,1,1
Secrets of the Temple: How the Federal Reserve Runs the Country,Books,https://www.amazon.com/Secrets-Temple-Federal-Reserve-Country/dp/0671675567,1,1
The Russian Revolution,Books,https://www.amazon.com/Russian-Revolution-Richard-Pipes/dp/0679736603,1,1
Huarochiri: An Andean Society Under Inca and Spanish Rule,Books,https://www.amazon.com/Huarochiri-Andean-Society-Under-Spanish/dp/0804715165,1,1
Economics,Books,https://www.amazon.com/Economics-Paul-Krugman/dp/0716771586,1,1
The Pinochet File: A Declassified Dossier on Atrocity and Accountability,Books,https://www.amazon.com/Pinochet-File-Declassified-Atrocity-Accountability/dp/1595589120,1,1
"Free Trade Doesn't Work: What Should Replace It and Why, 2011 Edition",Books,https://www.amazon.com/Free-Trade-Doesnt-Work-Replace/dp/0578079674,1,1
The Right to Trade: Rethinking the Aid for Trade Agenda,Books,https://www.amazon.com/The-Right-Trade-Rethinking-Agenda/dp/1849291055,1,1
"Identity Economics: How Our Identities Shape Our Work, Wages, and Well-Being",Books,https://www.amazon.com/Identity-Economics-Identities-Shape-Well-Being/dp/0691146489,1,1
"Institutions, Institutional Change and Economic Performance (Political Economy of Institutions and Decisions)",Books,https://www.amazon.com/Institutions-Institutional-Performance-Political-Decisions/dp/0521397340,1,1
International Economics: Theory and Policy (6th Edition),Books,https://www.amazon.com/International-Economics-Theory-Policy-6th/dp/0201770377,1,1
Coal: A Human History,Books,https://www.amazon.com/Coal-Human-History-Barbara-Freese/dp/0465057934,1,1
Managing the Global Commons: The Economics of Climate Change,Books,https://www.amazon.com/Managing-Global-Commons-Economics-Climate/dp/0262140551/ref=sr_1_3?s=books&amp;ie=UTF8&amp;qid=1476804404&amp;sr=1-3&amp;keywords=commons+climate+change,1,1
"Imagined Communities: Reflections on the Origin and Spread of Nationalism, Revised Edition",Books,https://www.amazon.com/Imagined-Communities-Reflections-Nationalism-Revised/dp/1844670864,1,1
GAY REALITY: THE TEAM GUIDO STORY,Books,https://www.amazon.com/GAY-REALITY-TEAM-GUIDO-STORY/dp/0595275036,1,1
Business Cycle Economics: Understanding Recessions and Depressions from Boom to Bust,Books,https://www.amazon.com/Business-Cycle-Economics-Understanding-Depressions/dp/1440831742,1,1
Game Theory for Applied Economists,Books,https://www.amazon.com/Theory-Applied-Economists-Robert-Gibbons/dp/0691003955,1,1
Recessions and Depressions: Understanding Business Cycles,Books,https://www.amazon.com/Recessions-Depressions-Understanding-Business-Cycles/dp/0313361711,1,1
The Worldly Philosophers,Books,https://www.amazon.com/The-Worldly-Philosophers-Robert-Heilbroner/dp/0786102934,1,1
Too Big to Fail: The Hazards of Bank Bailouts,Books,https://www.amazon.com/Too-Big-Fail-Hazards-Bailouts/dp/081570304X,1,1
Post-Keynesian Economics: New Foundations,Books,https://www.amazon.com/Post-Keynesian-Economics-Foundations-Marc-Lavoie/dp/1783475285,1,1
"After the Music Stopped: The Financial Crisis, the Response, and the Work Ahead",Books,https://www.amazon.com/After-Music-Stopped-Financial-Response/dp/014312448X/ref=sr_1_2?s=books&amp;ie=UTF8&amp;qid=1488175309&amp;sr=1-2&amp;keywords=when+the+music+stopped,1,1
The Industrial Revolution: A Very Short Introduction (Very Short Introductions),Books,https://www.amazon.com/gp/product/0198706782/ref=oh_aui_detailpage_o00_s00?ie=UTF8&amp;psc=1,1,1
Give and Take: A Revolutionary Approach to Success,Books,https://www.amazon.com/Give-Take-Revolutionary-Approach-Success/dp/B00BMBANYY,1,1
An Uncertain Glory: India and its Contradictions,Books,https://www.amazon.com/Uncertain-Glory-India-its-Contradictions/dp/0691165521,1,1
"The Calculus of Consent (Selected Works of Gordon Tullock, The) (v. 2)",Books,https://www.amazon.com/Calculus-Consent-Selected-Gordon-Tullock/dp/0865975329/ref=pd_sim_14_3?ie=UTF8&amp;dpID=51L,1,1
This Time Is Different: Eight Centuries of Financial Folly,Books,https://www.amazon.com/This-Time-Different-Centuries-Financial/dp/0691152640,1,1
Irwin Schiff's How Anyone Can Stop Paying Income Taxes,Books,https://www.amazon.com/Irwin-Schiffs-Anyone-Paying-Income/dp/0930374037,1,1
Exorbitant Privilege: The Rise and Fall of the Dollar and the Future of the International Monetary System,Books,https://www.amazon.com/Exorbitant-Privilege-Dollar-International-Monetary/dp/0199931097,1,1
Change We Can Believe In: Barack Obama's Plan to Renew America's Promise,Books,https://www.amazon.com/Change-We-Can-Believe-Americas/dp/0307460452,1,1
Why Growth Matters: How Economic Growth in India Reduced Poverty and the Lessons for Other Developing Countries,Books,https://www.amazon.com/Why-Growth-Matters-Developing-Countries/dp/1610393732/ref=sr_1_1?s=books&amp;ie=UTF8&amp;qid=1474369185&amp;sr=1-1&amp;keywords=Why+Growth+Matters+by+Jagdish+Bhagwati,1,1
Russia's War: A History of the Soviet Effort: 1941-1945,Books,https://www.amazon.com/Russias-War-History-Soviet-1941-1945/dp/0140271694,1,1
Mitt Romney in His Own Words,Books,https://www.amazon.com/Mitt-Romney-His-Own-Words/dp/145168780X/ref=la_B001KJ63Y2_1_3?s=books&amp;ie=UTF8&amp;qid=1473465058&amp;sr=1-3,1,1
The Cartoon Introduction to Economics: Volume One: Microeconomics,Books,https://www.amazon.com/Cartoon-Introduction-Economics-One-Microeconomics/dp/0809094819,1,1
Mostly Harmless Econometrics: An Empiricist's Companion,Books,https://www.amazon.com/Mostly-Harmless-Econometrics-Empiricists-Companion/dp/0691120358,1,1
"The End of Alchemy: Money, Banking, and the Future of the Global Economy",Books,https://www.amazon.com/End-Alchemy-Banking-Future-Economy/dp/0393247023,1,1
Creating Value from Mergers and Acquisitions (2nd Edition),Books,https://www.amazon.com/Creating-Value-Mergers-Acquisitions-Edition/dp/0273715399,1,1
Microeconomics of Market Failures,Books,https://www.amazon.com/Microeconomics-Market-Failures-Bernard-Salanie/dp/0262194430,1,1
Mail and Internet Surveys: The Tailored Design Method,Books,https://www.amazon.com/gp/product/0471323543/ref=oh_aui_detailpage_o00_s00?ie=UTF8&amp;psc=1,1,1
Internet Data Collection (Quantitative Applications in the Social Sciences),Books,https://www.amazon.com/gp/product/0761927107/ref=oh_aui_detailpage_o02_s00?ie=UTF8&amp;psc=1,1,1
Improving Survey Questions: Design and Evaluation (Applied Social Research Methods),Books,https://www.amazon.com/gp/product/0803945833/ref=oh_aui_detailpage_o01_s00?ie=UTF8&amp;psc=1,1,1
Conducting Research Surveys via E-mail and the Web,Books,https://www.amazon.com/gp/product/0833031104/ref=oh_aui_detailpage_o02_s00?ie=UTF8&amp;psc=1,1,1
Econometric Theory and Methods,Books,https://www.amazon.com/Econometric-Theory-Methods-Russell-Davidson/dp/0195123727,1,1
When to Rob a Bank: ...And 131 More Warped Suggestions and Well-Intended Rants,Books,https://www.amazon.com/When-Rob-Bank-Suggestions-Well-Intended/dp/0062385321,1,1
Putin Country: A Journey into the Real Russia,Books,https://www.amazon.com/Putin-Country-Journey-into-Russia/dp/0374247722/ref=sr_1_1?s=books&amp;ie=UTF8&amp;qid=1484573193&amp;sr=1-1&amp;keywords=putin+country,1,1
Are You A Horse?,Books,https://www.amazon.com/Are-You-Horse-Andy-Rash/dp/0439724171,1,1
"Money, Banking, and the Financial System",Books,https://www.amazon.com/Money-Banking-Financial-System-Hubbard/dp/0132553457,1,1
Principles of Macroeconomics,Books,https://www.amazon.com/Principles-Macroeconomics-Robert-Frank/dp/0073362654,1,1
"Hair Growth Conditioner - Clinically Proven to Reduce Hair Loss w/ Argan Oil, Biotin + DHT Blockers - Guaranteed – Save With 2 Pack",Beauty & Personal Care,https://www.amazon.com/Conditioner--GUARANTEED-Treatment-Redensyl-Regrowth/dp/B00WTPVTXQ/ref=sr_1_1?ie=UTF8&amp;qid=1456059096&amp;sr=8-1-spons&amp;keywords=hair+regrowth&amp;psc=1,1,1
Big Ideas in Macroeconomics: A Nontechnical View (MIT Press),Books,https://www.amazon.com/Big-Ideas-Macroeconomics-Nontechnical-Press/dp/0262528304,1,1
