name,category,amazon_link,total_mentions,subreddit_mentions
Emergency!: True Stories From The Nation's ERs,Books,https://www.amazon.com/Emergency-True-Stories-Nations-ERs/dp/0312962657,2,2
"It's Perfectly Normal: Changing Bodies, Growing Up, Sex, and Sexual Health (The Family Library)",Books,https://www.amazon.com/Its-Perfectly-Normal-Changing-Growing/dp/0763668729/ref=redir_mobile_desktop?_encoding=UTF8&amp%3BdpID=61eSz7BpJlL&amp%3BdpPl=1&amp%3Bkeywords=its%20perfectly%20normal&amp%3Bpi=AC_SX236_SY340_QL65&amp%3Bqid=1489554539&amp%3Bref=plSrch&amp%3Bsr=8-1&ref_=mp_s_a_1_1,11,1
"Arcor Juice Filled Strawberry Hard Kosher Candy 2 Packs,Each bag contains 470 Grams = Total 940 Grams (2.072lb)",Grocery & Gourmet Food,https://www.amazon.com/Arcor-Strawberry-Kosher-contains-2-072lb/dp/B004TNVSDW/ref=sr_1_3_a_it?ie=UTF8&amp;qid=1478026878&amp;sr=8-3&amp;keywords=strawberry+candy,10,1
"It's Not the Stork!: A Book About Girls, Boys, Babies, Bodies, Families and Friends (The Family Library)",Books,https://www.amazon.com/dp/0763633313/ref=cm_sw_r_cp_apa_cahYybTP4D4C8,7,1
Infidel,Books,https://www.amazon.com/Infidel-Ayaan-Hirsi-Ali/dp/0743289692/ref=sr_1_1?ie=UTF8&amp;qid=1504192375&amp;sr=8-1&amp;keywords=infidel,4,1
The Purity Myth: How America's Obsession with Virginity Is Hurting Young Women,Books,https://www.amazon.com/The-Purity-Myth-Obsession-Virginity/dp/1580053149,3,1
Factory Girls: From Village to City in a Changing China,Books,https://www.amazon.com/Factory-Girls-Village-Changing-China/dp/0385520182/ref=sr_1_1?ie=UTF8&amp;qid=1499800957&amp;sr=8-1&amp;keywords=factory+girls,3,1
Difficult Conversations: How to Discuss What Matters Most,Books,https://www.amazon.com/Difficult-Conversations-Discuss-What-Matters/dp/0143118447,3,1
"New TS, Premium Heating Full Back Shiatsu Kneading & Vibrating Massage - Seat Cushions -- Maximize Comfort During Travel, At Home and Office","Health, Household & Baby Care",https://www.amazon.com/TickleSeat-friend-zone-ingenious-find/dp/B01CG84UDQ,2,1
"Netter's Anatomy Coloring Book: with Student Consult Access, 2e (Netter Basic Science)",Books,https://www.amazon.com/Netters-Anatomy-Coloring-Book-Student/dp/0323187986,2,1
Boxer Gifts Born Again Virgin Hen Night Accessory by Boxer Gifts,Appliances,https://www.amazon.com/Boxer-Gifts-Again-Virgin-Accessory/dp/B00BJGRQEW,1,1
"Our Bodies, Ourselves: A New Edition for a New Era",Books,https://www.amazon.com/Our-Bodies-Ourselves-New-Era/dp/0743256115/ref=sr_1_1?s=books&amp;ie=UTF8&amp;qid=1489530071&amp;sr=1-1&amp;keywords=our+bodies+ourselves,1,1
Human Sexual Response,Books,https://www.amazon.com/Human-Sexual-Response-William-Masters/dp/0923891218,1,1
Kegel Exercise Weights - 6 Fully Assembled Weights Ranging from 25 to 100g - Includes Kegels4me Tracking Software,"Health, Household & Baby Care",https://www.amazon.com/Kegel-Exercise-Weights-Assembled-Kegels4me/dp/B0034DLBB2,1,1
"The One Mediator, the Saints, and Mary (Lutherans and Catholics in Dialogue)",Books,https://www.amazon.com/Mediator-Saints-Lutherans-Catholics-Dialogue/dp/0806625791,1,1
"Love in action, the sociology of sex.",Books,https://www.amazon.com/Love-action-sociology-Fernando-Henriques/dp/B000P8WV8Q,1,1
Extra Small Condoms,"Health, Household & Baby Care",https://www.amazon.com/dgp-DP0398-Extra-Small-Condoms/dp/B003ZV1YV0,1,1
Europe at Home,Books,https://www.amazon.com/Europe-at-Home-Raffaella-Sarti/dp/0300102593,1,1
The Joy of Sex: The Ultimate Revised Edition,Books,https://www.amazon.com/Joy-Sex-Ultimate-Revised/dp/0307587789/,1,1
Everything You Always Wanted to Know About Sex: But Were Afraid to Ask,Books,https://www.amazon.com/Everything-Always-Wanted-Know-About/dp/0060192674/,1,1
