name,category,amazon_link,total_mentions,subreddit_mentions
The Logic Book,Book,http://www.amazon.com/dp/0078038413/,3,1
The Merriam-Webster Dictionary New Edition (c) 2016,Book,http://www.amazon.com/dp/087779295X/,8,1
Inside Syria: The Backstory of Their Civil War and What the World Can Expect,Book,http://www.amazon.com/dp/1616149485/,1,1
Boy's Club #1,Book,http://www.amazon.com/dp/B001MJXDF2/,12,1
Does Regulation Kill Jobs?,eBooks,http://www.amazon.com/dp/B00HUNZT5G/,1,1
Domald Tromp Pounded In The Butt By His Fabricated Wiretapping Scandal Made Up To Redirect Focus Away From His Seemingly Endless Unethical Connections To Russia,eBooks,http://www.amazon.com/dp/B06XF4KGPR/,1,1
