name,category,amazon_link,total_mentions,subreddit_mentions
Sharks Have Feelings Too,eBooks,http://www.amazon.com/dp/B01EJ17DHS/,2,2
Goodell vs. Obama: The Battle for the Future of the NFL,eBooks,http://www.amazon.com/dp/B00KLCZMXC/,2,2
Seiko Men's SNK805 Seiko 5 Automatic Stainless Steel Watch with Green Canvas,Watch,http://www.amazon.com/dp/B000LTAY1U/,22,1
Bulova Men's 96B104 Stainless Steel Dress Watch,Watch,http://www.amazon.com/dp/B002IDTUHG/,40,1
"Clarks Originals Men's Desert Boot,Beeswax,6 M US",Shoes,http://www.amazon.com/dp/B002IFNVKG/,1,1
Vegemite (220 gram),Grocery,http://www.amazon.com/dp/B004AVEW8G/,2,1
Michael Kors Women's Runway Rose Gold-Tone Watch MK3197,Watch,http://www.amazon.com/dp/B00C6PIJPA/,2,1
Michael Kors Women's Slim Runway Rose Gold-Tone Watch MK4294,Watch,http://www.amazon.com/dp/B00PXMPPJQ/,1,1
"Kieba Hemorrhoid Treatment Donut Tailbone Cushion for Hemorrhoids, Prostate Cushion, Pregnancy Cushion, 18 Inches. Ultra Premium Comfort Foam Hemorrhoid Pillow (Black)",Health and Beauty,http://www.amazon.com/dp/B01A5CRM6W/,4,1
Young Money: Inside the Hidden World of Wall Street's Post-Crash Recruits,Book,http://www.amazon.com/dp/0446583251/,3,1
"Hydro Flask 12 oz Double Wall Vacuum Insulated Stainless Steel Leak Proof Kids Sports Water Bottle, Standard Mouth with BPA Free Flex Cap, Sage",Sports,http://www.amazon.com/dp/B01NAUA1LC/,1,1
"D Day: June 6, 1944: The Climactic Battle of World War II",Book,http://www.amazon.com/dp/068480137X/,3,1
