name,category,amazon_link,total_mentions,subreddit_mentions
The Beaded Garden: Creating Flowers with Beads and Thread,Book,http://www.amazon.com/dp/1931499551/,1,1
Clover Kantan Couture Bead Embroidery Tool-,Art and Craft Supply,http://www.amazon.com/dp/B000XAHBQS/,1,1
Darice(R) Oval Wood Beads - 75PK/Multi,Art and Craft Supply,http://www.amazon.com/dp/B002XNN0TA/,1,1
"Darice Large Oak Bead Loom with Legs, 15-Inch by 14-Inch by 3-1/2-Inch",Art and Craft Supply,http://www.amazon.com/dp/B005M68LTO/,1,1
"Preciosa Czech Fire 8mm Polished Glass Bead, Faceted Round, Black Aurora Borealis, 80-Pack",Art and Craft Supply,http://www.amazon.com/dp/B0079D0PTM/,1,1
