name,category,amazon_link,total_mentions,subreddit_mentions
You Have the Right to Remain Innocent,Book,http://www.amazon.com/dp/1503933393/,5,1
"Wild Republic Cuddlekins 12"" Wolf",Toy,http://www.amazon.com/dp/B00705YYGY/,1,1
"Exclusive Wellness Club DMSO Odorless 99.995% Pharma Grade, Liquid (8 oz)",Beauty,http://www.amazon.com/dp/B009L6NW4U/,2,1
"Kitchen Safe: Time Locking Container (White Lid + Clear Base) - 5.5"" Height",Kitchen,http://www.amazon.com/dp/B00E9J3MLM/,8,1
Pillbox Keychain by Profile Gifts® - Carry Your Daily Medicine in This Compact Metal Pill Box Case,Health and Beauty,http://www.amazon.com/dp/B00GG13Q7Q/,4,1
Black Secret Hidden Stash Watch with Storage,Home Improvement,http://www.amazon.com/dp/B00OVB5D92/,1,1
