name,category,amazon_link,total_mentions,subreddit_mentions
"Passion Lubes, Natural Water-Based Lubricant, 55 Gallon Drum","Health, Household & Baby Care",https://www.amazon.com/Passion-Lubes-Natural-Water-Based-Lubricant/dp/B005MR3IVO/ref=sr_1_1_a_it?ie=UTF8&amp;qid=1497024138&amp;sr=8-1&amp;keywords=55+gal+drum+lubricant,74,1
"Kidde KL-2S Two-Story Fire Escape Ladder with Anti-Slip Rungs, 13-Foot",Tools & Home Improvement,https://www.amazon.com/dp/B00005OU7B/,4,1
"18,000 Live Ladybugs - Good Bugs - Ladybugs - Guaranteed Live Delivery! by Bug Sales","Patio, Lawn & Garden",https://www.amazon.com/18-000-Live-Ladybugs-Guaranteed/dp/B00YFE9KN0/ref=sr_1_13?ie=UTF8&amp;qid=1445702260&amp;sr=8-13&amp;keywords=ladybugs,3,1
"4,500 Live Ladybugs - Good Bugs - Guaranteed Live Delivery!","Patio, Lawn & Garden",https://www.amazon.com/gp/product/B00I0DOKNW?keywords=ladybugs&amp;qid=1445630289&amp;ref_=sr_1_6&amp;sr=8-6,2,1
FreedomCapes American Flag Cape Costume,"Clothing, Shoes & Jewelry",https://www.amazon.com/FreedomCapes-American-Flag-Cape-Costume/dp/B00LLRJOXU,2,1
An American Sickness: How Healthcare Became Big Business and How You Can Take It Back,Books,https://www.amazon.com/American-Sickness-Healthcare-Became-Business/dp/1594206759/ref=sr_1_1?s=books&amp;ie=UTF8&amp;qid=1496388629&amp;sr=1-1&amp;keywords=an+american+sickness,2,1
"Best Maid Dill Pickles, 18-22 ct, 128 oz",Grocery & Gourmet Food,https://www.amazon.com/Best-Maid-Dill-Pickles-18-22/dp/B0030D50ZE,2,1
"It's Perfectly Normal: Changing Bodies, Growing Up, Sex, and Sexual Health (The Family Library)",Books,https://www.amazon.com/Its-Perfectly-Normal-Changing-Growing/dp/0763644838/ref=sr_1_3?ie=UTF8&amp;s=books&amp;qid=1283648405&amp;sr=8-3,1,1
YI Home Camera Wireless IP Security Surveillance System (US Edition) Black,Electronics,https://www.amazon.com/YI-Camera-Wireless-Security-Surveillance/dp/B019MMRV1M/ref=lp_16221803011_1_1?srs=16221803011&amp;ie=UTF8&amp;qid=1501677885&amp;sr=8-1,1,1
"Booze Tubes 5 Tampon Flask Test Tubes with 5 Wrappers, 1-Ounce",Home & Kitchen,https://www.amazon.com/Booze-Tubes-Tampon-Wrappers-1-Ounce/dp/B00CLBWRCA,1,1
Express Water 5 Stage Undersink Reverse Osmosis Drinking Water Filtration System plus Extra Set of 4 Supreme Quality Replacement Filters - RO5DX,Industrial & Scientific,https://www.amazon.com/Drinking-Reverse-Osmosis-System-Water/dp/B00J2DGTD8,1,1
HDP Car Harness Dog Safety Seat Belt Gear Travel System,Pet Supplies,https://www.amazon.com/HDP-Harness-Safety-Travel-System/dp/B000XKSUD6,1,1
Star Trek Federation of Planets Flag 3' X 5',"Patio, Lawn & Garden",https://www.amazon.com/Star-Trek-Federation-Planets-Flag/dp/B01AWJUARG,1,1
Imperium of Man Warhammer Galactic Empire Eagle Flag Banner 3x5 feet,"Patio, Lawn & Garden",https://www.amazon.com/Imperium-Warhammer-Galactic-Empire-Banner/dp/B01GJZ0EFU,1,1
Bissell 1650A Pet Hair Eraser Vacuum,Home & Kitchen,https://www.amazon.com/dp/B01DTYB05C/ref=cm_sw_r_cp_api_oiRwzb9HNSSD0,1,1
King Lear (Dover Thrift Editions),Books,https://www.amazon.com/King-Lear-Dover-Thrift-Editions/dp/0486280586,1,1
"Daisy Outdoor Products 880 Rifle with Scope (Dark Brown/Black, 37.6 Inch)",Sports & Outdoors,https://www.amazon.com/Daisy-Outdoor-Products-Rifle-Scope/dp/B001BS3YQM/ref=sr_1_2?s=sports-and-fitness&amp;ie=UTF8&amp;qid=1485900775&amp;sr=1-2&amp;keywords=pellet+guns,1,1
Sea to Summit Premium Blend Silk/Cotton Traveler Travel Liner with Pillowcase,Sports & Outdoors,https://www.amazon.com/Sea-Summit-Traveler-Pillowcase-Blue/dp/B001PR0728/ref=sr_1_6?ie=UTF8&amp;qid=1439618156&amp;sr=8-6&amp;keywords=travel+silk+sleep+sack,1,1
Guardian Gear Nylon Cat Muzzle,Pet Supplies,https://www.amazon.com/Guardian-Gear-Nylon-Cat-Muzzles/dp/B002T1ICX0,1,1
"Escort Passport 8500X50 Black Radar Detector, Blue Display",Cell Phones & Accessories,https://www.amazon.com/dp/B005IQGU0A,1,1
Mt. Olive - Kosher Dill Pickles - 128-Fl. Oz. (1 Gallon) Jar,Grocery & Gourmet Food,https://www.amazon.com/Mt-Olive-Kosher-Pickles-128-Fl/dp/B003N4B04A,1,1
Chutes and Ladders Game (Amazon Exclusive),Toys & Games,https://www.amazon.com/Hasbro-4555-S5-Chutes-Ladders/dp/B00000DMF6,1,1
"Clauss Titanium Bonded Bent Snips, 7""","Patio, Lawn & Garden",https://www.amazon.com/gp/product/B000XB4U0C/,1,1
"Acer Aspire R 15 Convertible Laptop, 7th Gen Intel Core i7, GeForce 940MX, 15.6"" Full HD Touch, 12GB DDR4, 256GB SSD, R5-571TG-7229",Electronics,https://www.amazon.com/dp/B06WD61CF5/ref=cm_sw_r_cp_apa_owhkzbXXX7MZR,1,1
