name,category,amazon_link,total_mentions,subreddit_mentions
"Lee Men's Big-Tall Modern Series Custom Fit Relaxed Straight Leg Jean, Santiago, 46W x 30L",Apparel,http://www.amazon.com/dp/B00D6F1924/,2,2
5 Collar Extenders,Health and Beauty,http://www.amazon.com/dp/B005PF5ITS/,4,1
Laco / 1925 Men's 861688 Laco 1925 Pilot Classic Stainless Steel Automatic Watch with Brown Leather Band,Watch,http://www.amazon.com/dp/B009LDPTCG/,5,1
"Lee Men's Big-Tall Modern Series Custom Fit Relaxed Straight Leg Jean, Storm Rider, 46W x 30L",Apparel,http://www.amazon.com/dp/B00D6F0ZFQ/,1,1
Men's Shearling Coat Brown Leather Swedish Bomber Jacket ►BEST SELLER◄,Apparel,http://www.amazon.com/dp/B00HSRKU9Y/,4,1
"Cottonhood Long Sleeve T-Shirt Zip Hoodie (Medium, Charcoal Heather)",Apparel,http://www.amazon.com/dp/B00ZYTWD4I/,1,1
Vans Men's Shoes Atwood Canvas Bugundy Windsor Burgundy Wine/White Skate Sneakers (14),Shoes,http://www.amazon.com/dp/B015Z49LNC/,1,1
Mobile Edge BEFBP3 Boomer Esiason Premium Backpack,Personal Computer,http://www.amazon.com/dp/B000GWMKBO/,1,1
"Victorious Mens Drop Crotch Jogger Twill Pants JG804 (3X-Large, DARK DARK WHEAT)",Apparel,http://www.amazon.com/dp/B01F45AREY/,1,1
