name,category,amazon_link,total_mentions,subreddit_mentions
"Thinking, Fast and Slow",Books,https://www.amazon.com/Thinking-Fast-Slow-Daniel-Kahneman/dp/0374533555/ref=sr_1_1?s=books&amp;ie=UTF8&amp;qid=1490548065&amp;sr=1-1&amp;keywords=thinking+fast+and+slow,11,1
Liar's Poker (Norton Paperback),Books,https://www.amazon.com/Liars-Poker-Norton-Paperback-Michael/dp/039333869X/ref=sr_1_1?s=books&amp;ie=UTF8&amp;qid=1490547910&amp;sr=1-1&amp;keywords=liars+poker,4,1
More Money Than God: Hedge Funds and the Making of a New Elite (Council on Foreign Relations Books (Penguin Press)),Books,https://www.amazon.com/More-Money-Than-God-Relations/dp/0143119419/ref=sr_1_1?s=books&amp;ie=UTF8&amp;qid=1490547947&amp;sr=1-1&amp;keywords=more+money+than+god,1,1
The Snowball: Warren Buffett and the Business of Life,Books,https://www.amazon.com/Snowball-Warren-Buffett-Business-Life/dp/0553384619/ref=sr_1_1?s=books&amp;ie=UTF8&amp;qid=1490548006&amp;sr=1-1&amp;keywords=warren+buffett+biography,1,1
Stress Test: Reflections on Financial Crises,Books,https://www.amazon.com/Stress-Test-Reflections-Financial-Crises/dp/0804138613/ref=pd_rhf_dp_s_cp_27?_encoding=UTF8&amp;pd_rd_i=0804138613&amp;pd_rd_r=2BB9B6FDR4RZSSSPX5S5&amp;pd_rd_w=3hzWz&amp;pd_rd_wg=6hzBu&amp;psc=1&amp;refRID=2BB9B6FDR4RZSSSPX5S5,1,1
