name,category,amazon_link,total_mentions,subreddit_mentions
BioShock: Rapture,Book,http://www.amazon.com/dp/0765367351/,23,11
BioShock Infinite: Mind in Revolt,eBooks,http://www.amazon.com/dp/B00B2SO7NU/,2,2
Bioshock 2 Special Edition Three Rapture Advertisement Posters Set,Home,http://www.amazon.com/dp/B00B3ZTR50/,3,2
BioShock 2 Subject Omega & Little Sister with Bunny Splicer Mask Gift Pack Figure,Toy,http://www.amazon.com/dp/B004BFU8AM/,2,2
Bioshock 2 - PC,Video Games,http://www.amazon.com/dp/B0016BVYAM/,1,1
BioShock 2: Big Daddy Ultra Deluxe Action Figure,Toy,http://www.amazon.com/dp/B002PAH9NE/,1,1
BioShock 2 Poster - Paving the Future,Home,http://www.amazon.com/dp/B003MCO3GA/,1,1
Expo - Magic of the White City,Movie,http://www.amazon.com/dp/B004S77VGW/,2,1
Bioshock Rapture Tomorrow's Promise Kept Today Poster,Sports,http://www.amazon.com/dp/B004V424IM/,1,1
Bioshock Rapture the Best and the Brightest Poster,Home,http://www.amazon.com/dp/B004V44Y26/,1,1
Rapture Retro Travel Poster 13 x 19in by Poster Revolution,Home,http://www.amazon.com/dp/B00CX8VKDS/,2,1
Columbia Retro Travel Poster 13 x 19in with Poster Hanger,Home,http://www.amazon.com/dp/B00CX8VLHS/,2,1
"PS3 Glow in the Dark Full Parts Set (Thumbsticks, Buttons, D-pad, Triggers, Start/Select) for Playstation 3 Controller",Video Games,http://www.amazon.com/dp/B00D8GQZ7U/,1,1
"Funko POP Games: Bioshock - Big Daddy 6"" Action Figure",Toy,http://www.amazon.com/dp/B012OWVSC0/,5,1
H2H Mens Casual Turtle Neck Slim Fit Pullover Sweater With Twist Patterned BEIGE US L/Asia XL (KMOSWL033),Apparel,http://www.amazon.com/dp/B01LYGCXTC/,1,1
Old-Time Fruit Crate Labels in Full Color (Dover Pictorial Archive Series),Book,http://www.amazon.com/dp/0486400069/,1,1
"Bioshock ""A Man Chooses, A Slave Obeys"" Tungsten Ring",Single Detail Page Misc,http://www.amazon.com/dp/B01NA8R28T/,1,1
Full-Color Fruit Crate Labels CD-ROM and Book (Dover Electronic Series),Book,http://www.amazon.com/dp/0486999823/,1,1
Rapture: The Big Daddy (Volume 1),Book,http://www.amazon.com/dp/1517585783/,1,1
The Art of Bioshock Infinite,Book,http://www.amazon.com/dp/1595829946/,1,1
