name,category,amazon_link,total_mentions,subreddit_mentions
Reminiscences of a Stock Operator: With New Commentary and Insights on the Life and Times of Jesse Livermore (Annotated Edition),Book,http://www.amazon.com/dp/0470481595/,7,5
Encyclopedia of Chart Patterns,Book,http://www.amazon.com/dp/0471668265/,3,3
Fooled by Randomness: The Hidden Role of Chance in Life and in the Markets (Incerto),Book,http://www.amazon.com/dp/0812975219/,12,2
The Misbehavior of Markets: A Fractal View of Financial Turbulence,Book,http://www.amazon.com/dp/0465043577/,10,2
Basic Economics,Book,http://www.amazon.com/dp/0465060730/,24,1
The Universal Principles of Successful Trading: Essential Knowledge for All Traders in All Markets,Book,http://www.amazon.com/dp/0470825804/,1,1
Day Trading For Dummies,Book,http://www.amazon.com/dp/047094272X/,1,1
Where Are the Customers' Yachts?: or A Good Hard Look at Wall Street,Book,http://www.amazon.com/dp/0471770892/,5,1
The Sovereign Individual: Mastering the Transition to the Information Age,Book,http://www.amazon.com/dp/0684832720/,4,1
"The Black Swan: Second Edition: The Impact of the Highly Improbable: With a new section: ""On Robustness and Fragility"" (Incerto)",Book,http://www.amazon.com/dp/081297381X/,23,1
Getting Started in Chart Patterns,Book,http://www.amazon.com/dp/1118859200/,2,1
The Problem of Political Authority: An Examination of the Right to Coerce and the Duty to Obey,Book,http://www.amazon.com/dp/1137281650/,55,1
Reminiscences of a Stock Operator,Book,http://www.amazon.com/dp/1500541052/,2,1
Rumi Daylight: A Daybook of Spiritual Guidance,Book,http://www.amazon.com/dp/1570625301/,1,1
"The Hour Between Dog and Wolf: Risk Taking, Gut Feelings and the Biology of Boom and Bust",Book,http://www.amazon.com/dp/1594203385/,1,1
How Money Got Free: Bitcoin and the Fight for the Future of Finance,Book,http://www.amazon.com/dp/178074658X/,1,1
Mattel Games Magic 8 Ball®,Toy,http://www.amazon.com/dp/B00001ZWV7/,9,1
"The Gorilla Game, Revised Edition: Picking Winners in High Technology",eBooks,http://www.amazon.com/dp/B000FC120U/,1,1
"ForeverOzone 20,000 Mg/H Solid State Ozone Generator / Timer",Home,http://www.amazon.com/dp/B007GS3T8O/,12,1
The Geologic Model of Religion,eBooks,http://www.amazon.com/dp/B008MZVRXO/,2,1
Flash Boys: A Wall Street Revolt,eBooks,http://www.amazon.com/dp/B00HVJB4VM/,5,1
"Onite Replacement Battery for LG G3 D850 (AT&T), VS985(Verizon), LS990(Sprint), BL-53YH",Wireless,http://www.amazon.com/dp/B00M0FCRHW/,2,1
"Kindle E-reader - Black, 6"" Glare-Free Touchscreen Display, Built-In Audible, Wi-Fi -  Includes Special Offers",Amazon Ereaders,http://www.amazon.com/dp/B00ZV9PXP2/,12,1
Inflatable Judy Doll,Toy,http://www.amazon.com/dp/B010R6I8V4/,2,1
Dan Bigfootzerian Parties In My Butthole With His Billionaire Lifestyle,eBooks,http://www.amazon.com/dp/B01795QW2I/,1,1
Ledger Nano S Cryptocurrency Hardware Wallet,Personal Computer,http://www.amazon.com/dp/B01J66NF46/,8,1
What I Learned Losing a Million Dollars (Columbia Business School Publishing),Book,http://www.amazon.com/dp/0231164688/,3,1
Electric Engraving Engraver Pen Carve Tool For DIY Jewellery Jewelry Metal Glass - (Cordless Precision Engraver with Diamond Tip Bit),Art and Craft Supply,http://www.amazon.com/dp/B01M6X5KWV/,1,1
The Moon Is a Harsh Mistress,Book,http://www.amazon.com/dp/0312863551/,12,1
The Art of Invisibility,Book,http://www.amazon.com/dp/0316554545/,1,1
Flash Boys: A Wall Street Revolt,Book,http://www.amazon.com/dp/0393351599/,11,1
