name,category,amazon_link,total_mentions,subreddit_mentions
The 21 Bitcoin Computer,Personal Computer,http://www.amazon.com/dp/B014RD021C/,11,2
The Creature from Jekyll Island: A Second Look at the Federal Reserve,Book,http://www.amazon.com/dp/091298645X/,10,2
Amlong Crystal Clear Crystal Ball 110mm (4.2 in.) Including Wooden Stand,Home,http://www.amazon.com/dp/B004ZWMA3Y/,3,2
The Bitcoin Big Bang: How Alternative Currencies Are About to Change the World,eBooks,http://www.amazon.com/dp/B00NRC5AWQ/,,1
DiceCheck,Mobile Application,http://www.amazon.com/dp/B00R122I46/,,1
Deep Web,Movie,http://www.amazon.com/dp/B012PJRXQC/,,1
The Bitcoin Investor: Gay Male Erotica Daily Release Series (High Street Hunger Book 51),eBooks,http://www.amazon.com/dp/B00MRAC8HY/,,1
Banking on Bitcoin,Movie,http://www.amazon.com/dp/B01N980S1A/,,1
Bitcoin:  The End Of Money As We Know It,Movie,http://www.amazon.com/dp/B013HU40NC/,,1
Magic Money,Movie,http://www.amazon.com/dp/B01N9I4XLE/,,1
The Book Of Satoshi: The Collected Writings of Bitcoin Creator Satoshi Nakamoto,eBooks,http://www.amazon.com/dp/B00M6KGJ2K/,,1
Three Felonies A Day: How the Feds Target the Innocent,Book,http://www.amazon.com/dp/1594035229/,38,1
Economics in One Lesson: The Shortest and Surest Way to Understand Basic Economics,Book,http://www.amazon.com/dp/0517548232/,14,1
CanaKit Raspberry Pi 2 Complete Starter Kit (9-Items),Personal Computer,http://www.amazon.com/dp/B008XVAVAW/,13,1
A Random Walk down Wall Street: The Time-tested Strategy for Successful Investing,Book,http://www.amazon.com/dp/0393352242/,10,1
"Cryptex Round Lock USB Flash Drive 32 GB, USB 3.0, Antique Gold",Personal Computer,http://www.amazon.com/dp/B01F44IZ3U/,9,1
Antifragile: Things That Gain from Disorder (Incerto),Book,http://www.amazon.com/dp/0812979680/,8,1
Basic Economics,Book,http://www.amazon.com/dp/0465060730/,8,1
Crucial BX100 250GB SATA 2.5 Inch Internal Solid State Drive - CT250BX100SSD1,Personal Computer,http://www.amazon.com/dp/B00RQA6TEI/,3,1
The Misbehavior of Markets: A Fractal View of Financial Turbulence,Book,http://www.amazon.com/dp/0465043577/,3,1
Silk Road,eBooks,http://www.amazon.com/dp/B00HTWDEK0/,2,1
"Trezor bitcoin wallet, Black",Personal Computer,http://www.amazon.com/dp/B00R6MKDDE/,2,1
Metaphors We Live By,Book,http://www.amazon.com/dp/0226468011/,2,1
The IT Regulatory and Standards Compliance Handbook: How to Survive Information Systems Audit and Assessments,Book,http://www.amazon.com/dp/1597492663/,2,1
Wall Street and the Bolshevik Revolution: The Remarkable True Story of the American Capitalists Who Financed the Russian Communists,Book,http://www.amazon.com/dp/190557035X/,2,1
Digital Gold: Bitcoin and the Inside Story of the Misfits and Millionaires Trying to Reinvent Money,Book,http://www.amazon.com/dp/0062362496/,2,1
Bitcoin and Cryptocurrency Technologies: A Comprehensive Introduction,Book,http://www.amazon.com/dp/0691171696/,2,1
The Geologic Model of Religion,eBooks,http://www.amazon.com/dp/B008MZVRXO/,2,1
The Innovator's Dilemma: The Revolutionary Book That Will Change the Way You Do Business,Book,http://www.amazon.com/dp/0062060244/,2,1
The Book Of Satoshi: The Collected Writings of Bitcoin Creator Satoshi Nakamoto,Book,http://www.amazon.com/dp/0996061312/,2,1
America's Bank: The Epic Struggle to Create the Federal Reserve,Book,http://www.amazon.com/dp/1594205493/,1,1
Sirman MINICOOKER Thermal Blender,Kitchen,http://www.amazon.com/dp/B00E5J1U06/,1,1
"Sirman 15304C0G08NA Canova 300 Commercial Food Slicer, 12-Inch",Kitchen,http://www.amazon.com/dp/B00FU4URF4/,1,1
The Bitcoin Big Bang: How Alternative Currencies Are About to Change the World,Book,http://www.amazon.com/dp/1118963660/,1,1
Ledger Wallet Nano Bitcoin Security Card (Ledger Wallet Nano),Personal Computer,http://www.amazon.com/dp/B00UA47IIS/,1,1
Practical Cryptography,Book,http://www.amazon.com/dp/0471223573/,1,1
INTEL NUC Kit Component - BOXNUC6CAYH,Personal Computer,http://www.amazon.com/dp/B01MSZTD8N/,1,1
Seagate 1TB BarraCuda SATA 6Gb/s 128MB Cache 2.5-Inch 7mm Internal Hard Drive (ST1000LM048),Personal Computer,http://www.amazon.com/dp/B01LYNQXCP/,1,1
Crucial 8GB KiT (4GBx2) DDR3/DDR3L 1866 MT/s (PC3-14900) Unbuffered SODIMM 204-Pin Memory - CT2K51264BF186DJ,Personal Computer,http://www.amazon.com/dp/B00N5UFBME/,1,1
Wall Street and the Rise of Hitler,Book,http://www.amazon.com/dp/0945001533/,1,1
Kingston Technology 8GB 1600MHz DDR3L (PC3-12800) 1.35V Non-ECC CL11 SODIMM Intel Laptop Memory KVR16LS11/8,Personal Computer,http://www.amazon.com/dp/B00CQ35HBQ/,1,1
Gigabyte Intel Celeron J1900 Mini PC Barebone Components GB-BXBT-1900,Personal Computer,http://www.amazon.com/dp/B00VBNSO8U/,1,1
Western Digital 500GB SATA 3.5 Hard Drive - WD5000AAKX-60U6AA0,PC Accessory,http://www.amazon.com/dp/B00Y3DSLD8/,1,1
"Encyclopedia of Physical Bitcoins and Crypto-Currencies, Revised Edition",Book,http://www.amazon.com/dp/0995089922/,1,1
"The Investor's Manifesto: Preparing for Prosperity, Armageddon, and Everything in Between",Book,http://www.amazon.com/dp/1118073762/,1,1
Ethics DeMYSTiFieD: Hard Stuff Made Easy,Book,http://www.amazon.com/dp/0071762752/,1,1
Sandisk CZ48 128GB USB 3.0 Flash memory Drive - SDCZ48-128G-U46,Personal Computer,http://www.amazon.com/dp/B00P8XQPY4/,1,1
Komputerbay 128GB SDXC Secure Digital Extended Capacity Speed Class 10 600X UHS-I Ultra High Speed Flash Memory Card 60MB/s Write 90MB/s Read 128 GB,Personal Computer,http://www.amazon.com/dp/B008AN1C1A/,1,1
"A Radically Beneficial World: Automation, Technology and Creating Jobs for All: The Future Belongs to Work That Is Meaningful",Book,http://www.amazon.com/dp/1517160960/,1,1
Bitcoin: And the Future of Money,Book,http://www.amazon.com/dp/1629370363/,1,1
Against Intellectual Property,Book,http://www.amazon.com/dp/B001DTHFWS/,1,1
Victoria Palace Canopy Bed by Michael Amini,Furniture,http://www.amazon.com/dp/B00ZCOJXAW/,1,1
"Tsukineko Full-Size StazOn Multi-Surface Inkpad, Blazing Red",Art and Craft Supply,http://www.amazon.com/dp/B0013JLEBG/,1,1
The Official CHFI Study Guide (Exam 312-49): for Computer Hacking Forensic Investigator,Book,http://www.amazon.com/dp/1597491977/,1,1
Building Bitcoin Websites: A Beginner's Guide to Bitcoin Focused Web Development,Book,http://www.amazon.com/dp/153494544X/,1,1
Arouse-Rx Sex Pheromones For Men: Unscented Cologne Additive to Attract Women - 10mL,Beauty,http://www.amazon.com/dp/B001P4EM3G/,1,1
Bitcoin: The future of money?,Book,http://www.amazon.com/dp/1783521023/,1,1
"The Sovereign Individual: How to Survive and Thrive During the Collapse of the Welfare State First edition by Davidson, James Dale; Rees-Mogg, William published by Simon & Schuster Hardcover",Book,http://www.amazon.com/dp/B00924G6J4/,1,1
AntMiner S5 ~1155Gh/s @ 0.51W/Gh 28nm ASIC Bitcoin Miner,PC Accessory,http://www.amazon.com/dp/B00RCTIY4G/,1,1
APPLE II BASIC programming manual,Book,http://www.amazon.com/dp/B0006XJ4GW/,1,1
StarTech.com 3 Drive 3.5in Trayless Hot Swap SATA Mobile Rack Backplane,CE,http://www.amazon.com/dp/B000NMAZU0/,1,1
OXO Good Grips Ratcheting Pineapple Slicer,Kitchen,http://www.amazon.com/dp/B005LCT5I0/,1,1
The Science of the Blockchain,Book,http://www.amazon.com/dp/1522751831/,1,1
TREZOR - The Bitcoin Safe (Grey),Electronics,https://www.amazon.com/TREZOR-The-Bitcoin-Safe-Grey/dp/B00R6MRI50,1,1
