name,category,amazon_link,total_mentions,subreddit_mentions
Originial TEDCO Gyroscope Twin Pak,Toy,http://www.amazon.com/dp/B000FGKHZ2/,4,3
Mount Fuji 360 Book (Japanese and English Edition),Book,http://www.amazon.com/dp/4949999125/,3,2
"360 Book Mount Fuji"" Yusuke Oono (Japanese)",Book,http://www.amazon.com/dp/4861525160/,3,1
The Famous Drinking Bird,Toy,http://www.amazon.com/dp/B000JSGLBK/,18,1
Balancing Bird Center of Gravity Physics Toy 6.5 inch Wing Span [Toy] Colors may vary,Toy,http://www.amazon.com/dp/B0019LNESE/,7,1
Empire Magic Match Boxes - Coin Vanish and Reappear Trick,Toy,http://www.amazon.com/dp/B001IWPVDK/,1,1
Magswitch MAGJIG 95 MagJig  95 Magswitch,Home Improvement,http://www.amazon.com/dp/B003FWERRC/,2,1
Chemical Guys Stripper Scent Premium Air Freshener and Odor Eliminator (16 oz),Automotive Parts and Accessories,http://www.amazon.com/dp/B004CMMFK0/,3,1
"Original Black Hairagami,99901,multi-colored,One-Size",Apparel,http://www.amazon.com/dp/B0051XP4KC/,2,1
Can You Imagine Airzooka Toy (Black/Silver),Toy,http://www.amazon.com/dp/B00C2S97HA/,10,1
Westminster Magnetic Sand Timer,Home,http://www.amazon.com/dp/B00MBCLA2C/,3,1
"(12) 6 DRAM SMALL ROUND HINGED CONTAINER CRAFTS, RX PILL BOTTLES MIX CONTAINERS (10) Transparent & (2) Solid COLOR",Health and Beauty,http://www.amazon.com/dp/B00P6N3O5E/,1,1
Magic Makers Red Light Up Thumb Tips,Toy,http://www.amazon.com/dp/B00XWTVV9U/,1,1
"Akstore Small Super Steel Fetish Plug Anal Butt Personal Sex Massager, Pink, 5.3 Ounce",Health and Beauty,http://www.amazon.com/dp/B017CMCO5W/,1,1
IMAX 65297 Convertible Console Table Bookshelf,Furniture,http://www.amazon.com/dp/B01BSRRH36/,2,1
"4DBlocks - Play it , Love it! - Magnetic Building Block Set–40 Pieces(Important! 2.52inch) – Promotes Creativity, Imagination & Brain Development–Recreation & Education For Children",Toy,http://www.amazon.com/dp/B01HXYXKMU/,2,1
Levitating Air Bonsai Pot - Magnetic Levitation Suspension flower and air bonsai pot,Lawn & Patio,http://www.amazon.com/dp/B01JFBK8HO/,2,1
Feel Flux A Scientific Toy that Feels Like Magic (Brown) by Feel Flux,Toy,http://www.amazon.com/dp/B01MRSOIRY/,1,1
DAEMON,Book,http://www.amazon.com/dp/0451228731/,21,1
Japanese style Levitating Air Bonsai Pot - Magnetic Levitation Suspension flower (Gray),Home,http://www.amazon.com/dp/B01N1ZPUTZ/,1,1
Alcohol: Soviet Anti-Alcohol Posters,Book,http://www.amazon.com/dp/0993191150/,1,1
