name,category,amazon_link,total_mentions,subreddit_mentions
A Brief History of Neoliberalism,Book,http://www.amazon.com/dp/0199283273/,6,2
Forbidden Fruit: Love Stories from the Underground Railroad,Book,http://www.amazon.com/dp/0743482646/,2,2
Lion's Blood (Insh'Allah Book 1),eBooks,http://www.amazon.com/dp/B006K3I1S4/,,1
High Aztech: The Wildly Inventive Underground SF Classic,eBooks,http://www.amazon.com/dp/B01B5BE7GU/,,1
The Yiddish Policemen's Union: A Novel (P.S.),eBooks,http://www.amazon.com/dp/B006VE7JV2/,,1
Hidden Figures: The American Dream and the Untold Story of the Black Women Mathematicians Who Helped Win the Space Race,eBooks,http://www.amazon.com/dp/B0166JFFD0/,,1
Tameka's New Dress,eBooks,http://www.amazon.com/dp/B01HC8JE5Y/,,1
The Warmth of Other Suns: The Epic Story of America's Great Migration,eBooks,http://www.amazon.com/dp/B003EY7JGM/,,1
Our Kind of People: Inside America's Black Upper Class,eBooks,http://www.amazon.com/dp/B000GCFWVY/,,1
Sin Is a Puppy That Follows You Home,eBooks,http://www.amazon.com/dp/B009TKJKQC/,,1
Biore Sarasara Aqua Rich Watery Essence SPF50+/PA++++ 50g Sunscreen,Beauty,http://www.amazon.com/dp/B00SM99KWU/,31,1
"Hada Labo Rohto Gokujyn Hyaluronic Acid Lotion, 170ml",Beauty,http://www.amazon.com/dp/B000FQUGXA/,17,1
Biore Sarasara Uv Aqua Rich Waterly Essence Sunscreen 50g Spf50+ Pa+++ for Face and Body,Health and Beauty,http://www.amazon.com/dp/B004LRO7DO/,13,1
Biore Uv Aqua Rich Smooth Watery Gel Spf50 + / Pa ++++ 90ml 2015 New Version By 21st Century Japan Export by Kao Corporation,Health and Beauty,http://www.amazon.com/dp/B00SM99KVG/,11,1
Dead Aid: Why Aid Is Not Working and How There Is a Better Way for Africa,Book,http://www.amazon.com/dp/0374532125/,8,1
"At the Dark End of the Street: Black Women, Rape, and Resistance--A New History of the Civil Rights Movement from Rosa Parks to the Rise of Black Power",Book,http://www.amazon.com/dp/0307389243/,5,1
Shiseido SENKA | Sunscreen | Mineral Water UV Gel SPF50 PA+++ 40ml,Beauty,http://www.amazon.com/dp/B004Q1WT58/,5,1
Sundown Towns: A Hidden Dimension of American Racism,Book,http://www.amazon.com/dp/0743294483/,4,1
Eternal Treblinka: Our Treatment of Animals and the Holocaust,Book,http://www.amazon.com/dp/1930051999/,3,1
What Makes Your Brain Happy and Why You Should Do the Opposite,Book,http://www.amazon.com/dp/1616144831/,2,1
"Unrefined Shea Butter by Better Shea Butter - African, Raw, Pure - Use Alone or in DIY Body Butters, Lotions, Soap, Eczema & Stretch Marks Products, Lotion Bars, Lip Balms and More! - 1 lb (16 oz)",Beauty,http://www.amazon.com/dp/B00D9NV2D4/,2,1
Paradise Silk One New Pure Silk Slumber Cap Sleeping Cap Black,Home,http://www.amazon.com/dp/B008AEEVBM/,2,1
"Killing the Black Body: Race, Reproduction, and the Meaning of Liberty",Book,http://www.amazon.com/dp/0679758690/,2,1
Dreams of Africa in Alabama: The Slave Ship Clotilda and the Story of the Last Africans Brought to America,Book,http://www.amazon.com/dp/0195382935/,1,1
Race in North America: Origin and Evolution of a Worldview,Book,http://www.amazon.com/dp/0813345545/,1,1
Spare the Kids: Why Whupping Children Won't Save Black America,Book,http://www.amazon.com/dp/0807061042/,1,1
Other People's Children: Cultural Conflict in the Classroom,Book,http://www.amazon.com/dp/1595580743/,1,1
Black Man in a White Coat: A Doctor's Reflections on Race and Medicine,Book,http://www.amazon.com/dp/1250105048/,1,1
"La Tourangelle, Avocado Oil, 16.9 Fl. Oz.",Grocery,http://www.amazon.com/dp/B006K3RCPC/,1,1
Tropic Isle Jamaican Black Castor Oil 4 Oz,Beauty,http://www.amazon.com/dp/B003COAFPQ/,1,1
The White Boy Shuffle: A Novel,Book,http://www.amazon.com/dp/031228019X/,1,1
Please Stop Helping Us: How Liberals Make It Harder for Blacks to Succeed,Book,http://www.amazon.com/dp/1594037256/,1,1
Racism on Trial: The Chicano Fight for Justice,Book,http://www.amazon.com/dp/0674016297/,1,1
The Death and Life of the Great American School System: How Testing and Choice Are Undermining Education,Book,http://www.amazon.com/dp/0465025579/,1,1
Magic Twist Hair Brush Sponge,Beauty,http://www.amazon.com/dp/B00NQOZVQK/,1,1
Black Elephants in the Room: The Unexpected Politics of African American Republicans (George Gund Foundation Book in African American Studies),Book,http://www.amazon.com/dp/0520291905/,1,1
Concrete Park Volume 2: R-E-S-P-E-C-T,Book,http://www.amazon.com/dp/1616556331/,1,1
Concrete Park Volume 1: You Send Me,Book,http://www.amazon.com/dp/1616555300/,1,1
CEAJOO Sport Headband 3 Pack Sweat Wicking Headband Stretch Head Sweatbands for Women Comfortable Head Bands Sports Hair Accessories Solid Color 2,Sports,http://www.amazon.com/dp/B01FQW310C/,1,1
When and Where I Enter: The Impact of Black Women on Race and Sex in America,Book,http://www.amazon.com/dp/0688146503/,1,1
"Super Strong Folding Step Stool - 11"" Height - Holds up to 300 Lb - The lightweight foldable step stool is sturdy enough to support adults & safe enough for kids. Skid resistant and open with one flip",Furniture,http://www.amazon.com/dp/B01M1ANK5A/,1,1
The Census of 1790: A Demographic History of Colonial California (Ballena Press Anthropological Papers),Book,http://www.amazon.com/dp/0879191384/,1,1
"Garnier SkinActive Micellar Cleansing Water, For Waterproof Makeup, All Skin Types, 13.5 fl. oz.",Pantry,http://www.amazon.com/dp/B019IK3A36/,1,1
"Wildfire 18% Pepper Gel Sticky Pepper Spray 4 oz, Flip Top Actuator",Sports,http://www.amazon.com/dp/B0052VIPA4/,1,1
"Discovering Child Development, 2nd Edition",Book,http://www.amazon.com/dp/0547003617/,1,1
The Autobiography of Malcolm X,Book,http://www.amazon.com/dp/B00193RJEM/,1,1
Solgar - Vitamin E 400 IU Mixed (d-Alpha Tocopherol & Mixed Tocopherols) 100 Softgels,Health and Beauty,http://www.amazon.com/dp/B0001VURB0/,1,1
Increasing Multicultural Understanding (Multicultural Aspects of Counseling And Psychotherapy),Book,http://www.amazon.com/dp/1412936586/,1,1
"Manitou Trading Company Bamboo Rice, 17-Ounce, 2 Pack",Grocery,http://www.amazon.com/dp/B00P03K8SQ/,1,1
An Original Man: The Life and Times of Elijah Muhammad,Book,http://www.amazon.com/dp/0312151845/,1,1
Dial Corp. 04303 Fels-Naptha Laundry Bar Soap (Pack of 4),Home,http://www.amazon.com/dp/B00A7ZD9RE/,1,1
Romantic Violence: Memoirs of an American Skinhead,Book,http://www.amazon.com/dp/0986240427/,1,1
The Original African Heritage Study Bible: King James Version,Book,http://www.amazon.com/dp/0529100673/,1,1
