name,category,amazon_link,total_mentions,subreddit_mentions
Advion Syngenta Cockroach Gel Bait 1 Box(4 Tubes),Lawn & Patio,http://www.amazon.com/dp/B002Y2GNVM/,93,2
1001 Questions to Ask Before You Get Married,Book,http://www.amazon.com/dp/0071438033/,5,1
To An Unknown God: Religious Freedom On Trial,Book,http://www.amazon.com/dp/0312262396/,1,1
Crazy Rich Asians,Book,http://www.amazon.com/dp/0345803787/,3,1
Feeling Good: The New Mood Therapy,Book,http://www.amazon.com/dp/0380810336/,228,1
The Official J.A.P. Handbook,Book,http://www.amazon.com/dp/0452253594/,1,1
A Column of Fire (Kingsbridge),Book,http://www.amazon.com/dp/052595497X/,1,1
Gluten-Free Girl American Classics Reinvented,Book,http://www.amazon.com/dp/0544219880/,3,1
"Harry Potter and the Sorcerer's Stone: The Illustrated Edition (Harry Potter, Book 1)",Book,http://www.amazon.com/dp/0545790352/,25,1
"Everybody Loves Ramen: Recipes, Stories, Games, & Fun Facts About the Noodles You Love",Book,http://www.amazon.com/dp/0740733265/,1,1
Strong Is the New Pretty: A Celebration of Girls Being Themselves,Book,http://www.amazon.com/dp/0761189130/,1,1
I Hope They Serve Beer In Hell,Book,http://www.amazon.com/dp/0806532254/,3,1
One Man's Wilderness: An Alaskan Odyssey,Book,http://www.amazon.com/dp/0882405136/,12,1
Intuitive Eating: A Revolutionary Program that Works,Book,http://www.amazon.com/dp/1250004047/,7,1
The Southern Slow Cooker Bible: 365 Easy and Delicious Down-Home Recipes,Book,http://www.amazon.com/dp/1401605001/,1,1
Habitat: The Field Guide to Decorating,Book,http://www.amazon.com/dp/1419717855/,1,1
"Ada Twist, Scientist",Book,http://www.amazon.com/dp/1419721372/,1,1
"Unicorns Are Jerks: A Coloring Book Exposing the Cold, Hard, Sparkly Truth",Book,http://www.amazon.com/dp/1492647209/,7,1
"The Encyclopedia of Country Living, 40th Anniversary Edition: The Original Manual for Living off the Land & Doing It Yourself",Book,http://www.amazon.com/dp/1570618402/,18,1
Mini Farming: Self-Sufficiency on 1/4 Acre,Book,http://www.amazon.com/dp/1602399840/,6,1
The Backyard Homestead: Produce all the food you need on just a quarter acre!,Book,http://www.amazon.com/dp/1603421386/,6,1
The Cognitive Behavioral Workbook for Depression: A Step-by-Step Program,Book,http://www.amazon.com/dp/1608823806/,9,1
"The Farmer's Cookbook: A Back to Basics Guide to Making Cheese, Curing Meat, Preserving Produce, Baking Bread, Fermenting, and More (The Handbook Series)",Book,http://www.amazon.com/dp/1616083808/,1,1
To Train Up a Child,Book,http://www.amazon.com/dp/1892112000/,10,1
Experience Yoga Nidra: Guided Deep Relaxation (Remastered),Book,http://www.amazon.com/dp/9197789429/,3,1
Chemex 6-Cup Classic Series Glass Coffee Maker,Office Product,http://www.amazon.com/dp/B0000YWF5E/,27,1
"New Blades for the Original Paderno World Cuisine Tri-Blade Spiral Slicer, #A4982799",Kitchen,http://www.amazon.com/dp/B0007Y9WHQ/,48,1
"Sakura Pigma 30062 Micron Blister Card Ink Pen Set, Black, Ass't Point Sizes 6CT Set",Art and Craft Supply,http://www.amazon.com/dp/B0008G8G8Y/,47,1
Dr. Bronner’s Pure-Castile Liquid Soap – Tea Tree 32oz.,Health and Beauty,http://www.amazon.com/dp/B0009R16O8/,1,1
Four Paws Magic Coat Instant Mat Removing Comb,Pet Products,http://www.amazon.com/dp/B000HCJX2C/,1,1
The Spiral Staircase: My Climb Out of Darkness,eBooks,http://www.amazon.com/dp/B000XU4TYK/,1,1
Balneol Hygienic Cleansing Lotion 3fl oz.,Beauty,http://www.amazon.com/dp/B001MSET8I/,2,1
"Scotch-Brite Lint Roller, 95 Sheets, 5 Count",Health and Beauty,http://www.amazon.com/dp/B002DQ6EU4/,3,1
"Capezio Women's Tank Leotard,Light Suntan,X-Small",Apparel,http://www.amazon.com/dp/B002XULQCQ/,1,1
VIAIR 85P Portable Air Compressor,Automotive Parts and Accessories,http://www.amazon.com/dp/B0036E9VB6/,7,1
"Sexy Hair Big Sexy Hair Powder Play, 0.53 Ounce",Beauty,http://www.amazon.com/dp/B00390DN34/,8,1
"Huggies Little Movers Jean Diapers size 3, 29 count",Health and Beauty,http://www.amazon.com/dp/B003EGEL6G/,1,1
DCNL Hair Accessories Sticks,Beauty,http://www.amazon.com/dp/B003N8YBL0/,2,1
Twin Draft Guard Extreme in Brown - Energy Saving Under Door Draft Stopper,Home Improvement,http://www.amazon.com/dp/B003ZSWER6/,7,1
"KONG Cloud E-Collar for Cats and Dogs, Small",Pet Products,http://www.amazon.com/dp/B0045Y1JGQ/,4,1
Lucky Line 64001 Retractable Key Chain- colors vary,Office Product,http://www.amazon.com/dp/B004C3YIP4/,1,1
"Jessica Simpson Women's Bendie Platform Sandal,Deep Purple Kid Suede,6.5 M US",Shoes,http://www.amazon.com/dp/B004CW790Q/,1,1
"Goody - Claw Clip, Curved, Perfect for Medium to Long Hair, Pack of 3",Beauty,http://www.amazon.com/dp/B004G55L86/,1,1
"Nite Ize KRG-03-11 S-Biner Key Ring, Stainless",Home Improvement,http://www.amazon.com/dp/B004MMEHWE/,2,1
Foot Massager - Relieves Foot Pain and Stress in Minutes - by Foot Log,Home,http://www.amazon.com/dp/B004QZPVEA/,1,1
Go the F**k to Sleep,eBooks,http://www.amazon.com/dp/B004YMYR2C/,4,1
"N.Y.C. New York Color Smooth Skin Loose Face Powder, Translucent, 0.7 Ounce",Beauty,http://www.amazon.com/dp/B004ZDTSLA/,1,1
RUSK Engineering W8less Professional 2000 Watt Dryer,Prestige Beauty,http://www.amazon.com/dp/B005B9NWRS/,1,1
"GLYTONE Back Acne Spray, 2 fl. oz",Prestige Beauty,http://www.amazon.com/dp/B005LTCWBA/,1,1
"Amazon Kindle Paperwhite Leather Case, Ink Blue - fits all Paperwhite generations",Digital Device Accessory,http://www.amazon.com/dp/B007R5YG8S/,1,1
"True Lemon, Lime, Orange & Grapefruit 32ct Boxes Sampler Pack (4 packs)",Grocery,http://www.amazon.com/dp/B008GE87BG/,1,1
"Nature's Miracle Stain & Odor Remover, Lavender Scent, 32-Ounce Spray (5385)",Pet Products,http://www.amazon.com/dp/B008RGWFRA/,4,1
Ninja Professional Blender with Nutri Ninja Cups (BL660),Kitchen,http://www.amazon.com/dp/B00939FV8K/,8,1
1 X Organic Kombucha Scoby - Live Culture by Scoby Kombucha,Kitchen,http://www.amazon.com/dp/B009ZW8RP4/,7,1
FreeKey System,Office Product,http://www.amazon.com/dp/B00AQ664H6/,27,1
"Zojirushi SM-JHE48XA Stainless Steel Travel Mug, 16-Ounce/0.48-Liter",Kitchen,http://www.amazon.com/dp/B00C4OE7A4/,1,1
Trader Joe's Kona Coffee Shortbread Cookies (Pack of 2),Grocery,http://www.amazon.com/dp/B00C50SGSG/,1,1
"Muscle Roller Stick - Professional Grade Trigger-Point Design - Massages, Soothes, Refreshes And Invigorates - Fits Conveniently Inside Your Sports Bag",Health and Beauty,http://www.amazon.com/dp/B00CBNDNOO/,6,1
"Melissa & Doug On the Go Water Wow! Activity Book, 3-Pack - Animals, Alphabet, and Numbers",Toy,http://www.amazon.com/dp/B00CPHX9JK/,3,1
ProX by Olay Microdermabrasion Plus Advanced Facial Cleansing Brush System,Beauty,http://www.amazon.com/dp/B00CYA5E1O/,2,1
"GMS Optical Premium Grade Comfortable Silicone Anti-slip Holder for Glasses, Ear Hook, Eyeglass Temple Tip (2 pair, Black)",Apparel,http://www.amazon.com/dp/B00DQOLADS/,2,1
Getting to 50/50: How Working Parents Can Have It All,eBooks,http://www.amazon.com/dp/B00E257WGY/,1,1
"Philips Wake-up Light with Sunrise Simulation alarm clock, White HF3500/60",Health and Beauty,http://www.amazon.com/dp/B00F0W1RIW/,35,1
"Instant Pot DUO60 6 Qt 7-in-1 Multi-Use Programmable Pressure Cooker, Slow Cooker, Rice Cooker, Steamer, Sauté, Yogurt Maker and Warmer",Kitchen,http://www.amazon.com/dp/B00FLYWNYQ/,170,1
Citizen Eco-Drive Women's EW1962-53A Silhouette Sport Watch,Watch,http://www.amazon.com/dp/B00GTNQOTS/,1,1
"Marpac Dohm-DS All-Natural White Noise Sound Machine, Black",Health and Beauty,http://www.amazon.com/dp/B00HD0ELFA/,13,1
TravelWise Packing Cube System - Durable 5 Piece Weekender Plus Set [2014 Version] (Black),Apparel,http://www.amazon.com/dp/B00HHBR00I/,1,1
"Hario Mizudashi Cold Brew Iced Coffee Pot/Maker (1000ml, Brown)",Kitchen,http://www.amazon.com/dp/B00I7JKAQ0/,25,1
Biore Sarasara UV Aqua Rich Watery Essence Sunscreen SPF50+ PA++++ 50g (Pack of 2) ,Beauty,http://www.amazon.com/dp/B00LA6QEOE/,92,1
Unbecoming: A Novel,eBooks,http://www.amazon.com/dp/B00LFZ86DM/,1,1
"HealthAndYoga(TM) Surgical Grade Stainless Steel Tongue Cleaner Scraper | Bacteria Inhibiting, Non-synthetic Grip | Sterilizable",Beauty,http://www.amazon.com/dp/B00LM43DWK/,3,1
"Albanese Candy 12 Flavor Gummi Bears (1) 5 Pound Bag, Gummi Candy, Assorted Flavors, Gluten Free, Dairy Free, Fat Free, Low Calorie",Grocery,http://www.amazon.com/dp/B00OYPFC46/,4,1
Hidden Bodies: A Novel,eBooks,http://www.amazon.com/dp/B00P42WZGG/,1,1
Sharper Image Digital Tranquility Sound Soother,Baby Product,http://www.amazon.com/dp/B00PGHUB6A/,1,1
"VISCATA Palamos (Estartit Suede) 3"" Wedge, Soft Suede, Ankle-Strap, Closed Toe, Espadrilles Heel Made in Spain",Shoes,http://www.amazon.com/dp/B00PP9HPHW/,1,1
"Mizuno Women's Wave Inspire 11 Running Shoe,Grass Green Fuchsia Purple,9.5 B US",Shoes,http://www.amazon.com/dp/B00QW4BDSG/,1,1
"Divas Bra Straps Women's, Replacement Bra Straps, Set of 2",Apparel,http://www.amazon.com/dp/B00RSN41J8/,1,1
DURACELL DURABEAM ULTRA Safety Armband Led Light Black ends 2-Pack,Sports,http://www.amazon.com/dp/B00SCK096U/,4,1
Nivea Sun Protect Super Water Gel SPF 50/PA+++ (Face & Body)Pump Type 140 g (Japan Import),Beauty,http://www.amazon.com/dp/B00SM997I2/,37,1
"Miusol Women's Floral Lace 2/3 Sleeves Long Bridesmaid Maxi Dress (Small, Red)",Apparel,http://www.amazon.com/dp/B00VQ1AUHA/,1,1
"Fruit of the Loom Women's  Breathable Bikini Panties,Assorted,2X-Large 9 ( Pack of 4)",Apparel,http://www.amazon.com/dp/B00VTV8L3C/,1,1
"BXT Creative Vintage Nostalgia Style Safe,Energy-saving and LED Blowing Blow Control Kerosene Oil Lamp USB Rechargeable Cordless Wireless Table Desk Lamp with Brightness Dimming Switch Handheld Night Light Candle Lantern for Indoor & Outdoor Use, Nightlight, Reading Lights, Romantic Dinner, Outdoor Camping, Fishing, Home and Hotel Decoration Gift, etc",Home,http://www.amazon.com/dp/B012CJMQ4O/,1,1
Kill the Boy Band,eBooks,http://www.amazon.com/dp/B013504FBG/,1,1
"Comfort Zone Multicat Diffuser Kit, For Cat Calming",Pet Products,http://www.amazon.com/dp/B014HCXECW/,2,1
"LOEFFLER RANDALL Women's Kiki Flat Sandal, Wheat/Multi, 8 M US",Shoes,http://www.amazon.com/dp/B015ZNK9XO/,1,1
VicTsing 300ml Cool Mist Humidifier Ultrasonic Aroma Essential Oil Diffuser for Office Home Bedroom Living Room Study Yoga Spa - Wood Grain,Health and Beauty,http://www.amazon.com/dp/B018CLNEOM/,3,1
The Woman in Cabin 10,eBooks,http://www.amazon.com/dp/B019DKO5BM/,1,1
The Dollhouse: A Novel,eBooks,http://www.amazon.com/dp/B01AHKXIS8/,1,1
Mischling,eBooks,http://www.amazon.com/dp/B01B1W0L6I/,1,1
"SON & Park Beauty Water 340ml, 11.49oz",Beauty,http://www.amazon.com/dp/B01BJOY2LS/,1,1
Her Every Fear: A Novel,eBooks,http://www.amazon.com/dp/B01EFLYHF8/,1,1
"MHD Professional Flat Iron Hair Straightener (Negative Ionic Technology) with 2 Salon Clips, 1-Inch, Black",Beauty,http://www.amazon.com/dp/B01FD6A7P8/,1,1
"Zen Bamboo Luxury Bed Sheets - Eco-friendly, Hypoallergenic and Wrinkle Resistant Bamboo Derived Rayon - 4-Piece - King - Burgundy",Home,http://www.amazon.com/dp/B01FKNER4G/,1,1
She'sModa Women's Mesh Breath Push Up Bustier Crop Top Club Party Vest L Size Black,Apparel,http://www.amazon.com/dp/B01GD3LZXS/,1,1
Women Mesh Holes Breathable Leakproof Period Panties US size XL/8 Blue Black Gray,Apparel,http://www.amazon.com/dp/B01H6MZI38/,1,1
Velvet Plush Sherpa Throw in Ginger Plaid,Home,http://www.amazon.com/dp/B01HRXHATG/,1,1
"VicTsing 300ml Essential Oil Diffuser, Wood Grain Ultrasonic Aroma Cool Mist Humidifier for Office Home Bedroom Baby Room Study Yoga Spa",Home,http://www.amazon.com/dp/B01HULIXKU/,4,1
Calmoseptine Ointment Tube 4 Oz (Pack of 2),Health and Beauty,http://www.amazon.com/dp/B01INL3TKU/,1,1
"Graco Modes Duo Stroller, Basin",Baby Product,http://www.amazon.com/dp/B01JSC09BK/,1,1
Baleaf Women's Ankle Legging Inner Pocket Non See-through Dark Blue Size L,Apparel,http://www.amazon.com/dp/B01M6UKVQ0/,1,1
