name,category,amazon_link,total_mentions,subreddit_mentions
"Siemens VersiCharge Universal (VC30GRYU): Fast Charging, Easy Installation, Flexible Control, Award Winning, UL Listed, J1772 Compatibility, 20ft Cable, NEMA 6-50 Plug",Home Improvement,http://www.amazon.com/dp/B00MFVI92S/,19,4
JuiceBox Pro 40 Lite: WiFi-equipped 40 Amp UL Listed Electric Vehicle Charging Station (EVSE) with 24-foot cable and NEMA 14-50 plug,Automotive Parts and Accessories,http://www.amazon.com/dp/B00I4D6SJ2/,8,2
RoadPro RPSC-818 12V Hair Dryer/ Defroster with Folding Handle,Automotive Parts and Accessories,http://www.amazon.com/dp/B000BHQ5JC/,1,1
"Silblade WB122S Premium Black Silicone Wiper Blade, 22"" (Pack of 1)",Automotive Parts and Accessories,http://www.amazon.com/dp/B00029X5WO/,1,1
"AeroVironment TurboCord Dual Plug-In EV Charger, 120 & 240 Volt, UL-Listed",Automotive Parts and Accessories,http://www.amazon.com/dp/B00J8O1XQE/,5,1
"Siemens VersiCharge Hard-Wired (VC30GRYHW) : Fast Charging, Easy Installation, Flexible Control, Award Winning, UL Listed, J1772 Compatibility, 14ft Cable, Hard-Wired",Home Improvement,http://www.amazon.com/dp/B00MFVI8UG/,1,1
"PIAA 95055 Super Silicone Wiper Blade - 22"" 550mm (Pack of 1)",Automotive Parts and Accessories,http://www.amazon.com/dp/B0002Z9QWQ/,1,1
