name,category,amazon_link,total_mentions,subreddit_mentions
Best ChoiceProducts Space Saving Steel Hammock Stand 9' Outdoor Patio Portable with Carrying Case,Lawn & Patio,http://www.amazon.com/dp/B00WFH3TIG/,23,5
"Best Choice Products Double Hammock With Space Saving Steel Stand Includes Portable Carrying Case, Desert Stripe",Lawn & Patio,http://www.amazon.com/dp/B00LOZNXRC/,9,3
"Frogg Toggs The Original Chilly Pad Cooling Towel, Sky Blue",Sports,http://www.amazon.com/dp/B003YF7W22/,12,3
"GoPong Hidden Sunscreen Alcohol Flask, 2-Pack",Kitchen,http://www.amazon.com/dp/B00IJ63K86/,21,3
Flagpole To Go Ultimate Tailgaters Package With 20-Foot Portable Flagpole,Sports,http://www.amazon.com/dp/B000OWNMRM/,6,2
Coleman 5-Gallon Solar Shower,Sports,http://www.amazon.com/dp/B0009PUT20/,31,2
Set Of Ten Finger Hands Finger Puppets,Toy,http://www.amazon.com/dp/B00OACD9CU/,18,2
Coleman 2000020273 80 x 32-Inches Pack-Away Cot,Sports,http://www.amazon.com/dp/B0043AK0O4/,3,2
Coleman Airbed Cot - Queen,Sports,http://www.amazon.com/dp/B00AU6AVLW/,7,2
"ION Audio Tailgater (iPA77) | Portable Bluetooth PA Speaker with Mic, AM/FM Radio, and USB Charge Port",Musical Instruments,http://www.amazon.com/dp/B00SNBCBGE/,7,2
Farberware Classic Stainless Steel Yosemite 8-Cup Coffee Percolator,Kitchen,http://www.amazon.com/dp/B00005NCWQ/,3,2
Jackery Titan 20100 mAh Portable Charger Battery Pack 3.4A (Max) Output For Each Port Superior Charging Speed Smart Fit Technology Aluminum Shell - Black,Wireless,http://www.amazon.com/dp/B015QGW4BU/,4,2
"RioRand RR-NL-EW-HD Neon Glowing Strobing Electroluminescent Light El Wire w/Battery Pack for Parties, Halloween Decoration (Green, 15ft)",Home Improvement,http://www.amazon.com/dp/B00EENNGJQ/,2,2
"20 Pairs - Neon Prism Diffraction Fireworks Glasses - For Laser Shows, Raves",Toy,http://www.amazon.com/dp/B005JT5P7A/,9,2
Power Rangers Adult Costume Robe,Apparel,http://www.amazon.com/dp/B00PHTQ66G/,2,2
Stainless Steel Beer Growler - 64 oz,Kitchen,http://www.amazon.com/dp/B00885HHSM/,5,2
Flagpole To Go 20-Foot Portable Flagpole,Sports,http://www.amazon.com/dp/B000OWM2BE/,6,2
TETON Sports Outfitter XXL Camping Cot; Perfect for Base Camp and Hunting; Cots for Adults; Free Storage Bag Included,Sports,http://www.amazon.com/dp/B000P6BGYI/,5,2
Etekcity Ultralight Portable Outdoor Backpacking Camping Stoves with Piezo Ignition (Orange),Sports,http://www.amazon.com/dp/B00B4FY8YO/,90,2
"Body Glide Original Anti-Chafe Balm, 2.5 oz (USA Sale Only)",Sports,http://www.amazon.com/dp/B0043S06GI/,26,2
Flagpole To Go Portable Flagpole Tire Mount,Sports,http://www.amazon.com/dp/B000OWM2EQ/,2,2
Advanced Elements Summer Solar Shower - 3 Gallon,Sports,http://www.amazon.com/dp/B000J2Q0SU/,1,1
Kamp-Rite Oversize Tent Cot,Sports,http://www.amazon.com/dp/B000I641UQ/,3,1
Performix 11203 Plasti Dip Black Multi-Purpose Rubber Coating Aerosol - 11 oz.,Automotive Parts and Accessories,http://www.amazon.com/dp/B0006SU3QW/,26,1
"Rubie's Costume Gorilla In The Midst with Ape Hand, Multicolored, One Size Costume",Apparel,http://www.amazon.com/dp/B000VOESTE/,1,1
"Coghlan's Solar Heated Camp Shower, 5-Gallon, Black",Sports,http://www.amazon.com/dp/B000VNITQS/,2,1
"Intex Quick-Fill AC Electric Air Pump, 110-120 Volt, Max. Air Flow 21.2CFM",Sports,http://www.amazon.com/dp/B000XQK2MW/,1,1
"The Keeper Inc Moon Cup, Size B",Health and Beauty,http://www.amazon.com/dp/B0016D7S28/,1,1
Big Time Toys Moon Shoes Black,Toy,http://www.amazon.com/dp/B0018CI0D8/,4,1
Inflatable Killer Whale (each),Toy,http://www.amazon.com/dp/B0019EY868/,1,1
AeroPress Coffee Maker,Kitchen,http://www.amazon.com/dp/B000GXZ2GS/,16,1
O2cool 8101 Deluxe Battery-operated Handheld Water-misting Fan- Colors May Vary,Home,http://www.amazon.com/dp/B000QUC8N6/,6,1
"HEAROS High Fidelity Series Ear Plugs for Comfortable Long Term Use with Free Case, 1 Pair",Health and Beauty,http://www.amazon.com/dp/B0037KM8QY/,19,1
Coleman 100 Quart Xtreme  5 Wheeled Cooler,Sports,http://www.amazon.com/dp/B000G64FJK/,1,1
Fan-Tastic Vent 01100WH Endless Breeze - 12 Volt Fan,Automotive Parts and Accessories,http://www.amazon.com/dp/B0000AY2Z6/,6,1
"Rubbermaid 1172 ActionPacker Storage Box, 24 Gallon",Home,http://www.amazon.com/dp/B00002N6SQ/,10,1
Coleman 13 x 13 Instant Eaved Shelter,Sports,http://www.amazon.com/dp/B0033990N8/,3,1
Coleman 10-In. Steel Tent Stakes,Sports,http://www.amazon.com/dp/B002HU086C/,3,1
"Leviton 5410 Appliance Switch, Feed-Through Switch Rocker, Single Pole, Single Throw, 3A-125V AC, Brown",Home Improvement,http://www.amazon.com/dp/B000FPANMK/,4,1
ALPS Mountaineering Weekender Seat (Steel Blue),Sports,http://www.amazon.com/dp/B001URCH7G/,5,1
"TETON Sports Oasis 1100 2 Liter Hydration Backpack Perfect for Biking, Hiking, Climbing, and Hunting; Green",Sports,http://www.amazon.com/dp/B006JYHG3U/,6,1
Cleanwaste Go Anywhere Portable Toilet,Sports,http://www.amazon.com/dp/B001TKGAKO/,3,1
Fun Central AC894 LED Foam Stick Baton Supreme - Multicolor - 12 Pack,Toy,http://www.amazon.com/dp/B008483ZRA/,2,1
ZODI Outback Gear Battery Powered Shower,Sports,http://www.amazon.com/dp/B002L9A4BI/,2,1
"Platypus Soft Bottle with Push-Pull Cap, Blue, 0.5-Liter",Sports,http://www.amazon.com/dp/B008W0I6BK/,1,1
Coleman Aluminum Deck Chair (color may vary),Sports,http://www.amazon.com/dp/B00363PSEQ/,3,1
"Anker Astro E3 Ultra Compact 10000mAh Portable Charger (2nd Generation, Classic External Battery Power Bank) Slim with PowerIQ Technologygy for Samsung, iPhone, iPad, Nintendo Switch and More (Black)",Wireless,http://www.amazon.com/dp/B009USAJCC/,71,1
Blue Lizard Sensitive Sunscreen SPF 30+-8.75 oz,Beauty,http://www.amazon.com/dp/B003AVNK0S/,3,1
Guide Gear Portable Folding Hammock,Sports,http://www.amazon.com/dp/B003DQ2YIY/,4,1
Portable Foldaway Hammock With Stand And Carry Bag,Sports,http://www.amazon.com/dp/B003ED9T6Q/,1,1
9ft Blue Neon Glowing Strobing Electroluminescent Wire (El Wire),Home,http://www.amazon.com/dp/B003J99JW4/,13,1
"Bobble Water Bottle, 18.5oz, Black",Kitchen,http://www.amazon.com/dp/B003LTFSAE/,1,1
Hide A Key Under Car Magnet Key Case Large Black,Single Detail Page Misc,http://www.amazon.com/dp/B003P4IH9O/,4,1
Coleman 8-Person Instant Tent (14'x10'),Sports,http://www.amazon.com/dp/B003QUT9OE/,3,1
"Coleman Montana 6-Person Tent,Green",Sports,http://www.amazon.com/dp/B001RPFAFW/,3,1
Camelbak Fresh Reservoir Filter,Sports,http://www.amazon.com/dp/B00437WY32/,1,1
Lightspeed Outdoors Quick Canopy Instant Pop Up Shade Tent,Sports,http://www.amazon.com/dp/B005LGUWRE/,1,1
KanJam Ultimate Disc Game,Sports,http://www.amazon.com/dp/B001RJ4Q2G/,4,1
"Etymotic High Fidelity Earplugs, ER20 ETY-Plugs, Standard Fit Blue Tip, 1 pair",Health and Beauty,http://www.amazon.com/dp/B0044DEESS/,185,1
LED Finger Lights (40 pcs),Apparel,http://www.amazon.com/dp/B0045H0L1W/,4,1
Aeropress Coffee and Espresso Maker,Kitchen,http://www.amazon.com/dp/B0047BIWSK/,117,1
"DuroStar DS4000S, 3300 Running Watts/4000 Starting Watts, Gas Powered Portable Generator",Lawn & Patio,http://www.amazon.com/dp/B004918MO2/,1,1
Gear Aid Aquaseal 10510 Seam Grip,Sports,http://www.amazon.com/dp/B000OR5PHW/,3,1
FUJIFILM FP-100C 3.25 X 4.25 Inches Professional Instant Color Film,Photography,http://www.amazon.com/dp/B0000ALLYO/,9,1
Swing Trek Umbrellas Liteflex Trek Umbrella Silver W2L69027-SILVER,Lawn & Patio,http://www.amazon.com/dp/B001OPO7L8/,3,1
Go Anywhere Waste Kit 100 Pk,Sports,http://www.amazon.com/dp/B001OPFCW6/,1,1
TravelJohn-Disposable Urinal (6 pack),Sports,http://www.amazon.com/dp/B000NV878S/,8,1
"Deodorant Stones of America: Thai Crystal Deodorant, 4.25 oz (Pack of 2)",Health and Beauty,http://www.amazon.com/dp/B001E0YN1W/,1,1
"Scotchgard Outdoor Water Shield, 10.5-Ounce",Home Improvement,http://www.amazon.com/dp/B004ZP83H8/,3,1
"Vivere Double Hammock with Space-Saving Steel Stand, Tropical",Lawn & Patio,http://www.amazon.com/dp/B004YJCP7O/,21,1
Fun Express 25 Piece Plastic Squirt Gun Assortment,Toy,http://www.amazon.com/dp/B001BQTEZY/,1,1
"Maglite LED 2-Cell D Flashlight, Black",Home Improvement,http://www.amazon.com/dp/B000KC418A/,2,1
MistyMate 20007 16 Classic Personal Mister,Lawn & Patio,http://www.amazon.com/dp/B005727DHE/,3,1
"Hydro Flask Insulated Stainless Steel Wide Mouth Water Bottle and Beer Growler, 64-Ounce, Black",Sports,http://www.amazon.com/dp/B005G5YRYY/,3,1
"HitLights Warm White LED Light Strip, 3528 - 16.4 Feet, 300 LEDs, 3000K, 72 Lumens per Foot. 12V DC",Musical Instruments,http://www.amazon.com/dp/B005GL5UG2/,4,1
Coleman 5-Ft. High-Pressure Propane Hose and Adaptor,Sports,http://www.amazon.com/dp/B0009PUQAK/,2,1
Wilton Silver Color Mist,Kitchen,http://www.amazon.com/dp/B005KTVG86/,71,1
Bodyglide Original Anti-Chafe Balm (Packaging May Vary),Sports,http://www.amazon.com/dp/B005L8YVRO/,31,1
Flora Hydroponics 2 Mil Reflective Mylar 48 inches X 25 feet,Lawn & Patio,http://www.amazon.com/dp/B004Q1B4GS/,1,1
"California Costumes Goin' Ape Bodysuit, Black, One Size Costume",Apparel,http://www.amazon.com/dp/B005LLN7H6/,1,1
Mountain Trails Base Camp Cot,Sports,http://www.amazon.com/dp/B005NIAJCS/,1,1
"HitLights LED Light Strip Connector, 8mm Single Color 3528 - 6 Inch Any Angle Strip to Strip, 4 Pack",Musical Instruments,http://www.amazon.com/dp/B0062RBR84/,4,1
Beach Cart with Folding Table / Drink Holders by BeachMall,Sports,http://www.amazon.com/dp/B004N9TCPS/,1,1
"Instapark 10 Watt Solar Panel Portable Solar Charger with Dual USB Ports for iPhone, iPad & all other USB Compatible Devices",Network Media Player,http://www.amazon.com/dp/B006ZRYU9O/,3,1
"Camco 42873 Reversible Outdoor Mat (6' x 9', Charcoal Stripe)",Automotive Parts and Accessories,http://www.amazon.com/dp/B007G2KL2M/,1,1
"50 pairs 3D Fireworks Glasses Neon Multi-Starbursts of 3D Color for Fireworks Displays, Holiday Lights, Club/Concert Lights",Speakers,http://www.amazon.com/dp/B0081LC7MY/,7,1
"Ergodyne Chill-Its 6602 Evaporative Cooling Towel, Blue",Home Improvement,http://www.amazon.com/dp/B001B5I57I/,17,1
3897864 Tent Cot Double Kwik-Cot FC321,Sports,http://www.amazon.com/dp/B004M0YY0G/,2,1
Shut Up And Play The Hits [Blu-ray],DVD,http://www.amazon.com/dp/B008MMONA6/,3,1
Cat Latex Animal Mask,Apparel,http://www.amazon.com/dp/B008V4HEUG/,1,1
16 Ft Telescoping Tailgate Flagpole,Lawn & Patio,http://www.amazon.com/dp/B004IAIQ18/,1,1
Razor Reef Portable Surf Shower,Sports,http://www.amazon.com/dp/B0094JHA6U/,2,1
"Hair Chalk | Metallic Glitter Temporary Hair Color - Edge Chalkers - Lasts up to 3 Days, No Mess, Built in Sealant, 80 Applications Per Stick, Works on All Hair Colors-6 COUNT.",Beauty,http://www.amazon.com/dp/B009P4ZJXK/,2,1
"75"" Portable Folding Camping Bed & Cot - 260 lbs. Capacity By Trademark Innovations (Black)",Sports,http://www.amazon.com/dp/B009S3BA4K/,1,1
"O2COOL 5-Inch Portable Fan, Gray",Home,http://www.amazon.com/dp/B001B16VT6/,11,1
Alite Designs Monarch Chair,Sports,http://www.amazon.com/dp/B009UW2TV2/,2,1
Nemo Equipment Helio Pressure Shower,Sports,http://www.amazon.com/dp/B00ARHKLWS/,3,1
ANLEY [Fly Breeze] 3x5 Foot Marijuana Leaf USA Polyester Flag - Vivid Color and UV Fade Resistant - Canvas Header and Double Stitched - US Marijuana Leaves Flags with Brass Grommets 3 X 5 Ft,Lawn & Patio,http://www.amazon.com/dp/B00ATVYJLG/,2,1
"300 10"" Glow Sticks Bracelets Assorted Colors",Toy,http://www.amazon.com/dp/B000JDZF1W/,1,1
"Instapark SP Series Mono-crystalline Photovoltaic PV Solar Panel (Charge Controller NOT Included, 5 Watts)",Lawn & Patio,http://www.amazon.com/dp/B004FWXWGS/,1,1
