name,category,amazon_link,total_mentions,subreddit_mentions
Plant Identification Terminology: An Illustrated Glossary,Book,http://www.amazon.com/dp/0964022168/,11,9
Botany in a Day: The Patterns Method of Plant Identification,Book,http://www.amazon.com/dp/1892784351/,7,4
Raven Biology of Plants,Book,http://www.amazon.com/dp/1429219610/,3,2
"Botany for Gardeners, 3rd Edition",Book,http://www.amazon.com/dp/160469095X/,3,2
"Plant Physiology, Fifth Edition",Book,http://www.amazon.com/dp/0878938664/,2,2
National Audubon Society Field Guide to North American Wildflowers--E: Eastern Region - Revised Edition,Book,http://www.amazon.com/dp/0375402322/,1,1
I Can Name 50 Trees Today!: All About Trees (Cat in the Hat's Learning Library),Book,http://www.amazon.com/dp/0375822771/,1,1
Trees and Shrubs of California (California Natural History Guides),Book,http://www.amazon.com/dp/0520221109/,1,1
The Ecology of Mycorrhizae (Cambridge Studies in Ecology),Book,http://www.amazon.com/dp/0521335531/,1,1
"Mabberley's Plant-book: A Portable Dictionary of Plants, their Classification and Uses",Book,http://www.amazon.com/dp/0521820715/,1,1
National Audubon Society Field Guide to Florida,Book,http://www.amazon.com/dp/067944677X/,1,1
Ethnobotany: A Modern Perspective,Book,http://www.amazon.com/dp/0757572510/,1,1
Guide to Flowering Plant Families,Book,http://www.amazon.com/dp/0807844705/,1,1
Last Stands: A Journey Through North America's Vanishing Ancient Rainforests,Book,http://www.amazon.com/dp/0870710273/,1,1
Gathering Moss: A Natural and Cultural History of Mosses,Book,http://www.amazon.com/dp/0870714996/,1,1
"Plant Physiology, 4th Edition",Book,http://www.amazon.com/dp/0878938567/,1,1
Plant Survival: Adapting to a Hostile World,Book,http://www.amazon.com/dp/0881922870/,1,1
Native American Ethnobotany,Book,http://www.amazon.com/dp/0881924539/,2,1
"Exotica, Series 3: Pictorial Cyclopedia of Exotic Plants, 10th Edition",Book,http://www.amazon.com/dp/0911266151/,1,1
"Edible Wild Plants: Wild Foods From Dirt To Plate (The Wild Food Adventure Series, Book 1)",Book,http://www.amazon.com/dp/1423601505/,9,1
"Botanica: The Illustrated A-Z of Over 10,000 Garden Plants and How to Cultivate Them",Book,http://www.amazon.com/dp/1566491754/,1,1
Bark: A Field Guide to Trees of the Northeast,Book,http://www.amazon.com/dp/1584658525/,1,1
A Natural History of North American Trees (Donald Culross Peattie Library),Book,http://www.amazon.com/dp/1595341668/,1,1
Brilliant Green: The Surprising History and Science of Plant Intelligence,Book,http://www.amazon.com/dp/1610916034/,4,1
Impacts of Agriculture on Human Health and Nutrition: v. 1,Book,http://www.amazon.com/dp/1848265433/,1,1
A Tour of the Flowering Plants Based on the Classification System of the Angiosperm Phylogeny Group,Book,http://www.amazon.com/dp/1930723482/,2,1
"Nisaku NJP650 7.25"" Blade Hori-Hori Stainless Steel Tomita Weeding Knife",Lawn & Patio,http://www.amazon.com/dp/B0007WFG2I/,3,1
"Jobe’s Organics Vegetable & Tomato Fertilizer 2-5-3 Organic Fast Acting Granular Fertilizer with Biozome, 4 Pound Bag",Lawn & Patio,http://www.amazon.com/dp/B002YOJDAS/,2,1
"Package of 100 Seeds, Sensitive Plant ""Compact Growth"" (Mimosa Pudica) Non-GMO Seeds by Seed Needs",Lawn & Patio,http://www.amazon.com/dp/B00323LXCG/,3,1
Bluapple 2-pack - Freshness extender - Absorbs ethylene gas - Keeps produce fresher longer,Kitchen,http://www.amazon.com/dp/B005W6DRNY/,1,1
Introduction to Bryophytes,eBooks,http://www.amazon.com/dp/B007NWFWQK/,1,1
"BestNest Nature Press, 12"" x 18""",Lawn & Patio,http://www.amazon.com/dp/B009T817UG/,1,1
Miracle Fruit Plant,Lawn & Patio,http://www.amazon.com/dp/B00HVTNJMY/,1,1
"Leaton Digital Luxmeter / Digital Illuminance Light Meter lux meter with LCD Display(Range: 0.1~200,000 Lux Luxmeter, 0.01~20,000Fc)",Home Improvement,http://www.amazon.com/dp/B018QLIVSC/,2,1
The Botany Coloring Book,Book,http://www.amazon.com/dp/0064603024/,2,1
ADB Inc 2016 Tasty Sweet Hai'nan Pink Pitaya Dragon Fruit Cactus Plant,Lawn & Patio,http://www.amazon.com/dp/B01L6XXNJO/,1,1
"Plant Pathology, Fifth Edition",Book,http://www.amazon.com/dp/0120445654/,1,1
Plant Biology (2nd Edition),Book,http://www.amazon.com/dp/0131469061/,1,1
The Forest Unseen: A Year's Watch in Nature,Book,http://www.amazon.com/dp/0143122940/,3,1
Genetic Analysis: An Integrated Approach,Book,http://www.amazon.com/dp/0321732502/,1,1
