name,category,amazon_link,total_mentions,subreddit_mentions
Stop Walking on Eggshells: Taking Your Life Back When Someone You Care About Has Borderline Personality Disorder,Book,http://www.amazon.com/dp/1572246901/,72,2
"The Dialectical Behavior Therapy Skills Workbook: Practical DBT Exercises for Learning Mindfulness, Interpersonal Effectiveness, Emotion Regulation & ... Tolerance (New Harbinger Self-Help Workbook)",Book,http://www.amazon.com/dp/1572245131/,99,2
Splitting: Protecting Yourself While Divorcing Someone with Borderline or Narcissistic Personality Disorder,Book,http://www.amazon.com/dp/1608820254/,48,2
"Full Catastrophe Living (Revised Edition): Using the Wisdom of Your Body and Mind to Face Stress, Pain, and Illness",Book,http://www.amazon.com/dp/0345536932/,24,1
The Essential Family Guide to Borderline Personality Disorder: New Tools and Techniques to Stop Walking on Eggshells,eBooks,http://www.amazon.com/dp/B00BS03LO8/,1,1
Cognitive-Behavioral Treatment of Borderline Personality Disorder,Book,http://www.amazon.com/dp/0898621836/,3,1
Stop Walking on Eggshells: Taking Your Life Back When Someone You Care About Has Borderline Personality Disorder,eBooks,http://www.amazon.com/dp/B004DNXGFQ/,10,1
