name,category,amazon_link,total_mentions,subreddit_mentions
Crafting with Cat Hair: Cute Handicrafts to Make with Your Cat,Book,http://www.amazon.com/dp/1594745250/,13,2
Hertzko Self Cleaning Slicker Brush,Pet Products,http://www.amazon.com/dp/B00ZGPI3OY/,2,1
Vktech Industrial Gas Chemical Anti-Dust Respirator Mask Goggles Set (Style A),Home Improvement,http://www.amazon.com/dp/B00B1YP7U2/,2,1
Catit Self Groomer with Catnip,Pet Products,http://www.amazon.com/dp/B001B58L0O/,1,1
Wahl 2-in-1 Combination Double Row Pet Rake with hair shedding Blade for dog or cat fur by The Brand Used By Professionals.  #858424,Pet Products,http://www.amazon.com/dp/B00292BRCC/,1,1
Purrfect Arch Groom Toy,Pet Products,http://www.amazon.com/dp/B00LV46BVQ/,1,1
"Pet Dematting Comb By Hertzko - Suitable for Dogs and Cats - Removes Loose Undercoat, Mats and Tangled Hair- Great Tool for Brushing and Deshedding.",Pet Products,http://www.amazon.com/dp/B010CCUJ9W/,1,1
"West Chester 12018 18"" Chemical Resistant Gloves, Large, Black (Pack of 1 Pair)",BISS,http://www.amazon.com/dp/B0067NOY2Y/,1,1
Dupont Large Yellow Tychem Qc Chemical Protection Coveralls,Home Improvement,http://www.amazon.com/dp/B005QQFHI8/,1,1
