name,category,amazon_link,total_mentions,subreddit_mentions
"Morakniv Companion Fixed Blade Outdoor Knife with Carbon Steel Blade, 4.1-Inch, Military Green",Sports,http://www.amazon.com/dp/B004TNWD40/,62,13
Bushcraft: Outdoor Skills and Wilderness Survival,Book,http://www.amazon.com/dp/1551051222/,11,6
Bushcraft 101: A Field Guide to the Art of Wilderness Survival,Book,http://www.amazon.com/dp/1440579776/,8,5
"Morakniv Companion Fixed Blade Outdoor Knife with Sandvik Stainless Steel Blade, 4.1-Inch, Military Green",Sports,http://www.amazon.com/dp/B004ZAIXSC/,23,5
"Bahco 396-LAP Laplander Folding Saw, 7-1/2 -Inch Blade, 7 TPI",Home Improvement,http://www.amazon.com/dp/B0001IX7OW/,25,5
"Subsistence: A Guide For The Modern Hunter Gatherer: Hunting, Trapping, Fishing & Foraging for a Living In Central Texas (BLACK & WHITE EDITION)",Book,http://www.amazon.com/dp/1479259667/,4,4
Audubon Society Field Guide to North American Trees:  Eastern Region,Book,http://www.amazon.com/dp/0394507606/,5,4
Fiskars X7 Hatchet 14 Inch,Lawn & Patio,http://www.amazon.com/dp/B0002YTO7E/,19,4
"Condor Tool & Knife, Bushlore Camp Knife, 4-5/16in Blade, Hardwood Handle with Sheath",Sports,http://www.amazon.com/dp/B002CC6BPM/,14,4
Epiphany Outdoor Gear Pocket Bellow Collapsible Fire Tool,Sports,http://www.amazon.com/dp/B00LDSW5BA/,9,4
"Magnesium Fire Starter by Relefree Survival Emergency Flint Firesteel Ferro Rod with Quick Well Sparks for Camping, Hiking",Sports,http://www.amazon.com/dp/B00UHD41T6/,6,4
"Ka-Bar Leather Sheath, 7-Inch, Brown",Sports,http://www.amazon.com/dp/B005GREUD0/,6,3
"SAS Survival Handbook, Third Edition: The Ultimate Guide to Surviving Anywhere",Book,http://www.amazon.com/dp/0062378074/,15,3
Edible Wild Plants: Eastern/Central North America (Peterson Field Guides),Book,http://www.amazon.com/dp/039592622X/,19,3
"Sawyer Products SP103 Mini Water Filtration System, Single, Orange",Sports,http://www.amazon.com/dp/B00MPH1LEU/,42,3
What the Robin Knows: How Birds Reveal the Secrets of the Natural World,Book,http://www.amazon.com/dp/054400230X/,5,2
Smith's TRI-6 Arkansas TRI-HONE Sharpening Stones System,Home Improvement,http://www.amazon.com/dp/B00062BIT4/,19,2
Hultafors 380020 GK Heavy Duty Knife,Home Improvement,http://www.amazon.com/dp/B004O9MIE4/,3,2
Plants of the Pacific Northwest Coast,Book,http://www.amazon.com/dp/1551055309/,7,2
"A Field Guide to Eastern Trees: Eastern United States and Canada, Including the Midwest (Peterson Field Guides)",Book,http://www.amazon.com/dp/0395904552/,2,2
"Morakniv Craftline Basic 511 High Carbon Steel Fixed Blade Utility Knife and Combi-Sheath, 3.6-Inch Blade, Red",Sports,http://www.amazon.com/dp/B00T3DCVVG/,6,2
Bushcraft: Outdoor Skills and Wilderness Survival,Book,http://www.amazon.com/dp/1772130079/,4,2
Essential Bushcraft,Book,http://www.amazon.com/dp/0340829710/,3,2
Dr. Bronner's Pure-Castile Liquid Soap - Peppermint 32oz.,Beauty,http://www.amazon.com/dp/B00120VWJ0/,24,2
Lansky Puck - Dual Grit Multi-Purpose Sharpener - Blade & Tool Sharpener,Sports,http://www.amazon.com/dp/B000B8FW0Y/,9,2
Relefree Ferrocerium Rod Flint Fire Starter lighter Slim Magnesium Camping Survival Tool Kits Black (Pack of 6) 4.5mmx75mm,Sports,http://www.amazon.com/dp/B00UKZE6AA/,2,2
Condor MA31 Single P90/UMP45 Mag Pouch,Sports,http://www.amazon.com/dp/B00865O4A8/,2,2
"Aqua Quest Guide Tarp Medium 10 x 7 ft Olive Drab - Ultralight Waterproof Rip-Stop Sil Nylon Backpacking Rain Fly Shelter - Compact, Versatile & Durable",Sports,http://www.amazon.com/dp/B01B5D0C6W/,3,2
"Morakniv Companion Fixed Blade Outdoor Knife with Sandvik Stainless Steel Blade, 4.1-Inch, Black",Sports,http://www.amazon.com/dp/B00BTJKB00/,16,2
"WELL-STRONG 2-in-1 Waterproof First Aid Kit 104 Pcs Light and Durable for Car, Sports, Travel, Survival, Emergency, Outdoor Camping, Fishing and Hiking",Sports,http://www.amazon.com/dp/B01H3HDMDO/,2,2
"Morakniv Companion Heavy Duty Knife with Sandvik Carbon Steel Blade, 0.125/4.1-Inch, Military Green",Sports,http://www.amazon.com/dp/B009NZVZ3E/,13,2
"SAS Survival Guide 2E (Collins Gem): For any climate, for any situation",Book,http://www.amazon.com/dp/0061992860/,12,2
"Morakniv Bushcraft Carbon Fixed Blade Knife with Carbon Steel Blade, Black, 0.125/4.3-Inch",Sports,http://www.amazon.com/dp/B009O01H0Y/,7,2
"Morakniv Classic No 1 Wood Handle Utility Knife with Carbon Steel Blade, 3.9-Inch",Sports,http://www.amazon.com/dp/B00449YYM8/,6,2
Ontario Knife 7025 7-Inch Butcher Knife,Kitchen,http://www.amazon.com/dp/B000MF9PY0/,5,2
"Morakniv Companion Fixed Blade Outdoor Knife with Sandvik Stainless Steel Blade, 4.1-Inch",Sports,http://www.amazon.com/dp/B00EF2RUD4/,12,2
Wild Cards: Edible Wild Foods (All Ages),Book,http://www.amazon.com/dp/0880795158/,4,2
Raqpak Reflective Cord 100 Feet Long Tent Guyline Rope with Carry Pouch (Red),Home Improvement,http://www.amazon.com/dp/B010EJ52CW/,2,2
DMT FWFC  Double Sided Diafold Sharpener Fine / Coarse,Home Improvement,http://www.amazon.com/dp/B00004WFTW/,5,2
Cold Steel Trail Hawk American Hickory Handle,Sports,http://www.amazon.com/dp/B0014BMBA6/,2,2
ALPS OutdoorZ Commander + Pack Bag,Sports,http://www.amazon.com/dp/B004R7L7YU/,4,2
Primitive Wilderness Living & Survival Skills: Naked into the Wilderness,Book,http://www.amazon.com/dp/0967877776/,3,2
Genuine US Military All Weather Poncho Liner Blanket,Sports,http://www.amazon.com/dp/B001L0VX2W/,17,2
"Nature's Garden: A Guide to Identifying, Harvesting, and Preparing Edible Wild Plants",Book,http://www.amazon.com/dp/0976626616/,5,2
"CRKT Woods Chogan Tomahawk Axe: RMJ 2730 T-Hawk Lightweight Outdoor Camping Axe with Hammerhead, Forged Carbon Steel Blade and Hickory Wooden Handle",Home Improvement,http://www.amazon.com/dp/B00I04Q7LO/,3,2
"Morakniv Craftline HighQ Robust Trade Knife with Carbon Steel Blade and Combi-Sheath, 4.1-Inch",Sports,http://www.amazon.com/dp/B00816PZ8W/,7,2
Lansky LKDMD 4-Stone Deluxe Diamond System Precision Knife Sharpening Kit,Sports,http://www.amazon.com/dp/B000B8L6LS/,9,1
Lansky Deluxe 5-Stone Sharpening System,Sports,http://www.amazon.com/dp/B000B8IEA4/,61,1
"The Indian Tipi: Its History, Construction, and Use, 2nd Edition",Book,http://www.amazon.com/dp/0806122366/,2,1
Medicinal Plants of North America: A Field Guide (Falcon Guide Medicinal Plants of North America),Book,http://www.amazon.com/dp/1493019619/,1,1
Tajima JPR-SET Japanese Precision Woodworkers Rapid Pull Hand Saw Kit - 4 Piece Set with 16 & 19 TPI Blades & Canvas Carrying Case,Home Improvement,http://www.amazon.com/dp/B0008KLNSA/,1,1
"Ranger Confidential: Living, Working, And Dying In The National Parks",Book,http://www.amazon.com/dp/0762752637/,1,1
Into the Wild,Book,http://www.amazon.com/dp/0385486804/,7,1
"Estwing E44A 16"" Camper's Axe - All Steel with Shock Reduction Grip",Lawn & Patio,http://www.amazon.com/dp/B00047F130/,2,1
Flames Vinyl Stick Onz Decal,Automotive Parts and Accessories,http://www.amazon.com/dp/B0002NIIPY/,2,1
THE SHELTERING DESERT,Book,http://www.amazon.com/dp/1245718797/,1,1
Smith's SK2 2-Stone Sharpening Kit,Home Improvement,http://www.amazon.com/dp/B000B5JXU2/,7,1
"Lansky 8"" Ceramic Sharp Stick",Sports,http://www.amazon.com/dp/B000B8FW0O/,9,1
"Bahco 51-21 Bow Saw Blade, 21-Inch, Dry Wood",Home Improvement,http://www.amazon.com/dp/B0001IX72E/,1,1
Leatherman Crater c33 Straight Blade Knife,Home Improvement,http://www.amazon.com/dp/B001EYU4IY/,2,1
KING 250/1000 Grit Combination Waterstone,Kitchen,http://www.amazon.com/dp/B0000Y7LAS/,11,1
Outdoor Research Bug Bivy,Apparel,http://www.amazon.com/dp/B000BH0VME/,4,1
"Carhartt Men's Arctic Quilt Lined Yukon Coat,Black,Large",Apparel,http://www.amazon.com/dp/B0000VC1OC/,3,1
KING KW65 1000/6000 Grit Combination Whetstone with Plastic Base,Kitchen,http://www.amazon.com/dp/B001DT1X9O/,49,1
Baker MS8 Mouth Spreader (8-Inch),Sports,http://www.amazon.com/dp/B0000AV0V6/,2,1
"The Forager's Harvest: A Guide to Identifying, Harvesting, and Preparing Edible Wild Plants",Book,http://www.amazon.com/dp/0976626608/,4,1
"Shelters, Shacks, and Shanties: The Classic Guide to Building Wilderness Shelters (Dover Books on Architecture)",Book,http://www.amazon.com/dp/0486437477/,1,1
"The Foxfire Book: Hog Dressing, Log Cabin Building, Mountain Crafts and Foods, Planting by the Signs, Snake Lore, Hunting Tales, Faith Healing, Moonshining, and Other Affairs of Plain Living",Book,http://www.amazon.com/dp/0385073534/,12,1
Fiskars Ultra Light Knee Pads (9418),Lawn & Patio,http://www.amazon.com/dp/B00005LEXF/,3,1
"Quikclot Sport Brand Advanced Clotting Sponge ,Stop Bleeding Fast, 50 Gram Package",Health and Beauty,http://www.amazon.com/dp/B001BCNTHC/,7,1
Victorinox Swiss Army Recruit Knife #53241,Sports,http://www.amazon.com/dp/B00004YVB7/,3,1
"GSI Outdoors - Halulite Tea Kettle, 1 Quart, Superior Backcountry Cookware Since 1985",Sports,http://www.amazon.com/dp/B0018BLKOU/,1,1
Cold Steel Bushman Black SK-5 Steel Cordura Survival Sheath,Sports,http://www.amazon.com/dp/B0015RQI7Q/,1,1
AccuSharp 001 Knife Sharpener,Home Improvement,http://www.amazon.com/dp/B00004VWKQ/,22,1
Edible and Medicinal Plants of the Great Lakes Region,Book,http://www.amazon.com/dp/0923568379/,1,1
"Leather Work Gloves with Wrist Closure, DIY, Yardwork, Construction, Motorcycle, Large (Wells Lamont 1132L)",Home Improvement,http://www.amazon.com/dp/B00004R9RW/,1,1
"Deerskin Driver Gloves, Full Leather Work and Driving Gloves, Large (Wells Lamont 962L)",Home Improvement,http://www.amazon.com/dp/B00004R9RI/,1,1
Winter Tree Finder: A Manual for Identifying Deciduous Trees in Winter (Eastern US) (Nature Study Guides),Book,http://www.amazon.com/dp/0912550031/,3,1
S.O.L. Survive Outdoors Longer Emergency Bivvy,Health and Beauty,http://www.amazon.com/dp/B000WXX0JS/,9,1
Botany in a Day: The Patterns Method of Plant Identification,Book,http://www.amazon.com/dp/1892784351/,7,1
EZE-LAP L PAK Set SF/F/M Color Coded Diamond Hones,Home Improvement,http://www.amazon.com/dp/B000UVS62S/,2,1
Kydex Sheath For Short Ka-Bars,Sports,http://www.amazon.com/dp/B000UPWYMM/,1,1
Spyderco Double 1 x 5 x 1/4 Stuff Fine/Medium Stone with Pouch,Sports,http://www.amazon.com/dp/B0013AVZR8/,5,1
Knives of Alaska Suregrip Cub Bear Caping Knife,Sports,http://www.amazon.com/dp/B0013AY4GM/,1,1
Plants of the Pacific Northwest Coast,Book,http://www.amazon.com/dp/1772130087/,3,1
Rothco G.I. O.D. Casualty Blanket,Sports,http://www.amazon.com/dp/B0014EWWFM/,1,1
Tree Finder: A Manual for Identification of Trees by their Leaves (Eastern US) (Nature Study Guides),Book,http://www.amazon.com/dp/0912550015/,5,1
Coleman Camp Axe,Sports,http://www.amazon.com/dp/B00168XMDM/,2,1
Woodcraft and Camping,Book,http://www.amazon.com/dp/0486211452/,1,1
Grand Trunk Ultralight Hammock (Forest Green),Sports,http://www.amazon.com/dp/B001AIHB76/,7,1
Spyderco Tri-Angle Sharpmaker Knife Sharpener 204MF,Sports,http://www.amazon.com/dp/B000Q9C4AE/,28,1
Ontario Spec Plus Marine Raider Bowie,Sports,http://www.amazon.com/dp/B001BMTZSY/,6,1
"Nalgene HDPE Wide Mouth Water Bottle (Green, 1-Quart)",Sports,http://www.amazon.com/dp/B001CKA6EW/,2,1
Cold Steel Trail Boss Hickory Handle,Sports,http://www.amazon.com/dp/B001CZ9UY4/,4,1
"Silva Guide Compass, Orange",Sports,http://www.amazon.com/dp/B000PGJ4V0/,1,1
1086284 Ontario Knife Co RTAK-II Knife,Sports,http://www.amazon.com/dp/B001DZV3BG/,3,1
Light My Fire Titanium Spork,Sports,http://www.amazon.com/dp/B001E7S5BO/,19,1
Nalgene Stainless Bottle,Sports,http://www.amazon.com/dp/B001EOKH7W/,1,1
"Smith's PP1 Pocket Pal Multifunction Sharpener, Grey",Home Improvement,http://www.amazon.com/dp/B000O8OTNC/,5,1
Coghlan's Aluminum Clamp-On Pot Holder,Sports,http://www.amazon.com/dp/B000O73R72/,1,1
