name,category,amazon_link,total_mentions,subreddit_mentions
The Lean Startup: How Today's Entrepreneurs Use Continuous Innovation to Create Radically Successful Businesses,Books,https://www.amazon.com/Constant-Innovation-Radically-Successful-Businesses/dp/0670921602/ref=tmm_pap_swatch_0?_encoding=UTF8&amp;sr=&amp;qid=,2,2
Getting Things Done: The Art of Stress-Free Productivity,Books,https://www.amazon.com/dp/0142000280/,3,1
The No Asshole Rule: Building a Civilized Workplace and Surviving One That Isn't,Books,https://www.amazon.com/The-Asshole-Rule-Civilized-Workplace/dp/0446698202,2,1
The Effective Executive: The Definitive Guide to Getting the Right Things Done (Harperbusiness Essentials),Books,https://www.amazon.com/dp/0060833459/,2,1
"Pitch Anything: An Innovative Method for Presenting, Persuading, and Winning the Deal (Business Skills and Development)",Books,https://www.amazon.com/dp/0071752854/,2,1
"Getting Everything You Can Out of All You've Got: 21 Ways You Can Out-Think, Out-Perform, and Out-Earn the Competition",Books,https://www.amazon.com/dp/0312284543/,2,1
Accounting Made Simple: Accounting Explained in 100 Pages or Less,Books,https://www.amazon.com/dp/0981454224/,2,1
Financial Intelligence for Entrepreneurs: What You Really Need to Know About the Numbers,Books,https://www.amazon.com/dp/1422119157/,2,1
3-d Negotiation: Powerful Tools to Change the Game in Your Most Important Deals,Books,https://www.amazon.com/dp/1591397995/,2,1
E.R. WEISS: THE TYPOGRAPHY OF AN ARTIST,Books,https://www.amazon.com/E-R-WEISS-TYPOGRAPHY-Gerald-Cinamon/dp/B005954VO2/ref=sr_1_1?s=books&amp;ie=UTF8&amp;qid=1479228626&amp;sr=1-1&amp;keywords=typography,1,1
Waterman Edson Limited Edition Sterling Silver Fountain Pen Extra Fine Nib,Office Products,https://www.amazon.com/Waterman-Limited-Sterling-Silver-Fountain/dp/B0006G2LPU/ref=sr_1_20?ie=UTF8&amp;qid=1498684596&amp;sr=8-20&amp;keywords=pen,1,1
Why Does College Cost So Much?,Books,https://www.amazon.com/Why-Does-College-Cost-Much/dp/0190214104/ref=sr_1_1?ie=UTF8&amp;qid=1425826060&amp;sr=8-1&amp;keywords=Why+Does+College+Cost+So+Much,1,1
"Bic Round Stic Xtra Life Medium Ballpoint Pen, Blue Ink 10 ea",Office Products,https://www.amazon.com/Round-Stic-Xtra-Medium-Ballpoint/dp/B00004YTPX/ref=sr_1_5?rps=1&amp;ie=UTF8&amp;qid=1498684714&amp;sr=8-5&amp;keywords=pen&amp;refinements=p_85,1,1
Allwood Eagle Point | 1108 SQF Kit Cabin,Home & Kitchen,https://www.amazon.com/Allwood-Kit-Cabin-Eagle-Point/dp/B00LYGIEU2/ref=sr_1_1?ie=UTF8&amp;qid=1451683864&amp;sr=8-1,1,1
Out of the Crisis (MIT Press),Books,https://www.amazon.com/Out-Crisis-Press-Edwards-Deming/dp/0262541157,1,1
Career Warfare: 10 Rules for Building a Successful Personal Brand on the Business Battlefield,Books,https://www.amazon.com/Career-Warfare-Building-Successful-Battlefield/dp/0071597298/ref=sr_1_1?s=books&amp;ie=UTF8&amp;qid=1471881384&amp;sr=1-1,1,1
Executive Warfare: 10 Rules of Engagement for Winning Your War for Success (Management & Leadership),Books,https://www.amazon.com/Executive-Warfare-Engagement-Winning-Success/dp/0071544232/ref=sr_1_3?s=books&amp;ie=UTF8&amp;qid=1471881384&amp;sr=1-3,1,1
Smart Choices: A Practical Guide to Making Better Decisions,Books,https://www.amazon.com/dp/0767908864/,1,1
Making Sense of Behavior: The Meaning of Control,Books,https://www.amazon.com/dp/0964712156/,1,1
Making Things Happen: Mastering Project Management (Theory in Practice),Books,https://www.amazon.com/dp/0596517718/,1,1
Purpose: The Starting Point of Great Companies,Books,https://www.amazon.com/dp/1403975817/,1,1
Ubiquiti UniFi Enterprise WiFi System AP-Pro (UAP-PRO),Electronics,https://www.amazon.com/dp/B00HXT8T5O/ref=psdc_1194486_t3_B015PRO512,1,1
Indispensable: How To Become The Company That Your Customers Can't Live Without,Books,https://www.amazon.com/dp/0471703087/,1,1
All Marketers Are Liars: The Power of Telling Authentic Stories in a Low-Trust World,Books,https://www.amazon.com/dp/1591841003/,1,1
Growing Great Employees: Turning Ordinary People into Extraordinary Performers,Books,https://www.amazon.com/dp/1591841909/,1,1
World's Largest Crossword Puzzle,Toys & Games,https://www.amazon.com/dp/B00001R3WO,1,1
How to Make Millions with Your Ideas: An Entrepreneur's Guide,Books,https://www.amazon.com/dp/0452273161/,1,1
Your Money or Your Life: Transforming Your Relationship with Money and Achieving Financial Independence,Books,https://www.amazon.com/dp/0140286780/,1,1
Marketing Metrics: 50+ Metrics Every Executive Should Master,Books,https://www.amazon.com/dp/0131873709/,1,1
The 80/20 Principle: The Secret to Achieving More with Less,Books,https://www.amazon.com/dp/0385491743/,1,1
The Creative Habit: Learn It and Use It for Life,Books,https://www.amazon.com/dp/0743235274/,1,1
