name,category,amazon_link,total_mentions,subreddit_mentions
Triangular UFOs: An Estimate of the Situation,Book,http://www.amazon.com/dp/1490465812/,3,2
UFOs and Nukes Extraordinary Encounters at Nuclear Weapons Sites,Book,http://www.amazon.com/dp/1434398315/,2,2
Inner Paths to Outer Space: Journeys to Alien Worlds through Psychedelics and Other Spiritual Technologies,Book,http://www.amazon.com/dp/159477224X/,2,2
UFOs and Nukes: The Secret Link Revealed,Movie,http://www.amazon.com/dp/B01M0AX0WW/,,1
Unidentified: The UFO Phenomenon,eBooks,http://www.amazon.com/dp/B00MS2RVXW/,,1
When the Impossible Happens: Adventures in Non-Ordinary Realities,Book,http://www.amazon.com/dp/159179420X/,3,1
Hunt for the Skinwalker: Science Confronts the Unexplained at a Remote Ranch in Utah,Book,http://www.amazon.com/dp/1416505210/,2,1
"UFOs: Generals, Pilots, and Government Officials Go on the Record",Book,http://www.amazon.com/dp/0307717089/,1,1
"It Never Happened, Volume 1: U.S. Air Force UFO Cover-up Revealed",Book,http://www.amazon.com/dp/0998689041/,1,1
"UFOs and the National Security State: Chronology of a Coverup, 1941-1973",Book,http://www.amazon.com/dp/1571743170/,1,1
UFO Detector - Internal magnetometer interfaced with microcontroller for 24 hour/7 days a week monitoring for magnetic anomalies that have been reported with many UFO sightings,Wireless,http://www.amazon.com/dp/B000796XYQ/,1,1
BINZET 10ft 5050 SMD 110V Red Led Strip Lights IP67 Waterproof Outdoor LED Rope Lights Party Wedding LED String Light for Christmas Festival Decoration DIY LED Lighting,Musical Instruments,http://www.amazon.com/dp/B00MMXMG1E/,1,1
