name,category,amazon_link,total_mentions,subreddit_mentions
"STABILicers Walk Traction Ice Cleat and Tread for Snow, Ice, Attaches Over Shoes/Boots for Everyday Safety in Winter, Outdoor, Slippery Terrain",Sports,http://www.amazon.com/dp/B000GUEAVO/,6,2
"Aroma Housewares 20 Cup Cooked (10 cup uncooked) Digital Rice Cooker, Slow Cooker, Food Steamer, SS Exterior (ARC-150SB)",Kitchen,http://www.amazon.com/dp/B0055FSN0Y/,14,2
How to Talk to Anyone: 92 Little Tricks for Big Success in Relationships,Book,http://www.amazon.com/dp/007141858X/,26,1
Introduction to Computing Systems: From Bits and Gates to C and Beyond,Book,http://www.amazon.com/dp/0072467509/,8,1
Introduction to Chemical Engineering Thermodynamics (The Mcgraw-Hill Chemical Engineering Series),Book,http://www.amazon.com/dp/0073104450/,2,1
"C Programming Language, 2nd Edition",Book,http://www.amazon.com/dp/0131103628/,109,1
An Invitation to Discrete Mathematics,Book,http://www.amazon.com/dp/0198570422/,4,1
Invitation to World Religions,Book,http://www.amazon.com/dp/0199378363/,2,1
"Character Book for Chinese Link: Beginning Chinese, Traditional & Simplified Character Versions, Level 1/Part 1",Book,http://www.amazon.com/dp/0205782981/,1,1
The Elements of Computing Systems: Building a Modern Computer from First Principles,Book,http://www.amazon.com/dp/0262640686/,34,1
Differential Equations and Boundary Value Problems: Computing and Modeling (5th Edition) (Edwards/Penney/Calvis Differential Equations),Book,http://www.amazon.com/dp/0321796985/,1,1
Programming: Principles and Practice Using C++ (2nd Edition),Book,http://www.amazon.com/dp/0321992784/,36,1
Mindset: The New Psychology of Success,Book,http://www.amazon.com/dp/0345472322/,44,1
"Change Your Brain, Change Your Life (Before 25): Change Your Developing Mind for Real World Success",Book,http://www.amazon.com/dp/0373892926/,1,1
All of Statistics: A Concise Course in Statistical Inference (Springer Texts in Statistics),Book,http://www.amazon.com/dp/0387402721/,10,1
Naked Statistics: Stripping the Dread from the Data,Book,http://www.amazon.com/dp/039334777X/,6,1
The Defining Decade: Why Your Twenties Matter--And How to Make the Most of Them Now,Book,http://www.amazon.com/dp/0446561754/,12,1
1984 (Signet Classics),Book,http://www.amazon.com/dp/0451524934/,17,1
Nakama 1 (World Languages),Book,http://www.amazon.com/dp/0495798185/,2,1
"Understanding the Linux Kernel, Third Edition",Book,http://www.amazon.com/dp/0596005652/,8,1
"Why Marriage Matters: America, Equality, and Gay People's Right to Marry",Book,http://www.amazon.com/dp/0743264592/,1,1
How to Become a Straight-A Student: The Unconventional Strategies Real College Students Use to Score High While Studying Less,Book,http://www.amazon.com/dp/0767922719/,36,1
Landscape Design: A Cultural and Architectural History,Book,http://www.amazon.com/dp/0810942534/,1,1
Introduction to the Practice of Statistics: w/Student CD,Book,http://www.amazon.com/dp/1429240326/,1,1
"Python for Data Analysis: Data Wrangling with Pandas, NumPy, and IPython",Book,http://www.amazon.com/dp/1449319793/,17,1
The Life and Letters of Tofu Roshi,Book,http://www.amazon.com/dp/1570626812/,1,1
The Manga Guide to Databases,Book,http://www.amazon.com/dp/1593271905/,9,1
The Manga Guide to Calculus,Book,http://www.amazon.com/dp/1593271948/,2,1
What Color Is Your Parachute? 2016: A Practical Manual for Job-Hunters and Career-Changers,Book,http://www.amazon.com/dp/160774662X/,10,1
"Big Foot Doorstop, 4-3/4"" x 2-1/4"" x 1-1/4"", Gray, 1/Pack (00941)",Office Product,http://www.amazon.com/dp/B00006IATM/,2,1
"Red Bull Energy Drink, 8.4 Fl Oz Cans (6 Packs of 4, Total 24 Cans)",Grocery,http://www.amazon.com/dp/B000MTST70/,4,1
"Kenney 7004244450 Twist and Fit Curtain Rod with Petal, 28-to-48-Inch Width, Satin Nickel",Home Improvement,http://www.amazon.com/dp/B000VBDRM6/,1,1
"NOW Foods Erythritol Natural Sweetener, 1 lb",Health and Beauty,http://www.amazon.com/dp/B000Z978SS/,8,1
"KitchenIQ 50009 Edge Grip 2 Stage Knife Sharpener, Black",Kitchen,http://www.amazon.com/dp/B001CQTLJM/,21,1
Yaktrax Pro Traction Cleats for Snow and Ice,Apparel,http://www.amazon.com/dp/B001CZJBKC/,6,1
Petzl Sarken Crampon Spir Lock One Size,Sports,http://www.amazon.com/dp/B001G5VDSG/,1,1
Flents Quiet Please Ear Plugs (50 Pair),Health and Beauty,http://www.amazon.com/dp/B001J4HB1C/,4,1
"Neutrogena Skinclearing Makeup, 20 Natural Ivory, 1 Fl. Oz.",Beauty,http://www.amazon.com/dp/B001MS7GYW/,1,1
DEWALT DG5204 Professional Kneepads with Layered Gel and Neoprene Fabric Liner,Home Improvement,http://www.amazon.com/dp/B001P30BQE/,6,1
DJ Hero: Bundle with Turntable,Video Games,http://www.amazon.com/dp/B0028ZNX68/,1,1
"Mad Dog 357 Ghost Pepper Hot Sauce, 5oz",Grocery,http://www.amazon.com/dp/B002B9HC6I/,6,1
"Glytone Acne Treatment Spray (Back and Chest), 8-Ounce Package",Prestige Beauty,http://www.amazon.com/dp/B002D48QNE/,3,1
Kalita Wave Dripper 185 series glass [2-4] people for Black # 05039 (japan import) by Kalita (Carita),Kitchen,http://www.amazon.com/dp/B004W5KPSQ/,3,1
Probability and Statistical Inference 7th Edition (Seventh Ed.) 7e By Robert V. Hogg and Elliot A. Tanis 2005,Book,http://www.amazon.com/dp/B005E0DN82/,1,1
Models: Attract Women Through Honesty,eBooks,http://www.amazon.com/dp/B005EOTH24/,38,1
"K-Y Jelly Personal Lubricant, 4 oz",Health and Beauty,http://www.amazon.com/dp/B005IHQGWQ/,5,1
"Passion Lubes, Natural Water-Based Lubricant, 55 Gallon Drum",Health and Beauty,http://www.amazon.com/dp/B005MR3IVO/,713,1
"Paul Mitchell Men by Paul Mitchell Mitch Reformer Strong Hold/Matte Finish Texturizer for Men, 3 Ounce",Beauty,http://www.amazon.com/dp/B005NWO9G6/,2,1
Levi's 511  Slim/Skinny Fit Rigid Dragon 34 x 29,Apparel,http://www.amazon.com/dp/B005YO38K6/,1,1
"Aroma Housewares ARC-914SBD 8-Cup (Cooked) Digital Cool-Touch Rice Cooker and Food Steamer with Stainless Steel Exterior, Silver",Kitchen,http://www.amazon.com/dp/B007WQ9YNO/,60,1
"Patuoxun® USB 2.0 to Sata Converter Adapter Cable with 2.5"" 2.5 Inch Hard Drive HDD Case",Personal Computer,http://www.amazon.com/dp/B008ASF5MC/,1,1
HP KU-0316 USB WIRED KEYBOARD 104 KEYS BLACK AND SILVER HP PART# 434821-002,Personal Computer,http://www.amazon.com/dp/B008FPFT7G/,1,1
Projekt Fixie - Fixed Gear Mountain Bike Mtb Track Seat Clamp 28.6mm Black,Sports,http://www.amazon.com/dp/B008PNU41Y/,1,1
"Yaktrax Pro Traction Cleats for Walking, Jogging, or Hiking on Snow and Ice, Medium",Sports,http://www.amazon.com/dp/B0094GO6ZG/,5,1
"Yaktrax Walk Traction Cleats for Walking on Snow and Ice, Large",Sports,http://www.amazon.com/dp/B0094GO8Q8/,2,1
TP-Link N600 Wireless Wi-Fi Dual Band Router (TL-WDR3500),Personal Computer,http://www.amazon.com/dp/B0098QV038/,12,1
"Crest 3D White Professional Effects Whitestrips Dental Teeth Whitening Strips Kit, 20 Treatments + BONUS 1 Hour Express Whitening Strips, 2 Treatments - (PACKAGING MAY VARY)",Beauty,http://www.amazon.com/dp/B00AHAWWO0/,5,1
Result Classic Heavy Knit Thermal Winter Scarf,Apparel,http://www.amazon.com/dp/B00B64A7PW/,1,1
"6-Inch Power Extension Cable, 5-Pack, Outlet Saver, 18 AWG",CE,http://www.amazon.com/dp/B00DVRUTXW/,5,1
Sabrent External USB 1.44 MB 2x Floppy Disk Drive (FL-UDRV),Personal Computer,http://www.amazon.com/dp/B00E9MD700/,20,1
"Instant Pot DUO60 6 Qt 7-in-1 Multi-Use Programmable Pressure Cooker, Slow Cooker, Rice Cooker, Steamer, Sauté, Yogurt Maker and Warmer",Kitchen,http://www.amazon.com/dp/B00FLYWNYQ/,170,1
"Big Plush Personalized Giant 5 Foot Teddy Bear Premium Soft, Weighs 17 Lbs in Big Box, Not Vacuum Packed",Toy,http://www.amazon.com/dp/B00HZYMQ9W/,3,1
Ghost Pepper Hot Sauce Wicked Tickle XXX Chipotle Extra Hot World's Hottest Hot Sauce Gift Wax Sealed Wings,Grocery,http://www.amazon.com/dp/B00JD1MD7K/,1,1
2016 New Belgium Brewery Artisan Series Globe Glass -25th Anniversary - 1 Glass,Kitchen,http://www.amazon.com/dp/B00K0Y3M8I/,1,1
Nokia 220 RM-971 Unlocked GSM 850 / 1900 Cell Phone w/ 2MP Camera - Black,Wireless,http://www.amazon.com/dp/B00L4DXRS4/,1,1
"Philips Norelco Bodygroom Series 3100, Shave and trim with back attachment, BG2034",Beauty,http://www.amazon.com/dp/B00OX58Y92/,13,1
AmazonBasics Ultra Thin Indoor TV Antenna - 35 Mile Range,Speakers,http://www.amazon.com/dp/B00X4RA74A/,16,1
"Gaoyu Adjustable Handheld Showerhead Bracket Holder, Plastic Bathroom Powerful Vacuum Suction Cup Shower Wand Holder, Waterproof, Wall Mounted, Universal Showering Components - NO TOOLS REQUIRED",Home Improvement,http://www.amazon.com/dp/B00YC67XCQ/,1,1
8 Inch Bolt And Wire Cutter,Home Improvement,http://www.amazon.com/dp/B01FUCIG9Y/,1,1
"Dave's Gourmet Ghost Pepper Jolokia Hot Sauce, Pack of 1",Grocery,http://www.amazon.com/dp/B01JAKNUPC/,1,1
The World's Religions (Plus),Book,http://www.amazon.com/dp/0061660183/,10,1
Deliao Handheld Shower Head Set With 79-Inch Shower Hose Home Care 2 Settings Hand Shower kit Control Button And Convenient Push Button Pause Control Kids Senior Elderly Aged Or Pets Showerhead,Home Improvement,http://www.amazon.com/dp/B01JYUT75U/,1,1
The Subtle Art of Not Giving a F*ck: A Counterintuitive Approach to Living a Good Life,Book,http://www.amazon.com/dp/0062457713/,38,1
