name,category,amazon_link,total_mentions,subreddit_mentions
"Etymotic High Fidelity Earplugs, ER20 ETY-Plugs, Standard Fit Blue Tip, 1 pair",Health and Beauty,http://www.amazon.com/dp/B0044DEESS/,185,4
Invisible Ink Pen and Black Light - 4 Pack,Office Product,http://www.amazon.com/dp/B00408DT5Q/,3,1
Outdoor Products H20 Performance Hydration Pack (Black),Sports,http://www.amazon.com/dp/B004H2WN2K/,1,1
"Leather Money Belt, Brown, 40",Apparel,http://www.amazon.com/dp/B004XZPNN2/,1,1
Pacsafe RFIDsafe 100 Anti-Theft RFID-Blocking Travel Waist Wallet,Apparel,http://www.amazon.com/dp/B0094DZZ0O/,1,1
Totes Clear Adult Rain Poncho,Apparel,http://www.amazon.com/dp/B009KSSK9G/,1,1
Smuggle Your Booze Sun Sunscreen Lotion,Kitchen,http://www.amazon.com/dp/B00CKCQGY0/,14,1
"iHeartRaves Hide Your Stash Boxer Briefs (Small, Black)",Apparel,http://www.amazon.com/dp/B00F5JD8AA/,1,1
TP-Link 10400mAh Fast Charge Power Bank Dual USB Universal Outputs Portable Charger & Ultra Compact External Battery Pack with LG Li-ion Battery 3A Smart Charging Flashlight for iPhone Samsung Galaxy GoPro Fitbits & More,Wireless,http://www.amazon.com/dp/B00G0AMUE8/,1,1
"Etymotic Research ETY Plugs High Fidelity Earplugs; Standard Fit, Blue Tip, Polybag",Health and Beauty,http://www.amazon.com/dp/B00G0PPTAK/,17,1
"Camelbak Products 2016 Classic Hydration Pack, Black, 70-Ounce",Sports,http://www.amazon.com/dp/B00G46CY08/,2,1
"GoPong Hidden Sunscreen Alcohol Flask, 2-Pack",Kitchen,http://www.amazon.com/dp/B00IJ63K86/,21,1
"CamelBak 2016 M.U.L.E. Hydration Pack, Charcoal",Sports,http://www.amazon.com/dp/B00O0OKKA2/,4,1
"Bags for Less Clear Drawstring Bag, Small Clear Bag For Stadiums, Sporting Events - 14” x 17” (Clear/Royal Blue)",Apparel,http://www.amazon.com/dp/B0106M9BH4/,1,1
"Camelbak ThermoBak Mil Spec Antidote Hydration Backpack, Foilage Green",Sports,http://www.amazon.com/dp/B00304Z3Z0/,1,1
"ErgaLogik Gravity 70 UltraLight 2L Hydration Pack - Great for Running, Hiking, Cycling and Skiing",Sports,http://www.amazon.com/dp/B01ECCEAR0/,2,1
