name,category,amazon_link,total_mentions,subreddit_mentions
"Passion Lubes, Natural Water-Based Lubricant, 55 Gallon Drum","Health, Household & Baby Care",https://www.amazon.com/Passion-Lubes-Natural-Water-Based-Lubricant/dp/B005MR3IVO/ref=redir_mobile_desktop?_encoding=UTF8&amp%3Bkeywords=55%20gallons%20of%20lube&amp%3Bqid=1501324776&amp%3Bsr=8-1&ref_=mp_s_a_1_1_a_it,74,1
"SABRE Red Pepper Gel - Police Strength - Tactical Series with 18-Foot (5.5M) Range, 18 Bursts & Belt Holster",Sports & Outdoors,https://www.amazon.com/gp/product/B004NKSPR8/ref=oh_aui_detailpage_o00_s00?ie=UTF8&amp;psc=1,9,1
Tools of Life® Car Hammer Seatbelt Cutter Window Breaker Emergency Escape Tool,Automotive Parts & Accessories,https://www.amazon.com/Tools-Life-Seatbelt-Breaker-Emergency/dp/B00CB8WM2S/ref=sr_1_2?ie=UTF8&amp;qid=1488914718&amp;sr=8-2&amp;keywords=car+windows+hammer,9,1
The Great Theft: Wrestling Islam from the Extremists,Books,https://www.amazon.com/Great-Theft-Wrestling-Islam-Extremists/dp/0061189030/ref=sr_1_1?ie=UTF8&amp;qid=1477407926&amp;sr=8-1&amp;keywords=the+great+theft,7,1
Kidde Battery-Operated Carbon Monoxide Alarm with Digital Dis,Tools & Home Improvement,https://www.amazon.com/dp/B004Y6V5CI/ref=twister_B00I0BSD5K,4,1
Dog Life Jacket Ripstop Life Jacket for Dogs,Pet Supplies,https://www.amazon.com/Jacket-Ripstop-Outward-Hound-Orange/dp/B0081XIK4Q/ref=redir_mobile_desktop?_encoding=UTF8&pc_redir=T1,4,1
Bidet Attachment With Dual Nozzles and Self Cleaning,Tools & Home Improvement,https://www.amazon.com/gp/product/B00BMAQH6S/,3,1
TEKTON 6580 Automatic Center Punch,Tools & Home Improvement,https://www.amazon.com/TEKTON-6580-Automatic-Center-Punch/dp/B0037UUO60/ref=sr_1_1?ie=UTF8&amp;qid=1437075121&amp;sr=8-1&amp;keywords=center+punch+spring+loaded,3,1
"Deep Survival: Who Lives, Who Dies, and Why",Books,https://www.amazon.com/Deep-Survival-Who-Lives-Dies/dp/0393326152/ref=sr_1_1?ie=UTF8&amp;qid=1440531725&amp;sr=8-1&amp;keywords=deep+survival&amp;pebp=1440531728492&amp;perid=18WKMN6KVA7DCBZ310QF,2,1
Detroit: An American Autopsy,Books,https://www.amazon.com/Detroit-American-Autopsy-Charlie-LeDuff/dp/0143124463,2,1
"The Art of Tracking, the Origin of Science",Books,https://www.amazon.com/The-Art-Tracking-Origin-Science/dp/0864861311,2,1
Mason Bee House,"Patio, Lawn & Garden",https://www.amazon.com/Gardeners-Supply-Company-Mason-House/dp/B007XIWY1A,2,1
ABSOLUTE OUTDOOR Onyx A/M-24 Automatic/Manual Inflatable Life Jacket,Sports & Outdoors,https://www.amazon.com/Onyx-Co2-Automatic-Vest-Universal-Adult/dp/B0032ALK36,2,1
Regular Rolled Oats - Bulk 50 Pound Bag,Grocery & Gourmet Food,https://www.amazon.com/Regular-Rolled-Oats-Bulk-Pound/dp/B007KV68UI/ref=sr_1_7?ie=UTF8&amp;qid=1441653633&amp;sr=8-7&amp;keywords=50lb+bag+oats&amp;pebp=1441653645495&amp;perid=0NWNR3H75SQDSRA8B4J7,1,1
The Sunflower: On the Possibilities and Limits of Forgiveness (Newly Expanded Paperback Edition),Books,https://www.amazon.com/Sunflower-Possibilities-Forgiveness-Expanded-Paperback/dp/0805210601,1,1
Thin Blue Line Decal Sticker,Automotive Parts & Accessories,https://www.amazon.com/Thin-Blue-Line-Decal-Sticker/dp/B0038EOS9Y,1,1
Wall and Piece,Books,https://www.amazon.com/Wall-Piece-Banksy/dp/1844137872,1,1
Green House Salt Water Powered LED Lantern (Eco emergency light lamp GH-LED10WBW) White JAPAN,Sports & Outdoors,https://www.amazon.com/Green-House-Powered-emergency-GH-LED10WBW/dp/B009588582,1,1
"Inside of a Dog: What Dogs See, Smell, and Know",Books,https://www.amazon.com/Inside-Dog-What-Dogs-Smell/dp/1416583408/ref=tmm_hrd_swatch_0?_encoding=UTF8&amp;qid=1461820336&amp;sr=1-1,1,1
Esther's Children,Books,https://www.amazon.com/Esthers-Children-Houman-Sarshar/dp/0827607512,1,1
Raving Fans: A Revolutionary Approach to Customer Service,Books,https://www.amazon.com/Raving-Fans-Revolutionary-Approach-Customer/dp/0739309536,1,1
"SABRE Red Pepper Spray - Police Strength - with Durable Pink Key Case, Finger Grip, Quick Release Key Ring, 25 Bursts (Up to 5x Other Brands) & 10-Foot (3M) Range - Supports National Breast Cancer Foundation (Over $1.25 Million Donated so Far!)",Sports & Outdoors,https://www.amazon.com/SABRE-Red-Pepper-Spray-Foundation/dp/B001CZ9MRY,1,1
Freedom Aerial Dog Run 50 FT Standard Duty FADR-50SD,Pet Supplies,https://www.amazon.com/dp/B00CPNO86M?psc=1,1,1
Acorn Academy,Books,https://www.amazon.com/Acorn-Academy-Ursula-McCafferty/dp/0970843011,1,1
Caravan '88,Books,https://www.amazon.com/Caravan-88-Ursula-McCafferty/dp/1492988758,1,1
Pissing in the Snow and Other Ozark Folktales,Books,https://www.amazon.com/Pissing-Snow-Other-Ozark-Folktales/dp/0252013646,1,1
Peak: Secrets from the New Science of Expertise,Books,https://www.amazon.com/Peak-Secrets-New-Science-Expertise/dp/0544456238,1,1
Ozark Magic and Folklore,Books,https://www.amazon.com/Ozark-Magic-Folklore-Vance-Randolph/dp/0486211819/ref=pd_bxgy_14_img_2/191-2605828-6252717?ie=UTF8&amp;psc=1&amp;refRID=K73AQM869NR8ACCSV3X4,1,1
Pet Tracker: The Amazing Story of Rachel the K-9 Pet Detective,Books,https://www.amazon.com/Pet-Tracker-Amazing-Rachel-Detective/dp/0578157551/,1,1
Minions Pool Goggles,Sports & Outdoors,https://www.amazon.com/dp/B00WVBF1FA/ref=cm_sw_r_tw_awdm_cAQKvbMZBXTSD,1,1
Queering India: Same-Sex Love and Eroticism in Indian Culture and Society,Books,https://www.amazon.com/Queering-India-Same-Sex-Eroticism-Culture/dp/0415929504,1,1
"Gazillion Bubbles Hurricane Machine, Colors May Vary",Toys & Games,https://www.amazon.com/dp/B000197NXM/ref=cm_sw_r_tw_awdo_-DQKvb9GEFNMF,1,1
Esschert Design WA02 Bee House,"Patio, Lawn & Garden",https://www.amazon.com/gp/product/B000AMWT34/ref=oh_aui_detailpage_o01_s00?ie=UTF8&amp;psc=1,1,1
Soft Claws Nail Caps for Cats & Kittens,Pet Supplies,https://www.amazon.com/Feline-Soft-Claws-Take-Home-Medium/dp/B000ET88QK,1,1
Munchkin White Hot Safety Spoons 4 Ct,Baby,https://www.amazon.com/Munchkin-White-Hot-Safety-Spoons/dp/B0013NB70A?th=1,1,1
Cool Change Reusable Color Change Spoons,Home & Kitchen,https://www.amazon.com/Cool-Change-Reusable-Color-Spoons/dp/B00J492R7C,1,1
