name,category,amazon_link,total_mentions,subreddit_mentions
"No More Mr Nice Guy: A Proven Plan for Getting What You Want in Love, Sex, and Life",Book,http://www.amazon.com/dp/0762415339/,178,3
How to Talk to Anyone: 92 Little Tricks for Big Success in Relationships,Book,http://www.amazon.com/dp/007141858X/,26,1
How To Get A Date Worth Keeping: Be Dating In Six Months Or Your Money Back,Book,http://www.amazon.com/dp/0310262658/,1,1
How to Talk to Anyone: 92 Little Tricks for Big Success in Relationships,eBooks,http://www.amazon.com/dp/B000SEI4V0/,4,1
Across the Board: The Mathematics of Chessboard Problems (Princeton Puzzlers),eBooks,http://www.amazon.com/dp/B005OQH198/,1,1
