name,category,amazon_link,total_mentions,subreddit_mentions
"Howard Leight by Honeywell Impact Sport Sound Amplification Electronic Shooting Earmuff, Classic Green (R-01526)",Tools & Home Improvement,https://www.amazon.com/dp/B001T7QJ9O/ref=cm_sw_r_awd_JGskwbR8EFP88,40,1
Before the Awakening (Star Wars),Books,https://www.amazon.com/Star-Wars-Force-Awakens-Awakening/dp/148472822X,4,1
Aftermath: Star Wars: Journey to Star Wars: The Force Awakens,Books,https://www.amazon.com/Aftermath-Star-Journey-Force-Awakens/dp/034551162X,3,1
The Common Sense Book of Baby and Child Care,Books,https://www.amazon.com/Common-Sense-Book-Baby-Child/dp/4871879690,1,1
The Zombie Survival Guide: Recorded Attacks,Books,https://www.amazon.com/Zombie-Survival-Guide-Recorded-Attacks/dp/030740577X,1,1
Wolverine: The End,Books,https://www.amazon.com/Wolverine-End-Paul-Jenkins/dp/0785113495,1,1
Wireless Remote Controlled 120V 5-Outlet Switch Socket (5-Pack),Tools & Home Improvement,https://www.amazon.com/Wireless-Remote-Controlled-5-Outlet-Switch/dp/B003TL6FI8,1,1
Howitzer / Cannon Genuine Monopoly Token Parker Brothers,Toys & Games,https://www.amazon.com/Howitzer-Genuine-Monopoly-Parker-Brothers/dp/B00B6KJAMW,1,1
Star Wars Deluxe Transformer Millenium Falcon,Toys & Games,https://www.amazon.com/Star-Deluxe-Transformer-Millenium-Falcon/dp/B000EMJ9Z6,1,1
Do As I Say (Not As I Do): Profiles in Liberal Hypocrisy,Books,https://www.amazon.com/Do-As-Say-Not-Hypocrisy/dp/0767919025,1,1
