name,category,amazon_link,total_mentions,subreddit_mentions
Biore Sarasara Aqua Rich Watery Essence SPF50+/PA++++ 50g Sunscreen,Beauty,http://www.amazon.com/dp/B00SM99KWU/,31,1
Shiseido Senka Aging Care UV Sunscreen SPF50+ PA++++,Beauty,http://www.amazon.com/dp/B00IG12XLO/,15,1
Missha All Around Safe Block Essence Sun SPF45/PA+++,Beauty,http://www.amazon.com/dp/B00ENTM3FY/,4,1
"RedSwan Woman Lingerie Sleepwear Chemise Nightgown Sexy Lace Lounge Dress Sexy Lingerie (Dark Purple,M)",Apparel,http://www.amazon.com/dp/B01LXBQVI4/,1,1
"Gigi Pre-Epilation Oil, 4 Ounce",Beauty,http://www.amazon.com/dp/B0006Q01BQ/,1,1
"GiGi Azulene Wax, 13 Ounce",Beauty,http://www.amazon.com/dp/B0030ZRS9S/,1,1
"Cirepil Blue Wax Refill, 28.22 Ounce Bag",Beauty,http://www.amazon.com/dp/B008L0AI3U/,1,1
TITIN® Force Full Weighted Shirt System,Apparel,http://www.amazon.com/dp/B00E65FV8G/,1,1
"WaterWipes Baby Wipes, 60 Count (pack of 2) by DermaH2O",Health and Beauty,http://www.amazon.com/dp/B00JMJDGPQ/,1,1
"Calvin Klein Women's Ck Endless Chemise, Black, M",Apparel,http://www.amazon.com/dp/B01N2B0D09/,1,1
