name,category,amazon_link,total_mentions,subreddit_mentions
Columbine,Book,http://www.amazon.com/dp/0446546925/,8,2
Winning the Race: Beyond the Crisis in Black America,eBooks,http://www.amazon.com/dp/B000OT8GU8/,,1
How to House Train Your Husband,eBooks,http://www.amazon.com/dp/B01G9OAT24/,,1
How To Train Your Husband,eBooks,http://www.amazon.com/dp/B00F05H328/,,1
Train Your Husband. Create a Happy Marriage (Happy Marriage Manuals Book 1),eBooks,http://www.amazon.com/dp/B005G4P02S/,,1
Men: Notes from an Ongoing Investigation,eBooks,http://www.amazon.com/dp/B00JYYSD0C/,,1
"Moral Tribes: Emotion, Reason, and the Gap Between Us and Them",eBooks,http://www.amazon.com/dp/B00C5R7GRQ/,,1
Self-Made Man: One Woman's Year Disguised as a Man,Book,http://www.amazon.com/dp/0143038702/,18,1
So You've Been Publicly Shamed,Book,http://www.amazon.com/dp/1594487138/,12,1
Why Men Earn More: The Startling Truth Behind the Pay Gap -- and What Women Can Do About It,Book,http://www.amazon.com/dp/0814472109/,7,1
The War Against Boys: How Misguided Policies are Harming Our Young Men,Book,http://www.amazon.com/dp/1451644183/,6,1
The Second Sexism: Discrimination Against Men and Boys,Book,http://www.amazon.com/dp/0470674512/,5,1
Angry White Men: American Masculinity at the End of an Era,Book,http://www.amazon.com/dp/1568585136/,5,1
So You've Been Publicly Shamed,Book,http://www.amazon.com/dp/1501231847/,5,1
Superforecasting: The Art and Science of Prediction,Book,http://www.amazon.com/dp/0804136696/,5,1
The Big Sort: Why the Clustering of Like-Minded America is Tearing Us Apart,Book,http://www.amazon.com/dp/0547237723/,4,1
The Myth of the Rational Voter: Why Democracies Choose Bad Policies,Book,http://www.amazon.com/dp/0691138737/,4,1
Legalizing Misandry: From Public Shame to Systemic Discrimination against Men,Book,http://www.amazon.com/dp/0773528628/,4,1
"Gay New York: Gender, Urban Culture, and the Making of the Gay Male World, 1890-1940",Book,http://www.amazon.com/dp/0465026214/,4,1
You Just Don't Understand: Women and Men in Conversation,Book,http://www.amazon.com/dp/0060959622/,4,1
"Women After All: Sex, Evolution, and the End of Male Supremacy",Book,http://www.amazon.com/dp/0393239969/,3,1
So You've Been Publicly Shamed,eBooks,http://www.amazon.com/dp/B00L9B7IRC/,3,1
Spreading Misandry: The Teaching of Contempt for Men in Popular Culture,Book,http://www.amazon.com/dp/0773530991/,3,1
The Undercover Economist,Book,http://www.amazon.com/dp/0345494016/,2,1
The Suffragette Bombers: Britain's Forgotten Terrorists,Book,http://www.amazon.com/dp/1783400641/,2,1
Professing Feminism: Education and Indoctrination in Women's Studies,Book,http://www.amazon.com/dp/0739104551/,2,1
Replacing Misandry: A Revolutionary History of Men,Book,http://www.amazon.com/dp/0773545530/,2,1
Sanctifying Misandry: Goddess Ideology and the Fall of Man,Book,http://www.amazon.com/dp/0773538739/,2,1
Raskullz Unicorn Helmet,Sports,http://www.amazon.com/dp/B00U11OTAK/,2,1
Engineers of Jihad: The Curious Connection between Violent Extremism and Education,Book,http://www.amazon.com/dp/0691145172/,1,1
The Richer Sex: How the New Majority of Female Breadwinners Is Transforming Our Culture,Book,http://www.amazon.com/dp/1439197725/,1,1
Boys Are Stupid Throw Rocks At Them t-shirt,Apparel,http://www.amazon.com/dp/B00A3WWD9Q/,1,1
"As You Are: Ignite Your Charisma, Reclaim Your Confidence, Unleash Your Masculinity",Book,http://www.amazon.com/dp/1517737893/,1,1
Saliva Hormone Test - Female (5 Hormone Test Kit),Health and Beauty,http://www.amazon.com/dp/B00025OG1C/,1,1
The Great Big Book of Horrible Things: The Definitive Chronicle of History's 100 Worst Atrocities,Book,http://www.amazon.com/dp/0393081923/,1,1
Kampus,Book,http://www.amazon.com/dp/1585867772/,1,1
How to Train a Husband: A Vet Tech's Guide to Love and Marriage,Book,http://www.amazon.com/dp/1942549261/,1,1
Husband-ry 101: How to Train Your Husband to Be the Spouse You've Always Wanted Him to Be,Book,http://www.amazon.com/dp/1438277156/,1,1
How to Make Your Man Behave in 21 Days or Less Using the Secrets of Professional Dog Trainers,Book,http://www.amazon.com/dp/1563056267/,1,1
In Six Days: Why Fifty Scientists Choose to Believe in Creation,Book,http://www.amazon.com/dp/0890513414/,1,1
"Enlightenment 2.0: Restoring sanity to our politics, our economy, and our lives",Book,http://www.amazon.com/dp/0062342894/,1,1
"Men Are from Mars, Women Are from Venus: The Classic Guide to Understanding the Opposite Sex",Book,http://www.amazon.com/dp/0060574216/,1,1
Hitler's Children: The Hitler Youth and the SS,Book,http://www.amazon.com/dp/0807842990/,1,1
Raskullz Shark Jaws Helmet,Sports,http://www.amazon.com/dp/B00U11O5EK/,1,1
The Myth of Mars and Venus: Do Men and Women Really Speak Different Languages?,Book,http://www.amazon.com/dp/0199550999/,1,1
Affirmative Action Around the World: An Empirical Study (Yale Nota Bene S),Book,http://www.amazon.com/dp/0300107757/,1,1
The Feminist Utopia Project: Fifty-Seven Visions of a Wildly Better Future,Book,http://www.amazon.com/dp/1558619003/,1,1
"Circumcision, The Hidden Trauma : How an American Cultural Practice Affects Infants and Ultimately Us All",Book,http://www.amazon.com/dp/0964489538/,1,1
"Women & Shame: Reaching Out, Speaking Truths and Building Connection",Book,http://www.amazon.com/dp/0975425234/,1,1
"Pifito (TM) Running Belt - Premium Quality Stylish Waist Pack for iPhone & Galaxy - Cozy Ample Space Fanny Pack Pouch Bag for Sports, Exercise, Walking, Jogging and Travel",Sports,http://www.amazon.com/dp/B01L4Y1IGK/,1,1
