name,category,amazon_link,total_mentions,subreddit_mentions
TYZEST Spinner Fidget EDC ADHD Focus Toy Ultra Durable High Speed 3-8 Min Spins Precision Copper material,Toy,http://www.amazon.com/dp/B01NAPTIZQ/,2,2
"Apsung ADHD Fidget Toy, EDC Hand Spinner Fidget Toy, Finger Spinner, Copper High Speed Up to 6 Mins Spins, ADHD Focus Tri-spinner to Relieves Anxiety and Boredom, Gift Case Package",Toy,http://www.amazon.com/dp/B01N5Q2GYJ/,2,2
Elongdi EDC Fidget Spinner Precision Metal Help Focus Durable Hand Spinner Toy Perfect for Spend Time Relieves Anxiety Fidget ADHD Autism Lessen Boredom (Rainbow),Toy,http://www.amazon.com/dp/B06ZY74LTX/,,1
"XDesign Tri-Spinner Fidget Focus Toy Spinner, Prime Quality Anti-Stress Toys for Children, Teens, Students and Adults [Easy Carrying] Dice Stress Reliever for Work, School, Class -Black (XD000026)",Toy,http://www.amazon.com/dp/B0713QC1B7/,,1
"EWR- Original 360 Spinner Fidget Toy R188 Bearing Quiet & Fast 1-4 Min Avg Spins, Premium EDC Helps Focus, Stress, Anxiety, ADHD, Boredom. Extremely Durable",Toy,http://www.amazon.com/dp/B01MQIKV53/,2,1
Blitzed: Drugs in Nazi Germany,Book,http://www.amazon.com/dp/0241256992/,2,1
"EWR Tri Fidget Spinner White Focus Toy Stress Reducer for Kid and Adult [Premium Bearing] Easy Flick, Spin single/both Hands Finger Prime Figit Toys Perfect For Anxiety, Autism",Toy,http://www.amazon.com/dp/B01MSLJDB1/,2,1
"ILoveFidget Fidget Spinner, Best Stainless Steel Hand Spinner EDC Toy, R188 bearing spins up to 8 mins, relieve stress ADHD ADD Austism anxiety boredom, improve focus attention (Double Bar)",Toy,http://www.amazon.com/dp/B071CQV1NR/,1,1
"Precision Fidget Spinner Toy By Infinite Spin - High Speed Hybrid Bearings - Perfect for ADHD, Increasing Focus, Concentration, Quitting Bad Habits: 2 To 5 Min Spin Times: EDC (Gold)",Beauty,http://www.amazon.com/dp/B06WVVJMF5/,1,1
Infinity Silver i5 Fidget Spinner i-Series Pro with R188 VorTech Smoothest Rated Bearings (Premium Weighted Metal Fidget Spinner),Toy,http://www.amazon.com/dp/B06W5RY7PD/,1,1
Clear Display Stand Easel for Air-Tite Holder Coin Capsules Challenge Medals Casino Chips (Qty 5),Home,http://www.amazon.com/dp/B00BIXMDAS/,1,1
"Maxboost Tri-Spinner Fidget Spinner Focus Toy Stress Reducer for Kid and Adult [Premium Bearing] Easy Flick, Spin single/both Hands Finger Prime Figit Toys Perfect For Anxiety, Autism",Toy,http://www.amazon.com/dp/B06XDK684S/,1,1
Machine Era Pen- Solid Brass,Office Product,http://www.amazon.com/dp/B00ZSPRW0S/,1,1
ATESSON Hand Toys,Toy,http://www.amazon.com/dp/B071ZFG2JN/,1,1
