name,category,amazon_link,total_mentions,subreddit_mentions
"PANASONIC LUMIX G7 4K Mirrorless Camera, with 14-42mm MEGA O.I.S. Lens, 16 Megapixels, 3 Inch Touch LCD, DMC-G7KK (USA BLACK)",Photography,http://www.amazon.com/dp/B00X409PQS/,66,20
Azden SGM-250 Professional Dual Powered Shotgun Microphone,Musical Instruments,http://www.amazon.com/dp/B00XWG2YBW/,62,18
Masione Replacement for Sony NP-F550 NP-F330 Digital Camera Battery,Photography,http://www.amazon.com/dp/B0007Q9PWQ/,40,17
"Hosa MIT-156 XLR3F to 3.5 mm TRS Impedance Transformer, 18 inches",Musical Instruments,http://www.amazon.com/dp/B00FC4YR58/,40,16
"Panasonic Panasonic Lumix DMC-GH4 Mirrorless Digital Camera Body, 4K Video Recording with Free Panasonic DMW-SFU1-VLOG V-Log L Function Firmware Upgrade Kit",Photography,http://www.amazon.com/dp/B01D40CASW/,47,14
Ravelli AVTP Professional 75mm Video Camera Tripod with Fluid Drag Head,Photography,http://www.amazon.com/dp/B00139W0XM/,36,14
Panasonic Lumix G Series DMC-G6KK Mirrorless Digital Camera with 14-42mm II Lens Kit (Black),Photography,http://www.amazon.com/dp/B00CFCTDD6/,33,13
Panasonic Lumix DMC-GH3K 16.05 MP Digital Single Lens Mirrorless Digital Camera with 3-Inch OLED - Body Only (Black),Photography,http://www.amazon.com/dp/B009B0WREM/,38,12
The Location Sound Bible: How to Record Professional Dialog for Film and TV,eBooks,http://www.amazon.com/dp/B00ATOUXBI/,17,12
"Pyle PMKSB06 Shotgun Microphone Fishing Boom Pole, Telescoping/Extending Mic Arm Mount",Musical Instruments,http://www.amazon.com/dp/B011FOMA02/,20,11
"Panasonic DMC-G7KK Digital Single Lens Mirrorless Camera 14-42 mm Lens Kit, 4K + Starter Bundle + Transcend 64 GB High Speed 10 UHS3 + Polaroid 57"" Tripod + Polaroid 46mm UV Filter + Battery + Bag",Photography,http://www.amazon.com/dp/B0106BG35S/,24,10
"ALZO Cold Shoe Mount for Blackmagic Cinema Cameras and Pocket Cinema Camera with 1/4 in Thread Hole and Anti-Rotation Rubber Base for Camera Flash, LED Lights, Monitors, Video",Photography,http://www.amazon.com/dp/B00HQPF7PU/,23,10
JVC GY-LS300CHU Ultra 4K HD 4KCAM Super 35 Pro Camcorder & Top Handle Audio Unit,Photography,http://www.amazon.com/dp/B00USBVISE/,30,10
Hosa MHE125 1/8 Inch Headphone Extention Cable - 25 foot,Musical Instruments,http://www.amazon.com/dp/B000068O3J/,20,10
Tascam DR-60DmkII 4-Channel Portable Audio Recorder for DSLR,Musical Instruments,http://www.amazon.com/dp/B00MIXFBL0/,17,9
Sony PXWX70 HD422 Hand Held Camcorder with 3.5-Inch LCD (Black),Photography,http://www.amazon.com/dp/B00NPAJH8I/,48,9
"Photography Photo Portrait Studio 600W Day Light Umbrella Continuous Lighting Kit by LimoStudio, LMS103",Photography,http://www.amazon.com/dp/B005FHZ2SI/,61,9
"Miracle Sound Deluxe Lavalier Lapel Clip-on Omnidirectional Condenser Microphone for Apple Iphone, Ipad, Ipod Touch, Samsung Android and Windows Smartphones",Musical Instruments,http://www.amazon.com/dp/B011EXBCMQ/,24,9
Cell Phone Tripod Adapter - iPhone Tripod Mount – SE 8 X 7 6 6S Plus 5 5S 5C 4 4s Clip Holder Connector Head Smartphone Attachment Samsung Galaxy S8 S7 S6 S5 S4 S3 S2 - DaVoice (Black),Wireless,http://www.amazon.com/dp/B00OS9E6AO/,37,9
SanDisk Extreme PRO 64GB SDXC Flash Memory Card with up to 95MB/s (SDSDXPA-064G-AFFP),CE,http://www.amazon.com/dp/B007NDL54C/,22,8
Aspen Mics HQ-SPK Stereo Lavalier Lapel Micophone for iPhone iPad iPod Touch Android With Laptop Adapter,Musical Instruments,http://www.amazon.com/dp/B00MVK29BK/,17,8
Fotasy AMFD Canon FD FL Lens to Micro Four Thirds M43 MFT System Camera Mount Adapter,Photography,http://www.amazon.com/dp/B003MDWG68/,17,8
"Blackmagic Design Micro Cinema Camera Body Only, with Micro Four Thirds Lens Mount, 13 Stops of Dynamic Range",Photography,http://www.amazon.com/dp/B00WNFK0P0/,19,8
Senal SMH-1000 Closed-Back Professional Monitor Headphones,Speakers,http://www.amazon.com/dp/B00ASWZO6U/,19,8
On Stage MA100 3/8-Inch Male to 5/8-Inch Female Mic Screw Adapter,Musical Instruments,http://www.amazon.com/dp/B0007Y60HG/,12,7
Sony Alpha a7S Mirrorless Digital Camera,Photography,http://www.amazon.com/dp/B00JIWXTXG/,15,7
Samsung NX1 28.2 MP Wireless SMART Mirrorless Digital Camera (Body Only),Photography,http://www.amazon.com/dp/B00NFDZRRA/,16,7
Juicebox Complete Battery Kit for Blackmagic Ursa and Ursa Mini,Photography,http://www.amazon.com/dp/B01BG0M4EC/,15,7
"107"" x 12yds Background Paper (#46 Tech Green)",Photography,http://www.amazon.com/dp/B000B782NO/,18,7
Commlite CM-EF-MFT Electronic Aperture Control Lens Mount Adapter for Canon EF & EF-S to Olympus PEN E-P1 P2/3/5 E-PL1 OM-D E-M5 Panasonic LUMIX GH2/3/4 M4/3 Camera,Photography,http://www.amazon.com/dp/B01324WKAS/,12,7
"CBI MLC20 Low Z XLR Microphone Cable, 20 Foot",Musical Instruments,http://www.amazon.com/dp/B000VJJQUU/,27,7
K&F Concept Lens Mount Adapter Nikon G Lens to Micro 4/3 M4/3 Mount Adapter GF2 GF3 G2 G3 GH2 E-PL3 PM1,Photography,http://www.amazon.com/dp/B00LECYYR8/,27,7
Cinematography: Theory and Practice: Image Making for Cinematographers and Directors (Volume 1),Book,http://www.amazon.com/dp/0240812093/,13,7
"ILEDGear NPF-Series Battery Plate Adapter for BMPCC, BMPC, BMCC and HDV-Z96 LED Light",Home,http://www.amazon.com/dp/B00WLEKQS4/,13,7
Audio-Technica AT8024 Stereo/Mono Camera-Mount Microphone,Musical Instruments,http://www.amazon.com/dp/B00V66XWTI/,25,7
Rode VideoMicro Compact On-Camera Microphone with Rycote Lyre Shock Mount,Musical Instruments,http://www.amazon.com/dp/B015R0IQGW/,33,7
Portable Camera Dolly with 12ft of Straight Track,Photography,http://www.amazon.com/dp/B00A9213AU/,12,6
Saramonic SR-AX107 2 Channel Transformer XLR Audio Adapter with Phantom Power & Monitor (Red/Black),Photography,http://www.amazon.com/dp/B00SSLCON4/,16,6
Tascam DR-70D 4-Channel Portable Recorder,Musical Instruments,http://www.amazon.com/dp/B00OY6718K/,15,6
Rode Micro Boompole Pro Ultra-Lightweight Modular Boompole,Musical Instruments,http://www.amazon.com/dp/B015ZXVACI/,17,6
Pixco Adjustable Aperture Speed Booster with Optical Glass Full Manual Operation Focal Reducer Durable Mental Lens Adapter for Canon EF Lens to Micro Four Thirds M4/3 Micro 4/3 Camera,Photography,http://www.amazon.com/dp/B00XX5KK2M/,20,6
Ikan BMPCC-PWR-BC-S Blackmagic Pocket Cinema Camera Belt Clip DV Power Kit for Sony L (Black),Photography,http://www.amazon.com/dp/B00LPJ1FJ0/,6,6
Metabones Speed Booster XL 0.64x Adapter for Full-Frame Canon EF-Mount Lens to Select Micro Four Thirds-Mount Cameras,Photography,http://www.amazon.com/dp/B011GEMHU4/,20,6
TAKSTAR SGC-598 Interview Microphone for Nikon/Canon Camera/DV Camcorder,Photography,http://www.amazon.com/dp/B00E58AA0I/,13,6
Rode NTG2 Condenser Shotgun Microphone,Musical Instruments,http://www.amazon.com/dp/B00093ESSI/,10,6
"In the Blink of an Eye: A Perspective on Film Editing, 2nd Edition",Book,http://www.amazon.com/dp/1879505622/,23,6
Canon Lens FD 28mm 1:2.8,Photography,http://www.amazon.com/dp/B00AAZG5YA/,6,5
Canon EF-S 24mm f/2.8 STM Lens,Photography,http://www.amazon.com/dp/B00NI3BZ5K/,31,5
"Neewer 24""/60cm Handheld Stabilizer with Quick Release Plate 1/4"" and 3/8"" Screw for DSLR and Video Cameras up to 6lbs/2.7kg",Photography,http://www.amazon.com/dp/B00NJKJ1IA/,13,5
"Eggsnow Microphone Shockmount Universal Holder Clip + Hot Shoe Adapter Anti Vibration for AKG D230, Senheisser ME66, Rode NTG-2,NTG-1,Audio-Technica AT-875R",Musical Instruments,http://www.amazon.com/dp/B00KXQIV7K/,7,5
"The Filmmaker's Handbook, 2013 Edition",Book,http://www.amazon.com/dp/0452297281/,7,5
"Fotasy HR-DV Ergo Handle Pistol Grip for SONY camcorders w/ A/V R or LANC, Blackmagic Cinema camera",Photography,http://www.amazon.com/dp/B00NA797JU/,13,5
F&V Lighting R-300 LED Ring Light with L-Bracket,Photography,http://www.amazon.com/dp/B00AY0J4OY/,13,5
Panasonic LUMIX G7 Digital Camera with 14-42mm f/3.5-5.6 Lens & Rode On-Camera Microphone Accessory Bundle,Photography,http://www.amazon.com/dp/B01CF29K9M/,15,5
"PANASONIC LUMIX G LENS, 25MM, F1.7 ASPH., MIRRORLESS MICRO FOUR THIRDS, H-H025K (USA BLACK)",Photography,http://www.amazon.com/dp/B014RD6RC0/,39,5
DSTE 2x NP-F550 Battery + DC01 Travel and Car Charger Adapter for Sony CCD-RV100 CCD-RV200 SC5 SC9 TR1 TR940 TR917 Camera CN-160 CN-216 CN-304 YN 300 VL600 LED Video Light as NP-F330 NP-F530 NP-F570,Photography,http://www.amazon.com/dp/B00CPYXQ2S/,7,5
Blackmagic Pocket Cinema Camera with Micro Four Thirds Lens Mount,Home Theater,http://www.amazon.com/dp/B00CWLSHUK/,6,5
"Set Lighting Technician's Handbook: Film Lighting Equipment, Practice, and Electrical Distribution",Book,http://www.amazon.com/dp/0240810759/,15,5
Time and Again,DVD,http://www.amazon.com/dp/B0006AZ4OQ/,5,5
Directing Actors: Creating Memorable Performances for Film & Television,Book,http://www.amazon.com/dp/0941188248/,7,5
Canon EF 50mm f/1.8 II Camera Lens - Fixed (Discontinued by Manufacturer),Photography,http://www.amazon.com/dp/B00007E7JU/,34,5
"11 Simple Steps to turn a Screenplay into a Marketable Movie: or, How I got a $10k movie to gross $1 Million through Warner Bros.",eBooks,http://www.amazon.com/dp/B009YKJ5UI/,5,4
"LCDVF LCD Viewfinder for Black Magic Pocket Camera, 2.2x Magnification, 1.6"" Objective Lens Diameter",Photography,http://www.amazon.com/dp/B00Q7WSBGU/,6,4
"Swiftcam M3L 3-Axis Handheld Gimbal for IPhone, Android and Windows Smartphones for stabilized cinematic like video recording - Comes with Free MS1 Bluetooth Shutter Controller!",Photography,http://www.amazon.com/dp/B00QSJEFW6/,8,4
Filmmaking: Direct Your Movie from Script to Screen Using Proven Hollywood Techniques,eBooks,http://www.amazon.com/dp/B009W328QK/,4,4
"PANASONIC LUMIX G X VARIO POWER ZOOM LENS, 14-42MM, F3.5-5.6 ASPH., MIRRORLESS MICRO FOUR THIRDS, POWER O.I.S., H-PS14042K (USA BLACK)",Photography,http://www.amazon.com/dp/B005J5TZVG/,18,4
JJC HR-DV Pistol Grip Handle Stabilizer for SONY DV Camcorder with A/V R or LANC Port & Blackmagic Pocket Cinema Camera(BMPCC),Photography,http://www.amazon.com/dp/B00MRNP2LA/,11,4
Rode VideoMic Me Directional Microphone for Smart Phones,Musical Instruments,http://www.amazon.com/dp/B018KIJGU8/,20,4
"Saramonic UWMIC10 96-Channel Digital UHF Wireless Lavalier Microphone System with 2 Bodypack Transmitters, Portable Receiver, 2 Lav Mics, Shoe Mount, XLR/3.5mm Outputs + More",Musical Instruments,http://www.amazon.com/dp/B01AYDSWK2/,10,4
Nikon D3300 1532 18-55mm f/3.5-5.6G VR II Auto Focus-S DX NIKKOR Zoom Lens 24.2 MP Digital SLR – Black,Photography,http://www.amazon.com/dp/B00HQ4W1QE/,32,4
"Julius Studio 3x 216 Barndoor Continuous LED Video Lighting kit Dimmable Panel Camera, for Canon, Nikon, Sony and DSLR Cameras, Li-Ion Battery and Charger,Color Filters,Premium Carry Bag, JSAG159",Photography,http://www.amazon.com/dp/B0189TA68O/,11,4
Zoom H4N PRO Digital Multitrack Recorder - 2016 Version,Musical Instruments,http://www.amazon.com/dp/B01DPOXS8I/,16,4
3Pod V3AH Anodized Aluminum Video Tripod with 2-way Fluid Head and Quick-Release Plate,Photography,http://www.amazon.com/dp/B00F8VU3CQ/,23,4
Panasonic Lumix G Series DMC-G6 Compact System Digital Camera Body Only (Black),Photography,http://www.amazon.com/dp/B00EDN0PF0/,19,4
"EACHSHOT® Commlite CM-EF-MFT Lens Adapter for Canon EOS EF/EF-S to Micro Four Thirds (MFT) Camera; Supports Electronic Auto Aperture Control, Supports EV CONTROL, Supports IS/Image Stabilization, Compatible with Panasonic GH4, GH3; BMPCC; OLYMPUS OM-D E-M5, E-M1, E",Photography,http://www.amazon.com/dp/B011I2WWQ8/,19,4
"PANASONIC LUMIX G85 4K Mirrorless Camera, with 12-60mm Power O.I.S. Lens, Dual I.S. 2.0, 16 Megapixels, 3 Inch Touch LCD, DMC-G85MK (USA BLACK)",Photography,http://www.amazon.com/dp/B01M050N05/,18,4
Two Weeks,DVD,http://www.amazon.com/dp/B000TV1ST2/,11,4
Hosa GMP-467 Right Angle Female TRS 1/8-Inch to Sub-Mini 2.5mm TRS Male Adapter,Musical Instruments,http://www.amazon.com/dp/B000QU3JN4/,30,4
"Lilliput 5"" 569/O/P Field Monitor WITH HDMI & YPbPr Input 16: 9 Aspect Ratio F970 and LP-E6 Batter plate with Peaking advanced functions by LILLIPUT OFFICIAL SELLER :VIIVTEQ .",PC Accessory,http://www.amazon.com/dp/B00CDKY560/,8,4
Sennheiser MKE 600 Camcorder Shotgun Microphone,Musical Instruments,http://www.amazon.com/dp/B00B0YPAYQ/,6,4
How to Shoot Video That Doesn't Suck: Advice to Make Any Amateur Look Like a Pro,eBooks,http://www.amazon.com/dp/B0051NHJFU/,11,4
New KAMERAR 20 cm Black Hot Shoe Extension Bar for LED Lights Video Camera,Photography,http://www.amazon.com/dp/B00B7QQ91U/,15,4
Canon EF 50mm f/1.8 STM Lens,Photography,http://www.amazon.com/dp/B00X8MRBCW/,61,4
"Panasonic DMC-G7KK Digital Single Lens Mirrorless Camera 14-42 mm Lens Kit 4K, Accessory Bundle, Polaroid 64GB, Polaroid 72"" Professional Tripod, Filter Set, Battery, Charger, Camera Bag and Extras",Photography,http://www.amazon.com/dp/B00ZPXVAVA/,11,4
Pyle PPFMXLR15 15 Feet XLR Male to XLR Female Microphone Cable,Musical Instruments,http://www.amazon.com/dp/B000165DSM/,8,4
"Neewer 43-inch / 110cm 5-in-1 Collapsible Multi-Disc Light Reflector with Bag - Translucent, Silver, Gold, White and Black",Photography,http://www.amazon.com/dp/B002ZIMEMW/,16,4
The Five C's of Cinematography: Motion Picture Filming Techniques,Book,http://www.amazon.com/dp/187950541X/,10,4
"Panasonic LUMIX G85MK 4K Mirrorless Interchangeable Lens Camera Kit, 12-60mm Lens, Polaroid 64GB, 2 Spare Batteries, Charger, Bag and Accessory Bundle",Photography,http://www.amazon.com/dp/B01MXHN32J/,24,4
"Tascam DR-70D 4-Channel Audio Recorder For DSLR Camera, Acc Bundle. Kit #DR70DK",BISS,http://www.amazon.com/dp/B00U1SMWES/,4,3
Magnus VT-4000 Professional High Performance Tripod System with Fluid Head,Photography,http://www.amazon.com/dp/B008OM1GCW/,3,3
Blackmagic Design Pocket Cinema Camera + 10 Piece Essentials Accessory Kit,Photography,http://www.amazon.com/dp/B00V5BS4V0/,3,3
Sigma 19mm  F2.8 EX DN -Micro 4/3 400963,Photography,http://www.amazon.com/dp/B007F7G6WW/,4,3
"TubeTape DT-01 Duct Tape, 15 yds Length x 2"" Width, Chromakey Green",BISS,http://www.amazon.com/dp/B006YZBM20/,6,3
Feelworld FW759 Screen Camera Field Monitor 1280x800 IPS Screen (7 Inch),Photography,http://www.amazon.com/dp/B00SV5K9WA/,6,3
"Neewer Photography 304 LED Studio Lighting Kit, including (2)CN-304 Dimmable Ultra High Power Panel Digital Camera DSLR Camcorder LED Video Light (2)75""/190cm Tall Studio Photography Light Stand",Photography,http://www.amazon.com/dp/B00OIVBN4E/,4,3
CyberLink PowerDirector 13 Ultra [Download],Digital Software,http://www.amazon.com/dp/B00NQIB41C/,10,3
The Location Sound Bible: How to Record Professional Dialog for Film and TV,Book,http://www.amazon.com/dp/1615931201/,11,3
Samsung NX1 28 MP 4K Wireless Smart Camera with 16-50mm Power Zoom Lens,Photography,http://www.amazon.com/dp/B00V5UDU60/,12,3
"PANASONIC LUMIX FZ1000 4K Point and Shoot Camera, 16X LEICA DC Vario-ELMARIT F2.8-4.0 Lens, 21.1 Megapixels, 1 Inch High Sensitivity Sensor, DMC-FZ1000 (USA BLACK)",Photography,http://www.amazon.com/dp/B00KOUIBZW/,22,3
Rode SC4 3 inches Microphone Cable,Musical Instruments,http://www.amazon.com/dp/B00L6C8PN0/,9,3
