name,category,amazon_link,total_mentions,subreddit_mentions
Gentle Souls Women's Best Of Ankle Boot,"Clothing, Shoes & Jewelry",https://www.amazon.com/Gentle-Souls-Womens-Best-Ankle/dp/B00CM83IDE,1,1
Gentle Souls Women's Lexington Boot,"Clothing, Shoes & Jewelry",https://www.amazon.com/Gentle-Souls-Womens-Lexington-Brown/dp/B00HHE4Q52/ref=sr_1_8?s=apparel&amp;ie=UTF8&amp;qid=1473903802&amp;sr=1-8&amp;nodeID=679380011&amp;refinements=p_lbr_brands_browse-bin,1,1
ROMWE Women's High Waist Knee Length Pleated A-line Midi Skirt,"Clothing, Shoes & Jewelry",https://www.amazon.com/ROMWE-Womens-Length-Pleated-Silver/dp/B01M0APID4/ref=sr_1_fkmr0_1?ie=UTF8&amp;qid=1497283294&amp;sr=8-1-fkmr0&amp;keywords=Perforated+Metallic-Peekaboo+Coat+,1,1
Kate Spade New York Arbour Hill Printed Avva Shoulder Bag Crossbody Handbag,"Clothing, Shoes & Jewelry",https://www.amazon.com/Kate-Spade-New-York-Crossbody/dp/B01M24FXWZ,1,1
GUESS Womens Harlea Open Toe Casual Platform Sandals,"Clothing, Shoes & Jewelry",https://www.amazon.com/dp/B01B60PPKM/ref=twister_B01CEZUEWC,1,1
Kate Spade New York Arbour Hill Printed Avva Shoulder Bag Crossbody Handbag,"Clothing, Shoes & Jewelry",https://www.amazon.com/dp/B01LX4MG0C/ref=cm_sw_r_cp_awdb_hTdJyb5C46BVJ,1,1
Purple With Black Rats - Purple Printed Designer Tights,"Clothing, Shoes & Jewelry",https://www.amazon.com/Purple-Black-Rats-Printed-Designer/dp/B00BU9MJ0E,1,1
Forever Camille-86 Women's Comfort Stacked Chunky Heel Lace Up Ankle Booties,"Clothing, Shoes & Jewelry",https://www.amazon.com/Forever-Camille-86-Comfort-Stacked-Booties/dp/B012I05L62/ref=sr_1_473?s=apparel&amp;ie=UTF8&amp;qid=1446600510&amp;sr=1-473&amp;nodeID=11721153011&amp;keywords=ankle+boots,1,1
"Calvin Klein Women's Ganessa Shimmer Fabric Wedge Sandal,Olive,5 M US","Clothing, Shoes & Jewelry",https://www.amazon.com/Calvin-Klein-Ganessa-Shimmer-Fabric/dp/B00K127LBI,1,1
MOMOKI Sexy hand crochet bikini triangle swimming trunks knitting beach bathing suit,"Clothing, Shoes & Jewelry",https://www.amazon.com/crochet-triangle-swimming-knitting-bathing/dp/B01G13HGOM/ref=sr_1_6?ie=UTF8&amp;qid=1482340745&amp;sr=8-6&amp;keywords=crochet,1,1
