name,category,amazon_link,total_mentions,subreddit_mentions
"South Bend Slip Cast Spin Float (Pack of 12), 1-1/4-Inch",Sports,http://www.amazon.com/dp/B003CU9K4W/,1,1
Plano Liqua Bait Storage Bottle and Bait Grabber,Sports,http://www.amazon.com/dp/B003FYF4TU/,1,1
"Pflueger President Spinning Fishing Reel and Fishing Rod Combo, 6.5 Feet, Medium Power",Sports,http://www.amazon.com/dp/B00DTTRY0S/,2,1
"Shakespeare USSP701MH/50CBO Ugly Stik GX2 1-Piece Fishing Rod and Spinning Reel Combo, 7 Feet, Medium-Heavy Power",Sports,http://www.amazon.com/dp/B00F0KMLIE/,1,1
Okuma Scott Martin Tournament Concept Rods TCS-C-701MH,Sports,http://www.amazon.com/dp/B00F5E4ZSE/,1,1
"Allen Riprap Fishing Spin/Spey/Switch Rod Case, Olive",Sports,http://www.amazon.com/dp/B00MK16HMM/,1,1
Piscifun PF1400 Right Handed 13+1 Shielded Bearings Baitcasting Reel Low Profile Baitcaster Tuned Magnetic Brake System Baitcast Reel,Sports,http://www.amazon.com/dp/B00MOPC17O/,2,1
"Penn Battle II 3000 Spinning Reel Combo, Inshore, 7 Feet, Medium Light Power",Sports,http://www.amazon.com/dp/B00NIGQ3D6/,1,1
"Deeper Flexible Arm, Black",Sports,http://www.amazon.com/dp/B00TH79MRO/,1,1
"Abu Garcia BMAX3/662M Black Max Fishing Rod and Baitcast Fishing Reel Combo, 6.5 Feet, Medium Power",Sports,http://www.amazon.com/dp/B011LUQLHS/,1,1
"Abu Garcia BMAX3/701MH Black Max Fishing Rod and Baitcast Fishing Reel Combo, 7 Feet, Medium Heavy Power",Sports,http://www.amazon.com/dp/B011LV6SUW/,2,1
KastKing Summer Spinning Reel Light Weight Ultra Smooth Powerful Spinning Fishing Reel 9 +1 BB,Sports,http://www.amazon.com/dp/B017TQTZ8A/,1,1
Suaoki Stainless Steel Fish Lip Gripper Grabber Grip Two-sided Trigger Tool Fish Holder with Scale Max 33 lbs / 15kg EVA Foam Handle Adjustable lanyard,Sports,http://www.amazon.com/dp/B01BV9VI1I/,2,1
"Fishing Tackle Lots,InnoFun Fishing Baits Kit Set With Free Tackle Box,For Freshwater Trout Bass Salmon",Sports,http://www.amazon.com/dp/B01JGP8ZAG/,1,1
Daiwa BG BG2500 Spinning Reel,Sports,http://www.amazon.com/dp/B01JH8FHS0/,1,1
"Falcon Rods Extra-Heavy Casting Rod, 7'5"", Left/Right, Black",Sports,http://www.amazon.com/dp/B01MDSZ890/,1,1
