name,category,amazon_link,total_mentions,subreddit_mentions
"Starting Strength:  Basic Barbell Training, 3rd edition",Book,http://www.amazon.com/dp/0982522738/,141,46
Bigger Leaner Stronger: The Simple Science of Building the Ultimate Male Body,Book,http://www.amazon.com/dp/1938895274/,38,32
Accu-Measure Fitness 3000 Personal Body Fat Caliper Measurement Tool,Health and Beauty,http://www.amazon.com/dp/B000G7YW74/,48,31
"Optimum Nutrition Creatine Powder, Unflavored, 600g",Health and Beauty,http://www.amazon.com/dp/B002DYIZEO/,33,23
Starting Strength,eBooks,http://www.amazon.com/dp/B006XJR5ZA/,32,22
Iron Gym Total Upper Body Workout Bar,Sports,http://www.amazon.com/dp/B001EJMS6K/,82,21
"Optimum Nutrition Gold Standard 100% Whey Protein Powder, Double Rich Chocolate, 5 Pound",Health and Beauty,http://www.amazon.com/dp/B000QSNYGI/,68,20
"SoundPEATS Bluetooth Headphones Stereo Wireless Earphones for Running with Mic (6 Hours Play Time, Bluetooth 4.0, IPX4 Sweatproof, Secure Ear Hooks Design) - Black & Green",Wireless,http://www.amazon.com/dp/B00LP6CFEC/,56,20
Creatine Monohydrate Powder Micronized by BulkSupplements (1 kilogram) | 99.99% Pure High Performance Formula | Pre/Post Workout Bodybuilding/Crossfit Supplement,Health and Beauty,http://www.amazon.com/dp/B00E9M4XEE/,36,19
Bigger Leaner Stronger: The Simple Science of Building the Ultimate Male Body (The Muscle for Life Series Book 1),eBooks,http://www.amazon.com/dp/B006XF5BTG/,29,19
"Strength Training Anatomy, 3rd Edition",Book,http://www.amazon.com/dp/0736092269/,40,17
"Ozeri Pronto Digital Multifunction Kitchen and Food Scale, Elegant Black",Kitchen,http://www.amazon.com/dp/B004164SRA/,281,16
"ProLab Caffeine Maximum Potency 200mg Tablets, 100-Count",Health and Beauty,http://www.amazon.com/dp/B0011865IQ/,59,14
"Becoming a Supple Leopard 2nd Edition: The Ultimate Guide to Resolving Pain, Preventing Injury, and Optimizing Athletic Performance",Book,http://www.amazon.com/dp/1628600837/,40,12
Omron Fat Loss Monitor,Health and Beauty,http://www.amazon.com/dp/B000FYZMYK/,42,12
"The New Encyclopedia of Modern Bodybuilding : The Bible of Bodybuilding, Fully Updated and Revised",Book,http://www.amazon.com/dp/0684857219/,30,11
"DeskCycle Desk Exercise Bike Pedal Exerciser, White",Sports,http://www.amazon.com/dp/B00B1VDNQA/,45,11
Daniels' Running Formula-3rd Edition,eBooks,http://www.amazon.com/dp/B00F0X7U2S/,26,11
One Pair of Adjustable Dumbbells Kits - 200 Lbs (100lbs X 2pc),Sports,http://www.amazon.com/dp/B0087T8UOE/,17,10
"NOW Sports Whey Protein Isolate,5-Pound",Health and Beauty,http://www.amazon.com/dp/B0015AQL1Q/,21,10
Practical Programming for Strength Training,Book,http://www.amazon.com/dp/0982522754/,22,10
Harbinger Polypropylene Dip Belt with 30-Inch Steel Chain,Sports,http://www.amazon.com/dp/B001P0S3XU/,19,10
"CAP Barbell Olympic 2-Inch Spring Clip Collars, Pair",Sports,http://www.amazon.com/dp/B000BJKWXK/,12,9
"CAP Barbell Olympic Bar, 2-Inch, 1000-Pound Capacity, 7-Feet",Sports,http://www.amazon.com/dp/B001K4OPY2/,47,9
Solitary Fitness,Book,http://www.amazon.com/dp/1844543099/,12,8
Whey Protein Powder Isolate by BulkSupplements (1 kilograms) | Clean & Pure Unflavored 90% Isolate for Men & Women | Build Muscle Mass & Burn Fat Fast,Health and Beauty,http://www.amazon.com/dp/B00E7IODXQ/,13,8
Slim Guide Skinfold Caliper,BISS,http://www.amazon.com/dp/B000NN9SDO/,11,8
Cap Barbell Power Rack Exercise Stand,Sports,http://www.amazon.com/dp/B00HYQP72O/,31,8
Plantronics BackBeat Fit Bluetooth Headphones - Blue,Wireless,http://www.amazon.com/dp/B00KJLMBQQ/,52,7
"Perfect Fitness Multi-Gym Doorway Pull Up Bar and Portable Gym System, Original",Sports,http://www.amazon.com/dp/B008DNAJYI/,17,7
Accu-Measure Body Fat Caliper,Health and Beauty,http://www.amazon.com/dp/B000QURRUK/,17,7
Atlas Power Rack Squat Deadlift Cage with Bench Racks,Sports,http://www.amazon.com/dp/B004UMM4QC/,29,7
"Isopure Whey Protein Isolate, Unflavored, 3 Pounds (Packaging May Vary)",Health and Beauty,http://www.amazon.com/dp/B002TG3QPO/,14,7
Strong Curves: A Woman's Guide to Building a Better Butt and Body,Book,http://www.amazon.com/dp/1936608642/,48,7
"ProSource Multi-Grip Chin-Up/Pull-Up Bar, Heavy Duty Doorway Trainer for Home Gym",Sports,http://www.amazon.com/dp/B002YQUP7Q/,20,7
Lifeline Power Up Chin-Up,Sports,http://www.amazon.com/dp/B006PDK1B4/,11,6
PowerLine PPR200X Power Rack,Sports,http://www.amazon.com/dp/B000VLRVSC/,29,6
"NOW Sports Pea Protein Powder,2-Pound",Health and Beauty,http://www.amazon.com/dp/B001DB4MFO/,16,6
Spark: The Revolutionary New Science of Exercise and the Brain,Book,http://www.amazon.com/dp/0316113514/,44,6
"Optimum Nutrition Gold Standard 100% Whey Protein Powder, Naturally Flavored Chocolate, 4.8 Pound",Health and Beauty,http://www.amazon.com/dp/B00QQA0GSY/,6,6
Valor Fitness BD-7 Power Rack with Lat Pull Attachment,Sports,http://www.amazon.com/dp/B002EJC990/,10,6
BAS-RUTTEN MMA Workout CD and DVD,Sports,http://www.amazon.com/dp/B00CXS6T02/,11,6
EatSmart Precision Digital Bathroom Scale with Extra Large Lighted Display,Health and Beauty,http://www.amazon.com/dp/B001KXZ808/,74,6
"Orgain Organic Plant Based Protein Powder, Sweet Vanilla Bean, 2.03 Pound, Packaging May Vary",Grocery,http://www.amazon.com/dp/B00J074W7Q/,16,6
"EatSmart Precision Pro Digital Kitchen Scale, Silver",Kitchen,http://www.amazon.com/dp/B001N07KUE/,33,6
Stamina 1690 Power Tower,Sports,http://www.amazon.com/dp/B002Y2SUU4/,39,6
Ader Fitness Olympic Fractional Plates - 5 LB Set,Sports,http://www.amazon.com/dp/B008RP3KY8/,10,5
"Quick Release Pair of Locking 2"" Olympic Size Barbell Clamp Collar Great for Pro Crossfit Training by Clout Fitness (2-Pack Black)",Sports,http://www.amazon.com/dp/B014JJGCDQ/,10,5
5/3/1: The Simplest and Most Effective Training System for Raw Strength (2nd Edition),Book,http://www.amazon.com/dp/B00686OYGQ/,10,5
Tactical Barbell II: Conditioning,eBooks,http://www.amazon.com/dp/B0143HDCWS/,6,5
"Rainbow Light - Men's One™ Multivitamin - Supports Energy, Stress Management, Heart, Prostate, Muscle, and Reproductive Health in Men - 150 Tablets",Health and Beauty,http://www.amazon.com/dp/B0007YCC7S/,9,5
"Cap Barbell 300 Pound Olympic Set, Grey",Sports,http://www.amazon.com/dp/B002OP1Z44/,12,5
"Orgain Organic Plant Based Protein Powder, Creamy Chocolate Fudge, 2.03 Pound, Packaging May Vary",Grocery,http://www.amazon.com/dp/B00J074W94/,28,5
Kinivo BTH240 Bluetooth Stereo Headphone - Supports Wireless Music Streaming and Hands-Free calling (Black),Wireless,http://www.amazon.com/dp/B00AWIPITS/,20,5
"Philips SHS3200BK/37 Flexible Earhook Headphones, Black",Speakers,http://www.amazon.com/dp/B003CJTR82/,15,5
"Photive PH-BTE70 Wireless Bluetooth Earbuds. Sweatproof Secure Fit Headphones for Running, Gym, Exercise. 8 Hour Battery",Speakers,http://www.amazon.com/dp/B00XZHQAMC/,15,5
Iron Gym Express Chin-Up Bar,Sports,http://www.amazon.com/dp/B003VNAKEE/,5,4
One Pair of Adjustable Dumbbells Cast Iron Total 105 Lbs (2 X 52.5 Lbs) by Unipack,Sports,http://www.amazon.com/dp/B007WKK5HE/,6,4
"Franklin Sports MLB Batting Weight, 20-Ounce",Sports,http://www.amazon.com/dp/B0018BEGQE/,9,4
Bowflex SelectTech 552 Adjustable Dumbbells (Pair),Sports,http://www.amazon.com/dp/B001ARYU58/,18,4
Sennheiser CX 685 Adidas Sports In-Ear Headphones,Speakers,http://www.amazon.com/dp/B0094R4POC/,16,4
"Explore Asia Organic Black Bean Spaghetti, 7.05-Ounce Pouch",Grocery,http://www.amazon.com/dp/B0078DU1CY/,36,4
"Protein Plus, Roasted All Natural Peanut Flour, 32 oz (907 g)",Grocery,http://www.amazon.com/dp/B0052OOYOW/,21,4
adidas Flat Bench,Sports,http://www.amazon.com/dp/B006JJM38S/,8,4
PowerBlock Travel Bench (Silver),Sports,http://www.amazon.com/dp/B000XEAUDK/,5,4
"SENSO Bluetooth Headphones, Best Wireless Sports Earphones w/ Mic IPX7 Waterproof HD Stereo Sweatproof Earbuds for Gym Running Workout 8 Hour Battery Noise Cancelling Headsets",Wireless,http://www.amazon.com/dp/B01G8JO5F2/,18,4
Plantronics BackBeat Fit Wireless Headphones - Retail Packaging - Green,Wireless,http://www.amazon.com/dp/B00KJLMBSO/,22,4
EatSmart Products Precision Getfit Digital Body Fat Scale with Auto Recognition Technology,Health and Beauty,http://www.amazon.com/dp/B004L6NTHU/,16,4
"Seapoint Farms Dry Roasted Edamame, Sea Salt, 4-Ounce Pouches (Pack of 12)",Grocery,http://www.amazon.com/dp/B000G2UUOS/,11,4
MEE audio Sport-Fi M6 Noise Isolating In-Ear Headphones with Memory Wire (Clear),Speakers,http://www.amazon.com/dp/B0038W0K2U/,14,4
"SoundPEATS Bluetooth Headphones Sport Wireless Earbuds In-Ear Stereo Earphones with Mic (Bluetooth 4.1, 6 Hours Play-time, CVC 6.0 Noise Cancelling, IPX4 Sweatproof ) - Black",Wireless,http://www.amazon.com/dp/B00PEPIWNI/,19,4
The Power of Habit: Why We Do What We Do in Life and Business,Book,http://www.amazon.com/dp/081298160X/,113,4
"Doctor's Best High Absorption Magnesium Glycinate Lysinate, 100% Chelated, Non-GMO, Vegan, Gluten Free, Soy Free,  200 mg, 240 Tablets",Health and Beauty,http://www.amazon.com/dp/B000BD0RT0/,146,4
"Fractional Plates - Kit of 8 x 0.5 Pound Weight Plates (4 lb Total), Fits Olympic Bars – Microload from 1 lb to 4 lb",Sports,http://www.amazon.com/dp/B00HMCW3HM/,7,4
"Burn the Fat, Feed the Muscle: Transform Your Body Forever Using the Secrets of the Leanest People in the World",Book,http://www.amazon.com/dp/0804137846/,6,4
CAP Barbell Deluxe Utility Weight Bench,Sports,http://www.amazon.com/dp/B00HGCJZEC/,10,4
"NOW Sports Pea Protein Natural Unflavored Powder,7-Pound",Health and Beauty,http://www.amazon.com/dp/B00JL6ZKFE/,10,4
Training for the New Alpinism: A Manual for the Climber as Athlete,Book,http://www.amazon.com/dp/193834023X/,26,4
Bulksupplements Pure Beta Alanine Powder (500 grams),Health and Beauty,http://www.amazon.com/dp/B00EIO4I7A/,8,4
Thinner Leaner Stronger: The Simple Science of Building the Ultimate Female Body,Book,http://www.amazon.com/dp/1938895290/,9,4
BCAA Branched Chain Essential Amino Acids Powder by BulkSupplements (250 grams) | 100% Pure 2:1:1 Instantized Formula | Pre/Post Workout Bodybuilding Supplement | Boost Muscle Growth,Health and Beauty,http://www.amazon.com/dp/B00E7GV6G0/,8,4
Ader Olympic Dumbbell Handles w/ Collars (Sold As a Pair),Sports,http://www.amazon.com/dp/B002OB2BT6/,6,4
"Z-Athletic Chalk Ball for Gymnastics, Climbing, and Weight Lifting (3oz Chalk Ball)",Sports,http://www.amazon.com/dp/B001KGA1L6/,8,4
Daniels' Running Formula-3rd Edition,Book,http://www.amazon.com/dp/1450431836/,79,4
"Born to Run: A Hidden Tribe, Superathletes, and the Greatest Race the World Has Never Seen",Book,http://www.amazon.com/dp/0307279189/,28,4
Nayoya Gymnastic Rings for Full Body Strength and Muscular Bodyweight Training,Sports,http://www.amazon.com/dp/B009RA6C1K/,24,4
"Black Mountain Products Resistance Band Set with Door Anchor, Ankle Strap, Exercise Chart, and Resistance Band",Sports,http://www.amazon.com/dp/7245456313/,27,4
Shure SE215-K Sound Isolating Earphones with Single Dynamic MicroDriver,Musical Instruments,http://www.amazon.com/dp/B004PNZFZ8/,93,4
Titan Power Rack Squat Deadlift HD Lift Cage Bench Racks stand cross fit pull up,Sports,http://www.amazon.com/dp/B00GHNLK9E/,10,4
NOW Foods Beta Alanine Powder  500G,Health and Beauty,http://www.amazon.com/dp/B0017KU74Q/,4,3
Farmers Walk Black Bars,Sports,http://www.amazon.com/dp/B0017RLKIQ/,3,3
You Are Your Own Gym: The Bible of Bodyweight Exercises,Book,http://www.amazon.com/dp/0345528581/,11,3
NIMBAL Therapy,Book,http://www.amazon.com/dp/0692430997/,19,3
"OXO Good Grips Stainless Steel Food Scale with Pull-Out Display, 11-Pound",Kitchen,http://www.amazon.com/dp/B000WJMTNA/,17,3
Kirkland Signature Fast Acting Lactase - 180 Caplets,Health and Beauty,http://www.amazon.com/dp/B000VS4BF6/,11,3
Valor Fitness BD-9 Power Squat Stand,Sports,http://www.amazon.com/dp/B006CW02ZS/,11,3
"Fat Gripz - The Ultimate Arm Builder, Blue",Sports,http://www.amazon.com/dp/B005FIS14Y/,8,3
How to Good-bye Depression: If You Constrict Anus 100 Times Everyday. Malarkey? or Effective Way?,Book,http://www.amazon.com/dp/0595094724/,16,3
1 1/4 lb. Grey Machined Olympic Plates (Pair),Sports,http://www.amazon.com/dp/B004QJ2ZOK/,3,3
"Align Daily Probiotic Supplement, Probiotics Supplement, 28 Capsules",Health and Beauty,http://www.amazon.com/dp/B000W4PNDS/,8,3
