name,category,amazon_link,total_mentions,subreddit_mentions
Harry Potter - The Complete Cinematic Journey,Toys & Games,https://www.amazon.com/dp/B004WDCZHC/ref=cm_sw_r_cp_api_rCCRxbQC6JV7H,2,2
Brother HL-L2300D Monochrome Laser Printer with Duplex Printing,Electronics,https://www.amazon.com/Brother-HL-L2300D-Monochrome-Printer-Printing/dp/B00NQ1CLTI/ref=redir_mobile_desktop?_encoding=UTF8&%2AVersion%2A=1&%2Aentries%2A=0,5,1
Razer Naga 2014 Ergonomic MMO Gaming Mouse - Black (RZ01-01040100-R3U1),Electronics,https://www.amazon.com/Razer-Naga-MMO-Gaming-Mouse/dp/B00E8CF268,4,1
"Escolite UV Flashlight Black Light, 51 LED 395 nM Ultraviolet Blacklight Detector for Dog Urine, Pet Stains and Bed Bug",Tools & Home Improvement,https://www.amazon.com/gp/product/B008133KB4/ref=oh_aui_detailpage_o00_s00?ie=UTF8&amp;psc=1,3,1
Nintendo New 3DS XL - Black,Video Games,https://www.amazon.com/New-Nintendo-3DS-XL-Black/dp/B00S1LRX3W,3,1
Sony DVPCX995V 400-Disc DVD Mega Changer/Player (2009 Model),Electronics,https://www.amazon.com/dp/B000A3XRSO/ref=cm_sw_r_awd_8bucwbWJ8RV5Q,2,1
Drimark Dual Detector Bonus Pack (351UVB),Office Products,https://www.amazon.com/Drimark-Dual-Counterfeit-Detector-351UVB/dp/B0053Y5Q8Y/ref=sr_1_2?s=office-products&amp;ie=UTF8&amp;qid=1454358751&amp;sr=1-2&amp;keywords=counterfeit+pen,2,1
Margin of Safety: Risk-Averse Value Investing Strategies for the Thoughtful Investor,Books,https://www.amazon.com/Margin-Safety-Risk-Averse-Strategies-Thoughtful/dp/0887305105/ref=sr_1_31?ie=UTF8&amp;qid=1463045787&amp;sr=8-31&amp;keywords=stock+market+books,2,1
"Sparco Sealing Tape Transparent Heavy Duty, 48mm x 50m, 6 Rolls (60041)",Office Products,https://www.amazon.com/Sparco-Sealing-Transparent-Heavy-Rolls/dp/B005P7P9M2/ref=sr_1_1?s=office-products&amp;ie=UTF8&amp;qid=1474084174&amp;sr=1-1&amp;keywords=Sparco+Sealing+Tape+Transparent+Heavy+Duty,2,1
"Dome 750 Mileage Log/Expense Record, 3.5 x 6.5 Inches, Logs 324 Trips (DOM750)",Office Products,https://www.amazon.com/Mileage-Expense-Record-Inches-DOM750/dp/B00006IC8V/ref=sr_1_2?ie=UTF8&amp;qid=1477550933&amp;sr=8-2&amp;keywords=business+miles+log,1,1
"Genuine Dell Black/ Silver Optical USB 2-Button Scroll Wheel Corded Mouse Part Number: C8639, C8649, CJ339, D1161, DJ301, KD944 T0943",Electronics,https://www.amazon.com/Genuine-Dell-Silver-Optical-2-Button/dp/B004577GX8/ref=sr_1_11?s=electronics&amp;ie=UTF8&amp;qid=1437184787&amp;sr=1-11&amp;keywords=Optical+Mouse,1,1
Pioneer Elite CLD-99 Laserdisc Player,Electronics,https://www.amazon.com/Pioneer-Elite-CLD-99-Laserdisc-Player/dp/B002LV013C/ref=redir_mobile_desktop?_encoding=UTF8&amp%3Bkeywords=pioneer%20cld-99&amp%3Bpi=AC_SX236_SY340_QL65&amp%3Bsr=8-1&qid=1459772261&ref_=mp_s_a_1_1,1,1
CardScan 600c - Sheetfed scanner - USB,Electronics,https://www.amazon.com/CardScan-600c-Sheetfed-scanner-USB/dp/B00005O70U/ref=sr_1_1?ie=UTF8&amp;qid=1462314673&amp;sr=8-1&amp;keywords=cardscan+600c,1,1
The Only Grammar Book You'll Ever Need: A One-Stop Source for Every Writing Assignment,Books,https://www.amazon.com/Only-Grammar-Book-Youll-Ever/dp/1580628559/ref=sr_1_1?ie=UTF8&amp;qid=1423500322&amp;sr=8-1&amp;keywords=english+textbook,1,1
6ft Star Wars Airblown Inflatable Darth Vader and Death Star - Plays Imperial March Music,Home & Kitchen,https://www.amazon.com/gp/product/B00P8ER12I,1,1
Sinobi Ultra-thin Case Men's Causal Quartz Watch,"Clothing, Shoes & Jewelry",https://www.amazon.com/Sinobi-Ultra-thin-Causal-Quartz-Watch/dp/B00G461RTM,1,1
"WLPackaging 3/16 700 ft x 12"" Small Bubble Cushioning Wrap, Perforated Every 12""",Office Products,https://www.amazon.com/WLPackaging-Small-Bubble-Cushioning-Perforated/dp/B01F5HLGSC/ref=redir_mobile_desktop?_encoding=UTF8&amp%3Bkeywords=bubble%20wrap%20700&amp%3Bpi=AC_SX236_SY340_FMwebp_QL65&amp%3Bqid=1486155577&amp%3Bsr=sr-1&ref_=sr_ph_1,1,1
"Lexmark 100XL Color High Yield Return Program Ink Cart Tri-pack (Cyan, Magenta, Yellow)",Office Products,https://www.amazon.com/dp/B002PIUTSS/ref=cm_sw_r_awd_ii3mwbSTE6Q2Y,1,1
The Trash Pack 'Trashies' Garbage Truck,Toys & Games,https://www.amazon.com/Trash-Pack-Trashies-Garbage-Truck/dp/B005NID08I,1,1
SE BT20 Battery Tester,Tools & Home Improvement,https://www.amazon.com/SE-BT20-Battery-Tester/dp/B000RB60H4/ref=sr_1_1?ie=UTF8&amp;qid=1460476018&amp;sr=8-1-spons&amp;keywords=battery+tester&amp;psc=1,1,1
"Intertape Polymer Group N8213 500 Solvent Natural Rubber, Medium Grade Carton Sealing Tape, 1.9 mil Thick, 100m Length x 48mm Width, Clear, Case of 36 Rolls",Industrial & Scientific,https://www.amazon.com/dp/B00CLXIUZ6,1,1
"Blue ""Consumer Commodity ORM-D"" Label - 1"" by 2"" - 500 ct",Office Products,https://www.amazon.com/Blue-Consumer-Commodity-ORM-D-Label/dp/B00I8746I4/ref=redir_mobile_desktop?_encoding=UTF8&%2AVersion%2A=1&%2Aentries%2A=0,1,1
WD TV HD Media Player,Electronics,https://www.amazon.com/WD-TV-HD-Media-Player/dp/B001JZFQU4,1,1
"When Someone You Know Has Aids: A Practical Guide Revised by Fran D. Peltz, CSW. & William Messira",Books,https://www.amazon.com/When-Someone-You-Know-Aids/dp/0517880393,1,1
Zeo Personal Sleep Manager,Electronics,https://www.amazon.com/Zeo-Model-ZEOBP01-Personal-Sleep-Manager/dp/B002IY65V4,1,1
Star Wars Science Force Glove,Toys & Games,https://www.amazon.com/Star-Wars-Science-Force-Glove/dp/B007CJJRVA,1,1
Star Wars Trilogy THX Widescreen Edition: Star Wars / The Empire Strikes Back / Return of the Jedi (Set of 3 VHS Tapes - Collector's Edition) NTSC,Movies & TV,https://www.amazon.com/Star-Wars-Trilogy-THX-Widescreen/dp/B009R97M3S,1,1
"iLive iAH54R Over-the-Ear DJ Headphones, Red",Electronics,https://www.amazon.com/iLive-iAH54R-Over---Ear-Headphones/dp/B00LG9J9EC,1,1
"Silver Buffalo SW031P3 Star Wars Boxed Pint Glasses ( 4-Piece Pub Set), 16 oz. Each, Clear",Home & Kitchen,https://www.amazon.com/Buffalo-SW031P3-Star-Wars-Glasses/dp/B00S5PDXUG,1,1
"60 Bin Parts Rack easily Organize Nuts, Bolts, or Parts, Removable Parts Bins with Dividers",Tools & Home Improvement,https://www.amazon.com/Parts-easily-Organize-Removable-Dividers/dp/B00WJ0G6YS/ref=sr_1_2?ie=UTF8&amp;qid=1466098914&amp;sr=8-2&amp;keywords=small+parts+storage+bins,1,1
Aviditi SIZER Carton Sizer/Reducer,Industrial & Scientific,https://www.amazon.com/Aviditi-SIZER-Carton-Sizer-Reducer/dp/B00WXXFO1W,1,1
"VTech Kidizoom Camera Pix, Blue (Frustration Free Packaging)",Toys & Games,https://www.amazon.com/VTech-Kidizoom-Camera-Pix-Blue/dp/B01D11ZOAK,1,1
Radica IM Me Wireless toy Handheld Device,Toys & Games,https://www.amazon.com/Radica-Wireless-toy-Handheld-Device/dp/B000NX1LUM,1,1
Anesthesia for the Uninterested,Books,https://www.amazon.com/dp/0871892960,1,1
"Scotch Heavy Duty Shipping Packaging Tape with Heavy Duty Dispenser, 1.88 Inches x 54.6 yd (3850-ST)",Office Products,https://www.amazon.com/dp/B000FM0RT2/ref=cm_sw_r_awd_WT7XvbDMZPMTA,1,1
Marianna - Super Star Creme Developer 40 Volume 32 oz.,Beauty & Personal Care,https://www.amazon.com/Marianna-Super-Star-Creme-Developer/dp/B00FKVYCHQ/ref=sr_1_2_s_it?s=beauty&amp;ie=UTF8&amp;qid=1499263024&amp;sr=1-2&amp;keywords=40+Volume+Creme,1,1
"Aqua Leisure Single Rider Winter Inflatable Round Snow Tube Sled  with 2 Big Grip Handles and Repair Kit, 32-Inch",Toys & Games,https://www.amazon.com/gp/product/B00GSPKL28,1,1
Real Human Rib (Natural Bone),Industrial & Scientific,https://www.amazon.com/Real-Human-Rib-Natural-Bone/dp/B00N1XLZB6,1,1
"FYI: For Your Improvement, A Guide for Development and Coaching (4th edition)",Books,https://www.amazon.com/dp/0974589233,1,1
Spinmaster Beat the Bell Spot Five Game,Toys & Games,https://www.amazon.com/dp/B00OV9BW4O,1,1
Thomas Eakins: Scenes From Modern Life,Movies & TV,https://www.amazon.com/gp/product/0971841209,1,1
Shrieks And Creaks Game,Toys & Games,https://www.amazon.com/Shrieks-And-Creaks-Game/dp/0307042367/,1,1
LG RC897T Multi-Format DVD Recorder and VCR Combo with Digital Tuner (2009 Model),Electronics,https://www.amazon.com/dp/B00195IURA,1,1
The First Law: The Blade Itself (Graphic Novel),Books,https://www.amazon.com/First-Law-Blade-Itself-Graphic/dp/1926838246/,1,1
"Curtain (Hercule Poirot Mysteries) Hardcover September 10, 1988",Books,https://www.amazon.com/Curtain-Hercule-Mysteries-Hardcover-September/dp/B010EW5D28,1,1
Diamond Feng Shui Kit - DIAMOND EDITION,Books,https://www.amazon.com/gp/product/B0031KXZOY/ref=olp_product_details?ie=UTF8&amp;me=,1,1
"S.P. Richards Company General Purpose Sealing Tape, 1-7/8 x 164 Feet, 3"" Core, Clear (SPR60043), 6 Rolls",Office Products,https://www.amazon.com/Richards-Company-General-Purpose-SPR60043/dp/B005OQMW56?ie=UTF8&amp;psc=1&amp;redirect=true&amp;ref_=oh_aui_detailpage_o00_s00,1,1
Uniden DWX207 DECT 6.0 Waterproof Accessory Handset and Charging Cradle,Electronics,https://www.amazon.com/Uniden-DWX207-Waterproof-Accessory-Charging/dp/B0012Z8M48/ref=redir_mobile_desktop?_encoding=UTF8&amp%3BdpID=41aPcl1WsWL&amp%3BdpPl=1&amp%3Bkeywords=uniden%20waterproof%20cordless%20phone&amp%3Bpi=SY200_QL40&amp%3Bref=plSrch&amp%3Bsr=8-2&qid=1462541010&ref_=mp_s_a_1_2,1,1
"Accuteck ShipPro W-8580 110lbs x 0.1 oz Red Digital shipping postal scale, Limited Edition",Office Products,https://www.amazon.com/dp/B016LKIP4U,1,1
Olympus VN-8100PC Digital Voice Recorder 142600 (Silver and Black),Electronics,https://www.amazon.com/gp/product/B000NPKO4E,1,1
Cartexpo - SOUS VERRE NICE MONACO - Cartexpo - 70876,Home & Kitchen,https://www.amazon.com/Cartexpo-SOUS-VERRE-MONACO-70876/dp/B0088CNDI8/ref=sr_1_1?ie=UTF8&amp;qid=1460123114&amp;sr=8-1&amp;keywords=Cartexpo+-+SOUS+VERRE+NICE+MONACO+-+Cartexpo+-+70876,1,1
"Bobrick 3979 ClassicSeries Stainless Steel Surface Mounted Convertible Automatic, Universal Roll Towel Dispenser/Waste Receptacle, Satin Finish, 12 Gallon Capacity, 17-1/2"" Width x 56-5/16"" Height",Industrial & Scientific,https://www.amazon.com/Bobrick-ClassicSeries-Stainless-Convertible-Receptacle/dp/B00996SQRU?ie=UTF8&amp;keywords=bobrick,1,1
The Practice of Philosophy,Books,https://www.amazon.com/gp/product/B000YE8MNY,1,1
Essential Oils Desk Reference,Books,https://www.amazon.com/Essential-Oils-Reference-Science-Publishing/dp/0943685494/ref=sr_1_2?ie=UTF8&amp;qid=1422323418&amp;sr=8-2&amp;keywords=essential+oils+4th+edition&amp;pebp=1422323420102&amp;peasin=943685494&amp;pebp=1422323420106&amp;peasin=943685494,1,1
Victoria's Secret - Classics By Request (Collector's Edition Box Set - 5 Discs),Books,https://www.amazon.com/Victorias-Secret-Classics-Request-Collectors/dp/B000EUH45A,1,1
Merit 1000 Half Sheet Shipping Labels Self Adhesive 8.5 x 5.5 Blank Printer (2 labels per sheet),Office Products,https://www.amazon.com/Merit-Shipping-Labels-Adhesive-Printer/dp/B012X1O6NU/,1,1
Cranium Hullabaloo,Toys & Games,https://www.amazon.com/Cranium-16518-Hullabaloo/dp/B00008MIGQ,1,1
"Anchor Hocking Montana Glass Jar with Airtight Lid, Brushed Metal, 1.5 Gallon",Home & Kitchen,https://www.amazon.com/Anchor-Hocking-1-5-Gallon-Montana-Brushed/dp/B000RMO41M/ref=sr_1_1?s=kitchen&amp;ie=UTF8&amp;qid=1481831994&amp;sr=1-1&amp;keywords=cookie+jar,1,1
