name,category,amazon_link,total_mentions,subreddit_mentions
"The Killing Zone, Second Edition: How & Why Pilots Die",Books,https://www.amazon.com/Killing-Zone-Second-How-Pilots/dp/0071798404/,4,4
"Gel Ear Seals for Rugged Air David Clark Avcomm and FlightComm General Aviation Pilot Headset, and Racing Radios Electronics Headsets",Cell Phones & Accessories,https://www.amazon.com/gp/product/B0076N9LM2/ref=oh_aui_detailpage_o03_s00],2,2
Rugged Air RA200 Black General Aviation Pilot Headset,Automotive Parts & Accessories,https://www.amazon.com/Rugged-Air-RA200-General-Aviation/dp/B01A6KE0RC/ref=sr_1_1?ie=UTF8&amp;qid=1502381853&amp;sr=8-1&amp;keywords=ra200,2,2
Everything Explained for the Professional Pilot,Books,https://www.amazon.com/Everything-Explained-Professional-Richie-Lengel/dp/0974261300/ref=sr_1_1?ie=UTF8&amp;qid=1433721471&amp;sr=8-1&amp;keywords=everything+explained+for+the+professional+pilot,2,2
S&S Worldwide 25-1 PK36 Balsa-Wood Top Gun Glider Model Plane (Pack of 36),Industrial & Scientific,https://www.amazon.com/Worldwide-Balsa-Wood-Glider-Model-Plane/dp/B000HIYQL4,2,2
GoPro Suction Cup (GoPro Official Mount),Electronics,https://www.amazon.com/gp/product/B00F19Q7YI/ref=as_li_qf_sp_asin_il_tl?ie=UTF8&amp;tag=rolfev-20&amp;camp=1789&amp;creative=9325&amp;linkCode=as2&amp;creativeASIN=B00F19Q7YI&amp;linkId=95b6ca22b5faed0627db846786e5f052,2,2
SanDisk Extreme Pro 512 GB SDXC UHS-I Card (SDSDXPA-512G-G46),Electronics,https://www.amazon.com/SanDisk-Extreme-512GB-Memory-SDSDXPA-512G-G46/dp/B00NP699ZI,7,1
ACR ResQlink+ PLB - Programmed for US Registration,Cell Phones & Accessories,https://www.amazon.com/ACR-PLB-375-ResQLink-Personal-Locating/dp/B006JXY0CQ,5,1
AudioQuest Diamond 1m (3.2 feet) Braided HDMI Cable,Electronics,https://www.amazon.com/dp/B003CT08E4/,4,1
Jane's Aircraft Recognition Guide Fifth Edition (Jane's Recognition Guides),Books,https://www.amazon.com/Janes-Aircraft-Recognition-Guide-Guides/dp/0061346195/ref=sr_1_2?ie=UTF8&amp;qid=1435759895&amp;sr=8-2&amp;keywords=Jane,2,1
"Ettore 49036 Grip'n Grab Reach Tool, 34-Inch",Home & Kitchen,https://www.amazon.com/Ettore-49036-Gripn-Reach-32-Inch/dp/B001B13PC2,2,1
Stick and Rudder: An Explanation of the Art of Flying,Books,https://www.amazon.com/Stick-Rudder-Explanation-Art-Flying/dp/0070362408,2,1
Canon EOS 6D 20.2 MP CMOS Digital SLR Camera with 3.0-Inch LCD (Body Only) - Wi-Fi Enabled,Electronics,https://www.amazon.com/gp/product/B009B0MZ8U,2,1
Boyd: The Fighter Pilot Who Changed the Art of War,Books,https://www.amazon.com/Boyd-Fighter-Pilot-Who-Changed/dp/0316796883/ref=sr_1_1?ie=UTF8&amp;qid=1439761215&amp;sr=8-1&amp;keywords=boyd,2,1
FAR/AIM 2016: Federal Aviation Regulations/Aeronautical Information Manual (FAR/AIM series),Books,https://www.amazon.com/FAR-AIM-2016-Regulations-Aeronautical/dp/1619542501/,1,1
Flight (Make it Work! Science),Books,https://www.amazon.com/Flight-Make-Science-Andrew-Haslam/dp/1587283557,1,1
"Egolets, 5 Stripe Novelty Pilot Epaulets","Clothing, Shoes & Jewelry",https://www.amazon.com/Egolets-Stripe-Novelty-Epaulets-Metallic/dp/B00V1QFOR6/ref=sr_1_6?ie=UTF8&amp;qid=1489517709&amp;sr=8-6&amp;keywords=epaulets,1,1
"Weston Spring & Hook Scale, 50 lb (14-0304-W), Anodized Aluminum, Non-Slip Grip, Patented",Home & Kitchen,https://www.amazon.com/Weston-Spring-Hook-Scale-50/dp/B001IHB4JK/,1,1
Rodeo M3 Fit Over Prescription Rx No Blind-spot Driver Day & Night Wrap Around Sun Glasses,"Clothing, Shoes & Jewelry",https://www.amazon.com/Rodeo-Prescription-Blind-spot-Driver-Glasses/dp/B00T9X2ACA/ref=pd_sim_309_2?_encoding=UTF8&amp;pd_rd_i=B00T9X2ACA&amp;pd_rd_r=JWVENDGG17S8FETC6MQV&amp;pd_rd_w=SP4o5&amp;pd_rd_wg=T6Uxh&amp;psc=1&amp;refRID=JWVENDGG17S8FETC6MQV,1,1
Aiming High: The Little Australian Built to Fly the World,Books,https://www.amazon.com/Aiming-High-Little-Australian-Built/dp/1862544247,1,1
Syma S107C 3-Channel RC Helicopter with Camera,Toys & Games,https://www.amazon.com/Syma-S107C-3-Channel-Helicopter-Camera/dp/B00DPK10OM,1,1
IFR Flight File V,Electronics,https://www.amazon.com/Aero-Phoenix-17039-Flight-File/dp/B003VS6X86?tag=castleos-20,1,1
"Panasonic Lumix ZS50 Camera, Black (Amazon Exclusive)",Electronics,https://www.amazon.com/gp/product/B00RBG687A,1,1
"Weather Flying, Fifth Edition (Aviation)",Books,https://www.amazon.com/Weather-Flying-Fifth-Robert-Buck/dp/0071799729/ref=sr_1_1?ie=UTF8&amp;qid=1451753477&amp;sr=8-1&amp;keywords=weather+flying,1,1
Practical Aviation Law,Books,https://www.amazon.com/Practical-Aviation-Law-Scott-Hamilton/dp/1560277637,1,1
Mountain Flying Bible Revised,Books,https://www.amazon.com/Mountain-Flying-Revised-Sparky-Imeson/dp/1880568179,1,1
ASA Instrument Pilot Kneeboard (IFR) - ASA-KB-2,Sports & Outdoors,https://www.amazon.com/ASA-Kneeboards-IFR/dp/B0035X6F62,1,1
Timex Men's T5K457 1440 Sports Digital Black Resin Strap Watch,"Clothing, Shoes & Jewelry",https://www.amazon.com/Timex-T5K457-Sports-Digital-Black/dp/B003QFXPW6/ref=sr_1_67?s=apparel&amp;ie=UTF8&amp;qid=1428700783&amp;sr=1-67&amp;keywords=mens+watch,1,1
Triple Tell Timer 3 Alert Multi Timer (Black) by Product Club,Home & Kitchen,https://www.amazon.com/dp/B005P3KPU2/ref=cm_sw_r_cp_api_1TtlxbMKX615K,1,1
Pilot USA PA-1151ACG Child (Girl) Headset w/Audio In,Cell Phones & Accessories,https://www.amazon.com/gp/product/B003M5O4IY/.,1,1
"Rhode Island Novelty 8"" Flying Glider Plane Set of 12",Toys & Games,https://www.amazon.com/Rhode-Island-Novelty-Flying-Glider/dp/B0028P5R26/ref=sr_1_6?ie=UTF8&amp;qid=1474558665&amp;sr=8-6,1,1
"Peltor Sport Earmuffs, Pink, Small, 1/Pack",Tools & Home Improvement,https://www.amazon.com/dp/B0015V1VX8/.,1,1
"[Upgraded Quality] Anker Astro E5 16000mAh Compact Portable Charger (2nd Generation, Premium Panasonic Battery Cells Inside, External Battery Power Bank) with PowerIQ Technology",Cell Phones & Accessories,https://www.amazon.com/dp/B00D5VAYRU/ref=cm_sw_r_udp_awd_uzdevb0PDFD8J,1,1
Instrument Oral Exam Guide: The Comprehensive Guide to Prepare You for the FAA Oral Exam (Oral Exam Guide series),Books,https://www.amazon.com/Instrument-Oral-Exam-Guide-Comprehensive/dp/1560277572,1,1
50 Ultra Pro Doge Standard Size Card Sleeves MTG Deck Protectors,Toys & Games,https://www.amazon.com/Ultra-Pro-Standard-Sleeves-Protectors/dp/B00MSBFTZ0/ref=sr_1_8?ie=UTF8&amp;qid=1434736734&amp;sr=8-8&amp;keywords=magic+gathering+card+sleeves,1,1
10 -Pack Condom Catheter 31mm Freedom Clear Advantage Aloe Vera Adhesive Intermediate #6300,"Health, Household & Baby Care",https://www.amazon.com/Freedom-Clear-Advantage-Aloe-Vera/dp/B00XTBSX56,1,1
"Energizer Performance LED Cap Light (30 Lumens), Red",Sports & Outdoors,https://www.amazon.com/gp/product/B003F88740,1,1
"Urinary Drainage Bag with Anti-Reflux Chamber, McKesson Medi-Pak Performance, Each","Health, Household & Baby Care",https://www.amazon.com/Drainage-Anti-Reflux-McKesson-Medi-Pak-Performance/dp/B01HDZ4TZG/ref=pd_lpo_vtph_121_bs_t_2?_encoding=UTF8&amp;psc=1&amp;refRID=FDVF3G34BTJAGB5RW9MQ,1,1
Airplane Cockpit Intercom ATC Radio Recording Cable with Power Cable Adapter Audio Cable for GoPro HERO3 / HERO3+ / HERO4 NOT FOR HERO 5,Electronics,https://www.amazon.com/gp/product/B01M3WJSEL/ref=oh_aui_detailpage_o00_s00?ie=UTF8&amp;psc=1,1,1
"8 Hours Bottle to Throttle, Aviation Themed Baby Onesie (6 Month)",Baby,https://www.amazon.com/Bottle-Throttle-Aviation-Themed-Onesie/dp/B00PAC3VAY,1,1
Tactical Response Bag- Tan,Sports & Outdoors,https://www.amazon.com/Condor-Outdoors-136-Tactical-Response/dp/B003UBHVA8/ref=sr_1_1?ie=UTF8&amp;qid=1501000493&amp;sr=8-1&amp;keywords=Response+bag,1,1
Canon EF 70-300mm f/4-5.6L IS USM UD Telephoto Zoom Lens for Canon EOS SLR Cameras,Electronics,https://www.amazon.com/gp/product/B0040X4PQI,1,1
Yaesu FTA550L Handheld VHF Transceiver w/Li-Ion Battery,Electronics,https://www.amazon.com/Yaesu-FTA550L-Handheld-Transceiver-Battery/dp/B00JFJUCH8,1,1
FLEX B7 FLIGHT,Electronics,https://www.amazon.com/BrightLine-Bags-FLEX-B7-FLIGHT/dp/B00JPRACS4/ref=sr_1_1?ie=UTF8&amp;qid=1447100088&amp;sr=8-1&amp;keywords=brightline+bag&amp;pebp=1447100095860&amp;perid=19F8458TGH3X5W6K43BX,1,1
General Aviation Aircraft Design: Applied Methods and Procedures,Books,https://www.amazon.com/General-Aviation-Aircraft-Design-Procedures/dp/0123973082,1,1
Private Oral Exam Guide: The Comprehensive Guide to Prepare You for the FAA Oral Exam (Oral Exam Guide series),Books,https://www.amazon.com/Private-Oral-Exam-Guide-Comprehensive/dp/1560275790,1,1
The Claw C100 Aircraft Tie Down Kit (3 Anchors),Automotive Parts & Accessories,https://www.amazon.com/Claw-C100-Aircraft-Down-Anchors/dp/B003VSELJE/ref=sr_1_1?ie=UTF8&amp;qid=1499350053&amp;sr=8-1&amp;keywords=claw+aircraft+tie+down,1,1
Rod Machado's Private Pilot Handbook,Books,https://www.amazon.com/Rod-Machados-Private-Pilot-Handbook/dp/0963122991/,1,1
"Wind, Sand, and Stars",Books,https://www.amazon.com/Wind-Sand-Stars-Antoine-Saint-Exupery/dp/8087888456/ref=sr_1_2?s=books&amp;ie=UTF8&amp;qid=1422580561&amp;sr=1-2&amp;keywords=wind+sand+and+stars,1,1
Disposable Sanitary Earpiece Covers for Large Headphones 100 pcs (50 Pair),Electronics,https://www.amazon.com/Disposable-Sanitary-Earpiece-Covers-Headphones/dp/B00CBJORJS,1,1
Private Oral Exam Guide: The Comprehensive Guide to Prepare You for the FAA Checkride (Oral Exam Guide series),Books,https://www.amazon.com/Private-Oral-Exam-Guide-comprehensive/dp/1560279494,1,1
Private Pilot Manual,Books,https://www.amazon.com/Private-Jeppesen-Sanderson-Training-Products/dp/0884872386,1,1
The Turbine Pilot's Flight Manual,Books,https://www.amazon.com/Turbine-Pilots-Flight-Manual/dp/156027946X/ref=pd_sbs_14_img_1?_encoding=UTF8&amp;psc=1&amp;refRID=PCVHQDYYWD902HX9Q54R,1,1
"Night Flight (Harbrace Paperbound Library, Hpl63)",Books,https://www.amazon.com/Night-Flight-Harbrace-Paperbound-Library/dp/0156656051/ref=pd_bxgy_b_text_y,1,1
