name,category,amazon_link,total_mentions,subreddit_mentions
Edible Wild Plants: Eastern/Central North America (Peterson Field Guides),Book,http://www.amazon.com/dp/039592622X/,19,3
All That the Rain Promises and More: A Hip Pocket Guide to Western Mushrooms,Book,http://www.amazon.com/dp/0898153883/,40,3
"Foraging the Rocky Mountains: Finding, Identifying, And Preparing Edible Wild Foods In The Rockies (Foraging Series)",Book,http://www.amazon.com/dp/0762782609/,2,2
"How to Grow More Vegetables, Eighth Edition: (and Fruits, Nuts, Berries, Grains, and Other Crops) Than You Ever Thought Possible on Less Land Than You ... (And Fruits, Nuts, Berries, Grains,)",Book,http://www.amazon.com/dp/160774189X/,5,2
Coming Home to Eat: The Pleasures and Politics of Local Food,Book,http://www.amazon.com/dp/0393335054/,1,1
The Bay Area Forager: Your Guide to Edible Wild Plants of the San Francisco Bay Area,Book,http://www.amazon.com/dp/0615496121/,1,1
Mushrooms of the Pacific Northwest (A Timber Press Field Guide),Book,http://www.amazon.com/dp/0881929352/,14,1
Stalking The Wild Asparagus,Book,http://www.amazon.com/dp/0911469036/,1,1
Stalking The Blue-Eyed Scallop (19640101),Book,http://www.amazon.com/dp/0911469052/,1,1
Sacred and Herbal Healing Beers: The Secrets of Ancient Fermentation,Book,http://www.amazon.com/dp/0937381667/,16,1
"Nature's Garden: A Guide to Identifying, Harvesting, and Preparing Edible Wild Plants",Book,http://www.amazon.com/dp/0976626616/,5,1
"Wild Edibles: A Practical Guide to Foraging, with Easy Identification of 60 Edible Plants and 67 Recipes",Book,http://www.amazon.com/dp/1583946020/,2,1
Mushrooms of the Upper Midwest: A Simple Guide to Common Mushrooms (Mushroom Guides),Book,http://www.amazon.com/dp/1591934176/,14,1
Mushrooms of the Northeast: A Simple Guide to Common Mushrooms (Mushroom Guides),Book,http://www.amazon.com/dp/1591935911/,2,1
Northeast Foraging: 120 Wild and Flavorful Edibles from Beach Plums to Wineberries (Regional Foraging Series),Book,http://www.amazon.com/dp/1604694173/,1,1
Southeast Foraging: 120 Wild and Flavorful Edibles from Angelica to Wild Plums (Regional Foraging Series),Book,http://www.amazon.com/dp/1604694998/,2,1
Mountain States Foraging: 115 Wild and Flavorful Edibles from Alpine Sorrel to Wild Hops (Regional Foraging Series),Book,http://www.amazon.com/dp/1604696788/,1,1
Backyard Foraging: 65 Familiar Plants You Didn’t Know You Could Eat,Book,http://www.amazon.com/dp/1612120091/,3,1
"Foraging the Mountain West: Gourmet Edible Plants, Mushrooms, and Meat",Book,http://www.amazon.com/dp/189278436X/,1,1
"IRWIN VISE-GRIP Original Curved Jaw Locking Pliers with Wire Cutter, 7"", 702L3",Home Improvement,http://www.amazon.com/dp/B00004YO5L/,2,1
Stanley 84-105 6-Inch Diagonal Cutting Plier,Home Improvement,http://www.amazon.com/dp/B0001IW89W/,2,1
"Morakniv Companion Fixed Blade Outdoor Knife with Sandvik Stainless Steel Blade, 4.1-Inch, Military Green",Sports,http://www.amazon.com/dp/B004ZAIXSC/,23,1
"Terrasoul Superfoods Sun-dried White Mulberries (Organic), 16-ounce",Grocery,http://www.amazon.com/dp/B00EKL415U/,1,1
"All-Purpose 4 Inch Spiral Long Mixing Paddle Paint Mixer - Fits Any 1/2"" Drill",Home Improvement,http://www.amazon.com/dp/B00JS7XKYO/,1,1
"Bonsai Pruning Scissors, Sago Brothers Pruning Shears for Bud and Leaves Trimmer 5 PCS",Lawn & Patio,http://www.amazon.com/dp/B00P0FK7W6/,10,1
Sun Joe SJHH1902 Hori-Hori Garden Landscaping Digging Tool with Stainless Steel Blade and Sheath,Lawn & Patio,http://www.amazon.com/dp/B00R86UK1S/,1,1
Svord Peasant Knives WBK,Home Improvement,http://www.amazon.com/dp/B014G8FSTY/,1,1
Useful. UH-TL211 8.5ft Aluminum Telescoping Extension Ladder,Home Improvement,http://www.amazon.com/dp/B01GULGMHW/,1,1
Edible Wild Mushrooms of Illinois and Surrounding States: A Field-to-Kitchen Guide (Field-To-Kitchen Guides),Book,http://www.amazon.com/dp/0252076435/,13,1
"Work Gloves,12-Pair Lillypet WorkShop PU Knuckle Coated Nylon Gloves (10"")",Home Improvement,http://www.amazon.com/dp/B01LKPP602/,1,1
Mushrooms of the Midwest,Book,http://www.amazon.com/dp/0252079760/,14,1
How to Grow Native Plants of Texas and the Southwest: Revised and Updated Edition,Book,http://www.amazon.com/dp/0292755732/,1,1
Flora of the Pacific Northwest: An Illustrated Manual,Book,http://www.amazon.com/dp/0295952733/,1,1
