name,category,amazon_link,total_mentions,subreddit_mentions
Meguiar's M205 Mirror Glaze Ultra Finishing Polish - 32 oz.,Automotive Parts and Accessories,http://www.amazon.com/dp/B001O7PNXC/,10,1
PORTER-CABLE 7424XP 6-Inch Variable-Speed Polisher,Home Improvement,http://www.amazon.com/dp/B002654I46/,11,1
Nanoskin (AS-018) AutoScrub Medium Grade Sponge,Automotive Parts and Accessories,http://www.amazon.com/dp/B00CUAWEUM/,3,1
Suaoki G7 600A Peak Portable Jump Starter (Up to 6L Gas or 5L Diesel) 18000mAh Power Bank with Intelligent Clamps and LED Flashlight,Automotive Parts and Accessories,http://www.amazon.com/dp/B015O7AIIC/,1,1
"3-Piece Impact Universal Joint Set | ARES 70073 | 1/4, 3/8 and 1/2-Inch Drive Chrome Moly U Joint Sockets Accesses Hard to Reach Fasteners",Automotive Parts and Accessories,http://www.amazon.com/dp/B01E0G1Q3Y/,1,1
