name,category,amazon_link,total_mentions,subreddit_mentions
Uranium: Twisting the Dragon's Tail,TV Series Season Video on Demand,http://www.amazon.com/dp/B012VP8WT2/,,1
Natural Harvest: A collection of semen-based recipes,Book,http://www.amazon.com/dp/1481227041/,59,1
The Precariat: The New Dangerous Class,Book,http://www.amazon.com/dp/1472536169/,5,1
"Deglon Meeting Knife Set, Stainless Steel Knives and Block, Set of 4",Kitchen,http://www.amazon.com/dp/B002JTWRDS/,4,1
Narconomics: How to Run a Drug Cartel,Books,https://www.amazon.com/Narconomics-How-Run-Drug-Cartel/dp/1610395832,3,1
Superforecasting: The Art and Science of Prediction,Book,http://www.amazon.com/dp/0804136718/,2,1
Why We Can't Wait (Signet Classics),Book,http://www.amazon.com/dp/0451527534/,1,1
Escape from Freedom,Book,http://www.amazon.com/dp/0805031499/,1,1
Sixty Million Frenchmen Can't Be Wrong: Why We Love France but Not the French,Book,http://www.amazon.com/dp/1402200455/,1,1
"Saucisson Sec Dry French Sausage, Two 11 Ounce Sausages",Grocery,http://www.amazon.com/dp/B01LBYC862/,1,1
The Swearing Middle Finger - Motion Activated,Toy,http://www.amazon.com/dp/B0039OGQ0M/,1,1
Shackled and Chained: Mass Incarceration in Capitalist America,Book,http://www.amazon.com/dp/0984122087/,1,1
Beethoven: Favourite Piano Sonatas,Music,http://www.amazon.com/dp/B00000417L/,1,1
"Star Wars Star Wars Chewbacca Adult Fleece Bathrobe, brown, one size fits most",Apparel,http://www.amazon.com/dp/B00AGLSHBM/,1,1
String Quartet,Music,http://www.amazon.com/dp/B0035GU9TS/,1,1
