name,category,amazon_link,total_mentions,subreddit_mentions
Quiet: The Power of Introverts in a World That Can't Stop Talking,Book,http://www.amazon.com/dp/0307352153/,68,1
Caesar's Messiah: The Roman Conspiracy to Invent Jesus: Flavian Signature Edition,Book,http://www.amazon.com/dp/1461096405/,5,1
3: The Better Angels of Our Nature: Why Violence Has Declined,Book,http://www.amazon.com/dp/1491518243/,37,1
"Democratic Autonomy in North Kurdistan: The Council Movement, Gender Liberation, and Ecology",Book,http://www.amazon.com/dp/8293064269/,3,1
Blood and Belief: The PKK and the Kurdish Fight for Independence,eBooks,http://www.amazon.com/dp/B0029VCUTW/,1,1
The Fabulous History of the Dismal Swamp Company: A Story of George Washington's Times,eBooks,http://www.amazon.com/dp/B004DEPF04/,1,1
