name,category,amazon_link,total_mentions,subreddit_mentions
Clarks Men's Bushacre 2 Desert Boot,"Clothing, Shoes & Jewelry",https://www.amazon.com/Clarks-Mens-Bushacre-Desert-Boot/dp/B00UWIZZ5K/ref=cts_sh_1_vtp?psc=1,1,1
"Nespresso D40-US-SI-NE Inissia Espresso Maker, Silver (Discontinued Model)",Home & Kitchen,https://www.amazon.com/Nespresso-D40-US-SI-NE-Inissia-Espresso-Silver/dp/B015MIGAH6/ref=sr_1_1?m=A2L77EE7U53NWQ&amp;s=warehouse-deals&amp;ie=UTF8&amp;qid=1468119407&amp;sr=1-1,1,1
1883 by Wolverine Men's Alec Chelsea Boot,"Clothing, Shoes & Jewelry",https://www.amazon.com/1883-Wolverine-Mens-Alec-Chelsea/dp/B01AL6UWJG?th=1&amp;psc=1,1,1
Cole Haan Men's Jay Grand Apron Ox Oxford,"Clothing, Shoes & Jewelry",https://www.amazon.com/Cole-Haan-Grand-Oxford-British/dp/B01DEW520S/ref=sr_1_8?s=apparel&amp;ie=UTF8&amp;qid=1482937842&amp;sr=1-8&amp;nodeID=679319011&amp;keywords=cole,1,1
Amazon Essentials Men's Cotton Pique Polo Shirt,"Clothing, Shoes & Jewelry",https://www.amazon.com/dp/B01IXFPAAS/ref=cm_sw_r_cp_api_pwczzbSF9HGBA,1,1
Tommy Hilfiger Men's Arctic Cloth Full Length Quilted Snorkel,"Clothing, Shoes & Jewelry",https://www.amazon.com/Tommy-Hilfiger-Removable-Isulation-Charcoal/dp/B01L0AYJH8/ref=sr_1_11?m=ATVPDKIKX0DER&amp;s=apparel&amp;ie=UTF8&amp;qid=1481645706&amp;sr=1-11&amp;nodeID=7147441011&amp;refinements=p_6,1,1
Franklin Tailored Men's Tracy Tuxedo,"Clothing, Shoes & Jewelry",https://www.amazon.com/Franklin-Tailored-Tracy-Tuxedo-Black/dp/B013AY9BIE/ref=sr_1_14?srs=13962731011&amp;ie=UTF8&amp;qid=1482198047&amp;sr=8-14&amp;keywords=franklin,1,1
Calvin Klein Men's Artic Bomber Jacket With Removable Hood,"Clothing, Shoes & Jewelry",https://www.amazon.com/dp/B00UUGB846/ref=twister_B00ZZNRI2K,1,1
Clarks Mens Dargo Rise Boots Black Leather UK11 Black,"Clothing, Shoes & Jewelry",https://www.amazon.com/Clarks-Dargo-Boots-Black-Leather/dp/B013TAF1M4,1,1
Vostok Amphibian Military Russian Diver Watch Navy Black 2416/420526,"Clothing, Shoes & Jewelry",https://www.amazon.com/Vostok-Amphibian-Military-Russian-420526/dp/B00TKAVSHK/ref=sr_1_5?ie=UTF8&amp;qid=1445380263&amp;sr=8-5&amp;keywords=vostok+amphibia,1,1
Fanmis White Dial Sapphire Seagull Movement Power Reserve Portugal Style Automatic Watch,"Clothing, Shoes & Jewelry",https://www.amazon.com/dp/B00Q2GQ28K/ref=wl_it_dp_o_pC_S_ttl?_encoding=UTF8&amp;colid=14M2JT2IWOPD7&amp;coliid=I36P3Q6XULXXN2,1,1
SmartWool Trekking Heavy Crew Socks,Sports & Outdoors,https://www.amazon.com/SmartWool-Trekking-Heavy-Hiking-Socks/dp/B000NI662A/ref=sr_1_4?s=sporting-goods&amp;ie=UTF8&amp;qid=1454355438&amp;sr=1-4&amp;keywords=smartwool,1,1
adidas Performance Men's Powerlift.2 Trainer Shoe,"Clothing, Shoes & Jewelry",https://www.amazon.com/adidas-Performance-Powerlift-2-Trainer-Bright/dp/B00Q049P74/ref=sr_1_1?s=apparel&amp;ie=UTF8&amp;qid=1448580274&amp;sr=1-1&amp;nodeID=7141123011&amp;keywords=weightlifting+shoes,1,1
Alpine Swiss Winter Scarf Soft Elegant Long Fashion Wrap Scarves Maroon Houndstooth,"Clothing, Shoes & Jewelry",https://www.amazon.com/gp/product/B00P1V8J3S/ref=oh_aui_detailpage_o01_s00?ie=UTF8&amp;psc=1,1,1
"Navali Mainstay Messenger Bag, Navy","Clothing, Shoes & Jewelry",https://www.amazon.com/Navali-Mainstay-Messenger-Bag-Navy/dp/B00NB6W652/ref=sr_1_1?ie=UTF8&amp;qid=1468874887&amp;sr=8-1&amp;keywords=navali,1,1
Naked & Famous Denim Men's Weird Guy Tapered Fit Jean In Indigo Selvedge Chambray,"Clothing, Shoes & Jewelry",https://www.amazon.com/gp/product/B017PG0UFG/ref=oh_aui_detailpage_o00_s00?ie=UTF8&amp;th=1&amp;psc=1,1,1
"Elma Men's Touchscreen Texting Winter Italian Nappa Leather Gloves (9.5, Brown (2014 Winter New Cashmere Lining))","Clothing, Shoes & Jewelry",https://www.amazon.com/Touchscreen-Texting-Italian-Leather-Cashmere/dp/B00N3GTTHS/ref=redir_mobile_desktop?_encoding=UTF8&amp%3BdpID=41xZMQZkGdL&amp%3BdpPl=1&amp%3Bkeywords=Leather%20gloves&amp%3Bpi=SY200_QL40&amp%3Bref=plSrch&amp%3Bsr=8-1&qid=1443994594&ref_=mp_s_a_1_1,1,1
Franklin Tailored Men's Pinstripe Suit,"Clothing, Shoes & Jewelry",https://www.amazon.com/Franklin-Tailored-Mens-Pinstripe-Suit/dp/B019BWMY0G/ref=sr_1_10?srs=13962731011&amp;ie=UTF8&amp;qid=1482198047&amp;sr=8-10&amp;keywords=franklin,1,1
Navali Mainstay Waxed Canvas & Leather Messenger Bag (Olive Canvas),"Clothing, Shoes & Jewelry",https://www.amazon.com/Navali-Mainstay-Canvas-Leather-Messenger/dp/B00M4DO88Q/,1,1
adidas Men's Tiro 15 Training Pant,Sports & Outdoors,https://www.amazon.com/adidas-Performance-Training-Medium-Black/dp/B00LOU51Y0/ref=sr_1_1?ie=UTF8&amp;qid=1481567175&amp;sr=8-1&amp;keywords=tiro,1,1
Kirkland Signature Men's Outdoor Trail Sock Merino Wool Blend Assorted Pack,Sports & Outdoors,https://www.amazon.com/gp/product/B00KRH8B70?psc=1&amp;redirect=true&amp;ref_=oh_aui_detailpage_o01_s00,1,1
Columbia Men’s Steens Mountain Full Zip Fleece 2.0,"Clothing, Shoes & Jewelry",https://www.amazon.com/gp/product/B00K8Q19MO?psc=1&amp;redirect=true&amp;ref_=oh_aui_detailpage_o00_s00,1,1
Allen Edmonds Men's Park Avenue Cap-Toe Oxford,"Clothing, Shoes & Jewelry",https://www.amazon.com/Allen-Edmonds-Avenue-Oxford-Black/dp/B000H12K8M/ref=pd_cart_vw_2_2_p?ie=UTF8&amp;refRID=0DS0TWCAQF78QS2ESG0X,1,1
"New Balance Men's M373 Classic Running Shoe,Red/Blue,11.5 D US","Clothing, Shoes & Jewelry",https://www.amazon.com/dp/B00H2CDWXG/ref=cm_sw_r_awd_5MaRub0VW83WK,1,1
ASICS Men's Gel-Lyte V Fashion Sneaker,"Clothing, Shoes & Jewelry",https://www.amazon.com/ASICS-Gel-Lyte-Fashion-Sneaker-Black/dp/B01B57S1A2/ref=sr_1_85?s=apparel&amp;ie=UTF8&amp;qid=1503678072&amp;sr=1-85&amp;nodeID=679255011&amp;psd=1&amp;refinements=p_n_size_browse-vebin,1,1
CCCP Men's CP-7019-01 Heritage Analog Display Automatic Self Wind Black Watch,"Clothing, Shoes & Jewelry",https://www.amazon.com/gp/product/B00FWM06LO/ref=gb1h_img_c-2_6582_33e1ea6a?pf_rd_m=ATVPDKIKX0DER&amp;pf_rd_t=701&amp;pf_rd_s=center-new-2&amp;pf_rd_r=1FJ34MBEDVQ90KJWDDV6&amp;pf_rd_i=20&amp;pf_rd_p=2064246582,1,1
Sperry Top-Sider Men's A/O Boat Shoe,"Clothing, Shoes & Jewelry",https://www.amazon.com/Sperry-Top-Sider-Mens-Boat-Sahara/dp/B000EP6HYE/ref=sr_1_2?ie=UTF8&amp;qid=1427146188&amp;sr=8-2&amp;keywords=sperry+top-siders,1,1
David Archy Men's Micro Modal Separate Pouches Trunks 4PACK,"Clothing, Shoes & Jewelry",https://www.amazon.com/David-Archy-Separate-Pouches-Trunks/dp/B00DYNPGH2/ref=redir_mobile_desktop?_encoding=UTF8&amp%3BdpID=41GVbn7ZweL&amp%3BdpPl=1&amp%3Bpi=SY200_QL40&amp%3Bref=plSrch&amp%3Bsr=1-1&qid=1461340035&ref_=mp_s_a_1_1,1,1
Timex Men's T2P0439J Analog Display Analog Quartz Black Watch,"Clothing, Shoes & Jewelry",https://www.amazon.com/Timex-T2P0439J-Analog-Display-Quartz/dp/B00CBMMAIA,1,1
Original Chippewa Collection Men's 6-Inch Service Utility Boot,"Clothing, Shoes & Jewelry",https://www.amazon.com/gp/product/B00BP45EDS/ref=ox_sc_act_title_1?ie=UTF8&amp;psc=1&amp;smid=ATVPDKIKX0DER,1,1
Timex Men's South Street Watch,"Clothing, Shoes & Jewelry",https://www.amazon.com/gp/product/B0083XFVUK/ref=ox_sc_act_title_1?ie=UTF8&amp;psc=1&amp;smid=ATVPDKIKX0DER,1,1
Golden Fox Men's Premium Leather Soft Toe Light Weight Industrial Construction Moc Work Boots Insulated,"Clothing, Shoes & Jewelry",https://www.amazon.com/Golden-Fox-Industrial-Construction-Insulated/dp/B0083F3WJK/ref=cts_sh_4_vtp?_encoding=UTF8&amp;pf_rd_m=ATVPDKIKX0DER&amp;pf_rd_p=2601945442&amp;pf_rd_r=GW7V3GXRK70W5Z29B026&amp;pd_rd_wg=DZbgC&amp;pf_rd_s=desktop-detail-softlines&amp;pf_rd_t=40701&amp;pd_rd_i=B007ZU7SU8&amp;pd_rd_w=dZCWt&amp;pf_rd_i=desktop-detail-softlines&amp;pd_rd_r=GW7V3GXRK70W5Z29B026&amp;th=1,1,1
Seiko SSB025 men's Chronograph stainless Steel Case Watch,"Clothing, Shoes & Jewelry",https://www.amazon.com/gp/product/B007554WYI,1,1
"Timex Men's T2N754 Weekender Sport Black, Gray & Blue Nylon Strap Watch","Clothing, Shoes & Jewelry",https://www.amazon.com/Timex-T2N754-Weekender-Sport-Black/dp/B006K6DE56/ref=sr_1_1?s=apparel&amp;ie=UTF8&amp;qid=1425668985&amp;sr=1-1&amp;keywords=weekender,1,1
Champion Men's Pullover Eco Fleece Hoodie,"Clothing, Shoes & Jewelry",https://www.amazon.com/Champion-Pullover-Fleece-Hoodie-X-Large/dp/B005CSOS44/ref=sr_1_2?ie=UTF8&amp;qid=1484758420&amp;sr=8-2&amp;keywords=champion+hoodie,1,1
N6210 Next Level Men's CVC Crew,"Clothing, Shoes & Jewelry",https://www.amazon.com/dp/B004OWH4OU/,1,1
Jacquard Indigo Tie Dye Kit (Mini),"Arts, Crafts & Sewing",https://www.amazon.com/Jacquard-Indigo-Tie-Dye-Mini/dp/B003IIN7HO,1,1
Alpha Industries Men's MA-1 Flight Bomber Jacket,"Clothing, Shoes & Jewelry",https://www.amazon.com/gp/product/B002IAKVOU/ref=ox_sc_act_title_1?ie=UTF8&amp;psc=1&amp;smid=ATVPDKIKX0DER,1,1
"Optimum Nutrition Gold Standard 100% Whey Protein Powder, Double Rich Chocolate 2 Pound","Health, Household & Baby Care",https://www.amazon.com/gp/product/B002DYIZH6?psc=1&amp;redirect=true&amp;ref_=oh_aui_detailpage_o00_s00,1,1
"Red Wing Heritage Men's Classic Moc 6"" Boot","Clothing, Shoes & Jewelry",https://www.amazon.com/Red-Wing-Heritage-Moc-Boot/dp/B0018DW7QS,1,1
adidas Performance Men's Samba Classic Indoor Soccer Shoe,"Clothing, Shoes & Jewelry",https://www.amazon.com/adidas-Samba-Classic-Soccer-Running/dp/B000CER6RY/ref=sr_1_1?s=apparel&amp;ie=UTF8&amp;qid=1490828091&amp;sr=1-1&amp;nodeID=679255011&amp;psd=1&amp;keywords=adidas,1,1
Sunglasses Classic 80's Vintage Style Design …,"Clothing, Shoes & Jewelry",https://www.amazon.com/Retro-Rewind-Polarized-Sunglasses-Tortoise/dp/B01J4KAHVI/ref=redir_mobile_desktop?_encoding=UTF8&amp%3Bamp%3Bqid=1491403985&amp%3Bamp%3Brefinements=p_85&amp%3Bamp%3Bsr=8-11&ref_=mp_s_a_1_11,1,1
"adidas NEO Men's Advantage Clean VS Lifestyle Tennis Shoe, Black/Black/Lead","Clothing, Shoes & Jewelry",https://www.amazon.com/gp/product//B00XFBNPJ4/ref=twister_dp_update?ie=UTF8&amp;psc=1,1,1
"Timberland Men's Earthkeepers 6"" Lace-Up Boot","Clothing, Shoes & Jewelry",https://www.amazon.com/Timberland-Earthkeepers-Lace-Up-Burnished-Brown/dp/B000YDG5X4/ref=sr_1_1?s=apparel&amp;ie=UTF8&amp;qid=1440959942&amp;sr=1-1&amp;keywords=timberland+earthkeepers&amp;pebp=1440959943440&amp;perid=06DQPBT7PS9R5Y0W5Z7K,1,1
Calvin Klein Men's Steel Micro Boxer Brief,"Clothing, Shoes & Jewelry",https://www.amazon.com/Calvin-Klein-Steel-Micro-Boxer/dp/B000TGYGAK?sa-no-redirect=1,1,1
Red Wing Heritage Men's Weekender Chukka Boot,"Clothing, Shoes & Jewelry",https://www.amazon.com/gp/product/B01MDN9873/ref=oh_aui_detailpage_o00_s00?ie=UTF8&amp;psc=1,1,1
Timex Men's T44921 Expedition Metal Field Brown Leather Strap Watch,"Clothing, Shoes & Jewelry",https://www.amazon.com/gp/product/B000SZMN8E/ref=ox_sc_act_title_1?ie=UTF8&amp;psc=1&amp;smid=ATVPDKIKX0DER,1,1
Franklin & Freeman Men's Taylor Plain Toe Oxford,"Clothing, Shoes & Jewelry",https://www.amazon.com/Franklin-Freeman-Taylor-Oxford-Chocolate/dp/B010S5Z2E0/ref=sr_1_2?s=apparel&amp;ie=UTF8&amp;qid=1497979938&amp;sr=1-2&amp;nodeID=7141123011&amp;psd=1&amp;th=1&amp;psc=1,1,1
adidas Men's Condivo 16 Training Pants,Sports & Outdoors,https://www.amazon.com/dp/B010DKJBRE/ref=cm_sw_r_cp_api_jLFXxbPQ30TSP,1,1
adidas Men's Condivo 16 Training Pants,Sports & Outdoors,https://www.amazon.com/dp/B010DKGWZS/ref=cm_sw_r_cp_api_ZKFXxb5KADR7X,1,1
Zmart Men's Art Patterned Casual Crew Socks 8-Pack,"Clothing, Shoes & Jewelry",https://www.amazon.com/gp/product/B00ZUA6D4W?psc=1&amp;redirect=true&amp;ref_=oh_aui_detailpage_o05_s01,1,1
Timex Men's TW2P72200 Weekender Reversible Black/Gray Stripe Nylon Slip-Thru Strap Watch,"Clothing, Shoes & Jewelry",https://www.amazon.com/Timex-TW2P72200-Weekender-Reversible-Slip-Thru/dp/B00YTY9BQC/ref=sr_1_10?s=apparel&amp;ie=UTF8&amp;qid=1481988318&amp;sr=1-10&amp;nodeID=7141123011&amp;keywords=timex+weekender,1,1
