name,category,amazon_link,total_mentions,subreddit_mentions
Seiko Men's SNK809 Seiko 5 Automatic Stainless Steel Watch with Black Canvas Strap,"Clothing, Shoes & Jewelry",https://www.amazon.com/Seiko-SNK809-Automatic-Stainless-Canvas/dp/B002SSUQFG/ref=pd_sim_241_5?ie=UTF8&amp;refRID=16AHZR13R7PWQBM0W3PX,23,4
Timex Men's Expedition Field Chronograph Watch,"Clothing, Shoes & Jewelry",https://www.amazon.com/Timex-T499059J-Expedition-Field-Chronograph/dp/B0083XFHIG/ref=lp_13141448011_1_1?s=apparel&amp;ie=UTF8&amp;qid=1448596701&amp;sr=1-1&amp;nodeID=13141448011,9,3
Timex Unisex Weekender Analog Quartz Watch,"Clothing, Shoes & Jewelry",https://www.amazon.com/Timex-Unisex-T2N651KW-Weekender-Through/dp/B004VR9HP2/ref=sr_1_1?ie=UTF8&amp;qid=1430713811&amp;sr=8-1&amp;keywords=timex+weekender,12,2
Seiko Men's SNK807 Seiko 5 Automatic Stainless Steel Watch with Blue Canvas Band,"Clothing, Shoes & Jewelry",https://www.amazon.com/Seiko-SNK807-Automatic-Canvas-Strap/dp/B006CHML4I,7,2
GGI Watch Repair Spring Bar Tool Set 5 in-7 Pc,Tools & Home Improvement,https://www.amazon.com/dp/B005ZEWGSA/ref=cm_sw_r_awd_fXCzvb03MBS3X,7,2
Clarks Originals Men's Desert Boot,"Clothing, Shoes & Jewelry",https://www.amazon.com/Clarks-Originals-Mens-Desert-Boot/dp/B000WU8SBQ/ref=cts_sh_2_vtp?_encoding=UTF8&amp;pf_rd_m=ATVPDKIKX0DER&amp;pf_rd_p=2601945442&amp;pf_rd_r=9G6SGV98DH7919R18EXJ&amp;pd_rd_wg=46wTW&amp;pf_rd_s=desktop-detail-softlines&amp;pf_rd_t=40701&amp;pd_rd_i=B0007MCUTK&amp;pd_rd_w=US6xh&amp;pf_rd_i=desktop-detail-softlines&amp;pd_rd_r=9G6SGV98DH7919R18EXJ&amp;th=1&amp;psc=1,5,2
Timex Easy Reader Day-Date Leather Strap Watch,"Clothing, Shoes & Jewelry",https://www.amazon.com/gp/product/B0000TII00?psc=1&amp;redirect=true&amp;ref_=oh_aui_detailpage_o03_s00,4,2
Orient ER24005W Men's Bambino White Dial Brown Leather Strap Automatic Watch,"Clothing, Shoes & Jewelry",https://www.amazon.com/gp/product/B008VBUZ2I,4,2
Timex Unisex Weekender Analog Quartz Watch,"Clothing, Shoes & Jewelry",https://www.amazon.com/Timex-Unisex-T2N647-Weekender-Slip-Thru/dp/B00B2I167K?sa-no-redirect=1&amp;th=1,4,2
Timex Weekender Chronograph 40mm Watch,"Clothing, Shoes & Jewelry",https://www.amazon.com/gp/product/B00QIJ62M2,3,2
"Dockers Men's Chest Block Fairisle Zip Mock Sweater, Deep Night, Large","Clothing, Shoes & Jewelry",https://www.amazon.com/Dockers-Chest-Block-Fairisle-Sweater/dp/B00LCVX06W/ref=redir_mobile_desktop?_encoding=UTF8&%2AVersion%2A=1&%2Aentries%2A=0,2,2
Ray-Ban Classic Clubmaster,"Clothing, Shoes & Jewelry",https://www.amazon.com/Ray-Ban-Classic-Clubmaster-Sunglasses-Non-Polarized/dp/B001GNBJQO,2,2
"Navali Leather Mainstay Computer Messenger Bag, Brown","Clothing, Shoes & Jewelry",https://www.amazon.com/Navali-Leather-Mainstay-Messenger-Brown/dp/B00ANS7WQO/ref=sr_1_1?s=apparel&amp;ie=UTF8&amp;qid=1436986796&amp;sr=1-1,2,2
"AmazonBasics Wood Suit Hangers - 30 Pack, Natural",Home & Kitchen,https://www.amazon.com/AmazonBasics-Wood-Suit-Hangers-Natural/dp/B018YLFNUS/ref=sr_1_4?s=storageorganization&amp;ie=UTF8&amp;qid=1492608218&amp;sr=1-4&amp;keywords=wood+hangers,2,2
Timex Men's Highland Street Watch,"Clothing, Shoes & Jewelry",https://www.amazon.com/gp/product/B00B2I16D4?psc=1&amp;redirect=true&amp;ref_=oh_aui_detailpage_o01_s00,2,2
"Instant Pot DUO60 6 Qt 7-in-1 Multi-Use Programmable Pressure Cooker, Slow Cooker, Rice Cooker, Steamer, Sauté, Yogurt Maker and Warmer",Home & Kitchen,https://www.amazon.com/gp/product/B00FLYWNYQ/ref=oh_aui_detailpage_o00_s00?ie=UTF8&amp;psc=1,25,1
Sennheiser HD 598 Special Edition Over-Ear Headphones - Black,Electronics,https://www.amazon.com/gp/product/B0126HISOO?qid=1448618808&amp;ref_=lp_13227331011_1_2&amp;s=electronics&amp;sr=1-2,15,1
"Casio Men's EF503D-1AV ""Edifice"" Stainless Steel Watch","Clothing, Shoes & Jewelry",https://www.amazon.com/Casio-EF503D-1AV-Edifice-Stainless-Steel/dp/B003URWNOG?ie=UTF8&amp;psc=1&amp;redirect=true&amp;ref_=ox_sc_sfl_title_3&amp;smid=ATVPDKIKX0DER,12,1
Seiko Men's SNK803 Seiko 5 Automatic Watch with Beige Canvas Strap,"Clothing, Shoes & Jewelry",https://www.amazon.com/dp/B000G6R7B8/ref=wl_it_dp_o_pC_nS_ttl?_encoding=UTF8&amp;colid=14M2JT2IWOPD7&amp;coliid=I1M1T3NS8N768C,8,1
Casio Men's  A158WA-1DF Digital Watch,"Clothing, Shoes & Jewelry",https://www.amazon.com/Casio-Mens-A158WA-1DF-Digital-Watch/dp/B000GAYQJ0/ref=pd_sim_241_1?_encoding=UTF8&amp;pd_rd_i=B000GAYQJ0&amp;pd_rd_r=9CA9PC425FJW1YZ3Z17Z&amp;pd_rd_w=DpPOo&amp;pd_rd_wg=rpo0Y&amp;psc=1&amp;refRID=9CA9PC425FJW1YZ3Z17Z,7,1
Panasonic ErgoFit In-Ear Earbuds Headphones with Mic/Controller RP-TCM125-K (Black),Electronics,https://www.amazon.com/Panasonic-RPTCM125K-Headphones-Black/dp/B00E4LGVUO,6,1
Seiko Men's SNK805 Seiko 5 Automatic Stainless Steel Watch with Green Canvas,"Clothing, Shoes & Jewelry",https://www.amazon.com/Seiko-SNK805-Automatic-Stainless-Canvas/dp/B000LTAY1U/,5,1
Simplicity Unisex Timelessly Classic Manhattan Fedora Hat,Sports & Outdoors,https://www.amazon.com/Fedora-Hats-Unisex-Manhattan-Black/dp/B00EQWP8I2/ref=redir_mobile_desktop?_encoding=UTF8&amp%3BdpID=41BeMmTgKnL&amp%3BdpPl=1&amp%3Bkeywords=mens%20manhattan%20fedora&amp%3Bpi=AC_SX200_QL40&amp%3Bref=plSrch&amp%3Bsr=8-1&qid=1436967046&ref_=mp_s_a_1_1,4,1
Clarks Men's Bushacre 2 Desert Boot,"Clothing, Shoes & Jewelry",https://www.amazon.com/Clarks-Bushacre-Beeswax-Leather-US/dp/B004DCNN64,4,1
"Crock-Pot 6-Quart Programmable Cook & Carry Slow Cooker with Digital Timer, Stainless Steel , SCCPVL610-S",Home & Kitchen,https://www.amazon.com/Crock-Pot-SCCPVL610-S-Programmable-Carry-Cooker/dp/B004P2NG0K/ref=sr_1_1?s=kitchen&amp;ie=UTF8&amp;qid=1436974663&amp;sr=1-1&amp;keywords=crock+pot&amp;pebp=1436974664912&amp;perid=1P57DTEWPKTXNQFDAR21,4,1
Timex Men's Easy Reader Date Leather Strap Watch,"Clothing, Shoes & Jewelry",https://www.amazon.com/gp/product/B000AYYIYU?psc=1&amp;redirect=true&amp;ref_=oh_aui_detailpage_o02_s00,4,1
Timex Unisex TW2P62400 Weekender Chrono Oversize Blue/Cream/Brown Striped Slip-Thru Nylon Strap Watch,"Clothing, Shoes & Jewelry",https://www.amazon.com/Timex-Unisex-TW2P624009J-Weekender-Display/dp/B00QIJ6HW2/ref=lp_12730422011_1_5?m=ATVPDKIKX0DER&amp;s=apparel&amp;ie=UTF8&amp;qid=1450096783&amp;sr=1-5&amp;nodeID=12730422011,3,1
Bulova Men's 96B104 Stainless Steel Dress Watch,"Clothing, Shoes & Jewelry",https://www.amazon.com/Bulova-96B104-Silver-Dress-Watch/dp/B002IDTUHG/ref=sr_1_3?s=apparel&amp;ie=UTF8&amp;qid=1425346894&amp;sr=1-3&amp;keywords=bulova,3,1
Red Wing Heritage Iron Ranger 6-Inch Boot,"Clothing, Shoes & Jewelry",https://www.amazon.com/Red-Wing-Heritage-Iron-Ranger/dp/B001IOETP4/ref=sr_1_1?ie=UTF8&amp;qid=1503835818&amp;sr=8-1&amp;keywords=red,3,1
"Orient Bambino Automatic Dress Watch with Cream Dial, Vibrant Blue Hands ER2400CN","Clothing, Shoes & Jewelry",https://www.amazon.com/Orient-Bambino-Automatic-Vibrant-ER2400CN/dp/B00QM178B0,3,1
Orient Men's ER27006B Classic Automatic Watch,"Clothing, Shoes & Jewelry",https://www.amazon.com/Orient-ER27006B-Classic-Automatic-Watch/dp/B00A6GFBW0,3,1
"Thorogood Men's 814-4200 American Heritage 6"" Moc Toe Boot","Clothing, Shoes & Jewelry",https://www.amazon.com/gp/product/B001QJA6EO?psc=1&amp;redirect=true&amp;ref_=oh_aui_detailpage_o00_s00,3,1
Dockers Men's Alpha Khaki Pant,"Clothing, Shoes & Jewelry",https://www.amazon.com/Dockers-Mens-Alpha-Khaki-Pant/dp/B004VQ9APK,3,1
Orient Men's CEM65005D 'Blue Mako' Automatic Dive Watch With Black Rubber Band,"Clothing, Shoes & Jewelry",https://www.amazon.com/Orient-CEM65005D-Automatic-Rubber-Strap/dp/B001EWEQ4Y/ref=sr_1_6?s=apparel&amp;ie=UTF8&amp;qid=1445379945&amp;sr=1-6&amp;nodeID=7141123011&amp;keywords=orient+mako,3,1
Chippewa Apache Lace-Up Boot,"Clothing, Shoes & Jewelry",https://www.amazon.com/Chippewa-20080-M-Apache-Lace-Up-Boot/dp/B004TK2RPS,3,1
Tile (Gen 2) - Phone Finder. Key Finder. Item Finder  - 1 Pack (Discontinued by Manufacturer),Cell Phones & Accessories,https://www.amazon.com/Tile-Gen-Finder-Discontinued-Manufacturer/dp/B011HT9AL2/ref=redir_mobile_desktop?_encoding=UTF8&amp%3BdpID=41DWrjNpgXL&amp%3BdpPl=1&amp%3Bkeywords=tile%20tracker&amp%3Bpi=SY200_QL40&amp%3Bqid=1467454445&amp%3Bref=plSrch&amp%3Bsr=8-1&ref_=mp_s_a_1_1,3,1
Tarrago Hightech Nano Protector Spray 250 Ml,"Clothing, Shoes & Jewelry",https://www.amazon.com/Tarrago-Hightech-Nano-Protector-Spray/dp/B003U47QBY,3,1
"Safe Cut Can Opener by GoodCook 11834 – Easy Open, Manual Side Cut Can Opener – Ergonomic, Durable Design w/Safety Mechanism: Prevents Sharp Edges –, Kitchen-Safe, Rust-Resistant Chrome",Home & Kitchen,https://www.amazon.com/gp/product/B000AX13US?psc=1&amp;redirect=true&amp;ref_=oh_aui_detailpage_o00_s00,3,1
Timex Unisex Weekender Analog Quartz Watch,"Clothing, Shoes & Jewelry",https://www.amazon.com/Timex-Unisex-T2N654-Weekender-Watch/dp/B004VR9J0A/ref=pd_sim_241_3?ie=UTF8&amp;dpID=51,2,1
40 Metal Collar Stays in a Clear Plastic Box - 5 Sizes,"Clothing, Shoes & Jewelry",https://www.amazon.com/gp/product/B004L8J0C6/ref=oh_aui_search_detailpage?ie=UTF8&amp;psc=1,2,1
"Chippewa Men's 6"" 20067 Lace Up Boot","Clothing, Shoes & Jewelry",https://www.amazon.com/Chippewa-Mens-20067-Lace-Boot/dp/B00413PVOC,2,1
Timex Men's  TW2P72300 Weekender Reversible Gray/Blue Stripe Nylon Slip-Thru Strap Watch,"Clothing, Shoes & Jewelry",https://www.amazon.com/Timex-TW2P72300-Weekender-Reversible-Slip-Thru/dp/B00YTY9F3Q/ref=sr_1_4?s=apparel&amp;ie=UTF8&amp;qid=1481994659&amp;sr=1-4&amp;nodeID=7141123011&amp;keywords=timex+weekender,2,1
Timex Weekender Oversized Vintage-Style Watch,"Clothing, Shoes & Jewelry",https://www.amazon.com/Timex-TW2P85800-Weekender-Titanium-Tone-Slip-Thru/dp/B01F8V3Q1U/ref=pd_sim_241_3?_encoding=UTF8&amp;pd_rd_i=B01F8V3Q1U&amp;pd_rd_r=1M9BDK4V1NAFYWY63J28&amp;pd_rd_w=TbOIx&amp;pd_rd_wg=N4UUQ&amp;refRID=1M9BDK4V1NAFYWY63J28&amp;th=1,2,1
Bella Canvas Unisex Triblend S/S Tee,Sports & Outdoors,https://www.amazon.com/Bella-Canvas-Unisex-Triblend-Tee/dp/B0055NT1MK,2,1
Timex Men's Expedition Scout 40 Watch,"Clothing, Shoes & Jewelry",https://www.amazon.com/Timex-T49962-Expedition-Scout-Nylon/dp/B00HYUSTZ2/ref=redir_mobile_desktop?_encoding=UTF8&amp%3Bkeywords=timex%20expedition&amp%3Bpi=SY200_QL40&amp%3Bpsc=1&amp%3Bsr=8-1&amp%3Bth=1&qid=1455098765&ref_=mp_s_a_1_1,2,1
"Orient Bambino Automatic Dress Watch with White Dial, Roman Numeral Markers ER2400BW","Clothing, Shoes & Jewelry",https://www.amazon.com/Orient-Bambino-Automatic-Numeral-ER2400BW/dp/B00MVPB7UO,2,1
Timex Men's Easy Reader Day-Date Expansion Band Watch,"Clothing, Shoes & Jewelry",https://www.amazon.com/gp/product/B000B5459Q?psc=1&amp;redirect=true&amp;ref_=oh_aui_detailpage_o00_s00,2,1
Hadley-Roma Men's Genuine Leather Watch Strap,"Clothing, Shoes & Jewelry",https://www.amazon.com/Hadley-Roma-MSM906RA-220-22-mm-Genuine-Leather/dp/B002EEP5WI,2,1
Voguestrap TX77720BN Allstrap 20mm Brown Regular-Length Genuine-Leather Contrast-Stitch Watch Band,"Clothing, Shoes & Jewelry",https://www.amazon.com/Voguestrap-TX77720BN-Regular-Length-Leather-Contrast-Watchband/dp/B003U9BXPY/ref=sr_1_7?ie=UTF8&amp;qid=1425354103&amp;sr=8-7&amp;keywords=20mm+leather+strap,2,1
Timex TWG012800QM Analog Quartz Brass Brown & Blue Weekender Watch,"Clothing, Shoes & Jewelry",https://www.amazon.com/Timex-TWG012800QM-Analog-Quartz-Weekender/dp/B01GI8SU5O/ref=swr_wa_3_ses,2,1
"Layrite Cement Matte Hair Clay, 4.25 oz.",Beauty & Personal Care,https://www.amazon.com/Layrite-Cement-Matte-Hair-Clay/dp/B00UM4ZDCY/ref=sr_1_4_a_it?ie=UTF8&amp;qid=1500060626&amp;sr=8-4&amp;keywords=layright,2,1
Dickies Men's 6 Pack Cushion Crew Socks,"Clothing, Shoes & Jewelry",https://www.amazon.com/Dickies-Mens-Cushion-Socks-White/dp/B00BU9T0BA/ref=redir_mobile_desktop?_encoding=UTF8&amp%3BdpID=41kNsyhAOFL&amp%3BdpPl=1&amp%3Bkeywords=plain%20white%20socks&amp%3Bpi=AC_SX236_SY340_QL65&amp%3Bqid=1498417992&amp%3Bref=plSrch&amp%3Bsr=8-1&ref_=mp_s_a_1_1,1,1
Under Armour Men's Original Series 6” Boxerjock,Sports & Outdoors,https://www.amazon.com/Under-Armour-Mens-Original-Boxerjock/dp/B005CR5GK0?th=1&amp;psc=1,1,1
Perry Ellis Men's Corduroy Fedora,"Clothing, Shoes & Jewelry",https://www.amazon.com/dp/B008X25B74/ref=cm_sw_r_fa_awdo_mmHtwb09W7DQE,1,1
Champion Men's Powerblend Fleece Pullover Hoodie,"Clothing, Shoes & Jewelry",https://www.amazon.com/Champion-Powerblend-Pullover-Hoodie-Black/dp/B01HIUTCW6,1,1
grinderPUNCH Polarized Wayfarer Inspired Sunglasses Great for Driving,"Clothing, Shoes & Jewelry",https://www.amazon.com/grinderPUNCH-Polarized-Wayfarer-Inspired-Sunglasses/dp/B00NY682ZM/ref=redir_mobile_desktop?_encoding=UTF8&ref_=ya_aw_oh_pii,1,1
N6210 Next Level Men's CVC Crew,"Clothing, Shoes & Jewelry",https://www.amazon.com/dp/B00I2PWBFC/,1,1
Deep Blue 'Papa Praesto' Automatic Stainless Steel and Black Leather Aviator Watch (Model: ABPPSSGREEN),"Clothing, Shoes & Jewelry",https://www.amazon.com/Deep-Blue-Praesto-Automatic-Stainless/dp/B00P2POEGE/ref=sr_1_1?ie=UTF8&amp;qid=1479473525&amp;sr=8-1&amp;keywords=praesto,1,1
N6210 Next Level Men's CVC Crew,"Clothing, Shoes & Jewelry",https://www.amazon.com/Next-Level-CVC-Crew-CHARCOAL/dp/B004OWML5C/ref=sr_1_1?ie=UTF8&amp;qid=1496889328&amp;sr=8-1&amp;keywords=next+level+t+shirt,1,1
Timex Weekender Rip-Stop Water Resistant Analog Watch w/ Slip-Thru Strap,"Clothing, Shoes & Jewelry",https://www.amazon.com/Timex-Unisex-TW2P657009J-Weekender-Silver-Tone/dp/B00PUDQDSU/ref=pd_sim_241_5?ie=UTF8&amp;dpID=5131ZwZmoML&amp;dpSrc=sims&amp;preST=_AC_UL160_SR87,1,1
Canvas Men's Triblend V-Neck T-Shirt 3415,Sports & Outdoors,https://www.amazon.com/Bella-Canvas-Unisex-Sleeve-Charcoal-Black-Triblend/dp/B007M676WA/ref=sr_1_2?s=sporting-goods&amp;ie=UTF8&amp;qid=1494424915&amp;sr=1-2&amp;keywords=bella+canvas+triblend,1,1
Nautica Men's Herringbone Walker Coat with Bib,"Clothing, Shoes & Jewelry",https://www.amazon.com/Nautica-Herringbone-Walker-Charcoal-X-Large/dp/B00LIRZ34C/ref=sr_1_15?m=ATVPDKIKX0DER&amp;s=apparel&amp;ie=UTF8&amp;qid=1453995339&amp;sr=1-15&amp;nodeID=1045830&amp;refinements=p_6,1,1
Timex Men's TW2P64700ZA The Waterbury Analog Display Analog Quartz Brown Watch,"Clothing, Shoes & Jewelry",https://www.amazon.com/Timex-TW2P64700ZA-Waterbury-Analog-Display/dp/B014X25GTA,1,1
Champion Men's Cross Train Pant,"Clothing, Shoes & Jewelry",https://www.amazon.com/gp/product/B01ALNXXC2/ref=oh_aui_detailpage_o01_s00?ie=UTF8&amp;psc=1,1,1
"Fine Clutter Brushed Nickel Pawn Style  Fridge Magnets, Office Magnets, Dry Erase Board Magnets, Refrigerator Magnets, Whiteboard, Map, Magnetic Pins (Pack of 40)",Office Products,https://www.amazon.com/Fine-Clutter-Refrigerator-Whiteboard-Magnetic/dp/B01M0XJD3O/ref=pd_bxgy_79_3?_encoding=UTF8&amp;pd_rd_i=B01M0XJD3O&amp;pd_rd_r=YXDGWDSZ9287CRXP0063&amp;pd_rd_w=wCEFD&amp;pd_rd_wg=DLWHZ&amp;psc=1&amp;refRID=YXDGWDSZ9287CRXP0063,1,1
Bella Canvas Unisex Triblend S/S Tee,"Clothing, Shoes & Jewelry",https://www.amazon.com/Bella-Canvas-Unisex-Sleeve-Charcoal-Black-Triblend/dp/B01NCRFPXY/,1,1
"Dockers Men's Snowflake Crew-Neck Sweater, Red, Small","Clothing, Shoes & Jewelry",https://www.amazon.com/Dockers-Mens-Snowflake-Crew-Neck-Sweater/dp/B00LCVWXZQ/ref=redir_mobile_desktop?_encoding=UTF8&%2AVersion%2A=1&%2Aentries%2A=0,1,1
Dockers Men's Reindeer and Snowflake Crew Sweater,"Clothing, Shoes & Jewelry",https://www.amazon.com/Dockers-Mens-Reindeer-Snowflake-Sweater/dp/B00LCVWY9Q/ref=redir_mobile_desktop?_encoding=UTF8&%2AVersion%2A=1&%2Aentries%2A=0,1,1
"Haggar Men's Big-Tall Short Sleeve Mini Grid 2 Button Polyester Polo, Spit Fire, Large/Tall","Clothing, Shoes & Jewelry",https://www.amazon.com/Haggar-Big-Tall-Sleeve-Button-Polyester/dp/B00UL95JKQ/?psc=1,1,1
adidas Men's Originals Stan Smith Sneaker,"Clothing, Shoes & Jewelry",https://www.amazon.com/adidas-Mens-Originals-Smith-Sneaker/dp/B00J5ILOMG/ref=ya_od_pd_dx_gc_1?_encoding=UTF8&amp;pd_rd_i=B01DEDRI40&amp;pd_rd_r=8GEJ0GQBAPEWFYA7WR57&amp;pd_rd_w=4PpHK&amp;pd_rd_wg=Pqr6c&amp;refRID=8GEJ0GQBAPEWFYA7WR57&amp;th=1&amp;psc=1,1,1
Persol Mens Sunglasses (PO2747) Acetate,"Clothing, Shoes & Jewelry",https://www.amazon.com/gp/product/B00MKH3WVK,1,1
Levi's Men's 511 Slim-Fit Stretch Jean,"Clothing, Shoes & Jewelry",https://www.amazon.com/Levis-White-Stretch-Timberwolf-34x30/dp/B00WLLUYL6/ref=redir_mobile_desktop?_encoding=UTF8&amp%3Bm=ATVPDKIKX0DER&amp%3Brefinements=p_6&amp%3Bsr=1-421&qid=1444151184&ref_=mp_s_a_1_421,1,1
Hanes Men's Classics 6 Pack Crew Neck Tee,"Clothing, Shoes & Jewelry",https://www.amazon.com/Hanes-Mens-Ultimate-White-Large/dp/B00ACIFP64/ref=redir_mobile_desktop?_encoding=UTF8&amp%3Bm=ATVPDKIKX0DER&amp%3Brefinements=p_6&amp%3Bsr=1-25&qid=1444150493&ref_=mp_s_a_1_25,1,1
"Hanes Men's 10 Pack Ultimate No Show Socks, White, Sock Size: 10-13/Shoe Size:9-11 (Shoe Size Sock Size: 10-13/Shoe Size:9-11)","Clothing, Shoes & Jewelry",https://www.amazon.com/Hanes-Mens-Ultimate-Socks-White/dp/B00FBD2G1C/ref=redir_mobile_desktop?_encoding=UTF8&amp%3Bm=ATVPDKIKX0DER&amp%3Brefinements=p_6&amp%3Bsr=1-247&qid=1444150946&ref_=mp_s_a_1_247,1,1
Hanes Mens White V-Neck T 6-Pack (777VP6),"Clothing, Shoes & Jewelry",https://www.amazon.com/Hanes-6-Pack-FreshIQ-V-Neck-T-Shirt/dp/B00LSRU1QW/ref=redir_mobile_desktop?_encoding=UTF8&amp%3Bm=ATVPDKIKX0DER&amp%3Brefinements=p_6&amp%3Bsr=1-75&qid=1444150722&ref_=mp_s_a_1_75,1,1
adidas Men's  Essential Logo Tapered Pants,Sports & Outdoors,https://www.amazon.com/adidas-Mens-Essential-Tapered-Pants/dp/B01HNQ1OX0,1,1
Dockers Men's Alpha Khaki Pant,"Clothing, Shoes & Jewelry",https://www.amazon.com/Dockers-Mens-Alpha-Khaki-Hurricane/dp/B00B2IQJOA/ref=redir_mobile_desktop?_encoding=UTF8&amp%3Bm=ATVPDKIKX0DER&amp%3Brefinements=p_6&amp%3Bsr=1-49&qid=1444150637&ref_=mp_s_a_1_49,1,1
PF Flyers Men's Center Hi Sneaker,"Clothing, Shoes & Jewelry",https://www.amazon.com/PF-Flyers-Center-Hi-Sneaker/dp/B00BYI9RPQ/ref=sr_1_1?ie=UTF8&amp;qid=1422239495&amp;sr=8-1&amp;keywords=pf+flyers,1,1
Chippewa Mens Limited Edition Leather Service Casual Boots,"Clothing, Shoes & Jewelry",https://www.amazon.com/Chippewa-Limited-Lace-Up-Oxblood-Service/dp/B01BS8SIV0,1,1
N6210 Next Level Men's CVC Crew,"Clothing, Shoes & Jewelry",https://www.amazon.com/N6210-Next-Level-Mens-Charcoal/dp/B008LTLRFO/ref=sr_1_cc_1?s=aps&amp;ie=UTF8&amp;qid=1427652831&amp;sr=1-1-catcorr&amp;keywords=next+level+cvc,1,1
N6210 Next Level Men's CVC Crew,"Clothing, Shoes & Jewelry",https://www.amazon.com/gp/product/B006LDYEX4/ref=oh_aui_detailpage_o03_s00?ie=UTF8&amp;psc=1,1,1
J Crew,"Clothing, Shoes & Jewelry",https://www.amazon.com/New-Balance-CT791JC4-Mens-Ct791jc4/dp/B01MRN4RZR,1,1
Levi's Men's 511 Slim Fit Jean,"Clothing, Shoes & Jewelry",https://www.amazon.com/Levis-Mens-Black-Stretch-32x32/dp/B00405W432/ref=sr_1_1?s=apparel&amp;ie=UTF8&amp;qid=1477243032&amp;sr=1-1&amp;nodeID=7147441011&amp;keywords=Levi's,1,1
Wolverine 1000 Mile Men's Wesley Lace Up Wingtip Chukkas,"Clothing, Shoes & Jewelry",https://www.amazon.com/Wolverine-Wesley-Black-Chukka-Boots/dp/B00NI1QPMK/ref=sr_1_3?ie=UTF8&amp;qid=1494402302&amp;sr=8-3&amp;keywords=Wolverine+1000+Mile+Wesley+Wingtip+Chukka+Boots,1,1
Champion Men's Powerblend Fleece Full-Zip Hoodie,"Clothing, Shoes & Jewelry",https://www.amazon.com/dp/B01HIUTK2I/ref=twister_B01HIURPPW?th=1&amp;psc=1,1,1
adidas Men's Tiro 15 Training Pant,Sports & Outdoors,https://www.amazon.com/dp/B00LOU4TFC/ref=twister_dp_update?_encoding=UTF8&amp;th=1&amp;psc=1,1,1
Cole Haan Men's Grant Escape Slip-On Loafer,"Clothing, Shoes & Jewelry",https://www.amazon.com/dp/B00N18080A,1,1
Navali Boatswain Waxed Canvas & Leather Messenger Bag,"Clothing, Shoes & Jewelry",https://www.amazon.com/Navali-Boatswain-Canvas-Leather-Messenger/dp/B00M4GIJ5Q,1,1
Timex Kids' TW7B998009J My First Timex Silver-Tone Watch with Blue Nylon Band,"Clothing, Shoes & Jewelry",https://www.amazon.com/Timex-TW7B998009J-First-Silver-Tone-Watch/dp/B00MLXG8WI,1,1
3539-01 Boccia Titanium Watch,"Clothing, Shoes & Jewelry",https://www.amazon.com/gp/product/B002YHP2CI,1,1
Nautica Men's Melton Double-Breasted Peacoat,"Clothing, Shoes & Jewelry",https://www.amazon.com/Nautica-Melton-Peacoat-Black-Medium/dp/B00LIRZU22/ref=sr_1_6?m=ATVPDKIKX0DER&amp;s=apparel&amp;ie=UTF8&amp;qid=1447087543&amp;sr=1-6&amp;nodeID=1040658&amp;refinements=p_6,1,1
Kenneth Cole New York Men's Wool-Blend Coat with Bib,"Clothing, Shoes & Jewelry",https://www.amazon.com/Kenneth-Cole-New-York-Wool-Blend/dp/B01082KYVE/ref=sr_1_32?m=ATVPDKIKX0DER&amp;s=apparel&amp;ie=UTF8&amp;qid=1447087337&amp;sr=1-32&amp;nodeID=1040658&amp;refinements=p_6,1,1
Ray-Ban RB2132 New Wayfarer Non Polarized Sunglasses,"Clothing, Shoes & Jewelry",https://www.amazon.com/gp/product/B001UQ71GE?psc=1&amp;redirect=true&amp;ref_=od_aui_detailpages00,1,1
Nocona Boots Men's Legacy L Toe Boot,"Clothing, Shoes & Jewelry",https://www.amazon.com/gp/product/B009QY4L38?&amp;ref_=gb1h_img_c-2_0222_ccffff9f&amp;smid=ATVPDKIKX0DER,1,1
adidas Performance Men's Ultra Boost M Running Shoe,"Clothing, Shoes & Jewelry",https://www.amazon.com/dp/B00ZY6J312/ref=twister_B00WW7JCCG,1,1
prAna Men's Wyatt Pants,Sports & Outdoors,https://www.amazon.com/prAna-Mens-Wyatt-Pants-Size/dp/B01H2D8FLS/ref=sr_1_1?ie=UTF8&amp;qid=1499362318&amp;sr=8-1&amp;keywords=prana,1,1
Red Wing Heritage Iron Ranger 6-Inch Boot,"Clothing, Shoes & Jewelry",https://www.amazon.com/Red-Wing-Heritage-Iron-Ranger/dp/B007XOPTY8/,1,1
Nocona Boots Men's Legacy L Toe Boot,"Clothing, Shoes & Jewelry",https://www.amazon.com/Nocona-Boots-Mens-Legacy-Boot/dp/B009QY40XE/ref=cts_sh_1_fbt,1,1
adidas Men's Springblade Running Shoe,"Clothing, Shoes & Jewelry",https://www.amazon.com/adidas-Springblade-Running-Metallic-Silver/dp/B00FS41XTU/ref=sr_1_45?m=ATVPDKIKX0DER&amp;s=apparel&amp;ie=UTF8&amp;qid=1428507982&amp;sr=1-45,1,1
Smiffy's Men's Clown Shoes Deluxe,"Clothing, Shoes & Jewelry",https://www.amazon.com/Smiffys-Clown-Shoes-Deluxe-Multi/dp/B000IHDEEO/ref=sr_1_2?s=apparel&amp;ie=UTF8&amp;qid=1436979045&amp;sr=1-2&amp;keywords=clown+shoes,1,1
Converse Unisex Chuck Taylor All Star Low Top Sneakers,"Clothing, Shoes & Jewelry",https://www.amazon.com/Converse-Unisex-Taylor-Optical-Sneakers/dp/B01M97TJYK/ref=sr_1_1?ie=UTF8&amp;qid=1502395492&amp;sr=8-1&amp;keywords=converse,1,1
Orient Men's CEM65004B Black Mako Stainless Steel Automatic Watch with Black Rubber Band,"Clothing, Shoes & Jewelry",https://www.amazon.com/Orient-CEM65004B-Stainless-Automatic-Rubber/dp/B001EWEQ4E/ref=sr_1_3?s=apparel&amp;ie=UTF8&amp;qid=1453315622&amp;sr=1-3&amp;nodeID=7141123011&amp;keywords=orient+mako,1,1
Alternative Mens Basic Crew combed cotton t-shirt,"Clothing, Shoes & Jewelry",https://www.amazon.com/AA-MENS-BASIC-TEE-MIDNIGHT/dp/B004JUNGJO/ref=sr_1_14?s=apparel&amp;ie=UTF8&amp;qid=1434997634&amp;sr=1-14&amp;refinements=p_lbr_brands_browse-bin,1,1
Levi's Men's Washed Cotton Sherpa Lined Parka with Removable Faux Fur Trim,"Clothing, Shoes & Jewelry",https://www.amazon.com/Levis-Washed-Cotton-Sherpa-Removable/dp/B01EH0YKT0/ref=sr_1_1?ie=UTF8&amp;qid=1485717968&amp;sr=8-1&amp;keywords=levi+SHERPA+LINED+PARKA+JACKET,1,1
Nautica Men's Melton Double-Breasted Peacoat,"Clothing, Shoes & Jewelry",https://www.amazon.com/gp/product/B00LIRZYJQ/ref=ox_sc_act_title_2?ie=UTF8&amp;psc=1&amp;smid=ATVPDKIKX0DER,1,1
Timex Men's TW2P72100 Weekender Reversible Green/Tan Stripe Nylon Slip-Thru Strap Watch,"Clothing, Shoes & Jewelry",https://www.amazon.com/Timex-TW2P72100-Weekender-Reversible-Slip-Thru/dp/B00YTY9BYE/ref=sr_1_29?s=apparel&amp;ie=UTF8&amp;qid=1481994659&amp;sr=1-29&amp;nodeID=7141123011&amp;keywords=timex+weekender,1,1
Levi's Men's 510 Skinny-Fit Jean,"Clothing, Shoes & Jewelry",https://www.amazon.com/gp/product/B00C7XNAF0?ref_=ox_sc_act_title_1&amp;redirect=true&amp;smid=ATVPDKIKX0DER&amp;psc=1&amp;pldnSite=1,1,1
"Yves Saint Laurent L'homme Sport Eau de Toilette Spray for Men, 2.0 Ounce",Beauty & Personal Care,https://www.amazon.com/Yves-Saint-Laurent-Lhomme-Toilette/dp/B00JXMSEB8,1,1
Levi's Men's 511 Slim Fit Jean,"Clothing, Shoes & Jewelry",https://www.amazon.com/Levis-Mens-Slim-Rigid-Dragon/dp/B00405XYVS/ref=sr_1_1?s=apparel&amp;ie=UTF8&amp;qid=1499788209&amp;sr=1-1&amp;nodeID=7141123011&amp;psd=1&amp;keywords=levis,1,1
CLARKS Men's Desert Mali Chukka Boot,"Clothing, Shoes & Jewelry",https://www.amazon.com/Clarks-Mens-Desert-Chukka-Bronze/dp/B00V9S30KY/ref=sr_1_1?ie=UTF8&amp;qid=1500835440&amp;sr=8-1&amp;keywords=mens,1,1
H2H Mens Casual Slim Fit Short Sleeve Henley T-shirts,"Clothing, Shoes & Jewelry",https://www.amazon.com/gp/product/B00DI2SKXG/ref=s9_acsd_hps_bw_c_x_7_w,1,1
H2H Mens Casual Slim Fit Basic Henley Long Sleeve T-shirt,"Clothing, Shoes & Jewelry",https://www.amazon.com/gp/product/B00DMZFM80/ref=oh_aui_detailpage_o03_s00?ie=UTF8&amp;psc=1,1,1
H2H Mens Casual Slim Fit Henley Shirts With Bound Pocket of Waffle Cotton,"Clothing, Shoes & Jewelry",https://www.amazon.com/H2H-Pocket-Henley-Shirts-KMTTL062/dp/B00JR2NB0I/ref=lp_6930371011_1_13?srs=6930371011&amp;ie=UTF8&amp;qid=1504156023&amp;sr=8-13,1,1
CLARKS Men's Desert Mali Chukka Boot,"Clothing, Shoes & Jewelry",https://www.amazon.com/Clarks-Mens-Desert-Chukka-Bronze/dp/B01AAVJJCI/ref=sr_1_1?ie=UTF8&amp;qid=1500835440&amp;sr=8-1&amp;keywords=mens,1,1
Tissot Men's TIST0194301605101 Visodate Black Dial Watch,"Clothing, Shoes & Jewelry",https://www.amazon.com/Tissot-TIST0194301605101-Visodate-Black-Watch/dp/B003L2EEGU/ref=sr_1_27?s=apparel&amp;ie=UTF8&amp;qid=1454727116&amp;sr=1-27&amp;nodeID=7147441011&amp;refinements=p_89,1,1
H2H Mens Casual Henley Slim Fit Long Sleeve T Shirts Of Waffle Cotton,"Clothing, Shoes & Jewelry",https://www.amazon.com/H2H-Casual-Henley-Sleeve-Shirts/dp/B013HEUW1M/ref=pd_sbs_193_1?_encoding=UTF8&amp;refRID=MFGK93BDNSKPB1PRR20A,1,1
Working Person's 689 Black 4-Pack Merino Wool Hiking Socks - Made In The USA,"Clothing, Shoes & Jewelry",https://www.amazon.com/Working-Persons-4-Pack-Merino-Hiking/dp/B01DPZQC8A/ref=sr_1_7?ie=UTF8&amp;qid=1502918260&amp;sr=8-7&amp;keywords=made+in+usa+wool+socks,1,1
