name,category,amazon_link,total_mentions,subreddit_mentions
American Apparel Men's Unisex Flex Fleece Zip Hoodie,"Clothing, Shoes & Jewelry",https://www.amazon.com/American-Apparel-Unisex-Fleece-Hoodie/dp/B00GKF3QIC/ref=sr_1_1?ie=UTF8&amp;qid=1460826582&amp;sr=8-1&amp;keywords=american+apparel+hoodie,1,1
American Apparel Men's Baby Thermal Long Sleeve Henley,"Clothing, Shoes & Jewelry",https://www.amazon.com/American-Apparel-Thermal-Sleeve-Henley/dp/B00719WYOI/ref=sr_1_1?ie=UTF8&amp;qid=1460826495&amp;sr=8-1&amp;keywords=american+apparel+henley,1,1
Florsheim Men's Woodard Cedar Shoe Tree,"Clothing, Shoes & Jewelry",https://www.amazon.com/Florsheim-Woodard-Cedar-Shoe-Tree/dp/B0057UCYNO/ref=sr_1_3?s=apparel&amp;ie=UTF8&amp;qid=1468674561&amp;sr=1-3&amp;nodeID=3421050011&amp;keywords=shoe+tree,1,1
Timex Grand Street Watch,"Clothing, Shoes & Jewelry",https://www.amazon.com/gp/product/B00LW3R3SG/ref=pd_lpo_sbs_dp_ss_1?pf_rd_p=1944687602&amp;pf_rd_s=lpo-top-stripe-1&amp;pf_rd_t=201&amp;pf_rd_i=B00LPRSKPO&amp;pf_rd_m=ATVPDKIKX0DER&amp;pf_rd_r=0MYF62GZHPTHR9KRPAC3,1,1
2pk Men's or Women's Mountain Lodge 80% Merino Wool Socks Thermal Hiking Crew,"Clothing, Shoes & Jewelry",https://www.amazon.com/Womens-Mountain-Lodge-Merino-Thermal/dp/B00RPPEZS6?sa-no-redirect=1,1,1
Citizen Men's CA4210-24E Stainless Steel Eco-Drive Watch with Brown Band,"Clothing, Shoes & Jewelry",https://www.amazon.com/Citizen-CA4210-24E-Stainless-Steel-Eco-Drive/dp/B00UMD8KQ6/ref=redir_mobile_desktop?_encoding=UTF8&amp%3Bkeywords=ca4210-24e&amp%3Bpi=AC_SX236_SY340_FMwebp_QL65&amp%3Bsr=8-1&qid=1455099041&ref_=mp_s_a_1_1,1,1
David Carey Flames Camp Shirt (3XL),"Clothing, Shoes & Jewelry",https://www.amazon.com/David-Carey-Mens-Flames-Shirt/dp/B00DWGBB20/ref=cts_ap_3_vtp,1,1
Let My People Go Surfing: The Education of a Reluctant Businessman,Books,https://www.amazon.com/Let-People-Surfing-Education-Businessman/dp/0143037838,1,1
Oakley Men's Breadbox Sport Sunglasses,"Clothing, Shoes & Jewelry",https://www.amazon.com/Oakley-Breadbox-OO9199-01-Sport-Sunglasses/dp/B00EYVR2T8,1,1
"Puma Court Classic Sneaker,White/Black,9 US/10.5 D US","Clothing, Shoes & Jewelry",https://www.amazon.com/Court-Classic-Sneaker-White-Black/dp/B0077CLF9E/ref=sr_1_424?m=AG670YE9WDQRF&amp;s=shoes&amp;ie=UTF8&amp;qid=1472440584&amp;sr=1-424&amp;keywords=puma&amp;refinements=p_89,1,1
Western Chief Girls Printed Rain Boot,"Clothing, Shoes & Jewelry",https://www.amazon.com/Western-Chief-Ladybug-Toddler-Little/dp/B00B7HCOSG/ref=sr_1_58?m=ATVPDKIKX0DER&amp;s=apparel&amp;ie=UTF8&amp;qid=1447735303&amp;sr=1-58&amp;nodeID=3420847011&amp;refinements=p_6,1,1
"The North Face Borealis Laptop Backpack - 15""",Sports & Outdoors,https://www.amazon.com/The-North-Face-Unisex-Borealis/dp/B019WZ4KZY?th=1,1,1
"Haggar Men's Linen Shirt, Caviar, Medium","Clothing, Shoes & Jewelry",https://www.amazon.com/Haggar-Linen-Shirt-Caviar-Medium/dp/B014G24TAO/ref=sr_1_16?s=apparel&amp;ie=UTF8&amp;qid=1457311656&amp;sr=1-16&amp;nodeID=1045630&amp;keywords=haggar,1,1
The North Face Women's Jester Backpack,Sports & Outdoors,https://www.amazon.com/North-Face-Womens-Jester-Backpack/dp/B00T9YD0QY/ref=pd_lpo_vtph_198_bs_t_2/138-9819927-5999454?_encoding=UTF8&amp;refRID=V2T117SJEM4WCGJH6AMQ,1,1
"Red Wing Heritage Men's Moc 6"" Boot","Clothing, Shoes & Jewelry",https://www.amazon.com/Red-Wing-Heritage-1907-Copper/dp/B0018DVYUS/ref=sr_1_1?s=apparel&amp;ie=UTF8&amp;qid=1503543579&amp;sr=1-1&amp;nodeID=679307011&amp;psd=1&amp;keywords=red+wings,1,1
Puma Roma Weave Wht,"Clothing, Shoes & Jewelry",https://www.amazon.com/Roma-Weave-Wht-Fashion-Sneakers/dp/B00F854YX6/ref=sr_1_96?m=AG670YE9WDQRF&amp;s=shoes&amp;ie=UTF8&amp;qid=1472440098&amp;sr=1-96&amp;keywords=puma&amp;refinements=p_89,1,1
Puma Star Fashion Sneaker Shoe - Mens,"Clothing, Shoes & Jewelry",https://www.amazon.com/PUMA-Mens-Star-Sneaker-White/dp/B00NQC053G/ref=sr_1_19?m=AG670YE9WDQRF&amp;s=shoes&amp;ie=UTF8&amp;qid=1472439897&amp;sr=1-19&amp;keywords=puma,1,1
Adidas Men's PW Stan Smith SPD Originals Casual Shoe,"Clothing, Shoes & Jewelry",https://www.amazon.com/Adidas-Originals-Pharrell-Williams-Sneakers-White/dp/B00QLDARJ4/ref=sr_1_10_mc?s=apparel&amp;ie=UTF8&amp;qid=1428505451&amp;sr=1-10,1,1
PUMA Men's Match 74 Lace-Up Fashion Sneaker,"Clothing, Shoes & Jewelry",https://www.amazon.com/PUMA-Match-74-Lace-Up-Fashion/dp/B00LV762YY/ref=pd_sim_sbs_309_14?ie=UTF8&amp;refRID=4HBXNGEVQCHK2RQSR3ME,1,1
Puma Mens Court Star Anml Sneakers,"Clothing, Shoes & Jewelry",https://www.amazon.com/Court-Animal-Leather-Fashion-Sneakers/dp/B00UZ9JCOG/ref=sr_1_215?m=AG670YE9WDQRF&amp;s=shoes&amp;ie=UTF8&amp;qid=1472440272&amp;sr=1-215&amp;keywords=puma&amp;refinements=p_89,1,1
Puma Court Star CRFTD,"Clothing, Shoes & Jewelry",https://www.amazon.com/PUMA-35997702-100-Puma-Court-CRFTD/dp/B010DUGUS2/ref=sr_1_37?m=AG670YE9WDQRF&amp;s=shoes&amp;ie=UTF8&amp;qid=1472439944&amp;sr=1-37&amp;keywords=puma&amp;refinements=p_89,1,1
The Unbranded Brand Men's UB155 Skinny Black Selvedge Chino Pant,"Clothing, Shoes & Jewelry",https://www.amazon.com/Unbranded-Brand-UB155-Skinny-Selvedge/dp/B00YE2RE68/ref=pd_sim_193_3?_encoding=UTF8&amp;pd_rd_i=B00YE2L34M&amp;pd_rd_r=8NMA5QTAECAS2H18JB41&amp;pd_rd_w=1noU0&amp;pd_rd_wg=HzotO&amp;refRID=8NMA5QTAECAS2H18JB41&amp;th=1&amp;psc=1,1,1
Herschel Supply Co. Heritage Backpack,"Clothing, Shoes & Jewelry",https://www.amazon.com/gp/product/B0077BYMPE?ref_=gb1h_tit_m-6_2002_cbf46f43&amp;smid=ATVPDKIKX0DER,1,1
Herschel Supply Co. Settlement Backpack,"Clothing, Shoes & Jewelry",https://www.amazon.com/Herschel-Supply-Settlement-Backpack-Carrot/dp/B00KJ1SU2U/ref=cm_cr_pr_product_top?ie=UTF8,1,1
Fossil Men's CH2933 Wakefield Chronograph Stainless Steel Watch with Black Silicone Strap,"Clothing, Shoes & Jewelry",https://www.amazon.com/Fossil-CH2933-Wakefield-Chronograph-Stainless/dp/B00KGTXN68/ref=redir_mobile_desktop?_encoding=UTF8&amp%3Bm=ATVPDKIKX0DER&amp%3Bpi=AC_SX110_SY165_QL70&amp%3Bsr=1-13&qid=1442405634&ref_=mp_s_a_1_13,1,1
Next Level Mens Premium Fitted Short-Sleeve Crew T-Shirt,"Clothing, Shoes & Jewelry",https://www.amazon.com/gp/product/B003YQLD4O/ref=oh_aui_search_detailpage?ie=UTF8&amp;th=1&amp;psc=1,1,1
Timberland Men's EK Brook Park Chukka Boot,"Clothing, Shoes & Jewelry",https://www.amazon.com/Timberland-Brook-Chukka-Brown-Smooth/dp/B00HDYPOZW/ref=lp_11721158011_1_6?s=apparel&amp;ie=UTF8&amp;qid=1482126171&amp;sr=1-6&amp;nodeID=11721158011,1,1
The Unbranded Brand Men's UB108 Skinny Navy Selvedge Chino Pant,"Clothing, Shoes & Jewelry",https://www.amazon.com/Unbranded-Brand-UB108-Skinny-Selvedge/dp/B00YE2OD08/ref=sr_1_1?ie=UTF8&amp;qid=1487912720&amp;sr=8-1&amp;keywords=unbranded,1,1
Clarks Hawkley Rise,"Clothing, Shoes & Jewelry",https://www.amazon.com/Clarks-Mens-Hawkley-Rise-Leather/dp/B0131K1234/ref=sr_1_2?s=apparel&amp;ie=UTF8&amp;qid=1482126327&amp;sr=8-2&amp;keywords=hawkley&amp;th=1&amp;psc=1,1,1
Russell Athletic Men's Dri-Power Pullover Fleece Hoodie,"Clothing, Shoes & Jewelry",https://www.amazon.com/Russell-Athletic-Dri-Power-Pullover-Fleece/dp/B004J009F8/ref=redir_mobile_desktop?_encoding=UTF8&amp%3Bpsc=1&ref_=yo_ii_img,1,1
Wolverine 1000 Mile Men's Wesley Lace Up Wingtip Chukkas,"Clothing, Shoes & Jewelry",https://www.amazon.com/Wolverine-1000-Wesley-Wingtip-Chukkas/dp/B009WV0DSM,1,1
Hanes Men's 6 Pack Ultimate FreshIQ V-Neck T-Shirt,"Clothing, Shoes & Jewelry",https://www.amazon.com/Hanes-6-Pack-V-Neck-T-Shirt-Medium/dp/B00LSRU162/ref=sr_1_1?s=apparel&amp;ie=UTF8&amp;qid=1430248071&amp;sr=1-1&amp;keywords=Hanes+Men,1,1
No Show Socks For Men 3prs Quality Cotton Lge Heel Grip Non Slip,Books,https://www.amazon.com/Stomper-Joe-Socks-Quality-Cotton/dp/B0120X8JOI/ref=sr_1_fkmr0_1?srs=13180220011&amp;ie=UTF8&amp;qid=1498242533&amp;sr=8-1-fkmr0&amp;keywords=stomper+joe+mens+no+show,1,1
The Unbranded Brand Men's UB301 Straight-Leg Jean in Indigo Selvedge,"Clothing, Shoes & Jewelry",https://www.amazon.com/Unbranded-UB301-Straight-Indigo-Selvedge/dp/B00YE2M55S/,1,1
New Balance Men's Running Shoe,"Clothing, Shoes & Jewelry",https://www.amazon.com/dp/B015XJT1CU/ref=twister_B015XJSXKG?th=1&amp;psc=1,1,1
The Unbranded Brand Men's UB404 Tight Black Selvedge Denim,"Clothing, Shoes & Jewelry",https://www.amazon.com/Unbranded-Brand-UB404-Tight-Selvedge/dp/B015OWOUL8,1,1
Marc New York by Andrew Marc Men's Radford Distressed-Leather Jacket,"Clothing, Shoes & Jewelry",https://www.amazon.com/Marc-New-York-Andrew-Distressed/dp/B00JJ8PB7Q/ref=sr_1_30?m=ATVPDKIKX0DER&amp;s=apparel&amp;ie=UTF8&amp;qid=1454006530&amp;sr=1-30&amp;nodeID=1045830&amp;refinements=p_6,1,1
"Allen Edmonds Men's Jefferson Oxford,Brown,13 D US","Clothing, Shoes & Jewelry",https://www.amazon.com/gp/product/B006JPVV9Y/,1,1
Timex Men's Highland Street Watch,"Clothing, Shoes & Jewelry",https://www.amazon.com/gp/product/B00B2I13LY?psc=1&amp;redirect=true&amp;ref_=oh_aui_detailpage_o01_s00,1,1
Orient Capital Quartz Rose Goldtone Dress Watch with Day and Date UG1R005W,"Clothing, Shoes & Jewelry",https://www.amazon.com/Orient-Capital-Quartz-Goldtone-UG1R005W/dp/B00BDW3GEQ/ref=sr_1_1?ie=UTF8&amp;qid=1439743979&amp;sr=8-1&amp;keywords=orient+capital,1,1
Naked & Famous Denim Men's Superskinnyguy Stretch Selvedge Jean,"Clothing, Shoes & Jewelry",https://www.amazon.com/gp/product/B01E4GF1Y0/ref=od_aui_detailpages00?ie=UTF8&amp;psc=1,1,1
Orient ER24001B Men's Bambino Automatic Black Dial Rose Gold Tone Leather Strap Mechanical Watch,"Clothing, Shoes & Jewelry",https://www.amazon.com/Orient-ER24001B-Bambino-Automatic-Mechanical/dp/B00529W5CK,1,1
Dockers Men's Agent Slip-On Loafer,"Clothing, Shoes & Jewelry",https://www.amazon.com/Dockers-Mens-Agent-Slip-On-Loafer/dp/B004XFRB82,1,1
"Chippewa Men's 6"" 20028 Lace Up Boot","Clothing, Shoes & Jewelry",https://www.amazon.com/gp/product/B00EKTLPEW/ref=ox_sc_sfl_title_1?ie=UTF8&amp;psc=1&amp;smid=ATVPDKIKX0DER,1,1
MERRY'S Unisex Polarized Aluminum Sunglasses Vintage Sun Glasses For Men/Women S8286,"Clothing, Shoes & Jewelry",https://www.amazon.com/MERRYS-Polarized-Aluminum-Sunglasses-Vintage/dp/B01MQ08MTS/,1,1
New Balance Men's ML501 High Roller Pack Fashion Sneaker,"Clothing, Shoes & Jewelry",https://www.amazon.com/New-Balance-ML501-High-Roller/dp/B00IUX9MS0/ref=sr_1_15?m=ATVPDKIKX0DER&amp;s=apparel&amp;ie=UTF8&amp;qid=1428489736&amp;sr=1-15,1,1
"Original Chippewa Collection Men's 1901M64 6"" Moc-Toe Lugged Field Boot","Clothing, Shoes & Jewelry",https://www.amazon.com/Original-Chippewa-Collection-Moc-Lugged/dp/B00J03SM5S,1,1
Kirkland Signature Italian Leather Full-Grain Leather Belt,"Clothing, Shoes & Jewelry",https://www.amazon.com/Kirkland-Signature-Italian-Leather-Full-Grain/dp/B01MFBT7G0/ref=redir_mobile_desktop?_encoding=UTF8&amp%3Bkeywords=kirkland%20belt&amp%3Bpi=AC_UL420_SR280%2C420_FMwebp_QL65&amp%3Bqid=1501417555&amp%3Bsr=8-2&ref_=mp_s_a_1_2,1,1
Citizen Men's Eco-Drive Stainless Steel Watch with Black Leather Strap,"Clothing, Shoes & Jewelry",https://www.amazon.com/Citizen-AO9000-06B-Eco-Drive-Stainless-Casual/dp/B00843L4S2/ref=sr_1_6?s=apparel&amp;ie=UTF8&amp;qid=1467911290&amp;sr=1-6&amp;nodeID=7147441011,1,1
Dockers Men's Fair Isle Crew-Neck Sweater,"Clothing, Shoes & Jewelry",https://www.amazon.com/Dockers-Mens-Fair-Crew-Neck-Sweater/dp/B00LCVWXYC/ref=cts_ap_3_fbt,1,1
Polarized Clubmaster Classic Half Frame Semi-Rimless Rimmed Sunglasses,"Clothing, Shoes & Jewelry",https://www.amazon.com/dp/B01A03EKUM/ref=cm_sw_r_cp_awd_4Y5cxbATWCDS9,1,1
Navali Mainstay Waxed Canvas & Leather Messenger Bag (Olive Canvas),"Clothing, Shoes & Jewelry",https://www.amazon.com/dp/B00M4DO7E6/ref=twister_B00M4DO88Q?_encoding=UTF8&amp;psc=1,1,1
Navali Stowaway Waxed Canvas & Leather Weekender Bag (Olive Canvas),"Clothing, Shoes & Jewelry",https://www.amazon.com/Navali-Stowaway-Canvas-Leather-Weekender/dp/B00M4EM4VS/ref=cts_ap_1_fbt,1,1
Levi's Men's Faux-Shearling Trucker Jacket,"Clothing, Shoes & Jewelry",https://www.amazon.com/dp/B00UKYDV20/ref=twister_B00UKY2KMC?th=1&amp;psc=1,1,1
"Nike Men's Blazer Low GT QS, CARGO KHAKI/BAMBOO-GM LGHT BROWN-BLACK, 11 M US",Sports & Outdoors,https://www.amazon.com/Nike-Blazer-Mens-Skate-Shoe/dp/B00PU0CUK8,1,1
Next Level mens Premium Fitted Sueded V-Neck Tee (6440),Sports & Outdoors,https://www.amazon.com/Next-Level-Premium-Fitted-Sueded/dp/B00JJV4AFW/ref=pd_lpo_vtph_200_tr_t_3/135-6397321-0830142?_encoding=UTF8&amp;refRID=9GJ6X08JPT5YH8ABDNB5,1,1
Hadley-Roma Men's MSM866RAB180 18-mm Brown and Olive 'Swiss-Army' Style Nylon and Leather Watch Strap,"Clothing, Shoes & Jewelry",https://www.amazon.com/Hadley-Roma-MSM866RAB180-18-mm-Swiss-Army-Leather/dp/B001LIFGHC/,1,1
"JanSport Right Pack Laptop Backpack - 15""",Sports & Outdoors,https://www.amazon.com/dp/B0028BRZ98,1,1
Birkenstock Women's Gizeh Thong Sandal,"Clothing, Shoes & Jewelry",https://www.amazon.com/Birkenstock-Womens-Gizeh-Thong-Sandal/dp/B004EIHD18?sa-no-redirect=1,1,1
CLSL TF-BK31-BO_Men 10.5 D(M) Tesla Men's Trail Running Minimalist Barefoot Shoe BK31 (True to size),"Clothing, Shoes & Jewelry",https://www.amazon.com/TF-BK31-BO-Men-Tesla-Running-Minimalist-Barefoot/dp/B06XFB9118/ref=sr_1_2?ie=UTF8&amp;qid=1493477779&amp;sr=8-2&amp;keywords=tesla+running+shoes,1,1
Invicta Men's 10381 Pro Diver Scuba Chronograph Black Carbon Fiber Dial Stainless Steel Watch,"Clothing, Shoes & Jewelry",https://www.amazon.com/Invicta-10381-Chronograph-Carbon-Stainless/dp/B007HN6G2O,1,1
AO Eyewear Original Pilot Sunglasses 52mm Frames with Bayonet Temples and True Color Grey Glass Lenses (OP52S.BA.TC),Sports & Outdoors,https://www.amazon.com/American-Optical-Original-Eyewear-Bayonet/dp/B001E4SPLC/,1,1
Timex Unisex T2P235 Weekender Maroon Nylon Slip-Thru Strap Watch,"Clothing, Shoes & Jewelry",https://www.amazon.com/dp/B00D3DTP0W/ref=twister_B01M636GNK?_encoding=UTF8&amp;th=1,1,1
Code Alpha Hybrid Garment Duffel Bag,"Clothing, Shoes & Jewelry",https://www.amazon.com/Code-Alpha-Hybrid-Garment-Duffel/dp/B00UIE4V08/ref=sr_1_1?s=apparel&amp;ie=UTF8&amp;qid=1444950249&amp;sr=1-1&amp;nodeID=15743211&amp;keywords=garment+duffel,1,1
Florsheim Men's Montinaro Cap Toe Oxford,"Clothing, Shoes & Jewelry",https://www.amazon.com/Florsheim-Montinaro-Cap-Toe-Oxford/dp/B00TY5AKAC,1,1
Wolverine 1000 Mile Men's Wolverine 1000 Mile Boots,"Clothing, Shoes & Jewelry",https://www.amazon.com/gp/product/B005XMQFLS/ref=pd_sbs_309_4?ie=UTF8&amp;psc=1&amp;refRID=QBRPM852RZ9ER12NT137,1,1
Pointer Brand Indigo Denim Banded Collar Coat,"Clothing, Shoes & Jewelry",https://www.amazon.com/Pointer-Brand-Indigo-Banded-Collar/dp/B01FUMNB3A,1,1
"Icebreaker Merino Men's Lifestyle Light Crew Socks, Large, Ebony/Copper/Trail Heather",Sports & Outdoors,https://www.amazon.com/Icebreaker-Lifestyle-Heather-Admiral-X-Large/dp/B00KORAJKU/ref=sr_1_2?s=athletic-clothing&amp;ie=UTF8&amp;qid=1433647133&amp;sr=1-2&amp;keywords=icebreaker+lifestyle,1,1
Darn Tough Vermont Men's Vertex Tab No Show Ultra-Light,Sports & Outdoors,https://www.amazon.com/gp/product/B01A9K5Y56/ref=oh_aui_search_detailpage?ie=UTF8&amp;psc=1,1,1
Amazing GOOP 165012 RV Adhesive 3.7 fl. oz.,Automotive Parts & Accessories,https://www.amazon.com/Amazing-GOOP-165012-Adhesive-3-7/dp/B000DZBHLI,1,1
Next Level Men's Triblend Vee Tee,Sports & Outdoors,https://www.amazon.com/Next-Level-Tri-Blend-Vintage-Black/dp/B00STNFNQG/ref=sr_1_2?s=sporting-goods&amp;ie=UTF8&amp;qid=1494428997&amp;sr=1-2&amp;keywords=next,1,1
"HSELL 6 Packs Men Color Dress Socks Funny Colorful Rainbow Argyle High Fun Sock,Multicolors,One Size","Clothing, Shoes & Jewelry",https://www.amazon.com/dp/B01DSKGV92/ref=cm_sw_r_cp_api_LHXczbPCTZ7H2,1,1
Thorogood Men's American Heritage Six-Inch Plain-Toe Boot,"Clothing, Shoes & Jewelry",https://www.amazon.com/gp/product/B000I7DZSY?psc=1&amp;redirect=true&amp;ref_=ox_sc_sfl_title_6&amp;smid=ATVPDKIKX0DER,1,1
Perry Ellis Men's Shoe Shine Kit,"Clothing, Shoes & Jewelry",https://www.amazon.com/Perry-Ellis-Mens-Shoe-Shine/dp/B00KA2X92Y,1,1
Levi's Men's 511 Slim Fit Jeans,"Clothing, Shoes & Jewelry",https://www.amazon.com/gp/product/B00K821NRE/ref=oh_aui_detailpage_o01_s00?ie=UTF8,1,1
Timex Unisex Weekender Fairfield 41mm Slip-Thru Strap Watch,"Clothing, Shoes & Jewelry",https://www.amazon.com/dp/B01GI8R744/ref=twister_B01LYMU6EN?_encoding=UTF8&amp;psc=1,1,1
Nautica Men's 3 Button Wool Blend 37 Inch Topcoat,"Clothing, Shoes & Jewelry",https://www.amazon.com/Nautica-Button-Blend-Topcoat-Regular/dp/B01750EVSO/ref=sr_1_2?m=ATVPDKIKX0DER&amp;s=apparel&amp;ie=UTF8&amp;qid=1453990884&amp;sr=1-2&amp;nodeID=1045830&amp;refinements=p_6,1,1
Woolrich Men's Sportsman Chamois Shirt,"Clothing, Shoes & Jewelry",https://www.amazon.com/Woolrich-Sportsman-Chamois-Shirt-Heather/dp/B005I4P75G/ref=sr_1_4?s=apparel&amp;ie=UTF8&amp;qid=1479696916&amp;sr=1-4&amp;nodeID=1040658&amp;keywords=woolrich&amp;th=1&amp;psc=1,1,1
Kenneth Cole New York Men's Wool-Blend Walker Coat,"Clothing, Shoes & Jewelry",https://www.amazon.com/Kenneth-Cole-New-York-Hazelnut/dp/B00KT91E3E/ref=sr_1_41?m=ATVPDKIKX0DER&amp;s=apparel&amp;ie=UTF8&amp;qid=1481655111&amp;sr=1-41&amp;nodeID=7147441011&amp;refinements=p_6,1,1
"Red Wing Heritage Men's Classic Moc 6"" Boot","Clothing, Shoes & Jewelry",https://www.amazon.com/gp/product/B0018DVT08?psc=1&amp;redirect=true&amp;ref_=od_aui_detailpages00,1,1
Chaco Men's Z/2 Unaweep Sandal,"Clothing, Shoes & Jewelry",https://www.amazon.com/Chaco-Mens-Unaweep-Sandal-Black/dp/B002CAKBNM,1,1
Onitsuka Tiger Mexico 66 Fashion Sneaker,"Clothing, Shoes & Jewelry",https://www.amazon.com/Onitsuka-Tiger-Mexico-Fashion-Sneaker/dp/B00HQQSJE0/ref=sr_1_1?ie=UTF8&amp;qid=1442935734&amp;sr=8-1&amp;keywords=asics+tiger+mexico+66,1,1
Levi's Men's 502 Regular Taper Jean,"Clothing, Shoes & Jewelry",https://www.amazon.com/Levis-Mens-Regular-Taper-Jean/dp/B01EBPOJTW?th=1&amp;psc=1,1,1
Proman Products KSA9030 Wood Hanger,Home & Kitchen,https://www.amazon.com/dp/B000OSJMSE,1,1
Levi's Men's 511 Slim-Fit Jeans   -    Line 8,"Clothing, Shoes & Jewelry",https://www.amazon.com/Levis-Mens-Slim-Fit-Line-Jean/dp/B00GAZMAXY/ref=pd_sim_193_2?ie=UTF8&amp;refRID=0HQ5885VX7J1XD03RMHA,1,1
Chaco Men's Z1 Unaweep Sandal,"Clothing, Shoes & Jewelry",https://www.amazon.com/Chaco-Mens-Z1-Unaweep-Sandal/dp/B00NXM939G,1,1
Chaco Men's Z2 Yampa Sandals,"Clothing, Shoes & Jewelry",https://www.amazon.com/Chaco-Mens-Yampa-Sandal-Black/dp/B004OGH5Q8/,1,1
"Chippewa Men's 6"" 20028 Lace Up Boot","Clothing, Shoes & Jewelry",https://www.amazon.com/gp/product/B00EKTLPV0?psc=1&amp;redirect=true&amp;ref_=ox_sc_sfl_title_1&amp;smid=ATVPDKIKX0DER,1,1
Woolrich Men's Oxbow Bend Flannel Shirt,"Clothing, Shoes & Jewelry",https://www.amazon.com/Woolrich-Oxbow-Flannel-Shirt-Buffalo/dp/B00T3J0OYG/ref=sr_1_1?s=apparel&amp;ie=UTF8&amp;qid=1479696916&amp;sr=1-1&amp;nodeID=1040658&amp;keywords=woolrich&amp;th=1&amp;psc=1,1,1
Chippewa Apache Lace-Up Boot,"Clothing, Shoes & Jewelry",https://www.amazon.com/gp/product/B004TK2UCI?psc=1&amp;redirect=true&amp;ref_=ox_sc_sfl_title_3&amp;smid=ATVPDKIKX0DER,1,1
Reef Men's Leather Smoothy,"Clothing, Shoes & Jewelry",https://www.amazon.com/Reef-Leather-Smoothy-Sandal-Bronze/dp/B000KS2UFK,1,1
Caterpillar Men's Haverhill Boot,"Clothing, Shoes & Jewelry",https://www.amazon.com/Caterpillar-HAVERHILL-Mens-Haverhill-Boot/dp/B00M0COSKO?psc=1,1,1
"Perry Ellis 360 Red for Men, 3.4 fl oz EDT","Health, Household & Baby Care",https://www.amazon.com/Perry-Ellis-Toilette-Spray-Ounces/dp/B000C1W38O,1,1
adidas Performance Men's Samba Classic Indoor Soccer Shoe,"Clothing, Shoes & Jewelry",https://www.amazon.com/adidas-Samba-Classic-Soccer-White/dp/B000CEMYCG/ref=sr_1_12?s=apparel&amp;ie=UTF8&amp;qid=1498500415&amp;sr=1-12&amp;nodeID=679255011&amp;psd=1&amp;keywords=adidas,1,1
The Mountain 100% Cotton Three Wolf Moon T-Shirt,"Clothing, Shoes & Jewelry",https://www.amazon.com/Mountain-Three-Short-Sleeve-Green/dp/B000NZW3J8,1,1
Mens Genuine Italian Leather Watchband Tan 18mm Long Watch Band - by JP Leatherworks,"Clothing, Shoes & Jewelry",https://www.amazon.com/gp/product/B000RNM5QC/ref=oh_aui_search_detailpage?ie=UTF8&amp;psc=1,1,1
"IZOD Men's Big and Tall Short Sleeve Solid Oxford Pique Polo, Sunburst, 3X-Large Big","Clothing, Shoes & Jewelry",https://www.amazon.com/IZOD-Big-Tall-Sleeve-Sunburst-3X-Large/dp/B00102DPNQ/?psc=1,1,1
Kiwi Select Shoe Care Kit,"Clothing, Shoes & Jewelry",https://www.amazon.com/Kiwi-Select-Shoe-Care-Kit/dp/B0010TP3AM/ref=sr_1_4?ie=UTF8&amp;qid=1451192630&amp;sr=8-4&amp;keywords=shoe+shine+kit,1,1
"Cuba Gold by Cuba, 3.30 Ounce","Health, Household & Baby Care",https://www.amazon.com/Cuba-Gold-3-30-Ounce/dp/B001ALPKXA/ref=sr_1_1?s=hpc&amp;ie=UTF8&amp;qid=1437529911&amp;sr=1-1&amp;keywords=cuba+gold,1,1
Invicta Men's 5053 Pro Diver Collection Automatic Watch,"Clothing, Shoes & Jewelry",https://www.amazon.com/Invicta-Diver-Collection-Automatic-Watch/dp/B001CTI5SM/ref=sr_1_1?ie=UTF8&amp;qid=1454742431&amp;sr=8-1&amp;keywords=invicta+pepsi,1,1
"Chippewa Men's 6"" 20067 Lace Up Boot","Clothing, Shoes & Jewelry",https://www.amazon.com/Chippewa-Mens-20067-Lace-Boot/dp/B00413PV56/ref=sr_1_8?m=ATVPDKIKX0DER&amp;s=apparel&amp;ie=UTF8&amp;qid=1461937197&amp;sr=1-8&amp;nodeID=14373838011&amp;refinements=p_89,1,1
Kenneth Cole Reaction Luggage Show Business,"Clothing, Shoes & Jewelry",https://www.amazon.com/Kenneth-Cole-Reaction-Luggage-Business/dp/B0041O4G7Y,1,1
Sebago Men's Brattle Oxford,"Clothing, Shoes & Jewelry",https://www.amazon.com/Sebago-Brattle-Mens-Oxford/dp/B0041S0EZS,1,1
Chef Designs Men's RK Spun Poly Long Cook Shirt,"Clothing, Shoes & Jewelry",https://www.amazon.com/Chef-DesignsSpun-Shirt-Sleeve-3X-Large/dp/B007EXA4PM/?psc=1,1,1
Golden Fox Men's Premium Leather Soft Toe Light Weight Industrial Construction Moc Work Boots Insulated,"Clothing, Shoes & Jewelry",https://www.amazon.com/gp/product/B0083F3LM8?psc=1&amp;redirect=true&amp;ref_=od_aui_detailpages00,1,1
KOMONO Unisex KOM-W1901 Magnus Analog Display Japanese Quartz Brown Watch,"Clothing, Shoes & Jewelry",https://www.amazon.com/KOMONO-Unisex-KOM-W1901-Display-Japanese/dp/B00AAHIXYS/ref=sr_1_1?s=apparel&amp;ie=UTF8&amp;qid=1448561515&amp;sr=1-1&amp;nodeID=7141123011&amp;keywords=komono+magnus+black+cognac,1,1
Polaroid P8353S P8353S Polarized Wayfarer Sunglasses,"Clothing, Shoes & Jewelry",https://www.amazon.com/Polaroid-Sunglasses-P8353S-Polarized-Wayfarer/dp/B00AR5C5RO/ref=sr_1_32?s=apparel&amp;ie=UTF8&amp;qid=1427306349&amp;sr=1-32,1,1
Pendleton Men's Long Sleeve Fitted Trail Shirt,"Clothing, Shoes & Jewelry",https://www.amazon.com/Pendleton-Mens-Fitted-Trail-Shirt/dp/B00CEB7CG8/ref=cts_ap_1_fbt,1,1
Cole Haan Men's Great Jones Plain Oxford,"Clothing, Shoes & Jewelry",https://www.amazon.com/Cole-Haan-Great-Oxford-Milkshake/dp/B00ENZN5I2/ref=sr_1_6?s=apparel&amp;ie=UTF8&amp;qid=1482937842&amp;sr=1-6&amp;nodeID=679319011&amp;keywords=cole,1,1
Pendleton Men's Long-Sleeve Sir Pen Button Down Shirt,"Clothing, Shoes & Jewelry",https://www.amazon.com/Pendleton-Button-Down-Shirt-Slate-Crabapple/dp/B00GNZRZCC/ref=sr_1_79?s=apparel&amp;ie=UTF8&amp;qid=1445741933&amp;sr=1-79&amp;nodeID=1040658&amp;refinements=p_89,1,1
"JD Fisk Men's Cole Oxford,Sand Leather,8.5 M US","Clothing, Shoes & Jewelry",https://www.amazon.com/gp/product/B00HB1MFO0/ref=od_aui_detailpages00?ie=UTF8&amp;psc=1,1,1
"Kenneth Cole REACTION Men's Why Not Oxford,Navy,8.5 M US","Clothing, Shoes & Jewelry",https://www.amazon.com/Kenneth-Cole-REACTION-Why-Not/dp/B00J8WIDMS/ref=sr_1_42?m=ATVPDKIKX0DER&amp;s=apparel&amp;ie=UTF8&amp;qid=1428499982&amp;sr=1-42,1,1
Sebago Men's Campsides Oxford,"Clothing, Shoes & Jewelry",https://www.amazon.com/Sebago-Mens-Campsides-Oxford-Khaki/dp/B00JBYKPGK/ref=sr_1_8?m=ATVPDKIKX0DER&amp;s=apparel&amp;ie=UTF8&amp;qid=1428495765&amp;sr=1-8,1,1
Pendleton Men's Long Sleeve Classic-Fit Board Shirt,"Clothing, Shoes & Jewelry",https://www.amazon.com/Pendleton-Classic-Board-Shirt-X-Small/dp/B00JV52XMI/ref=sr_1_65?s=apparel&amp;ie=UTF8&amp;qid=1445741933&amp;sr=1-65&amp;nodeID=1040658&amp;refinements=p_89,1,1
"Pendleton Men's Fitted Sir Shirt, Black/Blue/White Plaid, Small","Clothing, Shoes & Jewelry",https://www.amazon.com/gp/product/B00JVPXCSC?psc=1&amp;redirect=true&amp;ref_=oh_aui_detailpage_o00_s00,1,1
Pendleton Men's Long Sleeve Fitted Fireside BD Shirt,"Clothing, Shoes & Jewelry",https://www.amazon.com/Pendleton-Mens-Fitted-Fireside-Shirt/dp/B00JYAUA7U/ref=pd_srecs_cs_193_6?ie=UTF8&amp;refRID=14DPHQRFMK3S59A4G50C,1,1
Pendleton Men's Zephyr Shirt,"Clothing, Shoes & Jewelry",https://www.amazon.com/Pendleton-Zephyr-Shirt-Brown-Green/dp/B00JYB0C04/ref=sr_1_88?s=apparel&amp;ie=UTF8&amp;qid=1445741933&amp;sr=1-88&amp;nodeID=1040658&amp;refinements=p_89,1,1
StrapsCo Perforated Leather Rally Watch Band,"Clothing, Shoes & Jewelry",https://www.amazon.com/gp/product/B00MT64IJW/ref=oh_aui_detailpage_o03_s00?ie=UTF8&amp;psc=1,1,1
"FOG by London Fog Men's Redlands Hooded Down Puffer Jacket, Midnight Blue, Large","Clothing, Shoes & Jewelry",https://www.amazon.com/FOG-London-Fog-Redlands-Midnight/dp/B00NQWNNSU/ref=sr_1_7?m=ATVPDKIKX0DER&amp;s=apparel&amp;ie=UTF8&amp;qid=1422912160&amp;sr=1-7&amp;pebp=1422912163783&amp;peasin=B00NQWNNSU,1,1
Navali Stowaway Weekender Bag (Sand),"Clothing, Shoes & Jewelry",https://www.amazon.com/gp/product/B00OKUGXS4?psc=1&amp;redirect=true&amp;ref_=od_aui_detailpages00,1,1
"Thomas K by Pendleton Men's Oliver Shirt, Gold Shadow Plaid, Large","Clothing, Shoes & Jewelry",https://www.amazon.com/Thomas-Pendleton-Oliver-Shirt-Shadow/dp/B00PKGHTIK/ref=sr_1_73?s=apparel&amp;ie=UTF8&amp;qid=1445741933&amp;sr=1-73&amp;nodeID=1040658&amp;refinements=p_89,1,1
New Balance Men's ML574 Lux Pack Sneaker,"Clothing, Shoes & Jewelry",https://www.amazon.com/New-Balance-ML574-Lux-Running/dp/B00RB9HIU8/ref=sr_1_fkmr0_1?ie=UTF8&amp;qid=1440946099&amp;sr=8-1-fkmr0&amp;keywords=nb+574+lux&amp;pebp=1440946102156&amp;perid=15PDD2E9Z87W1CEJ15A3,1,1
Tommy Hilfiger Men's Nathan Two-Button Tailored Fit Suit,"Clothing, Shoes & Jewelry",https://www.amazon.com/dp/B00SB1WCVA/ref=cm_sw_r_tw_dp_eFbevb04DB5N8,1,1
