name,category,amazon_link,total_mentions,subreddit_mentions
BaoFeng UV-5R Dual Band Two Way Radio (Black),Electronics,https://www.amazon.com/BaoFeng-UV-5R-Dual-Radio-Black/dp/B007H4VT7A/ref=sr_1_3?s=electronics&amp;ie=UTF8&amp;qid=1493949638&amp;sr=1-3&amp;keywords=baofeng+uv-5r,14,1
Fundamentals of Vehicle Dynamics (R114) (Premiere Series Books),Books,https://www.amazon.com/Fundamentals-Vehicle-Dynamics-Premiere-Books/dp/1560911999,2,1
Race Car Vehicle Dynamics (Premiere Series),Books,https://www.amazon.com/gp/product/1560915269/ref=pd_sim_14_6?ie=UTF8&amp;pd_rd_i=1560915269&amp;pd_rd_r=JARCRDCV27X1CKZTPM54&amp;pd_rd_w=D3ASF&amp;pd_rd_wg=MopUf&amp;psc=1&amp;refRID=JARCRDCV27X1CKZTPM54,2,1
Tune to Win: The art and science of race car development and tuning,Books,https://www.amazon.com/Tune-Win-science-development-tuning/dp/0879380713/ref=pd_sim_14_1?_encoding=UTF8&amp;pd_rd_i=0879380713&amp;pd_rd_r=XT89VRWM302EN5X81CD3&amp;pd_rd_w=1CvNG&amp;pd_rd_wg=cMBpP&amp;psc=1&amp;refRID=XT89VRWM302EN5X81CD3,2,1
Engineer to Win (Motorbooks Workshop),Books,https://www.amazon.com/Engineer-Motorbooks-Workshop-Carroll-Smith/dp/0879381868,1,1
Racecar: Searching for the Limit in Formula SAE,Books,https://www.amazon.com/Racecar-Searching-Limit-Formula-SAE/dp/0984719318/ref=sr_1_fkmr2_1?ie=UTF8&amp;qid=1426989376&amp;sr=8-1-fkmr2&amp;keywords=formula+sae+oklahoma,1,1
Prepare to Win: The Nuts and Bolts Guide to Professional Race Car Preparation,Books,https://www.amazon.com/Prepare-Win-Bolts-Professional-Preparation/dp/0615547338/ref=pd_sim_14_2?_encoding=UTF8&amp;pd_rd_i=0615547338&amp;pd_rd_r=629MFY976XFXTW1WT52T&amp;pd_rd_w=hImLB&amp;pd_rd_wg=9SnvS&amp;psc=1&amp;refRID=629MFY976XFXTW1WT52T,1,1
Four-Stroke Performance Tuning: Fourth edition,Books,https://www.amazon.com/Four-Stroke-Performance-Tuning-Graham-Bell/dp/0857331256/ref=sr_1_1?s=books&amp;ie=UTF8&amp;qid=1501178212&amp;sr=1-1&amp;keywords=4+stroke+performance+tuning,1,1
Engineer to Win,Books,https://www.amazon.com/Engineer-Win-Carroll-Smith/dp/0615754090/ref=sr_1_1?ie=UTF8&amp;qid=1501178056&amp;sr=8-1&amp;keywords=engineer+to+win,1,1
