name,category,amazon_link,total_mentions,subreddit_mentions
"Rexing V1 Car Dash Cam 2.4"" LCD FHD 1080p 170 Degree Wide Angle Dashboard Camera Recorder with Sony Exmor Video Sensor, G-Sensor, WDR, Loop Recording",Wireless,http://www.amazon.com/dp/B00X528FNE/,28,1
"Rexing V1P 2.4"" LCD FHD 1080p 170 Degree Wide Angle Dual Channel Dashboard Camera Recorder Car Dash Cam with Rear Camera, G-Sensor, WDR, Loop Recording",Wireless,http://www.amazon.com/dp/B01EX8ATKK/,5,1
Genuine Subaru J501SCA000 Cargo Tray,Automotive Parts and Accessories,http://www.amazon.com/dp/B00IJIKZPU/,1,1
Genuine Toyota Accessories PT347-12020 Cargo Net,Automotive Parts and Accessories,http://www.amazon.com/dp/B00540TO2Q/,1,1
Wool Car Steering Wheel Cover Winter Steering Wheel Cover Sheepskin Long Wool Steering Wheel Cover Automotive Winter Steering Wheel Covers (Pink),Automotive Parts and Accessories,http://www.amazon.com/dp/B00QJV4WAI/,1,1
Replacement Black Housing Brake Streak Signal LED Tail Light Unit Fits Scion Frs/Subaru Brz,Automotive Parts and Accessories,http://www.amazon.com/dp/B00XRBVZOE/,1,1
Gorilla Automotive 21123BC Small Diameter Acorn Black 5 Lug Kit (12mm x 1.25 Thread Size) - Pack of 20,Automotive Parts and Accessories,http://www.amazon.com/dp/B001O08ADO/,1,1
Red Cartoon Eyes Auto Car Front Window Windshield Sun Shade Visor,Automotive Parts and Accessories,http://www.amazon.com/dp/B01CJ7OZZ2/,1,1
Cllena Dual USB Charger Socket Power Outlet 2.1A & 2.1A for Car Boat Marine Mobile (4.2A-Red),CE,http://www.amazon.com/dp/B01HPSYBKE/,1,1
JOYING Android 5.1 Car GPS Navigation DVD Player 200x100mm for Toyota Rav4/Scion/GT86/Yaris/Highlander/Corolla/Land Cruiser indash Radio Touch Screen Car Stereo 2 Din Head Unit,GPS or Navigation System,http://www.amazon.com/dp/B01I6LP464/,1,1
INFLATABLE WIZARD HAT FOR CATS by Accoutrements,Toy,http://www.amazon.com/dp/B015NEIVUI/,1,1
"Pioneer AVH4200NEX 2-DIN Receiver with 7"" Motorized Display/Built-In Bluetooth/Siri Eyes Free/AppRadio One/NEX",Wireless,http://www.amazon.com/dp/B01D6HPMZQ/,1,1
Scosche MAGWSM2 MagicMount Suction Mount for Mobile Devices,Car Audio or Theater,http://www.amazon.com/dp/B00R2K4LCY/,1,1
