name,category,amazon_link,total_mentions,subreddit_mentions
"The Moonborn: or, Moby-Dick on the Moon",Book,http://www.amazon.com/dp/0998379409/,2,1
Children of the Fallen,Book,http://www.amazon.com/dp/1508461368/,1,1
The Hero with a Thousand Faces (The Collected Works of Joseph Campbell),Book,http://www.amazon.com/dp/1577315936/,26,1
Writer's Little Helper,Book,http://www.amazon.com/dp/1582974225/,1,1
"Douwe Egberts Aroma Rood Ground Coffee, 17.6-Ounce (Pack of 2)",Grocery,http://www.amazon.com/dp/B004868RJ8/,1,1
Steal This Plot: A Writer's Guide to Story Structure and Plagiarism (Classic Wisdom on Writing),eBooks,http://www.amazon.com/dp/B005FHXU4Q/,1,1
Crafting the Sun,eBooks,http://www.amazon.com/dp/B01H1QH652/,4,1
"The Moonborn: or, Moby-Dick on the Moon",eBooks,http://www.amazon.com/dp/B01M17L0VH/,5,1
"RCA Voyager Pro 7"" 16GB Tablet with Keyboard Case Android 6.0 (Marshmallow) in CHARCOAL",Personal Computer,http://www.amazon.com/dp/B01M7TSY16/,1,1
