name,category,amazon_link,total_mentions,subreddit_mentions
"Suave Shampoo, Daily Clarifying - 15oz.",Beauty,http://www.amazon.com/dp/B0000530LP/,1,1
"Johnson's Baby No More Tangles Detangling Spray, 10 Ounce",Health and Beauty,http://www.amazon.com/dp/B0009RFASQ/,1,1
Medicated Hair & Scalp Conditioner,Beauty,http://www.amazon.com/dp/B000AA9HP4/,1,1
"Conair Pro Style Collapsible Bonnet Hair Dryer, White",Beauty,http://www.amazon.com/dp/B000E8VI9U/,2,1
"Organic Root Stimulator Nature's Shine Hair Spray, 8 Ounce",Beauty,http://www.amazon.com/dp/B000EGIF84/,1,1
Kinky-Curly Knot Today Leave In Conditioner/Detangler - 8 oz,Beauty,http://www.amazon.com/dp/B00128WK4I/,6,1
"NOW Solutions Glycerine Vegetable, 16-Ounce",Health and Beauty,http://www.amazon.com/dp/B0019LWU2K/,8,1
Queen Helene Cocoa Butter Smoothing Conditioner 16 oz.,Beauty,http://www.amazon.com/dp/B001STB0GU/,1,1
Queen Helene Cocoa Butter Smoothing Shampoo 16 oz.,Beauty,http://www.amazon.com/dp/B001STB0MO/,1,1
"Trader Joe's Tea Tree Tingle Shampoo with Peppermint, Tea Tree and Eucalyptus Botanicals, 16-Ounces",Beauty,http://www.amazon.com/dp/B002LMBLTY/,10,1
Shea Moisture Raw Shea Retention Shampoo-13 oz,Beauty,http://www.amazon.com/dp/B0038TVHGG/,6,1
Tropic Isle Living- Jamaican Black Castor Oil-8oz Plastic PET Bottle,Beauty,http://www.amazon.com/dp/B003CTTZQQ/,5,1
"ECOCO Eco Style Gel, Olive, 32 Ounce",Beauty,http://www.amazon.com/dp/B003E7UNE4/,3,1
"Jamila Henna Powder, 100 grams",Beauty,http://www.amazon.com/dp/B006K3TZS4/,4,1
"Kinky-Curly, Tiny Twirls, Detangling Conditioner, 8 oz",Beauty,http://www.amazon.com/dp/B006Q5C7OA/,1,1
"African Pride Shea Butter Miracle Bouncy Curls Pudding, 15 Ounce",Beauty,http://www.amazon.com/dp/B007R6AOA6/,1,1
"Lusti Naturals Argan Oil 4 in 1 Leave-in Conditioner, 8 Fl Oz",Beauty,http://www.amazon.com/dp/B0090SFBR0/,1,1
"Murray's Edgewax 100% Australian Beeswax, 4 Ounce",Beauty,http://www.amazon.com/dp/B00AU62JG2/,1,1
"The Original BLOM. Patent Pending Headband for Sports or Fashion, Yoga or Travel. 30 Day Happy Head Guarantee. Super Comfortable. Designer Style & Quality. Black.",Sports,http://www.amazon.com/dp/B00PP83QQ2/,1,1
"Shea Moisture Yucca & Plantain Anti-Breakage Strengthening Styling Milk, 8 FL. OZ",Beauty,http://www.amazon.com/dp/B00TRMM0OQ/,1,1
Dread Lock Dreadlocks Braiding Beads Golden Metal Cuffs Hair Accessories Decoration Filigree Tube 8mm 10pcs Pack by Magic,Beauty,http://www.amazon.com/dp/B012V3FRJC/,1,1
