name,category,amazon_link,total_mentions,subreddit_mentions
MJ Soffe Men's Military T-Shirt (3 Pack),"Clothing, Shoes & Jewelry",https://www.amazon.com/dp/B00I40CUN8/ref=cm_sw_r_cp_apap_U9OjMiuTQKrjn,2,2
"Pilot G2 Retractable Premium Gel Ink Roller Ball Pens, Fine Pt, Dozen Box, Black",Office Products,https://www.amazon.com/Pilot-Retractable-Premium-12-Pack-31020/dp/B001GAOTSW,10,1
"Soundproof Store 4492 Acoustic Wedge Soundproofing Studio Foam Tiles, 2 X 12 X 12-Inch, Pack of 12 (Charcoal Black and Burgundy Maroon)",Musical Instruments,https://www.amazon.com/2x12x12-BURGUNDY-CHARCOAL-Acoustic-Soundproofing/dp/B00ATP5KF6,5,1
Bleeding Talent: How the US Military Mismanages Great Leaders and Why It's Time for a Revolution,Books,https://www.amazon.com/Bleeding-Talent-Military-Mismanages-Revolution/dp/0230391273/ref=sr_1_1?ie=UTF8&amp;qid=1427239018&amp;sr=8-1&amp;keywords=bleeding+talent,3,1
Contour ROAM2 Waterproof Video Camera (Black),Electronics,https://www.amazon.com/dp/B009CN8VRK,3,1
The Radioactive Boy Scout: The Frightening True Story of a Whiz Kid and His Homemade Nuclear Reactor,Books,https://www.amazon.com/Radioactive-Boy-Scout-Frightening-Homemade/dp/0812966600,2,1
"Gold Toe Men's Big & Tall Cotton Cushion Crew Socks, 6-Pack","Clothing, Shoes & Jewelry",https://www.amazon.com/dp/B0002TOZ1O,2,1
Westminster Silly Straws 0084,Toys & Games,https://www.amazon.com/Westminister-PT7327-Westminster-Silly-Straws/dp/B001JP9I5I/ref=sr_1_12?ie=UTF8&amp;qid=1482889414&amp;sr=8-12&amp;keywords=crazy+straw,1,1
Norpro Natural Sponges Pop-Up 12 Piece New Handy For Kitchen Drawer Glove Box,Home & Kitchen,https://www.amazon.com/dp/B000SSSUL0,1,1
"Leatherman - Rebar Multi-Tool, Black with Molle Sheath (FFP)",Tools & Home Improvement,https://www.amazon.com/gp/product/B019EN7E7A/,1,1
Darn Tough Vermont Men's Merino Wool Boot Cushion Hiking Socks,Sports & Outdoors,https://www.amazon.com/Darn-Tough-Merino-Cushion-Black/dp/B000XG34G8?ie=UTF8&amp;keywords=darn,1,1
Disposable Plastic Auto Seat Covers - Roll of 250,Automotive Parts & Accessories,https://www.amazon.com/Disposable-Plastic-Auto-Seat-Covers/dp/B0070XEXP8/ref=sr_1_1?ie=UTF8&amp;qid=1432695001&amp;sr=8-1&amp;keywords=plastic+seat+covers+for+cars,1,1
"The Naval Institute Guide to Naval Writing, 3rd Edition (Blue and Gold)",Books,https://www.amazon.com/Naval-Institute-Guide-Writing-Blue/dp/1591148227/ref=sr_1_1?s=books&amp;ie=UTF8&amp;qid=1477524974&amp;sr=1-1&amp;keywords=The+Naval+Institute+Guide+to+Naval+Writing,1,1
"Sistema Microwave Cookware Rice Steamer, 87.2 Ounce/ 10.9 Cup, Red",Home & Kitchen,https://www.amazon.com/dp/B00BTIVNT4/ref=asc_df_B00BTIVNT45119129/?tag=hyprod-20&amp;creative=394997&amp;creativeASIN=B00BTIVNT4&amp;linkCode=df0&amp;hvadid=198068785199&amp;hvpos=1o3&amp;hvnetw=g&amp;hvrand=1608056842089733176&amp;hvpone=&amp;hvptwo=&amp;hvqmt=&amp;hvdev=c&amp;hvdvcmdl=&amp;hvlocint=&amp;hvlocphy=9032800&amp;hvtargid=pla-384010877277,1,1
BlueJan Luggage Cart,"Clothing, Shoes & Jewelry",https://www.amazon.com/BlueJan-A-1-Luggage-Cart/dp/B01FX9F37C/ref=pd_lpo_vtph_198_tr_img_3/135-7203046-8903064?_encoding=UTF8&amp;psc=1&amp;refRID=BGMT6SB8VBEBV8NXD7CX,1,1
United States Submarine Operations in World War II.,Books,https://www.amazon.com/United-States-Submarine-Operations-World/dp/B00ABM4RXS,1,1
Zombie Eyes Undead Novelty Sleep Mask,"Health, Household & Baby Care",https://www.amazon.com/Zombie-Eyes-Undead-Novelty-Sleep/dp/B007C81L7E/ref=pd_sim_194_1?ie=UTF8&amp;dpID=51S9Fv0XmQL&amp;dpSrc=sims&amp;preST=_AC_UL320_SR320,1,1
ANDROID Men's AD690BK Intercross Analog Automatic-Self-Wind Silver Watch,"Clothing, Shoes & Jewelry",https://www.amazon.com/ANDROID-AD690BK-Intercross-Analog-Automatic-Self-Wind/dp/B00A1XHG7G/ref=sr_1_67?s=apparel&amp;ie=UTF8&amp;qid=1442095982&amp;sr=1-67&amp;nodeID=6358540011&amp;keywords=android+watches&amp;refinements=p_89,1,1
Android Men's AD477BK Antiforce 4 Open Heart Automatic Charcoal Watch,"Clothing, Shoes & Jewelry",https://www.amazon.com/Android-AD477BK-Antiforce-Automatic-Charcoal/dp/B004CMLZBK/ref=sr_1_10?s=apparel&amp;ie=UTF8&amp;qid=1442095944&amp;sr=1-10&amp;nodeID=6358540011&amp;keywords=android+watches&amp;refinements=p_89,1,1
Supertool 300 Multitool - - STAINLESS,Sports & Outdoors,https://www.amazon.com/Leatherman-Super-Tool-300-Multitool/dp/B00UCK8VFY,1,1
"We were there on the Nautilus (We were there books, 35)",Books,https://www.amazon.com/We-were-there-Nautilus-books/dp/B0007E13H8,1,1
