name,category,amazon_link,total_mentions,subreddit_mentions
The Web Application Hacker's Handbook: Finding and Exploiting Security Flaws,Book,http://www.amazon.com/dp/1118026470/,18,1
The Tangled Web: A Guide to Securing Modern Web Applications,Book,http://www.amazon.com/dp/1593273886/,6,1
Penetration Testing: A Hands-On Introduction to Hacking,Book,http://www.amazon.com/dp/1593275641/,5,1
The Art of Electronics,Book,http://www.amazon.com/dp/0521370957/,3,1
Rootkits: Subverting the Windows Kernel,Book,http://www.amazon.com/dp/0321294319/,3,1
"RTL-SDR, FM+DAB, DVB-T USB Stick Set with RTL2832U & R820T. Great SDR for SDR#, HDSDR",Speakers,http://www.amazon.com/dp/B00C37AZXK/,2,1
The Rootkit Arsenal: Escape and Evasion in the Dark Corners of the System,Book,http://www.amazon.com/dp/144962636X/,2,1
Introduction to 64 Bit Intel Assembly Language Programming for Linux,Book,http://www.amazon.com/dp/1466470038/,2,1
"Alfa 2.4HGz 7dBi RP-SMA Panel Screw-On Swivel Antenna for Alfa - WUS036H, WUS036H1W, APA05, WUS036NH, WUS036NEH, WUS048NH, WUS036EW, WUS051NH",PC Accessory,http://www.amazon.com/dp/B003ZWPRUI/,1,1
HP Designjet 500 42-inch Roll Printer (C7770B),CE,http://www.amazon.com/dp/B000067TR8/,1,1
Uberhacker: How to Break into Computers,Book,http://www.amazon.com/dp/155950207X/,1,1
