name,category,amazon_link,total_mentions,subreddit_mentions
"IndusClassic Himalayan Salt Block, Plate, Slab for Cooking, Grilling, Seasoning, And Serving (8 X 4 X 2)",Grocery & Gourmet Food,https://www.amazon.com/IndusClassic-Himalayan-Cooking-Grilling-Seasoning/dp/B00GUOOQTG/ref=sr_1_21?ie=UTF8&amp;qid=1426556197&amp;sr=8-21&amp;keywords=salt+block,1,1
Galaxy Quilt Cover Galaxy Duvet Cover Galaxy Sheet Space Sheet Outer Space Bedding Set Bedspread cover with 2 Matching Pillow Covers(King),Home & Kitchen,https://www.amazon.com/gp/product/B00KFHJP6S?psc=1&amp;redirect=true&amp;ref_=oh_aui_detailpage_o02_s00,1,1
You Negotiate Like a Girl: Reflections on a Career in the National Football League,Books,https://www.amazon.com/You-Negotiate-Like-Girl-Reflections/dp/1629371874,1,1
Art Briles: Looking Up: My Journey from Tragedy to Triumph,Books,https://www.amazon.com/Art-Briles-Looking-Journey-Tragedy/dp/1629370479,1,1
Take Your Eye Off the Ball: How to Watch Football by Knowing Where to Look,Books,https://www.amazon.com/Take-Your-Eye-Off-Ball/dp/1600783910,1,1
Finding the Winning Edge,Books,https://www.amazon.com/Finding-Winning-Edge-Brian-Billick/dp/1571671722,1,1
"The Big Book of Belichick: His Thoughts on Strategy, Fundamentals & History",Books,https://www.amazon.com/Big-Book-Belichick-Thoughts-Fundamentals/dp/1540670384/,1,1
"Duke Sucks: A Completely Evenhanded, Unbiased Investigation into the Most Evil Team on Planet Earth",Books,https://www.amazon.com/Duke-Sucks-Completely-Evenhanded-Investigation/dp/1250004632,1,1
Football's Wackiest Moment,Books,https://www.amazon.com/Footballs-Wackiest-Moment-Michael-Pellowski/dp/0806913630,1,1
Redskins: Racial Slur or Symbol of Success,Books,https://www.amazon.com/Redskins-Racial-Slur-Symbol-Success/dp/0595171672,1,1
Playboy Stories: The Best of Forty Years of Short Fiction,Books,https://www.amazon.com/Playboy-Stories-Forty-Years-Fiction/dp/0452271177,1,1
iPADKET *THE MOST DURABLE* Car Seat Headrest & Airplane Tray Table Mount Holder on the market for Apple iPad iPad2 The New iPad3 & iPad4 1 2 3 4,Electronics,https://www.amazon.com/iPADKET-DURABLE-Headrest-Airplane-Holder/dp/B004FDF0YO,1,1
Squatty Potty The Original Adjustable Height Bathroom Toilet Stool- Tao Bamboo,"Health, Household & Baby Care",https://www.amazon.com/Squatty-Potty-Original-Adjustable-Bathroom/dp/B00U37CQ16/ref=pd_lpo_121_tr_t_3?_encoding=UTF8&amp;psc=1&amp;refRID=7BQ0RWXFAYEP7WQ6H41R,1,1
Forever Collectibles MINNESOTA VIKINGS BUSY BLOCK UGLY SWEATER,Sports & Outdoors,https://www.amazon.com/Minnesota-Vikings-Sweater-X-Large-Purple/dp/B00JSLK4QW/ref=sr_1_2?ie=UTF8&amp;qid=1447683745&amp;sr=8-2&amp;keywords=ugly+vikings+sweater,1,1
Milton Bradley Battleball Game the Future of Football 2003 Board Game,Sports & Outdoors,https://www.amazon.com/Milton-Bradley-Battleball-Future-Football/dp/B00008NQEF/ref=sr_1_1?ie=UTF8&amp;qid=1431170028&amp;sr=8-1&amp;keywords=battleball,1,1
23 Ways to Get to First Base: The ESPN Uncyclopedia,Books,https://www.amazon.com/Ways-Get-First-Base-Uncyclopedia/dp/1933060107,1,1
SUPER GLUE 19061 Porcelain Repair,Electronics,https://www.amazon.com/SUPER-GLUE-19061-Porcelain-Repair/dp/B00009V3VT,1,1
"League of Denial: The NFL, Concussions, and the Battle for Truth",Books,https://www.amazon.com/League-Denial-Concussions-Battle-Truth/dp/0770437567/ref=sr_1_1?ie=UTF8&amp;qid=1427480741&amp;sr=8-1&amp;keywords=league+of+denial,1,1
"American Red Cross Clipray Clip-On Flashlight and Smartphone Charger, ARCCR100R-SNG",Sports & Outdoors,https://www.amazon.com/American-Clipray-Flashlight-Smartphone-ARCCR100R-SNG/dp/B00CHHFFAY,1,1
"Ten-Gallon War: The NFL’s Cowboys, the AFL’s Texans, and the Feud for Dallas’s Pro Football Future",Books,https://www.amazon.com/Ten-Gallon-War-Cowboys-Dallass-Football/dp/0547435509,1,1
"The Long Snapper LP: A Second Chance, a Super Bowl, a Lesson for Life",Books,https://www.amazon.com/Long-Snapper-LP-Second-Chance/dp/B005OL83A4,1,1
"RCA Multi-Directional, Flat Digital Indoor HDTV Antenna",Electronics,https://www.amazon.com/RCA-Multi-Directional-Digital-Indoor-Antenna/dp/B001GGAIIQ/ref=sr_1_1?s=electronics&amp;ie=UTF8&amp;qid=1436931031&amp;sr=1-1&amp;keywords=rca+digital+antenna,1,1
"NFL Tackle Buddy Inflatable Punching Bag, 40-Inch Tall",Sports & Outdoors,https://www.amazon.com/NFL-Francisco-49ers-Tackle-Buddy/dp/B001H7RNHS,1,1
