name,category,amazon_link,total_mentions,subreddit_mentions
Take Your Eye Off the Ball 2.0: How to Watch Football by Knowing Where to Look,Books,https://www.amazon.com/Take-Your-Eye-Off-Ball/dp/1629371696/ref=sr_1_1?ie=UTF8&amp;qid=1455485669&amp;sr=8-1&amp;keywords=keep+your+eye+off+the+ball,9,7
A Gronking to Remember (Rob Gronkowski Erotica Series) (Volume 1),Books,https://www.amazon.com/Gronking-Remember-Gronkowski-Erotica-Series/dp/150585766X,8,5
Minnesota Vikings 2008 Team Gnome,"Patio, Lawn & Garden",https://www.amazon.com/NFL-Minnesota-Vikings-Garden-Gnome/dp/B001CZJFT4,8,4
AmazonBasics Ultra-Thin Indoor HDTV Antenna - 35 Mile Range,Electronics,https://www.amazon.com/AmazonBasics-Ultra-Thin-Indoor-HDTV-Antenna/dp/B00DIFIO8E/ref=redir_mobile_desktop?_encoding=UTF8&ref_=s9_top_hm_biuv_g23_i1,9,3
War Room: The Legacy of Bill Belichick and the Art of Building the Perfect Team,Books,https://www.amazon.com/War-Room-Belichick-Building-Perfect/dp/006208240X,4,3
The Games That Changed the Game: The Evolution of the NFL in Seven Sundays,Books,https://www.amazon.com/Games-That-Changed-Game-Evolution/dp/0345517962,3,3
False Start: How the New Browns Were Set Up to Fail,Books,https://www.amazon.com/False-Start-Browns-Were-Fail/dp/1886228884,3,3
"RCA ANT111Z Durable FM Antenna, Rabbit Ears",Electronics,https://www.amazon.com/gp/product/B000HKGK8Y,2,2
The Education of a Coach,Books,https://www.amazon.com/Education-Coach-David-Halberstam/dp/1401308791/ref=sr_1_1?s=books&amp;ie=UTF8&amp;qid=1475238301&amp;sr=1-1&amp;keywords=david+halberstam+belichick,2,2
Slow Getting Up: A Story of NFL Survival from the Bottom of the Pile,Books,https://www.amazon.com/Slow-Getting-Up-Survival-Bottom/dp/0062108034/ref=sr_1_1?ie=UTF8&amp;qid=1468774181&amp;sr=8-1&amp;keywords=slow+getting+up,2,2
Boys Will Be Boys: The Glory Days and Party Nights of the Dallas Cowboys Dynasty,Books,https://www.amazon.com/Boys-Will-Be-Cowboys-Dynasty/dp/0061256811/ref=sr_1_1?s=books&amp;ie=UTF8&amp;qid=1426266643&amp;sr=1-1&amp;keywords=boys+will+be+boys,2,2
Madden NFL 08 [Download],Video Games,https://www.amazon.com/Electronic-Arts-70301-Madden-Download/dp/B007XXEG5C,2,2
"Passion Lubes, Natural Water-Based Lubricant, 55 Gallon Drum","Health, Household & Baby Care",https://www.amazon.com/Passion-Lubes-Natural-Water-Based-Lubricant/dp/B005MR3IVO/ref=sr_1_1_a_it?ie=UTF8&amp;qid=1486675538&amp;sr=8-1&amp;keywords=50,74,1
"Passion Lubes Passion Water and Silicone Blend Hybrid Lubricant, 55 Gallon","Health, Household & Baby Care",https://www.amazon.com/Passion-Lubes-Silicone-Hybrid-Lubricant/dp/B00SZ3O6OU/ref=sr_1_1?rps=1&amp;ie=UTF8&amp;qid=1441488684&amp;sr=8-1&amp;keywords=55+gallon+lube,21,1
"Optimum Nutrition Gold Standard 100% Whey Protein Powder, Double Rich Chocolate, 5 Pound","Health, Household & Baby Care",https://www.amazon.com/Optimum-Nutrition-Standard-Double-Chocolate/dp/B000QSNYGI/ref=sr_1_1?s=hpc&amp;ie=UTF8&amp;qid=1433171764&amp;sr=1-1&amp;keywords=protein+powder,9,1
"GoPong Hidden Sunscreen Alcohol Flask, 2-Pack",Home & Kitchen,https://www.amazon.com/GoPong-Hidden-Sunscreen-Alcohol-2-Pack/dp/B00IJ63K86/ref=sr_1_1?ie=UTF8&amp;qid=1427734020&amp;sr=8-1&amp;keywords=sunscreen+flask,6,1
Moneyball: The Art of Winning an Unfair Game,Books,https://www.amazon.com/Moneyball-Art-Winning-Unfair-Game/dp/0393324818,5,1
"Etymotic Research ETY Plugs High Fidelity Earplugs; Standard Fit, Blue Tip, Polybag","Health, Household & Baby Care",https://www.amazon.com/dp/B00G0PPTAK/ref=cm_sw_r_cp_apip_7Uw2xhFnPDT1p,5,1
"Preparation H Hemorrhoidal Cream Maximum Strength Pain Relief With Aloe Tube (0.9 Ounce, Pack of 3)","Health, Household & Baby Care",https://www.amazon.com/Preparation-Cream-Maximum-Strength-Ounce/dp/B0028AD6NI,4,1
"Maxam Jumbo Stainless Steel Flask, 64 oz",Home & Kitchen,https://www.amazon.com/Maxam-Jumbo-Stainless-Steel-Flask/dp/B007PAO4LO/ref=sr_1_1?ie=UTF8&amp;qid=1447621973&amp;sr=8-1&amp;keywords=half+gallon+flask,4,1
"Giant Gummy Bears  Party Python, 8 ft, 26.9 lbs",Grocery & Gourmet Food,https://www.amazon.com/Giant-26-Pound-Gummy-Party-Python/dp/B00LT3L7AO/ref=sr_1_13_s_it?s=grocery&amp;ie=UTF8&amp;qid=1456454377&amp;sr=1-13&amp;keywords=gummy+bears,4,1
If I Did It: Confessions of the Killer,Books,https://www.amazon.com/If-I-Did-Confessions-Killer/dp/0825305934,4,1
"Field of Schemes: How the Great Stadium Swindle Turns Public Money into Private Profit, Revised and Expanded Edition",Books,https://www.amazon.com/Field-Schemes-Stadium-Swindle-Expanded/dp/0803260164/ref=sr_1_1?ie=UTF8&amp;qid=1492023897&amp;sr=8-1&amp;keywords=field+of+schemes,3,1
NFL Greatest Games Series: Green Bay Packers Greatest Games,Movies & TV,https://www.amazon.com/dp/B00186DF5W/,3,1
"Plan B One-step Emergency Contraceptive 1 Tablet,1.5 mg","Health, Household & Baby Care",https://www.amazon.com/Plan-One-step-Emergency-Contraceptive-Tablet/dp/B00H2D6WUA/,3,1
"Shure SM7B Vocal Dynamic Microphone, Cardioid",Musical Instruments,https://www.amazon.com/Shure-SM7B-Dynamic-Microphone-Cardioid/dp/B0002E4Z8M,3,1
"Anker Ergonomic Optical USB Wired Vertical Mouse 1000/1600 DPI, 5 Buttons CE100",Electronics,https://www.amazon.com/Anker-Ergonomic-Optical-Vertical-Buttons/dp/B00FPAVUHC/ref=sr_1_5?s=pc&amp;ie=UTF8&amp;qid=1479837233&amp;sr=1-5&amp;keywords=vertical+mouse,3,1
"MCR Medical Supply SB-1001-010 Silver Mylar Emergency Blanket, 59"" x 87"" (Pack of 10)",Industrial & Scientific,https://www.amazon.com/gp/product/B00BL96D9G,2,1
"Badasses: The Legend of Snake, Foo, Dr. Death, and John Madden's Oakland Raiders",Books,https://www.amazon.com/Badasses-Legend-Maddens-Oakland-Raiders/dp/0061834319,2,1
Football Scouting Methods,Books,https://www.amazon.com/Football-Scouting-Methods-Steve-Belichick/dp/0978588150,2,1
"Haribo SUGAR FREE Classic Gummi Bears, 1 Lb",Grocery & Gourmet Food,https://www.amazon.com/Haribo-SUGAR-Classic-Gummi-Bears/dp/B006J1FBLM/ref=sr_1_1?s=grocery&amp;ie=UTF8&amp;qid=1398234888&amp;sr=1-1,2,1
Vktech Industrial Gas Chemical Anti-Dust Respirator Mask Goggles Set (Style A),Tools & Home Improvement,https://www.amazon.com/Vktech-Industrial-Chemical-Anti-Dust-Respirator/dp/B00B1YP7U2/ref=cts_ap_2_vtp?pf_rd_m=ATVPDKIKX0DER&amp;pf_rd_p=2601945442&amp;pf_rd_r=9SZCNX0Q4KMZYSHFBDCY&amp;pd_rd_wg=14WZX&amp;pf_rd_s=desktop-detail-softlines&amp;pf_rd_t=40701&amp;pd_rd_i=B00B1YP7U2&amp;pd_rd_w=Sh7DA&amp;pf_rd_i=desktop-detail-softlines&amp;pd_rd_r=9SZCNX0Q4KMZYSHFBDCY&amp;_encoding=UTF8,2,1
Steam Gift Card - $50,Video Games,https://www.amazon.com/Steam-Gift-Card-50-Pc/dp/B00HJBPZK8,2,1
Book of Sith: Secrets from the Dark Side [Vault Edition],Books,https://www.amazon.com/Book-Sith-Secrets-Vault-Edition/dp/1612182615,2,1
Glow N Dark Pussy Snorkel,"Health, Household & Baby Care",https://www.amazon.com/Glow-N-Dark-Pussy-Snorkel/dp/B001D26Q16,2,1
Insten Car Cassette Tape Deck Adapter Compatible with 3.5mm Jack Audio MP3/CD Player,Electronics,https://www.amazon.com/Insten-Cassette-Adapter-Compatible-Player/dp/B00QHNCQR4/ref=redir_mobile_desktop?_encoding=UTF8&amp%3Bpf_rd_i=13981611&amp%3Bpf_rd_p=68aba3b4-2c58-509c-a4dd-8cfda7de09a2&amp%3Bpf_rd_r=A2CWWCZHXY6ZVWVB12Y7&amp%3Bpf_rd_s=mobile-hybrid-3&amp%3Bpf_rd_t=30901&ref_=mh_s9_acsd_top_bwfFr_c_x_2_w,2,1
"Shure SM58-LC Vocal Microphone, Cardioid",Musical Instruments,https://www.amazon.com/Shure-SM58-LC-Vocal-Microphone-Cardioid/dp/B000CZ0R42/ref=redir_mobile_desktop?_encoding=UTF8&amp%3BdpID=4106gE2DYWL&amp%3BdpPl=1&amp%3Bkeywords=sm58&amp%3Bpi=SY200_QL40&amp%3Bqid=1475166425&amp%3Bref=plSrch&amp%3Bsr=8-1&ref_=mp_s_a_1_1,2,1
"Kleenex Ultra Soft Facial Tissues, Medium Count Flat, 170 ct, 6 Pack. Designs May Vary","Health, Household & Baby Care",https://www.amazon.com/Kleenex-Facial-Tissues-Medium-Designs/dp/B010OW13V8/,2,1
POTATOES RUSSET FRESH PRODUCE 5 LBS,Grocery & Gourmet Food,https://www.amazon.com/POTATOES-RUSSET-FRESH-PRODUCE-LBS/dp/B007S9ULGY/ref=sr_1_1_a_it?ie=UTF8&amp;qid=1489001060&amp;sr=8-1&amp;keywords=potato,2,1
1byone 25 Miles Super Thin HDTV Antenna with 16.5 Feet High Performance Coaxial Cable - Silver/Black,Electronics,https://www.amazon.com/dp/B00RFLGESE/ref=wl_it_dp_o_pC_nS_ttl?_encoding=UTF8&amp;colid=1F0JVSG8FJD83&amp;coliid=I3NUU83E7QTNUW&amp;psc=1,2,1
The Art of Smart Football,Books,https://www.amazon.com/Art-Smart-Football-Chris-Brown/dp/069244825X/ref=pd_sim_14_7?ie=UTF8&amp;dpID=51KnUI-8LpL&amp;dpSrc=sims&amp;preST=_AC_UL160_SR105,2,1
The Rhode Island Dictionary,Books,https://www.amazon.com/Rhode-Island-Dictionary-Mark-Patinkin/dp/0971358419/ref=sr_1_1?ie=UTF8&amp;qid=1453162802&amp;sr=8-1&amp;keywords=don+bousquet,2,1
Take Your Eye Off the Ball: Playbook Edition,Books,https://www.amazon.com/Take-Your-Eye-Off-Ball/dp/1600786170/ref=tmm_other_meta_binding_title_0?_encoding=UTF8&amp;sr=&amp;qid=,2,1
New England Patriots 2008 Team Gnome,Sports & Outdoors,https://www.amazon.com/NFL-England-Patriots-Garden-Gnome/dp/B001D518N4/ref=sr_1_1?ie=UTF8&amp;qid=1427069038&amp;sr=8-1&amp;keywords=patriots+gnome,1,1
"Alive and Kicking: My Journey Through Football, Addiction and Life",Books,https://www.amazon.com/Alive-Kicking-Journey-Football-Addiction/dp/0983733724,1,1
"Big Blue Wrecking Crew: Smashmouth Football, a Little Bit of Crazy, and the '86 Super Bowl Champion New York Giants",Books,https://www.amazon.com/Big-Blue-Wrecking-Crew-Smashmouth/dp/1250071534/ref=sr_1_1?ie=UTF8&amp;qid=1478793264&amp;sr=8-1&amp;keywords=86+giants,1,1
Bose SoundLink On-Ear Bluetooth Wireless Headphones - Black,Electronics,https://www.amazon.com/Bose-SoundLink-On-Ear-Bluetooth-Headphones/dp/B00M58CMYC,1,1
"The OFFICIAL ROXANT PRO video camera stabilizer Limited Edition (Midnight Black) With Low Profile Handle for GoPro, Smartphone, Canon, Nikon - or any camera up to 2.1 lbs.",Electronics,https://www.amazon.com/OFFICIAL-Midnight-Limited-stabilizer-Smartphone/dp/B00S10KFTC/ref=lp_196573011_1_5?s=photo&amp;ie=UTF8&amp;qid=1481290620&amp;sr=1-5,1,1
'Bonkers' Bear Coat from Begreenman.com,"Clothing, Shoes & Jewelry",https://www.amazon.com/Bonkers-Bear-Coat-from-Begreenman-com/dp/B00EW6WZ5Q/ref=aag_m_pw_dp?ie=UTF8&amp;m=A31E2VBC0OCSX7,1,1
Net Worth,Movies & TV,https://www.amazon.com/Net-Worth-Aidan-Devine/dp/B0000D9BCU,1,1
"Kool-Aid Drink Mix, Sugar Sweetened Grape, 19-Ounce Container (Pack of 4)",Grocery & Gourmet Food,https://www.amazon.com/Kool-Aid-Drink-Sweetened-19-Ounce-Container/dp/B001EQ4SP2,1,1
Pigskin: The Early Years of Pro Football,Books,https://www.amazon.com/Pigskin-The-Early-Years-Football/dp/0195119134,1,1
"Halas by Halas: The Autobiography of George Halas by George Stanley Halas (September 25,1979)",Books,https://www.amazon.com/Halas-Autobiography-George-Stanley-September/dp/B015X48Z54/ref=sr_1_11?s=books&amp;ie=UTF8&amp;qid=1448729406&amp;sr=1-11&amp;keywords=george+halas+book,1,1
When Football Was Football: The Chicago Cardinals and the Birth of the NFL,Books,https://www.amazon.com/When-Football-Was-Chicago-Cardinals/dp/1572433175/ref=sr_1_1?s=books&amp;ie=UTF8&amp;qid=1448729074&amp;sr=1-1&amp;keywords=when+football+was+football,1,1
Fritz Pollard: PIONEER IN RACIAL ADVANCEMENT (Sport and Society),Books,https://www.amazon.com/Fritz-Pollard-PIONEER-ADVANCEMENT-Society/dp/0252067991/ref=sr_1_2?s=books&amp;ie=UTF8&amp;qid=1448729107&amp;sr=1-2&amp;keywords=fritz+pollard,1,1
"Star Wars, Starbucks Coffee parody MUG. Ceramic / Dishwasher proof",Home & Kitchen,https://www.amazon.com/Starbucks-Coffee-parody-Ceramic-Dishwasher/dp/B007T540QE,1,1
Playing for Pizza: A Novel,Books,https://www.amazon.com/dp/0345532058/ref=cm_sw_r_other_apa_tr5Ixb8E9191M,1,1
"250 ft 1/2"" x  24"" wide LARGE BUBBLE WRAP, perforated every 12"", 500 total sq ft",Office Products,https://www.amazon.com/LARGE-BUBBLE-perforated-every-total/dp/B001PL9YJG,1,1
Glitter,Movies & TV,https://www.amazon.com/Glitter-Max-Beesley/dp/B00005TNER,1,1
The President's Team: The 1963 Army-Navy Game and the Assassination of JFK,Books,https://www.amazon.com/The-Presidents-Team-Army-Navy-Assassination/dp/0760337624,1,1
Olive Drab Air Force Pilot's Flask (1 Pint) by Unknown,Home & Kitchen,https://www.amazon.com/Olive-Drab-Force-Pilots-Flask/dp/B004WXCPYA/ref=sr_1_2?ie=UTF8&amp;amp;qid=1452008878&amp;amp;sr=8-2&amp;amp;keywords=pilots+flask,1,1
Field of Schemes: How the Great Stadium Swindle Turns Public Money into Private Profit,Books,https://www.amazon.com/Field-Schemes-Stadium-Swindle-Private/dp/1567511384,1,1
NFL 50 Greatest Quarterbacks VHS,Movies & TV,https://www.amazon.com/NFL-50-Greatest-Quarterbacks-VHS/dp/6305074518,1,1
"Bulk Skittles in an 8 lb Resealable Bomber Bag Fresh, Tasty Treats - Great For Office Candy Bowls - Vending Machine Refill - Holidays -Wholesale - Party Size!!!!",Grocery & Gourmet Food,https://www.amazon.com/Skittles-Bulk-Bag-Original/dp/B00OQEXHK6,1,1
Dan Rooney: My 75 Years with the Pittsburgh Steelers and the NFL,Books,https://www.amazon.com/Dan-Rooney-Years-Pittsburgh-Steelers/dp/0306817454,1,1
AAA 65-Piece Winter Severe Weather Travel Kit,Automotive Parts & Accessories,https://www.amazon.com/AAA-65-Piece-Winter-Severe-Weather/dp/B0006MQJ02,1,1
"Pedialyte Electrolyte Powder, Electrolyte Drink, Grape, Powder Sticks, 0.6 oz Packets (Pack of 6)","Health, Household & Baby Care",https://www.amazon.com/dp/B01DFA1UZA?tag=price15422-20&amp;ascsubtag=wtbs_595a5733b18ff33846817ce5&amp;th=1,1,1
WILDLIFE FACT-FILE Animal Identification and Conservation Guide [3-ring hardcover binder],Books,https://www.amazon.com/WILDLIFE-FACT-FILE-Identification-Conservation-hardcover/dp/1886614032,1,1
Slow Getting Up: A Story of NFL Survival from the Bottom of the Pile,Books,https://www.amazon.com/Slow-Getting-Up-Survival-Bottom/dp/0062108026,1,1
Football Scouting Methods,Books,https://www.amazon.com/Football-Scouting-Methods-Steve-Belichick/dp/1891396757,1,1
"Fetish Fantasy Big Daddy Hollow 10-Inch Strap On, Black","Health, Household & Baby Care",https://www.amazon.com/Fetish-Fantasy-Daddy-Hollow-10-Inch/dp/B002UVAGCE,1,1
NFL Game Day Board Game,Toys & Games,https://www.amazon.com/NFL-Game-Day-Board/dp/B00C9KRYY4,1,1
The New Eagles Encyclopedia,Books,https://www.amazon.com/New-Eagles-Encyclopedia-Ray-Didinger/dp/1439912114,1,1
Rugby Poems: Sonnets and Such,Books,https://www.amazon.com/Rugby-Poems-Sonnets-Daniel-OLeary/dp/1515394522,1,1
Think Like A Champion: Building Success One Victory at a Time,Books,https://www.amazon.com/Think-Like-Champion-Building-Success/dp/0066620392,1,1
First Xmas Without Harambe Gift: Porcelain Circle Ornament,Home & Kitchen,https://www.amazon.com/gp/product/B01MSMVWS7/,1,1
"Turnstile Security - 1101E-SS-FE-DA - Left Entrance, Free Exit",Tools & Home Improvement,https://www.amazon.com/Turnstile-Security-1101E-SS-FE-DA-Left-Entrance/dp/B01IWHZ4DK/ref=sr_1_66?ie=UTF8&amp;qid=1488999162&amp;sr=8-66,1,1
Zen Reflections Juniper Bonsai,Grocery & Gourmet Food,https://www.amazon.com/9GreenBox-Zen001-Reflections-Juniper-Bonsai/dp/B00K57JJ96/ref=sr_1_3_a_it?ie=UTF8&amp;qid=1489511847&amp;sr=8-3&amp;keywords=bonsai,1,1
"Stadium Mustard, 12 oz  (Pack Of 1)",Grocery & Gourmet Food,https://www.amazon.com/Stadium-Mustard-12-oz/dp/B0000DG5EE/ref=sr_1_2?ie=UTF8&amp;qid=1431010283&amp;sr=8-2&amp;keywords=stadium+mustard,1,1
"Comfitwear FCC-600 Traffic Cones with 3M Reflective Collars, Orange, 28"" H",Tools & Home Improvement,https://www.amazon.com/Orange-Traffic-Cones-Reflective-Collars/dp/B000VWZHLY,1,1
Blue BBOP Buddy Bumper Ball Inflatable Blow Up Giant Wearable Body Bubble Zorb Soccer Suit Durable PVC Vinyl Outdoor Active Play 36'' Diam,Toys & Games,https://www.amazon.com/Buddy-Bounce-Outdoor-Play-Inflatable/dp/B009E8LPDK,1,1
"Domino Sugar, Granulated, 10-Pound Bags",Grocery & Gourmet Food,https://www.amazon.com/gp/product/B00060N5OW/ref=s9_acsd_zgift_hd_bw_b16T27_c_x_w?pf_rd_m=ATVPDKIKX0DER&amp;pf_rd_s=merchandised-search-3&amp;pf_rd_r=AMKGW1B2TKTYH36V7488&amp;pf_rd_t=101&amp;pf_rd_p=8b14c1cd-481c-4564-80bf-ed860548adb6&amp;pf_rd_i=16317911&amp;th=1,1,1
Copper Fit Sport Socks (2 Pair),Sports & Outdoors,https://www.amazon.com/Copper-Fit-Ankle-Sports-Socks/dp/B00OIFQ85O/ref=redir_mobile_desktop?_encoding=UTF8&%2AVersion%2A=1&%2Aentries%2A=0,1,1
How to Good-bye Depression: If You Constrict Anus 100 Times Everyday. Malarkey? or Effective Way?,Books,https://www.amazon.com/How-Good-bye-Depression-Constrict-Everyday/dp/0595094724,1,1
The Genius: How Bill Walsh Reinvented Football and Created an NFL Dynasty,Books,https://www.amazon.com/Genius-Reinvented-Football-Created-Dynasty/dp/0345499123/ref=sr_1_74?s=books&amp;ie=UTF8&amp;qid=1475238145&amp;sr=1-74&amp;keywords=nfl+book,1,1
The Rookie Handbook: How to Survive the First Season in the NFL,Books,https://www.amazon.com/Rookie-Handbook-Survive-First-Season/dp/1682450341/ref=sr_1_4?ie=UTF8&amp;qid=1475237975&amp;sr=8-4&amp;keywords=nfl+book,1,1
"NFL Logo Only Flag with Grommetts, 3 x 5-Foot",Sports & Outdoors,https://www.amazon.com/Oakland-Raiders-Logo-Only-Grommetts/dp/B006UTFJF6/ref=redir_mobile_desktop?_encoding=UTF8&amp%3BdpID=41qe4njofEL&amp%3BdpPl=1&amp%3Bkeywords=Oakland%20Raider%20flag&amp%3Bpi=AC_SX236_SY340_QL65&amp%3Bqid=1478109618&amp%3Bref=plSrch&amp%3Bsr=8-1&ref_=mp_s_a_1_1,1,1
Think Like a Champion,Books,https://www.amazon.com/Think-Like-Champion-Mike-Shanahan/dp/0788199706,1,1
"Symphonized DRM Premium Genuine Wood In-ear Noise-isolating Headphones with Mic, Red/Gray",Electronics,https://www.amazon.com/gp/product/B00YJS4RLM?psc=1&amp;redirect=true&amp;ref_=oh_aui_detailpage_o02_s00,1,1
America's Game: The Epic Story of How Pro Football Captured a Nation,Books,https://www.amazon.com/Americas-Game-Football-Captured-Nation/dp/B001PIHVHG,1,1
Brady vs Manning: The Untold Story of the Rivalry That Transformed the NFL,Books,https://www.amazon.com/Brady-Manning-Untold-Rivalry-Transformed/dp/0804139393,1,1
"WELCH‘S Fruit Snacks Mixed Fruit, 250 Count",Grocery & Gourmet Food,https://www.amazon.com/WELCHS-Fruit-Snacks-Mixed-Count/dp/B003N47YUO,1,1
"Last Team Standing: How the Steelers and the Eagles--""The Steagles""--Saved Pro Football During World War II",Books,https://www.amazon.com/Last-Team-Standing-Steelers-Eagles/dp/B000WCNXHS/ref=tmm_hrd_swatch_0?_encoding=UTF8&amp;qid=1497738922&amp;sr=8-1,1,1
Twilight Struggle Deluxe Edition,Toys & Games,https://www.amazon.com/GMT-Twilight-Struggle/dp/B000TQ17FC,1,1
Bond 50: The Complete 22 Film Collection [Blu-ray],Movies & TV,https://www.amazon.com/Bond-50-Complete-Collection-Blu-ray/dp/B006U1J5ZY,1,1
NFL Tag Frame,Sports & Outdoors,https://www.amazon.com/NFL-Oakland-Raiders-Tag-Frame/dp/B004B3LFVU,1,1
GPX R300B AM/FM Armband Radio with Earbuds,Electronics,https://www.amazon.com/GPX-R300B-Armband-Radio-Earbuds/dp/B003EXMSFK/ref=pd_sim_sbs_23_4?ie=UTF8&amp;refRID=0SRVXQ2FCXT8415HDZZK&amp;dpID=41emVqNSfML&amp;dpSrc=sims&amp;preST=_AC_UL160_SR160,1,1
Shot Glass Chess Set Drinking Game - Drunken Chess,Toys & Games,https://www.amazon.com/Shot-Glass-Chess-Drinking-Game/dp/B00NQFIB7U,1,1
"GEEK TEEZ 30 Rock Inspired ""Music Band"" Men's T-Shirt","Clothing, Shoes & Jewelry",https://www.amazon.com/GEEK-TEEZ-Inspired-Music-T-Shirt/dp/B01H7Z7094,1,1
Next Man Up: A Year Behind the Lines in Today's NFL,Books,https://www.amazon.com/Next-Man-Up-Behind-Todays/dp/0316013285,1,1
"Just Win, Baby: The Al Davis Story",Books,https://www.amazon.com/Just-Win-Baby-Davis-Story/dp/1600787649/ref=sr_1_1?s=books&amp;ie=UTF8&amp;qid=1431977143&amp;sr=1-1&amp;keywords=al+davis,1,1
Shadow & Claw: The First Half of 'The Book of the New Sun',Books,https://www.amazon.com/Shadow-Claw-First-Half-Book/dp/0312890176,1,1
Leg Avenue Women's Cozy Bat Costume,"Clothing, Shoes & Jewelry",https://www.amazon.com/Leg-Avenue-Womens-Costume-Black/dp/B00JSJOSW0/ref=sr_1_1?ie=UTF8&amp;qid=1474476676&amp;sr=8-1&amp;keywords=bat+costume,1,1
Workaholics Official Bear Costume Coat One Size,"Clothing, Shoes & Jewelry",https://www.amazon.com/Workaholics-Official-Bear-Costume-Coat/dp/B009EGAE3O/ref=sr_1_1?s=apparel&amp;ie=UTF8&amp;qid=1443395914&amp;sr=1-1&amp;nodeID=7141123011&amp;keywords=Bear+coat,1,1
Jerry Rice & Nitus' Dog Football,Video Games,https://www.amazon.com/Jerry-Rice-Nitus-Football-nintendo-wii/dp/B005GBV5YI,1,1
"Streamlight 66124 Stylus Pro Pen Light with Green LED and Holster, Realtree Hardwood High Definition Green Camo",Tools & Home Improvement,https://www.amazon.com/Streamlight-66124-Realtree-Hardwood-Definition/dp/B002E1AUGM/ref=redir_mobile_desktop?_encoding=UTF8&amp%3Bqid=1483312376&amp%3Brefinements=p_85&amp%3Bsr=8-2&ref_=mp_s_a_1_2,1,1
"72,000 Live Ladybugs - Good Bugs - Ladybug Gallon - Guaranteed Live Delivery!","Patio, Lawn & Garden",https://www.amazon.com/72-000-Live-Ladybugs-Guaranteed/dp/B01B205Q0U/ref=sr_1_7?srs=3019836011&amp;ie=UTF8&amp;qid=1466039873&amp;sr=8-7,1,1
Football Coaching Strategies,Books,https://www.amazon.com/dp/0873228693/ref=rdr_ext_tmb,1,1
Defensive Football Strategies (American Football Coaches Association),Books,https://www.amazon.com/Defensive-Football-Strategies-American-Association/dp/0736001425/ref=sr_1_12?ie=UTF8&amp;qid=1374154867&amp;sr=8-12&amp;keywords=Coaching+Football,1,1
Not a Game: The Incredible Rise and Unthinkable Fall of Allen Iverson,Books,https://www.amazon.com/Not-Game-Incredible-Unthinkable-Iverson/dp/1476778973,1,1
Offensive Football Strategies,Books,https://www.amazon.com/dp/0736001395/ref=rdr_ext_tmb,1,1
"New Pig DRM166 Burpless Extra-Large Polyethylene Funnel, 22"" Length x 20"" Width x 10"" Height, Red",Industrial & Scientific,https://www.amazon.com/New-Pig-Burpless-Extra-Large-Polyethylene/dp/B00BUBX1RM/ref=sr_1_14?ie=UTF8&amp;qid=1485504316&amp;sr=8-14&amp;keywords=huge+funnel,1,1
"Earth Animal No-Hide Chicken Chews Large 7oz, 2-Pack",Pet Supplies,https://www.amazon.com/Earth-Animal-No-Hide-Chicken-2-Pack/dp/B0125DS0LU,1,1
"Hey,Wait a Minute (I Wrote a Book!)",Books,https://www.amazon.com/Hey-Wait-Minute-Wrote-Book/dp/0394531094/ref=sr_1_2?ie=UTF8&amp;qid=1448487871&amp;sr=8-2&amp;keywords=john+madden+books,1,1
One Knee Equals Two Feet: And Everything Else You Need to Know About Football,Books,https://www.amazon.com/One-Knee-Equals-Two-Feet/dp/0394553284/ref=sr_1_1?ie=UTF8&amp;qid=1448487871&amp;sr=8-1&amp;keywords=john+madden+books,1,1
One Size Doesn't Fit All,Books,https://www.amazon.com/One-Size-Doesnt-Fit-All/dp/0394563131/ref=sr_1_13?ie=UTF8&amp;qid=1448487871&amp;sr=8-13&amp;keywords=john+madden+books,1,1
Football For Dummies,Books,https://www.amazon.com/Football-Dummies-Howie-Long/dp/1119022630/ref=pd_sbs_14_img_0?_encoding=UTF8&amp;psc=1&amp;refRID=ZNM3F88KHAHZFC6PMA0T,1,1
A Game of Passion: The NFL Literary Companion,Books,https://www.amazon.com/Game-Passion-The-Literary-Companion/dp/1570361061,1,1
CHEESEHEAD WEDGE COZY,Sports & Outdoors,https://www.amazon.com/Cheesehead-10120-CHEESEHEAD-WEDGE-COZY/dp/B007REROFQ,1,1
"Quaffer Double Bubble Layered Shot Glass plus Recipe Card, Set of 4",Home & Kitchen,https://www.amazon.com/Quaffer-Double-Bubble-Layered-Recipe/dp/B00A0BLV0W/ref=sr_1_2?ie=UTF8&amp;qid=1457840263&amp;sr=8-2&amp;keywords=shot+and+chaser+glass,1,1
VonShef 6 Cup Italian Espresso Coffee Maker Stove Top Macchinetta,Home & Kitchen,https://www.amazon.com/VonShef-Italian-Espresso-Coffee-Macchinetta/dp/B00DYV4IZA/ref=sr_1_4?ie=UTF8&amp;qid=1473355772&amp;sr=8-4&amp;keywords=stove+top+espresso+maker,1,1
The Hidden Game of Football,Books,https://www.amazon.com/The-Hidden-Game-Football-Carroll/dp/0446514144,1,1
Wilson NFL Super Grip Football,Sports & Outdoors,https://www.amazon.com/Wilson-Super-Grip-Official-Football/dp/B0012SNLJG/ref=sr_1_3?s=sporting-goods&amp;ie=UTF8&amp;qid=1489785310&amp;sr=1-3&amp;keywords=wilson+football,1,1
"Duro-Med Deluxe Bedpan, Smooth Countoured Bariatric Bedpan, Autoclavable","Health, Household & Baby Care",https://www.amazon.com/Duro-Med-Deluxe-Smooth-Contoured-Autoclavable/dp/B0009STN8S,1,1
Pink Floyd: The Wall,Movies & TV,https://www.amazon.com/Pink-Floyd-Wall-Anniversary-Deluxe/dp/B0006ZE7G2/ref=sr_1_2?ie=UTF8&amp;qid=1469819318&amp;sr=8-2&amp;keywords=the+wall,1,1
MagicLight Pro Bluetooth Smart LED Light Bulb - Smartphone Controlled Sunrise Wake Up LED Lights - Dimmable Multicolored Color Changing Party Lights Bulb - 80w Equivalent,Tools & Home Improvement,https://www.amazon.com/dp/B00Y6X93EQ/ref=sr_ph_1?ie=UTF8&amp;qid=1484154232&amp;sr=sr-1&amp;keywords=smart+light,1,1
"TaoTronics LED Desk Lamp, Dimmable LED Table Lamp, Cool White Reading Light, Eye-caring Book Light (3-Level Dimmer, Touch-Sensitive Control, Night Light, Glossy Black, 6W)",Tools & Home Improvement,https://www.amazon.com/TaoTronics-Dimmable-Touch-Sensitive-Controller-Black/dp/B00M7TVSG2/ref=sr_1_5?s=lamps-light&amp;ie=UTF8&amp;qid=1443405124&amp;sr=1-5&amp;keywords=desk+lamp,1,1
Bleachers: A Novel,Books,https://www.amazon.com/Bleachers-Novel-John-Grisham/dp/0345532031,1,1
A Few Seconds of Panic: A Sportswriter Plays in the NFL,Books,https://www.amazon.com/Few-Seconds-Panic-Sportswriter-Plays/dp/0143115472/ref=sr_1_1?ie=UTF8&amp;qid=1468774209&amp;sr=8-1&amp;keywords=a+few+seconds+of+panic,1,1
The Dirt: Confessions of the World's Most Notorious Rock Band,Books,https://www.amazon.com/The-Dirt-Confessions-Worlds-Notorious/dp/0060989157,1,1
"Torani Strawberry Real Fruit Smoothie Mix, 64 oz",Grocery & Gourmet Food,https://www.amazon.com/Torani-Strawberry-Real-Fruit-Smoothie/dp/B003UW9P3S,1,1
Those Guys Have All the Fun: Inside the World of ESPN,Books,https://www.amazon.com/Those-Guys-Have-All-Fun/dp/B00BR4W8F8,1,1
"SE - Tape Measure - Tailor's, Round Tape, 5ft(60in.) - MT8R",Tools & Home Improvement,https://www.amazon.com/SE-Measure-Tailors-Round-60in/dp/B004XJ9ZJQ,1,1
O Holy Cow!: The Selected Verse of Phil Rizzuto,Books,https://www.amazon.com/Holy-Cow-Selected-Verse-Rizzuto/dp/0061567132,1,1
Wilson Game Ball Prep Kit,Sports & Outdoors,https://www.amazon.com/Wilson-Game-Ball-Prep-Kit/dp/B00F0WWQVY,1,1
Magic Silk Men Silk Knit Panel Short,"Health, Household & Baby Care",https://www.amazon.com/Magic-Silk-Knit-Panel-Short/dp/B003R5H21U,1,1
