name,category,amazon_link,total_mentions,subreddit_mentions
America's Game: The Epic Story of How Pro Football Captured a Nation,Book,http://www.amazon.com/dp/0375725067/,4,1
Aren't We Sioux Enough?: The Truth Behind the Attack on the U.N.D. Fighting Sioux Tradition,Book,http://www.amazon.com/dp/0615990681/,1,1
The Art of Smart Football,Book,http://www.amazon.com/dp/069244825X/,8,1
"Blood, Sweat & Chalk: The Ultimate Football Playbook: How the Great Coaches Built Today's Game",Book,http://www.amazon.com/dp/1603200614/,8,1
Take Your Eye Off the Ball 2.0: How to Watch Football by Knowing Where to Look,Book,http://www.amazon.com/dp/1629371696/,28,1
Take Your Eye Off the Ball 2.0: How to Watch Football by Knowing Where to Look,eBooks,http://www.amazon.com/dp/B015M9SQC2/,5,1
