name,category,amazon_link,total_mentions,subreddit_mentions
Science of Being and Art of Living: Transcendental Meditation,Book,http://www.amazon.com/dp/0452282667/,1,1
The Doctrine of Vibration: An Analysis of the Doctrines and Practices of Kashmir Shaivism (The Suny Series in the Shaiva Traditions of Kashmir),Book,http://www.amazon.com/dp/0887064329/,1,1
"The Triadic Heart of Siva: Kaula Tantricism of Abhinavagupta in the Non-Dual Shaivism of Kashmir (Suny Series, Shaiva Traditions of Kashmir)",Book,http://www.amazon.com/dp/0887067875/,1,1
"As It Is, Vol. 2",Book,http://www.amazon.com/dp/9627341398/,1,1
By Are Holen Acem Meditation - An Introductory Companion [Paperback],Book,http://www.amazon.com/dp/B00RWT5CCS/,1,1
