name,category,amazon_link,total_mentions,subreddit_mentions
The Only Grant-Writing Book You'll Ever Need: Top Grant Writers and Grant Givers Share Their Secrets,Book,http://www.amazon.com/dp/0465018696/,1,1
Keep Your Donors: The Guide to Better Communications & Stronger Relationships,Book,http://www.amazon.com/dp/0470080396/,1,1
Starting and Managing a Nonprofit Organization: A Legal Guide,Book,http://www.amazon.com/dp/1118413458/,1,1
"The Work of Leaders: How Vision, Alignment, and Execution Will Change the Way You Lead",Book,http://www.amazon.com/dp/1118636538/,1,1
The Law of Tax-Exempt Organizations (Wiley Nonprofit Authority),Book,http://www.amazon.com/dp/1118873696/,1,1
How Strategy Works: Using the Strategy Process Cycle to Develop Competitive Advantage,Book,http://www.amazon.com/dp/1491078480/,1,1
"Nonprofit Organizations, Cases and Materials, 4th (University Casebook Series)",Book,http://www.amazon.com/dp/1599416654/,1,1
Fiscal Sponsorship: 6 Ways to Do It Right,Book,http://www.amazon.com/dp/1888956070/,1,1
Retention Fundraising: The New Art and Science of Keeping Your Donors for Life,Book,http://www.amazon.com/dp/1889102539/,1,1
The Only Grant-Writing Book You'll Ever Need,eBooks,http://www.amazon.com/dp/B00GL9TODI/,1,1
