name,category,amazon_link,total_mentions,subreddit_mentions
Kingston 8 GB microSDHC Class 4 Flash Memory Card SDC4/8GBET,CE,http://www.amazon.com/dp/B00200K1TS/,6,1
OfficeSuite Professional,Mobile Application,http://www.amazon.com/dp/B0051UP5NQ/,2,1
Latitude Jacket Carrying Case for Digital Text Reader - Black,Wireless,http://www.amazon.com/dp/B005GQGQYC/,1,1
NOOK Simple Touch (Certified Pre-Owned),CE,http://www.amazon.com/dp/B00ESW6X16/,1,1
Premium Advanced Imitation Leather Cover Sleeve Case with Magnetic Closure for NOOK GlowLight (NOOK 4th Gen) - (NOT fit NOOK Simple Touch with GlowLight NOOK 3rd Gen or NOOK Simple Touch NOOK 2nd Gen) (Coffee),Wireless,http://www.amazon.com/dp/B00HVRK3B6/,1,1
