name,category,amazon_link,total_mentions,subreddit_mentions
One Night Wilderness: San Francisco Bay Area: Quick and Convenient Backpacking Trips within Two Hours of San Francisco,Book,http://www.amazon.com/dp/0899976239/,6,3
"Backpacking California: Mountain, Foothill, Coastal and Desert Adventures in the Golden State",Book,http://www.amazon.com/dp/0899974465/,2,1
The Kern River Sierra Outdoor Recreation Topo Map,Book,http://www.amazon.com/dp/0972336141/,3,1
Tuleyome's Trails Guide: Yolo and Solano County,Book,http://www.amazon.com/dp/136517624X/,1,1
Tuleyome's Trails Guide: Colusa and Glenn County,Book,http://www.amazon.com/dp/1365230333/,1,1
Tuleyome's Trails Guide: Napa and Lake County,Book,http://www.amazon.com/dp/136525142X/,1,1
Swimming Holes of California,Book,http://www.amazon.com/dp/1490456872/,1,1
"Laws Field Guide to the Sierra Nevada, The (California Academy of Sciences)",Book,http://www.amazon.com/dp/159714052X/,2,1
Blue Desert SmarTube Hydration System,Sports,http://www.amazon.com/dp/B000GM6LWS/,5,1
Hiking California's Trinity Alps Wilderness: A Guide To The Area's Greatest Hiking Adventures (Regional Hiking Series),Book,http://www.amazon.com/dp/0762741236/,1,1
Lighter1 Lil' Sami Bear Canister,Sports,http://www.amazon.com/dp/B00FM23RPG/,1,1
