name,category,amazon_link,total_mentions,subreddit_mentions
Norwegian Verbs And Essentials of Grammar,Book,http://www.amazon.com/dp/084428596X/,3,3
Fluent Forever: How to Learn Any Language Fast and Never Forget It,Book,http://www.amazon.com/dp/0385348118/,20,1
Norwegian: An Essential Grammar (Routledge Essential Grammars),Book,http://www.amazon.com/dp/0415109795/,2,1
"Beginner's Norwegian with 2 Audio CDs, Second Edition",Book,http://www.amazon.com/dp/0781812992/,1,1
"Complete Norwegian Beginner to Intermediate Course: Learn to read, write, speak and understand a new language (Teach Yourself)",Book,http://www.amazon.com/dp/1444195042/,3,1
