name,category,amazon_link,total_mentions,subreddit_mentions
"Point and Line to Plane (Dover Fine Art, History of Art)",Book,http://www.amazon.com/dp/0486238083/,1,1
A Nightmare's Prayer: A Marine Harrier Pilot's War in Afghanistan,Book,http://www.amazon.com/dp/143919498X/,1,1
"Crayola Bulk Crayons, 800 Count Classpack, 16 Assorted Colors (50 Each)",Toy,http://www.amazon.com/dp/B00006IBPK/,1,1
Carex 26 Inch EZ Grabber Reaching Aid - colors may vary,Health and Beauty,http://www.amazon.com/dp/B000AEGCW6/,4,1
Scientific Explorer Disgusting Science Kit,Toy,http://www.amazon.com/dp/B000BUW7E6/,2,1
Glad ClingWrap Plastic Food Wrap - 200 Square Foot Roll - 12 Pack,Health and Beauty,http://www.amazon.com/dp/B000EG73XW/,1,1
1 X ROCKLINE BASKET COFFEE FILTERS (8-12 Cup Basket) 700 Filters,Grocery,http://www.amazon.com/dp/B001UBNRH6/,1,1
Swann 4-Channel DVR4-2550 and 4x ADS-180 CMOS SWDVK-425504C Cameras,Photography,http://www.amazon.com/dp/B0058W5RC6/,1,1
"Giddy Up & Go Granola, Notoriously Nutty, Bulk, 2.5 Pound",Grocery,http://www.amazon.com/dp/B0091DV58S/,1,1
"Dell Alienware Area-51 Gaming Machine (Intel Core i7-5820K 6-cores, 32GB DDR4 Ram, 18 TB HDD, Windows 7 Professional)",Personal Computer,http://www.amazon.com/dp/B00QN0UFLA/,7,1
Sannysis Nail Stamping Printing Plate Manicure Nail Art Decor Image Stamps Plate,Beauty,http://www.amazon.com/dp/B00X6V7BRU/,5,1
Pet Memorial Picture Frame - Bereavement Photo Frame for Dog or Cat - You Were my Favorite Hello and My Hardest Goodbye - Holds a 4 x 6 Photo,Home,http://www.amazon.com/dp/B01FE5N60G/,1,1
Gaming Keyboard Mechanical Brown Switches 104-Key Doubleshot ABS Outemu Velocifire VM01 LED Illuminated Backlit Anti-ghosting Keys Full Size (Wired),PC Accessory,http://www.amazon.com/dp/B01M0QEYR4/,27,1
