name,category,amazon_link,total_mentions,subreddit_mentions
LUCKKYY®Welcome may all who come as guests leave as friends Vinyl Wall Decal,Home Improvement,http://www.amazon.com/dp/B00X19PCH8/,4,1
"The Dead Beat: Lost Souls, Lucky Stiffs, and the Perverse Pleasures of Obituaries (P.S.)",Book,http://www.amazon.com/dp/0060758767/,1,1
"Replacement Automatic Paper Towel Dispenser Keys, Plain Steel, 2-Pack",BISS,http://www.amazon.com/dp/B00SPGWBNA/,1,1
Making Memories Jill Schwartz Vintage Groove Alpha Charms G,Art and Craft Supply,http://www.amazon.com/dp/B003HM7MEU/,1,1
Dutch Glow Scratch Aide Kit,Home,http://www.amazon.com/dp/B00W23A79C/,1,1
ADIDAS X JEREMY SCOTT UNISEX JS TIGER FASHION SNEAKERS ORANGE BLACK M29010,Shoes,http://www.amazon.com/dp/B00NPTITLA/,1,1
"ProGreen 9W Flat LED Panel Light Lamp, Dimmable Round Ultrathin LED Recessed Downlight, 720lm, Warm White 3000K, Cut Hole 4.9 Inch, Panel Ceiling Lighting with 110V LED Driver",Home,http://www.amazon.com/dp/B01FX5D4UE/,1,1
