name,category,amazon_link,total_mentions,subreddit_mentions
"Acer Predator XB271HU bmiprz 27"" WQHD (2560x1440) NVIDIA G-SYNC IPS Display, (Display Port & HDMI Port, 144Hz)",Electronics,https://www.amazon.com/Acer-Predator-XB271HU-27-inch-Widescreen/dp/B0173PEX20,8,2
"AOC G2460PF 24-Inch Professional Gaming LED Monitor Free Sync,144hz,1ms, Hght Adjust, Spk, VGA DVI HDMI DP USB",Electronics,https://www.amazon.com/AOC-G2460PF-24-Inch-Gaming-Monitor/dp/B01BV1XBEI/ref=sr_1_1?s=pc&amp;ie=UTF8&amp;qid=1463880544&amp;sr=1-1&amp;keywords=g2460pf,15,1
"ASUS VG248QE 24"" Full HD 1920x1080 144Hz 1ms HDMI Gaming Monitor",Electronics,https://www.amazon.com/Asus-VG248QE-24-inch-Ergonomic-Back-lit/dp/B00B2HH7G0/175-8477342-7359324?ie=UTF8&amp;*Version*=1&amp;*entries*=0,13,1
Puget Systems Universal Acrylic GPU Brace,Electronics,https://www.amazon.com/dp/B019ZZQVK8/ref=cm_sw_r_cp_apa_YVYGxbJ0YH0GT,11,1
"ASUS ROG SWIFT PG279Q 27"" 2560x1440 IPS 165Hz 4ms G-SYNC Eye Care Gaming Monitor with DP and HDMI ports",Electronics,https://www.amazon.com/PG279Q-2560x1440-G-SYNC-Gaming-Monitor/dp/B017EVR2VM/ref=cm_cr_arp_d_product_top?ie=UTF8,5,1
LG Electronics OLED55B6P Flat 55-Inch 4K Ultra HD Smart OLED TV (2016 Model),Electronics,https://www.amazon.com/LG-Electronics-OLED55B6P-55-Inch-Ultra/dp/B01CDF9S1G/,4,1
"EVGA GeForce GTX 1080 FTW GAMING ACX 3.0, 8GB GDDR5X, RGB LED, 10CM FAN, 10 Power Phases, Double BIOS, DX12 OSD Support (PXOC) Graphics Card 08G-P4-6286-KR",Electronics,https://www.amazon.com/EVGA-GeForce-GAMING-Graphics-08G-P4-6286-KR/dp/B01GAI64GO,3,1
"EVGA GeForce GTX 1080 SC GAMING ACX 3.0, 8GB GDDR5X, LED, DX12 OSD Support (PXOC) Graphics Card 08G-P4-6183-KR",Electronics,https://www.amazon.com/EVGA-GeForce-GAMING-Graphics-08G-P4-6183-KR/dp/B01GAI6478,3,1
"EVGA GeForce GTX 1070 SC GAMING ACX 3.0, 8GB GDDR5, LED, DX12 OSD Support (PXOC) Graphics Card 08G-P4-6173-KR",Electronics,https://www.amazon.com/gp/product/B01GX5YWAO/ref=oh_aui_detailpage_o00_s00?ie=UTF8&amp;psc=1,3,1
PlayStation 4 Pro 1TB Console,Video Games,https://www.amazon.com/Sony-PlayStation-4-Pro-1TB/dp/B01LOP8EZC/,3,1
"EVGA SuperNOVA 750 G2, 80+ GOLD 750W, Fully Modular, EVGA ECO Mode, 10 Year Warranty, Includes FREE Power On Self Tester Power Supply 220-G2-0750-XR",Electronics,https://www.amazon.com/EVGA-SuperNOVA-Crossfire-Warranty-220-G2-0750-XR/dp/B00IKDETOW/ref=sr_1_1?s=pc&amp;ie=UTF8&amp;qid=1468711841&amp;sr=1-1&amp;keywords=evga+power+supply&amp;refinements=p_n_feature_keywords_two_browse-bin,3,1
Petra's Tech PT Nuke Cu Concentrated Biocide (10mL),Electronics,https://www.amazon.com/Petras-Tech-Nuke-Concentrated-Biocide/dp/B008EGYJ54/ref=pd_sbs_147_1?_encoding=UTF8&amp;pd_rd_i=B008EGYJ54&amp;pd_rd_r=409Z5JZGG7K8X4XGD1SJ&amp;pd_rd_w=sMvjl&amp;pd_rd_wg=oRn1O&amp;psc=1&amp;refRID=409Z5JZGG7K8X4XGD1SJ,2,1
Silver Coils - Antimicrobial .999 Fine Silver Strip,Electronics,https://www.amazon.com/Silver-Coils-Antimicrobial-999-Strip/dp/B00A66HMRC/ref=sr_1_1?s=pc&amp;ie=UTF8&amp;qid=1478115189&amp;sr=1-1,2,1
MasterAccessory Universal VGA Holder (MCA-0005-KUH00),Electronics,https://www.amazon.com/MasterAccessory-Universal-VGA-Holder-MCA-0005-KUH00/dp/B01IQCBKOI,2,1
MSI ARMOR 2X GeForce GTX 970 4GB OC DirectX 12 VR Ready (GTX 970 4GD5T OC),Electronics,https://www.amazon.com/MSI-GTX-970-4GD5T-OC/dp/B00NN0GIA0,2,1
Cosmos ® 8 PCS Copper VGA RAM Cooling Heatsinks cooler + Cosmos Cable Tie,Electronics,https://www.amazon.com/Cosmos-Copper-Cooling-Heatsinks-cooler/dp/B00637X42A/ref=pd_bxgy_147_img_y,2,1
Accell B142C-007B UltraAV DisplayPort to DisplayPort 1.2 Cable with Locking Latches - 6.6 Feet (2 Meters),Electronics,https://www.amazon.com/dp/B0098HVZBE/ref=twister_B01LY6Y25W?_encoding=UTF8&amp;psc=1,2,1
NVIDIA SHIELD Controller - Android,Video Games,https://www.amazon.com/NVIDIA-SHIELD-Controller-Android/dp/B01N7DQ0L6/ref=redir_mobile_desktop?_encoding=UTF8&amp%3BdpID=31MMbWCrpUL&amp%3BdpPl=1&amp%3Bkeywords=nvidia%20shield%20controller&amp%3Bpi=AC_SX236_SY340_QL65&amp%3Bqid=1484622228&amp%3Bref=plSrch&amp%3Bsr=8-1&ref_=mp_s_a_1_1,1,1
"Clevo Prostar P650RP6 15.6"" FHD/Matte Display, Intel Core i7-6700HQ, 8GB DDR4, GTX 1060, 256GB SSD, 1TB HDD, Windows 10 Home, Intel Dual Band Wireless 3165",Electronics,https://www.amazon.com/dp/B01LA24C5U/,1,1
"Alphacool NexXxoS UT60 Full Copper 360mm Radiator (3 x 120mm Fan Capacity, 6 x 120mm Fan Capacity in Push/Pull Configuration)",Electronics,https://www.amazon.com/Alphacool-NexXxoS-Radiator-Capacity-Configuration/dp/B007P05XXW/ref=sr_1_5?s=pc&amp;ie=UTF8&amp;qid=1478114149&amp;sr=1-5,1,1
"EVGA GeForce GTX 1080 GAMING ACX 3.0, 8GB GDDR5X, LED, DX12 OSD Support (PXOC) Graphics Card 08G-P4-6181-KR",Electronics,https://www.amazon.com/EVGA-GeForce-GAMING-Graphics-08G-P4-6181-KR/dp/B01GE9RFNK,1,1
"Alphacool Eiszapfen G1/4"" to 10mm ID, 13mm OD Compression Fitting, Deep Black, 6-pack",Electronics,https://www.amazon.com/Alphacool-Eiszapfen-Compression-Fitting-6-pack/dp/B01DHDWSV0/ref=sr_1_18?s=pc&amp;ie=UTF8&amp;qid=1478113507&amp;sr=1-18,1,1
XSPC D5 Dual Bay Reservoir/Pump Combo (Includes D5 Vario Pump - Speed Adjustable),Electronics,https://www.amazon.com/dp/B008RCERWA/ref=psdc_3015422011_t3_B00P8VI3DC,1,1
"Club 3D, CAC-1170, Active Mini DisplayPort to HDMI 2.0 Adapter (Supports displays up to 4k / UHD / 3840x2160@60Hz) VESA certified",Electronics,https://www.amazon.com/Club3D-Mini-Displayport-HDMI-CAC-1170/dp/B017BQCUGW/ref=pd_sim_147_1?ie=UTF8&amp;dpID=419k4gjd6SL&amp;dpSrc=sims&amp;preST=_AC_UL320_SR164,1,1
Asus ROG MAXIMUS VIII FORMULA DDR4 ATX Motherboard,Electronics,https://www.amazon.com/Asus-MAXIMUS-VIII-FORMULA-Motherboard/dp/B019U0VWKW/ref=sr_1_1?ie=UTF8&amp;qid=1467736428&amp;sr=8-1&amp;keywords=ROG+MAXIMUS+VIII+FORMULA,1,1
ASRock Z170 OC FORMULA LGA1151 Intel Z170 DDR4 Quad CrossFireX Quad SLI SATA3 M.2 SATA Express USB3.1 ATX Motherboard,Electronics,https://www.amazon.com/ASRock-Motherboards-Z170-OC-FORMULA/dp/B013WPZ02M/ref=sr_1_9?ie=UTF8&amp;qid=1467734879&amp;sr=8-9&amp;keywords=z170+asrock,1,1
"AOC G2460PQU 144hz, 1ms Ultimate Performance 24-Inch Professional Gaming Monitor",Electronics,https://www.amazon.com/AOC-G2460PQU-Ultimate-Performance-Professional/dp/B00HY7PAUC,1,1
BEST 100mmx100mm 2.0mm CPU GPU IC Chip Heatsink Silicone Compound Blue Thermal Conductive Pad for Computer Tablet Play Station PS3 and Any Other Proper Electronic Products,Electronics,https://www.amazon.com/100mmx100mm-Heatsink-Silicone-Conductive-Electronic/dp/B00LTN4IM8/ref=sr_1_1?ie=UTF8&amp;qid=1479797369&amp;sr=8-1&amp;keywords=thermal+pad+2.0+mm,1,1
"EVGA GeForce GTX780 HydroCopper 3GB GDDR5 384-Bit Dual-Link DVI-I, DVI-D, HDMI,DP, SLI Ready Graphics Card 03G-P4-2789-KR",Electronics,https://www.amazon.com/EVGA-HydroCopper-Dual-Link-Graphics-03G-P4-2789-KR/dp/B00D78Q2BS,1,1
"Dell 9Y779 Nvidia GeForce4 MX 440 64MB AGP Video Card VGA, DVI ,S-Video output",Electronics,https://www.amazon.com/9Y779-Nvidia-GeForce4-S-Video-output/dp/B01E93PO2C,1,1
Thermal Grizzly Conductonaut Thermal Grease Paste - 1.0 Gram,Automotive Parts & Accessories,https://www.amazon.com/Thermal-Grizzly-Conductonaut-Grease-Paste/dp/B01A9KIGSI,1,1
StarTech.com DisplayPort to DVI Dual Link Active Adapter Converter - DP to Dual Link DVI-D Active Adapter - 2560x1600 - 3D support,Electronics,https://www.amazon.com/gp/product/B00A493CNY/ref=oh_aui_search_detailpage?ie=UTF8&amp;psc=1,1,1
"Corsair Hydro Series H80i v2 Extreme Performance Liquid CPU Cooler, Black",Electronics,https://www.amazon.com/gp/product/B019954Y2Q/ref=oh_aui_detailpage_o08_s00?ie=UTF8&amp;psc=1,1,1
ASUS GeForce GTX 1080 Founders Edition GTX1080-8G 8GB GDDR5X PCI Express 3.0,Electronics,https://www.amazon.com/dp/B01FWI7J7G/,1,1
Cable Matters Gold Plated DisplayPort to DisplayPort Cable 6 Feet - 4K Resolution Ready,Electronics,https://www.amazon.com/Cable-Matters-Gold-Plated-DisplayPort/dp/B005H3Q59U/ref=sr_1_1?ie=UTF8&amp;qid=1458440275&amp;sr=8-1&amp;keywords=display+port+cable,1,1
ARCTIC Accelero Hybrid II-120 Water Cooler for Graphics Cards with Backside Cooler for Efficient RAM and VRM Cooling DCACO-V860001-GB Black,Electronics,https://www.amazon.com/ARCTIC-Accelero-Graphics-Efficient-DCACO-V860001-GB/dp/B00I3ETT84/ref=sr_1_2?ie=UTF8&amp;qid=1435159316&amp;sr=8-2&amp;keywords=graphics+card+cooler&amp;pebp=1435159304462&amp;perid=0Y70AR2NFH8YJKVM1R18,1,1
ARCTIC Accelero Xtreme IV High-End Graphics Card Cooler with Backside Cooler for Efficient RAM and VRM-Cooling DCACO-V800001-GBA01,Electronics,https://www.amazon.com/ARCTIC-Accelero-Efficient-VRM-Cooling-DCACO-V800001-GBA01/dp/B00HHMJIIO/ref=sr_1_3?ie=UTF8&amp;qid=1435158658&amp;sr=8-3&amp;keywords=graphics+card+cooler,1,1
