name,category,amazon_link,total_mentions,subreddit_mentions
"History of Biblical Interpretation, Vol. 2: From Late Antiquity to the End of the Middle Ages (Society of Biblical Literature Resources for Biblical Study)",Books,https://www.amazon.com/History-Biblical-Interpretation-Vol-Literature/dp/1589834550/ref=pd_sim_14_1?_encoding=UTF8&amp;pd_rd_i=1589834550&amp;pd_rd_r=E5EAP5PF3R7XR0M80FCW&amp;pd_rd_w=BX9CS&amp;pd_rd_wg=LRuCN&amp;psc=1&amp;refRID=E5EAP5PF3R7XR0M80FCW,1,1
"History of Biblical Interpretation, Vol. 4: From the Enlightenment to the Twentieth Century (Society of Biblical Literature Resources for Biblical Study)",Books,https://www.amazon.com/History-Biblical-Interpretation-Vol-Enlightenment/dp/1589834607/ref=pd_sim_14_3?_encoding=UTF8&amp;pd_rd_i=1589834607&amp;pd_rd_r=W6T1GBF64S5SP74AR177&amp;pd_rd_w=e1ypQ&amp;pd_rd_wg=2YXkF&amp;psc=1&amp;refRID=W6T1GBF64S5SP74AR177,1,1
The Gnostic Bible: Revised and Expanded Edition,Books,https://www.amazon.com/The-Gnostic-Bible-Revised-Expanded/dp/1590306317,1,1
The Complete Dead Sea Scrolls in English: Seventh Edition (Penguin Classics),Books,https://www.amazon.com/Complete-Dead-Sea-Scrolls-English/dp/0141197315/,1,1
James the Brother of Jesus: The Key to Unlocking the Secrets of Early Christianity and the Dead Sea Scrolls,Books,https://www.amazon.com/James-Brother-Jesus-Unlocking-Christianity/dp/014025773X/ref=sr_1_1?ie=UTF8&amp;qid=1497546088&amp;sr=8-1&amp;keywords=James,1,1
