name,category,amazon_link,total_mentions,subreddit_mentions
An Introduction to the New Testament (The Anchor Yale Bible Reference Library),Books,https://www.amazon.com/dp/0300140169,5,4
The Early History of God: Yahweh and the Other Deities in Ancient Israel (The Biblical Resource Series),Books,https://www.amazon.com/The-Early-History-God-Biblical/dp/080283972X/ref=pd_sim_14_1?ie=UTF8&amp;refRID=1JHSJHYN7EYAT4X8XCH5,6,3
"A Marginal Jew: Rethinking the Historical Jesus: The Roots of the Problem and the Person, Vol. 1",Books,https://www.amazon.com/Marginal-Jew-Rethinking-Historical-Problem/dp/0385264259/ref=sr_1_1?s=books&amp;ie=UTF8&amp;qid=1435014111&amp;sr=1-1&amp;keywords=a+marginal+jew,5,3
The New Oxford Annotated Bible with Apocrypha: New Revised Standard Version,Books,https://www.amazon.com/New-Oxford-Annotated-Bible-Apocrypha/dp/0195289609/ref=sr_1_1?s=books&amp;ie=UTF8&amp;qid=1449513517&amp;sr=1-1,8,2
Politicizing the Bible: The Roots of Historical Criticism and the Secularization of Scripture 1300-1700 (Herder & Herder Books),Books,https://www.amazon.com/Politicizing-Bible-Historical-Criticism-Secularization/dp/0824599039,7,2
The Origins of Biblical Monotheism: Israel's Polytheistic Background and the Ugaritic Texts,Books,https://www.amazon.com/Origins-Biblical-Monotheism-Polytheistic-Background/dp/0195167686/ref=la_B001H6IMK6_1_2?s=books&amp;ie=UTF8&amp;qid=1481614235&amp;sr=1-2,5,2
The New Testament: A Historical Introduction to the Early Christian Writings,Books,https://www.amazon.com/New-Testament-Historical-Introduction-Christian/dp/0199757534/ref=la_B001I9RR7G_1_15?s=books&amp;ie=UTF8&amp;qid=1487604721&amp;sr=1-15&amp;refinements=p_82,4,2
HarperCollins Study Bible - Student Edition: Fully Revised & Updated,Books,https://www.amazon.com/HarperCollins-Study-Bible-Student-Revised/dp/0060786841/ref=sr_1_2?s=books&amp;ie=UTF8&amp;qid=1432925545&amp;sr=1-2&amp;keywords=nrsv+harper+study+bible,4,2
The Bible with Sources Revealed,Books,https://www.amazon.com/Sources-Revealed-Richard-Elliott-Friedman/dp/006073065X/ref=sr_1_1?ie=UTF8&amp;qid=1492561123&amp;sr=8-1&amp;keywords=richard+elliott+friedman,4,2
Lost Christianities: The Battles for Scripture and the Faiths We Never Knew,Books,https://www.amazon.com/Lost-Christianities-Battles-Scripture-Faiths/dp/0195182499/ref=asap_bc?ie=UTF8,3,2
Paul and Jesus: How the Apostle Transformed Christianity,Books,https://www.amazon.com/Paul-Jesus-Apostle-Transformed-Christianity/dp/1439123322,2,2
The New Testament: A Historical Introduction to the Early Christian Writings,Books,https://www.amazon.com/New-Testament-Historical-Introduction-Christian/dp/019020382X/ref=sr_1_1?ie=UTF8&amp;qid=1458179626&amp;sr=8-1&amp;keywords=the+early+christians+ehrman,2,2
St. Paul versus St. Peter: A Tale of Two Missions,Books,https://www.amazon.com/St-Paul-versus-Peter-Missions/dp/0664255612/ref=sr_1_1?s=books&amp;ie=UTF8&amp;qid=1446124969&amp;sr=1-1&amp;keywords=st+paul+versus,2,2
Opposition to Paul in Jewish Christianity,Books,https://www.amazon.com/Opposition-Paul-Jewish-Christianity-Luedemann/dp/0800609085/ref=sr_1_1?s=books&amp;ie=UTF8&amp;qid=1446125914&amp;sr=1-1&amp;keywords=opposition+to+paul+in+jewish+christianity,2,2
Paul and the Competing Mission in Corinth,Books,https://www.amazon.com/Competing-Mission-Corinth-Michael-Goulder/dp/1565633792/ref=sr_1_1?s=books&amp;ie=UTF8&amp;qid=1445481918&amp;sr=1-1&amp;keywords=paul+and+the+competing+mission+in+corinth,2,2
The First New Testament: Marcion's Scriptural Canon,Books,https://www.amazon.com/The-First-New-Testament-Scriptural/dp/1598151312,2,2
"Of God and Gods: Egypt, Israel, and the Rise of Monotheism (George L. Mosse Series in Modern European Cultural and Intellectual History)",Books,https://www.amazon.com/God-Gods-Israel-Monotheism-George/dp/0299225542,2,2
The Jewish Annotated New Testament,Books,https://www.amazon.com/The-Jewish-Annotated-New-Testament/dp/0195297709,2,2
"How to Read the Bible: A Guide to Scripture, Then and Now",Books,https://www.amazon.com/How-Read-Bible-Guide-Scripture/dp/0743235878,2,2
Who Wrote the Bible?,Books,https://www.amazon.com/Wrote-Bible-Richard-Elliott-Friedman/dp/0060630353,5,1
How Jesus Became God: The Exaltation of a Jewish Preacher from Galilee,Books,https://www.amazon.com/How-Jesus-Became-God-Exaltation/dp/0061778192/,4,1
"Asimov's Guide to the Bible: Two Volumes in One, the Old and New Testaments",Books,https://www.amazon.com/Asimovs-Guide-Bible-Volumes-Testaments/dp/051734582X,3,1
"Jesus and the Victory of God (Christian Origins and the Question of God, Volume 2)",Books,https://www.amazon.com/Jesus-Victory-Christian-Origins-Question/dp/0800626826/,3,1
Forged: Writing in the Name of God--Why the Bible’s Authors Are Not Who We Think They Are,Books,https://www.amazon.com/Forged-Writing-God-Why-Bibles-Authors/dp/0062012622/,3,1
The Historical Figure of Jesus,Books,https://www.amazon.com/The-Historical-Figure-Jesus-Sanders/dp/0140144994,2,1
New Testament History and Literature (The Open Yale Courses Series),Books,https://www.amazon.com/Testament-History-Literature-Open-Courses/dp/0300180853/,2,1
Jesus and the Last Supper,Books,https://www.amazon.com/Jesus-Last-Supper-Brant-Pitre/dp/0802848710/ref=sr_1_1?s=books&amp;ie=UTF8&amp;qid=1486532932&amp;sr=1-1&amp;keywords=Pitre+Jesus+Last+Supper,2,1
A Gathering of Saints,Books,https://www.amazon.com/Gathering-Saints-Robert-Lindsey/dp/1501153110/ref=sr_1_1?ie=UTF8&amp;qid=1473319597&amp;sr=8-1&amp;keywords=,2,1
"The Mormon Murders: A True Story of Greed, Forgery, Deceit and Death",Books,https://www.amazon.com/Mormon-Murders-Steven-Naifeh/dp/1250025893/ref=sr_1_1?ie=UTF8&amp;qid=1473319626&amp;sr=8-1&amp;keywords=,2,1
"Revelations: Visions, Prophecy, and Politics in the Book of Revelation",Books,https://www.amazon.com/Revelations-Visions-Prophecy-Politics-Revelation/dp/0143121634,2,1
Christianity: The First Three Thousand Years,Books,https://www.amazon.com/Christianity-First-Three-Thousand-Years/dp/0143118692/,2,1
Kinship by Covenant: A Canonical Approach to the Fulfillment of God's Saving Promises (The Anchor Yale Bible Reference Library),Books,https://www.amazon.com/Kinship-Covenant-Canonical-Fulfillment-Reference/dp/0300140975/ref=sr_1_1?s=books&amp;ie=UTF8&amp;qid=1501259887&amp;sr=1-1&amp;keywords=Kinship+by+Covenant,2,1
The New Oxford Annotated Bible with Apocrypha: New Revised Standard Version,Books,https://www.amazon.com/New-Oxford-Annotated-Bible-Apocrypha/dp/0195289552/,2,1
"Jesus Before the Gospels: How the Earliest Christians Remembered, Changed, and Invented Their Stories of the Savior",Books,https://www.amazon.com/Jesus-Before-Gospels-Christians-Remembered/dp/0062285203/ref=sr_1_1?ie=UTF8&amp;qid=1469502446&amp;sr=8-1&amp;keywords=bart+ehrman,2,1
Ancient Near Eastern Thought and the Old Testament: Introducing the Conceptual World of the Hebrew Bible,Books,https://www.amazon.com/Ancient-Near-Eastern-Thought-Testament/dp/0801027500/,2,1
The Myth of Persecution: How Early Christians Invented a Story of Martyrdom,Books,https://www.amazon.com/The-Myth-Persecution-Christians-Martyrdom/dp/0062104527,2,1
A Catholic Introduction to the Bible: The Old Testament,Books,https://www.amazon.com/Catholic-Introduction-Bible-Old-Testament/dp/1586177222/ref=pd_rhf_dp_p_img_10?_encoding=UTF8&amp;psc=1&amp;refRID=2D9V6JEN17FWFXGGJN7S,2,1
The Birth of Satan: Tracing the Devil's Biblical Roots,Books,https://www.amazon.com/Birth-Satan-Tracing-Devils-Biblical/dp/1403969337?ie=UTF8&amp;*Version*=1&amp;*entries*=0,2,1
"The Lost History of Christianity: The Thousand-Year Golden Age of the Church in the Middle East, Africa, and Asia--and How It Died",Books,https://www.amazon.com/Lost-History-Christianity-Thousand-Year-Asia/dp/0061472816/ref=sr_1_3?ie=UTF8&amp;qid=1497546726&amp;sr=8-3&amp;keywords=philip+jenkins,2,1
Absolute Monarchs: A History of the Papacy,Books,https://www.amazon.com/Absolute-Monarchs-A-History-Papacy/dp/0812978846,2,1
"The Canon of the New Testament: Its Origin, Development, and Significance",Books,https://www.amazon.com/Canon-New-Testament-Development-Significance/dp/0198269544,2,1
Martyrdom and Persecution in the Early Church,Books,https://www.amazon.com/Martyrdom-Persecution-Early-Church-William/dp/0227172299,1,1
Q. A Reconstruction and Commentary (Biblical Tools and Studies),Books,https://www.amazon.com/Reconstruction-Commentary-Biblical-Tools-Studies/dp/9042916567,1,1
Dating Acts: Between the Evangelists and the Apologists,Books,https://www.amazon.com/Dating-Acts-Between-Evangelists-Apologists/dp/0944344739,1,1
"Empirical Models for Biblical Criticism: (Dove Studies in Bible, Language, and History)",Books,https://www.amazon.com/Empirical-Models-Biblical-Criticism-Language/dp/1597524379,1,1
Jewish Views of the Afterlife,Books,https://www.amazon.com/Jewish-Views-Afterlife-Simcha-Raphael/dp/0742562212/,1,1
"Understanding the Bible: An Introduction for Skeptics, Seekers, and Religious Liberals",Books,https://www.amazon.com/Understanding-Bible-Introduction-Skeptics-Religious/dp/0807010537/ref=sr_1_1?s=books&amp;ie=UTF8&amp;qid=1435014145&amp;sr=1-1&amp;keywords=understanding+the+bible+buehrens,1,1
An Introduction to the New Testament,Books,https://www.amazon.com/Introduction-New-Testament-D-Carson/dp/0310238595/,1,1
New Testament History: A Narrative Account,Books,https://www.amazon.com/New-Testament-History-Narrative-Account/dp/0801022932/,1,1
Jesus in His Jewish Context,Books,https://www.amazon.com/Jewish-Context-Emeritus-Professor-Studies/dp/0800636236/ref=sr_1_1?s=books&amp;ie=UTF8&amp;qid=1486533264&amp;sr=1-1&amp;keywords=Geza+Jesus+jewish,1,1
Prophecy and Society in Ancient Israel,Books,https://www.amazon.com/Prophecy-Society-Ancient-Israel-Robert/dp/0800618149,1,1
The Quest for the Plausible Jesus: The Question of Criteria,Books,https://www.amazon.com/Quest-Plausible-Jesus-Question-Criteria/dp/0664225373/ref=sr_1_1?s=books&amp;ie=UTF8&amp;qid=1486533328&amp;sr=1-1&amp;keywords=Quest+for+plausible+jesus,1,1
Greco-Roman Literature and the New Testament: Selected Forms and Genres (Sources for Biblical Study),Books,https://www.amazon.com/Greco-Roman-Literature-New-Testament-Selected/dp/1555402097,1,1
Dictionary of Jesus and the Gospels (The IVP Bible Dictionary Series),Books,https://www.amazon.com/Dictionary-Jesus-Gospels-IVP-Bible/dp/0830817778,1,1
The Right Guy for the Right Girl,Books,https://www.amazon.com/The-Right-Guy-Girl/dp/0768432561,1,1
The Birth of the Messiah: A Commentary on the Infancy Narratives in the Gospels of Matthew and Luke (The Anchor Yale Bible Reference Library),Books,https://www.amazon.com/The-Birth-Messiah-Commentary-Narratives/dp/0300140088,1,1
Sex and the Single Savior: Gender and Sexuality in Biblical Interpretation,Books,https://www.amazon.com/Sex-Single-Savior-Sexuality-Interpretation/dp/0664230466,1,1
The Corinthian Body,Books,https://www.amazon.com/Corinthian-Body-Professor-Dale-Martin/dp/0300062052/ref=la_B001H6W8FG_1_6?s=books&amp;ie=UTF8&amp;qid=1493595318&amp;sr=1-6,1,1
The Galatians Debate: Contemporary Issues in Rhetorical and Historical Interpretation,Books,https://www.amazon.com/Galatians-Debate-Contemporary-Rhetorical-Interpretation/dp/0801047277/ref=sr_1_1?s=books&amp;ie=UTF8&amp;qid=1445481839&amp;sr=1-1&amp;keywords=the+galatians+debate,1,1
Jewish Christianity Reconsidered: Rethinking Ancient Groups and Texts,Books,https://www.amazon.com/Jewish-Christianity-Reconsidered-Rethinking-Ancient/dp/B002SG7IV8,1,1
"Paul the Apostle of Jesus Christ: His Life and Works, His Epistles and Teachings",Books,https://www.amazon.com/Paul-Apostle-Jesus-Christ-Teachings/dp/0801045584/ref=sr_1_1?ie=UTF8&amp;qid=1445481991&amp;sr=8-1&amp;keywords=paul+the+apostle+of+jesus+christ+baur,1,1
Mark: Traditions in Conflict,Books,https://www.amazon.com/Mark-Traditions-Theodore-Weeden-Sr/dp/0800613716,1,1
Marcion and His Influence:,Books,https://www.amazon.com/Marcion-His-Influence-C-Blackman/dp/1592447317,1,1
Marcion: The Gospel of the Alien God,Books,https://www.amazon.com/Marcion-Gospel-Alien-Adolf-Harnack/dp/1556357036,1,1
"Marcion, on the Restitution of Christianity: An Essay on the Development of Radical Paulist Theology in the Second Century (American Academy of Religion Academy Series)",Books,https://www.amazon.com/Marcion-Restitution-Christianity-Development-Theology/dp/0891306382,1,1
"Matthew, Poet of the Beatitudes (Journal for the Study of the New Testament Supplement)",Books,https://www.amazon.com/Matthew-Beatitudes-Journal-Testament-Supplement/dp/1841271659/ref=sr_1_1?ie=UTF8&amp;qid=1468264237&amp;sr=8-1&amp;keywords=green+matthew+poet+of+the+beatitudes,1,1
Essays on the Sermon on the Mount,Books,https://www.amazon.com/Essays-Sermon-Mount-Hans-Dieter/dp/0800663047/ref=sr_1_2?ie=UTF8&amp;qid=1468264674&amp;sr=8-2&amp;keywords=sermon+on+the+mount+betz,1,1
The Fate of the Dead: Studies on the Jewish and Christian Apocalypses (Supplements to Novum Testamentum),Books,https://www.amazon.com/Fate-Dead-Apocalypses-Supplements-Testamentum/dp/1589832884,1,1
"From Gods to God: How the Bible Debunked, Suppressed, or Changed Ancient Myths and Legends",Books,https://www.amazon.com/From-Gods-God-Debunked-Suppressed/dp/0827609086,1,1
Biblia Hebraica Stuttgartensia  (Hebrew Edition),Books,https://www.amazon.com/Biblia-Hebraica-Stuttgartensia-Hebrew-Elliger/dp/1598561634/,1,1
Jesus and His World Paper,Books,https://www.amazon.com/Jesus-World-Paper-John-Rousseau/dp/0800628055/ref=sr_1_1?ie=UTF8&amp;qid=1435075952&amp;sr=8-1&amp;keywords=Jesus+and+His+World,1,1
"The Text of the New Testament: Its Transmission, Corruption, and Restoration (4th Edition)",Books,https://www.amazon.com/Text-New-Testament-Transmission-Restoration/dp/019516122X/,1,1
Daniel: A Commentary on the Book of Daniel (Hermeneia: A Critical & Historical Commentary on the Bible ),Books,https://www.amazon.com/Daniel-Hermeneia-Series-Historical-Commentary/dp/0800660404,1,1
Paul: In Fresh Perspective,Books,https://www.amazon.com/Paul-Perspective-N-T-Wright/dp/0800663578,1,1
"Baptism in the Early Church: History, Theology, and Liturgy in the First Five Centuries",Books,https://www.amazon.com/Baptism-Early-Church-Theology-Centuries/dp/0802871089/ref=sr_1_1?ie=UTF8&amp;qid=1472480266&amp;sr=8-,1,1
Apostle Paul: A Polite Bribe,Books,https://www.amazon.com/Apostle-Paul-Polite-Robert-Orlando/dp/162564972X,1,1
Let the Reader Understand: Reader-Response Criticism and the Gospel of Mark,Books,https://www.amazon.com/Let-Reader-Understand-Reader-Response-Criticism/dp/1563383381,1,1
Jesus and the Last Supper,Books,https://www.amazon.com/Jesus-Last-Supper-Brant-Pitre/dp/0802875335/ref=sr_1_1?s=books&amp;ie=UTF8&amp;qid=1501259861&amp;sr=1-1&amp;keywords=Jesus+and+the+Last+Supper,1,1
The Forgotten Kingdom: The Archaeology and History of Northern Israel (Ancient Near East Monographs),Books,https://www.amazon.com/Forgotten-Kingdom-Archaeology-Northern-Monographs/dp/1589839102,1,1
"The New Testament: A Historical Introduction to the Early Christian Writings, 4th Edition",Books,https://www.amazon.com/New-Testament-Historical-Introduction-Christian/dp/0195322592/,1,1
Priscilla's Letter: Finding the Author of the Epistle to the Hebrews,Books,https://www.amazon.com/Priscillas-Letter-Finding-Epistle-Hebrews/dp/1882897501,1,1
Wages of Cross-Bearing and Debt of Sin (Beihefte Zur Zeitschrift Fur die Neutestamentliche Wissensch),Books,https://www.amazon.com/Cross-Bearing-Beihefte-Zeitschrift-Neutestamentliche-Wissensch/dp/3110487985/ref=sr_1_1?ie=UTF8&amp;qid=1501257968&amp;sr=8-1&amp;keywords=Nathan+Eubank,1,1
The Bible Unearthed: Archaeology's New Vision of Ancient Israel and the Origin of Its Sacred Texts,Books,https://www.amazon.com/Bible-Unearthed-Archaeologys-Vision-Ancient/dp/0684869128/ref=pd_sbs_14_t_2?_encoding=UTF8&amp;psc=1&amp;refRID=3J2XQDRT81XFS6EZEBHZ,1,1
The Corinthian Body,Books,https://www.amazon.com/The-Corinthian-Body-Dale-Martin/dp/0300081723,1,1
"Dictionary of Deities and Demons in the Bible, Second Edition",Books,https://www.amazon.com/Dictionary-Deities-Demons-Bible-Second/dp/0802824919/,1,1
Biblia Sacra Hebraica Stuttgartensia with Greek New Testament (Greek Edition),Books,https://www.amazon.com/Biblia-Sacra-Hebraica-Stuttgartensia-Testament/dp/3438052504/,1,1
"The Origin of Evil Spirits: The Reception of Genesis 6:1-4 in Early Jewish Literature, Revised Edition",Books,https://www.amazon.com/Origin-Evil-Spirits-Reception-Literature/dp/1451490321/,1,1
Gospel Fictions,Books,https://www.amazon.com/Gospel-Fictions-Randel-Helms/dp/0879755725,1,1
The Apostolic Fathers: Greek Texts and English Translations,Books,https://www.amazon.com/Apostolic-Fathers-Greek-English-Translations/dp/080103468X/ref=sr_1_5?s=books&amp;ie=UTF8&amp;qid=1455651984&amp;sr=1-5&amp;keywords=the+apostolic+fathers+lightfoot,1,1
Galilee in the Late Second Temple and Mishnaic Periods: Two-Volume Set,Books,https://www.amazon.com/Galilee-Second-Temple-Mishnaic-Periods/dp/1506405126/ref=redir_mobile_desktop?_encoding=UTF8&amp%3BdpID=51RKV8Acy9L&amp%3BdpPl=1&amp%3Bkeywords=archaeology%20galilee&amp%3Bpi=SX200_QL40&amp%3Bref=plSrch&amp%3Bsr=8-2&qid=1462457120&ref_=mp_s_a_1_2,1,1
The First Alphabetic Inscriptions and How They Revolutionize the History of Israel: The Rise and Fall of Alphabetic Akkadian  (1475 - 850 BCE),Books,https://www.amazon.com/Alphabetic-Inscriptions-Revolutionize-History-Israel/dp/1511898208/,1,1
The Ante-Nicene Fathers (10 Volume Set),Books,https://www.amazon.com/Ante-Nicene-Fathers-10-Set/dp/1565630823/ref=sr_1_1?ie=UTF8&amp;qid=1455652034&amp;sr=8-1&amp;keywords=the+ante+nicene+fathers,1,1
"NIV Study Bible, Personal Size, Paperback, Red Letter Edition",Books,https://www.amazon.com/NIV-Study-Bible-Zondervan/dp/0310437334/,1,1
Perspectives on the Ending of Mark: Four Views,Books,https://www.amazon.com/Perspectives-Ending-Mark-Four-Views/dp/0805447628/ref=sr_1_1?ie=UTF8&amp;qid=1497630803&amp;sr=8-1&amp;keywords=Perspectives+on+the+ending+of+Mark,1,1
Among the Gentiles: Greco-Roman Religion and Christianity (The Anchor Yale Bible Reference Library),Books,https://www.amazon.com/Among-Gentiles-Greco-Roman-Christianity-Reference/dp/0300168101/,1,1
Understanding The Bible,Books,https://www.amazon.com/Understanding-Bible-Stephen-Harris/dp/0073407445/,1,1
Classical Syriac for Hebraists,Books,https://www.amazon.com/Classical-Syriac-Hebraists-T-Muraoka/dp/3447025859,1,1
"Gospel Parallels: A Comparison of the Synoptic Gospels, New Revised Standard Version",Books,https://www.amazon.com/Gospel-Parallels-Comparison-Synoptic-Standard/dp/0840774842,1,1
The Gospel of the Lord: How the Early Church Wrote the Story of Jesus,Books,https://www.amazon.com/The-Gospel-Lord-Early-Church/dp/0802867766,1,1
Reading Romans In Pompeii: Paul's Letter at Ground Level,Books,https://www.amazon.com/Reading-Romans-Pompeii-Letter-Ground/dp/1451476671/,1,1
On Collective Memory (Heritage of Sociology Series),Books,https://www.amazon.com/Collective-Memory-Heritage-Sociology/dp/0226115968/ref=sr_1_1?ie=UTF8&amp;qid=1469502302&amp;sr=8-1&amp;keywords=halbwachs,1,1
Social Memory: New Perspectives on the Past,Books,https://www.amazon.com/Social-Memory-New-Perspectives-Past/dp/1597406716/ref=sr_1_1?ie=UTF8&amp;qid=1469502239&amp;sr=8-1&amp;keywords=social+memory,1,1
"Memory, Tradition, And Text: Uses of the Past in Early Christianity (Society of Biblical Literature Semeia Studies) (Semeia Studies-Society of Biblical Literature)",Books,https://www.amazon.com/Memory-Tradition-Text-Christianity-Studies-Society/dp/1589831497/ref=sr_1_1?ie=UTF8&amp;qid=1469502139&amp;sr=8-1&amp;keywords=memory+tradition+and+text,1,1
"Jesus Remembered: Christianity in the Making, Volume 1",Books,https://www.amazon.com/Jesus-Remembered-Christianity-Making-1/dp/0802839312/ref=sr_1_1?ie=UTF8&amp;qid=1469502373&amp;sr=8-1&amp;keywords=jesus+remembered,1,1
"The Fall of Jerusalem and the Christian Church: A Study of the Effects of the Jewish Overthrow of AD 70 on Christianity, 2nd Edition",Books,https://www.amazon.com/Fall-Jerusalem-Christian-Church-Christianity/dp/1608997472/ref=sr_1_1?s=books&amp;ie=UTF8&amp;qid=1492121769&amp;sr=1-1&amp;keywords=Brandon,1,1
The Nag Hammadi Scriptures: The Revised and Updated Translation of Sacred Gnostic Texts Complete in One Volume,Books,https://www.amazon.com/Nag-Hammadi-Scriptures-Translation-Complete/dp/0061626007,1,1
The Torah: Jewish and Samaritan versions compared (Hebrew Edition),Books,https://www.amazon.com/Torah-Jewish-Samaritan-versions-compared/dp/1904808182,1,1
Christianity and Rabbinic Judaism,Books,https://www.amazon.com/Christianity-Rabbinic-Judaism-James-Charlesworth/dp/1935335529/,1,1
"Handbook on the Pentateuch: Genesis, Exodus, Leviticus, Numbers, Deuteronomy",Books,https://www.amazon.com/Handbook-Pentateuch-Genesis-Leviticus-Deuteronomy/dp/0801097738/ref=sr_1_1?ie=UTF8&amp;qid=1502473114&amp;sr=8-1&amp;keywords=handbook+on+the+pentateuch,1,1
Judaism: The evolution of a faith,Books,https://www.amazon.com/Judaism-evolution-faith-Phillip-Sigal/dp/0802803458/,1,1
The Roman Cult of Mithras: The God and His Mysteries,Books,https://www.amazon.com/Roman-Cult-Mithras-God-Mysteries/dp/0415929784/,1,1
Tradition Kept: The Literature of the Samaritans,Books,https://www.amazon.com/Tradition-Kept-Literature-Robert-Anderson/dp/0801045487,1,1
Handbook on the Wisdom Books and Psalms,Books,https://www.amazon.com/Handbook-Wisdom-Books-Psalms-Daniel/dp/080103888X/ref=pd_sim_14_25?_encoding=UTF8&amp;pd_rd_i=080103888X&amp;pd_rd_r=PXQF09CNRDAFRN2D0W5H&amp;pd_rd_w=yEfRj&amp;pd_rd_wg=fhVs1&amp;psc=1&amp;refRID=PXQF09CNRDAFRN2D0W5H,1,1
The Old Testament: An Introduction to the Hebrew Bible,Books,https://www.amazon.com/Old-Testament-Introduction-Hebrew-Bible/dp/0072990511/ref=sr_1_10?s=books&amp;ie=UTF8&amp;qid=1441422839&amp;sr=1-10&amp;keywords=introduction+to+the+hebrew+bible,1,1
The Book of Legends/Sefer Ha-Aggadah: Legends from the Talmud and Midrash,Books,https://www.amazon.com/Book-Legends-Sefer-Ha-Aggadah-Midrash/dp/0805241132,1,1
Handbook on the Prophets,Books,https://www.amazon.com/Handbook-Prophets-Robert-Jr-Chisholm/dp/080103860X/ref=pd_sim_14_29?_encoding=UTF8&amp;pd_rd_i=080103860X&amp;pd_rd_r=PXQF09CNRDAFRN2D0W5H&amp;pd_rd_w=yEfRj&amp;pd_rd_wg=fhVs1&amp;psc=1&amp;refRID=PXQF09CNRDAFRN2D0W5H,1,1
"Handbook on the Historical Books: Joshua, Judges, Ruth, Samuel, Kings, Chronicles, Ezra-Nehemiah, Esther",Books,https://www.amazon.com/Handbook-Historical-Books-Chronicles-Ezra-Nehemiah/dp/0801036143/ref=pd_bxgy_14_img_2?_encoding=UTF8&amp;pd_rd_i=0801036143&amp;pd_rd_r=77HHVDZ2DRQSMJZ7GZ19&amp;pd_rd_w=WftGz&amp;pd_rd_wg=K3IbU&amp;psc=1&amp;refRID=77HHVDZ2DRQSMJZ7GZ19,1,1
"Ancient Christian Worship: Early Church Practices in Social, Historical, and Theological Perspective",Books,https://www.amazon.com/Ancient-Christian-Worship-Theological-Perspective/dp/0801031524/ref=sr_1_4?s=books&amp;ie=UTF8&amp;qid=1430513990&amp;sr=1-4&amp;keywords=early+Christian+baptism,1,1
The IVP Bible Background Commentary: New Testament,Books,https://www.amazon.com/IVP-Bible-Background-Commentary-Testament/dp/0830814051,1,1
The Ways That Never Parted: Jews and Christians in Late Antiquity and the Early Middle Ages,Books,https://www.amazon.com/The-Ways-That-Never-Parted/dp/0800662091,1,1
The Question of Canon: Challenging the Status Quo in the New Testament Debate,Books,https://www.amazon.com/Question-Canon-Challenging-Status-Testament/dp/0830840311/,1,1
Prophecy and Society in Ancient Israel,Books,https://www.amazon.com/Prophecy-Society-Ancient-Israel-Robert-ebook/dp/0800605373/ref=sr_1_8?ie=UTF8&amp;qid=1471226259&amp;sr=8-8&amp;keywords=prophet+ancient+israel,1,1
God: A Biography,Books,https://www.amazon.com/God-A-Biography-Jack-Miles/dp/0679743685,1,1
The Last of the Rephaim: Conquest and Cataclysm in the Heroic Ages of Ancient Israel (Ilex Series),Books,https://www.amazon.com/The-Last-Rephaim-Conquest-Cataclysm/dp/0674066731,1,1
The Blackwell Companion to Paul,Books,https://www.amazon.com/Blackwell-Companion-Paul-Stephen-Westerholm/dp/1405188448/ref=sr_1_1?s=books&amp;ie=UTF8&amp;qid=1502473809&amp;sr=1-1&amp;keywords=companion+to+paul+blackwell,1,1
Byzantine Slavery and the Mediterranean World,Books,https://www.amazon.com/Byzantine-Slavery-Mediterranean-Youval-Rotman/dp/0674036115/,1,1
Introduction to the Hebrew Bible: Second Edition,Books,https://www.amazon.com/Introduction-Hebrew-Bible-John-Collins/dp/1451469233/ref=sr_1_1?s=books&amp;ie=UTF8&amp;qid=1441422839&amp;sr=1-1&amp;keywords=introduction+to+the+hebrew+bible,1,1
Apocalypses in Context: Apocalyptic Currents Through History,Books,https://www.amazon.com/Apocalypses-Context-Apocalyptic-Currents-Through/dp/1451496230/,1,1
Debt-Slavery in Israel and the Ancient Near East (The Library of Hebrew Bible/Old Testament Studies),Books,https://www.amazon.com/Debt-Slavery-Ancient-Library-Testament-Studies/dp/0567525813/,1,1
The Parting of the Ways: Between Christianity and Judaism and Their Significance for the Character of Christianity,Books,https://www.amazon.com/The-Parting-Ways-Christianity-Significance/dp/0334029996,1,1
The Case Against Q: Studies in Markan Priority and the Synoptic Problem,Books,https://www.amazon.com/gp/product/1563383349/ref=pd_lpo_sbs_dp_ss_1?pf_rd_p=1944687722&amp;pf_rd_s=lpo-top-stripe-1&amp;pf_rd_t=201&amp;pf_rd_i=0830827692&amp;pf_rd_m=ATVPDKIKX0DER&amp;pf_rd_r=03JD3EBQFAKJMK31VR0T,1,1
The Canon Debate: On the Origins and Formation of the Bible,Books,https://www.amazon.com/Canon-Debate-Origins-Formation-Bible/dp/1565635175/ref=sr_1_1?s=books&amp;ie=UTF8&amp;qid=1502473276&amp;sr=1-1&amp;keywords=The+Canon+debate,1,1
"History of Biblical Interpretation, Vol. 1: From the Old Testament to Origen (Society of Biblical Literature Resources for Biblical Study)",Books,https://www.amazon.com/History-Biblical-Interpretation-Vol-Literature/dp/1589832027/ref=sr_1_6?ie=UTF8&amp;qid=1502473382&amp;sr=8-6&amp;keywords=History+of+biblical+interpretation,1,1
