name,category,amazon_link,total_mentions,subreddit_mentions
Mating in Captivity: Unlocking Erotic Intelligence,Book,http://www.amazon.com/dp/0060753641/,13,1
Why Does He Do That?: Inside the Minds of Angry and Controlling Men,Book,http://www.amazon.com/dp/0425191656/,68,1
Getting Past Your Breakup: How to Turn a Devastating Loss into the Best Thing That Ever Happened to You,Book,http://www.amazon.com/dp/0738213284/,12,1
The 5 Love Languages: The Secret to Love that Lasts,Book,http://www.amazon.com/dp/080241270X/,68,1
Party of One: The Loners' Manifesto,Book,http://www.amazon.com/dp/1569245134/,2,1
Attached: The New Science of Adult Attachment and How It Can Help YouFind - and Keep - Love,Book,http://www.amazon.com/dp/1585429139/,50,1
"The Ethical Slut: A Practical Guide to Polyamory, Open Relationships & Other Adventures",Book,http://www.amazon.com/dp/1587613379/,51,1
"Men on Strike: Why Men Are Boycotting Marriage, Fatherhood, and the American Dream - and Why It Matters",Book,http://www.amazon.com/dp/1594037620/,16,1
"Helix Personal Safe with Tether, 1 Safe (61019)",Office Product,http://www.amazon.com/dp/B000GOYCYU/,1,1
Mr Unavailable & the Fallback Girl: The Definitive Guide to Understanding Emotionally Unavailable Men and the Women that Love Them,eBooks,http://www.amazon.com/dp/B005WJGPZI/,7,1
Getting Past Your Breakup: How to Turn a Devastating Loss into the Best Thing That Ever Happened to You,eBooks,http://www.amazon.com/dp/B0097CWNSO/,4,1
"Lipton Black Tea Bags, America's Favorite Tea 100 ct",Grocery,http://www.amazon.com/dp/B00CREY86Y/,2,1
"LELO GIGI 2 Luxury Personal Massager, Best Seller G-spot Vibrator, Deep Rose",Health and Beauty,http://www.amazon.com/dp/B00EA0N76U/,6,1
Lux Electric Massage Wand Body Massager - Neck Back Shoulder Massage Handheld Electric Personal Massager - Extra Long 9 FT Cord,Health and Beauty,http://www.amazon.com/dp/B00UZJKDDA/,3,1
"Saving a Low Sex Marriage: A Man's Guide to Dread, Seduction and the Long Game",eBooks,http://www.amazon.com/dp/B01BGZO1WK/,6,1
Simple Mobile Samsung Galaxy On5 4G LTE Prepaid Smartphone,Wireless,http://www.amazon.com/dp/B01M0UP4KT/,1,1
