name,category,amazon_link,total_mentions,subreddit_mentions
"Doctor's Best High Absorption Magnesium Glycinate Lysinate, 100% Chelated, Non-GMO, Vegan, Gluten Free, Soy Free,  200 mg, 240 Tablets",Health and Beauty,http://www.amazon.com/dp/B000BD0RT0/,146,1
Apex Ultra Pill Splitter,Health and Beauty,http://www.amazon.com/dp/B000EGKTGK/,11,1
"Apex Deluxe Pill Splitter, 1 splitter",Health and Beauty,http://www.amazon.com/dp/B000EGP5DC/,7,1
Nullo Internal Deodorant Tablets Controls Body Odors Safely and Effectively -,Beauty,http://www.amazon.com/dp/B000Q6HBIW/,1,1
"American Weigh Scale AWS-100 Digital Pocket Scale, 100g X 0.01g Resolution",Kitchen,http://www.amazon.com/dp/B0012LOQUQ/,167,1
"American Weigh Scales GEMINI-20 Portable MilliGram Scale, 20 by 0.001 G",Kitchen,http://www.amazon.com/dp/B0012TDNAM/,138,1
"Now Foods Vcaps '0' Empty Capsules, 300-Count",Health and Beauty,http://www.amazon.com/dp/B0014UEEBG/,1,1
"Natural Vitality Natural Calm Diet Supplement, Raspberry Lemon, 16 Ounce",Health and Beauty,http://www.amazon.com/dp/B00BPUY3W0/,35,1
MODIFILAN 90 CAPS,Health and Beauty,http://www.amazon.com/dp/B00RYOPNJ8/,1,1
