name,category,amazon_link,total_mentions,subreddit_mentions
Art For Dummies,Books,https://www.amazon.com/Art-Dummies-Thomas-Hoving/dp/0764551043/ref=sr_1_1?ie=UTF8&amp;qid=1439921644&amp;sr=8-1&amp;keywords=art+for+dummies,1,1
Adventurer Conqueror King System (AUT1001),Books,https://www.amazon.com/Adventurer-Conqueror-King-Alexander-Macris/dp/0984983201,1,1
Contested Closets: The Politics and Ethics of Outing,Books,https://www.amazon.com/Contested-Closets-Politics-Ethics-Outing/dp/0816621799,1,1
"The Philosophy and Politics of Abstract Expressionism, 1940-1960",Books,https://www.amazon.com/Philosophy-Politics-Abstract-Expressionism-1940-1960/dp/0521651549,1,1
"Volokh's The First Amendment and Related Statutes: Problems, Cases and Policy Arguments, 4th (University Casebook Series) (English and English Edition)",Books,https://www.amazon.com/Volokhs-First-Amendment-Related-Statutes/dp/1599418673,1,1
