name,category,amazon_link,total_mentions,subreddit_mentions
"The Phoenix Project: A Novel about IT, DevOps, and Helping Your Business Win",Book,http://www.amazon.com/dp/0988262592/,4,1
Behind Closed Doors: Secrets of Great Management (Pragmatic Programmers),Book,http://www.amazon.com/dp/0976694026/,1,1
The Gold Mine: A Novel of Lean Turnaround,Book,http://www.amazon.com/dp/0974322563/,1,1
Lead With Respect: A Novel of Lean Practice,Book,http://www.amazon.com/dp/1934109479/,1,1
The Gold Mine Trilogy Study Guide,Book,http://www.amazon.com/dp/1934109509/,1,1
The Lean Manager: A Novel of Lean Transformation,Book,http://www.amazon.com/dp/1934109258/,1,1
"PMI-ACP Exam Prep, Second Edition: A Course in a Book for Passing the PMI Agile Certified Practitioner (PMI-ACP) Exam",Book,http://www.amazon.com/dp/1932735984/,1,1
Scrum and XP from the Trenches (Enterprise Software Development),Book,http://www.amazon.com/dp/1430322640/,1,1
