name,category,amazon_link,total_mentions,subreddit_mentions
"SoHoMiLL  YL 99 Keyless Electronic Keypad Lock, Adjustable latch backset 2 3/8-Inch to 2 3/4-Inch , Satin Nickel",Home Improvement,http://www.amazon.com/dp/B00HLVGO7Y/,6,3
"Schlage Z-Wave Connect Century Touchscreen Deadbolt with Built-In Alarm, Works with Amazon Alexa via SmartThings, Wink or Iris,  Satin Chrome, BE469 CEN 626",Home Improvement,http://www.amazon.com/dp/B00AGK9KJG/,5,3
"Schlage BE365VCAM619 Camelot Keypad Deadbolt, Satin Nickel",Home Improvement,http://www.amazon.com/dp/B000NJJ1MQ/,14,2
"Wine Away Red Wine Stain Remover,12-Ounces",Health and Beauty,http://www.amazon.com/dp/B0000DDYOU/,5,2
"Schlage FE595VCAM619ACC Camelot Keypad  Entry with Flex-Lock and Accent Levers,  Satin Nickel",Home Improvement,http://www.amazon.com/dp/B000NJJ1TY/,4,1
"Yacker Tracker Noise Detector, 17"" x 5.5"" x 5""",BISS,http://www.amazon.com/dp/B001AZ2O2Q/,3,1
Sanitary Disposal Bags with Refillable Dispenser,Office Product,http://www.amazon.com/dp/B001R1SLRK/,1,1
"Scotch Permanent Mounting Tape, 1 Inch x 125 Inches",Home Improvement,http://www.amazon.com/dp/B00347A8GC/,1,1
"Paragon 7750 Electronic Wall Lock and Safe, .83 CF Hidden In Wall Large Safe",BISS,http://www.amazon.com/dp/B0040HS3QW/,1,1
"Bayer Advantage II Flea and Lice Treatment for X-Large Dogs, Over 55 lb, 4 doses",Pet Products,http://www.amazon.com/dp/B004QBL9IQ/,1,1
KeyGuard SL-590 Punch Button Key Storage Wall Mount Lock Box,Home Improvement,http://www.amazon.com/dp/B00545AD2Q/,1,1
"Signature Sleep 12 Inch Memory Foam Mattress, Queen",Furniture,http://www.amazon.com/dp/B005A4OO80/,14,1
"Schlage Z-Wave Home Keypad Lever, Works with Amazon Alexa via SmartThings, Satin Nickel, FE599NX CAM 619 ACC 619",Home Improvement,http://www.amazon.com/dp/B0083GJ17G/,4,1
OBi200 1-Port VoIP Phone Adapter with Google Voice and Fax Support for Home and SOHO Phone Service,CE,http://www.amazon.com/dp/B00BUV7C9A/,31,1
"Mr. Coffee Flintshire Stainless Steel Whistling Tea Kettle, 1.75-Quart, Silver",Kitchen,http://www.amazon.com/dp/B00F9U0T52/,7,1
"digitharbor® 3.5 inches TFT LCD screen digital door peephole viewer camera Night vision wide angle+Video Record+Photo shooting, 3.5"" door viewer Doorbell Security Camera Cam",Home Improvement,http://www.amazon.com/dp/B00FRA9WAM/,2,1
iChargerlock - The ONLY Apple iPhone Charger & Cord Lock-No One will take your Charger AGAIN! Lock Your Charger into your Outlet!,Wireless,http://www.amazon.com/dp/B00GFWYKM6/,1,1
Soft'N Style (30 oz. Lotion Dispense Bottle) (Pack 2),Health and Beauty,http://www.amazon.com/dp/B00INYDVMO/,1,1
"Anker 60W 6-Port USB Wall Charger, PowerPort 6 for iPhone X/ 8/ 7 / 6s / Plus, iPad Pro / Air 2 / mini/ iPod, Galaxy S7 / S6 / Edge / Plus, Note 5 / 4, LG, Nexus, HTC and More",Wireless,http://www.amazon.com/dp/B00P936188/,28,1
"Vastar Premium 4 in 1 Multiple USB Charging Cable Adapter Connector with Micro USB / Mini USB Ports for iPhone 6, 5, 4, iPad 4,3,2,Air,Galaxy S4, S5,Nexus 5, and More",Personal Computer,http://www.amazon.com/dp/B00WFNNJB2/,1,1
"OxyLED OxyWild 12 Ultraviolet LED UV Light, Pet Urine Stain Detector Blacklight Flashlight (AAA Batteries Inclued)",Home Improvement,http://www.amazon.com/dp/B013OIKCF2/,1,1
"YI Home Camera, Wireless IP Video Suveillance System with Night Vision for Indoor Security, Nursery, Pet Monitor - Cloud Service Available (Black)",Photography,http://www.amazon.com/dp/B019MMRV1M/,7,1
World Decorator [Laminated] (National Geographic Reference Map),Book,http://www.amazon.com/dp/0792283090/,2,1
"Bodum K10938-01US Brazil Set, French Press 8 Cup Coffee Maker, Electric Coffee Blade Grinder & Electric 34 oz. Water Kettle, , Black",Kitchen,http://www.amazon.com/dp/B01JL66USE/,1,1
"Biokleen Bac-Out Stain+Odor Remover, 32 Ounces",Health and Beauty,http://www.amazon.com/dp/B0009ET4XQ/,3,1
Dog Dazer II Ultrasonic Dog Deterrent,Pet Products,http://www.amazon.com/dp/B000IBRI2Y/,14,1
"Schlage BE365VCAM716 Camelot Keypad Deadbolt, Aged Bronze",Home Improvement,http://www.amazon.com/dp/B000NJDRDA/,3,1
