name,category,amazon_link,total_mentions,subreddit_mentions
On Becoming an Alchemist: A Guide for the Modern Magician,Book,http://www.amazon.com/dp/1590306872/,3,2
The Alchemists Handbook: Manual for Practical Laboratory Alchemy,Book,http://www.amazon.com/dp/0877286558/,2,2
The Golden Thread: The Ageless Wisdom of the Western Mystery Traditions,Book,http://www.amazon.com/dp/0835608603/,1,1
Real Alchemy: A Primer of Practical Alchemy,Book,http://www.amazon.com/dp/0892541504/,4,1
The Way of the Crucible,Book,http://www.amazon.com/dp/0892541547/,1,1
The Chemical Wedding of Christian Rosenkreutz (Magnum Opus Hermetic Sourceworks Series: No. 18),Book,http://www.amazon.com/dp/0933999356/,1,1
Sorcerer's Stone: A Beginner's Guide to Alchemy,Book,http://www.amazon.com/dp/1481179144/,1,1
Mystical Qabalah,Book,http://www.amazon.com/dp/1578631505/,4,1
The Chicken Qabalah of Rabbi Lamed Ben Clifford: Dilettante's Guide to What You Do and Do Not Need to Know to Become a Qabalist,Book,http://www.amazon.com/dp/1578632153/,9,1
Alchemical Psychology: Old Recipes for Living in a New World,Book,http://www.amazon.com/dp/1585421405/,3,1
The Complete Idiot's Guide to Alchemy (Complete Idiot's Guides (Lifestyle Paperback)),Book,http://www.amazon.com/dp/1592577350/,1,1
Initiation into Hermetics,Book,http://www.amazon.com/dp/1885928122/,10,1
The Alchemist,Book,http://www.amazon.com/dp/0061122416/,8,1
Alchemy Booklet,eBooks,http://www.amazon.com/dp/B00HJQK6V6/,2,1
The Emerald Tablet: Alchemy for Personal Transformation,Book,http://www.amazon.com/dp/0140195718/,3,1
