name,category,amazon_link,total_mentions,subreddit_mentions
"Palomar: The Heartbreak Soup Stories, A Love and Rockets Book",Book,http://www.amazon.com/dp/1560975393/,2,2
The Acme Novelty Library (Pantheon Graphic Novels),Book,http://www.amazon.com/dp/0375422951/,1,1
Jimmy Corrigan: The Smartest Kid on Earth (Pantheon Graphic Novels),Book,http://www.amazon.com/dp/0375714545/,3,1
Deadbone,Book,http://www.amazon.com/dp/0930193989/,1,1
The Nikopol Trilogy,Book,http://www.amazon.com/dp/0967240123/,1,1
Locas: The Maggie and Hopey Stories (Love & Rockets),Book,http://www.amazon.com/dp/156097611X/,2,1
"Prophet, Vol. 1: Remission",Book,http://www.amazon.com/dp/1607066114/,2,1
Corto Maltese: Under the Sign of Capricorn,Book,http://www.amazon.com/dp/1631400657/,1,1
Acme Novelty Library #20,Book,http://www.amazon.com/dp/1770460209/,1,1
The R. Crumb Coffee Table Art Book (Kitchen Sink Press Book for Back Bay Books),Book,http://www.amazon.com/dp/0316163333/,1,1
Pablo: Art Masters Series,Book,http://www.amazon.com/dp/1906838941/,1,1
