name,category,amazon_link,total_mentions,subreddit_mentions
"Wiremold CMK50 Cord Mate II Kit Wall Cord Cover, White",Home Improvement,http://www.amazon.com/dp/B0015EDVVU/,5,1
"gearup OakRak Floor to Ceiling Storage Rack, Golden Pecan",Sports,http://www.amazon.com/dp/B000TM96MM/,3,1
Bunk Buddy Bedside Shelf,Furniture,http://www.amazon.com/dp/B00M0KNZKK/,2,1
Flash Furniture Beech Bentwood Adjustable Height Barstool with Button Tufted Black Vinyl Seat,Furniture,http://www.amazon.com/dp/B00F8LWZUO/,2,1
Vixen,Book,http://www.amazon.com/dp/1466316578/,1,1
"Set of 4 Throw Pillow Covers, YIFAN Tropical Cactus Plants Pattern Polyester Ramie Square Pillow Cover Decorative Cushion Case Pillowcase Home Decor 17.7*17.7 Inch",Home,http://www.amazon.com/dp/B01H1IC0SI/,1,1
Gear Up Oak Rak Floor to Ceiling Storage Rack,Sports,http://www.amazon.com/dp/B00IPJCUQK/,1,1
"54"" Long Hanger Hooker with Wooden Handle -Reach Pole",Home,http://www.amazon.com/dp/B0027Z02ZY/,1,1
Retired SKU,CE,http://www.amazon.com/dp/B014HYJEMY/,1,1
Whitmor Supreme Baker’s Rack Wood & Chrome,Home,http://www.amazon.com/dp/B0014QS1XC/,1,1
The Complete Guide to Easy Woodworking Projects (Black & Decker),Book,http://www.amazon.com/dp/1589230930/,1,1
"Society6 Mountain Shades Wall Tapestry Large: 88"" x 104""",Home,http://www.amazon.com/dp/B01FG5LNPE/,1,1
