name,category,amazon_link,total_mentions,subreddit_mentions
THC Marijuana Surface Residue Detection Test,Health and Beauty,http://www.amazon.com/dp/B00BPX4XW2/,4,3
The Deacons for Defense: Armed Resistance and the Civil Rights Movement,Book,http://www.amazon.com/dp/0807857025/,2,1
The Citizen Journalist’s Photography Handbook,Book,http://www.amazon.com/dp/1285859022/,1,1
Seven Souls,Music,http://www.amazon.com/dp/B0000057RJ/,1,1
Kershaw 1620 Scallion Folding Knife with SpeedSafe,Sports,http://www.amazon.com/dp/B0009VC9UY/,1,1
Valentine One Radar Detector,Car Audio or Theater,http://www.amazon.com/dp/B000U89KGW/,2,1
Cyclops C18MIL Thor X Colossus 18 Million Candle Power Rechargable Halogen Spotlight,BISS,http://www.amazon.com/dp/B0018F1CJ4/,4,1
4GB Mini Spy Button Camera Hidden DVR Camcorder,Photography,http://www.amazon.com/dp/B0083F7VEC/,3,1
Rothco Clear Polycarbonate Blank Antiriot Shield,Sports,http://www.amazon.com/dp/B0098KG0IO/,2,1
"Vehicle Blackbox DVR, 2.5"" TFT LCD Screen",Car Audio or Theater,http://www.amazon.com/dp/B00B2383T4/,2,1
Nitecore TM26,Sports,http://www.amazon.com/dp/B00B8XAEJ0/,1,1
SONY  ICD PX333 Digital Voice Recorder,Office Product,http://www.amazon.com/dp/B00BOXNSRY/,15,1
"Timetec 62RHG680-B8G Road Hawk HD 1080P Automobile Digital Video Recorder System with GPS, Gsensor & Google Maps, Black",Car Audio or Theater,http://www.amazon.com/dp/B00CXB186Y/,12,1
Arkon Car Mount Phone Holder for iPhone X iPhone 8 7 6S Plus 8 7 6S Galaxy S8 S7 Note 8 7 Retail Black,Wireless,http://www.amazon.com/dp/B00I58VAZS/,5,1
"Spy Tec G1W-C Capacitor Model Dash Cam Heat Resistant Full HD 1080P 2.7"" LCD Car DVR Video Recorder with Novatek NT96650",Photography,http://www.amazon.com/dp/B00JJ3SQRI/,25,1
"Napoer Beelike HD Car DVR Traveling Driving Data Recorder Camcorder Vehicle Camera with 120° Angle View, Black",Photography,http://www.amazon.com/dp/B00QT2ZWUQ/,1,1
"Lukas LK-7900 ARA 1080p Full HD Car Dashboard Camera and Video Recorder with GPS, 16GB",Automotive Parts and Accessories,http://www.amazon.com/dp/B00QTG49B0/,6,1
You Have the Right to Remain Innocent,eBooks,http://www.amazon.com/dp/B01DAD218W/,1,1
X.YShine Zoomable 5W IR 850nm Infrared Light Flashlight for Night Vision Device Camera Monitor Fill Light with 18650 Battery & Charger Included (The infared torch Is Invisible to Human Eyes.),Sports,http://www.amazon.com/dp/B01EX46D72/,1,1
License plate frame Flipper USA type 2 PCS in Set,Automotive Parts and Accessories,http://www.amazon.com/dp/B01FW4WHEU/,1,1
Fair DUI: Stay safe and sane in a world gone MADD,Book,http://www.amazon.com/dp/0615832784/,1,1
Falcon Zero F360+ HD DVR Dual 1080P 3.5-Inch Color TFT Rear View Mirror LCD Dash Cam with 32GB SD Card,Wireless,http://www.amazon.com/dp/B01MCZ5SM9/,2,1
