name,category,amazon_link,total_mentions,subreddit_mentions
Clean Code: A Handbook of Agile Software Craftsmanship,Book,http://www.amazon.com/dp/0132350882/,71,2
Effective Java (2nd Edition),Book,http://www.amazon.com/dp/0321356683/,8,2
Android Programming: The Big Nerd Ranch Guide (2nd Edition),Book,http://www.amazon.com/dp/0134171454/,2,2
Android Programming: The Big Nerd Ranch Guide (Big Nerd Ranch Guides),Book,http://www.amazon.com/dp/0321804333/,2,1
"Breett Lazy Mount Cell Phone Holder, Universal Plastic Cell Phone Clip Holder, Lazy Bracket Flexible Long Arms for iPhone, GPS Devices, Fit on Desktop, Stand for Bedroom, Office, Bathroom, Kitchen, chair, wall cabinet",Wireless,http://www.amazon.com/dp/B00UTD4XV0/,2,1
Version Control with Git: Powerful tools and techniques for collaborative software development,Book,http://www.amazon.com/dp/1449316387/,1,1
"Type C, Veckle USB to USB C Cable 10ft Braided Cable for Samsung Galaxy S8, LG G5, ChromeBook Pixel, OnePlus 2, Nexus 6P, 5X, Lumia 950, Nokia N1, Nintendo Switch and Other USB C Devices, Black",Wireless,http://www.amazon.com/dp/B016ZYUG80/,1,1
kenable Slimline PRO 3.5mm Jack to Stereo Jack Socket Extension Cable 0.3m (~1 foot),Speakers,http://www.amazon.com/dp/B00O2X0OMU/,1,1
Elements of Programming Interviews in Java: The Insiders' Guide,Book,http://www.amazon.com/dp/1517435803/,1,1
Making Musical Apps: Real-time audio synthesis on Android and iOS,Book,http://www.amazon.com/dp/1449314902/,1,1
Clean Architecture: A Craftsman's Guide to Software Structure and Design (Robert C. Martin Series),Book,http://www.amazon.com/dp/0134494164/,1,1
