name,category,amazon_link,total_mentions,subreddit_mentions
BAFX Products 34t5 Bluetooth OBDII Scan Tool for Android Devices,Automotive Parts and Accessories,http://www.amazon.com/dp/B005NLQAHS/,136,2
"PortaPow Specialised 3.3ft 20AWG Charge Only Micro USB Cable for Blackberry, OnePlus One, HTC One, Google Nexus, Asus Transformer, Dell Venue, Other Fast Charging Devices",Wireless,http://www.amazon.com/dp/B00RL68RNS/,7,2
Sabrent USB External Stereo Sound Adapter for Windows and Mac. Plug and play No drivers Needed. (AU-MMSA),Personal Computer,http://www.amazon.com/dp/B00IRVQ0F8/,124,2
Seveneves: A Novel,eBooks,http://www.amazon.com/dp/B00LZWV8JO/,8,2
SanDisk Ultra 64GB USB 3.0 OTG Flash Drive With micro USB connector For Android Mobile Devices(SDDD2-064G-G46),Personal Computer,http://www.amazon.com/dp/B00RBGYGPG/,16,2
Allen Carr's Easy Way To Stop Smoking,Book,http://www.amazon.com/dp/0615482155/,83,1
The 7 Habits of Highly Effective People: Powerful Lessons in Personal Change,Book,http://www.amazon.com/dp/1455892823/,10,1
Uvex Skyper Blue Light Blocking Computer Glasses with SCT-Orange Lens (S1933X),Home Improvement,http://www.amazon.com/dp/B000USRG90/,73,1
Brother HL-2270DW Compact Laser Printer with Wireless Networking and Duplex,CE,http://www.amazon.com/dp/B00450DVDY/,14,1
Amazon Underground,Mobile Application,http://www.amazon.com/dp/B004GJDQT8/,2,1
"Clocky Alarm Clock on Wheels, Black",Home,http://www.amazon.com/dp/B004MSMUGI/,5,1
"eWeather HD with Future Radar, Alerts and Air Quality",Mobile Application,http://www.amazon.com/dp/B0058EBNAO/,1,1
LunarMap HD,Mobile Application,http://www.amazon.com/dp/B006MI0VJE/,1,1
CrossMe Premium Nonograms,Mobile Application,http://www.amazon.com/dp/B007JM4CWY/,1,1
CrossMe Color Premium Nonograms,Mobile Application,http://www.amazon.com/dp/B008D28HYS/,1,1
Deluxe Moon - Moon Phases Calendar,Mobile Application,http://www.amazon.com/dp/B009MGLSU4/,1,1
Goliton Bluetooth Supper Mini OBD 2 /Mini OBD II Compatible with Andriod Power 2-Blue,Wireless,http://www.amazon.com/dp/B009NPAORC/,3,1
"SMSL SD793-II PCM1793 DIR9001 DAC Digital Audio Decoder Amplifier, Black",Speakers,http://www.amazon.com/dp/B00A2QLPJM/,50,1
"Belkin 3-Outlet SurgePlus Mini Travel Swivel Charger Surge Protector with Dual USB Ports (2.1 AMP / 10 Watt), BST300",Speakers,http://www.amazon.com/dp/B00ATZJ5YS/,19,1
Pebble Smartwatch Black,Wireless,http://www.amazon.com/dp/B00BKEQBI0/,15,1
SanDisk Connect 32GB Wireless Flash Drive For Smartphones And Tablets- SDWS2-032G-E57,Personal Computer,http://www.amazon.com/dp/B00DBX371C/,8,1
"Philips SHQ1200WT/28 ActionFit Sports In-Ear Headphones, White",Speakers,http://www.amazon.com/dp/B00DUSVV8O/,1,1
"GOgroove FlexSMART X3 Mini Bluetooth FM Transmitter with Hands-free Calling , Audio Playback and USB Charging - Works with Apple iPhone 6s , Samsung Galaxy S6 , HTC One M9 and More Smartphones",Wireless,http://www.amazon.com/dp/B00EPQ0U2S/,2,1
Signstek HIFI USB to Coaxial S/PDIF Converter Convert Digital to Analogue Signal Mini USB DAC PCM,PC Accessory,http://www.amazon.com/dp/B00FEDHHKE/,28,1
Motorola Moto G (1st Generation) - Black - 16GB - Global GSM Unlocked Phone,Wireless,http://www.amazon.com/dp/B00GWR373M/,9,1
ScanTool 427201 OBDLink LX Bluetooth: Professional OBD-II Scan Tool for Android & Windows,Automotive Parts and Accessories,http://www.amazon.com/dp/B00H9S71LW/,9,1
LYNE,Mobile Application,http://www.amazon.com/dp/B00HA8WNZ0/,2,1
"iClever Wireless Bluetooth FM Transmitter Radio Adapter Car Kit with 3.5mm Audio Plug and USB Car Charger, Black",Wireless,http://www.amazon.com/dp/B00HIATW04/,12,1
"NETGEAR Trek N300 Travel Router, Range Extender, and Wireless Bridge (PR2000)",Personal Computer,http://www.amazon.com/dp/B00HQ883T4/,9,1
Coodio USB Bluetooth Music Audio Stereo Receiver Fit for Car AUX in Home Mp3 Speaker Iphone.,Wireless,http://www.amazon.com/dp/B00HT07QXI/,7,1
Motorola Moto G LTE- Factory Unlocked US Warranty (Black),Wireless,http://www.amazon.com/dp/B00K0NRZSW/,4,1
Monument Valley,Mobile Application,http://www.amazon.com/dp/B00KA7JIII/,3,1
Sorcery! 2,Mobile Application,http://www.amazon.com/dp/B00KT6MYX6/,4,1
FiiO E10K USB DAC and Headphone Amplifier (Black),Wireless,http://www.amazon.com/dp/B00LP3AMC2/,163,1
Motorola XT1068 Moto G (2ND GENERATION - 2014) DUAL SIM 8GB Factory Unlocked 3G Phone - Black (International Version - No Warranty),Wireless,http://www.amazon.com/dp/B00NBSZ56C/,1,1
Mpow Cheetah Sport Bluetooth 4.1 Wireless Headphones Stereo Sport Running Gym Exercise Headsets Earphones-Retail Packaging-Black,Wireless,http://www.amazon.com/dp/B00QXT7JOC/,6,1
80 Days,Mobile Application,http://www.amazon.com/dp/B00QZ727TO/,3,1
"IPEGA PG-9023 Telescopic Wireless Bluetooth Game Controller Gamepad for iPhone iPod iPad iOS System, Samsung Galaxy Note HTC LG Android Tablet PC",Wireless,http://www.amazon.com/dp/B00RE6FMD8/,34,1
The 7 Habits of Highly Effective People: Powerful Lessons in Personal Change,eBooks,http://www.amazon.com/dp/B01069X4H0/,7,1
Pebble Time Smartwatch - Black,Wireless,http://www.amazon.com/dp/B0106IS5XY/,19,1
Shadow Strike,Mobile Application,http://www.amazon.com/dp/B012NSBUCI/,1,1
CHENYANG Ultra Mini DM Micro USB 5pin OTG Adapter Connector for Cell Phone Tablet & USB Cable & Flash Disk - 5pcs,BISS,http://www.amazon.com/dp/B015GZOHKW/,20,1
"FiiO K1 Portable Headphone Amplifier and USB DAC, Titanium",CE,http://www.amazon.com/dp/B0189EVGAG/,21,1
"Braun MQ725 Multiquick Hand Blender, Black",Kitchen,http://www.amazon.com/dp/B01EA5ZLOU/,2,1
Pebble Time Steel Smartwatch for Apple/Android Devices - Gold (Certified Refurbished),Wireless,http://www.amazon.com/dp/B01FIAXHCO/,3,1
"BroadLink IR Control Hub, RM Mini3 Smart Home Wi-Fi IR Universal Remote Control, One for All Control TV PVR VDO DVD CD AUD SAT ( Black Bean RMMINI3-EN )",PC Accessory,http://www.amazon.com/dp/B01FK2SDOC/,5,1
"Vyncs: No Monthly Fee Connected Car OBD Link, Real Time 3G Car GPS Tracker, Trips, Engine Diagnostics, Driver Coaching for Teens, Optional Roadside Assistance",GPS or Navigation System,http://www.amazon.com/dp/B01HSODG10/,1,1
DTCdb,Mobile Application,http://www.amazon.com/dp/B01I230K06/,1,1
Mobizen World's First Voice and Internal Sound Recording Earphones Headphones with Microphone and Volume Control for Android Cell Phones and Tablets,Speakers,http://www.amazon.com/dp/B01KZM6KM4/,2,1
"Avantree aptX LOW LATENCY Bluetooth Adapter for Headphones with Clip / Microphone, BT 4.2, Wireless Audio Receiver for Handsfree Call and Music - Clipper Pro",PC Accessory,http://www.amazon.com/dp/B01LZRB8HJ/,2,1
"Intro to Java Programming, Comprehensive Version (10th Edition)",Book,http://www.amazon.com/dp/0133761312/,11,1
Maceton Aluminum Wireless Bluetooth Receiver with 3.5mm Jack and headphone Amplifier and Lossless APT-X and Bass Boost Option for Beats Headphones/ Speakers/ Car audio,Car Audio or Theater,http://www.amazon.com/dp/B01NAQ5089/,2,1
Android Programming: The Big Nerd Ranch Guide (3rd Edition) (Big Nerd Ranch Guides),Book,http://www.amazon.com/dp/0134706056/,18,1
The Design of Everyday Things (MIT Press),Book,http://www.amazon.com/dp/0262525674/,2,1
Mrs. Meyer's Clean Home: No-Nonsense Advice that Will Inspire You to CLEAN like the DICKENS,Book,http://www.amazon.com/dp/0446544590/,1,1
Everyone Poops (Turtleback School & Library Binding Edition),Book,http://www.amazon.com/dp/0613685725/,51,1
