name,category,amazon_link,total_mentions,subreddit_mentions
"TV Anime ""Sound! Euphonium"" Original Soundtrack Memories of Music",Music,http://www.amazon.com/dp/B00WFA2DOO/,14,14
"Spice and Wolf, Vol. 7 - light novel",Book,http://www.amazon.com/dp/0316229121/,6,6
"Spice and Wolf, Vol. 1 - light novel",Book,http://www.amazon.com/dp/0759531048/,6,4
Steins Gate: Complete Series Classic [Blu-ray],DVD,http://www.amazon.com/dp/B00KU3Y5CG/,4,3
Anime: A History,Book,http://www.amazon.com/dp/1844573907/,3,3
KABANERI OF THE IRON FORTRESS(Subbed),TV Series Season Video on Demand,http://www.amazon.com/dp/B01DU4K5ES/,3,3
"Baccano!, Vol. 1: The Rolling Bootlegs - light novel",Book,http://www.amazon.com/dp/0316270369/,3,3
Character Collection 4,Music,http://www.amazon.com/dp/B001PM0BU6/,3,3
"The Devil Is a Part-Timer, Vol. 1 - light novel",Book,http://www.amazon.com/dp/0316383120/,3,3
"Is It Wrong to Try to Pick Up Girls in a Dungeon?, Vol. 1 - light novel",Book,http://www.amazon.com/dp/0316339156/,11,2
Cowboy Bebop: The Complete Series [Blu-ray],DVD,http://www.amazon.com/dp/B00NP06DJE/,4,2
Nichijou: My Ordinary Life - The Complete Series (SUB Only) (Blu-ray/DVD Combo),DVD,http://www.amazon.com/dp/B01N0E5NH3/,3,2
"Food Wars!, Vol. 5: Shokugeki no Soma",Book,http://www.amazon.com/dp/1421573857/,2,2
"Food Wars!, Vol. 6: Shokugeki no Soma",Book,http://www.amazon.com/dp/1421576880/,2,2
"Food Wars!, Vol. 3: Shokugeki no Soma",Book,http://www.amazon.com/dp/1421572567/,2,2
"Food Wars!, Vol. 2: Shokugeki no Soma",Book,http://www.amazon.com/dp/1421572559/,2,2
"Food Wars!, Vol. 7: Shokugeki no Soma",Book,http://www.amazon.com/dp/1421579650/,2,2
"Food Wars!, Vol. 4: Shokugeki no Soma",Book,http://www.amazon.com/dp/1421572575/,2,2
"Food Wars!, Vol. 1: Shokugeki no Soma",Book,http://www.amazon.com/dp/1421572540/,2,2
Sega My Teen Romantic Comedy SNAFU: Yukino Yukinoshita Premium Figure,Toy,http://www.amazon.com/dp/B00HEVB89K/,2,2
"Spice and Wolf, Vol. 8: The Town of Strife I - light novel",Book,http://www.amazon.com/dp/0316245461/,2,2
"Spice and Wolf, Vol. 5 - light novel",Book,http://www.amazon.com/dp/0759531102/,2,2
"Spice and Wolf, Vol. 12 - light novel",Book,http://www.amazon.com/dp/0316324329/,2,2
"Spice and Wolf, Vol. 13: Side Colors III - light novel",Book,http://www.amazon.com/dp/0316336610/,2,2
"Spice and Wolf, Vol. 6 - light novel",Book,http://www.amazon.com/dp/0759531110/,2,2
"School-Live!, Vol. 1",Book,http://www.amazon.com/dp/0316309702/,2,2
"Spice and Wolf, Vol. 2 - light novel",Book,http://www.amazon.com/dp/0759531064/,2,2
"Spice and Wolf, Vol. 4 - light novel",Book,http://www.amazon.com/dp/0759531080/,2,2
"Spice and Wolf, Vol. 11: Side Colors II - light novel",Book,http://www.amazon.com/dp/0316324272/,2,2
"Spice and Wolf, Vol. 3 - light novel",Book,http://www.amazon.com/dp/0759531072/,2,2
Character Collection 5,Music,http://www.amazon.com/dp/B001PM0BUG/,2,2
Good Smile Company - Strike Witches Nendoroid PVC Action Figure Charlotte E. Yeager 1,Single Detail Page Misc,http://www.amazon.com/dp/B005ZN3VQM/,2,2
"Bandai Tamashii Nations Erica Hartmann Strike Witches 2, Armor Girls Project",Toy,http://www.amazon.com/dp/B00955MSII/,2,2
AKG Acoustics K701 Reference Class Headphones,CE,http://www.amazon.com/dp/B000EBBJ6Y/,2,2
Mobile Suit Gundam (First Gundam) Part 1 Blu-ray Collection,DVD,http://www.amazon.com/dp/B013TOVA98/,2,2
Max Factory K-ON: Mio Akiyama Figma Action Figure,Toy,http://www.amazon.com/dp/B00359EWQG/,2,2
One-Punch Man- Season 1,TV Series Season Video on Demand,http://www.amazon.com/dp/B01MS6IP6B/,,1
Eromanga Sensei - Season 1,TV Series Season Video on Demand,http://www.amazon.com/dp/B06Y459QJ6/,,1
GRANBLUE FANTASY The Animation,TV Series Season Video on Demand,http://www.amazon.com/dp/B01MTBLQVL/,,1
Tv Anime Made In Abyss Original Soundtrack,CDs & Vinyl,https://www.amazon.com/Anime-Made-Abyss-Original-Soundtrack/dp/B073QWKGNS/ref=sr_1_5?ie=UTF8&amp;qid=1506733568&amp;sr=8-5&amp;keywords=made+in+abyss,,1
"Farewell, My Dear Cramer #1",eBooks,http://www.amazon.com/dp/B01F6CSZGW/,,1
Black Butler Season 1,TV Series Season Video on Demand,http://www.amazon.com/dp/B00BN6TH54/,,1
Nostalgia,Digital Music Album,http://www.amazon.com/dp/B01MRVDUIY/,,1
Bakemonogatari - Season 1,TV Series Season Video on Demand,http://www.amazon.com/dp/B06XP34Y5F/,,1
Today Is A Beautiful Day,Digital Music Album,http://www.amazon.com/dp/B007D5F5KA/,,1
"Baccano!, Chapter 1 (manga) (Baccano! manga Serial)",eBooks,http://www.amazon.com/dp/B019NFEKO4/,,1
"Japan Anima(tor)'s Exhibition, Pt. 2 [feat. Dwango] [Khara BGM Series] [Explicit]",Digital Music Album,http://www.amazon.com/dp/B014G9I9PI/,,1
A Gronking to Remember 2: Chad Goes Deep in the Neutral Zone (Rob Gronkowski Erotica Series),eBooks,http://www.amazon.com/dp/B00T5DSXDY/,,1
"One-Punch Man, Vol. 1",eBooks,http://www.amazon.com/dp/B00I9IO7FE/,,1
Welcome to the Ballroom,TV Series Season Video on Demand,http://www.amazon.com/dp/B073R61J5N/,,1
MADE IN ABYSS - Season 1,TV Series Season Video on Demand,http://www.amazon.com/dp/B073S2KQGJ/,,1
Arifureta: From Commonplace to World's Strongest Volume 1,eBooks,http://www.amazon.com/dp/B06XBJVMDR/,,1
Anonymous Noise - Season 1,TV Series Season Video on Demand,http://www.amazon.com/dp/B06Y5WC21S/,,1
KABANERI OF THE IRON FORTRESS(Subbed),TV Series Season Video on Demand,http://www.amazon.com/dp/B01DU4LS3K/,,1
Avatar: The Last Airbender Season 1,TV Series Season Video on Demand,http://www.amazon.com/dp/B000GFD4C0/,,1
Macross Plus - Bundle,TV Series Season Video on Demand,http://www.amazon.com/dp/B00FJJE4AY/,,1
LOVE and LIES - Season 1,TV Series Season Video on Demand,http://www.amazon.com/dp/B073PC1SL6/,,1
"Love, Chunibyo and Other Delusions Season 1 [subtitled]",TV Series Season Video on Demand,http://www.amazon.com/dp/B00GTIQ7H2/,,1
Player's Handbook (Dungeons & Dragons),Book,http://www.amazon.com/dp/0786965606/,29,1
"Aroma Housewares ARC-914SBD 8-Cup (Cooked) Digital Cool-Touch Rice Cooker and Food Steamer with Stainless Steel Exterior, Silver",Kitchen,http://www.amazon.com/dp/B007WQ9YNO/,18,1
A Gronking to Remember: Book One in the Rob Gronkowski Erotica Series,eBooks,http://www.amazon.com/dp/B00RN7TNHE/,13,1
How to Draw: drawing and sketching objects and environments from your imagination,Book,http://www.amazon.com/dp/1933492732/,12,1
Blue Snowball USB Microphone (Textured White),Musical Instruments,http://www.amazon.com/dp/B000EOPQ7E/,10,1
WD 4TB My Book Desktop External Hard Drive - USB 3.0 - WDBFJK0040HBK-NESN,Personal Computer,http://www.amazon.com/dp/B00E3RH61W/,9,1
Hyperion (Hyperion Cantos),Book,http://www.amazon.com/dp/0553283685/,8,1
"Logitech G502 Proteus Spectrum RGB Tunable Gaming Mouse, 12,000 DPI On-The-Fly DPI Shifting",Electronics,https://www.amazon.com/Logitech-Proteus-Spectrum-Tunable-Gaming/dp/B019OB663A/ref=sr_1_11?s=electronics&amp;ie=UTF8&amp;qid=1476864132&amp;sr=1-11&amp;keywords=gaming+mouse&amp;refinements=p_72,7,1
Cory in the House - Nintendo DS,Video Games,http://www.amazon.com/dp/B00134YL8E/,6,1
"All-Clad 41126 Stainless Steel Tri-Ply Bonded Dishwasher Safe Fry Pan with Lid / Cookware, 12-Inch, Silver",Kitchen,http://www.amazon.com/dp/B00FUF5K8W/,6,1
"The Animator's Survival Kit: A Manual of Methods, Principles and Formulas for Classical, Computer, Games, Stop Motion and Internet Animators",Book,http://www.amazon.com/dp/086547897X/,6,1
Huion 4 x 2.23 Inches OSU Tablet Graphics Drawing Pen Tablet - 420,Personal Computer,http://www.amazon.com/dp/B00DTPYWBG/,6,1
KIZUMONOGATARI: Wound Tale,Book,http://www.amazon.com/dp/1941220975/,5,1
The Simpsons and Their Mathematical Secrets,Book,http://www.amazon.com/dp/1620402777/,5,1
Spice and Wolf Anniversary Collector's Edition (Numbered Edition),Book,http://www.amazon.com/dp/0316504017/,4,1
"BAKEMONOGATARI, Part 1: Monster Tale",Book,http://www.amazon.com/dp/1942993889/,4,1
"Bentgo All-in-One Stackable Lunch/Bento Box, Blue",Kitchen,http://www.amazon.com/dp/B00B78T8U2/,4,1
Cartoon Animation (Collector's Series),Book,http://www.amazon.com/dp/1560100842/,3,1
Sword Art Online Progressive 1 - light novel,Book,http://www.amazon.com/dp/0316259365/,3,1
"Wusthof Pro Cook's Knife, 8-Inch",Kitchen,http://www.amazon.com/dp/B008GRUNOC/,3,1
"I Don't Care if My Best Friend's Mom is a Sasquatch, She's Hot and I'm Taking a Shower With Her (...Because It's the New Millennium) (Volume 1)",Book,http://www.amazon.com/dp/150758833X/,3,1
Nanny Ogg's Cookbook: A Useful and Improving Almanack of Information Including Astonishing Recipes from Terry Pratchett's Discworld (Discworld Series),Book,http://www.amazon.com/dp/0552146730/,3,1
Polare Men’s Full Grain Leather Bifold Wallet– Classic Style - Extra Capacity (Gift Box included),Apparel,http://www.amazon.com/dp/B00VZUZCC0/,3,1
The Official WWE Book of Rules: (And How to Break Them),Book,http://www.amazon.com/dp/1942556101/,3,1
The Street Bible,Book,http://www.amazon.com/dp/0007107900/,3,1
Complete Gurren Lagann Limited Edition Bluray Set,DVD,http://www.amazon.com/dp/B00ATYCF1Y/,3,1
The Five Dysfunctions of a Team: A Leadership Fable,Book,http://www.amazon.com/dp/0787960756/,3,1
"Got2B Glued Spiking Glue, Styling, Original, 6 oz.",Beauty,http://www.amazon.com/dp/B000142OC2/,3,1
Gay Billionaire Dinosaurs In My Butt,eBooks,http://www.amazon.com/dp/B00W0JPA36/,2,1
Beautiful Fighting Girl,Book,http://www.amazon.com/dp/0816654514/,2,1
Corsair Gaming H2100 Dolby 7.1 Wireless Gaming Headset (CA-9011127-NA),Personal Computer,http://www.amazon.com/dp/B00N803C7W/,2,1
"Spice and Wolf, Vol. 15: The Coin of the Sun I - light novel",Book,http://www.amazon.com/dp/031633961X/,2,1
(OLD MODEL) Corsair Gaming K70 RGB LED Mechanical Gaming Keyboard - Cherry MX Red (CH-9000068-NA),Personal Computer,http://www.amazon.com/dp/B00N2ROO2S/,2,1
Welcome to the NHK (Novel),Book,http://www.amazon.com/dp/1427802564/,2,1
Ho-Kago Tea Time Second,Music,http://www.amazon.com/dp/B005UKB7GQ/,2,1
Kara No Kyoukai Kyokai Blu-ray Box Set,DVD,http://www.amazon.com/dp/B0040QE5NI/,2,1
Steins;Gate 0 - PlayStation Vita,Video Games,http://www.amazon.com/dp/B01JHQUTF8/,2,1
"My Hero Academia, Vol. 1",Book,http://www.amazon.com/dp/1421582694/,2,1
SAO Sword Art Online The Movie Ordinal Scale 35mm Film Frame Asuna Bath Scene,Toy,http://www.amazon.com/dp/B06Y4SQ9SC/,1,1
The Cat That Lived a Million Times (Latitude 20 Books),Book,http://www.amazon.com/dp/0824820983/,1,1
Hellsing Organization T-Shirts (Black) (M) by COSPA,Toy,http://www.amazon.com/dp/B001SN8K5A/,1,1
"GrassWorx Omega Doormat, 24"" by 36"", Earth Taupe",Lawn & Patio,http://www.amazon.com/dp/B016ZL62QI/,1,1
"Spice and Wolf, Vol. 18 (light novel): Spring Log",Book,http://www.amazon.com/dp/0316471674/,1,1
Kill la Kill Blu-ray 1,DVD,http://www.amazon.com/dp/B00KUDTWVU/,1,1
Wizarding World of Harry Potter Chocolate Frog Includes Hogwarts Wizard Founders Card,Grocery,http://www.amazon.com/dp/B0084T8PMY/,1,1
"Banpresto Fate/ Stay Night 8"" Saber SQ Action Figure",Toy,http://www.amazon.com/dp/B00VM5SYBY/,1,1
Doublju Mens Raglan V-Neck T-shirts BLUE (US-L),Apparel,http://www.amazon.com/dp/B009VCJXWO/,1,1
When They Cry Kai [Blu-ray],DVD,http://www.amazon.com/dp/B01AX930XG/,1,1
When They Cry: Season 1 [Blu-ray],DVD,http://www.amazon.com/dp/B018AXRJYS/,1,1
Aria the Animation (Litebox),DVD,http://www.amazon.com/dp/B00DYVUC4G/,1,1
"Food Wars!, Vol. 9: Shokugeki no Soma",Book,http://www.amazon.com/dp/1421580284/,1,1
"Food Wars!, Vol. 8: Shokugeki no Soma",Book,http://www.amazon.com/dp/1421579669/,1,1
ForPro Large Hand Mirror,Beauty,http://www.amazon.com/dp/B01IW1APTY/,1,1
The Animator's Workbook: Step-By-Step Techniques of Drawn Animation,Book,http://www.amazon.com/dp/0823002292/,1,1
Owfeel Comic Tools Plastic Ruler Fixed Paper Feet White for Fixing Animation Positioning Paper,Health and Beauty,http://www.amazon.com/dp/B00HH8R9FM/,1,1
Owfeel Pack of 200PCS 237mmx270mm Manga Comic Drawing 70G White Paper Animation Original Positioning Paper for Art Color Digital Animating Work,Office Product,http://www.amazon.com/dp/B00WMAFNA8/,1,1
"Prismacolor Col-Erase Erasable Colored Pencil, Light Blue",Office Product,http://www.amazon.com/dp/B0038DD85A/,1,1
Necomimi Brainwave Cat Ears,Toy,http://www.amazon.com/dp/B007YNBOJM/,1,1
Mxnpolar Fate Stay Night Emiya Shirou Jacket Long Sleeve T-shirt Costume Cosplay,Sports,http://www.amazon.com/dp/B00WQY3IKW/,1,1
"Sega Sega Kill La Kill 8.5"" Satsuki Kiryuin Premium Action Figure",Toys & Games,https://www.amazon.com/Sega-Kill-La-Satsuki-Kiryuin/dp/B00QY12IRC?sa-no-redirect=1,1,1
Fate/Zero Blu-Ray Box 1 (S) (Import),DVD,http://www.amazon.com/dp/B005ZOPANI/,1,1
J.A. Henckels International Fine Edge Pro 9-Inch Honing Steel,Kitchen,http://www.amazon.com/dp/B00004RFNK/,1,1
"T-fal D91305 Signature Hard Anodized Scratch Resistant PFOA Free Nonstick Thermo-Spot Heat Indicator Fry Pan Cookware, 10-Inch, Black",Kitchen,http://www.amazon.com/dp/B002HWRZ3E/,1,1
"Puella Magi Madoka Magica: The Different Story, Vol. 1",Book,http://www.amazon.com/dp/0316370517/,1,1
LifeShoppingMall Unisex DuRaRaRa Cosplay Orihara Izaya Costume Cotton Padded Hoodie,Apparel,http://www.amazon.com/dp/B00RXM20F6/,1,1
Spice & Wolf: Complete Series (Blu-ray/DVD Combo),DVD,http://www.amazon.com/dp/B00HXEWFWM/,1,1
"Steins;Gate: Complete Series, Part One (Blu-ray/DVD Combo)",DVD,http://www.amazon.com/dp/B00BZC029G/,1,1
"Steins;Gate: Complete Series, Part Two (Blu-ray/DVD Combo)",DVD,http://www.amazon.com/dp/B009B82FCS/,1,1
"A Certain Magical Index, Vol. 1 - light novel",Book,http://www.amazon.com/dp/0316339121/,1,1
Good Smile Hello! Kiniro Mosaic: Alice Cartelet Nendoroid,Toy,http://www.amazon.com/dp/B0131XWFGE/,1,1
"Great Eastern Spice and Wolf Holo In The Forest Wall Scroll, 33 by44-Inch",Home,http://www.amazon.com/dp/B004RWEGFC/,1,1
Soot because of academic (Kodansha academic library) (2006) ISBN: 4061597590 [Japanese Import],Book,http://www.amazon.com/dp/4061597590/,1,1
Sheaffer Piston Fountain Pen Converter (86700),Office Product,http://www.amazon.com/dp/B0017UJGBQ/,1,1
Osamu Tezuka: The Mysterious Underground Men (Ten-Cent Manga),Book,http://www.amazon.com/dp/1939799090/,1,1
Castle Town Dandelion: The Complete Series (Blu-ray/DVD Combo),DVD,http://www.amazon.com/dp/B01KWK56WY/,1,1
Wolf Children: Ame & Yuki,Book,http://www.amazon.com/dp/031640165X/,1,1
How To Draw Manga,Book,http://www.amazon.com/dp/0439317452/,1,1
"Spice and Wolf, Vol. 14 - light novel",Book,http://www.amazon.com/dp/0316339598/,1,1
Great Eastern Entertainment Gurren Lagann Coredrill Metal Keychain,Toy,http://www.amazon.com/dp/B002Y3RRUM/,1,1
"Spice and Wolf, Vol. 10 - light novel",Book,http://www.amazon.com/dp/0316322369/,1,1
Evangelion Chronicle: Illustrations (Evangelion Chronicle Illustrations SC),Book,http://www.amazon.com/dp/1926778553/,1,1
The Essential Evangelion Chronicle: Side A (Essential Evangelion Chronicle SC),Book,http://www.amazon.com/dp/192677857X/,1,1
The Essential Evangelion Chronicle: Side B,Book,http://www.amazon.com/dp/1926778588/,1,1
Der Mond: The Art of Neon Genesis Evangelion,Book,http://www.amazon.com/dp/1421507676/,1,1
"SHARP character 12 digit Nice size calculator ""K-On!"" Pink calculator type strap EL-KON1 (japan import)",CE,http://www.amazon.com/dp/B004OL3T3G/,1,1
OXO Good Grips 12-Inch Tongs with Black Silicone Heads,Kitchen,http://www.amazon.com/dp/B003L0OYK8/,1,1
Good Smile Fate/unlimited codes: Saber Lily Golden Caliburn PVC Figure (1:7 Scale),Single Detail Page Misc,http://www.amazon.com/dp/B0039S7HJC/,1,1
ZOIDS - RZ-046 Shadow Fox (Plastic model) by Kotobukiya,Toy,http://www.amazon.com/dp/B008ESKQ5E/,1,1
OXO Good Grips Saute Paddle,Kitchen,http://www.amazon.com/dp/B008H2JLV2/,1,1
"Kokuyo Campus NotebookRegla Semi B5Dotted 7mm30hojasPack de 5, colores",Office Product,http://www.amazon.com/dp/B002C4KL88/,1,1
"Berwick Splendorette Crimped Curling Ribbon, 3/16-Inch Wide by 500-Yard Spool, Royal",Art and Craft Supply,http://www.amazon.com/dp/B0018BSFP2/,1,1
"MIU France Large Stainless Steel Slotted Turner, 3 by 11-Inch",Kitchen,http://www.amazon.com/dp/B000GGTYC8/,1,1
Neumann TLM 103 SET w/ EA1 Shockmount and Aluminum Case,Musical Instruments,http://www.amazon.com/dp/B0002H0S4O/,1,1
elis Ultra Guard 360 Japanese Sanitary Napkins 14 Pads / Nighttime Use for Especially Heavy Menstrual Flow with Wings 36cm (Sailor Moon Design),Health and Beauty,http://www.amazon.com/dp/B00OLLFAUO/,1,1
"IMUSA USA WPAN-10012 4-Pair Bamboo Cooking Chopsticks, 13-Inch, Brown",Kitchen,http://www.amazon.com/dp/B00OPZJH82/,1,1
"Fate / Stay Night: Unlimited Blade Works, Vol. 1",DVD,http://www.amazon.com/dp/B00OUQWA76/,1,1
LifeShoppingMall LifeShoppingMall Unisex DuRaRaRa Cosplay Orihara Izaya Costume Cotton Padded Hoodie-Male-X-Large,Apparel,http://www.amazon.com/dp/B00RXM29FC/,1,1
Black Butler: Book of Circus - Season Three (Blu-ray/DVD Combo),DVD,http://www.amazon.com/dp/B01711D69W/,1,1
"Silicone Spatula Set,Besiva 3-piece 600ºF Heat-Resistant Spatulas & Baking Spoon ,Safe Soft and Non-stick Flexible Rubber Spatulas with Stainless Steel Core Design(Red)",Kitchen,http://www.amazon.com/dp/B01MTJMZLF/,1,1
"Women, Fire and Dangerous Things: What Categories Reveal About the Mind",Book,http://www.amazon.com/dp/0226468046/,1,1
"Log Horizon, Vol. 1: The Beginning of Another World - light novel",Book,http://www.amazon.com/dp/0316383058/,1,1
Good Smile A Certain Scientific Railgun S: Kuroko Shirai Nendoroid Action Figure,Toy,http://www.amazon.com/dp/B00F3VOWQY/,1,1
Good Smile Bakemonogatari: Nadeko Sengoku Medusa Version PVC Figure (1:8 Scale),Toy,http://www.amazon.com/dp/B018FTXEGE/,1,1
"Sleep Innovations 2-in-1 Ventilated Memory Foam and Fiber Fill Pillow with 100% Cotton Cover, Made in the USA with a 5-year Warranty - Standard Size",Home,http://www.amazon.com/dp/B0029LHHRW/,1,1
"ChefLand Ladle, 8-Ounce, Stainless Steel",Kitchen,http://www.amazon.com/dp/B008K3Z76Q/,1,1
Your Name (Limited Edition Blu-ray/DVD Combo),DVD,http://www.amazon.com/dp/B074QVZD11/,1,1
Heartbeat of Struggle: The Revolutionary Life of Yuri Kochiyama (Critical American Studies),Book,http://www.amazon.com/dp/0816645930/,1,1
Baccano Katsumi Enami Illustration Gashu Art Material Book Japan,Book,http://www.amazon.com/dp/4048683160/,1,1
Sound! Euphonium: Reflection of Youthful Music,Music,http://www.amazon.com/dp/B01BQN6QU2/,1,1
"HIC Harold Import Co. T-213-HIC White, 3-1/4"" Porcelain Soy Sauce Dish Home Decor Products",Home,http://www.amazon.com/dp/B000WR2RH0/,1,1
Azumanga Daioh: The Complete Collection,DVD,http://www.amazon.com/dp/B001VFM5YM/,1,1
K-ON! OST [Audio CD] ANIMATION(O.S.T.),Music,http://www.amazon.com/dp/B001WAHXUM/,1,1
"Sega Love Live!: Hanayo Koizumi Premium Figure ""Sore wa Bokutachi no Kiseki""",Toy,http://www.amazon.com/dp/B00WMYJC06/,1,1
Character Collection 2,Music,http://www.amazon.com/dp/B001PM0BTM/,1,1
Good Smile Love Live!: Nishikino Maki Nendoroid Action Figure,Toy,http://www.amazon.com/dp/B00WFN7ISC/,1,1
Star Trek Movie Spock Ears [Toy],Toy,http://www.amazon.com/dp/B0029F1WYC/,1,1
Pandora in the Crimson Shell: Ghost Urn Vol. 1,Book,http://www.amazon.com/dp/1626921903/,1,1
Terror in Resonance: Complete Series (Blu-ray/DVD Combo),DVD,http://www.amazon.com/dp/B01711CLY8/,1,1
Shirobako 1 [Blu-ray],DVD,http://www.amazon.com/dp/B0173UQVV6/,1,1
Senran Kagura: Asuka T-shirt (M) by Hobby Stock,Toy,http://www.amazon.com/dp/B0090EFID6/,1,1
Legend of the Galactic Heroes Blu-ray Box1,DVD,http://www.amazon.com/dp/B002N5P2QC/,1,1
Fate Zero Fate Stay Night Extra Anime Wall Scroll Poster Archer Tohsaka Rin (24''*32'') Support Customized,Home,http://www.amazon.com/dp/B007TDEQWY/,1,1
"Furyu Strike Witches High Quality Figure - 3858 - 9"" Perrine Clostermann",Toys & Games,https://www.amazon.com/gp/product/B006UJ2IKK?psc=1&amp;redirect=true&amp;ref_=oh_aui_detailpage_o06_s00,1,1
Good Smile Love Live!: Nico Yazawa Nendoroid Action Figure,Toys & Games,https://www.amazon.com/gp/product/B00M2JKW5K?psc=1&amp;redirect=true&amp;ref_=oh_aui_detailpage_o00_s00,1,1
Pokemon - I Choose You! Pikachu! (Vol. 1) [VHS],Video,http://www.amazon.com/dp/6305209871/,1,1
"The Devil Is a Part-Timer, Vol. 2 - light novel",Book,http://www.amazon.com/dp/0316385018/,1,1
Gurren Lagann,Music,http://www.amazon.com/dp/B0011NVAWM/,1,1
Puella Magi Madoka Magica Blu-Ray Disc Box,DVD,http://www.amazon.com/dp/B00G6LMJYW/,1,1
Fate/Zero - Saber - Mug Cup with Lid,Kitchen,http://www.amazon.com/dp/B007F5WARO/,1,1
"BioPEDIC Ultra-Fresh Anti-Odor Standard size Pillow, Set of 4 (White)",Home,http://www.amazon.com/dp/B002IVTEH4/,1,1
The Melancholy of Haruhi Suzumiya,Book,http://www.amazon.com/dp/0316039012/,1,1
Fullmetal Alchemist Customized 24inch x 38inch Silk Print Poster/WallPaper Great Gift,Home,http://www.amazon.com/dp/B00SES596U/,1,1
Bodymate® Body Pillow Hypo-allergenic Polyester Fiberfill,Home,http://www.amazon.com/dp/B01IO80MT8/,1,1
Animation - Nichijou No DVD Vol.10 [Japan BD] KAXA-3223,DVD,http://www.amazon.com/dp/B004V1ZCAW/,1,1
Technoboys Pulcraft Green-Fund - Sakurako-San No Ashimoto Ni Wa Shitai Ga Umatteiru (Anime) Outro Theme Song: Uchiyoserareta Boukyaku No Zankyo Ni [Japan CD] LACM-14416,Music,http://www.amazon.com/dp/B014163VUO/,1,1
History: From the Dawn of Civilization to the Present Day,Book,http://www.amazon.com/dp/1465437975/,1,1
Sword Art Online: Kirito Black Swordsman PVC Wristband,Apparel,http://www.amazon.com/dp/B016APSYP6/,1,1
GTO: Great Teacher Onizuka Complete Series (7DVD),DVD,http://www.amazon.com/dp/B00EBDXYPK/,1,1
Samurai Champloo: The Complete Series [Blu-ray],DVD,http://www.amazon.com/dp/B0049TC8C6/,1,1
New Kid in Town: Junior Novel (Cory in the House),Book,http://www.amazon.com/dp/1423110730/,1,1
A Sky Longing for Memories: The Art of Makoto Shinkai,Book,http://www.amazon.com/dp/1941220436/,1,1
My Neighbor Totoro (Full Screen Edition),DVD,http://www.amazon.com/dp/B00003CXCZ/,1,1
Ghost In The Shell - Stand Alone Complex Volume 2: Revenge Of The Cold Machines (v. 2),Book,http://www.amazon.com/dp/1595820736/,1,1
"Inu x Boku SS, Vol. 1",Book,http://www.amazon.com/dp/0316243132/,1,1
Ghost In The Shell - Stand Alone Complex Volume 1: The Lost Memory (v. 1),Book,http://www.amazon.com/dp/1595820728/,1,1
Moe Jazz - Vol.2 [Japan CD] GNCA-1338,Music,http://www.amazon.com/dp/B0098HR6OE/,1,1
The Illusion of Life: Disney Animation,Book,http://www.amazon.com/dp/0786860707/,1,1
Popular Re Zero Kara Hajimeru Isekai Seikatsu Beanie Hat Knit Hat Toboggan Hat,Book,http://www.amazon.com/dp/B01LZRAD1Q/,1,1
Warriors: The Rise of Scourge,Book,http://www.amazon.com/dp/0061478679/,1,1
Hunter x Hunter Set 3 Standard Edition (BD) [Blu-ray],DVD,http://www.amazon.com/dp/B073X83C41/,1,1
"Spice and Wolf, Vol. 17 - light novel",Book,http://www.amazon.com/dp/0316339644/,1,1
Animation - Aria The Animation Blu-Ray Box (3BDS) [Japan BD] SHBR-335,DVD,http://www.amazon.com/dp/B00YQWMXVW/,1,1
Hyakko Complete TV Series (Litebox),DVD,http://www.amazon.com/dp/B00B04KVOA/,1,1
Moe Jazz - Vol.1 [Japan CD] GNCA-1337,Music,http://www.amazon.com/dp/B0098HR6OY/,1,1
"The Moe Manifesto: An Insider's Look at the Worlds of Manga, Anime, and Gaming",Book,http://www.amazon.com/dp/4805312823/,1,1
Ghost In The Shell - Stand Alone Complex Volume 3: White Maze (v. 3),Book,http://www.amazon.com/dp/1595820744/,1,1
