name,category,amazon_link,total_mentions,subreddit_mentions
"Pentel Graph Gear 1000 Automatic Drafting Pencil, 0.5mm Lead Size, Brushed Metal Barrel, 1 Each (PG1015A)",Office Products,https://www.amazon.com/dp/B000GAU2RU/ref=cm_sw_r_cp_api_FQv6xbBTYEBW1,12,1
His Crown is pechalat by Jig,Toy,http://www.amazon.com/dp/B001FOQJOG/,6,1
The Introvert Advantage: How Quiet People Can Thrive in an Extrovert World,Book,http://www.amazon.com/dp/0761123695/,4,1
Sad Frog Feels Bad Man 3D Silicone Wrist Rest Mouse Pad Gaming Mousepad,PC Accessory,http://www.amazon.com/dp/B01FFRUWO6/,4,1
The Manga Guide to Databases,Book,http://www.amazon.com/dp/1593271905/,3,1
Aqua Notes Water Proof Note Pad,Office Products,https://www.amazon.com/dp/B003W09LTQ/,3,1
JustinCostume Spandex Open Face Full Bodysuit Zentai Suit,Apparel,http://www.amazon.com/dp/B00MP44OEM/,2,1
Manga Messiah,Book,http://www.amazon.com/dp/1414316801/,2,1
"Pentel Mechanical Pencil Lead, Ain Stein, 0.3mm, 2B (C273-2B)",Office Product,http://www.amazon.com/dp/B004NNKF0K/,1,1
Wacom Cintiq 22HD   Touch Interactive Pen Display (DTH2200),Personal Computer,http://www.amazon.com/dp/B00B8292O4/,1,1
C88 Limited Non Non Biyori repeat Holding Tote Bag Koshigaya Komari comic Market,Toy,http://www.amazon.com/dp/B016WNCUE2/,1,1
Re Zero kara Hajimeru Isekai Seikatsu 3D Mousepad (CL-3),Office Product,http://www.amazon.com/dp/B07116LG3Z/,1,1
Best of Chums Cat Onesie,Apparel,http://www.amazon.com/dp/B00JMK6KJY/,1,1
Pentel Fine Writing Instrument Mechanical Pencil (Q1005-1),Office Product,http://www.amazon.com/dp/B0013NHU6K/,1,1
"Pentel Drafting Pencil Graph for Pro, 0.5mm (PG1005)",Office Product,http://www.amazon.com/dp/B0013NFZU8/,1,1
"Akame Ga Kill! Characters Akame Body Pillowcase Akame Ga Kiru! Body Pillow Case (50x150cm Peach skin, 01)",Home,http://www.amazon.com/dp/B00PGSIBZM/,1,1
Stauffer's Original Animal Crackers - 4lb 14oz tub,Grocery,http://www.amazon.com/dp/B001NC8HS6/,1,1
For children up to 54 inches tall. The original SnooZzoo Polar Bear children's stuffed animal sleeping bag.,Toy,http://www.amazon.com/dp/B01697WKXC/,1,1
"Yipost Women's Bunny Girl Costume Cosplay Dress, One size",Apparel,http://www.amazon.com/dp/B015FLL4KI/,1,1
Sega Hatsune Miku: Premium Figure -Project DIVA Arcade-,Toy,http://www.amazon.com/dp/B00IRSP1T2/,1,1
"Sega Project Diva Arcade 2nd Premium PM Figure - 8"" Hatsune Miku",Toy,http://www.amazon.com/dp/B00VWXHSC2/,1,1
Nothing,Book,http://www.amazon.com/dp/1416985794/,1,1
