name,category,amazon_link,total_mentions,subreddit_mentions
Animals Make Us Human: Creating the Best Life for Animals,Book,http://www.amazon.com/dp/0547248237/,1,1
"PetSafe Drinkwell Original Dog and Cat Water Fountain, 50 oz.",Pet Products,http://www.amazon.com/dp/B00063446M/,29,1
"DaVinci Kalani 4-In-1 Convertible Crib, Espresso",Baby Product,http://www.amazon.com/dp/B0010TODHG/,2,1
Bottomless Bath Overflow Drain Cover - Recyclable,Home Improvement,http://www.amazon.com/dp/B00314WHW6/,18,1
"Your Heart's Delight Single Bucket Old Pump Fountain, 11 by 13-1/2-Inch",Home,http://www.amazon.com/dp/B0077EOHGA/,1,1
Strip-Curtains.com: Strip Door Curtain - 36 in. (3 ft) width X 80 in. (6ft 8 in) height - LOW TEMP smooth 8 in. strips with 50% overlap - common door kit (Hardware included),BISS,http://www.amazon.com/dp/B01C36HG78/,1,1
"SUPER DESIGN Classic Removable Stainless Steel Bowl in High Gloss Anti-Skid Round Melamine Stand,for Dog or Cat M Orange",Pet Products,http://www.amazon.com/dp/B01FH3B3NC/,1,1
