name,category,amazon_link,total_mentions,subreddit_mentions
The Syro-Aramaic Reading of the Koran: A Contribution to the Decoding of the Language of the Koran,Book,http://www.amazon.com/dp/3899300882/,2,2
Gold Medal Prod. 2045 Flavacol Seasoning Popcorn Salt 35oz.,Grocery,http://www.amazon.com/dp/B004W8LT10/,40,2
Alphasmart Alpha Smart 3000 Word Processing Computer Mac PC,Personal Computer,http://www.amazon.com/dp/B002WJ8VLM/,4,2
The Genius of Dogs: How Dogs Are Smarter Than You Think,Book,http://www.amazon.com/dp/0142180467/,6,1
The Knowledge: How to Rebuild Civilization in the Aftermath of a Cataclysm,Book,http://www.amazon.com/dp/0143127047/,12,1
Why Only Us: Language and Evolution (MIT Press),Book,http://www.amazon.com/dp/0262034247/,1,1
A Natural History of Rape: Biological Bases of Sexual Coercion,Book,http://www.amazon.com/dp/0262700832/,2,1
"In the Garden of Beasts: Love, Terror, and an American Family in Hitler's Berlin",Book,http://www.amazon.com/dp/030740885X/,12,1
Eating Animals,Book,http://www.amazon.com/dp/0316069884/,40,1
Garbage Land: On the Secret Trail of Trash,Book,http://www.amazon.com/dp/031615461X/,1,1
Dust,Book,http://www.amazon.com/dp/0380787423/,1,1
Motel of the Mysteries,Book,http://www.amazon.com/dp/0395284252/,19,1
"Gay New York: Gender, Urban Culture, and the Making of the Gay Male World, 1890-1940",Book,http://www.amazon.com/dp/0465026214/,11,1
Introduction to the Theory of Computation,Book,http://www.amazon.com/dp/0534950973/,4,1
Siddhartha,Book,http://www.amazon.com/dp/0553208845/,6,1
Adventure in Legoland (Little Apple),Book,http://www.amazon.com/dp/0590438751/,1,1
Bending Science: How Special Interests Corrupt Public Health Research,Book,http://www.amazon.com/dp/0674047141/,1,1
Code: The Hidden Language of Computer Hardware and Software,Book,http://www.amazon.com/dp/0735611319/,158,1
Connections,Book,http://www.amazon.com/dp/0743299558/,1,1
A Short History of Nearly Everything,Book,http://www.amazon.com/dp/076790818X/,48,1
Comic Wars: How Two Tycoons Battled Over the Marvel Comics Empire--And Both Lost,Book,http://www.amazon.com/dp/0767908309/,1,1
Player's Handbook (Dungeons & Dragons),Book,http://www.amazon.com/dp/0786965606/,137,1
The Power of Habit: Why We Do What We Do in Life and Business,Book,http://www.amazon.com/dp/081298160X/,113,1
A Thousand Plateaus: Capitalism and Schizophrenia,Book,http://www.amazon.com/dp/0816614024/,1,1
Runners to the Rescue (NFL Huddles Series),Book,http://www.amazon.com/dp/0910313768/,1,1
The Decipherment of Linear B (Canto Classics),Book,http://www.amazon.com/dp/1107691761/,1,1
The Language of God: A Scientist Presents Evidence for Belief,Book,http://www.amazon.com/dp/1416542744/,35,1
The Big-Ass Book of Crafts,Book,http://www.amazon.com/dp/1416937854/,1,1
The Last Gunfight: The Real Story of the Shootout at the O.K. Corral-And How It Changed the American West,Book,http://www.amazon.com/dp/1439154252/,1,1
The Emperor of All Maladies: A Biography of Cancer,Book,http://www.amazon.com/dp/1439170916/,19,1
"Making Things Talk: Using Sensors, Networks, and Arduino to see, hear, and feel your world",Book,http://www.amazon.com/dp/1449392431/,1,1
"Grow the F*ck Up - White Elephant & Yankee Swap gift, gag gift for men, birthday gift for him, novelty book, Secret Santa exchange, teenage & young adult how-to, high school & college graduation gift",Book,http://www.amazon.com/dp/1511720247/,3,1
Internet Yellow Pages (6th ed),Book,http://www.amazon.com/dp/1562057847/,5,1
"Man Som Hatar Kvinnor (Millennium, 1)",Book,http://www.amazon.com/dp/9170013683/,1,1
3M Indoor Window Insulator Kit for 5 Windows,Home Improvement,http://www.amazon.com/dp/B00002NCJI/,42,1
"Master Lock Padlock, Stainless Steel Discus Lock, 2-3/4 in. Wide, 40DPF",Home Improvement,http://www.amazon.com/dp/B00004SQKX/,5,1
Gator Grip the Original Universal Socket 3PC Kit. Made in the USA. Self-Adjusts for shape and size as well as Standard and Metric application,Home Improvement,http://www.amazon.com/dp/B000065CJ8/,5,1
AlphaSmart Dana - Handheld - Palm OS 4.1 ( 560 x 160 ),CE,http://www.amazon.com/dp/B00007FV2Z/,3,1
P3 P4400 Kill A Watt Electricity Usage Monitor,Home Improvement,http://www.amazon.com/dp/B00009MDBU/,153,1
"The Clapper Sound Activated On/Off Switch, 1 Each",Health and Beauty,http://www.amazon.com/dp/B0000CGKLR/,10,1
"Cheddar Cheese Powder, 1 lb. by Barry Farm",Grocery,http://www.amazon.com/dp/B00016LZT8/,10,1
JITTER RING,Personal Computer,http://www.amazon.com/dp/B00062JUM6/,1,1
M-D Building Products 64428 18-Foot Pipe Heating Cable with Thermostat,Home Improvement,http://www.amazon.com/dp/B0006VAL8O/,1,1
MSR PocketRocket Stove,Sports,http://www.amazon.com/dp/B000A8C5QE/,16,1
"Elite Cuisine ERC-003 Maxi-Matic 6 Cup Rice Cooker with Glass Lid, White",Kitchen,http://www.amazon.com/dp/B000B2UADE/,1,1
Stant 10504 Locking Fuel Cap,Automotive Parts and Accessories,http://www.amazon.com/dp/B000B8JUAW/,1,1
Rode Deadcat Wind Muff Microphone Cover,Musical Instruments,http://www.amazon.com/dp/B000BH437S/,3,1
"Chicken In A Biskit Original Crackers, 8-Ounce Units (Pack of 6)",Grocery,http://www.amazon.com/dp/B000F9XB8O/,1,1
"TRENDnet Low Loss Reverse SMA Female to N-Type Male Weatherproof Connector Cable (8M, 26.2ft.) TEW-L208",Speakers,http://www.amazon.com/dp/B000FICJ8S/,1,1
Ezy Care Dental Irrigating Syringe,Beauty,http://www.amazon.com/dp/B000FQ5N1A/,5,1
Gyro-Ring High Performance Edition,Toy,http://www.amazon.com/dp/B000GFJKWI/,1,1
"Sony mylo Personal Communicator COM-1 2.4"" LCD-Black",Personal Computer,http://www.amazon.com/dp/B000HAQHXC/,1,1
Cmple - 3.5mm to 3 RCA Camcorder Video Audio Cable - 6 ft,Photography,http://www.amazon.com/dp/B000KW6VJ2/,5,1
Titan Tools 12031 Mini Razor Scraper,Automotive Parts and Accessories,http://www.amazon.com/dp/B000OEDQQW/,4,1
Holland Plastics Original Brand Slat Type Door Curtain Bug Fly Strip Blind 'Traditional Multi',Home,http://www.amazon.com/dp/B000OP4DCC/,1,1
BRK Brands HD6135FB Hardwire Heat Alarm with Battery Backup,Home Improvement,http://www.amazon.com/dp/B000Q6LXW2/,1,1
SE 513TW 12-Inch Stainless Steel Tweezers,Home Improvement,http://www.amazon.com/dp/B000T68ZUM/,2,1
Ralf the Barking Dog Plush Large Puppet (1992),Office Product,http://www.amazon.com/dp/B000ZQC45I/,1,1
"Charles Leonard Pen Style Aluminum Chalk Holder with Chalk, Silver (74541)",Office Product,http://www.amazon.com/dp/B0013CHGHO/,1,1
1-1/2mm Nylon Cord - 25yds/Black,Home,http://www.amazon.com/dp/B001682AXK/,1,1
Panef Corp. L-300 Powdered Graphite Lubricant - Net Wt .21 oz,Automotive Parts and Accessories,http://www.amazon.com/dp/B0016GZQ60/,13,1
"UT Wire UTW-CP501-BG 5-Feet Cord Protector with 3-Channels, Beige",Home Improvement,http://www.amazon.com/dp/B00170DC3E/,2,1
Hobart 770095 Welding Oxy-Acetylene Goggle - Flip Front 2-Inch x 4 1/4-Inch,Home Improvement,http://www.amazon.com/dp/B0017Z5IZE/,2,1
Taylor Precision Products Digital Cooking Thermometer with Probe and Timer,Kitchen,http://www.amazon.com/dp/B001GD1WHU/,3,1
"Oster 4722 Rice Cooker with Steamer 6cups,Red",Kitchen,http://www.amazon.com/dp/B001KBY9M8/,5,1
CTTR SFTY YEL 3BLD F/ CTN MONARCH MARKING 954847 789797097782,Home Improvement,http://www.amazon.com/dp/B001T33I2O/,1,1
Chemical Guys Leather Cleaner and Conditioner Complete Leather Care Kit (16 oz) (2 Items),Automotive Parts and Accessories,http://www.amazon.com/dp/B001TJ3HUG/,4,1
"SentrySafe Depository Safe, Small Dual Key Lock Money Safe with Drop Slot, 0.23 Cubic Feet, UC-025K",Home Improvement,http://www.amazon.com/dp/B002CJMC7Q/,2,1
"4"" SafCord Carpet Cord Cover - Length: 6FT - Color: Taupe",Speakers,http://www.amazon.com/dp/B002CTBXQC/,2,1
Chemical Guys AIR_101_16 New Car Smell Premium Air Freshener and Odor Eliminator (16 oz),Automotive Parts and Accessories,http://www.amazon.com/dp/B002J7VX4Y/,5,1
"KEY-BAK SUPER48 Heavy Duty 8oz. Locking Retractable Reel, 48"" Kevlar Cord, Black Polycarbonate Case, Steel Belt Clip, Oversized Split Ring",Sports,http://www.amazon.com/dp/B002SQ9P5K/,3,1
"STANLEY J5C09 Jump Starter: 1000 Peak/500 Instant Amps, 120 PSI Air Compressor",Automotive Parts and Accessories,http://www.amazon.com/dp/B002X6VXL4/,19,1
"Plastic Transfer Pipettes 1 ml, Gradulated (0.2 ml Graduation), Pack of 500",BISS,http://www.amazon.com/dp/B002XNMP4Q/,1,1
"Wahl Clipper Groomsman Pro All in One Men's Grooming Kit, Rechargeable Beard Trimmers and Hair Clippers for Mustache, Stubble, Ear, Nose, Body Grooming by the brand used by professionals #9860-700",Beauty,http://www.amazon.com/dp/B0033SJZJ8/,1,1
"Philips Norelco Bodygroom Series 7100, BG2040",Beauty,http://www.amazon.com/dp/B0037HP9OA/,64,1
"Snappy Popcorn Colored Coconut Oil, 1 Gallon",Grocery,http://www.amazon.com/dp/B003C4UDEY/,8,1
"TP-Link 2.4GHz 24dBi Directional Grid Parabolic Antenna, N Female Connector, Weather Resistant (TL-ANT2424B)",CE,http://www.amazon.com/dp/B003CFATOW/,8,1
"Samsung B2100 Unlocked Quad-Band Phone, Extreme Anti-Shock, Waterproof, Built-in Flashlight, Bluetooth-International Version-Black",Wireless,http://www.amazon.com/dp/B003ICWA7I/,1,1
HDE Z05 Triple RCA Male to USB Male Adapter Cable for USB-enabled television or PC,Speakers,http://www.amazon.com/dp/B003QA5LA0/,2,1
InstaMorph - Moldable Plastic - 12oz (White),Art and Craft Supply,http://www.amazon.com/dp/B003QKLJKQ/,21,1
Powermatic 2 PLUS Electric Cigarette Injector Machine,Home,http://www.amazon.com/dp/B003TQPRDW/,2,1
Philips Norelco 1250X/42 SensoTouch 3D Electric Razor with Jet Clean System (Series 8000) (packaging may vary),Beauty,http://www.amazon.com/dp/B003V37Z9W/,1,1
"Frogg Toggs The Original Chilly Pad Cooling Towel, Sky Blue",Sports,http://www.amazon.com/dp/B003YF7W22/,12,1
Alfa AWUS036NH 2000mW 2W 802.11g/n High Gain USB Wireless G / N Long-Range WiFi Network Adapter with 5dBi Screw-On Swivel Rubber Antenna and 7dBi Panel Antenna and Suction cup / Clip Window Mount,PC Accessory,http://www.amazon.com/dp/B003YIFHJY/,12,1
Windsor Direct Trabasack Curve Wheelchair Lap Tray and Storage Bag,Health and Beauty,http://www.amazon.com/dp/B0041HL386/,1,1
WD My Passport Essential 500 GB USB 3.0/2.0 Portable External Hard Drive (Pacific Blue),CE,http://www.amazon.com/dp/B0041OSAZI/,1,1
3 feet Satellite Tripod Mount with 2-Inch OD Mast,Speakers,http://www.amazon.com/dp/B0043OAI9M/,1,1
Magic Shaving Powder Gold 5 Ounce Fragrant (145ml),Health and Beauty,http://www.amazon.com/dp/B0048ZIFA0/,32,1
Stop Walking on Eggshells: Taking Your Life Back When Someone You Care About Has Borderline Personality Disorder,eBooks,http://www.amazon.com/dp/B004DNXGFQ/,10,1
"Hershey's Whole White Milk,  32-Ounce Asceptic Carton (Pack of 12)",Grocery,http://www.amazon.com/dp/B004L46ENS/,1,1
"Signature Sleep Contour 8 Inch Independently Encased Coil Mattress with Low VOC CertiPUR-US Certified Foam, 8 Inch Full Coil Mattress - Available in Multiple Sizes",Furniture,http://www.amazon.com/dp/B004LQ1RKQ/,5,1
P3 P4330 Kill A Watt Ps 10 Surge Protector,Speakers,http://www.amazon.com/dp/B004OG94VW/,1,1
"Oster BLSTPB-WBL My Blend 250-Watt Blender with Travel Sport Bottle, Light Powder Blue",Kitchen,http://www.amazon.com/dp/B004P2OLB8/,8,1
HDE Gold Plated DVI-I 24+5 To RCA Component Display Adapter for 1080p HDTV,Speakers,http://www.amazon.com/dp/B004VNJK8K/,1,1
Alfa R36 802.11 b/g/N Repeater and Range Extender for AWUS036H,Personal Computer,http://www.amazon.com/dp/B004ZF0I3U/,3,1
"Vanco 20-10089C 8in Beaded Cable Ties, Natural",Office Product,http://www.amazon.com/dp/B004ZJD0KY/,1,1
"Mack's Ultra Soft Foam Earplugs, 50 Pair - 32dB Highest NRR, Comfortable Ear Plugs for Sleeping, Snoring, Work, Travel and Loud Events",Health and Beauty,http://www.amazon.com/dp/B0051U7W32/,34,1
Easy Threader Flexible Needle Drawstring replacement and craft tool by schaller,Home,http://www.amazon.com/dp/B0052Y3RRM/,4,1
Swedish Steak Knife - Ergonomic Kitchen Chef's Knife,Kitchen,http://www.amazon.com/dp/B0052ZTSGA/,1,1
Home Security Battery Powered Vibration Detector Alarm,Home Improvement,http://www.amazon.com/dp/B00554MLPI/,1,1
