name,category,amazon_link,total_mentions,subreddit_mentions
"elago W3 Stand [Original] [White] - [Vintage Apple Monitor][Supports Nightstand Mode][Cable Management] - for Apple Watch Series 1, 2, and 3",Wireless,http://www.amazon.com/dp/B01MYNE2BM/,4,4
Orzly Night-Stand for Apple Watch (38mm & 42mm) - Black,Wireless,http://www.amazon.com/dp/B0127F1IC4/,4,4
"Apple Watch Band, JETech 42mm Milanese Loop Stainless Steel Bracelet Strap Bands – Black",Wireless,http://www.amazon.com/dp/B013SAJQB2/,4,4
"[Apple MFi Certified] Apple Watch Portable Charger, Oittm Pocket Sized Travel Friendly Wireless Charger 700mAh Smart Keychain Power Bank for Apple Watch Series 3/ Series 2/ Series 1/ Nike+(Grey)",Wireless,http://www.amazon.com/dp/B01J318FSA/,2,2
"LUVVITT Stainless Steel Adapter for Apple Watch 42mm Band Connector, Adaptor, Apple Watch Buckle, Apple Watch Clasp, Comparable to Click - 42mm Silver",Wireless,http://www.amazon.com/dp/B00V9P7ZSA/,2,2
"Apple Watch Stand, Aerb Bamboo Wood Charging Stand Bracket Docking Station Cradle Holder W Business Card Slot for iPhone and Apple Watch 38mm 42mm Series 1 Series 2",Cell Phones & Accessories,https://www.amazon.com/dp/B00XVUC4EG/ref=cm_sw_r_cp_awd_-8GFwbKYVPCMW,2,2
Nevr Dull NEVER DULL POLISH 5OZ,Home & Kitchen,https://www.amazon.com/gp/product/B000VPBMCO?psc=1&amp;redirect=true&amp;ref_=oh_aui_detailpage_o09_s00,2,2
Optima Unisex 33-190 Black Twenty-Watch Case with Zipper,Watch,http://www.amazon.com/dp/B002CVUODS/,2,2
38mm Silver Watch Band Metal Clasp Connection Adapter For All Apple Watch 38mm Band (Silver),Wireless,http://www.amazon.com/dp/B00XLVAVI6/,2,2
"Apple Watch 42mm Band, HuanlongTM Luxury Ceramic Bracelet Watch Band Strap Replacement Wrist Band for Apple Watch & Sport & Edition Iwatch 42/38mm with Adapter(Ceramic White 42mm)",Wireless,http://www.amazon.com/dp/B019SZNW2K/,2,2
Plantronics BackBeat Fit Bluetooth Headphones - Blue,Wireless,http://www.amazon.com/dp/B00KJLMBQQ/,12,1
"Anker 5-Port Desktop Usb Charger with PowerIQ Technology, 40-Watt, Black",Wireless,http://www.amazon.com/dp/B00GTGETFG/,4,1
Never Gonna Give You Up,Digital Music Track,http://www.amazon.com/dp/B00137RNIQ/,2,1
"Apple Watch Stand, Hapurs iWatch Bamboo Wood Charging Dock Charge Station Stock Cradle Holder for Apple Watch Both 38mm and 42mm & iPhone 6 6 plus 5S 5",Wireless,http://www.amazon.com/dp/B00ZFS4SL4/,2,1
Reynolds Wrap Aluminum Foil (200 Square Foot Roll),Health and Beauty,http://www.amazon.com/dp/B00UNT0Y2M/,2,1
"Anker 20W 2-Port USB Wall Charger with Foldable Plug and PowerIQ Technology for Apple iPhone 6 / 6 Plus, iPad Air 2 / mini 3, Samsung Galaxy S6 / S6 Edge, Nexus, HTC M9, Motorola, LG and More (White)",Cell Phones & Accessories,https://www.amazon.com/dp/B00B8L36A6/ref=cm_sw_r_udp_awd_fUFwvb1MKQSRZ,2,1
Cape Cod Metal Polishing Cloths Foil Pouch 0.53oz,Home,http://www.amazon.com/dp/B0017H3PIO/,2,1
Zwipes Microfiber Cleaning Cloths (24-Pack),Automotive Parts and Accessories,http://www.amazon.com/dp/B00ANZHG7C/,2,1
"1byone Bluetooth Body Fat Scale with IOS and Android App Smart Wireless Digital Bathroom Scale for Body weight, Body Fat, Water, Muscle Mass, BMI, BMR, Bone Mass and Visceral Fat, White",Health and Beauty,http://www.amazon.com/dp/B01FHELB56/,2,1
"Anker SoundBuds Wireless Headphones - Sweatproof, Magnetic In-Ear Sport Earbuds with 8-Hour Playtime and Noise Cancellation, Secure Fit Bluetooth Headset for Running, Workout and Gym",Wireless,http://www.amazon.com/dp/B016Y8XJCW/,2,1
DYMO LabelManager 160 Handheld Label Maker (1790415),Office Product,http://www.amazon.com/dp/B005X9VZ70/,2,1
Wiha 26794 Precision Pentalobe Screwdriver Set (PL1-PL6),Home Improvement,http://www.amazon.com/dp/B00GY8VQQE/,2,1
Wahoo TICKR Heart Rate Monitor for iPhone & Android,Sports,http://www.amazon.com/dp/B00INQVYZ8/,2,1
Clockwork Synergy - Watch Bands for Apple Watch (42mm Camo Classic NATO PVD),Wireless,http://www.amazon.com/dp/B01LDHU8U0/,1,1
"HOCO Apple Watch Band Series 2 Series 1, JDHDL 3 in 1 Double Tour and Cuff Genuine Cow Leather Classic with Metal Buckle for Apple Watch, Sport, Edition All Models (Black 42mm)",Wireless,http://www.amazon.com/dp/B01966560M/,1,1
"Apple Watch Series 1 Series 2 band Connectors Links, Huanlong(TM) Ceramic Adapter, Apple Watch Band Connector Link for Apple Watch iWatch (Ceramics White 42mm)",Wireless,http://www.amazon.com/dp/B01LY9K5KN/,1,1
"Spigen S350 Apple Watch Stand and charger with Night Stand Mode for Apple Watch Series 3 / series 2 / Series 1 / 42mm / 38mm, Patent Registered - Black",Wireless,http://www.amazon.com/dp/B0109I9W24/,1,1
"Twelve South ActionSleeve/Armband for 42mm Apple Watch, black",Wireless,http://www.amazon.com/dp/B01MY2ENNT/,1,1
"UMTELE 42mm Soft Silicone Replacement Band Sport Strap with Ventilation Holes for Apple Watch Nike+, Series 2, Series 1, Sport, Edition, Light Bone/Black",Wireless,http://www.amazon.com/dp/B071YTCRNR/,1,1
22mm Panatime Green Waterproof Silicone 'Luminous' - Glow in the Dark Watch Band 130/75,Watch,http://www.amazon.com/dp/B00T8A30EG/,1,1
"EloBeth for Apple Watch Band, Soft Silicone Sport Style Replacement Wrist Strap Stripe Color Splicing for Apple Watch Bands Series 3/Series 2/Series 1 (Blue/White 42mm)",Wireless,http://www.amazon.com/dp/B071DCNPLZ/,1,1
"Apple Watch Band with Metal Clasp, Pandawell™ 38mm Genuine Leather Replacement Watchband Strap Wrist Band for Apple Watch & Sport & Edition [Compare to Classic Buckle & Modern Buckle] Directly Use for any Version Apple Watch, No need a Screw Driver to Install It (38mm-Black)",Wireless,http://www.amazon.com/dp/B00WT25MUK/,1,1
INTENY Woven Nylon Strap Buckle Replacement Wrist Bracelet with Silicone Band for Apple Watch Band Series 1 Series 2 42mm-Black,Network Media Player,http://www.amazon.com/dp/B01KA1Q5FW/,1,1
"Apple Watch 42mm Screen Protector (Series 1/Series 2), Skinomi TechSkin (Updated Version)(6-Pack) Full Coverage Screen Protector for Apple Watch 42mm Clear HD Anti-Bubble Film",Wireless,http://www.amazon.com/dp/B01H7WV1QU/,1,1
"elago W3 Stand [Original Design Awards] [Black] - [Vintage Apple Monitor][Supports Nightstand Mode][Cable Management] - for Apple Watch Series 1, 2, and 3",Wireless,http://www.amazon.com/dp/B01N412BQA/,1,1
HuanlongTM 2016 Newest Fine Woven Nylon Strap Replacement Wrist Band for Apple Watch iWatch Series 1 Series 2(Nylon US flag 38mm),Sports,http://www.amazon.com/dp/B01LGTHHKE/,1,1
MIFA Best #1 Apple Watch Leather Strap Band Genuine Premium Soft Leather Wristband Link Bracelet Color Brown with Top Quality Stainless Steel Clasp Lugs for Apple Watch Sports/Edition 42 mm H3,Wireless,http://www.amazon.com/dp/B0197TMFXY/,1,1
Bluelounge Kosta - Apple Watch Charging Coaster - Light Grey,Kitchen,http://www.amazon.com/dp/B0145FEIFS/,1,1
"Kartice for Apple Watch Band, 2016 Double Tour Textured Genuine Leather Watch Band strap Bracelet Replacement Wrist Bands for Apple Watch&Sport&Edition(38mm, Double Tour Peacock Blue)",Wireless,http://www.amazon.com/dp/B01FX4MC3A/,1,1
"HUANLONG VE-0001 Apple Watch Band, Nylon with Genuine Leather Sport Replacement Strap Wrist Band with Metal Adapter Clasp - 42mm- Red/Green/Black",Wireless,http://www.amazon.com/dp/B01914EHPE/,1,1
MyCell 38mm Metal Loop Stainless Steel Mesh Replacement Band for Apple Watch,Wireless,http://www.amazon.com/dp/B00UGHK8S6/,1,1
Caseology [Waterfall Series] Case for iPhone 7 Plus / iPhone 8 Plus - Slim Design Clear Transparent Protective Air Space Technology Cover - (Clear),PC Accessory,http://www.amazon.com/dp/B01KKWG18C/,1,1
"Oittm [Nightstand Mode] Charging Stand for Apple Watch Series 2/Series 1/Nike+, 4-Port USB 3.0 Hub Charging Dock Station Cable Management for iPhone 7/7 Plus/SE, iPad, Samsung (White)",Wireless,http://www.amazon.com/dp/B019SO9EHI/,1,1
Pebble Technology Corp Smartwatch Replacement Band for Pebble Time Round 20mm - Retail Packaging - Silver,Boost,http://www.amazon.com/dp/B01BV1R8T2/,1,1
9milelake Watch Box 24 Slots Men Black PU Leather Display Clear Top Jewelry Case Organizer,Furniture,http://www.amazon.com/dp/B019JSKNVO/,1,1
"5 Colors for Apple Watch Bands, Fullmosa Yona Calf Leather Replacement Band/Strap with Stainless Steel Clasp for Apple iWatch Series 1 2 3 Sport and Edition Versions 2015 2016 2017, Light Brown,42mm",Wireless,http://www.amazon.com/dp/B019I8JL7M/,1,1
"MoKo Band for Apple Watch Series 1 Series 2, Luxury Genuine Leather Smart Watch Band Strap Single Tour Replacement for 42mm Apple Watch 2015 & 2016 All Models, BROWN (Not Fit 38mm Versions)",Wireless,http://www.amazon.com/dp/B016JO9VEQ/,1,1
"Pacuwi Bluetooth Headphones, Wireless Noise Cancelling Headphones Running/Exercise/Sports Earbuds Headset Earphones for Bluetooth Smart Cell phones/Devices",Wireless,http://www.amazon.com/dp/B015N2CKDE/,1,1
"Apple Watch Band, Rock® Luxury Cowhide Genuine Leather Strap Wrist Band Replacement Metal Clasp for Apple Watch-42mm Blue",Wireless,http://www.amazon.com/dp/B00Y4169LA/,1,1
"7 Colors for Apple Watch Bands, Fullmosa Jan Calf Leather Strap Replacement Band/Strap with Stainless Steel Clasp for iWatch Series 1 2 3 Sport and Edition Versions 2015 2016 2017, Red,42mm",Wireless,http://www.amazon.com/dp/B071S6KV72/,1,1
"15 Colors for Apple Watch Bands 38mm, Fullmosa Yan Calf Leather Replacement Band/Strap with Stainless Steel Clasp for iWatch Series 0 1 2 3 Sport and Edition Versions 2015 2016 2017, 38mm White",CE,http://www.amazon.com/dp/B06XK6MQY2/,1,1
Motorola S10-HD Bluetooth Stereo Headphones - Retail Packaging,Cell Phones & Accessories,https://www.amazon.com/Motorola-S10-HD-Bluetooth-Stereo-Headphones/dp/B004QWOSLK,1,1
TMS Black Leather 24 Mens Watch Box Large Glass Top Display Jewelry Case Organizer,Home,http://www.amazon.com/dp/B00DNJ8WNW/,1,1
Hadley-Roma Men's MSM881RB-220 22-mm Brown Oil-Tan Leather Watch Strap,Watch,http://www.amazon.com/dp/B001F0PTOQ/,1,1
Write Dudes Infinity Metallic Permanent Markers 8-Count Assorted Colors (CYB80),Office Product,http://www.amazon.com/dp/B0055GH67E/,1,1
"MoKo Apple Watch Band Series 1 Series 2, Soft Silicone Replacement Sports Band for 38mm Apple Watch 2015 & 2016 All Models, Royal BLUE (Not fit 42mm Versions)",Wireless,http://www.amazon.com/dp/B00JP097XM/,1,1
"MoKo Band for Apple Watch Series 3 Bands, Stainless Steel Replacement Band Wrist Strap with Butterfly Buckle Clasp for iWatch 42mm 2017 Series 3 / 2 / 1 - Space GRAY(Not Fit iWatch 38mm)",Wireless,http://www.amazon.com/dp/B00JP6FU78/,1,1
Mpow Cheetah Sport Bluetooth 4.1 Wireless Headphones Stereo Sport Running Gym Exercise Headsets Earphones-Retail Packaging-Black,Cell Phones & Accessories,https://www.amazon.com/gp/product/B00RMRL8WS,1,1
Monowear Brown Leather Band with Classic buckle for your 42MM Apple Watch Sport,Wireless,http://www.amazon.com/dp/B00WISNMFM/,1,1
"Apple Watch Band, eLander™ Top-grain Leather Band Strap with Stainless Metal Clasp for Apple Watch All Models 42mm (Leather - Black)",Wireless,http://www.amazon.com/dp/B00YGKOY5W/,1,1
"Apple Watch Leather Band, Icarercase Vintage Series Genuine Leather Watchband Strap Replacement iWatch Wristband Link Bracelet with Secure Metal Clasp Buckle for Apple Watch (Brown for 42mm)",Wireless,http://www.amazon.com/dp/B012VCTGA4/,1,1
"MoKo Band for Apple Watch Series 3 Bands, Stainless Steel Metal Replacement Smart Watch Strap Bracelet for iWatch 42mm 2017 Series 3 / 2 / 1 - SILVER & GOLD (Not Fit iWatch 38mm)",Wireless,http://www.amazon.com/dp/B017133VBS/,1,1
"MIFA Clasp Buckle Lugs Adapters Connectorwith Pentalobe Screwdriver for Apple Watch Series 1 and 2, 38mm - Space Black",Wireless,http://www.amazon.com/dp/B01BUWKDFI/,1,1
Clockwork Synergy - Watch Bands for Apple Watch (42mm Worn Light Brown Leather SS),Wireless,http://www.amazon.com/dp/B01F9Z90FQ/,1,1
"Pantheon PWKCAWC700 MFI Apple Certified Wireless Apple Watch, Series 1/2 and Nike, Keychain Magnetic Charger with Portable Built in Power Bank - Black",Wireless,http://www.amazon.com/dp/B01N4KTZPP/,1,1
"Apple watch 2 case, Julk i watch tpu screen protector all-around protective 0.3mm hd clear ultra-thin cover for 2016 new apple watch series 2 (42mm)",Wireless,http://www.amazon.com/dp/B01N8PNEFN/,1,1
Twist-O-Flex Expansion Band in Brushed Stainless Steel for the 38mm Apple Watch in Size Large/Extra Large,Watch,http://www.amazon.com/dp/B073RQ5BWW/,1,1
Twist-O-Flex Expansion Band in Brushed Stainless Steel for the 42mm Apple Watch in Size Large/Extra Large,Watch,http://www.amazon.com/dp/B073RRKTDK/,1,1
iVAPO Apple Watch Stand Solid Aluminum Charging Holder for iPhone X/8/8 Plus/7/7 Plus and Apple Watch Series 3/Series 2-Space Gray,Wireless,http://www.amazon.com/dp/B015MSKC48/,1,1
"[Break A Sweat in Comfort] Bluetooth Headphones TaoTronics Wireless Earphones Sport Earbuds Headsets (Bluetooth 4.0, Balanced Audio, Build-in Mic, aptX, CVC 6.0 Noise-Cancelling)-Black & Green",Cell Phones & Accessories,https://www.amazon.com/gp/product/B00YTW9KT2?psc=1&amp;redirect=true&amp;ref_=oh_aui_detailpage_o08_s00,1,1
Y-BAND Apple Watch 42mm Band NATO Iwatch Woven Nylon Fabric Replacement Strap with Storage Box Navy Blue with Gold Adaptors,Wireless,http://www.amazon.com/dp/B01HS475OE/,1,1
"WiFi Smart Connected Body Fat Scale by Weight Gurus, Large Digital Backlit LCD, Precision/Accurate Measurements include: BMI, Body Fat, Muscle Mass, Water Weight, and Bone Mass",Health and Beauty,http://www.amazon.com/dp/B01IFYLAR4/,1,1
In stock Black Space Gray Adapter for Apple Watch 42mm Watchband Adapter for Apple Watch Sport Edition Watchband Adapter 2pcs(42mm),Wireless,http://www.amazon.com/dp/B00YA4HMMG/,1,1
"Apple Watch Stand, Aerb Rosewood Charging Stand Bracket Docking Station Cradle Holder for iPhone X 8 7 6 Plus 5 5c and Apple Watch 38mm 42mm Series 3 Series 2 Series 1",Wireless,http://www.amazon.com/dp/B00XKPN5KO/,1,1
Classic Leather Buckle Strap Watch Wrist Band With Metal Clasp For 42mm Apple Watch (YESOO Retail Packaging - 180 Days Warranty) (Red),Wireless,http://www.amazon.com/dp/B00XKDFB26/,1,1
"Apple Watch Band with Metal Clasp, Pandawell™ 38mm Genuine Leather Replacement Watchband Strap Wrist Band for Apple Watch & Sport & Edition [Compare to Classic Buckle & Modern Buckle] Directly Use for any Version Apple Watch, No need a Screw Driver to Install It (38mm-Brown)",Wireless,http://www.amazon.com/dp/B00WT25NJU/,1,1
"Apple Watch Adapter. Band Adapter for Apple Watch (Stainless Steel, 38 mm)",Wireless,http://www.amazon.com/dp/B00WL3537O/,1,1
ZAGG InvisibleShield HD Screen Protection - HD Clarity + Premium Protection for Apple iWatch (42mm),Wireless,http://www.amazon.com/dp/B00W9KC8F4/,1,1
"Moretek 38mm for Apple Watch Sport Bands, Silicone Wristband Replacement Bracelet Strap for Apple Watch ( Series 1 / Series 2 / Apple watch Nike+ ) Smartwatch (BlackRed, 38MM)",PC Accessory,http://www.amazon.com/dp/B01MA4UQOR/,1,1
"OULUOQI Apple Watch Band 42mm, Soft Silicone Replacement Band for Apple Watch Series 3, Series 2, Series 1, Sport , Edition, M/L Size ( Black / Volt Yellow )",Cell Phones & Accessories,https://www.amazon.com/gp/product/B01MCWYSJZ/ref=oh_aui_detailpage_o01_s00?ie=UTF8&amp;psc=1,1,1
Vitech Soft Silicone Nike+ Sport Style Replacement Strap band for Apple Wrist Watch Series 1 Series 2 (42mm M/L Black/Volt),Wireless,http://www.amazon.com/dp/B01MEF7F2J/,1,1
"Monoy wcase-c3 Apple Watch Series 2, 42 mm Case, Monoy New Design Slim Clear 2nd PC Hard Screen Protector for iWatch Series 2, 42 mm 2016 (PC Hard Case) - Clear Plus Grey- 2 Piece",Wireless,http://www.amazon.com/dp/B01MTL6BRE/,1,1
Spigen Rugged Armor Apple Watch Case with Resilient Shock Absorption for 42mm Apple Watch Series 3 / Series 2 / 1 / Original (2015) - Black,Wireless,http://www.amazon.com/dp/B00UVSNQPM/,1,1
SONGMICS 24 Watch Box Large Watch Case Glass Top Black Display Organizer Faux Leather UJWB024,Home,http://www.amazon.com/dp/B00NHM75HO/,1,1
"MoKo Apple Watch Band, Stainless Steel Replacement Smart Watch Band Link Bracelet with Double Button Folding Clasp for 42mm All Models – Black (Not Fit iWatch 38mm Version 2015)",Wireless,http://www.amazon.com/dp/B00JP6FX1Q/,1,1
"Anker 36W 4-Port USB Wall Charger Travel Adapter with PowerIQ Technology for iPhone, iPad, Samsung Galaxy, Nexus, HTC, Motorola, LG and More (White)",Wireless,http://www.amazon.com/dp/B00EI8SS4U/,1,1
"Depend For Men Incontinence Guards, Maximum Absorbency 52 ea",Health and Beauty,http://www.amazon.com/dp/B004OQP3O4/,1,1
Apple Watch-Cuff Burkley Case Luxury Genuine Leather Watch Band Strap Bracelet Replacement Wrist Band With Adapter Clasp for iWatch Apple Watch & Sport & Edition 42mm (Antique Coffee),Wireless,http://www.amazon.com/dp/B01A9IFKJI/,1,1
"Camkey Apple Watch Band, Best Milanese Loop Stainless Steel Bracelet Strap Magnetic Closure for Apple iWatch Sport Edition 42mm – Black",Wireless,http://www.amazon.com/dp/B01ABT0IW4/,1,1
"MoKo Band for Apple Watch Series 1 & 2, Stainless Steel Replacement Bracelet with Custom Butterfly Closure, Double Button Clasp for iWatch 42mm 2015 & 2016 All Models - SILVER (Not Fit iWatch 38mm)",Wireless,http://www.amazon.com/dp/B00JP6FV8Q/,1,1
"Smatree SmaShell A100 Charging Case (Original Magnetic Charging Cable NOT Included) for Apple Watch Series 1, Series 2, Series 3 (Black)",Wireless,http://www.amazon.com/dp/B019MS45B0/,1,1
22mm Watch Band Black Carbon Fiber White Stitching Water Resistant,Watch,http://www.amazon.com/dp/B00II7K2XC/,1,1
"Apple Watch Stand,ZIKU Aluminum Apple watch charger iPhone Charging stand Dock Station -- Fit Apple Watch 3 2 and All iPhone 8/8 plus/iPhone X/SE/7/6S/PLUS Charging with Various Case（sliver）",PC Accessory,http://www.amazon.com/dp/B018Y7HEZE/,1,1
