name,category,amazon_link,total_mentions,subreddit_mentions
"Edible and Useful Plants of the Southwest: Texas, New Mexico, and Arizona",Book,http://www.amazon.com/dp/0292748272/,1,1
Medicinal Plants of the American Southwest (Herbal Medicine of the American Southwest),Book,http://www.amazon.com/dp/0977133370/,1,1
A Brief History of Phoenix,Book,http://www.amazon.com/dp/1467118443/,1,1
The Complete Survival in the Southwest: Guide to Desert Survival,Book,http://www.amazon.com/dp/1490353631/,1,1
TERRO Scorpion Killer Aerosol Spray T2101,Lawn & Patio,http://www.amazon.com/dp/B000XBM180/,1,1
"LEDwholesalers 51-LED 395nm Ultra Violet Blacklight UV Flashlight 3xAA, 7202UV395",Sports,http://www.amazon.com/dp/B001Q70A0G/,10,1
"Prestige Medical Bandage Scissors, 5 1/2 Inches",Health and Beauty,http://www.amazon.com/dp/B003YDGQBM/,2,1
"ARRIS SURFboard DOCSIS 3.0 Cable Modem (SB6121) Time Warner Cable, Charter, Cox, Cablevision, and more (Black,Retail Packaging)",CE,http://www.amazon.com/dp/B004XC6GJ0/,85,1
Cy-Kick Aerosol Pressurized 17.5 oz-2 cans 6634212,BISS,http://www.amazon.com/dp/B005SKY61Q/,1,1
"Escolite UV Flashlight Black Light, 51 LED 395 nM Ultraviolet Blacklight Detector for Dog Urine, Pet Stains and Bed Bug",Home Improvement,http://www.amazon.com/dp/B008133KB4/,12,1
"Intex Mega Chill II, Inflatable Floating Cooler, 48"" X 38""",Toy,http://www.amazon.com/dp/B009QUCVJI/,1,1
"Satechi Universal Smartphone CD Slot Mount for iPhone 6 Plus, 6, 5S, 5C, 5, 4S, Samsung Galaxy S5, Note 3, Nexus 5, S, HTC One X, S, Motorola Droid Razr HD, Maxx, Nokia Lumia 920",Wireless,http://www.amazon.com/dp/B00D4ABOZS/,14,1
Camp Chef Redwood Port. Pro Fire Pitt,Sports,http://www.amazon.com/dp/B00D6LJLWS/,1,1
Seek Thermal XR Imager for iOS-Apple,Boost,http://www.amazon.com/dp/B00SSZ5KPY/,2,1
"Armasight Predator 336 2-8x25 (30 Hz) Thermal Imaging Weapon Sight, FLIR Tau 2 - 336x256 (17 micron) 30Hz Core, 25mm Lens",Sports,http://www.amazon.com/dp/B00TMAGCEC/,1,1
"Mini-Factory Car Windshield Snow Cover / Sun Shade Protector Exterior Shield Guard - All Weather - Sun, Snow, Ice, Frost and Wind Proof - Extra Thick - Door Flaps",Automotive Parts and Accessories,http://www.amazon.com/dp/B017AKM1PY/,3,1
