name,category,amazon_link,total_mentions,subreddit_mentions
"Drawing on the Right Side of the Brain: The Definitive, 4th Edition",Book,http://www.amazon.com/dp/1585429201/,79,5
Color and Light: A Guide for the Realist Painter (James Gurney Art),Book,http://www.amazon.com/dp/0740797719/,45,5
"Sakura Pigma 30062 Micron Blister Card Ink Pen Set, Black, Ass't Point Sizes 6CT Set",Art and Craft Supply,http://www.amazon.com/dp/B0008G8G8Y/,47,4
Imaginative Realism: How to Paint What Doesn't Exist (James Gurney Art),Book,http://www.amazon.com/dp/0740785508/,7,2
"Prismacolor Premier Water-Soluble Colored Pencils, 24 Pack",Art and Craft Supply,http://www.amazon.com/dp/B0019IKWIM/,2,2
Fred GIN & TITONIC Titanic Ice Tray,Kitchen,http://www.amazon.com/dp/B001GQ2SQ6/,6,2
Powertrip,Music,http://www.amazon.com/dp/B00000HZH9/,2,2
Vegebook: A Curious Coloring Book for Peculiar People,Book,http://www.amazon.com/dp/1511732512/,9,2
"Sharpie Oil-Based Paint Markers, Medium Point, Bright Colors, 5 Count - Great for Rock Painting",Office Product,http://www.amazon.com/dp/B003VQ9M04/,4,2
Modern Life of The Immortals Vol. 1,eBooks,http://www.amazon.com/dp/B01N8SI5XQ/,4,2
Delphi Complete Works of Vincent van Gogh (Illustrated) (Masters of Art Book 3),eBooks,http://www.amazon.com/dp/B007H2UTG4/,2,2
"Pentel Arts Pocket Brush Pen, Includes 2 Black Ink Refills (GFKP3BPA)",Office Product,http://www.amazon.com/dp/B002LJRKN8/,18,2
Van Gogh: The Life,Book,http://www.amazon.com/dp/0375758976/,4,1
Feeling Good: The New Mood Therapy,Book,http://www.amazon.com/dp/0380810336/,228,1
The Return of the Prodigal Son: A Story of Homecoming,Book,http://www.amazon.com/dp/0385473079/,4,1
The Book of Genesis Illustrated by R. Crumb,Book,http://www.amazon.com/dp/0393061027/,19,1
The Giver (Giver Quartet),Book,http://www.amazon.com/dp/0440237688/,1,1
Need A House? Call Ms. Mouse!,Book,http://www.amazon.com/dp/0448165759/,1,1
The Art Spirit,Book,http://www.amazon.com/dp/0465002633/,7,1
Staring at the Sun: Overcoming the Terror of Death,Book,http://www.amazon.com/dp/0470401818/,4,1
The Human Figure in Motion,Book,http://www.amazon.com/dp/0486202046/,3,1
Hawthorne on Painting (Dover Art Instruction),Book,http://www.amazon.com/dp/048620653X/,1,1
Perspective Drawing Handbook (Dover Art Instruction),Book,http://www.amazon.com/dp/0486432084/,1,1
Mystical Mandala Coloring Book (Dover Design Coloring Books),Book,http://www.amazon.com/dp/0486456943/,5,1
Seeing Is Forgetting the Name of the Thing One Sees: Expanded Edition,Book,http://www.amazon.com/dp/0520256093/,1,1
Ivan the Terrible,Book,http://www.amazon.com/dp/0525242465/,1,1
Dinosaur for a Day (Blue Ribbon Book),Book,http://www.amazon.com/dp/0590921266/,1,1
How To Draw Comics The Marvel Way,Book,http://www.amazon.com/dp/0671530771/,19,1
Imagine a Day,Book,http://www.amazon.com/dp/0689852193/,1,1
"Exploring the Invisible: Art, Science, and the Spiritual",Book,http://www.amazon.com/dp/0691089728/,1,1
The Story of Art,Book,http://www.amazon.com/dp/0714832472/,4,1
Intricate Ink: Animals in Detail Coloring Book,Book,http://www.amazon.com/dp/0764974696/,3,1
"Daily Painting: Paint Small and Often To Become a More Creative, Productive, and Successful Artist",Book,http://www.amazon.com/dp/0770435335/,1,1
"Hawkeye, Vol. 1: My Life as a Weapon (Marvel NOW!)",Book,http://www.amazon.com/dp/0785165622/,134,1
Andy Goldsworthy: A Collaboration with Nature,Book,http://www.amazon.com/dp/0810933519/,1,1
Ivan the Terrible,Book,http://www.amazon.com/dp/0815412290/,1,1
The Artist's Guide to Sketching,Book,http://www.amazon.com/dp/0823003329/,1,1
Drawing Lessons from the Great Masters,Book,http://www.amazon.com/dp/0823014010/,1,1
Dynamic Wrinkles and Drapery: Solutions for Drawing the Clothed Figure,Book,http://www.amazon.com/dp/0823015874/,3,1
"Rendering in Pen and Ink: The Classic Book On Pen and Ink Techniques for Artists, Illustrators, Architects, and Designers",Book,http://www.amazon.com/dp/0823045293/,12,1
Graphic Artist's Guild Handbook of Pricing and Ethical Guidelines (Graphic Artists Guild Handbook: Pricing & Ethical Guidelines),Book,http://www.amazon.com/dp/0932102166/,14,1
From Hell,Book,http://www.amazon.com/dp/0958578346/,3,1
Alla Prima: Everything I Know About Painting,Book,http://www.amazon.com/dp/0966211731/,1,1
"Batman: Arkham Asylum - A Serious House on Serious Earth, 15th Anniversary Edition",Book,http://www.amazon.com/dp/1401204252/,4,1
V for Vendetta,Book,http://www.amazon.com/dp/140120841X/,7,1
The Sandman Vol. 1: Preludes & Nocturnes (New Edition) (Sandman New Editions),Book,http://www.amazon.com/dp/1401225756/,53,1
Watchmen,Book,http://www.amazon.com/dp/1401245250/,57,1
Y: The Last Man Book One,Book,http://www.amazon.com/dp/140125151X/,36,1
The Magical City: A Colouring Book (Magical Colouring Books),Book,http://www.amazon.com/dp/1405924098/,1,1
Master of Illusion 2017 Wall Calendar,Book,http://www.amazon.com/dp/1416242872/,1,1
ART/WORK: Everything You Need to Know (and Do) As You Pursue Your Art Career,Book,http://www.amazon.com/dp/1416572333/,5,1
Leviathan (The Leviathan Trilogy),Book,http://www.amazon.com/dp/1416971742/,4,1
Dinotopia: Journey to Chandara,Book,http://www.amazon.com/dp/1449479847/,1,1
Between the Lines: An Expert Level Coloring Book,Book,http://www.amazon.com/dp/1495337111/,5,1
Vegepatterns: A kaleidoscopic coloring book of perplexing patterns,Book,http://www.amazon.com/dp/1512340200/,1,1
Cats & Quilts: Adult Coloring Book,Book,http://www.amazon.com/dp/1517128153/,1,1
"Colouring book: The Magical City : A Coloring books for adults relaxation(Stress Relief Coloring Book, Creativity, Patterns, coloring books for adults) (coloring book for adults) (Volume 1)",Book,http://www.amazon.com/dp/1530102189/,1,1
Cartoon Animation (Collector's Series),Book,http://www.amazon.com/dp/1560100842/,7,1
Anatomy and Drawing,Book,http://www.amazon.com/dp/1566197872/,1,1
"Form+Code in Design, Art, and Architecture (Design Briefs)",Book,http://www.amazon.com/dp/1568989377/,2,1
J Is for Jealousy (Erotic Alphabet),Book,http://www.amazon.com/dp/1573443069/,1,1
"Pyrography Basics: Techniques and Exercises for Beginners (Skill-Building Step-by-Step Instructions & Patterns with Temperature, Time, Texture & Layering Advice from Lora S. Irish)",Book,http://www.amazon.com/dp/1574215051/,1,1
The Artist's Way: A Spiritual Path to Higher Creativity,Book,http://www.amazon.com/dp/1585421464/,22,1
Talent is Overrated: What Really Separates World-Class Performers from Everybody Else,Book,http://www.amazon.com/dp/1591842948/,14,1
"Dinotopia, A Land Apart from Time: 20th Anniversary Edition (Calla Editions)",Book,http://www.amazon.com/dp/1606600222/,3,1
"Dinotopia, The World Beneath: 20th Anniversary Edition (Calla Editions)",Book,http://www.amazon.com/dp/1606600338/,1,1
"Dinotopia, First Flight: 20th Anniversary Edition",Book,http://www.amazon.com/dp/1606600575/,1,1
Grant Morrison's 18 Days,Book,http://www.amazon.com/dp/1606901745/,5,1
"Saga, Vol. 1 (Saga (Comic Series))",Book,http://www.amazon.com/dp/1607066017/,31,1
"The Books of Enoch: Complete edition: Including (1) The Ethiopian Book of Enoch, (2) The Slavonic Secrets and (3) The Hebrew Book of Enoch",Book,http://www.amazon.com/dp/1609422007/,2,1
Last Man Standing: Killbook of a Bounty Hunter,Book,http://www.amazon.com/dp/1616552409/,4,1
Tales from the Loop,Book,http://www.amazon.com/dp/1624650392/,3,1
Half-Earth: Our Planet's Fight for Life,Book,http://www.amazon.com/dp/1631490826/,3,1
Learn to Paint in Acrylics with 50 Small Paintings: Pick up the skills * Put on the paint * Hang up your art,Book,http://www.amazon.com/dp/1631590561/,1,1
Artistry: Pen & Ink: A creative exploration of a time-treatured drawing technique,Book,http://www.amazon.com/dp/1633221784/,1,1
Imagine,Book,http://www.amazon.com/dp/1681881675/,1,1
Complete Guide to Life Drawing,Book,http://www.amazon.com/dp/1844486907/,1,1
ASH: A Secret History,Book,http://www.amazon.com/dp/1857987446/,1,1
How to Draw: drawing and sketching objects and environments from your imagination,Book,http://www.amazon.com/dp/1933492732/,43,1
Framed Ink: Drawing and Composition for Visual Storytellers,Book,http://www.amazon.com/dp/1933492953/,13,1
Van Gogh Complete Paintings,Book,http://www.amazon.com/dp/3822815888/,1,1
"Pentel R.S.V.P. Ballpoint Pen, 0.7mm Fine Tip, Black Ink, Box of 12 (BK90-A)",Office Product,http://www.amazon.com/dp/B00006IEAK/,4,1
"Krylon K01306 Workable Fixatif Spray Clear, 11-Ounce Aerosol",Home Improvement,http://www.amazon.com/dp/B00023JE7U/,6,1
Speedball Sketching Project Set,Art and Craft Supply,http://www.amazon.com/dp/B0007ZJ8RO/,2,1
"Strathmore 400 Series Drawing Pad, 11""x14"" Wire Bound, 24 Sheets",Art and Craft Supply,http://www.amazon.com/dp/B000A7OPAO/,1,1
"Prismacolor Premier Colored Pencils, Soft Core, 72-Count",Office Product,http://www.amazon.com/dp/B000E23RSQ/,4,1
Weller WSB25WB  25-Watt Short Barrel Woodburning Kit,Home Improvement,http://www.amazon.com/dp/B000EMBEY0/,9,1
"Permatex 01406 DL Blue Label Cream Hand Cleaner, 4.5 lb",Automotive Parts and Accessories,http://www.amazon.com/dp/B000HBNV76/,1,1
Pro Art 18-Piece Sketch/Draw Pencil Set,Art and Craft Supply,http://www.amazon.com/dp/B000HTBBO8/,6,1
High Times: Singles 1992-2006,Music,http://www.amazon.com/dp/B000INAXGU/,1,1
"Liquitex Professional Matte Gel Medium, 8-oz",Art and Craft Supply,http://www.amazon.com/dp/B000KNJFKI/,2,1
Copic Markers 36-Piece Sketch Basic Set,Art and Craft Supply,http://www.amazon.com/dp/B000MRSUDU/,1,1
Walnut Hollow Creative Woodburner Introduction Value Pen for Beginners and Intermediate Woodburners,Hobby,http://www.amazon.com/dp/B000VRTG8Y/,9,1
Design Kneaded Rubber Eraser Extra Large (SAN70532)- Sold Individually,Home,http://www.amazon.com/dp/B000XZTIIM/,1,1
"Sakura XNCW-12H, 12 Assorted Watercolors Field Sketch Set with Brush",Art and Craft Supply,http://www.amazon.com/dp/B00122CN64/,1,1
"Coats & Clark Dual Duty All-Purpose Thread, 400 Yards/1 Spool of Yarn, Black",Art and Craft Supply,http://www.amazon.com/dp/B00172V5VI/,2,1
"General Pencil All-Art Sharpener, Pack of 3, Little Red (S6503BP)",Office Product,http://www.amazon.com/dp/B0018N80XW/,2,1
Alvin Wooden Human Mannequin (Unisex) 12 Inches Tall,Home,http://www.amazon.com/dp/B001OBMZIE/,6,1
Art Advantage 18-Inch by 18-Inch Artist Sketch Board,Art and Craft Supply,http://www.amazon.com/dp/B0027A7B5I/,1,1
"Winsor & Newton Winton Oil Color 10-Tube Set, 37ml",Art and Craft Supply,http://www.amazon.com/dp/B002E9GUZ4/,1,1
