name,category,amazon_link,total_mentions,subreddit_mentions
Kill Anything That Moves: The Real American War in Vietnam (American Empire Project),Books,https://www.amazon.com/Kill-Anything-That-Moves-American/dp/1250045061/ref=sr_1_1/191-8201762-0731846?ie=UTF8&amp;qid=1430547444&amp;sr=8-1,7,2
Orientalism,Books,https://www.amazon.com/Orientalism-Edward-W-Said/dp/039474067X/ref=sr_1_1?ie=UTF8&amp;qid=1426553762&amp;sr=8-1&amp;keywords=orientalism+edward+said,3,1
The Man Without a Face: The Unlikely Rise of Vladimir Putin,Books,https://www.amazon.com/Man-Without-Face-Unlikely-Vladimir/dp/1594486514?sa-no-redirect=1,2,1
Big Little Man: In Search of My Asian Self,Books,https://www.amazon.com/Big-Little-Man-Search-Asian/dp/0547450486/ref=asap_bc?ie=UTF8,2,1
"No Longer Separate, Not Yet Equal: Race and Class in Elite College Admission and Campus Life",Books,https://www.amazon.com/Longer-Separate-Not-Yet-Equal/dp/0691141606,2,1
"Tresemme Thermal Creations Volumising Mousse, 6.5 Ounce",Beauty & Personal Care,https://www.amazon.com/Tresemme-Thermal-Creations-Volumising-Mousse/dp/B0019J4R6Y,2,1
The Secret History of the Mongol Queens: How the Daughters of Genghis Khan Rescued His Empire,Books,https://www.amazon.com/The-Secret-History-Mongol-Queens/dp/0307407160,2,1
Rescuing History from the Nation: Questioning Narratives of Modern China,Books,https://www.amazon.com/Rescuing-History-Nation-Questioning-Narratives/dp/0226167224/ref=sr_1_1?ie=UTF8&amp;qid=1426554057&amp;sr=8-1&amp;keywords=rescuing+history+from+the+nation,1,1
Japan's Orient: Rendering Pasts into History,Books,https://www.amazon.com/Japans-Orient-Rendering-Pasts-History/dp/0520201701/ref=sr_1_1?ie=UTF8&amp;qid=1426553687&amp;sr=8-1&amp;keywords=japan,1,1
Gia Vi Nau Pho (Pho Hoa) Beef Noodle Soup Spices,Grocery & Gourmet Food,https://www.amazon.com/Pho-Hoa-Beef-Noodle-Spices/dp/B003GRMUCU,1,1
Chinese Girl in the Ghetto,Books,https://www.amazon.com/Chinese-Girl-Ghetto-Ying-Ma/dp/1460970454/ref=sr_1_1?ie=UTF8&amp;qid=1460647829&amp;sr=8-1&amp;keywords=Chinese+girl+in+the+ghetto,1,1
The Repatriation of Henry Chin,Books,https://www.amazon.com/Repatriation-Henry-Chin-Isaac-Ho/dp/0615548385,1,1
"The US Army's First, Last, and Only All-Black Rangers: The 2d Ranger Infantry Company (Airborne) in the Korean War, 1950-1951",Books,https://www.amazon.com/Armys-First-Last-All-Black-Rangers/dp/1611210771,1,1
The Hundred-Year Flood,Books,https://www.amazon.com/Hundred-Year-Flood-Matthew-Salesses/dp/1477829547/,1,1
Gatsby Moving Rubber Grunge Mat 80g,Beauty & Personal Care,https://www.amazon.com/Gatsby-Moving-Rubber-Grunge-Mat/dp/B000V2ACIM/ref=pd_sim_194_4?ie=UTF8&amp;dpID=515j2QG5Y,1,1
If Mahan Ran the Great Pacific War: An Analysis of World War II Naval Strategy,Books,https://www.amazon.com/Mahan-Ran-Great-Pacific-War/dp/0253351057,1,1
The Problem of Asia: Its Effect upon International Politics,Books,https://www.amazon.com/The-Problem-Asia-International-Politics/dp/0765805243,1,1
[Tosowoong]Enzyme cleanser 70g/Enzyme Powder wash/acne/blackheads/pore cleansing/cosmetics,Beauty & Personal Care,https://www.amazon.com/Tosowoong-cleanser-blackheads-cleansing-cosmetics/dp/B00I76Q3XM/ref=sr_1_1_s_it?s=beauty&amp;ie=UTF8&amp;qid=1489439693&amp;sr=1-1&amp;keywords=toosowong+enzyme+powder,1,1
Squeamish About Sushi: And other Food Adventures in Japan,Books,https://www.amazon.com/Squeamish-About-Sushi-other-Adventures/dp/080483301X,1,1
Japanese Farm Food,Books,https://www.amazon.com/Japanese-Farm-Nancy-Singleton-Hachisu/dp/1449418295,1,1
Five Days at Memorial: Life and Death in a Storm-Ravaged Hospital,Books,https://www.amazon.com/Five-Days-Memorial-Storm-Ravaged-Hospital/dp/0307718972/ref=sr_1_1?ie=UTF8&amp;qid=1489166610&amp;sr=8-1&amp;keywords=five+days+at+memorial,1,1
Fives and Twenty-Fives: A Novel,Books,https://www.amazon.com/Fives-Twenty-Fives-Novel-Michael-Pitre/dp/1620407558/ref=sr_1_1?s=books&amp;ie=UTF8&amp;qid=1489166648&amp;sr=1-1&amp;keywords=fives+and+twenty-fives,1,1
Cities Without Ground: A Hong Kong Guidebook,Books,https://www.amazon.com/Cities-Without-Ground-Hong-Guidebook/dp/1935935321,1,1
