name,category,amazon_link,total_mentions,subreddit_mentions
The Basque History of the World: The Story of a Nation,Books,https://www.amazon.com/Basque-History-World-Story-Nation/dp/0140298517/ref=asap_bc?ie=UTF8,3,2
Abba-Zaba Strawberry Taffy and Peanut Butter Candy Bars 24 Count,Grocery & Gourmet Food,https://www.amazon.com/Abba-Zaba-Strawberry-Taffy-Peanut-Butter/dp/B00IHS3PUE,,1
Astor Bidet Fresh Water Spray Non-Electric Mechanical Bidet Toilet Seat Attachment CB-1000,Tools & Home Improvement,https://www.amazon.com/dp/B003TPGPUW/ref=cm_sw_r_cp_apa_TUK7yb4RP9XSS,54,1
Luxe Bidet Neo 320 - Self Cleaning Dual Nozzle - Hot and Cold Water Non-Electric Mechanical Bidet Toilet Attachment,Tools & Home Improvement,https://www.amazon.com/Luxe-Bidet-Neo-320-Non-Electric/dp/B00A0RX2UI/ref=sr_1_3?ie=UTF8&amp;qid=1492012297&amp;sr=8-3&amp;keywords=luxe+bidet,15,1
"MOD Complete MDC77037 Double Basket Flat Folding Shopping Cart with Swivel Wheels, Black",Home & Kitchen,https://www.amazon.com/Wellmax-WM99017S-Double-Folding-Shopping/dp/B0000UZ58C,4,1
The Looming Tower: Al-Qaeda and the Road to 9/11,Books,https://www.amazon.com/Looming-Tower-Al-Qaeda-Road-11/dp/1400030846/ref=sr_1_1?s=books&amp;ie=UTF8&amp;qid=1496875754&amp;sr=1-1&amp;keywords=Looming+Tower,4,1
Cod: A Biography of the Fish that Changed the World,Books,https://www.amazon.com/Cod-Biography-Fish-Changed-World/dp/0140275010/ref=asap_bc?ie=UTF8,3,1
Norpro Heavy Duty Adjustable Cheese Slicer,Home & Kitchen,https://www.amazon.com/Norpro-330-Adjustable-Cheese-Slicer/dp/B000HMB0IM/ref=sr_1_4?s=kitchen&amp;ie=UTF8&amp;qid=1460222432&amp;sr=1-4&amp;keywords=cheese+slicer,3,1
Thermos Stainless Steel Beverage Can Insulator for 12 Ounce Can,Home & Kitchen,https://www.amazon.com/Thermos-Stainless-Steel-Beverage-Insulator/dp/B0000644AF,3,1
"The Innovators: How a Group of Hackers, Geniuses, and Geeks Created the Digital Revolution",Books,https://www.amazon.com/Innovators-Hackers-Geniuses-Created-Revolution/dp/1476708703,2,1
"J&D Baconnaise Regular Mayonnaise, Bacon, 15 Ounce",Grocery & Gourmet Food,https://www.amazon.com/Baconnaise-Regular-Mayonnaise-Bacon-Ounce/dp/B002HQNCBO/ref=sr_1_2_a_it?ie=UTF8&amp;qid=1481299857&amp;sr=8-2&amp;keywords=J,2,1
American on Purpose: The Improbable Adventures of an Unlikely Patriot,Books,https://www.amazon.com/American-Purpose-Improbable-Adventures-Unlikely/dp/0061998494,2,1
The Siege of Mecca: The 1979 Uprising at Islam's Holiest Shrine,Books,https://www.amazon.com/Siege-Mecca-Uprising-Islams-Holiest/dp/0307277739/ref=sr_1_1?s=books&amp;ie=UTF8&amp;qid=1496876042&amp;sr=1-1&amp;keywords=The+Siege+of+Mecca,2,1
"Diagnostic and Statistical Manual of Mental Disorders, 5th Edition: DSM-5",Books,https://www.amazon.com/Diagnostic-Statistical-Manual-Mental-Disorders/dp/0890425558,2,1
The Strategy of Conflict,Books,https://www.amazon.com/Strategy-Conflict-Thomas-C-Schelling/dp/0674840313,1,1
The Cruelest Miles: The Heroic Story of Dogs and Men in a Race Against an Epidemic,Books,https://www.amazon.com/Cruelest-Miles-Heroic-Against-Epidemic/dp/0393325709,1,1
Dove,Books,https://www.amazon.com/Dove-Robin-L-Graham/dp/0060920475,1,1
CultureShock! USA: A Survival Guide to Customs and Etiquette (Cultureshock USA: A Survival Guide to Customs & Etiquette),Books,https://www.amazon.com/CultureShock-USA-Survival-Etiquette-Cultureshock/dp/B00DPNW98U,1,1
Emily Post's Wedding Etiquette,Books,https://www.amazon.com/dp/0062326104/ref=cm_sw_r_other_awd_AxLRwb6J49958,1,1
Macho Man Randy Savage WWE Odd Socks,"Clothing, Shoes & Jewelry",https://www.amazon.com/Mens-Macho-Randy-Savage-Socks/dp/B01H5Q9XPY/ref=pd_sbs_193_3?_encoding=UTF8&amp;psc=1&amp;refRID=7V8CPY7NDCH9TSC7SWGD,1,1
"Sock It To Me Men's Crew Sock, One Giant Leap","Clothing, Shoes & Jewelry",https://www.amazon.com/Sock-Me-Giant-Leap-Socks/dp/B0127MIXPC/ref=sr_1_2_a_it?ie=UTF8&amp;qid=1487466393&amp;sr=8-2&amp;keywords=astronaut+socks,1,1
"Man Cave Trouser Socks, Eagle, 10-13","Clothing, Shoes & Jewelry",https://www.amazon.com/Man-Cave-Trouser-Socks-Eagle/dp/B014RSSKBQ/ref=pd_sim_75_7?_encoding=UTF8&amp;psc=1&amp;refRID=FEXH0TMF6PDAZNCKV52V,1,1
Yo! Sacramento,Books,https://www.amazon.com/Sacramento-Will-Cleveland-Mark-Alvarez/dp/0761302379,1,1
"The Explanation of Ideology: Family Structure and Social Systems (Family, Sexuality and Social Relations in Past Times)",Books,https://www.amazon.com/The-Explanation-Ideology-Structure-Sexuality/dp/0631154914,1,1
USA American Flag Lounge Pants Pajamas,"Clothing, Shoes & Jewelry",https://www.amazon.com/American-Lounge-Pants-Pajamas-Medium/dp/B00OG9E3IQ/ref=sr_1_4?ie=UTF8&amp;qid=1481317358&amp;sr=8-4&amp;keywords=american+flag+pants,1,1
"Native Indian Wild Game, Fish, and Wild Foods Cookbook: New Revised and Expanded Edition (Cooking)",Books,https://www.amazon.com/Native-Indian-Wild-Foods-Cookbook/dp/1565230779,1,1
"A Pirate of Exquisite Mind: The Life of William Dampier: Explorer, Naturalist, and Buccaneer",Books,https://www.amazon.com/Pirate-Exquisite-Mind-Naturalist-Buccaneer/dp/042520037X/.,1,1
What Were the Twin Towers? (What Was?),Books,https://www.amazon.com/What-Were-Twin-Towers-Was/dp/0448487853,1,1
"KitchenAid KG300 Box Grater, Black",Home & Kitchen,https://www.amazon.com/KitchenAid-KG300OB-Grater-Box-Black/dp/B0000655YB,1,1
Zapps Kettle Chips VooDoo Heat 2 Oz Snack Size (Pack of 5),Grocery & Gourmet Food,https://www.amazon.com/Zapps-Kettle-Chips-VooDoo-Snack/dp/B06W2M1PGJ/ref=pd_lpo_vtph_tr_t_3?_encoding=UTF8&amp;psc=1&amp;refRID=F77F9TWYZ157YHHWAWY4,1,1
"KitchenAid Professional Stainless Steel Euro Peeler, Red",Home & Kitchen,https://www.amazon.com/KitchenAid-Stainless-Steel-Euro-Peeler/dp/B00005KIC7/ref=sr_1_sc_4?ie=UTF8&amp;qid=1460229354&amp;sr=8-4-spell&amp;keywords=kitchenaide+vegetable+peeler,1,1
ANLEY [Fly Breeze] 3x5 Foot Marijuana Leaf USA Polyester Flag - Vivid Color and UV Fade Resistant - Canvas Header and Double Stitched - US Marijuana Leaves Flags with Brass Grommets 3 X 5 Ft,"Patio, Lawn & Garden",https://www.amazon.com/dp/B01AJJ05DI,1,1
"Norpro Deluxe Mandoline Slicer, Grater, Shredder, Julienne and Juicer w/ Safety Guard",Home & Kitchen,https://www.amazon.com/Norpro-Mandoline-Slicer-Grater-Guard/dp/B001FB59LS/ref=sr_1_22?s=home-garden&amp;ie=UTF8&amp;qid=1460229159&amp;sr=1-22&amp;keywords=mandoline+slicer,1,1
Rainbow / USA - 3' x 5' Polyester Flag,"Patio, Lawn & Garden",https://www.amazon.com/Flagline-Rainbow-USA-Polyester-Flag/dp/B001GZUOR2,1,1
AN AUSSIE IN AMERICA-OP,Books,https://www.amazon.com/AUSSIE-AMERICA-OP-Anne-Maxwell-High/dp/1594111103/ref=sr_1_1?s=books&amp;ie=UTF8&amp;qid=1492184509&amp;sr=1-1,1,1
"Farberware Pro Forged Cheese Knife, 5-Inch, Black",Home & Kitchen,https://www.amazon.com/Farberware-Forged-Cheese-Knife-Black/dp/B00QUDOL8S,1,1
Kingdom of the Unjust: Behind the U.S.-Saudi Connection,Books,https://www.amazon.com/Kingdom-Unjust-Behind-U-S-Saudi-Connection/dp/1944869026/ref=sr_1_1?s=books&amp;ie=UTF8&amp;qid=1496875675&amp;sr=1-1&amp;keywords=kingdom+of+the+unjust+behind+the+u.s.-saudi+connection,1,1
Force and Fanaticism: Wahhabism in Saudi Arabia and Beyond,Books,https://www.amazon.com/Force-Fanaticism-Wahhabism-Arabia-Beyond/dp/1849044643,1,1
My Year Inside Radical Islam: A Memoir,Books,https://www.amazon.com/My-Year-Inside-Radical-Islam/dp/1585426113/ref=sr_1_1?s=books&amp;ie=UTF8&amp;qid=1496875857&amp;sr=1-1&amp;keywords=My+Year+inside+Radical+Islam,1,1
"The ISIS Apocalypse: The History, Strategy, and Doomsday Vision of the Islamic State",Books,https://www.amazon.com/ISIS-Apocalypse-History-Strategy-Doomsday/dp/1250112648/ref=sr_1_1?s=books&amp;ie=UTF8&amp;qid=1496875330&amp;sr=1-1&amp;keywords=The+ISIS+Apocalypse,1,1
"What the F: What Swearing Reveals About Our Language, Our Brains, and Ourselves",Books,https://www.amazon.com/What-Swearing-Reveals-Language-Ourselves/dp/0465060919,1,1
Back to Back World War Champs USA T-Shirt - America T-Shirt,"Clothing, Shoes & Jewelry",https://www.amazon.com/dp/B00KUXXIZQ,1,1
"On Saudi Arabia: Its People, Past, Religion, Fault Lines--and Future",Books,https://www.amazon.com/Saudi-Arabia-People-Religion-Lines/dp/0307473287/ref=sr_1_1?s=books&amp;ie=UTF8&amp;qid=1496875930&amp;sr=1-1&amp;keywords=On+Saudi+Arabia,1,1
Knowing the Enemy: Jihadist Ideology and the War on Terror,Books,https://www.amazon.com/Knowing-Enemy-Jihadist-Ideology-Terror/dp/0300122578/ref=sr_1_1?s=books&amp;ie=UTF8&amp;qid=1496876149&amp;sr=1-1&amp;keywords=Knowing+the+Enemy,1,1
"Terry's Chocolate Orange, Dark Chocolate",Grocery & Gourmet Food,https://www.amazon.com/Terrys-Chocolate-Orange-Dark/dp/B006RYL6WY,1,1
DEWALT DW1107 7/64-Inch Black Oxide Split Point Twist Drill Bit (2-Pack),Tools & Home Improvement,https://www.amazon.com/DEWALT-DW1107-64-Inch-Black-2-Pack/dp/B00004RHHL/ref=sr_1_1?ie=UTF8&amp;qid=1501103084&amp;sr=8-1&amp;keywords=7,1,1
Kool Aid Variety 48 Packs,Grocery & Gourmet Food,https://www.amazon.com/Kool-Aid-Variety-48-Packs/dp/B0019MMQXM,1,1
"Keeping Oregon Green: Livability, Stewardship, and the Challenges of Growth, 19601980",Books,https://www.amazon.com/Keeping-Oregon-Green-Livability-Stewardship/dp/0870718711/ref=sr_1_1?ie=UTF8&amp;qid=1477881271&amp;sr=8-1&amp;keywords=keeping+oregon+green,1,1
"Physics for Scientists and Engineers, Hybrid (with WebAssign)",Books,https://www.amazon.com/Physics-Scientists-Engineers-Hybrid-WebAssign/dp/1111572054,1,1
