name,category,amazon_link,total_mentions,subreddit_mentions
"Introduction to Algorithms, 3rd Edition (MIT Press)",Books,https://www.amazon.com/Introduction-Algorithms-3rd-Thomas-Cormen/dp/0262033844,20,1
Code: The Hidden Language of Computer Hardware and Software,Books,https://www.amazon.com/Code-Language-Computer-Hardware-Software/dp/0735611319/ref=sr_1_1/181-7743827-9922735?ie=UTF8&amp;qid=1468287892&amp;sr=8-1&amp;keywords=charles+petzold+code,16,1
"Acer Chromebook 14, Aluminum, 14-inch Full HD, Intel Celeron Quad-Core N3160, 4GB LPDDR3, 32GB, Chrome, CB3-431-C5FM",Electronics,https://www.amazon.com/Acer-Chromebook-Aluminum-Quad-Core-CB3-431-C5FM/dp/B01CVOLVPA/,4,1
Modern Information Retrieval: The Concepts and Technology behind Search (2nd Edition) (ACM Press Books),Books,https://www.amazon.com/dp/0321416910/ref=cm_sw_r_cp_api_79PFybMZVWFXR,2,1
Discrete Mathematics with Applications,Books,https://www.amazon.com/x/dp/0534359450/,1,1
Foundations Of Algorithms,Books,https://www.amazon.com/gp/product/1284049191/,1,1
Introduction to Information Retrieval,Books,https://www.amazon.com/dp/0521865719/ref=cm_sw_r_cp_api_0cQFyb1D23W2C,1,1
Home Networking Demystified,Books,https://www.amazon.com/Home-Networking-Demystified-Larry-Long/dp/0072258780,1,1
Information Retrieval: Implementing and Evaluating Search Engines (MIT Press),Books,https://www.amazon.com/dp/0262528878/ref=cm_sw_r_cp_api_PaQFybMAJMS3F,1,1
Operating Systems DeMYSTiFieD,Books,https://www.amazon.com/Operating-Systems-DeMYSTiFieD-McIver-McHoes/dp/0071752269,1,1
