name,category,amazon_link,total_mentions,subreddit_mentions
Battery Management Systems for Large Lithium Ion Battery Packs,Book,http://www.amazon.com/dp/1608071049/,14,12
Getting Started in Electronics,Book,http://www.amazon.com/dp/0945053282/,34,8
"Practical Electronics for Inventors, Third Edition",Book,http://www.amazon.com/dp/0071771336/,35,6
Hakko FX888D-23BY Digital Soldering Station FX-888D FX-888 (blue & yellow),BISS Basic,http://www.amazon.com/dp/B00ANZRT4M/,52,5
Engineer PA-09 Micro Connector Crimpers,Home Improvement,http://www.amazon.com/dp/B002AVVO7K/,19,5
Battery Power Management for Portable Devices (Artech House Power Engineering),Book,http://www.amazon.com/dp/1608074919/,5,4
Kohree 110V LED Digital 858D SMD Hot Air Rework Station Solder Blower Heat Gun,Home Improvement,http://www.amazon.com/dp/B00ITMPQS2/,9,4
Maxitronix  200-in-One Electronic Project Lab,Toy,http://www.amazon.com/dp/B0002AHR04/,6,4
Automatic Wire Stripper with Cutter by Parts Express,Home Improvement,http://www.amazon.com/dp/B0002KR95W/,6,4
PAC SNI-1/3.5 3.5-mm Ground Loop Noise Isolator Works with iPod/Zune/iRiver and Others,Automotive Parts and Accessories,http://www.amazon.com/dp/B001EAQTRI/,66,4
MG Chemicals Rosin Flux Pen,BISS,http://www.amazon.com/dp/B0080X79HG/,4,3
"MG Chemicals No Clean Flux Paste, 10 ml Syringe",BISS,http://www.amazon.com/dp/B00425FUW2/,12,3
"Aoyue Soldering Iron Tip Cleaner with Brass wire sponge, no water needed",Home Improvement,http://www.amazon.com/dp/B005C789EU/,9,3
NKC 12VDC 1A Wall Adapter Power Supply LJY-186,CE,http://www.amazon.com/dp/B006GEPUYA/,6,3
"Hakko CHP CSP-30-1 Wire Stripper, 30-20 Gauge Maximum Cutting Capacity",BISS,http://www.amazon.com/dp/B00FZPHMUG/,6,3
eBoot 6 Pack LM2596 DC to DC Buck Converter 3.0-40V to 1.5-35V Power Supply Step Down Module,Automotive Parts and Accessories,http://www.amazon.com/dp/B01GJ0SC2C/,7,3
YOUYUE 858D Hot Air Gun Rework Station SMD Solder Soldering Digital 110V 700W,Home Improvement,http://www.amazon.com/dp/B00P8Z4RPG/,3,3
Rigol DS1054Z Digital Oscilloscope 50 Mhz DSO 4 Channels,BISS,http://www.amazon.com/dp/B012938E76/,8,3
P3 P4400 Kill A Watt Electricity Usage Monitor,Home Improvement,http://www.amazon.com/dp/B00009MDBU/,153,3
Kimdrox 3A/15W Dual Power Adapter 12V to 5V Double USB Cable Connector Car Charger For IPhone/iPad/Nokia/HTC,Wireless,http://www.amazon.com/dp/B00XDSA82Q/,9,3
"RF Circuit Design, Second Edition",Book,http://www.amazon.com/dp/0750685182/,9,3
The Art of Electronics,Book,http://www.amazon.com/dp/0521370957/,19,3
Microelectronic Circuits (The Oxford Series in Electrical and Computer Engineering) 7th edition,Book,http://www.amazon.com/dp/0199339139/,8,3
"Timer, Op Amp, and Optoelectronic Circuits & Projects",Book,http://www.amazon.com/dp/0945053290/,4,3
Fluke 115 Compact True-RMS Digital Multimeter,BISS Basic,http://www.amazon.com/dp/B000OCFFMW/,6,3
"12V DC Power Adapter Supply 2.1mm 1A, CCTV",Photography,http://www.amazon.com/dp/B00452YFZU/,7,3
Designing Audio Power Amplifiers,Book,http://www.amazon.com/dp/007164024X/,5,3
Lepai LP-2020A+ Tripath TA2020 Class-T Hi-Fi Audio Amplifier with Power Supply,Speakers,http://www.amazon.com/dp/B0049P6OTI/,103,3
Small Signal Audio Design,Book,http://www.amazon.com/dp/0415709733/,2,2
Crystal Fire: The Invention of the Transistor and the Birth of the Information Age (Sloan Technology Series),Book,http://www.amazon.com/dp/0393318516/,2,2
"RioRand 3-01-0076 Buck Converter (Step Down Module Power Supply Output 1.23V-30V (1 Piece), LM2596 DC-DC)",Automotive Parts and Accessories,http://www.amazon.com/dp/B008BHAOQO/,6,2
"Etekcity Wireless Remote Control Electrical Outlet Switch for Household Appliances, Wireless Remote Light Switch, White (Learning Code, 5Rx-2Tx)",Home Improvement,http://www.amazon.com/dp/B00DQELHBS/,36,2
ShowJade (TM) 2PCS LM2596 Buck DC-DC Adjustable Step Down Power Supply Module Converter New,PC Accessory,http://www.amazon.com/dp/B00MEFJXM0/,2,2
Audio Power Amplifier Design,Book,http://www.amazon.com/dp/0240526139/,4,2
Triangle Bulbs 12-24V LED Strip Lights PWM Dimmer Controller For LED Lights or Ribbon lights,Lighting,http://www.amazon.com/dp/B00IYXGEEQ/,4,2
Puuli 38V 6A DC-DC Digital Boost Buck Converter Module Step-up Step-down Module DPS-3806,Speakers,http://www.amazon.com/dp/B0184XAWF2/,2,2
"Iot Relay - Enclosed High-power Power Relay for Arduino, Raspberry Pi, PIC or Wifi, Relay Shield",CE,http://www.amazon.com/dp/B00WV7GMA2/,12,2
"Tekpower TP8268 AC DC Auto/Manual Range Digital Multimeter with NCV Feature, Mastech MS8268 Upgraded",Home Improvement,http://www.amazon.com/dp/B00SAJ8MM6/,3,2
2 Needle Tip Bottle Liquid Flux Dispenser Oil Solvent Applicator Dropper 0.7 Oz,BISS,http://www.amazon.com/dp/B00UG08QDC/,2,2
Code: The Hidden Language of Computer Hardware and Software,Book,http://www.amazon.com/dp/0735611319/,158,2
Uni-T B4Q094 UT210E True RMS AC/DC Current Mini Clamp M W Capacitance Tester,BISS,http://www.amazon.com/dp/B00O1Q2HOQ/,6,2
Sound Reproduction: The Acoustics and Psychoacoustics of Loudspeakers and Rooms (Audio Engineering Society Presents),Book,http://www.amazon.com/dp/0240520092/,8,2
Low Voltage Battery Disconnect (EC-LVD2) - 12v 40A Solid State - by Energy Core Products,PC Accessory,http://www.amazon.com/dp/B00BEA5NPW/,3,2
Make: Electronics (Learning by Discovery),Book,http://www.amazon.com/dp/0596153740/,21,2
"Generic ge New 24V 1A AC/DC Power Adapter Power Supply, Black",CE,http://www.amazon.com/dp/B00J8CG86G/,3,2
Thermaltronics TMT-TC-2 Lead Free Tip Tinner (20g) in 0.8oz Container,Home Improvement,http://www.amazon.com/dp/B00NS4J6BY/,6,2
DROK DC-DC Buck Converter 12V/24V to 5V 5A/25W Step-down Voltage Transformer Volt Regulator Power Supply Inverter Module,BISS,http://www.amazon.com/dp/B00CE75K0W/,3,2
Velleman MK188 1S-60H Pulse/Pause Timer,BISS,http://www.amazon.com/dp/B0090S0W42/,2,2
Titan Tools 11477 Ratcheting Wire Terminal Crimper,Home Improvement,http://www.amazon.com/dp/B0069TRKJ0/,4,2
Donegan OptiVISOR Headband Magnifier,BISS Basic,http://www.amazon.com/dp/B0068OSIIS/,4,2
Weller D550PK 120-volt 260/200-watt Professional Soldering Gun Kit,Home Improvement,http://www.amazon.com/dp/B00002N7S1/,2,2
Quasar Led Lighting System for Optivisors,Musical Instruments,http://www.amazon.com/dp/B0058ECQ46/,2,2
"MG Chemicals Liquid Rosin Flux, Non Corrosive and Non Conductive residue, 125 ml Bottle",BISS Basic,http://www.amazon.com/dp/B005DNR01Q/,3,2
Sabrent 5V 4A 100V-240V to DC Power Adapter Support most Sabrent USB Hub [Black] (PS-5V4A),Personal Computer,http://www.amazon.com/dp/B00MRGKPH8/,3,2
4 Pcs PCB 6A 600V Full Wave Single Phase Bridge Rectifiers RS606,BISS,http://www.amazon.com/dp/B00AUB987K/,2,2
"Mini Timer Time Delay Relay .2 Sec to 1000 Hours. 12V 5A. Power on or Off Delay, Cycling and More",Home Improvement,http://www.amazon.com/dp/B00PD65UGA/,5,2
Make: Electronics: Learning Through Discovery,Book,http://www.amazon.com/dp/1680450263/,12,2
"The ARRL Handbook for Radio Communications, 2015",Book,http://www.amazon.com/dp/1625950195/,4,2
"Akro-Mils 10144 D 20-Inch by 16-Inch by 6-1/2-Inch Hardware and Craft Cabinet, Black",Home Improvement,http://www.amazon.com/dp/B003P2UOCO/,29,2
Small Signal Audio Design,Book,http://www.amazon.com/dp/0240521773/,2,2
"Electronic Sensor Circuits & Projects, Volume III (Engineer's Mini Notebook)",Book,http://www.amazon.com/dp/0945053312/,3,2
Science  and Communication Circuits & Projects,Book,http://www.amazon.com/dp/0945053320/,3,2
Neiko 01924A Ultimate Self-Adjusting Wire and Cable Stripper,Home Improvement,http://www.amazon.com/dp/B000IYTCG6/,6,2
"Donegan DA-5 OptiVisor Headband Magnifier, 2.5x Magnification, 8"" Focal Length",BISS,http://www.amazon.com/dp/B0015IN8J6/,3,2
SainSmart 4-Channel Relay Module,Wireless,http://www.amazon.com/dp/B0057OC5O8/,8,2
Weller WES51 Analog Soldering Station,Home Improvement,http://www.amazon.com/dp/B000BRC2XU/,33,2
"PanaVise Model 201 ""Junior"" Miniature Vise",BISS Basic,http://www.amazon.com/dp/B000B61D22/,10,2
INNOVA 3320 Auto-Ranging Digital Multimeter,Automotive Parts and Accessories,http://www.amazon.com/dp/B000EVYGZA/,18,2
Weller WESD51 Digital Soldering Station,Home Improvement,http://www.amazon.com/dp/B000ARU9PO/,12,2
Kester 24-6337-0010 44 Rosin Core Solder 63/37 .020 1 lb. SPOOL,BISS,http://www.amazon.com/dp/B00068IJWC/,7,2
Weller WLC100 40-Watt Soldering Station,Home Improvement,http://www.amazon.com/dp/B000AS28UC/,78,2
Extech EX330 Autoranging Mini Multimeter with NCV and Type K Temperature,Home Improvement,http://www.amazon.com/dp/B000EX0AE4/,11,2
Elenco RS-500 Resistance Substitution Box,Hobby,http://www.amazon.com/dp/B0002KX76M/,2,2
"Practical Electronics for Inventors, Fourth Edition",Book,http://www.amazon.com/dp/1259587541/,16,2
Roadpro 12V Battery Clip-On and Cigarette Lighter Adapter,Automotive Parts and Accessories,http://www.amazon.com/dp/B00065L2D8/,7,2
"KESTER SOLDER 24-6040-0027 60/40 Stand, 0.031"" Diameter, ""44"", 1.5""",BISS,http://www.amazon.com/dp/B00068IJPO/,16,2
"Aoyue 937+ 45 Watt Programmable Digital Soldering Station-ESD Safe, C/F Switchable, Configurable Iron Holder, Spare Plug-in Heating Element",Home Improvement,http://www.amazon.com/dp/B000I30QBW/,18,2
IOGEAR Wireless 4-Port USB Sharing Station GUWIP204,CE,http://www.amazon.com/dp/B0058DN1Q4/,7,2
Universal UB121000-45978 12v 100AH Deep Cycle AGM Battery 12V 24V 48V(Black),CE,http://www.amazon.com/dp/B00S1RT58C/,9,2
Learning the Art of Electronics: A Hands-On Lab Course,Book,http://www.amazon.com/dp/0521177235/,6,2
"Electronic Formulas, Symbols & Circuits",Book,http://www.amazon.com/dp/0945053304/,2,1
"Digital Design and Computer Architecture, Second Edition",Book,http://www.amazon.com/dp/0123944244/,22,1
SPOOK BOOK  A Strange and Dangerous Look at Forbidden Technology,Book,http://www.amazon.com/dp/094040172X/,1,1
Calculus: A Complete Course,Book,http://www.amazon.com/dp/0321781074/,1,1
Surveillance Audio Amplifiers: The Cult of Electronic Super Hearing,Book,http://www.amazon.com/dp/0940401541/,1,1
Guitar Amplifier Handbook,Book,http://www.amazon.com/dp/087930863X/,9,1
IBM's Early Computers (History of Computing),Book,http://www.amazon.com/dp/0262022257/,2,1
"Switching Power Supplies A - Z, Second Edition",Book,http://www.amazon.com/dp/0123865336/,1,1
Schaums Easy Outline of Basic Electricity Revised (Schaum's Easy Outlines),Book,http://www.amazon.com/dp/0071780688/,1,1
The Home Workshop Spy: Spookware For The Serious Hobbyist,Book,http://www.amazon.com/dp/0873649222/,1,1
Bench-Tested Circuits For Surveillance And Countersurveillance Technicians,Book,http://www.amazon.com/dp/0873649176/,1,1
The Design of Active Crossovers,Book,http://www.amazon.com/dp/0240817389/,2,1
The ARRL Handbook for Radio Amateurs (ARRL Handbook for Radio Communications),Book,http://www.amazon.com/dp/0872591832/,1,1
1998 The Arrl Handbook for Radio Amateurs (75th ed),Book,http://www.amazon.com/dp/0872591786/,1,1
Computer Architecture: A Quantitative Approach,Book,http://www.amazon.com/dp/012383872X/,26,1
Encyclopedia of Electronic Circuits Volume 1,Book,http://www.amazon.com/dp/0830619380/,1,1
"Saunders UHU Tac Removable Adhesive Putty Tabs, 2.1 oz. (99683)",Office Product,http://www.amazon.com/dp/B0000AQODM/,5,1
"Essentials of Electronic Testing for Digital, Memory and Mixed-Signal VLSI Circuits (Frontiers in Electronic Testing)",Book,http://www.amazon.com/dp/0792379918/,1,1
StarTech.com 24x27.5-Inch Desktop Anti-Static Mat M3013 (Beige),CE,http://www.amazon.com/dp/B00009XT3H/,5,1
"3M Peltor Optime 105 Over the Head Earmuff, Ear Protectors, Hearing Protection, NRR 30 dB",Home Improvement,http://www.amazon.com/dp/B00009LI4K/,17,1
