name,category,amazon_link,total_mentions,subreddit_mentions
The Soul of A New Machine,Book,http://www.amazon.com/dp/0316491977/,15,5
PAC SNI-1/3.5 3.5-mm Ground Loop Noise Isolator Works with iPod/Zune/iRiver and Others,Automotive Parts and Accessories,http://www.amazon.com/dp/B001EAQTRI/,66,4
Kelly: More Than My Share of It All,Book,http://www.amazon.com/dp/0874744911/,7,3
Internal Combustion Engine Fundamentals,Book,http://www.amazon.com/dp/1259002071/,5,3
Marks' Standard Handbook for Mechanical Engineers 11th Edition,Book,http://www.amazon.com/dp/0071428674/,7,2
Skunk Works: A Personal Memoir of My Years at Lockheed,Book,http://www.amazon.com/dp/0316743003/,50,2
Inviting Disaster: Lessons From the Edge of Technology,Book,http://www.amazon.com/dp/0066620821/,5,2
rOtring 600 0.5mm Black Barrel Mechanical Pencil (1904443),Office Product,http://www.amazon.com/dp/B00AZWYUA4/,14,2
GEOTOL Pocket Guide,Book,http://www.amazon.com/dp/0872638669/,2,2
The Elements of Computing Systems: Building a Modern Computer from First Principles,Book,http://www.amazon.com/dp/0262640686/,34,2
"1800 Mechanical Movements, Devices and Appliances (Dover Science Books)",Book,http://www.amazon.com/dp/0486457435/,3,2
Manufacturing Processes for Design Professionals,Book,http://www.amazon.com/dp/0500513759/,6,2
"uni-ball 207 Retractable Gel Pens, Ultra Micro Point (0.38mm), Black, 12 Count",BISS Basic,http://www.amazon.com/dp/B005HNZ5SW/,3,2
"Roark's Formulas for Stress and Strain, 8th Edition",Book,http://www.amazon.com/dp/0071742476/,6,2
"Vivere Double Hammock with Space-Saving Steel Stand, Tropical",Lawn & Patio,http://www.amazon.com/dp/B004YJCP7O/,21,2
"OurWarm Set of 2 Car Safety Hammer, Window Breaker, Emergency Escape Tool, Multi-Purpose Life-saving Emergency Hammer With Seatbelt Cutter",Home Improvement,http://www.amazon.com/dp/B00UOJIT8C/,2,2
"Machinery's Handbook, 29th",Book,http://www.amazon.com/dp/083112900X/,18,2
"iGaging ABSOLUTE ORIGIN 0-6"" Digital Electronic Caliper - IP54 Protection / Extreme Accuracy",Home Improvement,http://www.amazon.com/dp/B00INL0BTS/,18,2
How Would You Move Mount Fuji?: Microsoft's Cult of the Puzzle -- How the World's Smartest Companies Select the Most Creative Thinkers,Book,http://www.amazon.com/dp/0316778494/,6,2
12V 100Ah AGM Sealed Lead Acid Battery UB121000 Group 27,Automotive Parts and Accessories,http://www.amazon.com/dp/B00BMUDOLE/,2,2
Structures: Or Why Things Don't Fall Down,Book,http://www.amazon.com/dp/0306812835/,8,2
"Materials Selection in Mechanical Design, Fourth Edition",Book,http://www.amazon.com/dp/1856176630/,2,2
Unwritten Laws of Engineering: Revised and Updated Edition,Book,http://www.amazon.com/dp/0791801624/,7,2
Modern Control Engineering (5th Edition),Book,http://www.amazon.com/dp/0136156738/,6,2
Shigley's Mechanical Engineering Design (McGraw-Hill Series in Mechanical Engineering),Book,http://www.amazon.com/dp/0073398209/,17,2
Rocket Propulsion Elements,Book,http://www.amazon.com/dp/0470080248/,8,2
Pocket Ref 4th Edition,Book,http://www.amazon.com/dp/1885071620/,28,2
"FE Review Manual: Rapid Preparation for the Fundamentals of Engineering Exam, 3rd Ed",Book,http://www.amazon.com/dp/1591263336/,13,2
"Div, Grad, Curl, and All That: An Informal Text on Vector Calculus (Fourth Edition)",Book,http://www.amazon.com/dp/0393925161/,18,2
Ingenious Mechanisms for Designers and Inventors (4-Volume Set) (Ingenious Mechanisms for Designers & Inventors),Book,http://www.amazon.com/dp/0831110848/,4,2
Basic Machines and How They Work,Book,http://www.amazon.com/dp/0486217094/,3,2
How Round Is Your Circle?: Where Engineering and Mathematics Meet,Book,http://www.amazon.com/dp/0691149925/,5,2
"An Introduction to the Design and Behavior of Bolted Joints (Mechanical Engineering, Volume 97)",Book,http://www.amazon.com/dp/0824792971/,2,2
"Build Your Own Electric Vehicle, Third Edition",Book,http://www.amazon.com/dp/0071770569/,2,2
Finite Element Procedures,Book,http://www.amazon.com/dp/8120310756/,2,2
Inventing Accuracy: A Historical Sociology of Nuclear Missile Guidance (Inside Technology),Book,http://www.amazon.com/dp/0262631474/,4,2
K-TOR Pocket Socket Hand Crank Generator Portable Power Supply 10 Watts 120 Volts Made in the USA,Speakers,http://www.amazon.com/dp/B00658Z3UI/,6,2
NOCO D420S Battery Post and Terminal Cleaner,Automotive Parts and Accessories,http://www.amazon.com/dp/B00DTLOKQ2/,2,2
Engineering Design,Book,http://www.amazon.com/dp/0073398144/,1,1
High Speed Digital Design: A Handbook of Black Magic,Book,http://www.amazon.com/dp/0133957241/,14,1
Fitzgerald & Kingsley's Electric Machinery,Book,http://www.amazon.com/dp/0073380466/,2,1
Mechanics of Materials,Book,http://www.amazon.com/dp/0073380288/,2,1
Introduction to Flight,Book,http://www.amazon.com/dp/0073380245/,10,1
Schaum's Easy Outline of Electric Circuits,Book,http://www.amazon.com/dp/0071422412/,1,1
"Optical Tooling, for Precise Manufacture and Alignment",Book,http://www.amazon.com/dp/0070348758/,1,1
Design of Machinery: An Introduction to the Synthesis and Analysis of Mechanisms and Machines,Book,http://www.amazon.com/dp/0072864478/,2,1
"Practical Electronics for Inventors, Third Edition",Book,http://www.amazon.com/dp/0071771336/,35,1
System Dynamics,Book,http://www.amazon.com/dp/0071267794/,1,1
Water Supply and Pollution Control (8th Edition),Book,http://www.amazon.com/dp/0132337177/,1,1
The New Way Things Work,Book,http://www.amazon.com/dp/0395938473/,12,1
Introduction to VBA for Excel (2nd Edition),Book,http://www.amazon.com/dp/013239667X/,1,1
Engineering Mechanics: Dynamics (13th Edition),Book,http://www.amazon.com/dp/0132911272/,3,1
Mechanics of Materials (9th Edition),Book,http://www.amazon.com/dp/0133254429/,1,1
Machine Design (5th Edition),Book,http://www.amazon.com/dp/013335671X/,1,1
"Fundamentals of Statistical Signal Processing, Volume I: Estimation Theory  (v. 1)",Book,http://www.amazon.com/dp/0133457117/,1,1
MATLAB for Engineers (4th Edition),Book,http://www.amazon.com/dp/0133485978/,1,1
Handbook of Transducers,Book,http://www.amazon.com/dp/013382599X/,1,1
Engineering Mechanics: Statics & Dynamics (14th Edition),Book,http://www.amazon.com/dp/0133915425/,1,1
Contemporary Polymer Chemistry,Book,http://www.amazon.com/dp/0131702580/,1,1
"Engineering Mechanics: Statics Plus MasteringEngineering with Pearson eText -- Access Card Package (14th Edition) (Hibbeler, The Engineering Mechanics: Statics & Dynamics Series, 14th Edition)",Book,http://www.amazon.com/dp/0134160681/,1,1
Artificial Intelligence: A Modern Approach (3rd Edition),Book,http://www.amazon.com/dp/0136042597/,36,1
Analog Signals and Systems,Book,http://www.amazon.com/dp/013143506X/,3,1
Why Buildings Fall Down: How Structures Fail,Book,http://www.amazon.com/dp/039331152X/,8,1
Mechanical Behavior of Materials (4th Edition),Book,http://www.amazon.com/dp/0131395068/,1,1
Design of Wood Structures-ASD/LRFD,Book,http://www.amazon.com/dp/0071745602/,1,1
Roark's Formulas for Stress and Strain,Book,http://www.amazon.com/dp/007072542X/,3,1
"The Intel Trinity: How Robert Noyce, Gordon Moore, and Andy Grove Built the World's Most Important Company",Book,http://www.amazon.com/dp/0062226762/,1,1
Power Programming with VBA/Excel,Book,http://www.amazon.com/dp/0130473774/,1,1
Getting What You Came For: The Smart Student's Guide to Earning an M.A. or a Ph.D.,Book,http://www.amazon.com/dp/0374524777/,8,1
Fiber Optic Communications (5th Edition),Book,http://www.amazon.com/dp/0130085103/,1,1
Matlab: A Practical Introduction to Programming and Problem Solving,Book,http://www.amazon.com/dp/0124058760/,3,1
Subsea Engineering Handbook,Book,http://www.amazon.com/dp/0123978041/,1,1
"Making Things Move DIY Mechanisms for Inventors, Hobbyists, and Artists",Book,http://www.amazon.com/dp/0071741674/,2,1
History of Strength of Materials,Book,http://www.amazon.com/dp/0070647259/,1,1
"Electrical Engineering 101, Third Edition: Everything You Should Have Learned in School...but Probably Didn't",Book,http://www.amazon.com/dp/0123860016/,2,1
Computer Architecture: A Quantitative Approach,Book,http://www.amazon.com/dp/012383872X/,26,1
"Mechanisms and Mechanical Devices Sourcebook, 5th Edition",Book,http://www.amazon.com/dp/0071704426/,6,1
"Are You Smart Enough to Work at Google?: Trick Questions, Zen-like Riddles, Insanely Difficult Puzzles, and Other Devious Interviewing Techniques You ... Know to Get a Job Anywhere in the New Economy",Book,http://www.amazon.com/dp/0316099988/,1,1
"Gas Turbine Engineering Handbook, Fourth Edition",Book,http://www.amazon.com/dp/0123838428/,1,1
A Measure of All Things: The Story of Man and Measurement,Book,http://www.amazon.com/dp/0312370261/,1,1
The Existential Pleasures of Engineering (Thomas Dunne Book),Book,http://www.amazon.com/dp/0312141041/,3,1
"Computer Organization and Design, Fourth Edition: The Hardware/Software Interface (The Morgan Kaufmann Series in Computer Architecture and Design)",Book,http://www.amazon.com/dp/0123747503/,8,1
Precision Engineering,Book,http://www.amazon.com/dp/0071548270/,1,1
Skunk Works: A Personal Memoir of My Years at Lockheed,Book,http://www.amazon.com/dp/0316743305/,2,1
Mechanical Engineering Design (McGraw-Hill Mechanical Engineering),Book,http://www.amazon.com/dp/0070568995/,1,1
Boyd: The Fighter Pilot Who Changed the Art of War,Book,http://www.amazon.com/dp/0316796883/,8,1
Elements of Programming,Book,http://www.amazon.com/dp/032163537X/,4,1
"The Cross-Time Engineer (Adventures of Conrad Stargard, Book 1)",Book,http://www.amazon.com/dp/0345327624/,12,1
Ringworld (A Del Rey book),Book,http://www.amazon.com/dp/0345333926/,6,1
Cosmos,Book,http://www.amazon.com/dp/0345539435/,5,1
The Cartoon Guide to Statistics,Book,http://www.amazon.com/dp/0062731025/,5,1
Angle of Attack: Harrison Storms and the Race to the Moon,Book,http://www.amazon.com/dp/039301892X/,1,1
The Art of Strategy: A Game Theorist's Guide to Success in Business and Life,Book,http://www.amazon.com/dp/0393062430/,1,1
Why Buildings Stand Up: The Strength of Architecture,Book,http://www.amazon.com/dp/0393306763/,8,1
Dick's Encyclopedia of Practical Receipts and Processes or How They Did it in the 1870's,Book,http://www.amazon.com/dp/030810157X/,1,1
Traffic: Why We Drive the Way We Do (and What It Says About Us),Book,http://www.amazon.com/dp/0307277194/,32,1
The Way Things Work,Book,http://www.amazon.com/dp/0395428572/,4,1
Lost Moon: The Perilous Voyage of Apollo 13,Book,http://www.amazon.com/dp/0395670292/,3,1
Tools for the Job: A History of Machine Tools to 1950,Book,http://www.amazon.com/dp/0112904335/,1,1
Studies in the History of Machine Tools,Book,http://www.amazon.com/dp/0262730332/,1,1
