name,category,amazon_link,total_mentions,subreddit_mentions
"Delusions of Gender: How Our Minds, Society, and Neurosexism Create Difference",Book,http://www.amazon.com/dp/0393340244/,27,4
What Do Women Want?: Adventures in the Science of Female Desire,Book,http://www.amazon.com/dp/0061906085/,4,1
I Am Not a Slut: Slut-Shaming in the Age of the Internet,Book,http://www.amazon.com/dp/006228259X/,1,1
"The Chalice and the Blade: Our History, Our Future",Book,http://www.amazon.com/dp/0062502891/,2,1
Good Night Stories for Rebel Girls,Book,http://www.amazon.com/dp/014198600X/,5,1
"Sex on Six Legs: Lessons on Life, Love, and Language from the Insect World",Book,http://www.amazon.com/dp/015101373X/,1,1
Psychology of Gender: Fourth Edition,Book,http://www.amazon.com/dp/0205050182/,1,1
Men's Lives (9th Edition),Book,http://www.amazon.com/dp/0205096417/,2,1
Gender in Cross-Cultural Perspective,Book,http://www.amazon.com/dp/0205247288/,1,1
"Male Rape is a Feminist Issue: Feminism, Governmentality and Male Rape (Critical Criminological Perspectives)",Book,http://www.amazon.com/dp/0230223966/,3,1
Backlash: The Undeclared War Against American Women,Book,http://www.amazon.com/dp/0307345424/,6,1
"At the Dark End of the Street: Black Women, Rape, and Resistance--A New History of the Civil Rights Movement from Rosa Parks to the Rise of Black Power",Book,http://www.amazon.com/dp/0307389243/,8,1
The Frailty Myth: Redefining the Physical Potential of Women and Girls,Book,http://www.amazon.com/dp/0375758151/,5,1
"Guns, Germs, and Steel: The Fates of Human Societies",Book,http://www.amazon.com/dp/0393317552/,51,1
"Gender: Ideas, Interactions, Institutions",Book,http://www.amazon.com/dp/0393931072/,2,1
Wreck This Journal (Paper bag) Expanded Ed.,Book,http://www.amazon.com/dp/0399162712/,2,1
We Real Cool: Black Men and Masculinity,Book,http://www.amazon.com/dp/0415969271/,1,1
Brown Girl in the Ring,Book,http://www.amazon.com/dp/0446674338/,1,1
Parable of the Sower (Earthseed),Book,http://www.amazon.com/dp/0446675504/,7,1
"Gay New York: Gender, Urban Culture, and the Making of the Gay Male World, 1890-1940",Book,http://www.amazon.com/dp/0465026214/,11,1
Why Are All the Black Kids Sitting Together in the Cafeteria: And Other Conversations About Race,Book,http://www.amazon.com/dp/0465083617/,12,1
The Sociology of Gender: An Introduction to Theory and Research,Book,http://www.amazon.com/dp/0470655682/,1,1
Plain City (Point Signature),Book,http://www.amazon.com/dp/0590473654/,1,1
"A Goal Diggers Guide (How to Get What You Want, Without Giving It Up)",Book,http://www.amazon.com/dp/0615248241/,1,1
Girls Think of Everything: Stories of Ingenious Inventions by Women,Book,http://www.amazon.com/dp/0618195637/,2,1
The Media and the Models of Masculinity,Book,http://www.amazon.com/dp/0739166263/,1,1
"The Will to Change: Men, Masculinity, and Love",Book,http://www.amazon.com/dp/0743456084/,6,1
Gender (Polity Short Introductions),Book,http://www.amazon.com/dp/0745645682/,1,1
Who Fears Death,Book,http://www.amazon.com/dp/0756406692/,3,1
The Gold Digger's Guide: How To Marry The Man And The Money,Book,http://www.amazon.com/dp/0758206607/,1,1
"Thinking Kink: The Collision of BDSM, Feminism and Popular Culture",Book,http://www.amazon.com/dp/0786498633/,1,1
We'll Call You If We Need You: Experiences of Women Working Construction (Ilr Press Books),Book,http://www.amazon.com/dp/080148605X/,1,1
From Front Porch to Back Seat: Courtship in Twentieth-Century America,Book,http://www.amazon.com/dp/0801839351/,1,1
"Male Fantasies, Vol. 1: Women, Floods, Bodies, History (Theory and History of Literature, Vol. 22)",Book,http://www.amazon.com/dp/0816614490/,1,1
"Rad American Women A-Z: Rebels, Trailblazers, and Visionaries who Shaped Our History . . . and Our Future! (City Lights/Sister Spit)",Book,http://www.amazon.com/dp/0872866831/,2,1
Alone in a Crowd: Women in the Trades Tell Their Stories (Women in the Political Economy),Book,http://www.amazon.com/dp/0877223785/,1,1
Feminism Is for Everybody: Passionate Politics,Book,http://www.amazon.com/dp/0896086283/,4,1
Out of My Mind,Book,http://www.amazon.com/dp/1416971718/,2,1
A Woman Among Warlords: The Extraordinary Story of an Afghan Who Dared to Raise Her Voice,Book,http://www.amazon.com/dp/1439109478/,1,1
Sexual Outsiders: Understanding BDSM Sexualities and Communities,Book,http://www.amazon.com/dp/1442217359/,1,1
Sex at Dusk: Lifting the Shiny Wrapping from Sex at Dawn,Book,http://www.amazon.com/dp/1477697284/,6,1
The New Jim Crow: Mass Incarceration in the Age of Colorblindness,Book,http://www.amazon.com/dp/1501260235/,7,1
Bi: Notes for a Bisexual Revolution,Book,http://www.amazon.com/dp/1580054749/,12,1
Words with Wings,Book,http://www.amazon.com/dp/1590789857/,1,1
Women in Science: 50 Fearless Pioneers Who Changed the World,Book,http://www.amazon.com/dp/1607749769/,2,1
Men Explain Things to Me,Book,http://www.amazon.com/dp/1608463869/,1,1
"Mothers, Monsters, Whores: Women's Violence in Global Politics",Book,http://www.amazon.com/dp/1842778668/,1,1
Living Dolls: The Return of Sexism,Book,http://www.amazon.com/dp/1844087093/,1,1
"I, Rigoberta Menchu: An Indian Woman in Guatemala",Book,http://www.amazon.com/dp/1844674185/,1,1
A Brief History of Misogyny: The World's Oldest Prejudice (Brief Histories),Book,http://www.amazon.com/dp/1845293711/,2,1
"Victims, Perpetrators or Actors: Gender, Armed Conflict and Political Violence",Book,http://www.amazon.com/dp/1856498980/,1,1
Mindscape,Book,http://www.amazon.com/dp/1933500034/,1,1
"REESE'S Peanut Butter Cup, Milk Chocolate Covered Peanut Butter Cup Candy, 1.5 Ounce Package (Pack of 36) (Halloween Candy)",Grocery,http://www.amazon.com/dp/B000IXUK8G/,3,1
"Neumann U 87 Ai Switchable Studio Microphone, 3 Directional - Nickel",Musical Instruments,http://www.amazon.com/dp/B0016ZSIP2/,2,1
"Delusions of Gender: How Our Minds, Society, and Neurosexism Create Difference",eBooks,http://www.amazon.com/dp/B003YJEXL6/,1,1
"BIC Cristal For Her Ball Pen, 1.0mm, Black, 16ct (MSLP16-Blk)",Office Product,http://www.amazon.com/dp/B004F9QBE6/,22,1
Justin's Organic Milk Chocolate Peanut Butter Cups 1.4oz (Pack of 12),Grocery,http://www.amazon.com/dp/B004S03SZ2/,1,1
"BIC For Her Retractable Ball Pen, Medium Point, 1.0 mm, Black Ink, 2 Count (FHAP21-Black)",Office Product,http://www.amazon.com/dp/B005PFESMG/,7,1
#GIRLBOSS,eBooks,http://www.amazon.com/dp/B00G3L13UQ/,1,1
Mate: Become the Man Women Want,eBooks,http://www.amazon.com/dp/B00RTY0FKK/,1,1
Mating in Captivity: Unlocking Erotic Intelligence,Book,http://www.amazon.com/dp/0060753641/,13,1
HOW TO BE A GOLD DIGGER: A Step-by-Step Guide On How To Be A Gold Digger And Prosper In Life,eBooks,http://www.amazon.com/dp/B00YLBK0SG/,1,1
