name,category,amazon_link,total_mentions,subreddit_mentions
Introduction to Folklore: Traditional Studies in Europe and Elsewhere,eBooks,http://www.amazon.com/dp/B00N65B0BY/,70,49
Introduction to Folklore: Traditional Studies in Europe and Elsewhere,Book,http://www.amazon.com/dp/1521423261/,11,10
Virginia City: Secrets of a Western Past (Historical Archaeology of the American West),Book,http://www.amazon.com/dp/0803238487/,8,8
The Birth of Christianity : Discovering What Happened in the Years Immediately After the Execution of Jesus,Book,http://www.amazon.com/dp/0060616601/,8,8
Lost Christianities: The Battles for Scripture and the Faiths We Never Knew,Book,http://www.amazon.com/dp/0195182499/,18,7
The Historical Jesus: The Life of a Mediterranean Jewish Peasant,Book,http://www.amazon.com/dp/0060616296/,12,7
Annals of Pornographie: How Porn Became Bad,eBooks,http://www.amazon.com/dp/B01CMU51V8/,9,7
How Jesus Became God: The Exaltation of a Jewish Preacher from Galilee,Book,http://www.amazon.com/dp/0061778192/,14,6
The Myth of Persecution: How Early Christians Invented a Story of Martyrdom,eBooks,http://www.amazon.com/dp/B0089LOOF4/,10,6
"Jesus, Interrupted: Revealing the Hidden Contradictions in the Bible (And Why We Don't Know About Them)",Book,http://www.amazon.com/dp/0061173940/,18,6
Washington: A Life,Book,http://www.amazon.com/dp/0143119966/,10,5
"The Rise of Christianity: How the Obscure, Marginal Jesus Movement Became the Dominant Religious Force in the Western World in a Few Centuries",Book,http://www.amazon.com/dp/0060677015/,14,5
Jesus: Apocalyptic Prophet of the New Millennium,Book,http://www.amazon.com/dp/019512474X/,19,5
Alexander Hamilton,Book,http://www.amazon.com/dp/0143034758/,15,5
The Cause of All Nations: An International History of the American Civil War,Book,http://www.amazon.com/dp/0465029671/,4,4
"The Marne, 1914: The Opening of World War I and the Battle That Changed the World",Book,http://www.amazon.com/dp/0812978293/,5,4
The Shoemaker and the Tea Party: Memory and the American Revolution,Book,http://www.amazon.com/dp/0807054054/,5,4
"Trolls: From Scandinavia to Dam Dolls, Tolkien, and Harry Potter",eBooks,http://www.amazon.com/dp/B00JRGYS38/,6,4
The American Way of War: A History of United States Military Strategy and Policy,Book,http://www.amazon.com/dp/025328029X/,4,4
The Inheritance of Rome: Illuminating the Dark Ages 400-1000 (The Penguin History of Europe),Book,http://www.amazon.com/dp/0143117424/,5,4
Slavery by Another Name: The Re-Enslavement of Black Americans from the Civil War to World War II,Book,http://www.amazon.com/dp/0385722702/,19,3
The Gold Rush Letters of E. Allen Grosh and Hosea B. Grosh (Shepperson Series in Nevada History),Book,http://www.amazon.com/dp/0874178851/,3,3
Did Jesus Exist?: The Historical Argument for Jesus of Nazareth,Book,http://www.amazon.com/dp/0062206443/,22,3
The Bible Unearthed: Archaeology's New Vision of Ancient Israel and the Origin of Its Sacred Texts,Book,http://www.amazon.com/dp/0684869136/,42,3
Comstock Women: The Making Of A Mining Community (Shepperson Series in History Humanities),Book,http://www.amazon.com/dp/0874172977/,3,3
The Hard Hand of War,Book,http://www.amazon.com/dp/0521599415/,3,3
"Ancient Persia: A Concise History of the Achaemenid Empire, 550-330 BCE",Book,http://www.amazon.com/dp/0521253691/,6,3
Who Wrote the Bible?,Book,http://www.amazon.com/dp/0060630353/,53,3
Shadows in the Desert: Ancient Persia at War (General Military),Book,http://www.amazon.com/dp/1846031087/,9,3
The Wages of Destruction: The Making and Breaking of the Nazi Economy,Book,http://www.amazon.com/dp/0143113208/,30,3
James Madison: A Life Reconsidered,Book,http://www.amazon.com/dp/0143127039/,3,3
Shaft Tombs and Figures in West Mexican Society: A Reassessment,Book,http://www.amazon.com/dp/0981979998/,7,3
"Milestones in the History of English in America (Publication of the American Dialect Society, No. 86)",Book,http://www.amazon.com/dp/082236526X/,3,3
The Historical Figure of Jesus,eBooks,http://www.amazon.com/dp/B002RI9L7G/,5,3
Jesus: A Revolutionary Biography,Book,http://www.amazon.com/dp/006180035X/,6,3
Shays' Rebellion: The Making of an Agrarian Insurrection,Book,http://www.amazon.com/dp/0870234196/,2,2
Body and Soul: The Black Panther Party and the Fight against Medical Discrimination,Book,http://www.amazon.com/dp/0816676496/,2,2
Peig: The Autobiography of Peig Sayers of the Great Blasket Island (Irish Studies),Book,http://www.amazon.com/dp/0815602588/,2,2
The Balkans: A Short History (Modern Library Chronicles),Book,http://www.amazon.com/dp/081296621X/,2,2
Shays's Rebellion: The American Revolution's Final Battle,Book,http://www.amazon.com/dp/0812218701/,3,2
History of the Byzantine State,Book,http://www.amazon.com/dp/0813511984/,3,2
The Roar and the Silence: A History of Virginia City and the Comstock Lode (Shepperson Series in History Humanities),Book,http://www.amazon.com/dp/0874173205/,2,2
Popular Religion in Late Saxon England: Elf Charms in Context,Book,http://www.amazon.com/dp/0807845655/,3,2
Waiting 'Til the Midnight Hour: A Narrative History of Black Power in America,Book,http://www.amazon.com/dp/0805083359/,2,2
Omaha Beach: A Flawed Victory,Book,http://www.amazon.com/dp/0807854697/,2,2
Team of Rivals: The Political Genius of Abraham Lincoln,Book,http://www.amazon.com/dp/0743270754/,8,2
Crucifixion (Facets),Book,http://www.amazon.com/dp/080061268X/,2,2
John Adams,Book,http://www.amazon.com/dp/0743223136/,8,2
1177 B.C.: The Year Civilization Collapsed (Turning Points in Ancient History),Book,http://www.amazon.com/dp/0691140898/,8,2
The Nanjing Massacre: A Japanese Journalist Confronts Japan's National Shame (Studies of the Pacific Basin Institute),Book,http://www.amazon.com/dp/0765603349/,2,2
Misquoting Jesus: The Story Behind Who Changed the Bible and Why,Book,http://www.amazon.com/dp/0060859512/,54,2
Art of Falconry; Being the De Arte Venandi cum Avibus of Frederick II of Hohenstaufen,Book,http://www.amazon.com/dp/0804703744/,2,2
Custer Died for Your Sins: An Indian Manifesto,Book,http://www.amazon.com/dp/0806121297/,5,2
Empires of the Silk Road: A History of Central Eurasia from the Bronze Age to the Present,Book,http://www.amazon.com/dp/0691150346/,2,2
The Historical David: The Real Life of an Invented Hero,Book,http://www.amazon.com/dp/0062188372/,2,2
"British Campaign Furniture: Elegance Under Canvas, 1740-1914",Book,http://www.amazon.com/dp/0810957116/,2,2
1776,Book,http://www.amazon.com/dp/0743226720/,10,2
"Changes in the Land: Indians, Colonists, and the Ecology of New England",Book,http://www.amazon.com/dp/0809016346/,7,2
A Bridge Too Far: The Classic History of the Greatest Battle of World War II,Book,http://www.amazon.com/dp/0684803305/,4,2
The Sagas of Icelanders: (Penguin Classics Deluxe Edition),Book,http://www.amazon.com/dp/0141000031/,15,2
Language of the Third Reich: LTI: Lingua Tertii Imperii,Book,http://www.amazon.com/dp/0826491308/,4,2
Women in the Viking Age,Book,http://www.amazon.com/dp/0851153607/,2,2
Race and Reunion: The Civil War in American Memory,Book,http://www.amazon.com/dp/0674008197/,12,2
Black against Empire: The History and Politics of the Black Panther Party,Book,http://www.amazon.com/dp/0520282221/,4,2
The Economy of Prostitution in the Roman World: A Study of Social History and the Brothel,Book,http://www.amazon.com/dp/0472113623/,2,2
The Complete Roman Army (The Complete Series),Book,http://www.amazon.com/dp/0500288992/,2,2
The End of the Bronze Age,Book,http://www.amazon.com/dp/0691025916/,2,2
Denying the Holocaust: The Growing Assault on Truth and Memory,Book,http://www.amazon.com/dp/0452272742/,2,2
Embracing Defeat: Japan in the Wake of World War II,Book,http://www.amazon.com/dp/0393320278/,5,2
The Bloody Shirt: Terror After the Civil War,Book,http://www.amazon.com/dp/0452290163/,3,2
The Great Transformation: The Beginning of Our Religious Traditions,Book,http://www.amazon.com/dp/0385721242/,2,2
"A History of God: The 4,000-Year Quest of Judaism, Christianity and Islam",Book,http://www.amazon.com/dp/0345384563/,122,2
We Were Soldiers Once...and Young: Ia Drang - The Battle That Changed the War in Vietnam,Book,http://www.amazon.com/dp/0345472640/,4,2
The Half Has Never Been Told: Slavery and the Making of American Capitalism,Book,http://www.amazon.com/dp/046500296X/,20,2
Makers of Modern Strategy from Machiavelli to the Nuclear Age,Book,http://www.amazon.com/dp/0691027641/,3,2
Religion and the Decline of Magic: Studies in Popular Beliefs in Sixteenth and Seventeenth-Century England (Penguin History),Book,http://www.amazon.com/dp/0140137440/,3,2
"Treacherous Alliance: The Secret Dealings of Israel, Iran, and the United States",Book,http://www.amazon.com/dp/0300143117/,12,2
The Christians as the Romans Saw Them,Book,http://www.amazon.com/dp/0300098391/,4,2
"Hubbub: Filth, Noise, and Stench in England, 1600-1770",Book,http://www.amazon.com/dp/0300137567/,3,2
Achtung - Panzer! (Cassell Military Classics),Book,http://www.amazon.com/dp/0304352853/,4,2
The Dirt on Clean: An Unsanitized History,Book,http://www.amazon.com/dp/0374531374/,2,2
"The Arc of a Covenant: The United States, Israel, and the Fate of the Jewish People",Book,http://www.amazon.com/dp/0375414045/,2,2
Holy Sh*t: A Brief History of Swearing,Book,http://www.amazon.com/dp/0199742677/,4,2
Into the American Woods: Negotiations on the Pennsylvania Frontier,Book,http://www.amazon.com/dp/0393319768/,2,2
The World of Late Antiquity: AD 150-750 (Library of World Civilization),Book,http://www.amazon.com/dp/0393958035/,3,2
Mythology: Timeless Tales of Gods and Heroes,Book,http://www.amazon.com/dp/0446574759/,15,2
The Qur'an (Oxford World's Classics),Book,http://www.amazon.com/dp/0199535957/,54,2
"The Sumerians: Their History, Culture, and Character (Phoenix Books)",Book,http://www.amazon.com/dp/0226452387/,5,2
"The Canon of the New Testament: Its Origin, Development, and Significance",Book,http://www.amazon.com/dp/0198269544/,7,2
"The Middle Ground: Indians, Empires, and Republics in the Great Lakes Region, 1650-1815 (Studies in North American Indian History)",Book,http://www.amazon.com/dp/0521183448/,2,2
The Historical Atlas of the Congresses of the Confederate States of America 1861-1865,Book,http://www.amazon.com/dp/0133891151/,2,2
Worlds of Arthur: Facts and Fictions of the Dark Ages,Book,http://www.amazon.com/dp/0198700849/,2,2
How Jesus Became God: The Exaltation of a Jewish Preacher from Galilee,Book,http://www.amazon.com/dp/0061778184/,19,2
A History of Venice,Book,http://www.amazon.com/dp/0679721975/,2,2
"This Gulf of Fire: The Destruction of Lisbon, or Apocalypse in the Age of Science and Reason",Book,http://www.amazon.com/dp/0307267628/,2,2
Presidential Campaigns: From George Washington to George W. Bush,Book,http://www.amazon.com/dp/0195167163/,4,2
"Norse Mythology: A Guide to Gods, Heroes, Rituals, and Beliefs",Book,http://www.amazon.com/dp/0195153820/,4,2
Afghanistan: A Cultural and Political History (Princeton Studies in Muslim Politics),Book,http://www.amazon.com/dp/0691154414/,8,2
Battle Cry of Freedom: The Civil War Era,Book,http://www.amazon.com/dp/019516895X/,11,2
The Republic of Pirates: Being the True and Surprising Story of the Caribbean Pirates and the Man Who Brought Them Down,Book,http://www.amazon.com/dp/015603462X/,9,2
