name,category,amazon_link,total_mentions,subreddit_mentions
In the Dust of This Planet: Horror of Philosophy (Volume 1),Book,http://www.amazon.com/dp/184694676X/,12,2
"The English Bible, King James Version: The Old Testament (Vol. 1)  (Norton Critical Editions)",Book,http://www.amazon.com/dp/0393927458/,2,2
The Cambridge Companion to Science Fiction (Cambridge Companions to Literature),Book,http://www.amazon.com/dp/0521016576/,3,2
Literary Theory: An Introduction,Book,http://www.amazon.com/dp/0816654476/,3,2
"The English Bible, King James Version: The New Testament and The Apocrypha (Vol. 2)  (Norton Critical Editions)",Book,http://www.amazon.com/dp/039397507X/,2,2
Modernism: A Very Short Introduction,Book,http://www.amazon.com/dp/0192804413/,2,2
The Literary Guide to the Bible,Book,http://www.amazon.com/dp/0674875311/,2,2
Lectures on Literature,Book,http://www.amazon.com/dp/0156027755/,3,2
Fun Home: A Family Tragicomic,Book,http://www.amazon.com/dp/0618871713/,8,2
Shakespeare's Words: A Glossary and Language Companion,Book,http://www.amazon.com/dp/0140291172/,1,1
Le Morte D'Arthur: Volume 1 (The Penguin English Library),Book,http://www.amazon.com/dp/0140430431/,1,1
The Heptameron (Penguin Classics),Book,http://www.amazon.com/dp/014044355X/,1,1
The Manuscript Found in Saragossa,Book,http://www.amazon.com/dp/0140445803/,1,1
De Nerval: Selected Writings (Penguin Classics),Book,http://www.amazon.com/dp/014044601X/,1,1
Michel de Montaigne - The Complete Essays (Penguin Classics),Book,http://www.amazon.com/dp/0140446044/,1,1
Strange Tales from a Chinese Studio (Penguin Classics),Book,http://www.amazon.com/dp/0140447407/,2,1
The Poetics of Space,Book,http://www.amazon.com/dp/0143107526/,1,1
Les Miserables: (Penguin Classics Deluxe Edition),Book,http://www.amazon.com/dp/0143107569/,1,1
The Tale of Tales (Penguin Classics),Book,http://www.amazon.com/dp/0143129147/,1,1
Critical Theory Since Plato,Book,http://www.amazon.com/dp/0155055046/,1,1
A Writer's Diary,Book,http://www.amazon.com/dp/0156027917/,1,1
"The Poetry of Slavery: An Anglo-American Anthology, 1764-1865",Book,http://www.amazon.com/dp/0198187092/,1,1
The Bible: Authorized King James Version (Oxford World's Classics),Book,http://www.amazon.com/dp/0199535949/,7,1
Le Morte Darthur: The Winchester Manuscript (Oxford World's Classics),Book,http://www.amazon.com/dp/0199537348/,1,1
Greek Lyric Poetry (Oxford World's Classics),Book,http://www.amazon.com/dp/019954039X/,1,1
Murder Most Foul: Hamlet Through the Ages,Book,http://www.amazon.com/dp/0199599106/,1,1
The Oxford Dictionary of English Grammar (Oxford Quick Reference),Book,http://www.amazon.com/dp/0199658234/,1,1
"A History of Renaissance Rhetoric, 1380-1620 (Oxford-Warburg Studies)",Book,http://www.amazon.com/dp/0199679991/,1,1
How Literature Works: 50 Key Concepts,Book,http://www.amazon.com/dp/0199794200/,2,1
A Writer's Grammar,Book,http://www.amazon.com/dp/0205318045/,1,1
Rhetoric in the European Tradition,Book,http://www.amazon.com/dp/0226114899/,1,1
Memoirs of the Life of Henriette-Sylvie de Moliere: A Novel (The Other Voice in Early Modern Europe),Book,http://www.amazon.com/dp/0226144208/,1,1
Professing Literature: An Institutional History,Book,http://www.amazon.com/dp/0226306046/,1,1
My Mother Was a Computer: Digital Subjects and Literary Texts,Book,http://www.amazon.com/dp/0226321487/,1,1
Genres of the Credit Economy: Mediating Value in Eighteenth- and Nineteenth-Century Britain,Book,http://www.amazon.com/dp/0226675335/,1,1
"Shakespeare's Hybrid Faith: History, Religion and the Stage (Early Modern Literature in History)",Book,http://www.amazon.com/dp/023000525X/,1,1
To Write Like a Woman: Essays in Feminism and Science Fiction,Book,http://www.amazon.com/dp/0253209838/,1,1
English Syntax - 2nd Edition,Book,http://www.amazon.com/dp/0262521989/,1,1
The Belgian Essays: A Critical Edition,Book,http://www.amazon.com/dp/0300064896/,1,1
Theory of Literature (The Open Yale Courses Series),Book,http://www.amazon.com/dp/0300180837/,1,1
A Little History of Literature (Little Histories),Book,http://www.amazon.com/dp/0300205317/,1,1
The Student Bible: King James Version,Book,http://www.amazon.com/dp/0310926793/,1,1
Frankenstein (Case Studies in Contemporary Criticism),Book,http://www.amazon.com/dp/031219126X/,1,1
Can't Stop Won't Stop: A History of the Hip-Hop Generation,Book,http://www.amazon.com/dp/0312425791/,17,1
The David Foster Wallace Reader,Book,http://www.amazon.com/dp/0316182400/,1,1
Rimbaud Complete (Modern Library Classics),Book,http://www.amazon.com/dp/0375757708/,1,1
Ecrits: The First Complete Edition in English,Book,http://www.amazon.com/dp/0393329259/,2,1
The Swerve: How the World Became Modern,Book,http://www.amazon.com/dp/0393343405/,3,1
The Norton Anthology of Theory and Criticism,Book,http://www.amazon.com/dp/0393932923/,3,1
"The Norton Anthology of World Literature (Third Edition)  (Vol. Package 1: Volumes A, B, C)",Book,http://www.amazon.com/dp/0393933652/,1,1
Le Morte Darthur (Norton Critical Editions),Book,http://www.amazon.com/dp/0393974642/,2,1
The Post-Colonial Studies Reader,Book,http://www.amazon.com/dp/0415345650/,1,1
The Continental Aesthetics Reader (500 Tips),Book,http://www.amazon.com/dp/0415481848/,1,1
That's the Joint!: The Hip-Hop Studies Reader,Book,http://www.amazon.com/dp/0415873266/,1,1
Macbeth: New Critical Essays (Shakespeare Criticism Series),Book,http://www.amazon.com/dp/0415974046/,1,1
"Three Kingdoms: A Historical Novel, Part 1",Book,http://www.amazon.com/dp/0520224787/,4,1
The Scarlet Gang of Asakusa,Book,http://www.amazon.com/dp/0520241827/,1,1
Ulysses Annotated: Notes for James Joyce's Ulysses,Book,http://www.amazon.com/dp/0520253973/,5,1
Elizabethan Rhetoric: Theory and Practice (Ideas in Context),Book,http://www.amazon.com/dp/0521020999/,1,1
"The Cambridge History of Classical Literature: Volume 1, Greek Literature, Part 1, Early Greek Poetry",Book,http://www.amazon.com/dp/0521359813/,1,1
The Complete Fairy Tales of the Brothers Grimm All-New Third Edition,Book,http://www.amazon.com/dp/0553382160/,1,1
How to Read a Book: The Classic Guide to Intelligent Reading (A Touchstone book),Book,http://www.amazon.com/dp/0671212095/,36,1
Walter Benjamin: A Critical Life,Book,http://www.amazon.com/dp/0674051866/,1,1
The Novel: A Biography,Book,http://www.amazon.com/dp/0674724739/,1,1
Six Walks in the Fictional Woods,Book,http://www.amazon.com/dp/0674810511/,1,1
Walter Benjamin: A Critical Life,Book,http://www.amazon.com/dp/0674970772/,1,1
U and I: A True Story,Book,http://www.amazon.com/dp/0679735755/,1,1
The Bird Man and the Lap Dancer: Close Encounters with Strangers,Book,http://www.amazon.com/dp/0679771824/,1,1
"The Plum in the Golden Vase or, Chin P'ing Mei: Vol. 1, The Gathering",Book,http://www.amazon.com/dp/0691016143/,1,1
The Poetry and Poetics of Nishiwaki Junzaburo,Book,http://www.amazon.com/dp/0691069816/,1,1
The uncanny: An introduction,Book,http://www.amazon.com/dp/071905561X/,1,1
"Dear Scott, Dearest Zelda: The Love Letters of F.Scott and Zelda Fitzgerald",Book,http://www.amazon.com/dp/0747566011/,1,1
American Folktales: From the Collections of the Library of Congress,Book,http://www.amazon.com/dp/0765680629/,1,1
"Faithful Narratives: Historians, Religion, and the Challenge of Objectivity",Book,http://www.amazon.com/dp/080147857X/,1,1
"Black Skin, White Masks",Book,http://www.amazon.com/dp/0802143008/,3,1
The Poetics of Space,Book,http://www.amazon.com/dp/0807064734/,3,1
Out of the Shadows: A Structuralist Approach to Understanding the Fiction of H. P. Lovecraft,Book,http://www.amazon.com/dp/0809530023/,1,1
Speculations on Speculation: Theories of Science Fiction,Book,http://www.amazon.com/dp/081084902X/,1,1
Some Versions of Pastoral: Literary Criticism (New Directions Paperbook ; 92),Book,http://www.amazon.com/dp/0811200388/,1,1
2: I Promise to Be Good: The Letters of Arthur Rimbaud (Modern Library Classics),Book,http://www.amazon.com/dp/0812970152/,1,1
"Supergods: What Masked Vigilantes, Miraculous Mutants, and a Sun God from Smallville Can Teach Us About Being Human",Book,http://www.amazon.com/dp/0812981383/,7,1
"A Trip to the Country: by Henriette-Julie de Castelnau, Comtesse de Murat (Series in Fairy-Tale Studies)",Book,http://www.amazon.com/dp/0814335039/,1,1
From Utopia to Apocalypse: Science Fiction and the Politics of Catastrophe,Book,http://www.amazon.com/dp/0816650799/,1,1
Sharing the Earth: An International Environmental Justice Reader,Book,http://www.amazon.com/dp/082034771X/,1,1
"Magical Realism: Theory, History, Community",Book,http://www.amazon.com/dp/0822316404/,1,1
Giovan Francesco Straparola: The Pleasant Nights (MEDIEVAL & RENAIS TEXT STUDIES),Book,http://www.amazon.com/dp/0866985360/,1,1
No Laughing Matter: The Life and Times of Flann O'Brien,Book,http://www.amazon.com/dp/0880641835/,1,1
Air and Dreams: An Essay on the Imagination of Movement (Bachelard Translation Series),Book,http://www.amazon.com/dp/0911005137/,1,1
The Epic Cosmos (Studies in Genre),Book,http://www.amazon.com/dp/0911005226/,1,1
Structure & Surprise: Engaging Poetic Turns,Book,http://www.amazon.com/dp/0915924277/,1,1
The Collected Poems of Chika Sagawa,Book,http://www.amazon.com/dp/0984947167/,1,1
The Cambridge Companion to American Science Fiction (Cambridge Companions to Literature),Book,http://www.amazon.com/dp/1107694272/,1,1
"The Heath Anthology of American Literature: Beginnings to 1800, Volume A",Book,http://www.amazon.com/dp/1133310222/,1,1
New Formalist Criticism: Theory and Practice,Book,http://www.amazon.com/dp/1137362588/,1,1
The Theatre of the Absurd,Book,http://www.amazon.com/dp/1400075238/,1,1
Beowulf: A Dual-Language Edition,Book,http://www.amazon.com/dp/1400096227/,1,1
Literary Theory (A Brief Insight),Book,http://www.amazon.com/dp/1402768753/,1,1
Anime from Akira to Howl's Moving Castle: Experiencing Contemporary Japanese Animation,Book,http://www.amazon.com/dp/1403970521/,1,1
Uses of Literature,Book,http://www.amazon.com/dp/1405147245/,1,1
Modern Literary Criticism and Theory: A History,Book,http://www.amazon.com/dp/1405176660/,1,1
