name,category,amazon_link,total_mentions,subreddit_mentions
"Star Wars, Episode III: Revenge of the Sith",Books,https://www.amazon.com/Star-Wars-Episode-III-Revenge/dp/0345428846/ref=sr_1_1?ie=UTF8&amp;qid=1448314599&amp;sr=8-1&amp;keywords=revenge+of+the+sith+novelization,3,2
The Science of Interstellar,Books,https://www.amazon.com/Science-Interstellar-Kip-Thorne/dp/0393351378/ref=tmm_pap_swatch_0?_encoding=UTF8&amp;sr=&amp;qid=,6,1
"JLA: The Deluxe Edition, Vol. 1",Books,https://www.amazon.com/JLA-Deluxe-Vol-Grant-Morrison/dp/1401233147/ref=sr_1_1?ie=UTF8&amp;qid=1438049643&amp;sr=8-1&amp;keywords=JLA+vol.+1&amp;pebp=1438049645179&amp;perid=0WG111B5FSEQXCVBBFHX,5,1
"Superior Spider-Man, Vol. 1: My Own Worst Enemy",Books,https://www.amazon.com/Superior-Spider-Man-Vol-Worst-Enemy/dp/0785167048,4,1
Gotrek & Felix: The First Omnibus (Gotrek & Felix Novels),Books,https://www.amazon.com/Gotrek-Felix-First-Omnibus-Novels/dp/1844163741,3,1
The Zombie Survival Guide: Complete Protection from the Living Dead,Books,https://www.amazon.com/The-Zombie-Survival-Guide-Protection/dp/1400049628,3,1
Mars Attacks (Topps),Books,https://www.amazon.com/Mars-Attacks-Topps-Company/dp/1419704095/ref=sr_1_1?s=books&amp;ie=UTF8&amp;qid=1423385995&amp;sr=1-1&amp;keywords=mars+attacks,2,1
Vampire: The Masquerade,Books,https://www.amazon.com/Vampire-The-Masquerade-Richard-Dansky/dp/1565042492/ref=cm_cr_pr_product_top?ie=UTF8,2,1
The Player of Games (Culture),Books,https://www.amazon.com/Player-Games-Culture-Iain-Banks/dp/0316005401,2,1
"X-Men Wolverine Claws, Pair",Sports & Outdoors,https://www.amazon.com/Superstores-X-Men-Wolverine-Claws-Pair/dp/B00J7J1FHW,1,1
Fantastic Beasts and Where to Find Them (Harry Potter),Books,https://www.amazon.com/Fantastic-Beasts-Where-Harry-Potter/dp/0545850568?ie=UTF8&amp;keywords=fantastic,1,1
Batman: Venom,Books,https://www.amazon.com/Batman-Venom-Dennis-J-ONeil/dp/140123383X,1,1
Batman & Captain America (Elseworlds),Books,https://www.amazon.com/Batman-Captain-America-Elseworlds-Byrne/dp/156389291X,1,1
Mindflex Game,Toys & Games,https://www.amazon.com/Mattel-P2639-Mindflex-Game/dp/B001UEUHCG,1,1
Superman/Batman: The Search for Kryptonite,Books,https://www.amazon.com/Superman-Batman-The-Search-Kryptonite/dp/1401219330,1,1
Tales of the Bounty Hunters (Star Wars) (Book 3),Books,https://www.amazon.com/Tales-Bounty-Hunters-Star-Wars/dp/0553568167,1,1
Speaker for the Dead (The Ender Quintet),Books,https://www.amazon.com/Speaker-Ender-Quintet-Orson-Scott/dp/0812550757,1,1
Alias Vol. 1,Books,https://www.amazon.com/Alias-Vol-Brian-Michael-Bendis/dp/0785111417,1,1
PLAYMOBIL Pirate with Treasure Chest Play Set,Toys & Games,https://www.amazon.com/gp/product/B00FJR0FM2,1,1
The Future of Warfare,Books,https://www.amazon.com/Future-Warfare-Bevin-Alexander/dp/0393332403,1,1
"SM30512 RS232 Flash Memory/Drive, RS232 Data Logger",Electronics,https://www.amazon.com/SM30512-RS232-Flash-Memory-Logger/dp/B009YNT1RM?sa-no-redirect=1,1,1
Accoutrements Jesus Action Figure,Toys & Games,https://www.amazon.com/Accoutrements-10746-Jesus-Action-Figure/dp/B0006FUEV4,1,1
Gremlins (An Avon Camelot book),Books,https://www.amazon.com/Gremlins-An-Avon-Camelot-book/dp/0380890038,1,1
Watchmen and Philosophy: A Rorschach Test (The Blackwell Philosophy and Pop Culture Series),Books,https://www.amazon.com/Watchmen-Philosophy-Rorschach-Blackwell-Culture/dp/0470396857/,1,1
Graphitti Designs Buddy Christ Dashboard Statue,Toys & Games,https://www.amazon.com/Graphitti-Designs-Christ-Dashboard-Statue/dp/B000AP5974/ref=sr_1_1?s=toys-and-games&amp;ie=UTF8&amp;qid=1479550337&amp;sr=1-1&amp;keywords=buddy+christ,1,1
CONTINUUM: Roleplaying in The Yet,Books,https://www.amazon.com/CONTINUUM-Roleplaying-Yet-Chris-Adams/dp/1929312008/ref=sr_1_1?ie=UTF8&amp;qid=1447224309&amp;sr=8-1&amp;keywords=Continuum+RPG,1,1
Star Wars: The Old Republic - Revan (Star Wars: The Old Republic - Legends),Books,https://www.amazon.com/Star-Wars-Republic-Revan-Legends/dp/0345511352,1,1
The Book of Weird,Books,https://www.amazon.com/Book-Weird-Barbara-N-Byfield/dp/0385065914,1,1
Dydeetown World,Books,https://www.amazon.com/Dydeetown-World-F-Paul-Wilson/dp/0671698281,1,1
Arkham Manor,Books,https://www.amazon.com/Arkham-Manor-Gerry-Duggan/dp/1401254586/ref=sr_1_1?ie=UTF8&amp;qid=1480310160&amp;sr=8-1&amp;keywords=arkham+manor,1,1
Excession,Books,https://www.amazon.com/Excession-Iain-M-Banks/dp/0553575376/ref=sr_1_1?s=books&amp;ie=UTF8&amp;qid=1441904916&amp;sr=1-1&amp;keywords=Excession,1,1
Empire from the Ashes,Books,https://www.amazon.com/Empire-Ashes-David-Weber/dp/141650933X,1,1
The Real Story: The Gap into Conflict (The Gap Cycle),Books,https://www.amazon.com/The-Real-Story-Conflict-Cycle/dp/0553295098,1,1
Corporate Shadowfiles: A Shadowrun Sourcebook (Shadowrun 7113),Books,https://www.amazon.com/Corporate-Shadowfiles-Shadowrun-Sourcebook-7113/dp/1555602118,1,1
Planet X (Star Trek: The Next Generation),Books,https://www.amazon.com/Planet-Star-Trek-Next-Generation/dp/0671019163,1,1
Havok & Wolverine Meltdown #1-#4 graphic novel set / X-Men,Books,https://www.amazon.com/Havok-Wolverine-Meltdown-graphic-novel/dp/B004R7NNWY/ref=sr_1_1?ie=UTF8&amp;qid=1456537302&amp;sr=8-1&amp;keywords=Havok+,1,1
Myo Gesture Control Armband (Black),Amazon Launchpad,https://www.amazon.com/dp/B00O66E58M/ref=cm_sw_r_cp_apa_MNoyzbYM7FVTS,1,1
