name,category,amazon_link,total_mentions,subreddit_mentions
"The Spirit Catches You and You Fall Down: A Hmong Child, Her American Doctors, and the Collision of Two Cultures (FSG Classics)",Books,https://www.amazon.com/The-Spirit-Catches-Fall-Down/dp/0374533407/ref=pd_bxgy_14_3?ie=UTF8&amp;refRID=06NPWZ9CZV5NPHP6PBJ7,5,1
Sexing the Body: Gender Politics and the Construction of Sexuality,Books,https://www.amazon.com/Sexing-Body-Politics-Construction-Sexuality/dp/0465077145?_encoding=UTF8&amp;*Version*=1&amp;*entries*=0,3,1
"Ain't No Makin' It: Aspirations and Attainment in a Low-Income Neighborhood, 3rd Edition",Books,https://www.amazon.com/Aint-Makin-Aspirations-Attainment-Neighborhood/dp/0813343585,2,1
Essays on the Great Depression,Books,https://www.amazon.com/Essays-Great-Depression-Ben-Bernanke/dp/0691118205/ref=sr_1_1?s=books&amp;ie=UTF8&amp;qid=1421083324&amp;sr=1-1&amp;keywords=bernanke+depression,2,1
"Macroeconomics, 3rd Edition",Books,https://www.amazon.com/Macroeconomics-3rd-Paul-Krugman/dp/1429283432/,2,1
It's Even Worse Than It Looks: How the American Constitutional System Collided With the New Politics of Extremism,Books,https://www.amazon.com/gp/product/0465074731?keywords=It,2,1
Freakonomics: A Rogue Economist Explores the Hidden Side of Everything,Books,https://www.amazon.com/Freakonomics-Economist-Explores-Hidden-Everything/dp/0060731338,2,1
World-Systems Analysis: An Introduction,Books,https://www.amazon.com/World-Systems-Analysis-Introduction-Immanuel-Wallerstein/dp/0822334429/ref=sr_1_1?s=books&amp;ie=UTF8&amp;qid=1469687150&amp;sr=1-1&amp;keywords=introduction+to+world+systems+theory,2,1
"Dude, You're a Fag: Masculinity and Sexuality in High School",Books,https://www.amazon.com/Dude-Youre-Fag-Masculinity-Sexuality/dp/0520271483/ref=sr_1_1?ie=UTF8&amp;qid=1490991138&amp;sr=8-1&amp;keywords=dude+you,2,1
"Black Skin, White Masks",Books,https://www.amazon.com/Black-White-Masks-Frantz-Fanon/dp/0802143008,2,1
The Rationalizing Voter (Cambridge Studies in Public Opinion and Political Psychology),Books,https://www.amazon.com/Rationalizing-Cambridge-Studies-Political-Psychology/dp/052117614X,2,1
"A Monetary History of the United States, 1867-1960",Books,https://www.amazon.com/Monetary-History-United-States-1867-1960/dp/0691003548,2,1
The Invisible Gorilla: How Our Intuitions Deceive Us,Books,https://www.amazon.com/Invisible-Gorilla-How-Intuitions-Deceive/dp/0307459667/,2,1
"Imperial Leather: Race, Gender, and Sexuality in the Colonial Contest",Books,https://www.amazon.com/Imperial-Leather-Sexuality-Colonial-Contest/dp/0415908906/ref=sr_1_2?ie=UTF8&amp;qid=1434901543&amp;sr=8-2&amp;keywords=imperial+leather,1,1
Political Ideologies and Political Parties in America (Cambridge Studies in Public Opinion and Political Psychology),Books,https://www.amazon.com/Political-Ideologies-Parties-Cambridge-Psychology/dp/110762052X/ref=sr_1_1?ie=UTF8&amp;qid=1441497124&amp;sr=8-1&amp;keywords=hans+noel&amp;pebp=1441497107719&amp;perid=0VZBRMD97S0YE83XXXX6,1,1
The Paradox of Plenty: Oil Booms and Petro-States (Studies in International Political Economy),Books,https://www.amazon.com/Paradox-Plenty-Petro-States-International-Political/dp/0520207726/ref=sr_1_2?ie=UTF8&amp;qid=1427162101&amp;sr=8-2&amp;keywords=Paradox+of+Plenty,1,1
"Education, Justice, and Democracy",Books,https://www.amazon.com/Education-Justice-Democracy-Danielle-Allen/dp/022601276X/ref=sr_1_1?ie=UTF8&amp;qid=1456950059&amp;sr=8-1&amp;keywords=justice+education+democracy,1,1
Dogs and Demons: Tales from the Dark Side of Japan,Books,https://www.amazon.com/Dogs-Demons-Tales-Dark-Japan/dp/0809039435,1,1
Hollowing Out the Middle: The Rural Brain Drain and What It Means for America,Books,https://www.amazon.com/Hollowing-Out-Middle-Rural-America/dp/0807006149,1,1
The Failure of Nonviolence,Books,https://www.amazon.com/Failure-Nonviolence-Peter-Gelderloos/dp/0939306042,1,1
"The Great Contraction, 1929-1933 (Princeton Classic Editions)",Books,https://www.amazon.com/Contraction-1929-1933-Princeton-Classic-Editions/dp/0691137943/ref=cm_cr_pr_product_top,1,1
"Principles of Macroeconomics, 6th Edition (Mankiw's Principles of Economics)",Books,https://www.amazon.com/Principles-Macroeconomics-6th-Gregory-Mankiw/dp/0538453060,1,1
The Undercover Economist Strikes Back: How to Run--or Ruin--an Economy,Books,https://www.amazon.com/Undercover-Economist-Strikes-Run---Ruin--/dp/159463291X/,1,1
A Culture of Conspiracy: Apocalyptic Visions in Contemporary America (Comparative Studies in Religion and Society),Books,https://www.amazon.com/Culture-Conspiracy-Apocalyptic-Contemporary-Comparative/dp/0520248120/ref=sr_1_2?ie=UTF8,1,1
"The Rhetoric of Empire: Colonial Discourse in Journalism, Travel Writing, and Imperial Administration (Post-Contemporary Interventions)",Books,https://www.amazon.com/Rhetoric-Empire-Administration-Post-Contemporary-Interventions/dp/0822313170,1,1
Islamic Exceptionalism: How the Struggle Over Islam Is Reshaping the World,Books,https://www.amazon.com/Islamic-Exceptionalism-Struggle-Islam-Reshaping/dp/1250061016,1,1
Born in the Country: A History of Rural America (Revisiting Rural America),Books,https://www.amazon.com/Born-Country-History-America-Revisiting/dp/0801850401/ref=tmm_pap_swatch_0?_encoding=UTF8&amp;qid=1479150780&amp;sr=1-1],1,1
"Critical Rural Theory: Structure, Space, Culture",Books,https://www.amazon.com/Critical-Rural-Theory-Structure-Culture/dp/0739135600/ref=sr_1_1?s=books&amp;ie=UTF8&amp;qid=1479150319&amp;sr=1-1&amp;keywords=Critical+Rural+Theory,1,1
Studies in Urbanormativity: Rural Community in Urban Society,Books,https://www.amazon.com/Studies-Urbanormativity-Rural-Community-Society/dp/0739178768,1,1
"""Socialism Is Great!"": A Worker's Memoir of the New China",Books,https://www.amazon.com/Socialism-Great-Workers-Memoir-China/dp/0307472191/ref=sr_1_1?s=books&amp;ie=UTF8&amp;qid=1467507625&amp;sr=1-1&amp;keywords=Socialism+is+great,1,1
Governing the Market: Economic Theory and the Role of Government in East Asian Industrialization,Books,https://www.amazon.com/Governing-Market-Economic-Government-Industrialization/dp/0691117292/ref=sr_1_1?ie=UTF8&amp;qid=1469687233&amp;sr=8-1&amp;keywords=governing+the+market+wade,1,1
Student Loans and the Dynamics of Debt,Books,https://www.amazon.com/Student-Loans-Dynamics-Debt-Hershbein/dp/0880994843,1,1
Uninsured in America: Life and Death in the Land of Opportunity,Books,https://www.amazon.com/Uninsured-America-Life-Death-Opportunity/dp/0520250060,1,1
Dependency and Development in Latin America,Books,https://www.amazon.com/Dependency-Development-America-Fernando-Henrique/dp/0520035275,1,1
Fat Land: How Americans Became the Fattest People in the World,Books,https://www.amazon.com/Fat-Land-Americans-Became-Fattest/dp/0618380604,1,1
Capitalism and Underdevelopment in Latin America: Historical Studies of Chile and Brazil,Books,https://www.amazon.com/Capitalism-Underdevelopment-Latin-America-Historical/dp/0853450935?ie=UTF8&amp;ref_=asap_bc,1,1
"The Rise of ""The Rest"": Challenges to the West from Late-Industrializing Economies",Books,https://www.amazon.com/Rise-Rest-Challenges-Late-Industrializing-Economies/dp/0195170598/ref=sr_1_1?s=books&amp;ie=UTF8&amp;qid=1469687226&amp;sr=1-1&amp;keywords=amsden+rise+of+the+rest,1,1
The Myth of Continents: A Critique of Metageography,Books,https://www.amazon.com/The-Myth-Continents-Critique-Metageography/dp/0520207432,1,1
Patterns of Democracy: Government Forms and Performance in Thirty-Six Countries,Books,https://www.amazon.com/Patterns-Democracy-Government-Performance-Thirty-Six/dp/0300078935,1,1
"The Church, Society, and Hegemony: A Critical Sociology of Religion in Latin America",Books,https://www.amazon.com/The-Church-Society-Hegemony-Sociology/dp/0275937739,1,1
The American Voter,Books,https://www.amazon.com/American-Voter-Angus-Campbell/dp/0226092542,1,1
The Unthinkable Revolution in Iran,Books,https://www.amazon.com/Unthinkable-Revolution-Iran-Charles-Kurzman/dp/0674018435,1,1
A Practical Guide for Policy Analysis: The Eightfold Path to More Effective Problem Solving 4E,Books,https://www.amazon.com/Practical-Guide-Policy-Analysis-Eightfold/dp/1608718425/ref=pd_sim_14_6?ie=UTF8&amp;dpID=51K-OlqiuLL&amp;dpSrc=sims&amp;preST=_AC_UL160_SR107,1,1
Policy Paradox: The Art of Political Decision Making (Third Edition),Books,https://www.amazon.com/Policy-Paradox-Political-Decision-Making/dp/0393912728/ref=sr_1_1?s=books&amp;ie=UTF8&amp;qid=1452053891&amp;sr=1-1&amp;keywords=policy+paradox+the+art+of+political+decision+making+3rd+edition,1,1
"Karl Marx, Anthropologist",Books,https://www.amazon.com/Karl-Marx-Anthropologist-Thomas-Patterson/dp/1845205111,1,1
The Geography of Thought: How Asians and Westerners Think Differently...and Why,Books,https://www.amazon.com/Geography-Thought-Asians-Westerners-Differently/dp/0743255356,1,1
Racism without Racists: Color-Blind Racism and the Persistence of Racial Inequality in America,Books,https://www.amazon.com/Racism-without-Racists-Color-Blind-Persistence/dp/1442202181,1,1
Alligator Candy: A Memoir,Books,https://www.amazon.com/Alligator-Candy-Memoir-David-Kushner/dp/1451682530,1,1
"Modernity At Large: Cultural Dimensions of Globalization (Public Worlds, Vol. 1)",Books,https://www.amazon.com/Modernity-At-Large-Dimensions-Globalization/dp/0816627932/ref=pd_sim_b_3?ie=UTF8&amp;refRID=1NMJCK00BHSGCQYE57J4,1,1
Modern Money Theory: A Primer on Macroeconomics for Sovereign Monetary Systems,Books,https://www.amazon.com/Modern-Money-Theory-Macroeconomics-Sovereign/dp/0230368891,1,1
Qualitative Inquiry and Research Design: Choosing Among Five Approaches,Books,https://www.amazon.com/Qualitative-Inquiry-Research-Design-Approaches/dp/1412995302,1,1
"Divided World, Divided Class",Books,https://www.amazon.com/Divided-World-Class-Zak-Cope/dp/1894946685/ref=pd_sim_14_1?ie=UTF8&amp;dpID=41tx5jF9cbL&amp;dpSrc=sims&amp;preST=_AC_UL160_SR114,1,1
"The Rich Get Richer and the Poor Get Prison: Ideology, Class, and Criminal Justice",Books,https://www.amazon.com/Rich-Get-Richer-Poor-Prison/dp/0205137725/ref=sr_1_1?ie=UTF8&amp;qid=1486422559&amp;sr=8-1&amp;keywords=rich+get+richer+poor+get+prison,1,1
"The Royal Commentaries of the Incas and General History of Peru, Abridged",Books,https://www.amazon.com/Royal-Commentaries-General-History-Abridged/dp/0872208435,1,1
The First New Chronicle and Good Government: On the History of the World and the Incas up to 1615 (Joe R. and Teresa Lozana Long Series in Latin American and Latino Art and Culture (Hardcover)),Books,https://www.amazon.com/First-New-Chronicle-Good-Government/dp/0292719590,1,1
"The Codex Borgia: A Full-Color Restoration of the Ancient Mexican Manuscript (Dover Fine Art, History of Art)",Books,https://www.amazon.com/Codex-Borgia-Full-Color-Restoration-Manuscript/dp/0486275698,1,1
Introduction to Psychology,Books,https://www.amazon.com/Introduction-Psychology-James-W-Kalat/dp/1305271556,1,1
"International Economics: Theory and Policy, 9th Edition",Books,https://www.amazon.com/International-Economics-Theory-Policy-Edition/dp/0132146657,1,1
Psychology: A Concise Introduction,Books,https://www.amazon.com/Psychology-Concise-Introduction-Richard-Griggs/dp/1429298901/,1,1
The Political Economy of Latin America: Reflections on Neoliberalism and Development,Books,https://www.amazon.com/Political-Economy-Latin-America-Neoliberalism/dp/0415998271,1,1
Understanding Class,Books,https://www.amazon.com/Understanding-Class-Erik-Olin-Wright/dp/1781689458/ref=sr_1_1?ie=UTF8&amp;qid=1456050671&amp;sr=8-1&amp;keywords=Understanding+class,1,1
Governmentality: Power and Rule in Modern Society,Books,https://www.amazon.com/Governmentality-Power-Rule-Modern-Society/dp/1847873847,1,1
