name,category,amazon_link,total_mentions,subreddit_mentions
"The Dialectical Behavior Therapy Skills Workbook: Practical DBT Exercises for Learning Mindfulness, Interpersonal Effectiveness, Emotion Regulation & ... Tolerance (New Harbinger Self-Help Workbook)",Book,http://www.amazon.com/dp/1572245131/,99,3
The Life-Changing Magic of Tidying Up: The Japanese Art of Decluttering and Organizing,eBooks,http://www.amazon.com/dp/B00KK0PICK/,26,2
"LELO GIGI 2 Luxury Personal Massager, Best Seller G-spot Vibrator, Deep Rose",Health and Beauty,http://www.amazon.com/dp/B00EA0N76U/,6,2
Queen of the Talking Stones,eBooks,http://www.amazon.com/dp/B005LVWUYW/,2,2
Magic Wand Massager with Wand Essentials Variable Speed Controller,Health and Beauty,http://www.amazon.com/dp/B0089175GE/,18,2
"Panasonic ES2207P Ladies Electric Shaver, 3-Blade Cordless Women’s Electric Razor with Pop-Up Trimmer, Use Wet or Dry",Beauty,http://www.amazon.com/dp/B0018A32XS/,17,2
"The Verbally Abusive Relationship, Expanded Third Edition: How to recognize it and how to respond",Book,http://www.amazon.com/dp/1440504636/,18,2
"Prioritization, Delegation, and Assignment: Practice Exercises for the NCLEX Examination, 3e",Book,http://www.amazon.com/dp/0323113435/,3,1
My Boyfriend Barfed in My Handbag . . . and Other Things You Can't Ask Martha,Book,http://www.amazon.com/dp/0142196932/,2,1
The Burgermeister's Daughter: Scandal in a Sixteenth-Century German Town,Book,http://www.amazon.com/dp/0060977213/,2,1
Outside the Lines: An Artists' Coloring Book for Giant Imaginations,Book,http://www.amazon.com/dp/0399162089/,3,1
Why Does He Do That?: Inside the Minds of Angry and Controlling Men,Book,http://www.amazon.com/dp/0425191656/,68,1
India Black (A Madam of Espionage Mystery),Book,http://www.amazon.com/dp/0425238660/,1,1
Captive Prince (The Captive Prince Trilogy),Book,http://www.amazon.com/dp/0425274268/,3,1
Love My Rifle More than You: Young and Female in the U.S. Army,Book,http://www.amazon.com/dp/0393329224/,1,1
The Poet's Companion: A Guide to the Pleasures of Writing Poetry,Book,http://www.amazon.com/dp/0393316548/,1,1
"Crucial Conversations Tools for Talking When Stakes Are High, Second Edition",Book,http://www.amazon.com/dp/0071771328/,19,1
"It's Perfectly Normal: Changing Bodies, Growing Up, Sex, and Sexual Health (The Family Library)",Book,http://www.amazon.com/dp/0763668729/,25,1
The Stripper's Guide to Looking Great Naked,Book,http://www.amazon.com/dp/0811846474/,1,1
Spies: A Narrative Encyclopedia of Dirty Tricks and Double Dealing from Biblical Times to Today,Book,http://www.amazon.com/dp/0871317907/,1,1
More Than Two: A Practical Guide to Ethical Polyamory,Book,http://www.amazon.com/dp/0991399706/,32,1
Stories of Your Life and Others,Book,http://www.amazon.com/dp/1101972122/,12,1
Harry Potter Coloring Book,Book,http://www.amazon.com/dp/1338029991/,5,1
Inner Voice: Unlock Your Purpose and Passion,Book,http://www.amazon.com/dp/1401943462/,1,1
"The New Rules of Attraction: How to Get Him, Keep Him, and Make Him Beg for More",Book,http://www.amazon.com/dp/1402266529/,2,1
"Wondfo Pregnancy Test Strips, 25-count medical",Health and Beauty,http://www.amazon.com/dp/B0002YIQEQ/,25,1
642 Tiny Things to Write About,Book,http://www.amazon.com/dp/1452142173/,2,1
"Animal Kingdom: Color Me, Draw Me (A Millie Marotta Adult Coloring Book)",Book,http://www.amazon.com/dp/1454709103/,2,1
All the Single Ladies: Unmarried Women and the Rise of an Independent Nation,Book,http://www.amazon.com/dp/1476716560/,2,1
Come as You Are: The Surprising New Science that Will Transform Your Sex Life,Book,http://www.amazon.com/dp/1476762090/,133,1
Who Fears Death,Book,http://www.amazon.com/dp/0756406692/,3,1
Bird by Bird: Some Instructions on Writing and Life,Book,http://www.amazon.com/dp/0385480016/,12,1
The Threesome Handbook: A Practical Guide to SLEEPING WITH THREE,Book,http://www.amazon.com/dp/1568583338/,7,1
Active Birth: The New Approach to Giving Birth Naturally,Book,http://www.amazon.com/dp/1558320385/,3,1
"Pipedream Boobie Cake Pan, Silver",Health and Beauty,http://www.amazon.com/dp/B00163B6Y4/,2,1
"Digging Out: Helping Your Loved One Manage Clutter, Hoarding, and Compulsive Acquiring",Book,http://www.amazon.com/dp/1572245948/,8,1
Attached: The New Science of Adult Attachment and How It Can Help YouFind - and Keep - Love,Book,http://www.amazon.com/dp/1585429139/,50,1
"How to Be Happy, Dammit: A Cynic's Guide to Spiritual Happiness",Book,http://www.amazon.com/dp/1587611198/,1,1
"The Ethical Slut: A Practical Guide to Polyamory, Open Relationships & Other Adventures",Book,http://www.amazon.com/dp/1587613379/,51,1
StrengthsFinder 2.0,Book,http://www.amazon.com/dp/159562015X/,12,1
The Life-Changing Magic of Tidying Up: The Japanese Art of Decluttering and Organizing,Book,http://www.amazon.com/dp/1607747308/,145,1
The Creative Colouring Book for Grown-Ups,Book,http://www.amazon.com/dp/1843178699/,1,1
Guide To Getting It On: Unzipped,Book,http://www.amazon.com/dp/1885535171/,2,1
Guide To Getting It On,Book,http://www.amazon.com/dp/1885535457/,9,1
"Action Day Thread-Bound 2016 Jan-Dec Calendar Planner Journal,  8 X 11-Inch, Black (AD2)",Office Product,http://www.amazon.com/dp/993591786X/,2,1
AccuSharp 001 Knife Sharpener,Home Improvement,http://www.amazon.com/dp/B00004VWKQ/,22,1
Vibratex G-Spotter Attachment,Health and Beauty,http://www.amazon.com/dp/B00005M1WF/,1,1
"Lutron TT-300H-WH Electronics Plug-In Lamp Dimmer, White",Home Improvement,http://www.amazon.com/dp/B0000BYEF6/,28,1
"Nature's Plus Beauty Cleansing Bar, 3.5 Ounce",Boost,http://www.amazon.com/dp/B00014EKJC/,2,1
"Thayers Alcohol-free Rose Petal Witch Hazel with Aloe Vera, 12 oz",Beauty,http://www.amazon.com/dp/B00016XJ4M/,50,1
ConvaTec DuoDERM Extra Thin CGF Dressings 4 X 4 Inches 187955 10 Each,Health and Beauty,http://www.amazon.com/dp/B0002DMANU/,46,1
Retro 3-Piece Chrome Bar Stools and Table Set,Furniture,http://www.amazon.com/dp/B0002XILV0/,1,1
The Nympho and Other Maniacs,Book,http://www.amazon.com/dp/0671207962/,2,1
Toysmith Squawkin' Chicken,Toy,http://www.amazon.com/dp/B0009Z3MQU/,2,1
Fiskars 3 Piece Rotary Cutting Set,Art and Craft Supply,http://www.amazon.com/dp/B000B7K9UI/,6,1
Dr. Laura Berman Intimate Basics Athena - Waterproof Mini Massager - Adult Toys Vibrator - Pocket Massager - Purple,Health and Beauty,http://www.amazon.com/dp/B000C9MB74/,4,1
"JASON 84% Aloe Vera Conditioner, 16 Ounce",Beauty,http://www.amazon.com/dp/B000FG8SY4/,1,1
"Nature's Way Primadophilus Reuteri, 90 Vcaps",Health and Beauty,http://www.amazon.com/dp/B000FL9EAG/,3,1
The Original McKenzie® Super Roll by OPTP (708),Health and Beauty,http://www.amazon.com/dp/B000GPS7NG/,1,1
The Bollywood Dance Workout with Hemalayaa,DVD,http://www.amazon.com/dp/B000JJ4DF0/,1,1
Wahl Color Pro Complete Hair Cutting Kit 79300-400T,Beauty,http://www.amazon.com/dp/B000JNQSIQ/,18,1
"Paper Mate Flair Porous-Point Felt Tip Pen, Medium Tip, 8-Pack, Core Colors (74740PP)",Office Product,http://www.amazon.com/dp/B000KI413O/,1,1
"I Thought It Was Just Me (but it isn't): Making the Journey from ""What Will People Think?"" to ""I Am Enough""",eBooks,http://www.amazon.com/dp/B000SEHDGM/,3,1
"Stabilo Point 88 Pen Sets Color Parade Adjustable, Set of 20",Toy,http://www.amazon.com/dp/B000OZQB36/,5,1
Mini Weapons of Mass Destruction: Build Implements of Spitball Warfare,Book,http://www.amazon.com/dp/1556529538/,1,1
GT Lubricant Included Powerful Wired Silver Bullet Spot Style Back Scalp Body Battery Massager,Health and Beauty,http://www.amazon.com/dp/B000MQJIXC/,1,1
"Clairol Professional Shimmer Lights Shampoo blonde & silver,16 fl.oz",Beauty,http://www.amazon.com/dp/B000TBVGBM/,7,1
The Original Backnobber II.,Health and Beauty,http://www.amazon.com/dp/B0010B8CGM/,4,1
"O'Keeffe's Working Hands Hand Cream, 3.4 oz., Jar",Home Improvement,http://www.amazon.com/dp/B00121UVU0/,40,1
"Fruit of the Loom Women'sCotton Pullover Sportsbra, White/Grey Heather/Black Hue, Size 38(Pack of 3)",Apparel,http://www.amazon.com/dp/B0013XWDGC/,2,1
Joy Division Soft-Tampons Dry 10St. by Joy Division,Health and Beauty,http://www.amazon.com/dp/B000LRUIOK/,2,1
"Jellycat Bashful Beige Bunny, Medium, 12 inches",Toy,http://www.amazon.com/dp/B00163U4LK/,3,1
"Organic India Whole Husk Psyllium, 12-Ounce",Health and Beauty,http://www.amazon.com/dp/B0016AXN7A/,10,1
"Mario Badescu Drying Lotion, 1 fl. oz.",Prestige Beauty,http://www.amazon.com/dp/B0017SWIU4/,9,1
"I Thought It Was Just Me (but it isn't): Making the Journey from ""What Will People Think?"" to ""I Am Enough""",Book,http://www.amazon.com/dp/1491513853/,3,1
Clear Plastic Large Capacity Cosmetic Storage and Makeup Organizer,Beauty,http://www.amazon.com/dp/B001B0YMB6/,3,1
"Pink Silicone Lubricant For Women, 3.3 Ounces",Health and Beauty,http://www.amazon.com/dp/B001CBAHA4/,2,1
"Rubber Chicken Purse - The ""Hen Bag"" Handbag",Toy,http://www.amazon.com/dp/B001G8N95I/,5,1
"Good Clean Love Almost Naked Personal Lubricant, 4 oz Tubes",Health and Beauty,http://www.amazon.com/dp/B001L1S16C/,3,1
Nippies Skin ORIGINAL Hypoallergenic Nipple Covers Pasties with ADHESIVE CREME COLOR SIZE 1,Apparel,http://www.amazon.com/dp/B001PU9A9Q/,14,1
Scensibles Personal Disposal Bags for Sanitary Pads and Tampons,Health and Beauty,http://www.amazon.com/dp/B001PYQE78/,5,1
Scun 4.5cm Clipples Ren Size 1 Ea Scun 4.5cm Clipples Ren 1 Ea,Beauty,http://www.amazon.com/dp/B001T8S8JC/,1,1
Trinity Vibes Pink Waterproof Rabbit Vibrator,Health and Beauty,http://www.amazon.com/dp/B001UFMRC8/,3,1
Locker Brand Inc 157281 The Original Fridge Locker,Home,http://www.amazon.com/dp/B001UFNCHM/,28,1
"SENTRY Calming Collar for Cats, 1 Count",Pet Products,http://www.amazon.com/dp/B0026JAKWG/,5,1
"Gigi Brazilian Waxing Kit, 14 Ounce",Beauty,http://www.amazon.com/dp/B002EP9OUG/,3,1
"Ouidad Moisture Lock Leave-in Conditioner, 8.5 Ounce",Beauty,http://www.amazon.com/dp/B002HM3EM0/,1,1
Dublin Jod Clips,Sports,http://www.amazon.com/dp/B002HUYL1K/,1,1
California Exotics Silicone Slims Vibrating Smooth Bullet,Health and Beauty,http://www.amazon.com/dp/B002JINN96/,1,1
"Gun Oil H2O, 8-Ounces Bottle",Health and Beauty,http://www.amazon.com/dp/B002UXRNWI/,5,1
Wine Wipes - 1 compact of 15 wipes,Kitchen,http://www.amazon.com/dp/B002VYT6JE/,2,1
Trinity Vibrating Silver Egg,Health and Beauty,http://www.amazon.com/dp/B002X78W6W/,2,1
AeroPress Coffee and Espresso Maker with zippered nylon tote bag with bonus 350 Micro Filters,Kitchen,http://www.amazon.com/dp/B002ZD3QJC/,3,1
NFL Seattle Seahawks Zippo Lighter,Sports,http://www.amazon.com/dp/B002ZTGCWE/,1,1
"Enjoy Leave In Conditioner, 10.1 Ounce",Beauty,http://www.amazon.com/dp/B0035CRMEC/,1,1
"Philips Norelco Bodygroom Series 7100, BG2040",Beauty,http://www.amazon.com/dp/B0037HP9OA/,64,1
"Sebastian Volupt Volume Building Spray Gel Unisex, 5.07 Ounce",Beauty,http://www.amazon.com/dp/B0037IESXC/,1,1
SheaMoisture 4 oz Raw Shea Butter Reconstructive Finishing Elixir,Beauty,http://www.amazon.com/dp/B0038TVH34/,1,1
"Dream Brands The Natural Personal Lubricant, 1.7 Ounce",Health and Beauty,http://www.amazon.com/dp/B003IGLS7C/,1,1
Women Don't Ask: The High Cost of Avoiding Negotiation--and Positive Strategies for Change,Book,http://www.amazon.com/dp/0553383876/,7,1
