name,category,amazon_link,total_mentions,subreddit_mentions
Reasons To Vote For Democrats: A Comprehensive Guide,Book,http://www.amazon.com/dp/1543024971/,14,1
Trump: The Art of the Comeback,Book,http://www.amazon.com/dp/0812929640/,11,1
The Creature from Jekyll Island: A Second Look at the Federal Reserve,Book,http://www.amazon.com/dp/091298645X/,10,1
The Clintons' War on Women,Book,http://www.amazon.com/dp/151070678X/,9,1
Slavery by Another Name: The Re-Enslavement of Black Americans from the Civil War to World War II,Book,http://www.amazon.com/dp/0385722702/,7,1
Unlimited Access : An FBI Agent Inside the Clinton White House,Book,http://www.amazon.com/dp/0895264064/,4,1
Women Don't Ask: The High Cost of Avoiding Negotiation--and Positive Strategies for Change,Book,http://www.amazon.com/dp/0553383876/,4,1
Bias: A CBS Insider Exposes How the Media Distort the News,Book,http://www.amazon.com/dp/0060520841/,1,1
"The Creationists: From Scientific Creationism to Intelligent Design, Expanded Edition",Book,http://www.amazon.com/dp/0674023390/,1,1
