name,category,amazon_link,total_mentions,subreddit_mentions
Intelex Cozy Plush Elephant Microwaveable Warmer,Health and Beauty,http://www.amazon.com/dp/B002WILK7A/,,1
Complex PTSD: From Surviving to Thriving: A GUIDE AND MAP FOR RECOVERING FROM CHILDHOOD TRAUMA,Book,http://www.amazon.com/dp/1492871842/,14,1
"The Body Keeps the Score: Brain, Mind, and Body in the Healing of Trauma",Book,http://www.amazon.com/dp/0143127748/,14,1
"It's Perfectly Normal: Changing Bodies, Growing Up, Sex, and Sexual Health (The Family Library)",Book,http://www.amazon.com/dp/0763668729/,11,1
"Body Glide Original Anti-Chafe Balm, 2.5 oz (USA Sale Only)",Sports,http://www.amazon.com/dp/B0043S06GI/,7,1
Come as You Are: The Surprising New Science that Will Transform Your Sex Life,eBooks,http://www.amazon.com/dp/B00LD1ORBI/,4,1
Nipple Rings no piercing pair Non-Piercing Clip On Nipple Ring Tribal Floral Pai,"Clothing, Shoes & Jewelry",https://www.amazon.com/Nipple-pierce-Non-Piercing-Tribal-Floral/dp/B00FFL02E8,1,1
