name,category,amazon_link,total_mentions,subreddit_mentions
Horoscope Symbols,Books,https://www.amazon.com/Horoscope-Symbols-Robert-Hand/dp/0914918168/ref=sr_1_1?ie=UTF8&amp;qid=1481936515&amp;sr=8-1&amp;keywords=robert+hand+horoscope+symbols,2,2
Planets in Transit: Life Cycles for Living,Books,https://www.amazon.com/Planets-Transit-Life-Cycles-Living/dp/0924608269/ref=sr_1_1?ie=UTF8&amp;qid=1490306291&amp;sr=8-1&amp;keywords=planets+in+transit+robert+hand,2,2
The Houses - Temples of the Sky,Books,https://www.amazon.com/Houses-Temples-Sky-D-Houlding/dp/190240520X/ref=sr_1_1?ie=UTF8&amp;qid=1456382965&amp;sr=8-1&amp;keywords=Temples+of+the+sky,2,2
A History of Western Astrology Volume I: The Ancient and Classical Worlds,Books,https://www.amazon.com/History-Western-Astrology-Ancient-Classical/dp/1441127372/ref=sr_1_3?ie=UTF8&amp;qid=1496606053&amp;sr=8-3&amp;keywords=history+of+western+astrology,2,1
But What If We're Wrong?: Thinking About the Present As If It Were the Past,Books,https://www.amazon.com/But-What-If-Were-Wrong/dp/0399184139/ref=sr_1_1?ie=UTF8&amp;qid=1492996071&amp;sr=8-1&amp;keywords=but+what+if+we,1,1
The Scientific Basis of Astrology: Tuning to the Music of the Planets,Books,https://www.amazon.com/dp/0312077955/ref=cm_sw_r_cp_awd_DjzMwb3820R6P,1,1
Planets in Youth: Patterns of Early Development (The Planet Series),Books,https://www.amazon.com/Planets-Youth-Patterns-Development-Planet/dp/0914918265/ref=redir_mobile_desktop?_encoding=UTF8&amp%3BdpID=51D4BVYDCAL&amp%3BdpPl=1&amp%3Bkeywords=robert%20hand%20planets%20in%20youth&amp%3Bpi=SY200_QL40&amp%3Bqid=1474561418&amp%3Bref=plSrch&amp%3Bsr=8-1&ref_=mp_s_a_1_1,1,1
The Secret Language of Birthdays: Your Complete Personology Guide for Each Day of the Year,Books,https://www.amazon.com/Secret-Language-Birthdays-Complete-Personology/dp/0525426884,1,1
Astrology: Understanding the Birth Chart,Books,https://www.amazon.com/Astrology-Understanding-Birth-Kevin-Burk/dp/1567180884/ref=redir_mobile_desktop?_encoding=UTF8&amp%3BdpID=51m2WjfqOaL&amp%3BdpPl=1&amp%3Bkeywords=kevin%20burk%20astrology&amp%3Bpi=SY200_QL40&amp%3Bqid=1474561144&amp%3Bref=plSrch&amp%3Bsr=8-1&ref_=mp_s_a_1_1,1,1
The Only Astrology Book You'll Ever Need,Books,https://www.amazon.com/Only-Astrology-Book-Youll-Ever/dp/1589796535,1,1
The Secret Power Within: Zen Solutions to Real Problems,Books,https://www.amazon.com/The-Secret-Power-Within-Solutions/dp/0316583502/ref=pd_sim_14_1?ie=UTF8&amp;dpID=41Dgdw,1,1
