name,category,amazon_link,total_mentions,subreddit_mentions
The Houses - Temples of the Sky,Book,http://www.amazon.com/dp/190240520X/,9,7
Horoscope Symbols,Book,http://www.amazon.com/dp/0914918168/,7,6
Astrology: Understanding the Birth Chart,Book,http://www.amazon.com/dp/1567180884/,8,5
Planets in Transit: Life Cycles for Living,Book,http://www.amazon.com/dp/0924608269/,6,4
Bonatti on Basic Astrology,Book,http://www.amazon.com/dp/1934586129/,4,3
A History of Western Astrology Volume I: The Ancient and Classical Worlds,Book,http://www.amazon.com/dp/1441127372/,4,3
Planets in Youth: Patterns of Early Development (The Planet Series),Book,http://www.amazon.com/dp/0914918265/,3,3
Traditional Astrology for Today: An Introduction,Book,http://www.amazon.com/dp/1934586226/,5,3
A History of Horoscopic Astrology,Book,http://www.amazon.com/dp/0866904638/,3,3
The Scientific Basis of Astrology: Tuning to the Music of the Planets,Book,http://www.amazon.com/dp/0312077955/,2,2
Primary Directions: Astrology's Old Master Technique,Book,http://www.amazon.com/dp/1902405390/,2,2
The Beginning of Wisdom (Translation From Hebrew),Book,http://www.amazon.com/dp/096622664X/,2,2
"Christian Astrology, Books 1 and 2",Book,http://www.amazon.com/dp/1933303026/,2,2
Astrology for Yourself: How to Understand And Interpret Your Own Birth Chart,Book,http://www.amazon.com/dp/0892541229/,2,1
Astrology and the Authentic Self: Integrating Traditional and Modern Astrology to Uncover the Essence of the Birth Chart,Book,http://www.amazon.com/dp/0892541490/,1,1
Your Secret Self: Illuminating the Mysteries of the Twelfth House,Book,http://www.amazon.com/dp/089254161X/,1,1
Chart Interpretation Handbook: Guidelines for Understanding the Essentials of the Birth Chart,Book,http://www.amazon.com/dp/0916360490/,1,1
"Astrology, Karma & Transformation: The Inner Dimensions of the Birth Chart",Book,http://www.amazon.com/dp/0916360547/,2,1
Lilith: Healing the Wild,Book,http://www.amazon.com/dp/1456433016/,1,1
Darkside Zodiac,Book,http://www.amazon.com/dp/1578633109/,1,1
"Person-to-Person Astrology: Energy Factors in Love, Sex and Compatibility",Book,http://www.amazon.com/dp/1583942041/,1,1
The Only Astrology Book You'll Ever Need,Book,http://www.amazon.com/dp/1589796535/,3,1
The Art and Science of Hand Reading: Classical Methods for Self-Discovery through Palmistry,Book,http://www.amazon.com/dp/162055108X/,1,1
The Complete Guide to Chinese Astrology: The Most Comprehensive Study of the Subject Ever Published in the English Language,Book,http://www.amazon.com/dp/1842931113/,1,1
Works of Sahl & Masha'allah,Book,http://www.amazon.com/dp/1934586021/,1,1
Persian Nativities I: Masha'allah and Abu 'Ali,Book,http://www.amazon.com/dp/193458603X/,1,1
Introductions to Traditional Astrology,Book,http://www.amazon.com/dp/1934586153/,1,1
The Book of the Nine Judges,Book,http://www.amazon.com/dp/193458620X/,1,1
Orcus,eBooks,http://www.amazon.com/dp/B00A1P28K4/,1,1
The Forty Chapters of al-Kindi,eBooks,http://www.amazon.com/dp/B00AUYQC9E/,1,1
Stephen Arroyo's Chart Interpretation Handbook: Guidelines for Understanding the Essentials of the Birth Chart,eBooks,http://www.amazon.com/dp/B00CABC2LC/,1,1
The Way of the Shaman,Book,http://www.amazon.com/dp/0062503731/,2,1
Foundations of Astrology,eBooks,http://www.amazon.com/dp/B00NKBZNOE/,1,1
The Secret Power Within: Zen Solutions to Real Problems,Book,http://www.amazon.com/dp/0316583502/,1,1
Astrology (Teach Yourself),Book,http://www.amazon.com/dp/0340055138/,1,1
But What If We're Wrong?: Thinking About the Present As If It Were the Past,Book,http://www.amazon.com/dp/0399184139/,1,1
Astrology For Dummies,Book,http://www.amazon.com/dp/0470098406/,1,1
The Secret Language of Birthdays: Your Complete Personology Guide for Each Day of the Year,Book,http://www.amazon.com/dp/0525426884/,1,1
"The Jesus Mysteries: Was the ""Original Jesus"" a Pagan God?",Book,http://www.amazon.com/dp/0609807986/,3,1
All Around the Zodiac: Exploring Astrology's Twelve Signs,Book,http://www.amazon.com/dp/0738701114/,1,1
Midpoints: Identify & Integrate Midpoints Into Horoscope Synthesis (Special Topics in Astrology),Book,http://www.amazon.com/dp/0738709832/,1,1
"Llewellyn's 2017 Astrological Calendar: 84th Edition of the World's Best Known, Most Trusted Astrology Calendar",Book,http://www.amazon.com/dp/0738737585/,1,1
Born on a Rotten Day,Book,http://www.amazon.com/dp/0743225627/,1,1
Discovering Eris: The Symbolism and Significance of a New Planetary Archetype,Book,http://www.amazon.com/dp/0863158676/,1,1
Healing Pluto Problems,Book,http://www.amazon.com/dp/0877283982/,1,1
