name,category,amazon_link,total_mentions,subreddit_mentions
VGA2USB - VGA Video Frame Grabber Capture Device via USB2,PC Accessory,http://www.amazon.com/dp/B000UO94DU/,1,1
ASUS 10/18W Power Adapter for Transformer Pad Series Tablets,Personal Computer,http://www.amazon.com/dp/B00CFIDQZG/,1,1
"ASUS Transformer Book T100HA-C4-GR 10.1-Inch 2 in 1 Touchscreen Laptop (Cherry Trail Quad-Core Z8500 Processor, 4GB RAM, 64GB Storage, Windows 10), Gray",Personal Computer,http://www.amazon.com/dp/B014854RGK/,9,1
"Anker Quick Charge 3.0 60W 6-Port USB Wall Charger, PowerPort+ 6 for Galaxy S7 / S6 / Edge / Plus, Note 5 / 4 and PowerIQ for iPhone 7 / 6s / Plus, iPad Pro / Air 2 / mini, LG, Nexus, HTC and More",Wireless,http://www.amazon.com/dp/B017JT6846/,4,1
"ASUS Transformer Book T100HA-C4-GR 10.1-Inch 2 in 1 Touchscreen Laptop (Cherry Trail Quad-Core Z8500 Processor, 4GB RAM, 64GB Storage, Windows 10), Gray (Certified Refurbished)",Personal Computer,http://www.amazon.com/dp/B01MQDFK96/,1,1
