name,category,amazon_link,total_mentions,subreddit_mentions
"HSI Professional Glider | Ceramic Tourmaline Ionic Flat Iron Hair Straightener | Straightens & Curls with Adjustable Temp | Incl Glove, Pouch, & Travel Size Argan Oil Hair Treatment | Packaging Varies",Beauty,http://www.amazon.com/dp/B001MA0QY2/,8,1
Kose SOFTYMO Speedy Bubble Cleansing Oil - 200ml,Beauty,http://www.amazon.com/dp/B004P8B21E/,1,1
Every Drop Beauty Spatula,Beauty,http://www.amazon.com/dp/B0069VYSFM/,28,1
LORAC PRO To Go Palette,Prestige Beauty,http://www.amazon.com/dp/B00DHGC9EY/,1,1
"EcoTools Cruelty Free and Eco Friendly Smooth Detangler Paddle Brush, Made with Recycled and Sustainable Materials",Beauty,http://www.amazon.com/dp/B00GNA9WG4/,1,1
"Maybelline New York Color Sensational Color Elixir Lip Color, Breathtaking Apricot, 0.17 Fluid Ounce",Beauty,http://www.amazon.com/dp/B00HKH0VBO/,1,1
Vera Mona Color Switch Duo Removes Shadow from Your Brush,Beauty,http://www.amazon.com/dp/B00HLV4EB2/,2,1
"Maybelline Color Sensational Creamy Matte Lipstick, Touch of Spice, 0.15 oz.",Beauty,http://www.amazon.com/dp/B00N6YEI6O/,4,1
Sorbus 5-Tier Acrylic Cosmetic and Makeup Storage Case Organizer,Home,http://www.amazon.com/dp/B013J15U9M/,1,1
Phantom YoYo 6pcs BB Sponges for BB Cushion DIY Case Kit,Beauty,http://www.amazon.com/dp/B01DF90SAE/,3,1
BS-MALL(TM) Premium 14 Pcs Synthetic Foundation Powder Concealers Eye Shadows Silver Black Makeup Brush Sets(Rose Golden),Beauty,http://www.amazon.com/dp/B01LZ3RLPC/,3,1
