name,category,amazon_link,total_mentions,subreddit_mentions
OurPets IQ Treat Ball Interactive Food Dispensing Dog Toy,Pet Products,http://www.amazon.com/dp/B003ARUKTG/,41,2
Mars Veterinary Wisdom Panel 2.5 Breed Identification DNA Test Kit,Pet Products,http://www.amazon.com/dp/B00U9AJB24/,10,2
Springer Dog Exerciser,Pet Products,http://www.amazon.com/dp/B0017NM4OE/,6,1
Walky Dog Plus Hands Free Dog Bicycle Exerciser Leash 2017 Newest Model with 550-lbs pull strength Paracord Leash Military Grade,Pet Products,http://www.amazon.com/dp/B003OYIAW4/,22,1
"StarMark Bob-A-Lot Interactive Dog Toy, Small",Pet Products,http://www.amazon.com/dp/B003YHB8EI/,13,1
"Trixie Move-2-Win, Level 3",Pet Products,http://www.amazon.com/dp/B0054LTPTC/,4,1
