name,category,amazon_link,total_mentions,subreddit_mentions
"BESTEK 150W 2-Socket Cigarette Lighter Power Adapter DC Outlet Splitter 3.1A Dual USB Car Charger for iPhone X/8/7/6s/6 Plus, iPad, Samsung Galaxy S6/S6 Edge and More",Automotive Parts and Accessories,http://www.amazon.com/dp/B003YJ8TVQ/,6,1
"BlueDriver Bluetooth Professional OBDII Scan Tool for iPhone, iPad & Android",Automotive Parts and Accessories,http://www.amazon.com/dp/B00652G4TS/,7,1
Slime 20144 Professional Mushroom Style Tire Plug with Glue,Automotive Parts and Accessories,http://www.amazon.com/dp/B008FHWXAU/,1,1
E Support 12v Car Add-a-circuit Fuse TAP Adapter Mini ATM APM Blade Fuse Holder Pack of 5,Home Improvement,http://www.amazon.com/dp/B00SUTYYS2/,8,1
"Funny Bumper Sticker Decal - Band-Aid - Covers Scratches, Dents and Dings on Your Car, Truck, SUV, Etc.",Automotive Parts and Accessories,http://www.amazon.com/dp/B00VAZVTHW/,1,1
