name,category,amazon_link,total_mentions,subreddit_mentions
Warmness on the Soul,Music,http://www.amazon.com/dp/B0001Z64EU/,1,1
"Audio Technica AT-LP60 Fully Automatic Stereo Turntable System, Silver",Musical Instruments,http://www.amazon.com/dp/B002GYTPAE/,41,1
Guitar Pick Display & Easel (Black 351 Style) - 100% MADE IN USA!,Musical Instruments,http://www.amazon.com/dp/B004XWDYO0/,2,1
"Audio Technica AT-LP60BK Fully Automatic Belt-Drive Stereo Turntable, Black",CE,http://www.amazon.com/dp/B008872SIO/,16,1
Avenged Sevenfold - God Hates Us Soft T-Shirt,Apparel,http://www.amazon.com/dp/B00COLTAE0/,1,1
"Purple Burning Sun Tapestry, Celestial Sun Moon Planet Tapestries, Hippie Hippy Wall Hanging, sun moon tapestry, twin Psychedelic tapestry, Burning Sun Tapestries",Home,http://www.amazon.com/dp/B00UOYYBAC/,1,1
"Album Frame Sized 12.5 x 12.5 inches - Made to Display Standard Album Covers, Vinyl Covers, Record Covers and LPs - Perfect Square Frame for Album Covers",Home,http://www.amazon.com/dp/B00XCZQ5UE/,2,1
"Trends International Avenged Sevenfold Holy Reaper Wall Poster 22.375"" x 34""",Home,http://www.amazon.com/dp/B01LZB7E3Y/,1,1
