name,category,amazon_link,total_mentions,subreddit_mentions
API FRESHWATER MASTER TEST KIT 800-Test Freshwater Aquarium Water Master Test Kit,Pet Products,http://www.amazon.com/dp/B000255NCI/,216,3
25 Foot - Python No Spill Clean and Fill Aquarium Maintenance System,Pet Products,http://www.amazon.com/dp/B000255NXC/,44,1
Seachem Prime 500ml,Pet Products,http://www.amazon.com/dp/B00025694O/,39,1
Wardley Shrimp Pellet Fish Food for Bottom and Algae Eaters - 9oz,Pet Products,http://www.amazon.com/dp/B00026Z444/,1,1
Penn Plax Cascade 500 GPH Canister Filter,Pet Products,http://www.amazon.com/dp/B0002DJIQW/,1,1
Zoo Med Floating Turtle Log,Pet Products,http://www.amazon.com/dp/B000BN3EQS/,1,1
IceProbe Thermoelectric Aquarium Chiller - 4 in. x 4 3/4 in. x 7 1/2 in.,Pet Products,http://www.amazon.com/dp/B001JSVLBO/,5,1
API GH & KH TEST KIT Freshwater Aquarium Water Test Kit,Pet Products,http://www.amazon.com/dp/B003SNCHMA/,9,1
"Active Aqua Chiller, 1/10 HP",Lawn & Patio,http://www.amazon.com/dp/B0048IVBT4/,3,1
"XY-380 Aquarium Fish Tank Biochemical Sponge Filter, 4-1/2-Inch",Pet Products,http://www.amazon.com/dp/B0051XIN78/,13,1
XY-2822 Air Pump Double Sponge Water Filter for Aquarium,Pet Products,http://www.amazon.com/dp/B005VAFGKI/,18,1
"24"" Surgical Grade Stainless Steel Tweezers",Beauty,http://www.amazon.com/dp/B009H6WREK/,1,1
JEBO F-9020 Aquarium Cooling System Fan,Pet Products,http://www.amazon.com/dp/B00ESWVD3E/,1,1
MaxxAir HVDF6 High Velocity 6-Inch Metal 5V Desk Fan with 3 Polypropylene Blades,Home Improvement,http://www.amazon.com/dp/B00KWMQ5EG/,1,1
iPettie Aquarium Cooling System Fan Chiller + AC Adapter (2 Fan),Pet Products,http://www.amazon.com/dp/B00L54ZYAQ/,1,1
iPettie Aquarium Cooling System Fan Chiller + AC Adapter (5-Fan),Pet Products,http://www.amazon.com/dp/B00M9UV9R2/,1,1
"Finnex Stingray Aquarium LED Light, 20-Inch",Pet Products,http://www.amazon.com/dp/B00NAFQ6FK/,13,1
"Petzilla Aquarium Chiller, Fish Tank Cooling Fan System for Salt Fresh Water (4-Fan)",Pet Products,http://www.amazon.com/dp/B01DXHFI9E/,1,1
