name,category,amazon_link,total_mentions,subreddit_mentions
"The Practice of System and Network Administration, Second Edition",Book,http://www.amazon.com/dp/0321492668/,19,1
"Handbook of MRI Scanning, 1e",Book,http://www.amazon.com/dp/0323068189/,1,1
"Musculoskeletal MRI, 2e",Book,http://www.amazon.com/dp/1416055347/,1,1
"The Essential Physics of Medical Imaging, Third Edition",Book,http://www.amazon.com/dp/0781780578/,1,1
"Bontrager's Textbook of Radiographic Positioning and Related Anatomy, 9e",Book,http://www.amazon.com/dp/0323399665/,1,1
Handbook of Interventional Radiologic Procedures (Lippincott Williams & Wilkins Handbook Series),Book,http://www.amazon.com/dp/0781768160/,1,1
"Merrill's Atlas of Radiographic Positioning and Procedures: 3-Volume Set, 13e",Book,http://www.amazon.com/dp/0323263410/,1,1
"Radiographic Image Analysis, 4e",Book,http://www.amazon.com/dp/0323280528/,1,1
