name,category,amazon_link,total_mentions,subreddit_mentions
TOM CLANCY’S Rainbow Six SIEGE Season Pass [Online Game Code],Digital Video Games,http://www.amazon.com/dp/B018RGK5YY/,6,5
HORI Tactical Assault Commander Pro (TAC Pro) KeyPad and Mouse Controller for PS4 and PS3 FPS Games Officially Licensed by Sony - PlayStation 4,Video Games,http://www.amazon.com/dp/B01JTOWU0K/,15,2
Audio Technica ATH-AD700X Audiophile Headphones,Speakers,http://www.amazon.com/dp/B009S332TQ/,68,2
SteelSeries QcK+ Gaming Mouse Pad - Black,CE,http://www.amazon.com/dp/B000UVRU6G/,41,2
"Tactical Military Airsoft M88 PASGT Kelver Swat Helmet with Clear Visor, Olive Drab",Sports,http://www.amazon.com/dp/B019O204IW/,2,2
"Rainbow Six (John Clark Novel, A)",Book,http://www.amazon.com/dp/0425170349/,4,2
Collectable MILITARY AIR FORCE Jet Pilot Flight Helmet Open Face Gloss black,Sports,http://www.amazon.com/dp/B00FZEN5E4/,2,2
Gerber Ding-Dong Breaching Tool [30-000790],Sports,http://www.amazon.com/dp/B00KYO6BXM/,5,2
Combat and Survival - Complete 28 Volume Set - What it Takes to Fight and Win,Book,http://www.amazon.com/dp/B000HD0MO4/,3,1
Stansport 12 Gauge Shotshell Thermo Bottle 25-Ounce - Red,Sports,http://www.amazon.com/dp/B000IL8KI0/,1,1
Hobart 770096 Welding Oxy-Acetylene Goggle - 50mm Eye Cup,Home Improvement,http://www.amazon.com/dp/B0017Z04SK/,8,1
"UTG Law Enforcement Tactical SWAT Vest, Black",Sports,http://www.amazon.com/dp/B001BR1O74/,4,1
Audio Technica ATH-EQ300M PL Purple | Ear-Fit Headphones (Japan Import),Speakers,http://www.amazon.com/dp/B001DDIJ24/,2,1
Sony ECM-NV1 Short Monoaural Electolet Condenser Microphone with XLR Connection for the DSR-PD170 Camcorder.,Photography,http://www.amazon.com/dp/B001DHB6WU/,1,1
"Forney 54722 Battery Charger Clamps, 500-Amp, Commercial Grade",Home Improvement,http://www.amazon.com/dp/B001EOI1IO/,1,1
AKG Pro Audio K702 Channel Studio Headphones,Speakers,http://www.amazon.com/dp/B001RCD2DW/,10,1
Speedfeed Mossberg I Magazine Stock (500/590 12 gauge),Sports,http://www.amazon.com/dp/B001RIF9PK/,1,1
Ultraviolet UV Theft Detection Powder & Ultraviolet UV LED Flashlight Combo,Home Improvement,http://www.amazon.com/dp/B0038AM1QU/,10,1
BGR Mods No Scope Decal,Automotive Parts and Accessories,http://www.amazon.com/dp/B003F1M3Q0/,2,1
Superlux HD668B Dynamic Semi-Open Headphones,CE,http://www.amazon.com/dp/B003JOETX8/,138,1
Sennheiser HD 598 Over-Ear Headphones - Ivory,Speakers,http://www.amazon.com/dp/B0042A8CW2/,139,1
Sennheiser HD 558 Headphones,Speakers,http://www.amazon.com/dp/B004FEEY9A/,134,1
"Ultimate Arms Gear Tactical Entry Operation SWAT Police Military Law Enforcement Assault Vest, Right Handed, Black",Sports,http://www.amazon.com/dp/B004R7G33K/,2,1
"Passion Lubes, Natural Water-Based Lubricant, 55 Gallon Drum",Health and Beauty,http://www.amazon.com/dp/B005MR3IVO/,713,1
Goofy Teeth-fake Teeth-prank Gag by Loftus,Toy,http://www.amazon.com/dp/B0072UGPZU/,1,1
"Craftsman 9-45714 Curve Jaw Locking Pliers, 10""",Home Improvement,http://www.amazon.com/dp/B007C6LIPG/,1,1
Kirkland Signature Stretch Tite Plastic Food Wrap 11 7/8 Inch X 750 SQ. FT.,Home,http://www.amazon.com/dp/B007MWNFBA/,2,1
Docter Optic Colt Sight Mount 58967,Sports,http://www.amazon.com/dp/B0081G3Y3A/,1,1
Pulse Elite Edition Wireless Stereo Headset,Video Games,http://www.amazon.com/dp/B0087OZ5FG/,11,1
"Consumer Electronic Products Smartphone Headset to PC Adapter - Use a 3.5mm iPhone/Smartphone Headset With Your PC, Converts 3.5mm Plug to Dual Mic/Audio 3.5mm, for Skype/VOIP (01-PH35-PC35) Supply Store",Speakers,http://www.amazon.com/dp/B008OB2NHA/,27,1
"Twinings Pure Peppermint Herbal Tea, 1.41 Ounce Box, 20 Count",Grocery,http://www.amazon.com/dp/B009L6Q2YW/,1,1
Audio Technica AUD ATHAD500X Audiophile Open-Air Headphones,Speakers,http://www.amazon.com/dp/B009S333U4/,30,1
"TP-Link AV600 Nano Powerline Adapter Starter Kit, up to 600Mbps (TL-PA4010KIT)",Personal Computer,http://www.amazon.com/dp/B00AWRUICG/,292,1
5x Battery Box Holder Case for 4 AA Batteries 6V with Wire,Home Improvement,http://www.amazon.com/dp/B00C4PU612/,1,1
BladesUSA Rubber Training Gun Black and Red Head Painting,Sports,http://www.amazon.com/dp/B00CHKIMRY/,1,1
"Logitech G430 7.1 DTS Headphone: X and Dolby Surround Sound Gaming Headset for PC, Playstation 4 – On-Cable Controls – Sports-Performance Ear Pads – Rotating Ear Cups – Light Weight Design",Personal Computer,http://www.amazon.com/dp/B00CQ35C1Q/,58,1
"ASG Dan Wesson 8"" CO2 Powered Airgun Revolver",Sports,http://www.amazon.com/dp/B00CSSGVXC/,1,1
LOHAS 100W LED Chip Warm White Bulb High Power Energy Saving Lamp Chip,Lighting,http://www.amazon.com/dp/B00CZ6QDDU/,6,1
"Gaming Mouse, UtechSmart Venus 16400 DPI High Precision Laser MMO Gaming Mouse [ IGN's PICK]",Personal Computer,http://www.amazon.com/dp/B00FNKMVUO/,37,1
"Audio-Technica ATH-M50x Professional Monitor Headphones, Black",Musical Instruments,http://www.amazon.com/dp/B00HVLUR86/,221,1
LEGO Hero Factory 44022 EVO XL Machine,Toy,http://www.amazon.com/dp/B00IANU79S/,1,1
"HyperX KHX-H3CL/WR Cloud Gaming Headset for PC, Xbox One, Xbox One S, PS4, PS4 Pro, Mac, Mobile and VR - Black",Personal Computer,http://www.amazon.com/dp/B00JJNQG98/,145,1
JACKYLED 2-pack 36W Cree Flood LED Beam Light Bars 12V 7 inches Super Bright White 6000K 4000 lms for Jeeps Off-road Vehicles ATVs SUVs Marine,Home Improvement,http://www.amazon.com/dp/B00K0FB5V8/,1,1
Tom Clancy's Rainbow Six Siege - PC,Video Games,http://www.amazon.com/dp/B00KUYQZAU/,3,1
Tom Clancy's Rainbow Six Siege - Xbox One,Video Games,http://www.amazon.com/dp/B00KVHSNB0/,7,1
Tom Clancy's Rainbow Six Siege - PlayStation 4,Video Games,http://www.amazon.com/dp/B00KVHSOX2/,6,1
FiiO E10K USB DAC and Headphone Amplifier (Black),Wireless,http://www.amazon.com/dp/B00LP3AMC2/,163,1
"Brainwavz Replacement Memory Foam Earpads - Suitable For Many Other Large Over The Ear Headphones - AKG, HifiMan, ATH, Philips, Fostex",Speakers,http://www.amazon.com/dp/B00MFDT894/,58,1
"ASUS ROG SWIFT 27-inch 144Hz G-SYNC Gaming 3D Monitor [PG278Q] 1440p, 1ms Rapid Response Time, 2560 x 1440 WQHD Full HD Display with Pivot, Tilt, and Swivel, USB 3.0, Display Port",Personal Computer,http://www.amazon.com/dp/B00MSOND8C/,88,1
"EOTech GPNVG Ground Panoramic Night Vision Goggle System Kit,LE,NVIS Mount,Tan GPG-000-A19",Sports,http://www.amazon.com/dp/B00N8WXNF6/,3,1
"ClearArmor 141001 Shooters Hearing Protection Safety Ear Muffs Folding-Padded Head Band Ear Cups, Black",Home Improvement,http://www.amazon.com/dp/B00NKSMPZW/,25,1
Adidas GSG9 Trail Hiking Shoes Womens Sz 10,Shoes,http://www.amazon.com/dp/B00PKPC6CK/,1,1
Antlion Audio ModMic Attachable Boom Microphone - Noise Cancelling with Mute Switch,Speakers,http://www.amazon.com/dp/B00R98JVVU/,45,1
Best Choice Products Hanging Chaise Lounger Chair Arc Stand Air Porch Swing Hammock Chair Canopy Teal,Lawn & Patio,http://www.amazon.com/dp/B00S8UT6YK/,1,1
HyperX Cloud II Gaming Headset for PC & PS4 - Gun Metal (KHX-HSCP-GM),Personal Computer,http://www.amazon.com/dp/B00SAYCVTQ/,74,1
"HyperX Cloud II Gaming Headset for PC & PS4 & Xbox One, Nintendo Switch - Red (KHX-HSCP-RD)",Personal Computer,http://www.amazon.com/dp/B00SAYCXWG/,82,1
Antlion Audio ModMic 4.0 Attachable Boom Microphone - Omni-Directional with Mute Switch,Speakers,http://www.amazon.com/dp/B00T6XUL8S/,79,1
"Military Outdoor Clothing Never Issued Olive Drab General Purpose Strap, Green",Sports,http://www.amazon.com/dp/B00TX8YL2I/,1,1
"HOLOSUN HS403C Solar Power Micro Red Dot Sight, Black",Sports,http://www.amazon.com/dp/B00U2KMVCI/,6,1
Tom Clancy's Rainbow Six Siege [Online Game Code],Digital Video Games,http://www.amazon.com/dp/B00VF6A5JE/,4,1
WD 2TB Black My Passport Ultra Portable External Hard Drive - USB 3.0 - WDBBKD0020BBK-NESN [Old Model],Personal Computer,http://www.amazon.com/dp/B00W8XXYSM/,23,1
Sky Viper Video Drone (V950HD) High Definition Vehicle,Toy,http://www.amazon.com/dp/B00XVPJC4G/,2,1
Barbie and Her Sisters: Puppy Rescue - Wii U,Video Games,http://www.amazon.com/dp/B00Y4S4N34/,1,1
"Kootek Vertical Stand with Cooling Fan for PS4, Controllers Charging Station with Dual Charger Ports and USB HUB for PlayStation 4 Console Dualshock 4 ( Not for PS4 Slim / Pro )",CE,http://www.amazon.com/dp/B00Y8CQCXA/,2,1
Pyramex S1015 Polythylene Aluminum Bound PETG Face Shield - Shield Only,Home Improvement,http://www.amazon.com/dp/B00YA27E8A/,1,1
"Turtle Beach Ear Force Recon 50 Gaming Headset for PlayStation 4, Xbox One, & PC/Mac",Personal Computer,http://www.amazon.com/dp/B00ZC3S818/,5,1
Razer Tartarus Chroma Expert RGB Gaming Keypad with 25 Programmable Keys Including an 8-way Thumb-pad,Personal Computer,http://www.amazon.com/dp/B00ZTRW00C/,20,1
Tom Clancy's Rainbow Six Siege - Gold Edition - PlayStation 4 [Download Code],Digital Video Games,http://www.amazon.com/dp/B010GM4CKA/,1,1
"adidas Outdoor Men's GSG9 Trail Running Shoe, Dark Grey/Black/White, 10 M US",Shoes,http://www.amazon.com/dp/B0115QRE6U/,1,1
"adidas Outdoor Women's Gsg9 Trail Running Shoe, Raw Purple/Black/Super Purple, 9.5 M US",Shoes,http://www.amazon.com/dp/B0116E9I6A/,1,1
Sennheiser HD 598 Special Edition Over-Ear Headphones - Black,Speakers,http://www.amazon.com/dp/B0126HISOO/,93,1
AmazonBasics RJ45 Cat-6 Ethernet Patch Cable - 50 Feet (15.2 Meters),Personal Computer,http://www.amazon.com/dp/B0134QJH4G/,2,1
"ASTRO Gaming A40 TR  Gaming Headset - White - Xbox One, PS4, PC",Video Games,http://www.amazon.com/dp/B014H326ES/,1,1
Tom Clancy's Rainbow Six Siege (Beta) - [Uplay Code],Digital Video Games,http://www.amazon.com/dp/B014K1HFAW/,2,1
USB Gaming Headset-SADES A60/OMG Computer Over Ear Stereo Heaphones With Microphone Noise Isolating Volume Control LED Light (Black+White) For PC & MAC,PC Accessory,http://www.amazon.com/dp/B01A73ZIL0/,5,1
"FLATSEVEN Men's Classic Henley Long Sleeve Shirt Buttoned (THL101) Charcoal, L",Apparel,http://www.amazon.com/dp/B01AF0MG74/,1,1
Kinsal Ergonomic Leather High-back Swivel Chair with Headrest and Lumbar Support - Blue,Furniture,http://www.amazon.com/dp/B01AW9XDVG/,1,1
"SteelSeries Rival 700 Gaming Mouse, OLED Display, Tactile Alerts, 16000 CPI, Multicolor - Black",Personal Computer,http://www.amazon.com/dp/B01AZC3I6U/,4,1
"Acer Predator XB241H bmipr 24-inch Full HD 1920x1080 NVIDIA G-Sync Display, 144Hz, 2 x 2w speakers, HDMI & DP",Personal Computer,http://www.amazon.com/dp/B01C05C1OK/,15,1
LA Police Gear Urban Ops Tactical Pants Khaki 36 x 30,Apparel,http://www.amazon.com/dp/B01CF3MWEG/,1,1
"ASUS ZenBook Pro UX501VW-US71 15.6-Inch 4K Touchscreen Laptop (Core i7-6700HQ CPU, 16 GB DDR4, 512 GB NVMe SSD, GTX960M GPU, Thunderbolt III, Windows 10 MS Signature image)",Personal Computer,http://www.amazon.com/dp/B01CQRNBJG/,56,1
"ASUS 24-inch 144Hz Full HD FreeSync Gaming 3D Monitor [MG248Q] 1080p, 1ms Rapid Repsonse Time, HDMI, DVI-D, DisplayPort, Fliker Free Display with Pivot, Tilt, and Swivel",Personal Computer,http://www.amazon.com/dp/B01F9UC20Q/,5,1
"GLTECK XXL Large Mouse Pad, Extended Mousepad, 36""x16.5"" Non-Slip Rubber Big Mouse Pad, Stitched Edges with Carrying Bag(XXXL)",Office Product,http://www.amazon.com/dp/B01FU8TQFQ/,4,1
Original Russian Army Special Forces Assault Vest SMERSH AK by SPOSN SSO,Sports,http://www.amazon.com/dp/B01IW55TEG/,2,1
"Logitech G403 Prodigy RGB Gaming Mouse – 16.8 Million Color Backlighting, 6 Programmable Buttons, Onboard Memory, Up to 12,000 DPI",Personal Computer,http://www.amazon.com/dp/B01KUAMCV4/,19,1
Tom Clancy's Rainbow Six Siege: Pro League All Gold Sets - PS4 [Digital Code],Digital Video Games,http://www.amazon.com/dp/B01LWU0IIB/,1,1
Rainbow Six Siege Logo Style Hat,Apparel,http://www.amazon.com/dp/B01LXKC6CK/,1,1
Tactical Drop Leg Gun Holster Adjustable Right Handed Thigh Pistol Pouch,Sports,http://www.amazon.com/dp/B01LYYDGZ1/,1,1
XJBD Custom Superb Tom Clancy's Rainbow Six Siege Children School Bagpack Bag For 1-6 Years Old Pink,Book,http://www.amazon.com/dp/B01M06H5PP/,1,1
"ENVEL 3.5mm Jack Cable Headset Adapter Kit Mutual Convertors for Laptop,Mac,PS4,Smartphone,Xbox One,Tablet Earphone with Headphone/Microphone Simultaneously Y Splitter Audio 2 Female to 1 Male",Speakers,http://www.amazon.com/dp/B01M0T6PSF/,12,1
"EVGA GeForce GTX 1050 GAMING, 2GB GDDR5, DX12 OSD Support (PXOC) Graphics Card 02G-P4-6150-KR",Personal Computer,http://www.amazon.com/dp/B01M9FD3PC/,8,1
Customized Color Changing Mug Gift--Heat Changing Coffee Cup with Personalized Photo Cup & Spoon Set,Kitchen,http://www.amazon.com/dp/B01MYNHW3S/,1,1
Tom Clancy's Rainbow Six Siege Year 2 Pass - PS4 [Digital Code],Digital Video Games,http://www.amazon.com/dp/B01N5ADQ5A/,1,1
Tom Clancy's Rainbow Six Siege Year 2 Pass - Xbox One Digital Code,Digital Video Games,http://www.amazon.com/dp/B01NA9LTZ4/,1,1
Tom Clancy's Rainbow Six Siege Complete Edition [Online Game Code],Digital Video Games,http://www.amazon.com/dp/B06XX54NSJ/,1,1
Tom Clancy's Rainbow Six Siege Year 2 Pass [Online Game Code],Digital Video Games,http://www.amazon.com/dp/B06XXFQCDB/,1,1
"Acer Predator Helios 300 Gaming Laptop, 15.6"" Full HD, Intel Core i7-7700HQ CPU, 16GB DDR4 RAM, 256GB SSD, GeForce GTX 1060-6GB, VR Ready, Red Backlit KB, Metal Chassis, G3-571-77QK",Personal Computer,http://www.amazon.com/dp/B06Y4GZS9C/,220,1
The Death of Expertise: The Campaign Against Established Knowledge and Why it Matters,Book,http://www.amazon.com/dp/0190469412/,9,1
ASTRO Gaming A10 Gaming Headset - Green/Black - Xbox One,Video Games,http://www.amazon.com/dp/B071S9R9YB/,1,1
"The Mythical Man-Month: Essays on Software Engineering, Anniversary Edition (2nd Edition)",Book,http://www.amazon.com/dp/0201835959/,37,1
