name,category,amazon_link,total_mentions,subreddit_mentions
The Nun's Story,Book,http://www.amazon.com/dp/0316381357/,1,1
Ender's Game (The Ender Quintet),Book,http://www.amazon.com/dp/0812550706/,11,1
"The ADHD Workbook for Kids: Helping Children Gain Self-Confidence, Social Skills, and Self-Control (Instant Help Book for Parents & Kids)",Book,http://www.amazon.com/dp/1572247665/,1,1
The Windup Girl,Book,http://www.amazon.com/dp/1597801585/,8,1
Gone with the Wind,Book,http://www.amazon.com/dp/B000GISOGS/,1,1
