name,category,amazon_link,total_mentions,subreddit_mentions
"Government Bullies: How Everyday Americans Are Being Harassed, Abused, and Imprisoned by the Feds",Book,http://www.amazon.com/dp/1455522759/,1,1
Our Presidents & Their Prayers: Proclamations of Faith by America's Leaders,Book,http://www.amazon.com/dp/1455535737/,1,1
"True and Constant Friends: Love and Inspiration from Our Grandmothers, Mothers, and Friends",Book,http://www.amazon.com/dp/1455560758/,1,1
For Liberty: How the Ron Paul Revolution Watered the Withered Tree of Liberty,DVD,http://www.amazon.com/dp/B002QFJC7Y/,1,1
Taking a Stand: Moving Beyond Partisan Politics to Unite America,eBooks,http://www.amazon.com/dp/B00DTUHLI2/,1,1
