name,category,amazon_link,total_mentions,subreddit_mentions
Thin Ice: A Season in Hell With the New York Rangers,Book,http://www.amazon.com/dp/0440185718/,1,1
Losing the Edge: The Rise and Fall of the Stanley Cup Champion New York Rangers,Book,http://www.amazon.com/dp/0684815192/,1,1
"The Good, the Bad, & the Ugly: New York Rangers: Heart-Pounding, Jaw-Dropping, and Gut-Wrenching Moments from New York Rangers History",Book,http://www.amazon.com/dp/1572439653/,1,1
Take Your Eye Off the Puck: How to Watch Hockey By Knowing Where to Look,Book,http://www.amazon.com/dp/1629371203/,23,1
Hockey Abstract Presents... Stat Shot: The Ultimate Guide to Hockey Analytics,Book,http://www.amazon.com/dp/177041309X/,1,1
NHL Original Six Series - The New York Rangers 1994 Stanley Cup Champions,Sports,http://www.amazon.com/dp/B000EGEJIO/,2,1
"NHL New York Rangers Premier Jersey, Blue, X-Large",Apparel,http://www.amazon.com/dp/B0010OF9T2/,1,1
"Hold Me, Thrill Me, Kiss Me",Music,http://www.amazon.com/dp/B001546PGI/,1,1
NHL New York Rangers Chrome Plate Frame,Sports,http://www.amazon.com/dp/B001PR0QM4/,1,1
"Skittles Sour Candy, 3.3 ounce (24 Share Size Packs)",Grocery,http://www.amazon.com/dp/B003YZ3LHC/,1,1
"NHL New York Rangers Pet Jersey,  X-Large",Apparel,http://www.amazon.com/dp/B004XOA27U/,1,1
"JOBY GripTight Mount - Universal Stand for Smartphones (2.1"" - 2.8"" wide) including iPhone 6, iPhone 7 and iPhone 8",Wireless,http://www.amazon.com/dp/B009GHYLKS/,6,1
Tokens & Icons NHL Game-Used Jersey Wallet (81-NHL-P),Apparel,http://www.amazon.com/dp/B00C1SSW2M/,1,1
Snow Joe iON18SB Ion Cordless Single Stage Brushless Snow Blower with Rechargeable Ecosharp 40-volt Lithium-Ion Battery,Lawn & Patio,http://www.amazon.com/dp/B00E3OXF6A/,1,1
1 X New York Rangers 2 Oz Clear Shot Glass New York,Kitchen,http://www.amazon.com/dp/B00GKTC2NI/,1,1
Pretty Women Beauty Silicone Face Slimmer Mouth Muscle Tightener Present,Home Improvement,http://www.amazon.com/dp/B00STNDXVS/,4,1
"NHL Washington Capitals Dog Collar, Large, Red",Sports,http://www.amazon.com/dp/B00VN1IW3W/,1,1
French Toast Crunch Cereal 19 oz Box,Pantry,http://www.amazon.com/dp/B00Z9ZUZ92/,2,1
"Blizzard Bay Men's Santa Jersey Ugly Christmas Sweater, Blue/Red/White, X-Large",Apparel,http://www.amazon.com/dp/B012TJC4YE/,1,1
"Blizzard Bay Men's Santa Jersey Ugly Christmas Sweater, Blue/Red/White, Small",Apparel,http://www.amazon.com/dp/B012TJG7RO/,1,1
Rangers Greatest Plays - Slate Coasters (Set of 4),Kitchen,http://www.amazon.com/dp/B015M6RZZ4/,1,1
Uideazone Unisex 3D Fashion Graffiti Crewneck Tank Hoodie Sweatshirt Shirt White,Apparel,http://www.amazon.com/dp/B017809A82/,1,1
"Protective Knee Pads, Thick Sponge Anti-slip, Collision Avoidance Knee Sleeve (Large)",Sports,http://www.amazon.com/dp/B01L379FPE/,2,1
Funko 11210 NHL Henrik Lundqvist Pop Figure,Toy,http://www.amazon.com/dp/B01LEJDP6G/,1,1
"Premium Mini Tripod with phone mount, Fugetek Table Top stand for Gopro, Smartphones, Compact Cameras and DSLRs",Photography,http://www.amazon.com/dp/B01LY7HYWU/,1,1
2017 NHL New York Rangers 90th Anniversary Official Hockey Game Jersey Patch,Sports,http://www.amazon.com/dp/B01M0N5EO6/,1,1
