name,category,amazon_link,total_mentions,subreddit_mentions
"Passion Lubes, Natural Water-Based Lubricant, 55 Gallon Drum",Health and Beauty,http://www.amazon.com/dp/B005MR3IVO/,273,2
Wabi Sabi: The Japanese Art of Impermanence,eBooks,http://www.amazon.com/dp/B007UPDDWU/,,1
The Life-Changing Magic of Tidying Up: The Japanese Art of Decluttering and Organizing,Book,http://www.amazon.com/dp/1607747308/,39,1
Kershaw 1660 Ken Onion Leek,Sports,http://www.amazon.com/dp/B0009VC9Y0/,11,1
Baratza Encore Conical Burr Coffee Grinder with Bin,Kitchen,http://www.amazon.com/dp/B00LW8122Y/,7,1
Echo Dot (2nd Generation) - Black,Amazon Home,http://www.amazon.com/dp/B01DFKC2SO/,4,1
ZERO AUDIO-ear stereo headphone carbo Tenore ZH-DX200-CT,Speakers,http://www.amazon.com/dp/B0093VVP0Q/,2,1
Trident Skull & Crossbones Denim Skull Cap,Sports,http://www.amazon.com/dp/B0051IFOU2/,1,1
"DMI Wood Dressing Stick, Button Aid and Zipper Pull, 9 ¼ Inches",Health and Beauty,http://www.amazon.com/dp/B000EWXSV2/,1,1
S-ZONE Oversized Canvas Genuine Leather Trim Travel Tote Duffel Shoulder Handbag Weekend Bag,Apparel,http://www.amazon.com/dp/B0107UPA9I/,1,1
MSI Computer GE60 APACHE-629; 9S7-16GH11-629 15.6-Inch Laptop,Personal Computer,http://www.amazon.com/dp/B00NNQDZRI/,1,1
OXO On Barista Brain 9 Cup Coffee Maker,Kitchen,http://www.amazon.com/dp/B00YEYKK8U/,1,1
Yasutomo Black Sumi Ink (Bokuju) 12 oz.,Art and Craft Supply,http://www.amazon.com/dp/B004O7AIUW/,1,1
"Old Spice Classic Deodorant , Original Scent, 3.25-Ounces (Pack of 6)",Beauty,http://www.amazon.com/dp/B0017WNFXE/,1,1
Shop Class as Soulcraft: An Inquiry into the Value of Work,Book,http://www.amazon.com/dp/0143117467/,1,1
Brother Designio Series DZ1234 Serger,Art and Craft Supply,http://www.amazon.com/dp/B00EJW5OTC/,1,1
JUKI MO644D Portable Serger,Art and Craft Supply,http://www.amazon.com/dp/B0014134IO/,1,1
JUKI TL-2000Qi Sewing and Quilting Machine,Art and Craft Supply,http://www.amazon.com/dp/B004C04YII/,1,1
"Hypoallergenic Pillow – ADJUSTABLE THICKNESS Bamboo Shredded Memory Foam Pillow - Kool-Flow Micro-Vented Bamboo Cover, Dust Mite Resistant & Machine Washable - Premium Quality - MADE IN USA - QUEEN",Home,http://www.amazon.com/dp/B00V909F4M/,1,1
"Brother SE400 Combination Computerized Sewing and 4x4 Embroidery Machine With 67 Built-in Stitches, 70 Built-in Designs, 5 Lettering Fonts",Art and Craft Supply,http://www.amazon.com/dp/B003AVMZA4/,1,1
Dritz Styling Design Ruler,Art and Craft Supply,http://www.amazon.com/dp/B001BDEOVG/,1,1
"Naked & Famous Denim Men's Weird Guy Elephant Selvedge Jean, Elephant, 32",Apparel,http://www.amazon.com/dp/B0120C9ISU/,1,1
"Naked & Famous Denim Men's Skinny Guy Elephant Selvedge, Elephant, 31",Apparel,http://www.amazon.com/dp/B0120CC8FK/,1,1
"Lodge EC6D53 Enameled Cast Iron Dutch Oven, 6-Quart, Emerald Green",Kitchen,http://www.amazon.com/dp/B0012N7G60/,1,1
