name,category,amazon_link,total_mentions,subreddit_mentions
"Crazy Aaron's Thinking Putty, 3.2 Ounce, Super Magnetic Strange Attractor",Toys & Games,https://www.amazon.com/Crazy-Aarons-Thinking-Putty-3-2oz/dp/B001BS3FHU,4,1
Levitating Air Bonsai Pot - Magnetic Levitation Suspension flower and air bonsai pot,"Patio, Lawn & Garden",https://www.amazon.com/Levitating-Air-Bonsai-Pot-Levitation/dp/B01JFBK8HO?ie=UTF8&amp;keywords=air,2,1
"Toysmith Bubble Motion Tumbler, Pack of 1",Toys & Games,https://www.amazon.com/dp/B004USMMVS/ref=cm_sw_r_cp_apa_Ju9Czb7DEFDQW,1,1
Kindling Cracker Firewood Kindling Splitter,"Patio, Lawn & Garden",https://www.amazon.com/dp/B00ZFS960C,1,1
6 inch Liquid Timer with Light (Age 10+) - mesmerizing to watch,Toys & Games,https://www.amazon.com/dp/B011VSZ0VS/ref=cm_sw_r_cp_api_qG8CzbSDFX5PM,1,1
Levitating Air Bonsai Pot - Magnetic Levitation Suspension flower and air bonsai pot,Home & Kitchen,https://www.amazon.com/Levitating-Air-Bonsai-Pot-Levitation/dp/B01EVF8OIO,1,1
In the Land of the Lawn Weenies: and Other Warped and Creepy Tales (Weenies Stories),Books,https://www.amazon.com/In-Land-Lawn-Weenies-Stories/dp/0765345706,1,1
