name,category,amazon_link,total_mentions,subreddit_mentions
Shure M44-7 Standard DJ Turntable Cartridge,Musical Instruments,http://www.amazon.com/dp/B00008W2LW/,8,1
"Polk Audio RTi12 High Output Floorstanding Loudspeaker (Single, Black)",Speakers,http://www.amazon.com/dp/B00011CRZE/,2,1
"Polk Audio DB6501 6.5-Inch 2-Way Component System (Pair, Silver)",Car Audio or Theater,http://www.amazon.com/dp/B000P0R6LQ/,8,1
Stanton T62 Straight Arm Direct-Drive DJ Turntable with 300 Cartridge Pre-Mounted,Musical Instruments,http://www.amazon.com/dp/B001JY9MB4/,2,1
Stanton T92USB USB Direct Drive DJ Turntable,Musical Instruments,http://www.amazon.com/dp/B00292BREU/,2,1
Logitech Speaker System Z323 with Subwoofer,CE,http://www.amazon.com/dp/B002FU5QM0/,18,1
Audio-Technica AT-LP120-USB Direct-Drive Professional Turntable in Silver,Speakers,http://www.amazon.com/dp/B002S1CJ2Q/,69,1
Sennheiser HD 598 Over-Ear Headphones - Ivory,Speakers,http://www.amazon.com/dp/B0042A8CW2/,139,1
Rockford Fosgate P3D4-12 Punch P3 DVC 4-Ohm 12-Inch 600-Watt RMS 1200-Watt Peak Subwoofer,Car Audio or Theater,http://www.amazon.com/dp/B004UFHXNI/,3,1
Sena SMH10-10 Motorcycle Bluetooth Headset / Intercom (Single),Automotive Parts and Accessories,http://www.amazon.com/dp/B0087NAWYQ/,5,1
Logitech 982-000104 UE 6000 Headphones - White,Speakers,http://www.amazon.com/dp/B0094S379U/,6,1
Yamaha RX-V675 7.2 Channel Network AV Receiver with Airplay (Discontinued by Manufacturer),Speakers,http://www.amazon.com/dp/B00B981F1U/,3,1
