name,category,amazon_link,total_mentions,subreddit_mentions
The Red Hot Chili Peppers: An Oral/Visual History,Book,http://www.amazon.com/dp/006135192X/,1,1
Red Hot Chili Peppers,Book,http://www.amazon.com/dp/1780972849/,1,1
Essential Red Hot Chili Peppers: Under The Covers,Music,http://www.amazon.com/dp/B00000635D/,1,1
Scar Tissue,Music,http://www.amazon.com/dp/B00001P4TX/,1,1
The Hunter,DVD,http://www.amazon.com/dp/B00005KHK0/,1,1
The Getaway (Deluxe Edition),DVD,http://www.amazon.com/dp/B0008ENHTY/,1,1
Desecration Smile,Music,http://www.amazon.com/dp/B000MTOSR0/,1,1
The Red Hot Chili Peppers: An Oral/Visual History [Hardcover],Book,http://www.amazon.com/dp/B00480FIFU/,1,1
Lullaby Versions of Nirvana,Music,http://www.amazon.com/dp/B005S4JA2C/,1,1
Lullaby Versions of Pantera,Music,http://www.amazon.com/dp/B00BNM1W38/,1,1
Lullaby Versions of Coheed and Cambria,Music,http://www.amazon.com/dp/B00I564DWW/,1,1
Peppers Greatest Hits (Explicit)(2LP Limited Edition Silver Vinyl),Music,http://www.amazon.com/dp/B0184MPKNM/,1,1
"Bravado Adult Red Hot Chili Peppers ""Doodle Logo"" White Slim Fit Tee Shirt",Apparel,http://www.amazon.com/dp/B01A779JCK/,1,1
Red Hot Chili Peppers RHCP Classic Asterisk For Women's T-shirts Black Large - Hill,Apparel,http://www.amazon.com/dp/B01AU5W8OU/,1,1
Lullaby Versions of Rammstein,Music,http://www.amazon.com/dp/B01DJQ890E/,1,1
The Getaway,Music,http://www.amazon.com/dp/B01F3REDMU/,1,1
Red Hot Chili Peppers poster wall decoration photo print 24x24 inches,Home,http://www.amazon.com/dp/B01MXMRHO3/,1,1
Red Hot Chili Peppers poster wall decoration photo print 24x24 inches,Home,http://www.amazon.com/dp/B01MYO9ZEL/,1,1
Red Hot Chili Peppers poster wall decoration photo print 24x24 inches,Home,http://www.amazon.com/dp/B01N9637J5/,1,1
Live On Air,Music,http://www.amazon.com/dp/B06Y1P8HQD/,1,1
