name,category,amazon_link,total_mentions,subreddit_mentions
Why Does He Do That?: Inside the Minds of Angry and Controlling Men,Books,https://www.amazon.com/gp/product/0425191656/sr=8-1/qid=1423940587/ref=olp_product_details?ie=UTF8&amp;me=&amp;qid=1423940587&amp;sr=8-1,9,1
The Fall of Freddie the Leaf: A Story of Life for All Ages,Books,https://www.amazon.com/The-Fall-Freddie-Leaf-Story/dp/0943432898,4,1
"The Verbally Abusive Relationship, Expanded Third Edition: How to recognize it and how to respond",Books,https://www.amazon.com/Verbally-Abusive-Relationship-Expanded-Third/dp/1440504636/ref=sr_1_1?ie=UTF8&amp;qid=1426849546&amp;sr=8-1&amp;keywords=patricia+evans,4,1
PetSafe Easy Walk Harness,Pet Supplies,https://www.amazon.com/PetSafe-Harness-Large-Black-Silver/dp/B0009ZBKG4/ref=sr_1_1?ie=UTF8&amp;qid=1423077119&amp;sr=8-1&amp;keywords=easy+walk+harness+premier,3,1
Ella Enchanted (Trophy Newbery),Books,https://www.amazon.com/Enchanted-Trophy-Newbery-Carson-Levine/dp/0064407055,1,1
"BodyMint, 60 Count Bottle","Health, Household & Baby Care",https://www.amazon.com/Body-Mint-60ct-BodyMint-Bottle/dp/B000B8WXWY/ref=sr_1_1?ie=UTF8&amp;qid=1421503631&amp;sr=8-1&amp;keywords=body+odor+eliminator,1,1
"Natural Intimate Personal Lubricant for Sensitive Skin, Isabel Fay - Water Based, Discreet Label - Best Personal Lube for Women and Men – Made in USA – Natural Personal Gel Without Glycerin (8 Oz)","Health, Household & Baby Care",https://www.amazon.com/gp/product/B00Q3GHPUS/ref=as_li_tl?ie=UTF8&amp;camp=1789&amp;creative=390957&amp;creativeASIN=B00Q3GHPUS&amp;linkCode=as2&amp;tag=everyneedsage-20&amp;linkId=DLMIWXUCYZ4S43XI,1,1
Good Grief: 50th Anniversary Edition,Books,https://www.amazon.com/Good-Grief-Anniversary-Granger-Westberg/dp/0800697812/ref=sr_1_1?ie=UTF8&amp;qid=1430144171&amp;sr=8-1&amp;keywords=good+grief+book.,1,1
Get Financially Naked: How to Talk Money with Your Honey,Books,https://www.amazon.com/Get-Financially-Naked-Money-Honey/dp/1440502013/ref=pd_sim_b_6?ie=UTF8&amp;refRID=0M2PBC830052PBPJ1TSH,1,1
Couples Money: What Every Couple Should Know about Money and Relationships,Books,https://www.amazon.com/Couples-Money-Couple-Should-Relationships/dp/1461148332,1,1
Rekindling Desire,Books,https://www.amazon.com/Rekindling-Desire-Barry-McCarthy/dp/0415823528,1,1
The World's Strongest Librarian: A Book Lover's Adventures,Books,https://www.amazon.com/The-Worlds-Strongest-Librarian-Adventures/dp/159240877X,1,1
Mindfulness for Borderline Personality Disorder: Relieve Your Suffering Using the Core Skill of Dialectical Behavior Therapy,Books,https://www.amazon.com/Mindfulness-Borderline-Personality-Disorder-Dialectical/dp/1608825655/ref=cm_lmf_tit_8,1,1
