name,category,amazon_link,total_mentions,subreddit_mentions
Future Perfect: Vintage Futuristic Graphics (Icons Series),Book,http://www.amazon.com/dp/3822815667/,2,2
Art of Atari,Book,http://www.amazon.com/dp/1524101036/,7,2
The lost starship (Starters stories),Book,http://www.amazon.com/dp/0382065794/,1,1
Logan: A Trilogy,Book,http://www.amazon.com/dp/044050404X/,1,1
The Metropolis of Tomorrow (Dover Architecture),Book,http://www.amazon.com/dp/0486437272/,1,1
Scouting for Boys: The Original 1908 Edition (Dover Books on Sports and Popular Recreations),Book,http://www.amazon.com/dp/0486457192/,1,1
The Ultimate Hitchhiker's Guide,Book,http://www.amazon.com/dp/0517149257/,1,1
The Rise and Fall of American Growth: The U.S. Standard of Living since the Civil War (The Princeton Economic History of the Western World),Book,http://www.amazon.com/dp/0691147728/,8,1
The future world of agriculture (Walt Disney World EPCOT Center book),Book,http://www.amazon.com/dp/0717281426/,1,1
TechTV's Catalog of Tomorrow,Book,http://www.amazon.com/dp/0789728109/,1,1
Yesterday's Tomorrows: Past Visions of the American Future,Book,http://www.amazon.com/dp/0801853990/,1,1
A Planet for Texans,Book,http://www.amazon.com/dp/0809501422/,1,1
002: Western Technology and Soviet Economic Development: 1930–1945 (Hoover Institution Press Publication),Book,http://www.amazon.com/dp/0817919015/,1,1
Parallel Lines: The Science Fiction Illustrations,Book,http://www.amazon.com/dp/0825695694/,1,1
DiFate's catalog of science fiction hardware,Book,http://www.amazon.com/dp/0894801260/,1,1
Metropolis of Tomorrow,Book,http://www.amazon.com/dp/0910413118/,1,1
Shelter (The Shelter Library of Building Books),Book,http://www.amazon.com/dp/0936070110/,2,1
N-1: For the Moon and Mars A Guide to the Soviet Superbooster (English and Russian Edition),Book,http://www.amazon.com/dp/0989991407/,1,1
The Cuckoo's Egg: Tracking a Spy Through the Maze of Computer Espionage,Book,http://www.amazon.com/dp/1416507787/,16,1
Moebius Library: The World of Edena,Book,http://www.amazon.com/dp/1506702163/,5,1
Art of Atari Poster Collection,Book,http://www.amazon.com/dp/1524103020/,1,1
Pin-Up Art of Dan DeCarlo,Book,http://www.amazon.com/dp/1560976195/,1,1
Saucer Attack!: Pop Culture in the Golden Age of Flying Saucers,Book,http://www.amazon.com/dp/1575440660/,1,1
"Popular Mechanics The Amazing Weapons That Never Were: Robots, Flying Tanks & Other Machines of War",Book,http://www.amazon.com/dp/158816862X/,1,1
"Popular Mechanics The Wonderful Future that Never Was: Flying Cars, Mail Delivery by Parachute, and Other Predictions from the Past",Book,http://www.amazon.com/dp/1588169758/,1,1
The Incal,Book,http://www.amazon.com/dp/1594650934/,8,1
Dan DeCarlo's Jetta (The Library of Good Girl Art) (The Good Girl Art Library),Book,http://www.amazon.com/dp/1600106463/,1,1
Frank R. Paul Art Book,Book,http://www.amazon.com/dp/1613772777/,1,1
Fear Agent Volume 1: Re-Ignition (2nd edition),Book,http://www.amazon.com/dp/161655536X/,5,1
The Art of Fallout 4,Book,http://www.amazon.com/dp/1616559802/,18,1
Ghost Cities of China: The Story of Cities without People in the World's Most Populated Country (Asian Arguments),Book,http://www.amazon.com/dp/178360218X/,1,1
The Movie Art of Syd Mead: Visual Futurist,Book,http://www.amazon.com/dp/1785651188/,3,1
As I See: The Fantastic World of Boris Artzybasheff,Book,http://www.amazon.com/dp/1845767675/,1,1
Hardware: The Definitive SF Works of Chris Foss,Book,http://www.amazon.com/dp/1848566980/,2,1
Russia in Space,Book,http://www.amazon.com/dp/1926837258/,6,1
Follies of Science: 20th Century Visions of Our Fantastic Future,Book,http://www.amazon.com/dp/1933108096/,1,1
Operating Manual for Spaceship Earth,Book,http://www.amazon.com/dp/3037781262/,1,1
Apple Design,Book,http://www.amazon.com/dp/3775730117/,1,1
Frederic Chaubin: Cosmic Communist Constructions Photographed,Book,http://www.amazon.com/dp/3836525194/,1,1
Keep It Simple: The Early Design Years of Apple,Book,http://www.amazon.com/dp/3897904071/,1,1
Arzach,Book,http://www.amazon.com/dp/3936480680/,1,1
Arzak / Arzach: El vigilante / The Watcher (Spanish Edition),Book,http://www.amazon.com/dp/8467906162/,1,1
Steel Couture - Syd Mead - Futurist Sentinel,Book,http://www.amazon.com/dp/9063325916/,1,1
Revere 1400 Line 7-Piece Set,Kitchen,http://www.amazon.com/dp/B00005B5ZA/,2,1
Presto 03430 Pizzazz Plus Rotating Oven,Kitchen,http://www.amazon.com/dp/B00005IBXJ/,24,1
Walt Disney Treasures - Tomorrow Land: Disney in Space and Beyond,DVD,http://www.amazon.com/dp/B0000BWVAI/,1,1
75 to 300 Ohm UHF/VHF Matching Transformer,CE,http://www.amazon.com/dp/B0002ZPIOG/,10,1
Futurama Zapp Brannigan Space Gun,Toy,http://www.amazon.com/dp/B0006GKFSA/,2,1
ART Pro Audio DJPRE II Phono Turntable Preamplifier,Musical Instruments,http://www.amazon.com/dp/B000AJR482/,120,1
Casio Men's DBC32-1A Data Bank Black Digital Watch,Watch,http://www.amazon.com/dp/B000AQVRWO/,6,1
Casio Men's CA53W-1 Calculator Watch,Watch,http://www.amazon.com/dp/B000GB1R7S/,40,1
Cuisinart CBK-100 2 LB Bread Maker,Kitchen,http://www.amazon.com/dp/B001C2KY7Y/,4,1
"HP LaserJet Pro P1606dn Printer - Old Version, (CE749A)",CE,http://www.amazon.com/dp/B0036TGGW8/,1,1
Georg Jensen Arne Jacobsen 5-piece Steel Cutlery Set,Kitchen,http://www.amazon.com/dp/B003GEIZMM/,2,1
"Pyle 2X120 Watt Home Audio Power Amplifier - Portable 2 Channel Surround Sound Stereo Receiver w/ USB IN - For Amplified Subwoofer Speaker, CD DVD, MP3, iPhone, Phone, Theater, PA System - PTAU45",Speakers,http://www.amazon.com/dp/B003OELGGG/,3,1
Alloy Indoor Bicycle Bike Rollers Roller TRAINER,Sports,http://www.amazon.com/dp/B005IN02ZC/,2,1
"Belkin Fridge Mount for iPad 2, 3rd Generation, and 4th Generation with Retina Display",Personal Computer,http://www.amazon.com/dp/B005NHR6MU/,2,1
RSVP Green Polyester Collapsible Market Basket with Pocket,Home,http://www.amazon.com/dp/B0096CDTA6/,1,1
"FineMod FMI1113-Red Alpha Egg Chair and Ottoman, Red",Furniture,http://www.amazon.com/dp/B009YY35PK/,1,1
Fujitsu ScanSnap iX500 Deluxe Bundle Scanner for PC (PA03656-B015) (Discontinued by Manufacturer),CE,http://www.amazon.com/dp/B00AYUI490/,4,1
You Will Live under the Sea,Book,http://www.amazon.com/dp/B00CCEEHKG/,1,1
Seiki SE22FR01 22-Inch  1080p 60Hz LED TV (Retro TV),Home Theater,http://www.amazon.com/dp/B00DQBA4D8/,1,1
"SodaStream Jet Sparkling Water Maker Starter Kit, Black and Silver",Kitchen,http://www.amazon.com/dp/B00EPEALEM/,9,1
Verbatim 5.25 Diskettes (10 Pcs),Speakers,http://www.amazon.com/dp/B00HOPMBBK/,1,1
"Sylvania Turntable Record Player with USB Encoding, Black",Speakers,http://www.amazon.com/dp/B00KADVQV4/,7,1
Atomic Power Plant by Retro Sci-Fi Science Fiction Energy Vintage Print Poster 24x16,Home,http://www.amazon.com/dp/B00NF0GQ28/,1,1
"LG 32LB640R Classic TV Television 32"" HD LED Retro Design IPS Display (220V) 2014 New model",CE,http://www.amazon.com/dp/B00QAG371C/,2,1
Hell Divers (The Hell Divers Trilogy Book 1),eBooks,http://www.amazon.com/dp/B01BW6CG1Q/,1,1
The Millennial Project: Colonizing the Galaxy in Eight Easy Steps,Book,http://www.amazon.com/dp/0316771635/,4,1
The Atomic Grinder by Holy Grail Grinders,Kitchen,http://www.amazon.com/dp/B01ESPU6ME/,5,1
Old Venus,Book,http://www.amazon.com/dp/0345537289/,2,1
