name,category,amazon_link,total_mentions,subreddit_mentions
"Practical Reverse Engineering: x86, x64, ARM, Windows Kernel, Reversing Tools, and Obfuscation",Book,http://www.amazon.com/dp/1118787315/,9,3
"Compilers: Principles, Techniques, and Tools (2nd Edition)",Book,http://www.amazon.com/dp/0321486811/,25,1
Reversing: Secrets of Reverse Engineering,Book,http://www.amazon.com/dp/0764574817/,6,1
Gray Hat Python: Python Programming for Hackers and Reverse Engineers,Book,http://www.amazon.com/dp/1593271921/,5,1
Practical Malware Analysis: A Hands-On Guide to Dissecting Malicious Software,Book,http://www.amazon.com/dp/1593272901/,21,1
niceeshop(TM) PL2303HX USB To TTL To UART RS232 COM Cable Module Converter,PC Accessory,http://www.amazon.com/dp/B00F167PWE/,1,1
The Art of Software Security Assessment: Identifying and Preventing Software Vulnerabilities (2 Volume set),Book,http://www.amazon.com/dp/0321444426/,5,1
Misiri 606 HiCo Magnetic Card Reader Writer Work With 607 608 705 706,CE,http://www.amazon.com/dp/B01EA61PXK/,1,1
