name,category,amazon_link,total_mentions,subreddit_mentions
The Merriam-Webster Dictionary New Edition (c) 2016,Book,http://www.amazon.com/dp/087779295X/,8,1
Basic ROBLOX Lua Programming: (Black and White Edition),Book,http://www.amazon.com/dp/1475026048/,1,1
War of Extermination: The German Military in World War II (War and Genocide),Book,http://www.amazon.com/dp/1571814930/,8,1
Clone Wars Adventures: The Official Guide to the Virtual World (Star Wars: The Clone Wars),Book,http://www.amazon.com/dp/B00AK2UD6O/,1,1
"CYBERPOWERPC Gamer Xtreme VR GXiVR8020A Gaming Desktop - Intel i5-6402P Quad Core 2.8GHz, 8GB DDR4 RAM, 1TB HDD, 24X DVD, AMD RX 480 4GB, WI-Fi USB Adapter, Windows 10 Home (Discontinued by Manufacturer)",Personal Computer,http://www.amazon.com/dp/B01HNBLHAA/,48,1
