name,category,amazon_link,total_mentions,subreddit_mentions
Microsoft Xbox 360 Wired Controller for Windows & Xbox 360 Console,CE,http://www.amazon.com/dp/B004QRKWLA/,25,3
"Passion Lubes, Natural Water-Based Lubricant, 55 Gallon Drum",Health and Beauty,http://www.amazon.com/dp/B005MR3IVO/,273,1
Thrustmaster T-16000M Flight Stick,CE,http://www.amazon.com/dp/B001S0RTU0/,17,1
Stinky Gaming Footboard Foot Controller - PC,Personal Computer,http://www.amazon.com/dp/B00EOPT5ZS/,11,1
JL421 Badonkadonk Land Cruiser/Tank,Single Detail Page Misc,http://www.amazon.com/dp/B00067F1CE/,10,1
Microsoft Xbox One Controller + Cable for Windows,Personal Computer,http://www.amazon.com/dp/B00O65I2VY/,8,1
Wenger 16999 Swiss Army Knife Giant,Home Improvement,http://www.amazon.com/dp/B001DZTJRQ/,8,1
Nintendo Switch Wired Internet LAN Adapter by HORI Officially Licensed by Nintendo,Video Games,http://www.amazon.com/dp/B01N6S068R/,6,1
KONG Classic Large,Pet Products,http://www.amazon.com/dp/B0002AR0I8/,6,1
UGREEN Network Adapter USB 3.0 to Ethernet RJ45 Lan Gigabit Adapter for 10/100/1000 Mbps Ethernet Supports Nintendo Switch Black,Personal Computer,http://www.amazon.com/dp/B00MYTSN18/,3,1
Xbox 360 Wireless Controller - Glossy Black,Video Games,http://www.amazon.com/dp/B003ZSP0WW/,3,1
"Angelcare Bath Support, Aqua",Baby,https://www.amazon.com/gp/product/B008H3PFM0/ref=oh_aui_detailpage_o05_s00?ie=UTF8&amp;psc=1,2,1
"SwaddleMe Original Swaddle 3-PK, Teal Whales (SM)",Baby Product,http://www.amazon.com/dp/B0100O60W2/,2,1
DualShock 4 Wireless Controller for PlayStation 4 - Urban Camouflage [Old Model],Video Games,http://www.amazon.com/dp/B00KVP78FE/,2,1
BenQ DLP HD 1080p Projector (HT2050) - 3D Home Theater Projector with All-Glass Cinema Grade Lens and RGBRGB Color Wheel,Home Theater,http://www.amazon.com/dp/B016JYOQ3W/,2,1
"Grip-iT Analog Stick Covers, Set of 4",Video Games,http://www.amazon.com/dp/B003NSLGW2/,2,1
Logitech G27 Racing Wheel,CE,http://www.amazon.com/dp/B001NT9TK4/,2,1
"Matimati Baby Bandana Drool Bibs With Snaps For Boys & Girls - Super Absorbent, Soft, & Modern Pack of 4 (Solid Arrow Unisex)",Baby Product,http://www.amazon.com/dp/B010IF6V04/,1,1
"Graco Glider LX Gliding Swing, Peyton",Baby Product,http://www.amazon.com/dp/B00AO083KU/,1,1
Ballistic Jester 17x9 Black Wheel / Rim 5x5 with a -12mm Offset and a 83.70 Hub Bore. Partnumber 814790550-12FB,Automotive Parts and Accessories,http://www.amazon.com/dp/B007MGX9X0/,1,1
Rocket League Stress Ball,Toy,http://www.amazon.com/dp/B0716L2LK8/,1,1
"TRENDnet Power Line 1200 AV2 Adapter Starter Kit, 2 Adapters Included with Gigabit Port, Plug and Play, MIMO, Beamforming (TPL-420E2K)",Personal Computer,http://www.amazon.com/dp/B00S7NJWOM/,1,1
"Acer Nitro 5, 7th Gen Intel Core i5-7300HQ, GeForce GTX 1050 Ti, 16GB DDR4, 256GB SSD, 1TB HDD, Win 10 Home, Shale Black, AN515-51-53W5",Personal Computer,http://www.amazon.com/dp/B073PXNPG7/,1,1
Wired USB Controller Double Vibration Gamepad Joystick For PC Computer Laptop Blue,Video Games,http://www.amazon.com/dp/B01CZVNEU4/,1,1
"Lenovo Legion Y520 - 15.6"" Gaming Laptop Computer i5-7300HQ / Nvidia GeForce GTX 1050 Ti 4GB / 8GB DDR4 DRAM / 256GB PCIe SSD / Windows 10 Signature Image 80WK00FHUS",Personal Computer,http://www.amazon.com/dp/B06WVMJ713/,1,1
"MSI GL62M 7RD-1407 15.6"" Full HD Thin and Light Performance Gaming Laptop i5-7300HQ GTX 1050 2G 8GB 256GB SSD Win10 SteelSeries Keyboard",Personal Computer,http://www.amazon.com/dp/B072QT88DG/,1,1
