name,category,amazon_link,total_mentions,subreddit_mentions
"Rojava: An Alternative to Imperialism, Nationalism, and Islamism in the Middle East (An introduction)",Book,http://www.amazon.com/dp/1326454803/,2,1
To Dare Imagining: Rojava Revolution,Book,http://www.amazon.com/dp/157027312X/,2,1
The PKK: Coming Down from the Mountains (Rebels),Book,http://www.amazon.com/dp/1783600373/,1,1
The Boys are Dead: The Roboski Massacre and the Kurdish Question in Turkey,Book,http://www.amazon.com/dp/1909382191/,1,1
A Small Key Can Open a Large Door,Book,http://www.amazon.com/dp/193866017X/,3,1
