name,category,amazon_link,total_mentions,subreddit_mentions
"Flat Earth News: An Award-Winning Reporter Exposes Falsehood, Distortion and Propaganda in the Global Media",Book,http://www.amazon.com/dp/0099512688/,5,2
KNACRO Load Tester Board USB 0.15-3A Adjustable Constant Current Industrial Grade Electronic Load Equipment Module Charger Detector Aging Device Intelligent Discharge Resistance with Cooling Fan,Electronics,https://www.amazon.com/gp/product/B01F4OZZVK/ref=oh_aui_detailpage_o00_s01?ie=UTF8&amp;psc=1,,1
"Thinking, Fast and Slow",Book,http://www.amazon.com/dp/0374533555/,35,1
"YI 2.7"" Screen Full HD 1080P60 165 Wide Angle Dashboard Camera, Car DVR Vehicle Dash Cam with G-Sensor, WDR, Loop Recording, Grey",Wireless,http://www.amazon.com/dp/B01C89GCHU/,23,1
Cracking the Coding Interview: 150 Programming Questions and Solutions,Book,http://www.amazon.com/dp/098478280X/,15,1
Toxic Parents: Overcoming Their Hurtful Legacy and Reclaiming Your Life,Book,http://www.amazon.com/dp/0553381407/,13,1
"Zero to One: Notes on Startups, or How to Build the Future",Book,http://www.amazon.com/dp/0804139296/,7,1
Nothing Is True and Everything Is Possible: The Surreal Heart of the New Russia,Book,http://www.amazon.com/dp/1610394550/,6,1
Homosexualities: A Study of Diversity Among Men & Women,Book,http://www.amazon.com/dp/0671251503/,5,1
"How to Live with a Huge Penis: Advice, Meditations, and Wisdom for Men Who Have Too Much",Book,http://www.amazon.com/dp/1594743061/,5,1
"Deluxe Comfort P009 Boyfriend Pillow With A Pillow In Shining Armor, Blue",Home,http://www.amazon.com/dp/B002RWJ9S8/,4,1
Firefly: A Celebration (Anniversary Edition),Book,http://www.amazon.com/dp/1781161682/,4,1
The Comic Toolbox How to Be Funny Even If You're Not,Book,http://www.amazon.com/dp/1879505215/,3,1
Motorola Moto G (3rd Generation) - Black - 8 GB - Global GSM Unlocked Phone,Wireless,http://www.amazon.com/dp/B00ZQVSKSM/,2,1
Modern C++ Design: Generic Programming and Design Patterns Applied,Book,http://www.amazon.com/dp/0201704315/,2,1
"Scooby-Doo! Baked Graham Cracker Sticks, Cinnamon, 11-Ounce Boxes (Pack of 6)",Grocery,http://www.amazon.com/dp/B000AYGVX6/,1,1
Abbey Road,Music,http://www.amazon.com/dp/B0025KVLUQ/,1,1
Nyguard Insect Growth Regulator 110ml MGK1001,Lawn & Patio,http://www.amazon.com/dp/B004H0I2RM/,1,1
Londongrad: From Russia with Cash;The Inside Story of the Oligarchs,Book,http://www.amazon.com/dp/0007356374/,1,1
Terry Jones' Barbarians: An Alternative Roman History,Book,http://www.amazon.com/dp/056353916X/,1,1
Fortinet FortiGate-100D Security Appliance FG-100D,PC Accessory,http://www.amazon.com/dp/B008XND2GA/,1,1
"Frostline Chocolate Soft Serve Ice Cream Mix Bag, 6 lb., Large",Grocery,http://www.amazon.com/dp/B01F0LECMU/,1,1
The Complete Insider's Guide to Romania: 2013,Book,http://www.amazon.com/dp/148492178X/,1,1
