name,category,amazon_link,total_mentions,subreddit_mentions
I Do Not Want This On My PLate,Book,http://www.amazon.com/dp/1564924076/,2,2
Gap,DVD,http://www.amazon.com/dp/B001NY42JM/,2,2
Oddy Clone,Digital Music Album,http://www.amazon.com/dp/B00C6TN78U/,2,2
"Make 'Em Laugh: 35 Years of the Comic Strip, the Greatest Comedy Club of All Time!",Book,http://www.amazon.com/dp/1620870746/,1,1
Trader Joe's Cold Brew Coffee Concentrate 100% Arabica Beans. 32fl. Oz,Grocery,http://www.amazon.com/dp/B00EBFA2IU/,2,1
"180s Mens & Womens Unisex Bluetooth Ear Warmer, Black",Apparel,http://www.amazon.com/dp/B00EDHW7H0/,1,1
Audible Membership,Audible Membership,http://www.amazon.com/dp/B00NB86OYE/,8,1
Bennington Girls Are Easy: A Novel,eBooks,http://www.amazon.com/dp/B00ONUVQVU/,1,1
Efanr Sports Invisible in Ear Smallest Mini Bluetooth 4.0 Headset with Hands-free Calling Stereo - Beige,Wireless,http://www.amazon.com/dp/B0118Y730G/,1,1
Digging Up Mother: A Love Story,Book,http://www.amazon.com/dp/0306824396/,7,1
Jelly Comb MK09 Wireless Keyboard and Mouse,Personal Computer,http://www.amazon.com/dp/B01C9XMOQ8/,2,1
Trump Strategies for Real Estate: Billionaire Lessons for the Small Investor,Book,http://www.amazon.com/dp/0471774340/,1,1
Undeniable: Evolution and the Science of Creation,Book,http://www.amazon.com/dp/1250007135/,12,1
