name,category,amazon_link,total_mentions,subreddit_mentions
"Logitech Wireless Touch Keyboard K400 with Built-In Multi-Touch Touchpad, Black",Electronics,https://www.amazon.com/dp/B005DKZTMG/ref=twister_B00FIYEBK8?_encoding=UTF8&amp;psc=1,12,1
Nikon COOLPIX P900 Digital Camera with 83x Optical Zoom and Built-In Wi-Fi(Black),Electronics,https://www.amazon.com/Nikon-COOLPIX-Digital-Camera-Optical/dp/B00U2W4JEY,8,1
"Solid Wood Bed Support Slats | Bunkie Board, Queen",Home & Kitchen,https://www.amazon.com/Solid-Support-Slats-Bunkie-Board/dp/B00FNFBQSM/ref=redir_mobile_desktop?_encoding=UTF8&amp%3Bfpl=fresh&amp%3Bpf_rd_i=mobile&amp%3Bpf_rd_m=ATVPDKIKX0DER&amp%3Bpf_rd_p=ada34224-8f73-447e-a6e9-f98978a254b9&amp%3Bpf_rd_r=0ZRMPHDHGGXVMXGNQXW9&amp%3Bpf_rd_s=mobile-1&amp%3Bpf_rd_t=36701&amp%3Bpsc=1&amp%3Bth=1&ref_=s9_simh_gw_d0_g196_i1,1,1
(39x55) Stephen Fishwick It&apos;s All Relative Einstein Huge Art Print Poster,Home & Kitchen,https://www.amazon.com/Stephen-Fishwick-Relative-Einstein-Poster/dp/B005BCNM2U,1,1
STRUCTURES Low Profile 8-Leg Heavy Duty Adjustable Metal Bed Frame with Glides - Universal Size (Cal King - King - Queen - Full XL - Full - Twin XL - Twin),Home & Kitchen,https://www.amazon.com/STRUCTURES-Profile-8-Leg-Adjustable-Glides/dp/B00S09RRHM/ref=sr_1_5?s=home-garden&amp;ie=UTF8&amp;qid=1462430994&amp;sr=1-5&amp;keywords=short+bed+frame,1,1
"Classic Brands Hercules Universal Heavy-Duty Metal Bed Frame | Adjustable Width Fits Twin, Twin XL, Full, Queen, King, California King",Home & Kitchen,https://www.amazon.com/Hercules-Universal-Adjustable-7-Locking-California/dp/B00NEJ4Y4M/ref=sr_1_8?s=home-garden&amp;ie=UTF8&amp;qid=1462431054&amp;sr=1-8&amp;keywords=low+profile+bed+frame,1,1
STRUCTURES Low Profile 8-Leg Heavy Duty Adjustable Metal Bed Frame with Rug Rollers and Locking Wheels - Universal Size (Cal King - King - Queen - Full XL - Full - Twin XL - Twin),Home & Kitchen,https://www.amazon.com/STRUCTURES-Profile-Adjustable-Rollers-Locking/dp/B00S09RPTW/ref=sr_1_1?s=home-garden&amp;ie=UTF8&amp;qid=1462430994&amp;sr=1-1&amp;keywords=short+bed+frame,1,1
"Smeg FAB32URDRN 24"" 50's Retro Style Bottom Freezer Refrigerator with 10.74 cu. ft. Capacity No Frost Fast-Freezing Automatic Defrost Adjustable Glass Shelves and LED Interior Lighting: Red with Right",Appliances,https://www.amazon.com/Smeg-FAB32URDRN-Refrigerator-Fast-Freezing-Adjustable/dp/B017YDLY9Q,1,1
"Decorative Window Film Holographic Prismatic Etched Glass Effect - Fill Your House with Rainbow Light 23"" X 36"" Panels",Home & Kitchen,https://www.amazon.com/Decorative-Window-Holographic-Prismatic-Etched/dp/B00IO5UIZK,1,1
"LED bulb e12 LED Bulbs Canderlabra Base LED Bulbs for Chandelier Edison Filament Bulb, Warm White 2700K, 2W 20W Equivalent, Beam Spread 360 Degree, 1-Pack",Tools & Home Improvement,https://www.amazon.com/Chandelier-Incandescent-Equivalent-Candelabra-Torpedo/dp/B016X09S9Y/ref=sr_1_2?ie=UTF8&amp;qid=1475191577&amp;sr=8-2&amp;keywords=volare-hk+bulbs,1,1
"Elite Screens Manual, 120-inch 16:9, Pull Down Projection Manual Projector Screen with Auto Lock, M120UWH2",Electronics,https://www.amazon.com/dp/B000PHLB88/ref=cm_sw_r_cp_apa_.n59ybNN9RPNN,1,1
