name,category,amazon_link,total_mentions,subreddit_mentions
Natasha's Dance: A Cultural History of Russia,Book,http://www.amazon.com/dp/0312421958/,2,2
"Freedom from Fear: The American People in Depression and War, 1929-1945 (Oxford History of the United States)",Book,http://www.amazon.com/dp/0195144031/,2,1
The Coming War With Japan,Book,http://www.amazon.com/dp/0312058365/,16,1
Two Sides of the Moon: Our Story of the Cold War Space Race,Book,http://www.amazon.com/dp/0312308663/,2,1
New Russians,Book,http://www.amazon.com/dp/0380716518/,1,1
The Man Who Tried to Save the World: The Dangerous Life and Mysterious Disappearance of an American Hero,Book,http://www.amazon.com/dp/0385486669/,2,1
Khrushchev: The Man and His Era,Book,http://www.amazon.com/dp/0393324842/,1,1
The Russian Tea Room Cookbook,Book,http://www.amazon.com/dp/039951032X/,1,1
The Phony Litvinenko Murder (Litvinenko Murder Series),Book,http://www.amazon.com/dp/0615559018/,1,1
"Putin's Labyrinth: Spies, Murder, and the Dark Heart of the New Russia",Book,http://www.amazon.com/dp/0812978412/,2,1
"Two Thousand Years of Economic Statistics: World Population, GDP and PPP",Book,http://www.amazon.com/dp/0875867502/,1,1
"The Russian's World: Life and Language, Fourth Edition",Book,http://www.amazon.com/dp/0893573809/,1,1
Queen of Chaos: The Misadventures of Hillary Clinton,Book,http://www.amazon.com/dp/0989763765/,2,1
Stalin: The Court of the Red Tsar,Book,http://www.amazon.com/dp/1400076781/,10,1
Sally Ride: America’s First Woman in Space,Book,http://www.amazon.com/dp/1476725764/,2,1
Dirty Russian: Everyday Slang from (Dirty Everyday Slang),Book,http://www.amazon.com/dp/1569757062/,2,1
Nothing Is True and Everything Is Possible: The Surreal Heart of the New Russia,Book,http://www.amazon.com/dp/1610394550/,14,1
The Librarian,Book,http://www.amazon.com/dp/1782270272/,1,1
Notes of a Russian Sniper,Book,http://www.amazon.com/dp/1848325657/,1,1
Soviet Casualties and Combat Losses in the Twentieth Century,Book,http://www.amazon.com/dp/1853672807/,2,1
Sankya,Book,http://www.amazon.com/dp/1938604512/,1,1
"Guylian Belgian Chocolate Sea Shells Perles d' Ocean, 8.82 Oz",Grocery,http://www.amazon.com/dp/B000LQJKI6/,2,1
Russia: The Once and Future Empire From Pre-History to Putin,eBooks,http://www.amazon.com/dp/B000Q80SR6/,1,1
"Candy ""Cow"" (Korovka) 1 Lb (Rot Front)",Grocery,http://www.amazon.com/dp/B005BYOZ06/,2,1
Putin,eBooks,http://www.amazon.com/dp/B007VM383Q/,1,1
Mold for Russian Ukraine Pelmeni Ravioli Meat Dumplings,Home,http://www.amazon.com/dp/B008NXA1V4/,2,1
"Russian Soviet Army Fur Military Cossack Ushanka Hat (Black, 59/L)",Sports,http://www.amazon.com/dp/B009BQUI2Y/,2,1
Latvian Smoked Riga Sprats in Oil 5.6 Oz. Tin Pack of 24,Grocery,http://www.amazon.com/dp/B00DJGEDLY/,2,1
Long Sleeved Telnyashka Russian Navy Striped Shirt (M),Apparel,http://www.amazon.com/dp/B00DVLM4D6/,2,1
I WAS IN THIS WAR. Chechnya 95 (ENGLISH EDITION + ORIGINAL RUSSIAN EDITION): Я был на этой войне. Чечня 95,eBooks,http://www.amazon.com/dp/B00RRSTD24/,1,1
"Summer Hunting Suit Russian SWAT Gorka-4 (Jacket & Pants) Fishing Paintball (Chest 37.8""/Tall 5'7"")",Sports,http://www.amazon.com/dp/B00S1LH8NC/,1,1
Russia TV Channels,Mobile Application,http://www.amazon.com/dp/B016AETE7O/,1,1
The Freedom Fighter: A memoir of a member of the Donbass Militia in the War in Ukraine,eBooks,http://www.amazon.com/dp/B01HZPULXS/,6,1
The New Penguin Russian Course: A Complete Course for Beginners (Penguin Handbooks),Book,http://www.amazon.com/dp/0140120416/,24,1
Military Russian Army Food Ration Daily Pack Mre Emergency Rations 2017-2018,Home Improvement,http://www.amazon.com/dp/B01M72Y9UF/,1,1
