name,category,amazon_link,total_mentions,subreddit_mentions
The Subtle Art of Not Giving a F*ck: A Counterintuitive Approach to Living a Good Life,Book,http://www.amazon.com/dp/0062457713/,38,1
"HORI Real Arcade Pro 4 Kai for PlayStation 4, PlayStation 3, and PC",Video Games,http://www.amazon.com/dp/B00SULMRI4/,65,1
HORI Fighting Stick Mini 4 for PlayStation 4 and 3,Video Games,http://www.amazon.com/dp/B014KXMEW4/,12,1
Mad Catz Street Fighter V Arcade FightStick Alpha for PlayStation4 and PlayStation3,Software,http://www.amazon.com/dp/B018HXA6H8/,6,1
Mayflash F300 Arcade Fight Stick Joystick for PS4 PS3 XBOX ONE 360 PC & SWITCH,Personal Computer,http://www.amazon.com/dp/B019MFPLC0/,18,1
