name,category,amazon_link,total_mentions,subreddit_mentions
"Espree Bright White Dog Shampoo, 20 oz",Pet Products,http://www.amazon.com/dp/B00379H6S0/,2,2
Master Grooming Tools Fine/Coarse Steel Greyhound Comb,Pet Products,http://www.amazon.com/dp/B0007KTL8K/,3,2
Pet Corrector Pet Behavioral Training Aid,Pet Products,http://www.amazon.com/dp/B000UCH02O/,6,2
FURminator Dog Rake,Pet Products,http://www.amazon.com/dp/B0062Z0RPA/,6,2
John Paul Pet Detangling Spray,Pet Products,http://www.amazon.com/dp/B0012X8LGO/,3,2
"#1 All Systems Pet Pin Brush with Molded Plastic Handle, Large",Pet Products,http://www.amazon.com/dp/B001VPAD00/,2,2
"Master Equipment Foldable, Portable Pet Grooming Table",Pet Products,http://www.amazon.com/dp/B001VP873K/,1,1
"KONG Wobbler Treat Dispensing Dog Toy, Large",Pet Products,http://www.amazon.com/dp/B003ALMW0M/,41,1
"Safari Pet Products DSFW404B 3-5/8-Inch Dog Soft Slicker Brush, Medium",Pet Products,http://www.amazon.com/dp/B0041LDQCS/,2,1
"Coastal Pet - Safari Long Tooth Undercoat Dog Rake, Designed for Breeds with Medium Undercoats.",Pet Products,http://www.amazon.com/dp/B0083TSC64/,5,1
"Grizzly Pollock Oil Supplement for Dogs, 64-Ounce",Pet Products,http://www.amazon.com/dp/B00B5YJ0LU/,1,1
"Premium Quality Bed Pad, Quilted, Waterproof, and Washable , 34"" x 52"" The Best Underpad Sheet Protector for Children or Adults with Incontinence",Health and Beauty,http://www.amazon.com/dp/B00CX6JAUK/,5,1
"JW Pet Company 46125 EverTuff Treat Pod Nylon Toys for Pets, Large, White Bone with Colored Pods of Orange, Green, Blue",Pet Products,http://www.amazon.com/dp/B00DIE46XC/,2,1
"K-9 Dryers 17-127-U II Blower/Dryer, Blue",Pet Products,http://www.amazon.com/dp/B00HNB4G9A/,2,1
GG Beauty 24 Colors Temporary Hair Chalk Set - Non-Toxic Rainbow Colored Dye Pastel Kit (24 Color),Beauty,http://www.amazon.com/dp/B017N6REZC/,1,1
"Comsun 2-pack Collapsible Dog Bowl, Food Grade Silicone BPA Free, Foldable Expandable Cup Dish for Pet Cat Food Water Feeding Portable Travel Bowl Blue and Green Free Carabiner ¡­",Pet Products,http://www.amazon.com/dp/B019B53YVQ/,3,1
MidWest Life Stages Folding Metal Dog Crate,Pet Products,http://www.amazon.com/dp/B0002AT3M4/,8,1
Wisdom Panel 3.0 Breed Identification DNA Test Kit,Pet Products,http://www.amazon.com/dp/B01EHX2BH0/,17,1
Untangler Rake,Pet Products,http://www.amazon.com/dp/B0002Y1QTI/,1,1
Air Force Commander 2-Speed Dryer 4.0 HP Motor  S,Home Improvement,http://www.amazon.com/dp/B00063KHPE/,4,1
"PetSafe Busy Buddy Tug-A-Jug Meal Dispensing Dog Toy, Medium/Large",Pet Products,http://www.amazon.com/dp/B000KV7ZGQ/,23,1
High Cotton Doormat - For Whom The Dog Barks,Lawn & Patio,http://www.amazon.com/dp/B0018AIQ8Y/,6,1
#1 All Systems Super Whitening Gel- 8 Oz [Misc.],Pet Products,http://www.amazon.com/dp/B001L12ZQE/,1,1
