name,category,amazon_link,total_mentions,subreddit_mentions
Samurai Jack Season 5,TV Series Season Video on Demand,http://www.amazon.com/dp/B06XC7NBTC/,,1
Samurai Jack: Season 5 (BD) [Blu-ray],DVD,http://www.amazon.com/dp/B074XTYMT3/,2,1
Samurai Jack: The Complete Series Box Set (BD) [Blu-ray],DVD,http://www.amazon.com/dp/B074XJ48WV/,1,1
Samurai Jack: Seasons 1-4,DVD,http://www.amazon.com/dp/B001CT05VC/,1,1
Organic Jagua Black Temporary Tattoo and Body Painting Premium Kit,Beauty,http://www.amazon.com/dp/B00Z1XBS8O/,1,1
