name,category,amazon_link,total_mentions,subreddit_mentions
Functional Programming in Scala,Book,http://www.amazon.com/dp/1617290653/,3,3
"Programming in Scala: A Comprehensive Step-by-Step Guide, 2nd Edition",Book,http://www.amazon.com/dp/0981531644/,2,2
Scala for the Impatient,Book,http://www.amazon.com/dp/0321774094/,2,2
Scala High Performance Programming,Book,http://www.amazon.com/dp/178646604X/,2,2
How to Bake Pi: An Edible Exploration of the Mathematics of Mathematics,Book,http://www.amazon.com/dp/0465051715/,2,1
Implementing Domain-Driven Design,Book,http://www.amazon.com/dp/0321834577/,2,1
Scala in Depth,Book,http://www.amazon.com/dp/1935182706/,1,1
