name,category,amazon_link,total_mentions,subreddit_mentions
Phenolic Cone Lined Caps 2oz (20/400) (Pack of 12),BISS,http://www.amazon.com/dp/B00TR1QYJO/,2,2
Star Wars X-Wing: YT-2400 Expansion Pack,Toy,http://www.amazon.com/dp/1616619171/,3,1
"Norpro Stainless Steel Funnels, Set of 3",Kitchen,http://www.amazon.com/dp/B000FKERMW/,7,1
"L'Atelier du Vin Twin Blade Cork Puller, Black",Kitchen,http://www.amazon.com/dp/B0030DH0ZM/,1,1
"Ball Dissolvable Labels, Set of 60",Kitchen,http://www.amazon.com/dp/B004NGVIIK/,4,1
"Pechiney Plastic Packaging PM996 - Parafilm M® all-purpose laboratory film, size: 4"" X 125' EACH",Home Improvement,http://www.amazon.com/dp/B004VQP6CQ/,1,1
1500 Live Ladybugs - Good Bugs - Ladybugs - Guaranteed Live Delivery!,Lawn & Patio,http://www.amazon.com/dp/B00533KOIC/,86,1
Stainless Steel Mini Funnel for Essential Oil Bottles / Flasks - Pack of 6,Kitchen,http://www.amazon.com/dp/B009CZEQ36/,3,1
"OXO SteeL Angled Measuring Jigger, Stainless Steel",Kitchen,http://www.amazon.com/dp/B00B6LUAPW/,15,1
"OXO Good Grips Angled Measuring Cup, Mini, Clear",Kitchen,http://www.amazon.com/dp/B00FYL4MPY/,10,1
"Premium Vials B26-12 Boston Round Glass Bottle with Cap, 2 oz Capacity, Clear (Pack of 12)",BISS Basic,http://www.amazon.com/dp/B00I52FRWG/,2,1
"45 x 23 Shrink Band Bundle of 250 for Boston Round 3/4"" To 1"" Diameter Lid [Many Different Sizes and Quantities Within This Listing]",Home,http://www.amazon.com/dp/B00TY1V58M/,1,1
Coolrunner Stainless Steel Mini Funnel for Essential Oil Bottles / Flasks - Pack of 6,BISS,http://www.amazon.com/dp/B016D82NFC/,2,1
Star Wars X-Wing: Tantive IV Expansion Pack,Toy,http://www.amazon.com/dp/1616617691/,1,1
"Victuals: An Appalachian Journey, with Recipes",eBooks,http://www.amazon.com/dp/B0190HP7FQ/,1,1
