name,category,amazon_link,total_mentions,subreddit_mentions
"Writing Movies for Fun and Profit: How We Made a Billion Dollars at the Box Office and You Can, Too!",Books,https://www.amazon.com/Writing-Movies-Fun-Profit-Billion/dp/1439186766/ref=sr_1_1?s=books&amp;ie=UTF8&amp;qid=1440174909&amp;sr=1-1&amp;keywords=how+to+write+movies+for+fun+and+profit,5,2
The War of Art: Break Through the Blocks and Win Your Inner Creative Battles,Books,https://www.amazon.com/War-Art-Through-Creative-Battles/dp/1936891026/,6,1
The Art of Fiction: Notes on Craft for Young Writers,Books,https://www.amazon.com/The-Art-Fiction-Notes-Writers/dp/0679734031,4,1
Upright Citizens Brigade Comedy Improvisation Manual,Books,https://www.amazon.com/Upright-Citizens-Brigade-Comedy-Improvisation/dp/0989387801,2,1
The Story Solution: 23 Actions All Great Heroes Must Take,Books,https://www.amazon.com/The-Story-Solution-Actions-Heroes/dp/1615930841,2,1
"The Disaster Artist: My Life Inside The Room, the Greatest Bad Movie Ever Made",Books,https://www.amazon.com/Disaster-Artist-Inside-Greatest-Movie/dp/1476730407/ref=sr_1_1?ie=UTF8&amp;qid=1421792298&amp;sr=8-1&amp;keywords=the+disaster+artist,2,1
The Seinfeld Scripts: The First and Second Seasons,Books,https://www.amazon.com/Seinfeld-Scripts-First-Second-Seasons/dp/0060953039,1,1
Writing from the Inside Out: Transforming Your Psychological Blocks to Release the Writer Within,Books,https://www.amazon.com/Writing-Inside-Out-Transforming-Psychological/dp/0471382663,1,1
Canon imageCLASS LBP6030w Wireless Laser Printer,Electronics,https://www.amazon.com/gp/product/B00K5UZO0Q?psc=1&amp;redirect=true&amp;ref_=oh_aui_detailpage_o04_s00,1,1
Gravity,Books,https://www.amazon.com/Gravity-Tess-Gerritsen/dp/0671016776/ref=la_B000AQ4IHU_1_16?s=books&amp;ie=UTF8&amp;qid=1422825626&amp;sr=1-16,1,1
"Clearance & Copyright, 4th Edition: Everything You Need to Know for Film and Television",Books,https://www.amazon.com/Clearance-Copyright-4th-Edition-Everything/dp/1935247123,1,1
Psychology for Screenwriters,Books,https://www.amazon.com/Psychology-Screenwriters-William-Indick/dp/0941188876,1,1
Three Uses of the Knife: On the Nature and Purpose of Drama,Books,https://www.amazon.com/Three-Uses-Knife-Nature-Purpose/dp/037570423X/ref=sr_1_1?ie=UTF8&amp;qid=1451115247&amp;sr=8-1&amp;keywords=three+uses+of+the+knife,1,1
43 Ways to Finance Your Feature Film: A Comprehensive Analysis of Film Finance,Books,https://www.amazon.com/Ways-Finance-Your-Feature-Film/dp/0809326930,1,1
"Guillermo del Toro Cabinet of Curiosities: My Notebooks, Collections, and Other Obsessions",Books,https://www.amazon.com/Guillermo-del-Toro-Cabinet-Curiosities/dp/0062082841,1,1
Stephen King CAT'S EYE Horror Movie Script - WoW!!!,All Departments,https://www.amazon.com/Stephen-King-Horror-Movie-Script/dp/B003JDVA40,1,1
All in the Timing: Fourteen Plays,Books,https://www.amazon.com/All-Timing-Fourteen-David-Ives/dp/067975928X,1,1
Jarvis Electric Adjustable Height Standing Desk Frame (Black),Office Products,https://www.amazon.com/gp/product/B01N023V8B,1,1
What Are You Laughing At?: A Comprehensive Guide to the Comedic Event,Books,https://www.amazon.com/What-Are-You-Laughing-Comprehensive/dp/1441162933,1,1
Rebecca,Books,https://www.amazon.com/Rebecca-Daphne-Du-Maurier/dp/0380778556,1,1
The Creative Habit: Learn It and Use It for Life,Books,https://www.amazon.com/The-Creative-Habit-Learn-Life/dp/1480589837,1,1
The Complete Book of Scriptwriting,Books,https://www.amazon.com/Complete-Book-Scriptwriting-Michael-Straczynski/dp/1582971587,1,1
Howdunit Forensics,Books,https://www.amazon.com/Howdunit-Forensics-D-P-Lyle/dp/1582974748/ref=sr_1_1?ie=UTF8&amp;qid=1490313262&amp;sr=8-1&amp;keywords=forensics+for+writers,1,1
