name,category,amazon_link,total_mentions,subreddit_mentions
How to Shoot Video That Doesn't Suck: Advice to Make Any Amateur Look Like a Pro,Books,https://www.amazon.com/Shoot-Video-That-Doesnt-Suck/dp/0761163239,2,1
AudioFlood Waterproof iPod Shuffle with True Short Cord Headphones,Electronics,https://www.amazon.com/AudioFlood-Waterproof-Apple-Shuffle-Headphones/dp/B0087RPKHG,1,1
IST M37 Pegasus Full Face Diving Mask,Sports & Outdoors,https://www.amazon.com/Full-Face-Black-Rubber-Dive/dp/B000KD0BI8,1,1
Diver Down: Real-World SCUBA Accidents and How to Avoid Them (International Marine-RMP),Books,https://www.amazon.com/Diver-Down-Real-World-SCUBA-Accidents/dp/0071445722,1,1
Color of Night (Director's Cut),Movies & TV,https://www.amazon.com/Color-Night-Directors-Bruce-Willis/dp/6305428484,1,1
Lycra Sock - One Size Fits Most,Sports & Outdoors,https://www.amazon.com/Lycra-Sock-Size-Fits-Most/dp/B003TDC5OY,1,1
Suunto D4i Novo Watch Dive Computer with Transmitter USB PC Download Kit,Sports & Outdoors,https://www.amazon.com/Suunto-Watch-Computer-Transmitter-Download/dp/B00LEPVSP6,1,1
"Promate Scuba Dive Snorkel Titanium Knife (4 3/8"" Blade) with straps and sheath",Sports & Outdoors,https://www.amazon.com/gp/product/B000L15UB2?psc=1&amp;redirect=true&amp;ref_=oh_aui_search_detailpage,1,1
New Safety and Rescue Scuba Diver EMT Scissors Shears with Sheath & Plastic Clip - Stealthy Midnight Black,Sports & Outdoors,https://www.amazon.com/gp/product/B00C9J694G?psc=1&amp;redirect=true&amp;ref_=oh_aui_search_detailpage,1,1
Oceanic Viper Scuba Diving Fin - Warrior Edition - Size X-Small,Sports & Outdoors,https://www.amazon.com/Oceanic-Viper-Scuba-Diving-Fin/dp/B008A0QIVC/ref=sr_1_1?s=sporting-goods&amp;ie=UTF8&amp;qid=1444847492&amp;sr=1-1&amp;keywords=oceanic+viper,1,1
"ADC Medicut Shears, 7-1/4"", Black",Industrial & Scientific,https://www.amazon.com/ADC-Medicut-Shears-7-1-Black/dp/B0011MIQUM/ref=redir_mobile_desktop?_encoding=UTF8&amp%3BdpID=41OcTZasjlL&amp%3BdpPl=1&amp%3Bpi=AC_SX110_SY165_QL70&amp%3Bref=plSrch&amp%3Bsr=8-8&qid=1422315946&ref_=mp_s_a_1_8,1,1
"Rite in the Rain All-Weather Side-Spiral Notebook, 4 5/8"" x 7"", Yellow Cover, Journal Pattern (No. 393)",Office Products,https://www.amazon.com/Rite-Rain-Notebook-Journal-393/dp/B001PD28JM,1,1
"OxyLED OxyWild DF20 Rechargeable Super Bright LED Submarine Waterproof Underwater Diving Torch Light, Yellow",Sports & Outdoors,https://www.amazon.com/dp/B00OSW3R8I/ref=cm_sw_r_em_apa_4raBybN3FM1E2,1,1
Mares X-Vision Ultra Liquidskin,Sports & Outdoors,https://www.amazon.com/Mares-X-Vision-Ultra-Liquidskin-Black/dp/B019P2TJSW?th=1,1,1
The Six Skills and Other Discussions: Creative Solutions for Technical Divers,Books,https://www.amazon.com/The-Six-Skills-Other-Discussions/dp/098122802X/ref=sr_1_1?ie=UTF8&amp;qid=1382970205&amp;sr=8-1&amp;keywords=six+skills+and+other+discussions,1,1
"Cressi PRO LIGHT, Open Heel Scuba Diving Fins - Made in Italy - Cressi: Italian Quality Since 1946",Sports & Outdoors,https://www.amazon.com/Cressi-Light-Diving-Black-Medium/dp/B0014F1JQE/ref=sr_1_2?ie=UTF8&amp;qid=1421104141&amp;sr=8-2&amp;keywords=scuba+fins,1,1
SwimWays Toypedo Bandits - 4 Pack,Toys & Games,https://www.amazon.com/SwimWays-Toypedo-Bandits-4-Pack/dp/B0038ZVPFI/,1,1
"MCNETT Mirazyme Odor Eliminator, 8 oz.",Sports & Outdoors,https://www.amazon.com/MCNETT-Mirazyme-Odor-Eliminator-oz/dp/B00WBIH6JC,1,1
"Waterproof Telescopic Pole and Floating Hand Grip in one - For Gopro Hero 5, Black, Session, Hero 4, Session, Black, Silver, Hero+ LCD, 3+, 3, 2, 1 - Extendable from 6.7"" to 15.7"" - Cradle for Remote",Electronics,https://www.amazon.com/Waterproof-Telescopic-Pole-Floating-Hand/dp/B015X8ETG4?ie=UTF8&amp;keywords=camkix,1,1
