name,category,amazon_link,total_mentions,subreddit_mentions
"Casio Men's MDV106-1AV 200M Duro Analog Watch, Black",Watch,http://www.amazon.com/dp/B009KYJAJY/,105,6
Aeris A300 Wrist Computer ~Includes now FREE the Digital online class to get the most out of your dive computer.,Sports,http://www.amazon.com/dp/B0073YYM5K/,3,3
The Six Skills and Other Discussions: Creative Solutions for Technical Divers,Book,http://www.amazon.com/dp/098122802X/,2,2
Casio Men's W800H-1AV Classic Sport Watch with Black Band,Watch,http://www.amazon.com/dp/B001AWZDA4/,21,2
Pernicious Marine Life: A Guide to Venomous and Poisonous Marine Animals,Book,http://www.amazon.com/dp/1537081330/,2,2
Citizen Men's BN0000-04H Stainless Steel Eco-Drive Dive Watch,Watch,http://www.amazon.com/dp/B000EQS1RO/,9,2
AudioFlood Waterproof Apple iPod Shuffle with True Short Cord Headphones - Blue,Speakers,http://www.amazon.com/dp/B0087RPKHG/,2,2
"Scuba Choice Silicone Roll-up Nautilus Snorkel with Storage Container, Black",Sports,http://www.amazon.com/dp/B006VJKQFI/,2,2
"MCNETT Mirazyme Odor Eliminator, 8",Sports,http://www.amazon.com/dp/B00WBIH6JC/,4,2
"Pirate Hunters: Treasure, Obsession, and the Search for a Legendary Pirate Ship",Book,http://www.amazon.com/dp/1400063361/,3,1
Reef Fish Identification - Tropical Pacific,Book,http://www.amazon.com/dp/1878348361/,1,1
Nudibranch & Sea Slug Identification,Book,http://www.amazon.com/dp/1878348590/,1,1
Deco for Divers: A Diver's Guide to Decompression Theory and Physiology,Book,http://www.amazon.com/dp/1905492294/,1,1
Underwater Photography,Book,http://www.amazon.com/dp/1937538524/,1,1
Color of Night (Director's Cut),DVD,http://www.amazon.com/dp/6305428484/,1,1
DryGuy Wide-Body Boot and Glove Dryer,Sports,http://www.amazon.com/dp/B0000AMK8R/,5,1
Quick Release Coil Lanyard,Sports,http://www.amazon.com/dp/B0000DYNUM/,1,1
PADI Diver's Log Book,Sports,http://www.amazon.com/dp/B0000DYV1L/,1,1
Scubapro Din Conversion Kit/Universal,Sports,http://www.amazon.com/dp/B0000DYVG3/,1,1
"Seiko Men's SKX779 ""Black Monster"" Automatic Dive Stainless steel Watch",Watch,http://www.amazon.com/dp/B0006IHHN4/,4,1
Seiko Men's SKX007K Diver's Automatic Watch,Watch,http://www.amazon.com/dp/B000B5MI3Q/,31,1
Seiko Men's SKX009 Diver's Automatic Watch,Watch,http://www.amazon.com/dp/B000B5MI40/,4,1
"Heavy-Duty Retrieving and Holding Magnet, 5"" Length, 2"" Width, 1"" Height with Eyebolt, Nut, and Magnetic Shields, 150 Pounds Pull, 1 each",Home Improvement,http://www.amazon.com/dp/B000CP2PG0/,5,1
U.S. Divers Explorer Snorkeling Bag,Sports,http://www.amazon.com/dp/B000EM2S5Y/,1,1
Shadow Divers: The True Adventure of Two Americans Who Risked Everything to Solve One of the Last Mysteries of World War II,eBooks,http://www.amazon.com/dp/B000FC1RSC/,3,1
G-shock DW5600E-1V Men's Black Resin Sport Watch,Watch,http://www.amazon.com/dp/B000GAYQKY/,74,1
Full Face Black Rubber Dive Mask - Scuba Mask,Sports,http://www.amazon.com/dp/B000KD0BI8/,1,1
"Promate Sharp Tip Titanium Dive Knife - KF593, Gray/Black, Sharp Tip",Sports,http://www.amazon.com/dp/B000L15UB2/,1,1
Innovative Dive Flag Mask Bag - Black,Sports,http://www.amazon.com/dp/B000NML25C/,1,1
Spyderco Tasman Salt Serrated Edge Yellow H-1 Steel Knife,Sports,http://www.amazon.com/dp/B000NQFPSS/,2,1
Momentum Men's 1M-DV04B0 M1 Pro Stainless-Steel Bracelet Watch,Watch,http://www.amazon.com/dp/B000PDESO6/,1,1
Mares MV Octopus Diving Regulator,Sports,http://www.amazon.com/dp/B000PVB5MQ/,1,1
"Heinz Distilled White Vinegar, 1 gallon",Grocery,http://www.amazon.com/dp/B000RO08L0/,1,1
"Bonine Motion Sickness Tablets, Raspberry, 16 Count",Health and Beauty,http://www.amazon.com/dp/B000YA8NYQ/,1,1
Mares Puck Wrist Dive Computer,Sports,http://www.amazon.com/dp/B00106GVLA/,1,1
"ADC Medicut Shears, 7-1/4"", Black",BISS Basic,http://www.amazon.com/dp/B0011MIQUM/,2,1
"Cressi Pro Light, black, M/L",Sports,http://www.amazon.com/dp/B0014F1JQE/,1,1
H2O Audio iDive 300 Deep Dive Waterproof Case,Wireless,http://www.amazon.com/dp/B001IVSC1Y/,1,1
1060 MICRO CASE RAVEN,Photography,http://www.amazon.com/dp/B001OF5TII/,11,1
"Rite in the Rain All-Weather Side-Spiral Notebook, 4 5/8"" x 7"", Yellow Cover, Journal Pattern (No. 393)",Office Product,http://www.amazon.com/dp/B001PD28JM/,1,1
PADI eRDPML Electronic Recreational Dive Planner Training Materials for Scuba,Sports,http://www.amazon.com/dp/B001R2N9TO/,1,1
Pro Ear Scuba Diving Mask for all around Ear Protection - All Black Scuba Div...,Sports,http://www.amazon.com/dp/B0021OZ1PW/,3,1
Vapur 0.5 Litres Anti-Bottle (Blue),Sports,http://www.amazon.com/dp/B002M0EDG8/,1,1
"Summer's Eve Douche - Extra Cleansing Vinegar & Water PH-Balanced - Gynecologist Tested - 4 Count, 4.5 Fluid Ounces Each (Pack of 6)",Health and Beauty,http://www.amazon.com/dp/B002ZCXUZI/,1,1
"NeoSport Full Body Sports Skins - Diving, Snorkeling & Swimming",Sports,http://www.amazon.com/dp/B003554F0I/,1,1
SwimWays Toypedo Bandits - 4 Pack,Toy,http://www.amazon.com/dp/B0038ZVPFI/,2,1
"Key-Bak bb-121-KEY-BAK Security Heavy Duty Retractable Key Holder, Kevlar Cord Retraction Force, Durable Polycarbonate Case, Zinc Alloy Carabineer, Split Ring - 8 oz. - Black",Sports,http://www.amazon.com/dp/B0039YY2QM/,6,1
"Rockland Luggage 40 Inch Rolling Duffle Bag, Black, X-Large",Apparel,http://www.amazon.com/dp/B003EZXP5U/,1,1
Tusa Liberator X Ten Fins,Sports,http://www.amazon.com/dp/B003JOW0KW/,1,1
Akona Large Retractor Accessory,Sports,http://www.amazon.com/dp/B003KYAUX0/,1,1
Scuba Diver Signal Tube Marker Buoy with Inflator and Safety Whistle,Sports,http://www.amazon.com/dp/B003NTHO2M/,1,1
"Lycra Sock - One Size Fits Most, Black",Sports,http://www.amazon.com/dp/B003TDC5OY/,1,1
Hula Hoop Tape - Prism Tape - 1/2 In. X 25 Ft. 7 Color Set,BISS,http://www.amazon.com/dp/B004EHG84W/,1,1
"Rugby Travel Sickness, Tablets, 100 ea",Beauty,http://www.amazon.com/dp/B004FJFF2A/,2,1
"Sherwood Fusion Spring Strap Dive Fins, White, X-Large",Sports,http://www.amazon.com/dp/B004ICEPR0/,1,1
Seiko Men's SNE109 Stainless Steel Solar Dive Watch,Watch,http://www.amazon.com/dp/B004JOM1YQ/,2,1
"North Face Base Camp Duffel (Large, TNF Black)",Sports,http://www.amazon.com/dp/B004LRDQR2/,1,1
"Repel Lemon Eucalyptus Natural Insect Repellent, 4-Ounce Pump Spray",Lawn & Patio,http://www.amazon.com/dp/B004N59OFU/,7,1
Badger SPF30 Sunscreen (2.9 oz) and Badger SPF 35 Sport Sunscreen Face Stick (.65 oz),Beauty,http://www.amazon.com/dp/B004OXEQ4U/,1,1
"MagicShine SCUBA Diving LED Flashlight with Battery and Charger, 1000-Lumen, Black",Sports,http://www.amazon.com/dp/B005657PD4/,1,1
S3 T1000 Watertight Dry Case (Black),Sports,http://www.amazon.com/dp/B005EGZBF4/,1,1
I-DIVE Dive Flag Swim Trunks,Sports,http://www.amazon.com/dp/B005F13SWG/,1,1
Casio Men's MRW200H-1BV Black Resin Dive Watch,Watch,http://www.amazon.com/dp/B005JVP0LE/,14,1
Scubapro Litehawk Quick-Ditch Weight Holster Pocket Kit,Sports,http://www.amazon.com/dp/B005TCGEM2/,1,1
"Cressi F1, black",Sports,http://www.amazon.com/dp/B0065NYXWW/,1,1
"5/4mm Tilos Men's Titanium Cold Water Semi-Dry Seal Suit for Scuba Diving, Black, LG",Sports,http://www.amazon.com/dp/B0067AVFTC/,1,1
Translucent Snappy Coil Lanyard with Spring Swivel Blue,Sports,http://www.amazon.com/dp/B006G2VE9W/,1,1
Reef Safe - Biodegradable Waterproof Sunscreen Lotion- SPF 30+ - 1 Pack,Beauty,http://www.amazon.com/dp/B007KBLJ8E/,1,1
Oceanic VT 4.1 Scuba Diving Computer with Transmitter,Sports,http://www.amazon.com/dp/B007NHRUW4/,1,1
"Scuba Choice Scuba Diving Palantic AS103 DIN Regulator Adjustable Second Stage with 27"" Hose",Toy,http://www.amazon.com/dp/B007XK0US2/,1,1
Timex Men's T2N812DH IQ Adventure Series Watch,Watch,http://www.amazon.com/dp/B008579380/,1,1
Voit Duck Feet Swim Fins,Sports,http://www.amazon.com/dp/B0088MGG4Q/,1,1
Oceanic Viper Scuba Diving Fin - Warrior Edition - Size X-Small,Sports,http://www.amazon.com/dp/B008A0QIVC/,1,1
"Garnier Fructis Sleek & Shine Moroccan Sleek Oil Treatment, 3.75 fl. oz.",Beauty,http://www.amazon.com/dp/B008DF6XB4/,2,1
Neoprene Mask Strap with Free Snorkel Keeper - Green,Sports,http://www.amazon.com/dp/B009N6AE44/,1,1
"Viewtainer Storage Container, 2.75-Inch by 5-Inch, Black",Art and Craft Supply,http://www.amazon.com/dp/B009OOYI24/,2,1
Gear Keeper RT5-5901 Micro Scuba Retractor Snap Clip Mount with Q/C Split Ring Accessory,Sports,http://www.amazon.com/dp/B00A36SKYO/,1,1
Gear Keeper RT4-5912 Small Flashlight Retractor Large Heavy Duty Snap Clip Mount with Q/C-II Split Ring Accessory,Sports,http://www.amazon.com/dp/B00A36SL4S/,1,1
Stahlsac by Bare HD Caicos Cargo Travel Roller Dive Bag (Black),Sports,http://www.amazon.com/dp/B00A4A44JE/,1,1
"U.S.Divers Diva 1 LX/Island Dry LX Snorkel with Trek/Travel Bag, Aqua, Small",Sports,http://www.amazon.com/dp/B00AVXPI4Y/,1,1
"T-REIGN Hunting Small Retractable Gear Tether, Carabiner, 24"" Kevlar Cord, 4 oz. Retraction Force, Green Polycarbonate Case, Universal Attachment",Sports,http://www.amazon.com/dp/B00BF6QRM8/,1,1
"The Original, Mil Spec. CHRISTO-LUBE MCG 111, 2 oz. Tube",Automotive Parts and Accessories,http://www.amazon.com/dp/B00BIQ7SD2/,1,1
"U.S. Divers Lux Platinum Snorkeling Set, Panoramic View Mask, Pivot Fins, Dry Top Snorkel + Gear Bag, Black L/XL",Sports,http://www.amazon.com/dp/B00BUMDZ72/,1,1
New Safety and Rescue Scuba Diver EMT Scissors Shears with Sheath & Plastic Clip - Hi-Visibility Yellow,Sports,http://www.amazon.com/dp/B00C9J694G/,1,1
Double Lock on Locking Bicycle Handlebar Grips Cycle Bicycle Mountain Bike BMX Floding (a Pair) Blue Gold Red (Red (a pair)),Sports,http://www.amazon.com/dp/B00E35Y9P0/,2,1
Meclizine HCL 25mg Generic For Bonine Chewable Tablets 100 ea 3 PACK by Rugby,Health and Beauty,http://www.amazon.com/dp/B00EMLC07O/,2,1
GoPro Hero4 and Hero3+ Frameless Dive Mask - Scuba and Snorkel - Black,Sports,http://www.amazon.com/dp/B00GMADODM/,1,1
PolarPro Red Filter Standard Housing Scuba Accessory for GoPro Hero4 and Hero3+,Photography,http://www.amazon.com/dp/B00GWFX69Y/,4,1
Hotshotz Instant Reusable Heat Pack Warmer 5x9 Green,Health and Beauty,http://www.amazon.com/dp/B00GZYY1RS/,1,1
"GOBUDi Action Camera Tough Stick | Works with AKASO, Cymas, Mesqool, Logicom, Vikeepro, DBPOWER, VTech, Lightdow, Campark, Garmin VIRB and top models | Extendible, Sturdy, Lightweight & Waterproof",Photography,http://www.amazon.com/dp/B00H1YPYLS/,2,1
"Canon PowerShot D30 Waterproof Digital Camera, Blue",Photography,http://www.amazon.com/dp/B00I58LNF0/,2,1
WoCase Professional Switchable Lens Filter Set for GoPro HERO4 HERO 3+ Cameras (Compatible with Standard Housing ONLY)(Full Dive Water Depth Coverage),Photography,http://www.amazon.com/dp/B00JL0U0E6/,3,1
"Glaceau Smartwater Vapor Distilled Water, 33.8 Ounce (Pack of 6)",Grocery,http://www.amazon.com/dp/B00KIG3WPQ/,4,1
Winning Images with Any Underwater Camera: The essential guide to creating engaging photos,eBooks,http://www.amazon.com/dp/B00KMBJJNQ/,1,1
"TUSA Full Foot Solla Fins (Medium/Large, Cobalt Blue)",Sports,http://www.amazon.com/dp/B00KMIRPSK/,1,1
"Xcel 3/2mm Axis Offset Wetsuit, Black, Small",Sports,http://www.amazon.com/dp/B00KXA0PDY/,1,1
"Phantom Aquatics Semi Dry Snorkel, Aqua",Sports,http://www.amazon.com/dp/B00MU1M9A6/,1,1
Mouth Mount for GoPro,Photography,http://www.amazon.com/dp/B00ODDO6A0/,2,1
"Osprey Porter Travel Backpack Bag, 46-Liter",Sports,http://www.amazon.com/dp/B00OKE68PS/,4,1
"OxyLED OxyWild DF20 Rechargeable Super Bright LED Submarine Waterproof Underwater Diving Torch Light, Yellow",Sports,http://www.amazon.com/dp/B00OSW3R8I/,1,1
