name,category,amazon_link,total_mentions,subreddit_mentions
Anaxagoras,eBooks,http://www.amazon.com/dp/B01M8JBI13/,23,8
Where's the Next Shelter?,eBooks,http://www.amazon.com/dp/B017QCTR2G/,15,7
Who Spoke on the Other Side,eBooks,http://www.amazon.com/dp/B073YS34BZ/,8,5
The Apotheosis Break (Skysail Saga Book 1),eBooks,http://www.amazon.com/dp/B01M9CZ909/,13,4
The Dungeoneers,eBooks,http://www.amazon.com/dp/B012EHKDTO/,15,4
"Upriver, Downriver",eBooks,http://www.amazon.com/dp/B01BAT3MLS/,18,3
Saving Hitler: An Alternate History Book,eBooks,http://www.amazon.com/dp/B011ZCUD6M/,4,3
The Goblin Wars Part One: Siege of Talonrend: (Epic Fantasy; Book One of the Goblin Wars Series),eBooks,http://www.amazon.com/dp/B00H9Y47LS/,6,3
Dead Kings: The Dawnmaiden,eBooks,http://www.amazon.com/dp/B071S1124H/,5,3
Heracles the Return,eBooks,http://www.amazon.com/dp/B01FNP4KMK/,3,3
How To Avoid Death On A Daily Basis (5 Book Series),Ebook Bundle,http://www.amazon.com/dp/B06XH2X4ST/,10,3
Soul Saver,eBooks,http://www.amazon.com/dp/B0127EV636/,3,3
Sky Ghosts: All for One (Sky Ghosts Series Book 1),eBooks,http://www.amazon.com/dp/B00QQABR5U/,4,2
Broken Tablet: Bronze Age Time Travel (Ixion Revolution Book 1),eBooks,http://www.amazon.com/dp/B01G4YM4RW/,2,2
Forged by Battle (WarVerse Book 1),eBooks,http://www.amazon.com/dp/B00QIRLF8U/,4,2
"5,000 Words Per Hour: Write Faster, Write Smarter: Write Faster, Write Smarter",eBooks,http://www.amazon.com/dp/B00XIQKBT8/,6,2
Windcatcher: Book I of the Stone War Chronicles,eBooks,http://www.amazon.com/dp/B017DPE2BW/,4,2
Almost Night: A Parody,eBooks,http://www.amazon.com/dp/B00V2UT95Y/,6,2
The Man Behind The Bar,eBooks,http://www.amazon.com/dp/B06Y35LQBB/,2,2
A Touch of Magic (The Llandra Saga Book 1),eBooks,http://www.amazon.com/dp/B006ETGELA/,3,2
The eBook Design and Development Guide,eBooks,http://www.amazon.com/dp/B009G2JMRK/,2,2
Wool Omnibus Edition [Kindle in Motion] (Silo series Book 1),eBooks,http://www.amazon.com/dp/B0071XO8RA/,53,2
Zulu,eBooks,http://www.amazon.com/dp/B0081NRRAE/,3,2
A PERILOUS JOURNEY: A Short Tale From My Great Adventures (The B.S. Hornigold Series Book 1),eBooks,http://www.amazon.com/dp/B06Y2MHHP3/,2,2
It's Okay to be Different Thorina-Bina,Book,http://www.amazon.com/dp/0996580204/,2,2
The Hooligans of Kandahar,Book,http://www.amazon.com/dp/0692754695/,2,2
Dybsy (The Legend of Dybsy Book 1),eBooks,http://www.amazon.com/dp/B072B6NJF4/,3,2
God Had Sex With a Dinosaur,eBooks,http://www.amazon.com/dp/B01ILEQBZY/,12,2
The Goblin Wars Complete Trilogy: Omnibus Edition (Three epic fantasy books),eBooks,http://www.amazon.com/dp/B01C1Y4L0M/,2,2
Beginning (Tape Recorder Trilogy Book 1),eBooks,http://www.amazon.com/dp/B01L0N30UM/,3,2
Eden Green (Gothic Book 1),eBooks,http://www.amazon.com/dp/B010ON836U/,5,2
Full Steam Ahead: A Steampunk Steamventure,eBooks,http://www.amazon.com/dp/B0157O6EN0/,2,2
Siege of Praetar (Tales of a Dying Star Book 1),eBooks,http://www.amazon.com/dp/B00QXQR7UG/,10,2
"Write Book, Make Money: Monetize Your Existing Knowledge and Publish a Bestselling eBook",eBooks,http://www.amazon.com/dp/B00NU6AHDQ/,2,2
The Baby Jesus Butt Plug,Book,http://www.amazon.com/dp/0972959823/,5,2
Demorn: Blade of Exile (The Asanti Series Book 1),eBooks,http://www.amazon.com/dp/B018ZVID4U/,2,2
The Justifications of George Cann,eBooks,http://www.amazon.com/dp/B01CTD4O6G/,4,2
A Star-Reckoner's Lot (A Star-Reckoner's Legacy Book 1),eBooks,http://www.amazon.com/dp/B01I5WBOUO/,16,2
"Charlotte, Wander On.",eBooks,http://www.amazon.com/dp/B00PF4O1O2/,2,2
Home Is Where The Start Is (Roseland Book 1),eBooks,http://www.amazon.com/dp/B00SY2ARGS/,3,2
The Facts Of Life: As Taught by a Nine Year Old,Book,http://www.amazon.com/dp/1520156499/,2,2
The Agent,eBooks,http://www.amazon.com/dp/B009QS4AVC/,2,2
My New Family: A Horror Suspense Story,eBooks,http://www.amazon.com/dp/B016EI4OV2/,2,2
Risen: First Book of the Nameless Chronicle,eBooks,http://www.amazon.com/dp/B01ALZDY6A/,2,2
"Cum For Bigfoot: Volume One, Books 1-5",Book,http://www.amazon.com/dp/1478209828/,11,1
Ink on Paper,Book,http://www.amazon.com/dp/1365192423/,1,1
Crimson Dusk,Book,http://www.amazon.com/dp/0692785949/,1,1
The Things That Grow With Us,Book,http://www.amazon.com/dp/0998354112/,1,1
AfterLife AfterDeath: Stories for the Dark,Book,http://www.amazon.com/dp/099831630X/,4,1
Buff The Bison Explores Yellowstone,Book,http://www.amazon.com/dp/0692763228/,1,1
True Blood Omnibus III,Book,http://www.amazon.com/dp/0575099399/,1,1
Problem Play,Book,http://www.amazon.com/dp/153931216X/,1,1
The End of Refuge,Book,http://www.amazon.com/dp/1539091104/,1,1
The People You May See,Book,http://www.amazon.com/dp/1539070468/,7,1
Hedgehog Art Through The Ages,Book,http://www.amazon.com/dp/1539641880/,1,1
The Apotheosis Break (Skysail Saga) (Volume 1),Book,http://www.amazon.com/dp/1539678822/,1,1
Botanical Weave: Adult coloring book with incredible floral weaves,Book,http://www.amazon.com/dp/1540809536/,1,1
Tangerine: Poems at 94,Book,http://www.amazon.com/dp/1543011209/,1,1
"Winning At Life Workbook: Write your way to a better life: improve focus, defeat brain fog, and overcome anxiety even when you feel like (pile of poo emoji)",Book,http://www.amazon.com/dp/1543255701/,1,1
Neil Gaiman and Charles Vess' Stardust,Book,http://www.amazon.com/dp/156389470X/,3,1
The Personal MBA: Master the Art of Business,Book,http://www.amazon.com/dp/1591845572/,6,1
"I, Robot: The Illustrated Screenplay",Book,http://www.amazon.com/dp/1596870419/,2,1
The Bedtime Book with No Story: The Only Bedtime Book in the World with No Story,Book,http://www.amazon.com/dp/1535372060/,1,1
"That Day, Great and Terrible",Book,http://www.amazon.com/dp/0996843205/,2,1
Arsenic Flavored Bubblegum,Book,http://www.amazon.com/dp/153510743X/,1,1
The Genie's Oak,Book,http://www.amazon.com/dp/1530994233/,1,1
This Foolish Heart of Mine,Book,http://www.amazon.com/dp/0995252904/,1,1
How Two: Have a Successful Relationship,Book,http://www.amazon.com/dp/1523940115/,1,1
Finding Forever (Finding Heaven) (Volume 2),Book,http://www.amazon.com/dp/1522891226/,1,1
The Lock (Unlocked),Book,http://www.amazon.com/dp/0994581173/,1,1
Finding Heaven (Finding Heaven Series),Book,http://www.amazon.com/dp/0692550305/,1,1
True Blood Dead until Dark; Living Dead in Dallas; Club Dead,Book,http://www.amazon.com/dp/0575091223/,1,1
Ruin (The Faithful and the Fallen),Book,http://www.amazon.com/dp/0316386324/,1,1
Numbercaste,Book,http://www.amazon.com/dp/1521795436/,1,1
Dead Kings: The Dawnmaiden,Book,http://www.amazon.com/dp/1521264392/,1,1
Forbidden Lessons,Book,http://www.amazon.com/dp/0992501717/,1,1
"The wizard, the waif, and the wayfinder",Book,http://www.amazon.com/dp/1520755333/,1,1
A Night Without Sunshine,eBooks,http://www.amazon.com/dp/B00AA3OUCQ/,1,1
Monsters All the Way Down,Book,http://www.amazon.com/dp/0990460770/,1,1
WikiTi,Book,http://www.amazon.com/dp/0692466290/,1,1
Recovering is an Art (Volume 1),Book,http://www.amazon.com/dp/1519208839/,1,1
Bloodlust: A Gladiator's Tale (Domains of the Chosen Book 1),eBooks,http://www.amazon.com/dp/B008MAY80S/,5,1
Mommy and Daddy want to F%#&,Book,http://www.amazon.com/dp/1517249260/,1,1
Self-Publisher's Legal Handbook: The Step-by-Step Guide to the Legal Issues of Self-Publishing,Book,http://www.amazon.com/dp/0988302152/,1,1
Necromancer,eBooks,http://www.amazon.com/dp/B0088K8EQG/,1,1
Pressure: First Encounter,eBooks,http://www.amazon.com/dp/B009RYN2U0/,1,1
A Haiku Garden: Selections from the Everyday Photo Haiku Project,Book,http://www.amazon.com/dp/1516918266/,3,1
Formatting Your eBook (Using Word & Basic HTML to Format a Title by Yourself),eBooks,http://www.amazon.com/dp/B00ADSLXYQ/,1,1
Rusalka,eBooks,http://www.amazon.com/dp/B00B0KSCQI/,1,1
The Hotel Of Insanity: Teaching English In Korea (The Korea Trilogy Book 1),eBooks,http://www.amazon.com/dp/B00BO3EJUY/,1,1
How To Sell Fiction On Kindle. Marketing Your Ebook In Amazon's Ecosystem: A Guide For Kindle Publishing Authors.,eBooks,http://www.amazon.com/dp/B00BR6G3ZW/,1,1
Hawke's Doom (The Dreadful Monology Book 1),eBooks,http://www.amazon.com/dp/B00BUU57FM/,1,1
Semenology - The Semen Bartender's Handbook,eBooks,http://www.amazon.com/dp/B00D5FJOWC/,4,1
Book of Kayal: Strength of Unity,eBooks,http://www.amazon.com/dp/B00DCJR284/,3,1
Love In The Time Of Swine Flu: A Travel Adventure Book (The Korea Trilogy 2),eBooks,http://www.amazon.com/dp/B00DNPQVQ6/,2,1
Bloodlust: Will to Power (Domains of the Chosen Book 2),eBooks,http://www.amazon.com/dp/B00DZJKBV6/,5,1
Black Redneck vs. Space Zombies (A Black Redneck Adventure Book 1),eBooks,http://www.amazon.com/dp/B00EEJ3KDC/,21,1
Mirror Thief,eBooks,http://www.amazon.com/dp/B00FFRD672/,1,1
"Make A Killing On Kindle (Without Blogging, Facebook Or Twitter).  The Guerilla Marketer's Guide To Selling Ebooks On Amazon",eBooks,http://www.amazon.com/dp/B007XVWEIU/,1,1
Schooled,eBooks,http://www.amazon.com/dp/B007TPZ7XO/,1,1
