name,category,amazon_link,total_mentions,subreddit_mentions
"AXE Anti-Dandruff 2 in 1 Shampoo and Conditioner, Armor 12 oz ( Pack Of 3 )",Beauty & Personal Care,https://www.amazon.com/AXE-Anti-Dandruff-Shampoo-Conditioner-Armor/dp/B001FSK8RG?th=1,,1
Luxe Bidet Neo 120 - Self Cleaning Nozzle - Fresh Water Non-Electric Mechanical Bidet Toilet Attachment (blue and white),Tools & Home Improvement,https://www.amazon.com/Luxe-Bidet-Neo-120-Non-Electric/dp/B00A0RHSJO/ref=sr_1_3?s=kitchen-bath&amp;ie=UTF8&amp;qid=1446598582&amp;sr=1-3&amp;keywords=bidet,26,1
PetSafe SSSCAT Spray,Pet Supplies,https://www.amazon.com/PetSafe-KIT19001-SSScat/dp/B000RIA95G/ref=sr_1_1?ie=UTF8&amp;qid=1464720946&amp;sr=8-1&amp;keywords=ssscat,9,1
Outward Hound Fun Feeder Slow Feed Interactive Bloat Stop Dog Bowl,Pet Supplies,https://www.amazon.com/Feeder-Bloat-Outward-Hound-Large/dp/B00FPKNRF0/ref=redir_mobile_desktop?_encoding=UTF8&ref_=psdcmw_2975353011_t1_B000PE30MQ,5,1
"Micro USB Host OTG Cable with Micro USB Power for Samsung S7 S7 Edge, S6 S6+ S6 Edge, S5, S4 & Nexus 10 9 7 4 Player + ALL OTHERS",Cell Phones & Accessories,https://www.amazon.com/Micro-Cable-Samsung-Player-OTHERS/dp/B00CXAC1ZW,5,1
"Tuscan Dairy Whole Vitamin D Milk, Gallon, 128 oz",Grocery & Gourmet Food,https://www.amazon.com/Tuscan-Whole-Milk-Gallon-128/dp/B00032G1S0,4,1
American Born Chinese,Books,https://www.amazon.com/gp/product/0312384483/,3,1
AeroPress Coffee Maker,Home & Kitchen,https://www.amazon.com/AeroPress-80R08-Coffee-Maker/dp/B000GXZ2GS/ref=sr_1_1?s=kitchen&amp;ie=UTF8&amp;qid=1461199267&amp;sr=1-1&amp;keywords=aeropress,3,1
Kingston Digital DataTraveler SE9 16GB USB 2.0 (DTSE9H/16GBZET),Electronics,https://www.amazon.com/Kingston-Digital-DataTraveler-DTSE9H-16GBZET/dp/B00DYQYITG/ref=redir_mobile_desktop?_encoding=UTF8&%2AVersion%2A=1&%2Aentries%2A=0,2,1
"BABYBJORN Baby Carrier Original, Black, Cotton",Baby,https://www.amazon.com/dp/B0009JOSNM/ref=cm_sw_r_cp_apa_5xduzbYY70JVY,2,1
"SABRE Wedge Door Stop Security Alarm with 120 dB Siren - Great for Home, Travel, Apartment or Dorm",Tools & Home Improvement,https://www.amazon.com/SABRE-Wedge-Security-Alarm-Siren/dp/B00M30SQGA/,2,1
The OCD Workbook: Your Guide to Breaking Free from Obsessive-Compulsive Disorder (A New Harbinger Self-Help Workbook),Books,https://www.amazon.com/OCD-Workbook-Breaking-Obsessive-Compulsive-Disorder/dp/1572249218/ref=sr_1_1?ie=UTF8&amp;qid=1483290266&amp;sr=8-1&amp;keywords=ocd+workbook,2,1
JavaPresse Coffee Company Manual Coffee Grinder,Home & Kitchen,https://www.amazon.com/JavaPresse-Coffee-Grinder-Precision-Stainless/dp/B013R3Q7B2/ref=sr_1_16?s=kitchen&amp;ie=UTF8&amp;qid=1461199209&amp;sr=1-16&amp;keywords=coffee+grinder,2,1
"Metamucil Daily Fiber Supplement, Psyllium Husk Capsules, 160 Capsules (Pack of 2)","Health, Household & Baby Care",https://www.amazon.com/Metamucil-Multi-Health-Capsules-capsule-bottle/dp/B001G7QVAE/ref=sr_1_3?s=hpc&amp;ie=UTF8&amp;qid=1446598669&amp;sr=1-3&amp;keywords=metamucil,1,1
"10 Panel Dip Drug Testing Kit, Test for 10 Different Drugs. (1)",Industrial & Scientific,https://www.amazon.com/Panel-Drug-Testing-Different-Drugs/dp/B003DW6XPS/ref=zg_bs_3777251_1,1,1
"Fisher Space Pen Bullet Chrome Finish, Gift Boxed (400)",Office Products,https://www.amazon.com/Fisher-Bullet-Chrome-Finish-400/dp/B000095K9D,1,1
Pyrantel Pamoate Suspension 50 mg 16 oz bottle by Generic,"Health, Household & Baby Care",https://www.amazon.com/Pyrantel-Pamoate-Suspension-bottle-Generic/dp/B019QSE476/,1,1
Preparation H Medicated Wipes 48 Ea,"Health, Household & Baby Care",https://www.amazon.com/gp/product/B00CRNW06A/ref=pd_lpo_sbs_dp_ss_2?pf_rd_p=1944687602&amp;pf_rd_s=lpo-top-stripe-1&amp;pf_rd_t=201&amp;pf_rd_i=B001G7QV5E&amp;pf_rd_m=ATVPDKIKX0DER&amp;pf_rd_r=1ERDZ0W2KQAZJ3MCKKAS,1,1
OurPets DuraPet Slow Feed Premium Stainless Steel Dog Bowl,Pet Supplies,https://www.amazon.com/OurPets-DuraPet-Premium-Stainless-Steel/dp/B001NJ4PVW/ref=sr_1_4?s=pet-supplies&amp;ie=UTF8&amp;qid=1496416597&amp;sr=1-4&amp;keywords=dog+bowl+to+slow+down+eating,1,1
"Fruit of the Loom Men's  Low Rise Boxer, Assortment - Colors may vary(Pack of 4)","Clothing, Shoes & Jewelry",https://www.amazon.com/Fruit-Loom-Mens-4-Pack-Boxer/dp/B00BRDCRGO/ref=sr_1_6?s=apparel&amp;ie=UTF8&amp;qid=1422213503&amp;sr=1-6&amp;keywords=low+rise+boxer+briefs,1,1
CHUYI High Speed Metal Credit Bank Card Shape 16GB USB 2.0 Flash Drive Pen Drive Memory Stick Jump Drive Thumb Drive White,Electronics,https://www.amazon.com/Metal-Credit-Shape-Flash-Memory/dp/B00ULLG5GQ/ref=sr_1_12?s=pc&amp;ie=UTF8&amp;qid=1475768781&amp;sr=1-12&amp;keywords=credit+card+usb+drive&amp;refinements=p_36,1,1
The Gender Trap: Parents and the Pitfalls of Raising Boys and Girls,Books,https://www.amazon.com/The-Gender-Trap-Parents-Pitfalls/dp/0814737838,1,1
NEW Digital Peephole Door Viewer Video Recorder 3.0 Inch Touch Screen,Tools & Home Improvement,https://www.amazon.com/Digital-Peephole-Viewer-Recorder-Screen/dp/B009WQAODG,1,1
Roxaboxen,Books,https://www.amazon.com/Roxaboxen-Alice-McLerran/dp/0060526335,1,1
InterDesign 255 00 Clean & Dirty Dishwasher Indicator,Home & Kitchen,https://www.amazon.com/InterDesign-Clean-Dirty-Dishwasher-Indicator/dp/B00004XSF9/ref=redir_mobile_desktop?_encoding=UTF8&%2AVersion%2A=1&%2Aentries%2A=0,1,1
JUANW 20 Pack 1G Waterproof USB Flash Drive 1G Mini Small Flash Memory Stick USB Key Drive Rifle Gun Black,Electronics,https://www.amazon.com/JUANW-Waterproof-Flash-Drive-Memory/dp/B018I9DPC4/ref=sr_1_sc_1?s=pc&amp;ie=UTF8&amp;qid=1475771820&amp;sr=1-1-spell&amp;keywords=1,1,1
