name,category,amazon_link,total_mentions,subreddit_mentions
DEVIL IN THE DARKNESS: The True Story of Serial Killer Israel Keyes,Books,https://www.amazon.com/dp/1532727984/ref=cm_sw_r_sms_c_api_okzyzbP0HSYE3,1,1
Serial Killer Playing Cards - 54 Unique American Serial Killer Cards,Toys & Games,https://www.amazon.com/Serial-Killer-Playing-Cards-American/dp/B00FAYTCP0,1,1
Defending the Devil: My Story As Ted Bundy's Last Lawyer,Books,https://www.amazon.com/Defending-Devil-Story-Bundys-Lawyer/dp/0688108237,1,1
Notorious Serial Killers - a Trump card game for adults,Toys & Games,https://www.amazon.com/Notorious-Serial-Killers-Trump-adults/dp/B007OCAVLK/ref=pd_sbs_14_t_0?_encoding=UTF8&amp;psc=1&amp;refRID=JGXH7SRJ127VHJQ29Q7R,1,1
The Countess: A Novel of Elizabeth Bathory,Books,https://www.amazon.com/The-Countess-Novel-Elizabeth-Bathory/dp/0307588467,1,1
Invisible Killer: The Monster Behind the Mask,Books,https://www.amazon.com/Invisible-Killer-Monster-Behind-Mask/dp/0988860511/ref=sr_1_1?ie=UTF8&amp;qid=1434136612&amp;sr=8-1&amp;keywords=charlie+brandt,1,1
Appointment for Murder,Books,https://www.amazon.com/Appointment-Murder-S-C-Bakos/dp/1558175520,1,1
Internet Slave Master (Axis Trilogy),Books,https://www.amazon.com/Internet-Slave-Master-Axis-Trilogy/dp/0312979274/ref=sr_1_1?ie=UTF8&amp;qid=1437028889&amp;sr=8-1&amp;keywords=internet+slavemaster,1,1
Dahmer Detective: The Interrogation and Investigation That Shocked The World,Books,https://www.amazon.com/Dahmer-Detective-Interrogation-Investigation-Shocked/dp/0994750005/ref=sr_1_1?ie=UTF8&amp;qid=1492019796&amp;sr=8-1&amp;keywords=dahmer+detective,1,1
