name,category,amazon_link,total_mentions,subreddit_mentions
"Sliquid H2O Original Water Based Lubricant, 8.5 Ounce","Health, Household & Baby Care",https://www.amazon.com/Sliquid-Original-Water-Based-Lubricant/dp/B000C5KATO/ref=sr_1_1_s_it?s=hpc&amp;ie=UTF8&amp;qid=1458154563&amp;sr=1-1&amp;keywords=sliquid,4,1
"CalExotics Dr. Joel Kaplan Erection Enhancing Lasso Ring, Black","Health, Household & Baby Care",https://www.amazon.com/CalExotics-Kaplan-Erection-Enhancing-Lasso/dp/B002JINW4W/ref=pd_lpo_vtph_121_lp_img_3?_encoding=UTF8&amp;refRID=20HANHF0G8YZQWHAGP6W&amp;th=1,1,1
"Exxxtreme Sheets Fitted Rubber Sheet, King Size","Health, Household & Baby Care",https://www.amazon.com/gp/product/B00GRQL5BO,1,1
Million Dollar Consulting,Books,https://www.amazon.com/Million-Dollar-Consulting-Alan-Weiss/dp/0071622101/ref=sr_1_1?ie=UTF8&amp;qid=1436653515&amp;sr=8-1&amp;keywords=million+dollar+consulting,1,1
Blueprint for an Escort Service,Books,https://www.amazon.com/Blueprint-Escort-Service-Vicky-Gallas/dp/1449945058,1,1
"Lube Shooter Lubricant Delivery Device, Red","Health, Household & Baby Care",https://www.amazon.com/Lube-Shooter-Lubricant-Delivery-Device/dp/B00132TBCM,1,1
