name,category,amazon_link,total_mentions,subreddit_mentions
The Tax Domme's Guide for Sex Workers and All Other Business People,Book,http://www.amazon.com/dp/1439251061/,2,1
Swiss Navy 8oz - Silicone Lube,Health and Beauty,http://www.amazon.com/dp/B000ITXNRU/,2,1
"Logitech HD Pro Webcam C920, Widescreen Video Calling and Recording, 1080p Camera, Desktop or Laptop Webcam",Personal Computer,http://www.amazon.com/dp/B006JH8T3S/,96,1
By Gavin de Becker - The Gift of Fear (4.11.1998),Book,http://www.amazon.com/dp/B00HTJTPMO/,1,1
"pH-D Feminine Health Support, Boric Acid Vaginal Suppositories, Bottle of 14 (600mg)",Health and Beauty,http://www.amazon.com/dp/B00UNZEQVQ/,2,1
