name,category,amazon_link,total_mentions,subreddit_mentions
The Myth of the Robber Barons: A New Look at the Rise of Big Business in America,Books,https://www.amazon.com/Myth-Robber-Barons-Business-America/dp/0963020315,3,2
Economics in One Lesson: The Shortest and Surest Way to Understand Basic Economics,Books,https://www.amazon.com/dp/0517548232,6,1
The Law,Books,https://www.amazon.com/dp/1612930123,4,1
Crown Condoms 100 Pack,"Health, Household & Baby Care",https://www.amazon.com/Okamoto-Condoms-Famous-Sensitive-Sensation/dp/B000BK5TVY/ref=sr_1_4?ie=UTF8&amp;qid=1427569217&amp;sr=8-4&amp;keywords=condoms,4,1
How to Catch a Russian Spy: The True Story of an American Civilian Turned Double Agent,Books,https://www.amazon.com/How-Catch-Russian-Spy-American/dp/1476788820/ref=sr_1_1?ie=UTF8&amp;qid=1433172570&amp;sr=8-1&amp;keywords=how+to+catch+a+russian+spy,3,1
The True Believer: Thoughts on the Nature of Mass Movements (Perennial Classics),Books,https://www.amazon.com/True-Believer-Thoughts-Movements-Perennial/dp/0060505915,2,1
The White Man's Burden: Why the West's Efforts to Aid the Rest Have Done So Much Ill and So Little Good,Books,https://www.amazon.com/White-Mans-Burden-Efforts-Little/dp/0143038826,2,1
"NISHIKI Premium Brown Rice, 5-Pound",Grocery & Gourmet Food,https://www.amazon.com/NISHIKI-Premium-Brown-Rice-5-Pound/dp/B006SFAS6C/ref=redir_mobile_desktop?_encoding=UTF8&amp%3Bpsc=1&ref_=ya_st_dp_summary,1,1
Green Split Peas | Non-GMO Project Verified | 100% Non-Irradiated | Certified Kosher Parve | USA Grown |Identity Preserved (We tell you which field we grew it in) É,Grocery & Gourmet Food,https://www.amazon.com/Verified-Non-Irradiated-Certified-Identity-Preserved/dp/B004M0ES98/ref=redir_mobile_desktop?_encoding=UTF8&amp%3Bpsc=1&ref_=ya_st_dp_summary,1,1
Science Left Behind: Feel-Good Fallacies and the Rise of the Anti-Scientific Left,Books,https://www.amazon.com/Science-Left-Behind-Feel-Good-Anti-Scientific/dp/161039321X,1,1
The Slaveholding Crisis: Fear of Insurrection and the Coming of the Civil War (Conflicting Worlds: New Dimensions of the American Civil War),Books,https://www.amazon.com/Slaveholding-Crisis-Insurrection-Conflicting-Dimensions/dp/0807164356/ref=sr_1,1,1
LINKWELL 50x30cm USA American Revolver Gun Burlap Cushion Covers Pillow Case,Home & Kitchen,https://www.amazon.com/dp/B0096A4A74/,1,1
