name,category,amazon_link,total_mentions,subreddit_mentions
Sennheiser CX200 Twist-to-Fit Earbuds,Electronics,https://www.amazon.com/Sennheiser-CX200-Twist-to-Fit-Earbuds/dp/B001EZUQ5E?ie=UTF8&amp;keywords=sennheiser,3,1
American Nations: A History of the Eleven Rival Regional Cultures of North America,Books,https://www.amazon.com/American-Nations-History-Regional-Cultures/dp/0143122029/,3,1
Amazon Kindle 9W PowerFast Adapter for Accelerated Charging,Amazon Devices,https://www.amazon.com/Amazon-PowerFast-Adapter-Accelerated-Charging/dp/B006GWO5WK/ref=cm_cr_pr_sims_t/192-0089460-7181572,2,1
Golden Rule: The Investment Theory of Party Competition and the Logic of Money-Driven Political Systems (American Politics and Political Economy Series),Books,https://www.amazon.com/Golden-Rule-Investment-Competition-Money-Driven/dp/0226243176,2,1
Kindle PowerFast Charger for Accelerated Charging for Australia (for Kindle Fire tablets and Kindle e-readers),Amazon Devices,https://www.amazon.com/PowerFast-Charger-Accelerated-Charging-readers/dp/B006GWO782/ref=cm_cr_pr_product_top?ie=UTF8,1,1
Christian Ethics: A Very Short Introduction,Books,https://www.amazon.com/Christian-Ethics-Very-Short-Introduction/dp/0199568863/,1,1
"[ The End Is Near and It's Going to Be Awesome: How Going Broke Will Leave America Richer, Happier, and More Secure By Williamson, Kevin D ( Author ) Hardcover 2013 ]",Books,https://www.amazon.com/End-Near-Its-Going-Awesome/dp/B00J5X2S8U/ref=sr_1_7?s=books&amp;ie=UTF8&amp;qid=1496332614&amp;sr=1-7,1,1
"Nobrow : The Culture of Marketing, the Marketing of Culture",Books,https://www.amazon.com/Nobrow-Culture-Marketing/dp/0375704515,1,1
Story of World War II (Dover History Coloring Book),Books,https://www.amazon.com/Story-World-Dover-History-Coloring/dp/0486436950,1,1
Across Atlantic Ice: The Origin of America's Clovis Culture,Books,https://www.amazon.com/Across-Atlantic-Ice-Americas-Culture/dp/0520275780,1,1
The Politically Incorrect Guide to Capitalism,Books,https://www.amazon.com/Politically-Incorrect-Guide-Capitalism/dp/1596985046/ref=pd_sim_14_1?_encoding=UTF8&amp;pd_rd_i=1596985046&amp;pd_rd_r=844BTQD2VGYHTJ3QC4CB&amp;pd_rd_w=hiLTM&amp;pd_rd_wg=Bensp&amp;psc=1&amp;refRID=844BTQD2VGYHTJ3QC4CB,1,1
Wild Thing: A Novel,Books,https://www.amazon.com/Wild-Thing-Novel-Josh-Bazell/dp/0316032204,1,1
By Light of Moon: Campfire Songs & Cowboy Tunes,CDs & Vinyl,https://www.amazon.com/By-Light-Moon-Campfire-Cowboy/dp/B000002A03,1,1
Revell Germany Apollo Saturn V Rocket Model Kit,Toys & Games,https://www.amazon.com/Revell-Germany-Apollo-Saturn-Rocket/dp/B00G7G4EPI,1,1
The American flag metal Marine Corps Semper F1 Pillowcase zip 18x18 (Twin sides) Custom Zippered Pillow Cover Cases,"Clothing, Shoes & Jewelry",https://www.amazon.com/dp/B00MB9I8YI,1,1
