name,category,amazon_link,total_mentions,subreddit_mentions
"How to Travel the World on $50 a Day: Travel Cheaper, Longer, Smarter",Book,http://www.amazon.com/dp/0399159673/,3,1
Vagabonding: An Uncommon Guide to the Art of Long-Term World Travel,Book,http://www.amazon.com/dp/0812992180/,13,1
Lonely Planet Central America on a shoestring (Travel Guide),Book,http://www.amazon.com/dp/1786571110/,1,1
"Stansport Scout A-Frame Backpackers Tent, Green",Sports,http://www.amazon.com/dp/B0006V2B2I/,7,1
Coolerguys Dual 80mm USB Cooling Fans,PC Accessory,http://www.amazon.com/dp/B002NVC1DS/,8,1
Eagle Creek All-Terrain Money Belt,Apparel,http://www.amazon.com/dp/B0054IGU7U/,4,1
Military Outdoor Clothing Previously Issued Government Olive Drab Cordura 2 Strap Duffle Bag,Sports,http://www.amazon.com/dp/B00DBPMXR4/,2,1
HoboTraveler.com Zipper Secret Pockets for Money Ready to Sew into Clothing (10 Pack),Apparel,http://www.amazon.com/dp/B00N51DGHA/,3,1
BRS Outdoor Camping Gas Cooking Stove Portable Ultralight Burner 25g,Sports,http://www.amazon.com/dp/B00NNMF70U/,45,1
"10000mAh 3 USB Port Power Bank, Lumsing Ultrathin Portable External Battery Pack for iPhone, iPad, Samsung Galaxy, and Android",Wireless,http://www.amazon.com/dp/B01DU4E7EW/,1,1
