name,category,amazon_link,total_mentions,subreddit_mentions
Kaito T-1 Radio antenna,Speakers,http://www.amazon.com/dp/B00066Z9XG/,3,3
"Kaito KA1103 Worldband Radio, Silver",Speakers,http://www.amazon.com/dp/B0006OCEFY/,2,2
Sangean ANT-60 Short Wave Antenna,Speakers,http://www.amazon.com/dp/B000023VW2/,2,2
Zenith Trans-Oceanic: The Royalty of Radios,Book,http://www.amazon.com/dp/0764328387/,2,2
"TECSUN PL-380 DSP FM stereo. MW. SW. LW. World Band PLL Radio Receiver, LCD Display, ETM Function Added",Speakers,http://www.amazon.com/dp/B004H912FC/,1,1
Roadpro Motorola Plug To BNC Adapter Socket High Quality Durable Excellent Performance RPBNC-26,Speakers,http://www.amazon.com/dp/B005UURA6C/,1,1
"Tecsun PL-600 AM/FM/LW SSB Shortwave Radio, Black",Speakers,http://www.amazon.com/dp/B00ESUOMFW/,4,1
"Tecsun PL880 Portable Digital PLL Dual Conversion AM/FM, Longwave & Shortwave Radio with SSB (Single Side Band) Reception",Speakers,http://www.amazon.com/dp/B00GJ51NVA/,4,1
TECSUN PL-310ET FM Stereo/SW/MW/LW World Band PLL DSP Radio Black by allnice,Speakers,http://www.amazon.com/dp/B0104J57GS/,1,1
Sony ICF-SW7600GR AM/FM Shortwave World Band Receiver with Single Side Band Reception,Speakers,http://www.amazon.com/dp/B00006IS4X/,7,1
Sony ICF-SW11 12-band World Band Radio (Discontinued by Manufacturer),Speakers,http://www.amazon.com/dp/B0002VM7MG/,1,1
Eton Corp. NGAN200 Grundig Indoor Antenna,Personal Computer,http://www.amazon.com/dp/B001PNNXGO/,2,1
