name,category,amazon_link,total_mentions,subreddit_mentions
Lansky Deluxe 5-Stone Sharpening System,Sports,http://www.amazon.com/dp/B000B8IEA4/,9,1
Pocket Ref 4th Edition,Book,http://www.amazon.com/dp/1885071620/,6,1
Stanley FatMax Xtreme 55-120 FuBar III,Home Improvement,http://www.amazon.com/dp/B000VSSG3O/,6,1
Autocross to Win (DG's Autocross Secrets): The art and science of developing autocross cars,Book,http://www.amazon.com/dp/1521406987/,3,1
Monoprice 15-Feet USB 2.0 A Male to A Female Extension 28/24AWG Cable (Gold Plated) (105435),Personal Computer,http://www.amazon.com/dp/B003L137Y6/,3,1
Sugru Moldable Glue - Original Formula - Classic Colours 8-Pack,Boost,http://www.amazon.com/dp/B008URBC9I/,3,1
♡♡♡♡Shagsall SEX MACHINE ADAPTER for SAWZALL / RECIPROCATING SAW WORKS WITH VAC U LOCK DILDOS ♡♡♡♡,Health and Beauty,http://www.amazon.com/dp/B00IPQNA62/,2,1
"Performance Tool W3939 Hammer Tough 2-1/2"" Drill Press Vise",Home Improvement,http://www.amazon.com/dp/B002RTKFWU/,2,1
"Milwaukee 2763-22 M18 1/2"" Inch Impact Wrench",Home Improvement,http://www.amazon.com/dp/B00GFUA7FC/,2,1
"Hi-Lift Jack XT485 48"" Hi-Lift X-TREME Jack",Automotive Parts and Accessories,http://www.amazon.com/dp/B0017T7WHW/,2,1
Mueller-Kueps 745 100 Wrench Extender,Automotive Parts and Accessories,http://www.amazon.com/dp/B013SXTH04/,1,1
"Dont Put Dick in Machinery Prank Warning Decal 10 Pack. Funny Rude Stickers Save Your Friends from Enticing & Risky Temptations Like Wood Chippers, Coffee Grinders, Pencil Sharpeners, ATVs & Much More",Toy,http://www.amazon.com/dp/B01MZAWNOB/,1,1
"hilmor Digital Adjustable Torque Wrench, 1963826",Home Improvement,http://www.amazon.com/dp/B01N5XLDMS/,1,1
Mine Tools HW12 Hammer Head Adjustable Wrench,Home Improvement,http://www.amazon.com/dp/B00H87JEBE/,1,1
Swordfish 31070 200PC Extended and Compressed Spring assortment Case Kit,Automotive Parts and Accessories,http://www.amazon.com/dp/B00VBGHJCY/,1,1
"SE HEMO-SET-6 Ultimate Hemostat Set, 6 Piece",Home Improvement,http://www.amazon.com/dp/B010UHD3T2/,1,1
SUPCO SPP6 Relay/Capacitor Hard Start Kit with 500% Increase Starting Torque,Home Improvement,http://www.amazon.com/dp/B0002YTLFE/,1,1
"Bic Classic Disposable Lighter, Colors May Vary(Pack of 3)",Health and Beauty,http://www.amazon.com/dp/B004R7G02Y/,1,1
"Vastar Hot Glue Gun with 30 Pieces Melt Glue Sticks Melting Adhesive Glue Gun Kit for DIY Small Craft and Quick Repairs in Home & Office, 20 Watt",Art and Craft Supply,http://www.amazon.com/dp/B01JOMZ4Z0/,1,1
"Swordfish 61200 3:1 Dual Wall Adhesive Lined Heat Shrinkable Tubing Assortment Kit, 85 Piece",Automotive Parts and Accessories,http://www.amazon.com/dp/B018GVR0NE/,1,1
"WIHA 36999    Ball End Hex L-Key Mid Length Metric Set 1.5-10mm in Holder, 9-Piece",Home Improvement,http://www.amazon.com/dp/B00E4QWBSK/,1,1
"WIHA 36937    Ball End Hex L-Key Mid Length Inch Set 0.050-3/8-Inch in Holder, 13-Piece",Home Improvement,http://www.amazon.com/dp/B00E4RV446/,1,1
"Wiha 36995 Ball End Hex-Inch and Metric L-Key Sets, 2-Pack",BISS,http://www.amazon.com/dp/B002S0O8Q2/,1,1
"IRWIN HANSON Machine Screw/Fractional/Metric Tap and Hex Die and Drill Bit Deluxe Set, 117 Piece 26377",Home Improvement,http://www.amazon.com/dp/B0000DD4KW/,1,1
"AIRMASTER CA30APE 30"" NON-OSCILLATING PEDESTAL FAN",BISS,http://www.amazon.com/dp/B00AO6LXTM/,1,1
"Threadlocker 2047, 50mL Bottle, Black",Automotive Parts and Accessories,http://www.amazon.com/dp/B004OCMNP0/,1,1
"Neiko 55093 6-Inch Cross Slide Drill Press Vise, X-Y Compound Heavy Duty Steel",Tools & Home Improvement,https://www.amazon.com/Neiko-55093-Heavy-Degree-Swivel/dp/B002YG6NVS,1,1
Maryland Flag Crab Sticker,Art and Craft Supply,http://www.amazon.com/dp/B00QZ3QA78/,1,1
"Renfrew, Cloth Hockey Tape, 1"" (Bright Pink, 25m)",Sports,http://www.amazon.com/dp/B0147UVMZK/,1,1
"RustAid GSX00101 Goof Off Rust Stain Remover, 1 Gallon",Home Improvement,http://www.amazon.com/dp/B00LMIZ91Y/,1,1
Manual Corn Tortilla Maker by Monarca,Kitchen,http://www.amazon.com/dp/B00IFDGST6/,1,1
"EFOTOPRO Pro Handheld Video Camera Stabilizer Steady for GoPro, Smartphone, Cannon, Nikon or any DSLR camera up to 2.1 lbs With Smooth Pro Steady Glide Cam - Red + Silver + Black",Photography,http://www.amazon.com/dp/B01M4ISSDG/,1,1
Firestik K-4A Stud with Screw-On Coaxial Termination for Antenna Mirror Mounts,Automotive Parts and Accessories,http://www.amazon.com/dp/B0002HRBSU/,1,1
"Walter 54A005 Surfox-T Heavy Duty Weld Cleaning Electrolyte, 1.5L Liquid",BISS,http://www.amazon.com/dp/B003OA6KIE/,1,1
