name,category,amazon_link,total_mentions,subreddit_mentions
Voice-Over Voice Actor: What It's Like Behind the Mic,Books,https://www.amazon.com/Voice-Over-Voice-Actor-What-Behind/dp/0984074007/ref=sr_1_1?ie=UTF8&amp;qid=1475614800&amp;sr=8-1&amp;keywords=voice+over+voice+actor,1,1
"Total Sportscasting: Performance, Production, and Career Development",Books,https://www.amazon.com/Total-Sportscasting-Performance-Production-Development/dp/0415813921/ref=sr_1_7?s=books&amp;ie=UTF8&amp;qid=1438901045&amp;sr=1-7,1,1
The Art of Sportscasting: How to Build a Successful Career,Books,https://www.amazon.com/The-Art-Sportscasting-Successful-Career/dp/1888698241,1,1
Adult Propeller Beanie Hat Made in the USA,"Clothing, Shoes & Jewelry",https://www.amazon.com/gp/product/B001QK4RZC/ref=oh_aui_detailpage_o00_s00?ie=UTF8&amp;psc=1,1,1
"Dynamic Figure Drawing (Edition First Edition) by Hogarth, Burne [Paperback(1996£©]",Books,https://www.amazon.com/Dynamic-Figure-Drawing-Hogarth-Paperback/dp/B00BP0O1AO/ref=redir_mobile_desktop?_encoding=UTF8&amp%3BdpID=51eHkuc5aqL&amp%3BdpPl=1&amp%3Bkeywords=dynamic%20figure%20drawing&amp%3Bpi=AC_SX236_SY340_FMwebp_QL65&amp%3Bqid=1477280751&amp%3Bref=plSrch&amp%3Bsr=8-6&ref_=mp_s_a_1_6,1,1
