name,category,amazon_link,total_mentions,subreddit_mentions
"Seville Classics 3-Tier Resin Slat Utility Shoe Rack, Espresso",Home,http://www.amazon.com/dp/B00336TY0K/,5,5
URBANJ MEN'S CAMEL TWILL TAPERED ANKLE ZIP SKINNY JOGGER PANTS (L),Apparel,http://www.amazon.com/dp/B01FNZ6PA0/,3,3
URBANJ MEN'S BLACK TWILL TAPERED ANKLE ZIP SKINNY JOGGER PANTS (XL),Apparel,http://www.amazon.com/dp/B01K9VS5OW/,2,2
Japanese Katakana 3 Stripes Laces - Shoelaces for Adidas NMD / Ultraboost / Yeezy (White) - 1 Pair (2 Shoelaces),Shoes,http://www.amazon.com/dp/B06ZYRWHWK/,2,2
Wilton Silver Color Mist,Kitchen,http://www.amazon.com/dp/B005KTVG86/,35,1
"Remington RTFS-2 FuzzAway Battery Operated Fabric Shaver, Sweater Shaver, Fuzz Saver",Beauty,http://www.amazon.com/dp/B0034BV6KA/,5,1
"SE 7924LP Heavy-Duty Leather Hole Punch Tool, 2.0 - 4.5 mm",Home Improvement,http://www.amazon.com/dp/B000NK5VY2/,5,1
Tarrago Hightech Nano Protector Spray 250 Ml,Shoes,http://www.amazon.com/dp/B003U47QBY/,5,1
"Adidas Yeezy Boost 350 AQ4832 ""Turtle Dove""",Shoes,http://www.amazon.com/dp/B010O2FZRG/,2,1
Angelus Genuine Professional Mink Oil Conditioner Spray,Shoes,http://www.amazon.com/dp/B007NZFW12/,2,1
Angelus Leather Paint 1 Oz White,Home,http://www.amazon.com/dp/B0196T961O/,2,1
Angelus Leather Dye (Neutral),Automotive Parts and Accessories,http://www.amazon.com/dp/B00FEQ3IB8/,2,1
"Rust-Oleum 280886 NeverWet 11-Ounce Boot and Shoe Spray, Clear",Home Improvement,http://www.amazon.com/dp/B00KRHF88A/,2,1
"Walnut Hollow Unfinished Wood Classic Box with Hinged Lid for Arts, Crafts, Hobbies and Home Storage",Toy,http://www.amazon.com/dp/B004I9SLEG/,2,1
Nike Men's Reax Lightspeed Cross Trainer,Shoes,http://www.amazon.com/dp/B01B57SBNE/,1,1
Matte Metallic Blue Car Wrap Vinyl Roll with Air Release 3mil-VViViD8 (1ft x 5ft),Automotive Parts and Accessories,http://www.amazon.com/dp/B00L9J54N4/,1,1
"VViViD Black Ash Wood Grain Textured Vinyl Wrap Film W/ Air-release Adhesive (1ft x 48"")",Art and Craft Supply,http://www.amazon.com/dp/B01BNT5DBW/,1,1
VViViD Satin Matte Red Vinyl Wrap Roll with Air Release Technology (1ft x 5ft),Automotive Parts and Accessories,http://www.amazon.com/dp/B00FXYA9HM/,1,1
Matte White Car Wrap Vinyl Roll with Air Release 3MIL-VViViD8 (1ft x 5ft),Automotive Parts and Accessories,http://www.amazon.com/dp/B00L9J5PTC/,1,1
"SONGMICS 10 Tiers Shoe Rack 50 Pairs Non-woven Fabric Shoe Tower Organizer Cabinet Black 39 3/8"" x 11 3/8"" x 68 7/8"" ULSH11H",Home,http://www.amazon.com/dp/B00ZOH2J5I/,1,1
URBANJ MEN'S OLIVE TWILL TAPERED ANKLE ZIP SKINNY JOGGER PANTS (L),Apparel,http://www.amazon.com/dp/B01JPZ2ILO/,1,1
"Gucci Gift Paper Shopping Bags, 5pk",Home Improvement,http://www.amazon.com/dp/B00VL306RM/,1,1
RAINBOW 0.8mm Chinese Knot Nylon Braided Cord Shamballa Macrame Beading Kumihimo String (50yards Spool),Home,http://www.amazon.com/dp/B00LE6HL2E/,1,1
"Chameleon Purple Blue Carbon Fiber Vinyl Wrap Sticker Decal Film Sheet - 4""X8"" Sample",Automotive Parts and Accessories,http://www.amazon.com/dp/B00D0UVWAE/,1,1
"Chameleon Carbon Fiber Purple to Blue Oil Slick Stretch Conform Caste Vinyl Wrap Decal Roll VViViD XPO (17.75"" x 5ft)",Automotive Parts and Accessories,http://www.amazon.com/dp/B00YLFTOF2/,1,1
"Duck Brand 299005 Professional Grade Electrical Tape, 3/4-Inch by 66 Feet, Single Roll, Orange",Home Improvement,http://www.amazon.com/dp/B000BOHK58/,1,1
Crocs Kids 15263 Cars Light-Up Clog (Toddler/Little Kid),Shoes,http://www.amazon.com/dp/B00EDEVVVG/,1,1
"SneakerC Luxury Sneaker Display Box - 100% Clear - 100% See Through - Acrylic Display Shoe Box - 360° Angle View (Size Large, Fit up to Size 15)",Home,http://www.amazon.com/dp/B00QOQI5LU/,1,1
adidas Performance Women's Lite Slip-On Running Shoe,Shoes,http://www.amazon.com/dp/B00YGNJWXS/,1,1
Nike Women's Vomero 10 Size 10.5 U.S.,Shoes,http://www.amazon.com/dp/B010WQLEAG/,1,1
"adidas Originals Men's Doom Relaxed Jogger, Medium Grey Heather, Large",Apparel,http://www.amazon.com/dp/B01LZ41Y08/,1,1
Felt Furniture Pads To Protect Hardwood Floors 120 Pieces Premium Floor Protectors For Furniture Feet Black And Brown Chair Leg Pads FREE FELT STRIP ROLL!,Home Improvement,http://www.amazon.com/dp/B01E6IPR36/,1,1
"adidas Men's Athletic No Show Sock, Black/Aluminum 2, Pack of 6,  6-12",Sports,http://www.amazon.com/dp/B008YA0ZN0/,1,1
Kiwi Sport Shoe Whitener,Single Detail Page Misc,http://www.amazon.com/dp/B000UDEBMA/,1,1
OxiClean Max Force Laundry Stain Remover Spray 12 ounce (pack of 1),Health and Beauty,http://www.amazon.com/dp/B001EWOA1I/,1,1
New Balance Men's Fresh Foam Cruz Running Shoe,"Clothing, Shoes & Jewelry",https://www.amazon.com/gp/product/B01LX3SDT5/ref=oh_aui_detailpage_o00_s00?ie=UTF8&amp;th=1&amp;psc=1,1,1
"Seville Classics 3-Tier Resin Slat Utility Shoe Rack (2-Pack), Espresso",Home,http://www.amazon.com/dp/B00H1QWD6A/,1,1
KangaROOS Men's Navy Men's Shaker Jogger 9 Regular,Shoes,http://www.amazon.com/dp/B01JH9IFJ2/,1,1
"ASICS Men's Gel-Lyte III Fashion Sneaker, King Fisher/King Fisher, 9.5 M US",Shoes,http://www.amazon.com/dp/B01B58JUIS/,1,1
CRAZY Men's Baggy Jeans Denim Sweatpants Loose Pants-42 [Apparel],Apparel,http://www.amazon.com/dp/6342509409/,1,1
Deluxe Seam Ripper Combo. One Big and One Handy Small Seam Ripper. Top Quality - Includes a Sewing Tape Measure (Tape measure colors may vary),Art and Craft Supply,http://www.amazon.com/dp/B018IX9XRG/,1,1
Jason Markk Repel Premium Stain and Water Repellent 8 fl oz,Apparel,http://www.amazon.com/dp/B01CCWPA94/,1,1
Kiwi Select All Rain & Stain Water Protector Leather Suede Nubuck Fabrick 5.5 Oz by Kiwi,Shoes,http://www.amazon.com/dp/B01M21AFVQ/,1,1
"Levi's Men's 511 Slim Fit Jean, Black - Stretch, 34W x 30L",Apparel,http://www.amazon.com/dp/B000LXO6ZG/,1,1
The Art of Crep Protect Spray,Shoes,http://www.amazon.com/dp/B013YRRFJ4/,1,1
10 Pieces Pack Triangle Tailor's Chalk Sewing Quilting Notions WHITE/YELLOW/RED/BLUE,Art and Craft Supply,http://www.amazon.com/dp/B00V07YRJC/,1,1
AmazonBasics 50 Pair Shoe Rack,Home,http://www.amazon.com/dp/B00H7P1FHI/,1,1
"Levi's Men's 511 Slim Fit Double Stitch Jean, Deep Blue, 36x34",Apparel,http://www.amazon.com/dp/B00OTS1BNO/,1,1
SONGMICS 10 Tiers Shoe Rack with Dustproof Cover Closet Shoe Storage Cabinet Organizer Grey URXJ36G,Home,http://www.amazon.com/dp/B00S0Q1COO/,1,1
"Ecko UNLTD Men's Twill Belted Cargo, Black, 36",Apparel,http://www.amazon.com/dp/B00S2ZY9G6/,1,1
Genuine Ford Fluid ZC-14 Spot and Stain Remover - 16 oz.,Automotive Parts and Accessories,http://www.amazon.com/dp/B000LPPPOK/,1,1
"Levi's Men's 511 Slim-Fit Line 8 Jean, Grey / Black 3D - Stretch, 36W x 34L",Apparel,http://www.amazon.com/dp/B00FB4G22K/,1,1
"Levi's Men's 511 Slim-Fit Line 8 Jean, Black Indigo 3D Rinse - Stretch, 36W x 34L",Apparel,http://www.amazon.com/dp/B0086L8DBI/,1,1
"CUSSELEN Men's Breathable Summer fabric Sneakers Leisure Closed Toe Slippers,Black,9 D(M) US",Shoes,http://www.amazon.com/dp/B01G6C2VMA/,1,1
URBANJ MEN'S OLIVE TWILL TAPERED ANKLE ZIP SKINNY JOGGER PANTS (XL),Apparel,http://www.amazon.com/dp/B01JPZ2ISM/,1,1
Adidas Jeremy Scott Bones,Shoes,http://www.amazon.com/dp/B00JJ16Q4A/,1,1
"BIRCH's Oval Shoelaces 27 Colors Half Round 1/4"" Shoe Laces 4 Different Lengths (37"" (94cm) - M, Ivory)",Shoes,http://www.amazon.com/dp/B00J5Q0MBW/,1,1
"Sharpie Oil-Based Paint Marker, Medium Point, White, 1-Count",Office Product,http://www.amazon.com/dp/B001PLKRZQ/,1,1
"Gel Lyte III (Unisex Sizes) (Strawberries & Cream) in Red/Cream by Asics, 13",Shoes,http://www.amazon.com/dp/B01A9ESUOY/,1,1
"Heartybay 10Pieces Round Pointed Tip Nylon Hair Brush Set, Blue",Art and Craft Supply,http://www.amazon.com/dp/B00V4EG6D6/,1,1
Japanese Katakana 3 Stripes Laces - Shoelaces for NMD / Ultraboost / Yeezy - Multiple Colors to Choose From!,Shoes,http://www.amazon.com/dp/B06ZZMVPM8/,1,1
Men's Light Blue Ripped Skinny Distressed Destroyed Slim Jeans Pants with Holes,Apparel,http://www.amazon.com/dp/B01KZPNXV2/,1,1
"Yalumi Spark 105-Lumen 90-Meter Spotlight White LED Headlamp, Black/Gray",Sports,http://www.amazon.com/dp/B00DSRXYUU/,1,1
STK 20 Pack Extra Thick Magic Cleaning Sponges - Eraser Sponge For All Surfaces - Kitchen-Bathroom-Furniture-Leather-Car-Steel - Just Add Water to Erase All Dirt - Melamine - Universal Cleaner,Home,http://www.amazon.com/dp/B01CYTW58Y/,1,1
"Kayden K Men's Tapered Zipper Ankle Jogger Pants (M, Jet Black)",Apparel,http://www.amazon.com/dp/B01CH0NB38/,1,1
(72x23) Michael Jordan (Wings Door) Sports Poster Print,Home,http://www.amazon.com/dp/B0015KNSYY/,1,1
"VTech CS6719-2 DECT 6.0 Phone with Caller ID/Call Waiting, Silver/Black with 2 Cordless Handsets",CE,http://www.amazon.com/dp/B00FRSYS12/,1,1
