name,category,amazon_link,total_mentions,subreddit_mentions
Buffalo iBuffalo Classic USB Gamepad for PC BSGP801GY,Personal Computer,http://www.amazon.com/dp/B002B9XB0E/,141,6
CKITZE BG-460 HDMI/SCART PAL System to NTSC HDMI Digital Audio Video Converter,Speakers,http://www.amazon.com/dp/B00988GMLG/,11,4
Security Bit Steel SET 3.8mm + 4.5mm Security Bit Screwdriver Tool (7cm Length) Open NES SNES N64 Super Nintendo 64 Cartridges & Systems,Video Games,http://www.amazon.com/dp/B009I6FWOQ/,7,4
Scart Hdmi to Hdmi Video Converter Box 1080p Scaler 3.5mm Coaxial Audio Out,Speakers,http://www.amazon.com/dp/B00MUNIVRO/,7,3
Retro-Bit SNES - Super UFO Pro 8 Game Saves & Backup Cartridge Adapter (UFO) - Super NES,Video Games,http://www.amazon.com/dp/B007O3MWVG/,3,3
enKo products Mini AV RCA Composite & S-video Video R/L Audio To HDMI Converter With High Speed HDMI Cable (6.5 Feet / 2 Meter),CE,http://www.amazon.com/dp/B00KXDS77M/,7,2
INNOVATION 7-38012-14010-9 Super Nintendo Entertainment System(R) AC Adapter,BISS,http://www.amazon.com/dp/B00K3ADPQI/,2,2
SuperRetro Wireless Controller Dual Pack [RETROBIT],Video Games,http://www.amazon.com/dp/B0083LSCZ8/,2,2
AC adapter for FC Famicom / SFC Super Famicom Japan Import,Video Games,http://www.amazon.com/dp/B004IWS1RA/,2,2
40 Volume Clear Developer,Beauty,http://www.amazon.com/dp/B004OKDW5W/,7,2
Retro-Bit RetroPort NES to SNES Cartridge Adapter - Super NES,Video Games,http://www.amazon.com/dp/B007A57C7W/,5,2
"NMS IF-VC International Dual Voltage & Frequency Travel Converter (50Hz, 220V to 60Hz, 120V)",Speakers,http://www.amazon.com/dp/B00699IKWQ/,2,1
Nintendo NES Classic Controller Bifold Wallet,Video Games,http://www.amazon.com/dp/B007X5G17G/,2,1
Tmvel mini RCACVS 3 RCA Composite Video AV to HDMI Converter for TV/PC/PS3/Blue-Ray DVD,Speakers,http://www.amazon.com/dp/B009A6PJKQ/,14,1
Retro-Bit RDP - Portable Handheld Console V2.0: CORE Edition - Black - NES,Video Games,http://www.amazon.com/dp/B009SE735Y/,10,1
Energizer 2032BP-4 3 Volt Lithium Coin Battery - Retail Packaging (4-Count),Health and Beauty,http://www.amazon.com/dp/B00D8P5T0U/,4,1
"Nyko Smart Clip – PlayStation DualShock 4 Controller Clip On Mount for Android Phones, Samsung Galaxy, S7, S6, Edge, Note 5, HTC One, Sony Xperia, Max Clamp 6 Inches",Video Games,http://www.amazon.com/dp/B00FLLFGO8/,35,1
Mini Composite RCA CVBS AV To HDMI Converter (Input: AV; Output: HDMI) For VCR DVD 720P 1080P With High-Speed HDMI Cable (6.5 Feet / 2 Meter) enKo Products,CE,http://www.amazon.com/dp/B00I482KZI/,19,1
Cinpel S-Video Cable for Nintendo 64 N64,Video Games,http://www.amazon.com/dp/B00KZLEFAK/,5,1
Etekcity Mini AV Video Audio RCA CVBS to HDMI Converter Box with Power Adapter,Speakers,http://www.amazon.com/dp/B00MNFWYBI/,4,1
Blue Yeti USB Microphone - Blackout Edition,Musical Instruments,http://www.amazon.com/dp/B00N1YPXW2/,36,1
"CirKa ""S91"" Premium Controller for SNES",Video Games,http://www.amazon.com/dp/B00PIZMB6S/,3,1
Nintendo Entertainment System Mens T-Shirt -Classic Nes Controller Flat Image (Extra Large) Black,Apparel,http://www.amazon.com/dp/B00PMLSE9Q/,1,1
Unit DP3913547 XRGB Mini Framemeister Micomsoft Upscaler Japan Import by Denpashinbunsya,Speakers,http://www.amazon.com/dp/B00QUBK6RK/,8,1
"Raspberry Pi 2 Model B Desktop (Quad Core CPU 900 MHz, 1 GB RAM, Linux)",Personal Computer,http://www.amazon.com/dp/B00T2U7R7I/,30,1
Retro Freak Controller Adapter Set System - Not Machine Specific,Video Games,http://www.amazon.com/dp/B00ZZ70KMG/,2,1
"CirKa ""S91"" Premium Controller for SNES (Super Famicom)",Video Games,http://www.amazon.com/dp/B01326JM3Y/,1,1
Crystal Black Revo K101 Plus Emulator Game Handheld,Video Games,http://www.amazon.com/dp/B013T7LT8M/,2,1
Vans Unisex Authentic Nintendo Super Mario Skate Shoes-Super Mario Bros-13-Women/11.5-Men,Shoes,http://www.amazon.com/dp/B019NUFRNW/,1,1
"6-in-1 60W Soldering Iron Gun with Carry Case and Cleaning Sponge Stand, SOAIY Adjustable Temperature Welding Soldering Iron , Including 5pcs Different Soldering Tips, Desoldering Pump, Soldering Wire",Home Improvement,http://www.amazon.com/dp/B01C9P7HDQ/,3,1
Conductive Rubber Pads For SFC/ for Super Entertainment System SNES silicon pad replacement part,PC Accessory,http://www.amazon.com/dp/B01CTK4A1I/,1,1
8BITDO NES30 Pro Wireless Bluetooth Controller Dual Classic Joystick For Android Gamepad PC+ Willgoo SRing Stander (with silver sring),Wireless,http://www.amazon.com/dp/B01DM1VY6W/,2,1
"Musou 3RCA Composite CVBS AV to HDMI Video Audio Converter Adapter Mini Box Support 1080P for TV/PC/PS3/Blue-Ray DVD,black",Speakers,http://www.amazon.com/dp/B01EHL1JXE/,3,1
Raspberry Pi 3 Essentials Kit - On-board WiFi and Bluetooth Connectivity – 2.5A Power Supply - 32 GB Samsung Evo+,PC Accessory,http://www.amazon.com/dp/B01LWVVMUI/,7,1
"NES case for Raspberry Pi 3,2 and B+ by Old Skool Tools",PC Accessory,http://www.amazon.com/dp/B01M4OOY4U/,47,1
Old Skool SNES Power Input Jack Replacement Port for Super Nintendo,Video Games,http://www.amazon.com/dp/B01N772REK/,1,1
Gam3Gear RGB Scart Cable for SNES GameCube N64 NTSC,Video Games,http://www.amazon.com/dp/B01N8RCWK9/,1,1
Game Over: How Nintendo Conquered The World,Book,http://www.amazon.com/dp/0679736220/,7,1
Buffalo iBuffalo Classic USB Gamepad for PC BSGP815GY,PC Accessory,http://www.amazon.com/dp/B06XWD8QQJ/,12,1
Super Famicom: The Box Art Collection,Book,http://www.amazon.com/dp/0993012965/,1,1
Ninja Gaiden Trilogy,Video Games,http://www.amazon.com/dp/B00002SW3O/,1,1
"Staedtler Mars Latex-Free Eraser, White, 1 Eraser (STD52650)",Office Product,http://www.amazon.com/dp/B0006IK4BG/,4,1
Gamecube S-Video Cable (Bulk Packaging),Video Games,http://www.amazon.com/dp/B000P6R46W/,3,1
Chrono Trigger,Video Games,http://www.amazon.com/dp/B001E27DLM/,21,1
SNES Controller to Adapter for PC USB,Video Games,http://www.amazon.com/dp/B002IXZ5DE/,27,1
Repair KIT for Original 16 Bit Super Nintendo Snes Controller,Video Games,http://www.amazon.com/dp/B003KV5GDW/,1,1
Portta AV/ CVBS Composite RCA + S-Video to HDMI Converter v1.3 up Scaler support 720p 1080p,Speakers,http://www.amazon.com/dp/B003NS0UUQ/,13,1
"SPECIALTY-AV SCART to Component Video Converter for Sega, Genesis, Atari",CE,http://www.amazon.com/dp/B004XSSDPO/,14,1
Atlantic 38435715 Oskar 1080 Media Wall Unit P2,Speakers,http://www.amazon.com/dp/B0058O8GWW/,4,1
