name,category,amazon_link,total_mentions,subreddit_mentions
"No More Mr Nice Guy: A Proven Plan for Getting What You Want in Love, Sex, and Life",Book,http://www.amazon.com/dp/0762415339/,59,3
The Charisma Myth: How Anyone Can Master the Art and Science of Personal Magnetism,Book,http://www.amazon.com/dp/1591845947/,8,3
How to Win Friends & Influence People,Book,http://www.amazon.com/dp/0671027034/,63,2
Do You Talk Funny?: 7 Comedy Habits to Become a Better (and Funnier) Public Speaker,eBooks,http://www.amazon.com/dp/B017MWHCVI/,,1
"Nice Girls Just Don't Get It: 99 Ways to Win the Respect You Deserve, the Success You've Earned, and the Life You Want",eBooks,http://www.amazon.com/dp/B004C43F2A/,,1
Nice Girls Don't Get the Corner Office: Unconscious Mistakes Women Make That Sabotage Their Careers (A NICE GIRLS Book),eBooks,http://www.amazon.com/dp/B00D19E04E/,,1
First Impressions: What You Don't Know About How Others See You,Books,https://www.amazon.com/dp/0553382012/,,1
The Gift of Fear: And Other Survival Signals That Protect Us from Violence,Book,http://www.amazon.com/dp/0440226198/,43,1
"When I Say No, I Feel Guilty",Book,http://www.amazon.com/dp/0553263900/,14,1
Mindset: The New Psychology of Success,Book,http://www.amazon.com/dp/0345472322/,12,1
Why Are All the Black Kids Sitting Together in the Cafeteria: And Other Conversations About Race,Book,http://www.amazon.com/dp/0465083617/,9,1
"How to Win Friends and Influence People (8.5"" x 11"")",Book,http://www.amazon.com/dp/1508569754/,6,1
Assholes: A Theory,Book,http://www.amazon.com/dp/0804171351/,4,1
Attached: The New Science of Adult Attachment and How It Can Help You Find—and Keep—Love,eBooks,http://www.amazon.com/dp/B0049H9AVU/,4,1
Good to Great: Why Some Companies Make the Leap and Others Don't,Book,http://www.amazon.com/dp/0066620996/,3,1
Why Men Don't Listen and Women Can't Read Maps: How We're Different and What to Do About It,Book,http://www.amazon.com/dp/0767907639/,3,1
"Shyness and Social Anxiety Workbook: Proven, Step-by-Step Techniques for Overcoming your Fear",Book,http://www.amazon.com/dp/1572245530/,3,1
The Assertiveness Workbook: How to Express Your Ideas and Stand Up for Yourself at Work and in Relationships,Book,http://www.amazon.com/dp/1572242094/,2,1
Black Power : The Politics of Liberation,Book,http://www.amazon.com/dp/0679743138/,2,1
What Every BODY is Saying: An Ex-FBI Agent’s Guide to Speed-Reading People,eBooks,http://www.amazon.com/dp/B0010SKSTO/,2,1
"The Social Skills Guidebook: Manage Shyness, Improve Your Conversations, and Make Friends, Without Giving Up Who You Are",eBooks,http://www.amazon.com/dp/B01AU8C766/,2,1
"It's the Way You Say It: Becoming Articulate, Well-spoken, and Clear",Book,http://www.amazon.com/dp/1609947436/,2,1
The Conversation Code: How to Upgrade Your Social Skills and Your Life,Book,http://www.amazon.com/dp/0989890406/,1,1
"Mead Composition Book, Notebook, 100 Sheets, College Ruled, 9.75 x 7.5 Inch (9932)",Office Products,https://www.amazon.com/Mead-Composition-Notebook-Sheets-College/dp/B000GP16R0/ref=lp_1069756_1_8?s=office-products&amp;ie=UTF8&amp;qid=1474208724&amp;sr=1-8,1,1
