name,category,amazon_link,total_mentions,subreddit_mentions
How to Win Friends & Influence People,Books,https://www.amazon.com/How-Win-Friends-Influence-People/dp/0671027034/ref=sr_1_1?s=books&amp;ie=UTF8&amp;qid=1469052759&amp;sr=1-1&amp;keywords=how+to+make+friends+and+influence+people,21,2
First Impressions: What You Don't Know About How Others See You,Books,https://www.amazon.com/dp/0553382012/,,1
No More Mr Nice Guy,Books,https://www.amazon.com/No-More-Mr-Nice-Guy/dp/0762415339/ref=sr_1_1?ie=UTF8&amp;qid=1487606629&amp;sr=8-1,18,1
Mindset: The New Psychology of Success,Books,https://www.amazon.com/Mindset-Psychology-Carol-S-Dweck/dp/0345472322/ref=sr_1_1?ie=UTF8&amp;qid=1491608833&amp;sr=8-1&amp;keywords=mindset,8,1
The Charisma Myth: How Anyone Can Master the Art and Science of Personal Magnetism,Books,https://www.amazon.com/dp/1591845947/ref=olp_product_details?_encoding=UTF8&amp;me=,5,1
The Gift of Fear: And Other Survival Signals That Protect Us from Violence,Books,https://www.amazon.com/Gift-Fear-Gavin-Becker/dp/0440226198,5,1
"When I Say No, I Feel Guilty",Books,https://www.amazon.com/When-Say-No-Feel-Guilty/dp/0553263900/ref=redir_mobile_desktop?_encoding=UTF8&amp%3BdpID=51ALRAs32GL&amp%3BdpPl=1&amp%3Bkeywords=when%20i%20say%20no&amp%3Bpi=AC_SX236_SY340_FMwebp_QL65&amp%3Bqid=1484614034&amp%3Bref=plSrch&amp%3Bsr=8-1&ref_=mp_s_a_1_1,4,1
"Shyness and Social Anxiety Workbook: Proven, Step-by-Step Techniques for Overcoming your Fear",Books,https://www.amazon.com/Shyness-Social-Anxiety-Workbook-Step-/dp/1572245530/ref=sr_1_1?ie=UTF8&amp;qid=1456460916&amp;sr=8-1&amp;keywords=social+anxiety+workbook,3,1
The Assertiveness Workbook: How to Express Your Ideas and Stand Up for Yourself at Work and in Relationships,Books,https://www.amazon.com/Assertiveness-Workbook-Express-Yourself-Relationships/dp/1572242094/ref=redir_mobile_desktop?_encoding=UTF8&amp%3BdpID=31xabeOZIzL&amp%3BdpPl=1&amp%3Bkeywords=the%20assertiveness%20workbook&amp%3Bpi=AC_SX236_SY340_FMwebp_QL65&amp%3Bqid=1484614222&amp%3Bref=plSrch&amp%3Bsr=8-1&ref_=mp_s_a_1_1,2,1
Why Men Don't Listen and Women Can't Read Maps: How We're Different and What to Do About It,Books,https://www.amazon.com/Dont-Listen-Women-Cant-Read/dp/0767907639,2,1
Assholes: A Theory,Books,https://www.amazon.com/Assholes-A-Theory-Aaron-James/dp/0804171351,2,1
"It's the Way You Say It: Becoming Articulate, Well-spoken, and Clear",Books,https://www.amazon.com/Its-Way-You-Say-Well-spoken/dp/1609947436/ref=sr_1_1?ie=UTF8&amp;qid=1490511568&amp;sr=8-1&amp;keywords=how+you+say+it,2,1
The Conversation Code: How to Upgrade Your Social Skills and Your Life,Books,https://www.amazon.com/Conversation-Code-Upgrade-Social-Skills/dp/0989890406,1,1
"Mead Composition Book, Notebook, 100 Sheets, College Ruled, 9.75 x 7.5 Inch (9932)",Office Products,https://www.amazon.com/Mead-Composition-Notebook-Sheets-College/dp/B000GP16R0/ref=lp_1069756_1_8?s=office-products&amp;ie=UTF8&amp;qid=1474208724&amp;sr=1-8,1,1
