name,category,amazon_link,total_mentions,subreddit_mentions
"ECG J-045-DS Electric Corded De-Soldering Iron, +420 Degree C Tip Temperature, 45W",BISS,http://www.amazon.com/dp/B00068IJSG/,21,1
Weller SP23LK 25-Watt Soldering Iron,Home Improvement,http://www.amazon.com/dp/B0009ZD2AG/,2,1
"Sleeve Assembly, Blue, Rubber",BISS,http://www.amazon.com/dp/B0015X6BPY/,1,1
"Hakko T15-JL02 - Hakko T15-JL02 Soldering Tip for FM2027 Iron, Bent 30°, 0.2 x 7.5mm, Replaces Old P/N T7-JL02",Home Improvement,http://www.amazon.com/dp/B0015XET94/,1,1
"Hakko T15-JS02 Conical Bent Tip R 0.2/30 Degree, 1.6 x 7.9 mm for FX-951",BISS Basic,http://www.amazon.com/dp/B0015XEUQQ/,1,1
"MG Chemicals No Clean Flux Paste, 10 ml Syringe",BISS,http://www.amazon.com/dp/B00425FUW2/,12,1
"Edsyn Deluxe Soldapullt, Heavy Duty, High Vacuum, ESD",Home Improvement,http://www.amazon.com/dp/B006GOKVKI/,8,1
"""ALL IN ONE"" X-TRONIC - MODEL #5040-XTS HOT AIR REWORK SOLDERING IRON STATION & PREHEATING STATION - 4 Hot Air Nozzles - 10 Asst. Solder Tips - Pinpoint Tweezers - IC Popper, Gootwick - FREE 5X Mag Lamp - ""THIS IS A USA EXCLUSIVE PRODUCT""!",Home Improvement,http://www.amazon.com/dp/B00DRHRZ3S/,3,1
Hakko 599B-02 Wire-type soldering iron tip cleaner,BISS Basic,http://www.amazon.com/dp/B00FZPGDLA/,29,1
Hakko T15-J02 T15 Series Bent Soldering Tip 30? .20mm x 12.00mm for FM-2027 Iron,Home Improvement,http://www.amazon.com/dp/B00IFH187Y/,1,1
"Hakko B2756 Tip Tray for FM2027-02 Iron, Holds T15 Tips by Hakko",BISS,http://www.amazon.com/dp/B0195URO9K/,1,1
