name,category,amazon_link,total_mentions,subreddit_mentions
Writing Better Lyrics,Book,http://www.amazon.com/dp/1582975779/,22,2
"The Beatles Best: Over 120 Great Beatles Hits (Piano, Vocal, Guitar)",Book,http://www.amazon.com/dp/0881885983/,1,1
"Shortcuts to Songwriting for Film & TV: 114 Tips for Writing, Recording, & Pitching in Today's Hottest Market",Book,http://www.amazon.com/dp/0982004028/,1,1
Tunesmith: Inside the Art of Songwriting,Book,http://www.amazon.com/dp/0786884886/,3,1
"The Go-Giver, Expanded Edition: A Little Story About a Powerful Business Idea",Book,http://www.amazon.com/dp/1591848288/,1,1
Shure SM57-LC Cardioid Dynamic Microphone,Musical Instruments,http://www.amazon.com/dp/B0000AQRST/,21,1
"Audio-Technica AT2035 Large Diaphragm Studio Condenser Microphone Bundle with Shock Mount, Pop Filter, and XLR Cable",Musical Instruments,http://www.amazon.com/dp/B00D6RMFG6/,15,1
