name,category,amazon_link,total_mentions,subreddit_mentions
"Tendak 4 x 1 HDMI Switch with Audio Out Optical SPDIF Coaxial & RCA L/R 4 Port HDMI Switcher Box Selector Audio Extractor Splitter with IR Remote Supports 4Kx2K, ARC, MHL, Full 3D for Apple TV 4Gen",Wireless,http://www.amazon.com/dp/B01HM1RP6G/,3,2
"Polk Audio RC80i 2-Way In-Ceiling/In-Wall Speakers (Pair, White)",Speakers,http://www.amazon.com/dp/B00006BMQT/,5,1
Yamaha NS-AW350W All-Weather Indoor/Outdoor 2-Way Speakers - White (Pair),Speakers,http://www.amazon.com/dp/B0001VHARY/,1,1
"TCC TC-750 BLACK Audiophile Phono Preamp, Pre-amp (Preamplifier)",Speakers,http://www.amazon.com/dp/B000A36LQ4/,15,1
"Wiremold CMK50 Cord Mate II Kit Wall Cord Cover, White",Home Improvement,http://www.amazon.com/dp/B0015EDVVU/,34,1
PAC SNI-35 Variable LOC Line Out Converter,Car Audio or Theater,http://www.amazon.com/dp/B001EAWS3W/,21,1
"TRENDnet 8-Port Unmanaged Gigabit GREENnet Desktop Metal Housing Switch, 16Gbps Switching Capacity, Plug & Play, TEG-S80G",CE,http://www.amazon.com/dp/B001QUA6RA/,11,1
Sonos CR200 Wireless control of your Sonos Multi-Room Music System (Discontinued by Manufacturer),Speakers,http://www.amazon.com/dp/B002GU5YBM/,1,1
"Logitech Z623 200 Watt Home Speaker System, 2.1 Speaker System",CE,http://www.amazon.com/dp/B003VAHYTG/,29,1
"IOGEAR Universal Ethernet to Wi-Fi N Adapter for Home or Office, GWU627",CE,http://www.amazon.com/dp/B004UAKCS6/,17,1
Cavus Full motion Wall Mount - Wall bracket for Sonos Play 3 - White - SN3TW,Speakers,http://www.amazon.com/dp/B00652RRL2/,1,1
Sony STRDH130 2 Channel Stereo Receiver (Black),Speakers,http://www.amazon.com/dp/B006U1VH2S/,25,1
Adam Hall PAD ECO Series SPADECO1 Monitor Isolation Pad,Musical Instruments,http://www.amazon.com/dp/B007YFWTXU/,6,1
"Auralex Acoustics ProPAD Studio Monitor Acoustic Isolation Pads, 1 Set",Musical Instruments,http://www.amazon.com/dp/B008EH7CW0/,1,1
Pioneer SW-8MK2 Andrew Jones Designed 100-Watt Powered Subwoofer,Speakers,http://www.amazon.com/dp/B008NCD2PC/,13,1
FiiO D3 (D03K) Digital to Analog Audio Converter - 192kHz/24bit Optical and Coaxial DAC,CE,http://www.amazon.com/dp/B009346RSS/,49,1
Octava 4 x 1 HDMI Audio switch with ARC and Optical Audio output,Speakers,http://www.amazon.com/dp/B009B2NCOE/,1,1
"Micca MB42 Bookshelf Speakers With 4-Inch Carbon Fiber Woofer and Silk Dome Tweeter (Black, Pair)",Speakers,http://www.amazon.com/dp/B009IUIV4A/,94,1
Pass & Seymour TV1LVKITWCC2 Recessed Television Receptacle Box One Gang Low Voltage Kit Easy Install,Home Improvement,http://www.amazon.com/dp/B009VYDHCY/,1,1
Fiio D3 (D03 K) Digital to Analog Audio Coverter with Extreme Audio Optical TOSlink Cable and RCA to RCA Audio Cable (192kHz/24bit Optical and Coaxial DAC),Speakers,http://www.amazon.com/dp/B00BVT4M30/,6,1
"Pioneer 3"" Speaker Foam Surround Repair Kit - 3 Inch",Speakers,http://www.amazon.com/dp/B00CTUK34W/,1,1
"Flexible Polyethylene Wire Loom, 1.5 Inch Diameter, 10 Feet, White",CE,http://www.amazon.com/dp/B00DP41JS0/,1,1
"Auralex AmpDude 3 Inches High, 15 Inches by 15 Inches Amplifier Acoustic Isolation Platform, Charcoal",Musical Instruments,http://www.amazon.com/dp/B00DVZ6Y74/,1,1
8mm Black Flat Nail Cable Clip - 100 Pack,CE,http://www.amazon.com/dp/B00FRKK7PG/,1,1
ViewHD SPDIF | TOSLINK Digital Optical Audio Switcher 3x1 with Remote | Three Inputs to One Output | Model: VHD-TS3X1,Speakers,http://www.amazon.com/dp/B00G188Z7A/,10,1
Surround Sound Swivel Wall Mount Suitable for Sonos Play:1 White,Speakers,http://www.amazon.com/dp/B00I9Z9U4A/,1,1
"Etekcity 4 Port HDMI Switcher Selector with Audio, IR wireless remote, AC power Adapter, Supports 3D 1080P, Toslink, Coaxial, 3.5mm AUX Stereo",Speakers,http://www.amazon.com/dp/B00IAM74UO/,3,1
"LUTRON P-PKG1W-WH  Caseta Wireless 600-watt/150-watt Multi-Location In-Wall Dimmer with Pico Remote Control Kit, White, Works with Amazon Alexa",Home Improvement,http://www.amazon.com/dp/B00JJY0S4G/,28,1
ViewHD HDMI Audio Extractor | Optical Toslink + L/R Stereo Analog Converter Outputs | Model: VHD-H2HSAs,CE,http://www.amazon.com/dp/B00KBHX072/,71,1
Panlong 4-Way AV Switch RCA Switcher 4 In 1 Out Composite Video L/R Audio Selector Box for DVD STB Game Consoles,CE,http://www.amazon.com/dp/B00KXVBB3Q/,9,1
"In Wall Recessed Full Motion TV Mount with Zero Clearance for 32 to 55 Inch TVs LCD, LED, or Plasma - Extends 19 Inches",CE,http://www.amazon.com/dp/B00LPLS0RI/,2,1
Flexson Wall Bracket for PLAY:1 SONOS Speakers - WHITE - PAIR,Speakers,http://www.amazon.com/dp/B00MJZWDZO/,1,1
NETGEAR GS108 8-Port Gigabit Ethernet Network Switch | Lifetime Next Business Day Replacement | Sturdy Metal | Desktop | Plug-and-Play | Unmanaged,Personal Computer,http://www.amazon.com/dp/B00MPVR50A/,22,1
"J-Tech Digital HDMI 1.4 Switch Switcher Box Selector 3 In 1 Out Audio Extractor w/ Optical SPDIF & RCA L/R Audio Out & IR Control Supports ARC, MHL, 4K, Full 3D, 4kx2k, 1080P (Support Apple TV 4Gen)",CE,http://www.amazon.com/dp/B00QJGAKCW/,6,1
"Satechi Bluetooth Button Series (Media Button) for iPhone 7 Plus/7/6 Plus/6/5S/5C, iPad Pro/Air 2/Air/Mini/3/2/1, Samsung Galaxy S8/S7/S6,Note 4/Edge/Pro/Tab Pro, Google Nexus 9 and more",Wireless,http://www.amazon.com/dp/B00RM75NL0/,11,1
VIZIO SB3821-C6 38-Inch 2.1 Channel Sound Bar with Wireless Subwoofer,Home Theater,http://www.amazon.com/dp/B00SMBG8QY/,6,1
"Fire Tablet with Alexa, 7"" Display, 8 GB, Black - with Special Offers (Previous Generation - 5th)",Amazon Tablets,http://www.amazon.com/dp/B00TSUGXKE/,84,1
ViewHD Prosumer HDMI 3x1 Ultra HD / 4K | Auto Switch | ARC | Audio Extraction | Model: VHD-PRO3X1i | The Ultimate HDMI Switch,Speakers,http://www.amazon.com/dp/B00U8WBOOG/,1,1
Acoustic Audio WS1005 Low Frequency Passive Subwoofer Amplifier,Speakers,http://www.amazon.com/dp/B00VF5TY7E/,4,1
"eero Home WiFi System (Pack of 3) - 1st generation, 2016",Personal Computer,http://www.amazon.com/dp/B00XEW3YD6/,8,1
"LUTRON L-BDG2-WH Caseta Wireless Smart Bridge, HomeKit-enabled, works with Alexa, White",Home Improvement,http://www.amazon.com/dp/B00XPW67ZM/,4,1
"Flic: The Wireless Smart Button, White",Boost,http://www.amazon.com/dp/B00ZAEOC5K/,3,1
J-Tech Digital ® 5 Port HDMI/MHL Switch & Audio Extractor SPDIF/3.5mm Jack Stereo Outputs with Ultra HD 4K ARC EDID Setting(5x1 Ultra HD),CE,http://www.amazon.com/dp/B01296E5OO/,2,1
Ubiquiti UAP-AC-LR Networks Enterprise Wi-Fi System,Personal Computer,http://www.amazon.com/dp/B015PRCBBI/,24,1
MEE audio Connect Universal Dual Headphone or Dual Speaker Bluetooth Wireless Audio Transmitter for TV,Speakers,http://www.amazon.com/dp/B016NIOOH2/,5,1
"FLEXSON FLXP1X3M1021US 3M Right-Angled Extension Cable for Sonos Play:1, Black",Speakers,http://www.amazon.com/dp/B016RTX9Q4/,1,1
"Tendak 4K x 2K HDMI to HDMI and Optical TOSLINK SPDIF + 3.5mm Stereo Audio Extractor Converter HDMI Audio Splitter Adapter(HDMI Input, HDMI + Digital / Analog Audio Output)",Speakers,http://www.amazon.com/dp/B017B6WFP8/,21,1
"4 x 2 HDMI Matrix Switch [Ultra HD 4K x 2K], FosPower 4 In 2 Out Switcher / Splitter with Optical & L/R Audio Output - Support 3D 1080p | ARC - Includes IR Remote Control & Power Adapter",CE,http://www.amazon.com/dp/B017RW073I/,2,1
SMSL Q5 Pro Digital Amplifier 2 - 50W USB/Coaxial/Optical with Remote Control - Black,Speakers,http://www.amazon.com/dp/B017W12UCU/,28,1
"Monoprice 114537 Swivel Speaker Mount for Sonos PLAY:1, White ",Speakers,http://www.amazon.com/dp/B01953W3LG/,1,1
Monoprice Blackbird 4K Pro 3x1 HDMI Switch with HDCP 2.2 Support (1),CE,http://www.amazon.com/dp/B01BOB6T4E/,2,1
"EAKAI Digital Optical Coax to Analog RCA Audio Converter with 3.5 mm Jack, 24-bit DAC with DC 5V Power Supply Adapter [USA UL Licensed]",CE,http://www.amazon.com/dp/B01H4XC3DC/,2,1
"3x1 V1.4 HDMI Switch with TOSLINK Optical SPDIF & RCA L/R Audio Out, 3 Port HDMI Audio Extractor Splitter with Remote, Supports ARC, 4kx2k, Full 3D, 1080P",Speakers,http://www.amazon.com/dp/B01K7BZ1XC/,2,1
"Lutron PJ2-3BRL-GWH-A02 Pico Remote Control for Audio, Sonos Endorsed Integration, White",Home Improvement,http://www.amazon.com/dp/B01LC7O9MY/,2,1
"ROOFULL HDMI Optical / 3.5mm Audio Extractor Converter, HDMI to HDMI + Digital Optical Toslink (SPDIF) and 3.5mm Audio Out Splitter Adapter Converter, Support 4Kx2K @30Hz / 1080P / 3D, Black",Speakers,http://www.amazon.com/dp/B01LL5RI3Y/,3,1
"Analog to Digital Audio Converter, MACTIS SPDIF+ L/R RCA Interface Analog to Digital Coaxial and Optical S/PDIF Toslink Audio Converter Adapter (Analog to Digital Converter)",Home Improvement,http://www.amazon.com/dp/B01LZ2SIMB/,1,1
Google Wifi system (set of 3) - Router replacement for whole home coverage,Personal Computer,http://www.amazon.com/dp/B01MAW2294/,8,1
TCL 55P607 55-Inch 4K Ultra HD Roku Smart LED TV (2017 Model),Home Theater,http://www.amazon.com/dp/B06Y6FSV5Q/,13,1
"Wiremold C110 Cordmate Cord Organizer Kit- Cable Concealer On Wall Cord Cover Raceway, White",Home Improvement,http://www.amazon.com/dp/B00004W3ZP/,19,1
Introducing Echo Spot - Black,Amazon Home,http://www.amazon.com/dp/B073SQYXTW/,2,1
