name,category,amazon_link,total_mentions,subreddit_mentions
"Sumnacon Clear Crystal Ball Sphere 80mm / 3 inch , Solar System Crystal Ball with Wood Stand, Planet Balls for Astronomer, Lover of Space, Kids and Student",Toy,http://www.amazon.com/dp/B01IEPE7NI/,7,5
The Science of Interstellar,Book,http://www.amazon.com/dp/0393351378/,15,3
Failure Is Not an Option: Mission Control From Mercury to Apollo 13 and Beyond,Book,http://www.amazon.com/dp/1439148813/,5,3
An Introduction to Modern Astrophysics (2nd Edition),Book,http://www.amazon.com/dp/0805304029/,4,3
Celestron SkyMaster Giant 15x70 Binoculars with Tripod Adapter,Photography,http://www.amazon.com/dp/B00008Y0VN/,3,3
A Short History of Nearly Everything,Book,http://www.amazon.com/dp/076790818X/,18,2
A Universe from Nothing: Why There Is Something Rather than Nothing,Book,http://www.amazon.com/dp/1451624468/,14,2
A Brief History of Time,Book,http://www.amazon.com/dp/0553380168/,9,2
Ignition!: An informal history of liquid rocket propellants,Book,http://www.amazon.com/dp/0813507251/,7,2
Packing for Mars: The Curious Science of Life in the Void,Book,http://www.amazon.com/dp/1469235919/,7,2
"An Astronaut's Guide to Life on Earth: What Going to Space Taught Me About Ingenuity, Determination, and Being Prepared for Anything",Book,http://www.amazon.com/dp/0316253030/,6,2
Gravitation,Book,http://www.amazon.com/dp/0716703440/,4,2
This New Ocean: The Story of the First Space Age (Modern Library Paperbacks),Book,http://www.amazon.com/dp/0375754857/,4,2
Pale Blue Dot: A Vision of the Human Future in Space,Book,http://www.amazon.com/dp/0345376595/,4,2
"50mm Circular Welding Lens, Green IR Shade 14",Home Improvement,http://www.amazon.com/dp/B006Y9USNK/,3,2
"The Fabric of the Cosmos: Space, Time, and the Texture of Reality",Book,http://www.amazon.com/dp/0375727205/,3,2
Death by Black Hole: And Other Cosmic Quandaries,Book,http://www.amazon.com/dp/039335038X/,3,2
The Martian: A Novel,Book,http://www.amazon.com/dp/0804139024/,3,2
The Last Man On the Moon,Book,http://www.amazon.com/dp/1501264559/,3,2
Foundations of Astrophysics,Book,http://www.amazon.com/dp/0321595580/,3,2
Rocket Men: The Epic Story of the First Men on the Moon,Book,http://www.amazon.com/dp/0143117165/,3,2
A Man on the Moon: The Voyages of the Apollo Astronauts,Book,http://www.amazon.com/dp/014311235X/,3,2
Space Shuttle: The History of Developing the National Space Transportation System,Book,http://www.amazon.com/dp/0963397443/,3,2
Spacesuits: The Smithsonian National Air and Space Museum Collection,Book,http://www.amazon.com/dp/1576874982/,2,2
Hobart 770096 Welding Oxy-Acetylene Goggle - 50mm Eye Cup,Home Improvement,http://www.amazon.com/dp/B0017Z04SK/,2,2
The Right Stuff,Book,http://www.amazon.com/dp/0312427565/,2,2
"Rockets, missiles, and men in space",Book,http://www.amazon.com/dp/B0006BQYUS/,2,2
Rain Of Iron And Ice: The Very Real Threat Of Comet And Asteroid Bombardment (Helix Books),Book,http://www.amazon.com/dp/0201154943/,2,2
"Mining the Sky: Untold Riches From The Asteroids, Comets, And Planets (Helix Book)",Book,http://www.amazon.com/dp/0201328194/,2,2
Russia in Space,Book,http://www.amazon.com/dp/1926837258/,2,2
Entering Space: An Astronaut's Odyssey,Book,http://www.amazon.com/dp/0941434745/,2,2
How to Read the Solar System: A Guide to the Stars and Planets,Book,http://www.amazon.com/dp/1605986712/,2,2
You Are Here: Around the World in 92 Minutes: Photographs from the International Space Station,Book,http://www.amazon.com/dp/0316379646/,2,2
Cosmos,Book,http://www.amazon.com/dp/0345331354/,2,2
International Reference Guide to Space Launch Systems (Library of Flight),Book,http://www.amazon.com/dp/156347591X/,2,2
No Downlink: A Dramatic Narrative About the Challenger Accident and Our Time,Book,http://www.amazon.com/dp/0374120366/,2,2
"The Overview Effect: Space Exploration and Human Evolution, Second Edition (Library of Flight)",Book,http://www.amazon.com/dp/1563472600/,2,2
Moon Lander: How We Developed the Apollo Lunar Module,Book,http://www.amazon.com/dp/156098998X/,2,2
Origins: Fourteen Billion Years of Cosmic Evolution,Book,http://www.amazon.com/dp/0393327582/,2,2
Into the Black: The Extraordinary Untold Story of the First Flight of the Space Shuttle Columbia and the Astronauts Who Flew Her,Book,http://www.amazon.com/dp/1501123629/,2,2
Breaking the Chains of Gravity: The Story of Spaceflight before NASA,Book,http://www.amazon.com/dp/1472911172/,2,2
"Wings in Orbit: Scientific and Engineering Legacies of the Space Shuttle, 1971-2010",Book,http://www.amazon.com/dp/1470031345/,2,2
Apollo 13,Book,http://www.amazon.com/dp/0618619585/,2,2
Voices from the Moon: Apollo Astronauts Describe Their Lunar Experiences,Book,http://www.amazon.com/dp/0670020788/,2,2
The Whole Shebang: A State-of-the-Universe(s) Report,Book,http://www.amazon.com/dp/0684838613/,2,2
Asteroid Mining 101: Wealth for the New Space Economy,eBooks,http://www.amazon.com/dp/B00T3OQSK0/,2,2
How the Universe Got Its Spots: Diary of a Finite Time in a Finite Space,Book,http://www.amazon.com/dp/1400032725/,2,2
Final Countdown: NASA and the End of the Space Shuttle Program,Book,http://www.amazon.com/dp/0813033845/,2,2
The Scientific Exploration of Venus,Book,http://www.amazon.com/dp/1107023483/,2,2
Coming of Age in the Milky Way,Book,http://www.amazon.com/dp/0060535954/,2,2
Collapse: How Societies Choose to Fail or Succeed: Revised Edition,eBooks,http://www.amazon.com/dp/B004H0M8EA/,,1
The Druid Gene: A Novel in the Confluence Universe,eBooks,http://www.amazon.com/dp/B01M02D49F/,,1
Hubble,Movie,http://www.amazon.com/dp/B004U8VQEC/,,1
Giants,TV Series Episode Video on Demand,http://www.amazon.com/dp/B004BNASJA/,,1
The Perfect Machine: Building the Palomar Telescope,eBooks,http://www.amazon.com/dp/B004XVN10S/,,1
Uncanny Magazine Issue 2: January/February 2015,eBooks,http://www.amazon.com/dp/B00RQPF1YC/,,1
"Elon Musk: Tesla, SpaceX, and the Quest for a Fantastic Future",Book,http://www.amazon.com/dp/0062301233/,21,1
Nikon COOLPIX P900 Digital Camera with 83x Optical Zoom and Built-In Wi-Fi(Black),Photography,http://www.amazon.com/dp/B00U2W4JEY/,12,1
The Case for Mars: The Plan to Settle the Red Planet and Why We Must,Book,http://www.amazon.com/dp/145160811X/,10,1
One Second After (A John Matherson Novel),Book,http://www.amazon.com/dp/0765356864/,9,1
"Machinery's Handbook, 29th",Book,http://www.amazon.com/dp/083112900X/,7,1
The Three-Body Problem (Remembrance of Earth's Past),Book,http://www.amazon.com/dp/0765377063/,7,1
Thing Explainer: Complicated Stuff in Simple Words,Book,http://www.amazon.com/dp/0544668251/,7,1
The Martian: A Novel,eBooks,http://www.amazon.com/dp/B00EMXBDMA/,6,1
The Three-Body Problem,Book,http://www.amazon.com/dp/0765382032/,6,1
How to Catch a Russian Spy: The True Story of an American Civilian Turned Double Agent,Book,http://www.amazon.com/dp/1476788820/,5,1
Turn Left at Orion: Hundreds of Night Sky Objects to See in a Home Telescope - and How to Find Them,Book,http://www.amazon.com/dp/0521153972/,5,1
I Could Tell You But Then You Would Have to Be Destroyed By Me: Emblems from the Pentagon's Black World,Book,http://www.amazon.com/dp/193555414X/,4,1
Leviathan Wakes,Book,http://www.amazon.com/dp/0316129089/,4,1
The Apollo Guidance Computer: Architecture and Operation (Springer Praxis Books),Book,http://www.amazon.com/dp/1441908765/,3,1
Carrying the Fire: An Astronaut's Journeys,Book,http://www.amazon.com/dp/0374531943/,3,1
Man and Woman He Created Them: A Theology of the Body,Book,http://www.amazon.com/dp/0819874213/,3,1
A Sea without Fish: Life in the Ordovician Sea of the Cincinnati Region (Life of the Past),Book,http://www.amazon.com/dp/0253351987/,3,1
"AAXA P300 Pico/Micro LED Projector with 60 Minute Battery Life, WXGA 1280x800 Resolution, 400 Lumens, HDMI, Mini-VGA, 20,000 Hour LED Life, Media Player",CE,http://www.amazon.com/dp/B005Q2EGG6/,3,1
"How to Read Literature Like a Professor: A Lively and Entertaining Guide to Reading Between the Lines, Revised Edition",Book,http://www.amazon.com/dp/0062301675/,3,1
Official Google Cardboard,Wireless,http://www.amazon.com/dp/B01L92Z8D6/,3,1
From the Earth to the Moon (Four Disc Collector's Edition),DVD,http://www.amazon.com/dp/0783114222/,3,1
Telrad Finder Sight,Photography,http://www.amazon.com/dp/B0000ALKAN/,3,1
Eclipse Glasses - CE and ISO Certified Safe Solar Eclipse Shades - Viewer and filters (5 Pack) - Made in USA,Photography,http://www.amazon.com/dp/B00712I3JA/,3,1
Meade Instruments 216006 Polaris 130 EQ Reflector Telescope (Blue),Photography,http://www.amazon.com/dp/B00LU1DY8S/,3,1
"Soluna Solar Eclipse Glasses - CE and ISO Certified Safe Shades for Direct Sun Viewing, (10 Pack)",Home Improvement,http://www.amazon.com/dp/B01N9T9CZL/,2,1
Entering Space: Creating a Spacefaring Civilization,Book,http://www.amazon.com/dp/1585420360/,2,1
"6""x6"" Solar Filter Sheet for Telescopes, Binoculars and Cameras",Photography,http://www.amazon.com/dp/B00DS7RO7Y/,2,1
California Costumes Men's Adult Gorilla Costume,Apparel,http://www.amazon.com/dp/B00272LJHC/,2,1
"Sky-Watcher 8"" Collapsible Dobsonian Telescope",Photography,http://www.amazon.com/dp/B004Q78OII/,2,1
Incredible Everything (Cross Sections),Book,http://www.amazon.com/dp/0751356166/,2,1
Life as We Knew It,Book,http://www.amazon.com/dp/0152061541/,2,1
Rationality: From AI to Zombies,eBooks,http://www.amazon.com/dp/B00ULP6EW2/,2,1
"Underground Toys Star Wars Talking R2-D2 4"" Plush",Toy,http://www.amazon.com/dp/B003FBVNWK/,2,1
Dragon's Egg (Del Rey Impact),Book,http://www.amazon.com/dp/034543529X/,2,1
SR-71 Revealed: The Inside Story,Book,http://www.amazon.com/dp/0760301220/,2,1
Abyss Deep: Star Corpsman: Book Two (Star Corpsman Series),Book,http://www.amazon.com/dp/006189477X/,2,1
"Orbital Mechanics for Engineering Students, Third Edition (Aerospace Engineering)",Book,http://www.amazon.com/dp/0080977472/,2,1
Orion 8945 SkyQuest XT8 Classic Dobsonian Telescope,Photography,http://www.amazon.com/dp/B001DDW9V6/,2,1
iOptron 3302B SkyTracker Camera Mount - Black,Photography,http://www.amazon.com/dp/B00EFRN1GE/,2,1
The Singularity Is Near: When Humans Transcend Biology,eBooks,http://www.amazon.com/dp/B000QCSA7C/,2,1
Opticron Tripod Mount for Binoculars with 50mm+ Objective Lens,Photography,http://www.amazon.com/dp/B005F51HE8/,2,1
Hobart 770095 Welding Oxy-Acetylene Goggle - Flip Front 2-Inch x 4 1/4-Inch,Home Improvement,http://www.amazon.com/dp/B0017Z5IZE/,1,1
Green Welding Lens Shade 14 Standard Size Small 2 x 4.25,Home Improvement,http://www.amazon.com/dp/B00SLMHF5W/,1,1
"Plastic Eclipse Glasses - Eclipse Shades - With 2 Bonus Pair of our Paper Eclipse Glasses! As we always say ""Make a Friend!"" CE and ISO Certified - Made in USA",BISS,http://www.amazon.com/dp/B00V75S784/,1,1
CA-25 - Hand-Held Black Polymer Film Solar Filter Cards (One pack of 25 EA),Photography,http://www.amazon.com/dp/B01771MF7K/,1,1
Eclipse Glasses for the 2017 Sea to Shining Sea Eclipse (5 Pack) - CE & ISO Certified - Includes Commemorative Poster - Made in USA,Home Improvement,http://www.amazon.com/dp/B01B3PRCUG/,1,1
Creative Haven GeoScapes Coloring Book (Creative Haven Coloring Books) (Adult Coloring),Book,http://www.amazon.com/dp/0486493148/,1,1
By Hop David Conic Sections & Celestial Mechanics Coloring Book (1st First Edition) [Workbook],Book,http://www.amazon.com/dp/B00SB2BJAY/,1,1
Infinite Worlds: The People and Places of Space Exploration,Book,http://www.amazon.com/dp/1476738327/,1,1
Celestron 93428 X-Cel LX 1.25-Inch 3x Barlow Lens (Black),Electronics,https://www.amazon.com/Celestron-X-Cel-Barlow-Lens-1-25/dp/B006YTQ7B2,1,1
Human Spaceflight: Mission Analysis and Design (Space Technology Series),Book,http://www.amazon.com/dp/007236811X/,1,1
Korolev: How One Man Masterminded the Soviet Drive to Beat America to the Moon,Book,http://www.amazon.com/dp/0471327212/,1,1
George and the Blue Moon,Book,http://www.amazon.com/dp/0857533274/,1,1
Magnificent Desolation: The Long Journey Home from the Moon,Book,http://www.amazon.com/dp/030746346X/,1,1
"Space Shuttle Operator's Manual, Revised Edition",Book,http://www.amazon.com/dp/0345341813/,1,1
High Frontier: Human Colonies in Space,Book,http://www.amazon.com/dp/0962237906/,1,1
The Cosmic Cocktail: Three Parts Dark Matter (Science Essentials),Book,http://www.amazon.com/dp/0691169187/,1,1
Einstein Relatively Simple: Our Universe Revealed,Book,http://www.amazon.com/dp/9814525596/,1,1
"Genuine ""No-mes"" Nail Clipper with Catcher, Catches Clippings, Made in USA",Baby Product,http://www.amazon.com/dp/B00GYES4R2/,1,1
Eclipse Glasses for the Great American Eclipse 2017 (5 Pack) - CE & ISO Certified - Includes Commemorative Poster - Made in USA,Tools & Home Improvement,https://www.amazon.com/dp/B016APN2QM,1,1
"Hubble Ultra Deep Field - 24""x36"" Poster",Home,http://www.amazon.com/dp/B004VW2WVI/,1,1
Meade ETX90EC Telescope w/Electronic Controller,Photography,http://www.amazon.com/dp/B00000K3RI/,1,1
MIOPS Smart Professional High-Speed Camera Trigger with Smartphone Compatibility and N1 Cable for Nikon (MC-30),Photography,http://www.amazon.com/dp/B0143ENSPC/,1,1
What If the Moon Didn't Exist?: Voyages to Earths That Might Have Been,Book,http://www.amazon.com/dp/0060168641/,1,1
Continents and Supercontinents,Book,http://www.amazon.com/dp/0195165896/,1,1
Hasselblad H5D-60 Medium Format Digital SLR Camera Body,Photography,http://www.amazon.com/dp/B00CX7JRP2/,1,1
Space Chronicles: Facing the Ultimate Frontier,Book,http://www.amazon.com/dp/0393082105/,1,1
Lexar Professional 1000x 32GB SDHC UHS-II/U3 Card (Up to 150MB/s read) w/Image Rescue 5 Software LSD32GCRBNA1000,Personal Computer,http://www.amazon.com/dp/B00PLENZF2/,1,1
"An Introduction to the Mathematics and Methods of Astrodynamics, Revised Edition (AIAA Education)",Book,http://www.amazon.com/dp/1563473429/,1,1
AO Eyewear Original Pilot 55mm Gold Frame with Bayonet Temples and True Color Grey Glass Lenses (OP55G.BA.TC),Sports,http://www.amazon.com/dp/B000N5Z37C/,1,1
Space Shuttle: The First 20 Years -- The Astronauts' Experiences in Their Own Words,Book,http://www.amazon.com/dp/0789484250/,1,1
"Opteka High Definition 2X Telephoto Converter for Opteka 650-1300mm, 500mm and 800mm SLR Lenses",Photography,http://www.amazon.com/dp/B000JSZ41S/,1,1
"Fisher Space Pen, Zero Gravity Space Pen with U.S. Flag Imprint, Black Rubber Finish (ZG)",Office Product,http://www.amazon.com/dp/B0006IYM14/,1,1
Celestron 93436 Luminous 2-Inch 2.5x Barlow Lens (Silver),Photography,http://www.amazon.com/dp/B00A2YFT00/,1,1
China’s Strategy in Space (SpringerBriefs in Space Development),Book,http://www.amazon.com/dp/146146689X/,1,1
Vixen Optics 35505 Polarie Star Tracker (White),Photography,http://www.amazon.com/dp/B006ZSRHKC/,1,1
Celestron 71008 SkyMaster 25x70 Binoculars (Black),Photography,http://www.amazon.com/dp/B003AM87Q4/,1,1
"Space Mission Engineering: The New SMAD (Space Technology Library, Vol. 28)",Book,http://www.amazon.com/dp/1881883159/,1,1
Homesteading Space: The Skylab Story (Outward Odyssey: A People's History of Spaceflight),Book,http://www.amazon.com/dp/0803236395/,1,1
HEAT WAVE Instant Reusable Hand Warmers - 1 pair - Premium Quality - Medical Grade - MADE IN USA! (not China),Beauty,http://www.amazon.com/dp/B000E48LVM/,1,1
Rocketman: Astronaut Pete Conrad's Incredible Ride to the Moon and Beyond,Book,http://www.amazon.com/dp/0451215095/,1,1
Carson Universal Smart Phone Optics Digiscoping Adapter For Binoculars Spotting Scopes Monoculars Telescopes Microscopes and More (IS-100),Sports,http://www.amazon.com/dp/B00M1OPULW/,1,1
Moonwalker : The True Story of an Astronaut Who Found that the Moon Wasn't High Enough to Satisfy His Desire for Success,Book,http://www.amazon.com/dp/0840791062/,1,1
Space Toy Set - America's Space Program Collector's Series - 5-Piece Replica Spaceship Rocket Toy,Toy,http://www.amazon.com/dp/B007J4GGJY/,1,1
"SR-71 Blackbird: Stories, Tales, and Legends",Book,http://www.amazon.com/dp/0760311420/,1,1
"The 4 Percent Universe: Dark Matter, Dark Energy, and the Race to Discover the Rest of Reality",Book,http://www.amazon.com/dp/0547577575/,1,1
"The Day We Lost the H-Bomb: Cold War, Hot Nukes, and the Worst Nuclear Weapons Disaster in History",Book,http://www.amazon.com/dp/B008SLKERW/,1,1
How I Killed Pluto and Why It Had It Coming,Book,http://www.amazon.com/dp/0385531109/,1,1
Kids NASA Full Blue Logo Graphic T-Shirt 10 Black,Apparel,http://www.amazon.com/dp/B072JX2CR9/,1,1
Space Stations Poster 24 x 36in,Home,http://www.amazon.com/dp/B0013A4J5I/,1,1
Moon Machines,DVD,http://www.amazon.com/dp/B0026IQTR2/,1,1
Estes 2452 Athena Flying Model Rocket Kit,Hobby,http://www.amazon.com/dp/B002TWBY16/,1,1
STS-71 Shuttle Atlantis & Mir Space Station 8x10 Silver Halide Photo Print,Home,http://www.amazon.com/dp/B004G37Y1U/,1,1
"International Space Rockets, 24x36 Poster Print",Home,http://www.amazon.com/dp/B004GMAECC/,1,1
Estes 810 220 Swift Flying Model Rocket Kit,Hobby,http://www.amazon.com/dp/B0006MZMCS/,1,1
Slime Bicycle Tube Sealant,Sports,http://www.amazon.com/dp/B004U59WYG/,1,1
Wallmonkeys Illustration of an Orbiter Cutaway View of a Space Shuttle Peel and Stick Wall Decals WM314373 (48 in W x 22 in H),Home,http://www.amazon.com/dp/B00639F0IE/,1,1
Estes Sizzler Model Rocket Kit,Hobby,http://www.amazon.com/dp/B00A4UXEK4/,1,1
Laminated International Space Station Planet Earth 2 2011 Photo Poster 19 x 13in,Home,http://www.amazon.com/dp/B00ALGAAJY/,1,1
Dragonfly: NASA And The Crisis Aboard Mir,Book,http://www.amazon.com/dp/0887307833/,1,1
King Will METEOR 8mm 14K Gold Plated Domed Tungsten Carbide Ring Imitated Meteorite Wedding Band(10.5),Jewelry,http://www.amazon.com/dp/B00HTZSK8S/,1,1
"Aquarius Smithsonian Milestones of Flight Poster, 24 by 36-Inch",Home,http://www.amazon.com/dp/B00JB7QUTS/,1,1
Estes 1921 Mercury Redstone Model kit,Hobby,http://www.amazon.com/dp/B00TKBLRFM/,1,1
Fifth Sun NASA Logo Adult T-shirt - Black,Apparel,http://www.amazon.com/dp/B0178DM7PC/,1,1
XTOTO Men's Spacex Falcon 9 Logo Cool T-shirts black S,Apparel,http://www.amazon.com/dp/B01FFI5C2M/,1,1
"CafePress - NASA Saturn V Cutaway - 23""x35"" Poster on Heavy Semi-gloss Paper",Home,http://www.amazon.com/dp/B01HW5COLI/,1,1
Samsung 960 PRO Series - 2TB PCIe NVMe - M.2 Internal SSD (MZ-V6P2T0BW),Personal Computer,http://www.amazon.com/dp/B01LY3Y9PH/,1,1
LEGO Ideas NASA Apollo Saturn V 21309 Building Kit,Toy,http://www.amazon.com/dp/B01MUANC80/,1,1
"Skylab: Cutaway illustration, 1972 by NASA - 13"" x 16"" Giclee Canvas Art Print",Home,http://www.amazon.com/dp/B06XQ4SQZL/,1,1
Rocket Launch SpaceX Poster Framed Photo Picture Print Home Room Decor Cool Historical Wall Art - Space Exploration for Nursery Kids Children Collectors (13x19 Unframed Poster),Home,http://www.amazon.com/dp/B06XYLGH5G/,1,1
20x30 Poster; North American X-15 Cutaway Drawing,Single Detail Page Misc,http://www.amazon.com/dp/B06Y38QDXK/,1,1
Celestron 71020 SkyMaster 25-125x80 Zoom Binoculars,Photography,http://www.amazon.com/dp/B0014HODWE/,1,1
LEGO City Space Port 60078 Utility Shuttle Building Kit,Toy,http://www.amazon.com/dp/B00WI0GVJO/,1,1
"LEGO, City, Space Utility Vehicle (30315)",Toy,http://www.amazon.com/dp/B010HDJS0M/,1,1
Set of 4 Metal Earth 3D Laser Cut Models: Hubble Telescope - Apollo Lunar Rover - Apollo Lunar Module - Mars Rover,Toy,http://www.amazon.com/dp/B014NBO5SO/,1,1
The Last Man on the Moon: Astronaut Eugene Cernan and America's Race in Space,Book,http://www.amazon.com/dp/0312263511/,1,1
"20 ft dia. Professional Weather Balloon, 600g",Toy,http://www.amazon.com/dp/B004RK2RAU/,1,1
Celestron 127EQ PowerSeeker Telescope,Photography,http://www.amazon.com/dp/B0007UQNKY/,1,1
We Seven: By the Astronauts Themselves,Book,http://www.amazon.com/dp/1439181039/,1,1
Apollo 11: The NASA Mission Reports Vol 1: Apogee Books Space Series 5,Book,http://www.amazon.com/dp/189652253X/,1,1
Rocket Propulsion Elements,Book,http://www.amazon.com/dp/0470080248/,1,1
If the Universe Is Teeming with Aliens ... WHERE IS EVERYBODY?: Fifty Solutions to the Fermi Paradox and the Problem of Extraterrestrial Life,Book,http://www.amazon.com/dp/0387955011/,1,1
Exploring the Night Sky: The Equinox Astronomy Guide for Beginners,Book,http://www.amazon.com/dp/0920656668/,1,1
Olympus Trooper 8x40 DPS 1 Binoculars,Photography,http://www.amazon.com/dp/B0001M3612/,1,1
