name,category,amazon_link,total_mentions,subreddit_mentions
A New Reference Grammar of Modern Spanish,Book,http://www.amazon.com/dp/1444137697/,3,2
La R de mi padre y otras letras familiares (Spanish Edition),eBooks,http://www.amazon.com/dp/B00ERF319Q/,,1
Ricky Falcó: Una Historia de Elemencia (Spanish Edition),eBooks,http://www.amazon.com/dp/B06XW7QFFX/,,1
Assimil Spanish with Ease SUPERPACK [ Book + 4 audio CDs + 1 CD mp3 ] (Spanish Edition),Book,http://www.amazon.com/dp/2700580486/,4,1
Fluent Forever: How to Learn Any Language Fast and Never Forget It,Book,http://www.amazon.com/dp/0385348118/,4,1
Lonely Planet Spanish Phrasebook & Dictionary (Lonely Planet Spanish  Phrasebooks),Book,http://www.amazon.com/dp/1742208096/,1,1
Lonely Planet Latin American Spanish Phrasebook & Dictionary,Book,http://www.amazon.com/dp/1742201873/,1,1
"Practical Spanish Grammar: A Self-Teaching Guide, 2nd Edition",Book,http://www.amazon.com/dp/0471134465/,1,1
"Don Quijote: Legacy Edition (Cervantes & Co.) (Spanish Edition) (European Masterpieces, Cervantes & Co. Spanish Classics)",Book,http://www.amazon.com/dp/1589771001/,1,1
