name,category,amazon_link,total_mentions,subreddit_mentions
Biology of Spiders,Book,http://www.amazon.com/dp/0199734828/,7,6
Common Spiders of North America,Book,http://www.amazon.com/dp/0520274881/,4,4
"Spiders and Their Kin: A Fully Illustrated, Authoritative and Easy-to-Use Guide (A Golden Guide from St. Martin's Press)",Book,http://www.amazon.com/dp/1582381569/,3,3
Spiders of North America: An Identification Manual,Book,http://www.amazon.com/dp/0977143902/,2,2
"The Tarantula Keeper's Guide: Comprehensive Information on Care, Housing, and Feeding",Book,http://www.amazon.com/dp/0764138855/,55,2
The Book of the Spider,Book,http://www.amazon.com/dp/0679408819/,1,1
Spiders of the World**OUT OF PRINT**,Book,http://www.amazon.com/dp/081605214X/,1,1
Australia's Dangerous Creatures,Book,http://www.amazon.com/dp/0864380186/,1,1
Complicated Spiders: Anti-Stress Coloring Book (Complicated Coloring),Book,http://www.amazon.com/dp/1514878658/,2,1
Raynox DCR-250 Super Macro Snap-On Lens,Photography,http://www.amazon.com/dp/B000A1SZ2Y/,8,1
Camkix Universal 3 in 1 Cell Phone Camera Lens Kit - Fish Eye Lens / 2 in 1 Macro Lens & Wide Angle Lens / Universal Clip (Black),Photography,http://www.amazon.com/dp/B00CSJ50HY/,7,1
CamKix Universal 3 in 1 Cell Phone Camera Lens Kit for Smartphones including - Fish Eye Lens / 2 in 1 Macro Lens & Wide Angle Lens / Universal Clip / Carry Pouch / Microfiber Cleaning Cloth(blue),Wireless,http://www.amazon.com/dp/B00FDLNR7E/,1,1
"100 Pc Cotton Swab Applicator Q-tip Swabs 6"" Extra Long Wood Handle Sturdy New !",Beauty,http://www.amazon.com/dp/B00JG1RLPQ/,1,1
"AUKEY Ora iPhone Camera Lens, 0.45x 140° Wide-Angle + 10x Macro Clip-On iPhone Lens for iPhone 8 / 7 / 6s / 6 Plus, Samsung, Other Android Smartphones",Photography,http://www.amazon.com/dp/B01D8KOAWM/,9,1
Be Nice to Spiders,Book,http://www.amazon.com/dp/0060220732/,4,1
Tarantula stuffed spider 8 1/2 inches - F1344 B72,Toy,http://www.amazon.com/dp/B01DTZLUGA/,1,1
Arachnids,Book,http://www.amazon.com/dp/0520261402/,1,1
Spider Behaviour: Flexibility and Versatility,Book,http://www.amazon.com/dp/0521749271/,1,1
A Field Guide to Spiders of Australia,Book,http://www.amazon.com/dp/064310707X/,1,1
I'm Trying to Love Spiders,Book,http://www.amazon.com/dp/0670016934/,2,1
