name,category,amazon_link,total_mentions,subreddit_mentions
"USB Network Adapter, UtechSmart USB 2.0 to 10/100 Fast Ethernet LAN Wired Network Adapter for MacBook, Chromebook, Windows, Linux, Wii, Wii U and Switch Game Console",Electronics,https://www.amazon.com/Support-UtechSmart-Ethernet-Chromebook-Specific/dp/B00F41TWAO/ref=sr_1_1?ie=UTF8&amp;qid=1439460067&amp;sr=8-1&amp;keywords=wiiu+ethernet+to+usb,8,2
Splatoon 3-pack amiibo (Splatoon Series),Video Games,https://www.amazon.com/Splatoon-3-pack-amiibo-nintendo-wii-u/dp/B00VHWMK44/,6,2
"Elgato Game Capture HD, Xbox and PlayStation High Definition Game Recorder for Mac and PC, Full HD 1080p",Electronics,https://www.amazon.com/Elgato-Capture-PlayStation-gameplay-1080p/dp/B00840353W/ref=sr_1_1?ie=UTF8&amp;qid=1440775974&amp;sr=8-1&amp;keywords=elgato,5,2
"UGREEN Ethernet Adapter USB 2.0 to 10/100 Network RJ45 Lan Wired Adapter for Nintendo Switch, Wii, Wii U, Macbook, Chromebook, Windows 10, 8.1, Mac OS, Surface Pro, Linux ASIX AX88772 Chipset (Black)",Electronics,https://www.amazon.com/gp/product/B00MYT481C/ref=oh_aui_search_detailpage?ie=UTF8&amp;psc=1,4,2
HORI Splatoon Protector for Nintendo Wii U,Video Games,https://www.amazon.com/HORI-Splatoon-Protector-Nintendo-Wii-U/dp/B00Y0CIZW4/ref=redir_mobile_desktop?_encoding=UTF8&amp%3Bkeywords=hori%20splatoon&amp%3Bpi=AC_SX110_SY165_QL70&amp%3Bsr=8-1&qid=1436834752&ref_=mp_s_a_1_1,3,2
"Sanei SP01 Splatoon Series Female Inkling Stuffed Plush, 9""",Toys & Games,https://www.amazon.com/Sanei-SP01-Splatoon-Inkling-Stuffed/dp/B016LRXUDE/,2,2
"Portable Charger RAVPower 26800 Battery Packs 26800mAh Total 5.5A Output 3-Port Power Bank (2A Input, iSmart 2.0 USB Power Pack) Portable Battery Charger for iPhone, iPad, and other Smart Devices",Cell Phones & Accessories,https://www.amazon.com/gp/product/B012NIQG5E/ref=oh_aui_detailpage_o09_s00?ie=UTF8&amp;psc=1,7,1
"USB Network Adapter, UtechSmart USB 2.0 to 10/100 Fast Ethernet LAN Wired Network Adapter for MacBook, Chromebook, Windows, Linux, Wii, Wii U and Switch Game Console",Electronics,https://www.amazon.com/dp/B00CBD2X5E/ref=cm_sw_r_sms_awdo_52MAzb3BKRVGC,4,1
Good Smile Metroid: Other M Samus Aran Figma Action Figure(Discontinued by manufacturer),Toys & Games,https://www.amazon.com/Good-Smile-Metroid-Discontinued-manufacturer/dp/B00712Y28Q/ref=redir_mobile_desktop?_encoding=UTF8&%2AVersion%2A=1&%2Aentries%2A=0,3,1
"Elgato Game Capture HD60, for PlayStation 4, Xbox One and Xbox 360, or Nintendo Switch gameplay, Full HD 1080p 60fps",Electronics,https://www.amazon.com/Elgato-Capture-PlayStation-gameplay-1080p60/dp/B00MIQ40JQ/ref=sr_1_2?ie=UTF8&amp;qid=1440775974&amp;sr=8-2&amp;keywords=elgato,3,1
Foxnovo 5pcs Triwing Trigram Y-Tip Screwdrivers Screw Drivers for Nintendo Wii /DS /DS Lite /GBA (Red) (Red),Electronics,https://www.amazon.com/gp/product/B00KXSVBL6/ref=oh_aui_detailpage_o03_s00?ie=UTF8&amp;psc=1,2,1
Inkling Girl amiibo (Splatoon Series),Software,https://www.amazon.com/Inkling-amiibo-Splatoon-nintendo-wii-u/dp/B00VHWMJWC/ref=sr_1_4?s=software&amp;ie=UTF8&amp;qid=1461718741&amp;sr=8-4&amp;keywords=amiibo,1,1
Nintendo DS Wi-Fi USB Connector,Video Games,https://www.amazon.com/dp/B000MXMNG4/ref=cm_sw_r_cp_apa_KmcCzbX030HNP,1,1
"Platinum Pets Formal Pet Bow Tie and Collar, 9 to 10-Inch, White",Pet Supplies,https://www.amazon.com/Platinum-Pets-Formal-Collar-10-Inch/dp/B0081ZG2M6/ref=redir_mobile_desktop?_encoding=UTF8&amp%3BdpID=41vwU6GZh6L&amp%3BdpPl=1&amp%3Bkeywords=bow%20tie%20for%20cats&amp%3Bpi=SX200_QL40&amp%3Bref=plSrch&amp%3Bsr=8-1&qid=1449091482&ref_=mp_s_a_1_1,1,1
Splatoon Spline shooter Water Gun,Toys & Games,https://www.amazon.com/Splatoon-Spline-shooter-Water-Gun/dp/B01D64Y42G/ref=pd_lpo_vtph_21_tr_t_3?_encoding=UTF8&amp;psc=1&amp;refRID=VA07R6T4N394NZC0BFG1,1,1
Splatoon: Prima official Game Guide,Books,https://www.amazon.com/Splatoon-Prima-official-Official-Guides/dp/110189850X,1,1
Creativity from Constraints: The Psychology of Breakthrough,Books,https://www.amazon.com/gp/product/0826178456,1,1
Canari Men's Blade Gel Cycling Shorts,Sports & Outdoors,https://www.amazon.com/dp/B00T52A6G2/ref=twister_B01276CFTI,1,1
"AVerMedia Live Gamer Portable, Full HD 1080p Recording Without PC Directly to SD Card, Ultra Low Latency, H.264 Hardware Encoding, USB Video Capture, High Definition Game Capture, Recorder, Streaming (C875)",Electronics,https://www.amazon.com/AVerMedia-Portable-Capture-Xbox360-C875/dp/B00B2IZ3B0/ref=sr_1_1?ie=UTF8&amp;qid=1446889710&amp;sr=8-1&amp;keywords=avermedia,1,1
Blank Mesh Trucker Hat Cap (Choose Color),"Clothing, Shoes & Jewelry",https://www.amazon.com/Blank-Trucker-Choose-Color-White/dp/B005U1GKU8/ref=sr_1_3?ie=UTF8&amp;qid=1441768146&amp;sr=8-3&amp;keywords=blank+mesh+trucker+hat,1,1
"Sanei SP02 Splatoon Series Male Inkling Stuffed Plush Toy, 10""",Toys & Games,https://www.amazon.com/Sanei-Splatoon-Plush-Series-Inkling/dp/B016LRXUC0/ref=pd_sim_21_2?ie=UTF8&amp;dpID=41j6fM7BgHL&amp;dpSrc=sims&amp;preST=_AC_UL160_SR160,1,1
"Sanei SP03 Splatoon Series Callie Pink Squid Sister Stuffed Plush, 10""",Toys & Games,https://www.amazon.com/gp/product/B016LRXUQQ/ref=s9_simh_gw_g21_i4_r?pf_rd_m=ATVPDKIKX0DER&amp;pf_rd_s=desktop-1&amp;pf_rd_r=11R861FQ4386K7K9SDTV&amp;pf_rd_t=36701&amp;pf_rd_p=2079475242&amp;pf_rd_i=desktop,1,1
"Sanei SP04 Splatoon Series Marie Green Squid Sister Stuffed Plush, 9.5""",Toys & Games,https://www.amazon.com/Sanei-Splatoon-Plush-Series-Sister/dp/B016LRXUOS/ref=pd_bxgy_21_img_2?ie=UTF8&amp;refRID=03W20QD0D3DDRCXWXQ29,1,1
Splatoon squid cushion height 35cm pink,Toys & Games,https://www.amazon.com/Splatoon-squid-cushion-height-35cm/dp/B01KBDF1TU/ref=sr_1_23?ie=UTF8&amp;qid=1472402289&amp;sr=8-23&amp;keywords=splatoon+cushion,1,1
Splatoon Splatoon ink ring squid lime green (S) stuffed height 23cm SP05,Toys & Games,https://www.amazon.com/gp/product/B01KBDG1JY/ref=pd_day0_21_8?ie=UTF8&amp;psc=1&amp;refRID=HZ1WGEW37TNCEPCS4W9Z,1,1
"UNITEK USB 2.0 to RJ45 LAN Wired Gigabit Ethernet Network Adapter and Supported 10/100 Mbps Ethernet for Macbook Air, Macbook Pro, Surface Pro (Black)",Electronics,https://www.amazon.com/Gigabit-Ethernet-Network-Adapter-Supported/dp/B01HTJLQVG/ref=redir_mobile_desktop?_encoding=UTF8&amp%3Bkeywords=wii%20u%20lan&amp%3Bpi=AC_SX236_SY340_FMwebp_QL65&amp%3Bqid=1474156053&amp%3Bsr=8-12&ref_=mp_s_a_1_12,1,1
1 X Set of 2 Triangle Onigiri Musubi Rice Mold,Home & Kitchen,https://www.amazon.com/gp/product/B006MLACYK?psc=1&amp;redirect=true&amp;ref_=oh_aui_detailpage_o00_s00,1,1
Wii A/V Cable,Video Games,https://www.amazon.com/Wii-V-Cable-Nintendo/dp/B0011E4J2Y/ref=sr_1_1?ie=UTF8&amp;qid=1431206961&amp;sr=8-1&amp;keywords=Wii+AV+cables,1,1
Analog Stick with PCB Board for Nintendo Wii U GamePad Controller Left Right Set With Joy Stick Cap,Video Games,https://www.amazon.com/gp/product/B01H4FDII4/ref=oh_aui_detailpage_o03_s00?ie=UTF8&amp;psc=1,1,1
Blank Mesh Trucker Hat Cap (Choose Color),"Clothing, Shoes & Jewelry",https://www.amazon.com/Blank-Mesh-Trucker-Choose-Color/dp/B005U1GKTE,1,1
Nintendo Switch Game Traveler Deluxe Travel Case - Splatoon - Nintendo Switch,Video Games,https://www.amazon.com/Nintendo-Switch-Game-Traveler-Deluxe-Travel/dp/B071JGB2CV/ref=cm_cr_arp_d_product_top?ie=UTF8,1,1
