name,category,amazon_link,total_mentions,subreddit_mentions
"USB Network Adapter, UtechSmart USB 2.0 to 10/100 Fast Ethernet LAN Wired Network Adapter for MacBook, Chromebook, Windows, Linux, Wii, Wii U and Switch Game Console",Personal Computer,http://www.amazon.com/dp/B00F41TWAO/,75,18
HORI Splatoon Protector for Nintendo Wii U,Video Games,http://www.amazon.com/dp/B00Y0CIZW4/,13,8
"USB Network Adapter, UtechSmart USB 2.0 to 10/100 Fast Ethernet LAN Wired Network Adapter for MacBook, Chromebook, Windows, Linux, Wii, Wii U and Switch Game Console",Personal Computer,http://www.amazon.com/dp/B00CBD2X5E/,23,5
UGREEN Network Adapter USB 3.0 to Ethernet RJ45 Lan Gigabit Adapter for 10/100/1000 Mbps Ethernet Supports Nintendo Switch Black,Personal Computer,http://www.amazon.com/dp/B00MYTSN18/,31,4
"Elgato Game Capture HD, Xbox and PlayStation High Definition Game Recorder for Mac and PC, Full HD 1080p",Personal Computer,http://www.amazon.com/dp/B00840353W/,56,3
"Sanei SP01 Splatoon Series Female Inkling Stuffed Plush, 9""",Toy,http://www.amazon.com/dp/B016LRXUDE/,3,3
"Elgato Game Capture HD60, for PlayStation 4, Xbox One and Xbox 360, or Nintendo Switch gameplay, Full HD 1080p 60fps",Personal Computer,http://www.amazon.com/dp/B00MIQ40JQ/,33,3
"UGREEN Ethernet Adapter USB 2.0 to 10/100 Network RJ45 Lan Wired Adapter for Nintendo Switch, Wii, Wii U, Macbook, Chromebook, Windows 10, 8.1, Mac OS, Surface Pro, Linux ASIX AX88772 Chipset (Black)",Personal Computer,http://www.amazon.com/dp/B00MYT481C/,17,3
Nintendo Switch Game Traveler Deluxe Travel Case - Splatoon - Nintendo Switch,Video Games,http://www.amazon.com/dp/B071JGB2CV/,3,2
HDE Nintendo Switch / Wii U / Wii USB to LAN Network Adapter Ethernet [Wired Connection] Converter,Video Games,http://www.amazon.com/dp/B003XWD1G2/,11,2
"USB Network Adapter, UtechSmart USB 2.0 to 10/100 Fast Ethernet LAN Wired Network Adapter for MacBook, Chromebook, Windows, Linux, Wii, Wii U and Switch Game Console",Personal Computer,http://www.amazon.com/dp/B00QGAJ5YU/,5,2
"Plugable USB 2.0 to 10/100 Fast Ethernet LAN Wired Network Adapter for MacBook, Chromebook, Windows, Linux, Wii, Wii U & Switch Game Console",Personal Computer,http://www.amazon.com/dp/B00484IEJS/,31,2
Sabrent USB External Stereo Sound Adapter for Windows and Mac. Plug and play No drivers Needed. (AU-MMSA),Personal Computer,http://www.amazon.com/dp/B00IRVQ0F8/,124,2
Nintendo Switch - Joy-Con AA Battery Pack,Video Games,http://www.amazon.com/dp/B071XXXK2X/,7,2
Nintendo Switch Joy-Con (L/R)-Neon Green/Neon Pink (EUR Import),Personal Computer,http://www.amazon.com/dp/B072BZ66JL/,2,2
"Sanei SP02 Splatoon Series Male Inkling Stuffed Plush Toy, 10""",Toy,http://www.amazon.com/dp/B016LRXUC0/,2,2
Splatoon 2 - Nintendo Switch [Digital Code],Digital Video Games,http://www.amazon.com/dp/B073J2Y9NR/,2,2
"Sanei SP03 Splatoon Series Callie Pink Squid Sister Stuffed Plush, 10""",Toy,http://www.amazon.com/dp/B016LRXUQQ/,2,2
"Sanei SP04 Splatoon Series Marie Green Squid Sister Stuffed Plush, 9.5""",Toy,http://www.amazon.com/dp/B016LRXUOS/,2,2
Netgear AC1600 Smart WiFi 802.11ac Dual Band Gigabit Router R6250 (Certified Refurbished),PC Accessory,http://www.amazon.com/dp/B00JRCQRSQ/,5,2
Splatoon squid cushion height 35cm pink,Toy,http://www.amazon.com/dp/B01KBDF1TU/,4,2
"AUKEY Ground Loop Noise Isolator for Car Stereo Systems and Home Audio Systems, 3.5mm Audio Cable Included",CE,http://www.amazon.com/dp/B01L1NP7YI/,20,2
Inkling Girl amiibo (Splatoon Series),Video Games,http://www.amazon.com/dp/B00VHWMJWC/,8,2
Roxio Game Capture HD PRO,Software,http://www.amazon.com/dp/B008YTAGGW/,3,2
Hauppauge - HD PVR 2 Gaming Edition High Definition Game Capture Device,Personal Computer,http://www.amazon.com/dp/B008ZT8QKO/,5,2
"SURGE, 12 ct, 16 FL OZ Cans",Pantry,http://www.amazon.com/dp/B00OK0I4AO/,64,2
"Neiko 53941A High Visibility Safety Vest, ANSI/ ISEA Standard | Color Neon Yellow | Size L",Home Improvement,http://www.amazon.com/dp/B0030AA3YK/,5,1
AKG Q701 Quincy Jones Signature On-Ear Reference Headphones (Green),Speakers,http://www.amazon.com/dp/B004444O46/,4,1
ViewHD 2 Port 1x2 Powered HDMI Mini Splitter for 1080P & 3D | Model: VHD-1X2MN3D,Speakers,http://www.amazon.com/dp/B004F9LVXC/,70,1
Marshmallow Fluff - 16 oz plastic tub,Grocery,http://www.amazon.com/dp/B005BDBEEM/,2,1
OREI HD-102 1x2 1 Port HDMI Powered Splitter Ver 1.3 Certified for Full HD 1080P & 3D Support (One Input To Two Outputs),Speakers,http://www.amazon.com/dp/B005HXFARS/,19,1
Blank Mesh Trucker Hat Cap (Choose Color),Apparel,http://www.amazon.com/dp/B005U1GKTE/,1,1
Blank Mesh Trucker Hat Cap (Choose Color) (Red / White),Apparel,http://www.amazon.com/dp/B005U1GKU8/,1,1
1 X Set of 2 Triangle Onigiri Musubi Rice Mold,Kitchen,http://www.amazon.com/dp/B006MLACYK/,3,1
"AVerMedia Game Broadcaster HD Record and Stream PC, Xbox 360, PS3, Wii and iPads - Capture Up To 1080p with HDMI/DVI/VGA/Component Inputs",Personal Computer,http://www.amazon.com/dp/B006T8QCYA/,7,1
Good Smile Metroid: Other M Samus Aran Figma Action Figure(Discontinued by manufacturer),Toy,http://www.amazon.com/dp/B00712Y28Q/,8,1
"Linksys N600+ Wi-Fi Wireless Dual-Band+ Router with Gigabit Ports, Smart Wi-Fi App Enabled to Control Your Network from Anywhere (EA2700)",Personal Computer,http://www.amazon.com/dp/B007IL72CI/,2,1
"Platinum Pets Formal Pet Bow Tie and Collar, 9 to 10-Inch, White",Pet Products,http://www.amazon.com/dp/B0081ZG2M6/,1,1
DECKY Two Tone Trucker Mesh Caps Plain Baseball Hat- Black,Apparel,http://www.amazon.com/dp/B0088PDYG6/,1,1
"3M Medium Half Facepiece Reusable Respirator 7502/37082(AAD), Respiratory Protection, Medium",BISS,http://www.amazon.com/dp/B008MCUT86/,7,1
Novelty Rainbow Squid Hat Costume Party Hat Cap,Toy,http://www.amazon.com/dp/B008ZCUP2I/,1,1
Energizer 3x Charge Station for Wii U,Video Games,http://www.amazon.com/dp/B00A878J5I/,2,1
"TRENDnet Powerline AV200 Mini Network Adapter Starter Kit, up to 200 Mbps over existing electrical lines, TPL-308E2K",Personal Computer,http://www.amazon.com/dp/B00AOGZ80C/,2,1
"TP-Link AV600 Nano Powerline Adapter Starter Kit, up to 600Mbps (TL-PA4010KIT)",Personal Computer,http://www.amazon.com/dp/B00AWRUICG/,292,1
"TP-Link AV200 Nano Powerline Adapter Starter Kit, up to 200Mbps (TL-PA2010KIT)",Personal Computer,http://www.amazon.com/dp/B00AWRUIY4/,89,1
"AVerMedia Live Gamer Portable, Full HD 1080p Recording Without PC Directly to SD Card, Ultra Low Latency, H.264 Hardware Encoding, USB Video Capture, High Definition Game Capture, Recorder, Streaming (C875)",Personal Computer,http://www.amazon.com/dp/B00B2IZ3B0/,14,1
Cable Matters SuperSpeed USB 3.0 to RJ45 Gigabit Ethernet Network Adapter in Black,PC Accessory,http://www.amazon.com/dp/B00BBD7NFU/,13,1
Wyndham KTBEVDS9 Triple Beverage Dispenser Backpack,Home,http://www.amazon.com/dp/B00BHZ3N6U/,1,1
"Evercare Mega Cleaning Roller With 3-Foot Extendable Handle,25 sheets",Health and Beauty,http://www.amazon.com/dp/B00CJSPVC8/,3,1
"Cable Matters 160021 5-Feet Cat6 Snagless Ethernet Patch Cable, Pack of 5 (Black/ Blue/ White/ Red/ Green)",Personal Computer,http://www.amazon.com/dp/B00E5I7VJG/,5,1
Belkin USB 2.0 Ethernet Adapter (F4U047bt),CE,http://www.amazon.com/dp/B00E9655LU/,3,1
Performance Tool M731 Aluminum Paint Cup - 20 oz. Capacity,Automotive Parts and Accessories,http://www.amazon.com/dp/B00HFLC4ZQ/,1,1
Sony KDL55W950B 55-Inch 1080p 120Hz 3D Smart LED TV (2014 Model),Home Theater,http://www.amazon.com/dp/B00HPMCLCG/,5,1
NETGEAR 5-Port Gigabit Ethernet 10/100/1000Mbps Switch (GS205),Personal Computer,http://www.amazon.com/dp/B00KFD0SMC/,7,1
Splatoon,Video Games,http://www.amazon.com/dp/B00KWFCV32/,9,1
Foxnovo 5pcs Triwing Trigram Y-Tip Screwdrivers Screw Drivers for Nintendo Wii /DS /DS Lite /GBA (Red) (Red),PC Accessory,http://www.amazon.com/dp/B00KXSVBL6/,5,1
"MEKO (2-in-1 Precision Series) Disc Stylus Styli (2 Pcs) for all iPads,iPhones,tablets, Laptops and all Touch Screen Devices Bundle with 4 Replacement Disc Tips, 2 Fiber Tips (Black/Black)",Wireless,http://www.amazon.com/dp/B00N1BRWLA/,15,1
Silhouette Cameo -- Starter Bundle,Art and Craft Supply,http://www.amazon.com/dp/B00NAX7H78/,9,1
StarTech.com HDMI Video Capture Device – 1080p – 60fps Game Capture Card – USB Video Capture Card – with HDMI DVI VGA,Personal Computer,http://www.amazon.com/dp/B00PC5HUA6/,5,1
Acer G257HU smidpx 25-Inch WQHD (2560 x 1440) Widescreen Monitor,Personal Computer,http://www.amazon.com/dp/B00QS0AKVK/,112,1
NETGEAR AC1200 WiFi Range Extender  (EX6150-100NAS),Personal Computer,http://www.amazon.com/dp/B00R92CLCW/,3,1
"Canari Men's Blade Gel Cycling Shorts, Breakaway Blue, Small",Sports,http://www.amazon.com/dp/B00T52A6G2/,1,1
Inkling Squid amiibo - Japan Import (Splatoon Series),Video Games,http://www.amazon.com/dp/B00VFT4VGY/,1,1
SteelSeries Siberia v3 Gaming Headset - White (Certified Refurbished),PC Accessory,http://www.amazon.com/dp/B00WXY2SYC/,1,1
"Sanei Splatoon Series Orange Splatoon Squid Cushion 14"" Plush",Toy,http://www.amazon.com/dp/B00XOQGN26/,1,1
Splatoon Water Gun,Toy,http://www.amazon.com/dp/B00YKMCJ44/,3,1
HORI Retro Mario GamePad Protector and Stylus Set - Nintendo Wii U,Video Games,http://www.amazon.com/dp/B00ZUNOXJQ/,2,1
"TP-Link AV500 2-port Powerline Starter Kit, Up to 500Mbps (TL-PA4026 KIT)",Personal Computer,http://www.amazon.com/dp/B010Q29KRK/,19,1
"Portable Charger RAVPower 26800 Battery Packs 26800mAh Total 5.5A Output 3-Port Power Bank (2A Input, iSmart 2.0 USB Power Pack) Portable Battery Charger for iPhone, iPad, and other Smart Devices",Wireless,http://www.amazon.com/dp/B012NIQG5E/,21,1
"Sanei Splatoon Squid Stuffed Cushion Plush, 14"", Dark Blue",Toy,http://www.amazon.com/dp/B0136J7OXM/,1,1
Fifth Sun Nintendo Splatoon Characters Mens Graphic T Shirt,Apparel,http://www.amazon.com/dp/B013FA8JI6/,1,1
"Neleus Men's Classic Leather Motorcycle Jacket,0214,Black,M,Asia 2XL",Apparel,http://www.amazon.com/dp/B013YOAPS0/,1,1
Splatune: Splatoon Original Soundtrack,Music,http://www.amazon.com/dp/B014HZSPI2/,3,1
"Elgato Game Capture HD60 Pro, stream and record in 1080p60, superior low latency technology, H.264 hardware encoding, PCIe",Personal Computer,http://www.amazon.com/dp/B014MQIVPS/,22,1
HORI Super Mario Maker GamePad Protector for Nintendo Wii U,Video Games,http://www.amazon.com/dp/B014SEK3ZA/,3,1
"Funny Guy Mugs Like Totally 80s & 90s Retro Neon Windbreaker, Medium",Apparel,http://www.amazon.com/dp/B0171XN44M/,1,1
HORI Nintendo Switch Splatoon 2 Splat & Chat Headset,Video Games,http://www.amazon.com/dp/B01A0PVN5A/,4,1
HORI Splatoon 2 Hard Pouch Officially Licensed - Nintendo Switch,Video Games,http://www.amazon.com/dp/B01A0SGA8M/,1,1
HORI Splatoon 2 Squid Plush Pouch (Neon Green) Officially Licensed - Nintendo Switch,Video Games,http://www.amazon.com/dp/B01A0TEIX0/,2,1
"DUODUO Men's 2601 Genuine Leather Combat Boots ,Black,10D(M) US",Shoes,http://www.amazon.com/dp/B01AGB14G6/,1,1
"Tryone Gooseneck Tablet Stand, Tablet Mount Holder for iPad iPhone Series/ Nintendo Switch/ Samsung Galaxy Tabs/ Amazon Kindle Fire HD and more, 30in Overall Length(White)",Personal Computer,http://www.amazon.com/dp/B01AUQ33K2/,3,1
"Tryone Gooseneck Tablet Stand, Tablet Mount Holder for iPad iPhone Series/ Nintendo Switch/ Samsung Galaxy Tabs/ Amazon Kindle Fire HD and more, 30in Overall Length(Black)",Personal Computer,http://www.amazon.com/dp/B01AUQ33LG/,24,1
Mudder Silicone Thumb Grips Caps Stick Protect Cover for Xbox One Controllers,Video Games,http://www.amazon.com/dp/B01CY4ROTE/,1,1
"""Inkopolis Badge set"" Deluxe Metal Pins",Apparel,http://www.amazon.com/dp/B01D0K21ZS/,1,1
Splatoon Spline shooter Water Gun,Toy,http://www.amazon.com/dp/B01D64Y42G/,1,1
Diorama Kit for amiibo Super Smash Bros. Nintendo Wii U,Video Games,http://www.amazon.com/dp/B01DU1SX22/,3,1
"MEKO(TM) (2 Pcs)[2 in 1 Precision Series] Disc Stylus/Styli Bundle with 4 Replaceable Disc Tips, 2 Replaceable Fiber Tips For All Touch Screen Devices - (Black/Silver)",CE,http://www.amazon.com/dp/B01E0LHE26/,2,1
Hysenm Tour De France Polyester Breathable Sweat Absorbent Cycling Sports Sun Hat Helmet Liner Champion Cap,Sports,http://www.amazon.com/dp/B01E2CLNWU/,1,1
Takara Tomy Splatoon Splash Bottle Cap Collection Set of 6,Toy,http://www.amazon.com/dp/B01E5PQCIE/,1,1
Nintendo Callie & Marie 2-Pack amiibo - Nintendo Wii U,Video Games,http://www.amazon.com/dp/B01F41JL40/,1,1
amiibo diorama kit Splatoon [Shioka Live] Japan Import,Video Games,http://www.amazon.com/dp/B01G6LXRQ0/,1,1
amiibo diorama kit Splatoon [mozuku farm] Japan Import,Video Games,http://www.amazon.com/dp/B01G6LXXNM/,2,1
Nintendo Amiibo [Aori/Fire Fly],Video Games,http://www.amazon.com/dp/B01G6LXXWI/,2,1
Splatoon Ichiban Kuji - Prize D - Ink Tank Pet Buttle Case,Toy,http://www.amazon.com/dp/B01GU59QF8/,1,1
Analog Stick with PCB Board for Nintendo Wii U GamePad Controller Left Right Set With Joy Stick Cap,Video Games,http://www.amazon.com/dp/B01H4FDII4/,1,1
"UNITEK USB 2.0 to RJ45 LAN Wired Gigabit Ethernet Network Adapter and Supported 10/100 Mbps Ethernet for Macbook Air, Macbook Pro, Surface Pro (Black)",PC Accessory,http://www.amazon.com/dp/B01HTJLQVG/,1,1
Splatoon Splatoon ink ring squid lime green (S) stuffed height 23cm SP05,Toy,http://www.amazon.com/dp/B01KBDG1JY/,2,1
"World of Nintendo Inkling Boy with Blaster Action Figure, 4""",Toy,http://www.amazon.com/dp/B01M32J2QO/,1,1
Nintendo Switch Game Traveler Deluxe Travel Case,Video Games,http://www.amazon.com/dp/B01MY9JB2U/,113,1
Clarks  Men's Stinson Hi Dark Blue Suede Shoe,Shoes,http://www.amazon.com/dp/B01MYNZ6F0/,1,1
