name,category,amazon_link,total_mentions,subreddit_mentions
Microsoft SQL Server 2012 High-Performance T-SQL Using Window Functions (Developer Reference),eBooks,http://www.amazon.com/dp/B00JDMPHKY/,,1
Database Administration: The Complete Guide to DBA Practices and Procedures (2nd Edition),Book,http://www.amazon.com/dp/0321822943/,1,1
Oracle PL/SQL Programming: Covers Versions Through Oracle Database 12c,Book,http://www.amazon.com/dp/1449324452/,1,1
"SQL in 10 Minutes, Sams Teach Yourself (4th Edition)",Book,http://www.amazon.com/dp/0672336073/,1,1
"Agile Data Warehouse Design: Collaborative Dimensional Modeling, from Whiteboard to Star Schema",Book,http://www.amazon.com/dp/0956817203/,1,1
