name,category,amazon_link,total_mentions,subreddit_mentions
"Mayflash GameCube Controller Adapter for Wii U, PC USB and Switch, 4 Port",Personal Computer,http://www.amazon.com/dp/B00RSXRLUE/,149,25
"Sewell Wii to HDMI Converter, Low Latency, 480p",CE,http://www.amazon.com/dp/B0072JP56G/,27,7
I-o DATA USB connection video capture GV-USB2,PC Accessory,http://www.amazon.com/dp/B00428BF1Y/,50,6
Nintendo Super Smash Bros. White Classic Gamecube Controller,Video Games,http://www.amazon.com/dp/B00O9GW8TC/,51,5
The Inner Game of Tennis: The Classic Guide to the Mental Side of Peak Performance,Book,http://www.amazon.com/dp/0679778314/,24,5
Official Nintendo White Classic Gamecube Controller,Video Games,http://www.amazon.com/dp/B0017KIBAI/,31,5
New Gamecube Replacement Analog Cap Yellow Replaces Worn Out Analog Cap On Gamecube Controller,Video Games,http://www.amazon.com/dp/B004H7P0B6/,7,4
The Art of Learning: An Inner Journey to Optimal Performance,Book,http://www.amazon.com/dp/0743277465/,20,4
"Leegoal Tri-wing Screwdriver for Nintendo Wii, Gamecube, Gameboy Advance",Home Improvement,http://www.amazon.com/dp/B000S6AG9G/,18,4
Super Smash Bros. GameCube Adapter for Wii U,Video Games,http://www.amazon.com/dp/B00L3LQ1FI/,53,3
FiiO A1 Silver Portable Headphone Amp A1,Wireless,http://www.amazon.com/dp/B01CPUVPEM/,17,3
Manhattan 161336 Hi-Speed USB Audio/Video Grabber,Personal Computer,http://www.amazon.com/dp/B004S5VWSW/,3,3
Gamecube Controller Connection Tap for Wii U,Video Games,http://www.amazon.com/dp/B00O9GPB00/,6,3
"BenQ ZOWIE 24 inch 144Hz eSports Gaming Monitor, 1080p, 1ms Response Time, Black eQualizer, Height Adjustable (XL2411)",Personal Computer,http://www.amazon.com/dp/B01H5KKQTM/,20,3
Tomee S-Video AV Cable for Wii U/ Wii,Video Games,http://www.amazon.com/dp/B001B0A3A0/,4,3
"Elgato Game Capture HD, Xbox and PlayStation High Definition Game Recorder for Mac and PC, Full HD 1080p",Personal Computer,http://www.amazon.com/dp/B00840353W/,56,3
Gamecube Controller Platinum,Video Games,http://www.amazon.com/dp/B0002Y5180/,3,2
"BenQ ZOWIE 24 inch Full HD Gaming Monitor - 1080p 1ms Response Time for Competitive eSports Gaming, Dual HDMI, DVI-D, D-Sub (RL2455)",Personal Computer,http://www.amazon.com/dp/B01H5KKRLO/,30,2
Nintendo Super Smash Bros. Black Classic Gamecube Controller,Video Games,http://www.amazon.com/dp/B00O9GW8VK/,35,2
Tomee 3.5mm RCA Stereo Splitter Cable for Headset/ Audio Devices,Video Games,http://www.amazon.com/dp/B00HK74GO2/,2,2
Monoprice AV Cable w/ Composite (Yellow RCA)/S-Video and Stereo Audio (Red/White) for Wii - Net Jacket and Gold Plated,Personal Computer,http://www.amazon.com/dp/B003L16ZBI/,3,2
3.5mm Male to 2 RCA Left & Right Audio Female Adapter,CE,http://www.amazon.com/dp/B003LVDWOQ/,13,2
"Diamond Multimedia USB 2.0 High Definition (HD) Video Capture Box with Component Video Loop-Through. Capture & Edit Your Games from Xbox 360 & PS3 (GC500). For Windows 10, 8.1, 8, 7",Personal Computer,http://www.amazon.com/dp/B008KEPWN8/,3,2
StarTech.com HDMI Video Capture Device – 1080p – 60fps Game Capture Card – USB Video Capture Card – with HDMI DVI VGA,Personal Computer,http://www.amazon.com/dp/B00PC5HUA6/,5,2
Blackmagic Design Intensity Shuttle for USB 3.0 (BINTSSHU),Speakers,http://www.amazon.com/dp/B003WSQTWU/,3,2
Sminiker® USB 2.0 Video Easycap Tv DVD VHS Capture Card Audio Av Easiercap Adapter for Windows Xp/2000/ Vista/ Win7/win8,Personal Computer,http://www.amazon.com/dp/B00XMDR7KI/,2,2
"ASUS VG248QE 24"" Full HD 1920x1080 144Hz 1ms HDMI Gaming Monitor",Personal Computer,http://www.amazon.com/dp/B00B2HH7G0/,312,2
Logitech Speed Force,PC Accessory,http://www.amazon.com/dp/B00006HMPP/,2,2
RCA Compact RF Modulator (CRF907A),Speakers,http://www.amazon.com/dp/B0014KKV7W/,19,2
The Inner Game of Tennis: The Classic Guide to the Mental Side of Peak Performance,eBooks,http://www.amazon.com/dp/B003T0G9E4/,3,2
Wii/GameCube Converter PS/PS2 to Wii/GameCube w/ Dance Pad Support,Video Games,http://www.amazon.com/dp/B000F7B516/,8,2
Metal Aluminum Silver Playstation 2/3 Joystick PS2 PS3 Controller THUMBSTICKS,Video Games,http://www.amazon.com/dp/B00E1VO870/,2,2
Dazzle DVD Recorder HD VHS to DVD Converter,Software,http://www.amazon.com/dp/B00EAS14KI/,8,2
Flow: The Psychology of Optimal Experience (Harper Perennial Modern Classics),Book,http://www.amazon.com/dp/0061339202/,46,2
"ASUS VS247H-P 23.6"" Full HD 1920x1080 2ms HDMI DVI VGA Monitor",Personal Computer,http://www.amazon.com/dp/B005BZNDS0/,24,1
Audio Video Distribution Amplifier RCA Video Splitter Video Composite Signal Amp 1 Input to 4 Outputs Uninex Vs-23,Speakers,http://www.amazon.com/dp/B005N0CRT4/,4,1
"AVerMedia EZMaker 7, Standard Definition USB Video Capture Card , Analog to Digital Recorder, RCA Composite, VHS to DVD, S-Video, Cyberlink Media Suite Included, Win 10 / MAC (C039)",Personal Computer,http://www.amazon.com/dp/B00603S1OS/,10,1
Audio Cable Splitter Cable for Turtle Beach Headset - Female,PC Accessory,http://www.amazon.com/dp/B006G74X6I/,1,1
"Logitech HD Pro Webcam C920, Widescreen Video Calling and Recording, 1080p Camera, Desktop or Laptop Webcam",Personal Computer,http://www.amazon.com/dp/B006JH8T3S/,96,1
"SanDisk 16GB Class 4 SDHC Memory Card, Frustration-Free Packaging (SDSDB-016G-AFFP)",CE,http://www.amazon.com/dp/B007JRB0SS/,4,1
WD Blue 1TB SATA 6 Gb/s 7200 RPM 64MB Cache 3.5 Inch Desktop Hard Drive (WD10EZEX),Personal Computer,http://www.amazon.com/dp/B0088PUEPK/,88,1
MT-VIKI 4 Port 1 In 4 Out 3 RCA AV Audio Video Splitter Amplifier for Cable Box DVD DVR Analog TV,CE,http://www.amazon.com/dp/B008AGUFEW/,2,1
Thunderbolt to Gigabit Ethernet Adapter,Personal Computer,http://www.amazon.com/dp/B008ALA6DW/,1,1
Elenco Electronics WK-103 Hook-Up 3 Colors Wire Kit,Toy,http://www.amazon.com/dp/B008L3UXO6/,1,1
Monoprice 107113 Component YpbPr to VGA Converter,Speakers,http://www.amazon.com/dp/B009GUQYBO/,1,1
"HP Spectre XT TouchSmart Ultrabook 15-4010nr Intel Core i7-3517U , 8GB DDR3, 500GB HDD+32GB SSD Cache, 15.6? FHD 1920x1080 Touch-Screen LED, Windows 8 64-bit",Personal Computer,http://www.amazon.com/dp/B009WG6MXM/,1,1
"TP-Link AV200 Nano Powerline Adapter Starter Kit, up to 200Mbps (TL-PA2010KIT)",Personal Computer,http://www.amazon.com/dp/B00AWRUIY4/,89,1
"AVerMedia Live Gamer Portable, Full HD 1080p Recording Without PC Directly to SD Card, Ultra Low Latency, H.264 Hardware Encoding, USB Video Capture, High Definition Game Capture, Recorder, Streaming (C875)",Personal Computer,http://www.amazon.com/dp/B00B2IZ3B0/,14,1
RadioShack 4-Way Component Video Distribution Amplifier 15-311,Speakers,http://www.amazon.com/dp/B00B2MQD92/,4,1
SD Card Adapter for Wii (Gray),Video Games,http://www.amazon.com/dp/B00BYGH188/,2,1
1x4 Component Video Distribution Amplifier / Splitter,Speakers,http://www.amazon.com/dp/B00CAIBQ9E/,4,1
"HP Ultra Slim W2371d 23"" LED LCD Monitor - 16:9 - 5 ms (B3A19AA#ABA) -",Office Product,http://www.amazon.com/dp/B00D8J5Q72/,1,1
Metal Aluminum Blue Playstation 2/3 Joystick PS2 PS3 Controller THUMBSTICKS,Video Games,http://www.amazon.com/dp/B00E1ZQGJY/,1,1
Generic New USB 2.0 Easycap Dc60 Tv Dvd Vhs Video Adapter Capture Card Audio Av Capture Support Win Xp/ Win 7/ Vista 32,PC Accessory,http://www.amazon.com/dp/B00FILKNBM/,4,1
"Hauppauge HD PVR Rocket Portable Stand Alone HD 1080p Video Game Recorder for Xbox One, Xbox 360, PS4, PS3 and PC Gaming Systems (1540)",Personal Computer,http://www.amazon.com/dp/B00GEBVEI6/,3,1
Brunswick Thumb Sock,Sports,http://www.amazon.com/dp/B00GGGNJ6E/,1,1
Eastvita Full 1080p 720P HD Nintendo Wii To HDMI Converter Output 480i Upscaling Adapter,Personal Computer,http://www.amazon.com/dp/B00GRQAMJA/,4,1
Uxcell Foot Pedal Switch,Home Improvement,http://www.amazon.com/dp/B00GWFTCYW/,1,1
Outop 3 RCA Male Jack to 6 RCA Female Plug Splitter Audio Video Av Adapter Cable,CE,http://www.amazon.com/dp/B00HLV1KQO/,3,1
Super Smash Bros. Edition GameCube Controller,Video Games,http://www.amazon.com/dp/B00L3LQ4B4/,24,1
ChromaCast 2 Tier Adjustable Upright Guitar Stand,Musical Instruments,http://www.amazon.com/dp/B00L5QAPYO/,1,1
HORI Battle Pad for Wii U (Mario Version) with Turbo - Nintendo Wii U,Video Games,http://www.amazon.com/dp/B00ND0E5ZU/,36,1
Rosewill Mechanical Gaming Keyboard with Cherry MX Brown Switches (RK-9000V2 BR),Personal Computer,http://www.amazon.com/dp/B00S5E4LX0/,29,1
"Acuvar 50"" Inch Aluminum Camera Tripod and Universal Smartphone Mount",Photography,http://www.amazon.com/dp/B00SHJPMEU/,10,1
"AVerMedia Video Adapter, Component (YPbPr) to HDMI Output (ET113)",Personal Computer,http://www.amazon.com/dp/B00TQ6ZCF2/,2,1
"Linkcool Wii to HDMI 720P / 1080P HD Output Upscaling Converter 3.5mm Audio Video Output - Supports All Wii Display Modes,Convert Wii To HDMI",Wireless,http://www.amazon.com/dp/B00XKV0JCA/,2,1
Dell OptiPlex 790 SFF Desktop Intel Core i3-2120 3.3GHz 4GB DDR3 RAM 250GB HD DVD Windows 7 Professional 64-bit (Certified Refurbished),Personal Computer,http://www.amazon.com/dp/B00Y3SQRWA/,1,1
Acer Aspire E 15 E5-573G-79JP 15.6-inch Full HD Notebook - Charcoal Gray (Windows 10),Personal Computer,http://www.amazon.com/dp/B012IBOBLM/,5,1
XFUNY® Custom Metal Analog Thumbsticks Thumb Stick Joystick Replacement Cap Cover for PlayStation 3 Joystick PS3 Controller (Black),Wireless,http://www.amazon.com/dp/B0135NUBQQ/,1,1
XCSOURCE 5PCS IIC I2C Logic Level Converter Bi-Directional Module 5V to 3.3V TE291,CE,http://www.amazon.com/dp/B0148BLZGE/,2,1
DMiotech 0.3mm 35G 60/40 Rosin Core Tin Lead Roll Soldering Solder Wire,Home Improvement,http://www.amazon.com/dp/B015DLZOL0/,1,1
Manhattan Products 162579 Usb Audio Video Grabber,CE,http://www.amazon.com/dp/B015PQZC2O/,1,1
Crenova XPE460 LED Video Projector Home Projector with Free HDMI Support 1080P for Home Cinema Theater TV Laptop Game SD iPad iPhone Android Smartphone-White,Office Product,http://www.amazon.com/dp/B016XR7WA4/,2,1
Nintendo GameCube NGC Controller Conductive Silicone Button Pad Replacements,PC Accessory,http://www.amazon.com/dp/B017X83RYM/,1,1
"DIGIANT 50 Inch Aluminum Camera Phone Tripod+ Universal Tripod Smartphone Mount for Apple, iphone Samsung and Other Brands Smartphones+carrying bag",CE,http://www.amazon.com/dp/B018ICYNKY/,3,1
"ClearClick Video To Digital Converter - Capture Video From VCR's, VHS Tapes, Hi8, Camcorder, DVD, & Gaming Systems",CE,http://www.amazon.com/dp/B01AFBKSY6/,2,1
"HP Notebook 15-ay011nr 15.6-Inch Laptop (6th Gen Intel Core i5-6200U Processor, 8GB DDR3L SDRAM, 1TB HDD, Windows 10), Silver",Personal Computer,http://www.amazon.com/dp/B01CGGOZOM/,57,1
"Acer Aspire E5-575G-53VG  15.6-Inch Full HD Laptop (Intel Core i5, NVIDIA 940MX, 8GB DDR4, 256GB SSD, Windows 10)",Personal Computer,http://www.amazon.com/dp/B01DT4A2R4/,479,1
REDGO Video Audio VHS VCR USB Video Capture Card to DVD Converter Capture Card Adapter,Personal Computer,http://www.amazon.com/dp/B01E5ITE2W/,1,1
"ASUS 24-inch Full HD FreeSync Gaming Monitor [VG245H] 1080p, 1ms Rapid Response Time, 75Hz, Dual HDMI, Low Blue Light, Flicker Free Display with Pivot, Tilt and Swivel, ASUS EyeCare",Personal Computer,http://www.amazon.com/dp/B01JGYM5H6/,11,1
"Acer Aspire E 15 E5-575-33BM 15.6-Inch FHD Notebook (Intel Core i3-7100U 7th Generation , 4GB DDR4, 1TB 5400RPM HD, Intel HD Graphics 620, Windows 10 Home), Obsidian Black",Personal Computer,http://www.amazon.com/dp/B01K1IO3QW/,419,1
nScope,BISS,http://www.amazon.com/dp/B01KULLWB4/,1,1
Thumbsticks Analog Bullet Button Aluminum Custom Metal Playstation 4 DualShock 4 Replacement PS4 Joystick Thumb Sticks Buttons Hats Spare Parts Accessories Modded PS4 Controllers Bullet Silver,Video Games,http://www.amazon.com/dp/B01KZKWKAW/,1,1
"Acer Aspire E 15, 7th Gen Intel Core i7, GeForce 940MX, 15.6” Full HD, 8GB DDR4, 256GB SSD, Win 10, E5-575G-75MD",Personal Computer,http://www.amazon.com/dp/B01LD4MGR6/,7,1
"Acer Aspire E 15 E5-575G-57D4 15.6-Inches Full HD Notebook (7th Gen Intel Core i5-7200U, GeForce 940MX, 8GB DDR4 SDRAM, 256GB SSD, Windows 10 Home), Obsidian Black",Personal Computer,http://www.amazon.com/dp/B01LD4MGY4/,161,1
HDE GameCube Memory Card 512MB (8192 Blocks) for Nintendo GameCube or Wii (Clear),Video Games,http://www.amazon.com/dp/B01LWA474D/,1,1
"Fidget Spinner - Triune Spinner by Pocket Fidget - HIGH SPEED Si3N4 Ceramic Bearing, Fast EDC Fidget Toy for Increased Focus, Stress Relief, ADHD, Autism, and Anxiety.",Toy,http://www.amazon.com/dp/B01MSDI80W/,9,1
Zen and the Art of Motorcycle Maintenance: An Inquiry into Values,Book,http://www.amazon.com/dp/0060589469/,18,1
"For Arduino Nano V3.0, Elegoo Nano board CH340/ATmega328P without USB cable, compatible with Arduino Nano V3.0 (Nano x 3 without cable)",PC Accessory,http://www.amazon.com/dp/B0713XK923/,3,1
Blink: The Power of Thinking Without Thinking,Book,http://www.amazon.com/dp/0316010669/,13,1
"Thinking, Fast and Slow",Book,http://www.amazon.com/dp/0374275637/,4,1
Zen in the Art of Archery,Book,http://www.amazon.com/dp/0375705090/,1,1
The Six Pillars of Self-Esteem:  The Definitive Work on Self-Esteem by the Leading Pioneer in the Field,Book,http://www.amazon.com/dp/0553374397/,24,1
"The Mental Game of Poker: Proven Strategies for Improving Tilt Control, Confidence, Motivation, Coping with Variance, and More.",Book,http://www.amazon.com/dp/0615436137/,14,1
Unlimited Power : The New Science Of Personal Achievement,Book,http://www.amazon.com/dp/0684845776/,2,1
Tao of Jeet Kune Do: New Expanded Edition,Book,http://www.amazon.com/dp/0897502027/,5,1
Top Dog: The Science of Winning and Losing,Book,http://www.amazon.com/dp/1455515140/,2,1
You Can't Do That Here! This Is The BBC!: Or one man's odyssey around the fringes of radio broadcasting,Book,http://www.amazon.com/dp/1523764678/,1,1
Nintendo GameCube dedicated controller emerald blue,Video Games,http://www.amazon.com/dp/B00007IRC5/,1,1
GameCube Controller - Spice Orange,Video Games,http://www.amazon.com/dp/B0000E5U6J/,1,1
