name,category,amazon_link,total_mentions,subreddit_mentions
Star Wars: The Force Awakens Incredible Cross-Sections,Books,https://www.amazon.com/Star-Wars-Awakens-Incredible-Sections/dp/1465438157/ref=sr_1_14?s=books&amp;ie=UTF8&amp;qid=1441998598&amp;sr=1-14,6,1
The Art of Star Wars: The Force Awakens,Books,https://www.amazon.com/Art-Star-Wars-Force-Awakens/dp/1419717804/ref=sr_1_1?ie=UTF8&amp;qid=1449956522&amp;sr=8-1&amp;keywords=the+art+of+the+force+awakens,5,1
Star Wars: The Force Awakens The Visual Dictionary,Books,https://www.amazon.com/Star-Wars-Awakens-Visual-Dictionary/dp/1465438165/ref=sr_1_7?s=books&amp;ie=UTF8&amp;qid=1441998689&amp;sr=1-7,5,1
Before the Awakening (Star Wars),Books,https://www.amazon.com/Star-Wars-Awakens-Character-Anthology/dp/148472822X/ref=sr_1_17?s=books&amp;ie=UTF8&amp;qid=1441998598&amp;sr=1-17,4,1
The Star Wars,Books,https://www.amazon.com/Star-Wars-JW-Rinzler/dp/1616554258,2,1
Star Wars The Force Awakens 3.75-Inch Figure 2-Pack Snow Mission R2-D2 and C-3PO,Toys & Games,https://www.amazon.com/Star-Wars-Awakens-3-75-Inch-Mission/dp/B00SD8IOOK,1,1
