name,category,amazon_link,total_mentions,subreddit_mentions
Stargate SG-1: The Complete Series + The Ark of Truth + Continuum Bundle,DVD,http://www.amazon.com/dp/B01578RC3C/,2,1
SG-1 Patch Logo Embroidered Baseball Cap - Black,Apparel,http://www.amazon.com/dp/B008P8HVVA/,1,1
Jacobs Cookie Jaffa Cake,Grocery,http://www.amazon.com/dp/B001N9FICC/,1,1
"Wiley X Airrage Sunglasses, Polarized Silver Flash, Crystal Metallic",Sports,http://www.amazon.com/dp/B0014WKI4G/,1,1
Stargate Atlantis: Homecoming: SGA-16,Book,http://www.amazon.com/dp/1905586507/,1,1
"BZseed Head Up Display, Car HUD Phone GPS Navigation Image Reflector, Cell phone Holder Mount, Universal Smart Mobile Cell phone Holder Mount - Black",Car Audio or Theater,http://www.amazon.com/dp/B01DJXD4HK/,1,1
"Wiley X XL-1 Advanced Sunglasses, Smoke Grey, Matte Black",Single Detail Page Misc,http://www.amazon.com/dp/B000CBLDO4/,1,1
belgium p-90 automatic airsoft gun(Airsoft Gun),Sports,http://www.amazon.com/dp/B003Y79ENA/,1,1
Stargate Atlantis: The Complete Series [Blu-ray],DVD,http://www.amazon.com/dp/B004WJT5H4/,1,1
