name,category,amazon_link,total_mentions,subreddit_mentions
Bearllionaire: Paranormal BBW Bear Shifter Romance Standalone (Bearstone Park Book 1),eBooks,http://www.amazon.com/dp/B00S5U8OBE/,,1
BAFX Products 34t5 Bluetooth OBDII Scan Tool for Android Devices,Automotive Parts and Accessories,http://www.amazon.com/dp/B005NLQAHS/,28,1
Magic Shaving Powder Gold 5 Ounce Fragrant (145ml),Health and Beauty,http://www.amazon.com/dp/B0048ZIFA0/,8,1
"Clarks Men's Bushacre 2 Desert Boot,Beeswax Leather,10 M US",Shoes,http://www.amazon.com/dp/B004DCNN64/,5,1
Orientalism,Book,http://www.amazon.com/dp/039474067X/,5,1
Black smokebuddy Jr Personal Air Filter,Home,http://www.amazon.com/dp/B009V16BM0/,5,1
"Fidget Spinner - Triune Spinner by Pocket Fidget - HIGH SPEED Si3N4 Ceramic Bearing, Fast EDC Fidget Toy for Increased Focus, Stress Relief, ADHD, Autism, and Anxiety.",Toy,http://www.amazon.com/dp/B01MSDI80W/,4,1
"SweetGourmet Arcor Strawberry Buds Bon Bon Filled Hard Candy, 2Lb",Grocery,http://www.amazon.com/dp/B004QLOFN2/,4,1
The Point of View of the Universe: Sidgwick and Contemporary Ethics,Book,http://www.amazon.com/dp/0199603693/,3,1
"adidas Originals Men's Shoes | Stan Smith Vulc, White/White/Green, (9.5 M US)",Shoes,http://www.amazon.com/dp/B019G2WUGE/,2,1
"Oliasports Fidget Cube Relieves Stress & Anxiety, Black",Toy,http://www.amazon.com/dp/B01N3UN0QE/,2,1
"NOW Psyllium Husks Whole, 24-Ounce",Grocery,http://www.amazon.com/dp/B000OSSUP0/,2,1
Eucerin Redness Relief Day Lotion Broad Spectrum SPF 15 1.7 Fluid Ounce,Beauty,http://www.amazon.com/dp/B000P1S0N8/,2,1
"Samsung Galaxy S5 Glass Screen Protector, Tech Armor Premium Ballistic Glass [1-pack]",Wireless,http://www.amazon.com/dp/B00IGISUTG/,1,1
"Astell & Kern High-Resolution Music Player AK380, 256GB (Copper)",Speakers,http://www.amazon.com/dp/B01AUVJ1HG/,1,1
"LE3NO Womens Lightweight Cotton Military Anorak Jacket with Hoodie,Olive, Small",Apparel,http://www.amazon.com/dp/B016X3BZME/,1,1
iClever ICF40 Auto-Scan Wireless FM Transmitter Radio Car Kit with 3.5mm Audio Plug USB Car Charger,Wireless,http://www.amazon.com/dp/B00NXE4N4Y/,1,1
VS-2000 livestock cattle hog and sheep scale,Pet Products,http://www.amazon.com/dp/B00PHQSNJ2/,1,1
Solar Face Shield - Pink Full Face Sun Protection UPF 50 Post Peel Face Protector Sun Shield (7 inches),Apparel,http://www.amazon.com/dp/B00GGMWEHS/,1,1
Casio MTP-V005L-1A Men's Black Leather Dress Watch Black Dial,Watch,http://www.amazon.com/dp/B00X4U31GS/,1,1
"Salomon Men's Speedcross 3 Running Shoe,Black/Light Green/Cane,10 M US",Shoes,http://www.amazon.com/dp/B0054TJLXY/,1,1
Rio 500 64 MB USB MP3 Player (Gray),Speakers,http://www.amazon.com/dp/B00000JSGF/,1,1
The Good Old Days: They Were Terrible!,Book,http://www.amazon.com/dp/0394709411/,1,1
"Dove Men+Care 2 in 1 Shampoo and Conditioner, Fresh and Clean 12 Ounce",Beauty & Personal Care,https://www.amazon.com/Dove-Shampoo-Conditioner-Fresh-Clean/dp/B00AAJTDLI,1,1
Wirst Watch Sundial Compass with Leather Strap. C-3117-A,Lawn & Patio,http://www.amazon.com/dp/B00L7VAL0U/,1,1
City Hunter C104 Pineapple Cotton Baseball Cap Multi Colors (Black),Apparel,http://www.amazon.com/dp/B01GQU0NJU/,1,1
BMW Motorsports Puma Team Tee Shirt,Sports,http://www.amazon.com/dp/B01N22MV8G/,1,1
The Sources of Normativity,Book,http://www.amazon.com/dp/052155960X/,1,1
Junta Deluxe (Pollock Version) by Phish,Music,http://www.amazon.com/dp/B007VSZEVO/,1,1
VIVA OFFICE High Back Bonded Leather Recliner Office Chair with Footrest,Furniture,http://www.amazon.com/dp/B01AT3UVOM/,1,1
"Value, Reality, and Desire",Book,http://www.amazon.com/dp/0199562385/,1,1
