name,category,amazon_link,total_mentions,subreddit_mentions
Dan Rooney: My 75 Years with the Pittsburgh Steelers and the NFL,Book,http://www.amazon.com/dp/0306817454/,2,1
Always a Home Game: Our Journey Through Steelers Country in 140 Days,Book,http://www.amazon.com/dp/0989268829/,1,1
"Their Life's Work: The Brotherhood of the 1970s Pittsburgh Steelers, Then and Now",Book,http://www.amazon.com/dp/1451691629/,1,1
"The Ones Who Hit the Hardest: The Steelers, the Cowboys, the '70s, and the Fight for America's Soul",Book,http://www.amazon.com/dp/1592406653/,1,1
Pittsburgh Steelers: The Complete History,DVD,http://www.amazon.com/dp/B0009NSCSU/,1,1
"303 (30306) Marine UV Protectant Spray for Vinyl, Plastic, Rubber, Fiberglass, Leather & More – Dust and Dirt Repellant - Non-Toxic, Matte Finish, 32 fl. Oz",Automotive Parts and Accessories,http://www.amazon.com/dp/B000XBCURW/,21,1
NFL Greatest Games Series: Pittsburgh Steelers Super Bowls,DVD,http://www.amazon.com/dp/B001BGS176/,1,1
Grabber 7+ Hour Hand Warmers - 40 Pair Box,Sports,http://www.amazon.com/dp/B001G7QECY/,2,1
Ruanaidh: The Story of Art Rooney and His Clan,Book,http://www.amazon.com/dp/B001G900FO/,1,1
NFL: America's Game - Pittsburgh Steelers: The Story of Six Championships,DVD,http://www.amazon.com/dp/B002BIULOO/,1,1
Johnny U: The Life and Times of John Unitas,eBooks,http://www.amazon.com/dp/B003FCVFV8/,1,1
Pittsburgh Steelers Car Truck SUV Front Windshield Sunshade - Accordion Style,Automotive Parts and Accessories,http://www.amazon.com/dp/B005OC27R8/,1,1
Pittsburgh Steelers Busy Block Ugly Sweater Large,Sports,http://www.amazon.com/dp/B00JSLLO0W/,1,1
Stance Men's Run TMC Golden State Warriors Crew Socks,Apparel,http://www.amazon.com/dp/B00KX733C2/,1,1
"NFL Cleveland Browns Johnny Manziel Player Plush Doll, 6.5-Inch x 3.5-Inch x 10-Inch, Brown",Sports,http://www.amazon.com/dp/B00MFH6TA6/,1,1
Le'veon Bell Signed Custom Football Jersey Auto PSA/ DNA White,Collectibles,http://www.amazon.com/dp/B00ZBDXKTE/,1,1
Competition (#1483) Big Bird Visits the Neighborhood,TV Series Episode Video on Demand,http://www.amazon.com/dp/B01A7L35E4/,1,1
Born a Crime: Stories from a South African Childhood,eBooks,http://www.amazon.com/dp/B01DHWACVY/,1,1
"NFL Pittsburgh Steelers The League Classic 9Forty Adjustable Cap, One Size, Black",Sports,http://www.amazon.com/dp/B01LCAJ5W0/,1,1
STEELERS PATCH DAN ROONEY MEMORIAL PATCH,Sports,http://www.amazon.com/dp/B074FQ7MCT/,1,1
