name,category,amazon_link,total_mentions,subreddit_mentions
Stellaris: Infinite Frontiers,Book,http://www.amazon.com/dp/9187687607/,3,3
"In the Balance: An Alternate History of the Second World War (Worldwar, Volume 1)",Book,http://www.amazon.com/dp/0345388526/,3,1
Pandora's Star (The Commonwealth Saga),Book,http://www.amazon.com/dp/0345479211/,4,1
First Cycle,Book,http://www.amazon.com/dp/0441239196/,1,1
"The Forever War, Vol. 1: Private Mandella",Book,http://www.amazon.com/dp/0918348951/,1,1
Putin's Kleptocracy: Who Owns Russia?,Book,http://www.amazon.com/dp/1476795207/,6,1
Gaunt's Ghosts: The Founding,Book,http://www.amazon.com/dp/1844163695/,8,1
Xenos (Eisenhorn),Book,http://www.amazon.com/dp/1849708738/,3,1
AcuRite 13003 7-Inch Digital Alarm Clock,Home,http://www.amazon.com/dp/B0000C0XPQ/,3,1
The Dreaming Void (Commonwealth - The Void Trilogy Book 1),eBooks,http://www.amazon.com/dp/B000UZJQLE/,2,1
"Through Struggle, the Stars (The Human Reach Book 1)",eBooks,http://www.amazon.com/dp/B005FGNLDM/,1,1
"HAVIT HV-F2056 15.6""-17"" Laptop Cooler Cooling Pad - Slim Portable USB Powered (3 Fans)",PC Accessory,http://www.amazon.com/dp/B00NNMB3KS/,16,1
Taken by the Pterodactyl (Dinosaur Erotica),eBooks,http://www.amazon.com/dp/B00NP1NNR8/,3,1
Samsung S34E790C - 34-Inch Curved WQHD Cinema Wide (3440 x 1440) Professional LED Monitor,Personal Computer,http://www.amazon.com/dp/B00Q7VCSGU/,12,1
Space Raptor Butt Invasion,eBooks,http://www.amazon.com/dp/B00S4B95RQ/,26,1
"ASUS K501UX 15.6-inch Gaming Laptop (Intel Core i7 Processor, NVIDIA GTX 950M, 8GB RAM, 256GB SSD Hard Drive, Windows 10 (64 bit)), Black/Silver Metal",Personal Computer,http://www.amazon.com/dp/B0146DD02G/,71,1
"MSI GT72 Dominator Pro G-034 17.3"" EXTREME GAMING LAPTOP GTX 980M i7-6700HQ 24GB 256GB M.2 SATA + 1TB G-SYNC THUNDERBOLT",Personal Computer,http://www.amazon.com/dp/B0150PLSXC/,2,1
SilverStone Technology Mini-ITX Slim Small Form Factor Computer Case with Handle ML08B-H,Personal Computer,http://www.amazon.com/dp/B0161UXWRA/,6,1
Lord of Light,Book,http://www.amazon.com/dp/0060567236/,5,1
The Bridge: A Science Fiction Survival Story,eBooks,http://www.amazon.com/dp/B0711C45FC/,1,1
