name,category,amazon_link,total_mentions,subreddit_mentions
Mapping Decline: St. Louis and the Fate of the American City (Politics and Culture in Modern America),Book,http://www.amazon.com/dp/0812220943/,7,6
"60 Hikes Within 60 Miles: St. Louis: Including Sullivan, Potosi, and Farmington",Book,http://www.amazon.com/dp/0897328833/,7,6
"Don't Shoot: One Man, A Street Fellowship, and the End of Violence in Inner-City America",Book,http://www.amazon.com/dp/1608194140/,10,6
History of St. Louis Gangsters: a Chronology of Mob Activity on Both Sides of the River,Book,http://www.amazon.com/dp/0971340900/,2,2
Who Moved My Cheese?: An A-Mazing Way to Deal with Change in Your Work and in Your Life,eBooks,http://www.amazon.com/dp/B004CR6AM4/,5,2
Ghettoside: A True Story of Murder in America,Book,http://www.amazon.com/dp/0385529988/,3,1
Ghettoside: A True Story of Murder in America,Book,http://www.amazon.com/dp/0385529996/,6,1
A Rip in Heaven: A Memoir of Murder And Its Aftermath,Book,http://www.amazon.com/dp/0451210530/,1,1
RedDevil 4: A Novel,Book,http://www.amazon.com/dp/0765369125/,1,1
"The Black Swan: Second Edition: The Impact of the Highly Improbable: With a new section: ""On Robustness and Fragility"" (Incerto)",Book,http://www.amazon.com/dp/081297381X/,23,1
"The St. Louis Veiled Prophet Celebration: Power on Parade, 1877-1995",Book,http://www.amazon.com/dp/0826212670/,1,1
The Streets of St. Louis,Book,http://www.amazon.com/dp/0963144863/,1,1
Lost Caves of St. Louis,Book,http://www.amazon.com/dp/0963144871/,1,1
Streets and Streetcars of St. Louis: A Sentimental Journey,Book,http://www.amazon.com/dp/0964727935/,1,1
"The Steamer Admiral and Streckfus Steamers, A Personal View",Book,http://www.amazon.com/dp/0980200253/,1,1
Modernist Cuisine at Home,Book,http://www.amazon.com/dp/0982761015/,7,1
Admiral Glorious Mississippi Excursions A HIstory,Book,http://www.amazon.com/dp/0984150323/,1,1
Ferghanistan: The War on Police,Book,http://www.amazon.com/dp/0996959106/,1,1
Critical Thinking Skills For Dummies,Book,http://www.amazon.com/dp/111892472X/,7,1
Weird Missouri: Your Travel Guide to Missouri's Local Legends and Best Kept Secrets,Book,http://www.amazon.com/dp/1402745559/,1,1
"Click, Clack, Moo: Cows That Type (A Click, Clack Book)",Book,http://www.amazon.com/dp/1442408898/,3,1
The Missionary Position: Mother Teresa in Theory and Practice,Book,http://www.amazon.com/dp/1455523003/,25,1
Goodnight St. Louis,Book,http://www.amazon.com/dp/146021580X/,1,1
The Precariat: The New Dangerous Class,Book,http://www.amazon.com/dp/1472536169/,8,1
Chronicle of the Mound Builders,Book,http://www.amazon.com/dp/1479206652/,1,1
The Steamer Admiral,Book,http://www.amazon.com/dp/1540215369/,1,1
For a Christian America: A History of the Religious Right,Book,http://www.amazon.com/dp/1573929735/,1,1
"Secret St. Louis: A Guide to the Weird, Wonderful, and Obscure",Book,http://www.amazon.com/dp/1681060396/,1,1
"Lion of the Valley: St. Louis, Missouri, 1764-1980",Book,http://www.amazon.com/dp/1883982251/,1,1
Missouri's Wild Mushrooms,Book,http://www.amazon.com/dp/1887247742/,1,1
"Finally! A Locally Produced Guidebook to St. Louis By and For St. Louisans, Neighborhood by Neighborhood, Second Edition-Revised, Updated, and Spring-Cleaned!",Book,http://www.amazon.com/dp/1935806696/,1,1
The Saint  Louisans: A Novel,Book,http://www.amazon.com/dp/1940442036/,1,1
P3 P4400 Kill A Watt Electricity Usage Monitor,Home Improvement,http://www.amazon.com/dp/B00009MDBU/,153,1
GE Personal Security Door Stop Alarm,Home Improvement,http://www.amazon.com/dp/B0000YNR4M/,9,1
Adjustable Captain Hats-Navy,Apparel,http://www.amazon.com/dp/B0002RIKFS/,1,1
"Hopkins 532 Mallory 26"" Snow Brush with Foam Grip (Colors may vary)",Automotive Parts and Accessories,http://www.amazon.com/dp/B000BPLNXC/,10,1
Omron Fat Loss Monitor,Health and Beauty,http://www.amazon.com/dp/B000FYZMYK/,42,1
"HDPE (High Density Polyethylene) Sheet, Opaque Off-White, Standard Tolerance, ASTM D4976-245, 0.375"" Thickness, 12"" Width, 24"" Length",BISS,http://www.amazon.com/dp/B000ILLNZC/,1,1
Songs from the River Lounge 2000 - 2004,Music,http://www.amazon.com/dp/B000PH2G78/,1,1
"Armour Etch Cream, 10-Ounce",Art and Craft Supply,http://www.amazon.com/dp/B001BE3UM4/,8,1
"WillPowder Sodium Citrate, 16-Ounce Jar",Grocery,http://www.amazon.com/dp/B00250Y9Y6/,15,1
Bamboo Travel Utensils - To-Go Ware Utensil Set with Carrying Case (Avocado),Kitchen,http://www.amazon.com/dp/B002BFUPUM/,2,1
Off the Books: The Underground Economy of the Urban Poor,eBooks,http://www.amazon.com/dp/B002PY78F4/,1,1
Kensington 4ft/ 1.2m Nylon Braided Premium 3.5mm Auxiliary Audio Cable - Black (K39202US),Wireless,http://www.amazon.com/dp/B0031U1ATG/,3,1
"Chippewa Men's 6"" Rugged Handcrafted Lace-Up Boot",Shoes,http://www.amazon.com/dp/B0036VN958/,29,1
Talstar Pro 96 ounce (3/4 gallon) jug,Lawn & Patio,http://www.amazon.com/dp/B00409QKRY/,8,1
Cavender's All Purpose Greek Seasoning - 8 oz,Grocery,http://www.amazon.com/dp/B004H81QOA/,2,1
"Truper 30255 21-Inch Steel Handle Bow Saw, Cam Lever Quick Change Blade Release, Orange",Lawn & Patio,http://www.amazon.com/dp/B0052X7XV4/,2,1
Grand Trunk TreeSlings - Hanging Kit,Sports,http://www.amazon.com/dp/B009NK0P9O/,1,1
Winegard FlatWave Amped FL5500A Digital HD Indoor Amplified TV Antenna (4K Ready / ATSC 3.0 Ready /   High-VHF / UHF / Ultra-Thin / Black and White - Reversible / USB Power Supply) - 50 Mile Long Range OTA   Antenna,Speakers,http://www.amazon.com/dp/B00BN5Z2WM/,9,1
GQ GMC-300E-Plus Digital Geiger Counter Nuclear Radiation Detector Monitor Meter dosimeter Beta Gamma X ray data logger recorder realtime monitoring test equipment,BISS,http://www.amazon.com/dp/B00IN8TJYY/,7,1
Next by Danco 10718X Perfect Seal Toilet Wax Ring,Home Improvement,http://www.amazon.com/dp/B00KHSLV2G/,1,1
D-Link DCH-S150 mydlink Wi-Fi Smart Motion Sensor,Photography,http://www.amazon.com/dp/B00KZHP102/,4,1
"1byone Wireless Home Security Driveway Alarm, 1 Battery-operated / AC Adapter Receiver and 2 PIR Motion Sensor Detector Weatherproof Patrol Infrared Alert System Kit",Home Improvement,http://www.amazon.com/dp/B00RCW8QS2/,5,1
"HDTV Antenna, 1byone Indoor Amplified TV Antenna 50 Mile Range with Creative Adjustable Amplifier Booster, USB Power Supply and Longer 20FT High Performance Coaxial Cable-Shiny White Antenna",Speakers,http://www.amazon.com/dp/B00RFLXE0A/,14,1
"Freddie Lee's Ghetto Sauce Mild Quart Case, 12/32 oz Jars",Grocery,http://www.amazon.com/dp/B017XP8YXY/,1,1
"GS90C Car DVR Dash Cam Black Box Camera Recorder Super Full HD 1296P Ambarella A7LA70 2.7"" LCD 170 Wide Angle Lens HDR Night Vision G-Sensor GPS logger ADAS 2 Extra Mounts",Car Audio or Theater,http://www.amazon.com/dp/B019DAG5Z6/,1,1
Eclipse Glasses for the 2017 Sea to Shining Sea Eclipse (5 Pack) - CE & ISO Certified - Includes Commemorative Poster - Made in USA,Home Improvement,http://www.amazon.com/dp/B01B3PRCUG/,2,1
"A-ZONE 4 Channel 1080P AHD Home Security Cameras System W/ 4x HD 1.3MP waterproof Night vision Indoor/Outdoor CCTV surveillance Camera, Quick Remote Access Setup Free App, Including 2TB HDD",Photography,http://www.amazon.com/dp/B01GH665PY/,1,1
"Celestron ISO Certified, 2017 North American Total Solar Eclipse EclipSmart Solar Shades Observing Kit, Black (44405)",Photography,http://www.amazon.com/dp/B01N17N0MO/,1,1
5-Pack Premium ISO and CE Certified Lunt Solar Eclipse Glasses,Home Improvement,http://www.amazon.com/dp/B01NB09NHK/,10,1
Allen Carr's Easy Way to Enjoy Flying,Book,http://www.amazon.com/dp/0140278370/,1,1
WD Purple 3TB Surveillance Hard Disk Drive - 5400 RPM Class SATA 6 Gb/s 64MB Cache 3.5 Inch - WD30PURZ,Personal Computer,http://www.amazon.com/dp/B0718XQQJ9/,1,1
American Bottom Archaeology: A Summary of the FAI-270 Project Contribution to the Culture History of the Mississippi River Valley,Book,http://www.amazon.com/dp/0252011112/,1,1
The Gateway Arch: A Biography (Icons of America),Book,http://www.amazon.com/dp/0300205686/,1,1
Traffic: Why We Drive the Way We Do (and What It Says About Us),Book,http://www.amazon.com/dp/0307277194/,32,1
The Slide: A Novel,Book,http://www.amazon.com/dp/0385341857/,1,1
