name,category,amazon_link,total_mentions,subreddit_mentions
Star Trek Online Timecard - PC,Video Games,http://www.amazon.com/dp/B002X92W8E/,5,4
Star Trek Online: The Needs of the Many,eBooks,http://www.amazon.com/dp/B003CTEFHK/,2,2
A Stitch in Time (Star Trek: Deep Space Nine Book 27),eBooks,http://www.amazon.com/dp/B000FC0UXU/,9,1
Metro ED500 DataVac 500-Watt 120 volt 0.75-HP Electric Blower Duster,Home Improvement,http://www.amazon.com/dp/B001J4ZOAW/,256,1
"Winsome Wood Alden Lap Desk, Flip Top with Drawer, Foldable Legs",Furniture,http://www.amazon.com/dp/B0046EC19Y/,2,1
Department of Temporal Investigations: Watching the Clock (Star Trek: Department of Temporal Investigations S Book 1),eBooks,http://www.amazon.com/dp/B004INHDBO/,1,1
Department of Temporal Investigations: Forgotten History (Star Trek: Department of Temporal Investigations Series Book 2),eBooks,http://www.amazon.com/dp/B005GG0KLM/,1,1
"Logitech G600 MMO Gaming Mouse, RGB Backlit, 20 Programmable Buttons",Personal Computer,http://www.amazon.com/dp/B0086UK7IQ/,79,1
Diamond Select Toys Star Trek: Electronic Klingon Bird of Prey Ship,Toy,http://www.amazon.com/dp/B0086URM5M/,1,1
CSS IS AWESOME Coffee Tea Mug Cup - 11 ounces,Kitchen,http://www.amazon.com/dp/B008LQQD7O/,2,1
Logitech G700s 910-003584 Rechargeable Gaming Mouse,Personal Computer,http://www.amazon.com/dp/B00BFOEY3Y/,39,1
"Logitech G502 Proteus Core Tunable Gaming Mouse with Fully Customizable Surface, Weight and Balance Tuning",Personal Computer,http://www.amazon.com/dp/B00IRHE892/,105,1
Star Trek: The Next Generation Future USS Enterprise Ncc-1701-D Model (All Good Things) Die-cast Starship Collection by Star Trek The Next Generation TNG by Star Trek,Toy,http://www.amazon.com/dp/B00J43VVKC/,1,1
Department of Temporal Investigations: The Collectors (Star Trek: Deep Space Nine),eBooks,http://www.amazon.com/dp/B00JSRQV54/,1,1
"Dell 15.6-Inch Gaming Laptop (6th Gen Intel Quad-Core i5-6300HQ Processor up to 3.2GHz, 8GB DDR3, 256GB SSD, Nvidia GeForce GTX 960M, Windows 10)",Personal Computer,http://www.amazon.com/dp/B015PYYDMQ/,799,1
This One's from the Heart,Music,http://www.amazon.com/dp/B00000JZ0Z/,2,1
"Acer Aspire E 15 E5-575G-57D4 15.6-Inches Full HD Notebook (7th Gen Intel Core i5-7200U, GeForce 940MX, 8GB DDR4 SDRAM, 256GB SSD, Windows 10 Home), Obsidian Black",Personal Computer,http://www.amazon.com/dp/B01LD4MGY4/,161,1
Tom Paris Mutated,Toy,http://www.amazon.com/dp/B0006ZJ7QM/,7,1
