name,category,amazon_link,total_mentions,subreddit_mentions
Understanding and Controlling Stuttering A Comprehensive New Approach Based on the Valsalva Hypothesis - The Revised and Expanded 3rd Edition,Book,http://www.amazon.com/dp/1929773242/,3,3
Self-Therapy for the Stutterer,Book,http://www.amazon.com/dp/0933388454/,2,2
Stuttering: A Life Bound Up In Words,Book,http://www.amazon.com/dp/0465081274/,1,1
Out With It: How Stuttering Helped Me Find My Voice,Book,http://www.amazon.com/dp/145167659X/,1,1
I Have a Voice: How to Stop Stuttering,Book,http://www.amazon.com/dp/1845907272/,1,1
Stuttering: A Self-Help Guide,eBooks,http://www.amazon.com/dp/B0017J6XIQ/,1,1
Excedrin Migraine 300 Coated Caplets,Health and Beauty,http://www.amazon.com/dp/B009VQT53M/,1,1
A Guide to the Good Life: The Ancient Art of Stoic Joy,Book,http://www.amazon.com/dp/0195374614/,72,1
From Stuttering to Fluency: Manage Your Emotions and Live More Fully,eBooks,http://www.amazon.com/dp/B00GTHXQQ8/,1,1
"The Drama of the Gifted Child: The Search for the True Self, Revised Edition",Book,http://www.amazon.com/dp/0465016901/,17,1
