name,category,amazon_link,total_mentions,subreddit_mentions
Wool,Book,http://www.amazon.com/dp/1476733953/,38,20
Wool Omnibus Edition [Kindle in Motion] (Silo series Book 1),eBooks,http://www.amazon.com/dp/B0071XO8RA/,53,15
The First Fifteen Lives of Harry August,eBooks,http://www.amazon.com/dp/B00ECE9OD4/,22,15
The Whirlwind in the Thorn Tree (The Outlaw King Book 1),eBooks,http://www.amazon.com/dp/B00BJCLMFU/,40,14
Do Not Resuscitate,Book,http://www.amazon.com/dp/099082473X/,17,14
I Am Pilgrim: A Thriller,Book,http://www.amazon.com/dp/1439177732/,13,12
Half a King (Shattered Sea Book 1),eBooks,http://www.amazon.com/dp/B00HBQWGYO/,12,10
Half a King (Shattered Sea),Book,http://www.amazon.com/dp/0804178410/,14,10
Prince of Thorns (The Broken Empire Book 1),eBooks,http://www.amazon.com/dp/B0052RERW8/,15,10
Endurance: Shackleton's Incredible Voyage,Book,http://www.amazon.com/dp/0465062881/,23,10
I Am Pilgrim: A Thriller,Book,http://www.amazon.com/dp/1501119451/,10,9
The City & The City,eBooks,http://www.amazon.com/dp/B001NLKYQ0/,8,8
Red Rising,Book,http://www.amazon.com/dp/034553980X/,18,8
Carrion Comfort: A Novel,Book,http://www.amazon.com/dp/0312567073/,9,8
"The Devil in the White City: Murder, Magic, and Madness at the Fair That Changed America",Book,http://www.amazon.com/dp/0375725601/,36,7
Terms of Enlistment (Frontlines Book 1),eBooks,http://www.amazon.com/dp/B00CIXX144/,12,7
The Traitor Baru Cormorant (The Masquerade),eBooks,http://www.amazon.com/dp/B00V351EOM/,9,6
Angelmaker (Vintage Contemporaries),Book,http://www.amazon.com/dp/0307743624/,6,6
Carrion Comfort: A Novel,eBooks,http://www.amazon.com/dp/B00305CYHE/,6,6
The Remaining,Book,http://www.amazon.com/dp/0316404152/,8,6
Best Served Cold,Book,http://www.amazon.com/dp/0316198358/,10,6
Handbook to Higher Consciousness,Book,http://www.amazon.com/dp/0960068880/,9,6
Stories of Your Life and Others,eBooks,http://www.amazon.com/dp/B0048EKOP0/,17,6
To Say Nothing of the Dog,Book,http://www.amazon.com/dp/0553575384/,10,6
The Lies of Locke Lamora (Gentleman Bastards),Book,http://www.amazon.com/dp/055358894X/,20,6
Prince of Thorns  (The Broken Empire),Book,http://www.amazon.com/dp/1937007685/,16,6
The Peripheral,eBooks,http://www.amazon.com/dp/B00INIXKV2/,10,6
Generic Vampire Novel #937: Part One - American Sexy,eBooks,http://www.amazon.com/dp/B00OO7AWLW/,5,5
Kodoku: Sailing Alone Across the Pacific,eBooks,http://www.amazon.com/dp/B00HBU0AO8/,5,5
The Goblin Emperor,eBooks,http://www.amazon.com/dp/B00FO6NPIO/,11,5
"Red Rising (The Red Rising Series, Book 1)",eBooks,http://www.amazon.com/dp/B00CVS2J80/,8,5
The Name of the Wind,Book,http://www.amazon.com/dp/0756404746/,35,5
Blindsight,Book,http://www.amazon.com/dp/0765319640/,18,5
A Short History of Nearly Everything,Book,http://www.amazon.com/dp/076790818X/,48,5
Ready Player One,eBooks,http://www.amazon.com/dp/B004J4WKUQ/,17,5
Quicksilver (The Baroque Cycle No. 1),Book,http://www.amazon.com/dp/0060833165/,7,5
A Door Into Ocean (Elysium Cycle),Book,http://www.amazon.com/dp/0312876521/,7,5
"Lamb: The Gospel According to Biff, Christ's Childhood Pal",Book,http://www.amazon.com/dp/0380813815/,37,5
Sand Omnibus,eBooks,http://www.amazon.com/dp/B00HSXGYCK/,7,4
Tigerman: A novel (Vintage Contemporaries),eBooks,http://www.amazon.com/dp/B00I7695S2/,4,4
When HARLIE Was One: Release 2.0,eBooks,http://www.amazon.com/dp/B00HSSCFOG/,7,4
The Remaining,eBooks,http://www.amazon.com/dp/B00H25FGBO/,6,4
"Blood Song (A Raven's Shadow Novel, Book 1)",eBooks,http://www.amazon.com/dp/B00ABKGG0C/,19,4
The Black Prism (Lightbringer),Book,http://www.amazon.com/dp/0316246271/,8,4
The First Fifteen Lives of Harry August,Book,http://www.amazon.com/dp/0316399620/,11,4
The Goblin Emperor,Book,http://www.amazon.com/dp/0765365685/,8,4
Old Man's War,Book,http://www.amazon.com/dp/0765348276/,16,4
The Way of Kings,Book,http://www.amazon.com/dp/0765365278/,22,4
Mrs. Piggle-Wiggle,Book,http://www.amazon.com/dp/0064401480/,5,4
Gates of Fire: An Epic Novel of the Battle of Thermopylae,Book,http://www.amazon.com/dp/055338368X/,9,4
Stories of Your Life and Others,Book,http://www.amazon.com/dp/1931520720/,22,4
Wool - Part One (Silo series Book 1),eBooks,http://www.amazon.com/dp/B005FC52L0/,9,4
Ready Player One: A Novel,Book,http://www.amazon.com/dp/0307887448/,46,4
The 48 Laws of Power,Book,http://www.amazon.com/dp/0140280197/,33,4
Storm Front (Dresden Files),Book,http://www.amazon.com/dp/0451457811/,14,4
Do Not Resuscitate,eBooks,http://www.amazon.com/dp/B00VKSQFIC/,3,3
On My Way to Paradise,eBooks,http://www.amazon.com/dp/B00LTENBZC/,7,3
"Larkspur, or A Necromancer's Romance (The Larkspur Series vol. 1) (Stories of Clandestina)",eBooks,http://www.amazon.com/dp/B00J7H9JIG/,74,3
The Red: First Light (The Red Trilogy Book 1),eBooks,http://www.amazon.com/dp/B00O65X7ZU/,4,3
Wreck of the Gossamer (The Puzzle Box Chronicles Book 1),eBooks,http://www.amazon.com/dp/B01ACP32JI/,3,3
"The Elegant Universe: Superstrings, Hidden Dimensions, and the Quest for the Ultimate Theory",Book,http://www.amazon.com/dp/039333810X/,17,3
The Meaning of Night: A Confession,Book,http://www.amazon.com/dp/0393330346/,3,3
The Rise of Theodore Roosevelt (Modern Library Paperbacks),Book,http://www.amazon.com/dp/0375756787/,14,3
I Am Pilgrim: A Thriller,eBooks,http://www.amazon.com/dp/B00DPM90C4/,6,3
House of Blades (The Traveler's Gate Trilogy Book 1),eBooks,http://www.amazon.com/dp/B00D52X58Y/,36,3
House of Leaves,Book,http://www.amazon.com/dp/0375703764/,33,3
Angelmaker (Vintage Contemporaries),eBooks,http://www.amazon.com/dp/B005IQZ7IG/,4,3
Escape from Camp 14: One Man's Remarkable Odyssey from North Korea to Freedom in the West,eBooks,http://www.amazon.com/dp/B005GSZZ1A/,6,3
What Every BODY is Saying: An Ex-FBI Agent’s Guide to Speed-Reading People,Book,http://www.amazon.com/dp/0061438294/,42,3
Leviathan Wakes (The Expanse Book 1),eBooks,http://www.amazon.com/dp/B0047Y171G/,11,3
Best Served Cold (Set in the World of The First Law),eBooks,http://www.amazon.com/dp/B002GUK7JQ/,4,3
Ship of Theseus,Book,http://www.amazon.com/dp/0316201642/,13,3
"The Lies of Locke Lamora (Gentleman Bastards, Book 1)",eBooks,http://www.amazon.com/dp/B000JMKNJ2/,21,3
By Reason of Insanity (Rediscovered Classics),Book,http://www.amazon.com/dp/1556526628/,3,3
The Rook,Book,http://www.amazon.com/dp/0316098809/,9,3
High Fidelity,Book,http://www.amazon.com/dp/1573225517/,5,3
A Corpse in the Koryo: An Inspector O Novel (Inspector O Novels),Book,http://www.amazon.com/dp/0312374313/,4,3
The Stranger Beside Me,Book,http://www.amazon.com/dp/1416559590/,8,3
"Hyperbole and a Half: Unfortunate Situations, Flawed Coping Mechanisms, Mayhem, and Other Things That Happened",Book,http://www.amazon.com/dp/1451666179/,22,3
The Art Of War,Book,http://www.amazon.com/dp/1599869772/,9,3
"Unbroken: A World War II Story of Survival, Resilience, and Redemption",Book,http://www.amazon.com/dp/0812974492/,7,3
A Guide to the Good Life: The Ancient Art of Stoic Joy,Book,http://www.amazon.com/dp/0195374614/,72,3
Aztec,Book,http://www.amazon.com/dp/0765317508/,5,3
"The Serpent's Shadow (Elemental Masters, Book 1)",Book,http://www.amazon.com/dp/0756400619/,3,3
The Grace of Kings (The Dandelion Dynasty),Book,http://www.amazon.com/dp/1481424270/,4,3
Griffin & Sabine:  An Extraordinary Correspondence,Book,http://www.amazon.com/dp/0877017883/,6,3
How to Win Friends & Influence People,Book,http://www.amazon.com/dp/0671027034/,222,3
Illuminae (The Illuminae Files),Book,http://www.amazon.com/dp/0553499114/,3,3
Doomsday Book,Book,http://www.amazon.com/dp/0553562738/,5,3
The Society of Mind,Book,http://www.amazon.com/dp/0671657135/,6,3
The Magicians: A Novel (Magicians Trilogy),Book,http://www.amazon.com/dp/0452296293/,7,3
Collected Fictions,Book,http://www.amazon.com/dp/0140286802/,9,3
Mistborn: The Final Empire,eBooks,http://www.amazon.com/dp/B002GYI9C4/,17,3
Meditations (Dover Thrift Editions),Book,http://www.amazon.com/dp/048629823X/,22,3
Swan Song,Book,http://www.amazon.com/dp/0671741039/,4,3
"Arrows of the Queen ( The Heralds of Valdemar, Book 1)",Book,http://www.amazon.com/dp/0886773784/,4,3
The Turing Option: A Novel,Book,http://www.amazon.com/dp/0446515655/,4,2
Count Zero,Book,http://www.amazon.com/dp/0441117732/,3,2
The Devil You Know (Felix Castor (Paperback)),Book,http://www.amazon.com/dp/0446618705/,2,2
Pirate Latitudes,Book,http://www.amazon.com/dp/0061929387/,5,2
