name,category,amazon_link,total_mentions,subreddit_mentions
Supergirl Vol. 1: Last Daughter of Krypton (The New 52) (Supergirl (DC Comics)),Book,http://www.amazon.com/dp/1401236804/,7,2
Superman: Last Son of Krypton (Superman (DC Comics)),Book,http://www.amazon.com/dp/1401237797/,3,1
Supergirl: The Silver Age Omnibus Vol. 1,Book,http://www.amazon.com/dp/1401262465/,1,1
Superman: Lois and Clark,Book,http://www.amazon.com/dp/140126249X/,3,1
Superman: American Alien,Book,http://www.amazon.com/dp/1401262562/,80,1
Adventures of Supergirl Vol. 1,Book,http://www.amazon.com/dp/1401262651/,1,1
Daring New Adventures of Supergirl Vol. 1,Book,http://www.amazon.com/dp/1401263461/,3,1
Supergirl: Bizarrogirl,Book,http://www.amazon.com/dp/1401270123/,1,1
Daring New Adventures of Supergirl Vol. 2,Book,http://www.amazon.com/dp/1401271154/,2,1
Remote Control Vibrators Strap on Pussy Sex Toys for Women,Health and Beauty,http://www.amazon.com/dp/B00FBRWO42/,1,1
"Rubie's Costume Co Women's DC Superheroes Deluxe Supergirl Cape, Multi, One Size",Apparel,http://www.amazon.com/dp/B00TO6EIGS/,1,1
Supergirl: Season 1,TV Series Season Video on Demand,http://www.amazon.com/dp/B0155ON2WI/,1,1
Supergirl TV Series Statue,Toy,http://www.amazon.com/dp/B016YS259A/,1,1
"Supergirl - TV Show Poster / Print (Logo & Clouds) (Size: 24"" x 36"") (By POSTER STOP ONLINE)",Home,http://www.amazon.com/dp/B01CBTQAVA/,1,1
The Flash Vol. 1: The Dastardly Death of the Rogues: Brightest Day (Flash (DC Comics Unnumbered)),Book,http://www.amazon.com/dp/1401231950/,36,1
DC Super Hero Girls Supergirl Mini Figure,Toy,http://www.amazon.com/dp/B01IT3W4MG/,1,1
