name,category,amazon_link,total_mentions,subreddit_mentions
Daring New Adventures of Supergirl Vol. 1,Books,https://www.amazon.com/Daring-Adventures-Supergirl-Vol-1/dp/1401263461/,1,1
Supergirl: The Silver Age Omnibus Vol. 1,Books,https://www.amazon.com/Supergirl-Silver-Age-Omnibus-v1/dp/1401262465/,1,1
Superman: Lois and Clark,Books,https://www.amazon.com/Superman-Lois-Clark-Dan-Jurgens/dp/140126249X/,1,1
Daring New Adventures of Supergirl Vol. 2,Books,https://www.amazon.com/Daring-Adventures-Supergirl-Vol-2/dp/1401271154/,1,1
Remote Control Vibrators Strap on Pussy Sex Toys for Women,"Health, Household & Baby Care",https://www.amazon.com/Remote-Control-Vibrators-Strap-Pussy/dp/B00FBRWO42,1,1
Rubie's Costume Co Women's DC Superheroes Deluxe Supergirl Cape,"Clothing, Shoes & Jewelry",https://www.amazon.com/Rubies-Costume-Womens-Superheroes-Supergirl/dp/B00TO6EIGS/ref=sr_1_7?ie=UTF8&amp;qid=1499451205&amp;sr=8-7&amp;keywords=supergirl+robe,1,1
Supergirl Vol. 1: Last Daughter of Krypton (The New 52),Books,https://www.amazon.com/Supergirl-Vol-Last-Daughter-Krypton/dp/1401236804/,1,1
