name,category,amazon_link,total_mentions,subreddit_mentions
Principles of Marketing,Book,http://www.amazon.com/dp/0273786997/,1,1
"Epicurean Kitchen Series Utensils, Small Spoon, Nutmeg",Kitchen,http://www.amazon.com/dp/B002Z14FJY/,1,1
Brita 20 Ounce Sport Water Bottle with Filter - BPA Free - Blue,Kitchen,http://www.amazon.com/dp/B004GN8RDY/,8,1
The Age of Sustainable Development,eBooks,http://www.amazon.com/dp/B00S5CF2BW/,1,1
"purifyou Premium Reusable Mesh / Produce Bags, Set of 9 | Superior Double-Stitched Strength, with Tare Weight on Tags | Lightweight, See-Through, Large, Medium & Small",Kitchen,http://www.amazon.com/dp/B00XSHEJ90/,4,1
"Hefty Renew Recycled Plastic Tall Kitchen Drawstring Trash Bags (13-Gallon, 45-Count)",Health and Beauty,http://www.amazon.com/dp/B00ZR4TTG0/,1,1
"Seventh Generation Extra Strong Tall Kitchen Draw String Trash Bags, 50 Count",Health and Beauty,http://www.amazon.com/dp/B016Z9BJ0Y/,1,1
