name,category,amazon_link,total_mentions,subreddit_mentions
INK'D: The Tattoo Guessing Game,Toy,http://www.amazon.com/dp/B00VXTWP9Q/,2,2
The Seven Principles for Making Marriage Work: A Practical Guide from the Country's Foremost Relationship Expert,Book,http://www.amazon.com/dp/0609805797/,24,1
Girl Sex 101,Book,http://www.amazon.com/dp/0983830959/,14,1
The Four Agreements: A Practical Guide to Personal Freedom (A Toltec Wisdom Book),Book,http://www.amazon.com/dp/1878424319/,42,1
Carrageenan Gently Natural Personal Lubricant 3.4 Oz,Health and Beauty,http://www.amazon.com/dp/B0017QPOPW/,2,1
"NorthShore Champion, 35 x 47, 50 oz., Washable Underpad, X-Large, Each",Health and Beauty,http://www.amazon.com/dp/B001IN46NU/,17,1
Cleancut ES412 Personal Shaver,Beauty,http://www.amazon.com/dp/B001IZZX1C/,5,1
"Sliquid Organics Lubricant Oceanics with Carrageenan, nori & wakame  - 4.2 oz",Health and Beauty,http://www.amazon.com/dp/B004ODQJUE/,1,1
Sex and God: How Religion Distorts Sexuality,eBooks,http://www.amazon.com/dp/B0073WNSV6/,7,1
Sex and Punishment: Four Thousand Years of Judging Desire,eBooks,http://www.amazon.com/dp/B007VC29EK/,1,1
"NorthShore Champion, 36 x 60, 65 oz., Washable Underpad, 2X-Large, Each",Health and Beauty,http://www.amazon.com/dp/B007ZI98NK/,8,1
Tastees Tease Board Game,Health and Beauty,http://www.amazon.com/dp/B008JGNGGC/,1,1
3Aries Fashion Titanium Stainless Steel Black Lord-ring king's rings Power Men Ring Size 9,Jewelry,http://www.amazon.com/dp/B00CREM7KI/,1,1
Axe Philips Norelco XA2029/42 Body Groomer,Beauty,http://www.amazon.com/dp/B00D8LK5VM/,1,1
SLS,Mobile Application,http://www.amazon.com/dp/B00E6QGVQQ/,1,1
ION Block Rocker Bluetooth Portable Speaker System with Auxiliary USB Charger with extended 75 hour battery (Certified Refurbished),CE,http://www.amazon.com/dp/B00EOA7EMO/,2,1
WD 3TB My Cloud Personal Network Attached Storage - NAS - WDBCTL0030HWT-NESN,Personal Computer,http://www.amazon.com/dp/B00EVVGAC6/,3,1
"Shoes 18 Women's Foldable Portable Travel Ballet Flat Shoes w/ Matching Carrying Case (7/8, Black sh18-1)",Shoes,http://www.amazon.com/dp/B00KO3GU0M/,1,1
"Natural Personal Lubricant for Sensitive Skin - Water Based Moisturizer with Aloe Vera and Carrageenan - Paraben-free with Squeeze Tube Technology - USA Made By Maple Holistics, 4 OZ(118ml)",Health and Beauty,http://www.amazon.com/dp/B00P0A2UU8/,1,1
" Mens Large 30"" Inch Black Duffel Duffle Military Molle Tactical Cargo Gear Shoulder Bag ",Sports,http://www.amazon.com/dp/B00UV2XGMG/,1,1
"[Ultra Compact] Anker Compact Car Jump Starter and Portable Charger Power Bank with 400A Peak Current, Advanced Safety Protection and Built-In LED Flashlight",Automotive Parts and Accessories,http://www.amazon.com/dp/B010DP8PIU/,5,1
Stunning Heart Tattoos for Girls & Women - Temporary Tattoos Set,Toy,http://www.amazon.com/dp/B012LK6HBC/,1,1
"Queen.M Lace Sling Open Cup Floral Sexy Lingerie Lace Nighty,Black,Large",Apparel,http://www.amazon.com/dp/B01D4NP4W8/,1,1
"First Time Swingers: Swingers First Time, Wife Watching, Swinger Parties, Naughty Couples.",eBooks,http://www.amazon.com/dp/B01FGRWVK8/,1,1
"Sex at Dawn: How We Mate, Why We Stray, and What It Means for Modern Relationships",Book,http://www.amazon.com/dp/0061707813/,24,1
"SuteFoto S40 Handheld Camera Stabilizer 15.75""/40cm with Quick Release Plate 4/1'' and 3/8'' Screw Pro for Video Camera DV DSLR Nikon, Canon, Sony, Panasonic-up to 0.2-1.5kg/0.44-3.31Ib",Wireless,http://www.amazon.com/dp/B01LXI5DZ9/,2,1
