name,category,amazon_link,total_mentions,subreddit_mentions
Living and Working in Switzerland: A Survival Handbook,Book,http://www.amazon.com/dp/1909282634/,3,2
Transport for Suburbia: Beyond the Automobile Age,Book,http://www.amazon.com/dp/1844077403/,3,1
Assimil German with Ease - Learn German for English Speakers - Book+4CD's (German Edition),Book,http://www.amazon.com/dp/2700517504/,6,1
"Schwyzertüütsch: Praktische Sprachlehre des Schweizerdeutschen : ""Grüezi mitenand"" (German Edition)",Book,http://www.amazon.com/dp/3857010029/,1,1
Hoi: Your Swiss German survival guide,Book,http://www.amazon.com/dp/3905252139/,1,1
Swiss History in a Nutshell,Book,http://www.amazon.com/dp/3905252198/,1,1
"Knorr Aromat Seasoning, 3 Ounce (Pack of 12)",Grocery,http://www.amazon.com/dp/B000F3S6JY/,1,1
Hammer's German Grammar and Usage (German Edition),Book,http://www.amazon.com/dp/1444120166/,13,1
Wenger 16999 Swiss Army Knife Giant,Home Improvement,http://www.amazon.com/dp/B001DZTJRQ/,19,1
