name,category,amazon_link,total_mentions,subreddit_mentions
Sword Art Online Progressive 1 - light novel,Book,http://www.amazon.com/dp/0316259365/,15,12
Sword Art Online Progressive 2 - light novel,Book,http://www.amazon.com/dp/0316342173/,8,7
"Sword Art Online Progressive, Vol. 1 - manga",Book,http://www.amazon.com/dp/0316259373/,7,6
Sword Art Online 1: Aincrad,Book,http://www.amazon.com/dp/0316371246/,10,6
SAO Kirito Elucidator Replica Sword Art Online Version Two 41 Inches,Sports,http://www.amazon.com/dp/B00M5K433S/,6,6
"Sword Art Online Progressive, Vol. 2 - manga (Sword Art Online Progressive Manga)",Book,http://www.amazon.com/dp/0316383775/,5,4
"Sword Art Online Kirito Kirigaya Kazuto 41"" Dark Repulser Sword w/ Scabbard",Sports,http://www.amazon.com/dp/B00NO6C6CW/,3,3
Sword Art Online Progressive 3 - light novel,Book,http://www.amazon.com/dp/031634883X/,5,3
"Fairy Dance, Vol. 3 (Sword Art Online)",Book,http://www.amazon.com/dp/0316296422/,3,3
"Sword Art Online, Vol. 2: Aincrad",Book,http://www.amazon.com/dp/0316376817/,3,3
Sword Art Online Asuna Yuuki Lambient Light White Carbon Steel Replica Sword,Sports,http://www.amazon.com/dp/B00QHFETJA/,2,2
"Sword Art Online Progressive, Vol. 4 - manga (Sword Art Online Progressive Manga)",Book,http://www.amazon.com/dp/031631465X/,2,2
[Accel World] + [Sword Art Online] Drama CD,Toy,http://www.amazon.com/dp/B006WFLD3A/,1,1
Good Smile Sword Art Online: Kirito Nendoroid Action Figure,Toy,http://www.amazon.com/dp/B00AM4Y4RO/,1,1
Bushiroad Sleeve Collection HG Vol.455 - Sword Art Online [Yui],Toy,http://www.amazon.com/dp/B00ATL9OGQ/,1,1
Dream2reality Cosplay sword art online Asuna Lambent Light Medium Carbon Steel Sword,Sports,http://www.amazon.com/dp/B00C7AAQCS/,1,1
Dream2reality Cosplay sword art online Kirigaya Kazuto kirito Black - Dark Repulser Medium Carbon Steel Sword,Sports,http://www.amazon.com/dp/B00C7AAQT6/,1,1
"Furyu Sword Art Online S.A.O. 2 Lisbeth 6.5"" Action Figure",Toy,http://www.amazon.com/dp/B00CN97HPM/,1,1
"Great Eastern Entertainment Sword Art Online Group Shot Wall Scroll, 33 by 44-Inch",Home,http://www.amazon.com/dp/B00CPZ1LFQ/,1,1
"Great Eastern Entertainment Sword Art Online Kirito and Asuna Wall Scroll, 33 by 44-Inch",Home,http://www.amazon.com/dp/B00DM06WCU/,1,1
Sword Art Online Kirito Cosplay Costume L-Black,Apparel,http://www.amazon.com/dp/B00EZG3BOW/,1,1
SAO Kirito Cosplay Jacket Coat Costume Suit for Sword Art Online Uniform Version,Apparel,http://www.amazon.com/dp/B00GTBTWXA/,1,1
Sword Art Online Yui's Heart Necklace,Toy,http://www.amazon.com/dp/B00GTSGLPU/,1,1
Sword Art Online Asuna Yuuki Cosplay Costume Custom-made,Apparel,http://www.amazon.com/dp/B00HRMT50A/,1,1
"Sword Art Online SAO Kirito Asuna Hoodie Jacket costume(Size XL, chest 44.1"", shoulder 19.3"")",Apparel,http://www.amazon.com/dp/B00KBLI66S/,1,1
Art of Sword Japanese Anime Online Light Emerald - Dark Greatsword Turquoise Green Blue SA-03L,Sports,http://www.amazon.com/dp/B00KCW8CRE/,1,1
"Banpresto Sword Art Online 2.25-Inch Shino Chibi Figure, Chibi-Kyun-Chara Volume 1",Toy,http://www.amazon.com/dp/B00LWV2NR4/,1,1
Home Decor Anime Sword Art Online Ⅱ Kirigaya Kazuto Sinon Asuna Cosplay 23.6x35.4 Inches -150,Home,http://www.amazon.com/dp/B00N8H1TVG/,1,1
Max Factory Sword Art Online II: Sinon Figma Action Figure,Toy,http://www.amazon.com/dp/B00NW4HEFU/,3,1
Cosplaywho Sword Art Online Silica Dragon Pina Cosplay Props,Toy,http://www.amazon.com/dp/B00NZUJ6ZW/,1,1
"Banpresto Sword Art Online 2.25-inch Sinon Chibi Figure, Kirito Chibi Figure and Shino Chibi Figure, Chibi-Kyun-Chara Volume 1 Set of 3",Toy,http://www.amazon.com/dp/B00OHO5CZS/,1,1
Dream2reality Sword Art Online Kirito Black Sword Elucidator Cosplay Props(Metal),Sports,http://www.amazon.com/dp/B00P8PDST2/,1,1
"Sword Art Online Progressive, Vol. 1 (manga)",eBooks,http://www.amazon.com/dp/B00R1NS7V8/,1,1
"Sega Sword Art Online HG High Grade 6"" Lisbeth Action Figure",Toy,http://www.amazon.com/dp/B00RPGWLIG/,1,1
Most lottery premium Sword Art Online STAGE2 H Award Kyun Chara Philia,Toy,http://www.amazon.com/dp/B00U0815Z6/,1,1
"Sega Sword Art Online High Grade 6.5"" Undine Asuna Action Figure",Toy,http://www.amazon.com/dp/B00UCWQ9GK/,1,1
Japan Anime Cartoon Sword Art Online SAO Kirito Asuna Yui Custom Morphing Coffee Mug Tea Cup 11 OZ Office Home Cup (Printed on two sides),Apparel,http://www.amazon.com/dp/B00UD2YZT2/,1,1
[new 3DS XL] Sword Art Online #1 Limited Edition VINYL SKIN STICKER DECAL COVER for NEW Nintendo 3DS XL / LL Console System,Video Games,http://www.amazon.com/dp/B00UR7B2Y4/,1,1
Camplayco Sword Art Online Eugeo Uniform Cosplay Costume,Toy,http://www.amazon.com/dp/B0159SMYLA/,1,1
Acer Predator 34-inch Curved UltraWide QHD (3440 x 1440) NVIDIA G-Sync Widescreen Display (X34 bmiphz),Personal Computer,http://www.amazon.com/dp/B016GNX4SE/,49,1
Funko POP Anime: Sword Art Online Asuna Action Figure,Toy,http://www.amazon.com/dp/B0198KU69M/,1,1
Sword Art Online Season 1 + 2 Complete Set Ep. 1 - 49 End (4 Disc) / ENGLISH AUDIO **,DVD,http://www.amazon.com/dp/B01AC0QWL8/,1,1
Sword Art Online II Volume 4 -Mother's Rosario- Standard Edition DVD,DVD,http://www.amazon.com/dp/B01AU5NA9C/,1,1
"Sony H.ear on Wireless Noise Cancelling Headphone, Viridian Blue (MDR100ABN/L)",Speakers,http://www.amazon.com/dp/B01CQXGKWK/,1,1
"Sony H.ear on Wireless Noise Cancelling Headphone, Cinnabar Red (MDR100ABN/R)",Speakers,http://www.amazon.com/dp/B01CQXGSTU/,1,1
Sword Art Online: Hollow Realization Collector's Edition,Video Games,http://www.amazon.com/dp/B01HQGWJLI/,1,1
"Sony Premium Noise Cancelling, Bluetooth Headphone, Grey Beige (MDR1000X/C)",CE,http://www.amazon.com/dp/B01KHZ4ZVW/,1,1
"Sony Premium Noise Cancelling, Bluetooth Headphone, Black (MDR1000X/B)",CE,http://www.amazon.com/dp/B01KHZ4ZYY/,6,1
Sword Art Online 1:  Aincrad (light novel),eBooks,http://www.amazon.com/dp/B06XNJW99V/,1,1
"The Isolator, Vol. 1 (light novel): The Biter",Book,http://www.amazon.com/dp/0316260592/,2,1
"Sword Art Online: Phantom Bullet, Vol. 1 - manga (Sword Art Online Manga)",Book,http://www.amazon.com/dp/0316268887/,1,1
Sword Art Online 4: Fairy Dance - light novel,Book,http://www.amazon.com/dp/0316296430/,1,1
Sword Art Online 5: Phantom Bullet - light novel,Book,http://www.amazon.com/dp/0316296449/,1,1
"Sword Art Online Progressive, Vol. 3 - manga (Sword Art Online Progressive Manga)",Book,http://www.amazon.com/dp/0316348759/,1,1
Sword Art Online abec Artworks,Book,http://www.amazon.com/dp/0316442615/,1,1
"Sword Art Online: Girls' Ops, Vol. 3",Book,http://www.amazon.com/dp/0316552674/,1,1
"Martin's Big Words: The Life of Dr. Martin Luther King, Jr.",Book,http://www.amazon.com/dp/1423106350/,1,1
Sons of Anarchy Vol. 1,Book,http://www.amazon.com/dp/1608864022/,1,1
Razer Hydra PC Gaming Motion Sensing Controllers Portal 2 Bundle (RZ80-00630200-B3U1),CE,http://www.amazon.com/dp/B0052S3ZBG/,2,1
Nintendo NES Controller Lanyard with Rubber Charm,Apparel,http://www.amazon.com/dp/B005H3B9YG/,1,1
