name,category,amazon_link,total_mentions,subreddit_mentions
Marcus: The Autobiography of Marcus Allen,Book,http://www.amazon.com/dp/0312169248/,1,1
Zippo 12 oz. Lighter Fluid,Sports,http://www.amazon.com/dp/B000K2U3JG/,3,1
Antennacraft HDVIEW360 R Mini-State R Antenna System RF Remote/Direction Memory,Speakers,http://www.amazon.com/dp/B001JT0FWY/,1,1
"Diamond Strike on Box Greenlight Matches, 300 Count",Sports,http://www.amazon.com/dp/B003Y30NFW/,1,1
Cainthology (Songs In The Key Of Cain) [Explicit],Digital Music Album,http://www.amazon.com/dp/B0064Y0NRG/,1,1
"1byone TV Antenna, 50 Mile Range Amplified HDTV Antenna with Detachable Amplifier Signal Booster, USB Power Supply and 10 Feet Highest Performance Coaxial Cable-Black",Speakers,http://www.amazon.com/dp/B00IF70T4M/,42,1
"Dragon NaturallySpeaking Home 13.0, English",Software,http://www.amazon.com/dp/B00LX4BZAQ/,2,1
Kansas City Football Fans. Proud To Be A Raiders Hater (Red) T-Shirt(Sm-5X) (XL),Sports,http://www.amazon.com/dp/B00U9RE0BO/,1,1
NFL 4 Stripe Deuce Crew Socks Mens-Kansas City Chiefs-Size Large(10-13),Sports,http://www.amazon.com/dp/B012WSZZRA/,1,1
98% UV Protection - Baseball / Football / Basketball / Soccer / Hockey Jersey Display Case Shadowbox Wall Mount - Black JC34-BL,Sports,http://www.amazon.com/dp/B01DL0UESI/,1,1
