name,category,amazon_link,total_mentions,subreddit_mentions
The Ultimate Kauai Guidebook: Kauai revealed,Book,http://www.amazon.com/dp/0983888760/,3,3
Fishing Hawaii Style,Book,http://www.amazon.com/dp/0944462014/,1,1
To Steal a Kingdom: Probing Hawaiian History,Book,http://www.amazon.com/dp/096334840X/,2,1
"Kauai Trailblazer: Where to Hike, Snorkel, Bike, Paddle, Surf",Book,http://www.amazon.com/dp/0991369017/,1,1
Ready Mapbook of Kauai,Book,http://www.amazon.com/dp/1602743231/,1,1
WaterBOB Emergency Drinking Water Storage (100 Gallons),Home Improvement,http://www.amazon.com/dp/B001AXLUX2/,62,1
Shoal of Time: A History of the Hawaiian Islands,Book,http://www.amazon.com/dp/0824803248/,4,1
Armen and Lori's Kauai Guide,eBooks,http://www.amazon.com/dp/B01D97R1VG/,1,1
