name,category,amazon_link,total_mentions,subreddit_mentions
Fundamentals of Astrodynamics (Dover Books on Aeronautical Engineering),Book,http://www.amazon.com/dp/0486600610/,21,7
Kismet,eBooks,http://www.amazon.com/dp/B00R8PMXYQ/,5,5
Extreme 3D Pro Joystick for Windows,CE,http://www.amazon.com/dp/B00009OY9U/,107,5
Thrustmaster T-Flight Hotas X Flight Stick,Video Games,http://www.amazon.com/dp/B001CXYMFS/,220,3
Moon Lander: How We Developed the Apollo Lunar Module (Smithsonian History of Aviation and Spaceflight (Paperback)),Book,http://www.amazon.com/dp/1588342735/,7,2
The Case for Mars: The Plan to Settle the Red Planet and Why We Must,Book,http://www.amazon.com/dp/145160811X/,23,2
iKross Blue LED Hi-Fidelity 2.1 Satellite Speaker Sound System with Subwoofer,PC Accessory,http://www.amazon.com/dp/B008HV255C/,4,2
Brainwashed: The Seductive Appeal of Mindless Neuroscience,Book,http://www.amazon.com/dp/0465062911/,3,1
English Grammar For Dummies,Book,http://www.amazon.com/dp/0470546646/,13,1
Introduction to Space Dynamics (Dover Books on Aeronautical Engineering),Book,http://www.amazon.com/dp/0486651134/,5,1
Thing Explainer: Complicated Stuff in Simple Words,Book,http://www.amazon.com/dp/0544668251/,22,1
Rendezvous with Rama,Book,http://www.amazon.com/dp/0553287893/,3,1
The Martian,Book,http://www.amazon.com/dp/0553418025/,32,1
Make: Electronics (Learning by Discovery),Book,http://www.amazon.com/dp/0596153740/,21,1
Interplanetary Spacecraft,Book,http://www.amazon.com/dp/0671096052/,1,1
Guess How Much I Love You,Book,http://www.amazon.com/dp/0763642649/,7,1
The Martian: A Novel,Book,http://www.amazon.com/dp/0804139024/,7,1
"Why People Believe Weird Things: Pseudoscience, Superstition, and Other Confusions of Our Time",Book,http://www.amazon.com/dp/0805070893/,20,1
The Power of Habit: Why We Do What We Do in Life and Business,Book,http://www.amazon.com/dp/081298160X/,113,1
Stages to Saturn: A Technological History of the Apollo/Saturn Launch Vehicles,Book,http://www.amazon.com/dp/0813026911/,1,1
Ignition!: An informal history of liquid rocket propellants,Book,http://www.amazon.com/dp/0813507251/,18,1
Leo on the Cheap: Methods for Achieving Drastic Reductions in Space Launch Costs,Book,http://www.amazon.com/dp/0894991345/,1,1
Introductory Calculus For Infants,Book,http://www.amazon.com/dp/0987823914/,7,1
Rocket Girls,Book,http://www.amazon.com/dp/1421536420/,1,1
How Apollo Flew to the Moon (Springer Praxis Books),Book,http://www.amazon.com/dp/1441971785/,5,1
Getting Started with Dwarf Fortress: Learn to play the most complex video game ever made,Book,http://www.amazon.com/dp/1449314945/,10,1
Spaceflight Dynamics: Third Edition,Book,http://www.amazon.com/dp/1452879591/,2,1
Entering Space: Creating a Spacefaring Civilization,Book,http://www.amazon.com/dp/1585420360/,6,1
Mars Rover Curiosity: An Inside Account from Curiosity's Chief Engineer,Book,http://www.amazon.com/dp/1588344738/,4,1
Start with Why: How Great Leaders Inspire Everyone to Take Action,Book,http://www.amazon.com/dp/1591846447/,10,1
Drive: The Surprising Truth About What Motivates Us,Book,http://www.amazon.com/dp/1594484805/,16,1
The Story of the Blue Planet,Book,http://www.amazon.com/dp/1609804287/,1,1
Analytical Mechanics of Space Systems (Aiaa Education),Book,http://www.amazon.com/dp/1624102409/,1,1
Fundamentals of Astrodynamics and Applications,Book,http://www.amazon.com/dp/1881883140/,4,1
CH Products Pro Pedals USB Flight Simulator Pedals ( 300-111 ),CE,http://www.amazon.com/dp/B0000512IE/,17,1
CH Products Fighterstick USB,CE,http://www.amazon.com/dp/B00006B84X/,16,1
CH Products Pro Throttle USB,CE,http://www.amazon.com/dp/B00006B84Z/,27,1
Uranium Ore,BISS,http://www.amazon.com/dp/B000796XXM/,109,1
"Rolodex Mesh Workspace Laptop Stand, Black/Silver (82410)",Office Product,http://www.amazon.com/dp/B000JE7CMG/,3,1
3Dconnexion 3DX-700028 SpaceNavigator 3D Mouse,CE,http://www.amazon.com/dp/B000LB7G00/,14,1
Saitek Pro Flight Yoke with Three-Lever Throttle (PZ44),CE,http://www.amazon.com/dp/B000TCD1UK/,3,1
The Hitchhiker's Guide to the Galaxy,eBooks,http://www.amazon.com/dp/B000XUBC2C/,5,1
GN-U DOU Macross Plus: YF-21 Action Figure No. 002,Single Detail Page Misc,http://www.amazon.com/dp/B0013XXQWW/,1,1
APC Back-UPS 350VA UPS Battery Backup & Surge Protector (BE350G),Speakers,http://www.amazon.com/dp/B001985SWW/,9,1
Blue Icicle XLR to USB Mic Converter/Mic Preamp,Musical Instruments,http://www.amazon.com/dp/B001EW5YQS/,21,1
Challenger Revealed: An Insider's Account of How the Reagan Administration Caused the Greatest Tragedy of the Space Age,eBooks,http://www.amazon.com/dp/B001QCXRTM/,1,1
Thrustmaster T-16000M Flight Stick,CE,http://www.amazon.com/dp/B001S0RTU0/,96,1
Mexican Hats Candy 5 lb,Grocery,http://www.amazon.com/dp/B0028MOP54/,2,1
Thrustmaster MFD Cougar Pack Flight Control Panels,CE,http://www.amazon.com/dp/B002HH9TRY/,12,1
CalExotics Original Accommodator Latex Dong – Hands Free Strap On Probe for Couples – Adult Dildo Sex Toys - Ivory,Health and Beauty,http://www.amazon.com/dp/B002JINP1C/,3,1
"3D Glasses Direct-Clip On 3D Glasses for 3D Movies, DVD's and Gaming that Require Red/Cyan Lenses",CE,http://www.amazon.com/dp/B002TXYEV2/,1,1
LEGO Space Shuttle 3367,Toy,http://www.amazon.com/dp/B004478GDS/,1,1
Etichettatrice Dymo a rilievo Junior S0717910,Office Product,http://www.amazon.com/dp/B004ASMW9U/,1,1
Lego Technic Space Shuttle (8480),Toy,http://www.amazon.com/dp/B004F1Z0YQ/,1,1
LEGO Space Center 3368,Toy,http://www.amazon.com/dp/B004P98RR0/,1,1
LEGO Shuttle Expedition 10231,Toy,http://www.amazon.com/dp/B004ZWKWQQ/,1,1
HDE USB to XLR Microphone Instrument Karaoke Cable 3 Pin XLR Female to USB 2.0 Male MIC Link Adapter (10ft/3m),Musical Instruments,http://www.amazon.com/dp/B0050CEEIW/,6,1
Cooler Master NotePal X-Slim Ultra-Slim Laptop Cooling Pad with 160mm Fan (R9-NBC-XSLI-GP),Personal Computer,http://www.amazon.com/dp/B005C31HC0/,27,1
MC Hammer Parachute Pants Only Rapper Costume Pants 9057,Apparel,http://www.amazon.com/dp/B006VXC7AG/,2,1
Eclipse Glasses - CE and ISO Certified Safe Solar Eclipse Shades - Viewer and filters (5 Pack) - Made in USA,Photography,http://www.amazon.com/dp/B00712I3JA/,7,1
"EVGA GeForce GT 610 2048MB DDR3, DVI, VGA and HDMI Graphics Card (02G-P3-2619-KR)",Personal Computer,http://www.amazon.com/dp/B00847TPH0/,3,1
2PU1951 - TP-LINK TL-WDR3600 Wireless Router - IEEE 802.11n,PC Accessory,http://www.amazon.com/dp/B008RV51EE/,13,1
Where No Man Has Gone Before: A History of NASA's Apollo Lunar Expeditions (Dover Books on Astronomy),eBooks,http://www.amazon.com/dp/B00A73BSR4/,1,1
"TP-Link AV600 Nano Powerline Adapter Starter Kit, up to 600Mbps (TL-PA4010KIT)",Personal Computer,http://www.amazon.com/dp/B00AWRUICG/,292,1
Red-blue / Cyan Anaglyph Simple Style 3d Glasses 3d Movie Game-extra Upgrade Style (3Pcs With Different Style),CE,http://www.amazon.com/dp/B00CE452H6/,1,1
PNY StorEDGE 64GB Flash Memory Expansion Module (P-MEMEXP64U1-EF),Personal Computer,http://www.amazon.com/dp/B00DC9TN72/,1,1
PNY StorEDGE 128GB Flash Memory Expansion Module (P-MEMEXP128U1-EF),Personal Computer,http://www.amazon.com/dp/B00DC9U2Q8/,2,1
Razer Naga 2014 Ergonomic MMO Gaming Mouse - Black,Personal Computer,http://www.amazon.com/dp/B00E8CF268/,23,1
The Martian: A Novel,eBooks,http://www.amazon.com/dp/B00EMXBDMA/,29,1
Wacom Bamboo CTL471 Pen Tablet for PC/MAC (Black and Lime),Home Improvement,http://www.amazon.com/dp/B00EVOXM3S/,20,1
Transcend 128GB (32GB x 4 Kit) JetMemory DDR3- 1600 ECC Registered DIMM 4Rx4 For Mac Pro Late 2013 (TS128GJMA534P),Personal Computer,http://www.amazon.com/dp/B00JIJUAMW/,1,1
"Printrbot Simple Maker's Kit Model 1405 3D Printer, 4"" x 4"" x 4"" Maximum Build Dimensions, 100 Micron Maximum Resolution, 1.75-mm PLA Filament",BISS,http://www.amazon.com/dp/B00KJ6BU4K/,4,1
Corsair Graphite Series 380T Mini-ITX Portable PC Case - Black (CC-9011061-WW),Personal Computer,http://www.amazon.com/dp/B00LA6X38O/,6,1
Moebius Interstellar Ranger 1:72 Scale Model Kit,Toy,http://www.amazon.com/dp/B00V33B6TW/,2,1
WD 1TB Black My Passport Ultra Portable External Hard Drive - USB 3.0 - WDBGPU0010BBK-NESN [Old Model],Personal Computer,http://www.amazon.com/dp/B00W8XXRPM/,26,1
"Kerbal-space-program Mouse Pad, Mousepad (10.2 x 8.3 x 0.12 inches)",PC Accessory,http://www.amazon.com/dp/B00WR2BTYA/,1,1
DSI Modular Keypad with Cherry Blue Switch,PC Accessory,http://www.amazon.com/dp/B00X099AU4/,2,1
Intel CM8064401739300S Xeon E5-2699 v3 Octadeca-core (18 Core) 2.30 GHz Processor - Socket R3 (LGA2011-3) OEM Pack - 4.50 MB - 45 MB Cache - 9.60 GT/s QPI - 5 GT/s DMI - Yes - 3.60 GHz Overclocking Speed - 22 nm - 145 W - 169.5ftF (76.4ftC) - 1.3 V DC,PC Accessory,http://www.amazon.com/dp/B00X8CECUG/,2,1
Seveneves: A Novel,Book,http://www.amazon.com/dp/0062190377/,15,1
Icstation DIY Wireless FM Microphone Transmitter Kit Electronics Soldering Practice Set,BISS,http://www.amazon.com/dp/B01LWSU47I/,1,1
Stick and Rudder: An Explanation of the Art of Flying,Book,http://www.amazon.com/dp/0070362408/,17,1
The Forever War,Book,http://www.amazon.com/dp/0312536631/,15,1
Footfall,Book,http://www.amazon.com/dp/0345323440/,4,1
Lost in Space: The Fall of NASA and the Dream of a New Space Age,Book,http://www.amazon.com/dp/0375421505/,1,1
It's ONLY Rocket Science: An Introduction in Plain English (Astronomers' Universe),Book,http://www.amazon.com/dp/038775377X/,2,1
The Engines of God,Book,http://www.amazon.com/dp/0441002846/,2,1
