name,category,amazon_link,total_mentions,subreddit_mentions
The Art and Science of Low Carbohydrate Living: An Expert Guide to Making the Life-Saving Benefits of Carbohydrate Restriction Sustainable and Enjoyable,Books,https://www.amazon.com/Art-Science-Low-Carbohydrate-Living/dp/0983490708,6,3
Dr. Bernstein's Diabetes Solution: The Complete Guide to Achieving Normal Blood Sugars,Books,https://www.amazon.com/Dr-Bernsteins-Diabetes-Solution-Achieving/dp/0316182699/ref=sr_1_fkmr0_1?ie=UTF8&amp;qid=1478489895&amp;sr=8-1-fkmr0&amp;keywords=dr+feinstein,6,3
Why We Get Fat: And What to Do About It,Books,https://www.amazon.com/Why-We-Get-Fat-About/dp/0307474259?ie=UTF8&amp;*Version*=1&amp;*entries*=0,9,2
"Great Lakes Gelatin Collagen Hydrolysate Beef, Kosher, 16 oz.",Grocery & Gourmet Food,https://www.amazon.com/Great-Lakes-Collagen-Hydrolysate-16-Ounce/dp/B005KG7EDU/ref=sr_1_8?ie=UTF8&amp;qid=1455079606&amp;sr=8-8&amp;keywords=collagen,4,2
"Good Calories, Bad Calories: Fats, Carbs, and the Controversial Science of Diet and Health",Books,https://www.amazon.com/Good-Calories-Bad-Controversial-Science/dp/1400033462/,4,2
Nuun Mixed Fruit Nuun Tube - 4 Pack,"Health, Household & Baby Care",https://www.amazon.com/Nuun-Active-Hydration-Electrolyte-Enhanced/dp/B001QW1L72,4,2
"The Big Fat Surprise: Why Butter, Meat and Cheese Belong in a Healthy Diet",Books,https://www.amazon.com/Big-Fat-Surprise-Butter-Healthy/dp/1451624433/ref=sr_1_1?ie=UTF8&amp;qid=1432577742&amp;sr=8-1&amp;keywords=big+fat+surprise,4,2
"Revolving Punch Plier Kit, Punch Hole Tool including Punch Plier, Brass Pad, Screwdriver and Grinding Rod for Belt, Saddle, Watch Strap, Shoe, Fabric, Paper, etc",Tools & Home Improvement,https://www.amazon.com/gp/product/B06XRDBGY6/ref=oh_aui_detailpage_o05_s00?ie=UTF8&amp;psc=1,,1
Astor Bidet Fresh Water Spray Non-Electric Mechanical Bidet Toilet Seat Attachment CB-1000,Tools & Home Improvement,https://www.amazon.com/Astor-Non-Electric-Mechanical-Attachment-CB-1000/dp/B003TPGPUW/ref=sr_1_cc_1?s=aps&amp;ie=UTF8&amp;qid=1479115108&amp;sr=1-1-catcorr&amp;keywords=astor+bidet,54,1
Hario Mini Mill Slim Hand Coffee Grinder,Home & Kitchen,https://www.amazon.com/Hario-Coffee-Mill-Slim-Grinder/dp/B001804CLY/ref=sr_1_1?s=home-garden&amp;ie=UTF8&amp;qid=1447867895&amp;sr=1-1&amp;keywords=haribo+coffee+grinder,21,1
Aeropress Coffee and Espresso Maker,Home & Kitchen,https://www.amazon.com/Aeropress-Coffee-and-Espresso-Maker/dp/B0047BIWSK/ref=sr_1_1?s=kitchen&amp;ie=UTF8&amp;qid=1447867761&amp;sr=1-1&amp;keywords=aeropress,18,1
"Doctor's Best High Absorption Magnesium Glycinate Lysinate, 100% Chelated, Non-GMO, Vegan, Gluten Free, Soy Free,  200 mg, 240 Tablets","Health, Household & Baby Care",https://www.amazon.com/Doctors-Best-Absorption-Magnesium-Elemental/dp/B000BD0RT0,12,1
Natural Harvest: A collection of semen-based recipes,Books,https://www.amazon.com/Natural-Harvest-collection-semen-based-recipes/dp/1481227041/ref=sr_1_1?ie=UTF8&amp;qid=1429836387&amp;sr=8-1&amp;keywords=semen+cookbook,10,1
"LIFT Certified BPA-Free Reusable Microwavable Meal Prep Containers with Lids, 28-Ounce, 7 Pack (Includes Ebook)",Home & Kitchen,https://www.amazon.com/Certified-BPA-Free-Reusable-Microwavable-Containers/dp/B0128YT76S/ref=sr_1_3?ie=UTF8&amp;qid=1494806399&amp;sr=8-3&amp;keywords=meal+prep+boxes,9,1
"Albanese Candy, Sugar Free Assorted Fruit Gummi Bears, 5-pound Bag",Grocery & Gourmet Food,https://www.amazon.com/Albanese-Candy-Sugar-Assorted-5-pound/dp/B00DE4GWWY?_encoding=UTF8&amp;*Version*=1&amp;*entries*=0&amp;th=1,7,1
Paderno World Cuisine Spiral Vegetable Slicer / Countertop-Mounted Plastic Spiralizer Basic incl. 3 Different Blades Made of Stainless Steel,Home & Kitchen,https://www.amazon.com/Paderno-World-Cuisine-A4982799-Tri-Blade/dp/B0007Y9WHQ,7,1
My Weigh SCMXL700T 700 lb 320kg Talking Bathroom Scale,Tools & Home Improvement,https://www.amazon.com/gp/product/B00MQ8A5UY/ref=oh_aui_search_detailpage?ie=UTF8&amp;psc=1,5,1
"NOW Psyllium Husk Powder, 24-Ounce","Health, Household & Baby Care",https://www.amazon.com/Now-Foods-Psyllium-Powder-24-Ounce/dp/B002RWUNYM/ref=sr_1_1_a_it?ie=UTF8&amp;qid=1466280410&amp;sr=8-1&amp;keywords=now+foods+psyllium+powder,5,1
"SE 7924LP Heavy-Duty Leather Hole Punch Tool, 2.0 - 4.5 mm",Tools & Home Improvement,https://www.amazon.com/SE-7924LP-Heavy-Duty-Leather-Punch/dp/B000NK5VY2,5,1
AmazonBasics Stainless Steel Digital Kitchen Scale with LCD Display (Batteries Included),Home & Kitchen,https://www.amazon.com/gp/product/B00V5IM5PY,5,1
"Dash Rapid Egg Cooker, Black",Home & Kitchen,https://www.amazon.com/Dash-Rapid-Egg-Cooker-Black/dp/B00DDXWFY0,5,1
"Explore Asia Organic Black Bean Spaghetti, 7.05-Ounce Pouch",Grocery & Gourmet Food,https://www.amazon.com/Explore-Asia-Organic-Spaghetti-7-05-Ounce/dp/B0078DU1CY?sa-no-redirect=1,4,1
"Emergen-C Electro Mix Electrolyte Replacement Drink Mix, Potassium, Magnesium, Calcium, 0.14 Ounce Packets (30 Count)","Health, Household & Baby Care",https://www.amazon.com/EMERGEN-C-ELECTRO-MIX-Lemon-Lime-4-2/dp/B002HWRY5S/,4,1
"Better Than Bouillon, Organic Chicken Base, 8 oz",Grocery & Gourmet Food,https://www.amazon.com/Better-Than-Bouillon-Chicken-Base/dp/B00016LAFM/,4,1
"Bodum CHAMBORD Coffee & Tea Maker, French Press Coffee Maker, Stainless Steel & Heat-Resistant Borosilicate Glass, The Original French Press, Made in Europe, 8 cup, 1 liter, 34 ounces",Home & Kitchen,https://www.amazon.com/Bodum-Chambord-French-Coffee-Chrome/dp/B00008XEWG/ref=sr_1_12?s=kitchen&amp;ie=UTF8&amp;qid=1447867795&amp;sr=1-12&amp;keywords=french+press,4,1
"Huy Fong Chili Garlic Sauce, 8 oz",Grocery & Gourmet Food,https://www.amazon.com/Huy-Fong-Chili-Garlic-Sauce/dp/B0016L34GO/ref=pd_sim_325_5?ie=UTF8&amp;psc=1&amp;refRID=TMYN8J2QEM65V733C6DG,4,1
"Hamilton Beach 70740 8-Cup Food Processor, Black",Home & Kitchen,https://www.amazon.com/Hamilton-Beach-70740-8-Cup-Processor/dp/B00755KNCS/ref=sr_1_1?s=kitchen&amp;ie=UTF8&amp;qid=1435502542&amp;sr=1-1&amp;keywords=food+processor,4,1
"Natural Vitality Natural Calm Magnesium Anti Stress, Organic, Raspberry Lemon, 16 oz","Health, Household & Baby Care",https://www.amazon.com/Natural-Vitality-Magnesium-Organic-Raspberry/dp/B00BPUY3W0/ref=sr_1_1_s_it?s=hpc&amp;ie=UTF8&amp;qid=1465927999&amp;sr=1-1&amp;keywords=calm+raspberry+lemon,4,1
"The Complete Guide to Fasting: Heal Your Body Through Intermittent, Alternate-Day, and Extended Fasting",Books,https://www.amazon.com/dp/1628600012/ref=cm_sw_r_cp_api_XV2.yb6NW74W8,4,1
"Joy Bidet D1 Handheld Bidet Shattaf with Adjustable Pressure Shut-off Valve, CUPC Hose Certification",Tools & Home Improvement,https://www.amazon.com/dp/B00FPZUJRO/ref=cm_sw_r_other_apa_q1MpybZMAT9W5,3,1
"Paksh Novelty Plastic Reusable Food Storage Container with Clear Lid & Lunch Tray / Bento Box, Microwave & Dishwasher Safe, 38 ounce, 10 pack",Home & Kitchen,https://www.amazon.com/Paksh-Novelty-Container-Microwave-Dishwasher/dp/B00QMKPHLE,3,1
"Update international Cross-Wire Grid Cooling Rack, Wire Pan Grate, Baking Rack, Icing Rack, Chrome Plated Steel, Rectangle Shape, 6-Raised Feet, Commercial Quality, Full Size - 10 x 18 Inches",Home & Kitchen,https://www.amazon.com/Cross-Wire-Cooling-Rectangle-6-Raised-Commercial/dp/B000HLUKFC,3,1
"Isopure Low Carb Protein Powder, 100% Whey Protein Isolate, Flavor: Dutch Chocolate, 3 Pounds (Packaging May Vary)","Health, Household & Baby Care",https://www.amazon.com/gp/product/B000E8ZJGS,3,1
"EasyLunchboxes Insulated Lunch Box Cooler Bag, Black",Home & Kitchen,https://www.amazon.com/EasyLunchboxes-Insulated-Lunch-Cooler-Black/dp/B004UISANC/ref=sr_1_5?ie=UTF8&amp;qid=1452327502&amp;sr=8-5&amp;keywords=insulated+lunch+bag,3,1
EZ-Sweetz (2oz - Liquid Sweetener 800 Servings/Bottle),Grocery & Gourmet Food,https://www.amazon.com/EZ-Sweetz-2oz-Liquid-Sweetener-Servings/dp/B002MO765O,3,1
"NOW Magnesium Citrate 200 mg,250 Tablets","Health, Household & Baby Care",https://www.amazon.com/gp/product/B000BV1O26?psc=1&amp;redirect=true&amp;ref_=oh_aui_search_detailpage,3,1
"Lowrey's Original Bacon Curls, 1.75-Ounce (Pack of 18)",Grocery & Gourmet Food,https://www.amazon.com/Lowreys-microwave-chicharrones-original-1-75-Ounce/dp/B000UPFWW6/ref=sr_1_1?s=grocery&amp;ie=UTF8&amp;qid=1426621265&amp;sr=1-1&amp;keywords=pork+rinds,3,1
VonShef 7- Egg Electric Cooker Stainless Steel with Poacher & Steamer Attachment,Home & Kitchen,https://www.amazon.com/VonShef-Exclusive-Electric-Stainless-Attachment/dp/B00N3PVU1C/ref=sr_1_1?ie=UTF8&amp;qid=1446413956&amp;sr=8-1&amp;keywords=egg+steamer&amp;refinements=p_72,3,1
"Cello Whisps Parmesan Cheese Crisp, 9.5 Ounce",Grocery & Gourmet Food,https://www.amazon.com/Cello-Artisan-Parmesan-Protein-serving/dp/B01B5EF0OK,2,1
Mission Low Carb Soft Taco Flour Tortilla's 12oz./8 Ct. (Pack of 6) by Mission Ltd,Grocery & Gourmet Food,https://www.amazon.com/Mission-Carb-Flour-Tortillas-12oz/dp/B00B64Q2NS?sa-no-redirect=1,2,1
"Cello Whisps Pure Parmesan Cheese Crisps, 2.12 Ounce",Grocery & Gourmet Food,https://www.amazon.com/Cello-Whisps-Parmesan-Cheese-Crisps/dp/B010LWFX9O,2,1
"Frank's Red Hot Original Seasoning, 15.3 Ounce",Grocery & Gourmet Food,https://www.amazon.com/Red-Hot-Seasoning-Franks-Powder-15-3/dp/B00JV9VT9C,2,1
"PlantFusion Complete Protein Powder, Vanilla Bean, No Soy or Rice, 30 Servings, 21g Protein, 2lb Tub","Health, Household & Baby Care",https://www.amazon.com/PlantFusion-Protein-Vanilla-Bean-2lb/dp/B0021FEMZG/ref=sr_1_1?ie=UTF8&amp;qid=1455079543&amp;sr=8-1&amp;keywords=plantfusion,2,1
Norpro 431 4-Piece Silicone Ice Pop Maker Set - Assorted Colors,Home & Kitchen,https://www.amazon.com/Norpro-431-4-Piece-Silicone-Maker/dp/B0036B9KHO,2,1
"Optimum Nutrition ZMA, 180 Capsules","Health, Household & Baby Care",https://www.amazon.com/dp/B000GIQS02,2,1
"The Big Fat Surprise: Why Butter, Meat and Cheese Belong in a Healthy Diet",Books,https://www.amazon.com/Big-Fat-Surprise-Butter-Healthy/dp/1451624425,2,1
"Silpat 11-5/8"" x 16-1/2"" Non-Stick Silicone Baking Mat",Home & Kitchen,https://www.amazon.com/Silpat-AE420295-07-Premium-Non-Stick-Silicone/dp/B00008T960/ref=sr_1_2?ie=UTF8&amp;qid=1426886612&amp;sr=8-2&amp;keywords=silpat,2,1
"Eden Organic Black Soy Beans, No Salt Added, 15-Ounce Cans (Pack of 12)",Grocery & Gourmet Food,https://www.amazon.com/gp/product/B000GZS9Q6,2,1
"Nasco WA07173 Human Body Fat Replica with Display Base, 1 lb.",Industrial & Scientific,https://www.amazon.com/gp/product/B00J8FJQGW/ref=oh_aui_detailpage_o05_s00?ie=UTF8&amp;psc=1,2,1
"Bob's Red Mill Gluten Free Xanthan Gum, 8-ounce",Grocery & Gourmet Food,https://www.amazon.com/Bobs-Red-Mill-Xanthan-8-Ounce/dp/B0013JJZWG/ref=sr_1_2?ie=UTF8&amp;qid=1426886645&amp;sr=8-2&amp;keywords=xanthan+gum,2,1
RinGuard Ring Size Adjuster (Set of 3 Sizes),"Arts, Crafts & Sewing",https://www.amazon.com/RinGuard-Ring-Size-Adjuster-Sizes/dp/B00PI0T25Q,2,1
Greenco Bidet Fresh Water Spray Non-Electric Mechanical Bidet Toilet Seat Attachment,Home & Kitchen,https://www.amazon.com/dp/B01A17T3N6/ref=cm_sw_r_cp_apa_DggjzbN1A7T6E,1,1
"The Ketogenic Mediterranean Diet: A Low-Carb Approach to the Fresh-and-Delicious, Heart-Smart Lifestyle",Books,https://www.amazon.com/Ketogenic-Mediterranean-Diet-Fresh-Delicious/dp/1612436412,1,1
"Hershey's Sugar Free Chocolate Syrup, 17.5 oz",Grocery & Gourmet Food,https://www.amazon.com/Hersheys-Sugar-Free-Chocolate-Syrup/dp/B007TWNKHW,1,1
"Barney Butter Almond Butter Snack Pack, Cocoa + Coconut, 0.6 Ounce (Pack of 24)",Grocery & Gourmet Food,https://www.amazon.com/Barney-Butter-Almond-Snack-Coconut/dp/B00KMMOGPG/ref=redir_mobile_desktop?_encoding=UTF8&amp%3BdpID=41Lt-KCoKoL&amp%3BdpPl=1&amp%3Bkeywords=barney%20butter%20cocoa%20and%20coconut&amp%3Bpi=AC_SY200_QL40&amp%3Bref=plSrch&amp%3Bsr=8-3&qid=1424041055&ref_=mp_s_a_1_3,1,1
Taco Bell Restaurant Sauce - Fire - 7.5 Ounces,Grocery & Gourmet Food,https://www.amazon.com/Taco-Bell-Restaurant-Sauce-Ounces/dp/B012DGSYD8/,1,1
The Complete Ketogenic Diet for Beginners: Your Essential Guide to Living the Keto Lifestyle,Books,https://www.amazon.com/gp/product/1623158087/ref=oh_aui_detailpage_o06_s00?ie=UTF8&amp;psc=1,1,1
Carbquik Baking Biscuit Mix (48oz),Grocery & Gourmet Food,https://www.amazon.com/Carbquik-Baking-Mix-48/dp/B000G0EP78,1,1
"Califia Farms Unsweetened Almond Milk, 48 Fluid Ounce -- 6 per case.",Grocery & Gourmet Food,https://www.amazon.com/Califia-Farms-Unsweetened-Almond-Fluid/dp/B00OX72F18/ref=sr_1_1_s_it?s=grocery&amp;ie=UTF8&amp;qid=1490034887&amp;sr=1-1&amp;keywords=califia+almond+milk,1,1
"Isopure Zero Carb Protein Powder, 100% Whey Protein Isolate, Flavor: Creamy Vanilla, 3 Pounds (Packaging May Vary)","Health, Household & Baby Care",https://www.amazon.com/Isopure-Protein-Powder-Isolate-Flavor/dp/B000E95HP0/ref=sr_1_1_s_it?s=hpc&amp;ie=UTF8&amp;qid=1490034806&amp;sr=1-1,1,1
Verdana Vegetable Glycerin USP/BP Refined - 32 Fluid ounce (1 Quart) - Premium Food Grade & USP Grade - Pure Vegan Kosher Non-GMO Palm oil derived – Excellent Skin/ Hair Moisturizer,Beauty & Personal Care,https://www.amazon.com/gp/product/B01MSAAHPO/ref=oh_aui_detailpage_o01_s00?ie=UTF8&amp;psc=1,1,1
"SO DELICIOUS COCONUT MILK, 11 OZ - (Pack of 4)",Grocery & Gourmet Food,https://www.amazon.com/Delicious-Dairy-Culinary-Coconut-Original/dp/B00G2PCX5W?sa-no-redirect=1,1,1
"PBfit- All-Natural Peanut Butter Powder, Produced by BetterBody Foods - 15 oz",Grocery & Gourmet Food,https://www.amazon.com/BetterBody-Foods-Powder-Peanut-Butter/dp/B00KDCCYEA?sa-no-redirect=1,1,1
"Heavy Cream Powder (1lb) by Anthony's, Batch Tested Gluten-Free",Grocery & Gourmet Food,https://www.amazon.com/dp/B01A03E494/,1,1
"Promax LS Lower Sugar Protein Bar, Honey Peanut, 2.01 Ounce, 12 Count",Grocery & Gourmet Food,https://www.amazon.com/Promax-LS-Lower-Protein-Peanut/dp/B00KNOFUX0?sa-no-redirect=1,1,1
Chameleon Cold-Brew Mocha Coffee Concentrate 2 pack,Grocery & Gourmet Food,https://www.amazon.com/Chameleon-Cold-Brew-Mocha-Coffee-Concentrate/dp/B00W5SUMF8?sa-no-redirect=1,1,1
"NuGO Slim Brownie Crunch, 1.59-Ounce (Pack of 12)","Health, Household & Baby Care",https://www.amazon.com/NuGO-Slim-Brownie-Crunch-1-59-Ounce/dp/B005MWDVNY?sa-no-redirect=1,1,1
"Quest Nutrition Protein Powder, Multi-Purpose Mix, 24g Protein, 1g Net Carbs, 96% P/Cals, 2lb Tub, High Protein, Low Carb, Gluten Free, Soy Free","Health, Household & Baby Care",https://www.amazon.com/Quest-Nutrition-Protein-Powder-Multi-Purpose/dp/B00PDV0TFW?sa-no-redirect=1,1,1
"Doctor In The Kitchen, Flackers Organic Flax Seed Crackers, Savory Flaxseed, 5-Ounce",Grocery & Gourmet Food,https://www.amazon.com/Doctor-In-The-Kitchen-Flackers/dp/B0078DQ7PE?sa-no-redirect=1,1,1
"Quest Bars High Protein Gluten Free, Original Variety Pack (1-Pack of 12)","Health, Household & Baby Care",https://www.amazon.com/Quest-Protein-Original-Variety-12-Bars/dp/B009NVR3J8?sa-no-redirect=1,1,1
"gimMe Snacks Organic Roasted Seaweed Snacks, Sea Salt, 0.35 Ounce (Pack of 12)",Grocery & Gourmet Food,https://www.amazon.com/Health-Foods-Organic-Roasted-Seaweed/dp/B00BCG0O5C?sa-no-redirect=1,1,1
"gimMe Snacks Organic Roasted Seaweed Snacks, Sesame, 0.35 Ounce (Pack of 12) (Packaging May Vary)",Grocery & Gourmet Food,https://www.amazon.com/Health-Foods-Organic-Roasted-Seaweed/dp/B00BCG0OAC?sa-no-redirect=1,1,1
"ChocoRite Dark Chocolate Bars, 5 Ounce",Grocery & Gourmet Food,https://www.amazon.com/ChocoRite-Dark-Chocolate-Bars-Ounce/dp/B00CAK196M?sa-no-redirect=1,1,1
"Quest Nutrition Cravings Cups, Peanut Butter, 1.76 Ounce Bars, 12 Count","Health, Household & Baby Care",https://www.amazon.com/Quest-Nutrition-Cravings-Peanut-Butter/dp/B00CC08DCI?sa-no-redirect=1,1,1
Hormel Snackers Spinach & Artichoke Dip 7.5 Oz. (Pack of 3),Grocery & Gourmet Food,https://www.amazon.com/Hormel-Snackers-Spinach-Artichoke-Pack/dp/B00L4OXDA0?sa-no-redirect=1,1,1
Tripping over the Truth The Metabolic Theory of Cancer,Books,https://www.amazon.com/Tripping-Over-Truth-Metabolic-Theory/dp/1500600318,1,1
"Bulletproof - Brain Octane Oil, Reliable and Quick Source of Energy (16 Ounces)",Grocery & Gourmet Food,https://www.amazon.com/Bulletproof-Brain-Octane-Oil-oz/dp/B00P8E0QQG/ref=sr_1_2_s_it?s=grocery&amp;ie=UTF8&amp;qid=1490801146&amp;sr=1-2&amp;keywords=brain+octane+oil,1,1
"Resistance Band Set- Exercise Bands- Crossfit - P90x - Yoga - Ideal for Arms, Legs & CoreWorkouts - Physical Rehabilitation -Starter Guide, Strength Table & Wall Chart -Replacement Guarantee",Sports & Outdoors,https://www.amazon.com/Resistance-Bands-Rehabilitation-Hypoallergenic-Breathability/dp/B00N66YZAG/ref=sr_1_3?s=sporting-goods&amp;ie=UTF8&amp;qid=1430338136&amp;sr=1-3&amp;keywords=resistance+bands+set,1,1
Propper Tactical Duty Belt,Sports & Outdoors,https://www.amazon.com/Propper-Tactical-Duty-32-34-Black/dp/B004XW1SPM/ref=sr_1_2?ie=UTF8&amp;qid=1446507955&amp;sr=8-2&amp;keywords=belt+nylon,1,1
Seamless Satin Bra,"Clothing, Shoes & Jewelry",https://www.amazon.com/Prima-Donna-016-1330-Seamless-Satin/dp/B001JF7Y72/ref=cts_ap_1_vtp?pf_rd_m=ATVPDKIKX0DER&amp;pf_rd_p=2897711222&amp;pf_rd_r=VJCX3W4KJBMGX920MHM6&amp;pd_rd_wg=wgVod&amp;pf_rd_s=desktop-detail-softlines&amp;pf_rd_t=40701&amp;pd_rd_i=B000NE2TLQ&amp;pd_rd_w=K7Sad&amp;pf_rd_i=desktop-detail-softlines&amp;pd_rd_r=VJCX3W4KJBMGX920MHM6&amp;_encoding=UTF8&amp;th=1,1,1
"Kirkland Signature Mucus Relief Chest Expectorant (Guaifenesin 400 Mg), 2 bottles of 200-Count Immediate-Release Tablets","Health, Household & Baby Care",https://www.amazon.com/Kirkland-Signature-Expectorant-Guaifenesin-Immediate-Release/dp/B002RL8FIE,1,1
Forever New 32oz Granular Fabric Care Wash 2 Pack (64oz Total),"Health, Household & Baby Care",https://www.amazon.com/Forever-New-32oz-Granular-Total/dp/B00GM5JJB8/ref=sr_1_1?s=hpc&amp;ie=UTF8&amp;qid=1494532406&amp;sr=1-1-spons&amp;keywords=forever,1,1
BulkSupplements Pure Magnesium Carbonate (Micronized) Powder (500 grams),"Health, Household & Baby Care",https://www.amazon.com/BulkSupplements-Magnesium-Carbonate-Micronized-Powder/dp/B00EOWINQS/,1,1
Impeach 45 Anti-Trump Not My President T-Shirt,"Clothing, Shoes & Jewelry",https://www.amazon.com/Mens-Impeach-Anti-Trump-President-T-Shirt/dp/B06WVLZCZ9/ref=sr_1_1?ie=UTF8&amp;qid=1490410661&amp;sr=8-1&amp;keywords=trump+my+president+shirt,1,1
G Hughes Sauce Bbq Sf Hickory,Grocery & Gourmet Food,https://www.amazon.com/Hughes-Smokehouse-Bottle-Select-Hickory/dp/B00PF5M0VC,1,1
"Marino Men’s Ultra Soft Leather Ratchet Dress Belt with Automatic Buckle, Enclosed in an Elegant Gift Box","Clothing, Shoes & Jewelry",https://www.amazon.com/dp/B013JI46SG/ref=cm_sw_r_cp_apap_HIWB7fwl1InIo,1,1
"Foldable Splatter Screen with Heat Resistant Handle, Easy to Clean and Store",Home & Kitchen,https://www.amazon.com/dp/B01MF5FT18?psc=1,1,1
"REESE'S PIECES Candy, Peanut Butter Candy in a Crunchy Shell, 15 Ounce Bag (Halloween Candy)",Grocery & Gourmet Food,https://www.amazon.com/gp/product/B007RPMYGO/ref=pd_lpo_sbs_dp_ss_1?pf_rd_p=1944687502&amp;pf_rd_s=lpo-top-stripe-1&amp;pf_rd_t=201&amp;pf_rd_i=B001UUKMA2&amp;pf_rd_m=ATVPDKIKX0DER&amp;pf_rd_r=1V2NPZ0AFACG740HV3MG,1,1
"Nutritious Living Hi-Lo Cereal, Maple Pecan, 10-Ounce",Grocery & Gourmet Food,https://www.amazon.com/Nutritious-Living-Hi-Lo-Cereal-10-Ounce/dp/B005FL8P38,1,1
"Carrington Farms Organic Extra Virgin Coconut Oil, 54 Ounce, Packaging May Vary",Grocery & Gourmet Food,https://www.amazon.com/Carrington-Farms-Organic-Virgin-Coconut/dp/B00CPZPYLS/ref=sr_1_4?ie=UTF8&amp;qid=1455079454&amp;sr=8-4&amp;keywords=coconut+oil,1,1
"Basic Skills in Interpreting Laboratory Data, 5th edition",Books,https://www.amazon.com/dp/1585283436/,1,1
Rao's Homemade All Natural Pizza Sauce -13 oz,Grocery & Gourmet Food,https://www.amazon.com/Raos-Specialty-Food-Italian-Pasta/dp/B00L26YPLQ/ref=sr_1_2?ie=UTF8&amp;qid=1439999864&amp;sr=8-2&amp;keywords=rao,1,1
"Rao's Homemade Marinara Sauce, 24-Ounce (Pack of 4)",Grocery & Gourmet Food,https://www.amazon.com/Raos-Homemade-Marinara-Sauce-24-Ounce/dp/B004TQPJAM/ref=sr_1_1?ie=UTF8&amp;qid=1439999814&amp;sr=8-1&amp;keywords=rao,1,1
"Ikea Milk Frother 303.011.67, Black by IKEA",Home & Kitchen,https://www.amazon.com/Ikea-Milk-Frother-303-011-67-Black/dp/B013S27CLQ/ref=sr_1_9?s=kitchen&amp;ie=UTF8&amp;qid=1495573509&amp;sr=1-9&amp;keywords=milk+frother,1,1
"Raw Rev Glo Vegan, Gluten-Free Protein Bars - Creamy Peanut Butter & Sea Salt 1.6 ounce (Pack of 12)",Grocery & Gourmet Food,https://www.amazon.com/dp/B00PVS5PCE/ref=cm_sw_r_awd_H1l5vbVJYH4J1,1,1
"Blue Diamond Bold Almonds, Habanero BBQ, 1.5 oz tubes, 12 tubes each box",Grocery & Gourmet Food,https://www.amazon.com/Blue-Diamond-Almonds-Habanero-tubes/dp/B004051ATQ/,1,1
"Miyasaka Japanese Miso Soup, Tofu, 6.04 Ounce",Grocery & Gourmet Food,https://www.amazon.com/dp/B0086XR146/ref=cm_sw_r_awd_9Zl5vb31WM8DS,1,1
"Old Wisconsin Snack Sticks, Turkey, 28-Ounce",Grocery & Gourmet Food,https://www.amazon.com/Old-Wisconsin-Sticks-Turkey-28-Ounce/dp/B007K689MI,1,1
"Rumford Baking Powder, 8.1 Ounce, 2 Count",Grocery & Gourmet Food,https://www.amazon.com/Rumford-Aluminum-Baking-8-1-Ounce-Canisters/dp/B00655V2L0,1,1
RSVP Authetic Mexican Molcajete,Home & Kitchen,https://www.amazon.com/RSVP-GUAC-2-Authetic-Mexican-Molcajete/dp/B002AAYXQ0,1,1
The Drinking Man's Diet,Books,https://www.amazon.com/Drinking-Mans-Diet-Robert-Cameron/dp/091868465X,1,1
Pumpkin Seed Oil Unrefined Organic Carrier Cold Pressed Pure 8 oz,Beauty & Personal Care,https://www.amazon.com/Pumpkin-Unrefined-Organic-Carrier-Pressed/dp/B00DVM705W/ref=redir_mobile_desktop?_encoding=UTF8&amp%3Bkeywords=pumpkin%20seed%20oil&amp%3Bpi=AC_SX110_SY165_QL70&amp%3Bsr=8-10&qid=1436107178&ref_=mp_s_a_1_10,1,1
Dickies Men's 1 3/8 in. Genuine Leather Belt,"Clothing, Shoes & Jewelry",https://www.amazon.com/Dickies-Mens-Genuine-Leather-Black/dp/B001FOR2U6/ref=sr_1_1?s=apparel&amp;ie=UTF8&amp;qid=1420399850&amp;sr=1-1&amp;keywords=dickies+belt,1,1
"Quest Nutrition Protein Chips, Cheddar & Sour Cream, 21g Protein, 3g Net Carbs, 130 Cals, 1 1/8 oz Bags, High Protein, Low Carb, Gluten Free, Soy Free, Potato Free, 8 Count","Health, Household & Baby Care",https://www.amazon.com/dp/B00OJ9NBAO/ref=cm_sw_r_cp_api_jxxxxb8MTC45G,1,1
"President, Domestic Camembert, 8 oz",Grocery & Gourmet Food,https://www.amazon.com/Prsident-Domestic-Camembert-8-oz/dp/B000QG6SUE?ie=UTF8&amp;fpw=fresh&amp;redirect=true&amp;ref=afx_lists_i2,1,1
"Kerrygold, Aged Cheddar, 7 oz",Grocery & Gourmet Food,https://www.amazon.com/Kerrygold-Aged-Cheddar-7-oz/dp/B0011EGW2O?ie=UTF8&amp;fpw=fresh&amp;redirect=true&amp;ref=afx_lists_i6,1,1
Sleep Master Sleep Mask,Beauty & Personal Care,https://www.amazon.com/dp/B0015NZ6FK/ref=wl_it_dp_o_pd_nS_ttl?_encoding=UTF8&amp;colid=IQ5M329TGG07&amp;coliid=I3OQ0VIYCC31OU,1,1
"Traverse Bay Fruit Co. Dried Cherries, 4-Pound Bag",Grocery & Gourmet Food,https://www.amazon.com/gp/product/B000H7LVKY/ref=oh_aui_search_detailpage?ie=UTF8&amp;psc=1,1,1
"French Kids Eat Everything: How Our Family Moved to France, Cured Picky Eating, Banned Snacking, and Discovered 10 Simple Rules for Raising Happy, Healthy Eaters",Books,https://www.amazon.com/French-Kids-Eat-Everything-Discovered/dp/006210330X,1,1
"Healthworks Cacao Nibs Raw Organic, 1lb",Grocery & Gourmet Food,https://www.amazon.com/Healthworks-Certified-Organic-Cacao-Ounce/dp/B004EKHMXU,1,1
"Columbus - Peppered Salame, 2 - 10 Ounce. Sticks",Grocery & Gourmet Food,https://www.amazon.com/dp/B00D0D1SWI/ref=pd_lpo_sbs_dp_ss_1?pf_rd_p=1944687642&amp;pf_rd_s=lpo-top-stripe-1&amp;pf_rd_t=201&amp;pf_rd_i=B000SKUD2M&amp;pf_rd_m=ATVPDKIKX0DER&amp;pf_rd_r=1TF4ASDR0A9146ENE0VB,1,1
"NuSweet Liquid Sucralose , Concentrated Liquid Sweetener, 4 Oz",Grocery & Gourmet Food,https://www.amazon.com/NuSweet-Liquid-Sucralose-Concentrated-Sweetener/dp/B00I28OQ7K/ref=sr_1_5?s=grocery&amp;ie=UTF8&amp;qid=1445959663&amp;sr=1-5&amp;keywords=ezsweetz,1,1
Proctor Silex 38526 Electric Skillet,Home & Kitchen,https://www.amazon.com/Proctor-Silex-38526-Electric-Skillet/dp/B00JR5AJAK/ref=zg_bs_13838481_3,1,1
"Tiger Corporation JBV-A10U-W 5.5-Cup Micom Rice Cooker with Food Steamer and Slow Cooker, White",Home & Kitchen,https://www.amazon.com/dp/B00KDNKTJG/ref=psdc_678540011_t1_B004S59E5K,1,1
"Jell-O Sugar-Free Instant Pudding & Pie Filling, Cheesecake, 1-Ounce Boxes (Pack of 24)",Grocery & Gourmet Food,https://www.amazon.com/Jell-O-Sugar-Free-Instant-Pudding-Cheesecake/dp/B000E1DR28,1,1
Oloves Olives Variety (Pack of 24),Grocery & Gourmet Food,https://www.amazon.com/gp/product/B00R8352XW/ref=oh_aui_detailpage_o06_s00?ie=UTF8&amp;psc=1,1,1
"Natural Sources Inc Concentrate, Black Cherry, 16-Ounce",Grocery & Gourmet Food,https://www.amazon.com/gp/product/B00014WIC8/ref=oh_aui_search_detailpage?ie=UTF8&amp;psc=1,1,1
The Gabriel Method: The Revolutionary DIET-FREE Way to Totally Transform Your Body,Books,https://www.amazon.com/Gabriel-Method-Revolutionary-DIET-FREE-Transform/dp/1582702187,1,1
Paderno World Cuisine Folding Spiral Vegetable Slicer / Countertop-Mounted Plastic Spiralizer Pro incl. 4 Different Blades Made of Stainless Steel,Home & Kitchen,https://www.amazon.com/Paderno-World-Cuisine-Spiralizer-4-Blade/dp/B00AW3B5MM,1,1
Anticancer: A New Way of Life,Books,https://www.amazon.com/Anticancer-A-New-Way-Life/dp/0670021644,1,1
"Lyte Balance Electrolyte Concentrate - natural re-hydrating energy boost; Pure, high Potassium + Magnesium formula. (16 oz)","Health, Household & Baby Care",https://www.amazon.com/Lyte-Balance-Electrolytes-hydrating-Potassium/dp/B009I4H25U/ref=sr_1_1_s_it?s=hpc&amp;ie=UTF8&amp;qid=1465927804&amp;sr=1-1&amp;keywords=lyte+balance,1,1
Conair Extra-Large Dial Analog Precision Scale,"Health, Household & Baby Care",https://www.amazon.com/Conair-Extra-Large-Analog-Precision-Scale/dp/B000OCK9KU/ref=sr_1_3?ie=UTF8&amp;qid=1440219642&amp;sr=8-3&amp;keywords=weight+scale+analog,1,1
Three Flowers Brilliantine Pomade Solid 3.25oz,Beauty & Personal Care,https://www.amazon.com/Three-Flowers-Brilliantine-Pomade-3-25oz/dp/B000GCIC6Q/ref=sr_1_3?ie=UTF8&amp;qid=1449808636&amp;sr=8-3&amp;keywords=tres+flores+brilliantine,1,1
