name,category,amazon_link,total_mentions,subreddit_mentions
Principia Ketogenica: Low Carbohydrate And Ketogenic Diets - Compendium Of Science Literature On The Benefits,eBooks,http://www.amazon.com/dp/B00N0KGKNI/,22,4
The Art and Science of Low Carbohydrate Living: An Expert Guide to Making the Life-Saving Benefits of Carbohydrate Restriction Sustainable and Enjoyable,Book,http://www.amazon.com/dp/0983490708/,45,3
The Art and Science of Low Carbohydrate Performance,Book,http://www.amazon.com/dp/0983490716/,49,2
"Good Calories, Bad Calories: Fats, Carbs, and the Controversial Science of Diet and Health",Book,http://www.amazon.com/dp/1400033462/,22,2
Why We Get Fat: And What to Do About It,Book,http://www.amazon.com/dp/0307474259/,45,2
"Clinical Lipidology: A Companion to Braunwald's Heart Disease, 2e",Book,http://www.amazon.com/dp/0323287867/,1,1
The Salt Fix: Why the Experts Got It All Wrong--and How Eating More Might Save Your Life,Book,http://www.amazon.com/dp/0451496965/,1,1
Human Brain Evolution: The Influence of Freshwater and Marine Food Resources,Book,http://www.amazon.com/dp/0470452684/,1,1
Optimal Design of Experiments: A Case Study Approach,Book,http://www.amazon.com/dp/0470744618/,1,1
Blindspot: Hidden Biases of Good People,Book,http://www.amazon.com/dp/0553804642/,4,1
Biochemistry (4th edition),Book,http://www.amazon.com/dp/0716720094/,1,1
"Bad Science: Quacks, Hacks, and Big Pharma Flacks",Book,http://www.amazon.com/dp/0865479186/,6,1
"Know Your Fats : The Complete Primer for Understanding the Nutrition of Fats, Oils and Cholesterol",Book,http://www.amazon.com/dp/0967812607/,1,1
"Death by Food Pyramid: How Shoddy Science, Sketchy Politics and Shady Special Interests Have Ruined Our Health",Book,http://www.amazon.com/dp/0984755128/,5,1
Introduction to Logic and Critical Thinking,Book,http://www.amazon.com/dp/1133049753/,2,1
Advanced Nutrition and Human Metabolism,Book,http://www.amazon.com/dp/1133104053/,4,1
Diabetes Epidemic & You,Book,http://www.amazon.com/dp/142517812X/,1,1
Everyday Bias: Identifying and Navigating Unconscious Judgments in Our Daily Lives,Book,http://www.amazon.com/dp/1442230835/,1,1
"The Big Fat Surprise: Why Butter, Meat and Cheese Belong in a Healthy Diet",Book,http://www.amazon.com/dp/1451624433/,15,1
Marks' Basic Medical Biochemistry: A Clinical Approach,Book,http://www.amazon.com/dp/1496324811/,1,1
Principia Ketogenica: Compendium Of Science Literature On The Benefits Of Low Carbohydrate And Ketogenic Diets,Book,http://www.amazon.com/dp/1500969591/,1,1
The End of Overeating: Taking Control of the Insatiable American Appetite,Book,http://www.amazon.com/dp/1605294578/,9,1
An Illustrated Book of Bad Arguments,Book,http://www.amazon.com/dp/1615192255/,10,1
Imagining Head-Smashed-In: Aboriginal Buffalo Hunting on the Northern Plains (Athabasca University Press),Book,http://www.amazon.com/dp/189742504X/,1,1
Trace Minerals Research - Concentrace Trace Mineral Drops - 8oz,Health and Beauty,http://www.amazon.com/dp/B000AMUWLK/,6,1
"Lypo-Spheric Vitamin C , 0.2 fl oz. - 30 Packets | 1,000 mg Vitamin C Per Packet | Liposome Encapsulated for Maximum Bioavailability | Professionally Formulated | 100% Non-GMO, Ultra-Potent Vitamin C | 1,000 mg Essential Phospholipids Per Packet",Health and Beauty,http://www.amazon.com/dp/B000CD9XGC/,5,1
SOD CHLOR TABS 1 GM 100,Health and Beauty,http://www.amazon.com/dp/B000GCN130/,5,1
Precision Xtra NFR Blood Glucose Monitoring System (Packaging May Vary),Health and Beauty,http://www.amazon.com/dp/B000N64MZA/,4,1
"Jarrow Formulas Saccharomyces Boulardii + MOS, 5 Billion Cells Per Capsule, Promotes Intestinal and Digestive Health, 90 Veggie Capsules",Health and Beauty,http://www.amazon.com/dp/B0013OVW0E/,9,1
How to Lie with Statistics,eBooks,http://www.amazon.com/dp/B00351DSX2/,2,1
"Wild Planet Sardines in Extra Virgin Olive Oil, Lightly Smoked, 4.4 Ounce Tin (Pack of 12)",Grocery,http://www.amazon.com/dp/B003H7YHUW/,5,1
The Art and Science of Low Carbohydrate Living:  An Expert Guide to Making the Life-Saving Benefits of Carbohydrate Restriction Sustainable and Enjoyable,eBooks,http://www.amazon.com/dp/B005CVV2AE/,20,1
EZ-Sweetz (1.05oz - Liquid Sweetener 400 Servings/Bottle),Grocery,http://www.amazon.com/dp/B009L3HWV2/,2,1
"The Big Fat Surprise: Why Butter, Meat and Cheese Belong in a Healthy Diet",eBooks,http://www.amazon.com/dp/B00A25FDUA/,7,1
BulkSupplements Pure Potassium Chloride Powder (1 Kilogram),Health and Beauty,http://www.amazon.com/dp/B00ENS39XK/,1,1
BulkSupplements Pure Glycine Powder (1 Kilogram),Health and Beauty,http://www.amazon.com/dp/B00EOXU0MM/,2,1
Anthropic Bias: Observation Selection Effects in Science and Philosophy (Studies in Philosophy),eBooks,http://www.amazon.com/dp/B00FVTSFK2/,1,1
"Läkerol Salmiak Licorice Sugarfree Pastilles, 0.8 oz Packages in a BlackTie Box (Pack of 12)",Grocery,http://www.amazon.com/dp/B00HCMBD4G/,1,1
Humbug!: The Skeptic's Field Guide to Spotting Fallacies and Deceptive Arguments,eBooks,http://www.amazon.com/dp/B00KBB0XEQ/,1,1
My Weigh SCMXL700T 700 lb 320kg Talking Bathroom Scale,Home Improvement,http://www.amazon.com/dp/B00MQ8A5UY/,8,1
Statistics Done Wrong: The Woefully Complete Guide,eBooks,http://www.amazon.com/dp/B00UMA61RE/,1,1
The Art of Thinking Clearly,Book,http://www.amazon.com/dp/0062219693/,3,1
"Metagenics - SPM Active, 60 Count",Health and Beauty,http://www.amazon.com/dp/B019FYPYRA/,1,1
Salt: A World History,Book,http://www.amazon.com/dp/0142001619/,31,1
"Concepts of Epidemiology: An integrated introduction to the ideas, theories, principles and methods of epidemiology",Book,http://www.amazon.com/dp/0192631551/,1,1
The Invisible Gorilla: How Our Intuitions Deceive Us,Book,http://www.amazon.com/dp/0307459667/,8,1
Dr. Bernstein's Diabetes Solution: The Complete Guide to Achieving Normal Blood Sugars,Book,http://www.amazon.com/dp/0316182699/,44,1
