name,category,amazon_link,total_mentions,subreddit_mentions
"Cool Gear Go-Gear Silicone Travel Containers, Assorted Sizes, 3-Pack",Home & Kitchen,https://www.amazon.com/Cool-Gear-Silicone-Containers-Assorted/dp/B006ZTBVX0,1,1
"ICE BREAKERS Sours Mints, (Green Apple, Tangerine, and Watermelon), 1.5 Ounce Container (Count of 8) (Halloween Candy)",Grocery & Gourmet Food,https://www.amazon.com/BREAKERS-Tangerine-Watermelon-1-5-Ounce-Containers/dp/B005UBGN5U,1,1
"Nu-Salt Substitute Shaker, 3 Ounce",Grocery & Gourmet Food,https://www.amazon.com/Nu-Salt-Substitute-Shaker-3-Ounce/dp/B004EPBMRC/ref=sr_1_1?s=grocery&amp;ie=UTF8&amp;qid=1456113150&amp;sr=1-1&amp;keywords=nu-salt,1,1
NoSalt Original Sodium-Free Salt Alternative 11 Ounce (Pack of 2),Grocery & Gourmet Food,https://www.amazon.com/gp/product/B0049IRCAA/ref=pd_lpo_sbs_dp_ss_2?pf_rd_p=1944687702&amp;pf_rd_s=lpo-top-stripe-1&amp;pf_rd_t=201&amp;pf_rd_i=B000H1558E&amp;pf_rd_m=ATVPDKIKX0DER&amp;pf_rd_r=0H3HXFPD28Z2QH44MXJ8,1,1
Morning Pep 5 LB 100% Pure Birch Xylitol sweetener (Not From Corn) NON GMO - KOSHER - GLUTEN FREE - PRODUCT OF USA. 5 LB,Amazon Launchpad,https://www.amazon.com/gp/product/B00PT66JYQ/ref=oh_aui_detailpage_o03_s00?ie=UTF8&amp;psc=1,1,1
Russell Stover Sugar Free 4 Flavor Assortment Candies 20 5/8 oz Value Bag,Grocery & Gourmet Food,https://www.amazon.com/Russell-Stover-Flavor-Assortment-Candies/dp/B0044YMTKM,1,1
"Knorr Cube Bouillon, Chicken 2.5 oz, 6 ct",Grocery & Gourmet Food,https://www.amazon.com/Knorr-Cube-Bouillon-Chicken-2-5/dp/B000VB0COM/ref=sr_1_3?ie=UTF8&amp;qid=1456113403&amp;sr=8-3&amp;keywords=bullion+cube,1,1
Alacer Corp. ElectroMIX Emergen-C Lemon-Lime - Drink Mix: 30 PKTS (4.2 oz),"Health, Household & Baby Care",https://www.amazon.com/Alacer-Corp-ElectroMIX-Emergen-C-Lemon-Lime/dp/B000KHIYNI,1,1
Glow Kids: How Screen Addiction Is Hijacking Our Kids-and How to Break the Trance,Books,https://www.amazon.com/Glow-Kids-Addiction-Hijacking-Kids/dp/1250097991,1,1
"Old Wisconsin Beef Snack Sticks In a Jar, 24 Ounce",Prime Pantry,https://www.amazon.com/dp/B00VG37VE8/ref=cm_sw_r_awd_xLg4vb9QJPSAJ,1,1
Brown Sweetener: 16 oz by Just Like Sugar,"Health, Household & Baby Care",https://www.amazon.com/Brown-Sweetener-Just-Like-Sugar/dp/B004307EL6/ref=sr_1_1?ie=UTF8&amp;qid=1426886738&amp;sr=8-1&amp;keywords=just+like+sugar+brown,1,1
"Fitpacker Meal Prep Containers Certified BPA-free - Made in the USA - Reusable, Microwavable - 28 Oz - 10pk",Home & Kitchen,https://www.amazon.com/gp/product/B00W69Y28E?psc=1&amp;redirect=true&amp;ref_=oh_aui_detailpage_o06_s00,1,1
Fresh Gourmet Parmesan Cheese Crisps-Case of 9 (nine) 1.76 oz Packages,Grocery & Gourmet Food,https://www.amazon.com/Fresh-Gourmet-Parmesan-Crisps-Case-Packages/dp/B00Z1F4RJO,1,1
"Tyson Chunk Chicken Breast, 7-Ounce Pouches (Pack of 12)",Grocery & Gourmet Food,https://www.amazon.com/Tyson-Chicken-Breast-7-Ounce-Pouches/dp/B003NRMHFI,1,1
"No Salt Salt Substitute, 11 Oz",Grocery & Gourmet Food,https://www.amazon.com/No-Salt-Substitute-11-Ounce-Can/dp/B000H185N6,1,1
"BlenderBottle Classic Shaker Bottle, 28-Ounce, Clear/Black",Home & Kitchen,https://www.amazon.com/BlenderBottle-Classic-Shaker-Bottle-28-ounce/dp/B001KADGMI,1,1
"Slow-Mag Magnesium Chloride Dietary Supplement with Calcium, 60 Count (Pack of 2)","Health, Household & Baby Care",https://www.amazon.com/Slow-Mag-Magnesium-Chloride-Calcium-Tablets/dp/B001G7QZ8C/ref=sr_1_1?ie=UTF8&amp;qid=1456113181&amp;sr=8-1&amp;keywords=slo-mag,1,1
"Cardiovascular Research Magnesium Taurate Capsules, 60 Count","Health, Household & Baby Care",https://www.amazon.com/Cardiovascular-Research-Magnesium-Taurate-Capsules/dp/B00014D5TS,1,1
3 Silicone Wedding Ring Silicone Wedding Band for Men Rubber Thin Line Stripe No Glue One Piece for Climbing and Outdoors,Sports & Outdoors,https://www.amazon.com/dp/B01661786K/ref=cm_sw_r_cp_api_KdSuybGXSZ06G,1,1
"Just the Cheese Mini Round Snacks, Zesty Pizza, 0.5-Ounce Bags (Pack of 16)",Grocery & Gourmet Food,https://www.amazon.com/gp/product/B000IHNCP0/ref=oh_aui_detailpage_o00_s00?ie=UTF8&amp;psc=1,1,1
"Purina Fortiflora Feline Nutritional Supplement Box, 30gm",Pet Supplies,https://www.amazon.com/Purina-Fortiflora-Feline-Nutritional-Supplement/dp/B001650OE0/ref=sr_1_2?s=pet-supplies&amp;ie=UTF8&amp;qid=1439846680&amp;sr=1-2&amp;keywords=fortiflora,1,1
"93835 Hefty EZ Foil Bake Mini Loaf Pan 5.75""x3.25""x2"" 12-5PKS/CS",Home & Kitchen,https://www.amazon.com/93835-Hefty-Foil-x3-25-12-5PKS/dp/B000ZNUFHK/ref=redir_mobile_desktop?_encoding=UTF8&amp%3BdpID=51cl1ExBGAL&amp%3BdpPl=1&amp%3Bkeywords=mini%20loaf%20pan%20aluminum&amp%3Bpi=SY200_QL40&amp%3Bref=plSrch&amp%3Bsr=8-2&qid=1449151691&ref_=mp_s_a_1_2,1,1
RINGO: 6-Pack of the First Invisible Ring Sizer with Transparent Memory Polymer for the Perfect Fit on Your Finger Every Time - Not Metal,"Arts, Crafts & Sewing",https://www.amazon.com/RINGO-Invisible-Transparent-Polymer-Perfect/dp/B01LWTZC9H/ref=redir_mobile_desktop?_encoding=UTF8&amp%3BdpID=41cx3hyJfvL&amp%3BdpPl=1&amp%3Bkeywords=ring%20size%20adjuster&amp%3Bpi=AC_SX236_SY340_QL65&amp%3Bqid=1492455229&amp%3Bref=plSrch&amp%3Bsr=8-2&ref_=mp_s_a_1_2,1,1
"Solaray Magnesium Glycinate Dietary Supplement, 400 mg per 4 Capsules, 120 Count","Health, Household & Baby Care",https://www.amazon.com/Solaray-Magnesium-Glycinate-Supplement-Count/dp/B000Z1GLJI,1,1
Best Zucchini Spiralizer with 6 Ebooks and Spiral Slicer Recipes Cookbook - Eat Healthy Pasta with this Vegetable Spaghetti Noodle Maker,Home & Kitchen,https://www.amazon.com/gp/product/B00KOHAMV6/ref=oh_aui_detailpage_o01_s00?ie=UTF8&amp;psc=1,1,1
Blue Diamond Almonds Sea Salt Dark Chocolate 6oz Can,Grocery & Gourmet Food,https://www.amazon.com/Blue-Diamond-Almonds-Salt-Chocolate/dp/B00KXS2FSE/ref=sr_1_32?s=grocery&amp;ie=UTF8&amp;qid=1424967360&amp;sr=1-32&amp;keywords=dark+chocolate+almonds,1,1
"Spiral Vegetable Slicer, Hand Held with Cleaning Brush. Zucchini and Carrot Veggie Pasta Maker",Home & Kitchen,https://www.amazon.com/Spiral-Vegetable-Slicer-Cleaning-Zucchini/dp/B00GHA3S4C/ref=sr_1_9?s=kitchen&amp;ie=UTF8&amp;qid=1426886578&amp;sr=1-9&amp;keywords=spiralizer,1,1
