name,category,amazon_link,total_mentions,subreddit_mentions
CM Storm QuickFire TK - Compact Mechanical Gaming Keyboard with CHERRY MX RED Switches and Fully LED Backlit,Personal Computer,http://www.amazon.com/dp/B00AOIRCI6/,38,4
"TOMOKO Mechanical Gaming Keyboard, 87-Key Water-resistant Gaming Keyboard with Blue Switch Attached Anti-ghosting Key Cap Puller for Laptop Computer Macbook",Personal Computer,http://www.amazon.com/dp/B01DBJTZU2/,83,3
Logitech Keyboard K120,Personal Computer,http://www.amazon.com/dp/B003ELVLKU/,21,2
"E-Element Z-88 RGB LED Backlit Water-Proof Compact Mechanical Gaming Keyboard, 81 Keys Anti-Ghost, Aluminum Panel, DIY Blue Switches, Black",PC Accessory,http://www.amazon.com/dp/B01FXF7HFC/,24,2
"Redragon Karura K502 USB Gaming Keyboard, 7 Switchable Backlight Colors, 104+ Keys",Personal Computer,http://www.amazon.com/dp/B00LSGKEC4/,9,2
Dell Wired Keyboard KB216 (580-ADMT),Personal Computer,http://www.amazon.com/dp/B00ZYLMQH0/,6,2
Seahorse SE710 Protective Case with Foam (Black),Sports,http://www.amazon.com/dp/B001A1NSSO/,1,1
Logitech Illuminated Ultrathin Keyboard K740 with Laser-etched Backlit Keyboard and Soft-touch Palm Rest,CE,http://www.amazon.com/dp/B001F51G16/,11,1
"Finish Line Extreme Fluoro 100% DuPont Teflon Grease, 20g Syringe",Sports,http://www.amazon.com/dp/B002L5UL92/,11,1
Pyle-Pro PMEM1 Headworn Omni-Directional  Microphone (3.5mm / 1/4''),Musical Instruments,http://www.amazon.com/dp/B003D2S7HA/,3,1
Adesso Multimedia Desktop USB Keyboard with 2-Port USB Hub (AKB-131HB),Personal Computer,http://www.amazon.com/dp/B003N3A5WY/,1,1
U473D Slim Multimedia Keyboard with 2 USB Port,PC Accessory,http://www.amazon.com/dp/B004Y0ILC6/,3,1
"Buna O-Ring, 50A Durometer, Round, Black",BISS,http://www.amazon.com/dp/B0052AU0HQ/,1,1
"Perixx PERIBOARD-407B, Mini Keyboard - Black - USB - 12.60""x5.55""x0.98"" Dimension - Piano Finish - Chiclet Key Design - US English Layout",Personal Computer,http://www.amazon.com/dp/B0053O9ZNQ/,1,1
HP TouchPad Wireless Keyboard,CE,http://www.amazon.com/dp/B0055QYJK6/,1,1
HP Wireless Elite Keyboard v2,CE,http://www.amazon.com/dp/B005HNHRA6/,7,1
CM Storm QuickFire Rapid - Tenkeyless Mechanical Gaming Keyboard with Cherry MX Blue Switches,Personal Computer,http://www.amazon.com/dp/B0068INSUM/,143,1
Logitech G100 Laser Gaming Mouse and Keyboard Combo,CE,http://www.amazon.com/dp/B0079B4Y8M/,2,1
"Perixx PERIBOARD-409U, Mini Keyboard - USB - 12.40x5.79x0.79 Inch Dimension - Piano Finish Black - US English Layout",PC Accessory,http://www.amazon.com/dp/B007LQKFG0/,1,1
CM Storm QuickFire Rapid - Tenkeyless Mechanical Gaming Keyboard with CHERRY MX Brown Switches,Personal Computer,http://www.amazon.com/dp/B007VDKLLM/,85,1
Dell 2GR91 Slim USB 104-Key Keyboard with Fold-out Feet for Select Dell Models (Black),PC Accessory,http://www.amazon.com/dp/B008C4JA66/,2,1
Logitech Washable Keyboard K310,Personal Computer,http://www.amazon.com/dp/B008D1JRIO/,20,1
Das Keyboard Model S Professional Soft Tactile MX Brown Mechanical Keyboard (DASK3MKPROSIL),Personal Computer,http://www.amazon.com/dp/B008PFDUW2/,5,1
Noppoo Choc Mini 84 NKRO 1ms REALKEY (RK) Technology Mechanical Gaming Keyboard (Red Switches/POM KeyCaps),Personal Computer,http://www.amazon.com/dp/B0091QOCNA/,11,1
CM Storm QuickFire TK - Compact Mechanical Gaming Keyboard with CHERRY MX BLUE Switches and Fully LED Backlit,Personal Computer,http://www.amazon.com/dp/B00A378L4C/,49,1
"ROCCAT ISKU FX Multicolor Key Illuminated Gaming Keyboard, Black",Personal Computer,http://www.amazon.com/dp/B00AJILG1K/,2,1
Cherry MX Rubber O-Ring Switch Dampeners Blue 40A-R - 0.4mm Reduction (125pcs),PC Accessory,http://www.amazon.com/dp/B00AZQ2OF8/,13,1
USA Majestouch MINILA 67 Key Tactile Action Keyboard FFKB67M/EB,Personal Computer,http://www.amazon.com/dp/B00BEVVFD0/,8,1
CM Storm QuickFire Stealth - Compact Mechanical Gaming Keyboard with CHERRY MX BLUE Switches and Covert Keycaps,Personal Computer,http://www.amazon.com/dp/B00CKJ2EZI/,3,1
HP Wired USB Keyboard K1500 (Black),Personal Computer,http://www.amazon.com/dp/B00E4TOWR0/,7,1
CM Storm QuickFire Ultimate - Full Size Mechanical Gaming Keyboard with CHERRY MX RED Switches and Fully LED Backlit,Personal Computer,http://www.amazon.com/dp/B00EJ8CKIY/,10,1
Signstek HIFI USB to Coaxial S/PDIF Converter Convert Digital to Analogue Signal Mini USB DAC PCM,PC Accessory,http://www.amazon.com/dp/B00FEDHHKE/,28,1
Thermaltake Tt e SPORTS Poseidon Z Blue Switches with 4-Level Brightness Blue LED Mechanical Gaming Keyboard KB-PIZ-KLBLUS-01,Personal Computer,http://www.amazon.com/dp/B00HZE2PJS/,42,1
Razer BlackWidow Tournament Edition - Essential Mechanical Gaming Keyboard - Compact Layout - Tactile & Clicky Razer Green Switches,Personal Computer,http://www.amazon.com/dp/B00IG3GPC0/,12,1
Razer BlackWidow Ultimate 2014 Elite Mechanical Gaming Keyboard - Green Switch,Personal Computer,http://www.amazon.com/dp/B00IG3GPTS/,10,1
"Corsair Gaming K70 Mechanical Gaming Keyboard, Backlit Red LED, Cherry MX Blue (CH-9000076-NA)",Personal Computer,http://www.amazon.com/dp/B00M5DUJQ0/,11,1
The Aviator Keyboard,PC Accessory,http://www.amazon.com/dp/B00MJ3LSMA/,2,1
"Gaming Keyboard, UtechSmart Saturn RGB Visual Effect Wired Gaming Keyboard with Rainbow LED Backlit",Personal Computer,http://www.amazon.com/dp/B00MULE6KW/,1,1
"How Nice® Wireless Keyboard Combo With Smart Laser Optical Mouse Fashion Suspended Mechanical Touch 2.4G Keyboard and Mouse For Laptop,Desktop - Orange",PC Accessory,http://www.amazon.com/dp/B00N0KJZKI/,1,1
"Bluetooth Keyboard, Jelly Comb Universal Wireless Bluetooth Keyboard Ultra Slim for Apple iPad Pro, iPad mini 4/3/2/1, iPhone/Touch with iOS 4 & later, Android Tablets (Xoom,Galaxy Tab), Windows Mobile OS 6.0 & later (Black)",PC Accessory,http://www.amazon.com/dp/B00NOE7412/,8,1
"Perixx PERIBOARD-518H US, Wired USB Keyboard with Trackball - 14.88""x7.76""x1.18"" Dimension - Built-in Numeric Keypad - Silent X Type Keys",Personal Computer,http://www.amazon.com/dp/B00NY3SU4S/,1,1
Tesoro Excalibur G7NL Red Mechanical Switch Blue LED Backlit Illuminated Mechanical Gaming Keyboard TS-G7NL (RD),Personal Computer,http://www.amazon.com/dp/B00O4F0V4W/,1,1
Mechanical Keyboard - KBC Poker 3 (Pok3r) - Black Case - PBT Keycaps - Cherry Mx-Brown [Metal Casing],Personal Computer,http://www.amazon.com/dp/B00OFM5AC2/,10,1
Mechanical Keyboard - KBC Poker 3 - Black Case - PBT Keycaps - Cherry Mx-Red [Metal Casing],Personal Computer,http://www.amazon.com/dp/B00OFM67XS/,2,1
Logitech  G710 Blue Mechanical Gaming Keyboard with Cherry MX Blue Switches for Tactile High-Speed Feedback (920-006519),Personal Computer,http://www.amazon.com/dp/B00QI2WPJ8/,14,1
Mechanical Keyboard - Lolita Spyder 87 [Kailh Brown Switch],Video Games,http://www.amazon.com/dp/B00T1P6F1S/,14,1
Mechanical Keyboard - Ganss G.S 87 [Cherry MX-Red Switch],Video Games,http://www.amazon.com/dp/B00T1UHVEI/,1,1
Rosewill Mechanical Gaming Keyboard with Cherry MX Red Switch (RK-9000V2 RE),Personal Computer,http://www.amazon.com/dp/B00UBQZPXK/,8,1
"Arteck HB030B Universal Slim Portable Wireless Bluetooth 3.0 7-Colors Backlit Keyboard with Built in Rechargeable Battery, Black",Personal Computer,http://www.amazon.com/dp/B00X5P8BJO/,8,1
Razer DeathStalker Chroma - Multi-Color RGB Membrane Gaming Keyboard,Personal Computer,http://www.amazon.com/dp/B00ZTRW020/,5,1
Karnotech® Foldable Silicone Keyboard USB Wired Silicon Flexible Soft Waterproof Roll Up Silica Gel Computer Desktop (103 Keys) Keyboard for PC Laptop Notebook for library work class indoor environment Black,Personal Computer,http://www.amazon.com/dp/B0118J87VU/,2,1
Logitech G410 Atlas Spectrum RGB Tenkeyless Mechanical Gaming Keyboard (920-007731),Personal Computer,http://www.amazon.com/dp/B01645FHEI/,5,1
Redragon K552 KUMARA LED Backlit Mechanical Gaming Keyboard (Black),Personal Computer,http://www.amazon.com/dp/B016MAK38U/,89,1
New Genuine Dell SK-8115 KOREAN Wired USB Keyboard DJ321,PC Accessory,http://www.amazon.com/dp/B016OVPBFC/,1,1
Sungwoo Foldable Silicone Keyboard USB Wired Waterproof Rollup Keyboard for PC Notebook Laptop (Black),Personal Computer,http://www.amazon.com/dp/B0179N39KS/,5,1
Qisan Mechanical Keyboard Gaming Keyboard Black Switch 68-Keys Mini Design (60%) Gaming Wired Keyboard White Silver Magicforce,Personal Computer,http://www.amazon.com/dp/B01ABUIYVU/,40,1
"AULA Sapphire Mechanical Keyboard with Blue Switch, Ergonomic Keyboard Gaming Keyboard and Computer Keyboard",Personal Computer,http://www.amazon.com/dp/B01BY4Q31K/,1,1
"Cooler Master MasterKeys Pro L RGB Mechanical Gaming Keyboard, Cherry MX Red Switches, Per-Key RGB Lighting, Full Size",Personal Computer,http://www.amazon.com/dp/B01D3BDNLU/,11,1
MechanicalEagle Z-77 Multicolor Backlit Mechanical Keyboard Tenkeyless Wired Gaming Keyboard with Blue Switches - DIY Replaceable Switches - Black,Personal Computer,http://www.amazon.com/dp/B01DBVH16U/,24,1
"Hcman Teamwolf Zhuque Pure Alloy Panel Mechanical Gaming Keyboard , Mix Color Led Backlit, 7 Light Modes Office Keyboard(Black Keycap 87 key Black Switch)",Personal Computer,http://www.amazon.com/dp/B01EOHN73Q/,2,1
"DREVO 84 Key Gramr Backlit Edition Tenkeyless Mechanical Gaming Keyboard, Brown Switch Black",Personal Computer,http://www.amazon.com/dp/B01H6DHITE/,22,1
Mechanical Keyboard Gaming Keyboard Brown Switch 100% Full Size 108 keys GATERON switch with White Backlight Case White Magicforce by Qisan,PC Accessory,http://www.amazon.com/dp/B01HHTFSIK/,37,1
"Cooler Master MasterKeys Pro L White Mechanical Gaming Keyboard, Cherry MX Blue Switches, Per-Key White LED Lighting, Full Size",Personal Computer,http://www.amazon.com/dp/B01ITE96EY/,12,1
DREVO Gramr 84 Key Backlit USB Wired Tenkeyless Mechanical Gaming Keyboard Black Switch-Black,Personal Computer,http://www.amazon.com/dp/B01K1XDTJY/,7,1
"Logitech G403 Prodigy RGB Gaming Mouse – 16.8 Million Color Backlighting, 6 Programmable Buttons, Onboard Memory, Up to 12,000 DPI",Personal Computer,http://www.amazon.com/dp/B01KUAMCV4/,19,1
"E-Element Z-88 Rainbow LED Backlit Water-Proof Mechanical Gaming Keyboard with 81 Keys Anti-Ghost keys, DIY Blue Switches, Black",PC Accessory,http://www.amazon.com/dp/B01M3UQX1Y/,1,1
CORSAIR K55 RGB Gaming Keyboard - Quiet & Satisfying LED Backlit Keys - Media Controls - Wrist Rest Included – Onboard Macro Recording,Personal Computer,http://www.amazon.com/dp/B01M4LIKLI/,7,1
Microsoft Surface Ergonomic Keyboard,Personal Computer,http://www.amazon.com/dp/B01MFCTRZM/,1,1
The Trigger Point Therapy Workbook: Your Self-Treatment Guide for Pain Relief (A New Harbinger Self-Help Workbook),Book,http://www.amazon.com/dp/1608824942/,21,1
DREVO Tyrfing 87-Key White Backlit Wired Mechanical Gaming Keyboard Red Switch Black,Personal Computer,http://www.amazon.com/dp/B01N1OGPM8/,4,1
Happy Hacking Keyboard Lite2 USB (Black),Personal Computer,http://www.amazon.com/dp/B0000U1DJ2/,2,1
"008 Buna-N O-Ring, 70A Durometer, Black, 3/16"" ID, 5/16"" OD, 1/16"" Width (Pack of 100)",BISS,http://www.amazon.com/dp/B000FMWLR8/,27,1
"3M Gel Wrist Rest for Keyboards, Soothing Gel Comfort with Durable, Easy to Clean Leatherette Cover, Antimicrobial Product Protection, 19"", Black (WR310LE)",Office Product,http://www.amazon.com/dp/B000WU4H5C/,2,1
"3M Precise Mouse Pad with Gel Wrist Rest, Soothing Gel Comfort with Durable, Easy to Clean Leatherette Cover, Optical Mouse Performance and Battery Saving Design, 9.2"" x 8.7"", Black (MW310LE)",Office Product,http://www.amazon.com/dp/B000ZHB2HS/,1,1
Keyb 11IN Ultraslim Us 86-KEY USB & PS/2 Mech. Key Switch,Personal Computer,http://www.amazon.com/dp/B001920IYG/,1,1
