name,category,amazon_link,total_mentions,subreddit_mentions
Hank Hill's The Boy Ain't Right,Book,http://www.amazon.com/dp/0060953055/,2,2
Wd-40 for the Soul: The Guide to Fixing Everything,Book,http://www.amazon.com/dp/1575000997/,2,1
Feels So Good,Music,http://www.amazon.com/dp/B001J1UV7Q/,1,1
King Of The Hill Shirt Propane Adult Blue Heather Tee T-Shirt,Apparel,http://www.amazon.com/dp/B00J4UMD52/,1,1
Hank Hill King Of The Hill WHITE Vinyl Car/Laptop/Window/Wall Decal,Home Improvement,http://www.amazon.com/dp/B016Z1AWOG/,1,1
