name,category,amazon_link,total_mentions,subreddit_mentions
Shout It Out Loud: The Story of Kiss's Destroyer and the Making of an American Icon,Book,http://www.amazon.com/dp/1617136182/,2,2
Fargo Rock City: A Heavy Metal Odyssey in Rural North Dakota,Book,http://www.amazon.com/dp/0743406567/,1,1
"Encyclopedia of KISS: Music, Personnel, Events and Related Subjects",Book,http://www.amazon.com/dp/0786498021/,1,1
Kiss & Tell (NEW SPECIAL EDITION),Book,http://www.amazon.com/dp/0965879402/,1,1
"Gene, Ace, Peter & Paul: A detailed exploration of the 1978 KISS solo albums",Book,http://www.amazon.com/dp/0982253761/,1,1
Kiss: Greatest Hits Volume 1,Book,http://www.amazon.com/dp/1613772262/,1,1
Killing Yourself to Live: 85% of a True Story,Book,http://www.amazon.com/dp/0743264460/,3,1
KISS Collectors Memorabilia: 2012 Demon & Starchild Boots Christmas Ornaments,Single Detail Page Misc,http://www.amazon.com/dp/B00BRNARKW/,1,1
