name,category,amazon_link,total_mentions,subreddit_mentions
The Life-Changing Manga of Tidying Up: A Magical Story,Book,http://www.amazon.com/dp/0399580530/,7,3
The Life-Changing Magic of Tidying Up: The Japanese Art of Decluttering and Organizing,Book,http://www.amazon.com/dp/1607747308/,145,2
The Itty Bitty Kitchen Handbook: Everything You Need to Know About Setting Up and Cooking in the Most Ridiculously Small Kitchen in the World--Your Own,Book,http://www.amazon.com/dp/0767920163/,1,1
Mindfulness in Plain English,Book,http://www.amazon.com/dp/0861719069/,47,1
168 Hours: You Have More Time Than You Think,Book,http://www.amazon.com/dp/159184410X/,2,1
Cuisipro Stainless Steel Measuring Spoon Set,Kitchen,http://www.amazon.com/dp/B00004SU1I/,2,1
Wiremold C210 Cord Mate II Kit,Home Improvement,http://www.amazon.com/dp/B00004W3ZQ/,3,1
Case Logic CD/DVDW-92 100 Capacity Classic CD/DVD Wallet (Black),Speakers,http://www.amazon.com/dp/B00005ATMD/,2,1
Stanley 33-115 10-Foot-by-1/4-Inch PowerLock Pocket Tape Rule,Home Improvement,http://www.amazon.com/dp/B00009OYGH/,2,1
Kinetic Classicor Series Wrought-Iron Oval Pot Rack 12021,Kitchen,http://www.amazon.com/dp/B0000DJBIN/,3,1
Quakehold! 88111 Museum Putty Neutral,Home Improvement,http://www.amazon.com/dp/B0002VA9NA/,10,1
Fellowes Wire Drawer Sorter (73014),Office Product,http://www.amazon.com/dp/B0006HXMCK/,1,1
Black Leather Jewelry Box Travel Case and Lock,Home,http://www.amazon.com/dp/B0006JCGUM/,1,1
COVER ONLY for Whitmor Garment Rack,Home,http://www.amazon.com/dp/B0007MHCWU/,1,1
"Whitmor Supreme Garment Rack, Chrome with Wheels",Home,http://www.amazon.com/dp/B0007OBFA8/,1,1
"Bajer Design& Marketing 5234 Ez Fold'r Laun Basket [Misc.], 19-1/4"" x 19-1/4"" x 14""",Home,http://www.amazon.com/dp/B0010KZCFC/,2,1
"Shark Oven Mitt, Quilted Cotton, Designed for Light Duty Use, by Boston Warehouse",Home,http://www.amazon.com/dp/B00144A7QS/,1,1
"VELCRO Brand One Wrap Thin Ties, Black, 8 x 1/2-Inch, 100 Count (91140)",Office Product,http://www.amazon.com/dp/B001E1Y5O6/,206,1
"Sugarbooger Children's Closet Dividers, Pink Dots",Baby Product,http://www.amazon.com/dp/B001KYA0GO/,1,1
Highland 1932600 Car Trash Keeper,Automotive Parts and Accessories,http://www.amazon.com/dp/B0027QWNGO/,1,1
Rubbermaid Regeneration Recycled Deep-Drawer Desk Organizer,Office Product,http://www.amazon.com/dp/B002JG48R4/,1,1
Atlantic 74604729 Movie Sleeves,Speakers,http://www.amazon.com/dp/B002JR2V7C/,1,1
"simplehuman Triple Wall Mount Shower Pump, 3 x 15 fl. oz. Shampoo and Soap Dispensers, Stainless Steel",Home,http://www.amazon.com/dp/B002YNQX16/,1,1
OXO Good Grips Deep Clean Brush Set,Home,http://www.amazon.com/dp/B003M8GMS6/,3,1
"Ziploc Big Bag Double Zipper, X-Large, 4-Count",Health and Beauty,http://www.amazon.com/dp/B003U6A3EY/,12,1
IRON ON HEMMING TAPE,CE,http://www.amazon.com/dp/B005O9WU9Q/,4,1
"MIU COLOR Drawer Organizer, Closet Organizer Bra Underwear Drawer Divider 4 Set Beige",Home,http://www.amazon.com/dp/B009A3HTXY/,5,1
"ClosetMaid 3456 Large Shelf, White",Home,http://www.amazon.com/dp/B00AES2XB2/,2,1
The Little Paris Kitchen: 120 Simple But Classic French Recipes,eBooks,http://www.amazon.com/dp/B00BJ7G1VK/,1,1
"Seville Classics Expandable Closet Organizer System, UltraZinc",Home,http://www.amazon.com/dp/B00BL7GBMM/,1,1
Tools of Life® Car Hammer Seatbelt Cutter Window Breaker Emergency Escape Tool,Automotive Parts and Accessories,http://www.amazon.com/dp/B00CB8WM2S/,24,1
BLACK+DECKER BDH2020FL 20V Max Lithium Flex Vac with Pet Hair Brush - Cordless,Home,http://www.amazon.com/dp/B00CCYLBZ0/,1,1
"Umbra Pocketta Hanging Shoe/Handbag Organizer, Black",Home,http://www.amazon.com/dp/B00EV5EQ2S/,1,1
Let's Clean Up Your Life / Jinsei ga Tokimeku Katazuke no Maho (Japanese Movie with English Subtitles),DVD,http://www.amazon.com/dp/B00IYXPLX6/,1,1
"J.S. Hanger Natural Solid Wooden Collection Slack Hanger, Wood Skirt Hangers, Natural Polished, Set of 10",Home,http://www.amazon.com/dp/B00J5AS9ZE/,2,1
Home Basics Vented Stainless Steel Toilet Brush Holder,Home,http://www.amazon.com/dp/B00JB20IDW/,1,1
SNOWHALE Ultra Lightweight Packable Day Pack Hiking Traveling Camping Backpack 0712 (Black),Sports,http://www.amazon.com/dp/B00LXR04NC/,1,1
"Reditainer Deli Food Storage Containers with Lid, 16-Ounce, 36-Pack",Kitchen,http://www.amazon.com/dp/B00M9Z4SXY/,8,1
Premium Velvet Hangers Heavy duty - 50 Pack Clothes Hangers - Non slip Black Suit hangers - Clothes Hanger Hook swivel 360 - Ultra Thin,Home,http://www.amazon.com/dp/B00NMTUBF0/,2,1
(2 Pack) Magic Lint Brush Pet Hair Remover Clothing with Swivel,Pet Products,http://www.amazon.com/dp/B00NP677TI/,1,1
"Corelle Livingware 18-Piece Glass Dinnerware Set, Winter Frost White, Service for 6",Kitchen,http://www.amazon.com/dp/B00R790CLY/,1,1
"Sagler Measuring Cup Set, 6 Piece Heavy-duty Stainless Steel Measuring Cups",Kitchen,http://www.amazon.com/dp/B00V5EFWTO/,1,1
"Mini Marble Composition Books, Notebooks, Red, Blue and Green, 6-ct, 300 Total Pages",Office Product,http://www.amazon.com/dp/B00WRDIS9I/,1,1
ReBagMe Large Reusable Grocery Bag Totes with Extra Reinforced Handles - Brown (Pack of 10),Kitchen,http://www.amazon.com/dp/B00Y17OIR4/,1,1
"Pasow fastening tape Cable Tie Double Side Nylon Strap Power Wire Management 1 Roll Hook (25 Yards, Style 1)",Home Improvement,http://www.amazon.com/dp/B0167ZMNSS/,1,1
Cargo Trunk Organizer Collapsible Portable,Automotive Parts and Accessories,http://www.amazon.com/dp/B01AHK0J9Y/,1,1
"HIO 3-Tier Metal Plant Stand, Classy Scrollwork and Weaving Cover, 9""Long x 17""Wide x 51"" High",Lawn & Patio,http://www.amazon.com/dp/B01BGL3K1C/,1,1
Memory Box,Art and Craft Supply,http://www.amazon.com/dp/B01G7VGSBA/,1,1
"Sterilite 25306P01 3 Drawer Wide Weave Tower, Espresso Frame & Drawers w/ Driftwood Handles, 1-Pack",Home,http://www.amazon.com/dp/B01GSU5GWC/,4,1
"SimpleHouseware 6 Shelves Hanging Closet Organizer, Bronze",Home,http://www.amazon.com/dp/B01LYVDZIT/,2,1
Retrain Your Brain: Cognitive Behavioral Therapy in 7 Weeks: A Workbook for Managing Depression and Anxiety,eBooks,http://www.amazon.com/dp/B01M0ILKMQ/,1,1
The Art of Discarding: How to Get Rid of Clutter and Find Joy,Book,http://www.amazon.com/dp/0316558923/,1,1
Tangkula DIY Cube Storage Organizer 3 Tier 9 Cube Bookcase,Office Product,http://www.amazon.com/dp/B071Z2VCGN/,1,1
"Simplicity Parenting: Using the Extraordinary Power of Less to Raise Calmer, Happier, and More Secure Kids",Book,http://www.amazon.com/dp/0345507983/,7,1
