name,category,amazon_link,total_mentions,subreddit_mentions
Politics Among Nations,Book,http://www.amazon.com/dp/007289539X/,2,2
Blood and Belief: The PKK and the Kurdish Fight for Independence,Book,http://www.amazon.com/dp/0814757111/,3,2
The Miracle of the Kurds: A Remarkable Story of Hope Reborn In Northern Iraq,Book,http://www.amazon.com/dp/1613756518/,2,2
Invisible Nation: How the Kurds' Quest for Statehood Is Shaping Iraq and the Middle East,Book,http://www.amazon.com/dp/0802717438/,3,1
"Kurdistan on the Global Stage: Kinship, Land, and Community in Iraq",Book,http://www.amazon.com/dp/0813563526/,1,1
Kurdistan Tour Guide 2015-2016,Book,http://www.amazon.com/dp/0996266704/,1,1
"Memed, My Hawk",Book,http://www.amazon.com/dp/159017139X/,2,1
A Modern History of the Kurds,Book,http://www.amazon.com/dp/1850434166/,1,1
The Ayyubid Era: Art and Architecture in Medieval Syria (Islamic Art in the Mediterranean),Book,http://www.amazon.com/dp/3902782161/,1,1
"The Greatest Conquerors of the Middle Ages: Charlemagne, Saladin and Genghis Khan",eBooks,http://www.amazon.com/dp/B009QPGVBM/,1,1
Traditional Kurdish Food: An insight into Kurdish culinary heritage,eBooks,http://www.amazon.com/dp/B00UD9WODE/,1,1
The Kurdish Cookbook,eBooks,http://www.amazon.com/dp/B01LZ0DZ5I/,1,1
Holt Physics: STUDENT EDITION 2006,Book,http://www.amazon.com/dp/0030735483/,1,1
Flylife Large Flag People s Protection Units YPG Flag official armed wing of the Kurdish Supreme Committee Flag 3x5ft banner,Lawn & Patio,http://www.amazon.com/dp/B01MFA41MU/,1,1
Kurdish-English Dictionary: Ferhenga Kurmanci-Inglizi,Book,http://www.amazon.com/dp/0300091524/,1,1
Kurdistan: In the Shadow of History,Book,http://www.amazon.com/dp/0679423893/,1,1
