name,category,amazon_link,total_mentions,subreddit_mentions
Thru-Hiking Will Break Your Heart: An Adventure on the Pacific Crest Trail,eBooks,http://www.amazon.com/dp/B00W4RICAM/,3,2
Hikertrash: Life on the Pacific Crest Trail,Book,http://www.amazon.com/dp/0692341382/,2,1
"Ziploc Double Zipper Freezer Gallon Bags, Total: 152 Bags (4 X 38 Count)",Health and Beauty,http://www.amazon.com/dp/B001KWMERO/,2,1
Gordini Men's Stash Lite Touch Mitts,Sports,http://www.amazon.com/dp/B00YGUD54S/,1,1
"New Balance Men's Leadvillev3 Trail Shoe, Red/Black, 10.5 D US",Shoes,http://www.amazon.com/dp/B00Z7KLWCI/,1,1
