name,category,amazon_link,total_mentions,subreddit_mentions
The Book of The Great Queen: The Many Faces of the Morrigan from Ancient Legends to Modern Devotions,Books,https://www.amazon.com/Book-Great-Queen-Morrigan-Devotions/dp/0990392716/ref=asap_bc?ie=UTF8,2,2
A Practical Heathen's Guide to Asatru,Books,https://www.amazon.com/Practical-Heathens-Guide-Asatru/dp/0738733873,3,1
Pagan Theology: Paganism as a World Religion,Books,https://www.amazon.com/Pagan-Theology-Paganism-World-Religion/dp/0814797083/ref=sr_1_1?ie=UTF8&amp;qid=1450064322&amp;sr=8-1&amp;keywords=pagan+theology,2,1
"Encyclopedia of Gods: Over 2,500 Deities of the World",Books,https://www.amazon.com/Encyclopedia-Gods-Over-Deities-World/dp/0816029091/ref=la_B001HOKMOC_1_1?s=books&amp;ie=UTF8&amp;qid=1494452928&amp;sr=1-1,2,1
A World Full of Gods: An Inquiry into Polytheism,Books,https://www.amazon.com/World-Full-Gods-Inquiry-Polytheism/dp/0976568101/,2,1
"Taking Up The Runes: A Complete Guide To Using Runes In Spells, Rituals, Divination, And Magic",Books,https://www.amazon.com/Taking-Up-Runes-Complete-Divination/dp/1578633257/,1,1
Runes: Theory and Practice,Books,https://www.amazon.com/Runes-Theory-Practice-Galina-Krasskova/dp/1601630859,1,1
Gods and Myths of Northern Europe,Books,https://www.amazon.com/Myths-Northern-Europe-Ellis-Davidson/dp/0140136274,1,1
Mythic Ireland,Books,https://www.amazon.com/Mythic-Ireland-Michael-Dames/dp/0500278725/,1,1
Celtic Mythology,Books,https://www.amazon.com/Celtic-Mythology-Proinsias-MacCana/dp/0600006476,1,1
The Gods of the Celts,Books,https://www.amazon.com/Gods-Celts-Miranda-Green/dp/0750934794/,1,1
"Celtic Goddesses: Warriors, Virgins and Mothers",Books,https://www.amazon.com/Celtic-Goddesses-Warriors-Virgins-Mothers/dp/080761405X/,1,1
The Year in Ireland,Books,https://www.amazon.com/Year-Ireland-Kevin-Danaher/dp/1856350932/,1,1
The Ancient Egyptian Prayerbook,Books,https://www.amazon.com/Ancient-Egyptian-Prayerbook-Tamara-Siuda/dp/0578030713,1,1
Circle Of The Sun: Rites And Celebrations For Egyptian Pagans And Kemetics,Books,https://www.amazon.com/Circle-Sun-Celebrations-Egyptian-Kemetics/dp/1105498379,1,1
Handfasting and Wedding Rituals: Welcoming Hera's Blessing,Books,https://www.amazon.com/Handfasting-Wedding-Rituals-Welcoming-Blessing/dp/0738704709/ref=sr_1_1?ie=UTF8&amp;qid=1471977214&amp;sr=8-1&amp;keywords=handfasting,1,1
"White Clay Handmade Ceramic Figurine ""Perun"" House Decorating",Home & Kitchen,https://www.amazon.com/White-Handmade-Ceramic-Figurine-Decorating/dp/B00PW7Y4K8/ref=sr_1_1?ie=UTF8&amp;qid=1482644421&amp;sr=8-1&amp;keywords=perun+statue,1,1
