name,category,amazon_link,total_mentions,subreddit_mentions
Color and Light: A Guide for the Realist Painter (James Gurney Art),Book,http://www.amazon.com/dp/0740797719/,45,4
All Art Is Propaganda,Book,http://www.amazon.com/dp/0156033070/,5,1
Creative Perspective for Artists and Illustrators (Dover Art Instruction),Book,http://www.amazon.com/dp/0486273377/,2,1
Figure Drawing: Design and Invention,Book,http://www.amazon.com/dp/0615272819/,34,1
"The Elements of Landscape Oil Painting: Techniques for Rendering Sky, Terrain, Trees, and Water",Book,http://www.amazon.com/dp/0804137552/,1,1
Color: A Natural History of the Palette,Book,http://www.amazon.com/dp/0812971426/,3,1
Landscape Painting: Essential Concepts and Techniques for Plein Air and Studio Practice,Book,http://www.amazon.com/dp/0823032205/,1,1
"Space Art: How to Draw and Paint Planets, Moons, and Landscapes of Alien Worlds",Book,http://www.amazon.com/dp/0823048764/,2,1
The Hudson River School: Nature and the AmericanVision,Book,http://www.amazon.com/dp/0847832643/,1,1
The New Drawing on the Right Side of the Brain,Book,http://www.amazon.com/dp/0874774241/,6,1
"Factory Work: Warhol, Wyeth and Basquiat",Book,http://www.amazon.com/dp/0918749212/,1,1
Brushwork Essentials,Book,http://www.amazon.com/dp/1440306745/,1,1
Figure Drawing Master Class: Lessons in Life Drawing,Book,http://www.amazon.com/dp/1440339945/,1,1
Portraits from Life in 29 Steps,Book,http://www.amazon.com/dp/1581805829/,1,1
"Drawing on the Right Side of the Brain: The Definitive, 4th Edition",Book,http://www.amazon.com/dp/1585429201/,79,1
Children's Writer's & Illustrator's Market 2016: The Most Trusted Guide to Getting Published,Book,http://www.amazon.com/dp/1599639432/,1,1
What Color Is Your Parachute? 2016: A Practical Manual for Job-Hunters and Career-Changers,Book,http://www.amazon.com/dp/160774662X/,10,1
Iridescent Watercolor Medium by Winsor Newton,Home,http://www.amazon.com/dp/B0009IG1P6/,1,1
Martin Mijello Airtight Watercolor 18-Well Fuchsia Palette,Art and Craft Supply,http://www.amazon.com/dp/B002664868/,2,1
3791900 42 Watt Twist CFL Daylight High Wattage Light Bulb with Medium Base,Home Improvement,http://www.amazon.com/dp/B003NWC320/,2,1
CowboyStudio Photography & Video Portrait Umbrella Continuous Triple Lighting Kit,Photography,http://www.amazon.com/dp/B003WLY24O/,6,1
"da Vinci Watercolor Series 418 Petit Gris Pur Paint Brush, Wash/Mop Pure Russian Blue Squirrel, Size 2",Art and Craft Supply,http://www.amazon.com/dp/B00409JAEY/,1,1
"Grumbacher Goldenedge Golden Toray Round Watercolor Brush, Synthetic Bristles, Size 14 (4620.14)",Office Product,http://www.amazon.com/dp/B004BN7R9E/,1,1
"Princeton Artist Brush Neptune, Brushes for Watercolor Series 4750, Quill Synthetic Squirrel, Size 6",Art and Craft Supply,http://www.amazon.com/dp/B00512C1VS/,3,1
Winsor & Newton Brush Cleaner & Restorer - 4 oz. bottle,Art and Craft Supply,http://www.amazon.com/dp/B005M4W1VK/,2,1
Art Alternatives Tahoe Aluminum Studio Easel,Single Detail Page Misc,http://www.amazon.com/dp/B009ONS29A/,1,1
Santin Art - Modern Abstract Painting Wall Decor Landscape Paintings,Home,http://www.amazon.com/dp/B00A6O719S/,5,1
"Apple Barrel Acrylic Paint Set, 18 Piece (2 Ounce), PROMOABII Best Selling Colors II",Art and Craft Supply,http://www.amazon.com/dp/B00ATJSD8S/,1,1
Black Swan Synthetic Red Sable Brush Long Handle Explorer Set of 5,Art and Craft Supply,http://www.amazon.com/dp/B00OCJB4B4/,1,1
"SYLVANIA ULTRA 60W LED Light Bulb Dimmable - Daylight 5000K, 25,000 hour life,  E26 A19 Medium Base - Energy Star 9W",Home Improvement,http://www.amazon.com/dp/B01B0M9UZM/,1,1
Tangkula French Easel Wooden Sketch Box Portable Folding,Home,http://www.amazon.com/dp/B01DW0A4FA/,1,1
Gardner's Art Through the Ages,Book,http://www.amazon.com/dp/0155011413/,3,1
"Artlicious - Super Value 5 Pack - 16x20 Pre-Stretched Cotton Canvas Panel Boards - Use with All Acrylics, Oils and Other Painting Media",Art and Craft Supply,http://www.amazon.com/dp/B01FOYPERU/,1,1
