name,category,amazon_link,total_mentions,subreddit_mentions
The Island at the Center of the World,eBooks,http://www.amazon.com/dp/B000FCK2Z6/,4,2
Medieval Machine: The Industrial Revolution of the Middle Ages,Book,http://www.amazon.com/dp/0140045147/,3,2
"The Enemy at the Gate: Habsburgs, Ottomans, and the Battle for Europe",Book,http://www.amazon.com/dp/046502081X/,2,1
Star Wars Complete Locations: Inside the Worlds of the Entire Star Wars Saga,Book,http://www.amazon.com/dp/0756614198/,3,1
A Street Through Time,Book,http://www.amazon.com/dp/0789434261/,2,1
The First Crusade and the Idea of Crusading (The Middle Ages Series),Book,http://www.amazon.com/dp/0812220765/,1,1
Mannahatta: A Natural History of New York City,Book,http://www.amazon.com/dp/1419707485/,6,1
Map Stories: The Art of Discovery,Book,http://www.amazon.com/dp/1781573778/,1,1
"The Making of the Ancient Greek Economy: Institutions, Markets, and Growth in the City-States",eBooks,http://www.amazon.com/dp/B00XNZA89M/,1,1
The Great Fire Season 1,TV Series Season Video on Demand,http://www.amazon.com/dp/B0169Z11MU/,1,1
Barmi: A Mediterranean City Through The Ages,Book,http://www.amazon.com/dp/0395542278/,1,1
