name,category,amazon_link,total_mentions,subreddit_mentions
"When You're Expecting Twins, Triplets, or Quads: Proven Guidelines for a Healthy Multiple Pregnancy, 3rd Edition",Book,http://www.amazon.com/dp/0061803073/,17,9
"THE TWIN Z PILLOW- LIME GREEN -The Only 6 in 1 Twin Pillow Breastfeeding, Bottlefeeding, Tummy Time & Support! A Must Have for Twins! - LIME GREEN",Baby Product,http://www.amazon.com/dp/B007VF57C8/,6,5
Twelve Hours' Sleep by Twelve Weeks Old: A Step-by-Step Plan for Baby Sleep Success,Book,http://www.amazon.com/dp/0525949593/,9,4
"Healthy Sleep Habits, Happy Twins: A Step-by-Step Program for Sleep-Training Your Multiples",Book,http://www.amazon.com/dp/0345497791/,4,4
Dr. Brown's Formula Mixing Pitcher,Baby Product,http://www.amazon.com/dp/B001I481LM/,26,4
The Doctor and the Stork: A Memoir of Modern Medical Babymaking,Book,http://www.amazon.com/dp/1631528300/,3,3
Baby Brezza Formula Pro One Step Food Maker,Baby Product,http://www.amazon.com/dp/B00E8KJYNC/,8,3
"My Brest Friend Twins Plus Deluxe Nursing Pillow, Green, 0-12 Months",Baby Product,http://www.amazon.com/dp/B0032Z81M4/,4,3
"Motorola Digital Video Baby Monitor with 2 Cameras, 3.5 Inch Color Video Screen, Infrared Night Vision, with Camera Pan, Tilt, and Zoom",Baby Product,http://www.amazon.com/dp/B00D56GRVW/,2,2
Fisher-Price My Little Snugapuppy Cradle 'n Swing,Baby Product,http://www.amazon.com/dp/B00DGA06JQ/,6,2
Baby Jogger City Select Stroller with 2nd Seat Onyx,Baby Product,http://www.amazon.com/dp/B003Q85CRY/,2,2
"Graco Pack 'n Play Playard with Twins Bassinet, Vance",Baby Product,http://www.amazon.com/dp/B005UV0UV8/,3,2
Joovy Twin Roo+ Car Seat Stroller,Baby Product,http://www.amazon.com/dp/B00M733I02/,2,2
"Graco DuoGlider Classic Connect Stroller, Dragonfly",Baby Product,http://www.amazon.com/dp/B00AHVR4N8/,3,2
"Graco Glider Elite Baby Swing, Pierce",Baby Product,http://www.amazon.com/dp/B00Y286O6U/,6,2
"Fisher-Price Auto Rock 'n Play Sleeper, Aqua Stone",Baby Product,http://www.amazon.com/dp/B00NEO5UTU/,11,2
Baby Trend Universal Double Snap-N-Go Stroller Frame,Baby Product,http://www.amazon.com/dp/B008U4MKU6/,4,2
"Joovy Scooter X2 Double Stroller, Black",Baby Product,http://www.amazon.com/dp/B00O20OPTQ/,3,2
Happiest Baby: Learn to calm crying fast...help your baby sleep longer!,DVD,http://www.amazon.com/dp/B0006J021C/,6,2
"When You're Expecting Twins, Triplets, or Quads 4th Edition: Proven Guidelines for a Healthy Multiple Pregnancy",Book,http://www.amazon.com/dp/0062379488/,2,2
The Baby Sleep Solution: A Proven Program to Teach Your Baby to Sleep Twelve Hours a Night,Book,http://www.amazon.com/dp/0399532919/,4,2
"Simple Wishes Signature Hands Free Breastpump Bra, Pink, XS-Large",Baby Product,http://www.amazon.com/dp/B00295MQLU/,31,1
The Baby Sleep Solution: A Proven Program to Teach Your Baby to Sleep Twelve Hours aNight,eBooks,http://www.amazon.com/dp/B002GOP9LI/,1,1
"Delta Children Portable Mini Crib, White",Baby Product,http://www.amazon.com/dp/B002MZMDX8/,2,1
"Medela Easy Expression Hands-Free Bustier, Medium, White",Baby Product,http://www.amazon.com/dp/B002NUXHJQ/,1,1
"Prince Lionheart Table Edge Guard with 4 Corners, Chocolate Brown",Baby Product,http://www.amazon.com/dp/B002SG7JSK/,1,1
"Dream On Me, Classic 3 in 1 Convertible Crib, Cherry",Baby Product,http://www.amazon.com/dp/B0035ER8F8/,1,1
Dr. Brown's Bottle Warmer,Baby Product,http://www.amazon.com/dp/B0035LLG2W/,2,1
"Brown Monkey Baby Bottle Holder for Hands Free Bottle Feeding by Bebe Bottle Sling, LLC",Baby Product,http://www.amazon.com/dp/B003Z6AO7U/,1,1
Infant Optics DXR-5 Portable Video Baby Monitor,Baby Product,http://www.amazon.com/dp/B0052QYLUM/,4,1
Kelty Tour 1.0 Child Carrier,Sports,http://www.amazon.com/dp/B005F5LY6E/,1,1
Curad Medium Maternity Belt (sizes 4 to 14),Health and Beauty,http://www.amazon.com/dp/B005MT0MD4/,8,1
Tomy Winnie the Pooh Lullaby Dreams Lightshow,Baby Product,http://www.amazon.com/dp/B005UX2HYY/,1,1
"Boon Naked Collapsible Baby Bathtub Blue,Blue/White",Baby Product,http://www.amazon.com/dp/B005VLXIS4/,1,1
Fisher-Price Laugh & Learn Learning Home Playset,Toy,http://www.amazon.com/dp/B005YRAKJU/,2,1
"Prince Lionheart weePOD Basix | super squishy soft toilet trainer seat, Berry Blue",Baby Product,http://www.amazon.com/dp/B005ZBI03I/,3,1
"Family Care Clotrimazole Anti Fungal Cream, 1% USP Compare to Lotrimin 1oz LFRczv, Pack of 5",Health and Beauty,http://www.amazon.com/dp/B0064T0A8S/,3,1
Foscam FI8910W Pan & Tilt IP/Network Camera with Two-Way Audio and Night Vision (White),Photography,http://www.amazon.com/dp/B006ZPWS4U/,4,1
"Ju-Ju-Be Classic Collection B.F.F. Convertible Diaper Bag, Royal Envy",Baby Product,http://www.amazon.com/dp/B00B99QXMU/,1,1
Crayola Doodle Magic Color Mat,Toy,http://www.amazon.com/dp/B00CI6JDIO/,1,1
Infantino Squeeze and Stack Block Set,Baby Product,http://www.amazon.com/dp/B00DJPK9GI/,2,1
Deluxe Diner Reclining Feeding Seat,Baby Product,http://www.amazon.com/dp/B00DQQNSLI/,2,1
Mirari OK to Wake!  Alarm Clock & Night-Light,Home,http://www.amazon.com/dp/B00EAHSBV4/,21,1
Infant Optics DXR-8 Video Baby Monitor with Interchangeable Optical Lens,Baby Product,http://www.amazon.com/dp/B00ECHYTBI/,21,1
Foscam FI9821W V2 Megapixel HD 1280 x 720p H.264 Wireless/Wired Pan/Tilt IP Camera with IR-Cut Filter - 26ft Night Vision and 2.8mm Lens (70° Viewing Angle) - Black,Photography,http://www.amazon.com/dp/B00F3KWZW8/,16,1
"IncStores Premium Foam Tiles - Olive 12 Pack (48 Sqft) Great for P90x, Insanity, Pilates, Yoga, Aerobics and Kid Playrooms",Sports,http://www.amazon.com/dp/B00GDG2K62/,1,1
"THE SKIN-TO-SKIN KANGAROO T-SHIRT and nursing shirt (Medium, Jade)",Baby Product,http://www.amazon.com/dp/B00H7NE5CW/,1,1
"Marpac Dohm-DS All Natural Sound Machine, White",Health and Beauty,http://www.amazon.com/dp/B00HD0ELFK/,40,1
"Fisher-Price Rock 'n Play Sleeper, Luminosity",Baby Product,http://www.amazon.com/dp/B00HWVTY6G/,10,1
"The Gro Company Gro-Egg Room Thermometer, White",Baby Product,http://www.amazon.com/dp/B00I2IAJCG/,2,1
"Maclaren Twin Triumph, Denim Indigo, 6 Months",Baby Product,http://www.amazon.com/dp/B00I8RFZN4/,1,1
"Baby Car Mirror - Rear Facing - Safety Certified & Crash Tested - Shatterproof, Crystal Clear, Huge Back Seat Baby Mirror - Gorgeous Gift Box, FREE Cleaning Cloth Included",Baby Product,http://www.amazon.com/dp/B00INGNYXS/,1,1
LactaMed Simplicity Hands Free Bra Kit - Black,Baby Product,http://www.amazon.com/dp/B00JAO6TT8/,9,1
"Graco SnugRide Classic Connect 30 Infant Car Seat, Dragonfly",Baby Product,http://www.amazon.com/dp/B00JRYSGT2/,3,1
Swimways Baby Spring Float Sun Canopy - Pink Butterfly,Toy,http://www.amazon.com/dp/B00K1M9YGI/,1,1
"Trunki Yondi Travel Pillow, Blue, Small",Baby Product,http://www.amazon.com/dp/B00KJ92T60/,1,1
"Children Baby Infant Toddler No Bumps Safety Helmet Head Cushion, Blue Candy",Apparel,http://www.amazon.com/dp/B00KKCLPR0/,1,1
"Summer Infant SwaddleMe 2 Piece Adjustable Infant Wrap, Alphabet Soup, Large",Baby Product,http://www.amazon.com/dp/B00N6PKLV4/,2,1
"Evenflo Feeding Classic Glass Twist Bottles, 8 Ounce (Pack of 6)",Baby Product,http://www.amazon.com/dp/B00N9X4TYI/,1,1
"Fisher-Price Deluxe Rock 'n Play Sleeper, Moonlight Meadow",Baby Product,http://www.amazon.com/dp/B00NFETGMQ/,2,1
Bright Starts Safari Smiles Bouncer,Baby Product,http://www.amazon.com/dp/B00PAUF3MU/,2,1
"Graco Swivi Seat 3-in-1 Booster High Chair, Abbington",Baby Product,http://www.amazon.com/dp/B00PTL0CKS/,1,1
"Graco Simple Sway Baby Swing, Abbington",Baby Product,http://www.amazon.com/dp/B00PTL15D6/,1,1
Roving Cove 20.4 ft [18ft Edge + 8 Corners] Safe Edge and Corner Cushion - PRE-TAPED CORNERS; Jumbo ONYX; Premium Childproofing Guard Child Home Furniture Safety Bumper Baby Proof Table Protector,Baby Product,http://www.amazon.com/dp/B00PTL6JFU/,2,1
"Bumbo Multi Seat, Blue",Baby Product,http://www.amazon.com/dp/B00R0V7ZC8/,2,1
"Baby Proofing CABINET LOCKS Child Safety, Sliding Type, NO DRILL, 4 PACK, White",Home,http://www.amazon.com/dp/B00S9MBR12/,1,1
"Baby Jogger 2015 City Select with 2nd Seat, Onyx",Baby Product,http://www.amazon.com/dp/B00U0DCTVU/,1,1
Wabi Baby Electric Steam Sterilizer and Dryer Plus Version,Baby Product,http://www.amazon.com/dp/B00ZT394O6/,1,1
"Zeltababy ABS Baby Multi Use Adhesive Latches - Child Baby Safety Locks Used for Locking Cabinet,Drawer,Cupboard- Essential Baby Proofing Tool(White,Pack of 4)",Baby Product,http://www.amazon.com/dp/B010A45W1M/,1,1
Mudder Foam Door Stopper Finger Guard for Baby Safety - 3 Pack (White),Baby Product,http://www.amazon.com/dp/B011XYM4SM/,1,1
AmazonBasics Classic Backpack - Black,Personal Computer,http://www.amazon.com/dp/B013TGEJEE/,5,1
"DorDor & GorGor Reversible Infant Head Support, Organic Cotton, Gray",Baby Product,http://www.amazon.com/dp/B013TPBFMO/,1,1
"Grip-n-Gulp Kids Water Bottle Variation Parent (Spring Green, 12 Ounces)",Sports,http://www.amazon.com/dp/B015214FDO/,1,1
"Skip Hop Duo Double Signature Carry All Travel Diaper Bag Tote with Multipockets, One Size, Heather Grey",Baby Product,http://www.amazon.com/dp/B01899727C/,1,1
"Englacha 2-in-1 Cozy X Rider, Black",Baby Product,http://www.amazon.com/dp/B0194QWCMY/,1,1
Baby Diaper Bag Smart Organizer Waterproof Travel Diaper Backpack with Changing Pad and Stroller Clips (Black Dot),Baby Product,http://www.amazon.com/dp/B01EW7ROTG/,2,1
Fisher-Price My Little Snugabear Cradle 'N Swing,Baby Product,http://www.amazon.com/dp/B01FF8H5Q8/,2,1
Maternity Support Belt | 3XL Plus Size Pregnancy Abdominal Binder | Back / Waist / Abdomen Support Belly Band | Fully Adjustable Throughout Pregnancy (Plus Size XXXL),Sports,http://www.amazon.com/dp/B01H7VBXEQ/,1,1
"Eufy RoboVac 11, High Suction, Self-Charging Robotic Vacuum Cleaner with Drop-Sensing Technology and HEPA Style Filter for Pet Fur and Allergens, Designed for Hard Floor and Thin Carpet",Home,http://www.amazon.com/dp/B01LYCLS24/,2,1
"Summer Infant Pop 'N Play Deluxe Ultimate Playard, Aqua Splash/Textured Gray",Baby Product,http://www.amazon.com/dp/B01MTZ8EBE/,1,1
"#1 Top Recommended Maternity Belt - Babo Care Breathable Lower Back and Pelvic Support - Comfortable Belly Band for Pregnancy - Prenatal Cradle for Baby - One Size,Nude Color",Health and Beauty,http://www.amazon.com/dp/B01N0NT52Q/,1,1
"WonderFold Outdoor 2017 All New Collapsible Canopy Folding Wagon Utility Cart with 180° Steering Telescoping Handle with Spring Bounce, Auto Safety Locks, Rubber Tire, and Stand, Midnight Blue",Toy,http://www.amazon.com/dp/B06WD1TGXV/,1,1
Siblings Without Rivalry: How to Help Your Children Live Together So You Can Live Too,Book,http://www.amazon.com/dp/0393342212/,19,1
Those Darn Squirrels!,Book,http://www.amazon.com/dp/0547576811/,2,1
The Sleepeasy Solution: The Exhausted Parent's Guide to Getting Your Child to Sleep from Birth to Age 5,Book,http://www.amazon.com/dp/0757305601/,6,1
Dragons Love Tacos,Book,http://www.amazon.com/dp/0803736800/,6,1
Secret Pizza Party,Book,http://www.amazon.com/dp/0803739478/,2,1
Mothering Multiples: Breastfeeding and Caring for Twins or More! (La Leche League International Book),Book,http://www.amazon.com/dp/0976896931/,1,1
Dad's Guide to Twins: How to Survive the Twin Pregnancy and Prepare for Your Twins,Book,http://www.amazon.com/dp/1482372274/,2,1
Raising Twins: Parenting Multiples from Pregnancy Through the School Years,Book,http://www.amazon.com/dp/1581108656/,1,1
Twins: A Practical Guide to Parenting Multiples from Conception to preschool,Book,http://www.amazon.com/dp/1741146534/,1,1
Radio Flyer Full Size All-Terrain Steel & Wood Wagon,Toy,http://www.amazon.com/dp/B00000K1VS/,3,1
"Leachco Snoogle Total Body Pillow, Ivory",Home,http://www.amazon.com/dp/B0000635WI/,37,1
"It's You Babe Prenatal Cradle, Small (145-175 Pounds)",Health and Beauty,http://www.amazon.com/dp/B00006D2RB/,1,1
"HALO SleepSack 100% Cotton Wearable Blanket, Baby Blue, Large",Baby Product,http://www.amazon.com/dp/B00008KWO6/,6,1
"Leachco Back 'N Belly Contoured Body Pillow, Ivory",Baby Product,http://www.amazon.com/dp/B0002E7DIQ/,10,1
"Miracle Blanket Swaddle, Blue",Baby Product,http://www.amazon.com/dp/B000G0KQWQ/,2,1
Fisher-Price Rainforest Jumperoo,Baby Product,http://www.amazon.com/dp/B000LXQVA4/,9,1
"Enzymatic Therapy Eskimo-3 Double-Strength Supplement, 90 Count",Health and Beauty,http://www.amazon.com/dp/B000T294WE/,1,1
North States Superyard 3-in-1 Metal Gate,Baby Product,http://www.amazon.com/dp/B000U5FOT2/,10,1
