name,category,amazon_link,total_mentions,subreddit_mentions
War Room: The Legacy of Bill Belichick and the Art of Building the Perfect Team,Book,http://www.amazon.com/dp/006208240X/,14,5
"MINI 2"" METAL NFL VINCE LOMBARDI SUPER BOWL TROPHY w/Polished Mirror Chrome Finish",Home,http://www.amazon.com/dp/B00KAEG5A0/,3,3
A Gronking to Remember: Book One in the Rob Gronkowski Erotica Series,eBooks,http://www.amazon.com/dp/B00RN7TNHE/,37,3
"Belichick and Brady: Two Men, the Patriots, and How They Revolutionized Football",eBooks,http://www.amazon.com/dp/B01C37XF40/,2,2
Football Scouting Methods,Book,http://www.amazon.com/dp/1891396757/,7,2
NFLPA Tom Brady #12 Backpack,Wireless,http://www.amazon.com/dp/B01GSHAKT4/,2,2
Brady vs Manning: The Untold Story of the Rivalry That Transformed the NFL,Book,http://www.amazon.com/dp/0804139393/,3,2
Razor Sharp,Book,http://www.amazon.com/dp/0937247413/,1,1
Football Scouting Methods,Book,http://www.amazon.com/dp/0978588150/,2,1
The Education of a Coach,Book,http://www.amazon.com/dp/1401301541/,2,1
The Education of a Coach,Book,http://www.amazon.com/dp/1401308791/,6,1
It's Good to Be Gronk,Book,http://www.amazon.com/dp/1476754802/,2,1
The Night Dad Went to Jail: What to Expect When Someone You Love Goes to Jail (Life's Challenges),Book,http://www.amazon.com/dp/1479521426/,3,1
The Dark Tower I: The Gunslinger,Book,http://www.amazon.com/dp/1501143514/,4,1
Boned By LeGarrette's Blunt: A Novella of New England Football Erotica,Book,http://www.amazon.com/dp/1507585233/,1,1
A Gronking to Remember 2: Chad Goes Deep in the Neutral Zone (Rob Gronkowski Erotica Series) (Volume 2),Book,http://www.amazon.com/dp/1507785887/,1,1
The War on Football: Saving America's Game,Book,http://www.amazon.com/dp/1621571556/,1,1
Bill Belichick vs. the NFL: The Case for the NFL's Greatest Coach,Book,http://www.amazon.com/dp/1629373117/,1,1
The Sense of Humor (Mouton Select),Book,http://www.amazon.com/dp/3110198290/,1,1
Dritz Deluxe Seam Ripper,Art and Craft Supply,http://www.amazon.com/dp/B0001DSIVY/,33,1
Dritz Res-Q Tape - 0.75 x 5 Yards,Home,http://www.amazon.com/dp/B0001DUNIK/,1,1
Tachikara DIGI-GUAGE Digital Air Pressure Gauge.,Sports,http://www.amazon.com/dp/B000A6HM8W/,1,1
"Wilson ""The Duke"" Official NFL Game Football",Sports,http://www.amazon.com/dp/B000RHV172/,2,1
Rainbow In My Room Tabletop Décor Night Light Projector,Toy,http://www.amazon.com/dp/B000TK8440/,1,1
Basketball Football Baseball Hockey Jersey Display Case 98% UV ULTRA CLEAR GLASS,Sports,http://www.amazon.com/dp/B001ADKKNI/,1,1
Reynolds Consumer Produ Aluminum Foil 30 Sf Roll 08031,Health and Beauty,http://www.amazon.com/dp/B002M7XV8C/,3,1
Goat Overhead Animal Mask,Apparel,http://www.amazon.com/dp/B002VVSQRA/,1,1
Masshole Auto Emblem (Chrome),Automotive Parts and Accessories,http://www.amazon.com/dp/B002WK02PE/,1,1
"Mohu Leaf 30 TV Antenna, Indoor, 30 Mile Range, Original Paper-thin, Reversible, Paintable, 4K-Ready HDTV, 10 Foot Detachable Cable, Premium Materials for Performance, USA Made, MH-110583",Speakers,http://www.amazon.com/dp/B004QK7HI8/,12,1
NFL New England Patriots Boxed Relief Sculpted Mug,Sports,http://www.amazon.com/dp/B005N0RYGK/,1,1
NFL PET JERSEY. - Football Licensed Dog Jersey. - 32 NFL Teams Available. - Comes in 6 Sizes. - Football Pet Jersey. - Sports Mesh Jersey. - Dog Jersey Outfit. - NFL Dog Jersey,Pet Products,http://www.amazon.com/dp/B0072HB65W/,1,1
"New England Patriots Mickey Mouse Throw And Hugger Plush 40"" X 50""",Sports,http://www.amazon.com/dp/B008BI1QA6/,1,1
Slingbox 500,Home Theater,http://www.amazon.com/dp/B009FU8BR0/,1,1
BenQ DLP HD 1080p Projector (W1070) - 3D Home Theater Projector with Lens Shift Technology and RGBRGB Color Wheel,Home Theater,http://www.amazon.com/dp/B00A2T6X0K/,43,1
BenQ W1080ST 1080p 3D Short Throw DLP Home Theater Projector (White),Home Theater,http://www.amazon.com/dp/B00B11C6HW/,4,1
Future Essentials Organic Dehydrated Water,Sports,http://www.amazon.com/dp/B00BQ1VD6W/,16,1
Tools of Life® Car Hammer Seatbelt Cutter Window Breaker Emergency Escape Tool,Automotive Parts and Accessories,http://www.amazon.com/dp/B00CB8WM2S/,24,1
HotHands Hand Warmer Value Pack( 10 count),Sports,http://www.amazon.com/dp/B00D7H9LIA/,12,1
My First Cavity Search,eBooks,http://www.amazon.com/dp/B00DWYLHF8/,1,1
New England Patriots Glass Star Treetopper,Kitchen,http://www.amazon.com/dp/B00E3IG1B2/,1,1
"Epson EX3220, SVGA, 3000 Lumens Color Brightness (color light output), 3000 Lumens White Brightness, 3LCD Projector",CE,http://www.amazon.com/dp/B00E87E1NI/,1,1
New England Patriots New Era Throwback On Field Embroidered Beanie Fold Cap,Apparel,http://www.amazon.com/dp/B00FRWL4QU/,1,1
72 Red Foam Clown Noses,Toy,http://www.amazon.com/dp/B00G8ITZJU/,1,1
Super Bowl XLVIII Champions: Seattle Seahawks,DVD,http://www.amazon.com/dp/B00GSTHD48/,1,1
"Booze Buddy Concealable Flasks 6 Pack (3 8oz, 3 16oz.)",Kitchen,http://www.amazon.com/dp/B00I3LD4N8/,1,1
NASA Logo Embroidered Patched Mesh Back Cap - Navy OSFM ,Apparel,http://www.amazon.com/dp/B00JMIONUE/,1,1
"PUMA Kids Baby Boys' Logo Tricot Set, Navy/Red, 18 Months",Apparel,http://www.amazon.com/dp/B00K5NDXJM/,1,1
NFL Super Bowl XXXVIII 2003 Style-38 Embroidered Sew On Patch,Art and Craft Supply,http://www.amazon.com/dp/B00LIGJ4K2/,1,1
NFL Super Bowl Champions XLIX: New England Patriots [Blu-ray],DVD,http://www.amazon.com/dp/B00R0418VO/,1,1
NFL Super Bowl Champions XLIX: New England Patriots,DVD,http://www.amazon.com/dp/B00R041BAW/,1,1
"1byone 25 Miles Super Thin HDTV Antenna with 16.5ft High Performance Coaxial Cable, Shiny Antenna",Speakers,http://www.amazon.com/dp/B00RFLXCRK/,2,1
"NFL New England Patriots Super Bowl Champs Hood, Large, Navy",Sports,http://www.amazon.com/dp/B00S7FNMBE/,1,1
"Super Bowl 49 XLIX Program ""Stadium"" Holographic Cover 2015 Superbowl Arizona - PRE-ORDER",Sports,http://www.amazon.com/dp/B00SKD7X3Q/,1,1
New England Patriots - Team Roster Super Bowl XLIX 49 Champs 16 Oz. Pint Glass,Sports,http://www.amazon.com/dp/B00T2DXCTW/,1,1
Garvey Products My Turn Ticket Dispenser (TAGS-12001),BISS,http://www.amazon.com/dp/B00VBZWNSU/,1,1
Mohu Leaf Metro TV Antenna 25 Mile Range MH-110633,Speakers,http://www.amazon.com/dp/B00YBPMSY6/,4,1
"NFL New England Patriots Champion Tech Fleece Hoodie, Large, Heather Grey",Sports,http://www.amazon.com/dp/B00ZCLNG1W/,1,1
"1byone 80 Miles Digital Amplified Outdoor / Roof HDTV Antenna with Power Supply Box, Extremely High Performance for UHF Band",Home Theater,http://www.amazon.com/dp/B00ZI9LWS2/,5,1
Slingbox M2,Home Theater,http://www.amazon.com/dp/B011QHAOWO/,1,1
Under Armour UA Draft 199 SM Black,Sports,http://www.amazon.com/dp/B0157VLYDI/,1,1
Spevert 100pcs Sponge Foam Clown Magic Red Nose Circus for Party Halloween Costume Christmas Wedding,Toy,http://www.amazon.com/dp/B015GXWYB8/,1,1
Red Circus Clown Nose Halloween Christmas Costume Party/magic Dress 25pcs,Apparel,http://www.amazon.com/dp/B015VE2WTG/,1,1
The Education of a Coach by David Halberstam (2006-08-08),Book,http://www.amazon.com/dp/B017V8CXH6/,1,1
"POTEK 500W Power Inverter DC 12V to 110V AC Car Converter with Digital Display Dual AC Outlets and Dual USB Charging Ports for Tablets, Laptops and Smartphones",Automotive Parts and Accessories,http://www.amazon.com/dp/B01B3ZQG4O/,3,1
"NFL New England Patriots Men's Patches Ugly Business Jacket, Size 50/XX-Large",Sports,http://www.amazon.com/dp/B01G9B1RZU/,1,1
Uncle Bill Wants You Stainless Steel Vacuum Cup Travel Mug Coffee Mug,Kitchen,http://www.amazon.com/dp/B01M21914H/,1,1
NFL New England Patriots Super Bowl 51 5x Champions House Flag,Sports,http://www.amazon.com/dp/B01N16Q8RV/,1,1
"Tom Brady Goat tshirt (3XL, Royal Blue)",Apparel,http://www.amazon.com/dp/B06X973G9F/,1,1
"Patriot Reign: Bill Belichick, the Coaches, and the Players Who Built a Champion",Book,http://www.amazon.com/dp/0060757957/,1,1
3 Games to Glory V,DVD,http://www.amazon.com/dp/B06XGVSVKN/,1,1
Alex & Me: How a Scientist and a Parrot Discovered a Hidden World of Animal Intelligence--and Formed a Deep Bond in the Process,Book,http://www.amazon.com/dp/0061673986/,7,1
"Belichick and Brady: Two Men, the Patriots, and How They Revolutionized Football",Book,http://www.amazon.com/dp/0316266914/,2,1
America's Game: The Epic Story of How Pro Football Captured a Nation,Book,http://www.amazon.com/dp/0375725067/,4,1
The Rise of Theodore Roosevelt (Modern Library Paperbacks),Book,http://www.amazon.com/dp/0375756787/,14,1
The Making of the English Working Class,Book,http://www.amazon.com/dp/0394703227/,1,1
All My Friends Are Dead,Book,http://www.amazon.com/dp/0811874559/,23,1
