name,category,amazon_link,total_mentions,subreddit_mentions
"Simulacra and Simulation (The Body, In Theory: Histories of Cultural Materialism)",Books,https://www.amazon.com/Simulacra-Simulation-Body-Theory-Materialism/dp/0472065211,3,1
The Handmaid's Tale,Books,https://www.amazon.com/Handmaids-Tale-Margaret-Atwood/dp/038549081X,3,1
Weapons of Math Destruction: How Big Data Increases Inequality and Threatens Democracy,Books,https://www.amazon.com/Weapons-Math-Destruction-Increases-Inequality/dp/0553418815/,2,1
If on a Winter's Night a Traveler,Books,https://www.amazon.com/Winters-Night-Traveler-Italo-Calvino/dp/0156439611,1,1
Labyrinths (New Directions Paperbook),Books,https://www.amazon.com/Labyrinths-Directions-Paperbook-Jorge-Borges/dp/0811216993,1,1
Fear and Trembling (Penguin Classics),Books,https://www.amazon.com/Trembling-Penguin-Classics-Soren-Kierkegaard/dp/0140444491/ref=sr_1_1?s=books&amp;ie=UTF8&amp;qid=1469241400&amp;sr=1-1&amp;keywords=fear+and+trembling,1,1
Image-Music-Text,Books,https://www.amazon.com/Image-Music-Text-Roland-Barthes/dp/0374521360,1,1
A Perfect Vacuum,Books,https://www.amazon.com/Perfect-Vacuum-Stanislaw-Lem/dp/0810117339,1,1
