name,category,amazon_link,total_mentions,subreddit_mentions
Elite Chrome Satin Two Tone,"Patio, Lawn & Garden",https://www.amazon.com/dp/B00E4MR7YM/ref=cm_sw_su_dp,1,1
Mrs. Anderson's Baking Powdered Sugar Spoon,Home & Kitchen,https://www.amazon.com/Andersons-Baking-Powdered-Sugar-Spoon/dp/B007UGQ2S6,1,1
Canon EOS Rebel T1i 15.1 MP CMOS Digital SLR Camera with 3-Inch LCD and EF-S 18-55mm f/3.5-5.6 IS Lens,Electronics,https://www.amazon.com/Canon-T1i-Digital-18-55mm-3-5-5-6/dp/B001XURPQS/ref=sr_1_1?ie=UTF8&amp;qid=1425828558&amp;sr=8-1&amp;keywords=canon+500d,1,1
Fractal Design Node 605 Silent Home Theater Computer Case FD-CA-NODE-605-BL,Electronics,https://www.amazon.com/Fractal-Design-Theater-Computer-FD-CA-NODE-605-BL/dp/B009LHF4F4/ref=sr_1_12?s=pc&amp;ie=UTF8&amp;qid=1441868219&amp;sr=1-12&amp;keywords=htpc+case,1,1
Rapoo E9180p 5GHz Wireless Touch Ultra-Slim Keyboard Black/Sliver,Video Games,https://www.amazon.com/Rapoo-E9180p-Wireless-Ultra-Slim-Keyboard-Sliver/dp/B00DORH4DC/ref=sr_1_12?ie=UTF8&amp;qid=1440678159&amp;sr=8-12&amp;keywords=rapoo,1,1
RK PRO104 Macro Setting RGB Backlit Wired Mechanical Gaming Keyboard with Brown Switches (White),Electronics,https://www.amazon.com/Setting-Mechanical-Keyboard-Switches-HV-KB389L/dp/B01GYMEHGA/ref=sr_1_sc_1?ie=UTF8&amp;qid=1482555955&amp;sr=8-1-spell&amp;keywords=havlit+gaming+keyboard+mechanical,1,1
Glovion RGB Color Changing LED Coaster Drink Bottle Cup Coaster Diameter 3.6 Inch (3 AAA Battery Included),Home & Kitchen,https://www.amazon.com/Glovion-Changing-Coaster-Diameter-Included/dp/B00OA64RQ8,1,1
"Microsoft MS-DOS 6.22 Operating System on 3.5"" Floppy Disc & User's Guide",Software,https://www.amazon.com/Microsoft-MS-DOS-Operating-System-Floppy/dp/B003HN9ZK8/ref=sr_1_1?s=software&amp;ie=UTF8&amp;qid=1444863689&amp;sr=1-1&amp;keywords=dos,1,1
"Discovery Kids Teach 'n' Talk Exploration Laptop, Pink",Toys & Games,https://www.amazon.com/Discovery-Kids-Teach-Exploration-Laptop/dp/B0045H29OY,1,1
ASUS STRIX GeForce GTX 980 Overclocked 4 GB DDR5 256-bit DisplayPort HDMI 2.0 DVI-I Graphics Card,Electronics,https://www.amazon.com/dp/B00O4S9NY8/,1,1
"Pokemon Pikachu 3D LED Night Light, Elstey 3D Optical Illusion Visual Lamp 7 Colors Touch Table Desk Lamp",Tools & Home Improvement,https://www.amazon.com/Pokemon-Pikachu-Elstey-Optical-Illusion/dp/B01KO19LOK/ref=sr_1_4?ie=UTF8&amp;qid=1474392654&amp;sr=8-4&amp;keywords=pikachu+led,1,1
"Corsair Gaming K70 RGB Mechanical Keyboard, Backlit RGB LED, Cherry MX Red",Electronics,https://www.amazon.com/Corsair-Mechanical-Keyboard-Aircraft-Grade-CH-9000118-NA/dp/B014W1YUAS/ref=sr_1_1?s=pc&amp;ie=UTF8&amp;qid=1450554205&amp;sr=1-1&amp;keywords=corsair+k70,1,1
Microsoft Sidewinder X6 Gaming Keyboard with USB Port,Electronics,https://www.amazon.com/Microsoft-Sidewinder-Gaming-Keyboard-Port/dp/B001DWI4FM,1,1
SilverStone LC18B-V64 Aluminum ATX Media Center/HTPC Case - Retail (Black),Electronics,https://www.amazon.com/SilverStone-LC18B-V64-Aluminum-Media-Center/dp/B001NPEB74/ref=sr_1_21?s=pc&amp;ie=UTF8&amp;qid=1441868219&amp;sr=1-21&amp;keywords=htpc+case,1,1
Funny Software Programmer Coder shirt - RUN CMD,"Clothing, Shoes & Jewelry",https://www.amazon.com/gp/product/B01KW3CCOQ/ref=oh_aui_detailpage_o01_s00?ie=UTF8&amp;psc=1,1,1
"Toshiba Canvio Connect II 1TB Portable Hard Drive, Red (HDTC810XR3A1)",Electronics,https://www.amazon.com/Toshiba-Canvio-Connect-Portable-HDTC810XR3A1/dp/B00R4O9LXM,1,1
"BLU Studio X8 HD - 5.0"" GSM Unlocked Smartphone -Black",Cell Phones & Accessories,https://www.amazon.com/BLU-Studio-X8-HD-Smartphone/dp/B01EYT1URO/ref=sr_1_1?s=wireless&amp;ie=UTF8&amp;qid=1477574284&amp;sr=1-1&amp;refinements=p_36,1,1
"CYBERPOWERPC Gamer Xtreme Liquid Cool GLC3600A Gaming Desktop - Intel Core i7-6700K 4.0 GHz CPU, 8GB DDR4 RAM, AMD R7 360 2GB, 1TB HDD, 120GB SSD, 24X DVD+-RW, Liquid Cool, Win 10 Home",Electronics,https://www.amazon.com/CYBERPOWERPC-Xtreme-Liquid-GLC3600A-Desktop/dp/B012OU6R7S/ref=sr_1_11?s=pc&amp;ie=UTF8&amp;qid=1469666618&amp;sr=1-11&amp;keywords=gaming+PC&amp;refinements=p_n_feature_four_browse-bin,1,1
"ROSEWILL Micro ATX Mini Tower Computer Case, Black Steel and plastic computer case with 1x 120mm front fan and 1x 80mm rear fan, Front I/O and 2x USB 3.0 with transparent side panel ( FBM-X1)",Electronics,https://www.amazon.com/ROSEWILL-Computer-computer-transparent-FBM-X1/dp/B072F29JP4/ref=sr_1_5?ie=UTF8&amp;qid=1503936939&amp;sr=8-5&amp;keywords=rosewill+micro+atx,1,1
EVGA GeForce GT 730 2GB GDDR5 64bit DVI/HDMI/VGA Low Profile Graphics Card 02G-P3-3733-KR,Electronics,https://www.amazon.com/gp/product/B00L5GZ88W/ref=oh_aui_detailpage_o00_s00?ie=UTF8&amp;psc=1,1,1
"Logitech G502 Proteus Core Tunable Gaming Mouse, 12,000 DPI On-The-Fly DPI Shifting, Personalized Weight and Balance Tuning with (5) 3.6g Weights, 11 Programmable Buttons, Fully Customizable Surface (Certified Refurbished)",Electronics,https://www.amazon.com/Logitech-G502-Proteus-Gaming-Mouse/dp/B00TIJM6JM,1,1
"Opolar LC05 Laptop Cooler with Vacuum Fan (Rapid Cooling, Auto-Temp Detection, 13 Wind Speed, Unique Clamp Design, Compatible with Cooling Pads)",Electronics,https://www.amazon.com/dp/B00XKU47Y2/ref=cm_sw_r_other_apa_SKtExbWM8729W,1,1
Gino DDR3 Laptop to Desktop Memory RAM Adapter Connector Con,Electronics,https://www.amazon.com/Laptop-Desktop-Memory-Adapter-Connector/dp/B009N7XX4Q,1,1
GAMDIAS HERMES Lite Mechanical Gaming Combo with N-key Rollover Keyboard & 4000 DPI Mouse (GKC1002),Electronics,https://www.amazon.com/GAMDIAS-HERMES-Mechanical-Gaming-Combo/dp/B01DJ9YBIA,1,1
"Mahogany Wood Grain Film Vinyl Sheet Roll Wrap - 24"" Mahogany",Automotive Parts & Accessories,https://www.amazon.com/Mahogany-Wood-Grain-Vinyl-Sheet/dp/B0057ZQ70K,1,1
Crayola Washable Kids Paint set of 10 Bottles (2 fl oz/59mL),Toys & Games,https://www.amazon.com/Crayola-Washable-Kids-Paint-Bottles/dp/B00004UBH3,1,1
Burnout Paradise: The Ultimate Box - PC,Video Games,https://www.amazon.com/Burnout-Paradise-Ultimate-Box-PC/dp/B001988XHY/ref=sr_1_1_twi_dvd_2?ie=UTF8&amp;qid=1483725988&amp;sr=8-1&amp;keywords=burnout+paradise,1,1
Silverstone Tek Sleeved Extension Power Supply Cable with 1 x 8-Pin to PCI-E 8-Pin Connector (PP07-PCIW),Electronics,https://www.amazon.com/Silverstone-Sleeved-Extension-Connector-PP07-PCIW/dp/B00B46XJ2K/ref=sr_1_3?ie=UTF8&amp;qid=1488467084&amp;sr=8-3&amp;keywords=white+8+pin+cable,1,1
MyDigitalSSD Bullet Proof 30mm (2230) 42mm (2242) 60mm (2260) 80mm (2280) M.2 NGFF SuperSpeed USB 3.1 Adapter Enclosure - Supports UASP - MDM2-BP-USB3,Electronics,https://www.amazon.com/MyDigitalSSD-SuperSpeed-Enclosure-Adapter-Support/dp/B00LPH4OJK,1,1
25 Pcs Black Adhesive Backed Nylon Wire Adjustable Cable Clips Clamps,Tools & Home Improvement,https://www.amazon.com/Black-Adhesive-Backed-Adjustable-Clamps/dp/B005MN2QHK/ref=sr_1_14?ie=UTF8&amp;qid=1432301883&amp;sr=8-14&amp;keywords=cable+management,1,1
Cooler Master CM Storm Octane Multicolor LED Gaming Keyboard and Mouse Combo Bundle (SGB-3020-KKMF1-US),Electronics,https://www.amazon.com/Cooler-Master-Multicolor-Keyboard-SGB-3020-KKMF1-US/dp/B00P04ARC2/ref=sr_1_1?ie=UTF8&amp;qid=1457440532&amp;sr=8-1&amp;keywords=octane,1,1
Lenovo Y50 15.6-Inch Gaming Laptop (59441555) Black,Electronics,https://www.amazon.com/dp/B00SATBQVK/ref=psdc_565108_t3_B00REWLCVS,1,1
ASUS G751JT 17-Inch Gaming Laptop [2014 model],Electronics,https://www.amazon.com/G751JT-CH71-17-3-Inch-GeForce-GTX970M-Graphics/dp/B00NVV2B98/ref=sr_1_5?s=pc&amp;ie=UTF8&amp;qid=1430792884&amp;sr=1-5,1,1
HyperX FURY Black 16GB Kit (2x8GB) 2133MHz DDR4 Non-ECC CL14 DIMM Desktop Memory (HX421C14FBK2/16),Electronics,https://www.amazon.com/HyperX-2133MHz-Non-ECC-HX421C14FBK2-16/dp/B00TY6A1LY/ref=redir_mobile_desktop?_encoding=UTF8&amp%3Bpsc=1&amp%3Bsmid=ATVPDKIKX0DER&ref_=ox_sc_saved_image_4,1,1
ZOTAC GeForce GTX 750Ti 2GB GDDR5 PCI Express 3.0 DVI HDMI DisplayPort Video Graphics Card (ZT-70605-10M),Electronics,https://www.amazon.com/ZOTAC-GeForce-DisplayPort-Graphics-ZT-70605-10M/dp/B00M27TSJS/ref=sr_1_9?s=pc&amp;ie=UTF8&amp;qid=1453604049&amp;sr=1-9&amp;keywords=750+ti,1,1
Lian-Li Case PC-O5SX Mini-Tower 2.5/3.5inch HDD USB 3.0 Black Mini-ITX Retail,Electronics,https://www.amazon.com/Lian-Li-PC-O5SX-Aluminum-Wall-Mountable/dp/B00UPIB2PO,1,1
Lian-Li Case PC-O6SX Mid-Tower 2.5/3.5inch HDD USB 3.0 Black MicroATX Retail,Electronics,https://www.amazon.com/Lian-Li-PC-O6SX-Aluminum-Wall-Mountable/dp/B00UPICEW4/ref=sr_1_1?s=electronics&amp;ie=UTF8&amp;qid=1438166119&amp;sr=1-1&amp;keywords=Lian-Li+PC-O6S,1,1
Lian-Li Case PC-O7SX Mid-Tower 2.5/3.5inch HDD Black USB 3.0 ATX/SP-ATX Retail,Electronics,https://www.amazon.com/Lian-Li-PC-O7SX-Aluminum-Wall-Mountable/dp/B00UPIPYMG/ref=sr_1_2?ie=UTF8&amp;qid=1438964040&amp;sr=8-2&amp;keywords=Lian+Li+PC-O6S,1,1
Mad Catz R.A.T. PRO S Gaming Mouse for PC (MCB4372200A6/04/1),Electronics,https://www.amazon.com/dp/B00V7RTHUE/ref=cm_sw_r_cp_api_ddIWxbMPE2D88,1,1
"SANOXY 24x USB 2.0 External Slim CD±RW DVD ROM Combo Burner Drive, Black (PC0176)",Electronics,https://www.amazon.com/Generic-External-Combo-CD-RW-Burner/dp/B00LZMPYA8/ref=zg_bs_1292112011_11/182-6847841-2156226,1,1
Thermaltake Riing 12 Series High Static Pressure 120mm Circular LED Ring Case/Radiator Fan with Anti-Vibration Mounting System Cooling CL-F038-PL12WT-A White,Electronics,https://www.amazon.com/Thermaltake-Pressure-Circular-Anti-Vibration-CL-F038-PL12WT-/dp/B00VRKVG9Q/ref=sr_1_2?ie=UTF8&amp;qid=1450839408&amp;sr=8-2&amp;keywords=ring+12+thermaltake,1,1
Logitech Multimedia 2.1 Speakers Z213 for PC and Mobile Devices,Electronics,https://www.amazon.com/Logitech-Multimedia-Speakers-Stereo-Subwoofer/dp/B00KK9481I,1,1
Internet (First Discovery Books),Books,https://www.amazon.com/Internet-First-Discovery-Jean-Phillipe-Chabot/dp/0439148243,1,1
"Cable Matters 2-Pack, Gold Plated DisplayPort to DVI Cable 6 Feet",Electronics,https://www.amazon.com/gp/product/B00K2E4RGC/,1,1
Das Keyboard 4 Ultimate Clicky MX Blue Mechanical Keyboard (DASK4ULTMBLU),Electronics,https://www.amazon.com/Das-Keyboard-4-Ultimate-Clicky/dp/B00JKQSGWE/ref=sr_1_2?ie=UTF8&amp;qid=1454836913&amp;sr=8-2&amp;keywords=das+keyboard+4+ultimate,1,1
MSI R9 390 GAMING 8G Graphics Card,Electronics,https://www.amazon.com/MSI-R9-390-GAMING-8G/dp/B00ZGF0UAE/,1,1
"Culinary Elements Plastic Banana Holder Fruit Stand to Prevent Brusing and Maintain Texture, 1-pack",Home & Kitchen,https://www.amazon.com/gp/product/B00H9M6YI4?psc=1&amp;redirect=true&amp;ref_=oh_aui_detailpage_o00_s00,1,1
Asus optimized Z170 ATX HDMI DVI-D Dual DDR4 3400 LGA1151 socket for 6th Gen Intel Pro Gaming Motherboards (Z170 PRO GAMING),Electronics,https://www.amazon.com/GAMING-LGA1151-Intel-USB3-1-Motherboard/dp/B012NH074G/ref=sr_1_3?s=pc&amp;ie=UTF8&amp;qid=1470063419&amp;sr=1-3&amp;keywords=asus+z170+pro,1,1
XFX Double D R9 270X 1050M Boost Ready 2GB DDR5 2XmDP HDMI 2XDVI Graphics Card (R9270XCDFC),Electronics,https://www.amazon.com/XFX-Double-1050M-Graphics-R9270XCDFC/dp/B00GN1Y42A,1,1
Kingston Technology HyperX FURY 2666MHz DDR4 Non-ECC CL15 DIMM 16 DDR4 2400 MT/s (PC4-19200) HX426C15FBK2/16,Electronics,https://www.amazon.com/Kingston-Technology-16-PC4-19200-HX426C15FBK2/dp/B013H7QYEI/ref=sr_1_1?s=pc&amp;ie=UTF8&amp;qid=1470063286&amp;sr=1-1&amp;keywords=hyperx+2666,1,1
Aperture Logo - Portal die cut Vinyl Decal sticker - choose Colors,Automotive Parts & Accessories,https://www.amazon.com/gp/product/B00FXARNQQ/ref=oh_aui_search_detailpage?ie=UTF8&amp;psc=1,1,1
Twisted Veins 50’ High Speed HDMI Cable + Right Angle Adapter and Three Microfiber Cable Ties (Latest Version Supports Ethernet and Audio Return),Electronics,https://www.amazon.com/Twisted-Veins-Adapter-Supports-Ethernet/dp/B00FX867JC/ref=sr_1_1?ie=UTF8&amp;qid=1433624041&amp;sr=8-1&amp;keywords=50+ft+hdmi&amp;pebp=1433623970906&amp;perid=0H5R8DV8P3BCNEM7FTVX,1,1
Royal Epoch Portable Manual Typewriter,Office Products,https://www.amazon.com/Royal-Epoch-Portable-Manual-Typewriter/dp/B00FK540SI,1,1
FIFA 14 Sony Playstation PS2 Game UK PAL,Industrial & Scientific,https://www.amazon.com/FIFA-Sony-Playstation-PS2-Game/dp/B00E4LGDTS/ref=redir_mobile_desktop?_encoding=UTF8&amp%3BdpID=51aOOpHAEzL&amp%3BdpPl=1&amp%3Bkeywords=fifa%2014%20ps2&amp%3Bpi=SY200_QL40&amp%3Bqid=1471279297&amp%3Bref=plSrch&amp%3Bsr=8-2&ref_=mp_s_a_1_2,1,1
"Phanteks Enthoo Evolv ATX Alum/Steel Tower Computer Case, Window (PH-ES515E_GS) Galaxy Silver",Electronics,https://www.amazon.com/Phanteks-Enthoo-Computer-Window-PH-ES515E_GS/dp/B01803RRLI/ref=sr_1_2?ie=UTF8&amp;qid=1470063104&amp;sr=8-2&amp;keywords=phanteks+evolv+atx,1,1
"Corsair Hydro Series H115i Extreme Performance Liquid CPU Cooler , Black",Electronics,https://www.amazon.com/Corsair-Extreme-Performance-Liquid-Cooler/dp/B019955RNQ/ref=sr_1_1?s=pc&amp;ie=UTF8&amp;qid=1470063476&amp;sr=1-1&amp;keywords=115i,1,1
"NZXT Manta Computer Case, White/Black (CA-MANTW-W1)",Electronics,https://www.amazon.com/Manta-Computer-White-Black-CA-MANTW-W1/dp/B019JZ1YHE,1,1
Thermaltake PACIFIC DIY LCS R360 D5 Res/Pump Riing Blue LED Edition Water Cooling Kit CL-W115-CA12BU-A,Electronics,https://www.amazon.com/Thermaltake-PACIFIC-Riing-Cooling-CL-W115-CA12BU/dp/B01BI0XAUW/ref=pd_ybh_a_1?ie=UTF8&amp;psc=1&amp;refRID=JZQXM8NNQSSC1MJH4D52,1,1
Gigabyte GeForce GTX 980Ti 6GB XTREME Gaming Graphic Card GV-N98TXTREME C-6GD,Electronics,https://www.amazon.com/Gigabyte-GeForce-Graphic-GV-N98TXTREME-C-6GD/dp/B01BMJ0Z1Q?ie=UTF8&amp;ref_=cm_sw_r_other_awd_oXbcxbDT0EFWA,1,1
Thermaltake Core X5 Black E-ATX Stackable Tt LCS Certified Cube Computer Chassis CA-1E8-00M1WN-00,Electronics,https://www.amazon.com/gp/product/B01BVOIU78/ref=oh_aui_detailpage_o09_s01?ie=UTF8&amp;psc=1,1,1
"Sennheiser HD 429 Headphones, Black",Electronics,https://www.amazon.com/Sennheiser-HD-429-Headphones-Black/dp/B005N8W1Q0/ref=sr_1_3?ie=UTF8&amp;qid=1479838080&amp;sr=8-3&amp;keywords=sennheiser+hd+205,1,1
SteelSeries Sensei Laser Gaming Mouse - Grey,Electronics,https://www.amazon.com/SteelSeries-Sensei-Laser-Gaming-Mouse/dp/B005HGCNU2,1,1
Pyle-Pro PADH124 1200 Watt Dual 12''  3 Way  PA Speaker Cabinet,Musical Instruments,https://www.amazon.com/Pyle-Pro-PADH124-1200-Speaker-Cabinet/dp/B005DDJR1W/ref=sr_1_11?ie=UTF8&amp;qid=1457631044&amp;sr=8-11&amp;keywords=dual+18+pa+speakers,1,1
2-Port USB 3.0 A Female to 20 PIN Adapter,Electronics,https://www.amazon.com/2-Port-USB-3-0-Female-Adapter/dp/B005AJX9MW,1,1
MechanicalEagle Z-77 RGB Backlit 104 Keys Mechanical Gaming Keyboard with Blue Switches DIY-Replaceable Switches - Black,Electronics,https://www.amazon.com/MechanicalEagle-Mechanical-Keyboard-Switches-DIY-Replaceable/dp/B01DBVGXJ6/ref=pd_sim_147_5?_encoding=UTF8&amp;pd_rd_i=B01DBVGXJ6&amp;pd_rd_r=6P9AP1K20KD5XRC3TCJR&amp;pd_rd_w=3HpJl&amp;pd_rd_wg=uvk31&amp;psc=1&amp;refRID=6P9AP1K20KD5XRC3TCJR,1,1
StarTech.com Mini USB Cable - A to Left Angle Mini B - 3 feet (USB2HABM3LA),Electronics,https://www.amazon.com/dp/B004YD6LW0/,1,1
Crucial m4 512GB 2.5-Inch (9.5mm) SATA 6Gb/s Solid State Drive CT512M4SSD2,Electronics,https://www.amazon.com/Crucial-512GB-2-5-Inch-9-5mm-CT512M4SSD2/dp/B004W2JL3Y,1,1
"Corsair Gaming K70 LUX Mechanical Keyboard, Backlit Red LED, Cherry MX Red",Electronics,https://www.amazon.com/Corsair-Gaming-Mechanical-Keyboard-Backlit/dp/B01ER4B8B4/ref=redir_mobile_desktop?_encoding=UTF8&ref_=dp_ob_neva_mobile,1,1
"ZOTAC GeForce GTX 1080 Founders Edition, ZT-P10800A-10P, 8GB GDDR5X Dual-link DVI-I Display Port, HDMI Gaming Graphics Card",Electronics,https://www.amazon.com/ZOTAC-GeForce-Founders-ZT-P10800A-10P-Dual-link/dp/B01FMF6DAS/ref=sr_1_sc_1?s=pc&amp;ie=UTF8&amp;qid=1470063237&amp;sr=1-1-spell&amp;keywords=zotac+1080+foudners,1,1
Dell USB Enhanced Slim Black Keyboard DJ331 RH659 SK-8115 L100 W7658 J4628 U01,Electronics,https://www.amazon.com/Dell-Enhanced-Black-Keyboard-SK-8115/dp/B00496FELQ,1,1
HDE Xbox 360 USB Breakaway Cable,Video Games,https://www.amazon.com/Breakaway-Controller-Adapter-Cable-Xbox-360/dp/B0046RMJRU?th=1,1,1
Hexbug Nano - Random Color,Toys & Games,https://www.amazon.com/Innovation-First-Labs-Inc-477-2409/dp/B002R7IK74,1,1
Slimline Sata To Sata Adapter with Power,Electronics,https://www.amazon.com/Slimline-Sata-To-Adapter-Power/dp/B002O1W6ZK,1,1
BFG NVIDIA GeForce GTX 260 OC MAXCORE 55 896MB GDDR3 PCI Express 2.0 Graphics Card,Electronics,https://www.amazon.com/BFG-GeForce-MAXCORE-Express-Graphics/dp/B0029D8D32/ref=sr_1_7?ie=UTF8&amp;qid=1470692526&amp;sr=8-7&amp;keywords=gtx+260,1,1
StarTech 6-32 Brass Motherboard Standoffs for ATX Computer Case - 15 Pack STANDOFF632,Electronics,https://www.amazon.com/StarTech-Brass-Motherboard-Standoffs-Computer/dp/B00213KL5I,1,1
Equestriad 2001: Serious Horseplay,Video Games,https://www.amazon.com/dp/B001BC58QM/ref=cm_sw_r_udp_awd_no66ub19PQ6DK,1,1
Coolaroo Shade Fabric Heavy 86% to 90% UV Block  6 Feet by 15 Feet Wheat,"Patio, Lawn & Garden",https://www.amazon.com/Coolaroo-Shade-Fabric-Heavy-Block/dp/B000P7JL0S,1,1
"Free Tool Kit EZAUTOWRAP 4D Black Carbon Fiber Car Vinyl Wrap Sticker Decal with Bubble Free - 12""X60"" (1FT X 5FT)",Automotive Parts & Accessories,https://www.amazon.com/gp/product/B01M07C7B5/ref=oh_aui_detailpage_o03_s00?ie=UTF8&amp;psc=1,1,1
Star Wars Trilogy Bonus Disc (2004),Movies & TV,https://www.amazon.com/Star-Wars-Trilogy-Bonus-Disc/dp/B000FAGGWQ,1,1
"Cerwin Vega! VE-28S Dual 8"" Powered Subwoofer",Electronics,https://www.amazon.com/Cerwin-Vega-VE-28S-Powered-Subwoofer/dp/B000EHWDSG,1,1
ButtKicker BK-LFE Low Frequency Effects System,Electronics,https://www.amazon.com/ButtKicker-BK-LFE-Frequency-Effects-System/dp/B0007P98K6/ref=redir_mobile_desktop?_encoding=UTF8&amp%3Bamp%3Bkeywords=bass%20shaker&amp%3Bamp%3Bpi=SL75_QL70&amp%3Bamp%3Bqid=1494825738&amp%3Bamp%3Bsr=8-9&ref_=mp_s_a_1_9,1,1
Star Wars: Clone Wars - Volume One,Movies & TV,https://www.amazon.com/Star-Wars-Clone-One/dp/B0006Z2LMO/ref=redir_mobile_desktop?_encoding=UTF8&amp%3Bkeywords=star%20wars%20clone%20wars%20volume%201&amp%3Bpi=AC_SX236_SY340_QL65&amp%3Bqid=1484364136&amp%3Bsr=8-1&ref_=mp_s_a_1_1,1,1
"ASUS X756 17.3-Inch Full HD (1920 x 1080) Premium Laptop(Intel Core i5-6200U Processor, 12GB DDR4 RAM, 1TB HDD, NVIDIA GeForce 950M 2GB, SuperMulti DVD, HDMI, Bluetooth, VGA, Wifi, Windows 10)",Electronics,https://www.amazon.com/gp/product/B01NBL1NNB/ref=oh_aui_detailpage_o00_s00?ie=UTF8&amp;psc=1,1,1
"HyperX Alloy FPS Mechanical Gaming Keyboard, Cherry MX Red, Red LED (HX-KB1RD1-NA/A1)",Electronics,https://www.amazon.com/HyperX-Mechanical-Keyboard-HX-KB1RD1-NA-A1/dp/B01NCX88FQ/ref=sr_1_37?s=electronics&amp;ie=UTF8&amp;qid=1499480525&amp;sr=1-37&amp;keywords=mechanical+keyboard+cherry+mx,1,1
StarTech.com 4 Port USB A Female Slot Plate Adapter (USBPLATE4),Electronics,https://www.amazon.com/gp/product/B00015Y0FK/ref=pd_sim_147_1?ie=UTF8&amp;pd_rd_i=B00015Y0FK&amp;pd_rd_r=QPWJGNRSS5APFF2F11BS&amp;pd_rd_w=ekA90&amp;pd_rd_wg=mbf2G&amp;psc=1&amp;refRID=QPWJGNRSS5APFF2F11BS,1,1
The Way Things Work,Books,https://www.amazon.com/The-Things-Work-David-Macaulay/dp/1405302380,1,1
TRIPP LITE USB 2.0 to USB Motherboard 4-Pin IDC Header Cable 6-Inch (U024-06N-IDC),Electronics,https://www.amazon.com/TRIPP-Motherboard-Header-6-Inch-U024-06N-IDC/dp/B00QVTVB84,1,1
"Yakamoz DC12V 16mm 5/8"" Metal Momentary Push Button Switch Red Led Power Symbol Car DIY Switch Black",Automotive Parts & Accessories,https://www.amazon.com/Yakamoz-Momentary-Button-Switch-Symbol/dp/B01D48KNU6/ref=sr_1_3?ie=UTF8&amp;qid=1469261773&amp;sr=8-3&amp;keywords=Yakamoz+DC12V+16mm+5,1,1
"M.2 NGFF PCIe SSD to PCI Express 3.0 x4 Drvie Host Adapter Card Slot Support M.2 PCIe（NVMe，AHCI ）2280, 2260, 2242, 2230",Electronics,https://www.amazon.com/NVMe-Express-Drvie-Adapter-Support/dp/B01FFQQPUC/ref=sr_1_8?ie=UTF8&amp;qid=1490188033&amp;sr=8-8&amp;keywords=pci+m2,1,1
Fiio E17K ALPEN 2 USB DAC Headphone Amplifier,Electronics,https://www.amazon.com/Fiio-E17K-ALPEN-Headphone-Amplifier/dp/B00RPD7KP8,1,1
Samsung SH-224DB/BEBE-KIT 24x Internal CD DVD±R/RW Dual Layer Disc Burner Drive Writer + Nero 12 Essentials + Sata Cable Kit,Electronics,https://www.amazon.com/Samsung-SH-224DB-BEBE-KIT-Internal-Essentials/dp/B00IFRH9TA/,1,1
ONCHOICE USB Flash Drive USB 3.0 32GB Waterproof Memory Stick LED Thumb Drive Crystal Transparent with Box,Electronics,https://www.amazon.com/ONCHOICE-Waterproof-Memory-Crystal-Transparent/dp/B01HXZ0MSE?th=1,1,1
"SilverStone Technology 5.25"" Display with USB 3.1, Multi Card Reader, Fan Speed, and Voltage/Amperage LCD (FP59B)",Electronics,https://www.amazon.com/SilverStone-Technology-Display-Amperage-FP59B/dp/B01LWSP4K8/,1,1
Asus Hyper M.2 X4 PCI-E Mini,Electronics,https://www.amazon.com/gp/product/B01LXI58VO/ref=oh_aui_detailpage_o01_s00?ie=UTF8&amp;psc=1,1,1
ZOTAC NVIDIA GeForce GTX 750 Ti 2GB GDDR5 2DVI/Mini HDMI PCI-Express Video Card ZT-70601-10M,Electronics,https://www.amazon.com/ZOTAC-NVIDIA-GeForce-PCI-Express-ZT-70601-10M/dp/B00IFZ547Q,1,1
Aim Sports Shotgun Shell Bandolier/56 Rounds,Sports & Outdoors,https://www.amazon.com/Sports-Shotgun-Shell-Bandolier-Rounds/dp/B00551HARU/ref=sr_1_2?ie=UTF8&amp;qid=1462909757&amp;sr=8-2&amp;keywords=bandolier,1,1
Sony PSP 1.3 Megapixel Chotto Shot Camera for PlayStation,Electronics,https://www.amazon.com/Sony-Megapixel-Chotto-Shot-Camera/dp/B000IBELZG,1,1
Importer520 Gold Plated HDMI Female to DVI-D Male Video Adapter,Electronics,https://www.amazon.com/DVI-D-Male-HDMI-Female-Adapter/dp/B004CHATO4/ref=pd_sim_e_3?ie=UTF8&amp;refRID=0E26F7NHR40WHZB5HP6Y,1,1
Gadgetzan Memory Foam Earphone In-ear Earbud Earpad Sponge Replacement Covers (Black-M),Cell Phones & Accessories,https://www.amazon.com/Gadgetzan-Memory-Earphone-Replacement-Black-M/dp/B01DU6VXBA,1,1
Samsung 850 EVO - 1TB - mSATA Internal SSD (MZ-M5E1T0BW),Electronics,https://www.amazon.com/Samsung-850-mSATA-2-Inch-MZ-M5E1T0BW/dp/B00TGIVRYU,1,1
Depression For Dummies,Books,https://www.amazon.com/Depression-For-Dummies-Laura-Smith/dp/0764539000,1,1
"Alienware Area-51 Gaming Machine-Intel Core i7-5820K 6-cores Overclocked up to 3.8GHz, 8GB Ram, 2TB HDD, DVD Burner, AMD Radeon R9 270 2GB Graphics, Windows 7 Pro",Electronics,https://www.amazon.com/Alienware-Machine-Intel-i7-5820K-Overclocked-Graphics/dp/B00PUWAC3S,1,1
Hot Galgame Yosuga No Sora Series Mouse Pad Custom Ergonomic Design Wrist Rests - 3D Mousemat Gel Wrist Mousepad (QMO3),"Clothing, Shoes & Jewelry",https://www.amazon.com/Galgame-Yosuga-Custom-Ergonomic-Design/dp/B00QZ0N024/ref=pd_sim_sbs_147_2/187-2475029-2455806?ie=UTF8&amp;dpID=51Owwews68L&amp;dpSrc=sims&amp;preST=_AC_UL160_SR134,1,1
Razer Goliathus Control Gravity - Precision Cloth Gaming Mouse Mat - Professional Gaming Quality - Extended,Electronics,https://www.amazon.com/Razer-Goliathus-Control-Gravity-Professional/dp/B01M1GZ53Y,1,1
General Tools 482 Swivel Head Deburring Tool with Metal Handle,Tools & Home Improvement,https://www.amazon.com/General-Tools-482-Swivel-Deburring/dp/B00004T828/,1,1
"Laptop Stickers [100 pcs], Bezgar Car Stickers Motorcycle Bicycle Luggage Decal Graffiti Patches Skateboard Stickers for Laptop - Random Sticker Pack","Arts, Crafts & Sewing",https://www.amazon.com/Stickers-Motorcycle-Bicycle-Graffiti-Skateboard/dp/B01M7TG4U7/ref=sr_1_1?ie=UTF8&amp;qid=1489159127&amp;sr=8-1&amp;keywords=sticker+pack,1,1
"Samdi Desktop Wooden Cell Phone Stand or Cell Phone Holder, a Good Cell Phone Decorations, for All Kinds of Brand Cell Phone Such As iPhone Samsung Nokia Htc Huawei Sony Mi Moto Smartphone (White(birch Color))",Cell Phones & Accessories,https://www.amazon.com/gp/product/B00QF1KDRS/ref=oh_aui_detailpage_o08_s01?ie=UTF8&amp;psc=1,1,1
Xbox 360 Limited Edition Red Wireless Controller and Play & Charge Kit,Video Games,https://www.amazon.com/Xbox-360-Limited-Edition-Wireless-Controller/dp/B001E2D44W,1,1
Andoer Genuine GBS8200 1 Channel Relay Module Board CGA / EGA / YUV / RGB To VGA Arcade Game Video Converter for CRT Monitor LCD Monitor PDP Monitor,Electronics,https://www.amazon.com/Andoer-Genuine-GBS8200-Channel-Converter/dp/B00W3460UU,1,1
OXO Good Grips Electronics Cleaning Brush,Home & Kitchen,https://www.amazon.com/OXO-Grips-Electronics-Cleaning-Brush/dp/B0050B6CYW/ref=sr_1_1?ie=UTF8&amp;qid=1482966031&amp;sr=8-1&amp;keywords=brush+electronic,1,1
"iBUYPOWER AM720FX Gaming Desktop - AMD FX-4300 Quad Core 3.8GHz, 8GB DDR3 RAM, 1TB HDD, 24X DVD, NVIDIA GT 730 2GB, Wi-Fi USB Adapter, Windows 10 Home 64-Bit (Discontinued by Manufacturer)",Electronics,https://www.amazon.com/iBUYPOWER-AM720FX-Gaming-Desktop-Discontinued/dp/B00SV7ITKM/ref=redir_mobile_desktop?_encoding=UTF8&amp%3Bpsc=1&ref_=oh_aui_i_d_old_o0_img,1,1
Cyber Acoustics 100Hz to 16kHz Lapel Microphone (ACM-1B),Electronics,https://www.amazon.com/Cyber-Acoustics-100Hz-Microphone-ACM-1B/dp/B0000511GQ,1,1
"Avantree Wireless Headphones for TV with Bluetooth Transmitter SET, Auto-reconnect, No Lip Sync Delay, LONG RANGE, 40 Hours Battery, for PC / Video Game, BT 4.2 - HT3189 [24M Warranty]",Electronics,https://www.amazon.com/gp/product/B072V3478X/ref=oh_aui_detailpage_o04_s00?ie=UTF8&amp;psc=1,1,1
"ARCHEER LED Touch Bedside Lamp with Bluetooth Speaker, Dimmable Color Changing LED Night Light Table Lamp with Smart Touch Control for Home Party, Teens Kids Children",Tools & Home Improvement,https://www.amazon.com/ARCHEER-Bluetooth-Dimmable-Changing-Children/dp/B01N5K6G4N/ref=sr_1_149?s=lamps-light&amp;ie=UTF8&amp;qid=1496140611&amp;sr=1-149&amp;keywords=led+table+lamp&amp;refinements=p_n_feature_browse-bin,1,1
Redragon K553 USAS LED Backlit Mechanical Gaming Keyboard (Black),Electronics,https://www.amazon.com/Redragon-Backlit-Mechanical-Gaming-Keyboard/dp/B016MBNR8M/ref=gbph_img_m-3_61a3_ef7bca06?smid=AXZ7TDMJNMJSZ&amp;pf_rd_p=cb8828ba-8265-4e7f-8c4d-df6f0d9f61a3&amp;pf_rd_s=merchandised-search-3&amp;pf_rd_t=101&amp;pf_rd_i=409566&amp;pf_rd_m=ATVPDKIKX0DER&amp;pf_rd_r=HKT2BFXS27CDWH6N7SK7,1,1
NVIDIA SHIELD Controller (2015),Electronics,https://www.amazon.com/NVIDIA-945-12570-2500-000-SHIELD-Controller/dp/B00LMRL00O/ref=sr_1_15?ie=UTF8&amp;qid=1424020784&amp;sr=8-15&amp;keywords=Gaming+Controller+PC,1,1
