name,category,amazon_link,total_mentions,subreddit_mentions
AudioQuest Diamond 16m (52.49 feet) Braided HDMI Cable,Electronics,https://www.amazon.com/gp/product/B00IL3TZSQ/ref=pd_lpo_sbs_dp_ss_1?pf_rd_p=1944687582&amp;pf_rd_s=lpo-top-stripe-1&amp;pf_rd_t=201&amp;pf_rd_i=B003CT08E4&amp;pf_rd_m=ATVPDKIKX0DER&amp;pf_rd_r=0MGBXVRG2F2YTHE1X742,28,14
Metro ED500 DataVac 500-Watt 120 volt 0.75-HP Electric Blower Duster,Tools & Home Improvement,https://www.amazon.com/Metro-Vacuum-ED500-500-Watt-Electric/dp/B001J4ZOAW/ref=sr_1_fkmr0_1?ie=UTF8&amp;qid=1438846071&amp;sr=8-1-fkmr0&amp;keywords=D500+DataVac+120+Volt,44,13
"V-MODA BoomPro Gaming, VoIP Headset Headphone with Mic (Black)",Electronics,https://www.amazon.com/V-MODA-BoomPro-Gaming-Headset-Headphone/dp/B00BJ17WKK/ref=sr_1_1?ie=UTF8&amp;qid=1452554901&amp;sr=8-1&amp;keywords=vmoda+boom+pro+mic,23,6
Puget Systems Universal Acrylic GPU Brace,Electronics,https://www.amazon.com/Puget-Systems-Universal-Acrylic-Brace/dp/B019ZZQVK8/ref=sr_1_1?ie=UTF8&amp;qid=1455212512&amp;sr=8-1&amp;keywords=puget+gpu+brace,11,6
"Atlas Graphics Card Brace Support. A Video Card Holder, GPU brace, for custom Deskto Pc Gaming. a GPU stand case mod.",Electronics,https://www.amazon.com/Graphics-Support-Holder-custom-Gaming/dp/B01DQK7DDW,10,5
Seiorca Marvel Comics Deadpool Boobs 3D Mouse Pad with Wrist Support Rest Mat,Office Products,https://www.amazon.com/Seiorca-Marvel-Comics-Deadpool-Boobs/dp/B01CQAKA7Y/ref=sr_1_50?s=office-products&amp;ie=UTF8&amp;qid=1463068668&amp;sr=1-50&amp;keywords=mousepad,5,5
"TP-Link AV500 Nano Powerline Adapter Starter Kit, up to 500Mbps (TL-PA4010KIT)",Electronics,https://www.amazon.com/TP-LINK-TL-PA4010KIT-Powerline-Adapter-Starter/dp/B00AWRUICG/ref=sr_1_2?ie=UTF8&amp;qid=1422815623&amp;sr=8-2&amp;keywords=ethernet+outlet&amp;pebp=1422815626062&amp;peasin=B00AWRUICG,24,4
Samsung 850 EVO 250GB 2.5-Inch SATA III Internal SSD (MZ-75E250B/AM),Electronics,https://www.amazon.com/Samsung-850-EVO-2-5-Inch-MZ-75E250B/dp/B00OAJ412U/ref=sr_1_1/154-3156870-8814137?ie=UTF8&amp;qid=1470063679&amp;sr=8-1&amp;keywords=850+evo,19,4
WireWorld - Platinum Starlight 7 HDMI Cable - 20 Meter,Electronics,https://www.amazon.com/WireWorld-Platinum-Starlight-Cable-Meter/dp/B00KY2NKCO/ref=pd_sim_sbs_23_2?ie=UTF8&amp;dpID=51SrnnAYfGL&amp;dpSrc=sims&amp;preST=_AC_UL160_SR160,14,4
SteelSeries QcK Gaming Mouse Pad - Black,Electronics,https://www.amazon.com/dp/B000UEZ36W/ref=twister_B01MU14VHD?_encoding=UTF8&amp;psc=1,10,4
Diamond HDMI Digital Audio/Video Cable W/ Ethernet Connection 5 meters,Electronics,https://www.amazon.com/Diamond-Digital-Ethernet-Connection-meters/dp/B003CT2A6I/ref=sr_1_2?ie=UTF8&amp;qid=1429379048&amp;sr=8-2&amp;keywords=diamond+hdmi,9,4
"VELCRO Brand One Wrap Thin Ties, Black, 8 x 1/2-Inch, 100 Count (91140)",Office Products,https://www.amazon.com/gp/product/B001E1Y5O6?psc=1&amp;redirect=true&amp;ref_=oh_aui_detailpage_o06_s00,23,3
Zalman Zm-Mic1 High Sensitivity Headphone Microphone,Electronics,https://www.amazon.com/Zalman-Zm-Mic1-Sensitivity-Headphone-Microphone/dp/B00029MTMQ/ref=pd_sim_sbs_267_1?ie=UTF8&amp;dpID=41G0amLlbML&amp;dpSrc=sims&amp;preST=_AC_UL160_SR150,21,3
"Dell 15.6-Inch Gaming Laptop (6th Gen Intel Quad-Core i5-6300HQ Processor up to 3.2GHz, 8GB DDR3, 256GB SSD, Nvidia GeForce GTX 960M, Windows 10)",Electronics,https://www.amazon.com/Dell-15-6-Inch-Quad-Core-i5-6300HQ-Processor/dp/B015PYYDMQ/ref=sr_1_1?ie=UTF8&amp;qid=1465828421&amp;sr=8-1&amp;keywords=dell+gaming,21,3
Sennheiser HD 598 Special Edition Over-Ear Headphones - Black,Electronics,https://www.amazon.com/Sennheiser-HD-598-Over-Ear-Headphones/dp/B0126HISOO,15,3
WD Blue 1TB SATA 6 Gb/s 7200 RPM 64MB Cache 3.5 Inch Desktop Hard Drive (WD10EZEX),Electronics,https://www.amazon.com/Blue-Everyday-Desktop-Hard-Drive/dp/B0088PUEPK,12,3
"HyperX KHX-H3CL/WR Cloud Gaming Headset for PC, Xbox One, Xbox One S, PS4, PS4 Pro, Mac, Mobile and VR - Black",Electronics,https://www.amazon.com/HyperX-Gaming-Headset-KHX-H3CL-WR/dp/B00JJNQG98/ref=sr_1_3,11,3
Kingston DataTraveler HyperX Predator 1TB USB 3.0 Flash Drive (DTHXP30/1TB),Electronics,https://www.amazon.com/Kingston-DataTraveler-Predator-1TB-DTHXP30/dp/B00E65QM8O/ref=sr_1_4?ie=UTF8&amp;qid=1471659781&amp;sr=8-4&amp;keywords=1+TB+USB,10,3
Antlion Audio ModMic 4.0 Attachable Boom Microphone - Omni-Directional with Mute Switch,Electronics,https://www.amazon.com/Antlion-Audio-ModMic-Attachable-Microphone/dp/B00T6XUL8S,8,3
Redragon K552 KUMARA LED Backlit Mechanical Gaming Keyboard (Black),Electronics,https://www.amazon.com/dp/B016MAK38U/ref=cm_sw_r_cp_apa_gNneyb24PQ6DA,8,3
Acer GN246HL Bbid 24-Inch 3D Gaming Display (144Hz Refresh Rate),Electronics,https://www.amazon.com/dp/B00KO4518I,8,3
AudioQuest Diamond 2m (6.56 feet) Braided HDMI Cable,Electronics,https://www.amazon.com/AudioQuest-Diamond-6-56-Braided-Cable/dp/B003CT2A2M/ref=sr_1_4?ie=UTF8&amp;qid=1495904263&amp;sr=8-4&amp;keywords=diamond+hdmi,7,3
SteelSeries QcK+ Gaming Mouse Pad - Black,Electronics,https://www.amazon.com/SteelSeries-QcK-Gaming-Mouse-Black/dp/B000UVRU6G/ref=sr_1_2?ie=UTF8&amp;qid=1445955647&amp;sr=8-2&amp;keywords=steelseries+xxl,6,3
Dell Ultra HD 5K Monitor UP2715K 27-Inch Screen LED-Lit Monitor,Electronics,https://www.amazon.com/Dell-Monitor-UP2715K-27-Inch-LED-Lit/dp/B00OKSFXZU/,6,3
ASUS ROG SWIFT PG278Q  27-inch Gaming Monitor,Electronics,https://www.amazon.com/PG278Q-27-Inch-Display-Refresh-Monitor/dp/B00MSOND8C/ref=sr_1_1?s=pc&amp;ie=UTF8&amp;qid=1473937837&amp;sr=1-1&amp;keywords=asus+rog+swift,6,3
Zettaguard Wireless PC USB Gaming Receiver for Xbox 360 Compact Disc,Video Games,https://www.amazon.com/Wireless-Gaming-Receiver-360-xbox360-Compact/dp/B0076HD2W8/ref=sr_1_5?ie=UTF8&amp;qid=1431032817&amp;sr=8-5&amp;keywords=Xbox+Controller+for+Windows,6,3
"CyberPower CP1500PFCLCD PFC Sinewave UPS System, 1500VA/900W, 10 Outlets, AVR, Mini-Tower",Electronics,https://www.amazon.com/dp/B00429N19W?ref=emc_b_5_t,5,3
"COSMOS desktop computer ATX/MATX companion, blank drawer rack (5.25""), for computer accessories/storage devices+Cosmos Cable Tie",Electronics,https://www.amazon.com/desktop-computer-companion-accessories-Cosmos/dp/B006VAD2C6/ref=sr_1_1?ie=UTF8&amp;qid=1443195064&amp;sr=8-1&amp;keywords=pc+drawer,5,3
"EVGA 500 W1, 80+ WHITE 500W, 3 Year Warranty, Power Supply 100-W1-0500-KR, Black",Electronics,https://www.amazon.com/EVGA-WHITE-Warranty-Supply-100-W1-0500-KR/dp/B00H33SFJU/ref=sr_1_1?ie=UTF8&amp;qid=1474299804&amp;sr=8-1&amp;keywords=evga+psu,5,3
XPOWER A-2 Airrow Pro Multi-Use Electric Computer Duster Dryer Air Pump Blower - Black,Office Products,https://www.amazon.com/dp/B01BI4UQK0/ref=cm_sw_r_cp_api_CXZIzb95VH0TE,4,3
Metro Datavac ESD Safe Electric Duster - Model ED-500ESD - computer and equipment duster,Office Products,https://www.amazon.com/dp/B00U01YVYK,3,3
"Passion Lubes, Natural Water-Based Lubricant, 55 Gallon Drum","Health, Household & Baby Care",https://www.amazon.com/Passion-Lubes-Natural-Water-Based-Lubricant/dp/B005MR3IVO/ref=redir_mobile_desktop?_encoding=UTF8&refRID=1PGXPTQW30XHM3SMPE3E&ref_=pd_aw_sbs_328_1,74,2
"Mayflash GameCube Controller Adapter for Wii U and PC USB, 4 Port",Electronics,https://www.amazon.com/dp/B00RSXRLUE/ref=cm_sw_r_awd_ceB7vb6JXS307,24,2
Microsoft Xbox 360 Wired Controller for Windows & Xbox 360 Console,Electronics,https://www.amazon.com/Microsoft-Xbox-360-Controller-Windows/dp/B004QRKWLA,19,2
Microsoft Xbox Wireless Adapter for Windows,Video Games,https://www.amazon.com/dp/B00ZB7W4QU/ref=cm_sw_r_awd_Yy6VvbXPR4SF8,17,2
"AOC G2460PF 24-Inch Professional Gaming LED Monitor Free Sync,144hz,1ms, Hght Adjust, Spk, VGA DVI HDMI DP USB",Electronics,https://www.amazon.com/dp/B01BV1XBEI/ref=cm_sw_r_cp_api_BbszzbYWPS1E1,15,2
"Logitech HD Pro Webcam C920, Widescreen Video Calling and Recording, 1080p Camera, Desktop or Laptop Webcam",Electronics,https://www.amazon.com/Logitech-Widescreen-Calling-Recording-Desktop/dp/B006JH8T3S/ref=sr_1_1?ie=UTF8&amp;qid=1487973705&amp;sr=8-1&amp;keywords=logitech+920,15,2
Steam Link,Video Games,https://www.amazon.com/Steam-Link-Pc/dp/B016XBGWAQ,12,2
Cooler Master Hyper 212 EVO RR-212E-20PK-R2 CPU Cooler with 120mm PWM Fan,Electronics,https://www.amazon.com/Cooler-Master-Hyper-RR-212E-20PK-R2-120mm/dp/B005O65JXI/ref=sr_1_1?s=pc&amp;ie=UTF8&amp;qid=1495367377&amp;sr=1-1&amp;keywords=cooler+master+hyper+212+evo,11,2
Philips SHP9500 HiFi Precision Stereo Over-ear Headphones (Black),Electronics,https://www.amazon.com/Philips-SHP9500-Precision-Over-ear-Headphones/dp/B00ENMK1DW/ref=sr_1_1?ie=UTF8&amp;qid=1492525260&amp;sr=8-1&amp;keywords=shp9500,11,2
Sennheiser HD 558 Headphones,Electronics,https://www.amazon.com/Sennheiser-HD-558-Headphones/dp/B004FEEY9A/ref=sr_1_1?ie=UTF8&amp;qid=1488395736&amp;sr=8-1&amp;keywords=sennheiser+hd518,11,2
"Glorious Extended Gaming Mouse Mat / Pad - XXL Large, Wide (Long) Black Mousepad, Stitched Edges | 36""x11""x0.12"" (G-E)",Office Products,https://www.amazon.com/Glorious-Extended-Gaming-Mouse-Mat/dp/B00J2EF4K6/ref=sr_1_6?ie=UTF8&amp;qid=1435838559&amp;sr=8-6&amp;keywords=gaming+mousepad,9,2
Giottos AA1900 Rocket Air Blaster Large - Black,Electronics,https://www.amazon.com/gp/product/B00017LSPI/ref=pd_lpo_sbs_dp_ss_1?pf_rd_p=1944687642&amp;pf_rd_s=lpo-top-stripe-1&amp;pf_rd_t=201&amp;pf_rd_i=B002Q68E3G&amp;pf_rd_m=ATVPDKIKX0DER&amp;pf_rd_r=12N24MMAW6P7W51X3TAA,9,2
"Dell Gaming S2716DG 27.0"" Screen LED-Lit Monitor with G-SYNC",Electronics,https://www.amazon.com/Dell-Gaming-S2716DG-LED-Lit-Monitor/dp/B0149QBOF0/ref=redir_mobile_desktop?_encoding=UTF8&amp%3Bpsc=1&ref_=ya_aw_od_pi,9,2
"Metro Vacuum ED500P DataVac  500-Watt, .75-HP Electric Duster",Tools & Home Improvement,https://www.amazon.com/Metro-Vacuum-ED500P-500-Watt-Electric/dp/B001U899HQ/ref=sr_1_2?ie=UTF8&amp;qid=1500487502&amp;sr=8-2&amp;keywords=datavac,8,2
Dell Gaming S2417DG YNY1D 24-Inch Screen LED-Lit Monitor with G-SYNC,Electronics,https://www.amazon.com/dp/B01IOO4SGK,8,2
Superlux HD668B Dynamic Semi-Open Headphones,Electronics,https://www.amazon.com/Superlux-HD668B-Dynamic-Semi-Open-Headphones/dp/B003JOETX8/ref=sr_1_1?ie=UTF8&amp;qid=1488033005&amp;sr=8-1&amp;keywords=superlux+hd+668b,8,2
"Acer Predator XB271HU bmiprz 27"" WQHD (2560x1440) NVIDIA G-SYNC IPS Display, (Display Port & HDMI Port, 144Hz)",Electronics,https://www.amazon.com/Acer-Predator-XB271HU-27-inch-Widescreen/dp/B0173PEX20/ref=sr_1_1?s=aht&amp;ie=UTF8&amp;qid=1469767773&amp;sr=8-1&amp;keywords=Predator+XB271HU,8,2
SanDisk Extreme Pro 512 GB SDXC UHS-I Card (SDSDXPA-512G-G46),Electronics,https://www.amazon.com/SanDisk-Extreme-UHS-I-Memory-SDSDXPA-512G-G46/dp/B00NP699ZI/ref=sr_1_7?s=pc&amp;ie=UTF8&amp;qid=1424560437&amp;sr=1-7&amp;keywords=sd+card,7,2
"Dell Inspiron i7559-2512BLK 15.6 Inch FHD Laptop (6th Generation Intel Core i7, 8 GB RAM, 1 TB HDD + 8 GB SSD) NVIDIA Gaming GeForce GTX 960M",Electronics,https://www.amazon.com/dp/B015PYZ0J6/ref=cm_sw_r_cp_apa_WkZoybRDHQK04,7,2
Intel 7th Gen Intel Core Desktop Processor i7-7700K (BX80677I77700K),Electronics,https://www.amazon.com/Intel-Desktop-Processor-i7-7700K-BX80677I77700K/dp/B01MXSI216/,7,2
Microsoft Windows 10 Home USB Flash Drive,Software,https://www.amazon.com/Microsoft-Windows-Home-Flash-Drive/dp/B01019T6O0/ref=pd_cp_147_2?ie=UTF8&amp;refRID=0V5HS7DDN3GVMB8D8PM6,6,2
"8m (26'3"") Audioquest Diamond RJ/E (Ethernet) Cable",Electronics,https://www.amazon.com/gp/product/B0073HJVSK,5,2
"KLOUD City Black desktop computer ATX/MATX hard drive mobile blank rack drawer tray devices storage case (5.25"") (Black)",Electronics,https://www.amazon.com/gp/product/B00AVSSKOE?psc=1&amp;redirect=true&amp;ref_=oh_aui_detailpage_o03_s00,5,2
"Walker Edison Soreno 3-Piece Corner Desk, Black with Black Glass",Home & Kitchen,https://www.amazon.com/Walker-Edison-Soreno-3-Piece-Corner/dp/B001FB5LE8/ref=sr_1_2?ie=UTF8&amp;qid=1433050887&amp;sr=8-2&amp;keywords=desk,4,2
"Max Keyboard Keycap, Cherry MX Switch, O-Ring Sampler Tester Kit",Electronics,https://www.amazon.com/Max-Keyboard-Keycap-Cherry-Sampler/dp/B00E71W4O8/ref=sr_1_3?ie=UTF8&amp;qid=1434991927&amp;sr=8-3&amp;keywords=switch+tester,4,2
"VIVO 1,000 ft bulk Cat5e Ethernet Cable / Wire UTP Pull Box 1,000ft Cat-5e Style Grey (CABLE-V001)",Electronics,https://www.amazon.com/dp/B0092TG310/ref=cm_sw_r_awd_Q6-GvbTZ9MF20,4,2
"Mount-It! MI-753 Triple Screen LCD Computer Monitor Desk Mount Stand Arm for 19, 20, 22, 23, 24 Inch Monitors VESA 75 and 100 Compatible Full Motion, Tilt, Swivel, Rotate, 66 lbs Capacity, Black",Office Products,https://www.amazon.com/Mount--Articulating-Computer-Monitor-Monitors/dp/B00BDT072S/ref=sr_1_1?ie=UTF8&amp;qid=1435708161&amp;sr=8-1&amp;keywords=triple+monitor+mount&amp;pebp=1435708171288&amp;perid=067BH8VASMMKT9ZNCS7B,4,2
Metro Vacuum MDV-1BA DataVac Pro 4.5-AMP Computer Vac/Blower,Electronics,https://www.amazon.com/dp/B00006IAOR,4,2
Kingston Digital 120GB SSDNow V300 SATA 3 2.5 Solid State Drive (SV300S37A/120G),Electronics,https://www.amazon.com/Kingston-Digital-SSDNow-SV300S37A-120G/dp/B00A1ZTZOG/ref=sr_1_1?ie=UTF8&amp;qid=1459961253&amp;sr=8-1&amp;keywords=128+gb+ssd,4,2
X-Rite ColorMunki Smile (CMUNSML),Electronics,https://www.amazon.com/X-Rite-CMUNSML-ColorMunki-Smile/dp/B009APMNB0/ref=sr_1_3?ie=UTF8&amp;qid=1443190280&amp;sr=8-3&amp;keywords=colorimeter,4,2
"SilverStone PWM Fan Hub System Cables, Black (CPF04)",Electronics,https://www.amazon.com/SilverStone-System-Cables-Black-CPF04/dp/B00VNW556I/ref=pd_lpo_147_bs_tr_t_2?_encoding=UTF8&amp;psc=1&amp;refRID=PPDQBY4Y0220NRD3NNQH,4,2
FiiO D3 (D03K) Digital to Analog Audio Converter With Micca 6ft Optical Toslink Cable - 192kHz/24bit Optical and Coaxial DAC,Electronics,https://www.amazon.com/D3-Digital-Converter-Optical-Toslink/dp/B005K2TXMO/ref=sr_1_1?ie=UTF8&amp;qid=1456518217&amp;sr=8-1,4,2
XFX RADEON R7 260X 1075MHz 2GB DDR5 DP HDMI 2 X DVI Graphics Card (R7260XCNF4),Electronics,https://www.amazon.com/dp/B00FUR6FJ8/,3,2
"Insten 20 / 24-pin Power Supply Tester for ATX / SATA / HDD, Black",Electronics,https://www.amazon.com/Insten-24-pin-Power-Supply-Tester/dp/B005CTCD6S,3,2
Samsung 850 EVO - 120GB - 2.5-Inch SATA III Internal SSD (MZ-75E120B/AM),Electronics,https://www.amazon.com/Samsung-2-5-Inch-Internal-MZ-75E120B-AM/dp/B00OAJ5N6I/ref=sr_1_1?ie=UTF8&amp;qid=1456760940&amp;sr=8-1&amp;keywords=850+evo+128gb,3,2
PCIe x1 to x16 Powered Extender for Litecoin/Bitcoin Mining (Over 1m USB 3.0 Cable) (USB 3.0 A with Molex),Electronics,https://www.amazon.com/Powered-Extender-Litecoin-Bitcoin-Mining/dp/B00HZ0M9F2,3,2
"CYBERPOWERPC Gamer Xtreme VR GXiVR8020A Gaming Desktop - Intel i5-6402P Quad Core 2.8GHz, 8GB DDR4 RAM, 1TB HDD, 24X DVD, AMD RX 480 4GB, WI-Fi USB Adapter, Windows 10 Home (Discontinued by Manufacturer)",Electronics,https://www.amazon.com/CYBERPOWERPC-Xtreme-GXiVR8020A-Gaming-Desktop/dp/B01HNBLHAA/ref=sr_1_1?s=pc&amp;ie=UTF8&amp;qid=1481139989&amp;sr=1-1&amp;keywords=cyberpowerpc,3,2
"Dust-Off Compressed Gas Duster, Pack of 4",Electronics,https://www.amazon.com/Dust-Off-Compressed-Gas-Duster-Pack/dp/B00DZYEXPQ/ref=sr_1_3?s=electronics&amp;ie=UTF8&amp;qid=1500488745&amp;sr=1-3&amp;keywords=dust+off,3,2
"Razer Orbweaver Chroma - Elite RGB Mechanical Switches Gaming Keypad - Adjustable Hand, Thumb and Palm-Rest",Electronics,https://www.amazon.com/Razer-Orbweaver-Chroma-Mechanical-Adjustable/dp/B013P0HW7K/ref=sr_1_1?ie=UTF8&amp;qid=1479463000&amp;sr=8-1&amp;keywords=razer+orbweaver,3,2
Retro Link GameCube Style USB Wired Controller,Video Games,https://www.amazon.com/Retro-GameCube-Style-Wired-Controller-Pc/dp/B00HS7LJ2G,3,2
Montblanc Meisterstuck Classique Ballpoint Pen 164 Black with Gold Trim,Office Products,https://www.amazon.com/Montblanc-Meisterstuck-Classique-Ballpoint-Black/dp/B00126TNOK,2,2
"Nanoxia Deep Silence 4 Mini Tower Computer Case with 6 Fan Controller, Fits Micro-ATX Motherboard and 2 x 120mm Radiators, 20.1 Pounds, Anthracite (NXDS4A)",Electronics,https://www.amazon.com/Nanoxia-Controller-Motherboard-Anthracite-NXDS4A/dp/B00DSFDRRM,2,2
"Aorus Mechanical Keyboard with Detachable Marco Pads, Cherry Red with Blue Backlit (GK-THUNDER K7)",Electronics,https://www.amazon.com/Mechanical-Keyboard-Detachable-GK-THUNDER-K7/dp/B00O4VAX12,2,2
"Thermaltake Xray A2021 5.25"" Drive Bay Kit with Beverage Tray and Cigarette Lighter",Electronics,https://www.amazon.com/Thermaltake-A2021-Beverage-Cigarette-Lighter/dp/B0002F8WLM/ref=cm_cr_arp_d_product_top?ie=UTF8,2,2
TrackIr 5 Optical Head Tracking System Bundle + Track Clip PRO,Electronics,https://www.amazon.com/dp/B00KQPETHO/ref=pd_aw_sim_e_4?refRID=1XTY51GAP6GJDHDSMGBA,2,2
"EVGA GeForce GTX 1070 Founders Edition, 8GB GDDR5, LED, DX12 OSD Support (PXOC) Graphics Card 08G-P4-6170-KR",Electronics,https://www.amazon.com/dp/B01GLRX81I/ref=twister_B01HRIB0V0?_encoding=UTF8&amp;psc=1,2,2
Ziotek ZT1320380 CPU Security Lock for Desktop Computer Chassis,Electronics,https://www.amazon.com/Ziotek-ZT1320380-Security-Desktop-Computer/dp/B000BSHJKA,2,2
Razer DeathStalker Expert - Backlit Ergonomic Fully Programmable Membrane Black Gaming Keyboard - 10 Key Rollover,Electronics,https://www.amazon.com/Razer-DeathStalker-Expert-Gaming-Keyboard/dp/B009SJR28W,2,2
MSI Computer Graphics Cards N750TI-2GD5TLP,Electronics,https://www.amazon.com/MSI-Computer-Graphics-Cards-N750TI-2GD5TLP/dp/B00SOXMPJY?ie=UTF8&amp;psc=1&amp;redirect=true&amp;ref_=oh_aui_detailpage_o00_s00,2,2
"Dell Alienware Area-51 Gaming Machine (3.8 GHz Intel Core i7-5820K 6-cores Processor, 16GB DDR4 RAM, 2TB SSD, 18TB HDD, Windows 7 Professional)",Electronics,https://www.amazon.com/Alienware-Area-51-Gaming-Machine-Professional/dp/B00QN0Q1G8,2,2
PlayStation 4 500GB Console - Star Wars Battlefront Bundle,Video Games,https://www.amazon.com/gp/product/B01574SORE/ref=s9_ri_bw_g63_i1?pf_rd_m=ATVPDKIKX0DER&amp;pf_rd_s=merchandised-search-4&amp;pf_rd_r=1MP9JEDG9XZX1DMPVAV6&amp;pf_rd_t=101&amp;pf_rd_p=2281716582&amp;pf_rd_i=6427814011,2,2
Maximum Steel Profile Expansion Vented PCI Slot Cover plate - 10 Packs - Black,Electronics,https://www.amazon.com/dp/B015OTRJA0/ref=olp_product_details?_encoding=UTF8&amp;me=,2,2
"Razer BlackWidow Ultimate, Clicky Backlit Mechanical Gaming Keyboard, Fully Programmable - Cherry MX Blue Switches",Electronics,https://www.amazon.com/Razer-BlackWidow-Ultimate-Mechanical-Programmable/dp/B01CVOMWXU/ref=sr_1_22?s=electronics&amp;ie=UTF8&amp;qid=1499480358&amp;sr=1-22&amp;keywords=mechanical+keyboard+cherry+mx,2,2
Samson Go Mic Portable USB Condenser Microphone,Musical Instruments,https://www.amazon.com/Samson-Mic-Portable-Condenser-Microphone/dp/B001R76D42/ref=sr_1_1?ie=UTF8&amp;qid=1479838204&amp;sr=8-1&amp;keywords=samson+go,2,2
"ASUS ROG SWIFT PG258Q 24.5"" Full HD 1ms 240Hz DP HDMI Eye Care G-SYNC eSports Gaming Monitor with DP and HDMI ports",Electronics,https://www.amazon.com/dp/B06WRP3F5S,2,2
MSI GAMING Radeon RX 480 GDDR5 4GB CrossFire VR Ready FinFET DirectX 12 Graphics Card (RX 480 GAMING X 4G),Electronics,https://www.amazon.com/dp/B01KIZUF7Y/,2,2
Samson SR850 Semi-Open-Back Studio Reference Headphones,Musical Instruments,https://www.amazon.com/Samson-SR850-Semi-Open-Back-Reference-Headphones/dp/B002LBSEQS/ref=sr_1_1?ie=UTF8&amp;qid=1488395512&amp;sr=8-1&amp;keywords=Samson+SR850,2,2
"SilverStone Technology Mini-DTX, Mini-ITX Small Form Factor Computer Case SG13WB Black/White",Electronics,https://www.amazon.com/gp/product/B0148P0EKI/ref=oh_aui_detailpage_o03_s00?ie=UTF8&amp;psc=1,2,2
"MSI VR Ready GE62VR Apache Pro-026 15.6"" Powerful Gaming Laptop Geforce GTX 1060 i7-6700HQ 12GB 128GB M.2 SATA + 1TB Windows 10",Electronics,https://www.amazon.com/MSI-GE62VR-Apache-Pro-026-i7-6700HQ/dp/B01IS33QWY/ref=sr_1_3?s=pc&amp;ie=UTF8&amp;qid=1480274572&amp;sr=1-3&amp;keywords=msi+gaming,2,2
Volair Sim Universal Flight or Racing Simulation Cockpit Chassis with Triple Monitor Mounts,Home & Kitchen,https://www.amazon.com/Volair-Sim-Universal-Simulation-Cockpit/dp/B00AGYXUKW,2,2
"Eluktronics P650HP6-G VR Ready 15.6"" 120Hz 5ms Gamers Edition Laptop PC - Intel i7-7700HQ Quad Core Windows 10 Home 6GB GDDR5 NVIDIA GeForce GTX 1060 + G-SYNC 256GB SSD + 1TB HDD 16GB DDR4 RAM",Electronics,https://www.amazon.com/gp/product/B01MS7NSZ8/ref=oh_aui_search_detailpage?ie=UTF8&amp;psc=1,,1
Cherry MX Blue Keyswitch - MX1AE1NN (Tactile Click) - Plate Mounted (5 pack) by himalayanelixir,Electronics,https://www.amazon.com/Cherry-MX-Blue-Keyswitch-himalayanelixir/dp/B01LZ55PXC,,1
Cherry MX Red Keyswitch - MX1AL1NN (Linear) - Plate Mounted (5 pack) by himalayanelixir,Electronics,https://www.amazon.com/Cherry-MX-Red-Keyswitch-himalayanelixir/dp/B01LYHSV6Z,,1
Logitech K400 920-007119 Plus Wireless Touch Keyboard with Keyboard for TV Connected Computer,Electronics,https://www.amazon.com/Logitech-920-007119-Wireless-Keyboard-Connected/dp/B014EUQOGK,,1
"Walker Edison 3-Piece Contemporary Desk, Multi",Home & Kitchen,https://www.amazon.com/dp/B00166DUSG/ref=cm_sw_r_cp_apa_OETVzbE78TJ4W,,1
AULA Mechanical Keyboard Wings of Liberty 104keys Multicolors LED Backlit USB Gaming Keyboard with Blue Switches (Black),Electronics,https://www.amazon.com/AULA-Mechanical-Keyboard-Multicolors-Switches/dp/B01AJ5A6LI/ref=sr_1_1?ie=UTF8&amp;qid=1506443088&amp;sr=8-1&amp;keywords=aula+wings+of+liberty+mechanical+keyboard,,1
Super Smash Bros. GameCube Adapter for Wii U,Video Games,https://www.amazon.com/gp/product/B00L3LQ1FI,,1
"Passion Lubes Passion Water and Silicone Blend Hybrid Lubricant, 55 Gallon","Health, Household & Baby Care",https://www.amazon.com/gp/product/B00SZ3O6OU,21,1
"Haribo Original Gold-Bears Gummi Candy, 5-Pound Bag of Delicious Bears!  Ships to You  in Either Clear Packaging or the New Gold Updated Packaging.  The Same Delicious Gummi Bears in Either Packaging!",Grocery & Gourmet Food,https://www.amazon.com/Haribo-Gold-Bears-Gummi-Candy-5-Pound/dp/B000EVOSE4,20,1
"Raspberry PI 3 Model B 1.2GHz 64-bit quad-core ARMv8 CPU, 1GB RAM",Electronics,https://www.amazon.com/Raspberry-Pi-RASP-PI-3-Model-Motherboard/dp/B01CD5VC92,19,1
Samsung 850 EVO 500GB 2.5-Inch SATA III Internal SSD (MZ-75E500B/AM),Electronics,https://www.amazon.com/Samsung-2-5-Inch-Internal-MZ-75E500B-AM/dp/B00OBRE5UE,18,1
Logitech 963290-0403 Extreme 3D Pro Joystick for Windows,Electronics,https://www.amazon.com/Logitech-963290-0403-Extreme-Joystick-Windows/dp/B00009OY9U,16,1
"Infant Circumcision Trainer, White",All Departments,https://www.amazon.com/Nasco-Infant-Circumcision-Trainer-White/dp/B0083Y0W26/ref=pd_sim_sbs_121_2?ie=UTF8&amp;psc=1&amp;refRID=PYSTCSY73HZ5VJBA0JYT,16,1
PlayStation 4 Slim 500GB Console - Uncharted 4 Bundle,Video Games,https://www.amazon.com/PlayStation-Slim-500GB-Console-Uncharted-Bundle/dp/B01LRLJV28/,12,1
"Logitech Wireless Touch Keyboard K400 with Built-In Multi-Touch Touchpad, Black",Electronics,https://www.amazon.com/Logitech-Wireless-Keyboard-Multi-Touch-Touchpad/dp/B005DKZTMG/ref=sr_1_1?ie=UTF8&amp;qid=1434209781&amp;sr=8-1&amp;keywords=k400,12,1
Xbox Wireless Controller - White,Video Games,https://www.amazon.com/Xbox-Wireless-Controller-White/dp/B01GW3H3U8/ref=redir_mobile_desktop?_encoding=UTF8&amp%3BdpID=41f17cph6KL&amp%3BdpPl=1&amp%3Bkeywords=xbox%20wireless%20controller&amp%3Bpi=SX200_QL40&amp%3Bqid=1471666424&amp%3Bref=plSrch&amp%3Bsr=8-1&ref_=mp_s_a_1_1,12,1
Mayflash Wireless Wii U Pro Controller to PC USB Adapter,Electronics,https://www.amazon.com/Mayflash-Wireless-Wii-Controller-Adapter/dp/B00E6553PW/ref=sr_1_1?ie=UTF8&amp;qid=1445055405&amp;sr=8-1&amp;keywords=wii+u+pro+controller+pc,12,1
CM Storm QuickFire Rapid - Tenkeyless Mechanical Gaming Keyboard with Cherry MX Blue Switches,Electronics,https://www.amazon.com/gp/product/B0068INSUM?psc=1&amp;redirect=true&amp;ref_=oh_aui_detailpage_o04_s00,11,1
Kershaw 1660 Ken Onion Leek,Sports & Outdoors,https://www.amazon.com/Kershaw-1660-Onion-Folding-SpeedSafe/dp/B0009VC9Y0/ref=sr_1_1?ie=UTF8&amp;qid=1421540985&amp;sr=8-1&amp;keywords=kershaw+leek&amp;pebp=1421540990240&amp;peasin=B0009VC9Y0,11,1
Wallmonkeys Senior Woman with Asthma Inhaler Peel and Stick Wall Decals WM335116 (24 in H x 21 in W),Home & Kitchen,https://www.amazon.com/Wallmonkeys-WM335116-Inhaler-Wall-Decals/dp/B0150BAJYA/ref=pd_sim_sbs_236_2?ie=UTF8&amp;psc=1&amp;refRID=MPG0JBGXMQW2TBCHQ8XA,10,1
Redragon M901 PERDITION 16400 DPI High-Precision Programmable Laser Gaming Mouse (Black),Electronics,https://www.amazon.com/Redragon-PERDITION-High-Precision-Programmable-Gaming-PC/dp/B00GU8W5AE/ref=sr_1_1?ie=UTF8&amp;qid=1470570318&amp;sr=8-1&amp;keywords=redragon+perdition,10,1
"Logitech G502 Proteus Core Tunable Gaming Mouse, 12,000 DPI On-The-Fly DPI Shifting, Personalized Weight and Balance Tuning with (5) 3.6g Weights, 11 Programmable Buttons, Fully Customizable Surface",Electronics,https://www.amazon.com/Logitech-Proteus-Tunable-Customizable-910-004074/dp/B00IRHE892/,10,1
"TP-Link AV200 Nano Powerline Adapter Starter Kit, up to 200Mbps (TL-PA2010KIT)",Electronics,https://www.amazon.com/TP-LINK-TL-PA2010KIT-Powerline-Adapter-Starter/dp/B00AWRUIY4/ref=sr_1_2?s=pc&amp;ie=UTF8&amp;qid=1433603814&amp;sr=1-2&amp;keywords=powerline+adapter,10,1
"Squatty Potty The Original Bathroom Toilet Stool, White, 9""","Health, Household & Baby Care",https://www.amazon.com/Squatty-Potty-Original-Bathroom-Toilet/dp/B007BISCT0?ie=UTF8&amp;*Version*=1&amp;*entries*=0,9,1
"StarTech USB 3.0 to 2.5"" SATA III Hard Drive Adapter Cable w/ UASP - SATA to USB 3.0 Converter for SSD/HDD",Electronics,https://www.amazon.com/StarTech-SATA-Drive-Adapter-Cable/dp/B00HJZJI84?sa-no-redirect=1,9,1
WD 4TB My Book Desktop External Hard Drive - USB 3.0 - WDBFJK0040HBK-NESN,Electronics,https://www.amazon.com/gp/product/B00E3RH61W?psc=1&amp;redirect=true,9,1
Mechanical Keyboard Gaming Keyboard Brown Switch 68-Keys Mini Design (60%) Gaming Wired Keyboard White Silver Magicforce by Qisan,Electronics,https://www.amazon.com/Mechanical-Keyboard-68-Keys-Magicforce-Qisan/dp/B01E8KO2B0/ref=sr_1_5?ie=UTF8&amp;qid=1494265632&amp;sr=8-5&amp;keywords=brown+switches,9,1
