name,category,amazon_link,total_mentions,subreddit_mentions
Muscletown USA: Bob Hoffman and the Manly Culture of York Barbell,Book,http://www.amazon.com/dp/0271018550/,1,1
Fire Underground: The Ongoing Tragedy Of The Centralia Mine Fire,Book,http://www.amazon.com/dp/0762754273/,1,1
Flatlanders and Ridgerunners: Folktales from the Mountains of Northern Pennsylvania,Book,http://www.amazon.com/dp/0822953455/,1,1
Mountain folks: Fragments of central Pennsylvania lore,Book,http://www.amazon.com/dp/0915258021/,1,1
Weird Pennsylvania: Your Travel Guide to Pennsylvania's Local Legends and Best Kept Secrets,Book,http://www.amazon.com/dp/1402766866/,1,1
"Morakniv Companion Fixed Blade Outdoor Knife with Carbon Steel Blade, 4.1-Inch, Military Green",Sports,http://www.amazon.com/dp/B004TNWD40/,62,1
