name,category,amazon_link,total_mentions,subreddit_mentions
PetSafe SSSCAT Spray Deterrent,Pet Products,http://www.amazon.com/dp/B000RIA95G/,89,26
"Bergan Turbo Scratcher Cat Toy, Colors may vary",Pet Products,http://www.amazon.com/dp/B000IYSAIW/,44,18
"GoCat Da Bird Pull Apart Rod and Bird Cat Feather Toys, Assorted Colors",Pet Products,http://www.amazon.com/dp/B000F9JJJE/,30,8
"Ceva Feliway Plug-In Diffuser with Refill, 48 mL",Pet Products,http://www.amazon.com/dp/B000WHUOEI/,20,7
SmartCat Ultimate Scratching Post,Pet Products,http://www.amazon.com/dp/B000634MH8/,32,6
"Catit Design Senses Fountain with Water Softening Cartridge, 3L",Pet Products,http://www.amazon.com/dp/B00CO527IC/,12,5
Successful Dog Adoption,Book,http://www.amazon.com/dp/0764538934/,5,5
"PetSafe SlimCat Meal Dispensing Cat Toy, Blue",Pet Products,http://www.amazon.com/dp/B0018CG40O/,34,5
"Precious Cat Ultra Litter Attractant, 20 Ounces",Pet Products,http://www.amazon.com/dp/B000PKUUU0/,6,5
"PetSafe Drinkwell Platinum Dog and Cat Water Fountain, 168 oz.",Pet Products,http://www.amazon.com/dp/B000L3XYZ4/,43,5
Catit Flower Fountain: 3L Drinking Fountain with Triple-Action Filter,Pet Products,http://www.amazon.com/dp/B0146QXOB0/,21,5
Aspen Pet Lebistro Programmable Food Dispenser- 18 Cup,Pet Products,http://www.amazon.com/dp/B0016BVY2U/,13,4
"Pioneer Pet Tiger Diner Ceramic Food Dish/Bowl, Black",Pet Products,http://www.amazon.com/dp/B007DOS9C2/,10,4
Snuggle Safe Pet Bed Microwave Heating Pad,Pet Products,http://www.amazon.com/dp/B00008AJH9/,15,4
Think Like a Cat: How to Raise a Well-Adjusted Cat--Not a Sour Puss,Book,http://www.amazon.com/dp/0143119796/,11,4
"Pioneer Pet Sticky Paws on a Roll Cat Deterrent, White, 10m Per Roll",Pet Products,http://www.amazon.com/dp/B007I08FI4/,5,4
"Pioneer Pet Stainless Steel  Fountain Raindrop Design , 60oz",Pet Products,http://www.amazon.com/dp/B0037NKDSG/,24,4
"Armarkat Pet Steps, 4-steps, B4001, Ivory",Pet Products,http://www.amazon.com/dp/B003BYQ0ZG/,4,4
Catit Design Senses Food Maze,Pet Products,http://www.amazon.com/dp/B004G9L1H2/,7,4
Clevercat Top Entry Litterbox,Pet Products,http://www.amazon.com/dp/B0002ZS20I/,20,3
"Behavior Problems of the Dog and Cat, 3e",Book,http://www.amazon.com/dp/0702043354/,14,3
Drinkwell Ceramic Avalon Fountain for Pets,Pet Products,http://www.amazon.com/dp/B00BD3TO82/,5,3
"Soft Claws for Cats - CLS (Cleat Lock System), Size Medium, Color Pink",Pet Products,http://www.amazon.com/dp/B00074W458/,10,3
"Litter Genie Plus Cat Litter Disposal System with Odor Free Pail System, White",Pet Products,http://www.amazon.com/dp/B007IHY5CM/,5,3
"Pioneer Pet Tiger Diner Ceramic Food Dish/Bowl, White",Pet Products,http://www.amazon.com/dp/B007P5XUNW/,6,3
"PetSafe 5-Meal Automatic Dog and Cat Feeder, Dispenses Dog Food or Cat Food, Digital Clock",Pet Products,http://www.amazon.com/dp/B000GEWHNS/,14,3
Guinea Habitat Plus Guinea Habitat Plus,Pet Products,http://www.amazon.com/dp/B001NJ0DQ8/,11,3
"Catit Design Senses Play Circuit, Original",Pet Products,http://www.amazon.com/dp/B001LWRFW2/,15,3
"PetSafe Drinkwell Stainless Steel Multi-Pet Dog and Cat Water Fountain, 128 oz., Great for Multiple Pets",Pet Products,http://www.amazon.com/dp/B000FGIUV0/,5,3
"GoCat Da Bird Rod and Feather Cat Toys, Assorted Colors",Pet Products,http://www.amazon.com/dp/B001BOVEU4/,5,3
"iTouchless EZ Faucet PRO Automatic Sensor Faucet Adapter for Any Sink Faucet and Cat Fountain, Pet Water Dispenser",Home Improvement,http://www.amazon.com/dp/B000EJXR0M/,2,2
"Comfort Zone Feliway Spray, 75 mL, For Cat Calming",Pet Products,http://www.amazon.com/dp/B003E71E24/,8,2
Contech StayAway Motion-Activated Pet Deterrent,Pet Products,http://www.amazon.com/dp/B000DZFFN4/,3,2
Cat Dancer 301 Cat Charmer Interactive Cat Toy,Pet Products,http://www.amazon.com/dp/B0002DHV16/,14,2
Go Cat Cat Catcher Teaser Wand with Mouse Cat Toy,Pet Products,http://www.amazon.com/dp/B000LPOUNW/,12,2
"Sterilite 17571706 66 Quart/62 Liter ClearView Latch Box, Clear Lid & Base w/ Sweet Plum Latches, 6-Pack",Home,http://www.amazon.com/dp/B003EH1GH2/,3,2
"Soggy Doggy 36-Inch by 60-Inch Microfiber Chenille Doormat for Wet Dog Paws, Brown, Extra Large",Pet Products,http://www.amazon.com/dp/B008LD0UEY/,2,2
Qpets 6-Meal Automatic Pet Feeder,Pet Products,http://www.amazon.com/dp/B005POODL8/,12,2
KONG Classic Large,Pet Products,http://www.amazon.com/dp/B0002AR0I8/,30,2
"Petnet SmartFeeder, Automatic Pet Feeder for Cats and Dogs, Works with Amazon Alexa",Boost,http://www.amazon.com/dp/B010QYTN2K/,4,2
K&H Manufacturing Deluxe Kitty Sill With Bolster Tan Kitty Print 14-Inch by 24-Inch,Pet Products,http://www.amazon.com/dp/B000795XMY/,2,2
"Precious Cat Cat Attract Problem Cat Training Litter, 40 pound bag, Package may vary",Pet Products,http://www.amazon.com/dp/B000PKY7YA/,5,2
Midwest Homes Guinea Habitat (No Top Panel),Pet Products,http://www.amazon.com/dp/B01969JXZ8/,2,2
Vet's Best Comfort-Fit Disposable Female Diapers Small 288ct (24x12ct),Health and Beauty,http://www.amazon.com/dp/B00GT40QY6/,2,2
Nature's Miracle High-Sided Litter Box (P-82035),Pet Products,http://www.amazon.com/dp/B0087Y5NKS/,9,2
"Feed and Go Smart Pet Feeder 2018 Model Now With iOS/Android Apps. Built In Webcam. For Wet/Dry Food, Treats & Meds.",Boost,http://www.amazon.com/dp/B00UNQZ2QI/,3,2
Goughnuts - Indestructible Chew Toy MAXX 50 - Black Ring,Pet Products,http://www.amazon.com/dp/B00K5Y497G/,2,2
K&H Manufacturing Thermo-Kitty Mat Mocha 12.5-Inch by 25-Inch 6 Watts,Pet Products,http://www.amazon.com/dp/B000S9M2U4/,7,2
Cat Dancer 101 Cat Dancer Interactive Cat Toy,Pet Products,http://www.amazon.com/dp/B0006N9I68/,14,2
"Meow Town MDF Litter Box Cat Cabinet, Mahogany",Pet Products,http://www.amazon.com/dp/B005N0M5YG/,2,2
Professional Strength Stain & Odor Eliminator - Enzyme-Powered Pet Odor & Stain Remover for Dogs and Cat Urine - Spot Carpet Cleaner - Small Animal Odor Remover (32 oz),Pet Products,http://www.amazon.com/dp/B00CKFL93K/,13,2
"Precious Cat Ultra Premium Clumping Cat Litter, 40 pound bag",Pet Products,http://www.amazon.com/dp/B0009X29WK/,31,2
"Petmate Two Door Top Load 24-Inch Pet Kennel, Metallic Pearl Ash Blue and Coffee Ground Bottom",Pet Products,http://www.amazon.com/dp/B0062JFGM0/,9,2
Oster Sunny Seat Window-Mounted Cat Bed 50 lbs,Pet Products,http://www.amazon.com/dp/B005AUM8U0/,21,2
"PetSafe Drinkwell Original Dog and Cat Water Fountain, 50 oz.",Pet Products,http://www.amazon.com/dp/B00063446M/,29,2
"PetSafe ScatMat Indoor Pet Training Mat for Dogs and Cats , Large, 48 X 20 inch, Pet Proof Your Home, Electronic Training Mat",Pet Products,http://www.amazon.com/dp/B0007NTBJ6/,11,2
Think Like a Cat: How to Raise a Well-Adjusted Cat--Not a Sour Puss,eBooks,http://www.amazon.com/dp/B005ERIIRQ/,5,2
"Allerpet Cat Dander Remover, 12 oz",Pet Products,http://www.amazon.com/dp/B000S0L0M4/,12,2
"Nature's Miracle Just for Cats Urine Destroyer Intense Urine Stain & Odor Remover, 32-Ounce Pour Bottle (P-5721)",Pet Products,http://www.amazon.com/dp/B003I5QRJ2/,6,2
"Armarkat B5701 57-Inch Cat Tree, Ivory",Pet Products,http://www.amazon.com/dp/B003BYQ100/,4,2
ComPETability: Solving Behavior Problems In Your Cat-Dog Household,eBooks,http://www.amazon.com/dp/B00472O7DI/,4,2
ABO Gear Happy Habitat for Indoor Cats,Pet Products,http://www.amazon.com/dp/B002KWHE1E/,10,2
"KONG Wobbler Treat Dispensing Dog Toy, Large",Pet Products,http://www.amazon.com/dp/B003ALMW0M/,41,2
"SENTRY Calming Collar for Cats, 1 Count",Pet Products,http://www.amazon.com/dp/B0026JAKWG/,5,2
CET Toothbrush for Cats,Pet Products,http://www.amazon.com/dp/B000FUOD5I/,2,2
Cat Craft 124003 3-Tier Cat Climbing Tree,Pet Products,http://www.amazon.com/dp/B001F0RPSO/,3,2
"THORNELL Cat-Odor-Off Concentrate, 16-Ounce",Pet Products,http://www.amazon.com/dp/B0002XJ11E/,2,2
"StarMark Bob-A-Lot Interactive Pet Toy, Large",Pet Products,http://www.amazon.com/dp/B001JQLNB4/,36,2
PetSafe Bolt Interactive Laser Cat Toy,Pet Products,http://www.amazon.com/dp/B0021L8W6K/,5,2
"Prolabs Feline Tapeworm Tabs , 3-23mg Tabs",Pet Products,http://www.amazon.com/dp/B004KPLX2K/,4,2
The Original Scratch Lounge - Worlds Best Cat Scratcher - Includes Catnip,Pet Products,http://www.amazon.com/dp/B000EIHQU0/,2,1
"Jolly Pets 8-Inch Romp-n-Roll, Red",Pet Products,http://www.amazon.com/dp/B0002DK9OW/,5,1
Cord Protector - CritterCord - A New Way to Protect Your Pet from Chewing Hazardous Cords,Pet Products,http://www.amazon.com/dp/B000EH2I5O/,4,1
"Kaytee Aspen Bedding, 8.0 Cubic Foot Bag",Pet Products,http://www.amazon.com/dp/B0002DK8PW/,1,1
Wellington Puritan 10334 Twisted Cotton Cable Cord,Home Improvement,http://www.amazon.com/dp/B00004Z1TL/,1,1
Gates 90330 Static Strap,Automotive Parts and Accessories,http://www.amazon.com/dp/B000CRBR8U/,1,1
Petstages Cheese Chase,Pet Products,http://www.amazon.com/dp/B000CCW1OE/,1,1
"Yeowww! Catnip Toy, Yellow Banana",Pet Products,http://www.amazon.com/dp/B000AUJFHE/,5,1
"PetSafe Easy Walk Harness,  Large, BLACK/SILVER for Dogs",Pet Products,http://www.amazon.com/dp/B0009ZBKG4/,26,1
"Booda Dome Cleanstep Cat Box, Titanium",Pet Products,http://www.amazon.com/dp/B0002DH8L4/,4,1
The Fastidious Feline: How to Prevent and Treat Litter Box Problems,Book,http://www.amazon.com/dp/1891767046/,1,1
Dental Health Pair Catnip Cat Toys by Petstages,Pet Products,http://www.amazon.com/dp/B0009YF3KY/,1,1
"Precious Cat Cat Attract Problem Cat Training Litter, 20 pound box",Pet Products,http://www.amazon.com/dp/B0009X49IC/,6,1
FAT CAT Crazy Circle Interactive Cat Toy,Pet Products,http://www.amazon.com/dp/B0002AT5AO/,38,1
K&H Manufacturing Cool Bed III Large Gray32-Inch by 44-Inch,Pet Products,http://www.amazon.com/dp/B0009EUZWA/,7,1
Nature's Miracle Stain and Odor Remover,Pet Products,http://www.amazon.com/dp/B0002ASLMC/,1,1
Getting Started: Clicker Training for Birds,Book,http://www.amazon.com/dp/1890948152/,24,1
"Ideal Pet Products Aluminum Sash Window Pet Door,  Adjustable Width 33"" to 38"", Cat Flap, 6.25"" x 6.25"" Flap Size, White",Pet Products,http://www.amazon.com/dp/B000TRBXG4/,1,1
Performix 11207 Plasti Dip White Multi-Purpose Rubber Coating Aerosol - 11 oz.,Home Improvement,http://www.amazon.com/dp/B000981AA2/,2,1
Groomers Goop for Oily Coats 28 oz. Can,Pet Products,http://www.amazon.com/dp/B0007CZ696/,1,1
"Ultra Pet Little Pearls Litter Scoop, 1 Count Scoop",Grocery,http://www.amazon.com/dp/B0002AQQNS/,1,1
The Midnight Dog Walkers: Positive Training and Practical Advice for Living With Reactive and Aggressive Dogs,Book,http://www.amazon.com/dp/1621871169/,1,1
The Tenth Good Thing About Barney,Book,http://www.amazon.com/dp/0689712030/,9,1
NurtureShock: New Thinking About Children,Book,http://www.amazon.com/dp/0446504130/,3,1
Vittles Vault Outback 25 lb Airtight Pet Food Storage Container,Pet Products,http://www.amazon.com/dp/B000QSMWRK/,4,1
"Prevue Hendryx 485 Pet Products Feisty Ferret Home with Stand, Black Hammertone",Pet Products,http://www.amazon.com/dp/B000QFMYWQ/,8,1
"Safco Products 5279BL Wire Storage Cube Set, Black",Office Product,http://www.amazon.com/dp/B000789RSQ/,4,1
"Joybies Navy Blue Piddle Pants(tm) for Small Cat (Measuring 13""-15"" Along Back from Collar to Base of Tail)",Pet Products,http://www.amazon.com/dp/B000SE7AZG/,2,1
"Zoo Med Deluxe Porcelain Clamp Lamp with 5.5-Inch Dome, Black",Pet Products,http://www.amazon.com/dp/B0002AQCX2/,2,1
Precious Cat Kitten Attract Kitten Training Litter,Pet Products,http://www.amazon.com/dp/B000PKSW5A/,1,1
