name,category,amazon_link,total_mentions,subreddit_mentions
History of the Philippines: From Indios Bravos to Filipinos,Book,http://www.amazon.com/dp/1468308572/,5,4
Diary of a Dictator -- Ferdinand & Imelda: The Last Days of Camelot,eBooks,http://www.amazon.com/dp/B00BT009ME/,3,3
America's Boy: A Century of United States Colonialism in the Philippines,Book,http://www.amazon.com/dp/0805061185/,3,3
Pacific Rims: Beermen Ballin' in Flip-Flops and the Philippines' Unlikely Love Affair with Basketball,Book,http://www.amazon.com/dp/0451233220/,9,3
Thirty Years Later . . .: Catching Up with the Marcos-Era Crimes,Book,http://www.amazon.com/dp/0578175606/,3,3
Sakdalistas' Struggle for Philippine Independence 1930-1945,Book,http://www.amazon.com/dp/9715506798/,4,3
Muslims in the Philippines,Book,http://www.amazon.com/dp/9715421881/,3,3
"ZVE Apple iPhone SE/5S/5 Case Built-in Cigarette Lighter/Bottle Opener, Heavy Duty, Black",Wireless,http://www.amazon.com/dp/B00KNUILKS/,5,2
State and Society in the Philippines (State & Society in East Asia),Book,http://www.amazon.com/dp/0742510247/,2,2
Show and Episode Tracker,Mobile Application,http://www.amazon.com/dp/B01HMMBTM6/,2,2
So You've Been Publicly Shamed,Book,http://www.amazon.com/dp/1594487138/,25,2
How to Win Friends & Influence People,Book,http://www.amazon.com/dp/0671027034/,222,1
Democracy for Realists: Why Elections Do Not Produce Responsive Government (Princeton Studies in Political Behavior),Book,http://www.amazon.com/dp/0691169446/,4,1
The World's Most Evil Men (World's Greatest),Book,http://www.amazon.com/dp/0753706962/,1,1
"Writer's Guide to Book Editors, Publishers, and Literary Agents, 13th Edition (with CD-ROM): Who They Are! What They Want! And How to Win Them Over!",Book,http://www.amazon.com/dp/0761537457/,1,1
Filipino Tattoos Ancient to Modern,Book,http://www.amazon.com/dp/0764336029/,1,1
Tagalog-English/English-Tagalog Standard Dictionary (Hippocrene Standard Dictionaries),Book,http://www.amazon.com/dp/0781809606/,4,1
"Invented Eden: The Elusive, Disputed History of the Tasaday",Book,http://www.amazon.com/dp/0803273630/,1,1
On Tyranny: Twenty Lessons from the Twentieth Century,Book,http://www.amazon.com/dp/0804190119/,22,1
Behind Japanese Lines: An American Guerrilla in the Philippines,Book,http://www.amazon.com/dp/0813109868/,1,1
Customs Modernization Handbook (Trade and Development),Book,http://www.amazon.com/dp/0821357514/,1,1
Intermediate Tagalog: Developing Cultural Awareness through Language,Book,http://www.amazon.com/dp/0824807766/,1,1
Conversational Tagalog: A Functional-Situational Approach (PALI Language Texts),Book,http://www.amazon.com/dp/0824809440/,1,1
Reframing Paul: Conversations in Grace & Community,Book,http://www.amazon.com/dp/0830815708/,2,1
The Quarter-Life Breakthrough,Book,http://www.amazon.com/dp/0991404408/,2,1
The Lemonade Stand: What every entrepreneur should know to succeed in starting and running any business.,Book,http://www.amazon.com/dp/1469906562/,1,1
Moving Walls,Book,http://www.amazon.com/dp/1517258634/,1,1
The Conjugal Dictatorship of Ferdinand and Imelda Marcos,Book,http://www.amazon.com/dp/1523292199/,1,1
A Handbook Of Cebuano Visayan,Book,http://www.amazon.com/dp/1533379270/,1,1
Why Men Love Bitches: From Doormat to Dreamgirl―A Woman's Guide to Holding Her Own in a Relationship,Book,http://www.amazon.com/dp/1580627560/,11,1
The Germ of Laziness: Rockefeller Philanthropy and Public Health in the New South,Book,http://www.amazon.com/dp/1583485279/,1,1
The Wealth of Nations,Book,http://www.amazon.com/dp/1604598913/,3,1
"The Moro War: How America Battled a Muslim Insurgency in the Philippine Jungle, 1902-1913",Book,http://www.amazon.com/dp/1608190242/,1,1
West of Guam: The Complete Cases of Jo Gar,Book,http://www.amazon.com/dp/1618271180/,1,1
Under Three Flags: Anarchism and the Anti-Colonial Imagination,Book,http://www.amazon.com/dp/1844670902/,1,1
Gold Warriors: America's Secret Recovery of Yamashita's Gold,Book,http://www.amazon.com/dp/1844675319/,12,1
The Algorithm Design Manual,Book,http://www.amazon.com/dp/1848000693/,39,1
Galing Galing Philippine Cuisine: Food as Prepared in Philippine Homes,Book,http://www.amazon.com/dp/9710824740/,1,1
"A history of the inarticulate: Local history, prostitution, and other views from the bottom",Book,http://www.amazon.com/dp/9711010690/,1,1
"Terengati (Language Tagalog) (In English ""The mountain lad who married a skymaiden"")",Book,http://www.amazon.com/dp/9711211742/,1,1
U.G. An Underground Tale; The Journey Of Edgar Jopson And The First Quarter Storm Generation,Book,http://www.amazon.com/dp/9712717720/,1,1
Mondo Marcos (writings on Martial Law and the Marcos babies),Book,http://www.amazon.com/dp/9712724697/,1,1
May Mga Lihim Kami Ni Ingkong/Secrets with Lolo (Philippine Import),Book,http://www.amazon.com/dp/9715116965/,1,1
Barangay: Sixteenth-Century Phiippine Culture and Society,Book,http://www.amazon.com/dp/9715501354/,1,1
"Edifice Complex: Power, Myth And Marcos State Architecture",Book,http://www.amazon.com/dp/9715504353/,1,1
"A Nation Aborted: Rizal, American Hegemony, and Philippine Nationalism",Book,http://www.amazon.com/dp/9715505740/,1,1
History of the Filipino People (Eighth Edition) - Philippine Book,Book,http://www.amazon.com/dp/9718711066/,1,1
Greed & Betrayal: The Sequel to the 1986 EDSA Revolution,Book,http://www.amazon.com/dp/971910371X/,1,1
The Conjugal Dictatorship of Ferdinand and Imelda Marcos I,Book,http://www.amazon.com/dp/B0000EE86T/,1,1
"Roland JC-120 - 120W 2x12"" Guitar Combo Amp",Musical Instruments,http://www.amazon.com/dp/B0002CZQFA/,1,1
GustBuster Metro 43-Inch Automatic Umbrella,Sports,http://www.amazon.com/dp/B000AMXQVI/,3,1
"Sperry Top-Sider Men's A/O 2 Eye Boat Shoe,Sahara,10 M US",Shoes,http://www.amazon.com/dp/B000EPC4XW/,1,1
Happy Hacking Keyboard Professional2 (White),Personal Computer,http://www.amazon.com/dp/B000EXZ0V2/,10,1
Ron Jeremy: The Hardest (Working) Man in Showbiz,eBooks,http://www.amazon.com/dp/B000OI0E5Y/,1,1
Carson 60X-75X MicroMax LED Lighted Pocket Microscope (MM-200),Photography,http://www.amazon.com/dp/B000P8AUMU/,9,1
Pride & Prejudice (Deluxe 2-Disc DVD Gift Set),DVD,http://www.amazon.com/dp/B000VBP382/,1,1
"Fiber One Cereal, Honey Clusters, Whole Grain Cereal 14.25 Oz",Pantry,http://www.amazon.com/dp/B000VDZ04M/,1,1
"Intex Challenger 2, 2-Person Inflatable Boat Set with French Oars and High Output Air Pump (Latest Model)",Sports,http://www.amazon.com/dp/B000Y22BBA/,1,1
"American Metalcraft (IC80) 8-1/2"" Ice Pick",Kitchen,http://www.amazon.com/dp/B00125NJ64/,1,1
Chessex Role Playing Play Mat: Battlemat Double-Sided Reversible Mat for RPGs and Miniature Figure Games (26 in x 23 1/2 in) Squares/Hexes,Toy,http://www.amazon.com/dp/B0015IQO2O/,94,1
"Intex Seahawk 4, 4-Person Inflatable Boat Set with Aluminum Oars and High Output Air Pump (Latest Model)",Sports,http://www.amazon.com/dp/B00177BQC6/,2,1
AKG K450 Premium Foldable Headphone Navy,Speakers,http://www.amazon.com/dp/B0028N78C0/,1,1
Stanley 51-112 7 Ounce Fiberglass Hammer,Home Improvement,http://www.amazon.com/dp/B002BYJCRU/,2,1
"REESE'S Dark Chocolate Peanut Butter Cups, 1.5 Ounce (Pack of 24)",Grocery,http://www.amazon.com/dp/B002EDDA2Q/,1,1
Bulova Men's 97B100 Gold-Tone Stainless Steel Watch With Brown Leather Band,Watch,http://www.amazon.com/dp/B002LUEI9Q/,2,1
XXXopoly - Adult Board Games by 3DP Fusion,Toy,http://www.amazon.com/dp/B0035R26A2/,2,1
TP-Link N150 Wireless PCI-Express Adapter (TL-WN781ND),CE,http://www.amazon.com/dp/B0036AFAEW/,12,1
Pacific Rims: Beermen Ballin' in Flip-Flops and the Philippines' Unlikely Love Affair with Basketball,eBooks,http://www.amazon.com/dp/B003NX7NG0/,1,1
HAYES - HAYES 5901US ACCURA 28800 V.34 + FAX,PC Accessory,http://www.amazon.com/dp/B004571TEA/,1,1
"The Philippine Islands, 1493-1803 — Volume 01 of 55 1493-1529 Explorations by Early Navigators, Descriptions of the Islands and Their Peoples, Their History ... to the Beginning of the Nineteenth Century",eBooks,http://www.amazon.com/dp/B004TQGRNA/,1,1
"Delsey Luggage Helium Colours Lightweight Carry On Hardside 4 Wheel Spinner, Black, 21 Inch",Apparel,http://www.amazon.com/dp/B004VOFP4W/,1,1
Machete Maidens Unleashed,DVD,http://www.amazon.com/dp/B004XZ99W8/,1,1
"Secret Wishes Batman Arkham City  Adult Harley Quinn Costume, Multi-Colored, Small",Apparel,http://www.amazon.com/dp/B0073E55TW/,1,1
"Watch them wiggle eyes, Black(500 PIECES) - BULK",Toy,http://www.amazon.com/dp/B0074MHV7W/,7,1
"Cafe Du Monde Beignet Mix, 28 oz Box",Grocery,http://www.amazon.com/dp/B007NJT9ZS/,2,1
Antec Bias Lighting for HDTV with 51.1-Inch Cable (Reduce eye fatigue and increase image clarity),Personal Computer,http://www.amazon.com/dp/B007TG5EG8/,12,1
"Brondell GoSpa Travel Bidet GS-70 Easy-to-use Portable Bidet with Convenient Nozzle Storage, Travel Bag, 400 ml Capacity, and Angled Nozzle Spray",Home Improvement,http://www.amazon.com/dp/B008CSDKSQ/,16,1
ArgenMesh Conductive/Shielding Silver Fabric,Art and Craft Supply,http://www.amazon.com/dp/B008DXBFYQ/,3,1
[OLD MODEL] Focusrite Scarlett 2i4 USB Audio Interface,Musical Instruments,http://www.amazon.com/dp/B009B15N0Q/,11,1
Nayoya Gymnastic Rings for Full Body Strength and Muscular Bodyweight Training,Sports,http://www.amazon.com/dp/B009RA6C1K/,24,1
"Juan Ponce Enrile, A Memoir",eBooks,http://www.amazon.com/dp/B009VJ36MU/,1,1
Boxed Shirt Sleeve Holders / Arm Bands in Silver & Gold (Silver),Apparel,http://www.amazon.com/dp/B00BFX4MMS/,1,1
AOC e1659Fwu 16-Inch Ultra Slim 1366x768 Res 200 cd/m2 Brightness USB 3.0-Powered Portable LED Monitor w/ Case,Personal Computer,http://www.amazon.com/dp/B00CMKOVMO/,27,1
Not On Our Watch: Martial Law Really Happened. We Were There.,eBooks,http://www.amazon.com/dp/B00D6NCK4M/,1,1
Palm Corned Beef - Premium Quality from New Zealand - 4 x 11.5 oz (326 g),Grocery,http://www.amazon.com/dp/B00EFMW4VW/,1,1
JBL LSR305 Professional Studio Monitor (PACK OF 2),Musical Instruments,http://www.amazon.com/dp/B00F1DEI8G/,68,1
"Microsoft Universal Mobile Keyboard for iPad, iPhone, Android devices, and Windows tablets - Black",Personal Computer,http://www.amazon.com/dp/B00GWGLUZ0/,16,1
MILLIARD Borax Powder - Pure Multi-Purpose Cleaner 5 lb. Bag,Health and Beauty,http://www.amazon.com/dp/B00HLROBQ4/,1,1
The Hundred-Year Marathon: China's Secret Strategy to Replace America as the Global Superpower,eBooks,http://www.amazon.com/dp/B00IWUI7B4/,2,1
"Qi-Infinity™ Powergrid 34200mAh External Battery Pack/ High Capacity Power Bank charger for Laptops, Surface Pro 4/3/2, Surface book, Tablets and Smart Phones",Wireless,http://www.amazon.com/dp/B00JQKUCHQ/,10,1
Phanteks Enthoo Pro Full Tower Chassis with Window Cases PH-ES614P_BK,Personal Computer,http://www.amazon.com/dp/B00K6S1B3Q/,15,1
Nike Kaishi,Shoes,http://www.amazon.com/dp/B00LV8WMV0/,1,1
"Never Have I Ever, The Game of Poor Life Decisions [A Party Card Game]",Toy,http://www.amazon.com/dp/B00N36C6BE/,4,1
Crossy Road,Mobile Application,http://www.amazon.com/dp/B00QW8TYWO/,1,1
"Black Box G1W-X Dashboard Dash Cam - Ultra Wide 170° 4X Zoom 6G Glass Lens - Full HD 1080P 2.7"" LCD Car DVR Camera Video Recorder with Parking Mode G-Sensor WDR Night Vision Motion Detection",Car Audio or Theater,http://www.amazon.com/dp/B00SX88JIQ/,10,1
"Acer Aspire E5-573G 15.6-Inch Gaming Laptop (Intel Core i5-5200U, 8 GB RAM, 1 TB Hard Drive, Windows 10 Home), Black",Personal Computer,http://www.amazon.com/dp/B012IBOCRU/,37,1
U.G. An Underground Tale: The Journey of Edgar Jopson and the First Quarter Storm Generation,eBooks,http://www.amazon.com/dp/B013PD50BM/,1,1
"Cable Management Sleeve, JOTO Cord Management System for TV / Computer / Home Entertainment, 19 - 20 inch Flexible Cable Sleeve Wrap Cover Organizer, 4 Piece - Black",Home Improvement,http://www.amazon.com/dp/B015HWXG4M/,21,1
"Xiaomi professional Store Hybrid Dual Mi Hybrid Earphone In-Ear Headphones Multi-Unit Circle Iron Mixed Piston Earphones, Silver",Wireless,http://www.amazon.com/dp/B018AMDCLI/,7,1
The Subtle Art of Not Giving a F*ck: A Counterintuitive Approach to Living a Good Life,eBooks,http://www.amazon.com/dp/B019MMUA8S/,21,1
