name,category,amazon_link,total_mentions,subreddit_mentions
"Black Box G1W-X Dashboard Dash Cam - Ultra Wide 170° 4X Zoom 6G Glass Lens - Full HD 1080P 2.7"" LCD Car DVR Camera Video Recorder with Parking Mode G-Sensor WDR Night Vision Motion Detection",Electronics,https://www.amazon.com/gp/product/B00SX88JIQ?redirect=true&amp;ref_=cm_cr_ryp_prd_ttl_sol_0,2,1
Carson 60X-75X MicroMax LED Lighted Pocket Microscope (MM-200),Electronics,https://www.amazon.com/gp/product/B000P8AUMU,2,1
Behind Japanese Lines: An American Guerrilla in the Philippines,Books,https://www.amazon.com/Behind-Japanese-Lines-Guerrilla-Philippines/dp/0813109868,1,1
Secret Wishes Batman Arkham City Sexy Harley Quinn Costume,"Clothing, Shoes & Jewelry",https://www.amazon.com/gp/product/B0073E55TW/ref=od_aui_detailpages00?ie=UTF8&amp;psc=1,1,1
Under Three Flags: Anarchism and the Anti-Colonial Imagination,Books,https://www.amazon.com/Under-Three-Flags-Anti-Colonial-Imagination/dp/1844670902,1,1
Greed & Betrayal: The Sequel to the 1986 EDSA Revolution,Books,https://www.amazon.com/Greed-Betrayal-Sequel-1986-Revolution/dp/971910371X,1,1
The Lemonade Stand: What every entrepreneur should know to succeed in starting and running any business.,Books,https://www.amazon.com/The-Lemonade-Stand-entrepreneur-business/dp/1469906562,1,1
The Conjugal Dictatorship of Ferdinand and Imelda Marcos I,Books,https://www.amazon.com/Conjugal-Dictatorship-Ferdinand-Imelda-Marcos/dp/B0000EE86T,1,1
History of the Filipino People (Eighth Edition) - Philippine Book,Books,https://www.amazon.com/History-Filipino-People-Eighth-Philippine/dp/9718711066/,1,1
"Never Have I Ever, The Game of Poor Life Decisions [A Party Card Game]",Toys & Games,https://www.amazon.com/Never-Have-Adult-Party-Decisions/dp/B00N36C6BE,1,1
"A Nation Aborted: Rizal, American Hegemony, and Philippine Nationalism",Books,https://www.amazon.com/Nation-Aborted-American-Philippine-Nationalism/dp/9715505740,1,1
Mondo Marcos (writings on Martial Law and the Marcos babies),Books,https://www.amazon.com/Mondo-Marcos-writings-Martial-babies/dp/9712724697,1,1
"Edifice Complex: Power, Myth And Marcos State Architecture",Books,https://www.amazon.com/Edifice-Complex-Power-Marcos-Architecture/dp/9715504353,1,1
Machete Maidens Unleashed,Movies & TV,https://www.amazon.com/Machete-Maidens-Unleashed-Carmen-Argenziano/dp/B004XZ99W8,1,1
"Delsey Luggage Helium Colours Lightweight Carry On Hardside 4 Wheel Spinner, Black, 21 Inch","Clothing, Shoes & Jewelry",https://www.amazon.com/Luggage-Colours-Lightweight-Hardside-Spinner/dp/B004VOFP4W,1,1
"The Forgotten Children of Maui: Filipino Myths, Tattoos, and Rituals of a Demigod by Lane Wilcken (2013-09-25)",Books,https://www.amazon.com/Forgotten-Children-Maui-Filipino-2013-09-25/dp/B01F7XCRHI?ie=UTF8&amp;*Version*=1&amp;*entries*=0,1,1
Thirty Years Later . . .: Catching Up with the Marcos-Era Crimes,Books,https://www.amazon.com/Thirty-Years-Later-Catching-Marcos-Era/dp/0578175606/ref=pd_sim_14_1?_encoding=UTF8&amp;psc=1&amp;refRID=Z96C3HR27Q45JKP1H0QR,1,1
America's Boy: A Century of United States Colonialism in the Philippines,Books,https://www.amazon.com/Americas-Boy-Century-Colonialism-Philippines/dp/0805061185/ref=pd_sbs_14_1/151-1795713-9535901?_encoding=UTF8&amp;psc=1&amp;refRID=YAEHE5MMG6K7STA3HRYC,1,1
History of the Philippines: From Indios Bravos to Filipinos,Books,https://www.amazon.com/History-Philippines-Indios-Bravos-Filipinos/dp/1468308572/,1,1
Muslims in the Philippines,Books,https://www.amazon.com/Muslims-Philippines-Cesar-Adib-Majul/dp/9715421881/ref=sr_1_3?s=books&amp;ie=UTF8&amp;qid=1464964331&amp;sr=1-3&amp;keywords=Cesar+Majul,1,1
Sakdalistas' Struggle for Philippine Independence 1930-1945,Books,https://www.amazon.com/Sakdalistas-Struggle-Philippine-Independence-1930-1945/dp/9715506798/ref=sr_1_1/177-1922910-4091912?s=books&amp;ie=UTF8&amp;qid=1464963585&amp;sr=1-1&amp;refinements=p_27,1,1
Pacific Rims: Beermen Ballin' in Flip-Flops and the Philippines' Unlikely Love Affair with Basketball,Books,https://www.amazon.com/Pacific-Rims-Flip-Flops-Philippines-Unlikely/dp/0451233220,1,1
