name,category,amazon_link,total_mentions,subreddit_mentions
Dr. Chuck Tingle's Complete Guide To Romance,Book,http://www.amazon.com/dp/1514740737/,4,2
President Domald Loch Ness Tromp Pounds America's Butt,eBooks,http://www.amazon.com/dp/B015BH04HA/,,1
Fires of Darkness (Fires of Heroes Book 1),eBooks,http://www.amazon.com/dp/B01DL9M3S8/,,1
Bear-ever Yours (Polar Heat Book 1),eBooks,http://www.amazon.com/dp/B00UZFIXK4/,,1
One in a Bear-llion (Polar Heat Book 3),eBooks,http://www.amazon.com/dp/B00WH3H1C8/,,1
Alpha Protector (Wolf Protectors Book 3),eBooks,http://www.amazon.com/dp/B00ZAYDJT0/,,1
Desired by Dragons: BBW Paranormal Romance (Dragons of New York Book 2),eBooks,http://www.amazon.com/dp/B00ZRYDR86/,,1
Big Bad Bear (Soldier Bears Book 1),eBooks,http://www.amazon.com/dp/B012E4ED98/,,1
Big Sexy Bear (Soldier Bears Book 2),eBooks,http://www.amazon.com/dp/B0139HKO3S/,,1
Scary Stories To Tingle Your Butt: 7 Tales Of Gay Terror,eBooks,http://www.amazon.com/dp/B013HHFGPQ/,,1
William Shakespeare's Star Wars,eBooks,http://www.amazon.com/dp/B00BE24WT8/,,1
Pounded In The Butt By My Own Butt,eBooks,http://www.amazon.com/dp/B00UYC1ASU/,17,1
Space Raptor Butt Invasion,eBooks,http://www.amazon.com/dp/B00S4B95RQ/,11,1
"Pounded In The Butt By My Book ""Pounded In The Butt By My Book 'Pounded In The Butt By My Book ""Pounded In The Butt By My Own Butt""'""",eBooks,http://www.amazon.com/dp/B01ATM6I0O/,4,1
Hunter Dentist Pounded In The Butt By Cecil The Handsome Unicorn,eBooks,http://www.amazon.com/dp/B01359CZH8/,2,1
Reamed By My Reaction To The Title Of This Book,eBooks,http://www.amazon.com/dp/B00X1YKE6W/,2,1
Bio Design: Nature + Science + Creativity,Book,http://www.amazon.com/dp/0870709526/,1,1
Wild Animus: A Novel,Book,http://www.amazon.com/dp/B000HWYQX8/,1,1
