name,category,amazon_link,total_mentions,subreddit_mentions
"Cassey Ho's Hot Body Year-Round: The POP Pilates Plan to Get Slim, Eat Clean, and Live Happy Through Every Season",Book,http://www.amazon.com/dp/0804139040/,1,1
The Pilates Bible: The definitive guide to Pilates excercise,Book,http://www.amazon.com/dp/1591203171/,1,1
Stamina Pilates Magic Circle,Sports,http://www.amazon.com/dp/B000W09NYM/,1,1
STOTT PILATES Extreme Pilates - Strength and Agility on the Mat DVD,DVD,http://www.amazon.com/dp/B00AFSSMTI/,1,1
STOTT Pilates Deluxe Pilates Mat,Sports,http://www.amazon.com/dp/B00GSMFI4C/,1,1
