name,category,amazon_link,total_mentions,subreddit_mentions
"Anker 20000mAh Portable Charger PowerCore 20100 - Ultra High Capacity Power Bank with 4.8A Output, PowerIQ Technology for iPhone, iPad & Samsung Galaxy & More – Black",Wireless,http://www.amazon.com/dp/B00X5RV14Y/,25,6
"Nlife Power-Grip Half-finger SPORTS GLOVES,EXERCISE GLOVES Ideal For Cycling, Rowing, and Weightlifting",Sports,http://www.amazon.com/dp/B01E791EG8/,2,2
hellosy Replacement Band for Misfit Shine Only -10pcs Sport Wristband Replacement/Wrist Strap Fitness Band/ Wireless Activity Bracelet with Clasp,Sports,http://www.amazon.com/dp/B01CVQNH9Q/,2,2
BLU R1 HD - 8 GB - Black - Prime Exclusive - with Lockscreen Offers & Ads,Wireless,http://www.amazon.com/dp/B01F9N5QXI/,2,2
"Vibrelli Universal Bike Phone Mount - Fits iPhone 7, 7 Plus, 6, 6 Plus and Android devices",Wireless,http://www.amazon.com/dp/B010OPQVUS/,2,2
Luxe Bidet Neo 120 - Self Cleaning Nozzle - Fresh Water Non-Electric Mechanical Bidet Toilet Attachment (blue and white),Home Improvement,http://www.amazon.com/dp/B00A0RHSJO/,30,1
Kingston DataTraveler HyperX Predator 1TB USB 3.0 Flash Drive (DTHXP30/1TB),Personal Computer,http://www.amazon.com/dp/B00E65QM8O/,26,1
Anker AK-A1206012 10000mAh External Battery Power Bank with PowerIQ Technology (2nd Generation)- Black,Wireless,http://www.amazon.com/dp/B009USAJCC/,12,1
"The Mythical Man-Month: Essays on Software Engineering, Anniversary Edition (2nd Edition)",Book,http://www.amazon.com/dp/0201835959/,11,1
BLU R1 HD - 16 GB - Black - Prime Exclusive - with Lockscreen Offers & Ads,Wireless,http://www.amazon.com/dp/B01H2E0J5M/,8,1
"Anker Astro E7 26800mAh Ultra-High Capacity 3-Port 4A Compact Portable Charger External Battery Power Bank with PowerIQ Technology for iPhone, iPad, Nintendo Switch and More",Wireless,http://www.amazon.com/dp/B00M3073L4/,7,1
"Body Glide Original Anti-Chafe Balm, 2.5 oz (USA Sale Only)",Sports,http://www.amazon.com/dp/B0043S06GI/,7,1
"STANLEY J5C09 Jump Starter: 1000 Peak/500 Instant Amps, 120 PSI Air Compressor",Automotive Parts and Accessories,http://www.amazon.com/dp/B002X6VXL4/,6,1
"Dr. Scholl's Moleskin Plus 24"" x  4 5/8""  Padding Roll, 1 Count",Health and Beauty,http://www.amazon.com/dp/B007W9MGLI/,6,1
Sony Alpha a6000 Mirrorless Digital Camera - Body only,Photography,http://www.amazon.com/dp/B00I8BICCG/,4,1
"EC Technology 22400mAh Power Bank Ultra High Capacity External Battery 3 USB Output(5.5A) Powerbank Dual Input Port (4A) Portable Charger for iPhone, iPad, Samsung, Nexus and More, Black and Red",Wireless,http://www.amazon.com/dp/B00FDK2G2C/,3,1
"RioRand Pokemon Action Figures, 144-Piece and 2-3 (cm)",Toy,http://www.amazon.com/dp/B01BX4GFE6/,3,1
"Anker PowerCore 20000 with Quick Charge 3.0, 20000mAh Power Pack Portable Charger with Qualcomm Quick Charge 3.0, for Samsung, iPhone, iPad and more",Wireless,http://www.amazon.com/dp/B00VLNT9KW/,3,1
Sign - On This Site in 1897 Nothing Happened - Cast Iron Sign,Home,http://www.amazon.com/dp/B000H0I7FI/,3,1
"XYZprinting da Vinci Jr. 1.0 3D Printer - 5.9'' x 5.9'' x 5.9'' Built Volume (Includes: 300g PLA Filament, USB Cable & Power Adapter, Cleaning & Maintenance Tools, Print Bed Tape, Print Removal Scrapper)",Office Electronics,http://www.amazon.com/dp/B00V3J8JEG/,2,1
"Intex Explorer 200, 2-Person Inflatable Boat",Sports,http://www.amazon.com/dp/B000RZFBKW/,2,1
Aukey PB-N15 20000mAh 3.1A Dual-USB Portable External Battery Charger with AIPower Technology - Black,Cell Phones & Accessories,https://www.amazon.com/Aukey-PB-N15-Dual-USB-External-Smartphones/dp/B00RJQB4IU/ref=sr_1_1?ie=UTF8&amp;qid=1468005408&amp;sr=8-1&amp;keywords=Aukey+PB-N15+20000,2,1
"Zackees Rechargeable USB Coin Cell Charger. LIR2032 (LR2032) Batteries Included, Replaces CR2032 batteries",Speakers,http://www.amazon.com/dp/B01BA1CLN6/,2,1
"Anker Astro E7 26800mAh Ultra-High Capacity 3-Port 4A Compact Portable Charger External Battery Power Bank with PowerIQ Technology for iPhone, iPad, Nintendo Switch and More",Wireless,http://www.amazon.com/dp/B00M30B4IW/,2,1
Pokemon Substitute Plush Toy Whimsicott by Generic,Toy,http://www.amazon.com/dp/B00B49GU28/,2,1
"Solar Charger, Solar External Battery Pack, iBeek Portable 12000mAh Dual USB Solar Battery Charger Power Bank Phone Charger with Carabiner LED Lights for Emergency Cell Phones Tablet Camera (Black)",Wireless,http://www.amazon.com/dp/B017R8VREU/,2,1
FEESHOW Men's Soft Smooth Work Out Swimsuit Gym Fitness Bodysuit,Apparel,http://www.amazon.com/dp/B01FXNB1VK/,1,1
"26800mAh Solar Charger, ZeroLemon SolarJuice USB-C/QC 3.0 Portable Solar Battery Charger Outdoor Solar Power Charger with Multi-functional LED Flashlight 400 Lumens, 4 Light Modes, S.O.S. morse code",Wireless,http://www.amazon.com/dp/B00NIOGKL8/,1,1
myCharge - Transit Plus 3000 mAh Power Bank,Cell Phones & Accessories,https://www.amazon.com/myCharge-Transit-Plus-3000-Power/dp/B00KDJ4EBE,1,1
"USB C Portable Charger, Jackery Titan S 20100mAh 30W Total Output QC2.0 Qualcomm Quick Charge External Battery, Type-C Port for Nintendo Switch, Macbook, Nexus, Samsung and More - Black",Wireless,http://www.amazon.com/dp/B01CO8LCP2/,1,1
"Sanei Pokemon All Star Collection PP39 Dragonite 8.5"" Stuffed Plush",Toy,http://www.amazon.com/dp/B01K1P1WSM/,1,1
"Alaroo Women High Waist Blue Short Bodysuit,Dark-blue,X-Large",Apparel,http://www.amazon.com/dp/B01GRWTX2U/,1,1
"Canvas Web Belt Military Style with Black Buckle and Tip 56"" Long Many Colors (White)",Apparel,http://www.amazon.com/dp/B00FC1ZD9A/,1,1
Long Sleeve Fitted Crop Cropped Hoodie Hoody Zip Zipper white large,Apparel,http://www.amazon.com/dp/B001F9J5RE/,1,1
Lush Moda Seamless Full Length Leggings - Variety of Colors - Black,Apparel,http://www.amazon.com/dp/B01H7WPHZQ/,1,1
"Tonwhar Pikachu Kigurumi Costumes for Children Kids Cuddly Onesie Pajamas (95(height:41.3""-45.27""))",Toy,http://www.amazon.com/dp/B00MST3DFA/,1,1
AmazonBasics Classic Backpack - White,Personal Computer,http://www.amazon.com/dp/B013TGFDEY/,1,1
Yu-Gi-Oh! Duel Disk Accessory,Toy,http://www.amazon.com/dp/B00009VE2N/,1,1
"ZAQ Dew Essential Oil Diffuser LiteMist Ultrasonic Aromatherapy With Ionizer and Color-Changing Light - 80 ML Capacity, White",Health and Beauty,http://www.amazon.com/dp/B00FZ29ICO/,1,1
Fourteen Things Witches Hope Parents Never Find Out,Book,http://www.amazon.com/dp/1879366754/,1,1
"TaoTronics Bike Phone Mount Bicycle Holder, Universal Cradle Clamp for iOS Android Smartphone, Boating GPS, Other Devices, with One-button Released, 360 Degrees Rotatable, Rubber Strap - Black",Wireless,http://www.amazon.com/dp/B015PS3ME2/,1,1
The Art of Capacity Planning: Scaling Web Resources,Book,http://www.amazon.com/dp/0596518579/,1,1
EasyAcc 8000mAh Solar Power Bank Solar Flashlight Outdoor Portable Charger with Super-Bright Flashlight for Apple iPhone iPad Samsung Galaxy - Black,CE,http://www.amazon.com/dp/B01B73SIH0/,1,1
"LG Risio 4G LTE Cricket Wireless Titan 4.5"" display Android 5MP Camera",Wireless,http://www.amazon.com/dp/B016249VHU/,1,1
"CRE New 9"" Dragonite Pokemon Plush Toy Doll Rare Cute Cuddly Plush Toy",Toy,http://www.amazon.com/dp/B06ZZNMV53/,1,1
"Aduro U-Grip Plus Universal Bike Mount - for Motorcycle, Handlebar, Roll Bar, iPhone X 7 6 6s 7 Plus 5 5s 5c Bike Mount for all Android Smartphones, and GPS Holder (Black/Black)",Wireless,http://www.amazon.com/dp/B00V54CLNO/,1,1
Sony ECMXYST1M Stereo Microphone (Black),Photography,http://www.amazon.com/dp/B00BJSYV4S/,1,1
SAS Safety 2985 Non-Toxic Dust Mask Box of 50,Home Improvement,http://www.amazon.com/dp/B0002STR1I/,1,1
"Nintendo Pokemon Pikachu Virtual Pet, Yellow",Video Games,http://www.amazon.com/dp/B00003CW8U/,1,1
"Little Viper Pepper Spray Bracelet, Adjustable Silicone Band, Lightweight, Discreet and Easy Access For Quick Response to Attack, Contains 3 - 6 Bursts of 10% OC, Cannot Ship to MA or NY",Sports,http://www.amazon.com/dp/B00GJ0TWEK/,1,1
Esna Pokemon GOPower Bank Pokemon GO For Use With Pokémon GO power bankNEW Arrivals Action Figures Go Ball Power Bank 10000mAh Chager With LED Light For Go AR Games …,Wireless,http://www.amazon.com/dp/B01IRQM0E2/,1,1
Schwinn Universal Smart Phone Mount,Sports,http://www.amazon.com/dp/B01C7FHYPY/,1,1
"Aukey 20000mAh Portable Charger External Battery Power Bank with AiPower Tech for iPhone 6S, 6S Plus, 6Plus, iPad, Samsung Galaxy, Google Nexus, LG, HTC, Motorola and other USB Powered Devices(White)",Wireless,http://www.amazon.com/dp/B00N9ZG7GO/,1,1
The New Yorker All Access,Magazine,http://www.amazon.com/dp/B019RWZPL0/,1,1
ODIER Bike Phone Mount Bicycle Motorcycle Cell Phone Mount Holder for 3.5In to 7In Smart Phone Fits iPhone 6 Plus Samsung Galaxy S6 S7 Note 5 for Yeti Time GT Trek MTB Road Bikes (Black),Cell Phones & Accessories,https://www.amazon.com/ODIER-Bicycle-Motorcycle-Holder-Samsung/dp/B012B95B7E/ref=sr_1_2?s=wireless&amp;ie=UTF8&amp;qid=1470574615&amp;sr=1-2&amp;keywords=odier,1,1
Anker Astro E4 Classic 13000mAh Portable Charger for USB Chargeable Devices,Wireless,http://www.amazon.com/dp/B00OPYJV4S/,1,1
Pokemon: Official Pokemon Handbook: Deluxe Collecters' Edition: Official Pokemon Handbook: Deluxe Collector's Edition,Book,http://www.amazon.com/dp/0439154049/,1,1
"Bike Mount, UP UPKJ Universal Bicycle and Motorcycle Mount Phone Holder 360° Rotatable for iPhone 7/7+ 6 6+/6S/6S+/5S/5C, Samsung Galaxy S3 S4 S5 S6 S7 S8 Note 3/4/5,Nexus,HTC,LG & GPS devices,Black",Wireless,http://www.amazon.com/dp/B01DBAJ3K8/,1,1
Galaxy S6 Battery Case: Stalion Stamina Rechargeable Extended Charging Case (Jet Black) 3500mAh Protective Charger Cover with LED Charge Indicator Light,CE,http://www.amazon.com/dp/B00UGQPG02/,1,1
Pokémon Adventures (7 Volume Set - Reads R to L (Japanese Style) for all ages),Book,http://www.amazon.com/dp/1421550067/,1,1
"Lixit Thirsty Dog Portable Bottle And Bowl, Colors May Vary",Pet Products,http://www.amazon.com/dp/B0002Z16E2/,1,1
"H2H Mens Active Fashion Sleeveless Hoodie Zip-up Vest, JNSK31-NAVY, US L Asia XL",Apparel,http://www.amazon.com/dp/B00CW6N82M/,1,1
(165bi5) Pokemon POKEDEX iPhone 5 Black Case Dexter,Wireless,http://www.amazon.com/dp/B009KET3Q4/,1,1
LW (Living Water) Reflective Belt Sash Band Elastic Safety Running Jogging Walking Biking Cycling High Visibility (Yellow),Sports,http://www.amazon.com/dp/B00GOFTU2Y/,1,1
"[6.4oz] iMiX - Elivebuy 10000mAh Dual-Port Ultra-Thin Compact External Battery Portable USB Charger Power Bank For iPhone 6 / 6 Plus 5S 5C 5 4S, iPad Air mini (Lightning Adapter Not Included), Galaxy S5 S4 S3, Note 3 4, Tab 4 3 2 Pro, Nexus, HTC One, One 2 (M8), LG G3, Nexus, MOTO X and More",Wireless,http://www.amazon.com/dp/B00NNGDVTA/,1,1
CR2032 Maxell LITHIUM 5 BATTERIES,Speakers,http://www.amazon.com/dp/B0002TJGQS/,1,1
"iPhone 6S Plus Case, Coocolor Ultra Thin Full Body Coverage Protection Hard Slim iPhone 6S Plus Case with Tempered Glass Screen Protector for Apple iPhone 6S Plus 5.5""(Red)",Wireless,http://www.amazon.com/dp/B018XWW6CG/,1,1
"Patea bike mount，360° Rotatable Universal Heavy Duty Mountain & Road Handlebar Cradle Holder,Bicycle & Motorcycle Phone Mount, Fits any Smart Phones",CE,http://www.amazon.com/dp/B01GICDLFE/,1,1
"carriying case/ holder/ pouch/ cover/ skin/ keychain for pokemon go plus Bluetooth Bracelet, used with your key chain/ handbag, backpack. (ONLY CASE, NO DEVICE)",Sports,http://www.amazon.com/dp/B01M4IH1Y8/,1,1
