name,category,amazon_link,total_mentions,subreddit_mentions
ScanGO - Maps and Notifications for Pokemon GO,Mobile Application,http://www.amazon.com/dp/B01JF4YCUU/,4,4
Code: The Hidden Language of Computer Hardware and Software,Book,http://www.amazon.com/dp/0735611319/,158,2
ASUS RT-N66U Dual-Band Wireless-N900 Gigabit Router,Personal Computer,http://www.amazon.com/dp/B006QB1RPY/,69,2
Yagi WiFi Antenna 2.4GHz 15dBi H:30° V:25° Outdoor Directional Wireless N-female - TP512 ...,PC Accessory,http://www.amazon.com/dp/B008Z4DNFC/,7,2
Nintendo Pokemon Go Plus,Video Games,http://www.amazon.com/dp/B01H482N6E/,35,1
BlueBeach Replacement Xiaomi Mi Band 2 USB Charging Cable Dock Charger (Mi Band 1 and Pokemon GOTCHA Not Compatible) - MiBand Not Included,Wireless,http://www.amazon.com/dp/B01JAYED22/,1,1
Complete MBA For Dummies,Book,http://www.amazon.com/dp/0470194294/,1,1
New Fashion Replacement Wristband Silicon Wrist Strap For Xiaomi Mi Band Black,Speakers,http://www.amazon.com/dp/B01LNLYNKW/,1,1
"ASUS RT-AC3200 Wireless-AC3200 Tri-Band Wireless Gigabit Router, AiProtection with Trend Micro for Complete Network Security",Personal Computer,http://www.amazon.com/dp/B00S9SGNNS/,13,1
"Swan 99 Percent Isopropyl Alcohol Antiseptic Solution, 16 Ounce (Pack of 2)",Health and Beauty,http://www.amazon.com/dp/B00ZCCYTWG/,2,1
BLU R1 HD - 16 GB - Black - Prime Exclusive - with Lockscreen Offers & Ads,Wireless,http://www.amazon.com/dp/B01H2E0J5M/,62,1
