name,category,amazon_link,total_mentions,subreddit_mentions
"When God Looked the Other Way: An Odyssey of War, Exile, and Redemption",Book,http://www.amazon.com/dp/0226004449/,1,1
Postwar Polish Poetry,Book,http://www.amazon.com/dp/0520044762/,1,1
The Eagle Unbowed: Poland and the Poles in the Second World War,Book,http://www.amazon.com/dp/0674284003/,1,1
A Memoir of the Warsaw Uprising,Book,http://www.amazon.com/dp/0810110261/,1,1
First Year Polish,Book,http://www.amazon.com/dp/0893571083/,1,1
No Greater Ally: The Untold Story of Poland’s Forces in World War II (General Military),Book,http://www.amazon.com/dp/1849084793/,2,1
"Timberland Men's Chocorua Trail Mid Waterproof Boot, Black,7.5 M US",Shoes,http://www.amazon.com/dp/B002P2P7FY/,1,1
Kangol Men's Wool Ushanka Hat,Apparel,http://www.amazon.com/dp/B003V8B0OS/,1,1
Carhartt Men's Relaxed Fit Straight Leg Flannel Lined,Apparel,http://www.amazon.com/dp/B0041T42NC/,1,1
Doublju Mens Half Trench Coat BLACK (US-L),Apparel,http://www.amazon.com/dp/B0045FU3TE/,1,1
"Ptasie Mleczko Chocolate Covered Vanilla Marshmallow (birds milk chocolate), 13.4 Oz.",Grocery,http://www.amazon.com/dp/B004IGYQUW/,1,1
Frugo Mocno Czarny Multifruit Drink 250ml,Grocery,http://www.amazon.com/dp/B00D97DSGY/,1,1
ZNU Men's Winter Thicken Warm Stand Collar Down Jacket Coat Outwear Parka,Apparel,http://www.amazon.com/dp/B00OOELBCY/,1,1
PRINCE POLO MILK CHOCOLATE COVERED WAFER XXL 50g ( PACK OF 28 BARS ),Grocery,http://www.amazon.com/dp/B06XCC2HRR/,1,1
Mens Cool Polish Peace Victory Hand Fingers Sign Poland Tshirt Medium Slate,Apparel,http://www.amazon.com/dp/B074SY79GF/,1,1
