name,category,amazon_link,total_mentions,subreddit_mentions
"Organic Chemistry As a Second Language, 3e: First Semester Topics",Book,http://www.amazon.com/dp/111801040X/,4,2
Kaplan MCAT Flashcards + App (Kaplan Test Prep),Book,http://www.amazon.com/dp/161865621X/,2,2
The ThinkGeek Ringtone Annoy-a-tron,Toy,http://www.amazon.com/dp/B00DM4Y16A/,1,1
The Medical School Interview: Winning Strategies from Admissions Faculty,Book,http://www.amazon.com/dp/193797801X/,1,1
Essays That Will Get You into Medical School (Essays That Will Get You Into... Series),Book,http://www.amazon.com/dp/1438002742/,1,1
BS/MD Programs-The Complete Guide: Getting Into Medical School from High School,Book,http://www.amazon.com/dp/0983213283/,1,1
Multiple Mini Interview Mmi: Winning Strategies from Admissions Faculty,Book,http://www.amazon.com/dp/1937978052/,1,1
Uvex Stealth Safety Goggles with Uvextreme Anti-Fog Coating (S3960C),Home Improvement,http://www.amazon.com/dp/B0001YXFFM/,1,1
The DOs: Osteopathic Medicine in America,Book,http://www.amazon.com/dp/0801878349/,1,1
