name,category,amazon_link,total_mentions,subreddit_mentions
Ringworld (A Del Rey book),Books,https://www.amazon.com/Ringworld-Del-book-Larry-Niven/dp/0345333926/ref=sr_1_1?s=books&amp;ie=UTF8&amp;qid=1428720405&amp;sr=1-1&amp;keywords=ringworld,4,2
Armor,Books,https://www.amazon.com/Armor-John-Steakley/dp/0886773687,3,2
Wool,Books,https://www.amazon.com/Wool-Hugh-Howey/dp/1476733953/ref=sr_1_1?ie=UTF8&amp;qid=1440965475&amp;sr=8-1&amp;keywords=wool+omnibus,6,1
The Road,Books,https://www.amazon.com/Road-Cormac-McCarthy/dp/0307387895/ref=sr_1_1?s=books&amp;ie=UTF8&amp;qid=1489316713&amp;sr=1-1&amp;keywords=the+road,5,1
The Hitchhiker's Guide to the Galaxy,Books,https://www.amazon.com/Hitchhikers-Guide-Galaxy-Douglas-Adams/dp/0345391802/ref=sr_1_1?ie=UTF8&amp;qid=1436818900&amp;sr=8-1&amp;keywords=hitchhikers+guide+to+the+galaxy&amp;pebp=1436818906072&amp;perid=1YFZ1ZYPX8A3PYV3F5DD,5,1
The Forever War,Books,https://www.amazon.com/Forever-War-Joe-Haldeman/dp/0312536631?_encoding=UTF8&%2AVersion%2A=1&%2Aentries%2A=0,4,1
Redshirts: A Novel with Three Codas,Books,https://www.amazon.com/dp/0765334798/ref=cm_sw_r_cp_api_1LEzxbWHPGGYW,4,1
Red Mars (Mars Trilogy),Books,https://www.amazon.com/Red-Mars-Trilogy-Stanley-Robinson/dp/0553560735/,4,1
"Lamb: The Gospel According to Biff, Christ's Childhood Pal",Books,https://www.amazon.com/Lamb-Gospel-According-Christs-Childhood/dp/0380813815/ref=sr_1_1?ie=UTF8&amp;qid=1436818874&amp;sr=8-1&amp;keywords=lamb&amp;pebp=1436818875797&amp;perid=0073SAYBYQW706B7HYYN,4,1
All You Need Is Kill,Books,https://www.amazon.com/All-Need-Kill-Hiroshi-Sakurazaka/dp/1421527618/,3,1
Ender's Game (The Ender Quintet),Books,https://www.amazon.com/Enders-Ender-Quintet-Orson-Scott/dp/0812550706/ref=asap_bc?ie=UTF8,3,1
Red Rising,Books,https://www.amazon.com/Red-Rising-Pierce-Brown/dp/034553980X,3,1
Parable of the Sower (Earthseed),Books,https://www.amazon.com/Parable-Sower-Octavia-E-Butler/dp/0446675504,3,1
Earth Abides,Books,https://www.amazon.com/Earth-Abides-George-R-Stewart/dp/0345487133/ref=sr_1_1?s=books&amp;ie=UTF8&amp;qid=1489317254&amp;sr=1-1&amp;keywords=earth+abides,2,1
"Deep Survival: Who Lives, Who Dies, and Why",Books,https://www.amazon.com/Deep-Survival-Who-Lives-Dies/dp/0393353710,2,1
Saga Book One,Books,https://www.amazon.com/Saga-Deluxe-Edition-Volume-HC/dp/1632150786,2,1
Gateway (Heechee Saga),Books,https://www.amazon.com/Gateway-Heechee-Saga-Frederik-Pohl/dp/0345475836,2,1
The Dark Beyond the Stars: A Novel,Books,https://www.amazon.com/Dark-Beyond-Stars-Novel/dp/0312866240/ref=sr_1_1?ie=UTF8&amp;qid=1434139205&amp;sr=8-1&amp;keywords=the+dark+beyond+the+stars,2,1
Mainline: A Science Fiction Thriller,Books,https://www.amazon.com/Mainline-A-Science-Fiction-Thriller/dp/0812549082,2,1
The Player of Games (Culture),Books,https://www.amazon.com/Player-Games-Culture-Iain-Banks/dp/0316005401/ref=sr_1_1?ie=UTF8&amp;qid=1448437143&amp;sr=8-1,2,1
Contact,Books,https://www.amazon.com/Contact-Carl-Sagan/dp/0671004107?ie=UTF8&amp;*Version*=1&amp;*entries*=0,2,1
Vurt,Books,https://www.amazon.com/Vurt-Jeff-Noon/dp/0312141440,2,1
The Guns of the South,Books,https://www.amazon.com/The-Guns-South-Harry-Turtledove/dp/0345384687,2,1
The Peripheral,Books,https://www.amazon.com/Peripheral-William-Gibson/dp/0399158448/ref=sr_1_1?ie=UTF8&amp;qid=1438493548&amp;sr=8-1&amp;keywords=The+peripheral,2,1
A Wizard of Earthsea (The Earthsea Cycle),Books,https://www.amazon.com/Wizard-Earthsea-Cycle/dp/0547773749/ref=sr_1_1?ie=UTF8&amp;qid=1425056003&amp;sr=8-1&amp;keywords=Earthsea,2,1
Wasp,Books,https://www.amazon.com/Wasp-Eric-Frank-Russell/dp/0575070951,2,1
The End is Nigh (The Apocalypse Triptych) (Volume 1),Books,https://www.amazon.com/End-Nigh-Apocalypse-Triptych/dp/1495471179/ref=sr_1_1?s=books&amp;ie=UTF8&amp;qid=1439467440&amp;sr=1-1&amp;keywords=the+end+is+night,2,1
The Codebreakers: The Comprehensive History of Secret Communication from Ancient Times to the Internet,Books,https://www.amazon.com/Codebreakers-Comprehensive-History-Communication-Internet-ebook/dp/0684831309/,2,1
Death's End (Remembrance of Earth's Past),Books,https://www.amazon.com/Deaths-End-Cixin-Liu/dp/0765377101,2,1
Expedition: Being an Account in Words and Artwork of the 2358 A.D. Voyage to Darwin IV,Books,https://www.amazon.com/Expedition-Account-Artwork-Voyage-Darwin/dp/0894806297,2,1
The Android's Dream,Books,https://www.amazon.com/Androids-Dream-John-Scalzi/dp/0765348284/ref=sr_1_1?ie=UTF8&amp;qid=1436818926&amp;sr=8-1&amp;keywords=The+Android,2,1
Constellation Games,Books,https://www.amazon.com/Constellation-Games-Leonard-Richardson/dp/1936460238,2,1
A Game of Thrones: The Graphic Novel: Volume One,Books,https://www.amazon.com/Game-Thrones-Graphic-Novel-Volume/dp/044042321X/ref=pd_sim_sbs_14_1?ie=UTF8&amp;refRID=1BR0VSA8HKPMS1FS1GJY,2,1
Architects of Hyperspace,Books,https://www.amazon.com/Architects-Hyperspace-Thomas-R-MCDONOUGH/dp/B000O50T1G/ref=cm_cr_pr_product_top,1,1
The Time Traveler's Wife,Books,https://www.amazon.com/dp/015602943X/,1,1
The First Man in Rome (In the Masters of Rome),Books,https://www.amazon.com/First-Man-Rome-Masters/dp/0061582417/,1,1
Ship of Fools,Books,https://www.amazon.com/gp/product/0441008933/,1,1
Crescent,Books,https://www.amazon.com/gp/product/1896944523/,1,1
Science Fiction from China,Books,https://www.amazon.com/Science-Fiction-Patrick-Dennis-Murphy/dp/0275933431,1,1
Wool (Wool Trilogy),Books,https://www.amazon.com/dp/0099580489,1,1
The Chronicles of Prydain (5 Volumes),Books,https://www.amazon.com/The-Chronicles-Prydain-Boxed-Set/dp/1250000939,1,1
Wireless,Books,https://www.amazon.com/Wireless-Charles-Stross/dp/0441018939,1,1
"The Science Fiction Hall of Fame, Vol. 1: 1929-1964",Books,https://www.amazon.com/Science-Fiction-Hall-Fame-Vol/dp/0765305372,1,1
Bear Daughter,Books,https://www.amazon.com/Bear-Daughter-Judith-Berman/dp/B000H2N8KK,1,1
The Ware Tetralogy,Books,https://www.amazon.com/The-Ware-Tetralogy-Rudy-Rucker/dp/1607012111,1,1
Nova,Books,https://www.amazon.com/Nova-Samuel-R-Delany/dp/0375706704,1,1
Godlike Machines,Books,https://www.amazon.com/Godlike-Machines-Jonathan-editor-Strahan/dp/1616647590,1,1
The Theory of Island Biogeography (Princeton Landmarks in Biology),Books,https://www.amazon.com/Theory-Biogeography-Princeton-Landmarks-Biology/dp/0691088365/ref=sr_1_1?ie=UTF8&amp;qid=1447969480&amp;sr=8-1&amp;keywords=island+biogeography,1,1
Kindred,Books,https://www.amazon.com/Kindred-Octavia-E-Butler/dp/0807083690,1,1
Dark Intelligence: Transformation Book One,Books,https://www.amazon.com/Dark-Intelligence-Transformation-Book-One/dp/159780844X,1,1
Soft Apocalypse,Books,https://www.amazon.com/Soft-Apocalypse-Will-McIntosh/dp/159780276X,1,1
We (Modern Library Classics),Books,https://www.amazon.com/Modern-Library-Classics-Yevgeny-Zamyatin/dp/081297462X/ref=sr_1_4?s=books&amp;ie=UTF8&amp;qid=1428679810&amp;sr=1-4&amp;keywords=yevgeny+zamyatin,1,1
Heart of a Dog,Books,https://www.amazon.com/Heart-Dog-Mikhail-Bulgakov/dp/0802150594/ref=sr_1_1?ie=UTF8&amp;qid=1428679144&amp;sr=8-1&amp;keywords=the+heart+of+a+dog,1,1
Ice Trilogy (New York Review Books Classics),Books,https://www.amazon.com/Trilogy-York-Review-Books-Classics/dp/1590173864,1,1
The Culture Series of Iain M. Banks a Critical Introduction,Books,https://www.amazon.com/Culture-Iain-Banks-Critical-Introduction/dp/0786494476,1,1
A Taste of Honey,Books,https://www.amazon.com/Taste-Honey-Kai-Ashante-Wilson/dp/0765390043,1,1
The Slynx (New York Review Books Classics),Books,https://www.amazon.com/Slynx-York-Review-Books-Classics/dp/1590171969,1,1
Diary in the Dark,Books,https://www.amazon.com/gp/product/0692606513,1,1
Collected Fictions,Books,https://www.amazon.com/Collected-Fictions-Jorge-Luis-Borges/dp/0140286802/,1,1
Surface Detail (Culture),Books,https://www.amazon.com/Surface-Detail-Culture-Iain-Banks/dp/0316123412/ref=sr_1_1?ie=UTF8&amp;qid=1448437184&amp;sr=8-1,1,1
The City & The City (Random House Reader's Circle),Books,https://www.amazon.com/City-Random-House-Readers-Circle/dp/034549752X/,1,1
The Year's Best Science Fiction: Thirty-Second Annual Collection,Books,https://www.amazon.com/Years-Best-Science-Fiction-Thirty-Second/dp/1250064422/,1,1
Selected Stories of Philip K. Dick,Books,https://www.amazon.com/Selected-Stories-Philip-K-Dick/dp/0544040546/,1,1
Lilith's Brood,Books,https://www.amazon.com/Liliths-Brood-Octavia-E-Butler/dp/0446676101,1,1
The Voyage of the Space Beagle,Books,https://www.amazon.com/The-Voyage-Space-Beagle-Vogt/dp/0765320770,1,1
The Complete Stories of J. G. Ballard,Books,https://www.amazon.com/Complete-Stories-J-G-Ballard/dp/0393072622/,1,1
"The Rapture of the Nerds: A tale of the singularity, posthumanity, and awkward social situations",Books,https://www.amazon.com/Rapture-Nerds-singularity-posthumanity-situations/dp/0765329107,1,1
Welcome to the Monkey House: A Collection of Short Works,Books,https://www.amazon.com/Welcome-Monkey-House-Kurt-Vonnegut/dp/0385333501/,1,1
Camp Concentration: A Novel,Books,https://www.amazon.com/Camp-Concentration-Thomas-M-Disch/dp/0375705457/,1,1
The Best Short Stories of J.G. Ballard,Books,https://www.amazon.com/Best-Short-Stories-J-G-Ballard/dp/0030425069/,1,1
Ficciones,Books,https://www.amazon.com/Ficciones-Jorge-Luis-Borges/dp/0802130305/,1,1
Her Smoke Rose Up Forever,Books,https://www.amazon.com/Her-Smoke-Rose-Up-Forever/dp/1892391201/,1,1
Douglas Adams's Starship Titanic,Books,https://www.amazon.com/Douglas-Adamss-Starship-Titanic-Terry/dp/0345368436,1,1
"The Science Fiction Hall of Fame, Volume Two B: The Greatest Science Fiction Novellas of All Time Chosen by the Members of the Science Fiction Writers of America (SF Hall of Fame)",Books,https://www.amazon.com/Science-Fiction-Hall-Fame-Volume/dp/076530533X/,1,1
The Nightmare Stacks (A Laundry Files Novel),Books,https://www.amazon.com/Nightmare-Stacks-Laundry-Files-Novel/dp/0425281191,1,1
"The Legacy of Heorot (Heorot series, Book 1)",Books,https://www.amazon.com/The-Legacy-Heorot-Book/dp/1470835541,1,1
Vacuum Flowers,Books,https://www.amazon.com/Vacuum-Flowers-Michael-Swanwick/dp/0441858767/ref=sr_1_sc_1?s=books&amp;ie=UTF8&amp;qid=1443651115&amp;sr=1-1-spell&amp;keywords=Vaccuum+flowers,1,1
1632 (Ring of Fire),Books,https://www.amazon.com/gp/product/1416532811/,1,1
Replay,Books,https://www.amazon.com/Replay-Ken-Grimwood/dp/068816112X,1,1
"The Science Fiction Hall of Fame, Volume Two A: The Greatest Science Fiction Novellas of All Time Chosen by the Members of The Science Fiction Writers of America (SF Hall of Fame)",Books,https://www.amazon.com/Science-Fiction-Hall-Fame-Volume/dp/0765305356,1,1
"On a Red Station, Drifting",Books,https://www.amazon.com/Red-Station-Drifting-Aliette-Bodard/dp/1500597481,1,1
Signal to Noise,Books,https://www.amazon.com/Signal-Noise-Eric-S-Nylund/dp/0380792923,1,1
The Year's Best Science Fiction & Fantasy Novellas 2015,Books,https://www.amazon.com/Years-Science-Fiction-Fantasy-Novellas/dp/1607014556/,1,1
The Greatship,Books,https://www.amazon.com/Greatship-Robert-Reed/dp/0786753668,1,1
Earthsea: The First Four Books,Books,https://www.amazon.com/Earthsea-First-Books-Ursula-Guin/dp/014137053X/,1,1
The Best of the Best: 20 Years of the Year's Best Science Fiction,Books,https://www.amazon.com/Best-20-Years-Science-Fiction/dp/031233656X/,1,1
The Icarus Hunt,Books,https://www.amazon.com/The-Icarus-Hunt-Timothy-Zahn/dp/0553573918,1,1
The Quiet War (Gollancz),Books,https://www.amazon.com/dp/0575083557/,1,1
Cordelia's Honor,Books,https://www.amazon.com/Cordelias-Honor-Vorkosigan-Saga-Omnibus/dp/0671578286,1,1
The Human Edge,Books,https://www.amazon.com/Human-Edge-Gordon-R-Dickson/dp/0743471741/ref=sr_1_10?s=books&amp;ie=UTF8&amp;qid=1451668039&amp;sr=1-10&amp;keywords=The+Human+Edge,1,1
Out of the Dark,Books,https://www.amazon.com/Out-Dark-David-Weber/dp/0765324121,1,1
A Fire Upon The Deep (Zones of Thought),Books,https://www.amazon.com/Fire-Upon-Deep-Zones-Thought/dp/0812515285,1,1
"Black Sun Rising (The Coldfire Trilogy, Book 1)",Books,https://www.amazon.com/Black-Rising-Coldfire-Trilogy-Book/dp/0886775272,1,1
The End is Now (The Apocalypse Triptych Book 2) (Volume 2),Books,https://www.amazon.com/End-Now-Apocalypse-Triptych-Book/dp/1497484375/ref=sr_1_1?s=books&amp;ie=UTF8&amp;qid=1439467490&amp;sr=1-1&amp;keywords=the+end+is+now,1,1
The End Has Come (The Apocalypse Triptych) (Volume 3),Books,https://www.amazon.com/End-Has-Come-Apocalypse-Triptych/dp/1497484405/ref=sr_1_2?s=books&amp;ie=UTF8&amp;qid=1439467490&amp;sr=1-2&amp;keywords=the+end+is+now,1,1
In Other Worlds: SF and the Human Imagination,Books,https://www.amazon.com/Other-Worlds-SF-Human-Imagination/dp/0771008481,1,1
The Turing Option (Questar Science Fiction),Books,https://www.amazon.com/Turing-Option-Questar-Science-Fiction/dp/0446364967,1,1
The Miocene Arrow (Greatwinter Trilogy),Books,https://www.amazon.com/Miocene-Arrow-Greatwinter-Trilogy/dp/0765344556/,1,1
The Wiz Biz,Books,https://www.amazon.com/The-Wiz-Biz-Rick-Cook/dp/0671878468,1,1
Souls in the Great Machine (Greatwinter Trilogy),Books,https://www.amazon.com/Souls-Great-Machine-Greatwinter-Trilogy/dp/0312872569,1,1
Most Secret War (Penguin World War II Collection),Books,https://www.amazon.com/Most-Secret-Penguin-World-Collection/dp/0141042826/,1,1
Terms of Enlistment (Frontlines),Books,https://www.amazon.com/Terms-Enlistment-Frontlines-Marko-Kloos/dp/1477809783/ref=sr_1_1?ie=UTF8&amp;qid=1434178745&amp;sr=8-1&amp;keywords=terms+of+enlistment,1,1
The Best Short Stories of J. G. Ballard,Books,https://www.amazon.com/The-Best-Short-Stories-Ballard/dp/0312278446,1,1
Eyes of the Calculor (Greatwinter Trilogy),Books,https://www.amazon.com/Eyes-Calculor-Greatwinter-Trilogy-McMullen/dp/0765345129/,1,1
After Man: A Zoology of the Future,Books,https://www.amazon.com/After-Man-A-Zoology-Future/dp/0312011636/ref=pd_sim_14_2?ie=UTF8&amp;refRID=02T5VW758ZRHB7G94K0V,1,1
Stardoc,Books,https://www.amazon.com/Stardoc-S-L-Viehl/dp/0451457730,1,1
The Drowned World: A Novel (50th Anniversary),Books,https://www.amazon.com/The-Drowned-World-Novel-Anniversary/dp/0871403625,1,1
The Noise Within,Books,https://www.amazon.com/Noise-Within-Ian-Whates/dp/1906735654/ref=la_B0034PTEUA_1_3?s=books&amp;ie=UTF8&amp;qid=1448922355&amp;sr=1-3,1,1
The Noise Revealed,Books,https://www.amazon.com/The-Noise-Revealed-Ian-Whates/dp/1907519548/ref=pd_sim_14_1?ie=UTF8&amp;dpID=51NuaRDNBCL&amp;dpSrc=sims&amp;preST=_AC_UL160_SR99,1,1
Quarter Share (Trader's Tales From The Golden Age Of The Solar Clipper) (Volume 1),Books,https://www.amazon.com/Quarter-Traders-Golden-Clipper-Volume/dp/1940575001,1,1
The Year's Best Science Fiction: Thirty-Third Annual Collection,Books,https://www.amazon.com/Years-Best-Science-Fiction-Thirty-Third/dp/1250080843/ref=asap_bc?ie=UTF8,1,1
Collected Stories of Robert Silverberg: Volume 1 Secret Sharers,Books,https://www.amazon.com/Collected-Stories-Robert-Silverberg-Sharers/dp/0553370685,1,1
"In Search of Silence: The Journals of Samuel R. Delany, Volume I, 1957-1969",Books,https://www.amazon.com/Search-Silence-Journals-Samuel-1957-1969/dp/0819570893,1,1
Super Sad True Love Story: A Novel,Books,https://www.amazon.com/Super-Sad-True-Love-Story/dp/0812977866/ref=asap_bc?ie=UTF8,1,1
Wool: The Graphic Novel (Silo Saga),Books,https://www.amazon.com/Wool-Graphic-Novel-Silo-Saga/dp/1477849122/ref=tmm_pap_title_0,1,1
"The Rapture of the Nerds: A tale of the singularity, posthumanity, and awkward social situations",Books,https://www.amazon.com/The-Rapture-Nerds-singularity-posthumanity/dp/B00C0FLODA,1,1
Bloodchild and Other Stories,Books,https://www.amazon.com/Bloodchild-Other-Stories-Octavia-Butler/dp/1583226982/,1,1
Store of the Worlds: The Stories of Robert Sheckley (New York Review Books Classics),Books,https://www.amazon.com/Store-Worlds-Stories-Sheckley-Classics/dp/1590174941,1,1
Red Dust,Books,https://www.amazon.com/Red-Dust-Paul-McAuley/dp/0575086602,1,1
"The Many-Colored Land (The Saga of Pliocene Exile, Volume 1)",Books,https://www.amazon.com/Many-Colored-Land-Saga-Pliocene-Exile/dp/1433224097,1,1
Parable of the Talents (Earthseed),Books,https://www.amazon.com/Parable-Talents-Octavia-E-Butler/dp/0446675784,1,1
Manifold: Time,Books,https://www.amazon.com/Manifold-Time-Stephen-Baxter/dp/034543076X,1,1
Dragon's Egg/Starquake: 2-in-1 (Two Novels in One),Books,https://www.amazon.com/Dragons-Egg-Starquake-2---1/dp/0345388984/ref=sr_1_6?s=books&amp;ie=UTF8&amp;qid=1451952127&amp;sr=1-6,1,1
