name,category,amazon_link,total_mentions,subreddit_mentions
"Excipial Urea 20% Intensive Healing Cream, 3.7 Ounce",Beauty,http://www.amazon.com/dp/B014QVWM4A/,13,12
"Scalpmaster Shampoo Brush, Purple",Beauty,http://www.amazon.com/dp/B000NJG82W/,20,4
African Black Soap Raw Organic Natural Pure 1lb 16oz,Beauty,http://www.amazon.com/dp/B0058NANJC/,4,3
"CARA  Hypoallergenic Moisturizing Cotton Gloves, Large, 24 Pair",Health and Beauty,http://www.amazon.com/dp/B00CIBQD7I/,2,2
"TRITON CONSUMER PRODUCTS MG 217 Medicated Coal Tar Shampoo for Psoriasis, 8 Fluid Ounce",Beauty,http://www.amazon.com/dp/B000GD03TO/,3,2
Aquasentials Easy Lotion Applicator,Health and Beauty,http://www.amazon.com/dp/B001D8ZGAM/,13,2
"JASON Natural Cosmetics Dandruff Relief Shampoo, Rosemary, Olive and Jojoba, 12 Ounces",Beauty,http://www.amazon.com/dp/B000FGDIAS/,9,2
"DrFormulas' Best Probiotics for Women & Men | Nexabiotic Multi Probiotic with Saccharomyces Boulardii, Lactobacillus Acidophilus, B. infantis, & Prebiotic 60 Capsules (Not Pearls)",Health and Beauty,http://www.amazon.com/dp/B0050FKPU0/,3,2
"ACE Self-Adhering Elastic Bandage, 3 Inches, 1-Count",Health and Beauty,http://www.amazon.com/dp/B001AM4512/,1,1
PSORIASIN Deep Moisturizing Ointment 4 oz,Health and Beauty,http://www.amazon.com/dp/B001B4S0YC/,1,1
Eucerin Original Healing Rich Creme 16 oz (Pack of 2),Beauty,http://www.amazon.com/dp/B001FB5IIC/,4,1
5466000041EA - Opsite Flexifix Transparent Adhesive Film Dressing 4 x 11 yds.,Beauty,http://www.amazon.com/dp/B001SIQCRI/,6,1
"Sarna Original Lotion, 7.5-Ounce (222 mL) Bottle",Health and Beauty,http://www.amazon.com/dp/B002DUDEOY/,2,1
Coal Tar Psoriasis Shampoo Psoriatrax 25% Coal Tar Solution 12oz Bottles- Psoriasis - Equivalent to 5% Coal Tar (1 Bottle),Beauty,http://www.amazon.com/dp/B002KAA8KK/,2,1
HOLLYWOOD BEAUTY Tea Tree Oil Skin & Scalp Treatment 8 oz,Beauty,http://www.amazon.com/dp/B005B0XL6E/,2,1
SheaMoisture African Black Soap Body Wash | 13 oz.,Beauty,http://www.amazon.com/dp/B005C2NAE4/,1,1
"L'Oreal Paris EverCreme Sulfate-Free Moisture System Nourishing Shampoo, 8.5 Fluid Ounce",Beauty,http://www.amazon.com/dp/B005HIH24W/,1,1
"First Aid Beauty Ultra Repair Cream, Blue, 6 Ounce",Beauty,http://www.amazon.com/dp/B0065I0UMO/,4,1
"3M Kind Removal Silicone Tape 1""x5yds 1/roll 2770-1",Health and Beauty,http://www.amazon.com/dp/B006RNQ0FI/,2,1
"Davines Purifying Shampoo, 8.45 fl. oz.",Prestige Beauty,http://www.amazon.com/dp/B0073FO9AM/,3,1
"Primal Blueprint – Probiotics, Enhances Digestion, Nourishes Healthy Intestinal Bacteria & Boosts Immune Function (30 capsules, 0.3 oz.)",Health and Beauty,http://www.amazon.com/dp/B007N79QS0/,1,1
"Zoo Med 25157 Reprising 10.0 UVB Compact 13W Fluorescent Lamp, Mini",Pet Products,http://www.amazon.com/dp/B00A8RHTYU/,4,1
"OmegaVia Pharma-Grade Omega-3, Enteric coated. 1105 mg Omega-3 – Ultra-high Omega-3 per pill.",Health and Beauty,http://www.amazon.com/dp/B00CJKJK1E/,1,1
SheaMoisture African Black Soap Body Wash 13 fl. oz,Beauty,http://www.amazon.com/dp/B00CVSRTUI/,1,1
CeraVe Renewing SA Cream 12 oz Salicylic Acid Body Moisturizer for Rough and Bumpy Skin,Beauty,http://www.amazon.com/dp/B00D7BZNT2/,3,1
Earth Therapeutics - Exfoliating Hydro Gloves Natural,Beauty,http://www.amazon.com/dp/B00F0SK2Q4/,1,1
"Herbal Essences Naked Cleansing Conditioner 16.9 Fl Oz,",Beauty,http://www.amazon.com/dp/B00F4TQ49I/,3,1
"Aveeno Intense Relief Hand Cream For Dry Skin, 3.5 Oz",Pantry,http://www.amazon.com/dp/B00NPNQWLU/,1,1
"MG217 Medicated Tar Ointment Intensive Strength Psoriasis Treatment, 3.8 Ounce",Health and Beauty,http://www.amazon.com/dp/B00O59PFHK/,3,1
Psoriasis Salicylic Acid & Coal Tar Solution 200ml by SALVE,Beauty,http://www.amazon.com/dp/B00SBLO5OC/,1,1
"Aria Starr Argan Oil Restorative Mask Repair Hair Treatment - Best Professional Moisturizer & Deep Conditioner For Damaged, Dry, Brittle, Curly, Frizzy, Color Treated & Natural Hair",Health and Beauty,http://www.amazon.com/dp/B014KF3PWK/,1,1
Healing Psoriasis: The Natural Alternative,Book,http://www.amazon.com/dp/0470267267/,1,1
"L'Oréal Paris EverStrong Sulfate Free Thickening Shampoo, 8.5 fl. oz.",Pantry,http://www.amazon.com/dp/B01MZXSUWN/,1,1
"Kuby Immunology, 7th Edition",Book,http://www.amazon.com/dp/1464119910/,1,1
"An Atlas of Psoriasis, Second Edition (Encyclopedia of Visual Medicine Series)",Book,http://www.amazon.com/dp/1842142372/,1,1
"Eucerin Original Healing Rich Creme, 16 Ounce",Beauty,http://www.amazon.com/dp/B0000ZHGZ2/,4,1
Tec Labs Oak-N-Ivy CortiCool,Beauty,http://www.amazon.com/dp/B000GCMY24/,1,1
"Aquis - Exfoliating Back Scrubber, Deep Clean & Invigorate Your Skin, Linen (4 x 30 Inches)",Beauty,http://www.amazon.com/dp/B000I20Q72/,3,1
"Nature's Way Niacinamide 500mg Non-flushing for Energy Release, 100 Capsules, 100 Count",Health and Beauty,http://www.amazon.com/dp/B000I4AIUK/,1,1
"Bag Balm Ointment, 8 Ounce",Home,http://www.amazon.com/dp/B0014CI4X8/,11,1
