name,category,amazon_link,total_mentions,subreddit_mentions
Psycho Pass: Inspector Shinya Kogami Volume 1,Book,http://www.amazon.com/dp/1506701205/,1,1
"Sega Psycho-Pass: ""Dominator Portable Psychological Diagnosis and Suppression System"" Premium 1/1",Toy,http://www.amazon.com/dp/B00E8827K6/,2,1
PROPLICA Dominator PSYCHO-PASS PROPLICA (Japan Import) by Bandai,Toy,http://www.amazon.com/dp/B00O1F8JTO/,2,1
Megahouse Psycho Pass G.E.M. Series: Shinya Kougami Action Figure,Toy,http://www.amazon.com/dp/B00OC6IC0I/,1,1
PSYCHO-PASS psychopaths 2 Public Security Bureau tool box by Groove garage,Automotive Parts and Accessories,http://www.amazon.com/dp/B00UWS7SJG/,1,1
Psycho-Pass: The Movie (Blu-ray/DVD Combo + UV),DVD,http://www.amazon.com/dp/B01D7A93CU/,1,1
