name,category,amazon_link,total_mentions,subreddit_mentions
"The Everything Pug Book: A Complete Guide To Raising, Training, And Caring For Your Pug",Book,http://www.amazon.com/dp/1593373147/,4,4
Kurgo Skybox Dog Booster Seat for Cars and Dog Car Seat with Dog Seat Belt Tether,Pet Products,http://www.amazon.com/dp/B001INRIQW/,5,2
"NaturVet Kelp Help Plus Omegas for Dogs and Cats, 1 lb Powder, Made in USA",Pet Products,http://www.amazon.com/dp/B0002QX7DE/,1,1
"PetSafe Busy Buddy Tug-A-Jug Meal Dispensing Dog Toy, Small",Pet Products,http://www.amazon.com/dp/B000KV61FC/,2,1
"PetSafe Drinkwell Platinum Dog and Cat Water Fountain, 168 oz.",Pet Products,http://www.amazon.com/dp/B000L3XYZ4/,43,1
"Pet Gear I-GO2 Plus Traveler Rolling Backpack Carrier for Small Cats and Dogs, Sage",Pet Products,http://www.amazon.com/dp/B0028ZCCCE/,1,1
Solvit Tagalong Pet Booster Seat Medium,Pet Products,http://www.amazon.com/dp/B003F76Y6E/,2,1
"FURminator Long Hair deShedding Tool for Dogs, Large",Pet Products,http://www.amazon.com/dp/B0040QQ07C/,23,1
"Animal Planet PET20102 Tortoise Dog Costume, Medium",Pet Products,http://www.amazon.com/dp/B004WPI9XY/,1,1
Sock Monkey Baby - Brown,Toy,http://www.amazon.com/dp/B005GKARTS/,1,1
"Fruitables Skinny Minis Apple Bacon, 5oz",Pet Products,http://www.amazon.com/dp/B005OTJWUQ/,2,1
Puppy Cake Wheat-Free Peanut Butter Cake Mix and Frosting for Dogs,Pet Products,http://www.amazon.com/dp/B0068OWGE0/,3,1
Pet Gear Step and Ramp Combination with supertraX,Pet Products,http://www.amazon.com/dp/B006I8LLGK/,1,1
American Kennel Club Pet Booster Seat,Pet Products,http://www.amazon.com/dp/B008J8J7HC/,2,1
"Nordic Naturals - Pet-Omega-3, Promotes Optimal Pet Health and Wellness, 2 Ounces",Pet Products,http://www.amazon.com/dp/B008OYAZUE/,1,1
"RC Pet Products Sport Pawks Dog Socks, Small, Blue Heather",Pet Products,http://www.amazon.com/dp/B00ET0G9AC/,1,1
"Serta Air Health and Wellness Executive Office Chair, Light Grey",Furniture,http://www.amazon.com/dp/B00EUU5G82/,2,1
Natural Dog Company SNOUT SOOTHER TRAVEL SIZE - Dry Chapped Cracked and Crusty Dog Nose Remedy for Dry Dog Noses .25 oz,Pet Products,http://www.amazon.com/dp/B00IQUG794/,3,1
"Canine Friendly Short Snout Dog Muzzle, Medium, Orange",Pet Products,http://www.amazon.com/dp/B00J59JBPW/,1,1
"Rubies Costume Company Propeller Hat for Pets, Small/Medium",Pet Products,http://www.amazon.com/dp/B00JSMWS8I/,1,1
Curry Brush with Fine Bristles. Gentle Rubber Rectangular Grooming Comb for Dog Cat Horse Rabbit Small Animal and Other Pets. Ideal for Shampooing and Removal of Dead Losses Hair and Dirt. Distribute Natural Oils in the Coat.. (Fine),Pet Products,http://www.amazon.com/dp/B00KJGFGFO/,2,1
"AerWo Dog Cat Pet Carrier Portable Outdoor Travel Backpack, (Fuchsia ,S)",Pet Products,http://www.amazon.com/dp/B00VW8KSLU/,1,1
"Dog Shoes for Outdoors Protect Your Pets Paws from Harsh Surfaces, Rocks, Icy Paths and Hot Asphalt. NonSlip and Rugged (Small/Medium)",Pet Products,http://www.amazon.com/dp/B00WZOUSYM/,1,1
Vehicle Pet Travel Back Seat Barrier for Cars and SUVs,Pet Products,http://www.amazon.com/dp/B00XOUDE0Q/,1,1
EocuSun Kid's Ball Pit Playpen with Zippered Storage Bag,Toy,http://www.amazon.com/dp/B00XPLB35M/,2,1
"Vastar 2 Packs Adjustable Pet Dog Cat Car Seat Belt Safety Leads Vehicle Seatbelt Harness, Made from Nylon Fabric",Pet Products,http://www.amazon.com/dp/B014W40TSW/,12,1
"Pet MD Chlorhexidine Wipes with Ketoconazole and Aloe for Cats and Dogs, 50 Count",Pet Products,http://www.amazon.com/dp/B0180A1J38/,1,1
"Nootie Glucosamine Chondroitin Hip and Joint Supplement for Dogs, 120 Soft Chews",Home,http://www.amazon.com/dp/B018R9UHU8/,1,1
The Pug Who Ate the World,Book,http://www.amazon.com/dp/0692673717/,1,1
Professional Pet Nail Clipper and Trimmer By Hertzko - Suitable for Medium to Large Dogs and Cats - Includes Safety Guard to Avoid Overcutting - Bonus! Free Nail File Included!,Pet Products,http://www.amazon.com/dp/B01AL9B43G/,1,1
"Leachco Back 'N Belly Contoured Body Pillow, Ivory",Baby Product,http://www.amazon.com/dp/B0002E7DIQ/,10,1
